created,date,subreddit,id,body,parent_id,score
1597234199.0,2020-08-12,wallstreetbets,g17fx5m,"""Always FOMO your last money into a pennystock"" - Warrant Bullet",t3_i8b56i,116
1597235503.0,2020-08-12,wallstreetbets,g17hqbo,Imagine explaining your wife that you lost all the money on corn YOLO.,t3_i8b56i,112
1597230959.0,2020-08-12,wallstreetbets,g17by0d,"My moves for today?  

1. Watch Nasdaq like a fucking hawk.  

2. Maintain self control, Wait for the #TSLA dip at open. Buy $TSLA OTM 9/18 3500 CALLS and OTM 10/16 3500 CALLS for battery day.

3. Cuddle and Caress my $AAPL October Calls, whispering to them everything will be all right.  

4. Buy more $JDST Calls as a hedge.

5. Kick my $WMT calls, to find out if they truly are dead.

6. Post PAPA ELON MAKE ME RICH COMMENTS all day.",t3_i8b56i,85
1597235759.0,2020-08-12,wallstreetbets,g17i3ab,When this sub starts talking about a ticker you have 2 days to capitalize before it turns to shit.,t3_i8b56i,77
1597236575.0,2020-08-12,wallstreetbets,g17jacc,"In the 80s Forrest Gump bought 100k worth of AAPL. If Tom Hanks had decided to take investment advice from his retarded character and done the same, he would have been worth 60B today. Whoever wrote that part is probably kicking themselves lmao",t3_i8b56i,72
1597235470.0,2020-08-12,wallstreetbets,g17holt,Analysts are absolute garbage.,t3_i8b56i,57
1597238331.0,2020-08-12,wallstreetbets,g17m0vv,Tesla anounced a 5-1 stock split. Inspired by this JPOW has announced that the USD will receive a 100-1 split.,t3_i8b56i,65
1597230489.0,2020-08-12,wallstreetbets,g17bfag,US Billionaires lost a combined $20 Billion in net worth yesterday.  Please consider donating to them via RobinHood by purchasing a Tesla share.  Thank you.,t3_i8b56i,121
1597232578.0,2020-08-12,wallstreetbets,g17dunu,IF YOU AIN’T SLOBBIN’ 🌽🌽COB🌽🌽 WHAT IS YOU DOIN’,t3_i8b56i,58
1597238500.0,2020-08-12,wallstreetbets,g17mar4,As someone from the Midwest on a farm I’m very pleased with the corn meme today.  Please buy my corn.,t3_i8b56i,56
1597235991.0,2020-08-12,wallstreetbets,g17ifec,Sign of the Apocolypse:  My Mom called me last night.  Said she was watching CNBC and wanted me to buy GOLD for her.  This is a woman who owns -0- stocks.,t3_i8b56i,49
1597233306.0,2020-08-12,wallstreetbets,g17er88,Farmer here....buying corn options because of high crop yield is the dumbest thing you can do. Corn would be mooning all the time cause almost every other year is a record breaking yield,t3_i8b56i,96
1597231057.0,2020-08-12,wallstreetbets,g17c1xk,Honestly I really don’t want to work today. I just want to do boy stuff. Fuck.,t3_i8b56i,45
1597234813.0,2020-08-12,wallstreetbets,g17grfs,[deleted],t3_i8b56i,81
1597233468.0,2020-08-12,wallstreetbets,g17eyoq,"If you think about it, printer go brrr is kinda like a stock split for dollars",t3_i8b56i,37
1597238202.0,2020-08-12,wallstreetbets,g17ltbn,"Lmao I said I was taking a break from trading on Monday, and some retard commented ""see u tomorrow"" and then I literally went all in to SPY puts at close yesterday. God damnit I shouldve just stayed out",t3_i8b56i,38
1597247773.0,2020-08-12,wallstreetbets,g183tu9,"I bought the wrong ticker this morning by accident

It's been my most profitable trade so far in months",t3_i8b56i,41
1597237457.0,2020-08-12,wallstreetbets,g17kn1v,"Going into today like ""just need a ten bagger to break even""",t3_i8b56i,31
1597258238.0,2020-08-12,wallstreetbets,g18rsxb,Instantly vaporized 2k buying tesla at the top 🤡,t3_i8b56i,32
1597261390.0,2020-08-12,wallstreetbets,g18yqmr,This market is purely greed and fomo,t3_i8b56i,30
1597263068.0,2020-08-12,wallstreetbets,g192cba,My AAPL puts are as useful as Anne Frank’s drum kit.,t3_i8b56i,31
1597231254.0,2020-08-12,wallstreetbets,g17c9wb,Another day of unemployment. Another drunk morning of me looking at charts from my kayak,t3_i8b56i,59
1597231326.0,2020-08-12,wallstreetbets,g17ccui,[deleted],t3_i8b56i,53
1597227192.0,2020-08-12,wallstreetbets,g177yr1,SLV bagholders - get ready for IV crush today!,t3_i8b56i,27
1597231689.0,2020-08-12,wallstreetbets,g17cs1j,My account goes bankrupt if MSFT goes under $200,t3_i8b56i,26
1597232736.0,2020-08-12,wallstreetbets,g17e1nu,"Some maize farmers are probably becoming millionaires today thanks to wsb pumps...
🤡🤡🤡",t3_i8b56i,25
1597234778.0,2020-08-12,wallstreetbets,g17gpon,"If fastly can rise 22% today, I’ll be fine.",t3_i8b56i,27
1597234968.0,2020-08-12,wallstreetbets,g17gz0l,Why is WSB obsessed with trading commodities right now lol,t3_i8b56i,27
1597238820.0,2020-08-12,wallstreetbets,g17mtih,ALL THESE HOES TRYNA HOBNOB WIT DA MUTHAFUCKIN 🌽🌽COB MOB🌽🌽,t3_i8b56i,27
1597249646.0,2020-08-12,wallstreetbets,g187ztk,"Some fucking CORN trader wearing coveralls and sitting in a bum ass 1970's brown trimmed office in Iowa or Nebraska for a corn processing plant is working on an IBM 3270 terminal, punching the same damn numbers every day, and is now wondering what in the holy hellfire fuck is going on.",t3_i8b56i,28
1597257405.0,2020-08-12,wallstreetbets,g18pw3u,TSLA is the most expensive penny stock I've ever seen.,t3_i8b56i,25
1597257990.0,2020-08-12,wallstreetbets,g18r8gv,I’m physically unable to take profits,t3_i8b56i,25
1597234626.0,2020-08-12,wallstreetbets,g17gi2l,I love this sub because everyones agenda is self interested and not a load of virtue signalling,t3_i8b56i,110
1597238159.0,2020-08-12,wallstreetbets,g17lqun,I googled corn stock and all I get is fucking recipes with corn stock the fuck,t3_i8b56i,23
1597240007.0,2020-08-12,wallstreetbets,g17ou5y,I think mattresses are my limit as far as retarded shit to get hype about. Corn is too much,t3_i8b56i,24
1597234554.0,2020-08-12,wallstreetbets,g17gehp,[deleted],t3_i8b56i,49
1597235044.0,2020-08-12,wallstreetbets,g17h2uo,[deleted],t3_i8b56i,23
1597252514.0,2020-08-12,wallstreetbets,g18ej8z,"My short lived trading career is over. 
Back to flipping burgers at mcdonalds. Posting my loss porn soon. Take care everyone",t3_i8b56i,23
1597258304.0,2020-08-12,wallstreetbets,g18rycg,# ILL WAIT TO BUY TSLA AT $400,t3_i8b56i,21
1597235268.0,2020-08-12,wallstreetbets,g17he8y,"wake up take the dump make the coffee walk the dogs check the market and news then shitpost on wsb, what a life:"")",t3_i8b56i,21
1597246555.0,2020-08-12,wallstreetbets,g181b2j,"Never understood the idea of “house money”

Once you make a ton of money it is yours now and should be treated like the rest of your money 

Which means you YOLO it all again, pussy boy

We out here trying to become millionaires 🚀🔥",t3_i8b56i,23
1597253678.0,2020-08-12,wallstreetbets,g18h8su,"made about $400 scalping options the last three days. it ain't much, but it's honest work.",t3_i8b56i,21
1597230104.0,2020-08-12,wallstreetbets,g17b08a,[deleted],t3_i8b56i,42
1597232668.0,2020-08-12,wallstreetbets,g17dypp,Apparently stalks only go up? 🌽,t3_i8b56i,42
1597235258.0,2020-08-12,wallstreetbets,g17hdp0,I miss the days Tesla used to swing $150 a day lol,t3_i8b56i,20
1597248195.0,2020-08-12,wallstreetbets,g184p49,I love that I'm a daily WSB regular and still have no idea if corn is a real thing or not. Nice job guys 👍🏻,t3_i8b56i,21
1597248232.0,2020-08-12,wallstreetbets,g184rvh,“WSB Season 3 Episode 5: The gang discovers commodities”,t3_i8b56i,22
1597257172.0,2020-08-12,wallstreetbets,g18pcpv,$500 into TSLA 1600C yesterday is worth over 30K now. For a fucking split. 🤣,t3_i8b56i,21
1597258381.0,2020-08-12,wallstreetbets,g18s4qs,I now understand why all these guys with sick gains always have low battery.,t3_i8b56i,20
1597232684.0,2020-08-12,wallstreetbets,g17dzf6,"Corn chart is the most depressing thing I’ve seen, have fun with that.",t3_i8b56i,20
1597237877.0,2020-08-12,wallstreetbets,g17lald,"I've been to College Station, TX and State College, PA. Those towns are so fucked.",t3_i8b56i,19
1597240355.0,2020-08-12,wallstreetbets,g17pgel,Did a bunch of farmers discover WSB?,t3_i8b56i,19
1597242894.0,2020-08-12,wallstreetbets,g17u3s0,"I just tried scalping for the first time. I bought $50k of SPY, and after a few minutes of fluctuating prices I got so nervous that I sold. Ended up making $17, enough to order lunch. How did I do?",t3_i8b56i,19
1597245835.0,2020-08-12,wallstreetbets,g17zuen,"anyone feel like this game distorts your view of the world? like, i dont give a shit about corn. why am i on forums asking farmers hows it going?

only a $500 call? sure. $20 bucks for a pizza? seems expensive.",t3_i8b56i,19
1597249315.0,2020-08-12,wallstreetbets,g1877xx,"Spy $1.5 from ATHs. only took a global pandemic, mortage delinquencies worse than 2008 and about 30m unemployed",t3_i8b56i,20
1597250551.0,2020-08-12,wallstreetbets,g18a2vw,"Checking my account history, I found out that 90% of the time I lost money, I lost because I chickened out and closed my positions too early in panic. Most of those positions would have printed if I didn't close early in panic.

This also lack of proper hedging. It took me more than 10 fucking years of trading to realize value of hedging your shit. If you don't hedge your positions, you can lose 4-5 years worth of gains in one trade.",t3_i8b56i,21
1597257160.0,2020-08-12,wallstreetbets,g18pbqe,"Jesus Christ I have been a TSLA shareholder for approximately three hours and am already itching to go buy one of their cars and buy a few of their hats to wear everywhere I go.   No wonder this has turned into a cult, I am sipping the kool-aid.",t3_i8b56i,20
1597259371.0,2020-08-12,wallstreetbets,g18ue0c,[deleted],t3_i8b56i,20
1597230158.0,2020-08-12,wallstreetbets,g17b2bm,Morning poopers stand up!,t3_i8b56i,19
1597232315.0,2020-08-12,wallstreetbets,g17dj9s,"tech leading futures?


this is the way",t3_i8b56i,19
1597235235.0,2020-08-12,wallstreetbets,g17hcj6,Woke up this morning to a hooker screaming outside on the street about having HIV to her presumed John. Puts on Manhattan,t3_i8b56i,20
1597255359.0,2020-08-12,wallstreetbets,g18l6js,"RSI: 90

Algos: “JESUS WHAT A BARGAIN”",t3_i8b56i,20
1597261992.0,2020-08-12,wallstreetbets,g19019c,Imagine letting a guy with stickers on the back of his laptop manage your wealth,t3_i8b56i,18
1597245389.0,2020-08-12,wallstreetbets,g17yy2y,Lost 6 grand in two days. That’s about a month and a half of work. So now I get to work for a month and a half and it’s basically free labor in my mind. Prob gonna just die. Why do I do this to myself? I’m not a finance expert. I’m a fucking retard. Just gambling on my god damn phone with all my money. I am literally a fucking RETARD. My hard earned money. I press buttons and lose it all. What a fuckin moron,t3_i8b56i,37
1597238049.0,2020-08-12,wallstreetbets,g17lke8,"Mug full of coffee. Portfolio full of puts. 
Alexa play soon departed by children of bodom",t3_i8b56i,18
1597253983.0,2020-08-12,wallstreetbets,g18hykz,You literally have to pay to be a bear and i am at the point where i can pay no more,t3_i8b56i,18
1597256417.0,2020-08-12,wallstreetbets,g18nlow,My bro made 300k on Tesla lol,t3_i8b56i,19
1597257114.0,2020-08-12,wallstreetbets,g18p7xa,So guys. Not gunna lie. I may have sold a lot of you CORN calls.,t3_i8b56i,18
1597261863.0,2020-08-12,wallstreetbets,g18zr73,"If you are holding Tesla, good luck, because me too",t3_i8b56i,18
1597262227.0,2020-08-12,wallstreetbets,g190jlh,[deleted],t3_i8b56i,19
1597232946.0,2020-08-12,wallstreetbets,g17eb2z,Calls on precious vegetables,t3_i8b56i,17
1597235728.0,2020-08-12,wallstreetbets,g17i1q2,"Bro puts on bikers

I’m out here doing site acquisition in an area that’s a road to Sturgis, these fuckers are flocking by the thousands (as usual) as if Covid never happened maskless and all, Sturgis is gonna be wild lol",t3_i8b56i,17
1597238753.0,2020-08-12,wallstreetbets,g17mpjq,I fear what silver has done to WSB. Watch you guys fuck up the food chain screwing with hog and corn futures now.,t3_i8b56i,16
1597250306.0,2020-08-12,wallstreetbets,g189imt,Clearly Apple was undervalued by over hundred billion dollars before today.,t3_i8b56i,17
1597255675.0,2020-08-12,wallstreetbets,g18lwde,Watching Tesla skyrocket while all my money is tied up in a mattress company for earnings,t3_i8b56i,16
1597257643.0,2020-08-12,wallstreetbets,g18qfot,"Imagine checking out 8/14 TSLA 1500c 5 minutes before close yesterday

Imagine going for 9/11 SLV 25c instead

Imagine being me",t3_i8b56i,17
1597236797.0,2020-08-12,wallstreetbets,g17jm9r,"dear diary, how to stop being poor 101: go to trade school its cheap and short, get a hard working but niche job like in power gen or diesel technician(DO NOT DO AUTOMOTIVE TECH), no life that shit and get really good so the company will give you more money, save up your money and live as cheaply as possible, have a friend introduce you to the wonderful world of options, research and study the market + paper trade prove profitability etc, use the money you have saved to fund your brokerage acct, make more money in a year than you would in 5 years working any normal job trading while also working (dont forget to put money aside for taxes!), quit your job but be nice in case you ever decide to work there again (by the way your certifications/experience dont go away so you always have something to fall back on) and never take advice from this sub including me, it is for entertainment purposes only! GL!

100x DAL 8/28 31

40x DG 8/28 132.5",t3_i8b56i,15
1597253694.0,2020-08-12,wallstreetbets,g18ha4a,Is marriage a trap?,t3_i8b56i,17
1597254748.0,2020-08-12,wallstreetbets,g18jryc,Who knew shorting the market at ATH in a global pandemic was a bad idea? 😭🔫,t3_i8b56i,16
1597259819.0,2020-08-12,wallstreetbets,g18vcmw,If the market tanks I’ll make 5k and my Dad will lose 50k. So obviously I’m rooting for the market to tank. RUG PULL RUG PULL 🤓,t3_i8b56i,16
1597260966.0,2020-08-12,wallstreetbets,g18xu5s,How many of you retards bought calls at 338,t3_i8b56i,15
1597261991.0,2020-08-12,wallstreetbets,g19016z,"*Some hedge funds have been using Robinhood data in their algorithms*

You fuckn autists are fueling this market with Corn and PRPL calls",t3_i8b56i,16
1597227863.0,2020-08-12,wallstreetbets,g178n87,"ex-coworker / acquaintance of mine has been pretty vocal in his antimask and ""it's just a flu"" beliefs on Facebook for the last few months.  

Yesterday, his daughter is responding to happy birthday messages for him on Facebook as he's laying in the hospital on ventilator.

Don't know how I feel about this, partly feel bad but partly feel like... you deserved it you dumbass.",t3_i8b56i,99
1597232457.0,2020-08-12,wallstreetbets,g17dpgc,I did something retarded. All I'm going to say is I need everyone to go buy make up from ULTA. please.,t3_i8b56i,16
1597237070.0,2020-08-12,wallstreetbets,g17k1ds,Imagine buying corn stocks when you can literally just buy at  walmart,t3_i8b56i,16
1597240933.0,2020-08-12,wallstreetbets,g17qhvz,My entire watch list is green except for what I have calls in,t3_i8b56i,16
1597243736.0,2020-08-12,wallstreetbets,g17vpro,This is probably the worst mobile game I’ve ever downloaded,t3_i8b56i,15
1597245162.0,2020-08-12,wallstreetbets,g17yhsi,1k shares of vxx. let's get weird,t3_i8b56i,16
1597247035.0,2020-08-12,wallstreetbets,g182age,The entire sub is about to get cornholed,t3_i8b56i,15
1597247486.0,2020-08-12,wallstreetbets,g18387h,"imagine not using your entire life savings, taking out a second  mortgage on  your own and a random elderly person with dementia's house, selling all your possessions, opening a business and taking out a maximum PPP loan to buy $CORN 12c 8/21's. PATHETIC!",t3_i8b56i,15
1597249411.0,2020-08-12,wallstreetbets,g187g27,Hitting all time highs during a pandemic and 30m unemployment and possibly the worst time in the history of our country . Beautiful irony,t3_i8b56i,15
1597249629.0,2020-08-12,wallstreetbets,g187yeb,What if it just dropped to 247 again like last time we hit 339 lol,t3_i8b56i,15
1597249980.0,2020-08-12,wallstreetbets,g188rq2,Im never touching a put again,t3_i8b56i,16
1597250747.0,2020-08-12,wallstreetbets,g18aiv4,Seems like the sub got out of SLV. We still here tho,t3_i8b56i,15
1597252161.0,2020-08-12,wallstreetbets,g18dq2j,"Oh, I get it now. Buy low, **sell** high. 

I was buying green and selling never.",t3_i8b56i,14
1597253954.0,2020-08-12,wallstreetbets,g18hw4c,Girlfriend dumped me. Calls on $PORN futures,t3_i8b56i,15
1597255836.0,2020-08-12,wallstreetbets,g18m9qo,"Wait, you guys weren’t seriously, actually and not jokingly fucking with corn right?",t3_i8b56i,16
1597259594.0,2020-08-12,wallstreetbets,g18uv5p,Love being up 220% on Tesla calls then going back to 10% in 20 minutes,t3_i8b56i,15
1597259897.0,2020-08-12,wallstreetbets,g18vipn,A grain truck just dumped 20 metric tonnes of corn in my driveway.  WTF did I do?,t3_i8b56i,16
1597260947.0,2020-08-12,wallstreetbets,g18xsq9,I guess I will be the TSLA bagholder because I was greedy about not taking 3k profit🤣 and now I am down 4k,t3_i8b56i,15
1597261749.0,2020-08-12,wallstreetbets,g18zid7,"Yo my VXX calls going up 10% when VXX itself isn’t moving

SUSSSSS",t3_i8b56i,14
1597263524.0,2020-08-12,wallstreetbets,g193bek,"Up 10k daytrading TSLA back and forth. If i had done nothing i'd be up almost 15k.

No matter how well you do, you're just a retard and stocks are better left the fuck alone in the end.",t3_i8b56i,16
1597229671.0,2020-08-12,wallstreetbets,g17ajee,I don't care that its 7 am. $CORN being red right now is fucking hilarious.,t3_i8b56i,14
1597230110.0,2020-08-12,wallstreetbets,g17b0gt,so my SPY Puts and VXX calls that were both up 100% at close last night are worthless now. Fuaaaaaark what a way to start the morning,t3_i8b56i,14
1597232751.0,2020-08-12,wallstreetbets,g17e2eh,[deleted],t3_i8b56i,14
1597235782.0,2020-08-12,wallstreetbets,g17i4hc,all SLV gang needs is rising prices. and for JPM to fuck off nd kick rocks,t3_i8b56i,14
1597237247.0,2020-08-12,wallstreetbets,g17kbb0,What a nice day to get fucked again by institutional investors.,t3_i8b56i,14
1597238406.0,2020-08-12,wallstreetbets,g17m5ad,Mexican street corn gang 🌽💪🏼💪🏼🌽,t3_i8b56i,13
1597238413.0,2020-08-12,wallstreetbets,g17m5pl,"Can we all just go full Sweden...looks more and more like they were right, Virus gonna Virus. Denmark Finland Netherlands Norway starting to increase cases again, Sweden maintaining drops in cases and death rates. All had more lockdowns than Sweden.",t3_i8b56i,15
1597239919.0,2020-08-12,wallstreetbets,g17oole,All in on SLV,t3_i8b56i,14
1597241706.0,2020-08-12,wallstreetbets,g17rvl2,Bought one FB share last night and already sold it for $1.13 profit. I think I’m gonna start a YouTube channel on how to have massive gains like me.,t3_i8b56i,14
1597241823.0,2020-08-12,wallstreetbets,g17s3ap,i just clicked unusual call volume and you retards really have fucking CORN at the top,t3_i8b56i,14
1597252003.0,2020-08-12,wallstreetbets,g18dczy,"SPY near ATH is nice, but TSLA becoming a meme again is the true underdog story for today",t3_i8b56i,15
1597255765.0,2020-08-12,wallstreetbets,g18m3xe,"TESLA TO THE GODDAMN MOOOOOON

🚀 🚀 🚀",t3_i8b56i,13
1597256949.0,2020-08-12,wallstreetbets,g18ou63,Fuck it I FOMO‘d Tesla 8/20 1700c. Pray for me,t3_i8b56i,15
1597259828.0,2020-08-12,wallstreetbets,g18vddj,WHO IS BUYING AT THIS LEVEL,t3_i8b56i,15
1597260328.0,2020-08-12,wallstreetbets,g18wg47,[deleted],t3_i8b56i,14
1597261263.0,2020-08-12,wallstreetbets,g18ygwj,I'm up so much today I'm about to juul on my flight. No fucks given.,t3_i8b56i,13
1597261368.0,2020-08-12,wallstreetbets,g18yoyo,I love all the trash talk against bears today when yesterday bulls were drowning in their own tears on this thread.,t3_i8b56i,14
1597261549.0,2020-08-12,wallstreetbets,g18z2vz,"SPY up 3% for the day. 

SPY falls .01%

Portfolios: +200% to -90%",t3_i8b56i,16
1597261624.0,2020-08-12,wallstreetbets,g18z8q7,He boght? Dahhmp eet,t3_i8b56i,15
1597228421.0,2020-08-12,wallstreetbets,g17983o,SILVER GANG. Anyone still alive?,t3_i8b56i,32
1597262777.0,2020-08-12,wallstreetbets,g191psu,"Dude over on r/options crying about losing 50% on his first ever investment because he bought CORN calls 😂

First comment says don’t ever listen to WSB",t3_i8b56i,26
1597232652.0,2020-08-12,wallstreetbets,g17dxyu,[deleted],t3_i8b56i,12
1597233450.0,2020-08-12,wallstreetbets,g17exvb,"We're such fucking degens. All of us have a gambling addiction that we can't see, and instead hope for Donald pump or the rug pull to make tendies.... Nevermind, doesn't seem too bad",t3_i8b56i,13
1597233732.0,2020-08-12,wallstreetbets,g17fb3i,I’m handing out upvotes this morning. Lets profit today🤝,t3_i8b56i,13
1597237218.0,2020-08-12,wallstreetbets,g17k9ny,If I break even from silver today I’m never touching it again,t3_i8b56i,14
1597237983.0,2020-08-12,wallstreetbets,g17lgnp,"Payroll tax *deferral* sold as a tax ‘cut’ and a capital gain tax cut because we know unemployed, lower and middle class folks need that. Lmfao. Great stuff, munchkin man",t3_i8b56i,14
1597238153.0,2020-08-12,wallstreetbets,g17lqfz,Time to start drinking,t3_i8b56i,12
1597238305.0,2020-08-12,wallstreetbets,g17lzed,"going balls deep in MSFT at open. Clippy, cover my six",t3_i8b56i,13
1597238379.0,2020-08-12,wallstreetbets,g17m3ov,"I'm so excited I'm doing Muy Thai moves around the living room and my kid is yell laughing and the dogs are barking and going nuts. Meanwhile, my wife is quietly packing a suitcase and will be leaving me today.",t3_i8b56i,14
1597238411.0,2020-08-12,wallstreetbets,g17m5kt,"Sudden realization.         

When papa Elon was talking about stock price being too high, he was referring to the reason for stock split.",t3_i8b56i,13
1597240837.0,2020-08-12,wallstreetbets,g17qblw,TSLA stock soars based on expectations of TSLA stock soaring.,t3_i8b56i,13
1597242691.0,2020-08-12,wallstreetbets,g17tq2u,Fuck greed man I'm just gonna try to bag small profits every day from now on instead of going balls deep. It'll add up over time.,t3_i8b56i,14
1597244316.0,2020-08-12,wallstreetbets,g17wu4j,Just bought SPY puts. 340 eod.,t3_i8b56i,14
1597245873.0,2020-08-12,wallstreetbets,g17zx9x,Airlines looking pretty Malaysian today,t3_i8b56i,13
1597248983.0,2020-08-12,wallstreetbets,g186fvu,you idiots in corn gonna lose all your money,t3_i8b56i,12
1597250260.0,2020-08-12,wallstreetbets,g189et5,Spy puts,t3_i8b56i,13
1597251599.0,2020-08-12,wallstreetbets,g18cfuc,Sell off inbound,t3_i8b56i,13
1597253329.0,2020-08-12,wallstreetbets,g18gfa7,Are the corn posts ironic or this sub really this autistic?,t3_i8b56i,11
1597255243.0,2020-08-12,wallstreetbets,g18kwp7,Why the FUCK did I put money in corn,t3_i8b56i,14
1597255403.0,2020-08-12,wallstreetbets,g18la4x,i can’t wait for $40 loaves of bread in 2028,t3_i8b56i,13
1597257537.0,2020-08-12,wallstreetbets,g18q756,My entire account is now AAPL and TSLA. Godspeed,t3_i8b56i,13
1597258383.0,2020-08-12,wallstreetbets,g18s4yc,"Aight who FOMO’d at Tesla at 1584 thinking it would break 1600

Edit: it was me",t3_i8b56i,13
1597259854.0,2020-08-12,wallstreetbets,g18vfdh,How did we go from yesterday's close to this... I am in awe and numb to the money I'm losing shorting this shit,t3_i8b56i,14
1597260375.0,2020-08-12,wallstreetbets,g18wjwo,Hell of a dead cat bounce boys,t3_i8b56i,13
1597261001.0,2020-08-12,wallstreetbets,g18xwv4,"dump it all, fuck us all I don’t care anymore lol",t3_i8b56i,14
1597261539.0,2020-08-12,wallstreetbets,g18z22u,Welcome to the stock market where the questions are made up and the answers don't matter.,t3_i8b56i,13
1597262078.0,2020-08-12,wallstreetbets,g1907ym,Apparently after hours is the real market.,t3_i8b56i,14
1597262375.0,2020-08-12,wallstreetbets,g190v1k,Yippee made $150 on TSLA. Best day in 2 weeks 🙄,t3_i8b56i,13
1597262405.0,2020-08-12,wallstreetbets,g190xbl,Spy puts anyone?,t3_i8b56i,12
1597229736.0,2020-08-12,wallstreetbets,g17alt2,Upvote if you wish you never discovered the stock market,t3_i8b56i,161
1597234609.0,2020-08-12,wallstreetbets,g17gh8w,[deleted],t3_i8b56i,11
1597236055.0,2020-08-12,wallstreetbets,g17iior,[deleted],t3_i8b56i,11
1597237579.0,2020-08-12,wallstreetbets,g17ktr0,can SLV just jump to $40 so I can go on with my life?,t3_i8b56i,13
1597239668.0,2020-08-12,wallstreetbets,g17o8z2,Institutions buy AH and dump on retail. Welcome to TSLA.,t3_i8b56i,13
1597241403.0,2020-08-12,wallstreetbets,g17rboe,"""Leverage yourself to the absolute maximum tits"" - Warrant Buffet",t3_i8b56i,11
1597242024.0,2020-08-12,wallstreetbets,g17sgt1,why tf am in CORN rn,t3_i8b56i,12
1597242203.0,2020-08-12,wallstreetbets,g17st19,Where’s the Cob Mob 😂,t3_i8b56i,12
1597242318.0,2020-08-12,wallstreetbets,g17t0vg,"So glad I survived the 45 minute recession of August 11, 2020",t3_i8b56i,11
1597242761.0,2020-08-12,wallstreetbets,g17turx,My TSLA FD bought yesterday closed down $200 and is now worth near $2k lol life’s crazy,t3_i8b56i,11
1597243142.0,2020-08-12,wallstreetbets,g17ukp0,"Apple splitting $445 4 ways isn’t sexy. Maybe try on $460 or maybe even a $480, it would look so good on you. I heard $500 is the latest style so if you want to be bold...",t3_i8b56i,13
1597244040.0,2020-08-12,wallstreetbets,g17wapf,"I’m doing it again, SPY 8/14 337p.

Wish me luck bois and gurls",t3_i8b56i,12
1597244919.0,2020-08-12,wallstreetbets,g17y0m6,2000 bubble gonna look like nothing when this is done🤑,t3_i8b56i,13
1597245003.0,2020-08-12,wallstreetbets,g17y6gm,"If you panic sold SLV and GLD at yesterday's low, you were never Clang Gang",t3_i8b56i,13
1597246326.0,2020-08-12,wallstreetbets,g180ucg,the smartest thing I’ve ever done was buying NVDA in April and the dumbest thing I’ve ever done was not putting ALL my money in then,t3_i8b56i,12
