created,date,subreddit,id,body,parent_id,score
1630583417.0,2021-09-02,wallstreetbets,hbaz9ir,"if you ever feel you've accomplished nothing in life just remember it took 4 presidents, 20 years, 2 trillion dollars and the lives of thousands of troops to successfully change the afghan regime from taliban to taliban 🤣",t3_pgergo,163
1630578576.0,2021-09-02,wallstreetbets,hbas2xi,[deleted],t3_pgergo,70
1630585248.0,2021-09-02,wallstreetbets,hbb2ifv,WSB is finally normal again. I’m going to go and say 80% of the subs a few months ago were either bots or normies,t3_pgergo,51
1630581365.0,2021-09-02,wallstreetbets,hbavy8u,Even when I'm down 90% I always celebrate a green pre market,t3_pgergo,45
1630578970.0,2021-09-02,wallstreetbets,hbaslec,The blacker the berry the sweeter the juice 🍇🍇,t3_pgergo,39
1630585992.0,2021-09-02,wallstreetbets,hbb3wux,"Jobs up, economy is improving stocks go up

Jobs down, companies are streamlining operations and saving money, stocks go up",t3_pgergo,39
1630586269.0,2021-09-02,wallstreetbets,hbb4g3h,ACCOUNT BLOWN,t3_pgergo,36
1630587304.0,2021-09-02,wallstreetbets,hbb6h01,My shift starts at 9:30 so I’m gonna get there at 9:28 then take a 12 minute shit on the clock,t3_pgergo,36
1630580345.0,2021-09-02,wallstreetbets,hbaugo0,Do u think politicians sit around and laugh at us fighting each other while they take all our rights away?,t3_pgergo,99
1630584172.0,2021-09-02,wallstreetbets,hbb0klb,"CNBC this morning, probably:
  
""Indexes climb as investors shake off the loss of iconic city""",t3_pgergo,32
1630586071.0,2021-09-02,wallstreetbets,hbb42cq,"Fed: o shit. Job numbers miss. That means qe isnt working like we say it is...Quick, keep pumping up stocks so rich people and politicians dont give a shit.",t3_pgergo,32
1630586184.0,2021-09-02,wallstreetbets,hbb4a6a,I'm declaring bankruptcy 9:30 am today,t3_pgergo,32
1630586457.0,2021-09-02,wallstreetbets,hbb4t0o,How money people in here are taking investment advice from 13 year olds?,t3_pgergo,30
1630586599.0,2021-09-02,wallstreetbets,hbb52sv,"Need 80,000% to make up for missed opportunities",t3_pgergo,30
1630580536.0,2021-09-02,wallstreetbets,hbauqbm,SDC and BB preparing for liftoff.,t3_pgergo,26
1630582267.0,2021-09-02,wallstreetbets,hbaxcjx,Cathie sold the bottom in BABA,t3_pgergo,27
1630583720.0,2021-09-02,wallstreetbets,hbazs7k,"Literally everybody is expecting a 5-10% correction right now (see our post-close threads every day full of ""loaded SPY puts"" comments), that's why we're more likely to have a 10-15% lift before the 5% drop.

It's just a waste of time, buy any dip and just keep buying if the dip gets bigger.

It works until it doesn't, as long as you're not going all in on every play, you'll be okay.",t3_pgergo,28
1630584642.0,2021-09-02,wallstreetbets,hbb1efy,"I can't decide who's worse:

A. Stocktwits/WeBull experts

B. JoUrnAlisTs who write about 'The Next WSB Target'

C. People who actually listen to either",t3_pgergo,28
1630586022.0,2021-09-02,wallstreetbets,hbb3yxx,"Doesn't matter what I buy, stocks, options etc. Every day is opposite day.",t3_pgergo,25
1630588339.0,2021-09-02,wallstreetbets,hbb8lgz,The Taliban is sueing Boeing because of defective helicopters.,t3_pgergo,25
1630588374.0,2021-09-02,wallstreetbets,hbb8o80,Spy is incapable of going down,t3_pgergo,28
1630600443.0,2021-09-02,wallstreetbets,hbc1bt5,"CLOV, PAMP IT",t3_pgergo,23
1630601317.0,2021-09-02,wallstreetbets,hbc3kkl,Clov please moon.,t3_pgergo,24
1630579200.0,2021-09-02,wallstreetbets,hbaswhc,Sorry about the flash flood NY. I hope my thoughts and prayers tweet helps,t3_pgergo,23
1630586950.0,2021-09-02,wallstreetbets,hbb5rmc,SPY today: ATH AND I'LL DO IT AGAIN!,t3_pgergo,21
1630577886.0,2021-09-02,wallstreetbets,hbar7mt,CRSR at $33.80 BABA at $183.60 my two main positions LESGO ! 🚀,t3_pgergo,21
1630601349.0,2021-09-02,wallstreetbets,hbc3nl8,Is this it CLOV?,t3_pgergo,21
1630601521.0,2021-09-02,wallstreetbets,hbc43ex,"CLOV, you better rally bitch — tired of your fickle ass",t3_pgergo,22
1630601788.0,2021-09-02,wallstreetbets,hbc4ruz,CLOV trying to pull a walking dead!,t3_pgergo,21
1630602211.0,2021-09-02,wallstreetbets,hbc5ulu,"CLOV, in case anyone needs later today:

Lamborghini Manhattan
711 11th Ave, New York, NY 10019
+1 866-325-1538
Closes 7PM",t3_pgergo,20
1630581725.0,2021-09-02,wallstreetbets,hbawhxc,Remember when people were pumping $ASS and $CUM. That was a weird time,t3_pgergo,21
1630598499.0,2021-09-02,wallstreetbets,hbbwey0,What’s the point of going to university and studying for a degree? I could’ve done 3 years of Excel and PowerPoint courses and been 100x more competent at my job,t3_pgergo,20
1630581420.0,2021-09-02,wallstreetbets,hbaw18z,I have 180 SPY calls and 8 SPY puts. That’s a proper hedge right?,t3_pgergo,19
1630586503.0,2021-09-02,wallstreetbets,hbb4w83,SEPTEMBER IS PRICED IN 🗣,t3_pgergo,19
1630609228.0,2021-09-02,wallstreetbets,hbcnfhn,SPY just laying there like my ex wife on one of her annual sex nights.,t3_pgergo,18
1630583273.0,2021-09-02,wallstreetbets,hbaz0mq,"Reaching Valhalla:

Increasingly bigger bets with decreasing account balance.",t3_pgergo,17
1630591522.0,2021-09-02,wallstreetbets,hbbfpjd,All I want is to make a quick 5M in like 2 hours,t3_pgergo,19
1630596911.0,2021-09-02,wallstreetbets,hbbsjoh,"Due to Labor Day, there are SPY options expiring 3 trading days back to back, on Friday, Tuesday, and Wednesday.

Full retard 0dte gambling 3 days in a row is on the calendar. Who here is getting on board?",t3_pgergo,19
1630610892.0,2021-09-02,wallstreetbets,hbcrlbx,"The Robinhood interface is profoundly better than Fidelity's. I'm just going to go down with the ship man I don't care. Until somebody else updates their shit to work this well I just can't 

I transfer my real shit out to Fidelity but play in RH",t3_pgergo,18
1630582158.0,2021-09-02,wallstreetbets,hbax65a,"The floor of the NYSE is probably under 3 feet of water right now. 
  
SPY +6% today on uncontrollable algo buying",t3_pgergo,59
1630590696.0,2021-09-02,wallstreetbets,hbbdtbm,"Bought SPY calls and it immediately tanked.

You're welcome, bears.",t3_pgergo,16
1630594153.0,2021-09-02,wallstreetbets,hbblwd4,Apparently red September was referring to my account and not the market,t3_pgergo,18
1630607084.0,2021-09-02,wallstreetbets,hbci005,Broke my spy option virginity.  I expect to lose my house soon.,t3_pgergo,16
1630586055.0,2021-09-02,wallstreetbets,hbb4187,"in the future 100% of people will be jobless. jobs will not be necessary because everyone will just make money on the stock market. trading companies who employ zero people. zero products, zero customers, only shareholders and options traders. we have evolved passed the need for food and water and everything else. only money",t3_pgergo,52
1630586047.0,2021-09-02,wallstreetbets,hbb40nu,"Jobs beat by 5k, new ATHs incoming",t3_pgergo,16
1630588003.0,2021-09-02,wallstreetbets,hbb7vxu,"Cathie sold BABA at the absolute bottom , queen of 'buy high sell low'",t3_pgergo,16
1630588519.0,2021-09-02,wallstreetbets,hbb8z7m,"Cathie : ""Okay guys, looks like the CCP wants common prosperity and $BABA will have to go to zero eventually, I'm selling at the 150 lows.""  


Headlines the next day : Cathie Wood's ARK Invest Sells Over 13000 Shares of Alibaba  


CCP : ""OK, now PAMP IT""  


  


$BABA TO THE MOON",t3_pgergo,15
1630589093.0,2021-09-02,wallstreetbets,hbba7ja,"Why do smoke detectors only have problems between 2 am and 5 am?  Can't you wait until 11 am to tell me to change the damn batteries?  Also, the false alarm at 5 am was just an asshole move.",t3_pgergo,16
1630589237.0,2021-09-02,wallstreetbets,hbbaiug,Off work today due to flooding from last nights storm which means I get to get high and lose money with you retards all day,t3_pgergo,16
1630591159.0,2021-09-02,wallstreetbets,hbbevhl,i always take profit too early while i let my losses get bigger and bigger.,t3_pgergo,17
1630591679.0,2021-09-02,wallstreetbets,hbbg2k9,I feel like I’m old enough to be some of the people in this thread’s dad.  And I’m 35,t3_pgergo,15
1630596166.0,2021-09-02,wallstreetbets,hbbqr9p,Anybody bring their lunches to work daily? Some of my coworkers buy food DAILY. Do they not realize they could take that $10-15 dollars daily and buy SPY 0DTE every friday with the money saved?,t3_pgergo,16
1630601554.0,2021-09-02,wallstreetbets,hbc46hm,CLOV is actually doing it........,t3_pgergo,16
1630602219.0,2021-09-02,wallstreetbets,hbc5vad,I am simply asking for CLOV $20. Seriously no big deal,t3_pgergo,15
1630606187.0,2021-09-02,wallstreetbets,hbcfriv,"brain: you should really sell while you're up  


me: hmm  


brain: you should at least sell while you're broke even  


me: hmm  


brain: ahh, shit, well, might as well hold at this point.  


me: fuck this bullshit!!! im selling!!!",t3_pgergo,16
1630588250.0,2021-09-02,wallstreetbets,hbb8emv,[deleted],t3_pgergo,15
1630588631.0,2021-09-02,wallstreetbets,hbb97pt,PLTR pls go up? 🥺👉👈,t3_pgergo,15
1630589223.0,2021-09-02,wallstreetbets,hbbahrm,I'm gonna double down on my puts. I don't give  a fuck.,t3_pgergo,15
1630598111.0,2021-09-02,wallstreetbets,hbbvfhj,"Delta ravages the south: **Stocks go up**

Inflation runs hot: **Stocks go up**

Jobs report bad: **Stocks go up**

Unemployment numbers good: **Stocks go up**

Hurricane hits New York City: **Stocks go up**

SPY January 21 2022 $470c. It's that easy.",t3_pgergo,14
1630599577.0,2021-09-02,wallstreetbets,hbbz45q,"Pre-2020 it used to be that good news made a stock go up, good earnings meant something, but these days I basically just fucking guess on everything and it’s honestly annoying as fuck",t3_pgergo,15
1630600377.0,2021-09-02,wallstreetbets,hbc15qv,Last chance to fuel up on CLOV we headed to the moon tomorrow!,t3_pgergo,15
1630601783.0,2021-09-02,wallstreetbets,hbc4rg8,"The way some of you guys are commenting, I'd expect CLOV to be at 35%+ today.",t3_pgergo,16
1630581251.0,2021-09-02,wallstreetbets,hbavs3g,Baba calls printing🤑,t3_pgergo,13
1630588266.0,2021-09-02,wallstreetbets,hbb8fux,About to see the fastest loss of my career on chwy when market opens. New record for me,t3_pgergo,13
1630589987.0,2021-09-02,wallstreetbets,hbbc7pa,"All the pump n dumps I bought are dumping 

AMA",t3_pgergo,14
1630593955.0,2021-09-02,wallstreetbets,hbblfsi,"Man, I love jumping onto sinking ships....",t3_pgergo,14
1630598626.0,2021-09-02,wallstreetbets,hbbwqeo,I’m really fucking bad at this lol.,t3_pgergo,14
1630600468.0,2021-09-02,wallstreetbets,hbc1e58,CLOV buying volume is off the charts now,t3_pgergo,14
1630601372.0,2021-09-02,wallstreetbets,hbc3po5,"Clov mooning, hell yeah",t3_pgergo,14
1630601547.0,2021-09-02,wallstreetbets,hbc45vu,Clov saw that GME guy quit his job and wanted a piece of the action,t3_pgergo,14
1630601578.0,2021-09-02,wallstreetbets,hbc48mz,"$CLOV, there it is,  9 !!!",t3_pgergo,15
1630601602.0,2021-09-02,wallstreetbets,hbc4ay0,"This CLOV chart is starting to look similar to when it jumped to 28 a few months back.

Slow rally today, jumps on Friday, and then parabolic after the weekend 👀",t3_pgergo,13
1630608020.0,2021-09-02,wallstreetbets,hbckd1g,"This sub be like 

2:00 pm “AHHHHHHH”

2:15 pm “haha you guys are stupid we’re already recovering 😏”

2:30 pm “AHHHHHHHHH”",t3_pgergo,13
1630580245.0,2021-09-02,wallstreetbets,hbaubn0,Cathie sold BABA at the absolute bottom 🤦‍♂️,t3_pgergo,41
1630578517.0,2021-09-02,wallstreetbets,hbas08c,i'm inviting you to another episode of SKLZ P&D,t3_pgergo,14
1630581552.0,2021-09-02,wallstreetbets,hbaw8gg,"Put that coffee down, that coffee is for closers.",t3_pgergo,12
1630584753.0,2021-09-02,wallstreetbets,hbb1lne,"$BABA $180 premarket, we're going to the moon boys",t3_pgergo,13
1630585340.0,2021-09-02,wallstreetbets,hbb2osq,"Futures are still nice and green. You know what that means!

*absolutely nothing*",t3_pgergo,14
1630588208.0,2021-09-02,wallstreetbets,hbb8bdn,Is SPY psychologically unable to go down? Like wtf is this,t3_pgergo,14
1630589054.0,2021-09-02,wallstreetbets,hbba4e4,"Someone mentioned $HOOD yesterday and naturally I acquired some weeklies right away.   
Happen to happen right on top.   
And now I'm a short term bagholder for HOOD.   
Thanks retards",t3_pgergo,13
1630590430.0,2021-09-02,wallstreetbets,hbbd7oo,"For some reason, this feels fake and I feel a dump incoming",t3_pgergo,13
1630591628.0,2021-09-02,wallstreetbets,hbbfy8a,pdt rule is anti american,t3_pgergo,14
1630593238.0,2021-09-02,wallstreetbets,hbbjr9e,$TTCF this squeeze these bears. Fire up that money machine!!,t3_pgergo,14
1630595669.0,2021-09-02,wallstreetbets,hbbpirf,"Just sold my CRSR calls, prepare for the price to moon.",t3_pgergo,11
1630599828.0,2021-09-02,wallstreetbets,hbbzr1o,"If you want to make money, I auggest selling before the price goes down. Also buy when the price is lowest.",t3_pgergo,14
1630600433.0,2021-09-02,wallstreetbets,hbc1av6,CLOV! LAC also having a solid week.,t3_pgergo,13
1630601588.0,2021-09-02,wallstreetbets,hbc49o6,CLOV through the barrier!,t3_pgergo,13
1630601646.0,2021-09-02,wallstreetbets,hbc4evu,Holy shit I’m only down 50% on my CLOV FDs now lmao,t3_pgergo,14
1630605409.0,2021-09-02,wallstreetbets,hbcdul3,Bulls about to find out what the P in S&P500 stands for,t3_pgergo,14
1630610528.0,2021-09-02,wallstreetbets,hbcqomr,Remember: you are ONE FD away from a completely different life,t3_pgergo,12
1630582328.0,2021-09-02,wallstreetbets,hbaxg10,BABA all in,t3_pgergo,12
1630588268.0,2021-09-02,wallstreetbets,hbb8g02,I'm still sad about Alex Trebek. Anyway...SPY ATH by EOD!,t3_pgergo,11
1630591976.0,2021-09-02,wallstreetbets,hbbgr9x,TTCF squeeze is on,t3_pgergo,12
1630592253.0,2021-09-02,wallstreetbets,hbbhefy,TTCF is damn ready for a squeeze. So bullish right now,t3_pgergo,12
1630592359.0,2021-09-02,wallstreetbets,hbbhne3,"Yeah ttcf sky rocketing on no news and a bunch of folks saying ""it's finsta squeeze"" isn't suspicious at all.",t3_pgergo,12
1630596164.0,2021-09-02,wallstreetbets,hbbqr38,I. Don’t. Know. If. The. Market. Will. Ever. Go. Down. Again.,t3_pgergo,12
1630598887.0,2021-09-02,wallstreetbets,hbbxe0t,I need to stop drinking a load of beer and eating a whole ass pizza like it's nothing. Not 19 any more 🙏,t3_pgergo,13
1630599278.0,2021-09-02,wallstreetbets,hbbyd2y,"Damn, September has been brutal, thus far. My account has been ridiculously green 🥺",t3_pgergo,12
1630599774.0,2021-09-02,wallstreetbets,hbbzm5i,Go go CLOV!,t3_pgergo,11
1630600029.0,2021-09-02,wallstreetbets,hbc09px,GREEN DILDOS FOR CLOV,t3_pgergo,12
1630600998.0,2021-09-02,wallstreetbets,hbc2ra2,"quick, someone tell me why CLOV is moving?",t3_pgergo,12
1630601933.0,2021-09-02,wallstreetbets,hbc55as,CLOV to 9.08 LFG.,t3_pgergo,12
1630610346.0,2021-09-02,wallstreetbets,hbcq823,"I mean I’m no conspiracy guy, but if there was ever a virus engineered to cull the fatties, the old and the dumb, covid does a pretty good job.",t3_pgergo,13
1630611048.0,2021-09-02,wallstreetbets,hbcrzhv,"R o c k e t 

L a b 

U S A",t3_pgergo,12
1630613533.0,2021-09-02,wallstreetbets,hbcya63,**Cathie tomorrow:** we have decided to invest in DOCU because deflation will run rampant and we hedge by making bold plays in disruption.,t3_pgergo,11
1630613862.0,2021-09-02,wallstreetbets,hbcz431,i sold my PLTR shares at a loss today after bagholding for the whole year. I feel free,t3_pgergo,13
1630579892.0,2021-09-02,wallstreetbets,hbatu7q,Would be cool if CRSR could stop being ridiculous,t3_pgergo,11
1630588665.0,2021-09-02,wallstreetbets,hbb9a6y,Appl to 160 baby!!,t3_pgergo,11
1630589380.0,2021-09-02,wallstreetbets,hbbaucw,Baba writes china a 15billion dollar cheque to fuck off. So bullish,t3_pgergo,11
1630589622.0,2021-09-02,wallstreetbets,hbbbdwj,I’m never buying puts again,t3_pgergo,10
1630590065.0,2021-09-02,wallstreetbets,hbbce4q,Already down 35% today lmao.,t3_pgergo,11
1630590156.0,2021-09-02,wallstreetbets,hbbclkw,Can someone hold these bags while I run inside real quick?  I swear to god I’ll be RIGHT back,t3_pgergo,12
1630591292.0,2021-09-02,wallstreetbets,hbbf6kp,PLTR ![gif](emote|free_emotes_pack|give_upvote),t3_pgergo,11
1630594127.0,2021-09-02,wallstreetbets,hbblu60,GME 650$ EOD,t3_pgergo,10
1630596158.0,2021-09-02,wallstreetbets,hbbqqkm,Ever feel like the market has it out for you personally?,t3_pgergo,10
1630598956.0,2021-09-02,wallstreetbets,hbbxk63,Tell me a more iconic duo than Bears and a red Portfolio.,t3_pgergo,11
1630600237.0,2021-09-02,wallstreetbets,hbc0srh,CLOV never ceases to amaze,t3_pgergo,11
1630600615.0,2021-09-02,wallstreetbets,hbc1s55,Bought $CLOV a few weeks ago to be one of the boys.. look at us now,t3_pgergo,10
1630601391.0,2021-09-02,wallstreetbets,hbc3rd4,"At this point, I won’t start getting excited until I see TLRY over $20 and CLOV over $15. I say this as a bagholder.",t3_pgergo,11
1630601490.0,2021-09-02,wallstreetbets,hbc40hn,Clov is acting retarded let's fucking go! 🚀,t3_pgergo,11
1630601601.0,2021-09-02,wallstreetbets,hbc4atf,CLOV STOP YOU’RE MAKING ME SOAKING WET,t3_pgergo,11
1630601615.0,2021-09-02,wallstreetbets,hbc4c2o,"If you all buy clov, it will go up and squeeze",t3_pgergo,11
1630601966.0,2021-09-02,wallstreetbets,hbc58cv,My CLOV calls printing 👀,t3_pgergo,12
1630602012.0,2021-09-02,wallstreetbets,hbc5ciw,"Going into a meeting now, don't fuck this up CLOV, see you in 45 mins",t3_pgergo,11
1630602033.0,2021-09-02,wallstreetbets,hbc5ef9,#CLOV and DM literally printers💵,t3_pgergo,12
1630602161.0,2021-09-02,wallstreetbets,hbc5q6f,SOFI TO THE MOOOOOON,t3_pgergo,13
1630602305.0,2021-09-02,wallstreetbets,hbc632j,"Careful. I lost my wife, 2 sons, dog and relationship with the lord to my dark relationship with CLOV",t3_pgergo,10
1630602377.0,2021-09-02,wallstreetbets,hbc69ji,Clov making moves...to $20 EOD,t3_pgergo,11
1630605428.0,2021-09-02,wallstreetbets,hbcdwan,"SPY goes down 70%: “eh whatever”

Individual stock goes down 0.1%: “Jarvis, bring me my finest rope”",t3_pgergo,11
1630605876.0,2021-09-02,wallstreetbets,hbcezv8,[deleted],t3_pgergo,11
1630610708.0,2021-09-02,wallstreetbets,hbcr4oe,"Remember what happened on September 3, 2020. Half this sub was wiped out by that -8% week, and there weren't any meme apes back then either so this community was smaller.

Godspeed to you call holders, but I've closed my positions and will be sitting on the sidelines until next Tuesday. o7",t3_pgergo,10
1630611168.0,2021-09-02,wallstreetbets,hbcsa5k,RKLB what are you,t3_pgergo,11
1630614336.0,2021-09-02,wallstreetbets,hbd0bx5,got docu and spy puts,t3_pgergo,10
1630578166.0,2021-09-02,wallstreetbets,hbarkcp,Bought 10 contracts 9/3 222.5 of the stonk yesterday morning and I'm -2300 and I think I will watch the whole $6800 evap by tomorrow. I will post afterwards as loss porn. Ty Apes,t3_pgergo,9
1630585564.0,2021-09-02,wallstreetbets,hbb33y1,The only good thing about this sub is that I don't need anybody to agree with me for me to be right.,t3_pgergo,10
1630586399.0,2021-09-02,wallstreetbets,hbb4p0o,Why do you feel so relaxed and refreshed after taking a shit?,t3_pgergo,11
1630586504.0,2021-09-02,wallstreetbets,hbb4w93,The results are in: Bers still fuk,t3_pgergo,10
1630586547.0,2021-09-02,wallstreetbets,hbb4z8l,RkT is a piece of shit company.,t3_pgergo,9
1630590120.0,2021-09-02,wallstreetbets,hbbcinq,There goes spy killing bears again,t3_pgergo,11
1630591245.0,2021-09-02,wallstreetbets,hbbf2p8,Michael Phelps doing therapy ads when he knows the real secret is a fatty bong rip,t3_pgergo,10
1630591694.0,2021-09-02,wallstreetbets,hbbg3tv,corsair moves like cold honey,t3_pgergo,9
1630591704.0,2021-09-02,wallstreetbets,hbbg4o3,CLOV bitch can u do something,t3_pgergo,11
1630593605.0,2021-09-02,wallstreetbets,hbbkmp0,My all time chart is back down to its -75% support looking for a bounce back to -50% or more,t3_pgergo,12
1630593764.0,2021-09-02,wallstreetbets,hbbl0de,Who bought TTCF calls at the top? Couldn’t have been me 🥴,t3_pgergo,10
1630593796.0,2021-09-02,wallstreetbets,hbbl31i,"Looks like GME / AMC apes realize that if Gensler's figure is right and buy orders all get routed to darkpools, the selling is fake, people really do be HODLing.",t3_pgergo,9
1630594047.0,2021-09-02,wallstreetbets,hbblnd9,If DOCU could just plummet to the earth's core after earnings that would be great,t3_pgergo,11
1630594234.0,2021-09-02,wallstreetbets,hbbm3bd,Not sure why people lose money. You just buy when the stock is down and sell when it has gone up. Easy,t3_pgergo,11
1630594436.0,2021-09-02,wallstreetbets,hbbmkp8,[deleted],t3_pgergo,9
1630595975.0,2021-09-02,wallstreetbets,hbbqa2h,I’m a bear and I’m giving up,t3_pgergo,10
1630596079.0,2021-09-02,wallstreetbets,hbbqjg5,TLRY!!! Could today be the day you break $14.20??? ![gif](emote|free_emotes_pack|give_upvote),t3_pgergo,9
1630596531.0,2021-09-02,wallstreetbets,hbbrndu,Market is so good even $SOFI green.,t3_pgergo,10
1630596743.0,2021-09-02,wallstreetbets,hbbs4zc,People shilling 5 year uranium plays while everyone else is yoloing on 0 DTE spy calls. Go push your nuclear power microcap indexes at r/investing.,t3_pgergo,9
1630599009.0,2021-09-02,wallstreetbets,hbbxouw,WTF SPY?  Make me more money dammit.  Fuck 30% profits,t3_pgergo,11
1630599556.0,2021-09-02,wallstreetbets,hbbz2b4,CLOV keep flying you cunt,t3_pgergo,10
1630601451.0,2021-09-02,wallstreetbets,hbc3wxf,Chelsea Clinton is so smart and funny.  That's why I'm going all in on CLOV,t3_pgergo,9
1630601597.0,2021-09-02,wallstreetbets,hbc4agl,CLOV to the moon,t3_pgergo,10
1630601939.0,2021-09-02,wallstreetbets,hbc55tl,CLOV alert!,t3_pgergo,9
1630601946.0,2021-09-02,wallstreetbets,hbc56ky,Clov gotta break $9,t3_pgergo,9
1630602063.0,2021-09-02,wallstreetbets,hbc5hd3,CNBC just said buy sofi 15.5c. Selling my shares now lol,t3_pgergo,11
1630602066.0,2021-09-02,wallstreetbets,hbc5hlr,"So I get her a ring worth more than AMZN calls, then her six figure student loan and credit card debt becomes mine as well, we have a few kids, and if at any point she just decides she's just not feeling it anymore she gets them.....and the house....and half my money? Why do people get married?",t3_pgergo,11
1630602138.0,2021-09-02,wallstreetbets,hbc5o4x,Strap in boys! CLOV! 🚀,t3_pgergo,10
1630602154.0,2021-09-02,wallstreetbets,hbc5pjc,Sofi's ceo bought over 500k in stock at around 14.4... you think he wants to piss away his money?,t3_pgergo,10
1630602558.0,2021-09-02,wallstreetbets,hbc6q0e,CLOV waking up. Wells Fargo presentation next Thursday the day before expiry. Pump inbound,t3_pgergo,11
1630605762.0,2021-09-02,wallstreetbets,hbceps2,[deleted],t3_pgergo,9
1630607018.0,2021-09-02,wallstreetbets,hbchu8c,Media trying to tell me nflx has been surging because they announced when the 30 year old Seinfeld episodes will be available.,t3_pgergo,11
1630607661.0,2021-09-02,wallstreetbets,hbcjggi,"Feels like i should take a break from trading , i might not be very good and i’ve been losing alot of money 

*gets struck with pure luck and is up 1000% on SPCE puts that were purchased for no reason*

I’m a fucking genius",t3_pgergo,10
1630607923.0,2021-09-02,wallstreetbets,hbck4gl,"All of my tiny green gains are banding together to offset my SWBI losses, leading to a grand total of currently +$17.66 for the day.  


I don't want to brag guys, but that's almost enough for a large pizza at a fancy chain.",t3_pgergo,10
1630608406.0,2021-09-02,wallstreetbets,hbclbqc,"my life is in shambles. I will never financially recover from this. 

\#Sacrificed. #AMZN #railed",t3_pgergo,11
1630609211.0,2021-09-02,wallstreetbets,hbcndw2,Thought CHPT was chipotle,t3_pgergo,11
1630611775.0,2021-09-02,wallstreetbets,hbctt62,Stellar jobs report=tapering=market tank,t3_pgergo,10
1630612832.0,2021-09-02,wallstreetbets,hbcwi1z,Bought SPY puts 10 minutes before close. You're welcome for the pump.,t3_pgergo,10
1630613284.0,2021-09-02,wallstreetbets,hbcxnlo,How the fuck did DocuSign even get so high. What do they do that Adobe can't do,t3_pgergo,10
1630614776.0,2021-09-02,wallstreetbets,hbd1g05,"could somebody link me that ""how i made my first million"" speech from that guy who goes into detail describing how he made his first million $ by detailing how at 15, he bought candy/oranges/newspapers or some shit, kept doubling down, carefully reinvesting his profits and when he's 18 he gets gifted a couple of millions from his father?",t3_pgergo,12
1630580915.0,2021-09-02,wallstreetbets,hbava3i,China invades Afghanistan. Baba up 10000%,t3_pgergo,29
1630585996.0,2021-09-02,wallstreetbets,hbb3x5q,Mfs apartments be flooding and they be taking tiktoks for clout instead of getting out of there,t3_pgergo,31
1630588582.0,2021-09-02,wallstreetbets,hbb93za,I left an italian sub at my desk march 2020 and haven't been back to the office since. Wonder how thats holding up,t3_pgergo,28
1630579811.0,2021-09-02,wallstreetbets,hbatq5i,Cramer still uses his graduation picture on tinder,t3_pgergo,9
1630579820.0,2021-09-02,wallstreetbets,hbatqlm,"Well it’s 3:49 in California. I can almost go back to sleep after I see what this premarket does. Lets hope I wake back up to a green screen. Goodnight west coast, good morning east coast.",t3_pgergo,9
1630580176.0,2021-09-02,wallstreetbets,hbau8c2,"Bruh there was a electrical fire at work earlier this week, and Cintas manages our fire extinguisher maintenance right? Out of 6 extinguishers we used before the firetrucks came, **THREE of them didn't work!?!? WTF??!?** Clearly Cintas is cutting corners for profits, maybe we should all buy calls? Thoughts?",t3_pgergo,9
1630581348.0,2021-09-02,wallstreetbets,hbavxbl,I remember the daily comments exploded on the 2020 crash. The limit downs every night. But the memes....... *(chef's kiss)*......perfection 👌,t3_pgergo,10
