created,date,subreddit,id,body,parent_id,score
1620214629.0,2021-05-05,wallstreetbets,gx0jmi2,Mnmd deserve. Love it💯♥️,t3_n5cc1t,8
1620214810.0,2021-05-05,wallstreetbets,gx0jw29,How hard are bers going to get ass pounded today?,t3_n5cc1t,9
1620216006.0,2021-05-05,wallstreetbets,gx0lphq,Bears predicted the last 3 crashes 627 times. Amazingly accurate!,t3_n5cc1t,9
1620216734.0,2021-05-05,wallstreetbets,gx0muo1,RKT gonna get wild today strap in,t3_n5cc1t,9
1620217133.0,2021-05-05,wallstreetbets,gx0nie6,Guys it's all a pyramid scheme,t3_n5cc1t,9
1620217480.0,2021-05-05,wallstreetbets,gx0o3cl,Jessica Alba is stunning,t3_n5cc1t,8
1620218272.0,2021-05-05,wallstreetbets,gx0pgs1,"Why yes, I only buy stock in companies with ads on CNBC.",t3_n5cc1t,10
1620218957.0,2021-05-05,wallstreetbets,gx0qpku,"got burned on 3 day trades yesterday...Not one position worked out...

&#x200B;

I have made it....",t3_n5cc1t,8
1620219605.0,2021-05-05,wallstreetbets,gx0rx9x,"Citron tomorrow:  “after careful re-evaluation we have pltr as a buy, price target $95 2021”",t3_n5cc1t,9
1620219657.0,2021-05-05,wallstreetbets,gx0s0q6,The gates to hell have opened:D,t3_n5cc1t,10
1620219802.0,2021-05-05,wallstreetbets,gx0saht,Will my tits ever be jacked again 😩,t3_n5cc1t,8
1620219893.0,2021-05-05,wallstreetbets,gx0sgv3,"Idk why Cathie YOLO into COIN IPO. Like, ever amateur knows it's gonna drop after that first day.",t3_n5cc1t,9
1620220224.0,2021-05-05,wallstreetbets,gx0t3ff,Wait..you can make money on stocks instead of losing it?!,t3_n5cc1t,10
1620220579.0,2021-05-05,wallstreetbets,gx0ts90,"David ""Proud Boi"" Faber",t3_n5cc1t,8
1620221031.0,2021-05-05,wallstreetbets,gx0uoy4,"So many dumb 🐻 in here

We docked at the space station yesterday and are now back to our regularly scheduled moon mission",t3_n5cc1t,9
1620221347.0,2021-05-05,wallstreetbets,gx0vbti,Why don’t we tape down this stupid rug so they can’t pull it anymore,t3_n5cc1t,8
1620221371.0,2021-05-05,wallstreetbets,gx0vdno,Alhamdulillah here we go again,t3_n5cc1t,9
1620221731.0,2021-05-05,wallstreetbets,gx0w3z6,Stop selling fucking dumb boomers,t3_n5cc1t,9
1620222723.0,2021-05-05,wallstreetbets,gx0y6o0,"ocugen got me a little, how do i say this... wet in my man pussy",t3_n5cc1t,9
1620222803.0,2021-05-05,wallstreetbets,gx0ycsk,"Fuck after hours, fuck pre market, and fuck earnings. Shit is a scam",t3_n5cc1t,9
1620223023.0,2021-05-05,wallstreetbets,gx0ytvh,All in on shares of OCGN and puts of MVIS,t3_n5cc1t,9
1620223215.0,2021-05-05,wallstreetbets,gx0z8r0,[deleted],t3_n5cc1t,9
1620223396.0,2021-05-05,wallstreetbets,gx0zmvh,Aaaaaaaaand it’s gone,t3_n5cc1t,8
1620223402.0,2021-05-05,wallstreetbets,gx0znb9,Lets get CLOV back ☝ ☝ ☝,t3_n5cc1t,8
1620223593.0,2021-05-05,wallstreetbets,gx102kk,I don’t feel so good Mr. Market 📉,t3_n5cc1t,9
1620223595.0,2021-05-05,wallstreetbets,gx102py,"Well shit, I missed this 2nd SPX dump. Still made $7K on the first dump a few minutes after open.

I'm done trading for the day. Time to enjoy the sunshine 🌞🌞🌞",t3_n5cc1t,8
1620223891.0,2021-05-05,wallstreetbets,gx10q49,Loading up on more RKT before earnings.,t3_n5cc1t,9
1620224439.0,2021-05-05,wallstreetbets,gx11y6z,I've been losing 10% a day for about a week now,t3_n5cc1t,8
1620224769.0,2021-05-05,wallstreetbets,gx12otd,It’s all a 🌈🐻 trap,t3_n5cc1t,8
1620224920.0,2021-05-05,wallstreetbets,gx1312u,"Who would have thought that an absurdly overpriced exercise bike that becomes a brick when you stop paying for a subscription or the servers die weren't a very good investment 

find a throw out exercise bike in a dump and go search ""motivational speeches"" on youtube and save yourself some cash",t3_n5cc1t,9
1620225058.0,2021-05-05,wallstreetbets,gx13c8o,I expect to see some insane loss porn,t3_n5cc1t,9
1620226133.0,2021-05-05,wallstreetbets,gx15spa,"Bruh i promise if i break even this week, i wont even LOOK at another Tesla weekly",t3_n5cc1t,10
1620226298.0,2021-05-05,wallstreetbets,gx166g6,PLTR will provide for those who are worthy,t3_n5cc1t,9
1620226481.0,2021-05-05,wallstreetbets,gx16lw3,"When I start seeing negative articles about CLOV, I know that shit is about to pop.",t3_n5cc1t,9
1620226628.0,2021-05-05,wallstreetbets,gx16y81,AMD making them chips,t3_n5cc1t,10
1620226729.0,2021-05-05,wallstreetbets,gx176ph,salad was only invented as a vessel to eat salad dressing prove me wrong,t3_n5cc1t,9
1620226810.0,2021-05-05,wallstreetbets,gx17doi,Holy shit NIO actually turned green.  Time to break even and gtfo!,t3_n5cc1t,10
1620227265.0,2021-05-05,wallstreetbets,gx18gm8,It's getting more difficult to distinguish CNBC from MSNBC......and RKT to the moon,t3_n5cc1t,9
1620227353.0,2021-05-05,wallstreetbets,gx18o4r,We gonna break this stupid ass wall 🚀🚀🚀 RKT TO THE MOON,t3_n5cc1t,7
1620228295.0,2021-05-05,wallstreetbets,gx1ax2a,Hey AMD fuck you,t3_n5cc1t,9
1620228503.0,2021-05-05,wallstreetbets,gx1bf0j,"I was looking at how my portfolio goes up and down couple hundred over the course of the day and thought gee, I could just pick an up moment, sell everything, and then rebuy the same positions a few hours later, make an easy couple hundred a day. Thought I was a genius until I realized that's just what a day trader does ![gif](emote|free_emotes_pack|facepalm)",t3_n5cc1t,9
1620229163.0,2021-05-05,wallstreetbets,gx1d1on,"We all know the market is waiting on PLTR earnings on Tuesday. When PLTR smashes  earnings, it will inevitably tank allowing the mlrest of the market to go up.",t3_n5cc1t,9
1620229681.0,2021-05-05,wallstreetbets,gx1ec5u,CRSR? I don't even know her,t3_n5cc1t,10
1620231069.0,2021-05-05,wallstreetbets,gx1hqr8,10% up crsr and still undervalued,t3_n5cc1t,11
1620231204.0,2021-05-05,wallstreetbets,gx1i2k9, CRSR is up more than 1% lol. I must be dreaming. What happened that caused this?,t3_n5cc1t,8
1620231894.0,2021-05-05,wallstreetbets,gx1jrjd,CRSR straight up carrying the US economy rn,t3_n5cc1t,9
1620232143.0,2021-05-05,wallstreetbets,gx1kdgg,"*CRSR bags fade*


BAH GAWD",t3_n5cc1t,8
1620232753.0,2021-05-05,wallstreetbets,gx1lvt2,TFW you thought spy was gonna go parabolic but then it went Cosecant.,t3_n5cc1t,8
1620233037.0,2021-05-05,wallstreetbets,gx1ml95,PTON recall is one thing that was not priced in.,t3_n5cc1t,9
1620233368.0,2021-05-05,wallstreetbets,gx1nfea,"Ok what in the everlasting fuck is wrong with Blackberry?

Fuck you to death short sellers. Get lynched one day",t3_n5cc1t,9
1620234290.0,2021-05-05,wallstreetbets,gx1pqb2,This is not enjoyable.. I’m having the worst time,t3_n5cc1t,9
1620234293.0,2021-05-05,wallstreetbets,gx1pqlg,Pltr goes down every day yet never goes below 20. 75% of my portfolio so I don’t remember how it feels to have bigly green days anymore,t3_n5cc1t,10
1620234604.0,2021-05-05,wallstreetbets,gx1qhvk,This is just a test right? TSLA bout to take flight soon right 😒,t3_n5cc1t,8
1620234618.0,2021-05-05,wallstreetbets,gx1qj5h,Infinite money glitch: buy AMD at 77 sell at 83,t3_n5cc1t,8
1620234644.0,2021-05-05,wallstreetbets,gx1qld7,Any fuel left in the CRSR rocket?,t3_n5cc1t,8
1620235113.0,2021-05-05,wallstreetbets,gx1rqk0,Am I gonna be a TSLA bagholder now? this shit fR?,t3_n5cc1t,9
1620235761.0,2021-05-05,wallstreetbets,gx1tacs,"PLTR level 2 sell orders are piling up.

Fuck this stock.",t3_n5cc1t,9
1620236563.0,2021-05-05,wallstreetbets,gx1v6yw,Smells like a bull trap,t3_n5cc1t,10
1620236674.0,2021-05-05,wallstreetbets,gx1vgc8,PLTR the biggest piece of shit,t3_n5cc1t,9
1620236740.0,2021-05-05,wallstreetbets,gx1vm0x,"Where’s that dude who said the GME party is taking off at 1pm EST, cause I wanna laugh at you.",t3_n5cc1t,9
1620236757.0,2021-05-05,wallstreetbets,gx1vnhy,I was going to buy AMD but the price was too low,t3_n5cc1t,9
1620236810.0,2021-05-05,wallstreetbets,gx1vryt,One person doing a $30 million buy on PLTR and it still has a terrible day puts into perspective how little our pissant accounts actually matter in the grand scheme...and people actually think they can push GME to 1 million a share with their single share buys lmao.,t3_n5cc1t,9
1620236905.0,2021-05-05,wallstreetbets,gx1w06g,"Holy shit boys bots are off!!!

Calls on bagholder murder threats!",t3_n5cc1t,9
1620236980.0,2021-05-05,wallstreetbets,gx1w6ru,RKT ready for takeoff,t3_n5cc1t,9
1620236999.0,2021-05-05,wallstreetbets,gx1w8ej,RKT broke the VWAP,t3_n5cc1t,8
1620237002.0,2021-05-05,wallstreetbets,gx1w8ov,All aboard! RKT train will launch ETA 2 hours 40 minutes.,t3_n5cc1t,8
1620237272.0,2021-05-05,wallstreetbets,gx1wvx8,AMD is an obvious buy. Just like CRSR was an obvious buy. You didn’t want it at 78 but you’ll chase at $100+,t3_n5cc1t,8
1620237484.0,2021-05-05,wallstreetbets,gx1xdys,PTON better sell a shitload more bikes to basic white girls to overcome this.,t3_n5cc1t,9
1620237502.0,2021-05-05,wallstreetbets,gx1xfjc,Starting to think that inversing Cathie is the way to green,t3_n5cc1t,10
1620237556.0,2021-05-05,wallstreetbets,gx1xjwb,Let’s go RKT!,t3_n5cc1t,9
1620237782.0,2021-05-05,wallstreetbets,gx1y30s,SNDL is still overvalue.,t3_n5cc1t,8
1620238263.0,2021-05-05,wallstreetbets,gx1z7ad,"wtf — warren buffet said buy and hold.

i hold option and it expire!

liar!",t3_n5cc1t,9
1620239259.0,2021-05-05,wallstreetbets,gx21j36,"Whenever I sell half and let half ride, I get fucked. Whenever I sell all and take profits, it moons.",t3_n5cc1t,10
1620239587.0,2021-05-05,wallstreetbets,gx22ald,"When Martin Shkreli is free , he will post a DD in here for 10M retards to jump in and pump it to the moon.",t3_n5cc1t,10
1620239680.0,2021-05-05,wallstreetbets,gx22ig5,You bastards convinced me to ride the RKT ship to the moon 🚀🚀🚀,t3_n5cc1t,10
1620240948.0,2021-05-05,wallstreetbets,gx25i69,Cathie is gonna own the entire PLTR company tonight.,t3_n5cc1t,9
1620241364.0,2021-05-05,wallstreetbets,gx26hcz,tech is (A) undervalued (B) a fucking death trap,t3_n5cc1t,9
1620241649.0,2021-05-05,wallstreetbets,gx275ng,Amd bag holder here. Hodl me.,t3_n5cc1t,9
1620241901.0,2021-05-05,wallstreetbets,gx27r50,one day i'll learn to take profits instead of watching options go from 100+% to deep negative,t3_n5cc1t,9
1620242779.0,2021-05-05,wallstreetbets,gx29u8c,I’m done trading for a while man 😂,t3_n5cc1t,9
1620242883.0,2021-05-05,wallstreetbets,gx2a37k,Cashing out and dumping all into internet corn,t3_n5cc1t,8
1620242954.0,2021-05-05,wallstreetbets,gx2a9sm,The market is just going to grind itself down to $1 a share on everything apparently,t3_n5cc1t,8
1620243036.0,2021-05-05,wallstreetbets,gx2ah60,We should all agree to stop calling it power hour. The final hour hasn't had power in how long.,t3_n5cc1t,8
1620243185.0,2021-05-05,wallstreetbets,gx2atz8,If today closes red this will be 8 red days in a row for Nasdaq.,t3_n5cc1t,8
1620243458.0,2021-05-05,wallstreetbets,gx2bhsg,Going to be so poor I'm going to have to jerk off the dog to feed the cat,t3_n5cc1t,10
1620243673.0,2021-05-05,wallstreetbets,gx2c004,This game sucks,t3_n5cc1t,9
1620243899.0,2021-05-05,wallstreetbets,gx2cj40,[deleted],t3_n5cc1t,9
1620244277.0,2021-05-05,wallstreetbets,gx2dg4g,hey mom can you come pick me up? im not having fun anymore,t3_n5cc1t,9
1620244542.0,2021-05-05,wallstreetbets,gx2e2vc,Jesus i miss the days where many stocks r up 20% and we were acting just cool...now we r cheering a 0.56 % in AAPL 😭,t3_n5cc1t,10
1620244753.0,2021-05-05,wallstreetbets,gx2ekor,RKT let's go!,t3_n5cc1t,9
1620244916.0,2021-05-05,wallstreetbets,gx2eytj,If it’s this bad in a bull market imagine the pain we’ll feel when the bear market gets here.,t3_n5cc1t,9
1620224807.0,2021-05-05,wallstreetbets,gx12rwl,200 IQ play right here.  Half of Zero is still Zero.,t1_gx12n34,11
1620211623.0,2021-05-05,wallstreetbets,gx0fmqd,There is no inflation....there is no inflation....said with Dorothy from Kansas repetition.,t1_gx0f65u,14
1620212277.0,2021-05-05,wallstreetbets,gx0gfuj,it is literally a kangaroo jumps from 77-79 up to 84 every time i just dont have the balls to buy in,t1_gx0fyof,11
1620212410.0,2021-05-05,wallstreetbets,gx0glx3,"i wish i realized sooner that if you pick against most of the stocks posted here, you do pretty well. oh well. better late than never.",t1_gx0gc60,47
1620213656.0,2021-05-05,wallstreetbets,gx0i8r9,"Well? 

Is it?",t1_gx0hztc,65
1620213657.0,2021-05-05,wallstreetbets,gx0i8tp,"That’s pretty consistent, let me know your next move so I can inverse you. Of course knowing my track record that’ll be the time you get it right.",t1_gx0i1bd,30
1620213317.0,2021-05-05,wallstreetbets,gx0hsap,Career != Job my guy,t1_gx0hq4a,10
1620216489.0,2021-05-05,wallstreetbets,gx0mgn7,Virgin boss vs chad employee,t1_gx0mdu8,53
1620212956.0,2021-05-05,wallstreetbets,gx0hbg4,With divorce papers,t1_gx0h4x6,11
1620233209.0,2021-05-05,wallstreetbets,gx1n0ym,The teller gave me my tickets already ripped up,t1_gx1muov,10
1620241960.0,2021-05-05,wallstreetbets,gx27w17,"Seriously, what an annoying market",t1_gx27rla,9
1620218564.0,2021-05-05,wallstreetbets,gx0pzhb,I am also 5 and request this video,t1_gx0px2o,9
1620214104.0,2021-05-05,wallstreetbets,gx0ivb7,This is a retard convention,t1_gx0itgc,22
1620244019.0,2021-05-05,wallstreetbets,gx2ctd0,Yes,t1_gx2cpj3,9
1620210735.0,2021-05-05,wallstreetbets,gx0el5i,There's a coin named Elongate already.,t1_gx0dx5q,17
1620214409.0,2021-05-05,wallstreetbets,gx0jarn,"It’s like when a toddler learns a new word, and that’s all they can say for a few days.",t1_gx0j839,61
1620214510.0,2021-05-05,wallstreetbets,gx0jg3i,Shorts are covering.,t1_gx0j839,12
1620226039.0,2021-05-05,wallstreetbets,gx15kw1,Fucking bill gates fanboys,t1_gx15hje,13
1620227463.0,2021-05-05,wallstreetbets,gx18xjm,Oh I hope so my RKT bags are heavy and I'm never gonna listen to reason or take a bath!,t1_gx18t1z,7
1620235452.0,2021-05-05,wallstreetbets,gx1sjsw,This man right here officer,t1_gx1sg9d,9
1620239980.0,2021-05-05,wallstreetbets,gx237zw,"congratulations on becoming a ~~bagholder~~ ""long-term investor"" 🤡",t1_gx234lc,9
1620214160.0,2021-05-05,wallstreetbets,gx0iy65,She's built different I tell ya.,t1_gx0iu3w,10
1620215641.0,2021-05-05,wallstreetbets,gx0l552,"Just meet me behind the wendys, ill take care of it.",t1_gx0l2p9,10
1620228352.0,2021-05-05,wallstreetbets,gx1b22i,And you can do it as many times as you want!,t1_gx1azd1,8
1620211018.0,2021-05-05,wallstreetbets,gx0ex32,Drinking game: look up a list of Independence Days and see how many are independence from the UK,t1_gx0escq,21
1620243904.0,2021-05-05,wallstreetbets,gx2cjif,Calls on hot topic,t1_gx2cf6d,14
1620208999.0,2021-05-05,wallstreetbets,gx0cnma,I’m already holding my ankles,t1_gx0ckci,21
1620213417.0,2021-05-05,wallstreetbets,gx0hwzn,Big if true.,t1_gx0hqwj,15
1620212642.0,2021-05-05,wallstreetbets,gx0gwps,"It’s totally bipolar, you should have seen it last night. You’d have thought society as we know it had collapsed. Even I felt myself morphing into a 🐻",t1_gx0gs2g,11
1620226085.0,2021-05-05,wallstreetbets,gx15ooe,is this 2001,t1_gx15jh2,9
1620209834.0,2021-05-05,wallstreetbets,gx0dkhk,now kiss,t1_gx0ddlz,46
1620218648.0,2021-05-05,wallstreetbets,gx0q52b,Jesus,t1_gx0q1gn,20
1620211348.0,2021-05-05,wallstreetbets,gx0fazt,"JPow put her in indefinite timeout. She'll be allowed to announce when the Fed is buying stocks, that's it.",t1_gx0f105,8
1620213751.0,2021-05-05,wallstreetbets,gx0idgt,"No, it's an inverted ladder attack",t1_gx0i8r9,37
1620214490.0,2021-05-05,wallstreetbets,gx0jf14,*you mean months*,t1_gx0jarn,31
1620209961.0,2021-05-05,wallstreetbets,gx0dpmh,Don’t threaten me with a good time,t1_gx0dkhk,24
