created,date,subreddit,id,body,parent_id,score
1596815339.0,2020-08-07,wallstreetbets,g0owccz,"Say it with me:

PRPLs. Consumers. Are. Upper. Class. White. Chicks.

All you mother fuckers thinking they're going to tank because of unemployment are on drugs.",t3_i5b9o9,18
1596796042.0,2020-08-07,wallstreetbets,g0ntmsi,"Throwing 50 bucks on a few guys to win the pga feels no different than options

Edit: and it provides weekend entertainment. Nobody cares but did 40 each on Koepka, Woodland, Schauflee and Todd if anyone wants to buy lotto tickets with me",t3_i5b9o9,9
1596796644.0,2020-08-07,wallstreetbets,g0nu8j4,"According to Robintrack, the number of RH users holding RCKT grew by 30% yesterday

https://robintrack.net/symbol/RCKT

I wonder what percent actually meant to buy RCKT vs. what percent thought they were buying RKT...",t3_i5b9o9,8
1596796826.0,2020-08-07,wallstreetbets,g0nufdf,[deleted],t3_i5b9o9,8
1596798633.0,2020-08-07,wallstreetbets,g0nwlsn,Ok RKT very nice 👍,t3_i5b9o9,8
1596798729.0,2020-08-07,wallstreetbets,g0nwrhb,Bought 100 RKT.   Only wish I had bought 500.,t3_i5b9o9,9
1596799040.0,2020-08-07,wallstreetbets,g0nx9o5,Trade wars are fun and easy to win.,t3_i5b9o9,9
1596799837.0,2020-08-07,wallstreetbets,g0nylzq,"don’t ask how or why


but it’ll be green today",t3_i5b9o9,8
1596800669.0,2020-08-07,wallstreetbets,g0o01bx,If RKT touches 80 today I might sell... that’ll bring me back up to a zero lifetime gain,t3_i5b9o9,9
1596801837.0,2020-08-07,wallstreetbets,g0o27uc,"Yesterday fooled me too, SPY being down afterhours. Hopefully with some of the news floating around this will give me an opportunity to get out for less of a less on these 330p",t3_i5b9o9,9
1596802672.0,2020-08-07,wallstreetbets,g0o3vzu,I kinda want the jobs report to be bad so I can justify my own struggles getting a job,t3_i5b9o9,8
1596802937.0,2020-08-07,wallstreetbets,g0o4fhw,Had a price target of 30-40 for $RKT. But it looks like RH is buying all of it. New PT 50-60.,t3_i5b9o9,10
1596803571.0,2020-08-07,wallstreetbets,g0o5qdx,oh my god my puts,t3_i5b9o9,8
1596803666.0,2020-08-07,wallstreetbets,g0o5xbc,IMAGINE BEING A BEAR IN 2020,t3_i5b9o9,9
1596804041.0,2020-08-07,wallstreetbets,g0o6pk9,Better than expected job reports = Pelosi cocking Trump = no stimulus = bulls fucked,t3_i5b9o9,9
1596804206.0,2020-08-07,wallstreetbets,g0o71wr,[deleted],t3_i5b9o9,10
1596804606.0,2020-08-07,wallstreetbets,g0o7wpo,Odds of getting Stim this week dropped significantly.,t3_i5b9o9,9
1596804618.0,2020-08-07,wallstreetbets,g0o7xml,I need amzn 3300 today or my wife will leave me,t3_i5b9o9,9
1596804691.0,2020-08-07,wallstreetbets,g0o83g8,"I said it before and I will say it again. The key to FOMO is to do it immediately, if you wait it's already too late",t3_i5b9o9,9
1596804802.0,2020-08-07,wallstreetbets,g0o8c3t,Bulls stopped celebrating?,t3_i5b9o9,8
1596805046.0,2020-08-07,wallstreetbets,g0o8vfr,THE BILL SHALL NOT PASS,t3_i5b9o9,8
1596805668.0,2020-08-07,wallstreetbets,g0oa7ep,CNBC: Futures no longer shaky as the future becomes the past,t3_i5b9o9,9
1596805811.0,2020-08-07,wallstreetbets,g0oaik4,"I sold RKT at 19.6. I am a dumbass

AMA.",t3_i5b9o9,9
1596806063.0,2020-08-07,wallstreetbets,g0ob2hj,Let’s go to $328 so I can nut,t3_i5b9o9,8
1596806109.0,2020-08-07,wallstreetbets,g0ob630,I just refinanced my house yesterday with RKT,t3_i5b9o9,10
1596806388.0,2020-08-07,wallstreetbets,g0obspw,today feels sketchy,t3_i5b9o9,9
1596806436.0,2020-08-07,wallstreetbets,g0obwru,If China and US economy decouple oh boy March will look like child’s play,t3_i5b9o9,10
1596806437.0,2020-08-07,wallstreetbets,g0obwvt,Here's my Honest take of what will happen today.  I have no ideas.,t3_i5b9o9,9
1596806673.0,2020-08-07,wallstreetbets,g0ocfea,"For those that weren’t around during the China trade war, I have a feeling y’all are gonna get a little taste of what that bullshit was like. One tweet from Trump directed towards China would immediately tank the market. This TikTok shit is just the beginning.",t3_i5b9o9,8
1596807447.0,2020-08-07,wallstreetbets,g0oe3t1,let's go PRPL,t3_i5b9o9,10
1596807505.0,2020-08-07,wallstreetbets,g0oe8es,Buy that Silver dip,t3_i5b9o9,9
1596807884.0,2020-08-07,wallstreetbets,g0of3wm,Buy the AAPL dip you morons,t3_i5b9o9,8
1596807888.0,2020-08-07,wallstreetbets,g0of4b6,What happened to that dude that blew his college tuition on a yolo??,t3_i5b9o9,9
1596808329.0,2020-08-07,wallstreetbets,g0og5rx,lmao @ whoever bought silver yesterday & saw futures up 5% before going to bed,t3_i5b9o9,9
1596808475.0,2020-08-07,wallstreetbets,g0ogh03,"Lessons learned from this week...

Take 👏 the 👏 FUCKING 👏 profits.",t3_i5b9o9,10
1596808741.0,2020-08-07,wallstreetbets,g0oh2k9,"Fucking got margin called for 500k this morning. FML. Forced to buy 380k worth of apples shares. This bitch better not fucking tank. I’m bearish as fuck and just forced to take a long position. Can close it out, but feel like I need to recoup a bit off the trade. 460 eod pls",t3_i5b9o9,9
1596808758.0,2020-08-07,wallstreetbets,g0oh3xh,My silver brothers.  Hold or buy more.  Those are the only choices.,t3_i5b9o9,10
1596808862.0,2020-08-07,wallstreetbets,g0ohc70,I’d like to return these puts for store credit. I still have the receipt :(,t3_i5b9o9,9
1596809344.0,2020-08-07,wallstreetbets,g0oifwa,This dip in metals is super healthy,t3_i5b9o9,8
1596810717.0,2020-08-07,wallstreetbets,g0olizi,"Let the metal noobs cry and sell, stop talking about metal, and those that remain will be rewarded.  This is my last metal mention.",t3_i5b9o9,8
1596810724.0,2020-08-07,wallstreetbets,g0oljh2,If you didn’t buy this SLV dip you are missing out,t3_i5b9o9,8
1596811029.0,2020-08-07,wallstreetbets,g0om8a9,"Wow, the market dipped to red an hour after opening and is rebounding back to green? I can't believe it. It's not like it does this every single fucking day.",t3_i5b9o9,8
1596812026.0,2020-08-07,wallstreetbets,g0oolrq,Imagine not buying the SLV dip,t3_i5b9o9,9
1596812066.0,2020-08-07,wallstreetbets,g0oopsm,SLV Gang rise up,t3_i5b9o9,8
1596812093.0,2020-08-07,wallstreetbets,g0oosaq,BREAKING: BEARS FELL FOR IT AGAIN,t3_i5b9o9,9
1596812411.0,2020-08-07,wallstreetbets,g0opl90,Chances of SLV reaching 30 eom?,t3_i5b9o9,9
1596812671.0,2020-08-07,wallstreetbets,g0oq8fd,🚨FACEBOOK TURBULENCE HOLD ON🚨,t3_i5b9o9,10
1596812812.0,2020-08-07,wallstreetbets,g0oqkot,"When GLD and SLV goes down, I buy more GLD and SLV",t3_i5b9o9,9
1596813152.0,2020-08-07,wallstreetbets,g0orcgg,Can we ban people for spamming shit like “why is _____ tanking????!” When said stock is down 50 cents,t3_i5b9o9,9
1596813187.0,2020-08-07,wallstreetbets,g0orf4y,"VIX is down on a day where it should be higher with more geopolitical tensions and stimulus bill delays. It seems there is little to fear anymore, no more volatility boys, stonks only go up.",t3_i5b9o9,8
1596813497.0,2020-08-07,wallstreetbets,g0os45i,"welp 



looks like i will literally need that stimulus after atvi is done with me



hurry up congress for all of our sakes please jfc",t3_i5b9o9,9
1596813657.0,2020-08-07,wallstreetbets,g0osgc6,Just threw my entire account into slv calls expiring next week.  Fucking gluedto my screen. I feel Like I'm on crack. Jesus,t3_i5b9o9,9
1596813951.0,2020-08-07,wallstreetbets,g0ot4gc,I swear every stock I touch turns to shit. Fucking Apple. This is what happens when I become bullish. Top is in y’all. Just lost a good 2K that fast. Fucking stupid shit.,t3_i5b9o9,8
1596814654.0,2020-08-07,wallstreetbets,g0ouqji,Yo FB better go back to at least 275. I’m mad 😡,t3_i5b9o9,9
1596814792.0,2020-08-07,wallstreetbets,g0ov2cw,Love it when you watch a position for hours or days then sell it and it goes up $3000 about twenty five seconds later.,t3_i5b9o9,9
1596815138.0,2020-08-07,wallstreetbets,g0ovvbg,"Lean Hogs up 2.47% today. Best time to buy was a week ago, next best time is now.",t3_i5b9o9,9
1596815696.0,2020-08-07,wallstreetbets,g0ox692,Shoulda picked the username Bought_At_Top,t3_i5b9o9,10
1596815727.0,2020-08-07,wallstreetbets,g0ox902,Guys I might have a gambling problem,t3_i5b9o9,10
1596815891.0,2020-08-07,wallstreetbets,g0oxmpy,"2% chance pelosi causes a rally

98% chance pelosi crashes the market",t3_i5b9o9,10
1596816086.0,2020-08-07,wallstreetbets,g0oy2pv,Lost 3k in the last hour. Wtf,t3_i5b9o9,8
1596816274.0,2020-08-07,wallstreetbets,g0oyijn,"If re-opening will push the market to ATH, we should shut down and reopen more often",t3_i5b9o9,7
1596816332.0,2020-08-07,wallstreetbets,g0oynbm,"Jacked to the tits with OTM puts and calls all over the map, 🤞 for a crazy weekend",t3_i5b9o9,9
1596816966.0,2020-08-07,wallstreetbets,g0p00y1,Why does Boeing have to crash a plane every time they’re recovering,t3_i5b9o9,8
1596816974.0,2020-08-07,wallstreetbets,g0p01lf,Traditional Aug 2020 safe havens like RKT up 14.6%,t3_i5b9o9,9
1596817124.0,2020-08-07,wallstreetbets,g0p0ddv,AAPL 455c 0DTE is the most comfortable decision I've ever made.,t3_i5b9o9,10
1596817158.0,2020-08-07,wallstreetbets,g0p0g0u,"Come on, do that V shape recovery thing that always happens when I have puts.",t3_i5b9o9,9
1596817435.0,2020-08-07,wallstreetbets,g0p11vv,Goddamn. They're throwing A Trillion around like quarters. Well let me borrow some too.  🤗🤗,t3_i5b9o9,9
1596817467.0,2020-08-07,wallstreetbets,g0p14jq,"All this speech is literally useless, they should just come out right off the top, ""we're not in an agreement so no stimulus today, thanks have a good weekend.""",t3_i5b9o9,8
1596817506.0,2020-08-07,wallstreetbets,g0p17ei,Can these bitch ass niggas stop playing games and hand out some of dem freedom units?,t3_i5b9o9,10
1596817586.0,2020-08-07,wallstreetbets,g0p1d84,"Dollar 📉

SLV 📈",t3_i5b9o9,8
1596817663.0,2020-08-07,wallstreetbets,g0p1it8,Schumer wants to fuck Nancy so bad,t3_i5b9o9,9
1596817863.0,2020-08-07,wallstreetbets,g0p1xlo,"All this pelosi simping, go back to being jpow simps you fickle scum",t3_i5b9o9,10
1596818142.0,2020-08-07,wallstreetbets,g0p2ijq,"""his positions are quite hardened"" - Schumer

hold your calls",t3_i5b9o9,10
1596818159.0,2020-08-07,wallstreetbets,g0p2jss,no stimulus is priced in at spy almost ath interesting,t3_i5b9o9,9
1596818205.0,2020-08-07,wallstreetbets,g0p2n7r,I like when I'm reading the comments in this thread and I see a new comment someone made and it was clearly meant to be a reply to another comment then I keep scrolling down to see if I can guess which comment it was meant to be the reply to.   It's amazing I still have a steady job when this is my day.,t3_i5b9o9,9
1596818255.0,2020-08-07,wallstreetbets,g0p2qun,SLV gonna PM pump...r-right?,t3_i5b9o9,9
1596818356.0,2020-08-07,wallstreetbets,g0p2yfw,"Puts here seem too logical. 

And that’s why I’ll be going all in on calls.",t3_i5b9o9,9
1596818408.0,2020-08-07,wallstreetbets,g0p32a9,All y'all talking about banging Pelosi yet you know her labia sagging lower than your nut sack,t3_i5b9o9,8
1596818524.0,2020-08-07,wallstreetbets,g0p3b3m,My strategy: Ignore OSTK everyday and watch everyone else get rich.,t3_i5b9o9,9
1596818558.0,2020-08-07,wallstreetbets,g0p3dsd,Sold FB calls for $200 gain right before they went up another $1000 in 3 minutes. I hate myself,t3_i5b9o9,9
1596818688.0,2020-08-07,wallstreetbets,g0p3npi,"imagine betting against this

https://vvazw1o18pf4bhdd434btzh7-wpengine.netdna-ssl.com/wp-content/uploads/2020/07/Mark-Zuckerberg-Spooks-the-Internet-With-Too-Much-Sunscreen-on-His-Face-in-Hawaii-01-1-980x653.jpg",t3_i5b9o9,8
1596818858.0,2020-08-07,wallstreetbets,g0p40qi,"So, Nancy spoke today about why we weren’t able to reach a deal. What happens now? One month recess?",t3_i5b9o9,9
1596818876.0,2020-08-07,wallstreetbets,g0p423m,Bought the slv dip,t3_i5b9o9,10
1596819510.0,2020-08-07,wallstreetbets,g0p5dee,Wow my portfolio red AF,t3_i5b9o9,9
1596819660.0,2020-08-07,wallstreetbets,g0p5pgo,"Looking at individual tickers SPY should be like -1.5% rn but its barely red lol

&#x200B;

Super legally cooool",t3_i5b9o9,10
1596819707.0,2020-08-07,wallstreetbets,g0p5t8c,i was up 2k yesterday. now im -2.5k :),t3_i5b9o9,9
1596819770.0,2020-08-07,wallstreetbets,g0p5y6w,PSA - THE CHAMPIONS LEAGUE IS NOT ON TNT IT'S ON CBS ALL ACCESS OR UNIVISION,t3_i5b9o9,8
1596820521.0,2020-08-07,wallstreetbets,g0p7lij,[deleted],t3_i5b9o9,9
1596820618.0,2020-08-07,wallstreetbets,g0p7svz,I want to thank the Dems and Reps for tanking the market allowing the cash gang to buy massive dips,t3_i5b9o9,8
1596820810.0,2020-08-07,wallstreetbets,g0p878k,Bought the dip bout 20% ago 🤡,t3_i5b9o9,10
1596822546.0,2020-08-07,wallstreetbets,g0pbyzt,today looking like an actual attack on wsb,t3_i5b9o9,9
1596822572.0,2020-08-07,wallstreetbets,g0pc141,**I LOVE FOMOING INTO TECH. WORKS OUT EVERY TIME!!!**,t3_i5b9o9,9
1596822869.0,2020-08-07,wallstreetbets,g0pcpgb,"Buy puts at the bottom, buy calls at the top.",t3_i5b9o9,9
1596822889.0,2020-08-07,wallstreetbets,g0pcr64,"Let's pretend the bottom is in.

Everything is fine.",t3_i5b9o9,9
1596822893.0,2020-08-07,wallstreetbets,g0pcrhg,SLV TAKE MY ENERGY,t3_i5b9o9,8
1596822962.0,2020-08-07,wallstreetbets,g0pcx7h,I will never financially recover from this,t3_i5b9o9,9
1596823167.0,2020-08-07,wallstreetbets,g0pddxn,[deleted],t3_i5b9o9,8
1596823330.0,2020-08-07,wallstreetbets,g0pdqox,My FACE ID doesn’t recognize me anymore since I’ve been crying since market opened 😭,t3_i5b9o9,8
1596823645.0,2020-08-07,wallstreetbets,g0peepe,-70% return on spy calls 🤡,t3_i5b9o9,10
1596824246.0,2020-08-07,wallstreetbets,g0pfnty,lmao this thread is great today,t3_i5b9o9,10
1596824588.0,2020-08-07,wallstreetbets,g0pgdiq,Absolutely getting rekt.  Lost 20% of my value today,t3_i5b9o9,10
1596824617.0,2020-08-07,wallstreetbets,g0pgfo3,"Sweet, -$24K today. Instead of buying the dip, I should have bought a Honda civic.",t3_i5b9o9,8
1596825131.0,2020-08-07,wallstreetbets,g0phjjf,"Losing $100 playing options is no biggie 
Losing $100 trading stocks is a fucking tragedy 
bought RKT at the top and stuck with it because I reached my day trade limit",t3_i5b9o9,10
1596825936.0,2020-08-07,wallstreetbets,g0pj8l1,"He sold?

PAMP EET",t3_i5b9o9,8
1596826230.0,2020-08-07,wallstreetbets,g0pjunj,this market is absolutely retarded. who on earth is buying this bullshit,t3_i5b9o9,7
1596826463.0,2020-08-07,wallstreetbets,g0pkbv7,Is Monday being red even legal? Should I buy calls?,t3_i5b9o9,9
1596826559.0,2020-08-07,wallstreetbets,g0pkiyz,Remember back in March when we hit a limit down in futures and then at 9 AM JPow announced that the money printer goes BRRRRRR and we opened green? Wild times,t3_i5b9o9,9
1596826802.0,2020-08-07,wallstreetbets,g0pl1p4,Pump this shit,t3_i5b9o9,10
1596827069.0,2020-08-07,wallstreetbets,g0plltu,Autist Update: Was down $24K now down $20K. Upgrading from gruel to ramen this weekend.,t3_i5b9o9,10
1596827149.0,2020-08-07,wallstreetbets,g0plrqk,You are all a bunch of fucking dicks!!! I’m pretty sure if we met in real life we would be best friends.,t3_i5b9o9,10
1596827205.0,2020-08-07,wallstreetbets,g0plvtv,Terrible week,t3_i5b9o9,9
1596827319.0,2020-08-07,wallstreetbets,g0pm4b8,I gotta admit that SLV has been legit,t3_i5b9o9,8
1596827666.0,2020-08-07,wallstreetbets,g0pmv7c,TULIP PRICES ONLY GO UP,t3_i5b9o9,9
1596827955.0,2020-08-07,wallstreetbets,g0pnhfg,RH fucked for anyone else ?,t3_i5b9o9,8
1596828190.0,2020-08-07,wallstreetbets,g0pnzgu,Robinhands feature enabled,t3_i5b9o9,9
1596828317.0,2020-08-07,wallstreetbets,g0po908,WTF anybody getting an error message trying to cancel their trade on RH? BITCHH,t3_i5b9o9,10
1596828321.0,2020-08-07,wallstreetbets,g0po9ce,Cash gang so I'm losing money regardless thank you USD,t3_i5b9o9,9
1596801194.0,2020-08-07,wallstreetbets,g0o0ycy,[deleted],t1_g0o0qn2,51
1596796748.0,2020-08-07,wallstreetbets,g0nuceq,Just block her,t1_g0nu9k6,31
1596796812.0,2020-08-07,wallstreetbets,g0nuet1,Don't pick up,t1_g0nu9k6,15
1596797678.0,2020-08-07,wallstreetbets,g0nvby6,Although I feel far less sick watching sport,t1_g0num6u,39
1596805449.0,2020-08-07,wallstreetbets,g0o9qmj,Sorry about your loss. Your uncle sounded like a rad guy and he is right you are retarded.,t1_g0o9ehr,69
1596805370.0,2020-08-07,wallstreetbets,g0o9klh,Sorry for your loss but more sorry for my losses because I’ve been a bear for months,t1_g0o9ehr,12
1596796544.0,2020-08-07,wallstreetbets,g0nu4uv,"They'll just shift to Only Fans.

Actually, is that publicly traded?",t1_g0nu1ao,53
1596831980.0,2020-08-07,wallstreetbets,g0pvvxf,"Can somebody flair this dude ""WSB Mental Health Coach"" already?",t1_g0pvofm,13
1596796315.0,2020-08-07,wallstreetbets,g0ntwof,Gotta shake them paper hands not worthy of tendies.,t1_g0ntrs6,12
1596798498.0,2020-08-07,wallstreetbets,g0nwdps,Good bot,t1_g0nw5rz,28
1596805880.0,2020-08-07,wallstreetbets,g0oao30,Maybe. But i think its just that they all fucking suck,t1_g0oafhg,11
1596805909.0,2020-08-07,wallstreetbets,g0oaq8o,friendies.,t1_g0oanlf,21
1596800366.0,2020-08-07,wallstreetbets,g0nzj09,[deleted],t1_g0nzf7j,32
1596823021.0,2020-08-07,wallstreetbets,g0pd20f,[deleted],t1_g0pczfg,13
1596797215.0,2020-08-07,wallstreetbets,g0nuu5e,Because Robinhood is changing the way you invest 🙃,t1_g0nupm6,12
1596800831.0,2020-08-07,wallstreetbets,g0o0bl5,"Too many steps, just photoshop shitty trucks and claim to have a multi billion dollar company",t1_g0o03cc,15
1596819852.0,2020-08-07,wallstreetbets,g0p64k5,still up 5 hundo nibba,t1_g0p61ba,11
1596801202.0,2020-08-07,wallstreetbets,g0o0yx4,Should I throw 10k into silver and set my take profit at $40 then log out of my app and never look at it again?,t1_g0o0r3m,9
1596826812.0,2020-08-07,wallstreetbets,g0pl2ff,[deleted],t1_g0pkv1k,11
1596796683.0,2020-08-07,wallstreetbets,g0nua1p,30%,t1_g0nu8j4,10
1596807936.0,2020-08-07,wallstreetbets,g0of8c7,Honestly a better ROI than getting a liberal arts degree these days.,t1_g0of4b6,11
1596796708.0,2020-08-07,wallstreetbets,g0nuaz8,that company doesnt even have an app and is investigated for tax fraud,t1_g0nu4uv,14
