created,date,subreddit,id,body,parent_id,score
1589973329.0,2020-05-20,wallstreetbets,fr8ag3u,[deleted],t3_gn8r9k,187
1589972037.0,2020-05-20,wallstreetbets,fr8937x,"I wish I knew how to stop being a bear, lol. The bear thesis just makes so much more SENSE, though. 

Tik Tok is worth more than IBM... 1 out of every 2 dollars the US govt spends is borrowed... we fucking **drilled** into close yesterday...

Yet here we are, +1.2% premarket, back at $295.50. 

Being a bear sucks, but I can’t rationally justify being a bull.",t3_gn8r9k,157
1589972936.0,2020-05-20,wallstreetbets,fr8a0yb,[deleted],t3_gn8r9k,67
1589971030.0,2020-05-20,wallstreetbets,fr881yc,I’ll give it until 1030 before the mob starts calling for the geckos head,t3_gn8r9k,91
1589973730.0,2020-05-20,wallstreetbets,fr8avtf,If we go red and the gecko calls the fake out green to red I will name my firstborn Gordon,t3_gn8r9k,92
1589971069.0,2020-05-20,wallstreetbets,fr883h8,Didn't sell my 300 calls at close because I anticipated just this fuckery 🤙,t3_gn8r9k,36
1589976757.0,2020-05-20,wallstreetbets,fr8ehaw,A friend just called me and told me he bought a penny stock he saw on stocktwits. Shit just got halted. I am no longer the retard of the day and the day didn’t even start yet.,t3_gn8r9k,39
1589970447.0,2020-05-20,wallstreetbets,fr87g6u,Upwards rug pull today,t3_gn8r9k,39
1589972211.0,2020-05-20,wallstreetbets,fr899lo,"For all our new members, SPY Jan 2021 $25p are only $.05

It’s literally free money  ;\^)",t3_gn8r9k,35
1589973944.0,2020-05-20,wallstreetbets,fr8b4ca,If you were ever curious just how retarded people are here just look at the retards still fucking with LK. Unbelievable.,t3_gn8r9k,37
1589969613.0,2020-05-20,wallstreetbets,fr86m1b,Really surprised the dildo is this green today,t3_gn8r9k,31
1589974308.0,2020-05-20,wallstreetbets,fr8bivp,_The amount of LK mentioned in the comment section divided by the total comments on the thread is equal to the retardation of a sub in percent._ – John Nash (1967),t3_gn8r9k,33
1589976063.0,2020-05-20,wallstreetbets,fr8dlns,Shoutout to all my autists still holding fb calls,t3_gn8r9k,32
1589978940.0,2020-05-20,wallstreetbets,fr8hhd8,"Mark -"" At any given time how much money is being bet because of a gecko, or lil yahty albums ?"" 

WSB Autist - ""....A billion dollars.""",t3_gn8r9k,33
1589981058.0,2020-05-20,wallstreetbets,fr8kriz,I’m holding HUYA until after earnings. My father raised a fag but he didn’t raise a bitch,t3_gn8r9k,33
1589981094.0,2020-05-20,wallstreetbets,fr8ktpe,"Bullish AF: 

# U.K. sells first government bond with a negative interest rate",t3_gn8r9k,31
1589983666.0,2020-05-20,wallstreetbets,fr8p7be,"FB all time high.

I guess people are sitting at home masturbating to pictures of their old high school crushes or something.

Only so much pornhub you can watch right.",t3_gn8r9k,31
1589972320.0,2020-05-20,wallstreetbets,fr89drr,[deleted],t3_gn8r9k,54
1589970758.0,2020-05-20,wallstreetbets,fr87rsp,"Ok, selling my SPY calls eod for puts were not the way to go lol:",t3_gn8r9k,29
1589971719.0,2020-05-20,wallstreetbets,fr88rex,This market is a complex house of cards constructed by an old man with Aspergers and an unusually large penis.,t3_gn8r9k,27
1589974200.0,2020-05-20,wallstreetbets,fr8begd,"Step 1 of the prophecy looks to be shaping. Gordon claims bull trap today and we are looking like we open green. If we end the day red, I think we found our new financial advisor.",t3_gn8r9k,26
1589979603.0,2020-05-20,wallstreetbets,fr8ihd2,"became a bull a week ago and saw some good profits, went from -80% to -60% all time since last friday. Decided to buy some puts yesterday, huge fucking mistake.",t3_gn8r9k,25
1589980180.0,2020-05-20,wallstreetbets,fr8jd5e,"Reuters 14 hours ago ""wall street drops as investors lose confidence""",t3_gn8r9k,26
1589969709.0,2020-05-20,wallstreetbets,fr86ph3,Is this the twilight zone.? All prices restored back to pre drop lol,t3_gn8r9k,25
1589971632.0,2020-05-20,wallstreetbets,fr88o6s,"bruh every morning i think ""ahh too late now to hop on NVDA"" and then she does another 5%",t3_gn8r9k,24
1589978701.0,2020-05-20,wallstreetbets,fr8h4tj,"“We have a vaccine”

*DOW rises 1000 points

“Oh wait no we don’t”

*Market says fuck that, goes up anyway",t3_gn8r9k,44
1589972719.0,2020-05-20,wallstreetbets,fr89spj,[deleted],t3_gn8r9k,21
1589978028.0,2020-05-20,wallstreetbets,fr8g6i5,WTF is up with these LK kids. Get out nobody wants your fucking shit coffee.,t3_gn8r9k,21
1589972537.0,2020-05-20,wallstreetbets,fr89lyu,"Economic Terrorism because the disconnection between Wall Street & reality was magnified like never before & now everyone has to make a choice:

Continue ignoring logic 🙈

🚷®️

Realize we went broke as a result of 🦇🍲 & likely will never financially reeeecover",t3_gn8r9k,21
1589973311.0,2020-05-20,wallstreetbets,fr8afed,"We usually talk about risk in here.  The risk of buying FDs.  But the risk of LK is somethin else.

Actually wait no its on par with FDs.  They both have a very high chance of being worth 0.",t3_gn8r9k,19
1589975934.0,2020-05-20,wallstreetbets,fr8dfwz,"ZUCK making Etsy look directly into his lifeless robot eyes, sweat glistening on the 8th floor of his forehead while he squeezes out a huge pile onto its chest.",t3_gn8r9k,22
1589973550.0,2020-05-20,wallstreetbets,fr8aosf,[deleted],t3_gn8r9k,87
1589973967.0,2020-05-20,wallstreetbets,fr8b57g,FB isn't going to stop,t3_gn8r9k,19
1589976247.0,2020-05-20,wallstreetbets,fr8dtvq,FB $223 holy smokes.. FB Stores is a pretty great idea for small biz operators. Easier than SHOP but they just have to get pass the fact they are working with the devil,t3_gn8r9k,18
1589980279.0,2020-05-20,wallstreetbets,fr8jirj,I spend my days on Wall Street bets now instead of Instagram,t3_gn8r9k,43
1590005309.0,2020-05-20,wallstreetbets,fr9xltt,Saw “Disney getting obliterated AH” and went to check the chart... down 0.5% after a +5% day. Fuck off melodramatic cucks,t3_gn8r9k,19
1589973446.0,2020-05-20,wallstreetbets,fr8akr3,"Imagine if you had sold your LOW calls at a loss on Monday 


Imagine being me.",t3_gn8r9k,17
1589980626.0,2020-05-20,wallstreetbets,fr8k2cs,In 14 minutes the market will open and yesterday’s 25% gain on my spy puts premiums will disappear into thin air.,t3_gn8r9k,17
1589985125.0,2020-05-20,wallstreetbets,fr8ru7m,"Imagine being an equity research analyst at a major investment bank, working 80 hours a week for years learning about fundamentals, how to methodically dissect financial statements, interpret guidance on earnings calls - only to have the stock market spit in your face during a global depression because nothing that you learned matters.",t3_gn8r9k,17
1589969709.0,2020-05-20,wallstreetbets,fr86phm,"Lowe's killed earnings!

https://finance.yahoo.com/news/lowes-reports-first-quarter-2020-100000606.html",t3_gn8r9k,34
1589980101.0,2020-05-20,wallstreetbets,fr8j8t1,Summary of this market: lots of downward potential and very little upward potential.,t3_gn8r9k,16
1589991070.0,2020-05-20,wallstreetbets,fr93kg6,"HOLY SHIT WE'RE DUMPING TO +1.70% from 1.80%

CIRCUIT BREAKER INCOMING",t3_gn8r9k,16
1589978926.0,2020-05-20,wallstreetbets,fr8hgn9,"So funny the divergence between futures and the cash market, cash market sells off on high and increasing volume and ZERO momentum carries on into futures at all. I mean there was barely even a single test of further downside, entire futures session was near pure bidding.

I'm surprised whoever keeps bidding futures up isn't doing a better job though - if you want a big run you have to get SPX above that 2960 level so that all the shorts get stopped out and there is a run to 3000+ in the cash market.",t3_gn8r9k,14
1589979444.0,2020-05-20,wallstreetbets,fr8i8ni,If Ford hits 5.5 today I'll call my mom a hoe,t3_gn8r9k,15
1589995515.0,2020-05-20,wallstreetbets,fr9cxwn,If SPY somehow finishes red I’ll buy the fucking lizard whatever he wants,t3_gn8r9k,15
1589999965.0,2020-05-20,wallstreetbets,fr9m8vk,[deleted],t3_gn8r9k,15
1589981277.0,2020-05-20,wallstreetbets,fr8l4bl,"Steve Mnuchin is the ugliest man in the Trump administration. 

He looks like 160 pounds of discarded foreskins, held together by elastic bands.",t3_gn8r9k,55
1589978829.0,2020-05-20,wallstreetbets,fr8hbg8,The magic lizard 🦎 demands blood 🩸 sacrifices,t3_gn8r9k,14
1589970373.0,2020-05-20,wallstreetbets,fr87djy,LOW's doing better than HD was more or less expected. Better ran company that caters to the everyday customer than contractors.,t3_gn8r9k,31
1589974039.0,2020-05-20,wallstreetbets,fr8b813,Holy shit that ~~dump~~ ~~pump~~ ~~dump~~ pump!,t3_gn8r9k,14
1589979693.0,2020-05-20,wallstreetbets,fr8imci,I've said it before. This sub feels like fucking groundhog day.,t3_gn8r9k,14
1589981987.0,2020-05-20,wallstreetbets,fr8maak,"Took the 300% profit on FB calls and left - I know I'll regret it, but I am training myself to not be greedy.",t3_gn8r9k,12
1589984909.0,2020-05-20,wallstreetbets,fr8rfxl,"Apparently ""be fearful when others are greedy"" should be updated to ""be greedy when others are greedy because stonks only go up""",t3_gn8r9k,14
1589985215.0,2020-05-20,wallstreetbets,fr8s04m,"Happens to the best of us LOL

&#x200B;

[https://thestonkmarket.com/florida-man-goes-bankrupt-shorting-tesla-fills-car-with-human-poop-and-throws-feces-at-pedestrians/](https://thestonkmarket.com/florida-man-goes-bankrupt-shorting-tesla-fills-car-with-human-poop-and-throws-feces-at-pedestrians/)",t3_gn8r9k,12
1589991098.0,2020-05-20,wallstreetbets,fr93mk7,"Me: ""HUUUUUUUUUUYAAAAAA!!""

My neighbors: ""God damnit, that retard kid stuck his dick in the vacuum again....""",t3_gn8r9k,12
1589997829.0,2020-05-20,wallstreetbets,fr9hsbv,"$HUYA CEO is named Rong Dong, that’s all the DD I need",t3_gn8r9k,13
1590005986.0,2020-05-20,wallstreetbets,fr9z2h0,"If you own DIS or have calls something to look at:

1.	Apparently Disney is NOT proposing opening plans tomorrow (oops)
2.	universal Studios IS proposing opening plans which should be a boost to Disney
3.	NBA/Disney possibly working together to host season

No idea what happens tomorrow but good luck guys",t3_gn8r9k,13
1589976041.0,2020-05-20,wallstreetbets,fr8dkpc,FB approaching ATH premarket. If it breaks 224.20 there's no ceiling,t3_gn8r9k,12
1589980649.0,2020-05-20,wallstreetbets,fr8k3p1,Meg Tirrell i really need you to sit on my face!!,t3_gn8r9k,13
1589984914.0,2020-05-20,wallstreetbets,fr8rg8s,All this euphoria can’t possibly end well.,t3_gn8r9k,13
1589985501.0,2020-05-20,wallstreetbets,fr8sjbn,"I'm sorry, but this is just fucking ridiculous",t3_gn8r9k,12
1589987347.0,2020-05-20,wallstreetbets,fr8w2gp,"i thought it was ""buy the hype, sell the news""  
but it's actually ""buy the hype and buy the news because fuck you that's why""",t3_gn8r9k,12
1589990067.0,2020-05-20,wallstreetbets,fr91ijj,"""the most hated rally in stock market history""  


ain't that the truth. fuck the fed, forest fires are part of a healthy forest",t3_gn8r9k,11
1589998281.0,2020-05-20,wallstreetbets,fr9ipvy,"The year is 2023. ZM is once again up 5% on the day to a share price of 4750, after its 10:1 stock split earlier in the year. It has a $12.5tn market cap. Video calls permeate every facet of human kind's existence.",t3_gn8r9k,11
1590004526.0,2020-05-20,wallstreetbets,fr9vx1p,"I lost enough money to put a kid through a year of college whilst taking a shit, on a fucking app called Robinhood",t3_gn8r9k,11
1589970135.0,2020-05-20,wallstreetbets,fr874st,Plan for the day. Puts at open. Watch us gap up to 300 by 11. Cry. Complain. Buy more puts.,t3_gn8r9k,26
1589971485.0,2020-05-20,wallstreetbets,fr88is4,"So...

23.5M SPY volume traded in the 3:45 15-min candle yesterday.  From 2932 to 2916. A 16 point drop.

From 4:00 to 4:30 am today we saw a jump from 2930 to 2946.  A 16 point climb. On 17k in e-mini volume.  

Yesterday's drop in SPY shares USD volume... roughly $6.9 billion.

This morning's climb in e-minis USD volume... roughly $2.5bn over twice the time.

And that doesn't include the volume in the underlying components for the SPY, just the ETF shares that traded.",t3_gn8r9k,24
1589971826.0,2020-05-20,wallstreetbets,fr88vdb,"We have the most manipulated stock in the world market, Florida and Georgia just got ousted for lying about infections so they could open.... everyone hates bears but we are literally turning into China with this shit.",t3_gn8r9k,28
1589975184.0,2020-05-20,wallstreetbets,fr8cj5t,Can we give a big round of applause to the pajama bois who have made up most of yesterday's damage 2 hours before market open?,t3_gn8r9k,26
1589975251.0,2020-05-20,wallstreetbets,fr8clxr,[deleted],t3_gn8r9k,24
1589979783.0,2020-05-20,wallstreetbets,fr8ir92,LK getting delisted and you tards are buying LOL. You wonder why you all lose money,t3_gn8r9k,22
1589978907.0,2020-05-20,wallstreetbets,fr8hfme,I hear LK is coming out with a vaccine.,t3_gn8r9k,11
1589980322.0,2020-05-20,wallstreetbets,fr8jlaa,wrong way FB stocks only go up,t3_gn8r9k,11
1589985062.0,2020-05-20,wallstreetbets,fr8rq0q,The volume tells the story of one brave little robot with deep pockets determined to single-handedly drag SPY to 300 today.,t3_gn8r9k,11
1589985365.0,2020-05-20,wallstreetbets,fr8sa3l,I actually feel more comfortable about puts when we have huge green days. Means bulls are blowing their entire load and we can sneak up on them during their post ejaculatory nap.,t3_gn8r9k,12
1589987352.0,2020-05-20,wallstreetbets,fr8w2sz,I can't imagine anyone has actual faith in this rally. As soon as someone makes the first big move to pull out it's going to cascade.,t3_gn8r9k,12
1589988294.0,2020-05-20,wallstreetbets,fr8xxid,People waiting for the Rug Pull are like the jews wandering through the desert for 40 years. One day it will come but only your descendants will be alive to see it,t3_gn8r9k,12
1589990277.0,2020-05-20,wallstreetbets,fr91y3r,"Remember, it’s highly unlikely you will time the top perfectly. Don’t beat yourself up, gains are gains. 

Me to myself after selling my FB calls at open....",t3_gn8r9k,11
1589992150.0,2020-05-20,wallstreetbets,fr95suh,[deleted],t3_gn8r9k,10
1589994120.0,2020-05-20,wallstreetbets,fr99zlu,"Y’all are actually retarded if you’re buying the dip on those Chinese companies. 

The gauchos on you guys.",t3_gn8r9k,12
1589994794.0,2020-05-20,wallstreetbets,fr9begv,No one knows what’s happening but we fucking gambling baby 👶,t3_gn8r9k,11
1589998399.0,2020-05-20,wallstreetbets,fr9iyo8,the fuck are you retards talking about dump? this shit is completely flat. GTFO,t3_gn8r9k,11
1589998673.0,2020-05-20,wallstreetbets,fr9jjea,"🐻 gang? Nah

🐂 gang? Nah

🦎 gang",t3_gn8r9k,11
1590001581.0,2020-05-20,wallstreetbets,fr9plou,Y’all remember the days where SPY would lose $4 in one single 5 min candle? Then jump up 3 in the next and down another 4 the one after? Fuck I miss March,t3_gn8r9k,10
1590001671.0,2020-05-20,wallstreetbets,fr9psa1,"FYI, DIS is going to have a fucking reopening date tomorrow.",t3_gn8r9k,11
1590004336.0,2020-05-20,wallstreetbets,fr9vhya,the FED took the greatest equity market in the world and turned it into a casino,t3_gn8r9k,11
1589980838.0,2020-05-20,wallstreetbets,fr8kemi,[deleted],t3_gn8r9k,33
1589978319.0,2020-05-20,wallstreetbets,fr8gl5b,Upvote for ZM to die today,t3_gn8r9k,20
1589977529.0,2020-05-20,wallstreetbets,fr8fic2,This FB shop news is huge. Think of the implications of harnessing literally infinite small businesses. This is a macro e-commerce move that will put tendie meat on FBs bones. Upgrades are inevitable. This one seems like a no-brainer.,t3_gn8r9k,10
1589980778.0,2020-05-20,wallstreetbets,fr8kb58,This sub is better than checking CNBC for news,t3_gn8r9k,11
1589981123.0,2020-05-20,wallstreetbets,fr8kvbo,How fast can you sell your calls 5 minutes from now? Let's find out,t3_gn8r9k,10
1589982346.0,2020-05-20,wallstreetbets,fr8mwl8,320% return on FB calls.  thanks wsb for the play!,t3_gn8r9k,10
1589986699.0,2020-05-20,wallstreetbets,fr8utnl,wsb turns really dark if the guy has to eat his gecko.,t3_gn8r9k,10
1589988027.0,2020-05-20,wallstreetbets,fr8xedj,291 to 298 in 1 overnight night session lol,t3_gn8r9k,11
1589988977.0,2020-05-20,wallstreetbets,fr8zarg,Facebook broke 230 lmao holy shit,t3_gn8r9k,10
1589990320.0,2020-05-20,wallstreetbets,fr921bp,"about to be at $20k profit on a $7,000 position. in 48 hours. LMAO TY BASED GOD",t3_gn8r9k,10
1589991337.0,2020-05-20,wallstreetbets,fr944cf,What about my search history is making Reddit send me ads for at-home cremators?,t3_gn8r9k,9
1589991676.0,2020-05-20,wallstreetbets,fr94tiu,[deleted],t3_gn8r9k,10
1589994407.0,2020-05-20,wallstreetbets,fr9akv8,[deleted],t3_gn8r9k,9
1589995531.0,2020-05-20,wallstreetbets,fr9cz4w,"CNBC: NYC sees 'striking' decline in vaccinations.

*Karen has entered the chat*",t3_gn8r9k,9
1589997403.0,2020-05-20,wallstreetbets,fr9gww2,Bond market calls bullshit on this rally.,t3_gn8r9k,10
1589998848.0,2020-05-20,wallstreetbets,fr9jwuq,"Tldr: of the Fed Minutes:

- negative rates are not on the table
- money printer will go brrrr for as long as necessary
- concerns that many small businesses will not recover

So basically nothing new",t3_gn8r9k,12
1589999264.0,2020-05-20,wallstreetbets,fr9ks7r,"https://i.imgur.com/wll8bKU.png

7.5k gain 30% of my account in one day. We rebuilding that empire one yolo at a time",t3_gn8r9k,10
1590000078.0,2020-05-20,wallstreetbets,fr9mhi0,Herd immunity is the new game in town. That’s the real goal. No amount of deaths will stand in the way of SPY 340 before November,t3_gn8r9k,10
1590000151.0,2020-05-20,wallstreetbets,fr9mmwh,Friendship ended with Gordon. Zuck is my favorite lizard now.,t3_gn8r9k,10
1590001626.0,2020-05-20,wallstreetbets,fr9pozo,Tomorrow is guaranteed green due to unemployment numbers.  Holy shit poor people really don’t matter :/,t3_gn8r9k,11
1590004875.0,2020-05-20,wallstreetbets,fr9woi4,"Everyone in here is so fucking dramatic. DIS is up 5% on the day then drops like .5% and the thread is just filled with RIP DISNEY, MOUSE IS KILL, DURRR. Y’all need to buy ADHD meds not FDs",t3_gn8r9k,10
1590005929.0,2020-05-20,wallstreetbets,fr9yy3j,my friend got laid off from a white collar job today lmao what? 😂 bro look at the stock market thats fake news businesses are doing bigly,t3_gn8r9k,10
1590012059.0,2020-05-20,wallstreetbets,fra731g,Was it even possible to lose money on stocks today,t3_gn8r9k,10
1589976999.0,2020-05-20,wallstreetbets,fr8essd,"If I could just filter out all posts with the words ""Bear"" or ""Bull"" in them, this forum might actually be readable.

A majority of you are huge fucking fags, making annoying played out posts about which gang is fucked today, and none of them age well.",t3_gn8r9k,41
1589979447.0,2020-05-20,wallstreetbets,fr8i8s3,WSB slowly getting more and more bullish. Time to inverse WSB?,t3_gn8r9k,18
1589983917.0,2020-05-20,wallstreetbets,fr8pn77,"To the guy yesterday pumping FB...Thank you. Seriously. 
I had a substantial loss and was able to make it up thanks to you. Didn’t want to have to tell the wife I lost our mortgage $$ for the next 4 years! 😂
Bought $225 calls at $0.66 each, sold $4.80",t3_gn8r9k,19
1589970484.0,2020-05-20,wallstreetbets,fr87hl0,[deleted],t3_gn8r9k,36
1589973221.0,2020-05-20,wallstreetbets,fr8abwe,Haha Lowes going up because they didn't give their employees raises,t3_gn8r9k,10
1589974527.0,2020-05-20,wallstreetbets,fr8brru,Thanks $INO open is gonna be [fun](https://imgur.com/a/7yt0bYQ),t3_gn8r9k,8
1589979599.0,2020-05-20,wallstreetbets,fr8ih5g,Sold my Lowe’s calls yesterday for spy puts at EOD. Let’s go! 😭,t3_gn8r9k,10
1589979830.0,2020-05-20,wallstreetbets,fr8itw1,"Not an American. When I first heard about $LK, I thought it was Luckin Coffin.

And I was like, WTF WSB, do you bet on people dying? That is so wrong and smart at the same time, but a really autistic play.",t3_gn8r9k,10
1589983330.0,2020-05-20,wallstreetbets,fr8om5g,"1k to 80k to 10k to 35k in 4 months

Feelsgoodman",t3_gn8r9k,9
1589983837.0,2020-05-20,wallstreetbets,fr8pi4d,"Just sold 3 shares of AMZN and robinhood is just showing the money evaporated from my account. Not in my buying power and has my daily chart dropping by ~$7,500. Sick",t3_gn8r9k,8
1589985335.0,2020-05-20,wallstreetbets,fr8s84x,"Premarket, ""Royal Caribbean swings to wider-than-expected loss, but stock surges"" - may be my all time favorite headline as to why we're living in a simulation.

So who's buying this? Jerome, was it you?",t3_gn8r9k,10
1589986627.0,2020-05-20,wallstreetbets,fr8uohu,Don't worry guys this time it's different. This time the bubble can last forever!!1,t3_gn8r9k,8
1589987451.0,2020-05-20,wallstreetbets,fr8w9oj,Lizard said red be patient bears ✊,t3_gn8r9k,8
1589987944.0,2020-05-20,wallstreetbets,fr8x8ea,"Had I done nothing, left my portfolio as it is, I would be up 60k...regret this",t3_gn8r9k,9
1589990231.0,2020-05-20,wallstreetbets,fr91usc,HUYA is absolutely ripping and we’re not even at eod pump,t3_gn8r9k,9
1589991099.0,2020-05-20,wallstreetbets,fr93mlx,The fucking gecko,t3_gn8r9k,9
1589992438.0,2020-05-20,wallstreetbets,fr96enn,Bought a $2500 amazon call. Hearts fuckin thumping,t3_gn8r9k,9
1589993866.0,2020-05-20,wallstreetbets,fr99g9b,[Who listened](https://www.reddit.com/user/AveenoFresh/comments/gkedb5/so_this_is_my_next_earning_play_dd_will_be_posted/)? Should be a 500% play by now.,t3_gn8r9k,9
1589994812.0,2020-05-20,wallstreetbets,fr9bftu,[deleted],t3_gn8r9k,10
1589994917.0,2020-05-20,wallstreetbets,fr9bny1,Watch us dump EOD and then futures pump us back up again. And then it repeats forever,t3_gn8r9k,9
1589995295.0,2020-05-20,wallstreetbets,fr9cgux,"Finally starting to understand the complaints I hear about the terrible order fills with RH.  Its like you actually bought 10% above the value of the contract each time.  I'm immediately down 10% every single time, one second after purchase.",t3_gn8r9k,9
1589996675.0,2020-05-20,wallstreetbets,fr9feis,"The boomers haven't even heard about the delisting news yet, just like they didn't learn about the fb news until last night and this morning. Give them time to get home from work and turn fox news on before you predict what chinese stocks are going to do.",t3_gn8r9k,10
1589997225.0,2020-05-20,wallstreetbets,fr9gjoj,Donating $1.50 to charity if spy closes red,t3_gn8r9k,10
1589997323.0,2020-05-20,wallstreetbets,fr9gqyw,"Come on SPY 300, you can do it!!!! 

[**New coronavirus cases across the world jump by the most ever in a single day, WHO says**](https://www.cnbc.com/2020/05/20/new-coronavirus-cases-across-the-world-jump-by-the-most-in-a-single-day-who-says.html)",t3_gn8r9k,10
1589997831.0,2020-05-20,wallstreetbets,fr9hsf9,Actually gonna buy puts in preparation for the lil yachty album,t3_gn8r9k,10
1590001207.0,2020-05-20,wallstreetbets,fr9oukq,God I sold some DIS calls last week for 3.50 and they’re worth 21.00 now,t3_gn8r9k,9
1590001918.0,2020-05-20,wallstreetbets,fr9qaeu,MESS WITH THE GECK YOU GET RECK,t3_gn8r9k,9
1590001933.0,2020-05-20,wallstreetbets,fr9qbgf,[deleted],t3_gn8r9k,10
1590002442.0,2020-05-20,wallstreetbets,fr9rdjd,Who’s holding their DIS calls??,t3_gn8r9k,8
1590005024.0,2020-05-20,wallstreetbets,fr9wzqi,[DISNEY NOT ANNOUNCING REOPENING PLANS TOMORROW](https://twitter.com/CNBCnow/status/1263198126334267392),t3_gn8r9k,9
1590005088.0,2020-05-20,wallstreetbets,fr9x4p1,"# WTF, DISNEY PULLED THEIR PLANS WTF

# 

#  https://twitter.com/CNBCnow/status/1263198126334267392?s=20",t3_gn8r9k,9
1590005229.0,2020-05-20,wallstreetbets,fr9xfdl,CNBC announces that Disney pulled it’s plans to re-open at 4:01 pm. Nothing shady about that,t3_gn8r9k,10
1590005561.0,2020-05-20,wallstreetbets,fr9y5q5,"Fuck **CNBC**, me and my homies fucking hate **CNBC** 

😤😤😤😤😤😤😤😤",t3_gn8r9k,10
1589971380.0,2020-05-20,wallstreetbets,fr88eu1,I made so many kids mad when I said yesterday was a bear trap.,t3_gn8r9k,17
1589974766.0,2020-05-20,wallstreetbets,fr8c1kq,Playing vaccine speculation is now the wild west of gambling. There is no rhyme or reason if a headline can come out that is obvious bullshit and markets may or may not run on it for +20%. Just grip and rip baby. Throw the dice on the table.,t3_gn8r9k,16
1589975602.0,2020-05-20,wallstreetbets,fr8d18y,"Given we've completely abandoned capitalism for companies we may as well not even have a stock market.

Half the autists on this sub were buying calls on BA because ""They're so fucked the government will bail them out""

How did we get to this stage?",t3_gn8r9k,16
1589984405.0,2020-05-20,wallstreetbets,fr8qivx,"[A pizzeria owner made money buying his own $24 pizzas from DoorDash for $16](https://www.theverge.com/2020/5/18/21262316/doordash-pizza-profits-venture-capital-the-margins-ranjan-roy)   


somebody get this madlad on to WSB",t3_gn8r9k,16
1589974712.0,2020-05-20,wallstreetbets,fr8bzcg,is going all in on MGM today retarded? caus ei heard they re-opening on monday,t3_gn8r9k,7
1589975671.0,2020-05-20,wallstreetbets,fr8d4a0,Can someone explain why all this buying isnt happening during trading hours? horrendous volume on the spy also.,t3_gn8r9k,7
1589975920.0,2020-05-20,wallstreetbets,fr8dfb9,#CRM LADS RISE UP,t3_gn8r9k,8
1589977309.0,2020-05-20,wallstreetbets,fr8f7ij,Need TGT to keep going,t3_gn8r9k,8
1589977579.0,2020-05-20,wallstreetbets,fr8fkv4,This sub is turning into stocktwits,t3_gn8r9k,8
1589977859.0,2020-05-20,wallstreetbets,fr8fyed,Guys im not an analyst or anything but I'm starting to think that we might open green,t3_gn8r9k,8
1589978622.0,2020-05-20,wallstreetbets,fr8h0pi,DIS calls,t3_gn8r9k,8
