created,date,subreddit,id,body,parent_id,score
1621885621.0,2021-05-24,wallstreetbets,gzb5kiz,"My SPCE put orders triggered, it's about to moon now",t3_njubrl,9
1621885634.0,2021-05-24,wallstreetbets,gzb5lii,Holy shit SPCE cadets we burning shorts with rocket fuel,t3_njubrl,11
1621885692.0,2021-05-24,wallstreetbets,gzb5q7v,After seeing GME fall from 347 to 120 in 20 minutes and from 500 to 140 in a couple hours these sorts of moves don’t even phase me anymore. Wake me when we move 500%.,t3_njubrl,10
1621886101.0,2021-05-24,wallstreetbets,gzb6n1p,SPCE is about to take off even more,t3_njubrl,11
1621886170.0,2021-05-24,wallstreetbets,gzb6sjm,Get ready for the SPCE short squeeze 💴,t3_njubrl,10
1621862266.0,2021-05-24,wallstreetbets,gz9pony,A moment of silence for all the retards about to buy the news on SPCE,t3_njubrl,28
1621858190.0,2021-05-24,wallstreetbets,gz9j3gc,My farts are so bad right now there’s no way I have to worry about bed bugs. Straight fumigation,t3_njubrl,44
1621852776.0,2021-05-24,wallstreetbets,gz9c8ve,"been peeing out my anus all day and night.  
  
how is everyone else holding up?",t3_njubrl,8
1621856752.0,2021-05-24,wallstreetbets,gz9h3e1,AYE PLTRx SPACEFORCE collab,t3_njubrl,9
1621857550.0,2021-05-24,wallstreetbets,gz9i6tq,Lamborghini or Food Stamps. LFG!,t3_njubrl,9
1621857977.0,2021-05-24,wallstreetbets,gz9isk7,SPY gotta break above 418 if bulls wanna take the lead,t3_njubrl,9
1621858561.0,2021-05-24,wallstreetbets,gz9jmrz,"Morning boys, fuck bitches get money",t3_njubrl,10
1621859089.0,2021-05-24,wallstreetbets,gz9kf4w,[deleted],t3_njubrl,8
1621859438.0,2021-05-24,wallstreetbets,gz9kxsq,[deleted],t3_njubrl,8
1621860242.0,2021-05-24,wallstreetbets,gz9m77z,Come on Ford let’s break $13.5,t3_njubrl,9
1621860555.0,2021-05-24,wallstreetbets,gz9mpke,#YOLO 0 DTE $SPY $420 Calls,t3_njubrl,10
1621860811.0,2021-05-24,wallstreetbets,gz9n541,Well futures are pointing towards inflation being fake again… wonder how long it will last this time…,t3_njubrl,8
1621860952.0,2021-05-24,wallstreetbets,gz9ndqj,You can tell who’s still new here and wasn’t fucking with spce before January,t3_njubrl,9
1621863621.0,2021-05-24,wallstreetbets,gz9s8a8,Anyone else losing their ass? Just me? Ok,t3_njubrl,6
1621863938.0,2021-05-24,wallstreetbets,gz9suy7,I canceled my 24 limit buy for SPCE.,t3_njubrl,9
1621864509.0,2021-05-24,wallstreetbets,gz9u0c1,The dude with 360k in spy puts is in absolute shambles.,t3_njubrl,9
1621864909.0,2021-05-24,wallstreetbets,gz9utpy,"Oh, hi Mark",t3_njubrl,8
1621865032.0,2021-05-24,wallstreetbets,gz9v2r8,"Remember everyone, with enough leverage and 0DTE puts you too can can turn $1000 into $10 in the blink of an eye!

It's a get poor quick scheme and everyone's invited!",t3_njubrl,9
1621865435.0,2021-05-24,wallstreetbets,gz9vw95,SPCE lifting off 🚀🚀🚀,t3_njubrl,9
1621866052.0,2021-05-24,wallstreetbets,gz9x5z0,SPCE FOMOers got hella fucked this morning!,t3_njubrl,10
1621866308.0,2021-05-24,wallstreetbets,gz9xpd8,$8k gone to spy puts.. fml,t3_njubrl,9
1621868250.0,2021-05-24,wallstreetbets,gza1sn4,"SPY, QQQ, DIA : blood green, my portfolio : red",t3_njubrl,10
1621868258.0,2021-05-24,wallstreetbets,gza1t9k,Palantears,t3_njubrl,10
1621868878.0,2021-05-24,wallstreetbets,gza3688,Open the he flood gates Ryan,t3_njubrl,9
1621869120.0,2021-05-24,wallstreetbets,gza3p9l,this volume is pathetic,t3_njubrl,9
1621869260.0,2021-05-24,wallstreetbets,gza40gk,TSLA 630 eod,t3_njubrl,9
1621870944.0,2021-05-24,wallstreetbets,gza7ncq,Spce!,t3_njubrl,9
1621870969.0,2021-05-24,wallstreetbets,gza7p8p,[deleted],t3_njubrl,9
1621872194.0,2021-05-24,wallstreetbets,gzaact0,Sell my -58% SENS bags for GME?,t3_njubrl,9
1621873299.0,2021-05-24,wallstreetbets,gzacvq2,SPCE to 40$ EOW,t3_njubrl,9
1621873318.0,2021-05-24,wallstreetbets,gzacxbc,Alright fuck it strapped into SPCE. Let’s ride. 🚀,t3_njubrl,10
1621873680.0,2021-05-24,wallstreetbets,gzadqwx,"Either things are finally starting to turn around for bulls, or this is the biggest trap of the whole month

Tune in later this week to find out!",t3_njubrl,9
1621875536.0,2021-05-24,wallstreetbets,gzai5kc,Swamp ass season is here boys,t3_njubrl,9
1621876297.0,2021-05-24,wallstreetbets,gzak3nk,VIX price too low imo,t3_njubrl,9
1621876576.0,2021-05-24,wallstreetbets,gzakq70,"Calls on calls.

Puts on puts.",t3_njubrl,9
1621877636.0,2021-05-24,wallstreetbets,gzan67n,$200 EOD. you know which one.,t3_njubrl,9
1621878150.0,2021-05-24,wallstreetbets,gzaoc4b,Whole market is bigly green and BABA is in the corner sniffing glue,t3_njubrl,9
1621879101.0,2021-05-24,wallstreetbets,gzaqhk1,I don't know what to do on green days,t3_njubrl,8
1621879182.0,2021-05-24,wallstreetbets,gzaqodf,I hate stop loss. It’s like the market hits your stop loss amd immediately reverse,t3_njubrl,9
1621880597.0,2021-05-24,wallstreetbets,gzatwo1,"I want to go to SPCE. I want to float through the air motorboating big green alien titties in zero G's while drinking a pan galactic gargleblaster in a finely appointed suite aboard an intrepid gleaming metallic space faring vessel. I want to do it while wearing a monocle and a safari hat. I want to exclaim ""crikey!"" in a faux British accent just before blasting my gargle all over the circular triple-reinforced old-timey porthole windows.",t3_njubrl,9
1621880701.0,2021-05-24,wallstreetbets,gzau5mi,What retard would buy SPY puts because they’re expecting a reversal? Couldn’t be me.,t3_njubrl,10
1621880710.0,2021-05-24,wallstreetbets,gzau6b8,"Made 7k in basically an hour this morning, yet all I can think about is the 5k that I left on the table selling my calls too early smh

Meant to set a stop loss and accidentally set a limit sell. Fucking imagine the stupidity 

Fuuuckkk",t3_njubrl,9
1621880949.0,2021-05-24,wallstreetbets,gzaur7u,TSLA forming the cock and ball torture candle,t3_njubrl,7
1621881173.0,2021-05-24,wallstreetbets,gzav9w9,I think it might be a better strategy to buy things when the market is very red and sell things when the market is very green.,t3_njubrl,9
1621881797.0,2021-05-24,wallstreetbets,gzawpje,Almost power hour bitches - all-in on $SPCE?,t3_njubrl,10
1621882366.0,2021-05-24,wallstreetbets,gzay0u4,SPCE @ $26 coming right up! When we blow through that wall its gonna jump!,t3_njubrl,10
1621883520.0,2021-05-24,wallstreetbets,gzb0ojz,I had 10 fucking Tesla $590cs that expired worthless on Friday and it does this today. Unbelievable.,t3_njubrl,9
1621883720.0,2021-05-24,wallstreetbets,gzb14tx,26 was a cake walk for spce lol,t3_njubrl,10
1621883831.0,2021-05-24,wallstreetbets,gzb1dti,I told myself I wouldn’t buy puts again...but spy puts lookin so juicy rn,t3_njubrl,9
1621883924.0,2021-05-24,wallstreetbets,gzb1lah,Recession is canceled,t3_njubrl,9
1621883936.0,2021-05-24,wallstreetbets,gzb1m94,Spce still got fuel in it?,t3_njubrl,9
1621884551.0,2021-05-24,wallstreetbets,gzb36di,I feel like the rugpull of all rugpulls is coming.,t3_njubrl,9
1621885537.0,2021-05-24,wallstreetbets,gzb5dng,"virgin galactic! SPCE 
actually rockets to space",t3_njubrl,8
1621885808.0,2021-05-24,wallstreetbets,gzb5zol,It’s gonna be green tomorrow isn’t it 🙄,t3_njubrl,8
1621885870.0,2021-05-24,wallstreetbets,gzb64jm,"This shit right here kills us  


""Social Buzz: Virgin Galactic, AMC, Roblox Rally as Wallstreetbets Stocks Gain Ground""",t3_njubrl,8
1621885954.0,2021-05-24,wallstreetbets,gzb6bet,[deleted],t3_njubrl,9
1621886495.0,2021-05-24,wallstreetbets,gzb7ifu,Sold spy puts at the tippy top,t3_njubrl,10
1621886768.0,2021-05-24,wallstreetbets,gzb84d7,"if ur a SPCE bear, just read the virgin galactic twitter page. fuck those views are spectacular. im going to see that at least once in my life and ill probably never forget it. wow",t3_njubrl,10
1621852627.0,2021-05-24,wallstreetbets,gz9c2qw,Just another SPCE man ![gif](emote|free_emotes_pack|wink)![gif](emote|free_emotes_pack|upvote),t3_njubrl,23
1621853093.0,2021-05-24,wallstreetbets,gz9clpc,My gay son and bitch wife hate me for holding growth stocks,t3_njubrl,24
1621868747.0,2021-05-24,wallstreetbets,gza2vqr,"I dislike this generation of GME retards.

In January when People said GME was mooning it was up 1500% on the day.

Now whenever it's green people here say it's mooning.

Meme stock standards have slipped.",t3_njubrl,21
1621869228.0,2021-05-24,wallstreetbets,gza3xsz,GME LETS FUCKING GO,t3_njubrl,25
1621869239.0,2021-05-24,wallstreetbets,gza3yqj,GME give me a hell yeah,t3_njubrl,25
1621850481.0,2021-05-24,wallstreetbets,gz99og2,Green day ahead,t3_njubrl,8
1621854009.0,2021-05-24,wallstreetbets,gz9dncv,Over a year of losing money and I just figured out how to set a stop loss on my brokerage. I FEEL A CHANGE A’COMIN,t3_njubrl,8
1621854049.0,2021-05-24,wallstreetbets,gz9dp34,Bers fukd,t3_njubrl,8
1621854790.0,2021-05-24,wallstreetbets,gz9ekwm,Working nights as you get older really fucks you up,t3_njubrl,7
1621856635.0,2021-05-24,wallstreetbets,gz9gxsw,[deleted],t3_njubrl,8
1621857846.0,2021-05-24,wallstreetbets,gz9illf,Today is the day for 0DTE SPY $420c,t3_njubrl,8
1621857870.0,2021-05-24,wallstreetbets,gz9imvc,Thank you for being a friend,t3_njubrl,7
1621858266.0,2021-05-24,wallstreetbets,gz9j7db,I thinking of putting on a SPY short if it hits 419,t3_njubrl,8
1621859440.0,2021-05-24,wallstreetbets,gz9kxwd,"Waited until 7:30cst before checking stocks.. am i finally breaking the addiction? 

&#x200B;

Also genuinely surprised the market isn't crashing today due to internet money panic over the weekend.",t3_njubrl,8
1621861028.0,2021-05-24,wallstreetbets,gz9nid8,It surely can’t be safe to yolo on spce fds can it?,t3_njubrl,8
1621861095.0,2021-05-24,wallstreetbets,gz9nmhz,PLTR back on the menu,t3_njubrl,8
1621861284.0,2021-05-24,wallstreetbets,gz9ny7k,bears are soo fuk,t3_njubrl,9
1621861489.0,2021-05-24,wallstreetbets,gz9oay2,Robinhood spce FOMO gang at work,t3_njubrl,8
1621862635.0,2021-05-24,wallstreetbets,gz9qd0w,I haven't learned a thing since joining WSB. SPCE already up 20% and I still wanna hop in😂,t3_njubrl,9
1621864514.0,2021-05-24,wallstreetbets,gz9u0ok,Amc is starting the week nicely !,t3_njubrl,8
1621864665.0,2021-05-24,wallstreetbets,gz9ubv6,"I bought spce, y'all have been warned",t3_njubrl,7
1621864679.0,2021-05-24,wallstreetbets,gz9ucv6,SPY 425 end of day :)  Market is strong as fuck right now - recession and inflation all cancelled - stocks to the moon - bears are pussies,t3_njubrl,8
1621864866.0,2021-05-24,wallstreetbets,gz9uqmx,TSLA TO HIT 700 EOW!?,t3_njubrl,9
1621865007.0,2021-05-24,wallstreetbets,gz9v11e,Cathie is one of us. Inverse her plays and you be fine.,t3_njubrl,9
1621865568.0,2021-05-24,wallstreetbets,gz9w60i,Gonna get assigned on my amc ccs 🙃🙃🤬,t3_njubrl,9
1621865659.0,2021-05-24,wallstreetbets,gz9wcsl,Wow my RBLX puts got fucked,t3_njubrl,8
1621866154.0,2021-05-24,wallstreetbets,gz9xdnu,We’re approaching 420 so spy puts on the menu,t3_njubrl,8
1621867247.0,2021-05-24,wallstreetbets,gz9znfe,SPCE getting ready for a crazy afternoon,t3_njubrl,7
1621867492.0,2021-05-24,wallstreetbets,gza063q,"Man I think AMC is taking that VG rocket to space !!

Aiming for 20 ???",t3_njubrl,8
1621867503.0,2021-05-24,wallstreetbets,gza06xz,[deleted],t3_njubrl,9
1621867568.0,2021-05-24,wallstreetbets,gza0bw1,I promise to God if RBLX goes back to $60 this week i'll never touch myself again.,t3_njubrl,7
1621867954.0,2021-05-24,wallstreetbets,gza15jb,Selling covered calls on AMD has been free money,t3_njubrl,8
1621867995.0,2021-05-24,wallstreetbets,gza18pt,AMC 14 today?,t3_njubrl,7
1621868396.0,2021-05-24,wallstreetbets,gza2400,"So RBLX being up on literally no news is because shorts covered in combination with crazy options activity. Ok. Who tf is buying it at these inflated levels, tell me how this fucking company can trade at 110 time p/e with negative earnings and have a higher market cap than EA, Activision, and Take Two. This market is  fucking clown circus.


Also bagholding maaaaad puts so I'm a little bit perturbed.",t3_njubrl,8
1621868603.0,2021-05-24,wallstreetbets,gza2kgw,Some people really thought the internet money crash would trigger a stock crash lol,t3_njubrl,8
1621868612.0,2021-05-24,wallstreetbets,gza2l7n,GME 186,t3_njubrl,8
1621869262.0,2021-05-24,wallstreetbets,gza40nb,TSLA 625 eod,t3_njubrl,8
1621869428.0,2021-05-24,wallstreetbets,gza4dpb,CRSR and AMD. Two stocks that’s just continue to disappoint.,t3_njubrl,8
1621869617.0,2021-05-24,wallstreetbets,gza4sp4,"If I get a design internship at TSLA, I’m gonna blow a big ole load.",t3_njubrl,8
1621869641.0,2021-05-24,wallstreetbets,gza4uld,Help one of my calls is actually going up in value what do I do,t3_njubrl,8
1621871157.0,2021-05-24,wallstreetbets,gza83o4,360k spy puts weeklies guy is dead big oof,t3_njubrl,8
1621871218.0,2021-05-24,wallstreetbets,gza889u,"My favorite part of WSB is when TSLA starts to moon, then everyone who's owned calls and closed them prior to the moon.. get insanely upset with FOMO.

It's sadistic of me, but waaaay better than gain or loss porn. Don't doubt the great Elon.

Catching a small glimpse of it today 😁",t3_njubrl,9
1621872760.0,2021-05-24,wallstreetbets,gzabnv2,Getting laid off on Friday. Time to day trade and apply for jobs full time!,t3_njubrl,7
1621873241.0,2021-05-24,wallstreetbets,gzacr1m,WHY THE FUCK IS RBLX GOING UP SO MUCH,t3_njubrl,8
1621873442.0,2021-05-24,wallstreetbets,gzad7c0,All-in $SPCE,t3_njubrl,7
1621874069.0,2021-05-24,wallstreetbets,gzaemp4,I have a feeling we drill Wednesday,t3_njubrl,9
1621875015.0,2021-05-24,wallstreetbets,gzagsp7,Fuck yea CHADSDAQ bby. Lets go! Also fuck off value stonks,t3_njubrl,9
1621875032.0,2021-05-24,wallstreetbets,gzagu2b,"I'm about to nap, it's always a bull market when I nap. Sorry bears.",t3_njubrl,8
1621875241.0,2021-05-24,wallstreetbets,gzahbga,Waiting on PLTR is moon is about as affective as waiting for that girl to come up to you.,t3_njubrl,8
1621875283.0,2021-05-24,wallstreetbets,gzahf0i,"My friends always telling me about some crazy investment that I should get into. Then I check it 2 months later and it’s down 50% lmao, and they never bring it up again",t3_njubrl,7
1621875368.0,2021-05-24,wallstreetbets,gzahnu6,"Sunday night Wsb: Mara, Riot and Coin puts Monday 

Monday: Mara Coin and Riot green, okay",t3_njubrl,9
1621875748.0,2021-05-24,wallstreetbets,gzair3e,[deleted],t3_njubrl,8
1621875877.0,2021-05-24,wallstreetbets,gzaj4dg,"Looks like it's time for NIO to bottom out and start it's long rise to Q3 and Q4 success.

Double manufacturing capacity just agreed today! 🚀🚀🚀🤑",t3_njubrl,7
1621876414.0,2021-05-24,wallstreetbets,gzakd6b,puts on RBLX and calls on TSLA fuck it,t3_njubrl,7
1621876517.0,2021-05-24,wallstreetbets,gzaklfr,Lets buy RBLX at its all time high! said every retard ever,t3_njubrl,9
1621876836.0,2021-05-24,wallstreetbets,gzalbym,Spy volume low cause every fund is tryna find the next boppin meme stock instead of just hitting the green buy button on the indexes,t3_njubrl,7
1621877384.0,2021-05-24,wallstreetbets,gzamlml,"If you have a stock that is red on a day like today, cut it",t3_njubrl,9
1621877775.0,2021-05-24,wallstreetbets,gzanhs7,CNBC talking about aliens now,t3_njubrl,8
1621877804.0,2021-05-24,wallstreetbets,gzank98,"At some point tomorrow the inflation word gets bandied around, we drop to 41xx test the high 40xxs then by Thursday recover into a big green Friday

5th week in a row",t3_njubrl,8
1621877898.0,2021-05-24,wallstreetbets,gzanrui,"Imagine all the people who panic sold over the past 2 weeks buying back in now, remember buy high sell low!",t3_njubrl,9
1621877952.0,2021-05-24,wallstreetbets,gzanw4n,I’m ruined,t3_njubrl,7
1621878779.0,2021-05-24,wallstreetbets,gzapr4h,rblx puts,t3_njubrl,9
1621879067.0,2021-05-24,wallstreetbets,gzaqepz,2nd half.  Will it blast off?   SPCE,t3_njubrl,7
1621879157.0,2021-05-24,wallstreetbets,gzaqm7f,BULL MARKET IS BACK GET IN BABYYYYYY,t3_njubrl,8
1621879268.0,2021-05-24,wallstreetbets,gzaqvfp,SPCE the baby,t3_njubrl,9
1621879382.0,2021-05-24,wallstreetbets,gzar4tn,Everytime SPCE drops below $25 it gets bought back up.,t3_njubrl,8
1621880126.0,2021-05-24,wallstreetbets,gzastow,AMC the real MVP rn 😢,t3_njubrl,7
1621880259.0,2021-05-24,wallstreetbets,gzat4ai,Power hour for SPCE gonna be delicious,t3_njubrl,8
1621880491.0,2021-05-24,wallstreetbets,gzatnge,"$NVDA riding the earnings + split news ⬆️  
$GME bullish as ever ⬆️   
$TSLA bring back smiles   
And $SPCE, $AMC with retard strength.    
   
Tonight we feast with gain porn.",t3_njubrl,7
1621880648.0,2021-05-24,wallstreetbets,gzau0yr,"Kill the shorts, burn them to the ground TSLA",t3_njubrl,6
1621880855.0,2021-05-24,wallstreetbets,gzauj2k,Ber life matter,t3_njubrl,8
1621881722.0,2021-05-24,wallstreetbets,gzawje7,SPCE I shoulda bought more fackkkk,t3_njubrl,8
1621881928.0,2021-05-24,wallstreetbets,gzax0dg,"aaaaaaaaaaaaaaand there it is, the pre power hour gme dump",t3_njubrl,8
1621882044.0,2021-05-24,wallstreetbets,gzax9v6,pltr is rising!!! the spacs are back baby!!!,t3_njubrl,7
1621882280.0,2021-05-24,wallstreetbets,gzaxtmy,The less I know the better,t3_njubrl,8
1621882317.0,2021-05-24,wallstreetbets,gzaxwrf,#bers lol,t3_njubrl,9
1621882321.0,2021-05-24,wallstreetbets,gzaxx2s,PLTR!!!,t3_njubrl,8
1621882443.0,2021-05-24,wallstreetbets,gzay7ef,Level 2 on SPCE right now is CRAAAAZYYYY,t3_njubrl,8
1621882744.0,2021-05-24,wallstreetbets,gzaywor,SPCE to the space.,t3_njubrl,8
1621882857.0,2021-05-24,wallstreetbets,gzaz6am,AMD just that retarded stock who’s parents forgot to pick up at school,t3_njubrl,9
1621883138.0,2021-05-24,wallstreetbets,gzaztij,"PLTR 

WHAT INSIDER INFO DID HEDGEFUND GET THAT THERE LOADING UP 

WHAT NEW PARTNERSHIP?",t3_njubrl,8
1621883163.0,2021-05-24,wallstreetbets,gzazvkq,Take me to the moon 🌚 PLTR,t3_njubrl,8
1621883239.0,2021-05-24,wallstreetbets,gzb01y1,SPCE baby buy it up buy it up! Calls printing all week!,t3_njubrl,8
1621883414.0,2021-05-24,wallstreetbets,gzb0fyi,Sorry guys my fault for tanking GME - bought calls a few minutes before it decided to shit itself :(,t3_njubrl,8
1621883453.0,2021-05-24,wallstreetbets,gzb0j1a,ok spce is just making me hard now,t3_njubrl,7
1621883602.0,2021-05-24,wallstreetbets,gzb0v6k,I’m gonna shit myself if I see Cathie bought back into SPCE Loooool,t3_njubrl,7
1621883693.0,2021-05-24,wallstreetbets,gzb12j8,SPCE a good buy or too late ?,t3_njubrl,9
1621883937.0,2021-05-24,wallstreetbets,gzb1mdt,[deleted],t3_njubrl,8
1621883943.0,2021-05-24,wallstreetbets,gzb1mtf,At this rate Cathies gonna have to go all in on rogaine.  I can feel her finger quivering above the spce buy button,t3_njubrl,8
1621883967.0,2021-05-24,wallstreetbets,gzb1ooj,Power hour needs more power,t3_njubrl,8
1621884046.0,2021-05-24,wallstreetbets,gzb1v9v,SPCE eod price tomorrow?,t3_njubrl,9
1621884110.0,2021-05-24,wallstreetbets,gzb20mw,SQ wtf,t3_njubrl,8
1621884638.0,2021-05-24,wallstreetbets,gzb3dat,"Tomorrow markets will be red because of FeAr, UnCerTaiNty, DeSpAiR 🤡",t3_njubrl,7
1621884647.0,2021-05-24,wallstreetbets,gzb3dzk,Alert: TSLA is doing the thing again,t3_njubrl,8
1621884730.0,2021-05-24,wallstreetbets,gzb3kqk,Tesla up almost 6% with less than average volume. Nice,t3_njubrl,9
1621885082.0,2021-05-24,wallstreetbets,gzb4d0m,"Damn, I bought 27.50c on SPCE this morning that are up 150% today.. Do I sell or hold?? Feel like tomorrow is going to be the usual red",t3_njubrl,9
1621885193.0,2021-05-24,wallstreetbets,gzb4lzn,Checking this thread for updates rather than checking my positions is weirdly less anxiety inducing,t3_njubrl,8
1621885414.0,2021-05-24,wallstreetbets,gzb53ox,"I walked past our facilities guy and he was holding a short ladder, then GME goes down minutes later. Holy fuck boys this goes deeper than any of us could have expected",t3_njubrl,9
1621885706.0,2021-05-24,wallstreetbets,gzb5rdx,Why does today feel so fake? 😕,t3_njubrl,9
1621885744.0,2021-05-24,wallstreetbets,gzb5uj9,"Raise your hand if your still bagholding SPCE even after a +30% day.

&#x200B;

It me",t3_njubrl,8
1621885902.0,2021-05-24,wallstreetbets,gzb6793,SPCE is still a discount get in while you can 🥳,t3_njubrl,8
1621886278.0,2021-05-24,wallstreetbets,gzb711a,SPY -$1 and people are making a fuss,t3_njubrl,8
1621886308.0,2021-05-24,wallstreetbets,gzb73dd,"I've been poor all my life. A while longer won't hurt, I guess.",t3_njubrl,8
1621886401.0,2021-05-24,wallstreetbets,gzb7ar9,"Ding ding ding! 🔔

#PENCILS DOWN RETARDANTS!",t3_njubrl,8
1621886706.0,2021-05-24,wallstreetbets,gzb7zcj,Spce casually broke $27 AH,t3_njubrl,7
1621887087.0,2021-05-24,wallstreetbets,gzb8tex,Grats to anyone who got spy calls last week...or any calls on a decent stock 😂,t3_njubrl,8
1621888188.0,2021-05-24,wallstreetbets,gzbb7x5,"One more solid green day and I can stop crying into my ramen and switch to yogurt cups, tears, and granola for breakfast.",t3_njubrl,9
1621851555.0,2021-05-24,wallstreetbets,gz9auu4,Holeyyyy duck. $SPCE with the hulk dildos.,t3_njubrl,21
1621868198.0,2021-05-24,wallstreetbets,gza1ogn,My investments are diversified in a way that is clearly benefiting others.,t3_njubrl,22
1621868757.0,2021-05-24,wallstreetbets,gza2wje,Gme haters where u at,t3_njubrl,20
1621867569.0,2021-05-24,wallstreetbets,gza0byz,If GME hits 200 today I'll quit cigarettes,t3_njubrl,19
1621868515.0,2021-05-24,wallstreetbets,gza2dkx,"Rate my portfolio,

50% AMC
50% GME

thanks",t3_njubrl,20
1621852168.0,2021-05-24,wallstreetbets,gz9bjrv,COIN up 2.4% PM. Making money off all this crypto volatility trades might not be a bad thing,t3_njubrl,8
1621853034.0,2021-05-24,wallstreetbets,gz9cjch,Bears are die,t3_njubrl,7
1621853192.0,2021-05-24,wallstreetbets,gz9cpoh,"Beautiful day to blow some money 

SPCE and BNGO all day",t3_njubrl,7
1621854864.0,2021-05-24,wallstreetbets,gz9eo6a,is it still time to hop on SPCE??,t3_njubrl,6
1621855399.0,2021-05-24,wallstreetbets,gz9fcai,Reddit has been going down so much lately,t3_njubrl,7
1621856586.0,2021-05-24,wallstreetbets,gz9gvii,Banks: “oh thank god retail is here to take our massive SPCE bags”,t3_njubrl,7
1621856594.0,2021-05-24,wallstreetbets,gz9gvvp,pollen is mother nature's jizz and i'm getting a facial daily,t3_njubrl,7
1621856703.0,2021-05-24,wallstreetbets,gz9h10d,I'm old enough to remember when $TSLA had up days.,t3_njubrl,7
1621857261.0,2021-05-24,wallstreetbets,gz9hsi6,I feel like F is going to have another +7% to +10% day.,t3_njubrl,6
1621859428.0,2021-05-24,wallstreetbets,gz9kxak,Had my plays for the morning ready to go and then my account got restricted 🤡,t3_njubrl,8
1621860175.0,2021-05-24,wallstreetbets,gz9m378,Where do all these bots come from?!,t3_njubrl,8
1621860232.0,2021-05-24,wallstreetbets,gz9m6ka,"They say the ghost of Memetron wanders these halls to this day. If you listen *really* closely you can still here him saying... ^(no crip toe...)

&#x200B;

#SPY 420c EOD LESGOOOOOO",t3_njubrl,7
1621860977.0,2021-05-24,wallstreetbets,gz9nf7s,Succession is the best show on tv,t3_njubrl,8
1621861025.0,2021-05-24,wallstreetbets,gz9ni5o,"Calls all week.

With all the money leaving corn it has to go somewhere.",t3_njubrl,6
1621861354.0,2021-05-24,wallstreetbets,gz9o2hu,"Feels like a dead cat bounce with fake currency, going to continue with my plan to buy puts on idiotic companies putting fake currency on the balance sheet",t3_njubrl,7
1621861425.0,2021-05-24,wallstreetbets,gz9o6vo,"Im not sure how, but I am certain that this Wuhan lab story is going to somehow fuck my NIO positions",t3_njubrl,6
1621861466.0,2021-05-24,wallstreetbets,gz9o9f4,"Got in pre-market on SPCE, already 7.5M in volume.",t3_njubrl,6
1621861665.0,2021-05-24,wallstreetbets,gz9om6j,my. puts. are. fucked.,t3_njubrl,7
1621861975.0,2021-05-24,wallstreetbets,gz9p5o7,God damn everything available on the web should default to dark mode,t3_njubrl,7
1621862660.0,2021-05-24,wallstreetbets,gz9qelf,"
I'm not a bear, but come on guys... you know you need to inverse this sub",t3_njubrl,8
1621862923.0,2021-05-24,wallstreetbets,gz9qw9k,Yeayyyy casino opening!!!,t3_njubrl,7
1621863201.0,2021-05-24,wallstreetbets,gz9rf4a,Yo is TD broken?,t3_njubrl,8
1621863278.0,2021-05-24,wallstreetbets,gz9rke6,ToS and TDA are broken,t3_njubrl,8
1621863348.0,2021-05-24,wallstreetbets,gz9rpbr,Its not even 5 minutes and i am already poor 🤡🤡🤡,t3_njubrl,6
1621863475.0,2021-05-24,wallstreetbets,gz9ry6i,As expected my AMC puts are fucked.,t3_njubrl,7
1621863785.0,2021-05-24,wallstreetbets,gz9sjxx,Whatever fuck this. Fucking fuck,t3_njubrl,7
1621863844.0,2021-05-24,wallstreetbets,gz9soa4,I just can’t seem to beat this fucking market lol,t3_njubrl,8
1621864014.0,2021-05-24,wallstreetbets,gz9t0bj,Fuck you $BABA just fuck your piece of trash,t3_njubrl,7
1621864369.0,2021-05-24,wallstreetbets,gz9tq34,"If you bought SPCE at above $25 I get why your holding.

Those of you that bought last week and haven't taken profit yet.  You're just fucking dumb lol.  I mean yea maybe it could go up but... passing up huge gains for a few days of chilling?",t3_njubrl,8
1621864516.0,2021-05-24,wallstreetbets,gz9u0wd,SPY to 412 eod,t3_njubrl,7
1621865147.0,2021-05-24,wallstreetbets,gz9vb8m,Why do I always go back to AMD?🙄🤡,t3_njubrl,7
1621865299.0,2021-05-24,wallstreetbets,gz9vmg6,i feel like dogshit inside,t3_njubrl,7
1621865501.0,2021-05-24,wallstreetbets,gz9w10x,$PLTR to $420.69.,t3_njubrl,6
1621865516.0,2021-05-24,wallstreetbets,gz9w232,warren buffet says these three tips for wiping your ass will save you a trillion dollars,t3_njubrl,6
1621865823.0,2021-05-24,wallstreetbets,gz9woym,Tesla 1000c 5/28 who’s with me,t3_njubrl,7
1621865884.0,2021-05-24,wallstreetbets,gz9wthz,nothing bad could possibly happen today,t3_njubrl,7
