created,date,subreddit,id,body,parent_id,score
1602073984.0,2020-10-07,wallstreetbets,g7zv8bu,Dont overthink any of this. Just buy long dated tech calls.,t3_j6o9s8,9
1602074097.0,2020-10-07,wallstreetbets,g7zvdz9,[deleted],t3_j6o9s8,10
1602074402.0,2020-10-07,wallstreetbets,g7zvtv5,Giuliani treating Bloomberg like fucking Fox. No class,t3_j6o9s8,9
1602074571.0,2020-10-07,wallstreetbets,g7zw2lg,🥭 should quit and become a stock market “influencer” .yuge 💰,t3_j6o9s8,11
1602074627.0,2020-10-07,wallstreetbets,g7zw5l2,"Hope no one panic sold yesterday. 

I know y’all did.",t3_j6o9s8,9
1602074680.0,2020-10-07,wallstreetbets,g7zw8cy,#How the fuck is DKNG a 20 BILLION dollar company?? Dont they have like no revenue,t3_j6o9s8,9
1602074781.0,2020-10-07,wallstreetbets,g7zwdp5,"LOL 🥭: “FAKE NEWS says I have co-morbidities (morbidly obese)”

Also 🥭: “WHY is the FAKE NEWS not reporting numbers on co-morbidities?”",t3_j6o9s8,10
1602075456.0,2020-10-07,wallstreetbets,g7zxglc,"Yo I’m a bull cause I know the game is rigged but I feel genuinely sorry for the bears 

the market is delusional",t3_j6o9s8,9
1602075756.0,2020-10-07,wallstreetbets,g7zxzas,"Does dark to light on robinhood at 9am give anyone else a little kick of euphoria? 

Or am I just a gambling addict",t3_j6o9s8,10
1602076568.0,2020-10-07,wallstreetbets,g7zzf4m,"Lol someone said to Mango 

""Hurry up with the check, I need the PS5""",t3_j6o9s8,10
1602076832.0,2020-10-07,wallstreetbets,g7zzvzy,Im just here for the comment section,t3_j6o9s8,10
1602076832.0,2020-10-07,wallstreetbets,g7zzw0k,"I get the feeling we’re being manipulated over this whole “stimulus” business.  Just a funny feeling, you heard it here first.",t3_j6o9s8,10
1602077298.0,2020-10-07,wallstreetbets,g800qgj,Dump your fucking puts unless you want to get raped even more,t3_j6o9s8,10
1602077844.0,2020-10-07,wallstreetbets,g801qze,I guess the market really can stay irrational longer than I can stay solvent.,t3_j6o9s8,12
1602077889.0,2020-10-07,wallstreetbets,g801ucl,Watching a +127% position that you were a few seconds too late to sell at close go to -56% at open 😿,t3_j6o9s8,10
1602078172.0,2020-10-07,wallstreetbets,g802d03,Lol this is actually quite retarded,t3_j6o9s8,11
1602078501.0,2020-10-07,wallstreetbets,g802xq1,"This is getting old, 10-15 minutes pump after market open and then slow bleed for the rest of the day!",t3_j6o9s8,9
1602079289.0,2020-10-07,wallstreetbets,g804bzm,RKT loves being my only red stock,t3_j6o9s8,11
1602079626.0,2020-10-07,wallstreetbets,g804xbc,"If AAPL doesnt hit at least 116.5 today, Im selling this garbage. I've been more than patient with these clowns",t3_j6o9s8,10
1602079637.0,2020-10-07,wallstreetbets,g804y0o,Must. Stop. Buying. So. I. Can. Withdraw.,t3_j6o9s8,11
1602080612.0,2020-10-07,wallstreetbets,g806pu7,I heard a rumor that a stimulus might get passed in 2023. 📈📈📈,t3_j6o9s8,10
1602081108.0,2020-10-07,wallstreetbets,g807nbd,Who the fuck is pumping this shit lmao,t3_j6o9s8,10
1602081885.0,2020-10-07,wallstreetbets,g80949w,"American people about to go bankrupt

House and the Senate - ""I sleep""

Airlines about to go bankrupt

House and Senate - ""Real shit""",t3_j6o9s8,10
1602082025.0,2020-10-07,wallstreetbets,g809e20,This market is going to crash at some point today,t3_j6o9s8,10
1602082278.0,2020-10-07,wallstreetbets,g809vpe,"I keep saying it, ICLN is a freakin money machine",t3_j6o9s8,10
1602083972.0,2020-10-07,wallstreetbets,g80d7cj,uh oh pelosi talkin shit,t3_j6o9s8,11
1602084190.0,2020-10-07,wallstreetbets,g80dmyp,I’ve made 13 Peloton’s this year off PTON.,t3_j6o9s8,9
1602084561.0,2020-10-07,wallstreetbets,g80edw3,Let’s get a new $1200 check just in time for AAPLs new $1200 phone please.,t3_j6o9s8,10
1602084908.0,2020-10-07,wallstreetbets,g80f2p3,PLTR is now known as 👁. Carry on.,t3_j6o9s8,9
1602085250.0,2020-10-07,wallstreetbets,g80frbj,"Forget the moon, we’re going to the sun 🌞",t3_j6o9s8,10
1602085362.0,2020-10-07,wallstreetbets,g80fzcp,Don't want to buy. Don't want to sell. Time to unplug for a minute.,t3_j6o9s8,9
1602085653.0,2020-10-07,wallstreetbets,g80gkh3,Damn it was crazy when mango tanked the entire market yesterday,t3_j6o9s8,9
1602086097.0,2020-10-07,wallstreetbets,g80hh76,"Sold my UPS $130 leaps today 800% is a good place to stop being greedy right?

Bought 5 sold 1 then sold the other 4 

I wish things went this way more often  https://i.imgur.com/U1T9dzf.jpg https://i.imgur.com/EjLFqmE.jpg https://i.imgur.com/sfmpsmM.jpg",t3_j6o9s8,8
1602086404.0,2020-10-07,wallstreetbets,g80i4io,"Netflix indicted by Texas grand jury for cuties film

Netflix stock shoots up 5%",t3_j6o9s8,10
1602087356.0,2020-10-07,wallstreetbets,g80k1k0,yo whatever happened to tiktok? that shit disappeared from the news,t3_j6o9s8,9
1602087779.0,2020-10-07,wallstreetbets,g80kw4d,"markets are just a casino now 

we should've never created Robinhood",t3_j6o9s8,9
1602088757.0,2020-10-07,wallstreetbets,g80mv2r,The INTC calls I bought a month are finally green. I'm up $8,t3_j6o9s8,10
1602089066.0,2020-10-07,wallstreetbets,g80nhxl,Wow....... volume like the tv at grandmas house,t3_j6o9s8,9
1602089179.0,2020-10-07,wallstreetbets,g80nqia,"Am I reading this insider trading report for PLTR correctly?? Thiel sold 900 shares??? Uhh, that’s like $9k...",t3_j6o9s8,10
1602089217.0,2020-10-07,wallstreetbets,g80ntaj,"Playing stocks is like placing bets on a rigged horse race. You can get lucky and pick the horse that was rigged to win, but if you go off any logic at all your odds just go down. Insiders win and (almost) everybody else lose",t3_j6o9s8,10
1602089905.0,2020-10-07,wallstreetbets,g80p7yg,AMD is like your retarded sister that gets stuck in the dryer.,t3_j6o9s8,11
1602091281.0,2020-10-07,wallstreetbets,g80s0tw,Spy waiting for 🥭 to tweet,t3_j6o9s8,9
1602091371.0,2020-10-07,wallstreetbets,g80s7d8,"Bears, no stimulus this year means an even bigger stimulus next year. The market will be pricing that in for the rest of the year.

If Biden wins, most likely Democrats will control all three seats of government, and they’ll be looking to pass a big ol’ stimulus. 

It’s just simple jack enough to be possible.",t3_j6o9s8,12
1602091742.0,2020-10-07,wallstreetbets,g80syvo,This looks awfully similar to yesterday...,t3_j6o9s8,10
1602091889.0,2020-10-07,wallstreetbets,g80t9yg,Here’s the dump in 3...2....2......2......2....2....2....2....2...2....2.... let me start over 3....2...,t3_j6o9s8,9
1602093382.0,2020-10-07,wallstreetbets,g80wd7v,"Man, fuck HYLN, fuck GE, fuck SPY, and fuck this market",t3_j6o9s8,10
1602093634.0,2020-10-07,wallstreetbets,g80ww9f,Green lives matter,t3_j6o9s8,10
1602093652.0,2020-10-07,wallstreetbets,g80wxlu,Cathy Ark sees the future,t3_j6o9s8,11
1602093664.0,2020-10-07,wallstreetbets,g80wyik,"i threw 40 bucks on a SPY 330p for 10/9 hoping we may have some kind of a mini dump like the past few days, so i can use one day trade and make a small profit. so ofc we are on a moon mission today. you're welcome folks",t3_j6o9s8,9
1602093724.0,2020-10-07,wallstreetbets,g80x2ua,"I don’t see why the airlines should get 25B of tax payer money to sit around and twiddle their thumbs.  What’s wrong with furloughing?  If there isn’t demand for them to perform their job, what are we paying them for exactly?  The inconvenience of furloughing and having people return as the industry rebuilds over the next 2-3 years?",t3_j6o9s8,8
1602093891.0,2020-10-07,wallstreetbets,g80xfbd,"ALWAYS

BUY

THE DIP

PRAY FOR A CRASH

JUST FOR A BETTER DIP",t3_j6o9s8,8
1602093918.0,2020-10-07,wallstreetbets,g80xhbf,"*looks both ways* 

*puts on shitty sunglasses (loser aviator kind)*

# it's GUH time boys",t3_j6o9s8,10
1602094288.0,2020-10-07,wallstreetbets,g80y958,Lol so Fed said  without a stimmy means we getting dicked down?,t3_j6o9s8,11
1602094436.0,2020-10-07,wallstreetbets,g80yk93,Wtf is Girl❤️Bot - is the president really retweeting Girl❤️Bot?!,t3_j6o9s8,10
1602094517.0,2020-10-07,wallstreetbets,g80yq7k,"Nobody 

🥭: art of the *stimulus* deal",t3_j6o9s8,10
1602094792.0,2020-10-07,wallstreetbets,g80zaqj,LMAO ALMOST RETRACED THE ENTIRE DUMP 😂😂😂😂😂😂😂😂,t3_j6o9s8,10
1602095021.0,2020-10-07,wallstreetbets,g80zrr2,Lol spy up nearly 2% on 28mil volume. AND YOU THINK THE GAME ISNT RIGGED,t3_j6o9s8,9
1602095105.0,2020-10-07,wallstreetbets,g80zy65,lol we mooning. permabull here and even im upset,t3_j6o9s8,11
1602095209.0,2020-10-07,wallstreetbets,g8105uz,"2:30, time for Trump to announce he’s going to make owning stocks illegal in 48 hours.

Then at 11 pm, he can say “it’ll still probably be illegal, but I will strongly consider sending $45 checks to every American (but won’t!)”

And we’ll be at ATH by tomorrow afternoon",t3_j6o9s8,9
1602095229.0,2020-10-07,wallstreetbets,g8107dj,"I’m convinced there are actual tards on this sub. If we get even a fraction of a red day in the upcoming days, half the sub gets wiped. Learn to take profits and not romanticize whatever you see on Wolf of Wall Street.",t3_j6o9s8,9
1602096554.0,2020-10-07,wallstreetbets,g812yin,"[The stock market may be too optimistic about stimulus chances](https://www.cnbc.com/2020/10/07/stock-rally-may-have-b-on-likely-out-come-on-stimulus-spending.html)  


YOU THINK?!",t3_j6o9s8,10
1602096841.0,2020-10-07,wallstreetbets,g813jxj,I got out yesterday and the FOMO is killing my soul. I know if i get in the market will dump. I should probably uninstall RH and go cook dinner for my wife and her boyfriend.,t3_j6o9s8,11
1602097068.0,2020-10-07,wallstreetbets,g814172,I love how people got so fucked over by PRPL that no one even talks about it being at ATH rn lol,t3_j6o9s8,10
1602097248.0,2020-10-07,wallstreetbets,g814ez0,P O W E R     H O U R.  🚀🚀🚀🚀🚀🚀🚀🚀🚀🚀🚀🚀🚀🚀🚀,t3_j6o9s8,11
1602097718.0,2020-10-07,wallstreetbets,g815eae,When it’s going up I’m bearish when it’s going down I’m bullish and I’m never right,t3_j6o9s8,11
1602098105.0,2020-10-07,wallstreetbets,g81672k,"so look, all you retards are going to sell your puts that you panic fomo'd into yesterday before close. You gonna buy calls. THEN tomorrow is going to be the dog dickest reddest fucking day there ever were - rinse and repeat",t3_j6o9s8,10
1602098408.0,2020-10-07,wallstreetbets,g816t7w,idk how but my account somehow ended up being 70% calls on renewable energy,t3_j6o9s8,10
1602099049.0,2020-10-07,wallstreetbets,g818529,stonk market 2020: where retarded americans make or break their retarded dreams based on one retarded orange mans retarded tweets,t3_j6o9s8,10
1602099258.0,2020-10-07,wallstreetbets,g818kib,"SPY's like, here comes the DUMP! SIKE",t3_j6o9s8,9
1602099336.0,2020-10-07,wallstreetbets,g818q8t,"NY post found one of you retards lmao 
https://twitter.com/nypost/status/1313910093692444680",t3_j6o9s8,11
1602099906.0,2020-10-07,wallstreetbets,g819w8y,"Holding spy puts into tomorrow, going off technicals, but this bitch don’t play by the rules 🤡🤢",t3_j6o9s8,11
1602100679.0,2020-10-07,wallstreetbets,g81bh7n,What is FSLY and why did I just buy puts on it,t3_j6o9s8,9
1602100913.0,2020-10-07,wallstreetbets,g81byd5,"Ok, Donny. I just need you to get high off your meds again and talk a bunch of noise on Twitter to get my puts over the top.",t3_j6o9s8,10
1602101244.0,2020-10-07,wallstreetbets,g81cmr7,A $100 stock can go up 20% in one day on no news. If that isn't gambling I don't what gambling is lol 🎰 Casino definitely open,t3_j6o9s8,10
1602066921.0,2020-10-07,wallstreetbets,g7zndu2,"Entire admin testing positive, manga acting bipolar and manic, oil tanking, election in full swing and we are GREEN? 🤡🤡🤡",t3_j6o9s8,20
1602096274.0,2020-10-07,wallstreetbets,g812dip,"[TRUMP WILL SOON SPEAK TO THE AMERICAN PEOPLE, AIDE SAYS](https://twitter.com/deitaone/status/1313911219288449031?s=21)



Red candles after this. Can’t tell me otherwise. 



Mr market ended friendship with 🥭. Anything you say can and will be used against you in a court of stonks",t3_j6o9s8,19
1602098228.0,2020-10-07,wallstreetbets,g816g69,"Damn, GG Bulls! You did it!

You cured covid, stopped racial discrimination, passed the 2nd stimulus bill, saved Trump from Covid, reversed the recession.

I applaud you!",t3_j6o9s8,31
1602069186.0,2020-10-07,wallstreetbets,g7zpiuo,My SPY puts are going to -99% my account on open.,t3_j6o9s8,9
1602070328.0,2020-10-07,wallstreetbets,g7zqq68,airlines up after that late night tweet is hilarious,t3_j6o9s8,8
1602070761.0,2020-10-07,wallstreetbets,g7zr7wf,Wait til Trump tweets his new stimulus plan for the economy is to inject steroids in it. Media gonna luv that.,t3_j6o9s8,9
1602071139.0,2020-10-07,wallstreetbets,g7zrng2,"who cares about stimulus, we got earnings season coming up

strap in and put on your helmets",t3_j6o9s8,9
1602071471.0,2020-10-07,wallstreetbets,g7zs13g,"Not buying puts anymore, fuck this. Just get calls and take profit quickly to avoid holding positions on the random red day that will wipe you out.",t3_j6o9s8,9
1602071519.0,2020-10-07,wallstreetbets,g7zs344,I suspect my parents drank a lot of alcohol and smoked a ton of cigs when I was in the womb.,t3_j6o9s8,10
1602072690.0,2020-10-07,wallstreetbets,g7ztihh,its almost like yesterday never happened 😂,t3_j6o9s8,9
1602072871.0,2020-10-07,wallstreetbets,g7ztqum,[deleted],t3_j6o9s8,9
1602073162.0,2020-10-07,wallstreetbets,g7zu4b7,"Okay so for weeks and weeks people say the market is rising on “stimulus hopes”, trump tweets no stimulus, and the market just shits a point or two and then gap fills the very next day?????? RIGGED. SAD. BIGLY.",t3_j6o9s8,10
1602073559.0,2020-10-07,wallstreetbets,g7zunch,"Orange is already tweeting this early , another crazy volatile day.",t3_j6o9s8,9
1602073920.0,2020-10-07,wallstreetbets,g7zv566,Nancy Pelosi “Dark Chocolate connoisseur” 💀💀💀,t3_j6o9s8,9
1602074359.0,2020-10-07,wallstreetbets,g7zvrkq,Giuliani is going off the rails on bloomberg right now. smh,t3_j6o9s8,9
1602074469.0,2020-10-07,wallstreetbets,g7zvxd5,The Tesla bulls are going to be so annoying today,t3_j6o9s8,10
1602074825.0,2020-10-07,wallstreetbets,g7zwg3u,Congratulations to whoever bought the dip,t3_j6o9s8,9
1602075883.0,2020-10-07,wallstreetbets,g7zy808,never buying fucking puts again. this market is so fucking stupid. buy the fucking dip.,t3_j6o9s8,8
1602076029.0,2020-10-07,wallstreetbets,g7zygz4,"In other news, the Tik Tok deadline was basically bullshit.",t3_j6o9s8,8
1602076094.0,2020-10-07,wallstreetbets,g7zykup,Stimulus talks going well again.,t3_j6o9s8,10
1602076115.0,2020-10-07,wallstreetbets,g7zym5a,"Dame mango still tweeting fuck bro 

What juice is he on",t3_j6o9s8,9
1602076127.0,2020-10-07,wallstreetbets,g7zymv6,"Ah, a story as old as time itself. Bears r fuk",t3_j6o9s8,9
1602076203.0,2020-10-07,wallstreetbets,g7zyrry,Taking 15mg of addy to get on Donnies level,t3_j6o9s8,9
1602076315.0,2020-10-07,wallstreetbets,g7zyza2,"Let's go TAN gang, I want to see this shit hit 75 eow",t3_j6o9s8,9
1602076350.0,2020-10-07,wallstreetbets,g7zz1qr,If you bought yesterday's skiddish Tweet dump you can say good bye to the 40 hour work week.,t3_j6o9s8,9
1602076404.0,2020-10-07,wallstreetbets,g7zz4zh,Trump sus,t3_j6o9s8,8
1602076747.0,2020-10-07,wallstreetbets,g7zzq7r,Can we ban the asshole that keeps shit posting the same doctor prescription?,t3_j6o9s8,9
1602076885.0,2020-10-07,wallstreetbets,g7zzzdm,Add another side effect warning to remdesivir - May cause uncontrollable tweeting,t3_j6o9s8,9
1602077297.0,2020-10-07,wallstreetbets,g800qde,Nancy is going to have to scroll through a bunch of Russian bot shit to get to the actual request.,t3_j6o9s8,9
1602077322.0,2020-10-07,wallstreetbets,g800ryj,If AAPL just goes up everyone will fall in line and follow Tim to Tendietown,t3_j6o9s8,9
1602077432.0,2020-10-07,wallstreetbets,g800yvq,WTF was the at open,t3_j6o9s8,9
1602077554.0,2020-10-07,wallstreetbets,g8016q9,"That, ladies and gentlemen, is why you always buy the dip.",t3_j6o9s8,8
1602077598.0,2020-10-07,wallstreetbets,g8019gn,Portfolio finally positive for the year!! +$23.84 😭😭😭😭,t3_j6o9s8,9
1602077812.0,2020-10-07,wallstreetbets,g801ohf,Cramer just discovered The Boys and he’s in love.,t3_j6o9s8,8
1602078292.0,2020-10-07,wallstreetbets,g802kjq,Imagine selling and buying puts yesterday 😳,t3_j6o9s8,10
1602078426.0,2020-10-07,wallstreetbets,g802sx4,"""Buy the dip,"" he said

""Ok,"" I said. And things have been going well since",t3_j6o9s8,9
1602079312.0,2020-10-07,wallstreetbets,g804dg6,RKT is such a piece of shit,t3_j6o9s8,10
1602079658.0,2020-10-07,wallstreetbets,g804zdr,Just eliminated all of my 15% gains for the year. What's up with you guys?,t3_j6o9s8,8
1602080564.0,2020-10-07,wallstreetbets,g806mo1,"I made my money back within an hour today
now i gotta go to work.

Im so fucking afraid mango man is going to FUCK my shit with a tweet. God damn. we gotta get him out, not for political reasons, but to keep our calls safe boys.",t3_j6o9s8,10
1602080783.0,2020-10-07,wallstreetbets,g8071fg,Tim 🍎 must like my ass because he is really stretching it wide rn,t3_j6o9s8,10
1602080821.0,2020-10-07,wallstreetbets,g80740i,"As we all know, airline stimulus is great for PTON",t3_j6o9s8,9
1602081239.0,2020-10-07,wallstreetbets,g807w20,Ty to whoever suggested SPY. wow this thing has gone up for a hundred years.,t3_j6o9s8,9
1602082114.0,2020-10-07,wallstreetbets,g809kay,Stimulants > Stimulus,t3_j6o9s8,9
1602082179.0,2020-10-07,wallstreetbets,g809or5,I need a monster play to lift my account or I'm toast,t3_j6o9s8,8
1602083093.0,2020-10-07,wallstreetbets,g80bgx7,Aw shit ISIS again lmao,t3_j6o9s8,9
1602083116.0,2020-10-07,wallstreetbets,g80bik6,"Phew, just ISIS.",t3_j6o9s8,9
1602083241.0,2020-10-07,wallstreetbets,g80bras,[deleted],t3_j6o9s8,10
1602083450.0,2020-10-07,wallstreetbets,g80c672,Donald and Nancy could walk out of capital hill holding hands and announce 5k checks for everybody and their dog and id still be pretty fucked.,t3_j6o9s8,9
1602083536.0,2020-10-07,wallstreetbets,g80cc8u,AAPL Sub 120 has had me edging for eons,t3_j6o9s8,9
1602084199.0,2020-10-07,wallstreetbets,g80dnlw,P-Lady says DUDE Fked up Real Bad this time... STIMULUS TALKS are NO LONGER.,t3_j6o9s8,8
1602084551.0,2020-10-07,wallstreetbets,g80ed7a,Can this man please stop tweeting before he says some shit that tanks the market,t3_j6o9s8,10
1602084567.0,2020-10-07,wallstreetbets,g80eedf,I need this bitch to crash so I can go on vacation,t3_j6o9s8,9
1602084597.0,2020-10-07,wallstreetbets,g80egit,Everyone calling for rug pull. Please not another one.,t3_j6o9s8,10
1602084880.0,2020-10-07,wallstreetbets,g80f0ph,"We live in a time when a walking fruit can have a larger and faster impact on the market than a natural disaster or terrorist attack, yet discussing said fruit on a sub dedicated to the market isn't allowed because man-children can't distinguish between financial and perlitical discussions.

Can we all just pull some cash together and donate some $ROPE to the sub for the mods?",t3_j6o9s8,10
1602084890.0,2020-10-07,wallstreetbets,g80f1g3,The FDX 5 year chart is something else,t3_j6o9s8,9
1602085229.0,2020-10-07,wallstreetbets,g80fpqh,DDD collaboration with TSLA! Get in now!,t3_j6o9s8,9
1602085379.0,2020-10-07,wallstreetbets,g80g0me,What AMD holders would sell before tomorrow's event? Just seems silly unless it's just all short sellers.,t3_j6o9s8,10
1602085748.0,2020-10-07,wallstreetbets,g80grdy,i don't know how the market is doing this to me.  i once scored 4 touchdowns in a single game for the polk high panthers,t3_j6o9s8,9
1602086589.0,2020-10-07,wallstreetbets,g80ihw5,PDT rule can suck my left nut,t3_j6o9s8,11
1602086772.0,2020-10-07,wallstreetbets,g80iv2z,"I haven't made a winning trade since early July, I'm going fucking crazy man",t3_j6o9s8,9
1602086793.0,2020-10-07,wallstreetbets,g80iwme,my headphones are at a higher volume than this shit,t3_j6o9s8,9
1602086865.0,2020-10-07,wallstreetbets,g80j1ry,The year is 2040 Tesla is still trading at $420,t3_j6o9s8,9
1602087100.0,2020-10-07,wallstreetbets,g80jiyf,"Tesla:  I would like to go above 422 now please

&#x200B;

MM: no",t3_j6o9s8,10
1602087163.0,2020-10-07,wallstreetbets,g80jnix,"Holy shit guys I'm almost back to breakeven for the week! 

Which is basically the equivalent of a 10-bagger for an average trader.",t3_j6o9s8,8
1602088293.0,2020-10-07,wallstreetbets,g80lxf4,Ffs can we stop getting faked out every single day. Fuck big money,t3_j6o9s8,9
1602089226.0,2020-10-07,wallstreetbets,g80ntzi,"Can someone just make Donald do an AMA here, so we have the scoop before the algos and insiders?",t3_j6o9s8,9
1602089473.0,2020-10-07,wallstreetbets,g80ocbt," [https://twitter.com/JenniferJJacobs/status/1313884750201970690?s=20](https://twitter.com/JenniferJJacobs/status/1313884750201970690?s=20) 

New statement from POTUS's Doctor",t3_j6o9s8,9
1602089763.0,2020-10-07,wallstreetbets,g80oxm9,"SPY seems like it’s waiting to dump, which means it’ll prob pump",t3_j6o9s8,9
1602089782.0,2020-10-07,wallstreetbets,g80oz09,"Market is showing us how long it can hold a plank. I'm impressed, you can stop now",t3_j6o9s8,9
1602089877.0,2020-10-07,wallstreetbets,g80p5xf,tap a random stock on your watchlist and buy 10 contracts. Now that’s a real YOLO.,t3_j6o9s8,9
1602070566.0,2020-10-07,wallstreetbets,g7zqzw0,Boomers trade baseball cards. No this is Pokémon card trading in elementary school where no one knows the actual value of the card,t1_g7zqoko,51
1602068507.0,2020-10-07,wallstreetbets,g7zout0,Mods,t1_g7zou3x,66
1602071320.0,2020-10-07,wallstreetbets,g7zrut6,its not confusion.  it's called magical thinking,t1_g7zrrn0,29
1602071326.0,2020-10-07,wallstreetbets,g7zrv2g,"Nothing matters anymore, people are defaulting to greedy mode",t1_g7zrrn0,14
1602071476.0,2020-10-07,wallstreetbets,g7zs1ci,I'm now convinced he could've died and we would've recovered within a day.,t1_g7zrrn0,10
1602067720.0,2020-10-07,wallstreetbets,g7zo3zt,"""oh fuck the 'best' market shit the bed, tweet something""",t1_g7zns7f,51
1602067423.0,2020-10-07,wallstreetbets,g7znu57,"Snip snap, snip snap",t1_g7zns7f,73
1602097528.0,2020-10-07,wallstreetbets,g81505d,"I second that. And not for a couple days, just perma ban that pathetic fuck.",t1_g814xew,9
1602066455.0,2020-10-07,wallstreetbets,g7zmybg,"Yeah there are creatures on earth who freak out for losing 200 dollars.

I read a post of a guy who started investing in ETFs and his portfolio was down 2% and he was thinking whether he should retreat and sell everything.

I was down 40K in September and didnt bat an eye. Not that I am rich but I have been through many dips.",t1_g7zmsf2,57
1602075746.0,2020-10-07,wallstreetbets,g7zxyoo,"Yeah but rich people don't understand that at all. They think poor people need $1,200 and everything will be solved",t1_g7zxtgc,17
1602090974.0,2020-10-07,wallstreetbets,g80refd,the shirt doesn't come with a chance of making you RICH!,t1_g80rc91,10
1602070167.0,2020-10-07,wallstreetbets,g7zqjmo,[deleted],t1_g7zqirm,9
1602070917.0,2020-10-07,wallstreetbets,g7zreax,[removed],t1_g7zr67p,23
1602073286.0,2020-10-07,wallstreetbets,g7zua8h,Hopefully they used RKT.,t1_g7zu8qw,40
1602076774.0,2020-10-07,wallstreetbets,g7zzs2f,Is this real? 😂,t1_g7zzokc,21
1602073526.0,2020-10-07,wallstreetbets,g7zulr1,Stimulus talks going well inside his mind,t1_g7zue3r,14
1602065984.0,2020-10-07,wallstreetbets,g7zmhat,"look, I just need apple to go to 150$ by end of this month. Is that too much to ask?",t1_g7zmdma,15
1602066285.0,2020-10-07,wallstreetbets,g7zmsaf,I hope he makes the vaccine subscription-based,t1_g7zmdma,10
1602089174.0,2020-10-07,wallstreetbets,g80nq5j,Absolutely retarded lol,t1_g80nkve,10
1602068590.0,2020-10-07,wallstreetbets,g7zoxmk,🐻👈😂,t1_g7zowg4,35
1602102137.0,2020-10-07,wallstreetbets,g81efmy,You worked part time at McDonald's didn't you,t1_g81dwrr,12
1602067542.0,2020-10-07,wallstreetbets,g7zny20,The emotional toll Trump tweets have on a person...,t1_g7znu57,49
1602075853.0,2020-10-07,wallstreetbets,g7zy60a,"“It’s a year’s rent Michael, what could it cost, $1200?”",t1_g7zxyoo,15
