created,date,subreddit,id,body,parent_id,score
1589889486.0,2020-05-19,wallstreetbets,fr4ivr8,"Alright you fucking dipshits, last time I spoke about consistent small profits and hedging for newbies. Seems like some of you folks really liked it so I decided to post more cringe advice for you. 

Today’s Ted talk is about how to maintain your sanity trading in this absolute shit show of a market.

- Say you’re up bigly on a play and don’t know if to lock profits or diamond hands for a 10 bagger gain. Look at your all-time portfolio, remind yourself that we’re in the middle of a fucking pandemic with multiple countries heading straight into recession with a market waiting for a single bad news to drop dead and make the call. Personally I lock in profits when I’m up over 40% on a play but it’s your money so you decide what’s a better profit lock % for you.

- Betting on current market trend is a YOLO. Let’s say SPY(or any other ticker for that matter) has had a +2/3% day today and you’re anticipating it to go up further, buying more calls is a YOLO because you’re buying inflated option contracts with a gamble that it climbs further. So be wary before placing a bet that it can be wiped off very quickly if shit hits the fan. Many newbies don’t know this but VIX calls are an amazing hedge when you YOLO into SPY calls during rallies like a retard. Surprise Intra day dumps will fuck with your peace of mind and force you to panic sell if you don’t have insurance(VIX Calls) - having VIX calls will keep you in the game longer and they’re a fuckton cheaper than SPY contracts.


- Betting on opposite market trend on the other hand should never be a YOLO and you should start by building a position that is resilient to small price movements (for you dumbfucks who don’t know that means I’m saying that you should build an opposite trend position either 2 weeks or a month out so you don’t get fucked by Greeks). Let’s say SPY has been rallying for days in a row and weekly SPY puts are dirt cheap. I know a lot of you autists will yolo into weekly puts and then bitch about how the market is fucking retarded when the rally continues and your puts end up toast. It’s fair to be agitated but it’s better to smarter and start building a monthly put position slowly averaging in depending on how the market is behaving. You can be even more smart and get slightly OTM weekly calls(weekly calls that are +5/8$ are dirt fucking cheap for SPY) to hedge against the loss that your PUT position will be bleeding in the long run if the rally continues and give you a decent chance to exit if you feel the play is no longer at a good strike price and allow you to roll-over to a better strike price.

- Saved the best one for last. LEARN TO FUCKING ENJOY THE GAINS YOU MAKE BEFORE YOU FUCKING YOLO IT AGAIN YOU GREEDY FUCKING BASTARDS. 

I was up 8K yesterday due to the rally. My portfolio is still down 7% overall. I was up 177% in March but got greedy and took a huge hit being stubborn holding SPY puts and ended up being down 22%. After I closed my calls yesterday I rolled over a small capital back into some contracts. Of the 8K I made, I put 2k back in the bank and bought a bunch of stuff that I’ve been meaning to buy and it felt so fucking good. I’m not saying material goods are the road to happiness but I’m pretty certain over 99% of you fucking dopamine whores wouldn think twice before buying a 50$ hoodie/200$ sneakers or whatever dumb shit you’re into but you would rather FUCKING YOLO your gains immediately like the autistic fucks you are before doing something good/buying stuff that you’ve wanted and lose it all before enjoying the gains that you worked for. It’s beyond fucking crazy, I was like that too. 

But what’s the FUCKING POINT OF ALL THESE GAINS IF YOUVE BECOME SO FUCKING INSENSITIVE AND DONT EVENT BOTHER ENJOYING IT?

Thats all folks, thanks for coming to my Ted talk. Will post more shit when I’m in the mood.

Good luck today, let’s get them tendies.",t3_gmlsuw,59
1589887302.0,2020-05-19,wallstreetbets,fr4gai1,"Lowe’s .... you is kind ..... you is smart ..... you are proud. It’s time you get a mind of your own, ditch HD and crush your earnings tomorrow *gulp*",t3_gmlsuw,16
1589891293.0,2020-05-19,wallstreetbets,fr4l8af,Now a face melting sell off to get some of you boys back in shape.,t3_gmlsuw,8
1589895213.0,2020-05-19,wallstreetbets,fr4r69v,Cramer likes Theranos,t3_gmlsuw,8
1589897704.0,2020-05-19,wallstreetbets,fr4vkrn,"Lmao, he said hes providing liquidity to workers, lmfao.

Get the fuck out of here",t3_gmlsuw,7
1589898731.0,2020-05-19,wallstreetbets,fr4xhd6,Lmao this senator is out for blood. I have calls but I love this.,t3_gmlsuw,8
1589898736.0,2020-05-19,wallstreetbets,fr4xhrg,FB Announcement: you can now add GIFs to your pictures,t3_gmlsuw,7
1589898780.0,2020-05-19,wallstreetbets,fr4xkpi,Mnuchin looks like he's the CEO of the lollipop guild. I hate him.,t3_gmlsuw,7
1589898811.0,2020-05-19,wallstreetbets,fr4xmsh,This guy got puts lol,t3_gmlsuw,7
1589898869.0,2020-05-19,wallstreetbets,fr4xqsl,"Jesus, who shit into this senators cereal? Dude coming off as a complete dick lol.",t3_gmlsuw,8
1589899239.0,2020-05-19,wallstreetbets,fr4yg1u,I don't understand how a burrito stock is 1000,t3_gmlsuw,8
1589900247.0,2020-05-19,wallstreetbets,fr50e5y,"Guys, im sorry to tell you this, but theta gang is going to win this day",t3_gmlsuw,8
1589902198.0,2020-05-19,wallstreetbets,fr546x1,"""You are BOOSTING YOUR WALL STREET BUDDIES""

SPY 400 EOW",t3_gmlsuw,9
1589902851.0,2020-05-19,wallstreetbets,fr55hiy,Trump just said he's the best president we've ever had. Calls on $EGO,t3_gmlsuw,7
1589902892.0,2020-05-19,wallstreetbets,fr55kfj,"Powell, "" Lasting unemployment can weigh on economy for years""  SPY rises. Gotta love it",t3_gmlsuw,8
1589903078.0,2020-05-19,wallstreetbets,fr55xuu,"J. Powell has some MF charisma. Dude is calm, confident and knowledgable no matter the question. I trust him.",t3_gmlsuw,7
1589904803.0,2020-05-19,wallstreetbets,fr59f37,"wait.... there are people who haven't gotten their Donnie Dollars yet? Shit, I got that a month ago. I've already blown it betting against the American economy.",t3_gmlsuw,7
1589904849.0,2020-05-19,wallstreetbets,fr59iku,Blackrock straight up working for the FED HOLY SHIT,t3_gmlsuw,8
1589905742.0,2020-05-19,wallstreetbets,fr5bd3x,FB announcement is another 4 hour livestream of mark smoking meats,t3_gmlsuw,8
1589907095.0,2020-05-19,wallstreetbets,fr5e6wy,Shop 690 puts are literally 4.20. You know it's the trade,t3_gmlsuw,8
1589907398.0,2020-05-19,wallstreetbets,fr5eu2q,Zuck taking advantage of the crisis again just like 2008,t3_gmlsuw,9
1589908524.0,2020-05-19,wallstreetbets,fr5h8cy,"this is actually big

sounds like they're integrating it into everything including instagram

$$$$$$$",t3_gmlsuw,9
1589908843.0,2020-05-19,wallstreetbets,fr5hx71,ZUCK PLEASE KEEP TALKING UNTIL 4PM HAHAHAHAHAH,t3_gmlsuw,8
1589909309.0,2020-05-19,wallstreetbets,fr5ixju,"SHOP Put holders at 1:04PM: :D

SHOP Put holders at 1:20PM: :|",t3_gmlsuw,8
1589911506.0,2020-05-19,wallstreetbets,fr5nip4,". More than 4.1 million homeowners are in forbearance plans now, according to the latest data from the Mortgage Bankers Association

OVERALL, 8.16% OF ALL MORTGAGES WERE IN FORBEARANCE AS OF MAY 10 IN THE UNITED STATES.


All time highs by next week",t3_gmlsuw,8
1589911512.0,2020-05-19,wallstreetbets,fr5nj4w,"Facebook shops... I understand how it synergizes with the platform especially with IG; now all them influencers really gonna make bank hawking their essential oils and face creams while rolling in the commissions. 

But, its slightly depressing how Murica gonna be further dominated by social media. The golden age of social media is coming folks.  Soon we will develop technology to be able to live stream the feed directly to our brains without the need for handheld devices. 

Buy FB stonks and hold for 20 years, and you'll be part of the ruling class while the plebs stare are their screens from birth to death. Praise Zuckerberg and our machine overlords, join us while you can!",t3_gmlsuw,8
1589913350.0,2020-05-19,wallstreetbets,fr5rbil,Somebody here just euthanize me please. I'm ready.,t3_gmlsuw,8
1589914827.0,2020-05-19,wallstreetbets,fr5ue9c,crazy how I can lose $1000 in literally like 2 seconds lol.,t3_gmlsuw,7
1589914924.0,2020-05-19,wallstreetbets,fr5ulql,"We mooned off of Moderna's vaccine trials, they just released data showing it wasn't as effective as claimed. Live by the vaccine news, die by the vaccine news. This cycle is getting exhaustingly predictable.",t3_gmlsuw,8
1589915553.0,2020-05-19,wallstreetbets,fr5vx6x,"🌈🐻: told you so market was gonna crash die bulls.

SPY back to 296 in 10 minutes 

🌈🐻: fake market manipulated!!!",t3_gmlsuw,8
1589915642.0,2020-05-19,wallstreetbets,fr5w3zl,"Damn, these V-shaped recoveries just getting shorter and shorter",t3_gmlsuw,8
1589916319.0,2020-05-19,wallstreetbets,fr5xiqc,SPY tried to kill itself and found a group of firefighters with a net below it so it bounced back to the top of the building and jumped off the other side where they weren't setup yet,t3_gmlsuw,9
1589916681.0,2020-05-19,wallstreetbets,fr5y9nh,"My TSLA put and my PTON put are both worth $183 it's adorable! But one I paid $250 for and one I paid $2,000 for",t3_gmlsuw,9
1589916917.0,2020-05-19,wallstreetbets,fr5yr9x,[deleted],t3_gmlsuw,8
1589916989.0,2020-05-19,wallstreetbets,fr5ywmt,"back to reality  

oh there goes gravity",t3_gmlsuw,8
1589917111.0,2020-05-19,wallstreetbets,fr5z5tp,No joke I bought calls for the first time since February at today’s top.,t3_gmlsuw,7
1589917228.0,2020-05-19,wallstreetbets,fr5zeim,Does the gecko say tomorrow is green or red,t3_gmlsuw,10
1589918677.0,2020-05-19,wallstreetbets,fr62bi7,"This whole market is a big pump and dump scam...

 [**Vaccine experts say Moderna didn’t produce data critical to assessing Covid-19 vaccine**](https://www.cnbc.com/2020/05/19/experts-say-moderna-didnt-produce-data-critical-to-assessing-vaccine.html)",t3_gmlsuw,8
1589918978.0,2020-05-19,wallstreetbets,fr62wwc,"perma-bear is retarded....but now, at the RIGHT TIME, you see why bears are bears, mad profits in seconds",t3_gmlsuw,8
1589919747.0,2020-05-19,wallstreetbets,fr64fy9,So let me get this straight: pump the market based on hype of a potential vaccine reported from 1 company....let retail fomo into stocks all day Monday and Tuesday....let the big boys dump end of day Tuesday to fuck everyone over. Damn well played market...can’t believe I fell for it.,t3_gmlsuw,7
1589920492.0,2020-05-19,wallstreetbets,fr65yia,I have a HUGE problem locking in profits. I always end up with no profit at all (sometimes in minus) even if I had been up all the way to 100%. Any help with this? I’m foggy and couldn’t think straight.,t3_gmlsuw,8
1589920603.0,2020-05-19,wallstreetbets,fr666nm,"Oh fuck, everyone here saying green tomorrow. That means bigly red, and I'm fucked again",t3_gmlsuw,7
1589921059.0,2020-05-19,wallstreetbets,fr673km,FB are you going to gap up tomorrow? do it for the boys,t3_gmlsuw,8
1589922844.0,2020-05-19,wallstreetbets,fr6amkt,Blew up my account again,t3_gmlsuw,8
1589922896.0,2020-05-19,wallstreetbets,fr6aq8r,Held onto my Moderna puts bby,t3_gmlsuw,8
1589936679.0,2020-05-19,wallstreetbets,fr6zw9k,So Monday is a holiday. We have 3 days off trading. Is it likely pump or dump Friday?,t3_gmlsuw,7
1589894639.0,2020-05-19,wallstreetbets,fr4q8sk,"Senate : powell ! Naughty boy come here


Powell : hehehe lol comin



Senate : brrr meme true?



Powell : hehehe lol yea


Senate : being naughty boy?



Powell : hehehehe lol


Senate : lol",t3_gmlsuw,37
1589883525.0,2020-05-19,wallstreetbets,fr4cb5c,"Now that the oil crisis is all but over & re-opening is right around the corner, I expect to see the S&P start outperforming the Nasdaq again",t3_gmlsuw,14
1589934433.0,2020-05-19,wallstreetbets,fr6w32d,"Love how people shit on Cali for being good for nothing wealthfare recipients, when it’s technically the capitalist capital of the world, pumping out the most GDP of any other region in the ENTIREEE muthafuckiiin world. I mean I don’t even live there, but enjoy the fruits of their creations, mostly brazzers",t3_gmlsuw,13
1589887737.0,2020-05-19,wallstreetbets,fr4grwc,"Any other former JD call holders looking for $ROPE after selling way too early after earnings?

Fml",t3_gmlsuw,7
1589890585.0,2020-05-19,wallstreetbets,fr4kabm,"people who stayed up this night, were bulls creaming themselves at 297 last night?",t3_gmlsuw,7
1589890832.0,2020-05-19,wallstreetbets,fr4km40,"My 130c WMT and CBDMD
Calls are printing todayyyy",t3_gmlsuw,6
1589890857.0,2020-05-19,wallstreetbets,fr4kna8,If I bought a call the entire market would prob tank just to spite me,t3_gmlsuw,8
1589891506.0,2020-05-19,wallstreetbets,fr4lit9,The stable side of me says we are looking at the historic bull trap but the clown world has beaten me down frens. This casino needs a therapist.,t3_gmlsuw,7
1589891839.0,2020-05-19,wallstreetbets,fr4lzj3,"We agree that economy will slowly recover. However the market hasnt priced in the fact the most small-mid business require sharp improvement or they will shutdown forever.
https://twitter.com/chigrl/status/1262720614944604160

Like restarant, if pace of recovery in diner comes to too slow, they still will shut the door forever.

so far I dont see consumers can come back like nothing happened. with unprecedent sales lost, there isnt many to reopen or stay open when this is settle.",t3_gmlsuw,7
1589892627.0,2020-05-19,wallstreetbets,fr4n4si,Which one of you retards gave the automod an award?,t3_gmlsuw,7
1589893415.0,2020-05-19,wallstreetbets,fr4obmf,If the Fed is at the Capitol who is going to press the buy button?,t3_gmlsuw,7
1589893970.0,2020-05-19,wallstreetbets,fr4p6kn,Going to the Goodwill to buy silver chains and melt them down into calls I guess,t3_gmlsuw,7
1589895154.0,2020-05-19,wallstreetbets,fr4r2s8,"SPY, where no level provides resistance, but all of them provide support.



Weeeeeeeeeeeeeeeeeeee",t3_gmlsuw,8
1589895532.0,2020-05-19,wallstreetbets,fr4rpg3,If SPY could just nose dive for 285,t3_gmlsuw,7
1589896063.0,2020-05-19,wallstreetbets,fr4smmp,It’s funny watching your account be in a constant tug of war with itself while holding both spy calls & puts,t3_gmlsuw,7
1589896305.0,2020-05-19,wallstreetbets,fr4t1pt,Guess today is one those “ reopening fears” days...,t3_gmlsuw,6
1589896754.0,2020-05-19,wallstreetbets,fr4tuhu,[deleted],t3_gmlsuw,7
1589897252.0,2020-05-19,wallstreetbets,fr4uqlj,Jpow left the printer in while he left for the Senate hearing,t3_gmlsuw,6
1589898426.0,2020-05-19,wallstreetbets,fr4wwzf,What are the chances mnunchin is wearing a skin suit and is actually not human at all,t3_gmlsuw,7
1589899979.0,2020-05-19,wallstreetbets,fr4zvc5,Imagine buying SRNE at 10. Many did.,t3_gmlsuw,7
1589901406.0,2020-05-19,wallstreetbets,fr52n0m,It’s so hard making back all the money I lost last month holy shit,t3_gmlsuw,7
1589901699.0,2020-05-19,wallstreetbets,fr537uf,VTIQ accounts for -520% of my RH account,t3_gmlsuw,8
1589902018.0,2020-05-19,wallstreetbets,fr53u8u,VTIQ baby is that you ?,t3_gmlsuw,8
1589902105.0,2020-05-19,wallstreetbets,fr540c9,Having over 20% of my portfolio uninvested makes me feel like a virgin,t3_gmlsuw,7
1589902118.0,2020-05-19,wallstreetbets,fr5417r,"God there’s some guy pumping GRPN on here, please do not fall for that shit boys",t3_gmlsuw,7
1589902218.0,2020-05-19,wallstreetbets,fr548fn,"“you are boosting your wall street buddies”

that sounds bullish to me",t3_gmlsuw,7
1589902347.0,2020-05-19,wallstreetbets,fr54hl8,"300 is a magnet

market wants to go there and everyone knows it",t3_gmlsuw,8
1589902875.0,2020-05-19,wallstreetbets,fr55j9d,**Mnuchin: Workers Who Refuse To Come Back To Work Will No Longer Qualify For Jobless Benefits**,t3_gmlsuw,7
1589902914.0,2020-05-19,wallstreetbets,fr55m2g,RTX finally 🚀🚀🚀,t3_gmlsuw,7
1589903156.0,2020-05-19,wallstreetbets,fr563h6,"If every dip gets bought, will there be any dips left in the future? Our children may never get to experience the dips",t3_gmlsuw,7
1589903988.0,2020-05-19,wallstreetbets,fr57rys,"Finally, my calls are red. I was getting nervous seeing them actually making money. Now I can rest easy!",t3_gmlsuw,7
1589904592.0,2020-05-19,wallstreetbets,fr58zg6,Watch Zucks announce: WE ARE THE NEW AMAZON FOR SMALL BUSINESSES.,t3_gmlsuw,7
1589905120.0,2020-05-19,wallstreetbets,fr5a2r0,These senators are so disconnected with reality.,t3_gmlsuw,7
1589905154.0,2020-05-19,wallstreetbets,fr5a576,FB announcing a new theme,t3_gmlsuw,7
1589905243.0,2020-05-19,wallstreetbets,fr5abvw,ZUCK JUST TOOK A DNA TEST TURNS OUT HES 100 PERCENT DOUGS DAD,t3_gmlsuw,8
1589905270.0,2020-05-19,wallstreetbets,fr5adve,[deleted],t3_gmlsuw,5
1589905625.0,2020-05-19,wallstreetbets,fr5b49x,**OPERATION WARP SPEED**,t3_gmlsuw,7
1589906197.0,2020-05-19,wallstreetbets,fr5cbax,"man, spy hangin onto 295 like a hungry babe on a warm wet teat",t3_gmlsuw,6
1589907410.0,2020-05-19,wallstreetbets,fr5euz6,nothing can convince me the Zucc isn't really a reptile,t3_gmlsuw,7
1589907431.0,2020-05-19,wallstreetbets,fr5ewlc,FB 🚀🚀🚀🚀🚀🚀,t3_gmlsuw,7
1589907435.0,2020-05-19,wallstreetbets,fr5ewwj,GREEN DILDO FB,t3_gmlsuw,7
1589907541.0,2020-05-19,wallstreetbets,fr5f515,IN ZUCK THE CUCK WE TRUST,t3_gmlsuw,7
1589907552.0,2020-05-19,wallstreetbets,fr5f5vf,holy fucking ZUCK!!,t3_gmlsuw,7
1589907928.0,2020-05-19,wallstreetbets,fr5fyrt,Name a more punchable face than Zuckberg's,t3_gmlsuw,7
1589908092.0,2020-05-19,wallstreetbets,fr5gb41,Zuck says TSLA price too high imo,t3_gmlsuw,6
1589908510.0,2020-05-19,wallstreetbets,fr5h78j,"Whoever posted the FB news, thanks, printing on a call I bought 20 minutes ago.",t3_gmlsuw,7
1589908795.0,2020-05-19,wallstreetbets,fr5hth8,Fb today feels like one of the first plays all WSB has been united on,t3_gmlsuw,7
1589908814.0,2020-05-19,wallstreetbets,fr5hv09,FB offsetting my SPY puts coooool,t3_gmlsuw,8
1589909224.0,2020-05-19,wallstreetbets,fr5ir01,Zuck just turned my very red day into a very very green one. Thanks alien overlord,t3_gmlsuw,8
1589909410.0,2020-05-19,wallstreetbets,fr5j5bw,5k in 2 mins on SHOP calls,t3_gmlsuw,8
1589910991.0,2020-05-19,wallstreetbets,fr5mgs5,Big shouts to that $HUYA autist,t3_gmlsuw,6
1589911270.0,2020-05-19,wallstreetbets,fr5n1n3,[deleted],t3_gmlsuw,6
1589911547.0,2020-05-19,wallstreetbets,fr5nlmp,Already down 50% on my fb calls 🤣🤣🤣🤣,t3_gmlsuw,8
1589912012.0,2020-05-19,wallstreetbets,fr5ojzz,Can’t bring myself to buy calls at these prices...,t3_gmlsuw,7
1589912734.0,2020-05-19,wallstreetbets,fr5q1et," [https://twitter.com/SamRo/status/1262810736557821952](https://twitter.com/SamRo/status/1262810736557821952) 

we have achieved peak retardation, i am declaring the virus officially over",t3_gmlsuw,6
1589913220.0,2020-05-19,wallstreetbets,fr5r1us,VXX calls somethings gonna happen I can feel it,t3_gmlsuw,6
1589913774.0,2020-05-19,wallstreetbets,fr5s7bv,Today's volume 🤮,t3_gmlsuw,6
1589914465.0,2020-05-19,wallstreetbets,fr5tmqv,"It’s okay HUYA, take a little break, you have a lot of mooning still left to do",t3_gmlsuw,7
1589914848.0,2020-05-19,wallstreetbets,fr5ufyo,"For the bulls not understanding what's happening, this was a fake rally based on algos buying up everything cheap overnight, in a single day. You'd have to be truly autistic buying calls at the literal top.",t3_gmlsuw,6
1589915079.0,2020-05-19,wallstreetbets,fr5uxc0,NEWS IS THAT MODERNA VACCINE NOT WORKING AS EXPECTED,t3_gmlsuw,8
1589915127.0,2020-05-19,wallstreetbets,fr5v0y5,"3% pump on fake vaccine news

0.2% drop when it is bullshit",t3_gmlsuw,7
1589915143.0,2020-05-19,wallstreetbets,fr5v25b,my whole portfolio just took a beating within like a 2 minute window,t3_gmlsuw,8
1589915181.0,2020-05-19,wallstreetbets,fr5v4wb,"Sometimes I have to tell myself that doing nothing, is in fact an action.",t3_gmlsuw,8
1589915384.0,2020-05-19,wallstreetbets,fr5vkdk,"Someone invite this poor lost soul to WSBs 


https://www.reddit.com/r/stocks/comments/gmuyoy/i_have_6000_luckin_coffee_shares_what_the_hell/?utm_source=share&utm_medium=ios_app&utm_name=iossmf",t3_gmlsuw,8
1589915455.0,2020-05-19,wallstreetbets,fr5vpsl,[deleted],t3_gmlsuw,7
1589915488.0,2020-05-19,wallstreetbets,fr5vsam,"i think this rally makes total sense. 50M jobless people buy tons of knick knacks on shopify and amazon, ride $4k peloton bikes to stay fit, go on vacations, do home improvement projects, and host cloud services in microsoft azure",t3_gmlsuw,7
1589915537.0,2020-05-19,wallstreetbets,fr5vvxm,The nice thing about not checking your phone is that whenever we have a drop like that you completely miss it and so you don’t even have the opportunity to sell for a loss before it recovers.,t3_gmlsuw,7
1589915543.0,2020-05-19,wallstreetbets,fr5vwf0,lmao quickest V in the west,t3_gmlsuw,6
1589915567.0,2020-05-19,wallstreetbets,fr5vy8z,This is literally fucking retarded.,t3_gmlsuw,6
1589915596.0,2020-05-19,wallstreetbets,fr5w0h5,Spy trading like some backpage crypto,t3_gmlsuw,6
1589915777.0,2020-05-19,wallstreetbets,fr5we5x,There it is on CNBC about Moderna explaining the dip,t3_gmlsuw,8
1589915853.0,2020-05-19,wallstreetbets,fr5wjse,[deleted],t3_gmlsuw,7
1589915918.0,2020-05-19,wallstreetbets,fr5wolm,"I’ll be old and gray before I work this 7k into 25k so I can finally day trade

If I deposit 25k it’ll disappear like Houdini",t3_gmlsuw,6
1589916086.0,2020-05-19,wallstreetbets,fr5x16o,This is the wildest shit I've seen in ~~years~~ ~~months~~ ~~weeks~~ honestly just a few days,t3_gmlsuw,7
1589916153.0,2020-05-19,wallstreetbets,fr5x67g,[deleted],t3_gmlsuw,7
1589916154.0,2020-05-19,wallstreetbets,fr5x6ak,[deleted],t3_gmlsuw,7
1589916241.0,2020-05-19,wallstreetbets,fr5xcqz,"BREAKING: Peloton has not just released a statement saying they have made a breakthrough for their preliminary phase 1 therapeutic treatment of COVID-19...  


...what's that Steve? My producer Steve is now telling me that its being reported that heavy doses of vitamin McD's is seeing tremendous success and also that Bank of America and Blue Apron are also reporting huge breakthroughs for a cure.  


/satire",t3_gmlsuw,6
1589916287.0,2020-05-19,wallstreetbets,fr5xgan,Calls negative puts negative. Classic.,t3_gmlsuw,7
1589916307.0,2020-05-19,wallstreetbets,fr5xhre,Drilldos have arrived.,t3_gmlsuw,9
1589916583.0,2020-05-19,wallstreetbets,fr5y2bs,">Mnuchin said his department would accept losses from any Fed loans that would come out of that $454 billion. Mnuchin had previously said that the administration expected to recover all those funds. That observation had raised concerns that the Fed would adopt a cautious approach that would provide less financial support. 

Remember when they first started QE in 2008 and they said it's fine because it'll be paid back once we're through the crisis. Then we got through the crisis and surprise surprise, not only was it never paid back but the QE never even ended. Same bullshit different day.",t3_gmlsuw,8
1589917687.0,2020-05-19,wallstreetbets,fr60c2z,[deleted],t3_gmlsuw,6
1589917703.0,2020-05-19,wallstreetbets,fr60d9s,[deleted],t3_gmlsuw,8
1589917999.0,2020-05-19,wallstreetbets,fr60yxg,You know you're getting fucked when the chart starts shifting up to make room for more red dildos.,t3_gmlsuw,6
1589918185.0,2020-05-19,wallstreetbets,fr61cc2,CEO of SPY just came on and said that the price is too high in his opinion.,t3_gmlsuw,6
1589918294.0,2020-05-19,wallstreetbets,fr61k99,"Up at 280
Down at 293

Rinse and repeat",t3_gmlsuw,7
1589918307.0,2020-05-19,wallstreetbets,fr61l8b,God I'm glad I don't use margin. I'm already so fucked.,t3_gmlsuw,6
1589918499.0,2020-05-19,wallstreetbets,fr61yuv,"Went from up 1.09k at 2:50pm to up $9.49 by 4pm

lol",t3_gmlsuw,7
1589918504.0,2020-05-19,wallstreetbets,fr61z8t,"I can see the headline now

DOW SLIDES NEARLY 400 POINTS AS HOPE IN VACCINE FADES",t3_gmlsuw,6
1589918519.0,2020-05-19,wallstreetbets,fr6208u,"Me at 3pm: ""There's no way it drills to end the day again""

Somehow, I still manage to have a surprised pikachu face every fucking time.",t3_gmlsuw,7
1589918579.0,2020-05-19,wallstreetbets,fr624l7,"Holy fuck what a rollercoaster, I had $20k tied up in BYND puts that were down 50% at one point today.

I fucked held them close to my heart and sold at 3:59 for a fucking PROFIT",t3_gmlsuw,7
1589918980.0,2020-05-19,wallstreetbets,fr62x1w,"And it continues, price action between 2700-3000 is just noise. Wouldn't be surprised if 3 months from now, we're still fucking around in this range. It's been 5 weeks already.",t3_gmlsuw,6
1589919042.0,2020-05-19,wallstreetbets,fr631ey,Small recovery porn 4k to 2k back to 4k in a month - https://imgur.com/a/rEDcL5X,t3_gmlsuw,7
1589920037.0,2020-05-19,wallstreetbets,fr6516l,"hehha..  I'm sure my fellow fucking retards did this..

[http://www.opricot.com/ticker/spy/optiongraphs](http://www.opricot.com/ticker/spy/optiongraphs)

select the 01/2021 timeframe.

goddamn puts all the way down to 20, and calls up to 420.     I'd guess somewhat bearish.",t3_gmlsuw,8
1589920975.0,2020-05-19,wallstreetbets,fr66xg3,Too much power few pharmaceuticals have over the movement of the whole stock market. Such scams,t3_gmlsuw,8
1589893281.0,2020-05-19,wallstreetbets,fr4o46c,[deleted],t3_gmlsuw,20
1589887673.0,2020-05-19,wallstreetbets,fr4gp8t,Really need to block this nigga with multiple accounts spamming vbiv,t3_gmlsuw,12
