created,date,subreddit,id,body,parent_id,score
1597246715.0,2020-08-12,wallstreetbets,g181mn5,If spy closes down 1% today i will get a wsb tattoo. Screenshot this,t3_i8b56i,12
1597247145.0,2020-08-12,wallstreetbets,g182iny,who is still holding rkt? lol i am,t3_i8b56i,12
1597252990.0,2020-08-12,wallstreetbets,g18fmu5,"Wow... AMD just climbing steadily, unbelievable",t3_i8b56i,12
1597253240.0,2020-08-12,wallstreetbets,g18g7pl,"I usually ask my generous retired father to do my taxes, but now I can’t next year otherwise I’d have to explain to him that I got IV crushed by corn and had to sell my cobtracts at a loss",t3_i8b56i,13
1597256033.0,2020-08-12,wallstreetbets,g18mqas,Up 500% on TSLA on calls I bought at fucking 9:45 🥳,t3_i8b56i,12
1597256307.0,2020-08-12,wallstreetbets,g18ncge,Just cut off my fucking gay bear hands so I never buy puts again,t3_i8b56i,12
1597257135.0,2020-08-12,wallstreetbets,g18p9pq,"The US government has $465,000 in liability per citizen. 🤣",t3_i8b56i,12
1597257146.0,2020-08-12,wallstreetbets,g18panb,TSLA is doing a buy 1 get 4. who doesn't like that?,t3_i8b56i,12
1597258083.0,2020-08-12,wallstreetbets,g18rg1z,"Sold most of my positions today at my new ATH (+250% ytd), learning to take profits and not get greedy has been the hardest lesson to learn.",t3_i8b56i,12
1597259167.0,2020-08-12,wallstreetbets,g18txbr,Bull flag on tsla this is it boys,t3_i8b56i,12
1597259918.0,2020-08-12,wallstreetbets,g18vkbu,98% loss on portfolio today. GG bulls you win,t3_i8b56i,13
1597260270.0,2020-08-12,wallstreetbets,g18wbke,its astounding how bad i am at this,t3_i8b56i,11
1597260444.0,2020-08-12,wallstreetbets,g18wpcc,"Took a sizeable position in gold and silver today. They fell off a cliff yesterday solely because the CME raised the margin requirements for Comex Futures 6.9% and 15.2%, respectively.

My theory was that the selloff was because traders needed to cut their position sizes to make the new margin requirement, which means the drop is temporary until people wire more money in. 

Less of a future outlook on gold and silver and more of a temporary externality for new account requirements. 

Future outlook remains unchanged. Inflation is definitely going up, the dollar is definitely going down and times are tough, so I see GLD and AGQ continuing their run for the time being 👍🏻",t3_i8b56i,12
1597261024.0,2020-08-12,wallstreetbets,g18xymr,"I wonder who saw 338.28 and thought to themselves.

This is it. I've waited long enough.",t3_i8b56i,12
1597261079.0,2020-08-12,wallstreetbets,g18y2ws,"90% cash now 

This market is officially too autistic for my taste",t3_i8b56i,12
1597261896.0,2020-08-12,wallstreetbets,g18ztsz,Thanks Biden for the gains today ❤️,t3_i8b56i,12
1597262606.0,2020-08-12,wallstreetbets,g191cqg,TSLA $1700+ tomorrow tbh,t3_i8b56i,14
1597228587.0,2020-08-12,wallstreetbets,g179e4s,Seems like I get out of one bag holding situation and then jump right back into another,t3_i8b56i,26
1597229200.0,2020-08-12,wallstreetbets,g17a1bt,Got drunk last night thinking I was going to lose the remainder of my money. Now I have to go to work hungover for no reason.,t3_i8b56i,27
1597232983.0,2020-08-12,wallstreetbets,g17ecsz,Good morning to everyone except the 🌈🐻,t3_i8b56i,27
1597233486.0,2020-08-12,wallstreetbets,g17ezij,"Sold my spy calls at a loss yesterday at the bottom, then swapped for puts which are going to get decimated at open.
This is the way",t3_i8b56i,26
1597243817.0,2020-08-12,wallstreetbets,g17vvf4, This is probably the worst mobile game I’ve ever downloaded,t3_i8b56i,26
1597256493.0,2020-08-12,wallstreetbets,g18ns3y,7000% on my TSLA call today,t3_i8b56i,25
1597259980.0,2020-08-12,wallstreetbets,g18vp8d,ALL TIME HIGHS IN THE MIDDLE OF A PANDEMIC GOOD JOB YOU FUCKING IDIOTS,t3_i8b56i,24
1597253047.0,2020-08-12,wallstreetbets,g18fri0,"Another day, another 0 matches on tinder.",t3_i8b56i,21
1597253985.0,2020-08-12,wallstreetbets,g18hypm,"No more buying power today, positions closed at +$38.00 😎

Only $9,962.00 left to earn back to break even",t3_i8b56i,22
1597230513.0,2020-08-12,wallstreetbets,g17bg6l,I’m so fukd at open,t3_i8b56i,12
1597230877.0,2020-08-12,wallstreetbets,g17bun4,SLV up 3% pre market. I can almost afford the fancy can of beans this week,t3_i8b56i,12
1597235580.0,2020-08-12,wallstreetbets,g17hub6,# I MISS MSFT AT 213+,t3_i8b56i,11
1597238383.0,2020-08-12,wallstreetbets,g17m3xx,"APPL with the pre cum, time to stay rock hard Timmy boy 🍎🍎🍆",t3_i8b56i,11
1597238847.0,2020-08-12,wallstreetbets,g17mv2g,"is corn similar to oil, in which you're responsible for storing it? Lovin the prospect of a farmer rolling up on his tractor and dumping 30 bushels of corn on my driveway",t3_i8b56i,11
1597241528.0,2020-08-12,wallstreetbets,g17rjz4,"Woohoo!! The markets dropping to zero!!!

Oh shit that's my account, nvm...",t3_i8b56i,11
1597242534.0,2020-08-12,wallstreetbets,g17tfik,"if u sold your tech calls this week



you’re weak",t3_i8b56i,10
1597242655.0,2020-08-12,wallstreetbets,g17tnou,Lol this market is beyond retarded,t3_i8b56i,12
1597243868.0,2020-08-12,wallstreetbets,g17vyt0,[deleted],t3_i8b56i,11
1597244460.0,2020-08-12,wallstreetbets,g17x47z,"KAMALA Is from California, Apple is from California. It all makes sense.

$500 EOW confirmed. Flair as DD",t3_i8b56i,11
1597247250.0,2020-08-12,wallstreetbets,g182qin,"Today's return: 92% 

total return: 4% 

paper hands: ✔️😎 

I'm available for coaching if anyone wants to learn how to secure these MF bags",t3_i8b56i,10
1597247314.0,2020-08-12,wallstreetbets,g182v8q,AAPL 500?,t3_i8b56i,11
1597247927.0,2020-08-12,wallstreetbets,g1845ho,SPY really is gonna melt right along ATH isn’t it.  What gets us through?   Maybe Kazakhstan vaccine news?   Greatest country.,t3_i8b56i,12
1597248158.0,2020-08-12,wallstreetbets,g184mfy,COB MOB!!!,t3_i8b56i,12
1597249556.0,2020-08-12,wallstreetbets,g187s9k,I bought SPY 336p so ATH EOD,t3_i8b56i,11
1597249981.0,2020-08-12,wallstreetbets,g188rsd,"So basically we go like this:

Tech for a week

Travel / Finance for three days

Repeat",t3_i8b56i,11
1597250191.0,2020-08-12,wallstreetbets,g18997f,I'm in calls... But gotta admit a rug pull would be hilarious,t3_i8b56i,11
1597250670.0,2020-08-12,wallstreetbets,g18acny,joe biden tried to tell us about the corn pop,t3_i8b56i,11
1597251591.0,2020-08-12,wallstreetbets,g18cf6r,Everything I touch turns to shit,t3_i8b56i,12
1597251614.0,2020-08-12,wallstreetbets,g18ch0w,Being a 🌈 🐻 for tomorrow. This low volume shit seems fishy,t3_i8b56i,11
1597251682.0,2020-08-12,wallstreetbets,g18cmpb,BUY TSLA people,t3_i8b56i,10
1597253309.0,2020-08-12,wallstreetbets,g18gdkp,How AMZN is still hovering around 3150 is fucking beyond me. It needs to be at 4000 to make sense given rest of the market,t3_i8b56i,11
1597253593.0,2020-08-12,wallstreetbets,g18h1na,Would be cute if it didn't dump again,t3_i8b56i,11
1597253870.0,2020-08-12,wallstreetbets,g18hoy9,"""Tesla adds 30 billion to its market cap as investors are thrilled that Robinhood users will now be able to afford one share.""",t3_i8b56i,12
1597254829.0,2020-08-12,wallstreetbets,g18jytc,SPY mere inches away from a double top. Get ready to unload everything you own,t3_i8b56i,11
1597255585.0,2020-08-12,wallstreetbets,g18loxb,SLV calls are free money,t3_i8b56i,11
1597255704.0,2020-08-12,wallstreetbets,g18lysr,"“No sign of stimulus deal in sight as Pelosi says Dems, White House ‘miles apart’”


https://www.cnbc.com/2020/08/12/coronavirus-stimulus-news-pelosi-says-dems-and-white-house-are-miles-apart.html


stonks:  so? 😩👌",t3_i8b56i,11
1597255797.0,2020-08-12,wallstreetbets,g18m6if,338 puts loaded. Couldn't help myself,t3_i8b56i,11
1597256223.0,2020-08-12,wallstreetbets,g18n5se,"TSLA 1500c 8/14 at close yesterday was worth $202
 
It is now worth $7,800",t3_i8b56i,10
1597256432.0,2020-08-12,wallstreetbets,g18nmzo,"Fuck man. Left a good amount of money on the table with TSLA. Been burned too many times to not lock in a profit though. Welp see ya tomorrow fellas, best of luck 🐃",t3_i8b56i,11
1597257190.0,2020-08-12,wallstreetbets,g18pe6a,Bought TSLA at the top AMA,t3_i8b56i,11
1597258077.0,2020-08-12,wallstreetbets,g18rfma,"i have been buying weeklies on TSLA, and I have lost at least 5k.  The only week I didn't do it, it has a fucking $200 dollar jump. 
Fuck I hate the market",t3_i8b56i,13
1597258120.0,2020-08-12,wallstreetbets,g18rj5h,"I'm sitting at my desk, trading, watching hockey, and eating beef jerky.  I've done no work today.  What is wrong with me",t3_i8b56i,11
1597258252.0,2020-08-12,wallstreetbets,g18ru22,I’m not looking at my portfolio for all of power hour fuck it. Tech calls overnight,t3_i8b56i,9
1597258816.0,2020-08-12,wallstreetbets,g18t4dn,"Gold dipping, EOD pullback in coming",t3_i8b56i,11
1597259668.0,2020-08-12,wallstreetbets,g18v0z7,What really grinds my gears is when stock media calls us dUmB mOnEy. I may be retarded but stop acting like y’all know shit or any professional knows everything.  Reality check they don’t no shit,t3_i8b56i,10
1597259995.0,2020-08-12,wallstreetbets,g18vqem,If someone told you back in March that we'd be back at ATH's by August would you believe them?,t3_i8b56i,11
1597260033.0,2020-08-12,wallstreetbets,g18vtcd,I mean it’s just fucking funny at this point,t3_i8b56i,10
1597260158.0,2020-08-12,wallstreetbets,g18w31t,What an epic bear trap yesterday,t3_i8b56i,11
1597261045.0,2020-08-12,wallstreetbets,g18y08h,Day trading is the only way to make money here. Fuck this bs,t3_i8b56i,11
1597261431.0,2020-08-12,wallstreetbets,g18ytov,Too many expecting rug pull. Therefore we're blasting through ATHs,t3_i8b56i,13
1597261913.0,2020-08-12,wallstreetbets,g18zv79,Given that there is an unlimited amount of money to bail out Wall Street one must assume that poverty in society is a choice by policy makers for it could partially be eliminated with a spare trillion dollars.,t3_i8b56i,11
1597262516.0,2020-08-12,wallstreetbets,g1915w7,"well, tomorrow is the day.. PRPL will decide fate of hundreds of people here",t3_i8b56i,11
1597232007.0,2020-08-12,wallstreetbets,g17d5vs,"I should have never started ""trading"" options. I'm an idiot down to his last 500 bucks after starting this month with around 8k. Like, I'm just getting baked every day and losing money. I need a play. I need to either go out in a blaze of glory or start my miraculous comeback towards yachts and thotz. 

Blessings upon your tendiez, bois.",t3_i8b56i,39
1597255567.0,2020-08-12,wallstreetbets,g18lnk7,"Biggest bull rally of our lifetime over the past six months and I managed to make $6.6k. Yep, wage slave forever here.",t3_i8b56i,20
1597234813.0,2020-08-12,wallstreetbets,g17grfq,My mom was poor. My dad also came from a poor family. But I identify as a billionaire.,t3_i8b56i,21
1597238202.0,2020-08-12,wallstreetbets,g17ltce,"**HARAMBE DIDN'T SACRIFICE HIMSELF SO YOU COULD LOSE MONEY. I NEED YOU TO FOCUS, FAGGOTS. GRAB YOU WATER AND STAY HYDRATED.**  

*I'm preheating this 🍞 again. Will be ready in 15 minutes. Put your adult diapers on! We're eating or shitting ourselves today.*  

**LET'S FUCKING GET IT!!**",t3_i8b56i,21
1597259265.0,2020-08-12,wallstreetbets,g18u5ej,I put 50% of my portfolio into tsla puts at open today 🤡,t3_i8b56i,20
1597230520.0,2020-08-12,wallstreetbets,g17bgg1,I'm either feasting on steak and lobster or trying to make 1 single can of beans last a whole month.  I fucking love stock trading and I hate salads!,t3_i8b56i,10
1597233082.0,2020-08-12,wallstreetbets,g17eh48,"Good morning, WSB",t3_i8b56i,10
1597234034.0,2020-08-12,wallstreetbets,g17fpac,I hate bears,t3_i8b56i,10
1597234430.0,2020-08-12,wallstreetbets,g17g8fy,"Feds printing so much we got a global ink shortage.  

Brrrrrrrrr",t3_i8b56i,10
1597234590.0,2020-08-12,wallstreetbets,g17ggam,"SLV moves so violently.  I literally just watched it move down more than 1 percent, in a single click.",t3_i8b56i,11
1597235678.0,2020-08-12,wallstreetbets,g17hz5o,"CPI data is out. Inflation for July:

Consumer price index food & energy MoM: 0.6% reported vs 0.2% expected

Consumer price index food & energy YoY: 1.6% reported vs 1.1% expected",t3_i8b56i,10
1597235739.0,2020-08-12,wallstreetbets,g17i298,"Hey fabulous gents, I need someone to go halfsies with me until the government stimulates me further. I'm sending wedding invitations out to the top 1,200 wealthy families in the world.  They usually just send a nice gift or check. I don't expect anyone to show up due to Covid-19 but just in case.... Any takers? We might have to actually get married.",t3_i8b56i,9
1597236827.0,2020-08-12,wallstreetbets,g17jnx6,"Lets go silver, move that sexy ass baby",t3_i8b56i,10
1597236893.0,2020-08-12,wallstreetbets,g17jrl1,[deleted],t3_i8b56i,8
1597238166.0,2020-08-12,wallstreetbets,g17lr92,"Hopefully BA releases a ton of new early August plane cancellations soon so it can continue it's uptrend and break 190. ""Can't lose money if you're not making planes"" -market autists",t3_i8b56i,10
1597238190.0,2020-08-12,wallstreetbets,g17lsmt,"That is how you do it, SLV.  Now, we're talking.",t3_i8b56i,11
1597238561.0,2020-08-12,wallstreetbets,g17mebg,the tsla run today will be a meme we'll be sharing with our grandkids,t3_i8b56i,10
1597238628.0,2020-08-12,wallstreetbets,g17mi6l,may TSLA jump to $1600 today amen,t3_i8b56i,11
1597239239.0,2020-08-12,wallstreetbets,g17nipi,[deleted],t3_i8b56i,10
1597239475.0,2020-08-12,wallstreetbets,g17nwzs,"SPY down 1% - up $3500

SPY up 1% - down $5000

🙃",t3_i8b56i,10
1597241422.0,2020-08-12,wallstreetbets,g17rcxg,Apple go up idiot,t3_i8b56i,11
1597241434.0,2020-08-12,wallstreetbets,g17rdox,HOW THE FUCK DID WE OPEN UP THIS MUCH,t3_i8b56i,10
1597241536.0,2020-08-12,wallstreetbets,g17rkg0,"I’m not buying shit, market is on super hard crack mode",t3_i8b56i,10
1597242078.0,2020-08-12,wallstreetbets,g17skh4,Let’s goo AAPL we wanna see 455 eod,t3_i8b56i,10
1597243228.0,2020-08-12,wallstreetbets,g17uql8,Where my retarded TSLA gang at,t3_i8b56i,10
1597244002.0,2020-08-12,wallstreetbets,g17w83l,AAPL to the moon🌙🌙🌙🌙,t3_i8b56i,8
1597244315.0,2020-08-12,wallstreetbets,g17wu1q,"Yesterday? 

I lost 8k

Today? 

I made $97

You know what that means? 

Tendies for dinner

just tendies, nothing else, no breakfast either, or lunch

i always wanted to have an excuse to diet...and now i can!",t3_i8b56i,10
1597244526.0,2020-08-12,wallstreetbets,g17x8vz,I wanna become an Algo.  Anyone know of a good hormone therapy doctor?,t3_i8b56i,10
1597246606.0,2020-08-12,wallstreetbets,g181er6,Aapl going to the mooon,t3_i8b56i,10
1597247399.0,2020-08-12,wallstreetbets,g1831o4,"Russian Covid Patients 🤝 My TSLA Calls

                      Getting cucked by IV",t3_i8b56i,10
1597247737.0,2020-08-12,wallstreetbets,g183r2q,[deleted],t3_i8b56i,11
1597248751.0,2020-08-12,wallstreetbets,g185wsy,"IMAGINE SELLING SLV. WE IN THIS SILVER GANG, MOON MISSION TIME 🚀🚀🚀🥈🥈🥈🥈",t3_i8b56i,11
1597248813.0,2020-08-12,wallstreetbets,g1861v0,Rip anyone who dumped tech for travel,t3_i8b56i,10
1597248967.0,2020-08-12,wallstreetbets,g186ej5,$AAPL GOING VERTICAL,t3_i8b56i,11
1597248986.0,2020-08-12,wallstreetbets,g186g3v,"Down 16k for the year because of options.

I would love to break even before the year is done. Made a lot of wrong moves and jumped on trends too late. Oof

I need some plays.",t3_i8b56i,11
1597249319.0,2020-08-12,wallstreetbets,g18788o,[deleted],t3_i8b56i,10
1597250333.0,2020-08-12,wallstreetbets,g189kwd,"""You Are About To Witness The Strength of Street Knowledge"" Straight Outta Compton by Tim Apple",t3_i8b56i,10
1597250343.0,2020-08-12,wallstreetbets,g189lrj,"That’s it SPY is gonna crash, just bought calls",t3_i8b56i,10
1597250977.0,2020-08-12,wallstreetbets,g18b1y2,[deleted],t3_i8b56i,11
1597253277.0,2020-08-12,wallstreetbets,g18gb0b,"What the fuck is up with this market.  10 yr yield tanking, dollar weakening, printing more money, inflation up.  SILVER FUCKING TANKING??????",t3_i8b56i,12
1597253646.0,2020-08-12,wallstreetbets,g18h63o,"Market: at ATHs

VIX: off its low for the day

Bonds: At highs for the day

Traders: Let's buy more!",t3_i8b56i,10
1597254013.0,2020-08-12,wallstreetbets,g18i13l,Sold my Tesla 1585c yesterday for a loss I need fuckin brain surgery,t3_i8b56i,10
1597254199.0,2020-08-12,wallstreetbets,g18igst,[deleted],t3_i8b56i,11
1597254289.0,2020-08-12,wallstreetbets,g18ioko,I bought TSLA calls on margin this morning and that is the smartest and most responsible thing ive done this month.,t3_i8b56i,10
1597254493.0,2020-08-12,wallstreetbets,g18j692,I’m feeling a big fat sell off at 3:30,t3_i8b56i,10
1597254857.0,2020-08-12,wallstreetbets,g18k196,"Not even joking people buying TSLA stock thinking that their money will quintuple. 

People actually think that after split their money will multiply!",t3_i8b56i,9
1597254996.0,2020-08-12,wallstreetbets,g18kcgk,Imagine selling your TSLA $1500 calls this morning. 😂Oh..wait. 😒,t3_i8b56i,12
1597255062.0,2020-08-12,wallstreetbets,g18khpw,Holy fuck I sold TSLA 1670 calls for $43 two days ago wow,t3_i8b56i,10
1597255314.0,2020-08-12,wallstreetbets,g18l2st,i'M LITERALLY GONNA GO BUY A TESLA RIGHT FUCKING NOW. I KNEW ELON HAD IT IN HIM!!!!!,t3_i8b56i,10
1597255413.0,2020-08-12,wallstreetbets,g18lazu,"Everyones making money and i bought RKT today like an absolute moron, what the fuck is wrong with me",t3_i8b56i,11
1597255551.0,2020-08-12,wallstreetbets,g18lm7p," https://twitter.com/FirstSquawk/status/1293608868233191426?s=20 

 U.S MONTHLY BUDGET STATEMENT (JUL) ACTUAL: -63.0B VS 119.7B PREVIOUS; EST 90.0B 

 Oops, off by $153B",t3_i8b56i,10
1597255597.0,2020-08-12,wallstreetbets,g18lpyw,i just bought in to tsla good luck guys,t3_i8b56i,12
1597255620.0,2020-08-12,wallstreetbets,g18lrue,AAPL please bust past 453,t3_i8b56i,9
1597255676.0,2020-08-12,wallstreetbets,g18lwey,brb Killing myself by suffocating myself in my stupid PRPL mattress instead of buying TSLA,t3_i8b56i,10
1597255795.0,2020-08-12,wallstreetbets,g18m6am,Just dump the fuckin markets already and stop rubbing my balls !!!,t3_i8b56i,11
1597256113.0,2020-08-12,wallstreetbets,g18mwvj,"Trevor Milton: I'm going to out-Elon Elon

Elon Musk: gg garbage truck boi",t3_i8b56i,12
1597256227.0,2020-08-12,wallstreetbets,g18n62t,Bought SPY 335p instead of TSLA 1700c this morning 🤡🤡🤡🤡🤡,t3_i8b56i,10
1597256440.0,2020-08-12,wallstreetbets,g18nno4,this is wild. I was FOMO'ing for not buying more Tesla calls. So I figured fucking it we may be at the top but I've made enough on my first one that I can toss a little more in. Made $1k in 3.5 seconds.,t3_i8b56i,11
1597256535.0,2020-08-12,wallstreetbets,g18nvmr,[deleted],t3_i8b56i,10
1597256557.0,2020-08-12,wallstreetbets,g18nxgu,Can’t wait for all the TSLA gain porn.,t3_i8b56i,9
1597256733.0,2020-08-12,wallstreetbets,g18obwy,"Jesus fucking Christ, I expected TSLA to go up but FIFTEEN FUCKING PERCENT?!",t3_i8b56i,11
1597256738.0,2020-08-12,wallstreetbets,g18ocdd,"alright i want to see some really sick TSLA gain porns.

seriously.

some of these OTM shit are up 7,000%

you could buy 1,600c anytime today before 1pm and you'd be up bigly right now too. i know, cuz i kept selling it and kept watching it moon",t3_i8b56i,9
1597256936.0,2020-08-12,wallstreetbets,g18ot2z,One of these days I will have big enough balls to buy Tesla calls/puts,t3_i8b56i,11
1597256950.0,2020-08-12,wallstreetbets,g18ou8m,Sold my tsla 1500 calls at 26 yesterday and I thought I had it good because I sold it in the highs.. fuck me it's 114 now,t3_i8b56i,9
1597257487.0,2020-08-12,wallstreetbets,g18q2yj,"AAPL, TSLA, AMD, NVDA thank you for your service. SQ you can go sit in the corner",t3_i8b56i,11
1597257681.0,2020-08-12,wallstreetbets,g18qirf,[deleted],t3_i8b56i,9
1597257763.0,2020-08-12,wallstreetbets,g18qpew,ᴮᵉᵃʳ ᶜᵃʳᵉᶠᵘˡˡʸ ᵖᵉᵉᵏˢ ᵒᵘᵗ ᵒᶠ ʰⁱˢ ᶜᵃᵛᵉ,t3_i8b56i,10
1597257836.0,2020-08-12,wallstreetbets,g18qvhr,"If bezos splits the stock he'll get called out for pumping and raising his net worth 

Watch",t3_i8b56i,12
1597258210.0,2020-08-12,wallstreetbets,g18rqnr,First time trading Tesla FD’s. I feel alive again,t3_i8b56i,10
1597258385.0,2020-08-12,wallstreetbets,g18s55l,"TSLA OTM shit just casually up 5,000% nbd",t3_i8b56i,9
1597258801.0,2020-08-12,wallstreetbets,g18t36i,Time to crack a beer and watch my money vaporize.,t3_i8b56i,8
1597259959.0,2020-08-12,wallstreetbets,g18vnk4,"Just as we all expected. 10% unemployment, -GDP, and ATH for the S&P. Only a fool would be surprised.",t3_i8b56i,11
1597260016.0,2020-08-12,wallstreetbets,g18vs2y,"Boys I hope you all realize we are living through history right now.

Two weeks ago we released that the US GDP contracted 32.9% in Q2. 

Today we’re possibly closing at an ATH for S&P.

In conclusion stock market != Economy and the market is in a bubble. Tread carefully.",t3_i8b56i,11
1597260378.0,2020-08-12,wallstreetbets,g18wk49,I'm gonna be a bear for tomorrow,t3_i8b56i,11
1597260448.0,2020-08-12,wallstreetbets,g18wpkq,"Man so yesterday I had my last 1k to throw away. . .I said ""SPY puts"" or ""TSLA calls"" and flipped a coin.  

SPY puts it is. was up 250% EOD was hoping for a bigger dump today. . .but now I'm down 60% and if the fucking coin had landed on TSLA calls I would've had 40k!  

My luck is just the fucking best.",t3_i8b56i,9
1597261141.0,2020-08-12,wallstreetbets,g18y7m9,Am I the only one who found a way to lose $100+ on the greenest day I’ve seen in a while? Lol,t3_i8b56i,8
1597261163.0,2020-08-12,wallstreetbets,g18y989,Can anyone else smell the SPY dump coming?,t3_i8b56i,9
1597261171.0,2020-08-12,wallstreetbets,g18y9vy,#Pussies get slaughtered,t3_i8b56i,10
1597262111.0,2020-08-12,wallstreetbets,g190aha,Somehow managed to lose $2k on TSLA on a fucking 12% day by inopportune timing / weak hands.  Goddamn it.,t3_i8b56i,12
1597262193.0,2020-08-12,wallstreetbets,g190gwm,"**Hey you holding calls that are up 100%**

sell them you fuck tard",t3_i8b56i,10
1597262578.0,2020-08-12,wallstreetbets,g191anw,Always entertaining to see my tsla spreads go down 50% at close because the bid ask goes ape shit,t3_i8b56i,10
1597263029.0,2020-08-12,wallstreetbets,g1929el,"Up $2000 today, still down $17 on the month though",t3_i8b56i,9
1597263045.0,2020-08-12,wallstreetbets,g192am9,[deleted],t3_i8b56i,9
1597263940.0,2020-08-12,wallstreetbets,g19485y,[deleted],t3_i8b56i,10
1597231444.0,2020-08-12,wallstreetbets,g17chq2,These moves in silver are wicked,t3_i8b56i,19
1597231795.0,2020-08-12,wallstreetbets,g17cwm8,Bruh it literally says Dow futures up 250 points on stimulus hopes. 🤣🤣🤣🤣🤣.,t3_i8b56i,19
1597233937.0,2020-08-12,wallstreetbets,g17fkpq,Buying mutual funds is so fucking gay but at least they dont wipe you out in 45 minutes,t3_i8b56i,19
1597237988.0,2020-08-12,wallstreetbets,g17lgya,"$FB and $BABA need to moon by 8/28 or I’m done with this shit. I never know when to take profits. Remember that one Monday that Amazon rallied like 6%? I made 8K in like 2 hours, didn’t cash out, sold for $1K loss the next day. I’m the greediest, least fundamental person in this market. 

I never thought I would group myself with you idiots who buy $2000 Tesla FD’s, but here I am. I’m the same as all you greedy idiots and I’ve turned this into a pure casino.",t3_i8b56i,20
1597258158.0,2020-08-12,wallstreetbets,g18rmbu,The amount of money I’m making on TSLA is immoral,t3_i8b56i,19
1597227587.0,2020-08-12,wallstreetbets,g178d7z,"Can someone working for JPM here just tell me what direction they'll manipulate it today? Just, cmon I don't matter at all just give me the info and be done with it",t3_i8b56i,18
1597233612.0,2020-08-12,wallstreetbets,g17f5et,AAPL to $450 today and I’ll post more of my wife’s nudes as an offering to the wsb gods,t3_i8b56i,18
1597236122.0,2020-08-12,wallstreetbets,g17im5f,Imagine seeing this shit after dumping your slv calls EOD yesterday. I know some of you panic sold,t3_i8b56i,17
1597228212.0,2020-08-12,wallstreetbets,g179072,If I have cash in an emergency fund how long until it’s basically just Zimbabwe dollary-doos/Weimar marks,t3_i8b56i,9
1597231367.0,2020-08-12,wallstreetbets,g17cein,Weed ain’t gonna be legalized for a a good while huh?,t3_i8b56i,9
1597231378.0,2020-08-12,wallstreetbets,g17cezd,"investing.com says ""biden making dollar rise!""

DX is currently in the red

what?",t3_i8b56i,9
1597231471.0,2020-08-12,wallstreetbets,g17ciuo,SILVER IS GREEN MOTHER FUCKERS,t3_i8b56i,9
1597231780.0,2020-08-12,wallstreetbets,g17cvxx,"SLV gonna do something today, idk what yet but it'll do something",t3_i8b56i,8
1597231942.0,2020-08-12,wallstreetbets,g17d2zr,"> S&PGR REPORT: GLOBAL AIR TRAFFIC TO DROP 60%-70% IN 2020

BA 300 EOD",t3_i8b56i,9
1597234504.0,2020-08-12,wallstreetbets,g17gc3b,Someone bought 29k $AAPL shares at the ask @ 8:01am. fuk yeah,t3_i8b56i,9
1597234560.0,2020-08-12,wallstreetbets,g17ges7,Who thinks green futures mean nothing and it will be a very red day?,t3_i8b56i,9
1597234814.0,2020-08-12,wallstreetbets,g17grhl,We couldn’t go 10 straight Green Day’s? I guess we have the next 10 to try again,t3_i8b56i,9
1597234935.0,2020-08-12,wallstreetbets,g17gxf3,I'm ready for this -30% day to finally be off my screen,t3_i8b56i,9
1597235393.0,2020-08-12,wallstreetbets,g17hknd,So are we buying silver today? It’s tempting me real bad can’t lie,t3_i8b56i,8
1597236779.0,2020-08-12,wallstreetbets,g17jlcq,"I bought the dip in metals, anyone else?",t3_i8b56i,9
1597237172.0,2020-08-12,wallstreetbets,g17k72k,"Tech is going to fade, isn’t it?",t3_i8b56i,9
1597237490.0,2020-08-12,wallstreetbets,g17kovw,[deleted],t3_i8b56i,8
1597237567.0,2020-08-12,wallstreetbets,g17kt2q,🥈💎,t3_i8b56i,10
