created,date,subreddit,id,body,parent_id,score
1629992709.0,2021-08-26,wallstreetbets,hafqhsx,Where's the AMC crew?,t3_pbwdez,9
1629993024.0,2021-08-26,wallstreetbets,hafrak6,Taper going to happen. Big drop tomorrow.,t3_pbwdez,8
1629993905.0,2021-08-26,wallstreetbets,haftiq4,"“8/27 SPY 200P will print”

🤡",t3_pbwdez,7
1629994154.0,2021-08-26,wallstreetbets,hafu512,My neighbor behind me and 9 houses down thinks he fucking drives for NASCAR.,t3_pbwdez,7
1629994206.0,2021-08-26,wallstreetbets,hafu9r5,Boys I’m up $24 and change so far today 😎,t3_pbwdez,9
1629995503.0,2021-08-26,wallstreetbets,hafxjs0,The Fed will not breathe a word on tapering until at least November. facked,t3_pbwdez,7
1629996005.0,2021-08-26,wallstreetbets,hafyu0h,Gme gonna make me bus a nutty,t3_pbwdez,6
1629996070.0,2021-08-26,wallstreetbets,hafz02f,"Someone made a really good point yesterday 

People who think the market is overvalued based on historical data are not considering how easy it is to access the market today.

People in Russia, china, Japan, EVERYWHWRE can buy on the us exchange on their fucking phones... Anytime anywhere... This is new 

And they are all going LONG",t3_pbwdez,7
1629996098.0,2021-08-26,wallstreetbets,hafz2na,Can BB break past the 11.20 resistance level? Find out on the next episode of Dragon Ball Z.,t3_pbwdez,8
1629998138.0,2021-08-26,wallstreetbets,hag4chg,My apple $150 weeklies bought Monday are down 87% LMAO,t3_pbwdez,8
1629999196.0,2021-08-26,wallstreetbets,hag734k,Day trading is close to impossible if not in stocks with huge retail volume. The algos just literally fuk you on the daily non stop! Happens way too much to be coincidence,t3_pbwdez,8
1629999344.0,2021-08-26,wallstreetbets,hag7gya,"TIL ISIS also has variants. ISIS K apparently being suspected responsible for the attack.

Puts on Middle East peace.",t3_pbwdez,8
1630000501.0,2021-08-26,wallstreetbets,hagafqj,I deserve to lose money. Yoloed into a random ticker just because somebody mentioned here that it will maybe squeezes...,t3_pbwdez,8
1630000522.0,2021-08-26,wallstreetbets,hagahl7,"Just sent my resume to a firm specializing in Tunnel/ Geotechnical engineering.

Your boy is hopefully going underground.",t3_pbwdez,8
1630002028.0,2021-08-26,wallstreetbets,hage8le,Is everyone losing money too right? ... right?,t3_pbwdez,7
1630003050.0,2021-08-26,wallstreetbets,haggraq,I’m thinking SPY puts until 10 am of tomorrow.,t3_pbwdez,8
1630003121.0,2021-08-26,wallstreetbets,haggxjk,[deleted],t3_pbwdez,8
1630005339.0,2021-08-26,wallstreetbets,hagmfru,I actually like CLOV. Looking at the fundamentals its a value stock imo. Good balance sheet. Early stage growth. 1 billion in sales is a good proof of concept. 100%+ YoY growth. 3x forward.,t3_pbwdez,9
1630005968.0,2021-08-26,wallstreetbets,hago07g,Bears doing tribal dances trying to will the market downwards (Or is that just me),t3_pbwdez,9
1630006135.0,2021-08-26,wallstreetbets,hagof4t,"Saudis low key signed a military cooperation agreement with Russia lmao.

50 years after the gold standard went bust.",t3_pbwdez,8
1630006518.0,2021-08-26,wallstreetbets,hagpdk7,wsb is buying puts that's why my calls will print,t3_pbwdez,9
1630006625.0,2021-08-26,wallstreetbets,hagpn5x,[deleted],t3_pbwdez,8
1630006675.0,2021-08-26,wallstreetbets,hagpri8,Dude is waiting for market to close before he speaks,t3_pbwdez,7
1630006717.0,2021-08-26,wallstreetbets,hagpv9o,The scared poor bulls with low balances are spending their last money on donations to wall st,t3_pbwdez,8
1630006773.0,2021-08-26,wallstreetbets,hagq0bg,lol at this Abercrombie ceo on CNBC. “WE ARE THRILLED WITH OUR EARNINGS” she says “WE COULS NOT BE MORE PLEASED” as CNBC has a graphic up showing the stock plunging 12%,t3_pbwdez,8
1630007071.0,2021-08-26,wallstreetbets,hagqrcx,Honk honk look at me who bought the fucking top 🤡🤡🤡,t3_pbwdez,8
1630008011.0,2021-08-26,wallstreetbets,hagt3he,"RIP SPY, bulls can take back control after jpow talk tomorrow :p",t3_pbwdez,8
1630008087.0,2021-08-26,wallstreetbets,hagtaaw,"Most shit stocks: VIAC, INTC, CRSR",t3_pbwdez,10
1630008276.0,2021-08-26,wallstreetbets,hagtqxm,Tomorrow gonna make or break my ass,t3_pbwdez,9
1630009547.0,2021-08-26,wallstreetbets,hagww5q,*cries in sava*,t3_pbwdez,8
1629981858.0,2021-08-26,wallstreetbets,haf1myq,I hate the GME culture but I love gambling on it when it gets like this. Am I closet homo? I’m so confused,t3_pbwdez,22
1629981685.0,2021-08-26,wallstreetbets,haf1b0l,"So GDP is up less than expected at 6.6%. Meanwhile, inflation is confirmed at something like 5.5% (but we all know it's actually *much* higher).
  
So GDP is essentially decreasing at a time when money availability is through the roof. 
  
And unemployment is increasing. And fewer homes are being built and purchased. 
  
I think SPY should go up at least a quarter percent today.",t3_pbwdez,20
1629977495.0,2021-08-26,wallstreetbets,haeu029,Need a solid 10+bagger today boys or they're gonna break my legs,t3_pbwdez,33
1629986163.0,2021-08-26,wallstreetbets,hafaqy7,GME Is gonna fly today,t3_pbwdez,21
1630005285.0,2021-08-26,wallstreetbets,hagmax6,"WSB at ATH: i'm rich bitch!

WSB slight pull back from ATH: i'm fighting for my fucking life!",t3_pbwdez,20
1629977289.0,2021-08-26,wallstreetbets,haetonc,Who else drinks 🥃 instead  ☕️ ?,t3_pbwdez,7
1629981272.0,2021-08-26,wallstreetbets,haf0iqr,Gdp and jobless numbers were exceptionally boring so...ath today?,t3_pbwdez,6
1629982443.0,2021-08-26,wallstreetbets,haf2s53,will my nvda calls going to moon?,t3_pbwdez,7
1629983344.0,2021-08-26,wallstreetbets,haf4mms,THe great thing about working from home is i don't do shit until i watch the market open :),t3_pbwdez,8
1629983722.0,2021-08-26,wallstreetbets,haf5end,"George Gammon, a former entrepreneur, turned investor, and host of The Rebel Capitalist Show, says, “The Fed is buying $120 billion a month in treasuries and mortgage-backed securities creating basically quantitative easing, and they haven’t been able to stop. If our economy was healthy, they wouldn’t need to do $120 billion a month in quantitative easing.”",t3_pbwdez,7
1629983951.0,2021-08-26,wallstreetbets,haf5vvx,I get so sweaty premarket this aluminum free deodorant doesn’t do shit,t3_pbwdez,8
1629983978.0,2021-08-26,wallstreetbets,haf5xxi,Sooooo spy 450 or 440 today?,t3_pbwdez,7
1629984032.0,2021-08-26,wallstreetbets,haf627d,The fact that I bought MVIS calls yesterday blows my mind,t3_pbwdez,7
1629984278.0,2021-08-26,wallstreetbets,haf6kvx,Spy put or call FD at open? It’s going to end up flat 😭,t3_pbwdez,7
1629984430.0,2021-08-26,wallstreetbets,haf6wog,Cheesecake Factory really has a fucking ticker,t3_pbwdez,7
1629984492.0,2021-08-26,wallstreetbets,haf71ep,Here we go guys - let’s have a nice clean game. On my whistle…,t3_pbwdez,7
1629985150.0,2021-08-26,wallstreetbets,haf8h0o,ASTS will end the day above 11.,t3_pbwdez,7
1629985331.0,2021-08-26,wallstreetbets,haf8vdu,This sub is my personal apocalypse.,t3_pbwdez,8
1629985387.0,2021-08-26,wallstreetbets,haf8zub,Anyone who went in on SLQT based on that $500k bet? Poor soul lol..,t3_pbwdez,6
1629985642.0,2021-08-26,wallstreetbets,haf9k8n,"Same shit as June.  Negative day, negative open before run up $36 to $72.

Biggest fucking AMC bear trap of all time rn.",t3_pbwdez,7
1629985680.0,2021-08-26,wallstreetbets,haf9nd3,GME 250 eod,t3_pbwdez,8
1629985790.0,2021-08-26,wallstreetbets,haf9wae,CLNE be like 📉📈📉📈,t3_pbwdez,7
1629985794.0,2021-08-26,wallstreetbets,haf9wll,AMC looking to play laggard to GME once again,t3_pbwdez,7
1629985919.0,2021-08-26,wallstreetbets,hafa6zf,AMC needs to stop acting like it’s not gonna shoot up like GME,t3_pbwdez,6
1629985945.0,2021-08-26,wallstreetbets,hafa92r,"Putting my last 1k into GME weekly 235. If this don't hit ,I blew up my account.",t3_pbwdez,7
1629986077.0,2021-08-26,wallstreetbets,hafajuk,$BB is my BB 🌚,t3_pbwdez,7
1629986610.0,2021-08-26,wallstreetbets,hafbryt,"KABUL AIRPORT

Days without a workplace accident:  0",t3_pbwdez,6
1629986624.0,2021-08-26,wallstreetbets,hafbt14,GME since when are you just a one pump chump you stupid bitch your GME go up,t3_pbwdez,7
1629986656.0,2021-08-26,wallstreetbets,hafbvrz,Gme looking exactly like it did Tuesday. It’s ready to surge again later today folks.,t3_pbwdez,7
1629986901.0,2021-08-26,wallstreetbets,hafcfyn,how do i turn 50k into 5 million,t3_pbwdez,7
1629987237.0,2021-08-26,wallstreetbets,hafd7q0,Wheres the god damn volume,t3_pbwdez,7
1629987888.0,2021-08-26,wallstreetbets,hafeqvc,Holy BB is just not stoping,t3_pbwdez,6
1629988048.0,2021-08-26,wallstreetbets,haff4oj,Great job Joe,t3_pbwdez,7
1629988089.0,2021-08-26,wallstreetbets,haff8a9,"##HOCUS POCUS

##IM NOW BROKUS

😎😎😎",t3_pbwdez,9
1629988091.0,2021-08-26,wallstreetbets,haff8fq,I sold my spy puts literally 2 minutes too early,t3_pbwdez,6
1629988243.0,2021-08-26,wallstreetbets,hafflph,Everyday my Microsoft calls stray further from happiness,t3_pbwdez,7
1629988414.0,2021-08-26,wallstreetbets,hafg0lc,Raytheon calls time,t3_pbwdez,6
1629988776.0,2021-08-26,wallstreetbets,hafgw55,sold my 8/27 449p at open this morning for 10% because being a gay bear scares me. should have continued being gay for another hour,t3_pbwdez,7
1629988805.0,2021-08-26,wallstreetbets,hafgyot,What are you doing step market,t3_pbwdez,7
1629988809.0,2021-08-26,wallstreetbets,hafgyyc,"Friend - What is WSB like?

Me- It's a hell hole for market knowledge",t3_pbwdez,7
1629988881.0,2021-08-26,wallstreetbets,hafh5a4,Shares gang at total peace ☮️,t3_pbwdez,7
1629989232.0,2021-08-26,wallstreetbets,hafi073,YOLO in calls on $GME and puts on $SPY,t3_pbwdez,8
1629989279.0,2021-08-26,wallstreetbets,hafi4am,The taliban is literally stealing my gains,t3_pbwdez,9
1629989290.0,2021-08-26,wallstreetbets,hafi59z,"Buys call- stock dumps
Buys puts- stock rips 
Every. Single. Time.",t3_pbwdez,8
1629989553.0,2021-08-26,wallstreetbets,hafisl9,Dang sold my spy puts too early. I really suck at this,t3_pbwdez,8
1629989716.0,2021-08-26,wallstreetbets,hafj6wj,"Despite the stock market supposedly only going up, I feel like I spend most of my time watching it go down",t3_pbwdez,8
1629989815.0,2021-08-26,wallstreetbets,hafjfl3,"Imagine not buying that dip, airport news is just a blip.",t3_pbwdez,7
1629990036.0,2021-08-26,wallstreetbets,hafjypu,"was up 270k in february, now im down 30k, gg 300k",t3_pbwdez,6
1629990155.0,2021-08-26,wallstreetbets,hafk8z9,Frick I switched to calls way too early,t3_pbwdez,6
1629990178.0,2021-08-26,wallstreetbets,hafkaxz,"I’m up 200% on my spy puts, but I feel bad for the people’s 😔",t3_pbwdez,7
1629990194.0,2021-08-26,wallstreetbets,hafkcdz,So ice chips and hotdog water for next week,t3_pbwdez,7
1629990205.0,2021-08-26,wallstreetbets,hafkd8m,Just closed all my spy puts. Don’t care if we go down more. Gonna go smoke a cigar and might even rub one out,t3_pbwdez,7
1629990665.0,2021-08-26,wallstreetbets,haflhez,Why do we care if they blow themselves up in Afghanistan again?  Isn’t that what they do?,t3_pbwdez,6
1629990675.0,2021-08-26,wallstreetbets,hafli9o,"Stupid Bears, War is extremely bullish.",t3_pbwdez,7
1629990818.0,2021-08-26,wallstreetbets,hafluj1,actually bought the dip this time,t3_pbwdez,7
1629990819.0,2021-08-26,wallstreetbets,hafluo2,"Market is in shambles.  Insert coin?

9...8...7..6....5....4....3...2...

SPY:  ""HERE COMES A NEW CHALLENGER!""",t3_pbwdez,8
1629990888.0,2021-08-26,wallstreetbets,hafm0p5,I regret pushing for an extra dollar off on those SPY calls,t3_pbwdez,6
1629990975.0,2021-08-26,wallstreetbets,hafm89p,Hate to say it but you should buy this dip on the Afghanistan news. It's an awful tragedy unfolding but has little to nothing to do with markets.,t3_pbwdez,8
1629991073.0,2021-08-26,wallstreetbets,hafmgnt,How is the Taliban priced in,t3_pbwdez,7
1629991149.0,2021-08-26,wallstreetbets,hafmn84,Is this a fake and ghey recovery,t3_pbwdez,7
1629991256.0,2021-08-26,wallstreetbets,hafmwow,"Is SPY healing ❤️‍🩹 

Or a bull trap 🪤",t3_pbwdez,7
1629991259.0,2021-08-26,wallstreetbets,hafmwzt,"Fucking loving the volatility, thanks for $600 tsla 😂😂🥰",t3_pbwdez,8
1629991288.0,2021-08-26,wallstreetbets,hafmzgg,Spy down to levels not seen since yesterday,t3_pbwdez,7
1629991393.0,2021-08-26,wallstreetbets,hafn8ol,"This is actually my favorite part of the rollercoaster, the build up before the re-drop 🎢",t3_pbwdez,8
1629991581.0,2021-08-26,wallstreetbets,hafnpab,Options is where I just throw money into the fire.,t3_pbwdez,7
1629991685.0,2021-08-26,wallstreetbets,hafnyal,Nature documentaries are the craziest shit,t3_pbwdez,7
1629992377.0,2021-08-26,wallstreetbets,hafpnup,Was it a bull trap or a bear trap? Stay tuned to find out,t3_pbwdez,7
1629992582.0,2021-08-26,wallstreetbets,hafq6gy,Only up 5% from the beginning of the year but atleast I’m up right 😅,t3_pbwdez,7
1629993246.0,2021-08-26,wallstreetbets,hafruv6,I always buy puts at the exact bottom,t3_pbwdez,7
1629993427.0,2021-08-26,wallstreetbets,hafsbg9,"Look at JD, China tech rally about to kick off.  Way oversold and gaps to fill especially on BABA.",t3_pbwdez,5
1629993525.0,2021-08-26,wallstreetbets,hafskhx,I CAME IN LIKE A WREEECKING BAALLLLL-,t3_pbwdez,8
1629994275.0,2021-08-26,wallstreetbets,hafufx3,"JPow is giving a speech tomorrow at 10am. I’m holding these SPY puts. 10 bagger incoming. Party is over, now begins the time of the taper.",t3_pbwdez,7
1629995631.0,2021-08-26,wallstreetbets,hafxvmi,I've decided that I'm too drunk to trade today. I ain't even mad.,t3_pbwdez,7
1629995689.0,2021-08-26,wallstreetbets,hafy0wj,GME wants to break out soooooo bad,t3_pbwdez,6
1629996070.0,2021-08-26,wallstreetbets,hafz022,ACTION NEEDED ON YOUR SCHWAB ACCOUNT,t3_pbwdez,7
1629996100.0,2021-08-26,wallstreetbets,hafz2vm,Fed will continue to drop teases of tapering. Better to have a bunch of small drops then one massive drop when they finally do taper.,t3_pbwdez,7
1629997029.0,2021-08-26,wallstreetbets,hag1hlt,I love when a $1 increase in a option makes you $400+,t3_pbwdez,7
1629997078.0,2021-08-26,wallstreetbets,hag1lzt,"Yes BB, thats what we want to see!!!",t3_pbwdez,6
1629997085.0,2021-08-26,wallstreetbets,hag1mps,Bb calls and spy puts might make me a thousandaire today,t3_pbwdez,7
1629997690.0,2021-08-26,wallstreetbets,hag36rr,It’s gonna be scary the week this drops 10% by how we acting now,t3_pbwdez,7
1629997789.0,2021-08-26,wallstreetbets,hag3fyo,Petco needs to change their symbol too OOF,t3_pbwdez,8
1629997826.0,2021-08-26,wallstreetbets,hag3jct,WSB DD is like a blue hair standing in front of a slot machine giving reasons why it is definitely going to hit the jackpot on the next lever pull. Cannot go tits up.,t3_pbwdez,7
1629997866.0,2021-08-26,wallstreetbets,hag3n2e,I'm such a bad trader,t3_pbwdez,7
1629998003.0,2021-08-26,wallstreetbets,hag3ztc,"I wish I could day trade with just $10k, without being enticed with another $15k and $50k margin",t3_pbwdez,6
1629998275.0,2021-08-26,wallstreetbets,hag4pck,GME pls do something cool,t3_pbwdez,8
1629998758.0,2021-08-26,wallstreetbets,hag5yif,Just wanted to point out that the CEO of SPY was not at Kabul airport.,t3_pbwdez,6
1629998982.0,2021-08-26,wallstreetbets,hag6jgn,"red dildos coming out after you buy calls.

""C'mon man!""",t3_pbwdez,7
1629999037.0,2021-08-26,wallstreetbets,hag6oit,"Lets just say If SPY doesn't go down some this week, I'm gonna be hurting a good bit lmao. Legit just gonna let my roommate control my money so I dont lose it all ha He is a hardcore boomer type at 27",t3_pbwdez,7
1629999254.0,2021-08-26,wallstreetbets,hag78jl,My amd calls were worth so much more the last time we hit this level lmfao,t3_pbwdez,7
1629999350.0,2021-08-26,wallstreetbets,hag7hjh,I think it's pretty amazing that bats were able to develop a vaccine for coronavirus considering they're so small and they can't read or write. Nature is incredible,t3_pbwdez,7
1629999679.0,2021-08-26,wallstreetbets,hag8byc,"SPY options are up $5 right now, thinking of locking in profit.",t3_pbwdez,7
1630000312.0,2021-08-26,wallstreetbets,hag9ygz,literally breaking off chunks of tension and eating it for lunch,t3_pbwdez,6
1630000403.0,2021-08-26,wallstreetbets,haga6sy,Rip SLQT 500k bet guy 😞,t3_pbwdez,7
1630001369.0,2021-08-26,wallstreetbets,hagcljr,"GME will most definitly hit 250. I just wonder if it can pass its ath.  


it will bitches.",t3_pbwdez,8
1630001399.0,2021-08-26,wallstreetbets,hagco8j,CLOV AMC GME. Buckle up friends. This is going to be epic.,t3_pbwdez,7
1630001608.0,2021-08-26,wallstreetbets,hagd6wv,Volume is so low. Imagine this amplifying after any news tomorrow. I am ready.,t3_pbwdez,7
1630001632.0,2021-08-26,wallstreetbets,hagd94o,"Went too far in on options and lost, FML. 😔",t3_pbwdez,8
1630001720.0,2021-08-26,wallstreetbets,hagdh0s,Not only did I sell my SPY puts too soon but I bought my calls too early. Fuck me for trying to time anything.,t3_pbwdez,7
1630001823.0,2021-08-26,wallstreetbets,hagdq53,I’m a straight up pro at going in heavy on calls right before red days and going in very light right before green days,t3_pbwdez,7
1630002290.0,2021-08-26,wallstreetbets,hagew1s,[deleted],t3_pbwdez,8
1630003119.0,2021-08-26,wallstreetbets,haggxex,Dang 11 marines and 1 navy medic killed according to Royters.,t3_pbwdez,7
1630003340.0,2021-08-26,wallstreetbets,haghh6k, Tali’s need to get ban bruh,t3_pbwdez,7
1630003440.0,2021-08-26,wallstreetbets,haghq5h,Money is the best cocaine,t3_pbwdez,6
1630004054.0,2021-08-26,wallstreetbets,hagj8vj,Doubled down on SPY calls. Am I retarded?,t3_pbwdez,7
1630004184.0,2021-08-26,wallstreetbets,hagjkfp,"Bear gang, Bear gang, Bear gang, Bear gang (Bear gang)

Bear gang, Bear gang, Bear gang, Bear gang (Bear gang)

Spend three puts on a new chain (Yuh)

Bull bitches do love anal pain, ooh (Ooh)",t3_pbwdez,6
1630004213.0,2021-08-26,wallstreetbets,hagjn58,TLRY hulk ducks then drops for no reason.. take as old as time,t3_pbwdez,7
1630004865.0,2021-08-26,wallstreetbets,hagl9h4,We’re just getting started,t3_pbwdez,7
1630005291.0,2021-08-26,wallstreetbets,hagmbgo,$444 incoming,t3_pbwdez,7
1630005324.0,2021-08-26,wallstreetbets,hagmegt,Wow lost 2k ytd and now this sea of red . I just cant catch a fcking break can i,t3_pbwdez,7
1630005818.0,2021-08-26,wallstreetbets,hagnmqi,"This mother fucker Tom Lee is bullish everytime I see him on CNBC 

The day he is bearish is the day I go into Triple leveraged gold etfs",t3_pbwdez,8
1630006129.0,2021-08-26,wallstreetbets,hagoek7,Permabulls in shambles,t3_pbwdez,7
1630006623.0,2021-08-26,wallstreetbets,hagpmxj,Do kids still say the pledge of allegiance in class or did they get rid of that?,t3_pbwdez,7
1630006833.0,2021-08-26,wallstreetbets,hagq5rn,Holy shit msft went back under 300. Didnt actually think i could make any money on puts.,t3_pbwdez,8
1630006983.0,2021-08-26,wallstreetbets,hagqjep,"Oh boy,  I just love losing 4 grand in a day...",t3_pbwdez,7
1630007419.0,2021-08-26,wallstreetbets,hagrmsx,Prepare your bootyholes for Jackson hole tomorrow ⬇️,t3_pbwdez,5
1630007950.0,2021-08-26,wallstreetbets,hagsy0m,The SPY gap down at open is going to be epic.,t3_pbwdez,5
1630008059.0,2021-08-26,wallstreetbets,hagt7so,powell gonna do us dirty again? dirty in our jackson hole?,t3_pbwdez,7
1630012944.0,2021-08-26,wallstreetbets,hah56im,"Now that we had a down day...

LET THE 10,000-YEAR BULL MARKET BEGIN",t3_pbwdez,8
1630014194.0,2021-08-26,wallstreetbets,hah84s4,It feels wrong being a bear,t3_pbwdez,8
1629973754.0,2021-08-26,wallstreetbets,haeorv3,I’m about to lose money,t3_pbwdez,19
1629986637.0,2021-08-26,wallstreetbets,hafbu63,"Just got a new job at Kabul airport, so excited",t3_pbwdez,19
1629996416.0,2021-08-26,wallstreetbets,hafzvxj,"GME moves up like 4 dollars and my options go up by like 500$, so wild",t3_pbwdez,19
1630005016.0,2021-08-26,wallstreetbets,haglmyo,"*SPY down 0.5% from ATH

WSB portfolio down 50%

🤡🤡🤡",t3_pbwdez,19
1629979383.0,2021-08-26,wallstreetbets,haex3xw,"We've all see margin calls, but come talk to me when you get a margin put.",t3_pbwdez,18
1630006624.0,2021-08-26,wallstreetbets,hagpn0w,Bloodbath tomorrow?,t3_pbwdez,19
1629980511.0,2021-08-26,wallstreetbets,haez43v,This market is fucking bullshit.,t3_pbwdez,26
1629980385.0,2021-08-26,wallstreetbets,haeyvr1,They have yuengling in Texas now. 🙏,t3_pbwdez,17
1629998854.0,2021-08-26,wallstreetbets,hag67j6,RIP AMERICAN HEROES 🇺🇸🇺🇸🇺🇸🇺🇸🇺🇸🇺🇸,t3_pbwdez,17
1629981005.0,2021-08-26,wallstreetbets,haf00r9,"Stop being a little bitch

There are people literally living in Europe",t3_pbwdez,40
1629973290.0,2021-08-26,wallstreetbets,haeo6sz,"When I lose money, I feel a bit bad and ashamed of coming here since it feels like I let y'all down. Then I come to the thread and remember that you're all blood-thirsty retards and I feel good again. Thanks for that.",t3_pbwdez,33
1629972743.0,2021-08-26,wallstreetbets,haenhwe,"I guess the SAVA CEO's response to fraud claims didn't convince enough folks. Even if there is a dead cat bounce today, so many people were catching falling knives above $90 yesterday, there will be some carrying heavy bags for some time. 

If the fraud allegations are true, this thing will still take months to fully go to 0. I might day trade it here and there.",t3_pbwdez,6
1629973661.0,2021-08-26,wallstreetbets,haeonl8,I’ve gone full retard,t3_pbwdez,6
1629973914.0,2021-08-26,wallstreetbets,haeoz85,you call this a meme pump??,t3_pbwdez,5
1629977181.0,2021-08-26,wallstreetbets,haetilu,"Does anyone go Naked when looking and buying stocks, or is that just me?",t3_pbwdez,6
1629977403.0,2021-08-26,wallstreetbets,haetuyw,This market is so sus it's chatting shit something's definitely wrong with it,t3_pbwdez,5
1629978555.0,2021-08-26,wallstreetbets,haevpxb,"Is there ASTS news, or is it just being pumped?",t3_pbwdez,7
1629978944.0,2021-08-26,wallstreetbets,haewd64,"I'm gonna work today, get caught up so I still have a job and paycheck to buy FDs with. I don't expect much action until Monday, but hope you all make piles of money.",t3_pbwdez,6
1629979203.0,2021-08-26,wallstreetbets,haewst9,"From Forbes:

 ""Simply put, people act irrationally and the social media around meme stocks provide participants with shots of dopamine to compensate for the financial carnage they may suffer on that mythical journey to the moon.""",t3_pbwdez,6
1629979203.0,2021-08-26,wallstreetbets,haewsup,all becky stocks about to moon,t3_pbwdez,6
1629979314.0,2021-08-26,wallstreetbets,haewzsu,No popular ticker thread?,t3_pbwdez,6
1629979351.0,2021-08-26,wallstreetbets,haex20s,I wonder how much slower Sarah eisen turns her head due to the drag from her nose,t3_pbwdez,7
1629980541.0,2021-08-26,wallstreetbets,haez63z,Cathie bought A bunch of China stocks yesterday,t3_pbwdez,6
1629980633.0,2021-08-26,wallstreetbets,haezc1s,Russell 2000 hasn’t made any big progress since February. Yet SPY has made like +10% since then. Absolutely insane,t3_pbwdez,5
1629980706.0,2021-08-26,wallstreetbets,haezgv4,Alright boys I'm back and haven't learnt from my mistakes. Anyways SPY calls at open to prepare for Jacksons asshole,t3_pbwdez,6
1629980714.0,2021-08-26,wallstreetbets,haezhdb,[deleted],t3_pbwdez,6
1629981606.0,2021-08-26,wallstreetbets,haf15ji,#PLTR calls at open. The FBI story was a hit piece on our gurl Cathie. Buy more,t3_pbwdez,7
1629981693.0,2021-08-26,wallstreetbets,haf1bhz,"Oh fuck, he said the “t” word",t3_pbwdez,7
1629981798.0,2021-08-26,wallstreetbets,haf1ivn,So where can I buy this Theta everyone is speaking of,t3_pbwdez,6
1629982233.0,2021-08-26,wallstreetbets,haf2d92,Wendy's made a discord fellas..... might have to make an appearance,t3_pbwdez,6
1629982337.0,2021-08-26,wallstreetbets,haf2kon,Difference between catching a falling knife and buying  the dip please?,t3_pbwdez,6
1629982434.0,2021-08-26,wallstreetbets,haf2rfs,"I like putting the dollar symbol at the end. For example, 69$. That’s how we say it when we speak. We don’t say, “Dollars 69.” Let’s get this shit straightened out. 

PLTR to the moon. Puts on the FBI.",t3_pbwdez,5
1629982787.0,2021-08-26,wallstreetbets,haf3ha7,"SPY down 0.1%

Bear be like :   haha, I told u all .   The world is ending.",t3_pbwdez,6
1629983388.0,2021-08-26,wallstreetbets,haf4pwy,Apple sucking gdamn man,t3_pbwdez,6
1629983586.0,2021-08-26,wallstreetbets,haf54hn,Pull up to the blackjack table and open your laptop opening bell,t3_pbwdez,6
1629984006.0,2021-08-26,wallstreetbets,haf604s,It got much easier to make money on options after I started treating the market like a video game.,t3_pbwdez,5
1629984229.0,2021-08-26,wallstreetbets,haf6h86,"Working on my hydration with my 5 th

cup of coffee",t3_pbwdez,7
1629984544.0,2021-08-26,wallstreetbets,haf75cq,1 minute warning.  Good luck apes,t3_pbwdez,5
1629985177.0,2021-08-26,wallstreetbets,haf8j5g,lol I had to Google Jackson Hole to see what it meant. You guys are so crpytic,t3_pbwdez,6
1629985253.0,2021-08-26,wallstreetbets,haf8p6w,"Step 1: find a company that’s lost the most value in the last week

Step 2: check large orders - if big man be buying, I be buying

Step 3: profit",t3_pbwdez,6
1629985311.0,2021-08-26,wallstreetbets,haf8tta,"It was nice knowing you, popular ticker thread",t3_pbwdez,7
1629985455.0,2021-08-26,wallstreetbets,haf958v,Honestly I’m scared to touch anything right now maybe tomorrow after the meeting,t3_pbwdez,5
1629985490.0,2021-08-26,wallstreetbets,haf982w,I am up 1 dollar today boys. $3 more for a 4 for 4 from Wendy's. Fuck yeah,t3_pbwdez,5
1629985723.0,2021-08-26,wallstreetbets,haf9qsx,GME is black swan,t3_pbwdez,6
1629985758.0,2021-08-26,wallstreetbets,haf9to0,Didn’t have mute on in a meeting and just said fuck you SPY.,t3_pbwdez,6
