created,date,subreddit,id,body,parent_id,score
1620727563.0,2021-05-11,wallstreetbets,gxpnekv,[deleted],t3_n9th6n,322
1620730478.0,2021-05-11,wallstreetbets,gxpqu09,I’m never laughing at another Oreo double stuff DD again,t3_n9th6n,296
1620728190.0,2021-05-11,wallstreetbets,gxpo3no,"mom can you come pick me up

im not having fun anymore",t3_n9th6n,261
1620734176.0,2021-05-11,wallstreetbets,gxpw07u,"I was pretty convinced I was the best investor of all time with my 100% tech portfolio 

Now just another poor retard",t3_n9th6n,148
1620728155.0,2021-05-11,wallstreetbets,gxpo28o,"Where were you in the Great Growth Massacre of ‘21

I was home, buying the dip like a retard 🤡",t3_n9th6n,135
1620730156.0,2021-05-11,wallstreetbets,gxpqfim,damn I should have listened to that stuf Oreo cookie DD posted from a few days back smh,t3_n9th6n,128
1620732072.0,2021-05-11,wallstreetbets,gxpswx6,"If you buy you're a retard

If you hold you're a bagholder

If you sell you're a looser

Choose wisely!!!",t3_n9th6n,123
1620737863.0,2021-05-11,wallstreetbets,gxq2fqs,Time to buckle down and take the day job more seriously.,t3_n9th6n,120
1620732077.0,2021-05-11,wallstreetbets,gxpsx6f,"Day 15 of ""buying the dip"" 🤡",t3_n9th6n,113
1620733416.0,2021-05-11,wallstreetbets,gxpuu54,The collective GUH at market open will increase carbon emission by 2%,t3_n9th6n,106
1620728174.0,2021-05-11,wallstreetbets,gxpo30b,"When people say ""just buy the dip retard"" but all my money is already in a red market feels like when girls tell me ""go deeper"" but I'm already balls deep 😞😞😞",t3_n9th6n,277
1620736112.0,2021-05-11,wallstreetbets,gxpz8je,"“Tech is undervalued!!!” He says to himself as he’s waiting in line at the soup kitchen. He grabs his IPhone 5s out of his pocket, opens Robinhood, and proceeds to buy 1 last weekly call with his remaining $80. *This time will be different*.",t3_n9th6n,89
1620727879.0,2021-05-11,wallstreetbets,gxpnr1o,"WSB buys puts, market recovers totally.",t3_n9th6n,78
1620733661.0,2021-05-11,wallstreetbets,gxpv7jp,"""OMG inflation is getting bad, let me sell everything and go cash gang"". 🤡",t3_n9th6n,83
1620729455.0,2021-05-11,wallstreetbets,gxppl5d,"You guys remember the movie ""Black Sheep"" when Chris Farley was falling down the mountain but grabbed hold of that tiny tree and thought he was saved, but then the roots came out and he fell for like another 11 minutes?

This feels like that.",t3_n9th6n,78
1620735911.0,2021-05-11,wallstreetbets,gxpyvyn,"I live in Spain, but without the S",t3_n9th6n,76
1620739019.0,2021-05-11,wallstreetbets,gxq4o2c,"There are only two types of investors. Day traders, and day traders who have been holding for 3 months trying to recoup their loss.",t3_n9th6n,71
1620731770.0,2021-05-11,wallstreetbets,gxpsi00,I BLAME THIS ALL ON SNL,t3_n9th6n,67
1620735799.0,2021-05-11,wallstreetbets,gxpyp0u,If the market crashes can we at least get a housing crash again. I want a cheap house,t3_n9th6n,64
1620733285.0,2021-05-11,wallstreetbets,gxpun9b,Gentlemen it‘s been an honor playing with you 🎻,t3_n9th6n,60
1620734993.0,2021-05-11,wallstreetbets,gxpxbvn,This morning I’m feeling like Melvin Capital in January,t3_n9th6n,59
1620737427.0,2021-05-11,wallstreetbets,gxq1m9y,Damn that 0.50% APY savings account looking like the play,t3_n9th6n,58
1620748101.0,2021-05-11,wallstreetbets,gxqp7ge,"In this market, you make $50 one day, then the next day you lose $1,412, then lose another $1,057. But its all good because the day after that you make $27.",t3_n9th6n,57
1620728088.0,2021-05-11,wallstreetbets,gxpnzjb,Reverse gains are gonna be crazy today 🙈,t3_n9th6n,53
1620736626.0,2021-05-11,wallstreetbets,gxq05g1,i guess i can always learn to suck dick,t3_n9th6n,49
1620727789.0,2021-05-11,wallstreetbets,gxpnni6,I'm never going to financially recover from this,t3_n9th6n,149
1620728667.0,2021-05-11,wallstreetbets,gxponon,I identify myself as non brainery,t3_n9th6n,48
1620736816.0,2021-05-11,wallstreetbets,gxq0hst,I'm about to get a 100k margin call today because of PLTR. Guess who doesn't have 100k after losing almost 300k over the past 3 months?,t3_n9th6n,44
1620727450.0,2021-05-11,wallstreetbets,gxpn9z5,ARK bout to become a penny stock ETF,t3_n9th6n,134
1620729786.0,2021-05-11,wallstreetbets,gxppzep,Down 52% on PLTR shares at the moment. 💪,t3_n9th6n,41
1620734103.0,2021-05-11,wallstreetbets,gxpvw59,"make 10k in gme. think i am smart, lose 20k in tech three months later. 

making money is the worst thing that can happen to you in the stock market.",t3_n9th6n,40
1620738190.0,2021-05-11,wallstreetbets,gxq31r0,"#Holy fucking crash

Tech bulls, it was an honor serving with you.. looks like we’re heading to Valhalla in about 28 minutes",t3_n9th6n,41
1620739204.0,2021-05-11,wallstreetbets,gxq51bp,You gotta admit WSB is far more entertaining during huge moves down.,t3_n9th6n,44
1620732999.0,2021-05-11,wallstreetbets,gxpu806,Step market...what are you doing?,t3_n9th6n,107
1620729017.0,2021-05-11,wallstreetbets,gxpp28o,"“Always yolo options”

-Werran Buffel

I’ve taken that to heart",t3_n9th6n,38
1620731682.0,2021-05-11,wallstreetbets,gxpsdts,"“I mean, it’s one stock of NIO Michael. What could it cost, 10 dollars?” 

-Wall Street apparently.",t3_n9th6n,37
1620732358.0,2021-05-11,wallstreetbets,gxptb01,My family about to have sleep for supper tonight.,t3_n9th6n,35
1620732382.0,2021-05-11,wallstreetbets,gxptc8r,Can't wait to break even in 30 years,t3_n9th6n,40
1620733778.0,2021-05-11,wallstreetbets,gxpve4r,I guess ELON on SNL was actually the top,t3_n9th6n,35
1620736766.0,2021-05-11,wallstreetbets,gxq0ej5,[deleted],t3_n9th6n,39
1620747074.0,2021-05-11,wallstreetbets,gxqmqvy,let’s rename this sub to r/wallstreetdebt,t3_n9th6n,39
1620757381.0,2021-05-11,wallstreetbets,gxrbqss,"Me when I’m down big: “Just break even and I’m out.”

Me when I break even: “Just double up and I’m out.”

Me when I’m up double: “I’m the smartest person in the fucking world.”

Me when it crashes: “Just break even and I’m out!”",t3_n9th6n,39
1620730604.0,2021-05-11,wallstreetbets,gxpqzpy,"Ok, who shit my pants",t3_n9th6n,99
1620735869.0,2021-05-11,wallstreetbets,gxpytdu,https://wendys-careers.com/,t3_n9th6n,101
1620727826.0,2021-05-11,wallstreetbets,gxpnoz2,"Hey mom, it’s your son. I have no money left and I will soon be homeless. Plz help",t3_n9th6n,34
1620729261.0,2021-05-11,wallstreetbets,gxppcob,[deleted],t3_n9th6n,35
1620734979.0,2021-05-11,wallstreetbets,gxpxb0y,"I guarantee if I buy puts today, the market will rebound and go on another 10 year bull run.",t3_n9th6n,32
1620736071.0,2021-05-11,wallstreetbets,gxpz5xv,Today we are all Bill Hwang.,t3_n9th6n,30
1620737010.0,2021-05-11,wallstreetbets,gxq0ugj,"General rule of thumb is once the daily thread starts asking for a prayer thread, it’s time to start buying.",t3_n9th6n,34
1620738471.0,2021-05-11,wallstreetbets,gxq3li5,"Today's my first day of work. This market is God saying ""take it seriously, bc you're no day trader""",t3_n9th6n,30
1620745607.0,2021-05-11,wallstreetbets,gxqja6p,"*sees account -$1200*

*deposits $1250*

Im up $50 suckers, yall losers for not making money with this BuLl MaRkeT!!!!1!1!1",t3_n9th6n,32
1620751538.0,2021-05-11,wallstreetbets,gxqxgoj,"For those of you, like me, who are down 20-30% just remember, if we adjust for inflation its more like being down 40-50%",t3_n9th6n,32
1620729599.0,2021-05-11,wallstreetbets,gxppr9m,tech is in actual SHAMBLES.,t3_n9th6n,28
1620731795.0,2021-05-11,wallstreetbets,gxpsj6i,"Yesterday, premarket was green and I correctly called that I was fuk.

Today premarket is red, but I bet I'll still be fuk.",t3_n9th6n,27
1620733978.0,2021-05-11,wallstreetbets,gxpvpat,[deleted],t3_n9th6n,28
1620736330.0,2021-05-11,wallstreetbets,gxpzm82,"I planned a trip to Bora Bora in January

The plan changed today. I am heading to Golden Gate Bridge",t3_n9th6n,27
1620738547.0,2021-05-11,wallstreetbets,gxq3qsp,"#**Close the market**

Sir, the market hasn’t even opened

^oh",t3_n9th6n,24
1620738595.0,2021-05-11,wallstreetbets,gxq3u3d,I never guessed that I'd be forced to go live in the woods in my 30s,t3_n9th6n,28
1620739232.0,2021-05-11,wallstreetbets,gxq53d8,It’s getting bad out there. Cathie just started an OnlyFans.,t3_n9th6n,27
1620739698.0,2021-05-11,wallstreetbets,gxq610d,"I love how I was so hesistant on buying a PS5 for 600$

Then I lose $10,000 a day for the past week",t3_n9th6n,26
1620741924.0,2021-05-11,wallstreetbets,gxqasj7,Gone from -53% to -49% on PLTR. Who’s laughing now you doubters.,t3_n9th6n,26
1620745923.0,2021-05-11,wallstreetbets,gxqk0xb,Elon SNL ended the great bull market. Thanks Elon 🫂,t3_n9th6n,26
1620746593.0,2021-05-11,wallstreetbets,gxqlm0z,"So the bull trap turned out to be a bear trap, which was disguised as a bull trap, which secretly was a bear trap.",t3_n9th6n,25
1620735165.0,2021-05-11,wallstreetbets,gxpxlz0,Cathie gonna look fine as hell in her Wendy’s uniform.,t3_n9th6n,75
1620729914.0,2021-05-11,wallstreetbets,gxpq505,"It’s the day of reckoning, fellow Palantards.",t3_n9th6n,24
1620731768.0,2021-05-11,wallstreetbets,gxpshwa,It smells like margin calls and ass sweat in here 🤢,t3_n9th6n,24
1620729779.0,2021-05-11,wallstreetbets,gxppz4z,"Imagine buying 750 shares of PLTR at $15 cost basis and riding it all the way up to $40 and now you’re about to be back at even. Boy, THAT SURE WOULD SUCK.",t3_n9th6n,115
1620736134.0,2021-05-11,wallstreetbets,gxpz9yy,"The risk I took was calculated 

But man

Am I bad at math

👁👄👁 📉",t3_n9th6n,23
1620742204.0,2021-05-11,wallstreetbets,gxqbes0,"Hello Bull trap my best friend

I'm overleveraged once again

Inflation should be peaking

And my money is still, leaking

People buying calls, in a dangerous tech bubble,

But yet they win

Jpow using the sound, of silence",t3_n9th6n,23
1620743668.0,2021-05-11,wallstreetbets,gxqer5g,"im done with daytrading, i suck so extremely, buying at the top, then panic sells, immediately it goes up to what I bought it for. FUUUUUUUUUU",t3_n9th6n,23
1620763011.0,2021-05-11,wallstreetbets,gxrpies,"“A correction is healthy”

Me, as I watched my account go from $80k to $50k",t3_n9th6n,24
1620729594.0,2021-05-11,wallstreetbets,gxppr2o,I blame the impending crash on the fact that we couldn’t just be happy with the original 3 Star Wars movies.,t3_n9th6n,74
1620731273.0,2021-05-11,wallstreetbets,gxprupi,So what’s the bullshit narrative for this week’s sell off?,t3_n9th6n,21
1620737004.0,2021-05-11,wallstreetbets,gxq0u1z,Holy shit Tesla Elon’s going to be the 527th richest person by open,t3_n9th6n,23
1620741027.0,2021-05-11,wallstreetbets,gxq8ta2,My PLTR leaps are now only -91.48%.,t3_n9th6n,21
1620743600.0,2021-05-11,wallstreetbets,gxqelhk,"bull trap into bear trap into reverse cowgirl trap

You heard it here first",t3_n9th6n,22
1620747178.0,2021-05-11,wallstreetbets,gxqmzri,That was a scary recession.  Good try 🌈🐻,t3_n9th6n,22
1620763965.0,2021-05-11,wallstreetbets,gxrrsze,Rip to those who panic sold this morning,t3_n9th6n,22
1620734437.0,2021-05-11,wallstreetbets,gxpwf3x,I don’t think anyone can laugh at bagholders cause we’re all bagholders at this point.,t3_n9th6n,62
1620737212.0,2021-05-11,wallstreetbets,gxq17qu,"Anybody else considering LEAPS? If so, what bridge?",t3_n9th6n,68
1620729320.0,2021-05-11,wallstreetbets,gxppf8i,SPY literally at levels not seen since ... 4 days ago.,t3_n9th6n,21
1620730464.0,2021-05-11,wallstreetbets,gxpqtdm,Everyone enjoying their trip to the earths core?.,t3_n9th6n,21
1620732472.0,2021-05-11,wallstreetbets,gxptgsh,I guess renewable energy really wasn’t the future?,t3_n9th6n,22
1620732763.0,2021-05-11,wallstreetbets,gxptvlz,RIP ARK rip TSLA rip PLTR rip cathie,t3_n9th6n,21
1620735825.0,2021-05-11,wallstreetbets,gxpyqm3,Everything is fucking down. I already tried jerking off. I’m out of ideas.,t3_n9th6n,21
1620731762.0,2021-05-11,wallstreetbets,gxpshnk,I thought analyst's biggest criticism of PLTR was that commercial growth was only 4% last time. Now they report US commercial revenue grew 72% year-over-year and it's seen as bad?,t3_n9th6n,21
1620736466.0,2021-05-11,wallstreetbets,gxpzuyb,"At least the Dow is crashing. If we're going down, you boomers are coming with us.",t3_n9th6n,20
1620738676.0,2021-05-11,wallstreetbets,gxq3zq2,"It's ok guys, in two years we'll break even.",t3_n9th6n,20
1620739518.0,2021-05-11,wallstreetbets,gxq5nxy,Some of you guys are cool. Don't come to the market today.,t3_n9th6n,20
1620745848.0,2021-05-11,wallstreetbets,gxqjuhq,SPY calls I bought at open went from +86% to -26% 🤡,t3_n9th6n,20
1620747002.0,2021-05-11,wallstreetbets,gxqmktv,Yay!  PLTR with a MASSIVE rebound. Only down 46% the past three months now lmao,t3_n9th6n,19
1620747061.0,2021-05-11,wallstreetbets,gxqmpuv,"You lose some, you lose some.",t3_n9th6n,20
1620751053.0,2021-05-11,wallstreetbets,gxqwav1,Got some newfound respect for people who actually make money in this market,t3_n9th6n,20
1620751744.0,2021-05-11,wallstreetbets,gxqxyf5,I sold PLTR yesterday 🤡🤡🤡🧻🤲,t3_n9th6n,20
1620756811.0,2021-05-11,wallstreetbets,gxrad5b,Every single time I take some unnecessary risk I get bit in the ass. Discipline is key,t3_n9th6n,20
1620757233.0,2021-05-11,wallstreetbets,gxrbdud,"Cathie Wood said today she expects a “Very serious correction in commodity prices”

She sees a commodity correction coming but couldnt see an ARK correction?",t3_n9th6n,20
1620733567.0,2021-05-11,wallstreetbets,gxpv2g4,Lol Bloomberg is trying to blame inflation fears for sell off. Bruh. You do not sell for cash on inflation fears. That ain’t what this is.,t3_n9th6n,61
1620732033.0,2021-05-11,wallstreetbets,gxpsux3,It’s like that scene from *The Shining* where the elevator opens up and it’s nothing but blood.,t3_n9th6n,20
1620732496.0,2021-05-11,wallstreetbets,gxpti1g,Bull market cancelled,t3_n9th6n,19
1620737053.0,2021-05-11,wallstreetbets,gxq0xb0,I sold my SPY 423 put for a loss yesterday! 🤡,t3_n9th6n,19
1620737413.0,2021-05-11,wallstreetbets,gxq1lck,My timing is hilarious I stayed out for months to probably get my portfolio halved the day after I buy. Lmao I fucking hate this game.,t3_n9th6n,19
1620738588.0,2021-05-11,wallstreetbets,gxq3tld,I was promised Lambos but all I got was homelessness.,t3_n9th6n,19
1620742596.0,2021-05-11,wallstreetbets,gxqcabz,PLTR and the epic battle for *checks notes* nineteen dollars and fifty cents,t3_n9th6n,19
1620744604.0,2021-05-11,wallstreetbets,gxqgxpu,That dumpster at Wendy's is going to be busy tonight.,t3_n9th6n,20
1620764643.0,2021-05-11,wallstreetbets,gxrtfxm,"Omg FUBO, I fucking love you, haven’t seen green in months till now",t3_n9th6n,19
1620729858.0,2021-05-11,wallstreetbets,gxpq2m2,"“EV, Growth, Boomer, Commodity”

Long ago, the four stock types  lived together in harmony. Then everything changed when the 🌈🐻 Nation attacked. 

Only the Fed chairman, master of all four elements , could stop them. But when the world needed him most, he vanished.",t3_n9th6n,18
1620730346.0,2021-05-11,wallstreetbets,gxpqo63,"It’s a shame if you tripled down on PLTR yesterday, so no money to average down a 4th time 🤣🤣🤣🤣

^definitely ^not ^speaking ^from ^experience",t3_n9th6n,17
1620733300.0,2021-05-11,wallstreetbets,gxpuo3c,So... who’s going to be the person to buy a shitton of puts and turn this around?,t3_n9th6n,18
1620734231.0,2021-05-11,wallstreetbets,gxpw3ez,PALANTEARS 😭,t3_n9th6n,18
1620735773.0,2021-05-11,wallstreetbets,gxpyngq,At least we’re getting raped together ![gif](emote|free_emotes_pack|slightly_smiling)![gif](emote|free_emotes_pack|slightly_smiling),t3_n9th6n,19
1620736476.0,2021-05-11,wallstreetbets,gxpzvlx,"Portfolio: FUKT ✅
401k: SHIT ✅
Wife: Plowed by her boyfriend ✅
Wendy’s: APPLIED ✅",t3_n9th6n,19
1620737382.0,2021-05-11,wallstreetbets,gxq1j61,I hear Ornamental Gourds are a good buy right now.,t3_n9th6n,18
1620737725.0,2021-05-11,wallstreetbets,gxq26gt,Puts on me becoming rich,t3_n9th6n,17
1620738586.0,2021-05-11,wallstreetbets,gxq3tf2,Market ain't open yet but I'm gonna need it to go ahead and close already.,t3_n9th6n,19
1620738894.0,2021-05-11,wallstreetbets,gxq4f6f,"I love how I don't even need to open my account anymore. Just come here, scroll for 10 seconds, be depressed.",t3_n9th6n,18
1620738959.0,2021-05-11,wallstreetbets,gxq4jtj,"I live in the present, this loss is a problem for future me. 💁🏼‍♂️",t3_n9th6n,17
1620738979.0,2021-05-11,wallstreetbets,gxq4l7j,The fact that boomer stocks are also red makes the fact that I'm already down 15% in pre-market a lot easier to digest.,t3_n9th6n,17
1620753419.0,2021-05-11,wallstreetbets,gxr224w,[deleted],t3_n9th6n,18
1620728655.0,2021-05-11,wallstreetbets,gxpon6k,Cathie single handedly bankrupting an entire generation,t3_n9th6n,55
1620729224.0,2021-05-11,wallstreetbets,gxppb4c,r/bankruptcy getting some new recruits today,t3_n9th6n,57
1620735723.0,2021-05-11,wallstreetbets,gxpykg6,Honestly though. If some of y’all see your portfolios today and want to off yourself PLEASE. I beg you talk to someone. This shit is just money and you WILL make more.,t3_n9th6n,57
1620738892.0,2021-05-11,wallstreetbets,gxq4f1j,"the worst feeling in the world is looking at your portfolio at 9:29, then looking again at 9:30 when your options update.",t3_n9th6n,54
1620729469.0,2021-05-11,wallstreetbets,gxpplqu,Imagine being Warren Buffett right now. You’re watching the dip thinking it’s happening. You lick your 90 year old dry lips and prepare yourself to use your hundreds of billions dollar cash pile to buy the dip f*****.,t3_n9th6n,16
1620730058.0,2021-05-11,wallstreetbets,gxpqb6j,Im 100% certain that 70% of this sub will capitulate in a  bear market,t3_n9th6n,17
1620739182.0,2021-05-11,wallstreetbets,gxq4zq2,"Jesus, there's not a single ticker in sight that's green. Hold on tight everybody. You're gonna see things today you wish you hadn't.",t3_n9th6n,17
1620742785.0,2021-05-11,wallstreetbets,gxqcpsn,"I’m up 25% today, found a quarter in the gas station parking lot 📈",t3_n9th6n,18
1620743713.0,2021-05-11,wallstreetbets,gxqeuz8,All this b/c we're banning menthol cigarettes,t3_n9th6n,17
1620743800.0,2021-05-11,wallstreetbets,gxqf2cz,"What a bull trap this morning, geez.",t3_n9th6n,17
1620744682.0,2021-05-11,wallstreetbets,gxqh4j8,This is all because Elon decided to dress up as Wario on television.,t3_n9th6n,18
1620745635.0,2021-05-11,wallstreetbets,gxqjchq,"When I was young I was poor, and after a decade of hard work I am no longer young",t3_n9th6n,17
1620747028.0,2021-05-11,wallstreetbets,gxqmn27,"This may be the first time I’ve ever done this, but I had SPY puts yesterday that I sold for literally the bottom today and switched immediately to calls.",t3_n9th6n,17
1620761314.0,2021-05-11,wallstreetbets,gxrlesr,Y'all see that Gamestop tweet👁👁👁,t3_n9th6n,17
1620764490.0,2021-05-11,wallstreetbets,gxrt2fy,"Fubo up 24% 

I’m now only down, checks notes*
57%",t3_n9th6n,18
1620731917.0,2021-05-11,wallstreetbets,gxpsp1r,I went from +45% in February to -55% now. I'm about to call it quits,t3_n9th6n,48
1620737359.0,2021-05-11,wallstreetbets,gxq1hko,"TSLA down over 10% in 2 days yet Elon tweeting about a fake fucking meme coin as a way to pay for your new car

Fucking hell",t3_n9th6n,50
1620728630.0,2021-05-11,wallstreetbets,gxpom74,how do I block margin from calling me?,t3_n9th6n,16
1620736645.0,2021-05-11,wallstreetbets,gxq06kz,I WANT TO TALK WITH THE MANAGER OF NASDAQ,t3_n9th6n,16
1620736830.0,2021-05-11,wallstreetbets,gxq0iow,"""Proper fucked?""

""Yeah Tommy. Proper fucked.""",t3_n9th6n,17
1620738932.0,2021-05-11,wallstreetbets,gxq4hy8,STOP THE COUNT,t3_n9th6n,17
1620738949.0,2021-05-11,wallstreetbets,gxq4j5s,[deleted],t3_n9th6n,16
1620740847.0,2021-05-11,wallstreetbets,gxq8f2w,PLTR rising like a Phoenix...for the next twenty minutes,t3_n9th6n,17
1620742099.0,2021-05-11,wallstreetbets,gxqb6fy,Just read a article about how much money you would make if you invest 1000 in to BABA a year ago. Short story is you made 120$,t3_n9th6n,17
1620742292.0,2021-05-11,wallstreetbets,gxqblt0,I made $18 today,t3_n9th6n,15
1620743104.0,2021-05-11,wallstreetbets,gxqdg6e,"Within about 3 minutes of each other:

Retail is to blame for wild speculation leading to a sell off

Retail to the rescue?  Markets see turn around with retail buying.

Lets ignore the liquidity problem, chip shortage, inflation, slowing down housing market, and just resort to blaming Joe the WSB member who has June PLTR calls and 11 shares of GME.",t3_n9th6n,16
1620743693.0,2021-05-11,wallstreetbets,gxqetds,[deleted],t3_n9th6n,16
1620743956.0,2021-05-11,wallstreetbets,gxqffc8,So it was a bull trap lol,t3_n9th6n,16
1620744732.0,2021-05-11,wallstreetbets,gxqh8q1,Calls on divorce lawyers this week will print!,t3_n9th6n,16
1620754969.0,2021-05-11,wallstreetbets,gxr5uwh,"Damn it feels good to swing from -$1,500 to +200",t3_n9th6n,16
1620756987.0,2021-05-11,wallstreetbets,gxrasd3,Yo I fucking suck at stocks,t3_n9th6n,16
1620758723.0,2021-05-11,wallstreetbets,gxrf0rl,[deleted],t3_n9th6n,16
1620762239.0,2021-05-11,wallstreetbets,gxrnn6c,Started the day down 28%. Ended up 1%. This is a fuckin win.,t3_n9th6n,15
1620766141.0,2021-05-11,wallstreetbets,gxrx2c3,Man I’m feeling the FOMO of not getting on FUBO before close,t3_n9th6n,16
1620733011.0,2021-05-11,wallstreetbets,gxpu8n7,[deleted],t3_n9th6n,95
1620731773.0,2021-05-11,wallstreetbets,gxpsi4s,Ok so pltr posts great earnings and stock drops like shit lmao wtf,t3_n9th6n,14
1620734815.0,2021-05-11,wallstreetbets,gxpx1er,"this is the first time ive GUH'd myself on shares alone, jesus fuck",t3_n9th6n,15
1620734937.0,2021-05-11,wallstreetbets,gxpx8ld,My portfolio is performing so incredibly bad it's hilarious,t3_n9th6n,16
1620734962.0,2021-05-11,wallstreetbets,gxpxa0z,guess we all are bagholders now,t3_n9th6n,16
1620737441.0,2021-05-11,wallstreetbets,gxq1na4,I declare bankruptcy.,t3_n9th6n,15
1620737933.0,2021-05-11,wallstreetbets,gxq2kg4,[deleted],t3_n9th6n,15
1620738205.0,2021-05-11,wallstreetbets,gxq32s7,Time to buy AMD... Again... After buying it the last 15 dips.,t3_n9th6n,15
1620738758.0,2021-05-11,wallstreetbets,gxq45hc,"Gentlemen, it's been an honor losing money with you",t3_n9th6n,15
1620739016.0,2021-05-11,wallstreetbets,gxq4nu2,"Getting my teeth removed and finding a Wendy's dumpster to telework from. Please form an orderly line, gentlemen.",t3_n9th6n,15
1620739324.0,2021-05-11,wallstreetbets,gxq5a3b,"Well guess this stock shit is over, So you guys like baseball or something, wanna play baseball",t3_n9th6n,15
1620741381.0,2021-05-11,wallstreetbets,gxq9kxk,"#ROLL CALL, WHO IS STILL HOLDING $PLTR..CONGRATS!!!",t3_n9th6n,15
1620743790.0,2021-05-11,wallstreetbets,gxqf1hc,Execute order 66,t3_n9th6n,15
1620744032.0,2021-05-11,wallstreetbets,gxqflox,"This isn’t really a rug pull

More like the rug got stuck under the Roomba a week ago. Then it ran over some dog shit, and the feces soaked rug has been dragged around the house for days

🤡 🤡 🤡",t3_n9th6n,14
1620745340.0,2021-05-11,wallstreetbets,gxqintm,Can I offer you an egg in this trying time?,t3_n9th6n,15
1620745899.0,2021-05-11,wallstreetbets,gxqjysy,if small business is so great why is it small,t3_n9th6n,15
1620748394.0,2021-05-11,wallstreetbets,gxqpwzp,Little girl apartment across from me wailing Let It Go at the top of her lungs. I can only take this as a sign from the universe to close my browser and stop watching my account for the rest of the day. Good luck and Godspeed soldiers,t3_n9th6n,14
1620750051.0,2021-05-11,wallstreetbets,gxqtwh6,"I think congrats are in order. I sold two stocks near their bottom today, and they bounced back up.",t3_n9th6n,15
1620751064.0,2021-05-11,wallstreetbets,gxqwbt6,"The bags I'm holding right now will outlast me, eventually passing to my children and their children's children.  A family keepsake that will tell a great story and be entirely worthless for generations to come",t3_n9th6n,15
1620752381.0,2021-05-11,wallstreetbets,gxqzim6,I am shitfaced,t3_n9th6n,14
1620755236.0,2021-05-11,wallstreetbets,gxr6iqu,[deleted],t3_n9th6n,15
1620760488.0,2021-05-11,wallstreetbets,gxrjdo9,Used 10k to make 180$ bucks today 😎😎😎,t3_n9th6n,16
1620762044.0,2021-05-11,wallstreetbets,gxrn6dh,"welcome palatards, Sold yesterday at 18.51 with 25 cost average. I sacrificed for you guys.",t3_n9th6n,15
1620731977.0,2021-05-11,wallstreetbets,gxpss22,"Alright boys, only $40k more to go until my account is back at where my husband thinks my account is at.",t3_n9th6n,43
1620751759.0,2021-05-11,wallstreetbets,gxqxzqq,"When I was young, I was a terrible investor. 

**But after decades of hard work, I am no longer young.**


😎😎😎",t3_n9th6n,45
1620728920.0,2021-05-11,wallstreetbets,gxpoy63,Good thing for inflation otherwise I'd feel really bad losing all this money.,t3_n9th6n,14
1620732291.0,2021-05-11,wallstreetbets,gxpt7o4,Not even opening Schwab today. Not gonna ruin my day,t3_n9th6n,14
1620732672.0,2021-05-11,wallstreetbets,gxptqxi,Feels like PLTR will never see green ever again lmao,t3_n9th6n,15
1620733002.0,2021-05-11,wallstreetbets,gxpu858,"*Meet me at the mall* 

📉

*Meet me at the club* 

📉

*Meet me at the crib* 

📉",t3_n9th6n,13
1620733284.0,2021-05-11,wallstreetbets,gxpun7u,Calls on puts,t3_n9th6n,15
1620734279.0,2021-05-11,wallstreetbets,gxpw60z,"I got puts on roblox and it’s LITERALLY the only thing green in pre market 

I fuckin quit",t3_n9th6n,14
1620735152.0,2021-05-11,wallstreetbets,gxpxl5s,Im financially ruined,t3_n9th6n,15
1620736277.0,2021-05-11,wallstreetbets,gxpziut,Glad I got Resident Evil Village the other day....I need something way less scary to play than this today....,t3_n9th6n,14
