created,date,subreddit,id,body,parent_id,score
1602786219.0,2020-10-15,wallstreetbets,g8x8qm4,Anyone find the recent choppy movements every day very stressful?,t3_jbktdv,12
1602786357.0,2020-10-15,wallstreetbets,g8x90es,Now *this* is stonk racing,t3_jbktdv,12
1602787861.0,2020-10-15,wallstreetbets,g8xc0ys,whoever claimed that GME DD. Muchos gracias. Saved my account,t3_jbktdv,12
1602788086.0,2020-10-15,wallstreetbets,g8xchb4,GME is buying tiktok AH get in now!,t3_jbktdv,13
1602788290.0,2020-10-15,wallstreetbets,g8xcw0z,GME is really up 20% I cannot believe my fucking eyes,t3_jbktdv,12
1602788366.0,2020-10-15,wallstreetbets,g8xd1mg,"People telling me to sell my GME contracts expiring tm

I just saw a guy flip 300k coz he let his contracts expire worthless until they didnt

Im not selling til these 18c’s worthless",t3_jbktdv,12
1602788370.0,2020-10-15,wallstreetbets,g8xd1we,"#ROBINHOOD ESTIMATES HACKERS INFILTRATED ALMOST 2,000 ACCOUNTS  
  
https://twitter.com/zerohedge/status/1316815676707831808  
  
If my account got hacked, the hackers would be very surprised seeing my choices of options that are -80% down. They would spare me out of pity.",t3_jbktdv,12
1602788957.0,2020-10-15,wallstreetbets,g8xe8f0,If GME breaks 15 and holds it’s over for the shorts,t3_jbktdv,14
1602789007.0,2020-10-15,wallstreetbets,g8xec1x,GME CANT STOP WONT STOP,t3_jbktdv,12
1602789169.0,2020-10-15,wallstreetbets,g8xent2,"GAMESTOP: IT IS MA'AM. YOU SAID MA'AM

https://www.youtube.com/watch?v=jOkdR7on6Ok",t3_jbktdv,12
1602789192.0,2020-10-15,wallstreetbets,g8xepjk,Good job bullls,t3_jbktdv,12
1602789222.0,2020-10-15,wallstreetbets,g8xerr3,"made a quick 150% on GME 20C FD's expiring tomorrow, held for probably 3 hours... lmfao",t3_jbktdv,12
1602789245.0,2020-10-15,wallstreetbets,g8xetf6,[deleted],t3_jbktdv,12
1602789333.0,2020-10-15,wallstreetbets,g8xezy9,GME shorts tryna scare people by reshorting and pushing price down little do they know we got diamond hands lmfao,t3_jbktdv,12
1602791027.0,2020-10-15,wallstreetbets,g8xidp6,[deleted],t3_jbktdv,11
1602791090.0,2020-10-15,wallstreetbets,g8xii9b,"Two scenarios:

Open red - Buy Calls

Open Green - Buy Calls

Rinse and repeat",t3_jbktdv,11
1602791774.0,2020-10-15,wallstreetbets,g8xjuje,"""Boganov, He bought Puts.""

""Send him to his low waged job... PAHMP EEIT""",t3_jbktdv,13
1602792084.0,2020-10-15,wallstreetbets,g8xkgf7,"LOADED TO THE TITS WITH CALLS

&#x200B;

DEFINITELY LOADED WITH CALLS",t3_jbktdv,11
1602792320.0,2020-10-15,wallstreetbets,g8xkwop,Cashed out half my GME weeklies. Could’ve made 17k but I’m happy with 8k still 😁,t3_jbktdv,13
1602806809.0,2020-10-15,wallstreetbets,g8ybh9l,Long fucking week. I need to go rub one out!,t3_jbktdv,11
1602814998.0,2020-10-15,wallstreetbets,g8ypo9v,"My college roommate had a crush on this girl for 3 months. One night she came over to our place to party and disappeared into another roommate's room.

In the morning he saw her by the bathroom so he went to say hi and saw cum on her hair .

/rip",t3_jbktdv,11
1602767196.0,2020-10-15,wallstreetbets,g8w87ly,"If you don’t buy the dip, you ain’t black",t3_jbktdv,25
1602767952.0,2020-10-15,wallstreetbets,g8w9edz,"r/investing be like: Thoughts on my portfolio?

20% Physical Bank Branches

20% Brick and Mortar Retail

20% Linear TV

20% Freight Rail

20% Traditional Transportation",t3_jbktdv,26
1602757772.0,2020-10-15,wallstreetbets,g8vwyjy,"If you buy puts at open today, you may be retarded.",t3_jbktdv,23
1602763218.0,2020-10-15,wallstreetbets,g8w2psx,"Do not fucking open calls at 9:30-10:30.

The amount of selling is going to be strong. Go fap and come back with a clear head and don't try to catch falling knives.",t3_jbktdv,21
1602763399.0,2020-10-15,wallstreetbets,g8w2xq3,330 million new jobs.  They gave everyone in the country a job.  To the moon.,t3_jbktdv,22
1602758606.0,2020-10-15,wallstreetbets,g8vxqeu,I think my SPY calls are fucked.,t3_jbktdv,11
1602760467.0,2020-10-15,wallstreetbets,g8vzkk7,"Play the long game, We are entering earnings seasons, Be prepared for choppy waves.

Coffee and a Dog,  that's it boys.  Coffee and a Dog , that's all I need.

Along with Xvideos.com",t3_jbktdv,10
1602760586.0,2020-10-15,wallstreetbets,g8vzozu,"STOCKS IN EUROPE TUMBLE ACROSS THE CONTINENT AS VIRUS RESURGENCE, SPREADING LOCKDOWNS HIT MOOD",t3_jbktdv,11
1602760723.0,2020-10-15,wallstreetbets,g8vzu41,I’m waiting till 3pm before making a move. Might miss some opportunities but I’ve got burned too many times trying to jump in right at open,t3_jbktdv,11
1602762596.0,2020-10-15,wallstreetbets,g8w1yjf,"Man, I just bought SPCE and RKT calls yesterday. Dropped 15k into them. 😔",t3_jbktdv,10
1602763407.0,2020-10-15,wallstreetbets,g8w2y2i,SPY 10/19 343P at open,t3_jbktdv,12
1602764166.0,2020-10-15,wallstreetbets,g8w3wnp,I swear every time I go monthly or longer on a position all the fucker does is drill,t3_jbktdv,11
1602765682.0,2020-10-15,wallstreetbets,g8w5yby,What if we drill team 6 at open then we ram our life saving on calls at 10:45. How rich will we be.,t3_jbktdv,11
1602765685.0,2020-10-15,wallstreetbets,g8w5yig,"There go my UPS calls,  fuck this",t3_jbktdv,11
1602766001.0,2020-10-15,wallstreetbets,g8w6erp,""" gold is a good hedge""- # biggest bullshit of decade",t3_jbktdv,11
1602766190.0,2020-10-15,wallstreetbets,g8w6okf,local man finds 1 simple trick to lose thousands everyday,t3_jbktdv,10
1602766489.0,2020-10-15,wallstreetbets,g8w74lv,Scared to buy this dip tbh,t3_jbktdv,11
1602767433.0,2020-10-15,wallstreetbets,g8w8kxq,"We’re about to go down, fastly",t3_jbktdv,10
1602768131.0,2020-10-15,wallstreetbets,g8w9oqv,"Days like this, I’m just feeling like getting a latte and do actual work",t3_jbktdv,11
1602768140.0,2020-10-15,wallstreetbets,g8w9pa6,waiting for my portfolio to drop 45% in 8 mins,t3_jbktdv,11
1602768443.0,2020-10-15,wallstreetbets,g8wa6zf,$10k NIO leaps at open.,t3_jbktdv,11
1602770399.0,2020-10-15,wallstreetbets,g8wdig6,"AAPL going green today, buy in now",t3_jbktdv,10
1602770469.0,2020-10-15,wallstreetbets,g8wdmua,This a fake drop if I ever seen one,t3_jbktdv,11
1602772324.0,2020-10-15,wallstreetbets,g8wgzmj,i want Hunter Biden to plan my bachelor party,t3_jbktdv,10
1602772509.0,2020-10-15,wallstreetbets,g8whc0e,"NIO holders with Ray-Bans 

bears with colored Oakleys",t3_jbktdv,9
1602773006.0,2020-10-15,wallstreetbets,g8wi9gx,"Back when NIO was $2 a share some guy in here was ripping his boss for dropping 100k on NIO. Calling him a retard, etc. Would make fun of him every time he'd drop another 15k on it.",t3_jbktdv,11
1602773635.0,2020-10-15,wallstreetbets,g8wjhjt,"The president is behind in polls and desperate to say anything to keep the market up.  Forget democrats, **his own senate** has said it won't pass anything he is proposing about in these interviews.  Dire straits for mango.",t3_jbktdv,11
1602773834.0,2020-10-15,wallstreetbets,g8wjvhx,FOMOd into the FSLY dip,t3_jbktdv,11
1602773853.0,2020-10-15,wallstreetbets,g8wjwu0,Only down 90% on my draft king calls,t3_jbktdv,11
1602774386.0,2020-10-15,wallstreetbets,g8wkyc9,"Come on, Dumpster.  Offers 3 Trillion Stimmy.  GO BIG OR GO HOME.  Low energy!  Sad!",t3_jbktdv,11
1602775281.0,2020-10-15,wallstreetbets,g8wmowd,"Had 1 hr appointment and left worried about PTON - just came back and WTF such a ridiculous stock, how can you not love it.",t3_jbktdv,11
1602776964.0,2020-10-15,wallstreetbets,g8wq1vm,"#DAILY REMINDER 🎗️

#WILL MEADE SAID TO SHORT PTON AT $45",t3_jbktdv,10
1602778116.0,2020-10-15,wallstreetbets,g8wsd1x,AAPL going green you heard it here first,t3_jbktdv,13
1602778242.0,2020-10-15,wallstreetbets,g8wsm3n,"almost pulled the trigger on pton at $31, then thought “it’s just a stupid bike company” fuck me",t3_jbktdv,11
1602778902.0,2020-10-15,wallstreetbets,g8wtxoq,McConnell just rejected larger stim package,t3_jbktdv,12
1602778944.0,2020-10-15,wallstreetbets,g8wu0r1,Trump literally said he would be ok with 1.8T+ and Mitch is like no 500 billion like WHAT JUST PASS IT YALL WERE SO CLOSE,t3_jbktdv,11
1602779168.0,2020-10-15,wallstreetbets,g8wuh60,"I've literally never played zoom in my entire life. No calls, no puts, no shares.

But I still get physically angry when I look at that chart. Stupidest fucking stock perhaps in the entire history of the US stock market. Fucking video chat.",t3_jbktdv,11
1602779228.0,2020-10-15,wallstreetbets,g8wull4,I need Trump to come out riding a peleton bike,t3_jbktdv,11
1602779868.0,2020-10-15,wallstreetbets,g8wvw3s,GME 14,t3_jbktdv,12
1602779869.0,2020-10-15,wallstreetbets,g8wvw6b,Is today the day for a GME short squeeze???,t3_jbktdv,12
1602780284.0,2020-10-15,wallstreetbets,g8wwqnx,GME yesss I'm watching big short for the 1000th time tonight bb!!,t3_jbktdv,13
1602780387.0,2020-10-15,wallstreetbets,g8wwy8a,Gotta love when you close a position for profit and then it immediately tanks -50% 😎,t3_jbktdv,12
1602780407.0,2020-10-15,wallstreetbets,g8wwznf,Yes GME squeeze my balls tighter,t3_jbktdv,13
1602781641.0,2020-10-15,wallstreetbets,g8wzidk,[deleted],t3_jbktdv,11
1602782064.0,2020-10-15,wallstreetbets,g8x0d61,"First week playing options. I think I’m getting the hang of this!
https://i.imgur.com/4i6aKkr.jpg",t3_jbktdv,11
1602782091.0,2020-10-15,wallstreetbets,g8x0f5l,"I feel bad for the guy who lost all his money on gme, like all he had to do was wait a week",t3_jbktdv,11
1602782391.0,2020-10-15,wallstreetbets,g8x10wt,"Absolutely no sympathy for the GME put holders and bears from here who could’ve looked at fundamentals, console cycles, big money, then actively trying to turn the sinking ship around but instead they got all “GME shit company because they didn’t give me more than 3.50 for my 5 year old GTA SA”.",t3_jbktdv,11
1602783509.0,2020-10-15,wallstreetbets,g8x3ap3,"I'm buying 600 gme shares to help the short squeeze

Do your part f*****",t3_jbktdv,12
1602785630.0,2020-10-15,wallstreetbets,g8x7k52,SPY green eod confirmed,t3_jbktdv,12
1602786253.0,2020-10-15,wallstreetbets,g8x8t1m,Trump announcing stimmy at tonight’s town hall. Green AS FUCK tomorrow,t3_jbktdv,12
1602787075.0,2020-10-15,wallstreetbets,g8xafqq,"Money on Robinhood is fake,

Money on Robinhood is fake,

Money on Robinhood is fake

Ok phew I’ll be able to sleep tonight now",t3_jbktdv,10
1602787747.0,2020-10-15,wallstreetbets,g8xbsm9,"according to some quick math, if gme closes at 40 tomorrow i make 1.3 million dollars. so, like, can somebody get on that please",t3_jbktdv,11
1602788010.0,2020-10-15,wallstreetbets,g8xcbup,"&#x200B;

|I'M|NOT|
|:-|:-|
|FUCKING|SELLING|",t3_jbktdv,12
1602788062.0,2020-10-15,wallstreetbets,g8xcfhv,Holy shit is the GME squeeze happening,t3_jbktdv,11
1602788298.0,2020-10-15,wallstreetbets,g8xcwme,#P O W E R H O U R,t3_jbktdv,11
1602789148.0,2020-10-15,wallstreetbets,g8xemcm,"I started today thinking ""Don't look at your portfolio.  It's a bigly down day.  It happens.  Suck it up.""

Portfolio was down almost 6% today and now I'm almost even.

This shit is insane.",t3_jbktdv,11
1602789634.0,2020-10-15,wallstreetbets,g8xflq4,"It’s fucking bullshit that we are almost green for the day, this market never corrects under any circumstances lmfaoo",t3_jbktdv,12
1602790470.0,2020-10-15,wallstreetbets,g8xh9rs,"Goldman Sachs would sell out their own kids to turn a profit. Epitome of greedy, calculating, morally indifferent bankers.

They know how to turn a profit though.",t3_jbktdv,10
1602792009.0,2020-10-15,wallstreetbets,g8xkb6b,PENCILS DOWN,t3_jbktdv,11
1602792059.0,2020-10-15,wallstreetbets,g8xkepy,"Recession over, big earnings coming up. Orange man said it",t3_jbktdv,10
1602762648.0,2020-10-15,wallstreetbets,g8w20tc,"Guess Reddit decided BLM is over, app icon is back to red.",t3_jbktdv,33
1602763221.0,2020-10-15,wallstreetbets,g8w2pwf,Imagine owning a hedge fund. Now imagine owning the worlds largest hedge fund. Now imagine owning the worlds largest hedge fund and being given taxpayer money for the sole purpose of stealing from taxpayers. This is the system we live in today.,t3_jbktdv,22
1602763668.0,2020-10-15,wallstreetbets,g8w39rl,ah dont you love how the market goes from extreme bullish one week and then extreme bearish the next FOR NO GODDAMN FUKKEN REASON?,t3_jbktdv,21
1602772086.0,2020-10-15,wallstreetbets,g8wgjov,"TRUMP SAYS HE WOULD CUT INCOME TAXES IF HE IS RE-ELECTED

*riiiiiiiiigggggggghtttttttttttt*",t3_jbktdv,21
1602756837.0,2020-10-15,wallstreetbets,g8vw46f,He bought...?,t3_jbktdv,19
1602801437.0,2020-10-15,wallstreetbets,g8y22j3,Pretty sure Mitch McConnell hates America,t3_jbktdv,20
1602756710.0,2020-10-15,wallstreetbets,g8vw042,It’s just one big double top isn’t it :(,t3_jbktdv,10
1602757867.0,2020-10-15,wallstreetbets,g8vx1om,##Bulls in shambles,t3_jbktdv,10
1602762587.0,2020-10-15,wallstreetbets,g8w1y4z,"Sell winner too soon, sell losers too late. 

Am I doing this rufgt",t3_jbktdv,10
1602763258.0,2020-10-15,wallstreetbets,g8w2ri1,"Oh fuck boys, I just realized I can short sell in my brokerage account.

Guess who's gonna start losing money on low-float pre-market movers from now on!",t3_jbktdv,10
1602763312.0,2020-10-15,wallstreetbets,g8w2tv1,"Buy high, sell low. Then wait till it goes back up to buy back the same positions",t3_jbktdv,11
1602763421.0,2020-10-15,wallstreetbets,g8w2yos,$370 SPY CALLS NOV 2 YOLO,t3_jbktdv,10
1602764505.0,2020-10-15,wallstreetbets,g8w4cos,There’s people here that don’t even understand the Greeks. That is why you should not take advice from anyone but yourself. Fucking morons,t3_jbktdv,10
1602765047.0,2020-10-15,wallstreetbets,g8w52ry,Every person with three brain cells knows no stimi before 11/3,t3_jbktdv,10
1602765108.0,2020-10-15,wallstreetbets,g8w55pg,it appears that they have taken our jobs.,t3_jbktdv,9
1602765958.0,2020-10-15,wallstreetbets,g8w6ciw,I am not selling,t3_jbktdv,9
1602766798.0,2020-10-15,wallstreetbets,g8w7lnr,[deleted],t3_jbktdv,10
1602767033.0,2020-10-15,wallstreetbets,g8w7yhv,so apparently should NOT have gotten out of my LEAPs for a small profit to buy weeklies,t3_jbktdv,10
1602767208.0,2020-10-15,wallstreetbets,g8w887y,Goddamn it I should not have entered into TECH plays yesterday for a potential earnings run up. Looking at robinhood rn makes me puke,t3_jbktdv,10
1602767706.0,2020-10-15,wallstreetbets,g8w90df,Trump curse of stock market ATH continues.,t3_jbktdv,11
1602767975.0,2020-10-15,wallstreetbets,g8w9fqw,SPY earnings didn’t meet analysts expectations I’m guessing? That or their CEO is in hot water again,t3_jbktdv,11
1602768139.0,2020-10-15,wallstreetbets,g8w9p9b,"Hannibal on NFLX is really really good. Starts slow, but then gets amazing! For anyone who likes murdery stuff.",t3_jbktdv,10
1602768700.0,2020-10-15,wallstreetbets,g8waly1,"He’s a scenario for you:

Stimulus talks drag out to the week before Election Day. An agreed WH/Dem deal gets voted on and sent to Senate for vote. Repub senators grumble about deficit and delay with no vote. Election Day happens and Trump is clearly not going to win, regardless of mail-in counting.  Trump says fuck it and decides he no longer supports any stimulus since there is nothing in it for him. 

In the background, Europe lockdowns are occurring, cases are rising in US, and unemployment continues a trend up.",t3_jbktdv,11
1602769778.0,2020-10-15,wallstreetbets,g8wcfbo,"GME gotta be the absolute most retarded thing I’ve ever touched.

GME 14c 11/20",t3_jbktdv,11
1602770561.0,2020-10-15,wallstreetbets,g8wdstj,"I stopped being a bear because no matter how red or far things dropped. It would recover AH, PM, or right at open.

I would be fuming. Calling how rigged it all is. Then it hit me. Bears are fucked. And buy the dip.",t3_jbktdv,10
1602770712.0,2020-10-15,wallstreetbets,g8we2as,My girlfriend gave me a blowjob last night cause I convinced her to drop $5k on NIO when it was $15,t3_jbktdv,11
1602771273.0,2020-10-15,wallstreetbets,g8wf2jl,I need help Mr. Professional Apple Trader,t3_jbktdv,9
1602772193.0,2020-10-15,wallstreetbets,g8wgqpy,"TRUMP SAID 'GOING TO SEE GREAT NUMBERS' ON ECONOMY, ALTHOUGH HE DOESN'T KNOW THEM

Jinxed it again 🤷‍♂️",t3_jbktdv,11
1602772381.0,2020-10-15,wallstreetbets,g8wh3ia,"Fake sell-off. I am confident tech will do well and this will rally later today, tomorrow, and into next week. Keep selling. I'm buying.",t3_jbktdv,10
1602772888.0,2020-10-15,wallstreetbets,g8wi1ek,I knew I should have stretched my dick this morning 😔,t3_jbktdv,10
1602773219.0,2020-10-15,wallstreetbets,g8wiodp,"**Federal Reserve released the median wealth per age bracket data.**

https://i.imgur.com/vHKC7DQ.png

Median Wealth:

Under 35 = $6,900

Age 35-44 = $45,740

Age 45-54 = $100,000

Age 55-64 = $164,498

Age 65-69 = $193,833

Age 70-74 = $225,390

*Source: federalreserve.gov*",t3_jbktdv,10
1602773266.0,2020-10-15,wallstreetbets,g8wirml,"Does anyone else feel dead inside due to this year? Man south park really got that shit right. I've had a few winning positions today, but even that isn't enough to make my soul a little lighter. Also I'm not suicidal. Just dead inside due to covid and stress. But the good news is I got a 2020 jeep this year. Me and the wife went off roading with it the next week after we bought it. We took our 2 year old too. Literally drove up a mountain. Then 3 weeks later we found out I should have gotten the 4 door instead of the 2 door..... Also has anyone ever seen a man in a suit put a 2 year old into and take out of a car seat in a 2 door jeep. Its alot easier if you have experience with keeping your spine stiff.",t3_jbktdv,10
1602775240.0,2020-10-15,wallstreetbets,g8wmm2n,OF COURSE IT PUMPS RIGHT AFTER I FUCKING SELL,t3_jbktdv,9
1602776033.0,2020-10-15,wallstreetbets,g8wo6po,PTON says fuck your resistance,t3_jbktdv,10
1602776803.0,2020-10-15,wallstreetbets,g8wpq8a,GME mooning on zero news lmao this is how you know you’re winning,t3_jbktdv,10
1602776970.0,2020-10-15,wallstreetbets,g8wq2d0,Price action on GME is nutso,t3_jbktdv,10
1602777059.0,2020-10-15,wallstreetbets,g8wq8xs,I can’t believe I’m addicted to hot bean water,t3_jbktdv,8
1602777182.0,2020-10-15,wallstreetbets,g8wqhu6,Holy fuck I made a dollar I must be like the greatest investor or something,t3_jbktdv,11
1602777584.0,2020-10-15,wallstreetbets,g8wrb4h,GME gang - are we diamond handing this into holiday season?,t3_jbktdv,11
1602777629.0,2020-10-15,wallstreetbets,g8wrecx,Holy fuck GME. All shorts will close soon. $20 EoW,t3_jbktdv,10
1602778221.0,2020-10-15,wallstreetbets,g8wskjj,[deleted],t3_jbktdv,11
1602779651.0,2020-10-15,wallstreetbets,g8wvgey,Is gme still a buy this high,t3_jbktdv,11
1602779653.0,2020-10-15,wallstreetbets,g8wvgjj,"Tesla can't afford their water bill, buy calls.

[https://www.manufacturing.net/automotive/news/21198440/water-company-cuts-off-tesla-over-unpaid-bills](https://www.manufacturing.net/automotive/news/21198440/water-company-cuts-off-tesla-over-unpaid-bills)",t3_jbktdv,9
1602779888.0,2020-10-15,wallstreetbets,g8wvxko,"This GME chart is so fucking bullish holy shit, it may keep running all day",t3_jbktdv,10
1602779894.0,2020-10-15,wallstreetbets,g8wvy2e,MARKET IS DEPENDENT ON DEL TACO EARNINGS,t3_jbktdv,9
1602780032.0,2020-10-15,wallstreetbets,g8ww80j,you should be required to pass a 6th grade level government quiz before posting in here. holy fuck guys,t3_jbktdv,10
1602780179.0,2020-10-15,wallstreetbets,g8wwiv6,"Hey Mango here's an idea, how bout you created a bigger bill that nancy that way you can take all the credit? Nancy cant reject it either cuz its bigger and thats what she wants!",t3_jbktdv,10
1602780341.0,2020-10-15,wallstreetbets,g8wwux4,GME heavy volume and no news. I don’t think this is the squeeze..but somebody knows something.,t3_jbktdv,10
1602780852.0,2020-10-15,wallstreetbets,g8wxwl5,GME doing the thing again,t3_jbktdv,11
1602781471.0,2020-10-15,wallstreetbets,g8wz62g,Should have sold NIO at peak today...great,t3_jbktdv,11
1602781901.0,2020-10-15,wallstreetbets,g8x019p,"GME holders deserve all the tendies they gonna get

Good job holding retards",t3_jbktdv,10
1602781961.0,2020-10-15,wallstreetbets,g8x05pz,Damn can't believe that GME DD was legit,t3_jbktdv,10
1602782106.0,2020-10-15,wallstreetbets,g8x0g9g,GME GANG GANG GANG,t3_jbktdv,10
1602782112.0,2020-10-15,wallstreetbets,g8x0go8,Jesus man.  My GME 14c are up 190% but 700% from when i first thought about buying them this morning.,t3_jbktdv,11
1602783489.0,2020-10-15,wallstreetbets,g8x39bd,NIO stopping off at the battery changer,t3_jbktdv,10
1602783561.0,2020-10-15,wallstreetbets,g8x3eh8,Never EVER cut jalapenos and pick your nose.,t3_jbktdv,10
1602784041.0,2020-10-15,wallstreetbets,g8x4din,if NET ends the day green I will get a tattoo of the cloudflare logo. or ban. Tag it and bag it boys,t3_jbktdv,10
1602784260.0,2020-10-15,wallstreetbets,g8x4teb,"[MCCONNELL SAYS PRESIDENT TRUMP IS TALKING ABOUT 'A MUCH LARGER AMOUNT (FOR CORONAVIRUS RELIEF) THAN I CAN SELL TO MY MEMBERS' IN THE SENATE](https://twitter.com/deitaone/status/1316797715758682112?s=21)


Would you like to take a look at this bill? It’s only 10% off.


We have that one over there but that one takes care of Americans so we don’t like to sell that bill over there.",t3_jbktdv,10
1602784654.0,2020-10-15,wallstreetbets,g8x5m5a,"Dec 12 2020

CNBC headline: PTON rallies 3.7% premarket as comet crashes into earth vaporizing all life",t3_jbktdv,12
1602784691.0,2020-10-15,wallstreetbets,g8x5ot4,did anyone else think prime day sucked and no one really cared about it? didn’t see it trending on twitter once...couldn’t find anything good on slick deals or just browsing at all.,t3_jbktdv,9
1602785239.0,2020-10-15,wallstreetbets,g8x6s9t,I am totally going to GameStop the next time I’m near one,t3_jbktdv,10
1602785367.0,2020-10-15,wallstreetbets,g8x71dc,"Wish I could sell my GME contracts for 120% gain but I'm out of day trades lol. I can never win, and they will no doubt be worthless tomorow morning",t3_jbktdv,11
1602785423.0,2020-10-15,wallstreetbets,g8x75av,We’re in agreement that tomorrow is gonna be green af right?,t3_jbktdv,10
1602786043.0,2020-10-15,wallstreetbets,g8x8e0v,PTON recalls bikes and still goes up on a red day. unbelievable,t3_jbktdv,9
1602787306.0,2020-10-15,wallstreetbets,g8xawiq,"GME needs to stop teasing us with the 15% gains mans. We know you can do the 40-50. Just give it to us. 

Give us the fattest and longest green dildo. We’re ready.",t3_jbktdv,10
1602787552.0,2020-10-15,wallstreetbets,g8xbegy,The bigger the doomp the bigger the coom #JelqLife,t3_jbktdv,10
1602787656.0,2020-10-15,wallstreetbets,g8xbm53,DKNG is like that one girl you dated who you’d get in a small argument with and she’d go out and fuck 2 guys to get back at you but then she was really sorry about it and 2 weeks after it happened you were really starting to see a change but you obviously couldn’t tell your friends you were still seeing her because of what happened but the sex was so good and she was trying so hard and *honestly* those were a great 2 weeks! But then your buddy’s roommate finds her on tinder and they been fuckin the whole time too.,t3_jbktdv,10
1602787714.0,2020-10-15,wallstreetbets,g8xbq81,Bout to be sour hour for Gme.... put holders that is 🤡,t3_jbktdv,11
1602787857.0,2020-10-15,wallstreetbets,g8xc0nm,"pls continue shorting GME, bears ;)",t3_jbktdv,10
1602787987.0,2020-10-15,wallstreetbets,g8xca98, つ ◕\_◕ ༽つ GME TAKE MAH POWAH,t3_jbktdv,10
1602789121.0,2020-10-15,wallstreetbets,g8xekbu,GME GO BRRRR,t3_jbktdv,11
1602789297.0,2020-10-15,wallstreetbets,g8xexci,Went from poor to less poor,t3_jbktdv,9
1602789320.0,2020-10-15,wallstreetbets,g8xez1d,1.1 mil vol green candle right there on gme holy shit,t3_jbktdv,10
1602789443.0,2020-10-15,wallstreetbets,g8xf7yd,Apple going for green...,t3_jbktdv,10
1602789596.0,2020-10-15,wallstreetbets,g8xfiy8,Ber fuk ber fuk ber fuk,t3_jbktdv,11
1602789640.0,2020-10-15,wallstreetbets,g8xfm77,Rotation back to FOMO,t3_jbktdv,10
1602790215.0,2020-10-15,wallstreetbets,g8xgrfc,This year has been absolutely brutal for the perpetual bears.,t3_jbktdv,10
1602791091.0,2020-10-15,wallstreetbets,g8xiica,LMAO I FUCKING KNEW IT BRRRRRRRRRRR,t3_jbktdv,10
1602791599.0,2020-10-15,wallstreetbets,g8xji2b,"I wonder if anyone hacked into my RH account and saw the -$4,500 balance.",t3_jbktdv,10
1602791999.0,2020-10-15,wallstreetbets,g8xkag7,I bought the dip this time instead of being a scared little bitch. Let's go.,t3_jbktdv,10
1602792019.0,2020-10-15,wallstreetbets,g8xkbuz,Tomorrow’s gonna be green AF,t3_jbktdv,10
1602792058.0,2020-10-15,wallstreetbets,g8xkemp,"Finished the day at -1%.  I was expecting -10% at premarket this morning.

Down days always happen- but a -1% down day isn't bad at all.",t3_jbktdv,10
1602800906.0,2020-10-15,wallstreetbets,g8y14cb,"Double top, cup and handle, fettuccine retracement, bologna bands. Don’t  matter, SPY tree fiddy tomorrow",t3_jbktdv,10
1602757349.0,2020-10-15,wallstreetbets,g8vwkr9,NIO save us,t3_jbktdv,18
1602757465.0,2020-10-15,wallstreetbets,g8vwoia,GUH morning everyone,t3_jbktdv,20
1602757767.0,2020-10-15,wallstreetbets,g8vwydj,"Sisters and brothers, today we remember that 🐻 s, being a native species, are the real Americans and that domesticated 🐄 s were brought here from foreign lands.
#🇺🇸 🇺🇸 🇺🇸 🇺🇸 🇺🇸 🇺🇸 🇺🇸 🇺🇸 🇺🇸 🇺🇸 🇺🇸 🇺🇸 🇺🇸",t3_jbktdv,19
1602763928.0,2020-10-15,wallstreetbets,g8w3lm9,Bot trading should be banned,t3_jbktdv,19
1602765802.0,2020-10-15,wallstreetbets,g8w64g7,Why the FUCK is testing even an issue you fucking fuck face mnuchin? just agree to what the lady wants!!!! WHAT IS THE PROBLEM WITH TESTING,t3_jbktdv,19
1602757880.0,2020-10-15,wallstreetbets,g8vx24c,[deleted],t3_jbktdv,18
