created,date,subreddit,id,body,parent_id,score
1630001856.0,2021-08-26,wallstreetbets,hagdt8d,"**REMINDER**

No stocks under $1 billion market cap.",t3_pbwdez,1
1629995596.0,2021-08-26,wallstreetbets,hafxsbx,[deleted],t3_pbwdez,49
1629994285.0,2021-08-26,wallstreetbets,hafugt7,"Breaking: ISIS has claimed responsibility for Kabul attacks, declaring they will continue as long as people buy CLOV",t3_pbwdez,37
1630000432.0,2021-08-26,wallstreetbets,haga9da,When does Ashton Kutcher jump out and tell me I’ve actually only been trading on a paper account for the last year? Please god.,t3_pbwdez,33
1629990440.0,2021-08-26,wallstreetbets,hafkxwo,"Push to me the edge

All me calls are dead",t3_pbwdez,27
1629990791.0,2021-08-26,wallstreetbets,hafls5v,My portfolio went from moon mission into a deep diving expedition,t3_pbwdez,28
1629997013.0,2021-08-26,wallstreetbets,hag1g6v,"put your money into something safe boys, like meme stocks",t3_pbwdez,25
1629980939.0,2021-08-26,wallstreetbets,haezwci,"Y’all ever be chillin, and think... damn, I’d be retired if I wasn’t so fkn stupid?",t3_pbwdez,73
1629988492.0,2021-08-26,wallstreetbets,hafg7c4,If you guys think Kabul has anything to do with spy you are truly an autist. Kabul could get nuked and spy wouldn't move,t3_pbwdez,23
1629994399.0,2021-08-26,wallstreetbets,hafur2g,If I was smart I would’ve  taken the 700$ I made at 10 …now I’m up only 100 and my IQ is room temperature .,t3_pbwdez,24
1630006393.0,2021-08-26,wallstreetbets,hagp2aw,If you like spy at 446 you’re going to love it at 442,t3_pbwdez,23
1630001142.0,2021-08-26,wallstreetbets,hagc1co,GME chart is beautiful.,t3_pbwdez,21
1629995343.0,2021-08-26,wallstreetbets,hafx527,Just realized I went to class in a jizz stained shirt lol whoops,t3_pbwdez,20
1629989509.0,2021-08-26,wallstreetbets,hafiosh,"The world is not ending, just Afghanistan.

Back in business soon ✅",t3_pbwdez,19
1629992096.0,2021-08-26,wallstreetbets,hafoywi,"This is my worst trading day

*Narrator: worst trading day so far*",t3_pbwdez,19
1629982419.0,2021-08-26,wallstreetbets,haf2qfe,"**look we all do dumb shit**

But buying 50 NIO 8/27 ITM calls was down right neanderthal",t3_pbwdez,18
1629999356.0,2021-08-26,wallstreetbets,hag7i4e,Ever wonder how much more money you would have if you just bought Faang the last half decade instead of trying to be smart,t3_pbwdez,18
1629999943.0,2021-08-26,wallstreetbets,hag90gl,Up 5 bucks today... feeling pretty good about that,t3_pbwdez,18
1629990120.0,2021-08-26,wallstreetbets,hafk5xj,Fuck I shouldn’t have bought the dip,t3_pbwdez,15
1629992648.0,2021-08-26,wallstreetbets,hafqcbo,"The stock market is literally a random simulation. Carnival has a god damn covid outbreak on one it’s ships and it’s up 7% this week.

Why did I ever stray from meme stocks",t3_pbwdez,18
1630001098.0,2021-08-26,wallstreetbets,hagbxk4,GME needs to break 220,t3_pbwdez,18
1630001424.0,2021-08-26,wallstreetbets,hagcqhu,"Well I sold my calls, lost 5k, shit.",t3_pbwdez,17
1630009115.0,2021-08-26,wallstreetbets,hagvthg,I swear I lose 4-5% every day almost no matter what,t3_pbwdez,18
1629981227.0,2021-08-26,wallstreetbets,haf0fpz,Nirvana getting sued for the album cover baby pic by the 30 yr old baby now. What a loser.,t3_pbwdez,49
1629981863.0,2021-08-26,wallstreetbets,haf1nb6,"Dogs are the best people

All you really need in life is a dog, some escorts now and then and 2 or 3 close personal friends",t3_pbwdez,49
1629986158.0,2021-08-26,wallstreetbets,hafaqh3,[removed],t3_pbwdez,17
1629986406.0,2021-08-26,wallstreetbets,hafbb1r,GME go back up fuck off,t3_pbwdez,17
1629987823.0,2021-08-26,wallstreetbets,hafele6,I have it on good authority that AMC will either finish in the green or in the red today,t3_pbwdez,16
1629988683.0,2021-08-26,wallstreetbets,hafgo5e,[deleted],t3_pbwdez,16
1629990135.0,2021-08-26,wallstreetbets,hafk78u,# rip everyone who just posted that they bought the dip.,t3_pbwdez,17
1630001926.0,2021-08-26,wallstreetbets,hagdzdd,Dang GME is cooking even as AMC is tanking...very strange,t3_pbwdez,17
1630006458.0,2021-08-26,wallstreetbets,hagp85u,"Boutta flip a coin to buy a SPY call or put

Edit: It was tails for put. Retard quarter",t3_pbwdez,16
1629981624.0,2021-08-26,wallstreetbets,haf16ry,"When I was young, I was a terrible investor.

But after decades of hard work, I am no longer young.

Cheers Boys 🍻",t3_pbwdez,118
1630003347.0,2021-08-26,wallstreetbets,haghhsp,Nothing more American than war. Spy will pump on patriotism and love for the 🇺🇸,t3_pbwdez,15
1629986817.0,2021-08-26,wallstreetbets,hafc93o,"SNDL and BB, need to get higher than high to get high.",t3_pbwdez,14
1629989584.0,2021-08-26,wallstreetbets,hafivd1,All my calls are now -99%,t3_pbwdez,14
1629992810.0,2021-08-26,wallstreetbets,hafqqwp,"All I want is one 10 bagger every trading day for the rest of my life for me and my friends.  


Is that too much to ask?",t3_pbwdez,15
1629992873.0,2021-08-26,wallstreetbets,hafqwnk,When jpow make sound?,t3_pbwdez,15
1629993926.0,2021-08-26,wallstreetbets,haftkhd,"“What is this, a dip for ants??” Exclaimed the trader, forgetting that he was indeed an ant.",t3_pbwdez,14
1630004205.0,2021-08-26,wallstreetbets,hagjmet,"Whoever sold me those GME FD’s, well played. Enjoy my money!",t3_pbwdez,13
1630005770.0,2021-08-26,wallstreetbets,hagnif8,At least gme is green,t3_pbwdez,14
1630006487.0,2021-08-26,wallstreetbets,hagparw,Playing so many weeklies that two weeks out feels like a leap 🧐,t3_pbwdez,15
1629975224.0,2021-08-26,wallstreetbets,haeqpmh,"Low comment volume around here, everyone must be participating at the paralympics",t3_pbwdez,85
1629982598.0,2021-08-26,wallstreetbets,haf33fw,I need to turn $300 into $100K by this time next week,t3_pbwdez,84
1629988341.0,2021-08-26,wallstreetbets,haffu9c,Wtf guys I put my entire 401K into GME weeklies and you guys screw me like this?,t3_pbwdez,13
1629990962.0,2021-08-26,wallstreetbets,hafm72x,"Bomb me once, shame on you. Bomb me twice, buy the dip?",t3_pbwdez,13
1629992030.0,2021-08-26,wallstreetbets,hafosx6,Fuck this market and my retarded ass,t3_pbwdez,12
1629998823.0,2021-08-26,wallstreetbets,hag64ku,"Has anyone hear read the DD about why GME keeps surging every quarter?

The ""squeeze loop"" theory is pretty damn convincing.",t3_pbwdez,12
1630000344.0,2021-08-26,wallstreetbets,haga19v,Gonna do the take a shower and see where its at strategy,t3_pbwdez,12
1630001333.0,2021-08-26,wallstreetbets,hagci7h,Fuck the taliban,t3_pbwdez,13
1630003877.0,2021-08-26,wallstreetbets,hagit2g,"Jackson hole summit starting now

Afghanistan evacuation getting worse

Inflation still not as transitory as expected

Shipping and production costs rising in near future

Most of Wall Street still away on vacations

China markets continuing to implode

Def nothing wrong with this bull market, full steam ahead

Also adding that for months we have had decreasing trading volume on like everything in the market. Furthermore a significant reduction in margin volume",t3_pbwdez,12
1629983641.0,2021-08-26,wallstreetbets,haf58j6,"Here is a message to all the brand new investors visitng wsb

Get the fuck out of here if you like money",t3_pbwdez,59
1629999187.0,2021-08-26,wallstreetbets,hag72de,"Those marines we lost over there were us. I bet they had some GME and AMC. I bet they had COIN accounts. Wives and kids at home. Just some young guys trying to better themselves sent to die in a shithole for nothing. 

Pour one out, brothers.",t3_pbwdez,58
1629987606.0,2021-08-26,wallstreetbets,hafe2xj,"Just checking, you can do unlimited day trades above 25K in total account value right?",t3_pbwdez,13
1629988070.0,2021-08-26,wallstreetbets,haff6o3,welp I blew up my account again after erasing all my loses on Monday. RIP me,t3_pbwdez,11
1629991550.0,2021-08-26,wallstreetbets,hafnmly,This fucking discussion thread right here is bipolar as shit,t3_pbwdez,13
1629991788.0,2021-08-26,wallstreetbets,hafo7i9,can we normalize clapping randomly in the middle of conversations?,t3_pbwdez,12
1629995816.0,2021-08-26,wallstreetbets,hafyckc,Gme on the verge,t3_pbwdez,11
1629995980.0,2021-08-26,wallstreetbets,hafyrr4,Gamestop has a lot of volume moving rn,t3_pbwdez,12
1629999082.0,2021-08-26,wallstreetbets,hag6sl3,Taliban condemned the bombing. What a clusterfuck.,t3_pbwdez,12
1630001824.0,2021-08-26,wallstreetbets,hagdq9e,"I don't know who needs to hear this today, but fuck you",t3_pbwdez,12
1630007679.0,2021-08-26,wallstreetbets,hags9zb,I got some spy calls expiring in two weeks. Works everytime unless the world really ends,t3_pbwdez,13
1629978533.0,2021-08-26,wallstreetbets,haevoh6,tape her? i hardly even know her,t3_pbwdez,33
1629980507.0,2021-08-26,wallstreetbets,haez3uh,Wow I outrageously suck at this,t3_pbwdez,36
1629981850.0,2021-08-26,wallstreetbets,haf1mg8,"#SPY DOWN .09% PRE MARKET

♿️🐻 : MY THESIS WAS RIGHT",t3_pbwdez,32
1629989773.0,2021-08-26,wallstreetbets,hafjbwh,"168% gain on SPY puts, locking it in there.

Nice, that puts me at even for the week.",t3_pbwdez,11
1629994094.0,2021-08-26,wallstreetbets,haftzkw,who the fuck is Jackson? and why should I care about her hole?,t3_pbwdez,10
1629996327.0,2021-08-26,wallstreetbets,hafznvr,GME more green candles please,t3_pbwdez,11
1629999163.0,2021-08-26,wallstreetbets,hag7015,How amazing would it be if SPY went to 440 tomorrow,t3_pbwdez,12
1629999326.0,2021-08-26,wallstreetbets,hag7fbk,Gme giving blue balls,t3_pbwdez,11
1630000585.0,2021-08-26,wallstreetbets,haganb7,I said ape not gape my asshole,t3_pbwdez,11
1630000940.0,2021-08-26,wallstreetbets,hagbjcu,"GME edging up more and more, puts are fucked",t3_pbwdez,10
1630001631.0,2021-08-26,wallstreetbets,hagd921,[deleted],t3_pbwdez,11
1630001948.0,2021-08-26,wallstreetbets,hage1d1,If spy plummets I have set my self up nicely to make a $17 profit.,t3_pbwdez,12
1630003073.0,2021-08-26,wallstreetbets,haggtf7,"SPY dont wanna give $447 up, sorry but you got to. Lil bitch",t3_pbwdez,12
1630003801.0,2021-08-26,wallstreetbets,hagim5n,I desperately have to stop myself from rolling all my winnings into random plays I know nothing about... It's always such a horrible move,t3_pbwdez,11
1629980856.0,2021-08-26,wallstreetbets,haezqr5,"**IM NOT FUCKING SELLING**

*Coz my investment is down 80%*",t3_pbwdez,50
1629981018.0,2021-08-26,wallstreetbets,haf01kn,Arizona iced tea is still 99 cents. Inflation isn’t real.,t3_pbwdez,105
1629982132.0,2021-08-26,wallstreetbets,haf263o,"“At least I have my stocks.”

*I say to my laptop screen as I watch my account value steadily decline.*",t3_pbwdez,8
1629985134.0,2021-08-26,wallstreetbets,haf8fs3,Fuck WISH man wtf,t3_pbwdez,11
1629986468.0,2021-08-26,wallstreetbets,hafbgat,"SPY puts printed, now calls",t3_pbwdez,10
1629986718.0,2021-08-26,wallstreetbets,hafc0yt,why do i only want to buy after a stock is already up 20% in three days?,t3_pbwdez,9
1629989863.0,2021-08-26,wallstreetbets,hafjjr0,Fucked a girl named Sofie. Little did I know her evil twin SOFI would be out to fuck me,t3_pbwdez,11
1629990381.0,2021-08-26,wallstreetbets,hafkssj,##EVERYBODY STAY FUCKING CALM,t3_pbwdez,10
1629990475.0,2021-08-26,wallstreetbets,hafl0yt,WW3 priced in,t3_pbwdez,9
1629991248.0,2021-08-26,wallstreetbets,hafmw0o,this is a great fake bounce to load up on puts for tomorrow at 10am,t3_pbwdez,10
1629991465.0,2021-08-26,wallstreetbets,hafnf46,The fake out before the fake out before the fake out.,t3_pbwdez,11
1629991926.0,2021-08-26,wallstreetbets,hafojrq,SPY forming Titanic pattern. Ship about to sink.,t3_pbwdez,10
1629991929.0,2021-08-26,wallstreetbets,hafojz5,"I got hired no interview. He just looked at me and said you’re beautiful you’re hired 😜

Thank you for the prayers and vibes wsb",t3_pbwdez,11
1629993015.0,2021-08-26,wallstreetbets,hafr9qx,SPY quit playing with yourself and pick a side Jesus fuck. No point to look at you for another hour just gonna be sitting between $447.20-$447.30,t3_pbwdez,9
1629993131.0,2021-08-26,wallstreetbets,hafrkdd,#BABA GREEN EOD OR SUB GOES PRIVATE,t3_pbwdez,10
1629994523.0,2021-08-26,wallstreetbets,hafv2bg,Shout out to the guy who reminded me TLRY is still a piece of shit and made me a quick 35% on puts,t3_pbwdez,9
1629995260.0,2021-08-26,wallstreetbets,hafwxji,Nothing like watching the last few days gains evaporate in and afternoon.,t3_pbwdez,10
1629995949.0,2021-08-26,wallstreetbets,hafyoy4,GME about to bless us with its monster shrek dong.,t3_pbwdez,12
1629996681.0,2021-08-26,wallstreetbets,hag0kp4,Watched Schitt's Creek first two episodes. It works. Skepticism neutralized,t3_pbwdez,10
1629996785.0,2021-08-26,wallstreetbets,hag0up5,Why can’t I lose weight like I lose money,t3_pbwdez,9
1629997733.0,2021-08-26,wallstreetbets,hag3arb,Errybody expecting a sell off for the J Hole. Wouldn’t be the least bit surprised if we ripped above 450 for the lulz.,t3_pbwdez,10
1629998874.0,2021-08-26,wallstreetbets,hag69b4,"Yo dog, my account is down 17% today and nothing even happened . I’m literally retarded",t3_pbwdez,10
1630001249.0,2021-08-26,wallstreetbets,hagcaqk,"Bears cheering GME to tank the market wtf 

This is some goofy ass simulation",t3_pbwdez,10
1630001623.0,2021-08-26,wallstreetbets,hagd8cj,GME cocktease of the century,t3_pbwdez,11
1630002169.0,2021-08-26,wallstreetbets,hagel85,"I used to trade on fundamentals, now 90% of my portfolio is YOLO plays. This subreddit has ruined me lmao",t3_pbwdez,11
1630003001.0,2021-08-26,wallstreetbets,haggn1r,GME and SENS keeping me in the green today.,t3_pbwdez,10
1630003530.0,2021-08-26,wallstreetbets,haghy4y,"what a horrible day, don't even really care about trading. cya guys another day. buy the dip.",t3_pbwdez,10
1630003573.0,2021-08-26,wallstreetbets,hagi1xd,"Investment Hack:

TD doesn't adjust your portfolio performance for any deposits and instead makes it appear as  a gain. 

So any time my portfolio is red by a few hundred dollars I just deposit enough to make it green by a few hundred dollars. Huge win for my mental health.",t3_pbwdez,9
1630004885.0,2021-08-26,wallstreetbets,haglb8c,"HUGE GREEN CANDLES

*in bear portfolios",t3_pbwdez,10
1630005926.0,2021-08-26,wallstreetbets,hagnwgv,[deleted],t3_pbwdez,10
1630006348.0,2021-08-26,wallstreetbets,hagoy8f,the power dump is inevitable,t3_pbwdez,10
1630006516.0,2021-08-26,wallstreetbets,hagpddw,"Holyshit, S&P down .48%? Fucking joke. It could shed 30% and it wouldn't hurt anything.

Jpow sees this market as his gift to us. Let alone be concerned. The fix is in, and permanent. Carry on.",t3_pbwdez,10
1630007331.0,2021-08-26,wallstreetbets,hagrevc,Feeling super sad after I just bombed the fuck out of an interview. 😔,t3_pbwdez,9
1630007857.0,2021-08-26,wallstreetbets,hagsppu,The surest sign that we’ll be red tomorrow is that I’m holding calls overnight,t3_pbwdez,8
1630008058.0,2021-08-26,wallstreetbets,hagt7qq,Bought a spy put just to have some skin In The game. 28k cash,t3_pbwdez,12
1629980243.0,2021-08-26,wallstreetbets,haeymhu,Having a small portfolio and playing options is exciting. Every move feels like a yolo.,t3_pbwdez,30
1629981341.0,2021-08-26,wallstreetbets,haf0nh4,"Everything I bought in the past week

Went from Good Buy to Goodbye real quick

I think it’s time to join Congress now to make it all back 😎",t3_pbwdez,31
1629987368.0,2021-08-26,wallstreetbets,hafdivi,"Breaking: U.S. to invade Afghanistan with 400,000 troops in surprise attack. President Biden, when asked for comment, said ""lol baited""",t3_pbwdez,30
1629996238.0,2021-08-26,wallstreetbets,hafzfpj,Puts on Joe Biden,t3_pbwdez,29
1629982291.0,2021-08-26,wallstreetbets,haf2hdl,[deleted],t3_pbwdez,8
1629982469.0,2021-08-26,wallstreetbets,haf2tyt,"Wow RIDE actually blowing up the shorts.  
And by blowing up I mean forcing them to take 50%+ profit lol.",t3_pbwdez,9
1629982513.0,2021-08-26,wallstreetbets,haf2xaa,Y’all ever have a morning meeting that overlaps with your morning dump. I’m yet to figure this 1 out.,t3_pbwdez,9
1629983893.0,2021-08-26,wallstreetbets,haf5rez,Cash is trash and so is the economy,t3_pbwdez,9
1629985336.0,2021-08-26,wallstreetbets,haf8vs5,There goes my account fuck,t3_pbwdez,9
1629985903.0,2021-08-26,wallstreetbets,hafa5n5,"Can’t wait for my one GME to be worth 42,069",t3_pbwdez,8
1629986710.0,2021-08-26,wallstreetbets,hafc0cu,I bought SPY puts so naturally its about to pump hard. You're welcome bulls,t3_pbwdez,9
1629987460.0,2021-08-26,wallstreetbets,hafdqkk,"My school is giving everybody money because of some Covid relief fund. My university has given out so much free money this past year. I’ve gotten a free MacBook Air, $2k, I’m about to get another $2k, and $550. Who said college was expensive lol",t3_pbwdez,8
1629988617.0,2021-08-26,wallstreetbets,hafgih0,Sold my puts for a measly $40 profit 30 seconds later worth $250+ 🤦‍♂️,t3_pbwdez,9
1629988831.0,2021-08-26,wallstreetbets,hafh0x1,"Overheard @ Jaxson Hole: ""Tape her up, she's Yellen!"" Tapering confirmed.",t3_pbwdez,10
1629989187.0,2021-08-26,wallstreetbets,hafhwa5,Start the taper now!,t3_pbwdez,8
1629989190.0,2021-08-26,wallstreetbets,hafhwk5,20% correction pls,t3_pbwdez,8
1629990000.0,2021-08-26,wallstreetbets,hafjvji,So this SPY 450c is going expire worthless?,t3_pbwdez,9
1629990236.0,2021-08-26,wallstreetbets,hafkg10,TSLA is on course to go below 700. AGAIN,t3_pbwdez,10
1629990364.0,2021-08-26,wallstreetbets,hafkr8z,"I say taper, you say tantrum..

taper",t3_pbwdez,9
1629992362.0,2021-08-26,wallstreetbets,hafpmi8,Nerds be like look at this triple ballsack circumcised mushroom turd flag pattern on QQQ,t3_pbwdez,10
1629992893.0,2021-08-26,wallstreetbets,hafqygz,I just ashed my cigar into my drink instead of ashtray. It’s okay though I just stirred it around and fixed it,t3_pbwdez,8
1629993666.0,2021-08-26,wallstreetbets,hafsxdb,Only Fans now allowing videos of Options Traders getting railed by the Greeks.,t3_pbwdez,8
1629996678.0,2021-08-26,wallstreetbets,hag0kco,Gamma ramp on the video game store looks sexy,t3_pbwdez,9
1629996877.0,2021-08-26,wallstreetbets,hag13f2,How many of you degens trade and drive,t3_pbwdez,8
1629997745.0,2021-08-26,wallstreetbets,hag3bu9,I think I’m becoming one of those boring normie buy VTI assholes 🤦‍♂️,t3_pbwdez,8
1629997817.0,2021-08-26,wallstreetbets,hag3ijm,"ASTS going up on a low volume

Imagine wsb retards start picking this up it would be at $100+ easy",t3_pbwdez,9
1629997841.0,2021-08-26,wallstreetbets,hag3kqo,saw a comment that said that we were crashing... what the fuck are you talking about?,t3_pbwdez,8
1629998220.0,2021-08-26,wallstreetbets,hag4k4z,###All in $ASTS,t3_pbwdez,9
1629998745.0,2021-08-26,wallstreetbets,hag5x7l,Fuckkk get out now,t3_pbwdez,9
1629999159.0,2021-08-26,wallstreetbets,hag6zpk,What time is jpow yapping tomorrow,t3_pbwdez,9
1629999342.0,2021-08-26,wallstreetbets,hag7grc,I heard the printers are being given a viking funeral at Jackson hole.,t3_pbwdez,8
1630000566.0,2021-08-26,wallstreetbets,hagalmk,The only short squeeze I’ve ever been apart of is when I jerk off,t3_pbwdez,9
1630000840.0,2021-08-26,wallstreetbets,hagbaaw,"No matter what side you’re on, I know we’re all scared of tomorrow… don’t try and pretend 😏",t3_pbwdez,9
1630001225.0,2021-08-26,wallstreetbets,hagc8my,Come on GME bulls - push her higher,t3_pbwdez,11
1630001889.0,2021-08-26,wallstreetbets,hagdw02,More spy puts or nah,t3_pbwdez,9
1630002101.0,2021-08-26,wallstreetbets,hagef5u,"Just bought a $300 GME call that expires tomorrow

Idk why",t3_pbwdez,8
1630002908.0,2021-08-26,wallstreetbets,haggeui,10 Marines and a Navy medic confirmed dead...,t3_pbwdez,9
1630003041.0,2021-08-26,wallstreetbets,haggqjk,"So I made a mistake at work and I feel like shit, my boss is pissed off, and I’m going on a 6 month leave tomorrow. I basically sent a nasty email to someone at work for a perceived slight. It was a mistake. I tried to apologize but my boss seems still pissed off. The fuck do I do now?",t3_pbwdez,9
1630003075.0,2021-08-26,wallstreetbets,haggtl4,ISIS needs to chill bro,t3_pbwdez,9
1630006125.0,2021-08-26,wallstreetbets,hagoe8d,"Let's all stop to appreciate the fact that SPY moving half a percent in a day is no big deal anymore, and VIX is apparently totally used to it, too",t3_pbwdez,11
1630006328.0,2021-08-26,wallstreetbets,hagowgj,Anyone else holding puts overnight?,t3_pbwdez,7
1630006456.0,2021-08-26,wallstreetbets,hagp7zz,Looks like a 🌈🐻 orgy in here literally the only buy signal i ever needed,t3_pbwdez,9
1630006819.0,2021-08-26,wallstreetbets,hagq4gy,Who is ready for JPow Day tomorrow? I'm excited af my anus hairs are tingling.,t3_pbwdez,10
1630007036.0,2021-08-26,wallstreetbets,hagqo63,"""I'm going to level with you all... Shit's fucked."" - Jerome's opening statement tomorrow, probably",t3_pbwdez,8
1630007253.0,2021-08-26,wallstreetbets,hagr7s9,I bought Spy puts. Being a 🐻🏳️‍🌈 feels disgusting,t3_pbwdez,8
1630007523.0,2021-08-26,wallstreetbets,hagrw4y,My spy puts exp monday are up 23%. Sell or hold thru close,t3_pbwdez,9
1629977207.0,2021-08-26,wallstreetbets,haetk0u,If GME goes to $250 today I am going to buy so much cocaine,t3_pbwdez,70
1629981287.0,2021-08-26,wallstreetbets,haf0jrv,Lots of jobless people buying second hand video games I hope,t3_pbwdez,25
1629993956.0,2021-08-26,wallstreetbets,haftn5j,"they say 1% of options traders make money

i am the 99%",t3_pbwdez,25
1629998566.0,2021-08-26,wallstreetbets,hag5grb,RIP to the the four marines we just lost. Just last week a guy on here was saying his son got word he's deploying to Afghanistan to help out this clusterfuck.,t3_pbwdez,26
1630008268.0,2021-08-26,wallstreetbets,hagtqau,Spy gonna get delisted tomorrow,t3_pbwdez,21
1629981813.0,2021-08-26,wallstreetbets,haf1jy4,"Same as everyday 

Follow Michael burrys portfolio",t3_pbwdez,7
1629983518.0,2021-08-26,wallstreetbets,haf4zin,"sleepy groggy west coast trading at 6:30 vs East coast trading waiting for open on their 3rd bowl of cereal at 9:30
Time to move",t3_pbwdez,8
1629985169.0,2021-08-26,wallstreetbets,haf8ijt,Let’s go ASTS give me that green dildo,t3_pbwdez,9
1629985897.0,2021-08-26,wallstreetbets,hafa57g,CLOV is breaking out,t3_pbwdez,7
1629986008.0,2021-08-26,wallstreetbets,hafae6r,[removed],t3_pbwdez,10
1629986083.0,2021-08-26,wallstreetbets,hafakd1,CLOV is….green?!,t3_pbwdez,9
1629986121.0,2021-08-26,wallstreetbets,hafanfz,Bond market acting like total collapse coming 🤔,t3_pbwdez,9
1629986955.0,2021-08-26,wallstreetbets,hafckh9,Take your time BABA. I'm a patient bagholder 👜💎🙌👜,t3_pbwdez,8
1629987035.0,2021-08-26,wallstreetbets,hafcr25,I hate the stock market.,t3_pbwdez,8
1629987210.0,2021-08-26,wallstreetbets,hafd5ic,can AMC join the gains party already !!!,t3_pbwdez,9
1629987462.0,2021-08-26,wallstreetbets,hafdqpd,Cnbc trying hard to tank market with kabul bombing,t3_pbwdez,8
1629988416.0,2021-08-26,wallstreetbets,hafg0qc,How am I so good at buying SPY puts a few days too early?,t3_pbwdez,8
1629988417.0,2021-08-26,wallstreetbets,hafg0sx,TF is this cuz of afghanistan? legit nothing happening there should affect stocks there aint no money in that country,t3_pbwdez,8
1629988543.0,2021-08-26,wallstreetbets,hafgbuy,lol we will never crash as long we have algos programmed to buy the dip. It's like trying to throw a gutter ball in bowling when the gutter guards are in,t3_pbwdez,8
1629988774.0,2021-08-26,wallstreetbets,hafgvzr,"Big down or buy the dip???


I'm so glad I retired as a trader",t3_pbwdez,8
1629989525.0,2021-08-26,wallstreetbets,hafiq62,"I'd hope after last week some of you retards learned a lil lesson about the importance of hedging, although we both know the answer to that don't we",t3_pbwdez,9
1629989719.0,2021-08-26,wallstreetbets,hafj76o,I'm not a bull or a bear. I'm a tapir.,t3_pbwdez,8
1629990114.0,2021-08-26,wallstreetbets,hafk5es,"Looks like I sold spy puts too early.  Oh well, gain is gain.",t3_pbwdez,9
1629990293.0,2021-08-26,wallstreetbets,hafkkyj,I don’t feel so good,t3_pbwdez,7
1629990407.0,2021-08-26,wallstreetbets,hafkv3f,It’s not even 1% yet. Us 🐻🐻‍❄️🧸 need revenge.,t3_pbwdez,8
1629990692.0,2021-08-26,wallstreetbets,hafljp4,the taliban are hella gay straight up,t3_pbwdez,8
1629990763.0,2021-08-26,wallstreetbets,haflpt2,Wouldn’t it be hilarious if SPY hit 450 today. What a fookin day it will be.,t3_pbwdez,7
1629990980.0,2021-08-26,wallstreetbets,hafm8ok,0.4% is a large dip in spy now 🤣,t3_pbwdez,8
1629991069.0,2021-08-26,wallstreetbets,hafmgb0,"Fuck terrorism in Kabul, all my homies hate bombings

Can't let the SPY suffer",t3_pbwdez,7
1629991198.0,2021-08-26,wallstreetbets,hafmrke,Bears get about an hour once a week,t3_pbwdez,8
1629991469.0,2021-08-26,wallstreetbets,hafnfh3,"What a sexy recovery. If this is a bull trap, I have been trapped like a motherfucker",t3_pbwdez,9
1629991875.0,2021-08-26,wallstreetbets,hafof9d,"There is no doubt in my mind I am the coldest /unluckiest person on the market the last month

The 1 day in the last 2 months I sleep in, the 1 day 

Is the day my calls shoot way the fuck up and I wake up 20 minutes later and the stock is down 8 points, difference of 5 grand

Last week the entire market was blood red and I had WalMart puts, it was literally the only green stock on the entire Dow Jones index, fucking unreal man 

Team Never win, it’s an every day thing, this doesn’t just happen to anyone",t3_pbwdez,9
1629991908.0,2021-08-26,wallstreetbets,hafoi6z,"AMC red, puts are red.  Volatility is a beeeeotch",t3_pbwdez,7
1629991925.0,2021-08-26,wallstreetbets,hafojp8,Prayers to the innocent people that got hurt,t3_pbwdez,9
1629992226.0,2021-08-26,wallstreetbets,hafpae6,Imagine buying calls with US and civilian casualties in Kabul as well as Jackson Hole and Taper Talk with JPOW,t3_pbwdez,7
