created,date,subreddit,id,body,parent_id,score
1589823115.0,2020-05-18,wallstreetbets,fr1o6z2,I would consider myself one of Chipotle's biggest customers but NO WAY IN HELL ARE THEIR SHARES WORTH 1000,t3_glyucu,9
1589824660.0,2020-05-18,wallstreetbets,fr1reip,"Remember back in March were there was serious conversations about banning short selling. If we get another correction there will be a new program where put buyers are rounded up by the SEC, lined up along pre-dug mass graves and shot.",t3_glyucu,9
1589824800.0,2020-05-18,wallstreetbets,fr1rp52,"Turns out the last 10 years of my life were wasted on the man, tryin to make a dollar. All i have to do it btfd, wake up at noon and collect a month's worth of living expenses. Aint even cashed my trump bux yet. Thanks BA very cool!",t3_glyucu,8
1589824848.0,2020-05-18,wallstreetbets,fr1rss7,This game is a lot more fun playing as the green character,t3_glyucu,9
1589828146.0,2020-05-18,wallstreetbets,fr1ym8b,"as a critical participant of the market (🌈🐻) I have to say, today was beyond retarded",t3_glyucu,9
1589829995.0,2020-05-18,wallstreetbets,fr22f99,"Breaking through 296 AH would be so lame.

I bet they do it.",t3_glyucu,9
1589830012.0,2020-05-18,wallstreetbets,fr22gk0,I hope CRM goes out of business after having to hold these calls for a week and a half,t3_glyucu,9
1589830402.0,2020-05-18,wallstreetbets,fr239hh,It is taking literally everything I have not to buy puts right now,t3_glyucu,8
1589830747.0,2020-05-18,wallstreetbets,fr23yrl,"“So you’re basically just flooding the market with money.”

“Basically, yes.”",t3_glyucu,8
1589831562.0,2020-05-18,wallstreetbets,fr25mrr,"I bought DIS calls at the top, AMA",t3_glyucu,9
1589831798.0,2020-05-18,wallstreetbets,fr264c3,Congrats to all of you who bought puts at the top I'm proud of you for seeing through this bullshit rally :D,t3_glyucu,9
1589831868.0,2020-05-18,wallstreetbets,fr269hn,"Down 4K today 🤡

Only 7k left before I’m back to where I started",t3_glyucu,10
1589831923.0,2020-05-18,wallstreetbets,fr26dox,Jesus fuck I lost 45% of my portfolio today. FUCKING JEROME,t3_glyucu,10
1589832352.0,2020-05-18,wallstreetbets,fr279bw,I need a -3% tomorrow. Thanks,t3_glyucu,10
1589832693.0,2020-05-18,wallstreetbets,fr27y0r,"Something I've learned as a poor sucker playing this game: save your fucking daytrades. Don't burn them on getting out of a losing position that is, in all actuality, an acceptable loss. Save them for taking profit and not holding something uncertain overnight and save them for an emergency escape plan on a position that's an unacceptable loss. Also don't get into positions that are unacceptable losses.",t3_glyucu,9
1589801178.0,2020-05-18,wallstreetbets,fr0n0by,Bears head count. Upvote if your a bear. We need to record casualties.,t3_glyucu,55
1589797034.0,2020-05-18,wallstreetbets,fr0ineg,Sup,t3_glyucu,17
1589800332.0,2020-05-18,wallstreetbets,fr0m2nx,We probably moon at open,t3_glyucu,8
1589805658.0,2020-05-18,wallstreetbets,fr0sjnz,this is too good to be true. Take your profits and fucking hide mother fuckers before all hell breaks loose.,t3_glyucu,9
1589806131.0,2020-05-18,wallstreetbets,fr0t72w,PCG calls gonna be a nice boost today,t3_glyucu,7
1589806878.0,2020-05-18,wallstreetbets,fr0u9d4,NYT reporting the MRNA drug is based off 8 healthy people and 3 got bad side effects...pump and dump boyssss,t3_glyucu,9
1589807822.0,2020-05-18,wallstreetbets,fr0vob7,Question of the day is will the profit taking or fomo be stronger at open,t3_glyucu,9
1589808416.0,2020-05-18,wallstreetbets,fr0wl0u,"I got SPY 290c 5/20, planning on taking profit soon after open",t3_glyucu,8
1589809021.0,2020-05-18,wallstreetbets,fr0xibi,[deleted],t3_glyucu,8
1589809036.0,2020-05-18,wallstreetbets,fr0xj3p,Robinhood diamond hands mode engaged,t3_glyucu,8
1589809139.0,2020-05-18,wallstreetbets,fr0xp22,RH crash?,t3_glyucu,7
1589809306.0,2020-05-18,wallstreetbets,fr0xyv3,When my orders filled in RH while everyone else is suffering 👀,t3_glyucu,8
1589810348.0,2020-05-18,wallstreetbets,fr0zp0t,"Damn.

Holding disney calls over the weekend could have turned 10 grand into 200 grand",t3_glyucu,9
1589810567.0,2020-05-18,wallstreetbets,fr102d9,Just sold my spy 286c 5/22 and dis 105c 7/17. Up 250% is good enough for me. I've learned my lesson.,t3_glyucu,8
1589811816.0,2020-05-18,wallstreetbets,fr127sn,DISNEY call 112 from 1.09 to 6.90 ! !!!!!!,t3_glyucu,9
1589811866.0,2020-05-18,wallstreetbets,fr12ay8,"pro trader tipp:

if you sort your watch list by loss, you see your stocks first and don‘t need to scroll down",t3_glyucu,8
1589812862.0,2020-05-18,wallstreetbets,fr142y1,Can we just kill another iranian general already,t3_glyucu,8
1589813266.0,2020-05-18,wallstreetbets,fr14ti4,I just want casinos to open so I can go play some fucking roulette,t3_glyucu,9
1589813396.0,2020-05-18,wallstreetbets,fr15222,[deleted],t3_glyucu,8
1589813435.0,2020-05-18,wallstreetbets,fr154nt,I will never financially recover from this.,t3_glyucu,9
1589813645.0,2020-05-18,wallstreetbets,fr15igr,"1. Make bad move that gets burned AH

2. Over-correct bad moves and watch opening adjustments burn some more

3. Spend day rooting for big swings in BOTH directions

4. Bleed slow death that cancels all great play made otherwise.",t3_glyucu,8
1589814254.0,2020-05-18,wallstreetbets,fr16n95,[deleted],t3_glyucu,7
1589814379.0,2020-05-18,wallstreetbets,fr16vk2,"Abort with the puts.
Listen, it's not a triple top, it's a triple bottom.

Jay comes out with a seemingly harmless 60 minute interview saying vaccine is the key to Q3 recovery but also states it can last till 2021.

At the same time, MRNA announced vaccine next morning. It is orchestrated. Jay knows all along before you. This is artificial and is triggering the biggest FOMO to push this past 300.

The news is the subtle clue to which direction it is.",t3_glyucu,8
1589814826.0,2020-05-18,wallstreetbets,fr17q1e,Aurora Cannabis up another 60% today hahateehee! Smoking weed and making tendies all day!!,t3_glyucu,8
1589815085.0,2020-05-18,wallstreetbets,fr187j5,Did Buffet sell the bottom?!,t3_glyucu,8
1589815855.0,2020-05-18,wallstreetbets,fr19o4u,My condolences to anyone that FOMOed into DKNG. RIP.,t3_glyucu,7
1589815955.0,2020-05-18,wallstreetbets,fr19v1u,SPY was at 281 Friday morning.,t3_glyucu,8
1589817257.0,2020-05-18,wallstreetbets,fr1cej9,Selling off the last of my SPY calls. That was fun. Time to buy puts?,t3_glyucu,9
1589818348.0,2020-05-18,wallstreetbets,fr1ekn7,I like how this morning SPY decided to just say fuck your resistance/ fib levels and skipped straight up to the final boss of the long standing trendline.,t3_glyucu,8
1589819917.0,2020-05-18,wallstreetbets,fr1hp5p,Rode Spy up this morning for a nice $50 profit. Cheeseburger cash gang.,t3_glyucu,8
1589820024.0,2020-05-18,wallstreetbets,fr1hwyf,Why is KeyFondant’s comments still showing up after I blocked that fucker?,t3_glyucu,8
1589820495.0,2020-05-18,wallstreetbets,fr1ivaa,Quick 90 second reddit search before I can solidify a week's paycheck into this company I've never heard of bro bro,t3_glyucu,8
1589820693.0,2020-05-18,wallstreetbets,fr1j9py,"Come on LOW, start fucking ripping",t3_glyucu,7
1589822060.0,2020-05-18,wallstreetbets,fr1m14b,Will Meade is maybe a more ridiculous Twitter personality than Elon,t3_glyucu,7
1589822690.0,2020-05-18,wallstreetbets,fr1nbkn,"SPY is soooooo overextended. Puts here people. I know you bulls think I'm crazy, but holy fuck mid june $290 is free money.",t3_glyucu,7
1589822800.0,2020-05-18,wallstreetbets,fr1njhz,"bought VTIQ, DKNG, and SABR calls today. Whoever said to me a couple weeks ago ""see you in 2 weeks"" when I commented that I was done with options, you were right you son of a bitch.",t3_glyucu,8
1589824505.0,2020-05-18,wallstreetbets,fr1r2x4,"Like 70%+ of positions I sell go profitable weeks later.

I will now use this info wrongly to hold everything I have until it's worthless.",t3_glyucu,8
1589826087.0,2020-05-18,wallstreetbets,fr1uc8g,Bought my first fractional share today guys! I got $50 of Amazon stock and I'm already up $0.04 today! We're getting them tendies friends :3,t3_glyucu,8
1589827119.0,2020-05-18,wallstreetbets,fr1wixw,SPY 296 can literally go fuck boy pussy in thailand. gtfo back to 290,t3_glyucu,8
1589827915.0,2020-05-18,wallstreetbets,fr1y59t,Fuck it I’m switching to calls. Virus was literally a hoax,t3_glyucu,8
1589828070.0,2020-05-18,wallstreetbets,fr1ygiq,Did trump just say they were going to experiment on people that were gonna die anyway?,t3_glyucu,9
1589829552.0,2020-05-18,wallstreetbets,fr21ivg,Spy 6/8 290 puts. 8k worth purchased,t3_glyucu,8
1589830207.0,2020-05-18,wallstreetbets,fr22v7i,I am reading this thread 8 hours a day to confirm my positions,t3_glyucu,8
1589831405.0,2020-05-18,wallstreetbets,fr25b99,"Fuck it, 10 min left, why not make it 298 for the close.",t3_glyucu,8
1589831562.0,2020-05-18,wallstreetbets,fr25msr,"We are now where we were on October 22 of last year. 

Lol.",t3_glyucu,7
1589832169.0,2020-05-18,wallstreetbets,fr26vuq,LOL and to think I almost got squeezed out of my puts I bought at 295.2.,t3_glyucu,8
1589832447.0,2020-05-18,wallstreetbets,fr27g5n,Holding spy options overnight is playing with fire,t3_glyucu,8
1589833339.0,2020-05-18,wallstreetbets,fr2995x,"Dow closed at 911....meaning call the medics as Bears are on life support! 
Bang bang 🐻",t3_glyucu,7
1589833610.0,2020-05-18,wallstreetbets,fr29tg1,"Trump says he's taking hydroxychloroquine and has been for a few weeks, wtf",t3_glyucu,8
1589809147.0,2020-05-18,wallstreetbets,fr0xpj0,Robinhood not working after they push an update that changes the fucking color is so classic.,t3_glyucu,15
1589798276.0,2020-05-18,wallstreetbets,fr0jwht,"Unemployment 🆙

Infections 🆙

Deaths 🆙

Uncertainty 🆙

Stonks 🆙🆙🆙🆙🆙🆙🆙🆙",t3_glyucu,25
1589816459.0,2020-05-18,wallstreetbets,fr1au67,[deleted],t3_glyucu,24
1589812406.0,2020-05-18,wallstreetbets,fr139ba,"Hahaha fuck, not trying to discuss politics w anyone but the fact that Trump’s new vaccine czar had over $1m in Moderna calls makes me think that this is fake and gay news

Edit: $10m

https://www.thedailybeast.com/trumps-vaccine-czar-holds-millions-in-stock-options-at-company-that-got-federal-funding-for-covid-19-work",t3_glyucu,21
1589800337.0,2020-05-18,wallstreetbets,fr0m2un," R.I.P. Here lies a Gay Bear

March 2020 - March 2020",t3_glyucu,15
1589806146.0,2020-05-18,wallstreetbets,fr0t7tq,"Bears, you had like literally one very profitable day in nearly 2 months.

Hang it up. 🤦‍♂️",t3_glyucu,14
1589816828.0,2020-05-18,wallstreetbets,fr1bk08,Getting puts today seems like a very logical idea but it feels super retarded.,t3_glyucu,15
1589801077.0,2020-05-18,wallstreetbets,fr0mw94,Donkey Kong gang we at 30,t3_glyucu,7
1589801102.0,2020-05-18,wallstreetbets,fr0mx8t,Not as much action in this thread today.,t3_glyucu,7
1589801930.0,2020-05-18,wallstreetbets,fr0nvlk,Holy fuck MRNA,t3_glyucu,7
1589802990.0,2020-05-18,wallstreetbets,fr0p4i2,I remember when buying a 55 call on MRNA right before earnings felt risky🤦🏻‍♂️,t3_glyucu,7
1589803237.0,2020-05-18,wallstreetbets,fr0pf50,God damn. Fuck my life.,t3_glyucu,8
1589803448.0,2020-05-18,wallstreetbets,fr0pog0,"If you have to ask if its too late to buy calls then it usually is; MRNA, don’t be a chaser....",t3_glyucu,7
1589803565.0,2020-05-18,wallstreetbets,fr0ptj3,"DIS holy fuck my play was a week early. 


Fhdhshsjdjxudurnska",t3_glyucu,8
1589803731.0,2020-05-18,wallstreetbets,fr0q0te,Rip cash gang with all your fomo,t3_glyucu,7
1589804204.0,2020-05-18,wallstreetbets,fr0qmd7,The gain porn posts later today are gonna be willddddddddddd,t3_glyucu,7
1589805165.0,2020-05-18,wallstreetbets,fr0rvjb,So we couldn't find a vaccine for SARS in 15 years but all of a sudden in a month we have multiple choices for COVID19? Okay,t3_glyucu,7
1589805175.0,2020-05-18,wallstreetbets,fr0rvzv,If disney hits 115 today i will spontaneously ejaculate,t3_glyucu,6
1589805191.0,2020-05-18,wallstreetbets,fr0rws3,What's the opposite of a rug pull?,t3_glyucu,7
1589805787.0,2020-05-18,wallstreetbets,fr0sq3o,"all bad news priced in, but good news isn't.  LOL",t3_glyucu,7
1589806129.0,2020-05-18,wallstreetbets,fr0t6z8,"Me not listening to you guys about MRNA...major Fomo, anyone still jumping in at open?",t3_glyucu,6
1589806158.0,2020-05-18,wallstreetbets,fr0t8fp,Jesus I bought calls hoping to afford a Ryzen 9 but now I may just say fuck it and buy the threadripper lmao,t3_glyucu,7
1589806259.0,2020-05-18,wallstreetbets,fr0tdfr,My brain says buy puts at open... but my past experiences say buy calls,t3_glyucu,8
1589806912.0,2020-05-18,wallstreetbets,fr0ub4z,SOME OF YOU GUYS ARE OK DON'T BUY PUTS TODAY,t3_glyucu,6
1589807039.0,2020-05-18,wallstreetbets,fr0uhp1,I have concluded I have absolutely 0 understanding of golds price movement,t3_glyucu,7
1589807068.0,2020-05-18,wallstreetbets,fr0uj6m,bears waking up to immediately kick the dog this morning,t3_glyucu,7
1589807126.0,2020-05-18,wallstreetbets,fr0um5j,States opened up over the weekend and surprise no one instantly died. If they are going to get Covid it’ll be in a week or so,t3_glyucu,7
1589807137.0,2020-05-18,wallstreetbets,fr0umrx,[Nice pump now go back down](https://i.imgur.com/ypdmQZi.png),t3_glyucu,8
1589807164.0,2020-05-18,wallstreetbets,fr0uo5q,DRUG TALKS GOING WELL,t3_glyucu,7
1589807581.0,2020-05-18,wallstreetbets,fr0vb1f,Remember to take profits while they're guaranteed.,t3_glyucu,6
1589807661.0,2020-05-18,wallstreetbets,fr0vfdm,time to blindly buy calls on pretty much anything today in a last ditch effort to erase 8k losses over the past 2 weeks!,t3_glyucu,7
1589807763.0,2020-05-18,wallstreetbets,fr0vkx0,"LET'S MAKE THIS A DAY TO REMEMBEEEERRRR

road to greatnesss",t3_glyucu,7
1589807824.0,2020-05-18,wallstreetbets,fr0vofn,Imagine thinking a white guy named Jerome would be bearish for the stock market,t3_glyucu,7
1589807897.0,2020-05-18,wallstreetbets,fr0vsd1,"Big short Micheal J. Burry is continuing twitting that ""IT'S JUST THE FLU"".. must be in trump task force",t3_glyucu,8
1589808314.0,2020-05-18,wallstreetbets,fr0wfae,Why do i buy calls on gay boomer companies with good fundamentals like CVS when i could buy calls on shit like vege meat or a gambling app without sports?,t3_glyucu,8
1589808379.0,2020-05-18,wallstreetbets,fr0wixi,This is gunna be fucking great to watch,t3_glyucu,7
1589808408.0,2020-05-18,wallstreetbets,fr0wklg,[deleted],t3_glyucu,6
1589808444.0,2020-05-18,wallstreetbets,fr0wmn6,"I see Moderna is next on the roledex of covid cures being pumped, seen how this ends free puts after FOMO tails off",t3_glyucu,8
1589808764.0,2020-05-18,wallstreetbets,fr0x43m,I’m sure glad RH spent IT resources updating the colors.,t3_glyucu,6
1589808786.0,2020-05-18,wallstreetbets,fr0x5ab,Haha can’t sell anything on RH bye bye tendies,t3_glyucu,7
1589808797.0,2020-05-18,wallstreetbets,fr0x5uo,IT WONT LET ME SELL,t3_glyucu,7
1589808824.0,2020-05-18,wallstreetbets,fr0x799,Damn RH is fucking tripping,t3_glyucu,7
1589808830.0,2020-05-18,wallstreetbets,fr0x7ln,"Fking RH, piece of shit lol",t3_glyucu,7
1589808877.0,2020-05-18,wallstreetbets,fr0xa78,Is RH really damn slow for anyone or is my connection just shitty?,t3_glyucu,6
1589808991.0,2020-05-18,wallstreetbets,fr0xgm8,SRNE halted?,t3_glyucu,7
1589809042.0,2020-05-18,wallstreetbets,fr0xjgp,robinhood is such a fucking piece of shit,t3_glyucu,8
1589809048.0,2020-05-18,wallstreetbets,fr0xjs9,"Damn haven’t had RH fuck up in a long time now that I think of it, seems like everything really is going back to normal",t3_glyucu,7
1589809056.0,2020-05-18,wallstreetbets,fr0xkan,wtf is going on with RH,t3_glyucu,6
1589809098.0,2020-05-18,wallstreetbets,fr0xmn2,fuck robinhood IT SOLD MY CONTRACTS SO MUCH LOWER THAN PRICE,t3_glyucu,7
1589810408.0,2020-05-18,wallstreetbets,fr0zsru,"Game of trades is the single saddest trader alive, been calling the **imminent crash** every day for 8 months, then acts like a guru when it happens as if he actually knew",t3_glyucu,7
1589810569.0,2020-05-18,wallstreetbets,fr102hs,Holy shit congratulations disney call holders,t3_glyucu,7
1589810591.0,2020-05-18,wallstreetbets,fr103rx,feeling cute. might bag hold into expiry,t3_glyucu,8
1589810686.0,2020-05-18,wallstreetbets,fr109ir,Buying calls Friday afternoon and flipping Monday at open.  My only retard-proof strategy.,t3_glyucu,8
1589810693.0,2020-05-18,wallstreetbets,fr109x8,"I believe this is what we call, priced to perfection. Giant bump off vaccine news, ya gotta fade that shit for at least a day or two.

Not saying we won’t go higher, but cmon lol be practical.",t3_glyucu,7
1589810850.0,2020-05-18,wallstreetbets,fr10jc0,**GOD IT FEELS SO GOOD TO NOT BE GAY ANYMORE**,t3_glyucu,7
1589811258.0,2020-05-18,wallstreetbets,fr118p7,I fell for tanker DD again. Not sure why I keep doing this.,t3_glyucu,7
1589811289.0,2020-05-18,wallstreetbets,fr11ama,These people on tv act like the American population will just willingly accept a vaccine...,t3_glyucu,8
1589811759.0,2020-05-18,wallstreetbets,fr1244h,[deleted],t3_glyucu,8
1589811852.0,2020-05-18,wallstreetbets,fr12a4h,Shoulda just bought dis at 100,t3_glyucu,6
1589811982.0,2020-05-18,wallstreetbets,fr12ie3,"Alright. I made a few hundo. Positions closed, back to bed.",t3_glyucu,7
1589812244.0,2020-05-18,wallstreetbets,fr12z4c,This is your chance to buy puts.,t3_glyucu,6
1589812459.0,2020-05-18,wallstreetbets,fr13cqx,Buffet must be fucking pissed. Fed out bought him and he bought high and sold low 🤣,t3_glyucu,6
1589813395.0,2020-05-18,wallstreetbets,fr151yt,All these put holders rip,t3_glyucu,6
1589813999.0,2020-05-18,wallstreetbets,fr1668r,"Is RH absolutely fucked for anyone else? Had limit order to sell at $0.8, the price was $.83. Canceled it and tried to sell at 0.83. Nothing working. It’s a high volume stock too",t3_glyucu,8
1589815203.0,2020-05-18,wallstreetbets,fr18fg9,"I cashed in boys, might be early, but better early then late",t3_glyucu,6
1589815247.0,2020-05-18,wallstreetbets,fr18ihl,ARE YOU TELLING ME YOU LOST MONEY TODAY?,t3_glyucu,6
1589815751.0,2020-05-18,wallstreetbets,fr19gy1,[deleted],t3_glyucu,7
1589816036.0,2020-05-18,wallstreetbets,fr1a0qp,"Meant to buy an amazn put at open, somehow bought a call. Panicked and closed that call, it’s now worth double what I paid. Yo yo yo yo yo. Fuck I’m stupid",t3_glyucu,7
1589816152.0,2020-05-18,wallstreetbets,fr1a8u0,"Market != economy when the virus/unemployment is talked about, but the market = economy when talking about reopening the economy.

??????????",t3_glyucu,6
1589816376.0,2020-05-18,wallstreetbets,fr1aodo,Imagine this retarded rally fades...dem puts looking kinda like the 3/10 at the bar right before last call right about now 🤔🤨,t3_glyucu,7
1589817036.0,2020-05-18,wallstreetbets,fr1bynm,only if the 100k Apple call guy had bought them expiring a day later lmao,t3_glyucu,7
1589817067.0,2020-05-18,wallstreetbets,fr1c0vq,"It's like we forgot LA shut down for the summer already. Need a DD on all the major metros, what their current status is and when their lockdown's expire. NYC ends on the 28th so we'll get something soon. If Cuomo says opening within the next month the new floor is in. End of summer we gonna dip again",t3_glyucu,7
1589817148.0,2020-05-18,wallstreetbets,fr1c6rx,God it feels good to be short this market right now.,t3_glyucu,6
1589817485.0,2020-05-18,wallstreetbets,fr1cv4a,[deleted],t3_glyucu,6
1589817965.0,2020-05-18,wallstreetbets,fr1dtbg,Got my first 10 bagger. Too bad it was only 5 $2 calls to $20 calls...,t3_glyucu,7
1589818107.0,2020-05-18,wallstreetbets,fr1e3gs,"I buy DIS calls stock drops, I buy DIS puts stock rockets 😐",t3_glyucu,6
1589818354.0,2020-05-18,wallstreetbets,fr1el2c,"Why did I sell my SPY 290c 5/20 on friday and buy puts? Oh thats right, because im a fucking idiot.",t3_glyucu,7
1589818365.0,2020-05-18,wallstreetbets,fr1els7,"""It's only paper.""

-analfarmer2, 2019-2019",t3_glyucu,7
1589818630.0,2020-05-18,wallstreetbets,fr1f4ey,I picked up **BABA** $220c 6/19  and BABA $230c 6/19 last week.   I think I'm holding onto these through earnings.. Anyone else in the same boat?,t3_glyucu,8
1589819039.0,2020-05-18,wallstreetbets,fr1fxqy,I’ve hedged my puts with so many calls I’m technically a bull now,t3_glyucu,6
1589819111.0,2020-05-18,wallstreetbets,fr1g2xq,"don't buy calls on any honest companies that tried to give real guidance. market wants none of that right now. buy calls on the ""well it's impossible to judge the real impact but we see a strong rebound coming in Q3"" companies",t3_glyucu,7
1589820039.0,2020-05-18,wallstreetbets,fr1hy0m,CNBC commentators and being super bullish on stocks that have already made huge moves.  Name a better duo,t3_glyucu,6
1589820452.0,2020-05-18,wallstreetbets,fr1is6m,Just want to give a shout out and a big FUCK YOU to the assholes that post about WSB in all the default subs and invited so many fucking meme-lords and genuine retards to sub here.,t3_glyucu,6
1589821102.0,2020-05-18,wallstreetbets,fr1k3s6,"If SRNE ends red today, I’ll personally take flight to their HQ and take a shit on their property

Edit: SRNE is a fucking clown",t3_glyucu,7
1589821556.0,2020-05-18,wallstreetbets,fr1l0ha,I need Song of the South to be accidentally re-released on Disney+ so this bitch drops to $0.01 and I can retire at 23,t3_glyucu,7
1589821734.0,2020-05-18,wallstreetbets,fr1ld40,Tricking people into Pump n Dumps is WSBs form of hazing newbies,t3_glyucu,7
1589822289.0,2020-05-18,wallstreetbets,fr1mhz8,Lord why am i so tempted to buy SPY puts,t3_glyucu,7
1589823049.0,2020-05-18,wallstreetbets,fr1o21i,[deleted],t3_glyucu,6
1589823232.0,2020-05-18,wallstreetbets,fr1ofl0,This is some serious euphoria right here,t3_glyucu,7
1589823650.0,2020-05-18,wallstreetbets,fr1pawp,so this huge run up... too scared to buy calls... too scared to get rekts with puts :( gg,t3_glyucu,8
1589823676.0,2020-05-18,wallstreetbets,fr1pcun,[deleted],t3_glyucu,7
1589824853.0,2020-05-18,wallstreetbets,fr1rt5j,"My account has the most unbreakable resistance levels in the market. Doesnt matter long/short or ticker, the resistance will not be beat. No support levels tho.",t3_glyucu,8
1589825007.0,2020-05-18,wallstreetbets,fr1s4tt,Lol anyone buying puts today in a middle of a short squeeze with all the hard hit stocks is asking to lose money.,t3_glyucu,7
1589825137.0,2020-05-18,wallstreetbets,fr1sevu,what justifies a fucking 4% move. this is insane,t3_glyucu,7
1589825500.0,2020-05-18,wallstreetbets,fr1t4vs,Imagine buying calls Friday at close and having them be the only stocks that aren’t up bigly today.,t3_glyucu,6
1589826188.0,2020-05-18,wallstreetbets,fr1ujpc,See I’ve doubled my portfolio in the last weeks. Sad thing it’s only a 500$ portfolio now. God I’m poor,t3_glyucu,8
1589826269.0,2020-05-18,wallstreetbets,fr1upm9,[deleted],t3_glyucu,6
1589826943.0,2020-05-18,wallstreetbets,fr1w5yn,my friendship has ended with wmt... tgt is my new best friend,t3_glyucu,8
1589827202.0,2020-05-18,wallstreetbets,fr1wp0s,Halp I can’t stop buying puts,t3_glyucu,7
1589827459.0,2020-05-18,wallstreetbets,fr1x7wv,[deleted],t3_glyucu,7
1589827502.0,2020-05-18,wallstreetbets,fr1xb1l,Imagine telling your kids that they won't be eating because their daddy bet against America.,t3_glyucu,7
1589827676.0,2020-05-18,wallstreetbets,fr1xnym,Yeah were gonna hit 300 tomorrow arent we,t3_glyucu,7
1589827832.0,2020-05-18,wallstreetbets,fr1xz87,Anyone else feel like this power hour is about to rip one way or the other?? I'm spooked 😰,t3_glyucu,8
1589828015.0,2020-05-18,wallstreetbets,fr1ycf5,It would be so funny if we just dropped like a rock and hit a circuit breaker right now. Hahaha I’m just kidding... unless?,t3_glyucu,7
1589828035.0,2020-05-18,wallstreetbets,fr1ydtc,"Just opened up QQQ and SPY puts again since the market seems to have had a lot of trouble breaking this level before and who the hell knows what China is going to do with this Huawei trade fight. They might try to hit back at the US tech industry so I figured some QQQ puts wouldn't hurt.

Still wanna do some long earnings plays though.",t3_glyucu,7
1589828096.0,2020-05-18,wallstreetbets,fr1yife,“BIG ANNOUNCEMENTS COMING” - Trump,t3_glyucu,6
1589828100.0,2020-05-18,wallstreetbets,fr1yip0,Can’t believe how wrong I’ve been about this market.,t3_glyucu,6
1589828432.0,2020-05-18,wallstreetbets,fr1z7au,"   
[**First Squawk**@FirstSquawk](https://twitter.com/FirstSquawk)·[5m](https://twitter.com/FirstSquawk/status/1262456502071091200)U.S PRES. TRUMP SAYS 'SOME BIG ANNOUNCEMENTS COMING' AND HAVE COME OUT ON THERAPEUTICS AND VACCINES FOR THE CORONAVIRUS 

&#x200B;

Lol.. watch an additional pump that comes from an announcement about the announcement that already happened... what happened to *priced in*.",t3_glyucu,8
1589828581.0,2020-05-18,wallstreetbets,fr1zi9b,"Why the fuck is re-opening considered good news?  When the stores/restaurants open, their operating costs will go back to normal but they'll have 50% of the usual business. It's gonna be a bloodbath for small businesses.",t3_glyucu,6
1589828866.0,2020-05-18,wallstreetbets,fr2033s,"From Down 10k to down 9k lets goo, only 8 such days i need lol",t3_glyucu,7
1589828927.0,2020-05-18,wallstreetbets,fr207oa,You guys are really making me want to buy puts with how bullish this sub is,t3_glyucu,6
1589829071.0,2020-05-18,wallstreetbets,fr20ir7,[deleted],t3_glyucu,6
1589829194.0,2020-05-18,wallstreetbets,fr20sdu,Panera bread is expensive as shit and you just get frozen microwaved junk,t3_glyucu,7
1589829395.0,2020-05-18,wallstreetbets,fr217cl,The great algo trade wars of 2020 shall be remembered,t3_glyucu,7
