created,date,subreddit,id,body,parent_id,score
1590000184.0,2020-05-20,wallstreetbets,fr9mpb5,Cold brew >> regular coffee,t3_gn8r9k,14
1590001776.0,2020-05-20,wallstreetbets,fr9q02c,Upvote for BABA calls rn,t3_gn8r9k,13
1589969558.0,2020-05-20,wallstreetbets,fr86k1v,[deleted],t3_gn8r9k,12
1589972062.0,2020-05-20,wallstreetbets,fr8944k,"Once I have 25k in my account I’m not holding onto options overnight, fucks With my mental health too much. My 7k in Facebook looking like 13k once market opens though.",t3_gn8r9k,12
1590006306.0,2020-05-20,wallstreetbets,fr9zqnh,"LOL the amount of retail traders yoloing into calls is the highest amount in history! Amount of new accounts at brokerages has exploded since March.

all this fed intervention has resulted in your average joe noticing stocks, now they are yoloing their stimulus cheques into the market, money that would have gone into the economy is now being spent gambling in stocks.",t3_gn8r9k,11
1589970842.0,2020-05-20,wallstreetbets,fr87uyd,I sold June $135 calls for $low and it’s 🚀 🚀 🚀,t3_gn8r9k,5
1589971260.0,2020-05-20,wallstreetbets,fr88ah8,"Damn, Lowe’s made those earnings estimates his little bitch.",t3_gn8r9k,5
1589972771.0,2020-05-20,wallstreetbets,fr89upf,[deleted],t3_gn8r9k,7
1589972803.0,2020-05-20,wallstreetbets,fr89vww,Imagine buying LK at 50$...,t3_gn8r9k,6
1589973777.0,2020-05-20,wallstreetbets,fr8axnr,LOW might be like WMT and shit the bed at open. I’d take profits ASAP boys,t3_gn8r9k,6
1589973857.0,2020-05-20,wallstreetbets,fr8b0s5,Anyone else just continuously averaging down on tanker stocks every single day while your wife keeps asking why you are moaning STNG and DHT mid sex and what the stimulus money and tax return went towards?,t3_gn8r9k,6
1589973958.0,2020-05-20,wallstreetbets,fr8b4uv,LK is down 30% and people over stocktwits are screaming short squeeze at open lol most retarded volk ever,t3_gn8r9k,6
1589974270.0,2020-05-20,wallstreetbets,fr8bhaw,Should I hold my LOW calls?,t3_gn8r9k,5
1589974639.0,2020-05-20,wallstreetbets,fr8bwe1,How high can we see Baba get by Friday ? Feeling excited again,t3_gn8r9k,6
1589974778.0,2020-05-20,wallstreetbets,fr8c21x,"That HUYA, so hot right now",t3_gn8r9k,5
1589974842.0,2020-05-20,wallstreetbets,fr8c4pl,Feels great FOMOing into Facebook at close yesterday on that dip. Now to decide if I dump it at open or not,t3_gn8r9k,6
1589974856.0,2020-05-20,wallstreetbets,fr8c59w,Where do you retards buy the paint you huff? Lowe's or Home Depot?,t3_gn8r9k,6
1589975021.0,2020-05-20,wallstreetbets,fr8cc8x,What the fuck FB is at 223 now lol. Hellll yeahhh,t3_gn8r9k,7
1589975030.0,2020-05-20,wallstreetbets,fr8cclu,"I have no open positions, but I'd love to see this plummet today. Pajama traders need to have their asses handed to them.",t3_gn8r9k,5
1589975625.0,2020-05-20,wallstreetbets,fr8d2aj,fucking anxiety waking me up at  4AM fuck can i just wakeup at 6:28 pls? jeeze now staring at futures doing nothing like a cuck,t3_gn8r9k,5
1589975743.0,2020-05-20,wallstreetbets,fr8d7hq,"Hey guys, great questions about LK getting delisted and for sure hitting $0!

That’s 100% how delisting works. The company becomes entirely worthless. I’m fact, it usually goes negative! You saw oil, now watch LK do it!!",t3_gn8r9k,6
1589976082.0,2020-05-20,wallstreetbets,fr8dmh6,Damn quadruple top so obvious,t3_gn8r9k,5
1589977486.0,2020-05-20,wallstreetbets,fr8fg9i,$296 pre market. I bet if I bought calls shit would be tanking though. I swear the universe doesn’t want me to go to school,t3_gn8r9k,6
1589977528.0,2020-05-20,wallstreetbets,fr8fiav,E-commerce is the play today,t3_gn8r9k,6
1589977698.0,2020-05-20,wallstreetbets,fr8fqp4,Cumming hard on this FB run,t3_gn8r9k,7
1589977739.0,2020-05-20,wallstreetbets,fr8fspb,"That's the last time I hold spy puts overnight, heck let alone puts",t3_gn8r9k,6
1589977824.0,2020-05-20,wallstreetbets,fr8fwql,"The market can’t erase my vxx gains after hours, that’s fucked up jpow",t3_gn8r9k,5
1589977888.0,2020-05-20,wallstreetbets,fr8fzqw,I JERK MY COCK FOR STONKS,t3_gn8r9k,6
1589977949.0,2020-05-20,wallstreetbets,fr8g2o7,[deleted],t3_gn8r9k,6
1589978207.0,2020-05-20,wallstreetbets,fr8gfif,FUCK I SOLD MY $2K IN LOWES CALLS AT A $200 LOSS I'M A FUCKING COWARD,t3_gn8r9k,6
1589978552.0,2020-05-20,wallstreetbets,fr8gx40,"i dont fuck wit crayons, but I feel like whether we open above or below 295 is very important.",t3_gn8r9k,7
1589978585.0,2020-05-20,wallstreetbets,fr8gyss,Copped FB 225c @ 3:59...Glorzo is peace,t3_gn8r9k,6
1589978727.0,2020-05-20,wallstreetbets,fr8h66e,"So it was a good call to hold FB calls through the night. Now, do I sell at open or sell",t3_gn8r9k,5
1589978837.0,2020-05-20,wallstreetbets,fr8hbxe,Where my BABA gang at?,t3_gn8r9k,6
1589979833.0,2020-05-20,wallstreetbets,fr8iu31,If you were a college student in the city would you pay 1.1-1.3k /month for studio apartment or say fuck it and live in ghetto for like 800$/month,t3_gn8r9k,6
1589980099.0,2020-05-20,wallstreetbets,fr8j8oz,Bears don’t look at your account today k thanks,t3_gn8r9k,7
1589980132.0,2020-05-20,wallstreetbets,fr8jajl,So conflicted. Economies around the world going to shit. Money printing going 100mph. No inflation. Stocks going up like crazy. Job loses everywhere. What to do.,t3_gn8r9k,6
1589980249.0,2020-05-20,wallstreetbets,fr8jh2f,Ask: is what Luckin did worse than Wells Fargo?,t3_gn8r9k,5
1589980313.0,2020-05-20,wallstreetbets,fr8jkqu,China locks down 100m due to a second wind of cases....fuck that brrrrrrrr. We're all gonna get fucked,t3_gn8r9k,7
1589980557.0,2020-05-20,wallstreetbets,fr8jyeo,imagine not getting rich off LK because you were spooked by a little bit of fraud,t3_gn8r9k,5
1589980631.0,2020-05-20,wallstreetbets,fr8k2o2,If you're buying LK today you deserve to be here.,t3_gn8r9k,5
1589980822.0,2020-05-20,wallstreetbets,fr8kdp5,"F

my $15k worth of $291p are gonna open down -$8k",t3_gn8r9k,6
1589981426.0,2020-05-20,wallstreetbets,fr8ld4f,the bears are who we thought they were,t3_gn8r9k,5
1589981608.0,2020-05-20,wallstreetbets,fr8lnn0,Aapl is spitting distance from ATHs. So weird. Are people really going to buy more iphones than a year ago?,t3_gn8r9k,7
1589982015.0,2020-05-20,wallstreetbets,fr8mc23,Congrats FB call holders from a friendly HPQ call holder,t3_gn8r9k,5
1589982019.0,2020-05-20,wallstreetbets,fr8mc9n,[deleted],t3_gn8r9k,6
1589982023.0,2020-05-20,wallstreetbets,fr8mcke,ok now its rigged,t3_gn8r9k,6
1589982039.0,2020-05-20,wallstreetbets,fr8mdil,"I lost over 1k between 2:50pm and market close yesterday

This morning I made it back in 10 mins. Praise papa Jerome",t3_gn8r9k,5
1589982160.0,2020-05-20,wallstreetbets,fr8mkyj,650% return on some FB calls... damn it’s nice to win again,t3_gn8r9k,7
1589982202.0,2020-05-20,wallstreetbets,fr8mnkg,Sold FB at the open for a 393% profit. Not being greedy. It's mooning now so maybe I should have held...,t3_gn8r9k,5
1589982258.0,2020-05-20,wallstreetbets,fr8mqzz,Getting ready for the rug pull. Coming before 11AM EST today. Witness this,t3_gn8r9k,6
1589982358.0,2020-05-20,wallstreetbets,fr8mxb5,Call gains are so beautiful,t3_gn8r9k,7
1589982832.0,2020-05-20,wallstreetbets,fr8nqut,Got out of Facebook. Profits before anything.,t3_gn8r9k,5
1589982936.0,2020-05-20,wallstreetbets,fr8nxbu,money doesnt grow on trees....it gets printed digitally,t3_gn8r9k,6
1589983044.0,2020-05-20,wallstreetbets,fr8o44p,So Holding FB calls was the right fuckin move. Props to that one guy.,t3_gn8r9k,6
1589983318.0,2020-05-20,wallstreetbets,fr8olen,Holy fuck is this real. What fucking virus ? Unemployment ? Fuck cares,t3_gn8r9k,5
1589983347.0,2020-05-20,wallstreetbets,fr8on76,[deleted],t3_gn8r9k,7
1589983376.0,2020-05-20,wallstreetbets,fr8ooz7,[deleted],t3_gn8r9k,7
1589983400.0,2020-05-20,wallstreetbets,fr8oqjj,Congrats to those who got better hands than I do and are cashing in on FB,t3_gn8r9k,6
1589983538.0,2020-05-20,wallstreetbets,fr8oz9g,"HOLD STRONG $HUYA BROTHERS, WE WILL END TODAY ABOVE $19.50!",t3_gn8r9k,7
1589983543.0,2020-05-20,wallstreetbets,fr8ozjs,Whoever said buy tgt calls i will fuck your mother,t3_gn8r9k,6
1589983611.0,2020-05-20,wallstreetbets,fr8p3ug,"WANNA HEAR A JOKE..

LK$ 
😏😏😂😂🤣🤣😭😭🤣😏😏🤣😂😭🤣🤣🤣😂",t3_gn8r9k,7
1589983649.0,2020-05-20,wallstreetbets,fr8p69c,[deleted],t3_gn8r9k,6
1589983670.0,2020-05-20,wallstreetbets,fr8p7k8,Broke 297. Next stop 300,t3_gn8r9k,6
1589983698.0,2020-05-20,wallstreetbets,fr8p9b2,[deleted],t3_gn8r9k,6
1589984015.0,2020-05-20,wallstreetbets,fr8ptk6,"lol @ Bloomberg's headlines:

 [Pandemic Threatens the Dollar’s Global Dominance: Joe Weisenthal](https://www.bloomberg.com/news/articles/2020-05-20/coronavirus-threatens-the-dollar-s-global-dominance-weisenthal?srnd=premium) 

 [Crisis Reminds Us That Nothing Beats Dollars: Shawn Donnan](https://www.bloomberg.com/news/articles/2020-05-20/coronavirus-crisis-reminds-the-world-why-it-needs-dollars-donnan?srnd=premium)",t3_gn8r9k,6
1589984390.0,2020-05-20,wallstreetbets,fr8qhvz,[deleted],t3_gn8r9k,7
1589984397.0,2020-05-20,wallstreetbets,fr8qick,Getting really fucking pissed off at HUYA at the moment,t3_gn8r9k,7
1589984489.0,2020-05-20,wallstreetbets,fr8qo98,"Don't stress HUYA holders. Volume is also already over a third of its average daily volume, and we're barely an hour in.  She's coming back up",t3_gn8r9k,7
1589984507.0,2020-05-20,wallstreetbets,fr8qpe7,SPY 300: I am inevitable,t3_gn8r9k,7
1589984561.0,2020-05-20,wallstreetbets,fr8qsye,We were at 276 last Thursday lmao,t3_gn8r9k,7
1589984847.0,2020-05-20,wallstreetbets,fr8rbwi,[deleted],t3_gn8r9k,7
1589984940.0,2020-05-20,wallstreetbets,fr8ri10,"I don't even know how to approach all this green. I sold most everything and now I'm afraid to get back in. Just seems too precarious. And yet, puts seem doomed to fail. I don't want to just sit here and wait for shit to turn red? Wtf?",t3_gn8r9k,7
1589985003.0,2020-05-20,wallstreetbets,fr8rm6w,[deleted],t3_gn8r9k,6
1589985043.0,2020-05-20,wallstreetbets,fr8roq2,"If DKNG has no debt and is at this price with table tennis and KBO, it’s going to get retard strength and go to 50 when the pro/college sports come back isn’t it?",t3_gn8r9k,6
1589985048.0,2020-05-20,wallstreetbets,fr8rp1r,lol wtf is SPY. Steady climb to 300?,t3_gn8r9k,6
1589985162.0,2020-05-20,wallstreetbets,fr8rwmm,Zero day SPY 295p for .30? Sign me tbe fuck up! ^I^will^never^learn^^🐻🤡🐻🤡,t3_gn8r9k,6
1589985208.0,2020-05-20,wallstreetbets,fr8rzmu,Apparently HUYA is the sound I’m going to make after watching my portfolio tank,t3_gn8r9k,6
1589985256.0,2020-05-20,wallstreetbets,fr8s2tx,Anyone else have that feeling? I’m a bull and I’m getting that feeling,t3_gn8r9k,6
1589985261.0,2020-05-20,wallstreetbets,fr8s34c,"Ok hit 700 more shares of coty$ 

Man I’m building up serious weight there under 4$ 


Bullish Kylie Jenner cosmetics",t3_gn8r9k,6
1589985267.0,2020-05-20,wallstreetbets,fr8s3js,"Finally did some DD into $HUYA and I'm sold. 

It is the #2 gaming platform in the world behind Twitch but that gap is narrowing. I am bullish on the video game industry during the COVID-19 days therefore, I'm sprinkling in some calls for the earnings call. Good luck all,

Also letting you know if you wanna buy, now is the time because of it's dip right now",t3_gn8r9k,7
1589985413.0,2020-05-20,wallstreetbets,fr8sdam,[deleted],t3_gn8r9k,7
1589985445.0,2020-05-20,wallstreetbets,fr8sfgs,raise your hand if you bought LK above 2.70,t3_gn8r9k,6
1589985586.0,2020-05-20,wallstreetbets,fr8sp18,"What happens when a bear buys a call and makes money, too? Asking for a friend.",t3_gn8r9k,7
1589985613.0,2020-05-20,wallstreetbets,fr8squv,Very happy to be cash gang right now,t3_gn8r9k,6
1589985646.0,2020-05-20,wallstreetbets,fr8st6l,[deleted],t3_gn8r9k,6
1589985739.0,2020-05-20,wallstreetbets,fr8szj1,lost big time on both HD and LOW this week. learned my lesson....buy the hype and sell before earnings!,t3_gn8r9k,6
1589985789.0,2020-05-20,wallstreetbets,fr8t2wy,Everyone remember to get your calls in today so you can profit on the rally from another 2.4 million people making initial jobless claims this week!,t3_gn8r9k,6
1589985791.0,2020-05-20,wallstreetbets,fr8t32i,Gonna go play RDR2 while I watch red lines in my account go deeper and deeper,t3_gn8r9k,6
1589986074.0,2020-05-20,wallstreetbets,fr8tm7v,Seems like everyone is calling a drop. When was the last time it dropped when everyone was ready?,t3_gn8r9k,7
1589986499.0,2020-05-20,wallstreetbets,fr8ufib,Can RH unlock the feature where I am only alerted when the stock percentage moves in my favor. It’s like a big FUCK YOU when it tells me I am losing money. Ya I know BITCH!,t3_gn8r9k,5
1589987024.0,2020-05-20,wallstreetbets,fr8vg57,Back when we were all losing money on SPY puts I bought a 7/17 $300c to hedge. Damn I wish I held that fucker,t3_gn8r9k,6
1589987036.0,2020-05-20,wallstreetbets,fr8vgye,[deleted],t3_gn8r9k,5
1589987086.0,2020-05-20,wallstreetbets,fr8vked,Who else about to ride an ez DKNG call now,t3_gn8r9k,6
1589987211.0,2020-05-20,wallstreetbets,fr8vt56,"as predicted, $HUYA **WILL NOT** break $18.75 support, it didn't last night and it won't today. we will be rallying EOD, remind me 4 hours",t3_gn8r9k,5
1589987259.0,2020-05-20,wallstreetbets,fr8vwdi,Did Spotify jump ‘cause of Joe Rogan?,t3_gn8r9k,7
1589987265.0,2020-05-20,wallstreetbets,fr8vwu9,Qqq is less than 2% away from ath- this is fine,t3_gn8r9k,5
1589987500.0,2020-05-20,wallstreetbets,fr8wd5z,"Damn, I'm just glad I didn't go crazy buying puts at 292 right now lol

This is honestly insane",t3_gn8r9k,5
1589987791.0,2020-05-20,wallstreetbets,fr8wxl9,"Will Meade tweeted ""rug pull coming"" for like the 87th time in the past month, I see",t3_gn8r9k,6
1589987812.0,2020-05-20,wallstreetbets,fr8wz58,LOL what a massive shit VTIQ just took.,t3_gn8r9k,6
1589987993.0,2020-05-20,wallstreetbets,fr8xbzw,"I wonder what it feels like to be unemployed, still waiting on unemployment checks, mortgage past due, and seeing the stock market be near ATHs...Jesus no wonder there's so much domestic violence right now.",t3_gn8r9k,6
1589988248.0,2020-05-20,wallstreetbets,fr8xu77,"As a bear, this market feels like a fever dream by now and I reached the point where I question my mental maturity.",t3_gn8r9k,7
1589988252.0,2020-05-20,wallstreetbets,fr8xug5,"Pence has landed and is getting ready to save my DIS calls. 

https://twitter.com/Mike_Pence/status/1263127940708986881",t3_gn8r9k,6
1589988290.0,2020-05-20,wallstreetbets,fr8xx7i,I will be patient. I will wait for my buy order to trigger at the entry point I am happy about. I will not FOMO into a bad entry point. Repeat repeat repeat,t3_gn8r9k,6
1589988505.0,2020-05-20,wallstreetbets,fr8ycsy,[deleted],t3_gn8r9k,6
1589988726.0,2020-05-20,wallstreetbets,fr8ysn3,"I bought a FB $220c 5/22 yesterday at open for $60 and sold it for $106 8 minutes later. It is now worth over $1,000. I am a big fat idiot.",t3_gn8r9k,6
1589988912.0,2020-05-20,wallstreetbets,fr8z64x,Tanker gang is even sadder than bear gang,t3_gn8r9k,6
1589988944.0,2020-05-20,wallstreetbets,fr8z8g2,[deleted],t3_gn8r9k,6
1589988949.0,2020-05-20,wallstreetbets,fr8z8t4,Why do I buy long dated calls and then obsessively watch the 1 day 1 minute chart?,t3_gn8r9k,7
1589989019.0,2020-05-20,wallstreetbets,fr8zduv,"'US Stocks open higher after retailers post resilient earnings""

Guys we only lost $1bn instead of $1.1bn, we are fineeee",t3_gn8r9k,6
1589989134.0,2020-05-20,wallstreetbets,fr8zmb1,"Hey WSB, what's your guilty pleasure? Mine is crawling back to ZM puts over and over again even though they fucc me over bigly every single time.",t3_gn8r9k,5
1589989296.0,2020-05-20,wallstreetbets,fr8zxxm,I am just nervously waiting for the EOD dump. 😎,t3_gn8r9k,6
1589989359.0,2020-05-20,wallstreetbets,fr902g7,Facebook is easily $250..,t3_gn8r9k,6
1589989535.0,2020-05-20,wallstreetbets,fr90feq,"This is all just a deep fake bull trap 

We all know Lil Yachty will tank the markets next week",t3_gn8r9k,6
1589989614.0,2020-05-20,wallstreetbets,fr90l96,[deleted],t3_gn8r9k,6
1589990033.0,2020-05-20,wallstreetbets,fr91g0u,"Lmao I've had calls too, but some of you bulls are about to be left on the moon",t3_gn8r9k,7
1589990094.0,2020-05-20,wallstreetbets,fr91klv,gonna ride huya all the way to right before Q2 earnings probably,t3_gn8r9k,6
1589973590.0,2020-05-20,wallstreetbets,fr8aqc9,"Shit like this needs to be stickied on every daily thread. Good work, my man.",t1_fr8ag3u,75
1589973927.0,2020-05-20,wallstreetbets,fr8b3ny,"Very nice, thanks a lot",t1_fr8ag3u,7
1589972959.0,2020-05-20,wallstreetbets,fr8a1uq,"Just typed this elsewhere, sorry for rerun....

Don’t get stuck in this mindset. I missed out on a lot of the April gains because I was there too, focused on how bad covid was. 

Investors will allocate cash wherever they can get the highest yield. Right now interest rates are zero and staying there, and real estate will likely tank with commercial customers vacating. 

Even if the yield is lower than it was, stocks still have about a 5% yield on earnings. Forget if SPY will go up or down, investors are deciding if they want to buy SPY’s future returns. Right now, that’s about $15/share annual earnings at a cost of $300. So where else are you going to get that? Until there’s a viable alternative, stonks will keep going up. 

Also realize, the initial crash was not because investors thought that was what stocks were worth. There was an actual liquidity crisis, which forced sales to make cash available. With fed intervention, that’s been resolved. The market never believed SPY 220, there were just a lot of institutions forced to sell all at once.

If we are headed to the second Great Depression and the large businesses will have sustained loss of profitability, yes, SPY will rightly go down. But right now most people expect this to be a one wave affair where this is a blip on the radar when taking a a ten year view.",t1_fr8937x,86
1589972103.0,2020-05-20,wallstreetbets,fr895px,"Do you want to be ""rational"" or make money? We ain't in this for the long bull run, but making cash while doing it, risk is one day it just crashes 50% but I guess we willing to gamble that :D",t1_fr8937x,42
1589972135.0,2020-05-20,wallstreetbets,fr896w5,"Agreed.

Being bearish is a patience game. Bulls are on parade but SPY is basically in a channel and doing nothing impressive.",t1_fr8937x,7
1589976844.0,2020-05-20,wallstreetbets,fr8elc9,Wait the gecko predicted red today? We better get ready then.,t1_fr881yc,23
1589971137.0,2020-05-20,wallstreetbets,fr885y2,Should have listened to the shrimp.,t1_fr881yc,42
1589973783.0,2020-05-20,wallstreetbets,fr8axvo,Mods,t1_fr8avtf,38
1589973791.0,2020-05-20,wallstreetbets,fr8ay5y,Be ready to follow through,t1_fr8avtf,21
1589971283.0,2020-05-20,wallstreetbets,fr88ba2,💎,t1_fr883h8,12
1589976804.0,2020-05-20,wallstreetbets,fr8ejhi,Imagine doing DD on stocktits,t1_fr8ehaw,14
1589970486.0,2020-05-20,wallstreetbets,fr87hmz,Rug push,t1_fr87g6u,48
1589987043.0,2020-05-20,wallstreetbets,fr8vhh5,Lol if spy hits 25 you aren’t going to be able to use your winnings because of the alien invasion+thermonuclear war+ zombie apocalypse,t1_fr899lo,20
1589973990.0,2020-05-20,wallstreetbets,fr8b64b,Sir this is casino.,t1_fr8b4ca,26
1589970730.0,2020-05-20,wallstreetbets,fr87qqx,"Be patient. 

It will get greener. At least I hope so cuz I'm selling ATM puts at 10AM.",t1_fr86m1b,15
1589981187.0,2020-05-20,wallstreetbets,fr8kz44,You dumb fucks have convinced me to hop on this fuck train.,t1_fr8kriz,10
1589981204.0,2020-05-20,wallstreetbets,fr8l019,"I'm not even gay, but quality comment is fucking quality xD",t1_fr8kriz,7
1589981198.0,2020-05-20,wallstreetbets,fr8kzp9,actually mega bullish for stonks.,t1_fr8ktpe,18
1589972588.0,2020-05-20,wallstreetbets,fr89nwj,"Well this one might not have been random since he just plucked someone from their Board to be his ""vaccine czar.""  LOL.",t1_fr89drr,8
1589970889.0,2020-05-20,wallstreetbets,fr87wox,"Honestly man who even knows anymore. Market is so insane lately that we could drill red to 285 or rally to 305 at any fucking moment.

My puts were fucked yesterday, then they werent. In a span of like 10 seconds.",t1_fr87rsp,35
1589971849.0,2020-05-20,wallstreetbets,fr88w76,It’s Hodor,t1_fr88rex,21
1589980232.0,2020-05-20,wallstreetbets,fr8jg3e,The headlines for today should be particularly entertaining.,t1_fr8jd5e,18
1589980262.0,2020-05-20,wallstreetbets,fr8jhtn,"Financial news is so pathetic

I ignore it",t1_fr8jd5e,9
1589978054.0,2020-05-20,wallstreetbets,fr8g7ra,attempted pump n dump,t1_fr8g6i5,13
1589973574.0,2020-05-20,wallstreetbets,fr8appp,You can get mad,t1_fr8aosf,68
1589974679.0,2020-05-20,wallstreetbets,fr8bxz6,"Insiders dumping stocks

Runs up 20%+ and they do a stock offering to get money.

Haha",t1_fr8aosf,14
1589973666.0,2020-05-20,wallstreetbets,fr8at92,I get mad at all corruption that doesn’t involve me making money. 1 mil for the homie and I’m cool with it.,t1_fr8aosf,34
1589989252.0,2020-05-20,wallstreetbets,fr8zus1,You should definitely be mad. They are using the government to profit from a pandemic and at the same time  using the government to pretend there is no pandemic and have their wage slaves go back to work,t1_fr8aosf,6
1589980650.0,2020-05-20,wallstreetbets,fr8k3qt,You’ll lose money. Not just your gains,t1_fr8k2cs,16
1589969838.0,2020-05-20,wallstreetbets,fr86u43,Why do I never make the obvious plays. Fuck.,t1_fr86phm,31
1589982014.0,2020-05-20,wallstreetbets,fr8mbzy,You sold at their ATH if you sold today.. be happy on to the next,t1_fr8maak,7
1589997866.0,2020-05-20,wallstreetbets,fr9huzg,My wife slept with the Rong Dong!!!!,t1_fr9hsbv,7
1589976218.0,2020-05-20,wallstreetbets,fr8dsjx,I think 227.50 is the ceiling,t1_fr8dkpc,7
1589970281.0,2020-05-20,wallstreetbets,fr87a2z,"Don't do anything at open.  Be a little patient.  There will likely be some dumbass FOMO buying if the futures open this green.

I don't trade until 11.",t1_fr874st,7
1589971581.0,2020-05-20,wallstreetbets,fr88md1,PPT isn’t even trying to hide it anymore.,t1_fr88is4,11
1589972025.0,2020-05-20,wallstreetbets,fr892r1,Link for the infection lies?,t1_fr88vdb,7
1589975263.0,2020-05-20,wallstreetbets,fr8cmjn,"we don't do applause here, loud sudden noises like clapping can be triggering for autists",t1_fr8cj5t,22
1589975450.0,2020-05-20,wallstreetbets,fr8cujg,We both know youre drinking sunny delight you florida shit stain,t1_fr8clxr,28
1589975282.0,2020-05-20,wallstreetbets,fr8cnbp,Ah the nap by noon breakfast. Ballsy.,t1_fr8clxr,8
1590004359.0,2020-05-20,wallstreetbets,fr9vjs9,it was always a casino,t1_fr9vhya,7
1589980840.0,2020-05-20,wallstreetbets,fr8keqz,But this sub isnt better than checking CNBC for Sara,t1_fr8kb58,5
1589977178.0,2020-05-20,wallstreetbets,fr8f1a4,"Just manually block those people

I've been doing that for a week and I see almost no bears/bulls comments in this thread at all",t1_fr8essd,7
1589979518.0,2020-05-20,wallstreetbets,fr8icpy,slowly? lol the wsb poll was 4/5 wrong all on bullish.,t1_fr8i8s3,6
1589979503.0,2020-05-20,wallstreetbets,fr8ibvi,This,t1_fr8i8s3,7
1589970555.0,2020-05-20,wallstreetbets,fr87ka3,"You better belize it

You probably won't though",t1_fr87hl0,15
1589970994.0,2020-05-20,wallstreetbets,fr880k5,How is the cost of living? I've been considering a retirement in a cheap and warm country.,t1_fr87hl0,5
1589971506.0,2020-05-20,wallstreetbets,fr88jkf,That's when you know you are right,t1_fr88eu1,8
1589979603.0,2020-05-20,wallstreetbets,fr8ihdn,Husbands*,t1_fr8if67,11
1589987526.0,2020-05-20,wallstreetbets,fr8wezp,Mods,t1_fr8wdwl,6
1589982231.0,2020-05-20,wallstreetbets,fr8mpbj,Same. No shame in taking profits,t1_fr8mnkg,7
1589984510.0,2020-05-20,wallstreetbets,fr8qpl2,I bought January 2021 calls,t1_fr8qo98,7
1589980500.0,2020-05-20,wallstreetbets,fr8jvax,"I wish I had read this comment two months ago bc I would have pulls out of all my puts.  

But then again I'm not sure anyone was saying this two months ago.",t1_fr8a1uq,17
1589971444.0,2020-05-20,wallstreetbets,fr88h8o,Have a diamond hands tattoo on my forearm lol. Will actually make a post about it one day 😜,t1_fr88ba2,6
1589970856.0,2020-05-20,wallstreetbets,fr87vhl,Pushing $ROPE,t1_fr87hmz,12
1589974129.0,2020-05-20,wallstreetbets,fr8bblk,There’s gambling and then there’s shooting yourself in the face while throwing your money in a dumpster fire.,t1_fr8b64b,7
1589980326.0,2020-05-20,wallstreetbets,fr8jlhd,"> ""wall street rises as investors gain confidence""",t1_fr8jg3e,14
1589970035.0,2020-05-20,wallstreetbets,fr8717d,"True.  I mean I did have Lowe's, but also HD.  Lowe's doesn't even really have a contractor game to speak of they'd be missing out on.  Of course it would do better than HD.  Obvious.",t1_fr86u43,13
1589971835.0,2020-05-20,wallstreetbets,fr88vpa,"I think there is some of that.

I didn't even account for the fact that futures are traded on margin, so the real volume of cash moving is probably 1/10th of that.",t1_fr88md1,8
1589980739.0,2020-05-20,wallstreetbets,fr8k8va,"""Why you got that sick tattoo, bro?""

""I held an OTM call until it went ITM - at the expiry date."" *Flexes*

""That's so fuckin hardcore. Good, I wish my dick was large and hard like yours. How many contracts?""

""One."" *Flexes*",t1_fr88h8o,11
