created,date,subreddit,id,body,parent_id,score
1620235993.0,2021-05-05,wallstreetbets,gx1tub7,"I turned the bots off, let's see what happens

EDIT: BTW we did a mod reshuffle the other day and it's apparently become a conspiracy.

You can remove any mods under you (which is why scammers always try to woo the top mod) so we like to make sure the older mods that we trust are at the top. After the drama a couple months ago things were out of whack and some of the newer guys had made it toward the top and older guys had to be re-added (me). You'll see I'm back on the first page along with some of the orders being switched.",t3_n5cc1t,1
1620227609.0,2021-05-05,wallstreetbets,gx19a9d,This is why Bull>Bear. Whenever Bulls are green this place is a beautiful hugfest. When Bear is green everyone loses their fucking mind while Bears are in the corner jerking off to cartel execution videos.,t3_n5cc1t,93
1620224748.0,2021-05-05,wallstreetbets,gx12n34,"My wife can't afford a divorce lawyer if I lose all our money in stocks.

I'm doing this for us.",t3_n5cc1t,81
1620209538.0,2021-05-05,wallstreetbets,gx0d8wd,"i'm just gonna stop looking, so what if my portfolio goes 20% down in a day? what am i gonna do? all i can do is take the pounding like a little bitch D:",t3_n5cc1t,53
1620210064.0,2021-05-05,wallstreetbets,gx0dtvp,maybe i should quit options if i'm just gonna take it in the ass every week,t3_n5cc1t,59
1620211234.0,2021-05-05,wallstreetbets,gx0f65u,"Person of the day award goes to Yellen. She was like “Hey rates will go up” in the morning and lHey, I take that back”, in the evening. Bulls and bears R FUK",t3_n5cc1t,55
1620211703.0,2021-05-05,wallstreetbets,gx0fq7n,Still can't believe Bill Gates fucked my dad.,t3_n5cc1t,56
1620210828.0,2021-05-05,wallstreetbets,gx0eoy5,"No way PLTR will be down for the 20th day in a row, right? 😅",t3_n5cc1t,53
1620235188.0,2021-05-05,wallstreetbets,gx1rx30,Cannot wait to sell PLTR in 2038 for $24,t3_n5cc1t,44
1620211894.0,2021-05-05,wallstreetbets,gx0fyof,AMD in the $70s is a pretty solid entry,t3_n5cc1t,42
1620214535.0,2021-05-05,wallstreetbets,gx0jhga,"I gave Apple an expired credit card, I’ve had Apple Music for 6 months free already. Puts on AAPL",t3_n5cc1t,120
1620212197.0,2021-05-05,wallstreetbets,gx0gc60,Tired of hearing a potential short squeeze on every stock these days. The only thing that’s getting squeezed is them cheeks boi,t3_n5cc1t,244
1620215705.0,2021-05-05,wallstreetbets,gx0l8nt,"You lose some, you lose some",t3_n5cc1t,113
1620209760.0,2021-05-05,wallstreetbets,gx0dhj4,"me when portfolio is green: why would anyone buy weeklies, gd you stupid motherfuckers must hate money

me when portfolio is red: surely a few more FDs can't hurt, they're on sale! 🤡",t3_n5cc1t,37
1620219879.0,2021-05-05,wallstreetbets,gx0sftu,"Pretty soon, The Bill Gates Foundation will start helping struggling  young actresses and The Melinda Gates Foundation will start helping impoverished pool boys.",t3_n5cc1t,37
1620222629.0,2021-05-05,wallstreetbets,gx0xzhv,Where my RKT crew at?,t3_n5cc1t,37
1620240198.0,2021-05-05,wallstreetbets,gx23qe8,"WSB has really turned to shit

-guy who arrived in January",t3_n5cc1t,35
1620213478.0,2021-05-05,wallstreetbets,gx0hztc,Average person on WSB: Yo SPY went up 3 dollars. Is this a short squeeze?,t3_n5cc1t,106
1620213509.0,2021-05-05,wallstreetbets,gx0i1bd,[removed],t3_n5cc1t,162
1620213272.0,2021-05-05,wallstreetbets,gx0hq4a,"Puts on my career. 

Because it's not advisable to shit post on your company's Microsoft teams message board.",t3_n5cc1t,32
1620213495.0,2021-05-05,wallstreetbets,gx0i0lp,There will come a time when Cathie will own like 99% of all PLTR float and SP would still range from 21 to 24.,t3_n5cc1t,33
1620217864.0,2021-05-05,wallstreetbets,gx0oqtw,If tech isn't green today I'm going to drink gasoline,t3_n5cc1t,31
1620220725.0,2021-05-05,wallstreetbets,gx0u2s4,I'm worried it's a pre market fake out,t3_n5cc1t,31
1620216439.0,2021-05-05,wallstreetbets,gx0mdu8,Boss got back to me with a final offer of a 13k raise. I told him to go back to HR and try to get me 18k. He's actually doing it.,t3_n5cc1t,83
1620212816.0,2021-05-05,wallstreetbets,gx0h4x6,"How do I tell my wife I spent our life savings on a coin named CumRocket...

Edit: Fuck what the fuck do I tell my accountant?",t3_n5cc1t,25
1620214210.0,2021-05-05,wallstreetbets,gx0j0nk,Cathie desperately needs her next TSLA,t3_n5cc1t,28
1620214635.0,2021-05-05,wallstreetbets,gx0jmt9,"All in on RKT, here we go again...",t3_n5cc1t,24
1620215777.0,2021-05-05,wallstreetbets,gx0lcn7,Team RKT🚀🚀were blasting off again!,t3_n5cc1t,25
1620217218.0,2021-05-05,wallstreetbets,gx0nnhe,AMD wants to moon when I sell.,t3_n5cc1t,26
1620217535.0,2021-05-05,wallstreetbets,gx0o6pi,"So last night my wife learned the tournament im fishing this weekend is $500, she found that interesting. Imagine if she knew I ate $5000 in unrealized gains on the regular.",t3_n5cc1t,27
1620218437.0,2021-05-05,wallstreetbets,gx0pr65,Y’all are gonna make me FOMO into RKT 😒,t3_n5cc1t,25
1620220998.0,2021-05-05,wallstreetbets,gx0umj8,"Yellen yesterday: “idk rates might go up money printer has been on for a while”

Yellen today: “after a trip to Lake Laogai, I’ve determined there is no inflation in Ba Sing Se” 🤗🤗",t3_n5cc1t,28
1620222072.0,2021-05-05,wallstreetbets,gx0wt8m,I’m out. Going to join the cryptards. They don’t have to do anything to make 10x gains in a month. Just sit there praising some digital currency none of them actually use as currency. Simulation confirmed.,t3_n5cc1t,30
1620222844.0,2021-05-05,wallstreetbets,gx0yg1w,"My wife “so I read about these ‘options’ and they can expire and you lose ALL your money?!? Have you lost money? Why not be safe and hold stocks!?” Wife for sale, slightly used",t3_n5cc1t,24
1620232465.0,2021-05-05,wallstreetbets,gx1l64b,Lost all my money on options. Panic sold and just generally made terrible trading decisions. Time to reassess things,t3_n5cc1t,27
1620233140.0,2021-05-05,wallstreetbets,gx1muov,"I tell ya, gambling never agreed with me. Last week I went to the track and they shot my horse with the opening gun.",t3_n5cc1t,26
1620233744.0,2021-05-05,wallstreetbets,gx1odi9,[deleted],t3_n5cc1t,26
1620234213.0,2021-05-05,wallstreetbets,gx1pjgc,"Someone tell the boomers to rotate back into tech

Sincerely,

A man with a 100% tech portfolio",t3_n5cc1t,26
1620234779.0,2021-05-05,wallstreetbets,gx1qx6y,"*U.S. birth and fertility rates in 2020 dropped to another record low, CDC says*

*The U.S. birth rate is so low, the nation is “below replacement levels,” meaning more people die every day than are being born, the CDC said.*

Puts on humans 😈",t3_n5cc1t,29
1620241002.0,2021-05-05,wallstreetbets,gx25mmo,[removed],t3_n5cc1t,25
1620217822.0,2021-05-05,wallstreetbets,gx0oo95,clov bag holder here,t3_n5cc1t,23
1620220265.0,2021-05-05,wallstreetbets,gx0t68i,Cramer is weirdly obsessed with WSB,t3_n5cc1t,24
1620233151.0,2021-05-05,wallstreetbets,gx1mvn7,"The acorns sub is so sweet and innocent like ""Moving to RH because the $1 a month management fee will eat all my profits."" A month later they're here losing thousands on FDs and not blinking.",t3_n5cc1t,24
1620226937.0,2021-05-05,wallstreetbets,gx17on4,RKT fuck it round 2,t3_n5cc1t,23
1620228492.0,2021-05-05,wallstreetbets,gx1be2g,PLTR Is hands down the most frustrating stock I ever invested..,t3_n5cc1t,23
1620213389.0,2021-05-05,wallstreetbets,gx0hvme,All I want is to invest in a stock that makes 100% gains every day for 20 years.  Is that really too much to ask?,t3_n5cc1t,71
1620214381.0,2021-05-05,wallstreetbets,gx0j9b9,"I should sell all my PLTR, because as soon as I sell the price will skyrocket. 

Taking one for the team.",t3_n5cc1t,23
1620218546.0,2021-05-05,wallstreetbets,gx0py8z,Jessica Alba is bullish in the front and bearish in the back,t3_n5cc1t,21
1620218586.0,2021-05-05,wallstreetbets,gx0q0vc,"Coffee✔️ 

Massive dump before 9:30am (not talking about SPY)

SPY 420 eod",t3_n5cc1t,23
1620218938.0,2021-05-05,wallstreetbets,gx0qoa6,"I’m open my brokerage app, lie it on the floor, squat over it and shit on it - and let the buy and sell orders fall where they may",t3_n5cc1t,21
1620226937.0,2021-05-05,wallstreetbets,gx17onb,RKT gonna shoot up. To the moon.,t3_n5cc1t,21
1620232860.0,2021-05-05,wallstreetbets,gx1m5b9,"Said it before I’ll say it again, the beating will continue until retail stops playing short term options, these assholes on the street are literally just watching what y’all do and fucking it up to take your money. Only way you will get the rebound is with leaps and shares, they won’t stop shaking and filtering out your money until people stop making the donations",t3_n5cc1t,19
1620224573.0,2021-05-05,wallstreetbets,gx128wm,"Just discovered options. 

Can't go tits up.",t3_n5cc1t,20
1620224849.0,2021-05-05,wallstreetbets,gx12var,"It rubs the Peloton on the skin or it gets the Tread+ again

It rubs the Peloton on the skin or it gets the Tread+ again

It rubs the Peloton on the skin or it gets the Tread+ again",t3_n5cc1t,20
1620227094.0,2021-05-05,wallstreetbets,gx18208,"PLTR is going to have it's strongest day, yet... -2.5%",t3_n5cc1t,19
1620227697.0,2021-05-05,wallstreetbets,gx19htk,"I have RKT, I like RKT but you people that think blowout earnings mean anything anymore you are not understanding we live in opposite world now.",t3_n5cc1t,19
1620227838.0,2021-05-05,wallstreetbets,gx19tue,"Well I'm all in with my 300 shares in RKT, so let's do this 👌🙏💲🤞",t3_n5cc1t,21
1620238952.0,2021-05-05,wallstreetbets,gx20tge,Treadmill ate muh baby,t3_n5cc1t,20
1620241906.0,2021-05-05,wallstreetbets,gx27rla,A meme currency is up 500% in the past 2 weeks and my value portfolio is down around 20% even though all their earnings were perfect.,t3_n5cc1t,21
1620215854.0,2021-05-05,wallstreetbets,gx0lgx0,Thesis on why FB is on the decline: my friends list is basically just family and people I’ve had sex with. If I were in Alabama those lists would have significant overlap.,t3_n5cc1t,57
1620218529.0,2021-05-05,wallstreetbets,gx0px2o,Showed my 5 year old the video with JPow printing all the money. He laughed and said “he’s making way too much money.” Inflation fears are everywhere . Lol,t3_n5cc1t,60
1620211474.0,2021-05-05,wallstreetbets,gx0fgaz,AMD you juicy tease,t3_n5cc1t,18
1620216581.0,2021-05-05,wallstreetbets,gx0mlu7,[removed],t3_n5cc1t,19
1620244895.0,2021-05-05,wallstreetbets,gx2ex2d,RKT Gang... hold me,t3_n5cc1t,19
1620214067.0,2021-05-05,wallstreetbets,gx0itgc,The front page of WSB looks like a retard convention with all the memes,t3_n5cc1t,18
1620220908.0,2021-05-05,wallstreetbets,gx0ug0y,"Alexa, play ""Shit On My Chest"" by The American Stock Market",t3_n5cc1t,17
1620220967.0,2021-05-05,wallstreetbets,gx0uk8l,"Do you think Melinda needs a new boyfriend. I mean, I’m gay but $65b is $65b.",t3_n5cc1t,18
1620222932.0,2021-05-05,wallstreetbets,gx0ymv7,I'm $30 positive on my entire $10k portfolio for the first time in months.  Sould I just sell it all off now and quit 🤔 experience so far says yes but I'm going to pretend I understand how to make money now and keep going.,t3_n5cc1t,18
1620226993.0,2021-05-05,wallstreetbets,gx17tao,Thank god I’m dumb enough to buy RKT,t3_n5cc1t,18
1620234255.0,2021-05-05,wallstreetbets,gx1pn71,You really just gotta be a scalper in this market,t3_n5cc1t,18
1620236045.0,2021-05-05,wallstreetbets,gx1tyr0,"Here’s a good rule of thumb for the market. If the market is up, PLTR will be down. If the market is down, PLTR will be down",t3_n5cc1t,18
1620237792.0,2021-05-05,wallstreetbets,gx1y3up,got my 2nd pfizer shot.  am now trading with maximum autism,t3_n5cc1t,18
1620239816.0,2021-05-05,wallstreetbets,gx22txa,There's absolutely no one on Earth who hates their job more than me. Such a shame that the 4 years college then 40 year of Corporate droning is the dream we're all sold. When there's children on TikTok shaking their dicks making 10x what I'll make in a lifetime.,t3_n5cc1t,17
1620244346.0,2021-05-05,wallstreetbets,gx2dm58,"To think all of this fucking around in the stock market, selling puts for 50$ and risking tens of thousand of dollars could have been avoided had I just gambled 5K into a dog themed internet currency with no supply cap.....",t3_n5cc1t,17
1620219385.0,2021-05-05,wallstreetbets,gx0rijd,COIN is the biggest disappointment since my birth,t3_n5cc1t,17
1620222741.0,2021-05-05,wallstreetbets,gx0y834,Drank a bunch of coffee and am headed to the bathroom. Pretty confident we'll be seeing a Big Squeeze this morning,t3_n5cc1t,18
1620224585.0,2021-05-05,wallstreetbets,gx129sn,Closed fidelity opened up calculator and just started typing in big numbers,t3_n5cc1t,17
1620225127.0,2021-05-05,wallstreetbets,gx13huf,"How can Peloton kill kids? I thought they only existed in high end, ultra modern skyrise apartment buildings owned by childless sociopaths?",t3_n5cc1t,16
1620226307.0,2021-05-05,wallstreetbets,gx1675u,Anyone playing RKT?,t3_n5cc1t,17
1620227072.0,2021-05-05,wallstreetbets,gx18066,So you're saying put another 2k in RKT? 🤔,t3_n5cc1t,17
1620227456.0,2021-05-05,wallstreetbets,gx18wzp,RKT is up 3.5% and climbing! All aboard the RKT train!,t3_n5cc1t,17
1620229072.0,2021-05-05,wallstreetbets,gx1cti8,"Guys I got a billion dollar idea…

Ready?

A treadmill… that DOESN’T eat kids",t3_n5cc1t,16
1620233560.0,2021-05-05,wallstreetbets,gx1nwno,I would like to be rich so I can spend my days looking at boobs. Market please fulfil my noble wish.,t3_n5cc1t,16
1620244344.0,2021-05-05,wallstreetbets,gx2dlxi,I'm straight up not having a good time,t3_n5cc1t,18
1620244895.0,2021-05-05,wallstreetbets,gx2ex0c,"It's been a pleasure lads. But, this is pure fuckery. Will come back to this after boomers rotate into the graves.",t3_n5cc1t,18
1620213696.0,2021-05-05,wallstreetbets,gx0iap3,RKT gonna be the play today,t3_n5cc1t,16
1620221616.0,2021-05-05,wallstreetbets,gx0vvf9,"Dont stop now RKT, break out of orbit",t3_n5cc1t,16
1620222543.0,2021-05-05,wallstreetbets,gx0xsy4,"Break the RKT wall. There""S GOLD in DEM HILLS",t3_n5cc1t,15
1620222673.0,2021-05-05,wallstreetbets,gx0y2xr,When is the RKT taking off,t3_n5cc1t,16
1620223413.0,2021-05-05,wallstreetbets,gx0zo7l,Oh no. It was a trap,t3_n5cc1t,16
1620223971.0,2021-05-05,wallstreetbets,gx10wfl,Told my wife we’re having water for dinner tonight,t3_n5cc1t,16
1620226740.0,2021-05-05,wallstreetbets,gx177oc,RKT about to make me so much money,t3_n5cc1t,15
1620226989.0,2021-05-05,wallstreetbets,gx17swx,its literally a RKT boys,t3_n5cc1t,17
1620227401.0,2021-05-05,wallstreetbets,gx18s92,APES  **RKT**  flying rn,t3_n5cc1t,17
1620227623.0,2021-05-05,wallstreetbets,gx19bea,My marriage depends on SPY 419 today,t3_n5cc1t,17
1620227641.0,2021-05-05,wallstreetbets,gx19d13,okay RKT is retarde but now im in,t3_n5cc1t,15
1620233216.0,2021-05-05,wallstreetbets,gx1n1lu,Fuck this market. Say what you want about giving unenthusiastic hand jobs at local truck stops but at least I was making money.,t3_n5cc1t,16
1620233293.0,2021-05-05,wallstreetbets,gx1n8iw,Market is exhausted. Lets get the correction over with already and start fresh,t3_n5cc1t,16
1620235128.0,2021-05-05,wallstreetbets,gx1rrwb,"Jokes on you Wallstreet, I don't have to pay taxes on these significant losses.",t3_n5cc1t,15
1620236149.0,2021-05-05,wallstreetbets,gx1u7o8,Who’s in on RKT earnings?,t3_n5cc1t,17
1620236367.0,2021-05-05,wallstreetbets,gx1upuv,I have a gambling problem,t3_n5cc1t,16
1620237347.0,2021-05-05,wallstreetbets,gx1x2in,"NASDAQ up= ARKK down

TESLA up = ARKK down

ARKK up= ARKK down",t3_n5cc1t,17
1620243975.0,2021-05-05,wallstreetbets,gx2cpj3,Are we holding RKT through earnings?,t3_n5cc1t,17
1620210146.0,2021-05-05,wallstreetbets,gx0dx5q,I bet if i make a coin called musk coin retards will buy it,t3_n5cc1t,72
1620214356.0,2021-05-05,wallstreetbets,gx0j839,"Apparently any stock going up no matter what the catalyst is now ""squeezing""",t3_n5cc1t,71
1620214279.0,2021-05-05,wallstreetbets,gx0j476,Oh Boy can't wait for today's rally and recovering 10% of yesterday's losses,t3_n5cc1t,16
1620214600.0,2021-05-05,wallstreetbets,gx0jkyt,"I have decided I am going to stop telling my friends about my stock picks after they begin doing well...I tell people about palantir at 11, no one is interested, I tell them at 20 and no one is interested...they call me up when its at 30 & 40 and say ""how much palantir do you have? I'm hopping in""",t3_n5cc1t,15
1620215170.0,2021-05-05,wallstreetbets,gx0kflr,Cathie and I will bag hold pltr together,t3_n5cc1t,14
1620215911.0,2021-05-05,wallstreetbets,gx0lk72,[deleted],t3_n5cc1t,14
1620218527.0,2021-05-05,wallstreetbets,gx0px0a,"And then he turned himself into a pickle.  

Funniest shit I’ve ever seen.",t3_n5cc1t,15
1620220349.0,2021-05-05,wallstreetbets,gx0tc37,Cramer just called Faber a proud boy 😂,t3_n5cc1t,15
1620220362.0,2021-05-05,wallstreetbets,gx0td2u,"Lol, Cramer just called an anchor on CNBS a proud boy",t3_n5cc1t,15
1620220378.0,2021-05-05,wallstreetbets,gx0te5j,Did Cramer just say you're a proud boy to Faber? 😂,t3_n5cc1t,15
1620220403.0,2021-05-05,wallstreetbets,gx0tfy4,Cramer just called the host a proud boy LOL,t3_n5cc1t,16
1620220422.0,2021-05-05,wallstreetbets,gx0th9u,"Jim Cramer: ""You're a Proud Boy in the end.""

Not Jim Cramer: ""Excuse me?""

Jim Cramer: ""Sorry, I didn't mean that.""",t3_n5cc1t,15
1620224824.0,2021-05-05,wallstreetbets,gx12tc1,Raise your hand if you are a businessman doing business,t3_n5cc1t,16
1620227697.0,2021-05-05,wallstreetbets,gx19ht0,"CRSR flying as it should, we deserve this!!",t3_n5cc1t,14
1620236924.0,2021-05-05,wallstreetbets,gx1w1tw,Just YOLOd into RKT. What's the worst that can possibly happen.,t3_n5cc1t,15
1620237825.0,2021-05-05,wallstreetbets,gx1y6ob,Cathie wood says she takes a lot of walks if I knew where and when I’d walk with her and ask her what the fuck is wrong with ark invest,t3_n5cc1t,16
1620241695.0,2021-05-05,wallstreetbets,gx279mj,RIP WSB.,t3_n5cc1t,15
1620244260.0,2021-05-05,wallstreetbets,gx2demk,Alright I’m holding 10 rkt calls through earnings wish me luck,t3_n5cc1t,15
1620244428.0,2021-05-05,wallstreetbets,gx2dt7q,Holding through RKT earnings. Pray for me 😌,t3_n5cc1t,15
1620244768.0,2021-05-05,wallstreetbets,gx2elyi,"RKT through earnings, please pray for my butthole",t3_n5cc1t,16
1620244768.0,2021-05-05,wallstreetbets,gx2elzs,"Fuck it. Holding RKT calls through ER. 

Let’s lose some fucking money",t3_n5cc1t,15
1620244907.0,2021-05-05,wallstreetbets,gx2ey28,"All my calls are dead, push me to the edge",t3_n5cc1t,16
1620245432.0,2021-05-05,wallstreetbets,gx2g6u8,"Holy shit, Im not even in RKT and I still **GUH**ed. Praying for you RKT tards.",t3_n5cc1t,15
1620211369.0,2021-05-05,wallstreetbets,gx0fbun,Oil gang rise up.,t3_n5cc1t,13
1620214137.0,2021-05-05,wallstreetbets,gx0iwyt,So much green pre-market.....so red at opening?,t3_n5cc1t,14
1620218355.0,2021-05-05,wallstreetbets,gx0pm4u,brush your teeth,t3_n5cc1t,14
1620220036.0,2021-05-05,wallstreetbets,gx0sqoi,What is this green stuff on my account?,t3_n5cc1t,14
1620220494.0,2021-05-05,wallstreetbets,gx0tmb4,instead of choosing between moon or crash ive decided to substitute a bong rip,t3_n5cc1t,15
1620221350.0,2021-05-05,wallstreetbets,gx0vc0i,Imagine not buying <insert stock here> when it <cherry-picked factoid that makes it sound like a good buy>,t3_n5cc1t,14
1620221541.0,2021-05-05,wallstreetbets,gx0vpvo,Remember two minutes ago when everything was green pre-market?,t3_n5cc1t,14
1620221684.0,2021-05-05,wallstreetbets,gx0w0k9,RKT is blasting off!,t3_n5cc1t,14
1620222190.0,2021-05-05,wallstreetbets,gx0x247,Rkt to moon eod,t3_n5cc1t,14
1620223027.0,2021-05-05,wallstreetbets,gx0yu5c,Fukin impossible market,t3_n5cc1t,14
1620223582.0,2021-05-05,wallstreetbets,gx101pz,Fuck this market,t3_n5cc1t,15
1620224080.0,2021-05-05,wallstreetbets,gx1159i,Currently I would like death by peloton treadmill,t3_n5cc1t,13
1620224486.0,2021-05-05,wallstreetbets,gx121z3,I don’t want a world where your kid can’t safely sleep under a treadmill what have we become,t3_n5cc1t,14
1620224893.0,2021-05-05,wallstreetbets,gx12yux,I’m going all in on RKT. Gonna be a blowout earnings. Let’s go,t3_n5cc1t,15
1620225999.0,2021-05-05,wallstreetbets,gx15hje,Smells like divorce today for me baby,t3_n5cc1t,14
1620226069.0,2021-05-05,wallstreetbets,gx15ner,y’all plan to hold RKT AH?,t3_n5cc1t,14
1620227411.0,2021-05-05,wallstreetbets,gx18t1z,"RKT earnings are gonna kill it, back to the 40s we go.",t3_n5cc1t,13
1620227718.0,2021-05-05,wallstreetbets,gx19jk7,Markets are down but mods are still gayer than ever.,t3_n5cc1t,13
1620228039.0,2021-05-05,wallstreetbets,gx1aazl,"I was supposed to buy new pair of shoes in January. Market has forced me to live barefooted and on noodles.

Literally cosplaying Gandhi now",t3_n5cc1t,15
1620229117.0,2021-05-05,wallstreetbets,gx1cxkj,that was an impressive green dildo GME... ill give you that,t3_n5cc1t,13
1620232353.0,2021-05-05,wallstreetbets,gx1kw6h,It warms my heart to see something good finally happen for Jessica Alba. She's had a tough life as a model/actress/billionaire.,t3_n5cc1t,13
1620235410.0,2021-05-05,wallstreetbets,gx1sg9d,bruh these tiktok thots are testing me,t3_n5cc1t,14
1620238089.0,2021-05-05,wallstreetbets,gx1ysmz,AMD $110 Revisit my post in 1-2 months,t3_n5cc1t,13
1620239940.0,2021-05-05,wallstreetbets,gx234lc,I'm bagholding AMD for so long that they are asking me to vote for their board of directors. I am a... share owner now? 😮,t3_n5cc1t,14
1620241354.0,2021-05-05,wallstreetbets,gx26giv,Power hour is now cry in the shower hour boys let’s get that water warm,t3_n5cc1t,15
1620241884.0,2021-05-05,wallstreetbets,gx27prr,This markets making me wanna liquidate and go all in shitcoins,t3_n5cc1t,14
1620242471.0,2021-05-05,wallstreetbets,gx2941m,Red days recently: -5% Green days: +0.05%,t3_n5cc1t,14
1620242690.0,2021-05-05,wallstreetbets,gx29ml7,"Start the day: +$8000

End the day: ~~-$1500~~ ~~$-2400~~ $-3000

Nice.",t3_n5cc1t,14
1620242853.0,2021-05-05,wallstreetbets,gx2a0pt,"I did research for 2 weeks to create a tech portfolio consisting of companies that actually have profits and future, my friend bought some shitcoin and is up 450% whereas I am currently down 42%. What even is the point anymore",t3_n5cc1t,14
1620244992.0,2021-05-05,wallstreetbets,gx2f5ao,PLTR defies physics and math. It's down 2% every day but stays at $22 every day.,t3_n5cc1t,13
1620245479.0,2021-05-05,wallstreetbets,gx2gatt,RKT crashes so often you’d think they were launched out of North Korea,t3_n5cc1t,13
1620245587.0,2021-05-05,wallstreetbets,gx2gk48,lmaooooo rip the guy that put his mortgage in,t3_n5cc1t,13
1620210550.0,2021-05-05,wallstreetbets,gx0ednq,"Every morning my portfolio looks like a car wreck. It's flipped on it's roof, smoldering - and I am trying to plan my escape out the front windshield before it explodes.",t3_n5cc1t,39
1620216550.0,2021-05-05,wallstreetbets,gx0mk16,"If y’all didn’t buy the fucking dip yesterday, then you must’ve already been bagholding PLTR and RKT

Source: personal experience 🤡🤡",t3_n5cc1t,41
1620211987.0,2021-05-05,wallstreetbets,gx0g2uv,"Futures are higher this morning, rebounding from the ‘Yellen head-fake’ that caused a bunch of selling yesterday afternoon. Small caps are leading the move higher, with the Russell 2000 up 0.7%. Nasdaq is up 0.6%. S&P and Dow up about 0.3%. Russell and Nasdaq also saw the brunt of the damage yesterday, giving up almost 2% each.

We do get to hear from a couple of FOMC members: Eric Rosengren, Loretta Mester, and Charles Evans. Not sure if they’re taking questions but if so you can bet they’ll be asked about Yellen’s comments. 

My thoughts on Yellen and the Fed: Need to listen to the audio. Not gonna type it.

ADP payrolls are due out at 0815. Economists expecting 800k jobs added in April, quite a bit more than the 517k from March. We also get ISM services data at 10am. These are a couple of key reports where the health of the economy is concerned. As always, you need to watch for the Goldilocks scenario: too hot and it means inflation and Fed tightening. Too cold and the economy is not recovering quickly or strongly enough. Though nowadays, maybe the ‘too cold’ scenario is preferred.

More earnings today as well: Hilton Worldwide just came out with a miss. GM, Allstate, and Etsy report later. After the bell we get Uber, Booking Holdings, and PayPal.",t3_n5cc1t,12
1620212605.0,2021-05-05,wallstreetbets,gx0guxl,sick of the market made a killing in the last 6 months maybe its time to step back for a while,t3_n5cc1t,13
1620214080.0,2021-05-05,wallstreetbets,gx0iu3w,Cant hold SPY down. This is a bull market you gay bears,t3_n5cc1t,13
1620215596.0,2021-05-05,wallstreetbets,gx0l2p9,"my TD acct just sent me a message saying i'm in a ""Margin Call""

am i going to jail??",t3_n5cc1t,14
1620220995.0,2021-05-05,wallstreetbets,gx0um8h,RKT VIAC RKT VIAC ALL DAY EVERYDAY 🚀🚀🚀🚀🚀🚀🚀🚀🚀🚀,t3_n5cc1t,13
1620222215.0,2021-05-05,wallstreetbets,gx0x3y3,RKT moving pretty slow thought it would be a bigger movement,t3_n5cc1t,12
1620222672.0,2021-05-05,wallstreetbets,gx0y2v5,Volume on RKT is insane. Gonna pop,t3_n5cc1t,13
1620222733.0,2021-05-05,wallstreetbets,gx0y7g0,"DIS is just sad. 

Holding everyone hostage since month. Either go up or down Mickey you fucker, but not go sideways...",t3_n5cc1t,12
1620223257.0,2021-05-05,wallstreetbets,gx0zbxu,what the fuck is mvis doing,t3_n5cc1t,14
1620225551.0,2021-05-05,wallstreetbets,gx14gfg,"Me: *Buys calls on the top*
 

Stock market: 🎶🧍🏿‍♂️⚰️🧍🏿‍♂️🎶",t3_n5cc1t,14
