created,date,subreddit,id,body,parent_id,score
1630602270.0,2021-09-02,wallstreetbets,hbc5zvn,How y’all got 50k+ accounts and yolo it on stocks I’ve never even heard of.  It’s wild 😂,t3_pgergo,6
1630602402.0,2021-09-02,wallstreetbets,hbc6bug,"Big Brian CLOV... if every shareholder is a Bagholder, it simply cannot go down",t3_pgergo,8
1630602680.0,2021-09-02,wallstreetbets,hbc70xl,Just bought SOFI calls for tomorrow 15.5 will I need a millionaire or a bankrupt,t3_pgergo,7
1630603207.0,2021-09-02,wallstreetbets,hbc8bvw,When you realize you've sold off most of your profitable blue chips to average down on memes. My memefolio is amazingly diverse and probably very bad.,t3_pgergo,7
1630603266.0,2021-09-02,wallstreetbets,hbc8hav,SoFi calls printing. I don't normally jump on shit like this but I did today because I'd already done a bunch of stupid shit today.,t3_pgergo,7
1630603623.0,2021-09-02,wallstreetbets,hbc9egl,"SPY without stimmy = 300

SPY with stimmy = 400

SPY without stimmy + with stimmy hopes = 500

is this correct?",t3_pgergo,6
1630603946.0,2021-09-02,wallstreetbets,hbca835,"*Chinese Communist Party bans 'sissy men'*

Bearish for Coty and Estee Lauder",t3_pgergo,7
1630604893.0,2021-09-02,wallstreetbets,hbcclan,Die Spy so I can buy cheaper 🔥,t3_pgergo,7
1630604928.0,2021-09-02,wallstreetbets,hbccoe7,These 2 days of SPY dumping intraday is annoying as fuck lol,t3_pgergo,7
1630604953.0,2021-09-02,wallstreetbets,hbccqt5,"Me and SPY was taking dumps at the exact same time and I think that is just beautiful.

Edit: 🌈🐻",t3_pgergo,6
1630605081.0,2021-09-02,wallstreetbets,hbcd2gd,U don’t fight septembear history,t3_pgergo,7
1630605558.0,2021-09-02,wallstreetbets,hbce7s8,SPCE WHAT THE FUCK,t3_pgergo,8
1630606676.0,2021-09-02,wallstreetbets,hbcgz5t,"This was a test, only a test of the index emergency system.",t3_pgergo,7
1630606691.0,2021-09-02,wallstreetbets,hbch0kv,RIP in peace,t3_pgergo,7
1630606781.0,2021-09-02,wallstreetbets,hbch8n3,It's september and we're going into a three day weekend. I expect the selling to continue. Tomorrow going to be a -1% market day I'm calling it,t3_pgergo,7
1630607349.0,2021-09-02,wallstreetbets,hbciobm,Recession back on? 😅,t3_pgergo,7
1630607373.0,2021-09-02,wallstreetbets,hbciqg1,And I would have gotten away with it too if it weren't for them gey bears!,t3_pgergo,8
1630607491.0,2021-09-02,wallstreetbets,hbcj16d,And now to go to work where I’ll make 1/3 of what I lost today lmfao,t3_pgergo,7
1630607500.0,2021-09-02,wallstreetbets,hbcj1yx,I’m so good at DiAMonD HanDIng options when they’re up 100%+ just to lose 80% of the value every single time the next day,t3_pgergo,7
1630607864.0,2021-09-02,wallstreetbets,hbcjz8a,Go NEGATIVE!!!,t3_pgergo,8
1630608533.0,2021-09-02,wallstreetbets,hbcln3u,[deleted],t3_pgergo,7
1630608837.0,2021-09-02,wallstreetbets,hbcmeze,"VIX up stocks up

&#x200B;

Suns out guns out",t3_pgergo,7
1630608981.0,2021-09-02,wallstreetbets,hbcmsok,Step-BABA what are you doing?,t3_pgergo,7
1630609121.0,2021-09-02,wallstreetbets,hbcn5oq,SPY don’t embarrass me before my bear friends,t3_pgergo,7
1630610299.0,2021-09-02,wallstreetbets,hbcq3qg,Apple news solely crushing my SPY puts,t3_pgergo,6
1630610435.0,2021-09-02,wallstreetbets,hbcqg6f,Netflix all of a sudden has a change of heart the instant I buy puts. You ever have those days where you feel like the market gods are waiting for your every move just so they can fuck you?,t3_pgergo,8
1630610507.0,2021-09-02,wallstreetbets,hbcqmmq,"The people on the stock comment section be taking everything so personal, as if you're talking about their momma or something lol.",t3_pgergo,8
1630610569.0,2021-09-02,wallstreetbets,hbcqsbc,Appl is the embodiment of the American dream,t3_pgergo,8
1630610641.0,2021-09-02,wallstreetbets,hbcqyqk,Forgot we have a day off on Monday now Im mad.,t3_pgergo,9
1630611299.0,2021-09-02,wallstreetbets,hbcslym,"Imagine betting against a company that literally has USA in its name on top of rockets 

RKLB 🚀🚀🚀🚀🇺🇸🇺🇸🇺🇸🇺🇸",t3_pgergo,7
1630611471.0,2021-09-02,wallstreetbets,hbct1s9,Anyone holding RKLB overnight?,t3_pgergo,8
1630611613.0,2021-09-02,wallstreetbets,hbctehu,"If AMD doesn't break to $113 tomorrow then it's going back to $104 for a month. The algos are basically turned off today until the damn jobs news comes out, so it's just dead with no volume. Fuck our calls AND puts.",t3_pgergo,7
1630612295.0,2021-09-02,wallstreetbets,hbcv4qp,spy just said fuck you and your puts (until tomorrow),t3_pgergo,7
1630612859.0,2021-09-02,wallstreetbets,hbcwkpq,"HELLUVA CLOSE, SPY!",t3_pgergo,7
1630613038.0,2021-09-02,wallstreetbets,hbcx102,Lol what in the spy,t3_pgergo,5
1630613183.0,2021-09-02,wallstreetbets,hbcxebb,DOCU is trash.  Don't buy it unless you abhor money.,t3_pgergo,8
1630614406.0,2021-09-02,wallstreetbets,hbd0iaz,We need a fucking BABA riot,t3_pgergo,7
1630616596.0,2021-09-02,wallstreetbets,hbd602e,DOCU puts ruined,t3_pgergo,7
1630576978.0,2021-09-02,wallstreetbets,hbaq3ay,Just getting caffeinated and ready for my morning Blackberry surge,t3_pgergo,19
1630586642.0,2021-09-02,wallstreetbets,hbb55vt,"Had a dream that GME hit 12,000,000. By the time I got logged into my app to sell, the company had gone completely bankrupt and the stock was worthless. I woke up devastated.",t3_pgergo,19
1630601020.0,2021-09-02,wallstreetbets,hbc2tac,CLOV is next and everyone knows it!,t3_pgergo,18
1630601756.0,2021-09-02,wallstreetbets,hbc4ow4,CLOV FUCK YEAH,t3_pgergo,19
1630601823.0,2021-09-02,wallstreetbets,hbc4v8v,CLOV about to squeeeezzeeee 🚀🚀🚀,t3_pgergo,18
1630578779.0,2021-09-02,wallstreetbets,hbascbl,SPY closes red end of day or ban,t3_pgergo,27
1630586633.0,2021-09-02,wallstreetbets,hbb5591,SEPTEMBEAR? MORE LIKE SEPTEMBRRRRRRRR,t3_pgergo,28
1630584892.0,2021-09-02,wallstreetbets,hbb1uoh,$BABA to 200 end of week,t3_pgergo,16
1630602061.0,2021-09-02,wallstreetbets,hbc5h4x,CLOV about to 🚀???,t3_pgergo,17
1630609288.0,2021-09-02,wallstreetbets,hbcnkyg,Reddest green day ever,t3_pgergo,17
1630578666.0,2021-09-02,wallstreetbets,hbas71o,Futures are all slightly green. Why is everybody talking about a crash? Did I wander into a bear den?,t3_pgergo,6
1630580262.0,2021-09-02,wallstreetbets,hbaucgp,Joe Kernen on Squawk is such a tool,t3_pgergo,6
1630580289.0,2021-09-02,wallstreetbets,hbaudt0,Nah we don’t like WSB Twitter. It’s more fun being anonymous,t3_pgergo,7
1630583046.0,2021-09-02,wallstreetbets,hbayn1r,The other place I was looking to move to completely flooded last night. Glad I moved to the one on the hill,t3_pgergo,5
1630584830.0,2021-09-02,wallstreetbets,hbb1qn7,Is (stock that's never talked about on reddit) the next reddit stock? Find out in this clickbait ad now!,t3_pgergo,6
1630585048.0,2021-09-02,wallstreetbets,hbb2511,"Worked out, now Bon Iver and coffee on the fire escape, then Metallica and get ready for work and trading. Holding $QS $JPM $SNOW $URI weeklies. 

&#x200B;

Let's lose some fuckin money!",t3_pgergo,6
1630586121.0,2021-09-02,wallstreetbets,hbb45v9,Almost bought AAPL before close yesterday but I was convinced today was gonna be red,t3_pgergo,6
1630586160.0,2021-09-02,wallstreetbets,hbb48i3,Green hulk dildos on spy,t3_pgergo,6
1630586289.0,2021-09-02,wallstreetbets,hbb4hh8,Every TSLA article for the last couple days has been negative. Assume +3% today?,t3_pgergo,5
1630587672.0,2021-09-02,wallstreetbets,hbb77if,BB moon when,t3_pgergo,6
1630588173.0,2021-09-02,wallstreetbets,hbb88t3,"If everyone is calling for a correction, usually it either happens, or it doesn't",t3_pgergo,6
1630588255.0,2021-09-02,wallstreetbets,hbb8ezt,"haha wow, AMZN puts overnight were not the play. This market is unstoppable.",t3_pgergo,6
1630588519.0,2021-09-02,wallstreetbets,hbb8z8v,Baba guy was so close yet so far. Rip,t3_pgergo,6
1630588917.0,2021-09-02,wallstreetbets,hbb9tn8,I’m gonna throw up,t3_pgergo,6
1630588999.0,2021-09-02,wallstreetbets,hbba02k,"Is today the day we enter the memeverse again? SDC is my dark horse, but liking BB A LOT. Oh, and long PLTR because it is on the slow climb to new highs now.",t3_pgergo,5
1630589076.0,2021-09-02,wallstreetbets,hbba657,BABA. Buy calls daily,t3_pgergo,6
1630589593.0,2021-09-02,wallstreetbets,hbbbbg9,BABA is bound to moon today,t3_pgergo,5
1630589878.0,2021-09-02,wallstreetbets,hbbbypv,I hate you AMD. Wtf is wrong with you,t3_pgergo,6
1630583631.0,2021-09-02,wallstreetbets,hbazmo2,"The more things stay the same, the more things stay the same.",t1_hbaz9ir,27
1630587652.0,2021-09-02,wallstreetbets,hbb761t,This is the new more mature taliban tho. 20 years is a long time they are probably all chill and shit now.,t1_hbaz9ir,11
1630585304.0,2021-09-02,wallstreetbets,hbb2m8v,Still could go a few days without seeing 100 sQUEzee posts.,t1_hbb2ifv,46
1630586233.0,2021-09-02,wallstreetbets,hbb4dkm,"Yeah, don't get too excited.  One day earlier this week when GME jumped, the entire Daily thread was flooded with apes.  So they sit quietly in the background and pounce.  The rest are usually bots and they are still around.",t1_hbb2ifv,8
1630586246.0,2021-09-02,wallstreetbets,hbb4eh1,Why do bears exist again?,t1_hbb3wux,24
1630586367.0,2021-09-02,wallstreetbets,hbb4mtj,Can you remind everyone again of your journey,t1_hbb4g3h,5
1630587420.0,2021-09-02,wallstreetbets,hbb6pdt,"I swear, market opening at 9:30 is the only thing that gets me to work before then.",t1_hbb6h01,8
1630583452.0,2021-09-02,wallstreetbets,hbazbmo,"Yes, and then Pelosi makes bank trading options in our face!",t1_hbaugo0,27
1630583807.0,2021-09-02,wallstreetbets,hbazxkm,She really is the biggest dip shit in finance,t1_hbaxcjx,8
1630583958.0,2021-09-02,wallstreetbets,hbb0722,"IMO, I want people to keep on buying puts so market climbs the wall of worries. Once put buyers are exhausted then market will collapse.",t1_hbazs7k,6
1630584901.0,2021-09-02,wallstreetbets,hbb1vcx,D. This sub,t1_hbb1efy,5
1630586067.0,2021-09-02,wallstreetbets,hbb424d,Same,t1_hbb3yxx,7
1630601586.0,2021-09-02,wallstreetbets,hbc49gc,"$9 has been hard for us to hold. Hopefully today we can.

CLOV!",t1_hbc43ex,12
1630583429.0,2021-09-02,wallstreetbets,hbaza8p,Like a true gambling addict.  Good job.,t1_hbaz0mq,7
1630582622.0,2021-09-02,wallstreetbets,hbaxxd6,"NEW AND IMPROVED

NOW WATERCOOLED!!!!

NO MORE THERMAL THROTTLING TRADE TERMINALS!",t1_hbax65a,26
1630607159.0,2021-09-02,wallstreetbets,hbci6t9,Welcome to the Thunderdome.,t1_hbci005,6
1630586454.0,2021-09-02,wallstreetbets,hbb4ssp,"All former jobs will be done by robots, programmed and built by other robots.",t1_hbb4187,15
1630589229.0,2021-09-02,wallstreetbets,hbbai98,Hopefully it’s not going off because of carbon monoxide,t1_hbba7ja,5
1630588331.0,2021-09-02,wallstreetbets,hbb8ksa,I’d coom so hard,t1_hbb8emv,7
1630598220.0,2021-09-02,wallstreetbets,hbbvpc8,"Meteor hits earth, half population dead, SPY 1,000",t1_hbbvfhj,11
1630580290.0,2021-09-02,wallstreetbets,hbaudtw,"Of-fukin-couse,as per usual",t1_hbaubn0,7
1630580317.0,2021-09-02,wallstreetbets,hbauf87,The ultimate buy signal. Time for BABA 200C,t1_hbaubn0,28
1630610603.0,2021-09-02,wallstreetbets,hbcqvd0,Yeah the one with a cardboard box full of cum,t1_hbcqomr,8
1630610421.0,2021-09-02,wallstreetbets,hbcqeut,The truth no one wants to hear.,t1_hbcq823,8
1630613993.0,2021-09-02,wallstreetbets,hbczg4t,"got it, calls",t1_hbcz431,10
1630614001.0,2021-09-02,wallstreetbets,hbczgxg,I feel abandoned. I thought we were a team,t1_hbcz431,8
1630601688.0,2021-09-02,wallstreetbets,hbc4ioc,"Yes, everyone, pile on now and MAKE ME MONEY.",t1_hbc4c2o,8
1630614502.0,2021-09-02,wallstreetbets,hbd0r2q,DOCU gonna drill tomorrow.,t1_hbd0bx5,6
1630586620.0,2021-09-02,wallstreetbets,hbb5497,"Dump the bags, reinvest, you’ll feel better and may start making money",t1_hbb4z8l,7
1630588700.0,2021-09-02,wallstreetbets,hbb9ctf,"If its from Subway, I'm sure it is pristine",t1_hbb93za,6
1630580034.0,2021-09-02,wallstreetbets,hbau1a9,He looks the same now like he did back then,t1_hbatq5i,7
1630584072.0,2021-09-02,wallstreetbets,hbb0eg1,My boss’ boss announced yesterday he’s leaving. That’s the 4th departure from my office in the last year…I think it’s time for me to go,t1_hbb09cn,7
1630579950.0,2021-09-02,wallstreetbets,hbatx6f,You need multi-millions these days,t1_hbat9dd,21
1630580147.0,2021-09-02,wallstreetbets,hbau6wo,"And then you’re going to want 5m, you will keep gambling until you lose it all.",t1_hbat9dd,6
1630578175.0,2021-09-02,wallstreetbets,hbarkto,Personally I prefer the loss posts where someone sells at the bottom right before a big move.,t1_hbaqi82,12
1630583652.0,2021-09-02,wallstreetbets,hbaznys,"Make it 3, no crust, cut diagonally 

Thanks ❤",t1_hbazd7m,7
1630583631.0,2021-09-02,wallstreetbets,hbazmns,Sounds like New Yorkers to me,t1_hbazkfa,11
1630585928.0,2021-09-02,wallstreetbets,hbb3sk2,Its bullish since they'll push out tapering,t1_hbb3ogp,6
1630587374.0,2021-09-02,wallstreetbets,hbb6m1u,BULLISH ON OFF,t1_hbb6i9c,6
1630588593.0,2021-09-02,wallstreetbets,hbb94rz,Rip spy 200 puts,t1_hbb8tmg,6
1630591403.0,2021-09-02,wallstreetbets,hbbffkz,[deleted],t1_hbbf6fa,6
1630601116.0,2021-09-02,wallstreetbets,hbc3297,$30 easily if the volume comes. Gather the apes!,t1_hbc2yie,11
1630610577.0,2021-09-02,wallstreetbets,hbcqsyw,Hedge funds are working overtime to pump Apple with all these rumors,t1_hbcqo6y,5
1630599184.0,2021-09-02,wallstreetbets,hbby4o4,that's honestly wild bro,t1_hbby1gc,6
1630577648.0,2021-09-02,wallstreetbets,hbaqx0k,All the DD I needed. ALL in BB!,t1_hbaq3ay,9
1630587062.0,2021-09-02,wallstreetbets,hbb5zim,"Be sure and set a limit order to sell at 11,999,999 just to be safe.",t1_hbb55vt,8
1630578938.0,2021-09-02,wallstreetbets,hbasjum,MODS,t1_hbascbl,11
1630587861.0,2021-09-02,wallstreetbets,hbb7l6q,Opium does that for you.,t1_hbb761t,9
1630585642.0,2021-09-02,wallstreetbets,hbb39ak,At least the number of posts about LaDdEr AtTaCkS has come down,t1_hbb2m8v,21
1630587095.0,2021-09-02,wallstreetbets,hbb61uu,To get fuk,t1_hbb4eh1,9
1630580433.0,2021-09-02,wallstreetbets,hbaul2s,"She buys, you sell and vice versa",t1_hbauf87,12
1630584173.0,2021-09-02,wallstreetbets,hbb0koc,"start interviewing baby, you never know what kind of raise you can get",t1_hbb0eg1,6
