created,date,subreddit,id,body,parent_id,score
1621859223.0,2021-05-24,wallstreetbets,gz9kmf7,You have a 100% chance of losing money by following a post that ends with “thank me later”,t3_njubrl,105
1621855294.0,2021-05-24,wallstreetbets,gz9f7it,Boomers running the world but can’t figure out QR codes to read a menu.,t3_njubrl,77
1621862407.0,2021-05-24,wallstreetbets,gz9pxwh,Am i the only one that sees SPCE and always reads it as spice instead of space?  Starting to think my mom drank when she was pregnant,t3_njubrl,76
1621860461.0,2021-05-24,wallstreetbets,gz9mk1u,"Sell the rumor. 
Fuck the news.",t3_njubrl,66
1621869199.0,2021-05-24,wallstreetbets,gza3viy,GME 🚀🚀🚀,t3_njubrl,63
1621852640.0,2021-05-24,wallstreetbets,gz9c3bk,Congrats spce holders,t3_njubrl,67
1621853349.0,2021-05-24,wallstreetbets,gz9cvwx,Weekends are the worst because I have 2 days to reflect on all garbage plays i made on Friday and think about how much money I'll have lost by Monday open.,t3_njubrl,50
1621856411.0,2021-05-24,wallstreetbets,gz9gn73,CNBC Headline: Goldman Sachs confirmed COIN bag holder. Prays this headline will boost stock price 30%,t3_njubrl,46
1621860187.0,2021-05-24,wallstreetbets,gz9m3we,Remember to keep a balanced portfolio. 70% GUH and 30% OOF has worked wonders for me.,t3_njubrl,49
1621855519.0,2021-05-24,wallstreetbets,gz9fhl1,its not weird to still be drinking at 7:30 on a monday morning right,t3_njubrl,42
1621859921.0,2021-05-24,wallstreetbets,gz9loqp,"A decent number of posters here could learn a thing or two from poker. Sometimes you have pocket aces and the hand goes against you. Sometimes you get a two-seven unsuited on a blind, and the flop is three sevens. That doesn’t mean you should call every shit hand just in case.",t3_njubrl,40
1621862473.0,2021-05-24,wallstreetbets,gz9q2ck,Bro this stock market shit is supposed to make me rich wtf,t3_njubrl,42
1621860002.0,2021-05-24,wallstreetbets,gz9ltb9,Shopping lambos in pre-market only to get margin called at market open. Such is the life of a degenerate gambler,t3_njubrl,37
1621860470.0,2021-05-24,wallstreetbets,gz9mkig,I miss when I used to trust green premarkets,t3_njubrl,37
1621858571.0,2021-05-24,wallstreetbets,gz9jnbn,"It’s seriously so inspiring to see SPCE doing good this morning. I met Sir Richard Branson when I was a young boy and he inspired me to pursue acting. Now I make minimum wage and live in a 200 sqr foot apartment in New York, follow your dreams.",t3_njubrl,105
1621857602.0,2021-05-24,wallstreetbets,gz9i9g1,Good luck to everyone today! Sending good vibes!,t3_njubrl,32
1621862621.0,2021-05-24,wallstreetbets,gz9qc1x,[deleted],t3_njubrl,32
1621862266.0,2021-05-24,wallstreetbets,gz9ponu,Stop scaring me away from SPCE and let me burn my money in peace,t3_njubrl,25
1621863892.0,2021-05-24,wallstreetbets,gz9srol,"Why would you 🤡s buy something that was already +20% at open?

Trying to create generational tax losses?",t3_njubrl,28
1621866585.0,2021-05-24,wallstreetbets,gz9ya5c,"Can't believe we have 10.2 million degenerates and the daily thread has less comments than when we were at 700k two years ago

Did literally everyone get wiped out?",t3_njubrl,27
1621852616.0,2021-05-24,wallstreetbets,gz9c2b6,ARKX’s remaining 45 SPCE shares are printing. Lol,t3_njubrl,23
1621855888.0,2021-05-24,wallstreetbets,gz9fyk1,SPCE 🚀🚀🚀🚀🚀🚀🚀🚀,t3_njubrl,23
1621862540.0,2021-05-24,wallstreetbets,gz9q6s1,Time to lose a ton of money in the first 15min of trading and then spend the rest of the week trying to get it back,t3_njubrl,23
1621859164.0,2021-05-24,wallstreetbets,gz9kj6g,[deleted],t3_njubrl,23
1621859802.0,2021-05-24,wallstreetbets,gz9lhzv,Gonna be a whole lot of long term investors on SPCE,t3_njubrl,23
1621861976.0,2021-05-24,wallstreetbets,gz9p5r5,I've got trust issues with premarkets,t3_njubrl,24
1621852721.0,2021-05-24,wallstreetbets,gz9c6l3,"Futures are pointing higher this morning. Tech stocks are leading the way, with the Nasdaq up 0.7%. S&P 500 is 0.5% higher. Dow up 0.4%. That’s as of 0630.

There’s nothing new here. Investors buying the dip because it’s the best use of their cash in a zero interest rate environment.

Not much in data releases today.  We do have the Chicago Fed National Activity Index, seen as a gauge of economic activity and inflationary pressure, at 0830, but that’s relatively minor and no consensus estimates. Couple of Fed speeches as well.",t3_njubrl,70
1621855898.0,2021-05-24,wallstreetbets,gz9fz2d,Does anyone remember Bill Ackmans SPAC? I've been bagholding that shit since back in the day. Some idiot told me it was gonna be Stripe so I bought it... hmm maybe im the idiot,t3_njubrl,22
1621862255.0,2021-05-24,wallstreetbets,gz9pnzd,"I don't know who needs to hear this but, if you're chasing a stock up 20% pre market you're gonna have a bad time. Best of luck tho retard",t3_njubrl,22
1621876044.0,2021-05-24,wallstreetbets,gzajivc,TSLA about to slay some gay bears for old times sake.,t3_njubrl,22
1621859889.0,2021-05-24,wallstreetbets,gz9lmxp,PLTR my boy what are you doing 👀,t3_njubrl,22
1621879187.0,2021-05-24,wallstreetbets,gzaqoq4,"\*retards after buying robinhood IPO\* ""omg robinhood is shorting their own stock to screw us!""",t3_njubrl,22
1621864552.0,2021-05-24,wallstreetbets,gz9u3h1,Gme always impresses/confuses me,t3_njubrl,20
1621872057.0,2021-05-24,wallstreetbets,gzaa1ti,Normalise PLTR trading above 30,t3_njubrl,21
1621885523.0,2021-05-24,wallstreetbets,gzb5chx,"Friday:  Buy SPCE puts because test flight will fail.

Saturday:  Flight doesn't fail.

Monday morning: Up 20%.  Double down with more puts.  This can't last.

Monday afternoon:  Up 30%.  GUH.",t3_njubrl,19
1621864136.0,2021-05-24,wallstreetbets,gz9t8wg,"My boss had an extra long morning meeting (8 am smh). So I missed market open to listen to his motivational speech while half awake. Something about picking up a rock? I don’t remember 

I crave the sweet release of death to escape corporate America",t3_njubrl,20
1621872799.0,2021-05-24,wallstreetbets,gzabr0e,GME is my safe haven asset,t3_njubrl,19
1621873908.0,2021-05-24,wallstreetbets,gzae9li,Turned my last $450 to $2100. Lets go,t3_njubrl,19
1621859255.0,2021-05-24,wallstreetbets,gz9ko3v,"Imagine coming here for legit suggestions on plays. I mean, fool me 19 times shame on you, fool me 30 or more times shame on me.",t3_njubrl,19
1621860105.0,2021-05-24,wallstreetbets,gz9lz3v,It's 👏 all 👏 priced 👏 in,t3_njubrl,18
1621861418.0,2021-05-24,wallstreetbets,gz9o6f2,Guys I’ve been unbanned! Love you,t3_njubrl,16
1621868465.0,2021-05-24,wallstreetbets,gza29io,GME doing that thing again,t3_njubrl,18
1621882219.0,2021-05-24,wallstreetbets,gzaxogt,Day 1 of being approved for options:   -35%,t3_njubrl,18
1621858671.0,2021-05-24,wallstreetbets,gz9jskk,"You tards buying RBLX puts clearly dont have kids. 

School is out for summer in a week. You think all them lazy ass kids are going outside?!",t3_njubrl,54
1621860897.0,2021-05-24,wallstreetbets,gz9nabc,Holy shit did I make a mistake buying puts on SPY Friday oof,t3_njubrl,17
1621863695.0,2021-05-24,wallstreetbets,gz9sdi9,RKT bags are heavy AF. What a waste of a stock.,t3_njubrl,16
1621864350.0,2021-05-24,wallstreetbets,gz9tooq,\*looks at AMC\*  \*scratches head\*  \*spits\*,t3_njubrl,16
1621868867.0,2021-05-24,wallstreetbets,gza35d6,"Up 150% on this GME 185c I got on Friday

And call premiums on GME still the cheapest they've been in 4 months",t3_njubrl,16
1621870037.0,2021-05-24,wallstreetbets,gza5pkn,FOMO about to kick in for the meme stonks,t3_njubrl,17
1621871297.0,2021-05-24,wallstreetbets,gza8eem,"WSB: OMG NIO is going crazy!!!!!!!! 

Me: *Checks* it’s up $1....",t3_njubrl,17
1621871616.0,2021-05-24,wallstreetbets,gza93c4,GME looking sexy as a mufucka,t3_njubrl,17
1621881711.0,2021-05-24,wallstreetbets,gzawijy,Michael Burry? More like Michael Burry deez nuts in yo mouth ha gottem,t3_njubrl,16
1621883691.0,2021-05-24,wallstreetbets,gzb12dx,Good job Cathie dumping your SPCE back at $16-$18 😂😂,t3_njubrl,18
1621860296.0,2021-05-24,wallstreetbets,gz9mady,"Dear TD, Please take immediate action to meet ur lips to my sphincter.",t3_njubrl,16
1621863153.0,2021-05-24,wallstreetbets,gz9rbwm,lmaooooo some of u retards bought spce at 28+ pre market 🤡,t3_njubrl,17
1621866437.0,2021-05-24,wallstreetbets,gz9xyzd,"Sell in May bers r gay

Buy in June be billionaire soon",t3_njubrl,16
1621868912.0,2021-05-24,wallstreetbets,gza38tu,Everything is green except the shit I'm holding and I can't choose what to load up on,t3_njubrl,16
1621884715.0,2021-05-24,wallstreetbets,gzb3jha,"Love people in here saying “I TOLD YOU TO BUY xyz” like bitch there’s a billion retards in here all screeching about some bullshit, you ain’t special.",t3_njubrl,15
1621859452.0,2021-05-24,wallstreetbets,gz9kylj,Gonna tell myself not to make any moves until after 10:30 but will fomo into something by 9:45 like a genius.,t3_njubrl,47
1621858505.0,2021-05-24,wallstreetbets,gz9jjsz,Ayeeeee is this the comeback for my -85% portfolio?,t3_njubrl,15
1621863870.0,2021-05-24,wallstreetbets,gz9sq59,Really is remarkable that the major indexes are green yet all my positions are red.  I've got a super power for picking garabage,t3_njubrl,15
1621869007.0,2021-05-24,wallstreetbets,gza3ge8,[deleted],t3_njubrl,15
1621869321.0,2021-05-24,wallstreetbets,gza45cq,LOL what the hell is happening today?,t3_njubrl,15
1621850490.0,2021-05-24,wallstreetbets,gz99ot8,"Loss in portfolio ❌

Reverse gain in portfolio ✅

Increasing retirement age by 10 years ❌

Decreasing retirement age by -10 years✅",t3_njubrl,49
1621856567.0,2021-05-24,wallstreetbets,gz9gukx,"Circuit breaker today. 

When PG&E turns off my power for failure to pay.",t3_njubrl,14
1621858093.0,2021-05-24,wallstreetbets,gz9iyfy,PLTR expands deal w/ Space Force. LFG !! 🚀,t3_njubrl,13
1621861035.0,2021-05-24,wallstreetbets,gz9nism,Excited for all my stocks to announce they crushed earnings and still drop 6%,t3_njubrl,15
1621864751.0,2021-05-24,wallstreetbets,gz9ui63,"The population has been culled even more. Only 57,000 live users left",t3_njubrl,14
1621866464.0,2021-05-24,wallstreetbets,gz9y13l,"Holy shit boys, I'm about to go green for the first time since I started this in February!!! This is exciting!",t3_njubrl,15
1621866979.0,2021-05-24,wallstreetbets,gz9z3f2,SPY 420 fuck you bears,t3_njubrl,13
1621868528.0,2021-05-24,wallstreetbets,gza2em0,GME tendies,t3_njubrl,14
1621870348.0,2021-05-24,wallstreetbets,gza6d8w,"I shit you not, just walked in on my kid eating crayons.",t3_njubrl,14
1621873839.0,2021-05-24,wallstreetbets,gzae41p,“You’re telling me there’s going to be four times as many shares now??? That’s so bullish!”,t3_njubrl,14
1621874464.0,2021-05-24,wallstreetbets,gzafjee,"Imagine making your first $200 in the stock market, post it and then say that you won’t reinvest that profit back into the market, but instead, will buy new toys for your cat and go on a road trip with the cat. 

https://www.reddit.com/r/stocks/comments/nk1757/i_made_my_first_200_dollars_on_the_stock_market/",t3_njubrl,13
1621883630.0,2021-05-24,wallstreetbets,gzb0xfd,SPCE Launches a literal rocket into space and it's taking my portfolio with it as well.,t3_njubrl,14
1621883707.0,2021-05-24,wallstreetbets,gzb13r2,So is SPCE gonna keep going up tomorrow?,t3_njubrl,13
1621851641.0,2021-05-24,wallstreetbets,gz9aybj,[deleted],t3_njubrl,41
1621855891.0,2021-05-24,wallstreetbets,gz9fyq7,Daily reminder that today is the rug pull,t3_njubrl,38
1621861581.0,2021-05-24,wallstreetbets,gz9ogto,Can we have a proper green day plz? No mega lame fades in stepwise fashion down to opening price or below.,t3_njubrl,14
1621862358.0,2021-05-24,wallstreetbets,gz9pup0,Sitting on the toilet at market open in case I shit myself,t3_njubrl,13
1621862488.0,2021-05-24,wallstreetbets,gz9q3bh,"Thought you all would like to know, my account that was up thousands in January, up currently up $102.   Thinking of selling all and putting everything in Apple and deleting my apps for 5 years.  I’m clearly not a good active manager 🤡",t3_njubrl,13
1621862490.0,2021-05-24,wallstreetbets,gz9q3g8,So who’s gunna paper hand SPCE,t3_njubrl,13
1621862572.0,2021-05-24,wallstreetbets,gz9q8ta,Open the damn casino. I need my fix,t3_njubrl,14
1621872812.0,2021-05-24,wallstreetbets,gzabs41,"Just took a mind numbingly relieving piss and there was no blood in it. We're green all week, lads.",t3_njubrl,13
1621874711.0,2021-05-24,wallstreetbets,gzag3kw,SPY puts are so obvious right now. Gonna scoop some up to make SPY moon and singlehandedly save the market.,t3_njubrl,12
1621876220.0,2021-05-24,wallstreetbets,gzajxdo,TSLA $650 EOD🚀🚀🚀,t3_njubrl,14
1621883478.0,2021-05-24,wallstreetbets,gzb0l50,Wow GME dumps around $185 again just like it did last week? Color me surprised 😳,t3_njubrl,14
1621886185.0,2021-05-24,wallstreetbets,gzb6tpo,This market is exactly why you don’t buy puts even on shitty companies because in a bull rally everything goes up,t3_njubrl,13
1621886720.0,2021-05-24,wallstreetbets,gzb80gn,"Oh Elon, either he fucks his coin retards, or he fucks his TSLA retards. Either way, anyone who is invested in Elon gets fucked daily",t3_njubrl,13
1621850806.0,2021-05-24,wallstreetbets,gz9a198,"I was really expecting this to be red at open, shows how much of an idea I have.. even corn is coming back",t3_njubrl,11
1621852626.0,2021-05-24,wallstreetbets,gz9c2pn,Well my spy down but spce to the moon 🚀🚀,t3_njubrl,13
1621854513.0,2021-05-24,wallstreetbets,gz9e91s,Hopefully CLF is done getting pummeled.,t3_njubrl,11
1621855801.0,2021-05-24,wallstreetbets,gz9fufs,3/4 of you should schedule a vasectomy,t3_njubrl,11
1621861843.0,2021-05-24,wallstreetbets,gz9oxdg,I feel like anything I buy today will be the top,t3_njubrl,13
1621861867.0,2021-05-24,wallstreetbets,gz9oywx,Sick of CNBC talking about the crypt so much,t3_njubrl,12
1621864370.0,2021-05-24,wallstreetbets,gz9tq46,PLTR about to break $21.25 resistance! I hope they don’t release any good news.,t3_njubrl,10
1621865127.0,2021-05-24,wallstreetbets,gz9v9rg,If you love a stock soooo much but you think the only way it can go up is a “ShOrT sQuEeZe” then I really don’t know what to tell you.,t3_njubrl,13
1621866434.0,2021-05-24,wallstreetbets,gz9xyrn,"Stocks too expensive - we sell off.

Stocks now cheap - we rage green *(you are here)*

Stocks too expensive - we sell off

Repeat until spy 1000",t3_njubrl,12
1621866704.0,2021-05-24,wallstreetbets,gz9yj3h,"roblox puts is the play, just hit an all time high with zero news and no catalysts 

At 88 fucking dollars now, puts are the play",t3_njubrl,12
1621870065.0,2021-05-24,wallstreetbets,gza5rps,I have a combination of calls and puts and I’m red on all. Fucking hell,t3_njubrl,13
1621871534.0,2021-05-24,wallstreetbets,gza8x1y,Nio rise back to 60 you beautiful bitch,t3_njubrl,12
1621871922.0,2021-05-24,wallstreetbets,gza9r5d,"Roblox has revenue of $900 million and market cap of $50 billion. CLOWN WORLD",t3_njubrl,12
1621873815.0,2021-05-24,wallstreetbets,gzae251,I feel like I’ve been losing $2000 every day this month,t3_njubrl,12
1621874760.0,2021-05-24,wallstreetbets,gzag7kk,Don’t be that sucker buying calls at today price,t3_njubrl,12
1621874859.0,2021-05-24,wallstreetbets,gzagfp9,[deleted],t3_njubrl,13
1621875027.0,2021-05-24,wallstreetbets,gzagtnt,Theta gang stealing all my moneys,t3_njubrl,12
1621876133.0,2021-05-24,wallstreetbets,gzajq0u,"starting to feel bad for RKT gang

sorta",t3_njubrl,12
1621876350.0,2021-05-24,wallstreetbets,gzak88v,"I'm not a bear or a bull, I'm whatever loses me money and makes theta gang money",t3_njubrl,13
1621876430.0,2021-05-24,wallstreetbets,gzakeft,It feels so refreshing after options expire...so much less red and $0's on the screen. It almost feels like I haven't lost tens of thousands of dollars!,t3_njubrl,12
1621880353.0,2021-05-24,wallstreetbets,gzatbx7,Holy shit I’m up 9800 on Tesla today WOOO I MAYBE able to financially recover,t3_njubrl,13
1621881309.0,2021-05-24,wallstreetbets,gzavl3m,SPCE bullish AF 🤌🏻,t3_njubrl,11
1621881387.0,2021-05-24,wallstreetbets,gzavrlh,congrats space tards.  I really regret not yoloing in with you.,t3_njubrl,11
1621883307.0,2021-05-24,wallstreetbets,gzb079s,"GME: ""aight i'ma fuckin die now""",t3_njubrl,12
1621883803.0,2021-05-24,wallstreetbets,gzb1bju,Where does AMC keep finding this retard strength at,t3_njubrl,11
1621884675.0,2021-05-24,wallstreetbets,gzb3g7g,[deleted],t3_njubrl,11
1621884961.0,2021-05-24,wallstreetbets,gzb435a,How do I tell my girl her clam smells like sewage water,t3_njubrl,12
1621869817.0,2021-05-24,wallstreetbets,gza58hh,AMC bulls continuing to make me look like a fool,t3_njubrl,36
1621852659.0,2021-05-24,wallstreetbets,gz9c424,Wuh woh bears looks like you are FUCKED,t3_njubrl,12
1621853231.0,2021-05-24,wallstreetbets,gz9cr84,Spce!!,t3_njubrl,12
1621854219.0,2021-05-24,wallstreetbets,gz9dw8c,"SPCE, The Final Frontier 🚀🚀",t3_njubrl,12
1621856941.0,2021-05-24,wallstreetbets,gz9hcll,I smell ban,t3_njubrl,11
1621861218.0,2021-05-24,wallstreetbets,gz9nu2n,Seems like everyone has forgotten what green premarkets have meant this past 3 months,t3_njubrl,11
1621862253.0,2021-05-24,wallstreetbets,gz9pnti,Damn I hope you guys make money on SPCE this time and don’t have another “pls fly again” moment,t3_njubrl,9
1621863766.0,2021-05-24,wallstreetbets,gz9silc,Holy shit I actually sold my TSLA puts at the bottom for hella. 12 min in and my day is done !,t3_njubrl,11
1621864433.0,2021-05-24,wallstreetbets,gz9tuu1,My rblx puts r fuk.  You’re welcome 🤡,t3_njubrl,10
1621865730.0,2021-05-24,wallstreetbets,gz9wi52,Everything green except for my portfolio,t3_njubrl,10
1621867854.0,2021-05-24,wallstreetbets,gza0xoy,Made $280 today should I quit while I’m ahead,t3_njubrl,10
1621868218.0,2021-05-24,wallstreetbets,gza1q2v,This game sucks,t3_njubrl,11
1621868724.0,2021-05-24,wallstreetbets,gza2tye,Spy puts rn,t3_njubrl,12
1621868765.0,2021-05-24,wallstreetbets,gza2x8c,Lol the two main meme stonks are just mooning rn,t3_njubrl,11
1621869548.0,2021-05-24,wallstreetbets,gza4n2x,"This is my 7th shit for the morning, it's safe to say I have diareah",t3_njubrl,11
1621869668.0,2021-05-24,wallstreetbets,gza4wos,RBLX just fuckin defies logic apparently,t3_njubrl,12
1621870990.0,2021-05-24,wallstreetbets,gza7qug,Spce profit taking is over,t3_njubrl,12
1621871449.0,2021-05-24,wallstreetbets,gza8qbm,Someone posted a 360k spy put yolo can we check on him please,t3_njubrl,11
1621872299.0,2021-05-24,wallstreetbets,gzaal66,I bought one fcking put and rblx goes up 17% in 2 days for no reason can't make this shit up,t3_njubrl,12
1621874712.0,2021-05-24,wallstreetbets,gzag3mf,"Imagine being at all time lows in 2021.

That’s you, $RKTards. What a fucking piece of shit stonk.",t3_njubrl,10
1621876321.0,2021-05-24,wallstreetbets,gzak5v3,"The year is 3021, the world has been significantly transformed due to war, famine, climate change and pestilence. What was once a relative paradise is now a dystopian hellscape with only a fraction of humans remaining. 

Those that have survived, successfully melded their bodies and minds with cybernetic systems augmented to make humans more machine than man. Due to the lack of reliable energy sources and infrastructure much of the transportation vehicles of the past millennia have been rendered useless.

MVIS bag holders still optimistic that an acquisition will occur at a valuation of $20 billion.",t3_njubrl,11
1621877502.0,2021-05-24,wallstreetbets,gzamvcm,haha spy going up just to fuk everyone’s puts,t3_njubrl,10
1621878181.0,2021-05-24,wallstreetbets,gzaoeiy,I will be expecting loss porn from the guy who bought $365k of SPY puts today.,t3_njubrl,11
1621881224.0,2021-05-24,wallstreetbets,gzave2b,"everyone on this board euphoric, rug pull imminent.",t3_njubrl,10
1621881921.0,2021-05-24,wallstreetbets,gzawzqx,"The funny thing about TSLA is that it could either end up 520 or 720 EOW, and either way there would be a mob of people screaming “SEE I TOLD YOU SO” 😂",t3_njubrl,10
1621883475.0,2021-05-24,wallstreetbets,gzb0kul,FUCK YOUR PUTS. LONG AMERICAN COMPANIES 🇺🇸 $PLTR $AAPL $TSLA $NVDA $AMZN $MSFT $FB,t3_njubrl,11
1621883493.0,2021-05-24,wallstreetbets,gzb0md4,"GME: I get knocked down, but I get up again...",t3_njubrl,11
1621883707.0,2021-05-24,wallstreetbets,gzb13rz,FUCK YOU SPCE BEARS,t3_njubrl,11
1621884861.0,2021-05-24,wallstreetbets,gzb3v3f,Anyone holding SPCE overnight?,t3_njubrl,11
1621885518.0,2021-05-24,wallstreetbets,gzb5c3y,"Lol the next two SPCE test flights are to test the passenger cabin, and to fly Branson around. Since the ship can fly without exploding, I can't imagine that the passenger cabin is going to leak air or anything like that. But they are going to be huge publicity stunts. First tourists in space and the boss/celebrity himself in space. After that, they can go back to selling tickets/collecting 0% interest loans.",t3_njubrl,10
1621885601.0,2021-05-24,wallstreetbets,gzb5iwi,"“Almost exactly 11 years ago, a hungry programmer traded 10K corn coins for two Papa John's pizzas. Even with corn coin recent plunge, those would've been worth $350M+ today. We hope he got extra cheese.”

#FUCK 💀",t3_njubrl,11
1621885798.0,2021-05-24,wallstreetbets,gzb5yvu,"Dumbass SPCE shorts.  You can bend over, bigdaddy Dick Chadson will use lube if you cooperate.",t3_njubrl,10
1621851618.0,2021-05-24,wallstreetbets,gz9axdd,"Observing and chilling with SPCE. My plan is hodl but we'll see how far this racket will fly today.

After so much red on other position in last 3 months it'll be beautiful to enjoy some green again",t3_njubrl,9
1621857311.0,2021-05-24,wallstreetbets,gz9huzx,"who feels like their butthole has been stuffed enough, thanks?",t3_njubrl,9
1621857587.0,2021-05-24,wallstreetbets,gz9i8mt,JG Wentworth 877 cash now.,t3_njubrl,10
1621858691.0,2021-05-24,wallstreetbets,gz9jtkf,Name a easier strategy than perma bull,t3_njubrl,9
1621859297.0,2021-05-24,wallstreetbets,gz9kqbc,Isn’t someone holding like 1m in SPY put FDs rn?,t3_njubrl,11
1621862124.0,2021-05-24,wallstreetbets,gz9pffj,OPEN THE CASINO,t3_njubrl,10
1621862267.0,2021-05-24,wallstreetbets,gz9poro,bears assholes all vaselined up for this morning,t3_njubrl,9
1621863255.0,2021-05-24,wallstreetbets,gz9rirs,CLOSE THE CASINO,t3_njubrl,10
1621863999.0,2021-05-24,wallstreetbets,gz9sz9v,Where is the guy who got legit salty at me suggesting SPCE puts Saturday. Show yourself I have this for you 🤡,t3_njubrl,9
1621865650.0,2021-05-24,wallstreetbets,gz9wc59,SPCE puts are gonna print,t3_njubrl,11
1621867855.0,2021-05-24,wallstreetbets,gza0xrx,"Is the guy that spent 360K on Spy puts dead?

I think that guy might actually be dead.",t3_njubrl,10
1621868068.0,2021-05-24,wallstreetbets,gza1ea5,Sold SPCE. It’ll go up now you’re welcome.,t3_njubrl,9
1621869311.0,2021-05-24,wallstreetbets,gza44jp,No amc hype now its actually up 10 percent in a day and rising?,t3_njubrl,11
1621870220.0,2021-05-24,wallstreetbets,gza63kr,Maybe AMD should try announcing a 40bn buyback next🤣,t3_njubrl,10
1621871834.0,2021-05-24,wallstreetbets,gza9k7i,My portfolio is complete dogshit,t3_njubrl,10
1621872107.0,2021-05-24,wallstreetbets,gzaa5s8,Dkng running too bad I’m still way underwater from the last 3 months,t3_njubrl,10
1621872308.0,2021-05-24,wallstreetbets,gzaalwq,1 dollar on everything dumping tomorrow,t3_njubrl,9
1621872910.0,2021-05-24,wallstreetbets,gzabzxl,0 dte SPY 418P,t3_njubrl,9
1621875385.0,2021-05-24,wallstreetbets,gzahpkc,puts on my brokerage account,t3_njubrl,10
1621875666.0,2021-05-24,wallstreetbets,gzaij42,[deleted],t3_njubrl,10
1621878069.0,2021-05-24,wallstreetbets,gzao5o0,$TSLA $650 EOD and I’m brewing green crayon tea...,t3_njubrl,11
1621879046.0,2021-05-24,wallstreetbets,gzaqcy6,SPCE support is lifting. Workin overtime in the fuckin gym lesgo baybee,t3_njubrl,10
1621879694.0,2021-05-24,wallstreetbets,gzarukb,"PLTR finally breaks $21!  


Now all I need is it to break $26 and I'll be even.  
Haha.... ha.... Oh god why.....",t3_njubrl,9
1621880812.0,2021-05-24,wallstreetbets,gzauf8z,"New hot ass chick at work, but she got a boyfriend. Time to start really workin",t3_njubrl,10
1621880944.0,2021-05-24,wallstreetbets,gzauqsq,PLTR going up on positive news? Am I dreaming?,t3_njubrl,9
1621881803.0,2021-05-24,wallstreetbets,gzawpz0,Holy shit SPCE looks like she’s gonna blow her load. I’ve never seen a cleaner cup and handle,t3_njubrl,11
1621883261.0,2021-05-24,wallstreetbets,gzb03m2,"BUY SPCE

*this is for the algorithm",t3_njubrl,10
1621883393.0,2021-05-24,wallstreetbets,gzb0eai,SPCE!!!!!!🔥🔥🚀🚀🚀🚀🚀🚀🚀🚀,t3_njubrl,10
1621883573.0,2021-05-24,wallstreetbets,gzb0sud,There’s some serious euphoria going on today,t3_njubrl,9
1621883631.0,2021-05-24,wallstreetbets,gzb0xkj,SPCE you beautiful bastard,t3_njubrl,10
1621883645.0,2021-05-24,wallstreetbets,gzb0yof,Spce to $27 omg I’m rock hard,t3_njubrl,9
1621883694.0,2021-05-24,wallstreetbets,gzb12na,virgin galactic!!,t3_njubrl,10
1621883926.0,2021-05-24,wallstreetbets,gzb1lg6,SPCE is the epitome of irrational exuberance lol,t3_njubrl,9
1621883958.0,2021-05-24,wallstreetbets,gzb1ny6,So that FOMO into SPCE wasn’t a trap. 🚀🚀🚀,t3_njubrl,10
1621883997.0,2021-05-24,wallstreetbets,gzb1r6u,SPCE cadets I went to the moon ($60) before it’s nice up there,t3_njubrl,10
1621884323.0,2021-05-24,wallstreetbets,gzb2jcc,SPCE should be 100$ as per my calculations. if im off i might be off by 10% max.,t3_njubrl,10
1621884524.0,2021-05-24,wallstreetbets,gzb3457,"just a reminder that rblx went up to an all time high today on no news or catalysts 

Load up on puts",t3_njubrl,11
