created,date,subreddit,id,body,parent_id,score
1589801100.0,2020-05-18,wallstreetbets,fr0mx71,"you guys laughed at me when I bought REIT stocks a while ago

you were right.",t3_glyucu,194
1589800857.0,2020-05-18,wallstreetbets,fr0mnj3,Bear here who is officially done.  Going to enjoy the remainder of my quarantine.  Will be rationing food unfortunately.,t3_glyucu,161
1589797297.0,2020-05-18,wallstreetbets,fr0ix11,"Good luck this week everyone. 
Boxes or yachts. 
Let’s fucking go.",t3_glyucu,130
1589807067.0,2020-05-18,wallstreetbets,fr0uj5i,I’ve got 20k in MRNA CALLS HOLY FUCK THIS CANT B REAL🤯🤯,t3_glyucu,110
1589800299.0,2020-05-18,wallstreetbets,fr0m1do,"Weird how last week Powell said the end was nigh and uncertainty was unpredictable; Goldman said 20% drop in equities soon; and a string of bad news was released, including talk of second waves and conflict with China. Now, Powell's saying the worst GDP projections are wrong, and this won't be nearly as bad as the great depression. Somebody's making a lot of money knowing what he's going to say next. The rest of the news all turned positive like we overcame the apocalypse in 7 days. Ride the waves, and make sure you jump off before the music stops.",t3_glyucu,112
1589800004.0,2020-05-18,wallstreetbets,fr0lppo,"Getting ready for another day of ""why are markets up when we have 25% unemployment""",t3_glyucu,81
1589801252.0,2020-05-18,wallstreetbets,fr0n3a8,Imagine actually being a bear in a recession   😂 😂 🤣 🤣 🤣,t3_glyucu,225
1589797417.0,2020-05-18,wallstreetbets,fr0j1e8,"Coffee? ✅

Adderall? ✅✅

Questionable DD for the day? ✅✅✅✅

Ready to ride the Powwow train to the bank today",t3_glyucu,73
1589798437.0,2020-05-18,wallstreetbets,fr0k2e9,Daddy J Powell giving us the J-shaped recovery 🎉🎉🎉,t3_glyucu,71
1589801421.0,2020-05-18,wallstreetbets,fr0na6c,Today is the day Bears go from -98% to -99% in their portfolios,t3_glyucu,61
1589797242.0,2020-05-18,wallstreetbets,fr0iuzq,"Ah, cant wait to be stressed for another 5 days in a row. Let's go",t3_glyucu,48
1589805032.0,2020-05-18,wallstreetbets,fr0rpa6,200 contracts of 290 5/18 reporting in. God damn I love gambling,t3_glyucu,44
1589797875.0,2020-05-18,wallstreetbets,fr0jhqq,Tsla stock price too high imo,t3_glyucu,125
1589798870.0,2020-05-18,wallstreetbets,fr0kiik,[deleted],t3_glyucu,125
1589799814.0,2020-05-18,wallstreetbets,fr0lict,[deleted],t3_glyucu,44
1589805787.0,2020-05-18,wallstreetbets,fr0sq4n,Fun fact. Friday afternoon for the first time in my 3-year trading career I went all in on SPY puts. GUH,t3_glyucu,44
1589801432.0,2020-05-18,wallstreetbets,fr0namn,Robinhood green hurts my eyes. What the fuck kind of mowing your lawn green is this shit,t3_glyucu,39
1589803372.0,2020-05-18,wallstreetbets,fr0pl35,JP tossing green dildos at the market like donny tosses paper towels at puertoricans,t3_glyucu,38
1589803527.0,2020-05-18,wallstreetbets,fr0prv1,"Bears last week = 2nd leg down. Spy 200 puts at bell  

Bears this week = waiting for the pawn shop to open at the bell.",t3_glyucu,39
1589804287.0,2020-05-18,wallstreetbets,fr0qq74,I bought 40k in apple stock days before the crash. Just about to break even today.,t3_glyucu,38
1589806172.0,2020-05-18,wallstreetbets,fr0t93x,Watched a documentary of a Korean grandma with a hunchback spending her entire day collecting recycling to ultimate make about $2 usd in the end. Feeling blessed we can make bread with just a few pushes on a screen 🙏,t3_glyucu,36
1589805340.0,2020-05-18,wallstreetbets,fr0s3zq,Imagine being Warren Buffett rn and seeing this shit lol,t3_glyucu,34
1589806284.0,2020-05-18,wallstreetbets,fr0teqp,[deleted],t3_glyucu,36
1589802710.0,2020-05-18,wallstreetbets,fr0osfo,"Bears this is a safe space for you. Comment below and share your stories with the rest of the gay bears.

We are here to support you, and no one will judge you ❤️❤️❤️",t3_glyucu,24
1589804239.0,2020-05-18,wallstreetbets,fr0qnyx,How many times can Jerome Powell pump the market by saying the same thing? Does nobody understand what infinite means? Apparently not because every time he says it investors seem to price it in again lol,t3_glyucu,26
1589816147.0,2020-05-18,wallstreetbets,fr1a8hj,"Imagine going to a casino, sitting down at a blackjack table, and fist pumping when the guy sitting across from you goes bust. Even though it has nothing to do with your hand.

That's what it is like in this fucking forum now.",t3_glyucu,29
1589816674.0,2020-05-18,wallstreetbets,fr1b99y,"Screaming ""profit is profit"" to myself as I close out of winning positions and then watch them continue to moon",t3_glyucu,27
1589823209.0,2020-05-18,wallstreetbets,fr1odvn,Can bulls and bears collectively agree that only being 10% off the S&P5000 all time high is actually a hilarious train of thought right now.,t3_glyucu,27
1589805817.0,2020-05-18,wallstreetbets,fr0srmh,"Monday:  
Vaccine talks going well! Dow rallies 700 points.   

Wednesday:  
Vaccine flops, shows ineffective. Dow drops 200 points.",t3_glyucu,22
1589807817.0,2020-05-18,wallstreetbets,fr0vo0g,just stick in the word vaccine anywhere and your company's stock is virtually guaranteed to pump a bare mininum of 10%. this is 2017 and blockchain all over again,t3_glyucu,24
1589816276.0,2020-05-18,wallstreetbets,fr1ahi1,Someone told me I was a retard for buying SPY puts last week. Turns out they were right.,t3_glyucu,22
1589798177.0,2020-05-18,wallstreetbets,fr0jsxu,"Bought puts thinking that if I lose job puts will print, man what a life!",t3_glyucu,48
1589805260.0,2020-05-18,wallstreetbets,fr0s03s,"“Goldman this morning takes its Q4 S&P 500 EPS estimate from +27% to (-17%), on a ""more gradual recovery."" (Kostin)”",t3_glyucu,23
1589816550.0,2020-05-18,wallstreetbets,fr1b0ip,"Moderna has been in business for 10 years and has never gotten a drug approved. The only way that is possible is if the CEO is one of the best hype, story tellers on the planet. The guy went on national television this morning to declare victory after a phase 1 trial.
https://twitter.com/hks55/status/1262368936445820930",t3_glyucu,21
1589796994.0,2020-05-18,wallstreetbets,fr0ilyc,I fucking love chocolate milk,t3_glyucu,64
1589804368.0,2020-05-18,wallstreetbets,fr0qtzp,Vaccine “news” is the new trump tweet “progress on China trade talks”,t3_glyucu,21
1589833543.0,2020-05-18,wallstreetbets,fr29o9w,Lmao MRNA announces issue of 1.25B worth of common stock on the same day they announce their phase 1 results.,t3_glyucu,22
1589804198.0,2020-05-18,wallstreetbets,fr0qm27,Imagine putting 100k on AAPL calls and missing it a likely 160k swing by one trading day cause you bought a FD.,t3_glyucu,23
1589804969.0,2020-05-18,wallstreetbets,fr0rm9a,"As a bear who bought puts at exactly 9:55am on Thursday, I’m in shambles.",t3_glyucu,19
1589827320.0,2020-05-18,wallstreetbets,fr1wxpo,Fuck dude I want to be rich so bad,t3_glyucu,21
1589822968.0,2020-05-18,wallstreetbets,fr1nw1a,[deleted],t3_glyucu,21
1589800234.0,2020-05-18,wallstreetbets,fr0lyse,"The best part of waking up☕🌅

Is seeing 🐻 completely fucked🎶😌",t3_glyucu,70
1589806094.0,2020-05-18,wallstreetbets,fr0t58s,"SPY 295 HERE WE COME

SUCK MY DICK /r/investing",t3_glyucu,20
1589819396.0,2020-05-18,wallstreetbets,fr1gnqi,Everyone block u/KeyFondant6,t3_glyucu,18
1589801051.0,2020-05-18,wallstreetbets,fr0mv5e,"""Futures Will Normalize By Morning"" And Other Hilarious Stories Bears Tell Themselves",t3_glyucu,17
1589803265.0,2020-05-18,wallstreetbets,fr0pgca,"Fomo into calls at open, we trade sideways or down for the rest of the day. Deposit more money, average down, sell for a loss, then watch as we hit 🌳💯 premarket tomorrow.",t3_glyucu,15
1589819262.0,2020-05-18,wallstreetbets,fr1gdua,Glad I blocked that KeyFondant6 dude.,t3_glyucu,18
1589830003.0,2020-05-18,wallstreetbets,fr22fwe,"my spy puts down 64% 

have a feeling that the end of day pump is gonna rip my fucking face off",t3_glyucu,15
1589800518.0,2020-05-18,wallstreetbets,fr0m9wp,"Bears accounts be like: SPY 200P 6/19, Avg cost: $17.50 💀🤡",t3_glyucu,36
1589803753.0,2020-05-18,wallstreetbets,fr0q1sf,"We forgot one important enemy that will get fucked this week finally

FUCK THETA GANG YOU SIDEWAYS LOVING FUCKS",t3_glyucu,33
1589807268.0,2020-05-18,wallstreetbets,fr0utox,"So the whole stock market is a pharma pump and dump now?

They only released partial data, and they don't even know if the results they saw we're meaningful for stopping covid.

[Moderna reports 'positive' data on early-stage coronavirus vaccine trial, shares surge 39%](https://www.cnbc.com/2020/05/18/moderna-reports-positive-data-on-early-stage-coronavirus-vaccine-trial.html)

Powel says no limit to Fed help, but we need a vaccine for meaningful recovery, then we get positive vaccine ""news"" the next day in premarket.

🤔🤔🤔🤔🤔",t3_glyucu,33
1589803861.0,2020-05-18,wallstreetbets,fr0q6q8,I have calls but this massive pump is scaring me,t3_glyucu,16
1589805643.0,2020-05-18,wallstreetbets,fr0sixw,"SPY defeated covid, weak, pathetic virus, very low energy",t3_glyucu,15
1589806680.0,2020-05-18,wallstreetbets,fr0tz1q,Gonna go take a run just before open to make sure I don’t FOMO into some dumb shit. Who’s with me?,t3_glyucu,18
1589807760.0,2020-05-18,wallstreetbets,fr0vks9,"This is now starting to feel like December 2018. Pot stocks mooning, extreme euphoria, and I'm not getting any gifts from my family.",t3_glyucu,17
1589817187.0,2020-05-18,wallstreetbets,fr1c9lp,Finally unlocked Robinhood green boys! Overall portfolio at +1%. Revived from -50%,t3_glyucu,15
1589822618.0,2020-05-18,wallstreetbets,fr1n6aa,This is pure hysteria,t3_glyucu,17
1589833949.0,2020-05-18,wallstreetbets,fr2aid2,"So glad I sold my SPY calls this afternoon. No idea what is coming tmrw. I don't even care if it goes to 300, you ballers deserve the extra tendies for facing down the risk.",t3_glyucu,16
1589802856.0,2020-05-18,wallstreetbets,fr0oypg,[deleted],t3_glyucu,16
1589805543.0,2020-05-18,wallstreetbets,fr0sdwo,"Sold my TSLA 835c, MSFT 185c, APPL 120c friday for Trump sized hands gainz... Guh",t3_glyucu,16
1589815734.0,2020-05-18,wallstreetbets,fr19fu8,"Imagine working at UBER, you get fired and being the autist you are, you buy puts with your last paycheck before the news is public, it goes public and you immediately go -90%",t3_glyucu,13
1589822244.0,2020-05-18,wallstreetbets,fr1men1,"Up almost 10k 

Gonna buy Ryzen 9 3900, 2080ti rog strix, rog 8 hero, 32gb trident royal 3600mhz.

Thanks mouse!",t3_glyucu,14
1589824394.0,2020-05-18,wallstreetbets,fr1qukp,Being up 10k feels a lot less good than being down 10k feels bad,t3_glyucu,14
1589832341.0,2020-05-18,wallstreetbets,fr278kd,"So based on this sub, tomorrow will be somewhere between 282 and 310. Your welcome for the prediction and crunching those #’s. Now go make some trendies!",t3_glyucu,14
1589801572.0,2020-05-18,wallstreetbets,fr0ngid,"Imagine being retarded enough to bet against the most powerful nation the world has ever seen. 

I’m that retarded.",t3_glyucu,46
1589806226.0,2020-05-18,wallstreetbets,fr0tbt9,"Word to the wise: the vast majority of the stock market gains in history have taken place while the market is closed. We could climb all day, but dont expect too much and FOMO into bad calls",t3_glyucu,13
1589807265.0,2020-05-18,wallstreetbets,fr0utjc,Picked up some SPY 286c’s near close on Friday for cheap. I’m the happiest boy in the whole town today.,t3_glyucu,15
1589807271.0,2020-05-18,wallstreetbets,fr0utuz,I went from almost closing my RH account to buying a bunch of SPY and DIS puts on Friday. Fml,t3_glyucu,15
1589807488.0,2020-05-18,wallstreetbets,fr0v5zh,[deleted],t3_glyucu,13
1589814349.0,2020-05-18,wallstreetbets,fr16tim,haha I've lost so much money,t3_glyucu,14
1589819316.0,2020-05-18,wallstreetbets,fr1ghud,u/KeyFondant6 spamming the daily out of pure helpless desperation after losing what I'm sure was a few months of desperately-needed rent $$ is tbh exactly what brings me to this sub,t3_glyucu,15
1589820532.0,2020-05-18,wallstreetbets,fr1ixyi,"Will never understand how bleak of an existence you need to lead to post fake news on WSB

That’s your sense of humor? Of all things?",t3_glyucu,15
1589829364.0,2020-05-18,wallstreetbets,fr21553,"So my gf noticed I was in a shitty mood, said mondays are usually bad trading days. Little does she know I lose money every day",t3_glyucu,13
1589830783.0,2020-05-18,wallstreetbets,fr241dq,"Jerome: the economy will recover slowly

Economy: recover the next day",t3_glyucu,14
1589834546.0,2020-05-18,wallstreetbets,fr2bpw8,"I can’t be the only one, but when I see WSJ headline say “Stocks Rally as Hopes Build for a Virus Vaccine”, I think to myself: “Bullshit, that’s a vague ass statement to justify gains. This is just fueled by greedy degenerates like us, short squeeze, and institutions pushing the price up”",t3_glyucu,14
1589807017.0,2020-05-18,wallstreetbets,fr0uggo,[deleted],t3_glyucu,30
1589811607.0,2020-05-18,wallstreetbets,fr11uib,"I quit trading but I didn’t quit WSB and I didn’t work on my other hobbies so I always keep coming back, on Friday I FOMOed 2% of my account into VXX 60c 6/19 just for fun. 

It’s just so easy to push a few buttons, type a few words, and see tangible changes in your portfolio and encouraging replies from strangers. This is almost impossible in any other hobby.

But I already achieved my goals, I’m up 270% YTD, 320% all time, a better return in 2 months than I would have gotten in 2 decades of r/Investing bs. All the support and laughs from the WSB community made my quarantine entertaining and helped me adjust to a new life in a new city with no friends. It’s not helping me anymore and frantically checking every +-0.1% move on futures and refreshing the WSB discussion threads doesn’t add any new value to my life so I’m actually gonna quit WSB as well, gonna be back in a month when I’m more balanced. 

Farewell for now.",t3_glyucu,31
1589797348.0,2020-05-18,wallstreetbets,fr0iyyc,The overwhelmingly bullish sentiment makes me think there’s going to be a rug pull. I’m also a bear so that’s probably why I think that.,t3_glyucu,62
1589801291.0,2020-05-18,wallstreetbets,fr0n4t5,Donkey Kong gang lets go,t3_glyucu,11
1589808085.0,2020-05-18,wallstreetbets,fr0w2nq,9 mins till the Casino opens,t3_glyucu,11
1589817113.0,2020-05-18,wallstreetbets,fr1c49z,What is the opposite of a rug pull? Installing carpet?,t3_glyucu,11
1589817298.0,2020-05-18,wallstreetbets,fr1chfn,"No way this doesn't pull back within a day or two.
 
Fucking retarded movements lol",t3_glyucu,13
1589819284.0,2020-05-18,wallstreetbets,fr1gffv,If you weren't already holding or got in immediately this morning then you might as well just not bother today. all the action happened. wait until EOD and decide what you think is happening tomorrow.,t3_glyucu,12
1589822663.0,2020-05-18,wallstreetbets,fr1n9kn,276 to 296 in a matter of three trading days. lmao,t3_glyucu,15
1589833334.0,2020-05-18,wallstreetbets,fr298tr,"These times feel exciting! 

It's like a never ending party on a cruise ship that's on fire, under quarantine and about to hit an iceberg made out of defaulting debt",t3_glyucu,14
1589798230.0,2020-05-18,wallstreetbets,fr0juty,Shoo back to r/all you gold begging tards,t3_glyucu,11
1589803442.0,2020-05-18,wallstreetbets,fr0po67,This market is pure greed 😂🤣😂,t3_glyucu,12
1589805502.0,2020-05-18,wallstreetbets,fr0sbuv,God it's beautiful. Happy fucking Monday,t3_glyucu,10
1589805788.0,2020-05-18,wallstreetbets,fr0sq68,"Probably selling my spy calls At open, definitely don’t want to risk it. Profit is profit.",t3_glyucu,12
1589808400.0,2020-05-18,wallstreetbets,fr0wk5g,[deleted],t3_glyucu,13
1589821473.0,2020-05-18,wallstreetbets,fr1kul8,Wonder how salty the -107k AAPL guy is right now.,t3_glyucu,13
1589823418.0,2020-05-18,wallstreetbets,fr1otdz,I'm so glad we beat the virus and everyone is getting their jobs back!,t3_glyucu,12
1589823689.0,2020-05-18,wallstreetbets,fr1pdto,Omg if we get another +3% day tomorrow... back up to -95% all time 😃,t3_glyucu,13
1589824128.0,2020-05-18,wallstreetbets,fr1qara,"Ok so the rally is becsuse of the vaccine, are we gonna dump when people find out it will still take 2yrs to get the vaccine out though? Lol",t3_glyucu,12
1589825098.0,2020-05-18,wallstreetbets,fr1sbnp,Jesus Christ I’m ready to slap a toothpick underneath my big toenail and kick the fucking wall. I bought the wrong exp for my SPY 300 calls. Mfs exp worthless today. My stupid ass wanted calls for Friday.,t3_glyucu,10
1589826842.0,2020-05-18,wallstreetbets,fr1vxw4,276 -> 296 in 3 days lmao,t3_glyucu,13
1589828765.0,2020-05-18,wallstreetbets,fr1zvqc,"made a quick $400 off 2 SPY $300 calls I bought Friday, first 100%+ profit in a while felt good after getting wrecked for two months",t3_glyucu,11
1589831130.0,2020-05-18,wallstreetbets,fr24qvz,I’m sorry but if you buy calls EOD today after one of the largest rallies in months u deserve to lose money,t3_glyucu,12
1589832731.0,2020-05-18,wallstreetbets,fr280rr,SEC should definitely look into some of these bio companies. There's been a solid like 20 of them mooning off covid shit being pumped by their CEOs when more than half of them have nothing of substance,t3_glyucu,13
1589833750.0,2020-05-18,wallstreetbets,fr2a44m,Warren Buffet is worth $80 billion. Why doesn't he just throw $79 billion into SPY options. If it hits he's now worth $1 trillion and dies the most mythical status in the history of the universe. If it misses he'll die with $1 billion. He's gonna die in 2 years anyway so what's the difference.,t3_glyucu,22
1589803824.0,2020-05-18,wallstreetbets,fr0q50q,Smells like we’re nearing euphoria here..,t3_glyucu,12
1589805102.0,2020-05-18,wallstreetbets,fr0rsjk,Imagine being a bear in a recession,t3_glyucu,11
1589805879.0,2020-05-18,wallstreetbets,fr0sum4,So announcing a vaccine is the “blockchain” of 2020. Got it. Anyone got a list?,t3_glyucu,11
1589806073.0,2020-05-18,wallstreetbets,fr0t47d,"“That 11.2% plunge in April industrial production was the steepest in recorded history. And that includes the entire Great Depression.”

340 EOW?",t3_glyucu,10
1589807894.0,2020-05-18,wallstreetbets,fr0vs9b,"“Yeah our vaccine doesn’t work”

Market: “Did he just say vaccine????? BUY BUY BUY BUY BUY”",t3_glyucu,11
1589812114.0,2020-05-18,wallstreetbets,fr12qrw,omg that poor person that said they sold their $ACB calls for a loss on Thursday,t3_glyucu,11
1589813987.0,2020-05-18,wallstreetbets,fr165gq,I’m addicted to 0 DTE SPY,t3_glyucu,11
1589815691.0,2020-05-18,wallstreetbets,fr19cvy,Moderna vaccine shows promising results. In a test of that had a total of 8 people. This is what counts as promising results these days.,t3_glyucu,11
1589815800.0,2020-05-18,wallstreetbets,fr19k9y,"Buy anything. It’ll go up

Bears: VXX calls",t3_glyucu,11
1589817580.0,2020-05-18,wallstreetbets,fr1d1zy,Bought a SPY atm monthly and hedging with getting a job,t3_glyucu,11
1589821098.0,2020-05-18,wallstreetbets,fr1k3i3,hello i’m losing money,t3_glyucu,11
1589821234.0,2020-05-18,wallstreetbets,fr1kde1,So Chipotle shares are now at 1000. Modern Burrito Theory says we can add infinite guac so long as we control the avocado reserves.  Use this DD as you will.,t3_glyucu,11
1589821332.0,2020-05-18,wallstreetbets,fr1kkip,I don't think casinos will ever recover. Everyone is hooked on options plays.,t3_glyucu,11
1589823875.0,2020-05-18,wallstreetbets,fr1ps0p,"This melt up and the reaction to it is what euphoria looks like. IF there's a rug pull, the market is going to tank HARD.",t3_glyucu,10
1589830837.0,2020-05-18,wallstreetbets,fr2458l,The 294cs i bought friday went up 3000%...i'll probably never be this lucky again,t3_glyucu,11
1589832615.0,2020-05-18,wallstreetbets,fr27sbn,"With all due respect, you are fucking retarded if you didn't buy some weekly puts around close. Sure, Powell had a great interview yesterday about infinite money cheat codes in front of a fucking moron reporter but tomorrow he's in front of congress. And I think they're going to ask him to elaborate a little on the endless brrrrrrrrrrrr",t3_glyucu,10
1589833464.0,2020-05-18,wallstreetbets,fr29idu,You already know Boomers are on the phone with their brokers rn screaming to buy more DIS and KO out of pure FOMO. 305 EOW,t3_glyucu,11
1589800288.0,2020-05-18,wallstreetbets,fr0m0y0,Remember to take profits guys...don’t get blinded by the excitement. Been boned hard by that before...,t3_glyucu,35
1589802743.0,2020-05-18,wallstreetbets,fr0otta,[deleted],t3_glyucu,11
1589803376.0,2020-05-18,wallstreetbets,fr0pl8y,Bears are gonna need a support group after today. This is NSFW,t3_glyucu,10
1589803643.0,2020-05-18,wallstreetbets,fr0pwxn,"Futures up 2.5%

The fucking lol",t3_glyucu,10
1589803892.0,2020-05-18,wallstreetbets,fr0q83w,[deleted],t3_glyucu,9
1589804408.0,2020-05-18,wallstreetbets,fr0qvv0,"guys seriously tho wtf

is this the v-shaped recovery?

Im holding all calls and stonks, so this is very good for me, but this shit is odd.",t3_glyucu,10
1589806098.0,2020-05-18,wallstreetbets,fr0t5fi,Theta gang r fuk,t3_glyucu,10
1589806468.0,2020-05-18,wallstreetbets,fr0to9m,"""Investors bet American Airlines will default on debt""

AAL up 8% premarket. Lol are you fucking kidding me.

At least my puts are a hedge against my DAL and LUV calls",t3_glyucu,11
1589807306.0,2020-05-18,wallstreetbets,fr0uvpw,How do I tell my family I made this much money off my calls cuz I listened to shrimp?,t3_glyucu,10
1589808376.0,2020-05-18,wallstreetbets,fr0wiqs,"SPY will drop .5% today and we gonna see ""rug pull"" posts lmao",t3_glyucu,10
1589811292.0,2020-05-18,wallstreetbets,fr11ati,Made $200 on that Moderna bump. One step closer to +$0 all time,t3_glyucu,11
1589811904.0,2020-05-18,wallstreetbets,fr12ddw,"Made my target profit of 2.5k today. I'm out. See ya tomorrow, bulls.",t3_glyucu,11
1589823391.0,2020-05-18,wallstreetbets,fr1ores,"Need a pullback from SPY to 292 to load up on calls.  295/6 is way too dangerous.  Everytime it's gotten to this point, it's tanked the next 2 days",t3_glyucu,11
1589824762.0,2020-05-18,wallstreetbets,fr1rm68,"I’m switching to bull gang, just bought calls. 

On VIX 😉",t3_glyucu,10
1589826333.0,2020-05-18,wallstreetbets,fr1uucp,Portfolio went from -50% to -6% today is a good day,t3_glyucu,10
1589829182.0,2020-05-18,wallstreetbets,fr20rge,"Just made $7 on SPY puts 😎 looks like I'm gonna double my portfolio today
EDIT: I'm down 90 cents do you guys think this was too risky?",t3_glyucu,8
1589830783.0,2020-05-18,wallstreetbets,fr241dh,"I want to buy puts so bad, might just grab a 300c instead",t3_glyucu,10
1589830953.0,2020-05-18,wallstreetbets,fr24dtv,Even the Corona virus itself bought calls.,t3_glyucu,9
1589831125.0,2020-05-18,wallstreetbets,fr24qhu,[removed],t3_glyucu,10
1589831842.0,2020-05-18,wallstreetbets,fr267n4,Nothing about this is healthy.,t3_glyucu,9
1589832086.0,2020-05-18,wallstreetbets,fr26puk,Raise ur hand if ur still a bear,t3_glyucu,11
1589832311.0,2020-05-18,wallstreetbets,fr276ca,Buying calls at close made no sense so that’s exactly what I did 😎 #PPTGang,t3_glyucu,10
1589833043.0,2020-05-18,wallstreetbets,fr28ni2,does the 500 in s&p 500 mean that spy will not stop until it hits 500. isn't it obvious that we should buy calls then.,t3_glyucu,10
1589804147.0,2020-05-18,wallstreetbets,fr0qjr0,Time to unsub,t3_glyucu,19
1589806368.0,2020-05-18,wallstreetbets,fr0tj2x,Jesus Christ I should have listened to that fucking shrimp,t3_glyucu,17
1589813606.0,2020-05-18,wallstreetbets,fr15fux,apparently corona goes away once you’re bored with it,t3_glyucu,19
1589801792.0,2020-05-18,wallstreetbets,fr0npp0,"The chart’s gone green I’m wondering why I
Got out of bed at all
The morning pump clouds up my tendies
And I can’t see at all
And even if I could it’ll all be green
Put Jerome’s picture on my wall
It reminds me, that it’s not so bad
It’s not so bad",t3_glyucu,9
1589802109.0,2020-05-18,wallstreetbets,fr0o30u,This is too easy. I'm scared.,t3_glyucu,8
1589804410.0,2020-05-18,wallstreetbets,fr0qvy7,"25K invested into 5/22 DIS puts to play the weekly 100-109 swings .....
Will sell for a huge lost at open.

Thanks JPOW and 🇺🇸 - Pretty legit market pump never bet against you again.",t3_glyucu,10
1589805186.0,2020-05-18,wallstreetbets,fr0rwj0,"Oxford vaccine that everyone was praising on friday is apparently not useful 
https://www.telegraph.co.uk/global-health/science-and-disease/doubts-oxford-vaccine-fails-stop-coronavirus-animal-trials/

Lets see if its the same with moderna tomorrow",t3_glyucu,10
1589807740.0,2020-05-18,wallstreetbets,fr0vjpf,Here comes the classic buy high -> sell low gang,t3_glyucu,9
1589808533.0,2020-05-18,wallstreetbets,fr0wrl5,Sucks for that dude who had 100k in AAPL 5/15 305c....if he had just done 5/18 he would be golden,t3_glyucu,9
1589809166.0,2020-05-18,wallstreetbets,fr0xqms,"Robinhood is an absolute mess at opening. Just somehow sold 4 contracts instead of 2. At profit, but still....",t3_glyucu,8
1589810763.0,2020-05-18,wallstreetbets,fr10e5u,It feels so good to fucking win,t3_glyucu,8
1589811833.0,2020-05-18,wallstreetbets,fr128vy,The real 🤡 are the people buying calls now,t3_glyucu,9
1589813182.0,2020-05-18,wallstreetbets,fr14nxx,Well... puts before Friday close was the fucking of the century,t3_glyucu,9
1589815862.0,2020-05-18,wallstreetbets,fr19ol1,Theta gang checking in. Getting fucked all over.,t3_glyucu,9
1589822438.0,2020-05-18,wallstreetbets,fr1mt4c,Chipotle is an extremely dumb long term buy at these levels. What’s wrong with these idiots?,t3_glyucu,9
