created,date,subreddit,id,body,parent_id,score
1602069605.0,2020-10-07,wallstreetbets,g7zpyav,Had a really good shit this morning.,t3_j6o9s8,32
1602073709.0,2020-10-07,wallstreetbets,g7zuur6,I really bought SPY puts I cant believe this shit,t3_j6o9s8,29
1602075043.0,2020-10-07,wallstreetbets,g7zwt9s,Trump just retweeted no more forrest fires if you vote trump lol,t3_j6o9s8,29
1602089105.0,2020-10-07,wallstreetbets,g80nkve,"MIAMI DOLPHINS CLEARED FOR FULL STADIUM CAPACITY:FOX SPORTS 640

https://twitter.com/DeItaOne/status/1313882521558487041

Florida gonna Florida",t3_j6o9s8,30
1602065552.0,2020-10-07,wallstreetbets,g7zm1to,Can’t wait to see what the market built on a house of cards does today!,t3_j6o9s8,60
1602068532.0,2020-10-07,wallstreetbets,g7zovo4,I love watching the sunrise while thinking about a perfect pair of tits and drinking coffee..,t3_j6o9s8,15
1602071126.0,2020-10-07,wallstreetbets,g7zrmxd,"When I wake up, instead of checking news apps I check the daily discussion because I know U retards got me",t3_j6o9s8,13
1602071665.0,2020-10-07,wallstreetbets,g7zs97c,[deleted],t3_j6o9s8,13
1602073180.0,2020-10-07,wallstreetbets,g7zu57q,Held vxx calls overnight so that bulls could run today. Thankless job but someone had to do it,t3_j6o9s8,15
1602073652.0,2020-10-07,wallstreetbets,g7zurxp,"This market is in an abusive relationship with the fruit. He says something hurtful, the market doesn't like it and is about to leave. Mango apologies to the market and promises to never do it again and market stays. Rinse and repeat.",t3_j6o9s8,14
1602073677.0,2020-10-07,wallstreetbets,g7zut68,Yesssss keep tweeting. I bet you can fit like 15 more in before open.,t3_j6o9s8,13
1602076293.0,2020-10-07,wallstreetbets,g7zyxuy,"Buy calls! Wait no buy puts! What am I thinking clearly it's going to be a bull day, unless it won't be, but it might be, unless it's a trap, not to be confused with double trap which could also be the case. You know maybe I'll sit on the sidelines today and enjoy the show",t3_j6o9s8,12
1602076483.0,2020-10-07,wallstreetbets,g7zza20,"Did Cramer just utter ""im depressed"" to himself before commercials?",t3_j6o9s8,14
1602076900.0,2020-10-07,wallstreetbets,g8000bf,[removed],t3_j6o9s8,17
1602077878.0,2020-10-07,wallstreetbets,g801thk,"Congrats dip buyers yesterday, keep being true believers",t3_j6o9s8,13
1602078280.0,2020-10-07,wallstreetbets,g802jtc,im straight up not having a good time anymore,t3_j6o9s8,13
1602078598.0,2020-10-07,wallstreetbets,g8033ux,Lmao you fucking retards stop arguing with the market. Your interpretation of news is irrelevant. Market is buying for the new quarter.,t3_j6o9s8,12
1602080002.0,2020-10-07,wallstreetbets,g805luv,Being a bull is like a drug. That adrenaline rush when you’ve had 8 cups of coffee and you see that chart fucking runnnnn. I crave that high everyday,t3_j6o9s8,13
1602080672.0,2020-10-07,wallstreetbets,g806twv,My life was better before I discovered options,t3_j6o9s8,14
1602081030.0,2020-10-07,wallstreetbets,g807i23,"Reasons to be short: fuckton

Reasons to be long: hope",t3_j6o9s8,13
1602081205.0,2020-10-07,wallstreetbets,g807tog,"Mango pulls out of talks, market dumps

talks do not recover, market goes right back to where it was",t3_j6o9s8,13
1602082807.0,2020-10-07,wallstreetbets,g80awsx,[deleted],t3_j6o9s8,12
1602083646.0,2020-10-07,wallstreetbets,g80ck1u,This market is such trash.  It will go up unless there is absolutely no publicly rational reason to sell off.  You’re telling me a tweet that strings along a glimmer of hope is all we need to pump it up further on fears of inflation?  This thing is rigged and eventually someone is pulling the plug.,t3_j6o9s8,13
1602083694.0,2020-10-07,wallstreetbets,g80cng8,cash today .. not dealing with mango manic again yesterday gave me a heart attack on the 5m charts,t3_j6o9s8,14
1602085568.0,2020-10-07,wallstreetbets,g80gebc,I have 3 sources of income. Stocks is currently not one of them,t3_j6o9s8,13
1602088294.0,2020-10-07,wallstreetbets,g80lxhs,Dump to immediately pump again? Wtf is this market,t3_j6o9s8,12
1602089446.0,2020-10-07,wallstreetbets,g80oacy,[deleted],t3_j6o9s8,13
1602094070.0,2020-10-07,wallstreetbets,g80xspv,"fed: ""stocks too high, more stimulus needed""

spy: hold my beer",t3_j6o9s8,12
1602094491.0,2020-10-07,wallstreetbets,g80yodb,"10,000 SPY $380c expiring worthless today

Pour one out for ya homies",t3_j6o9s8,14
1602094704.0,2020-10-07,wallstreetbets,g80z45d,Lol 1.5% pump on no volume. I love this game,t3_j6o9s8,13
1602095225.0,2020-10-07,wallstreetbets,g81071f,This steady climb is shady af,t3_j6o9s8,14
1602095270.0,2020-10-07,wallstreetbets,g810agx,Being accused of being a monopoly is bullish as fuck,t3_j6o9s8,12
1602095328.0,2020-10-07,wallstreetbets,g810erg,We are reaching levels of priced in that shouldn’t be possible,t3_j6o9s8,12
1602096222.0,2020-10-07,wallstreetbets,g8129kj,At this point I’d almost bet we dump on stimulus passing. Nothing makes sense,t3_j6o9s8,13
1602096671.0,2020-10-07,wallstreetbets,g81379u,Imagine saying economy stronger than ever and begging for stimulus 🌝,t3_j6o9s8,13
1602096798.0,2020-10-07,wallstreetbets,g813gpj,"Here is what's going to happen: this shit is just going to go up, up, up and up and make no sense whatsoever for a long ass time until everyone is laughing and posting stonks only go up memes and it's way past the election and past the election court battle and everything is boring and then this shit is going to dump to 200, and stay there just long enough to fuck over everyone's calls before it bounces back up to like 325 and then slowly bleeds down for a year.  
  
Just to fuck absolutely everyone.",t3_j6o9s8,15
1602097499.0,2020-10-07,wallstreetbets,g814xwp,Trump is retweeting fake news claiming it’s a reason Biden shouldn’t be able to run. Nice.,t3_j6o9s8,13
1602099344.0,2020-10-07,wallstreetbets,g818qu3,I’m so sick of Aapl. Die or rise you lazy slut.,t3_j6o9s8,12
1602099868.0,2020-10-07,wallstreetbets,g819tiy,How many times do i have to learn that you always buy eod...,t3_j6o9s8,14
1602088805.0,2020-10-07,wallstreetbets,g80mylx,"CNN has the perfect sentiment describing America right now. 

A picture with a big ""Going Out of Business"" sign in front of a store under construction.

Underneath it, a headline that reads ""US Stocks Open Higher""

🤡🎉",t3_j6o9s8,37
1602067734.0,2020-10-07,wallstreetbets,g7zo4f9,"Well fellas, today seems like a good day to finally blow up my account",t3_j6o9s8,14
1602069467.0,2020-10-07,wallstreetbets,g7zpt5b,[deleted],t3_j6o9s8,13
1602073450.0,2020-10-07,wallstreetbets,g7zui23,If i see an article that says “market rallies on stimulus hopes” I’m going to have a fucking aneurysm,t3_j6o9s8,12
1602074454.0,2020-10-07,wallstreetbets,g7zvwkl,Giulani is a fucking idiot.,t3_j6o9s8,11
1602074692.0,2020-10-07,wallstreetbets,g7zw8z7,It smells like bitch in here,t3_j6o9s8,12
1602075144.0,2020-10-07,wallstreetbets,g7zwz38,"10/6 “Stock indices nose dive after stimulus talks terminated!”
10/7 “Stock futures jump on renewed stimulus hopes”",t3_j6o9s8,13
1602075487.0,2020-10-07,wallstreetbets,g7zxigw,"Shouldn't you be listening when the Chairman of the Fed is like ""Hey guys regardless of politics you need to fucking put some more stimulus back in this bitch"" Seems like that is a pretty big warning for the economy and the market...",t3_j6o9s8,12
1602076287.0,2020-10-07,wallstreetbets,g7zyxi9,"18 tweets in less than an hour.

Probably longing VXX",t3_j6o9s8,13
1602076885.0,2020-10-07,wallstreetbets,g7zzze7,If it weren’t for all of these gay events occurring AMD would be $95 already,t3_j6o9s8,12
1602078340.0,2020-10-07,wallstreetbets,g802nl6,"Big tech antitrust, no stimulus, Election, rona chaos, economic shambles.

What’s that mean?

PAAAMMMPPPP EEEEETTT",t3_j6o9s8,12
1602078684.0,2020-10-07,wallstreetbets,g8039ah,I'm a bull but why the fuck is the market pumping today...,t3_j6o9s8,12
1602078892.0,2020-10-07,wallstreetbets,g803mj2,AAPL to 120 today,t3_j6o9s8,11
1602079198.0,2020-10-07,wallstreetbets,g80464f,">Speaker Pelosi & Secretary Mnuchin spoke by phone at 9:33 a.m. The Secretary inquired about a standalone airlines bill. The Speaker reminded him that Republicans blocked that bill on Friday & asked him to review the DeFazio bill so that they could have an informed conversation.

Trump really fucked the stimulus bad",t3_j6o9s8,13
1602082094.0,2020-10-07,wallstreetbets,g809iuf,"I've gotten so fucked this last week, it's actually comical. Lost $25K",t3_j6o9s8,11
1602082439.0,2020-10-07,wallstreetbets,g80a6pg,Mango is going on a twitter rant Kanye himself would be proud of,t3_j6o9s8,13
1602083091.0,2020-10-07,wallstreetbets,g80bgsq,Oh ok just ISIS,t3_j6o9s8,12
1602084284.0,2020-10-07,wallstreetbets,g80dttg,Got this weird feeling we may sell off EOD. Wtf do I know tho,t3_j6o9s8,12
1602084666.0,2020-10-07,wallstreetbets,g80ell1,"This fucking bill isnt passing until 2021 after half of us have gambled our lives away and are starving in the streets. Let's just stop sugarcoating it. No one is getting elected until December, the Supreme court will probably have to get involved and we already know where the rest of this story is going.",t3_j6o9s8,13
1602084925.0,2020-10-07,wallstreetbets,g80f3uj,"AAPL moves like a snail, but it has been raising its lows almost every day.",t3_j6o9s8,12
1602085456.0,2020-10-07,wallstreetbets,g80g66k,"Me, almost every day when my account is red: Why do you keep doing this? This is straight up gambling, and at this point it's an addiction. Don't you know active traders almost never beat S&P returns?  
  
Also me, when my account is 1% green:  
Awwwww yissss, I'm a stock trader genius, I should quit my day job.",t3_j6o9s8,11
1602086648.0,2020-10-07,wallstreetbets,g80im06,This just in: I have officially been promoted from retarded to fucking retarded.,t3_j6o9s8,11
1602089359.0,2020-10-07,wallstreetbets,g80o3vj,TAN. VOTE,t3_j6o9s8,12
1602089564.0,2020-10-07,wallstreetbets,g80oivv,Theta gang in yachts,t3_j6o9s8,12
1602090522.0,2020-10-07,wallstreetbets,g80qhib,"If you don't cook with good olive oil, youre honestly a bitch.",t3_j6o9s8,11
1602092395.0,2020-10-07,wallstreetbets,g80ubk5,"wtf is this volume lmao, is everyone fallen asleep?",t3_j6o9s8,11
1602093936.0,2020-10-07,wallstreetbets,g80xipe,"I'll take one bottle of bleach, chilled please",t3_j6o9s8,13
1602094008.0,2020-10-07,wallstreetbets,g80xo2r,[deleted],t3_j6o9s8,10
1602094049.0,2020-10-07,wallstreetbets,g80xr5t,Lmao even fed is “why you no stimmy”,t3_j6o9s8,11
1602094297.0,2020-10-07,wallstreetbets,g80y9t8,This market is insane,t3_j6o9s8,11
1602094365.0,2020-10-07,wallstreetbets,g80yexn,EVERYTHING IS PRICED IN I REPEAT EVERYTHING PRICED IN,t3_j6o9s8,12
1602094419.0,2020-10-07,wallstreetbets,g80yizt,Lol at 🥭 retweeting a tweet from 2018 as if it's recent news,t3_j6o9s8,12
1602094789.0,2020-10-07,wallstreetbets,g80zaia,"*Me at market open...*

 ""I'll never buy another call in this retarded ass market. Totally manipulated. No calls until after erection""

*2 minutes later ....*


Send me any call and I will ~~sign~~ buy it right away.  You listening ~~Nancy~~ Market Makers?",t3_j6o9s8,11
1602095068.0,2020-10-07,wallstreetbets,g80zvcc,at this point I'm just expecting donnie to retweet some chick from onlyfans.,t3_j6o9s8,11
1602095124.0,2020-10-07,wallstreetbets,g80zzju,"MONEY MAKERS READING THIS SUB: FUCK YOU, I AINT FALLING FOR IT 

FUCK YOU",t3_j6o9s8,13
1602096624.0,2020-10-07,wallstreetbets,g8133n2,Cmon donny one more pump for old times sake,t3_j6o9s8,12
1602097735.0,2020-10-07,wallstreetbets,g815flj,"If mods won't ban this guy, I'd highly recommend just blocking him. You won't see any of his spam.",t3_j6o9s8,12
1602098182.0,2020-10-07,wallstreetbets,g816cr4,Spy put weeklies are like crack to me. I keep buying more and more and loose all my money.,t3_j6o9s8,12
1602098295.0,2020-10-07,wallstreetbets,g816kxi,"Congrats team, we split this dude’s karma in half",t3_j6o9s8,13
1602098835.0,2020-10-07,wallstreetbets,g817ozl,"Contrarian argument is that the market will rally into the election: especially if it looks like it will be a landslide one way or the other.

All the market cares about is a clear winner on erection night.

Extra bullish if the winner talks about stimulus on that night or by inauguration especially since the winner, if they win big, most likely controls all three seats of government.",t3_j6o9s8,12
1602098912.0,2020-10-07,wallstreetbets,g817ury,I’ve suddenly become a green energy baron,t3_j6o9s8,11
1602099400.0,2020-10-07,wallstreetbets,g818uzi,**IM NOT SELLING SHIT** 💎🙌,t3_j6o9s8,12
1602099738.0,2020-10-07,wallstreetbets,g819jxe,If you can make $10 in this market. Your are a genius.,t3_j6o9s8,11
1602104281.0,2020-10-07,wallstreetbets,g81iqpq,Damn I sold Fastly after Trump fucked with Tik Tok and now look at it... FUCKKKKKK,t3_j6o9s8,13
1602070075.0,2020-10-07,wallstreetbets,g7zqg78,Trump: “JK Stimulus checks for all.”,t3_j6o9s8,22
1602071536.0,2020-10-07,wallstreetbets,g7zs3te,🥭 stayed up late after his drug comedown and was “ohfuuuuck...” lmao,t3_j6o9s8,24
1602076414.0,2020-10-07,wallstreetbets,g7zz5ms,3.1k comments... wow. I think about 80% of the sub got wiped out in the past month 😂,t3_j6o9s8,24
1602086064.0,2020-10-07,wallstreetbets,g80herb,"Small business owners: Stimulus, please

American workers: Stimulus, please

Service industry leaders: Stimulus, please

JPow: Stimulus, please

Goldman Sachs: Stimulus, please

\---------------------------

Mango: I'm appealing the ruling on my tax returns to the supreme court and we need to focus exclusively on filling the vacant seat before they rule on my tax return appeal",t3_j6o9s8,24
1602097915.0,2020-10-07,wallstreetbets,g815svl,I just blocked wildmongoose,t3_j6o9s8,23
1602069389.0,2020-10-07,wallstreetbets,g7zpq8j,"NANCY ARE YOU LISTENING

ARE YOU LISTENING

ARE YOU LISTENING, NANCY

NANCY ARE YOU LISTENING

WILL YOU TELL US 

THAT YOUR LISTENING",t3_j6o9s8,22
1602068351.0,2020-10-07,wallstreetbets,g7zopdb,"need to workout, cause i soon need a sugar mama",t3_j6o9s8,11
1602068809.0,2020-10-07,wallstreetbets,g7zp59c,"BTFD has outperformed all other strategies and killed millions of bears.   
- WSJ",t3_j6o9s8,11
1602070391.0,2020-10-07,wallstreetbets,g7zqsna,"buy red sell green buy red sell green buy red sell green you fucking dumbass

(just talking to myself over here)",t3_j6o9s8,11
1602070538.0,2020-10-07,wallstreetbets,g7zqyox,We will literally just keep getting violently jerked higher then lower depending on how the steroids affect Donnies brain today.,t3_j6o9s8,10
1602070861.0,2020-10-07,wallstreetbets,g7zrbzf,I'm so confused how r we Green,t3_j6o9s8,11
1602070874.0,2020-10-07,wallstreetbets,g7zrchr,Losing makes me feel alive I wonder what winnings like,t3_j6o9s8,11
1602071094.0,2020-10-07,wallstreetbets,g7zrlmi,"So the market has been pumped up to the moon because of Stimulus, but when it is basically confirmed that it isn't coming, it only drops 1.4% and starts recovering the next day?",t3_j6o9s8,11
1602071289.0,2020-10-07,wallstreetbets,g7zrtit,"Nancy, can you hear me?

Nancy, can you see me?

Nancy, can you find me in the night?

Nancy, are you near me?

Nancy , can you hear me?

Nancy, can you help me not be frightened?

Looking at the skies I seem to see a million eyes, 
which ones are yours?

Where are you now that yesterday has waved goodbye and closed it doors?

The night is so much darker

The wind is so much colder

The world I see is so much bigger now that I'm alone

Nancy, please forgive me?

Try to understand me

Nancy, don't you know I had no choice?",t3_j6o9s8,11
1602072434.0,2020-10-07,wallstreetbets,g7zt6xx,"""Stonks rally on hopes of less than 10% of original stimulus money""",t3_j6o9s8,12
1602072601.0,2020-10-07,wallstreetbets,g7ztefb,Imagine how many people yolod puts after the trump tweet and didn’t take profit at all thinking we’d limit down overnight.,t3_j6o9s8,10
1602073063.0,2020-10-07,wallstreetbets,g7ztzn2,[deleted],t3_j6o9s8,9
1602073085.0,2020-10-07,wallstreetbets,g7zu0o0,"🥭 Man:  “Fuck your stimulus”

Also 🥭 Man:  “Psyche. Puuuuummmmp EETTT.” 

🌈 🐻 in shambles.  

This 🤡 on that good shit.",t3_j6o9s8,13
1602073565.0,2020-10-07,wallstreetbets,g7zunop,"I hate my job and I keep losing money on the market. 

Full circle baby",t3_j6o9s8,11
1602073830.0,2020-10-07,wallstreetbets,g7zv0rw,Ah fuck he got his phone back an hour before the market opens,t3_j6o9s8,12
1602074880.0,2020-10-07,wallstreetbets,g7zwj7h,And to think i *almost* bought puts yesterday 🤣🤡,t3_j6o9s8,10
1602074885.0,2020-10-07,wallstreetbets,g7zwjis,I knew buying puts yesterday made too much sense with this god damn meme market,t3_j6o9s8,12
1602075032.0,2020-10-07,wallstreetbets,g7zwsl8,"Imagine if Donnie actually got to nuke a hurricane. 

“WE DEFEATED STEPHANIE TODAY WITH OUR GREAT AMERICAN DEFENSE.”",t3_j6o9s8,11
1602075705.0,2020-10-07,wallstreetbets,g7zxw5f,"If this doesn't crash the market this week, nothing will",t3_j6o9s8,11
1602075757.0,2020-10-07,wallstreetbets,g7zxzef,I will keep repeating that this market is fake until my puts are ITM,t3_j6o9s8,13
1602075781.0,2020-10-07,wallstreetbets,g7zy0yi,"everyone in shambles, bears, bulls, theta... we are all fucked",t3_j6o9s8,12
1602076825.0,2020-10-07,wallstreetbets,g7zzvka,"trump’s twitter singlehandedly powering the VIX


why are any of us willing to trade rn lmao",t3_j6o9s8,11
1602076937.0,2020-10-07,wallstreetbets,g8002tw,Honestly the prudent move is to sit cash gang for the next month. But I have a gambling problem so 0dte SPY lottos is the way.,t3_j6o9s8,10
1602077041.0,2020-10-07,wallstreetbets,g8009va,[deleted],t3_j6o9s8,11
1602077071.0,2020-10-07,wallstreetbets,g800c0d,For once i bought the dip and it might actually pay off.,t3_j6o9s8,10
1602077084.0,2020-10-07,wallstreetbets,g800cwp,#EVERYTHING BIG GREEN 🤑,t3_j6o9s8,11
1602077318.0,2020-10-07,wallstreetbets,g800rp8,You know you're in the greatest economy in history when the mere suggestion that the government isn't going to inject another *few trillion dollars* into it within a month causes the fucking wheels to come off.,t3_j6o9s8,11
1602077571.0,2020-10-07,wallstreetbets,g8017sp,Institutions waiting for everyone here to FOMO back into calls 👁 👄 👁,t3_j6o9s8,11
1602077804.0,2020-10-07,wallstreetbets,g801nvo,Even the retards here know this is retarded,t3_j6o9s8,10
1602082424.0,2020-10-07,wallstreetbets,g80a5mz,Crazy how many Nikolas I've been seeing on the road lately. Great product,t3_j6o9s8,11
1602082511.0,2020-10-07,wallstreetbets,g80abob,"Damn, been 2 days and no response after my interview yet. Puts on my career",t3_j6o9s8,12
1602083057.0,2020-10-07,wallstreetbets,g80beh3,This guy at the DOJ looks like michael scott,t3_j6o9s8,11
1602083262.0,2020-10-07,wallstreetbets,g80bss8,Looks like they beat ISIS for the 10th Time.,t3_j6o9s8,11
1602084513.0,2020-10-07,wallstreetbets,g80eajp,We asked for this. Stimulus is a great example of how polarization gets nothing done. We voted for this.,t3_j6o9s8,10
1602084688.0,2020-10-07,wallstreetbets,g80en5y,Spy volume is horrendous,t3_j6o9s8,11
1602084957.0,2020-10-07,wallstreetbets,g80f64e,i WaS a FiNaNcE mAjOr,t3_j6o9s8,12
1602085305.0,2020-10-07,wallstreetbets,g80fv9f,"Holy shit AMD earnings are day of election.

What a play.",t3_j6o9s8,12
1602087028.0,2020-10-07,wallstreetbets,g80jdmx,These wild $.04 movements are just too much to handle,t3_j6o9s8,11
1602088752.0,2020-10-07,wallstreetbets,g80mupy,Guys I'm beginning to think AAPL is impotent,t3_j6o9s8,9
1602089345.0,2020-10-07,wallstreetbets,g80o2sb,"As soon as I hit $10k I'm liquidating half of my account, using that to pay off my debt and sitting tight until after the election.",t3_j6o9s8,10
1602090403.0,2020-10-07,wallstreetbets,g80q8ru,[deleted],t3_j6o9s8,11
1602090493.0,2020-10-07,wallstreetbets,g80qffi,AAPL 115 end of 2089!,t3_j6o9s8,10
1602091157.0,2020-10-07,wallstreetbets,g80rrra,[deleted],t3_j6o9s8,13
1602091454.0,2020-10-07,wallstreetbets,g80sdjp,just bought SPY puts so get ready to rocket guys,t3_j6o9s8,10
1602091615.0,2020-10-07,wallstreetbets,g80spfs,Everyone saying “this is boring” has puts 🤡,t3_j6o9s8,11
1602094384.0,2020-10-07,wallstreetbets,g80ygfp,"JPow: ""I'm worried about overvalued asset prices""

Me: *looks at PLTR calls and sighs*",t3_j6o9s8,11
1602094731.0,2020-10-07,wallstreetbets,g80z64v,Stock rise on stimulus hope. Stocks drop because no deal. Stock go higher than when stimulus was possible because the new stimulus will be better than last!!!,t3_j6o9s8,11
1602094765.0,2020-10-07,wallstreetbets,g80z8pd,This market starts to feel like Hyperinflation 🤡,t3_j6o9s8,11
1602094931.0,2020-10-07,wallstreetbets,g80zl1a,"man remember when stimulus freaked the market the fuck out?

its almost as if it was yesterday..",t3_j6o9s8,11
1602095788.0,2020-10-07,wallstreetbets,g811d10,"Trump: no stimulus

Market: the only stimulus I need is a 🥭 up my butt",t3_j6o9s8,11
1602096469.0,2020-10-07,wallstreetbets,g812s21,Do you want a rug pull? This retarded market is how you get a rug pull,t3_j6o9s8,12
1602096796.0,2020-10-07,wallstreetbets,g813gji,who lost money today?,t3_j6o9s8,11
1602097195.0,2020-10-07,wallstreetbets,g814b04,I really don’t see anywhere that trump is speaking.,t3_j6o9s8,11
1602097446.0,2020-10-07,wallstreetbets,g814tul,"IF YOU BOUGHT PUTS EOD YESTERDAY BUY TWICE AS MUCH TODAY

CANT GO WRONG!",t3_j6o9s8,11
1602098189.0,2020-10-07,wallstreetbets,g816da1,Remember when that dude went “Guh”,t3_j6o9s8,12
1602098202.0,2020-10-07,wallstreetbets,g816e75,today was a sector rotation from cash gang to stonk gang,t3_j6o9s8,10
1602098492.0,2020-10-07,wallstreetbets,g816ze0,I've been having dirty thoughts about Nancy Pelosi all day...,t3_j6o9s8,11
1602098579.0,2020-10-07,wallstreetbets,g8175yd,"calls on me boys quarantine was great, stimulus was great, unemployment was great, but I’m headed back into the workforce",t3_j6o9s8,11
1602098928.0,2020-10-07,wallstreetbets,g817vwh,[deleted],t3_j6o9s8,10
1602099189.0,2020-10-07,wallstreetbets,g818feh,[deleted],t3_j6o9s8,11
1602099302.0,2020-10-07,wallstreetbets,g818nsq,"#IT'S HAPPENING!

maybe",t3_j6o9s8,11
1602101866.0,2020-10-07,wallstreetbets,g81dw17,Ahhhh ok. I get it. Fuck my puts,t3_j6o9s8,10
1602114211.0,2020-10-07,wallstreetbets,g821njt,I would be up $7 grand if I could just leave my emotions out and hold my fucking positions,t3_j6o9s8,11
1602068554.0,2020-10-07,wallstreetbets,g7zowg4,I am so fucking mad fuck this,t3_j6o9s8,33
1602069119.0,2020-10-07,wallstreetbets,g7zpgfr,Lets report 🥭 man for market manipulation,t3_j6o9s8,59
1602076970.0,2020-10-07,wallstreetbets,g80053x,This dude struck a deal with himself and has now thanked himself. He’s too retarded even for this place.,t3_j6o9s8,48
1602067683.0,2020-10-07,wallstreetbets,g7zo2rs,[deleted],t3_j6o9s8,20
1602070909.0,2020-10-07,wallstreetbets,g7zrdxz,"TSLA passing 420, for like the 3000th time this year.",t3_j6o9s8,21
1602079764.0,2020-10-07,wallstreetbets,g8056c0,"I would like to thank the random dude in India who I would WhatsApp the pics of exams and he'd send me back answers for a small fee of $40. Also wrote my papers for me too. It wouldn't have been possible without you, Bhinesh.",t3_j6o9s8,21
1602081885.0,2020-10-07,wallstreetbets,g8094b1,"The entire U.S. has been leveled by a Nuclear strike. There is no economy any more, no jobs, no way of life. There is only survival, and suffering.

The internet exists only through a miraculous connection of telephone lines, lines that haven't been used since the early 2000s. The few thousands of people still alive know only suffering, only pain.

In other News, stocks reached an all time high today, up 3% on fallout clean up hopes.",t3_j6o9s8,20
1602085264.0,2020-10-07,wallstreetbets,g80fs9d,An exercise machine company with iPads on it. 33b company now. Wtffffff,t3_j6o9s8,20
1602088748.0,2020-10-07,wallstreetbets,g80muf6,[deleted],t3_j6o9s8,20
1602101876.0,2020-10-07,wallstreetbets,g81dwrr,"Jesus Christ, I got laid off a month ago, and I’ve already made my annual earnings after taxes in only a span of a week thanks to options",t3_j6o9s8,20
1602080164.0,2020-10-07,wallstreetbets,g805wci,"I've lost well over $150,000 from not taking profit from winning positions and then watching them crumble down to nothing. Now watching 🐢🐢🐢 do the exact same thing. When will I fucking learn?",t3_j6o9s8,20
1602066301.0,2020-10-07,wallstreetbets,g7zmst1,[removed],t3_j6o9s8,10
1602070515.0,2020-10-07,wallstreetbets,g7zqxpr,"bruh ... all these tweets to bump pre-market is going to fall off the cliff 

there is zero chance that grandma will change a hardcore decision she has taken for last few months",t3_j6o9s8,10
1602071835.0,2020-10-07,wallstreetbets,g7zsgjj,"BREAKING: 

FUTURES RISE ON HOPES OF MORE BUYS THAN SELLS FOR THE DAY",t3_j6o9s8,10
1602071882.0,2020-10-07,wallstreetbets,g7zsimr,[deleted],t3_j6o9s8,10
1602071972.0,2020-10-07,wallstreetbets,g7zsmkd,"had a double stream just now that i skillfully managed into the bowl.

Calls",t3_j6o9s8,10
1602072317.0,2020-10-07,wallstreetbets,g7zt1s7,I miss the old Kanye.,t3_j6o9s8,11
1602072375.0,2020-10-07,wallstreetbets,g7zt4bk,It's just bouncing up and down every day to collect our premium,t3_j6o9s8,10
1602072396.0,2020-10-07,wallstreetbets,g7zt5ar,DKNG drops to 50 I'm going hard on leaps,t3_j6o9s8,10
1602072737.0,2020-10-07,wallstreetbets,g7ztklg,[deleted],t3_j6o9s8,10
1602073590.0,2020-10-07,wallstreetbets,g7zuox2,If JPOW doesn’t get the Nobel Prize in Economic Sciences on Friday I will riot.,t3_j6o9s8,10
1602073675.0,2020-10-07,wallstreetbets,g7zut3c,Christ Donnie it’s 830am. Eat your toast and chill with the twitter,t3_j6o9s8,10
