created,date,subreddit,id,body,parent_id,score
1596819708.0,2020-08-07,wallstreetbets,g0p5tcj,"AAPL up 20% in a week: ""I am ok with this and do not question it whatsoever""

AAPL down 2% in a day: ""OMG WTF IS HAPPENING REEEEE""",t3_i5b9o9,11
1596819724.0,2020-08-07,wallstreetbets,g0p5ujw,Imagine being a senator or congressman and getting paid 6 figures to do nothing. JFC the incompetence of our government while they suck the working class dry and left to bleed.,t3_i5b9o9,13
1596820961.0,2020-08-07,wallstreetbets,g0p8ij2,"I put 100% of my account in tsla puts and I'm down
 25% in about 3 minutes :)",t3_i5b9o9,12
1596821013.0,2020-08-07,wallstreetbets,g0p8mil,I’ve lost so much money these past 2 months. Need a break. See you guys Monday!,t3_i5b9o9,13
1596822779.0,2020-08-07,wallstreetbets,g0pci66,[deleted],t3_i5b9o9,12
1596822876.0,2020-08-07,wallstreetbets,g0pcq6y,I predicted everything that happened today. And I still lost money. Fuck me sideways,t3_i5b9o9,12
1596822989.0,2020-08-07,wallstreetbets,g0pczfg,Fuck my shitty fucking life.,t3_i5b9o9,12
1596823971.0,2020-08-07,wallstreetbets,g0pf34k,"Started trading in may adding in 100 here and 100 there buying stocks and selling for small gains. Invested up to $500, turned that into $1000, lost back down to $750. Joined in on kodak turned that into $1400, made some more plays and in a week Ive made $10k. Would have had $15k this morning had I not been so greedy with my fb call this morning. 

I expect to lose this all soon but this is a good feeling right now. Luv u guys.",t3_i5b9o9,10
1596824187.0,2020-08-07,wallstreetbets,g0pfjjf,"Oh well

*its just money*",t3_i5b9o9,11
1596826251.0,2020-08-07,wallstreetbets,g0pjw7w,whats funny is today about 1030am i got in an argument with my mother over the  stock market her trying to tell me to be careful. so  now im mad  at her too,t3_i5b9o9,11
1596827775.0,2020-08-07,wallstreetbets,g0pn3j7,this market is emotionally exhausting,t3_i5b9o9,12
1596828064.0,2020-08-07,wallstreetbets,g0pnpzd,Idk about term limits. But there should sure as hell be age limits in Congress. A bunch of wrinkly ass wealthy dinosaurs determining how much yolo money they gonna give us.,t3_i5b9o9,12
1596828112.0,2020-08-07,wallstreetbets,g0pntm5,I wish Robinhood had 0DTE ... not a fan of having them selling my options at 1 hour before close when all the action happens 10 minutes before close ... time to plan better.,t3_i5b9o9,12
1596828140.0,2020-08-07,wallstreetbets,g0pnvqd,***House Speaker Pelosi says difference with White House is over food aide; WH and Democrats still far apart***,t3_i5b9o9,11
1596828830.0,2020-08-07,wallstreetbets,g0ppc4z,"They just need to get the stim checks out so everyone at home can by warzone passes 

My ATVI calls are on their deathbed 😓",t3_i5b9o9,14
1596828865.0,2020-08-07,wallstreetbets,g0ppew4,I heard every flash from a KODK camera cures everyone with Covid within 20ft.,t3_i5b9o9,13
1596828968.0,2020-08-07,wallstreetbets,g0ppmk9,50% of my portfolio is in SLV right now and I feel like such a boomer,t3_i5b9o9,13
1596829159.0,2020-08-07,wallstreetbets,g0pq0zu,Some guy in Webull commented on MSFT saying he didn't know whether or not to hold or sell his calls because he's new at it. I asked him what strike and date and I shit you not it's $220 8/7 LOL,t3_i5b9o9,11
1596830083.0,2020-08-07,wallstreetbets,g0prz9x,Ready up for SLV on Monday?? Im loaded as fuck,t3_i5b9o9,11
1596799881.0,2020-08-07,wallstreetbets,g0nyoug,[deleted],t3_i5b9o9,24
1596804725.0,2020-08-07,wallstreetbets,g0o8614,">LABOR STATISTICS BUREAU EVALUATING JOBS MISCLASSIFICATION ISSUE

LMAO so the numbers are actually cooked....",t3_i5b9o9,25
1596797094.0,2020-08-07,wallstreetbets,g0nupm6,I'm still puzzled on why I have to do an 'options trading' test when I started trading on IBKR but any retard can just download Robinhood and hit 'buy 100 0DTE SPY $350' without any knowledge whatsover,t3_i5b9o9,10
1596797838.0,2020-08-07,wallstreetbets,g0nvi42,The good thing about inflation is your debts don't seem so big anymore.,t3_i5b9o9,12
1596798459.0,2020-08-07,wallstreetbets,g0nwbbt,[deleted],t3_i5b9o9,10
1596800235.0,2020-08-07,wallstreetbets,g0nzagv,"Holding onto my SLV calls that expire next Friday, a pullback was needed. If you’re going to panic sell then maybe this market wasn’t made for you",t3_i5b9o9,10
1596800336.0,2020-08-07,wallstreetbets,g0nzh1q,It feels good to not have an option expiring until October,t3_i5b9o9,11
1596800702.0,2020-08-07,wallstreetbets,g0o03cc,"How to be a billionaire

Step 1: Get really good at Photoshop

Step 2: Photoshop yourself as very fat 

Step 3: Start an Instagram dedicated to health and wellness with a lot of your progress pics 

Step 4: Start charging people to access your ""secret"" weight loss tips which are just basic fitness and diet advice 

Step 5: Start touring and giving motivational speeches 

Step 6: Dump all your millions into tech stocks, sit back, and relax",t3_i5b9o9,12
1596801472.0,2020-08-07,wallstreetbets,g0o1idb,Anyone buying some RKT this morning?,t3_i5b9o9,12
1596802586.0,2020-08-07,wallstreetbets,g0o3pm0,$RKT  is going vertical premarket,t3_i5b9o9,12
1596802937.0,2020-08-07,wallstreetbets,g0o4fhi,"If i have one regret in life, its i only bought 100 shares of RKT when it opened",t3_i5b9o9,10
1596803164.0,2020-08-07,wallstreetbets,g0o4vtp,"Everything else bigly red, may have to fomo into RKT and join you morons",t3_i5b9o9,13
1596804270.0,2020-08-07,wallstreetbets,g0o76v2,WHERE MY FUCKEN BEARS AT?!? WAKE UP AND ROARRRRR 🌈🐻,t3_i5b9o9,11
1596804593.0,2020-08-07,wallstreetbets,g0o7vr1,"fuck


we need stimulus


it would destroy the bears",t3_i5b9o9,11
1596804838.0,2020-08-07,wallstreetbets,g0o8ewu,"I’m getting into silver today all in 

No more Prpl, CVS, ATVI   🤡

Heavy Metals GANG",t3_i5b9o9,11
1596804977.0,2020-08-07,wallstreetbets,g0o8pzc,China acts shocked when we ban their social media app but China bans U.S. social media and sees nothing wrong with that....literal idiots,t3_i5b9o9,10
1596805022.0,2020-08-07,wallstreetbets,g0o8tjt,Sold SLV to secure profit yesterday. Re enter on morning dip today? Thanks! Reee,t3_i5b9o9,11
1596805236.0,2020-08-07,wallstreetbets,g0o9a8t,"This deal ain't getting done,  mitchy has his floaties packed for summer camp he's not looking back",t3_i5b9o9,11
1596805851.0,2020-08-07,wallstreetbets,g0oalpc,"Just bought more RKT.

Doing my part guys!",t3_i5b9o9,11
1596805935.0,2020-08-07,wallstreetbets,g0oasbo,Market red? DOESNT MATTER TO US RKT BOYS,t3_i5b9o9,11
1596806273.0,2020-08-07,wallstreetbets,g0objq9,Mmm about to be real poor in about 13 min,t3_i5b9o9,10
1596808572.0,2020-08-07,wallstreetbets,g0ogp7n,Lol of course I buy RKT and it fucking rockets down,t3_i5b9o9,11
1596808734.0,2020-08-07,wallstreetbets,g0oh1xx,RKT is a long hold. Mortgage industry holding strong.,t3_i5b9o9,11
1596809000.0,2020-08-07,wallstreetbets,g0ohnpd,Man SLV doing me dirty 😭,t3_i5b9o9,11
1596810450.0,2020-08-07,wallstreetbets,g0okxg9,[deleted],t3_i5b9o9,11
1596811565.0,2020-08-07,wallstreetbets,g0onf3s,Who bought that SLV dip?,t3_i5b9o9,12
1596812573.0,2020-08-07,wallstreetbets,g0opz1a,Just went all in on SLV. this can’t go tits up right???,t3_i5b9o9,11
1596813980.0,2020-08-07,wallstreetbets,g0ot6u6,If we get another FB leg down I might commit silantro,t3_i5b9o9,11
1596815114.0,2020-08-07,wallstreetbets,g0ovt9q,Lol my 2k Facebook fomo gains were stripped from me in the matter of minutes. So fuckin gay,t3_i5b9o9,13
1596815823.0,2020-08-07,wallstreetbets,g0oxh2p,"Dips that were not, in fact, free money:

INTC

HSBC

FSLY",t3_i5b9o9,10
1596817530.0,2020-08-07,wallstreetbets,g0p195m,ok gg everyone its not happenin these old farts are all too proud imagine being like 900 years old and still bieng a petty cunt,t3_i5b9o9,12
1596817608.0,2020-08-07,wallstreetbets,g0p1es4,Remember when the market had actual reactions to things? Now it sucks up any news and shits green with some speckles of red if it eats the spicy memes.,t3_i5b9o9,12
1596818496.0,2020-08-07,wallstreetbets,g0p38ys,This thread is hot garbage right now.,t3_i5b9o9,10
1596818809.0,2020-08-07,wallstreetbets,g0p3x1z,"SPY up, whole watchlist is red, can’t explain that",t3_i5b9o9,11
1596819390.0,2020-08-07,wallstreetbets,g0p54d9,"Down $20K, this is fine! 🙃",t3_i5b9o9,12
1596819810.0,2020-08-07,wallstreetbets,g0p61ba,"made $1700 yesterday, lost $1200 so far today",t3_i5b9o9,10
1596820564.0,2020-08-07,wallstreetbets,g0p7orn,"Market prices in 3T stimulus

*No stimulus*

Ahh thats ok youll get em next time champ well park it right here for ya",t3_i5b9o9,10
1596820770.0,2020-08-07,wallstreetbets,g0p84by,I picked the wrong day to stop sniffing glue,t3_i5b9o9,12
1596821166.0,2020-08-07,wallstreetbets,g0p8xxo,"Lost about 10k this week, drinks on u boys",t3_i5b9o9,11
1596821497.0,2020-08-07,wallstreetbets,g0p9n58,I’m so fucking bad at this,t3_i5b9o9,12
1596821683.0,2020-08-07,wallstreetbets,g0pa0y2,Everyone wants a dip until it actually comes,t3_i5b9o9,11
1596822396.0,2020-08-07,wallstreetbets,g0pbmtr,I’m in danger,t3_i5b9o9,11
1596822769.0,2020-08-07,wallstreetbets,g0pchcp,The euphoria is making many of you bulls lose sight of imminent danger.,t3_i5b9o9,11
1596824503.0,2020-08-07,wallstreetbets,g0pg72h,I'm bleeding PRPL ☠,t3_i5b9o9,12
1596827332.0,2020-08-07,wallstreetbets,g0pm5b3,"Listen fat, if you ain’t loaded up on SPY and AAPL calls you ain’t black",t3_i5b9o9,10
1596827621.0,2020-08-07,wallstreetbets,g0pmrrp,Mnuchin rejected a split-the-difference bill? Stimulus genuinely fucked. Price discovery fucked. Market fucked.,t3_i5b9o9,12
1596828349.0,2020-08-07,wallstreetbets,g0pobi5,wtf is this fake and gay uppity down shit,t3_i5b9o9,11
1596828401.0,2020-08-07,wallstreetbets,g0poff7,Sigh...another Friday that my 100$ to millionaire FD's didn't print.  Fuck this market..nothing makes sense.  Feels like gambling.,t3_i5b9o9,11
1596828602.0,2020-08-07,wallstreetbets,g0pout9,"Donald Pump: Executive order to stimulate WSB autists with $1,200 stimulus checks!!!",t3_i5b9o9,10
1596828693.0,2020-08-07,wallstreetbets,g0pp1vu,Calls on civil unrest and broad based economic despair,t3_i5b9o9,10
1596829245.0,2020-08-07,wallstreetbets,g0pq7ho,[deleted],t3_i5b9o9,10
1596829263.0,2020-08-07,wallstreetbets,g0pq8vz,"no stimulus = bullish  


bears lol",t3_i5b9o9,11
1596829298.0,2020-08-07,wallstreetbets,g0pqblr,Can’t even get a proper red day lmao,t3_i5b9o9,12
1596830826.0,2020-08-07,wallstreetbets,g0ptixe,these geniuses in congress take two weeks to figure out that they need to meet halfway between $3T and $1T at $2T in stimulus 🤦‍♂️,t3_i5b9o9,11
1596830951.0,2020-08-07,wallstreetbets,g0pts2g,[deleted],t3_i5b9o9,12
1596805076.0,2020-08-07,wallstreetbets,g0o8xpr,**BREAKING: Purple Innovations buys out Apple to manufacture mattresses with built-in iPhones**,t3_i5b9o9,36
1596798327.0,2020-08-07,wallstreetbets,g0nw3mg,[deleted],t3_i5b9o9,19
1596801874.0,2020-08-07,wallstreetbets,g0o2adz,[deleted],t3_i5b9o9,21
1596814726.0,2020-08-07,wallstreetbets,g0ouwku,It’s my birthday and I haven’t told anyone probably won’t but I’ll tell you guys. Hope y’all get some tendies today for me,t3_i5b9o9,22
1596795631.0,2020-08-07,wallstreetbets,g0nt7rd,Silver please,t3_i5b9o9,9
1596796726.0,2020-08-07,wallstreetbets,g0nubn6,I feel like a boomer buying that silver dip,t3_i5b9o9,9
1596798759.0,2020-08-07,wallstreetbets,g0nwt5c,SLV gang?,t3_i5b9o9,9
1596801084.0,2020-08-07,wallstreetbets,g0o0r3m,All these FOMOers asking if they should throw a couple G’s into SLV and acting like they’re going to hold thru the next dip and not have shitstained hands that let precious metals slip through them like butter. Somebody is going to take your tendies and leave you with those poop hands for sure.,t3_i5b9o9,10
1596801594.0,2020-08-07,wallstreetbets,g0o1qti,COUNTRY ROADS TAKE ME HOME,t3_i5b9o9,9
1596802393.0,2020-08-07,wallstreetbets,g0o3bd9,I understand the concerns with TikTok but an executive order is not the way to remedy them. Pass a law that says data needs to be stored in US and no back doors to China or it’s banned. It’s short sighted to stoop down to their level. The reason US is #1 is precisely because our open capitalistic market. More importantly China is going to retaliate which will mess up my QQQ calls.,t3_i5b9o9,9
1596802466.0,2020-08-07,wallstreetbets,g0o3gw7,CALLING ALL SILVER GANG. REPORT TO THE LAUNCH SITE WE GOING MOON,t3_i5b9o9,9
1596802530.0,2020-08-07,wallstreetbets,g0o3lfw,[deleted],t3_i5b9o9,10
1596802977.0,2020-08-07,wallstreetbets,g0o4hyi,Red days are illegal,t3_i5b9o9,9
1596803067.0,2020-08-07,wallstreetbets,g0o4ofo,SLV green end of day,t3_i5b9o9,11
1596803137.0,2020-08-07,wallstreetbets,g0o4twk,[deleted],t3_i5b9o9,12
1596803500.0,2020-08-07,wallstreetbets,g0o5kw9,bruh these fucking bears cant win lmao,t3_i5b9o9,10
1596803657.0,2020-08-07,wallstreetbets,g0o5wnk,Red days are illegal.  It’s not a meme if it’s true.,t3_i5b9o9,11
1596803731.0,2020-08-07,wallstreetbets,g0o627u,Are we in a stock market cold war with china,t3_i5b9o9,12
1596803764.0,2020-08-07,wallstreetbets,g0o64nj,Papper handed half of my RKT shares yesterday because I hate money 🤡🤡,t3_i5b9o9,10
1596803788.0,2020-08-07,wallstreetbets,g0o66kf,1.8 out of 30million+.  At this rate we will be done in a year and a half.,t3_i5b9o9,11
1596803857.0,2020-08-07,wallstreetbets,g0o6boa,I can’t help but crack up how retarted this is even as a bear,t3_i5b9o9,9
1596804589.0,2020-08-07,wallstreetbets,g0o7vga,July 13th to today I have slowly bled out about 5k not a single green day to be found.  Not even like $1.  And today is about to be the worst day by far.,t3_i5b9o9,9
1596805375.0,2020-08-07,wallstreetbets,g0o9l0i,SLV is gonna hit 30 now,t3_i5b9o9,11
1596805722.0,2020-08-07,wallstreetbets,g0oabie,i kind of hate myself for only buying 100 shares of RKT,t3_i5b9o9,9
1596805843.0,2020-08-07,wallstreetbets,g0oal32,Massive volume on RKT pre-market. Huge pump incoming. Hold on to your boosters.,t3_i5b9o9,10
1596806263.0,2020-08-07,wallstreetbets,g0obiqy," https://twitter.com/DeItaOne/status/1291725096604884994?s=20 

 U.S. POISED TO SANCTION HONG KONG CHIEF LAM OVER CRACKDOWN",t3_i5b9o9,10
1596806617.0,2020-08-07,wallstreetbets,g0ocb6v,About time for a vaccine rumor...,t3_i5b9o9,10
1596806654.0,2020-08-07,wallstreetbets,g0oce0q,"there is no war in Bai Sing Tse.

there is no red in NASDAQ",t3_i5b9o9,11
1596806678.0,2020-08-07,wallstreetbets,g0ocfrm,SLV took a dive the worst it’s seen in months over the night. And it’s still at prices around 1:30 yesterday. What a fucking crazy metal.,t3_i5b9o9,10
1596808163.0,2020-08-07,wallstreetbets,g0ofrm0,"congress be like: ""why should I have to work when nobody else is working?""",t3_i5b9o9,10
1596808474.0,2020-08-07,wallstreetbets,g0oggwl,Bought rkt at 25.50 ama,t3_i5b9o9,9
1596808705.0,2020-08-07,wallstreetbets,g0ogzlj,The way I know SLV is red is when 80% of this thread stops shilling SLV,t3_i5b9o9,9
1596809294.0,2020-08-07,wallstreetbets,g0oicbr,Oh yes Silver I didnt want money anyways,t3_i5b9o9,10
1596810083.0,2020-08-07,wallstreetbets,g0ok3gn,I’ve been fucked more by options than by my wife,t3_i5b9o9,10
1596810177.0,2020-08-07,wallstreetbets,g0okazo,Metals are a long play for all you dipshits. Don’t buy weeklies and get mad when it does this. You’re also a dumbass if you are holding weeklies and didn’t sell yesterday.,t3_i5b9o9,11
1596810179.0,2020-08-07,wallstreetbets,g0okb3b,[deleted],t3_i5b9o9,10
1596810267.0,2020-08-07,wallstreetbets,g0okil2,SLV forming the “WSB went all in on weekly OTM calls” pattern,t3_i5b9o9,9
1596810409.0,2020-08-07,wallstreetbets,g0okubw,"Market is down -.5%

WSB: Here it is. This is the correction.",t3_i5b9o9,9
1596810548.0,2020-08-07,wallstreetbets,g0ol5n7,WSB ruined SLV,t3_i5b9o9,9
1596810610.0,2020-08-07,wallstreetbets,g0olaii,[deleted],t3_i5b9o9,11
1596811341.0,2020-08-07,wallstreetbets,g0omx8b,"# 🚨GRAB YOUR SPACESUITS, FACEBOOK TAKING AUTIST ON MOON MISSIONS🚨",t3_i5b9o9,10
1596812613.0,2020-08-07,wallstreetbets,g0oq2jj,SLV climbing back up 👀,t3_i5b9o9,10
1596813351.0,2020-08-07,wallstreetbets,g0ors8b,Hey Algos! I dare you to pump AAPL to 480! I have tons of puts.,t3_i5b9o9,9
1596813415.0,2020-08-07,wallstreetbets,g0orxle,"I’m liking this RKT consolidation, could moon soon",t3_i5b9o9,9
1596814208.0,2020-08-07,wallstreetbets,g0otph5,"Ugh, are we holding RKT? My money is itching to be moved to something far less responsible.",t3_i5b9o9,11
1596814403.0,2020-08-07,wallstreetbets,g0ou5jm,"I already know, Trumps just waiting for me to sell my calls to get this summ bitch signed",t3_i5b9o9,9
1596814589.0,2020-08-07,wallstreetbets,g0oul07,"Made 1k off of FB calls this morning, sold at 275 & bought puts. If I somehow finesse profiting off of both I’ll quit forever",t3_i5b9o9,10
1596814709.0,2020-08-07,wallstreetbets,g0ouv4s,Theyve gotta stop announcing these pelosi/schumer conferences lol.. literally shits the market,t3_i5b9o9,11
1596814754.0,2020-08-07,wallstreetbets,g0ouz30,1000 shares of RKT here,t3_i5b9o9,10
1596814890.0,2020-08-07,wallstreetbets,g0ovaqu,Message me when slv is mooning,t3_i5b9o9,10
1596814968.0,2020-08-07,wallstreetbets,g0ovh9p,wow i single-handedly stopped that FB drop by buying puts. amazing,t3_i5b9o9,10
1596815985.0,2020-08-07,wallstreetbets,g0oxuhj," [https://www.youtube.com/watch?v=OZgiPNYThaw](https://www.youtube.com/watch?v=OZgiPNYThaw) 

 

# LIVE: Nancy Pelosi and Chuck Schumer hold news conference on coronavirus aid bill",t3_i5b9o9,9
1596816297.0,2020-08-07,wallstreetbets,g0oykg8,FB please stop I'm already dead,t3_i5b9o9,10
1596816300.0,2020-08-07,wallstreetbets,g0oykok,I’m straight up not having a good time today,t3_i5b9o9,10
1596816682.0,2020-08-07,wallstreetbets,g0ozf1x,GO SLV GO,t3_i5b9o9,9
1596817362.0,2020-08-07,wallstreetbets,g0p0wao,Pelosi is New Scarf Lady.,t3_i5b9o9,10
1596817594.0,2020-08-07,wallstreetbets,g0p1dtb,The nerve of our country to give us credit scores lmaooo,t3_i5b9o9,10
1596817820.0,2020-08-07,wallstreetbets,g0p1uh5,Holy shit! Amy Schumer’s uncle is on TV!,t3_i5b9o9,11
1596818093.0,2020-08-07,wallstreetbets,g0p2ev8,7k on SLV. Sorry guys if it dip,t3_i5b9o9,11
1596818837.0,2020-08-07,wallstreetbets,g0p3z4s,Wow Activision has officially destroyed my portfolio. Rip,t3_i5b9o9,11
1596819465.0,2020-08-07,wallstreetbets,g0p59yp,"lol AMC reported 99% loss in revenue Q2 yoy ($1.51b -> $19mil)

Currently up 5.5% on a market red day",t3_i5b9o9,10
1596820033.0,2020-08-07,wallstreetbets,g0p6ise,"That moment when it is disclosed that J Powell doubled his money compared to 2019, thanks to BlackRock handling his account:

2019 financial disclosure, networth $11M: 

[https://extapps2.oge.gov/201/Presiden.nsf/PAS+Index/B7B81E8D7ED5CA51852584040027DABB/$FILE/Jerome-H-Powell-2019-278.pdf](https://extapps2.oge.gov/201/Presiden.nsf/PAS+Index/B7B81E8D7ED5CA51852584040027DABB/$FILE/Jerome-H-Powell-2019-278.pdf)

2020 financial disclosure, networth $24M:

[https://extapps2.oge.gov/201/Presiden.nsf/PAS+Index/5B86DBF3EBE069DB8525857F0027DBD0/$FILE/Jerome-H-Powell-2020-278.pdf](https://extapps2.oge.gov/201/Presiden.nsf/PAS+Index/5B86DBF3EBE069DB8525857F0027DBD0/$FILE/Jerome-H-Powell-2020-278.pdf)",t3_i5b9o9,9
1596820142.0,2020-08-07,wallstreetbets,g0p6rg5,Up 21k yesterday. Down 20k today. 😃,t3_i5b9o9,10
1596820603.0,2020-08-07,wallstreetbets,g0p7rr8,"fuck off and let this shit dump. jfc, not every dip needs to get bought back up instantly",t3_i5b9o9,10
1596820972.0,2020-08-07,wallstreetbets,g0p8jb4,Amazon puts I sold earlier up 200%. Apple calls I bought down 70%. Yeah I’m all kinds of sad now. I’m just gonna not look at my portfolio for a while. This shit is a mindfuck. Been holding puts for last 4 days and boom I switch like an idiot after that run up.,t3_i5b9o9,10
1596821171.0,2020-08-07,wallstreetbets,g0p8ych,How is SPY only down $1? Everything is blown the fuck up.,t3_i5b9o9,10
1596821577.0,2020-08-07,wallstreetbets,g0p9t2y,"SPY went from 323 to 296 the last time it was overbought on the 4hr.

QQQ went from 269 to 252.

IWM went from 153 to 133.

This shit doesn't matter because the market is a mouth breathing retard, but it's interesting nonetheless.",t3_i5b9o9,9
1596821839.0,2020-08-07,wallstreetbets,g0paddb,If you didn’t buy AAPL calls you hate money,t3_i5b9o9,10
1596822023.0,2020-08-07,wallstreetbets,g0pase4,I bet 90% this chat got greedy and didn’t sell while they were up.,t3_i5b9o9,10
1596822229.0,2020-08-07,wallstreetbets,g0pb9a4,"shares down, calls down, me down :(",t3_i5b9o9,11
1596822909.0,2020-08-07,wallstreetbets,g0pcssy,AND YET VIX ISNT GREEN LMAOOO,t3_i5b9o9,10
1596823018.0,2020-08-07,wallstreetbets,g0pd1u2,This dip is faker than my ex-wife’s tits,t3_i5b9o9,10
1596823073.0,2020-08-07,wallstreetbets,g0pd66e,my god the bears fucking won,t3_i5b9o9,9
1596823878.0,2020-08-07,wallstreetbets,g0pewbe,"Bulls “buying the dip” and whining when it’s barely even crashing. Stfu

My Puts Went from -99% to -98.9%",t3_i5b9o9,10
1596823986.0,2020-08-07,wallstreetbets,g0pf494,Who else holding SLV calls over the weekend?,t3_i5b9o9,12
1596824185.0,2020-08-07,wallstreetbets,g0pfjcj,"Y’all can check some of my comment history in here if you want but I’ve talked about my buddy a lot. 

He sold silver Aug 3rd. 

He lost money during spy puts in March. 

He lost money on Apple and MSFT just now too. 

He bought AYX two days ago.   Go check out that week chart guys. Just go look.  


He also just sold SPY calls so if you want free money.. spy calls 340spy 8/28 calls lol",t3_i5b9o9,9
1596824528.0,2020-08-07,wallstreetbets,g0pg8w1,i think the dip is buying me now,t3_i5b9o9,11
1596825073.0,2020-08-07,wallstreetbets,g0phetl,Ima kill myself,t3_i5b9o9,11
1596825189.0,2020-08-07,wallstreetbets,g0phoau,"Try to remember, this happens every couple of weeks and the next day no one even talks about it like it never even happened. Why would this time be any different?",t3_i5b9o9,10
1596825386.0,2020-08-07,wallstreetbets,g0pi3g8,[deleted],t3_i5b9o9,9
1596826032.0,2020-08-07,wallstreetbets,g0pjfqg,"I have a feeling its gonna be a bad dump eod. Nothing looking good. So many shooting, robbing and stabbing in my city",t3_i5b9o9,11
1596826269.0,2020-08-07,wallstreetbets,g0pjxl4,"Rule #1: Get your balance to at least $25k

Rule #2: Maintain your balance at/above $25k

Rule #3: Start back at Rule #1 you gambling fktard",t3_i5b9o9,11
1596826715.0,2020-08-07,wallstreetbets,g0pkv1k,I legitimately believe in RKT I just want it to cool off before I touch it. That shit will be 300$ a share minimum in less than a year.,t3_i5b9o9,9
1596826884.0,2020-08-07,wallstreetbets,g0pl7zo,"Up $4,000 this morning and now down $14,000. I swear to god the MMs watch this sub and fuck us when we making too many tendies",t3_i5b9o9,10
1596827262.0,2020-08-07,wallstreetbets,g0pm04s,"2% away from all time highs, tech companies increasing 400% in the past 3 months, pandemic still getting worse, possible Canada trade war, possible miss on a stimulus package:

SPY -0.20% on its first noticeable drop in a couple of weeks.

Next week: ""Vaccine bubbles spelled 'SPY UPPIES' during manufacture process""

SPY +2.13% probably.",t3_i5b9o9,9
1596828095.0,2020-08-07,wallstreetbets,g0pnsdu,I'd be buying calls on my way into a bunker before I lost service after nuclear war were declared in this market,t3_i5b9o9,10
1596828133.0,2020-08-07,wallstreetbets,g0pnv63,Robinhood not letting me sell anything!,t3_i5b9o9,11
1596828442.0,2020-08-07,wallstreetbets,g0poiit,Did Drill Team 6 get stuck in the elevator?,t3_i5b9o9,10
1596828454.0,2020-08-07,wallstreetbets,g0pojel,Lost 7k on put credit spreads with AMZN by selling at the bottom AMA,t3_i5b9o9,11
1596828558.0,2020-08-07,wallstreetbets,g0porb5,"Fuck every other stock, SLV and GLD are my friends now",t3_i5b9o9,11
1596828648.0,2020-08-07,wallstreetbets,g0poyge,I am weak. My hands? Paper. My Losses? Diamond High. My portfolio? $ROPED,t3_i5b9o9,8
1596828986.0,2020-08-07,wallstreetbets,g0ppnuq,Fucking RH is killing me.,t3_i5b9o9,11
1596828986.0,2020-08-07,wallstreetbets,g0ppnvz,RH is so garbage lmao. I have a purchase of $30 worth of stocks that has been pending for like an hour. I wish I was a big boy using a different platform.,t3_i5b9o9,12
1596829486.0,2020-08-07,wallstreetbets,g0pqpz3,jesus fucking christ i hate this game,t3_i5b9o9,11
1596829578.0,2020-08-07,wallstreetbets,g0pqx98,LMAO SPY greeeeen,t3_i5b9o9,9
1596830289.0,2020-08-07,wallstreetbets,g0psepz,only lost $600 this week 🙂,t3_i5b9o9,10
1596830705.0,2020-08-07,wallstreetbets,g0pt9yd,[deleted],t3_i5b9o9,10
1596830825.0,2020-08-07,wallstreetbets,g0ptiup,"Lost $10,000 on my ATVI calls today because of Trump, thank you",t3_i5b9o9,10
1596830997.0,2020-08-07,wallstreetbets,g0ptvl6,"-7k from amzn 0dte calls today rofl..

switched to puts too late.

think i was -10k at one point so... could have been worst?

wiped entire week of scalping gain which was about 1-2k per day leading up to today. oof.",t3_i5b9o9,10
1596831628.0,2020-08-07,wallstreetbets,g0pv5vx,490C AAPL 08/28,t3_i5b9o9,9
1596832239.0,2020-08-07,wallstreetbets,g0pwfui,"I didn't sell Cloudflare at $45 this morning, now it's $40. Fuck this market",t3_i5b9o9,10
1596832555.0,2020-08-07,wallstreetbets,g0px36l,[deleted],t3_i5b9o9,9
1596828640.0,2020-08-07,wallstreetbets,g0poxqz,[removed],t3_i5b9o9,22
1596795937.0,2020-08-07,wallstreetbets,g0ntj01,Daily reminder that if you don't yolo your 5x leveraged life savings into this SLV dip you only have yourself to blame.,t3_i5b9o9,18
1596803712.0,2020-08-07,wallstreetbets,g0o60re,[deleted],t3_i5b9o9,19
