date,subreddit,id,body,parent_id,score
2019-11-05,wallstreetbets,f6lweep,Just got off the phone with Schwab.  They won't agree to match Robinhood's unlimited margin.,t3_drxo17,100
2019-11-05,wallstreetbets,f6lrqm7,Theory: Jerome Powell discretely implements QE4 through RobinHood margin expansion.,t3_drxo17,90
2019-11-05,wallstreetbets,f6lvbio,"Finally tried Shake Shack yesterday. I got the basic burger, fries, and a drink. My total was $17.55. $17.55!!!!!!! And burger was tiny. So I just paid nearly $80 for my family of 4 for one shitty fast food meal. No wonder this piece of shit company tanked 20%",t3_drxo17,70
2019-11-05,wallstreetbets,f6lq7sv,"Lol the robinhood cheat made it to r/all

Grabbing my 🍿to watch the inevitable legal shitshow

Well done WSBs",t3_drxo17,49
2019-11-05,wallstreetbets,f6lssvf,This subreddit is really going out of its way to destroy Robin Hood,t3_drxo17,49
2019-11-05,wallstreetbets,f6lqmby,"I go to sleep to a guy losing 40k.


I wake up to another guy in the hole for 1M.


How RH didn’t immediately patch this or go offline to work on it is a fucking testament to their incompetence. RH is surely going to be investigated by the SEC. But I still want to see someone leverage to 100M before that",t3_drxo17,93
2019-11-05,wallstreetbets,f6lwysd,Feelin cute. Might borrow a million dollars in debt from Robinhood later idk,t3_drxo17,63
2019-11-05,wallstreetbets,f6llr5o,[deleted],t3_drxo17,35
2019-11-05,wallstreetbets,f6lxyod,dude autism is at all time highs in this sub... like wtf,t3_drxo17,31
2019-11-05,wallstreetbets,f6mzraq,[deleted],t3_drxo17,32
2019-11-05,wallstreetbets,f6mxlqw,"Autistic thought here, but what if this AMD price action is partially influenced by people levering up with the RH recursive loop with algos and trend followers coming in behind? 

Alone, RH PRT users abusing the loop won’t move the price much, but multiple algos would notice the consistent buy orders and buy shares themselves anticipating more share purchases to bring prices up further. Then trend followers and scalp traders notice the upward momentum and buy shares too. This process loops as algos, PRT users, and trend followers continue to push prices higher by continuing to buy shares, outweighing any sells on AMD. Throw in some FOMO and index fund rebalancing we have a potential recipe for a 10% increase one week.

I guess we’ll find out once the PRT loop is fully closed and if it causes AMD to go back down.",t3_drxo17,79
2019-11-05,wallstreetbets,f6lpohh,"In honor of stonks only going up, there will be only green lights on my xmas tree this year. I wonder what my wife and my girlfriend will think 🤔",t3_drxo17,30
2019-11-05,wallstreetbets,f6lqk2s,I don’t know how RH hasn’t patched this yet. Seems kind of odd but considering how the 725  can shoot me from across the map I guess patches aren’t a thing in 2019.,t3_drxo17,26
2019-11-05,wallstreetbets,f6lrd03,Keep falling Uber you gay piece of shit,t3_drxo17,25
2019-11-05,wallstreetbets,f6mkp40,I love how Bloomberg is laying out step by step guide of GUH so people reading the article could do it too.,t3_drxo17,24
2019-11-05,wallstreetbets,f6mpt4t,Holy Fuck. Shop puts just paid off my remaining student loans.,t3_drxo17,23
2019-11-05,wallstreetbets,f6md79h,I’m thinking WSB pushed the envelope a bit too much this week.,t3_drxo17,23
2019-11-05,wallstreetbets,f6ltfvc,"Hahahah, holy shit Peleton.  Expected EPS -0.39, actual -1.19",t3_drxo17,19
2019-11-05,wallstreetbets,f6naq01,Congratulation to all bears today whose accounts went from -99% to -98%.,t3_drxo17,18
2019-11-05,wallstreetbets,f6ls8vb,"There’s so much happening on wsb rn

First we were on Bloomberg

Then guh

1m out of 4K with gta duplication glitch

Now wsb might shut down robinhood

Truly the golden age 👌👌👌",t3_drxo17,41
2019-11-05,wallstreetbets,f6lms95,"So, will someone finally buy a trillion in apple puts? Robin Hood free money cheat hasn't been patched yet.",t3_drxo17,17
2019-11-05,wallstreetbets,f6lt7ey,Everyone who said Uber puts wouldn’t cover IV crush is about to watch an avalanche of tendies.,t3_drxo17,18
2019-11-05,wallstreetbets,f6mn1qm,I don’t like it when WSB goes mainstream...the influx of normies pollutes the gene pool.,t3_drxo17,19
2019-11-05,wallstreetbets,f6lyuee,Why doesn't Robinhood mention the infinite leverage feature in their commercials?  Weird.,t3_drxo17,17
2019-11-05,wallstreetbets,f6m7b7v,**I’M REALLY FUCKING TERRIBLE AT THIS**,t3_drxo17,19
2019-11-05,wallstreetbets,f6m7uk5,Risked ~$4000 to make $20. Where do I buy my yacht?,t3_drxo17,18
2019-11-05,wallstreetbets,f6mn2p6,lol wsb is gonna have the SEC looking at our retardation - imagine the person whose job it is to research this sub's postings and googling what an FD is lol,t3_drxo17,16
2019-11-05,wallstreetbets,f6mqjyx,[deleted],t3_drxo17,16
2019-11-05,wallstreetbets,f6myzzv,"Holy shit there’s 12k people online in WSB. There’s usually around 5k everyday, must be lurkers because of GUH",t3_drxo17,16
2019-11-05,wallstreetbets,f6ls0d1,How long until we see a hundred million dollar RH position?,t3_drxo17,14
2019-11-05,wallstreetbets,f6mw24s,[deleted],t3_drxo17,16
2019-11-05,wallstreetbets,f6mxnwf,"Over the years, I have learned so much and have become much more tolerant towards other people's culture religion sexual orientation. But one thing I still haven't come to terms with is a gay market.",t3_drxo17,16
2019-11-05,wallstreetbets,f6mzj1s,**This is your friendly neighborhood Spider-Man telling you that a rogue wave is upon us. Everyone is buying calls and there is no such thing as a free ride**,t3_drxo17,15
2019-11-05,wallstreetbets,f6n6p3y,[deleted],t3_drxo17,14
2019-11-05,wallstreetbets,f6lmd1j,I don't care about anything but seeing uber drop lower and lower.,t3_drxo17,13
2019-11-05,wallstreetbets,f6lx8zm,i have my entire account in spy puts a drop to 305 today would be pretty nice friends,t3_drxo17,13
2019-11-05,wallstreetbets,f6m0skk,"It's almost impressive how Uber continues to lose $4 billion a year. Guy gives you a ride, Uber takes 30%. How can you possibly screw that up",t3_drxo17,13
2019-11-05,wallstreetbets,f6m6exu,Petition to move the community to r/autism when this sub gets shut down because of SEC and RH over the multiple $1m leverages today,t3_drxo17,14
2019-11-05,wallstreetbets,f6n5ufg,"You all are riding on the short bus, driven by an orange man, headed 120 mph towards a cliff and you’re all screaming faster faster while drinking Mountain Dew and eating cheez it’s. 

I’m going to miss a few of you",t3_drxo17,12
2019-11-05,wallstreetbets,f6lyzqq,Don’t forget to have good posture today boys!,t3_drxo17,11
2019-11-05,wallstreetbets,f6moxan,"hello gentlemen, I am a regular wallstreetbets user, certainly not from the SEC, could one of you lads point me to the infinite leverage ?

best wishes,

not the (SEC)",t3_drxo17,13
2019-11-05,wallstreetbets,f6n6g62,"I'm noticing something, when SPY goes up, AAPL goes up.  When SPY goes down, AAPL goes up.  When MSFT goes up, AAPL goes up.  When MSFT goes down, AAPL goes up.  When everything goes up, AAPL goes up.  When everything goes down, AAPL goes up.  What the hell.",t3_drxo17,12
2019-11-05,wallstreetbets,f6lovm0,"Path to WSB hall of fame -

1. Get a job at investing.com
2. Post article titled ""Only thing you need to know in the market today""
3. Contents ""Market is fake and gay""

Worth it? Some analysts say maybe",t3_drxo17,26
2019-11-05,wallstreetbets,f6lyndd,"How retarded would it be if this god forsaken sub actually caused a recession. If this many people are leveraged to their Personal Risk Tolerance and are willing to post about it on the internet, how many more do you think are going GUH without saying anything.",t3_drxo17,26
2019-11-05,wallstreetbets,f6maev7,"“Mom, how come Daddy likes to get hammered, dress up in a bear costume, and mutter obscenities at a picture of the 16th Chair of the Federal Reserve?”

“Well, you see son, Daddy bought puts during the greatest bull market in history. Now eat your ramen.”",t3_drxo17,27
2019-11-05,wallstreetbets,f6lntou,Who the fuck designed daylight saving time? Now market opens 1:30AM instead of 11:30PM where I live.,t3_drxo17,9
2019-11-05,wallstreetbets,f6loh6m,Futures are going up as some Chinese dude deleted a tweet... cant make this shit up,t3_drxo17,11
2019-11-05,wallstreetbets,f6lv2b4,Drowned one of the midgets in my bathtub. Hopefully this will reverse golds movement,t3_drxo17,12
2019-11-05,wallstreetbets,f6m9efu,Finally broke that 307 magnet 🙏🙏 praise bear jesus,t3_drxo17,10
2019-11-05,wallstreetbets,f6mk97a,I have capitulated. Another bear gone to the bull side,t3_drxo17,11
2019-11-05,wallstreetbets,f6mlznf,"Look we’re on the internet again lol 

https://www.bloomberg.com/news/articles/2019-11-05/robinhood-has-a-glitch-that-gives-traders-infinite-leverage",t3_drxo17,11
2019-11-05,wallstreetbets,f6mm6zy,[deleted],t3_drxo17,11
2019-11-05,wallstreetbets,f6mo5jh," [https://www.bloomberg.com/opinion/newsletters/2019-11-05/money-stuff-playing-the-game-of-infinite-leverage?srnd=new-economy-forum](https://www.bloomberg.com/opinion/newsletters/2019-11-05/money-stuff-playing-the-game-of-infinite-leverage?srnd=new-economy-forum)

&#x200B;

And Another",t3_drxo17,11
2019-11-05,wallstreetbets,f6n0f5w,the cnbc article on GUH has a screenshot of the autist hall of fame and id be surprised if the author isnt fired for that,t3_drxo17,10
2019-11-05,wallstreetbets,f6loz8m,$310 spy calls. Cha-ching baby.,t3_drxo17,10
2019-11-05,wallstreetbets,f6lqq4c,AMD is literally insane for not having a blowout earnings this thing just keeps pushing higher,t3_drxo17,9
2019-11-05,wallstreetbets,f6lr92l,Usually don’t pay any attention to P/E but AMD’s is dumb as f. Wanna buy a put so bad,t3_drxo17,11
2019-11-05,wallstreetbets,f6lwjko,"If the market isn't fucking me, its fucking someone else.

Now I know how Melania feels :(",t3_drxo17,10
2019-11-05,wallstreetbets,f6lwn0v,"Just when I think I have seen peak autism from u/1ronyman I see $1M of debt hinging on fucking deep ITM calls not being exercised, and people actually not understanding why what u/MoonYachts and CTN did is actually retarded. Now I know, autism never peaks, there is always another mountain.",t3_drxo17,11
2019-11-05,wallstreetbets,f6m5g36,Finally sold Visa. Lost over $30k on it,t3_drxo17,10
2019-11-05,wallstreetbets,f6m67c3,[deleted],t3_drxo17,10
2019-11-05,wallstreetbets,f6m9a6w,I realize I’ve lost $13K in the last 3 years… I want to kms,t3_drxo17,10
2019-11-05,wallstreetbets,f6m9l6n,Please market give us a -1% day just once,t3_drxo17,10
2019-11-05,wallstreetbets,f6mdxik,MIDGET #2 DROWNED WILL NOT LET YOU DOWN 🥇GANG,t3_drxo17,10
2019-11-05,wallstreetbets,f6metm9,"Ok does anyone have Trump's #?

Can someone ask him to @ xi and call him Winnie the Pooh? I'm 15k in puts on a personal loan and I need this. Thanks.",t3_drxo17,10
2019-11-05,wallstreetbets,f6mfdmd,"Ok, here's the plan.

Step 1) Get robinhood cash management card.


Step 2) Get 1M leverage from Robinhood


Step 3) Payoff entire mortgage with robinhood cash management card.


Step 4) ???",t3_drxo17,10
2019-11-05,wallstreetbets,f6mikls,SPY's mom caught it sneaking downstairs for some 🐻Tendies and now it has to spend the night in the attic 😱,t3_drxo17,10
2019-11-05,wallstreetbets,f6mkc6w,"Market at all time high with GDP growth at 1%. Sheesh, we’re being pumped.",t3_drxo17,10
2019-11-05,wallstreetbets,f6ml0my,"Did you see what that crackpot Georgetown professor said? Users would be liable for securities fraud.

Good luck taking bankrupt homeless people to court 🤷‍♂️",t3_drxo17,10
2019-11-05,wallstreetbets,f6mlfud,"Bro we made zerohedge and Bloomberg.

Fucking idiots",t3_drxo17,11
2019-11-05,wallstreetbets,f6mo4ne,"First off, GUH your bitch and the click you claim
WSB when we ride come equipped with game
You claim to be investors but we GUHED your wife’s 
We bust on RH niggaz fucked for life",t3_drxo17,10
2019-11-05,wallstreetbets,f6mq4kc,"The day we get investigated by the sec and l2fmw is nowhere to be seen

Coincidence? Or something else... 🧐",t3_drxo17,10
2019-11-05,wallstreetbets,f6msljy,"Robinhood Traders Discovered a Glitch That Gave Them ‘Infinite Leverage’  https://www.bloomberg.com/news/articles/2019-11-05/robinhood-has-a-glitch-that-gives-traders-infinite-leverage

LOL",t3_drxo17,11
2019-11-05,wallstreetbets,f6mvvn8,[removed],t3_drxo17,10
2019-11-05,wallstreetbets,f6mw22x,CNBC wrote the flair of overleveraged people in their articles LMAOOO,t3_drxo17,10
2019-11-05,wallstreetbets,f6mx8r8,"DIS long holders, remember that Frozen 2 is out this month. Another guaranteed 1B box office movie just look at how hot Elsa is",t3_drxo17,10
2019-11-05,wallstreetbets,f6myiqo,u/controlthenarrative is a LEGEND.  hope you're good man! shit will just suck for a while and then you'll be ok,t3_drxo17,10
2019-11-05,wallstreetbets,f6n4pxn,"SPY up $5.00 in 2 days, on red day it's down 7 cents. Tough to be a bear.",t3_drxo17,12
2019-11-05,wallstreetbets,f6n9p2q,"🎖🐻🎖
S P Y  304p 11/15 
🔥🔥🔥🐖🐖🐖🔥🔥🔥",t3_drxo17,10
2019-11-05,wallstreetbets,f6lxgns,[deleted],t3_drxo17,25
2019-11-05,wallstreetbets,f6lou3m,Still fuck you SBUX,t3_drxo17,9
2019-11-05,wallstreetbets,f6lp7nl,"What’s on the menu today, times are EST

8:30 AM    Trade Balance

10:00 AM  ISM Non-Manufacturing Index
		
10:00 AM  JOLTS - Job Openings",t3_drxo17,10
2019-11-05,wallstreetbets,f6mgzwz,My robinhood theme is green. When did they update that?,t3_drxo17,8
2019-11-05,wallstreetbets,f6millp,"I think that stock meltdown is almost over...grab your -.15% drop and get out of your trades bears, it’s 🐄 time again",t3_drxo17,9
2019-11-05,wallstreetbets,f6mppwx,Imagine being the SEC employee who has to sift through all the shit here,t3_drxo17,9
2019-11-05,wallstreetbets,f6mqon2,"#📢Hey SEC

[What do you think of *my* infinite margin play](https://youtu.be/lItNYsksvUA)❓

#🤭",t3_drxo17,10
2019-11-05,wallstreetbets,f6mr3k6,"After all the news reporting and new people we need to bring this back holy fuck this was peak wsb 🤣🤣🤣

https://www.reddit.com/r/wallstreetbets/comments/at3nf1/a_message_from_the_mods/?utm_source=share&utm_medium=ios_app&utm_name=iossmf",t3_drxo17,9
2019-11-05,wallstreetbets,f6n2fxk,"I think the rug pull is getting closer but I'm not sure if this market is toppy enough yet for that. Need more bear capitulations. As a desperate bear I volunteer to jack off some bulls so they'll hurry up and blow off the top, then we can slit all their throats during their post ejaculatory nap time. Blood and semen everywhere for Christmas.",t3_drxo17,10
2019-11-05,wallstreetbets,f6n77sh,There she goes 🐻,t3_drxo17,10
2019-11-05,wallstreetbets,f6llrmf,I still can’t believe there are still so many bears on here,t3_drxo17,16
2019-11-05,wallstreetbets,f6lugio,If BUD can give me a solid green day I'll drink a bud lite lime at lunch,t3_drxo17,7
2019-11-05,wallstreetbets,f6luh8y,"I bought 10 SPY $350c 12/31, fed is going to be pumping money into this shit until December so mine as well absorb as much of it as I can. I’m going to have a great Christmas if it pays off.",t3_drxo17,8
2019-11-05,wallstreetbets,f6lwmai,All my bears in the back say “Guh”,t3_drxo17,7
2019-11-05,wallstreetbets,f6m5nvb,"Wait, stonks can go down?",t3_drxo17,8
2019-11-05,wallstreetbets,f6m661p,"uber more like poober am i right guys, up top",t3_drxo17,8
2019-11-05,wallstreetbets,f6m665p,I did a retarded,t3_drxo17,9
2019-11-05,wallstreetbets,f6m84ab,"ive decided trying to play spy is fucking retarded and impossible. i had puts, data comes and spy moons, i sell at a L like a reasonable fucking person, then not 30 seconds later spy starts to DRILL, what the FUCK? im never ever touching spy again",t3_drxo17,8
2019-11-05,wallstreetbets,f6m9i7j,[deleted],t3_drxo17,8
2019-11-05,wallstreetbets,f6mbh4e,"I feel like I keep winning but my account value keeps going down?

Is this what being mango man feels like?",t3_drxo17,9
2019-11-05,wallstreetbets,f6mc3g9,"Just got back from foraging for bugs in my backyard. Found a few juicy looking Beatles and a few worms, not much but I’ll be eating tonight.

🖕☕️",t3_drxo17,8
2019-11-05,wallstreetbets,f6mifaf,I’m so bad at this...made 500$ thought I was ray man now I lose it all lmao amd pls go down so I can afford rope,t3_drxo17,9
2019-11-05,wallstreetbets,f6mird0,Up 30% on my McDoanlds FDs bought this morning. Gonna hold until it expires worthless like a retard,t3_drxo17,7
2019-11-05,wallstreetbets,f6mj07a,"Alright kids, I bought deep ITM SPY C's ready for the crash?",t3_drxo17,8
2019-11-05,wallstreetbets,f6mki3h,"🚨🚨🚨***THEY KNOW***🚨🚨🚨

WHERE'S NEAREST, HANDICAP-FRIENDLY, EMERGENCY BUNKER

Can we margin charter a jet????",t3_drxo17,8
2019-11-05,wallstreetbets,f6mms12,"Another [Bloomberg article](https://www.bloomberg.com/news/articles/2019-11-05/robinhood-has-a-glitch-that-gives-traders-infinite-leverage?srnd=premium)!? I'm so proud of this community, keep it up my fellow autists",t3_drxo17,8
2019-11-05,wallstreetbets,f6mn2ad,Our boys on Bloomberg! GUH!,t3_drxo17,9
2019-11-05,wallstreetbets,f6mt1t2,SPY 310 by end of week guys. Load up on calls 😎 fuck yea,t3_drxo17,8
2019-11-05,wallstreetbets,f6mtqof,[deleted],t3_drxo17,8
2019-11-05,wallstreetbets,f6mytxa,"LOL UBER is such garbage.  Sat on $28 for about 5 minutes, then shot back up.  Just let the lockout expire and get this to $20.",t3_drxo17,7
2019-11-05,wallstreetbets,f6n1kww,"AFTER I exit my position  in dis$ I will dedicate my life to destroying it 

Ruthless ceo style 

Fuck, u have gave me
So much pain.



The world will know pain 



Plan code name “ GUH” 

*begin stages of initiation*",t3_drxo17,9
2019-11-05,wallstreetbets,f6n65rq,"Boys, I feel trading markets is making me more and more salty due to the flagrant manipulation

Anyone else feeling that way?",t3_drxo17,6
2019-11-05,wallstreetbets,f6n7h36,Can someone go infinite leverage themselves up a couple hundred mil and pump SPY back up please?,t3_drxo17,8
2019-11-05,wallstreetbets,f6lopsx,"AMD fucking stop already, don't go all SHOP on me",t3_drxo17,7
2019-11-05,wallstreetbets,f6lpvfy,"Stonks only go up, RH continues to become even more of meme, and WSB gets more and more autistic everyday, I fucking love it.",t3_drxo17,8
2019-11-05,wallstreetbets,f6lr2yt,"Okay boys got 18k in spy puts today ready to fuck my portfolio into pieces, what advice do ye have for me?",t3_drxo17,7
2019-11-05,wallstreetbets,f6lrd5o,Moving the meme account out of RH.,t3_drxo17,7
2019-11-05,wallstreetbets,f6lsz3k,Stonks only go up,t3_drxo17,6
2019-11-05,wallstreetbets,f6ltpu4,There is no pattern quite as consistent in the stonk market as DIS selling off every fucking morning,t3_drxo17,6
2019-11-05,wallstreetbets,f6luhmb,Keep making those $450-$600 a week on one trade. NO GUHs,t3_drxo17,6
2019-11-05,wallstreetbets,f6luoja,good morning everyone!  good luck today,t3_drxo17,8
2019-11-05,wallstreetbets,f6m24em,wow so many fucking noob questions today,t3_drxo17,7
2019-11-05,wallstreetbets,f6m5cdf,Bears could be making money right now if their accounts weren't already 95% wiped. I guess you can still turn your last $50 into $100,t3_drxo17,7
2019-11-05,wallstreetbets,f6m7pc7,These stonks ain’t loyal,t3_drxo17,7
2019-11-05,wallstreetbets,f6m81za,Fuck visa,t3_drxo17,8
2019-11-05,wallstreetbets,f6m9ek9,Hmmm...bought the wrong SPY dip. Again.,t3_drxo17,7
2019-11-05,wallstreetbets,f6m9rth,"SPY down 60 cents feels like a crash, biggest pullback in a month I think",t3_drxo17,6
2019-11-05,wallstreetbets,f6mcsfc,"One day, be it 1 year, 5 years or even 10 years from now, Spy will hit $420.69.    That day will be a glorious day for WSB",t3_drxo17,7
2019-11-05,wallstreetbets,f6mf6fh,Hmmm even banks are finally starting to get dragged down. We may see a selloff soon.,t3_drxo17,7
2019-11-05,wallstreetbets,f6mg28h,"Hi, I would like 1 Large Melt-up meal please",t3_drxo17,7
2019-11-05,wallstreetbets,f6mgamm,My McNipples are hard,t3_drxo17,8
2019-11-05,wallstreetbets,f6mgthb,"When my portfolio goes up, I am happy for am hour 
When my portfolio goes down, I am sad for a day
Why it be like that?",t3_drxo17,8
2019-11-05,wallstreetbets,f6mgu89,Just sold my $MCD calls for about 50% profit. Hope I don't regret selling...,t3_drxo17,7
2019-11-05,wallstreetbets,f6mjfme,How we feeling about Weight Watchers earnings? I still see a lot of fat people out there,t3_drxo17,8
2019-11-05,wallstreetbets,f6mk68l,Goddamn I’m really good at vaporizing money,t3_drxo17,6
2019-11-05,wallstreetbets,f6ml92r,"December puts: AMD, AAPL, Google

Literally free money. Look at how overbought everything is, lol, who the fuck is buying up here? 

I will eat my at if I dont double my money on every single one of these trades.",t3_drxo17,7
2019-11-05,wallstreetbets,f6mln43,That Bloomberg article gaining a lot of traction,t3_drxo17,6
2019-11-05,wallstreetbets,f6mmevl,Spy is bleeding and my puts ain’t doing jack shit,t3_drxo17,8
2019-11-05,wallstreetbets,f6mmg66,InB4 we get shutdown.,t3_drxo17,7
2019-11-05,wallstreetbets,f6mn0lz,[deleted],t3_drxo17,7
2019-11-05,wallstreetbets,f6mnzqm,Hi SEC 👋,t3_drxo17,8
2019-11-05,wallstreetbets,f6mtqqa,AMD such a cash cow,t3_drxo17,7
2019-11-05,wallstreetbets,f6mvgbx,[https://www.cnbc.com/2019/11/05/some-robinhood-users-were-able-to-trade-with-unlimited-borrowed-money.html](https://www.cnbc.com/2019/11/05/some-robinhood-users-were-able-to-trade-with-unlimited-borrowed-money.html) holy shit boys!,t3_drxo17,6
2019-11-05,wallstreetbets,f6mx4eq,these AMD puts are currently testing my PRT big time,t3_drxo17,8
2019-11-05,wallstreetbets,f6my26m,"FUUCKKK UUU DIS$$$ 


Holy shit !!!

🤬🤬🤬🤬🤬🤬🤬🤬🤬😤😤😤😤😤😰😰😰😰😰😥😥😥😨🤮🤮🤮🤮",t3_drxo17,8
2019-11-05,wallstreetbets,f6myjpd,"https://www.cnbc.com/2019/11/05/some-robinhood-users-were-able-to-trade-with-unlimited-borrowed-money.html

CNBC",t3_drxo17,7
2019-11-05,wallstreetbets,f6myx3g,"Dec AMD puts. Let’s gooo

Forgive me Su Bae",t3_drxo17,7
2019-11-05,wallstreetbets,f6mze7u, SPY YOU GAY PIECE OF SHIT MOVE!,t3_drxo17,8
2019-11-05,wallstreetbets,f6mzoy0,"Literally impossible for AMD to have another Green Day, if you got mullah in your account better put a few on AMD puts for tomorrow’s one day drop.",t3_drxo17,7
2019-11-05,wallstreetbets,f6n4a3i," New drink game 

Take a shot everytime
Some one mentions “ GUH” 

:)",t3_drxo17,7
2019-11-05,wallstreetbets,f6n4s3w,First time watching CNBC shit makes the market look like the fucking super bowl chill,t3_drxo17,9
2019-11-05,wallstreetbets,f6n7l0h,If we could head back down I'd appreciate that thanks.,t3_drxo17,6
2019-11-05,wallstreetbets,f6n8972,I almost bought puts at AMDs top above $37 earlier but didn't wanna get burned again. I hate everything,t3_drxo17,8
2019-11-05,wallstreetbets,f6nb83a,[deleted],t3_drxo17,6
2019-11-05,wallstreetbets,f6nbgmm,">Ironically, in a world where 97% of retail traders end up losing money in the long run, giving them even more money (i.e., unlimited) to lose, means that Robinhood should probably change its name to anti-Robinhood, as not only does it take from the poor and give to the rich, but it is now doing so at an infinite scale.",t3_drxo17,7
2019-11-05,wallstreetbets,f6lqh68,One of the stupidest things I’ve ever seen twitter do is making retweeting your own tweet a thing. Like wtf now I have to see Trump retweet himself?,t3_drxo17,6
2019-11-05,wallstreetbets,f6lu4ph,[deleted],t3_drxo17,5
2019-11-05,wallstreetbets,f6lujn7,I'll take one china tweet with a side of trade war please,t3_drxo17,6
2019-11-05,wallstreetbets,f6lxpzp,Time to re-enter LULU,t3_drxo17,6
2019-11-05,wallstreetbets,f6ly5n5,"ok bb ISM 

do your thang 

if we miss and still melt up, im certified 100% gaylord",t3_drxo17,7
2019-11-05,wallstreetbets,f6lyefx,"My 🐻 Brethren, rest easy. Today will be red, and it will be glorious.

No one is trying to call a recession, but I am for damn sure calling a profit taking pullback day.",t3_drxo17,6
2019-11-05,wallstreetbets,f6lzrmn,Remove the B from SBUX,t3_drxo17,6
2019-11-05,wallstreetbets,f6m0wca,Infinite leverage crashing the market,t3_drxo17,6
2019-11-05,wallstreetbets,f6m3r6y,"How to get rich: buy calls for 6 months out, delete the robinhood app, go check it in 3 months cash out",t3_drxo17,6
2019-11-05,wallstreetbets,f6m42ru,Is this the melt up I’ve heard so much about?,t3_drxo17,5
2019-11-05,wallstreetbets,f6m4hvv,That pop was short lived,t3_drxo17,6
2019-11-05,wallstreetbets,f6m4t4m,Bought $AMD 11/15 $36P as soon as it hit $37 and they’re already up 20%. So I’m feeling good right now,t3_drxo17,6
2019-11-05,wallstreetbets,f6m5o4e,"This is a bunch of hooey. There, I said it.",t3_drxo17,7
2019-11-05,wallstreetbets,f6m5q2d,Need an update on the 1M margin guys.  They may have timed this shit perfectly.,t3_drxo17,6
2019-11-05,wallstreetbets,f6m6k69,Ok AMD you may resume the downies,t3_drxo17,7
2019-11-05,wallstreetbets,f6m7h9b,"I keep reading articles saying ""why isnt Buffett buying anything?""  Hes old, senile, etc.

Translation: you are not helping the pump of all pumps!   We aren't getting ALL of retail because they see you aren't buying.

Warren: in 2 years, Ill be able to buy half of America with my Scrooge McDuck money.",t3_drxo17,6
2019-11-05,wallstreetbets,f6mccj8,Market goes up... fake and gay. Market goes down... fake and gay. I’m starting to think I’m the one who’s fake and gay,t3_drxo17,7
2019-11-05,wallstreetbets,f6mccje,People from r/amd_stock selling yesterday at 36 and buying back today at 37,t3_drxo17,6
