created,date,subreddit,id,body,parent_id,score
1589886080.0,2020-05-19,wallstreetbets,fr4eyrq,[deleted],t3_gmlsuw,202
1589884712.0,2020-05-19,wallstreetbets,fr4diwx,"JPow’s brushing his teeth.  He says, “Alexa.  Play Smash Mouth.”",t3_gmlsuw,77
1589888316.0,2020-05-19,wallstreetbets,fr4hgek,"JPow scrolls through r/WSB to get a sense of market sentiment.

“My God,” he says, leaning back in his chair, “it’s working!  IT’S WORKING!!!”",t3_gmlsuw,64
1589883349.0,2020-05-19,wallstreetbets,fr4c4ql,"Motley fool issues rare all-in double down, sell your kidney, rob your mother at gunpoint buy alert",t3_gmlsuw,113
1589883300.0,2020-05-19,wallstreetbets,fr4c2zf,Home Depot...ya blew it,t3_gmlsuw,50
1589883618.0,2020-05-19,wallstreetbets,fr4cej5,"Up until about a month ago, I assumed ""Investing"" was some shit done with meetings and guys in suits and signing papers and large amounts of money.

Thanks to /r/wallstreetbets, I now know that the stock market is basically just gambling that anyone can do on their phone with $50-$100 in 5 minutes with absolutely no understanding of finances or what anything is.

Thanks!",t3_gmlsuw,138
1589891815.0,2020-05-19,wallstreetbets,fr4ly9p,"WMT: ""terrific earnings!"" /moves +3.32%
 
Any tech company: ""lmao our app sucks, okay numbers, we're planning on adding a new cool button to it"" /moves +15%",t3_gmlsuw,50
1589886909.0,2020-05-19,wallstreetbets,fr4fuuo,"Imagine if jpow comes today and starts crying and be like ""I don't know what to do now""",t3_gmlsuw,40
1589883350.0,2020-05-19,wallstreetbets,fr4c4sc,"I'm actually surprised cuz the Home Depots around me have been unusually packed too lmao. Guess the WSB DD of ""the parking lots are full"" had some flaws.",t3_gmlsuw,37
1589891429.0,2020-05-19,wallstreetbets,fr4lf20,"I’ll be a bull, I’ll be cash gang, but I refuse to play spy puts again. I’m traumatized from my past.",t3_gmlsuw,38
1589891548.0,2020-05-19,wallstreetbets,fr4lkvy,Looking at my Snapchat discover feed makes me think I’m in the movie Idiocracy,t3_gmlsuw,33
1589892863.0,2020-05-19,wallstreetbets,fr4nhiq,[deleted],t3_gmlsuw,34
1589893702.0,2020-05-19,wallstreetbets,fr4oriw,"Just want to take this moment to show my appreciation for the hard-working people at WMT who have to deal with annoying obese Americans every day, just to make tendies for me. 

Thank you all, I love you and will think of you when I sniff a line of coke from the escort girls butt. Keep up the hard work <3",t3_gmlsuw,28
1589886607.0,2020-05-19,wallstreetbets,fr4fj2m,"wow, just found this hidden in secretary mnuchin’s statement he’ll read later this morning: “..we are continuing to see large unemployment and other negative indicators. It is important to realize that the large numbers represent real people.  This is why it is so important to begin bringing people back to work in a safe way“ now why would the government be trying to hire everyone at a safeway?",t3_gmlsuw,77
1589890187.0,2020-05-19,wallstreetbets,fr4jrne,"I just got banned from the Robinhood subreddit for posting a poll asking if people like the new or old version of Robinhood the best. Spoiler alert, the old version won.",t3_gmlsuw,50
1589892547.0,2020-05-19,wallstreetbets,fr4n0g6,So we’re taking our calc final rn and the blackboard site crashed lmfao,t3_gmlsuw,25
1589902131.0,2020-05-19,wallstreetbets,fr5426r,"Imagine having $56.72 in your robinhood account and posting ""WARREN BUFFETT IS DONEE""",t3_gmlsuw,25
1589906437.0,2020-05-19,wallstreetbets,fr5ct9r,If SPY loves 295 so much why don't they just get married,t3_gmlsuw,27
1589884467.0,2020-05-19,wallstreetbets,fr4d9pv,"I will accept circuit breakers

I will accept a rally to 300

Just not a flat sideways day please. I fucking stayed up all night goddamit",t3_gmlsuw,24
1589887466.0,2020-05-19,wallstreetbets,fr4ggzq,"Looks like another face ripping green day

WMT came through for us",t3_gmlsuw,25
1589903570.0,2020-05-19,wallstreetbets,fr56xd4,You aren't a man until you're trying to nurse a -90% portfolio back to health.,t3_gmlsuw,23
1589890083.0,2020-05-19,wallstreetbets,fr4jn1r,"For everyone asking what a triple top is on the $SPY, this is what traders who like classical patterns are looking at: [https://i.imgur.com/JZvcAaH.png](https://i.imgur.com/JZvcAaH.png)",t3_gmlsuw,22
1589910674.0,2020-05-19,wallstreetbets,fr5ltk2,"Put 125k in apple, msft and fb days before the crash.

Just broke even today.

https://imgur.com/a/Sz6ShOy",t3_gmlsuw,23
1589920685.0,2020-05-19,wallstreetbets,fr66cii,MRNA + CNBC = greatest cuck job of 2020,t3_gmlsuw,22
1589894358.0,2020-05-19,wallstreetbets,fr4psng,"This just in, JPOW tweets “spy stock is too low imo”",t3_gmlsuw,22
1589884439.0,2020-05-19,wallstreetbets,fr4d8p3,"If we triple top at 61.8% and then go down, TA gay retards are going to use this example for the rest of our lives",t3_gmlsuw,49
1589898683.0,2020-05-19,wallstreetbets,fr4xe3l,"""Mr. Secretary how many people WILL DIE if we send them back to work without the proper protections?""

Correct answer:

""Sir, this is a bank""",t3_gmlsuw,45
1589887332.0,2020-05-19,wallstreetbets,fr4gbpl,"Weird, the place that supplies independent contractors missed earnings during a lockdown.",t3_gmlsuw,22
1589889104.0,2020-05-19,wallstreetbets,fr4iem0,"*futures down 0.06%*

FUTURES FALL",t3_gmlsuw,21
1589891679.0,2020-05-19,wallstreetbets,fr4lrg9, SPCE call at open.. for no reason !,t3_gmlsuw,22
1589893536.0,2020-05-19,wallstreetbets,fr4oicn,"This BEAR is ready for that .5% drill today. 

it's going to be bloody",t3_gmlsuw,18
1589895826.0,2020-05-19,wallstreetbets,fr4s7rt,Home Depot built me a wood shed and then proceeded to take me out behind it,t3_gmlsuw,19
1589886959.0,2020-05-19,wallstreetbets,fr4fwti,"Holy shit. My retarded boomer play in Advance Auto Parts actually paid off.

Guess folks were fixing their rust buckets this whole time",t3_gmlsuw,39
1589900881.0,2020-05-19,wallstreetbets,fr51md1,“What’s a 100bil among friends?” FUCKING SAVAGE,t3_gmlsuw,18
1589891649.0,2020-05-19,wallstreetbets,fr4lpwz,Fb going live at 10 pt to announce a new product. Buy your calls!,t3_gmlsuw,17
1589900284.0,2020-05-19,wallstreetbets,fr50gtf,"Jerome Powell is actually so fucking good at his job. He does everything the big boys on Wall Street want, but keeps the rhetoric so bland and always emphasizes patience and *liquidity* which is just enough to keep all the idiots in DC off his back. He’s really good at this. Whether his decisions are responsible in the long run is a different question, but still.",t3_gmlsuw,17
1589903800.0,2020-05-19,wallstreetbets,fr57e72,"Jerome Powell :: ""We aren't buying junk bonds but we might be buying junk bond ETFs which are full of junk bonds, LOL""",t3_gmlsuw,17
1589908056.0,2020-05-19,wallstreetbets,fr5g8fo,"Mark's about to announce the Zuck Buck.  1,000 Zuck Bucks can be exchanged for an extra five minutes of lunch break.",t3_gmlsuw,18
1589908860.0,2020-05-19,wallstreetbets,fr5hyjf,whoever posted the fb tip this morning uhhhh thanks,t3_gmlsuw,17
1589883310.0,2020-05-19,wallstreetbets,fr4c3bf,[deleted],t3_gmlsuw,36
1589887085.0,2020-05-19,wallstreetbets,fr4g1t6,"Things I learned from WSB

Buy calls on red days

Never buy puts on TSLA

The gay bear circuit breaker dance in March will never happen again

99% of the DD is speculation or old news

On days where there is a big jump, take those gains and don't be greedy",t3_gmlsuw,32
1589886915.0,2020-05-19,wallstreetbets,fr4fv2w,We should start a publicly traded company and make the ticker FUK,t3_gmlsuw,16
1589888753.0,2020-05-19,wallstreetbets,fr4hz53,Waking up to Walmart. Dick is hard.,t3_gmlsuw,17
1589893912.0,2020-05-19,wallstreetbets,fr4p3d6,I went from the Al Kharid sand casino to the wall street casino,t3_gmlsuw,16
1589910861.0,2020-05-19,wallstreetbets,fr5m7a3,"For my next trick I will bag hold these FB 225 5/29 calls till tomorrow and see a 200% return down to zero 

Tada",t3_gmlsuw,16
1589923834.0,2020-05-19,wallstreetbets,fr6clnb,Y’all ever just eat a whole bag of garlic & butter croutons?,t3_gmlsuw,14
1589894260.0,2020-05-19,wallstreetbets,fr4pn1p,Anyone else think Trumps doctor just gives him sugar pills or powdered vegetables in capsules and tells him it’s a potential cure?,t3_gmlsuw,14
1589896990.0,2020-05-19,wallstreetbets,fr4u9ih,[deleted],t3_gmlsuw,13
1589906725.0,2020-05-19,wallstreetbets,fr5df2h,"There is literally nothing in the markets i want to buy right now.  Everything is either sky high valuations, or can potentially go bankrupt if spending patterns change.    :(",t3_gmlsuw,14
1589909394.0,2020-05-19,wallstreetbets,fr5j464,"I’m never seen such unity on this sub. Today, we are all zucc.",t3_gmlsuw,15
1589915606.0,2020-05-19,wallstreetbets,fr5w19y,"Me being retarded thinking I'm faster than some phd physics nerds multibillion dollar fake out machine, while I'm manually inputting limit orders on my phone during work hours.",t3_gmlsuw,14
1589884519.0,2020-05-19,wallstreetbets,fr4dbny,By 8:30 bears will be wtf happened,t3_gmlsuw,29
1589889328.0,2020-05-19,wallstreetbets,fr4iolf,$3k worth of HD calls down the drain. Adios amigos ✌🏽,t3_gmlsuw,14
1589890439.0,2020-05-19,wallstreetbets,fr4k3c2,"Some Dr. Timothy Leahy is on NPR expressing huge doubts on MRNA

POOTS 💨💨💨",t3_gmlsuw,13
1589894578.0,2020-05-19,wallstreetbets,fr4q5ds,Got a new Robinhood update and now I want to throw up every time I look at the icon 🤢,t3_gmlsuw,14
1589895078.0,2020-05-19,wallstreetbets,fr4qyhn,"Senate testimony: ""Chairman Powell are you concerned that Mr. Gordon, a gecko giving investing advise to over a million people, may in fact be able to psychically predict the direction of the market. He's been right 7/7 times so far Mr Chairman... unlike that fucking shrimp""",t3_gmlsuw,12
1589902377.0,2020-05-19,wallstreetbets,fr54jq1,"I'm a pacifist progressive, yet here I am on a Wall Street focused subreddit rooting for Raytheon to continue blasting off.

Fast forward a month from now and I'll be really happy that we bombed someone.",t3_gmlsuw,14
1589903744.0,2020-05-19,wallstreetbets,fr57a6y,Zuckerberg: “You can now add GIFs to your small business profile.”,t3_gmlsuw,13
1589905936.0,2020-05-19,wallstreetbets,fr5brn6,"DISNEY 113$ BEFORE END OF DAY
OR I WILL INVITE A BULL TO ASSFUCK MY WIFE",t3_gmlsuw,13
1589913207.0,2020-05-19,wallstreetbets,fr5r0vw,"All the algos right now be like

If market == open:

     
    buy_stonks()",t3_gmlsuw,13
1589921228.0,2020-05-19,wallstreetbets,fr67fl7,people blaming MRNA and media for the crash coping with the fact that if the market wants to go down it'll find a headline no matter what's going on,t3_gmlsuw,12
1589888215.0,2020-05-19,wallstreetbets,fr4hc3k,Didn’t Zuck say yesterday that FB had an announcement today,t3_gmlsuw,12
1589900338.0,2020-05-19,wallstreetbets,fr50km0,My wife's making more with her only fans account than I'm making with my options :(,t3_gmlsuw,10
1589908609.0,2020-05-19,wallstreetbets,fr5hewi,"FB Shops free

FB Shops integrated with every FB platform (insta, whatsapp)

FB Shops lets you import already created shops from other platforms

Zucc: ""SHOP stock too high IMO""",t3_gmlsuw,13
1589909908.0,2020-05-19,wallstreetbets,fr5k6y9,To the guy that caught Zuckerberg teasing about a big announcement today: i love you,t3_gmlsuw,12
1589915217.0,2020-05-19,wallstreetbets,fr5v7lt,"That flash crash is just MM algos asserting dominance and saying we are all their bitches. All can be given, all can be taken away",t3_gmlsuw,11
1589917288.0,2020-05-19,wallstreetbets,fr5ziso,This bears vs bulls thing is so gay and retarded. Sub sucks now because of this shit,t3_gmlsuw,12
1589918412.0,2020-05-19,wallstreetbets,fr61smr,I can see why people off themselves over this shit,t3_gmlsuw,11
1589918448.0,2020-05-19,wallstreetbets,fr61v6d,PENCILS DOWN,t3_gmlsuw,12
1589883468.0,2020-05-19,wallstreetbets,fr4c92f,"back on the construction site today, looks like they are trying to reopen things here. Im gonna miss day trading with my bros when im back at work full time.",t3_gmlsuw,12
1589886135.0,2020-05-19,wallstreetbets,fr4f0uv,"Guys... I'm really fucking sick of losing money. I think I'm done being a gay bear. I made thousands as a straight bull, then switched teams and lost it all. My ass hurts from getting rammed with big green dildos. It's time to take the cock out of my throat and buy some fucking calls or something.",t3_gmlsuw,11
1589890447.0,2020-05-19,wallstreetbets,fr4k3qz,Bashing all these HD call holders AFTER THE FACT. Smh,t3_gmlsuw,11
1589891925.0,2020-05-19,wallstreetbets,fr4m3v1,"Nobody's talking about SPCE

Might be time to hop in",t3_gmlsuw,10
1589892193.0,2020-05-19,wallstreetbets,fr4mi0s,[deleted],t3_gmlsuw,11
1589894170.0,2020-05-19,wallstreetbets,fr4phxq,Spy gonna dump until lunch,t3_gmlsuw,12
1589894529.0,2020-05-19,wallstreetbets,fr4q2jv,"Senator - Mr JPOW, does the money printer go BURRRR OR BEEP BOOP?",t3_gmlsuw,10
1589897048.0,2020-05-19,wallstreetbets,fr4ud8w,Made $9 today 😎,t3_gmlsuw,10
1589898065.0,2020-05-19,wallstreetbets,fr4w8tr,Unemployment at 20% yet sp 500 only down 10% ytd what a joke,t3_gmlsuw,11
1589900056.0,2020-05-19,wallstreetbets,fr500p2,I’m done. Playing options is fucking cancer,t3_gmlsuw,11
1589900500.0,2020-05-19,wallstreetbets,fr50w00,ฮิญ shaped recovery,t3_gmlsuw,10
1589905708.0,2020-05-19,wallstreetbets,fr5baoc,"Steve mnuchin straight spewing bullshit

Dude is a joke",t3_gmlsuw,11
1589906198.0,2020-05-19,wallstreetbets,fr5cbg2,"Literally the market is out to get me, and me alone.  I buy puts and the market rips, I buy calls and it tanks.  Today, I said let me buy some straddles, I'll teach it a thing or two.  SPY: +0.01%",t3_gmlsuw,11
1589910171.0,2020-05-19,wallstreetbets,fr5kr69,"How to make money using WSB:

Go on the daily/nightly thread

See what everyone’s pumping

Do minimal research

Make the play

There you did it.",t3_gmlsuw,10
1589915250.0,2020-05-19,wallstreetbets,fr5va7y,All I need is spy at 40 by next week,t3_gmlsuw,11
1589915699.0,2020-05-19,wallstreetbets,fr5w87p,[deleted],t3_gmlsuw,10
1589918802.0,2020-05-19,wallstreetbets,fr62kg1,sTOcKs EnD LoWeR aS iNvEsToRS tAkE BrEaThEr fRoM 2 daY RaLLy,t3_gmlsuw,10
1589893766.0,2020-05-19,wallstreetbets,fr4ov5s,"After 2.5 years, and being $20k in the hole, I made it out alive gentleman. I also got back with my high school sweet heart 7 months ago. Perseverance fellas. 
http://imgur.com/gallery/Glu3yxn",t3_gmlsuw,35
1589883658.0,2020-05-19,wallstreetbets,fr4cfyc,Won't insult bulls cause then there will be no difference between them and me,t3_gmlsuw,9
1589886098.0,2020-05-19,wallstreetbets,fr4ezhe,"$WMT | Walmart Q1 20 Earnings: 
- Revenue: $134.62 (exp $132.79B) 
- Adj EPS: $1.18 (exp $1.12)
- Total Comparable Sales Ex Fuel: +10.3% (exp +9.6%)  
- Withdraws Outlook For Fiscal 2020",t3_gmlsuw,9
1589887370.0,2020-05-19,wallstreetbets,fr4gd7c,You know what? Fuck it. Doubling down on puts at open. Fuck money. Who needs it.,t3_gmlsuw,10
1589890601.0,2020-05-19,wallstreetbets,fr4kb3a,I swear every day some autist on this sub mentions a stock that no one else has ever heard of then half the sub pile into it right at the top.,t3_gmlsuw,11
1589890610.0,2020-05-19,wallstreetbets,fr4kbh7,"It's red!!!

*happy gei bear noises* 🌈🐻",t3_gmlsuw,10
1589891356.0,2020-05-19,wallstreetbets,fr4lbfq,So happy I sold most of my HD calls yesterday and held onto my WMT calls,t3_gmlsuw,9
1589892095.0,2020-05-19,wallstreetbets,fr4mcwo,TDA better fix this shit...,t3_gmlsuw,10
1589892843.0,2020-05-19,wallstreetbets,fr4ngf5,[deleted],t3_gmlsuw,10
1589893600.0,2020-05-19,wallstreetbets,fr4olx3,"Gaps will be filled today on $SPY

If not, then it’s my ass that will get filled",t3_gmlsuw,10
1589893842.0,2020-05-19,wallstreetbets,fr4ozew,hold LOW or dump?,t3_gmlsuw,11
1589893856.0,2020-05-19,wallstreetbets,fr4p07k,[deleted],t3_gmlsuw,10
1589900777.0,2020-05-19,wallstreetbets,fr51f7t,Mnuchin is a slimeball tbh,t3_gmlsuw,11
1589900865.0,2020-05-19,wallstreetbets,fr51l86,Powell: (basically) we aint even started printing,t3_gmlsuw,11
1589904193.0,2020-05-19,wallstreetbets,fr586vk,"Senator Kennedy isn't a good'ol idiot southern boy, he just plays one on TV. Dude went to fucking Oxford.",t3_gmlsuw,11
1589904355.0,2020-05-19,wallstreetbets,fr58iex,"Everyone: How are we gonna save America?

Martha McSally: Fuck Gyna",t3_gmlsuw,10
1589904849.0,2020-05-19,wallstreetbets,fr59ilh,"Officially my best week ever https://i.imgur.com/712K5Ji.jpg

3 days can change that quick though",t3_gmlsuw,10
1589904962.0,2020-05-19,wallstreetbets,fr59qzb,"I don’t even like hard rock/metal, but I found the doom soundtrack on Apple Music. Shit adds another level to trading holy fuck. 

I’m revvvvvedddd all the way the fuck up right now",t3_gmlsuw,10
1589910935.0,2020-05-19,wallstreetbets,fr5mcok,"Straight up made 3k in 1:10 on shop puts in and out due to some retards. Keep in mind, I would’ve lost 7k if I held another 30 seconds.",t3_gmlsuw,10
1589912673.0,2020-05-19,wallstreetbets,fr5px03,"Bulls make money, pigs make money, bears get slaughtered.",t3_gmlsuw,10
1589915140.0,2020-05-19,wallstreetbets,fr5v1wv,"Everyone calm down, I still have puts, this thing ain't going down.",t3_gmlsuw,10
1589915276.0,2020-05-19,wallstreetbets,fr5vc57,"SPY up 3% on vaccine promise. 

Vaccine accurately being bullshit causes .5% dip that immediate gets bought up.

Makes sense. Rational market.",t3_gmlsuw,9
1589915800.0,2020-05-19,wallstreetbets,fr5wfxj,"so the vaccine is BS, but the market retains it's crazy gains from yesterday still. Logical",t3_gmlsuw,10
1589916199.0,2020-05-19,wallstreetbets,fr5x9pc,"MARKET DOWN -0.01% FOR THE DAY  
CIRCUIT BREAKER INCOMING",t3_gmlsuw,9
1589916475.0,2020-05-19,wallstreetbets,fr5xu9z,"Guys, I'm beginning to think Mr. Gordon isn't fucking around. If we close red, that boy is 7/7.",t3_gmlsuw,11
1589918474.0,2020-05-19,wallstreetbets,fr61x1x,I put 5k into spy calls at 3:55. I didnt want to sleep tonight anyways.,t3_gmlsuw,9
1589918623.0,2020-05-19,wallstreetbets,fr627ox,Imagine being retarded like me and not selling fb calls at 100% gains and holding overnight,t3_gmlsuw,10
1589919376.0,2020-05-19,wallstreetbets,fr63pam,Just took some hydroxicholoroquine and bought 310 calls. Match me.,t3_gmlsuw,9
1589919965.0,2020-05-19,wallstreetbets,fr64vys,"The bigger the dump, the bigger the pump.",t3_gmlsuw,9
1589920234.0,2020-05-19,wallstreetbets,fr65fmm,+200% on my SPY puts fuck yeah. And I brought myself to lock in profits at the close. That’s the biggest win.,t3_gmlsuw,10
1589884737.0,2020-05-19,wallstreetbets,fr4djui,"Vaccine czar who was on Modernas board divests his 10 MILLION in MRNA options and the next day they announce an offering. 

Fucking scum.",t3_gmlsuw,19
1589893098.0,2020-05-19,wallstreetbets,fr4nu7x,"Is it just me, or do you have a mini panic when you cant log into work because you messed up your password.

Like shit, they finally fired me.",t3_gmlsuw,20
1589884042.0,2020-05-19,wallstreetbets,fr4cu13,Cheers to another day of making the right moves and gaining money 🍻,t3_gmlsuw,32
1589883243.0,2020-05-19,wallstreetbets,fr4c0x8,Home Depot misses EPS $2.08 vs $2.27 est. Hopefully most of you closed out EOD yesterday. Any thoughts on the impact this will have on Lowe's EPS?,t3_gmlsuw,9
1589888455.0,2020-05-19,wallstreetbets,fr4hmbm,[deleted],t3_gmlsuw,9
1589888898.0,2020-05-19,wallstreetbets,fr4i5fv,They said WMT is reccesion proof. I didn't listen.,t3_gmlsuw,9
1589895819.0,2020-05-19,wallstreetbets,fr4s79z,Fomo vs Dump crowd. This an intense battle.,t3_gmlsuw,9
1589896313.0,2020-05-19,wallstreetbets,fr4t29m,"My NVDA 6/19 $475c which I bought(for fun) a few days ago with my remaining $28 buying power is now at +400%

https://ibb.co/3C8Jhv0",t3_gmlsuw,8
1589896832.0,2020-05-19,wallstreetbets,fr4tzhw,"I put 50k in amzn shares right before earnings. Thought I'd make an easy 3-4k.

Just broke even rn..",t3_gmlsuw,9
1589898065.0,2020-05-19,wallstreetbets,fr4w8v5,Everytime Jpow says tools I nut,t3_gmlsuw,9
1589898563.0,2020-05-19,wallstreetbets,fr4x63s,"TELL ME, MNUCHIN

#IS IT FAIR??

“Sorry but—“

##IS IT FAIR?",t3_gmlsuw,8
1589898656.0,2020-05-19,wallstreetbets,fr4xccv,This dude is a fucking savage lmao. Fuck their word salad bullshit,t3_gmlsuw,9
1589898664.0,2020-05-19,wallstreetbets,fr4xcvj,"This dude have BULLS on a paint behind him, we all know what that means right",t3_gmlsuw,10
1589899169.0,2020-05-19,wallstreetbets,fr4yb7y,"After trading for a while I think I m going to make some rules of trading:

1) If you own stock, never sell them buy every dip you can.

2) If you own puts you are fuck

3) Stop being a pussy and buy calls

4) All porn is fake. (massive gains with 1000 dollars)",t3_gmlsuw,10
1589899499.0,2020-05-19,wallstreetbets,fr4yy1t,You can literally buy calls before a republican and puts before a Democrat starts their questions and get paid.,t3_gmlsuw,8
1589900290.0,2020-05-19,wallstreetbets,fr50h8t,where is FB gang?,t3_gmlsuw,9
1589901944.0,2020-05-19,wallstreetbets,fr53p44,BEAR QUEEN WARREN,t3_gmlsuw,9
1589903432.0,2020-05-19,wallstreetbets,fr56ni8,"Trump talking at the same time as j pow? We getting the gang bang pump by Powell, Mnuchin, and Trump rn",t3_gmlsuw,9
1589909307.0,2020-05-19,wallstreetbets,fr5ixch,SHOP unreal.  Too focused on FB congrats to anyone who bought calls on the dip.  Instant 300%+,t3_gmlsuw,9
1589909727.0,2020-05-19,wallstreetbets,fr5jt9j,"Up over 80% on this Facebook call I got this morning. Can’t sell because I’m on a limit of PDT. 

Someone get me a fucking rope now.",t3_gmlsuw,9
1589909803.0,2020-05-19,wallstreetbets,fr5jz2d,"GUYS, THE BOOMERS HAVENT EVEN HEARD THIS NEWS YET. HOLD FB OVERNIGHT",t3_gmlsuw,10
1589914917.0,2020-05-19,wallstreetbets,fr5ul65,VIRUS TALKS GOING POORLY,t3_gmlsuw,10
1589915181.0,2020-05-19,wallstreetbets,fr5v4xg,"MRNA fake pump and dump

SRNE fake pump and dump

GILD fake pump and dump.

Lots of money being made by Wall Street crooks suckering retail to buy stocks especially biotech with fake vaccine news being released.",t3_gmlsuw,8
1589915562.0,2020-05-19,wallstreetbets,fr5vxu6,[deleted],t3_gmlsuw,9
1589915622.0,2020-05-19,wallstreetbets,fr5w2fj,Caution: Billionaires at play,t3_gmlsuw,8
1589915660.0,2020-05-19,wallstreetbets,fr5w5cf,"Hey ya'll, this is the fed, spinnin it live for ya. Make sure to pound that like and subscribe button.",t3_gmlsuw,9
1589915783.0,2020-05-19,wallstreetbets,fr5weld,The people that pumped the market on the moderna news yesterday already knew the moderna news was fake.,t3_gmlsuw,8
1589916106.0,2020-05-19,wallstreetbets,fr5x2pj,"i dont care if you're bull or bear, this market movement is so fucking broken",t3_gmlsuw,9
1589916402.0,2020-05-19,wallstreetbets,fr5xowg,"Is the SEC a failing institution? Remember that crazy Gilead options volume before their ""treatment"" was announced? Moderna is the same thing.",t3_gmlsuw,10
1589917204.0,2020-05-19,wallstreetbets,fr5zctc,I take financial advice from a lizard,t3_gmlsuw,10
1589917211.0,2020-05-19,wallstreetbets,fr5zd9q,DD: I cashed out my 401k today. I think that's what triggered the drop. MMs got nervous seeing me walk away with a $2000 check.,t3_gmlsuw,11
1589917219.0,2020-05-19,wallstreetbets,fr5zduw,This gecko deserves an award for being 7/7.,t3_gmlsuw,11
1589917566.0,2020-05-19,wallstreetbets,fr60390,the SPY 293 support floor: https://i.imgur.com/3E3FKp0.jpg,t3_gmlsuw,9
1589917890.0,2020-05-19,wallstreetbets,fr60r12,Fuck daytrading limits.,t3_gmlsuw,9
1589917992.0,2020-05-19,wallstreetbets,fr60ye4,That fucking 🦎 is unreal,t3_gmlsuw,8
1589918000.0,2020-05-19,wallstreetbets,fr60yyr,This literally happened last Tuesday.,t3_gmlsuw,8
1589918031.0,2020-05-19,wallstreetbets,fr61184,"why is it that we go up 3% and no one is really notably insane, just pretty surprised

&#x200B;

but now spy is down \~0.80% and this is it this is the end of the spy as we know it",t3_gmlsuw,9
1589918609.0,2020-05-19,wallstreetbets,fr626ne,I can’t believe SPY missed earnings. We all thought it would blow it out of the water and we’d see 300!,t3_gmlsuw,10
1589918744.0,2020-05-19,wallstreetbets,fr62gb3,"Spy rejected 296 for 4th time since april 29th, daily volume was lowest since feb 20th and more than half todays volume was the last 2 hours dump. Take it how you will",t3_gmlsuw,9
1589886371.0,2020-05-19,wallstreetbets,fr4f9zf,I'm down 20k all time but my options value increased by 50 bucks so i'm basically getting rich again.,t3_gmlsuw,17
