created,date,subreddit,id,body,parent_id,score
1597237809.0,2020-08-12,wallstreetbets,g17l6qh,Fauci says Russia Corona vaccine not taste so good.,t3_i8b56i,9
1597237867.0,2020-08-12,wallstreetbets,g17la1i,There is no way I don’t lose money today.,t3_i8b56i,9
1597238030.0,2020-08-12,wallstreetbets,g17ljbn,How long til CNBC has a segment on corn?,t3_i8b56i,10
1597238195.0,2020-08-12,wallstreetbets,g17lsya,0dte calls on bacon egg and cheese sandys,t3_i8b56i,9
1597238388.0,2020-08-12,wallstreetbets,g17m487,Anyone still holding AAPL 450$ calls?,t3_i8b56i,8
1597238468.0,2020-08-12,wallstreetbets,g17m8vl,If I was a smart man I'd use yesterday as a lesson and escape with some metal profits....so I'll be loading up on SLV 25c 8/14 and GLD 185c 8/14 at open,t3_i8b56i,9
1597238479.0,2020-08-12,wallstreetbets,g17m9k8,Lowe’s calls quietly killing it.,t3_i8b56i,9
1597238500.0,2020-08-12,wallstreetbets,g17marl,"I bought Tesla shares and calls at the very top, and I'll still be down bigly, but I have renowned confidence my bag holding will pay off. TESLA GANG GET IN!!",t3_i8b56i,9
1597238582.0,2020-08-12,wallstreetbets,g17mfht,[deleted],t3_i8b56i,9
1597238679.0,2020-08-12,wallstreetbets,g17ml7d,"Kinda funny.

I’ve checked in here at 7, 8, and now 930.

Different takes on silver every time haha",t3_i8b56i,9
1597238749.0,2020-08-12,wallstreetbets,g17mpd4,Msft pls pump $4 today,t3_i8b56i,8
1597239086.0,2020-08-12,wallstreetbets,g17n9f6,HOLY FUCK WHY DOES REDDIT KEEP CLOSING COMMENTS,t3_i8b56i,10
1597239142.0,2020-08-12,wallstreetbets,g17ncsj,Silver 💎👋,t3_i8b56i,9
1597239337.0,2020-08-12,wallstreetbets,g17nom8,Ah another day where SPY goes up while everything it indexes is dropping. Got it.,t3_i8b56i,9
1597239433.0,2020-08-12,wallstreetbets,g17nud6,Today got me confused. So I bought corn.,t3_i8b56i,9
1597239540.0,2020-08-12,wallstreetbets,g17o12n,Somebody told me smile direct club is a fraud I’m thinking about buying calls,t3_i8b56i,10
1597239672.0,2020-08-12,wallstreetbets,g17o98v,This market is gay af. Don’t listen to anyone saying they know what’s gonna moon. Everyone is just running around doing random shit,t3_i8b56i,10
1597239939.0,2020-08-12,wallstreetbets,g17opvg,"Apple:  Up 4$ today
My calls: Also up 4$ today",t3_i8b56i,8
1597240381.0,2020-08-12,wallstreetbets,g17pi26,"looks like value selling off, moving back into tech?",t3_i8b56i,8
1597240467.0,2020-08-12,wallstreetbets,g17pnm7,[deleted],t3_i8b56i,9
1597240792.0,2020-08-12,wallstreetbets,g17q8rg,I was about to kill myself this morning but no more now lol,t3_i8b56i,9
1597241704.0,2020-08-12,wallstreetbets,g17rvhv,That moment your put order gets filled and spy jumps .40 🤡,t3_i8b56i,9
1597241714.0,2020-08-12,wallstreetbets,g17rw3q,Trevor Milton stole my first edition Charizard in 1999,t3_i8b56i,9
1597241752.0,2020-08-12,wallstreetbets,g17rylw,"I know comments in this sub are like 99% the ravings of madmen screaming their wishes into the wind, but y'all sound extra raving this morning.",t3_i8b56i,9
1597242781.0,2020-08-12,wallstreetbets,g17tw5s,Nothing hurts as much as selling a call for a loss then seeing it moon a few days after,t3_i8b56i,9
1597243265.0,2020-08-12,wallstreetbets,g17ut86,Lot's of dip buyers at 337...,t3_i8b56i,8
1597243381.0,2020-08-12,wallstreetbets,g17v16v,“TSLAs up 8% in an hour? Time to buy calls 😎”,t3_i8b56i,9
1597243428.0,2020-08-12,wallstreetbets,g17v4bf,SPY wants to dump,t3_i8b56i,9
1597243455.0,2020-08-12,wallstreetbets,g17v6au,[deleted],t3_i8b56i,9
1597243905.0,2020-08-12,wallstreetbets,g17w1dd,"I could literally make a billion opening my own firm and telling my investors to do the opposite of what I tell them. 

Reverse Financials, Inc.

God I fuckin suck",t3_i8b56i,10
1597243911.0,2020-08-12,wallstreetbets,g17w1sj,"amd u beautiful bastard


😭


tears of joy


my portfolio just got promoted from dumpster fire to train wreck 


🙌",t3_i8b56i,9
1597243977.0,2020-08-12,wallstreetbets,g17w6f2,"Real talk guys. I'm 12k away from 69,420.69. I need some solid plays to make the meme happen. I will make a post when I acheive this most holy of goals.",t3_i8b56i,8
1597244615.0,2020-08-12,wallstreetbets,g17xf3q,It’s impressive how I lose money on days everything is green when I have calls,t3_i8b56i,10
1597244768.0,2020-08-12,wallstreetbets,g17xpzq,I’m going to be so mad when I ultimately miss the big crash by a day,t3_i8b56i,8
1597244928.0,2020-08-12,wallstreetbets,g17y18u,"Sorry babe. As much as I want to settle down with you, cob mob would never let me.",t3_i8b56i,10
1597245130.0,2020-08-12,wallstreetbets,g17yfgq,"While my trading platform usually gives me relevant news, I don't know how the fuck this ended up on my feed

> REUTERS: FIRST REPORT OF ITS KIND RELEASED EXPOSING CAT MEAT TRADE IN VIETNAM",t3_i8b56i,9
1597245322.0,2020-08-12,wallstreetbets,g17ytbm,[deleted],t3_i8b56i,9
1597246018.0,2020-08-12,wallstreetbets,g1807zn,Have a cornfield next to my house. Can confirm it is growing,t3_i8b56i,9
1597246185.0,2020-08-12,wallstreetbets,g180k1q,Imagine being balls deep in corn watching tech meme it’s way up again while you’re betting your house on a side dish.,t3_i8b56i,9
1597246302.0,2020-08-12,wallstreetbets,g180sm9,Baba only moons when everyone’s wiped out first,t3_i8b56i,9
1597246335.0,2020-08-12,wallstreetbets,g180uz8,"Trevor Milton announces he will be splitting, not the stock but his legs.",t3_i8b56i,9
1597246429.0,2020-08-12,wallstreetbets,g1811rh,Rip the guy who had spy puts print 500% yesterday but couldn’t sell cause of pdt,t3_i8b56i,9
1597246460.0,2020-08-12,wallstreetbets,g181441,It'd be funny if it wasn't happening to me,t3_i8b56i,9
1597246509.0,2020-08-12,wallstreetbets,g1817pa,"Dip then Rip, TSLA. we want 1550 EOd",t3_i8b56i,9
1597246866.0,2020-08-12,wallstreetbets,g181xv6,"Are you retards really investing in corn futures?

tf",t3_i8b56i,10
1597247481.0,2020-08-12,wallstreetbets,g1837ua,"electric cars, rocket ships, silver, and corn; the backbone of the wsb economy",t3_i8b56i,9
1597247773.0,2020-08-12,wallstreetbets,g183ttx,Shaun King is an actual cuck,t3_i8b56i,8
1597247997.0,2020-08-12,wallstreetbets,g184am8,When are these stalks supposed to go up?? 🌽🌽🌽,t3_i8b56i,9
1597248494.0,2020-08-12,wallstreetbets,g185bsf,Corn only grows Up,t3_i8b56i,8
1597248602.0,2020-08-12,wallstreetbets,g185knc,Stalks only go up 🌽,t3_i8b56i,8
1597248993.0,2020-08-12,wallstreetbets,g186gom,Is spy going to keep going up?,t3_i8b56i,9
1597249313.0,2020-08-12,wallstreetbets,g1877rf,"SPY has traveled 1.7% in 4 cash trading hours, immediately after a sell off.",t3_i8b56i,9
1597249446.0,2020-08-12,wallstreetbets,g187j2m,"We may be fuk but atleast we offset it with stock market tendies.

 Tik Tok generation r even more fuk lol",t3_i8b56i,9
1597249715.0,2020-08-12,wallstreetbets,g1885ox,WOW CORN IS POPPIN',t3_i8b56i,8
1597249862.0,2020-08-12,wallstreetbets,g188hwi,Will TSLA give us one of the autistic back to back 10% days?,t3_i8b56i,8
1597250032.0,2020-08-12,wallstreetbets,g188w30,Yesterday never happened?,t3_i8b56i,9
1597250076.0,2020-08-12,wallstreetbets,g188zps,"So im a permabull and loving this faceripping rally, but any of yall getting a bit nervous? Too much euphoria going around. Am i being too paranoid?",t3_i8b56i,9
1597252360.0,2020-08-12,wallstreetbets,g18e6g1,FUCK IT IM HOLDING MY TESLA CALL OVERNIGHT,t3_i8b56i,9
1597253523.0,2020-08-12,wallstreetbets,g18gvqx,I’m so bad at war zone it’s insane,t3_i8b56i,10
1597253589.0,2020-08-12,wallstreetbets,g18h1b1,TSLA 🥰 I’m in it for the thrill ride,t3_i8b56i,9
1597253719.0,2020-08-12,wallstreetbets,g18hc95,"I'd like to thank BA, TDOC, AYX, JPM for making me fucking red on a massive green day.",t3_i8b56i,9
1597255081.0,2020-08-12,wallstreetbets,g18kj86,13 fucking percent on TSLA today. This is wild.,t3_i8b56i,9
1597255288.0,2020-08-12,wallstreetbets,g18l0kv,Tesla is actually so fucking crazy,t3_i8b56i,8
1597255321.0,2020-08-12,wallstreetbets,g18l3at,If you don't take profits rn ur retarded,t3_i8b56i,9
1597255497.0,2020-08-12,wallstreetbets,g18lhv4,Who’s holding TSLA overnight?,t3_i8b56i,9
1597255556.0,2020-08-12,wallstreetbets,g18lmo3,"today... today, is for the boys.",t3_i8b56i,9
1597255582.0,2020-08-12,wallstreetbets,g18loox,I’m actually laughing my ass off right now that hundreds or thousands of people here played corn as a serious move. I’ll have a nice roasted ear in honor of you fine lads tonight.,t3_i8b56i,8
1597255680.0,2020-08-12,wallstreetbets,g18lwqa,Is anybody actually confident about holding OTM Tesla calls over night?,t3_i8b56i,11
1597255754.0,2020-08-12,wallstreetbets,g18m2yz,TSLA really carrying my whole portfolio.,t3_i8b56i,9
1597255785.0,2020-08-12,wallstreetbets,g18m5ie,Bull or bear; this shit is strange.,t3_i8b56i,8
1597255828.0,2020-08-12,wallstreetbets,g18m932,😐👉🏻VIX😇  do something,t3_i8b56i,10
1597256029.0,2020-08-12,wallstreetbets,g18mpvx,"What are the chances Trevor Milton announces a 40:1 stock split of NKLA to copy Elon make it accessible not only to retail investors, but even to the homeless?",t3_i8b56i,8
1597256427.0,2020-08-12,wallstreetbets,g18nmjl,"imagine selling TSLA OTM calls at like 12:55 thinking its up 1,000% how much further can it really go?

1 hr later: up 7,000%.",t3_i8b56i,10
1597256528.0,2020-08-12,wallstreetbets,g18nv1x,is this a WSB reddit or a TSLA one?  Sometimes i cant even tell.,t3_i8b56i,8
1597256539.0,2020-08-12,wallstreetbets,g18nvw9,Daddy Musk making my account beautious again 😘🥰😘,t3_i8b56i,8
1597256943.0,2020-08-12,wallstreetbets,g18otnh,"TSLA rips like this once a month, make sure you catch the next one boys",t3_i8b56i,8
1597256948.0,2020-08-12,wallstreetbets,g18ou1s,Hold Tesla calls to tomorrow?,t3_i8b56i,10
1597257138.0,2020-08-12,wallstreetbets,g18p9yh,One day I’ll hit on a lottery ticket,t3_i8b56i,9
1597257168.0,2020-08-12,wallstreetbets,g18pcdf,This thread is literally autists screaming about tesla,t3_i8b56i,10
1597257203.0,2020-08-12,wallstreetbets,g18pfaw,"just made $2100 holding tesla 1580 8/15 for 5 minutes, I guess I get it now",t3_i8b56i,9
1597257239.0,2020-08-12,wallstreetbets,g18pi7v,"Been trading options for a while. i cant even process the thousands I have lost trying to play TSLA over the past month, and any teenage fuck with a smartphone and a robinhood app probably just gained more today on TSLA than i did all year",t3_i8b56i,7
1597257321.0,2020-08-12,wallstreetbets,g18pp23,That autist that bought the TSLA 1500c 8/14s yesterday a few minutes before close has a 30 bagger as of right now.,t3_i8b56i,10
1597257354.0,2020-08-12,wallstreetbets,g18prsu,AAPL and TSLA splitting this close together is a once in a lifetime opportunity. Im getting loaded to the tits on shares of them bad boys.,t3_i8b56i,8
1597257684.0,2020-08-12,wallstreetbets,g18qj13,Bought 40 8/14P SPY 335 fuck it,t3_i8b56i,8
1597257720.0,2020-08-12,wallstreetbets,g18qlyw,Everything I touch only goes up.,t3_i8b56i,10
1597257807.0,2020-08-12,wallstreetbets,g18qt3c,u/trainwreck001 has a weird comment history,t3_i8b56i,8
1597257848.0,2020-08-12,wallstreetbets,g18qwgn,"Lord Elon hear my prayer,

Next iteration of Thine simulation, give me the mental fortitude and adamantium hands to always all in Thine stock.

Amen",t3_i8b56i,11
1597257888.0,2020-08-12,wallstreetbets,g18qzrq,Just checked my account. Life is beautiful. Get that money fam!!,t3_i8b56i,8
1597257972.0,2020-08-12,wallstreetbets,g18r70e,Finally got rid off that shit Netflix and reallocated into Apple and Nivdia.,t3_i8b56i,9
1597258013.0,2020-08-12,wallstreetbets,g18racf,"🐻 or 🐂

If you ain't hard for this power hour, you ain't alive",t3_i8b56i,9
1597258038.0,2020-08-12,wallstreetbets,g18rcfn,VXX FDs for power hour. Pray for me.,t3_i8b56i,8
1597258070.0,2020-08-12,wallstreetbets,g18rf0u,I have SPY puts but this feels like a face ripper type of power hour coming up ngl,t3_i8b56i,10
1597258455.0,2020-08-12,wallstreetbets,g18saya,PDT fucked me,t3_i8b56i,9
1597258759.0,2020-08-12,wallstreetbets,g18sznk,Got way too greedy on TSLA calls and now I’m scared,t3_i8b56i,8
1597258781.0,2020-08-12,wallstreetbets,g18t1j5,Who bought Tesla at the top?? 😵🤭,t3_i8b56i,9
1597258796.0,2020-08-12,wallstreetbets,g18t2so,Any retards out there buying puts still?,t3_i8b56i,9
1597259179.0,2020-08-12,wallstreetbets,g18tybz,.,t3_i8b56i,9
1597259619.0,2020-08-12,wallstreetbets,g18ux57,"[https://www.reddit.com/r/options/comments/i8jed9/lost\_50\_on\_corn\_calls/](https://www.reddit.com/r/options/comments/i8jed9/lost_50_on_corn_calls/)

&#x200B;

holy shit lmaooo a noob hopped on the retarded CORN play and lost 50%. Fairly confident he got the idea from here.",t3_i8b56i,9
1597260016.0,2020-08-12,wallstreetbets,g18vs04,"DOUBLE TOP SOON, HERE WE GO! GET READY FOR THE PLUNGE BOYS!",t3_i8b56i,9
1597260275.0,2020-08-12,wallstreetbets,g18wbxu,"I will not fomo SPY

I will not fomo SPY

I will not fomo SPY",t3_i8b56i,9
1597260387.0,2020-08-12,wallstreetbets,g18wksh,This is sooooo retarded,t3_i8b56i,9
1597260830.0,2020-08-12,wallstreetbets,g18xjqg,"Yall wanna hear a joke?? 

&#x200B;

&#x200B;

**SPY 338**",t3_i8b56i,8
1597260942.0,2020-08-12,wallstreetbets,g18xsc4,Fuckkkk!!!! SLV is dipping again. Gotta hold diamond hands,t3_i8b56i,9
1597261075.0,2020-08-12,wallstreetbets,g18y2l9,Weak dump TBH,t3_i8b56i,9
1597261230.0,2020-08-12,wallstreetbets,g18yedt,if TSLA stays the same price tomorrow my account is GONE,t3_i8b56i,8
1597261232.0,2020-08-12,wallstreetbets,g18yekr,Now they are questioning accuracy of virus data.  I mean who didnt see that coming that coming when we made the WH in charge of the data instead of the CDC.,t3_i8b56i,9
1597261409.0,2020-08-12,wallstreetbets,g18ys0g,#RUN ELON RUNNNNNNNN,t3_i8b56i,9
1597261427.0,2020-08-12,wallstreetbets,g18ytdg,MISSING OUT ON TSLA WILL BE YOUR BIGGEST REGRET,t3_i8b56i,8
1597261516.0,2020-08-12,wallstreetbets,g18z0b6,Never sell in panic mode. You just literally flushing money down the toilet. Just my 2 cents. Fml,t3_i8b56i,11
1597261642.0,2020-08-12,wallstreetbets,g18za48,I feel like tesla is gonna gap up again tomorrow lol,t3_i8b56i,11
1597261671.0,2020-08-12,wallstreetbets,g18zccq,"Who else is going to be having some capital loss tax deductions for 2020? 👌

Edit: The way I see it is at least this type of gambling can be written off 😂",t3_i8b56i,7
1597262237.0,2020-08-12,wallstreetbets,g190kbl,[deleted],t3_i8b56i,9
1597262691.0,2020-08-12,wallstreetbets,g191j5w,i didnt sell my 3000% tsla gain? why? this is a casino. thats it. nothing else,t3_i8b56i,9
1597262735.0,2020-08-12,wallstreetbets,g191ml8,If you lost money today it’s time to just get a regular job,t3_i8b56i,8
1597263573.0,2020-08-12,wallstreetbets,g193f9h,"According to the stock market, Covid and global shut downs never happened lol.",t3_i8b56i,9
1597228928.0,2020-08-12,wallstreetbets,g179r1g,"this thread is so dead compared to last night

metal gang died haha",t3_i8b56i,18
1597229720.0,2020-08-12,wallstreetbets,g17al7l,Buy airlines and cruises fellas. So I can sell my bags to you.,t3_i8b56i,17
1597235362.0,2020-08-12,wallstreetbets,g17hj24,"*watching precious metals rise*

**LOOK AT THE VIOLENCE. SPEED. MOMENTUM!**",t3_i8b56i,17
1597229379.0,2020-08-12,wallstreetbets,g17a86o,Us Europoors are pushing up the stocks again. I hope the Amerifags don't blow them again like yesterday.,t3_i8b56i,17
1597229552.0,2020-08-12,wallstreetbets,g17aete,Diamond hands SLV gang report in,t3_i8b56i,16
1597235719.0,2020-08-12,wallstreetbets,g17i193,aw shucks,t1_g17hqbo,95
1597230568.0,2020-08-12,wallstreetbets,g17biam,EXCLUSIVE OFFER: FOR A LIMITED TIME BUY ONE SHARE GET 4 FREE!!!!,t1_g17bfag,45
1597236134.0,2020-08-12,wallstreetbets,g17imqu,I swear the whole gold pump is because of those commercials they're running 24/7 to cuck boomers on daytime news.,t1_g17ifec,19
1597233352.0,2020-08-12,wallstreetbets,g17etbq,"can confirm, saw this guy on farmersonly.com",t1_g17er88,106
1597231133.0,2020-08-12,wallstreetbets,g17c4yc,Fuck work. Boys rule,t1_g17c1xk,28
1597234900.0,2020-08-12,wallstreetbets,g17gvo3,Grande if true,t1_g17grfs,92
1597231348.0,2020-08-12,wallstreetbets,g17cdsa,Is it a hobie or are you poor?,t1_g17c9wb,20
1597231467.0,2020-08-12,wallstreetbets,g17ciob,Get this man a PRPL,t1_g17ccui,110
1597231402.0,2020-08-12,wallstreetbets,g17cfze,[deleted],t1_g17ccui,20
1597227605.0,2020-08-12,wallstreetbets,g178dw7,Most of us are long we gucci,t1_g177yr1,19
1597235177.0,2020-08-12,wallstreetbets,g17h9n9,because WSB will trade anything that moons. usually YOLOing in at the exact top right before it stops mooning and goes down again,t1_g17gz0l,40
1597234806.0,2020-08-12,wallstreetbets,g17gr3d,Cont. we have no morals when making money. Will pump a company that sells kids in their closet if that is what it takes. I feel at home here,t1_g17gi2l,17
1597234954.0,2020-08-12,wallstreetbets,g17gyaq,"That’s actually a really good point. I couldn’t figure out why I enjoy this cesspool so much but it’s because it’s honest. And really funny. 

You all suck and I love you.",t1_g17gi2l,12
1597235117.0,2020-08-12,wallstreetbets,g17h6jz,"Doesn't need a reason, it's the default state these days lmao",t1_g17h2uo,11
1597232824.0,2020-08-12,wallstreetbets,g17e5o4,Are you dumbasses playing corn options now,t1_g17dzf6,27
1597253745.0,2020-08-12,wallstreetbets,g18heg6,depends on how her mother looks,t1_g18ha4a,14
1597228015.0,2020-08-12,wallstreetbets,g178st5,"Man, if more people had experienced a loved one on a respirator, especially at a healthy young age, there'd be a lot more people on-board with masks.  My wife aspirated while being sedated for a routine procedure last year (aged 39) and spent 36+ hours on a ventilator.  It was not pleasant to watch, and even worse for her to experience.",t1_g178n87,35
1597228018.0,2020-08-12,wallstreetbets,g178sxb,"Natural selection?

I’m going to hell aren’t I.",t1_g178n87,32
1597230244.0,2020-08-12,wallstreetbets,g17b5ol,Weird way of saying “I’m a fucking idiot”,t1_g17b0gt,9
1597228510.0,2020-08-12,wallstreetbets,g179bby,I’m still alive but barely breathing,t1_g17983o,25
1597228478.0,2020-08-12,wallstreetbets,g179a6u,Right here. Hanging on by a thread,t1_g17983o,9
1597232173.0,2020-08-12,wallstreetbets,g17dd19,[deleted],t1_g17d5vs,26
1597232074.0,2020-08-12,wallstreetbets,g17d8qc,Daytrade spy,t1_g17d5vs,9
1597233741.0,2020-08-12,wallstreetbets,g17fbk5,Our wife*,t1_g17f5et,18
1597228381.0,2020-08-12,wallstreetbets,g1796k9,"inflation wont really kick off until the real economy recovers

aka

if people have $1000 and stuff it into their mattress (stocks, real estate, bonds) and congress prints another $1000 does it really matter if that goes into the mattress too",t1_g179072,10
1597235416.0,2020-08-12,wallstreetbets,g17hluc,Calls on Champions Club.,t1_g17hj24,12
1597233593.0,2020-08-12,wallstreetbets,g17f4i9,"Stalker. 

Get it. Corn stalks. #Lol

Kinda corny. 🌽",t1_g17etbq,13
1597232296.0,2020-08-12,wallstreetbets,g17difz,I’m on wsb obviously I’m poor,t1_g17cdsa,44
