created,date,subreddit,id,body,parent_id,score
1617217063.0,2021-03-31,wallstreetbets,gsy1mon,"Last day to sign up for the paper trading competition! 100k here we come!

Comment here: 

https://www.reddit.com/r/wallstreetbets/comments/mdz6oc/join_rwallstreetbets_third_annual_paper_trading/",t3_mh2ryh,1
1617191701.0,2021-03-31,wallstreetbets,gswm8oi,Some guy hacked my RH account and stole $6k. I think his name is Dow Jones.,t3_mh2ryh,204
1617191072.0,2021-03-31,wallstreetbets,gswle95,I found myself telling someone that my portfolio is mostly long-term holds and wondered immediately if that's just code for absolute dog shit.,t3_mh2ryh,182
1617192541.0,2021-03-31,wallstreetbets,gswnefj,Anyone else’s broker glitching? Mine is showing PLTR green,t3_mh2ryh,144
1617194496.0,2021-03-31,wallstreetbets,gswqcei,"So you’re saying that every losing trade that I make, there is some guy on the other side profiting from all my losses. That guy Is a fucking genius",t3_mh2ryh,97
1617188108.0,2021-03-31,wallstreetbets,gswhtnc,[deleted],t3_mh2ryh,230
1617190823.0,2021-03-31,wallstreetbets,gswl2kq,"My wife is my sugar mama, and I’m a stay at home dad now with our 2 kids + 1 in preschool. My job is literally to coach his TeeBall team and make us vacation money on the market. Best career ever.",t3_mh2ryh,212
1617192009.0,2021-03-31,wallstreetbets,gswmnq1,Tech is about to fucking RIP,t3_mh2ryh,50
1617192219.0,2021-03-31,wallstreetbets,gswmy9q,"Cool, just need like 20 consecutive days green like this and I’m back to even for the year",t3_mh2ryh,52
1617196556.0,2021-03-31,wallstreetbets,gswtsk3,Apple should be viewed as a really good savings account with better interest,t3_mh2ryh,43
1617207657.0,2021-03-31,wallstreetbets,gsxgtca,This market is the abusive boyfriend that beats the shit out of you for 2 months then buys you 10 dollars worth of roses and you forgive him.,t3_mh2ryh,46
1617212738.0,2021-03-31,wallstreetbets,gsxs5g3,I've traded over $9000 today for a total gain of $1.53,t3_mh2ryh,41
1617187570.0,2021-03-31,wallstreetbets,gswh83t,I sure do hope stocks go up today,t3_mh2ryh,38
1617192700.0,2021-03-31,wallstreetbets,gswnmk8,"Let’s be honest, no one here trusts or is excited to see green PM after the last two weeks",t3_mh2ryh,39
1617194420.0,2021-03-31,wallstreetbets,gswq816,"Down jones down, nasdaq up.
This is the market i know",t3_mh2ryh,40
1617215224.0,2021-03-31,wallstreetbets,gsxxlx1,"My wife just doesn’t understand the stock market. She thinks I lost $120,694 last year, but I really just gained 120,694 knowledge points. When will she finally understand that you have to spend money to make money",t3_mh2ryh,38
1617188784.0,2021-03-31,wallstreetbets,gswil5h,"Some stocks may go up today, some may go down.",t3_mh2ryh,30
1617195262.0,2021-03-31,wallstreetbets,gswrld6,Today is a very emotional day for me because I gained back all my losses throughout last year,t3_mh2ryh,35
1617212338.0,2021-03-31,wallstreetbets,gsxr9nu,new business idea: Meat-Based Plant substitutes. BeyondGreens,t3_mh2ryh,30
1617185158.0,2021-03-31,wallstreetbets,gswepp1,Hitting the pecs today so my tits can be jacked,t3_mh2ryh,27
1617199814.0,2021-03-31,wallstreetbets,gswzwqc,"never doing options again

for now",t3_mh2ryh,26
1617204941.0,2021-03-31,wallstreetbets,gsxarkh,"this fucking day trading rule is unbelievably stupid

It doesn't help anyone, it just makes trading so much harder

With how volatile this market is you need to be ready to sell a position and you cant because of this pdt rule",t3_mh2ryh,29
1617207986.0,2021-03-31,wallstreetbets,gsxhjlg,You might be curious about that PLTR drop? That was me buying at the top,t3_mh2ryh,27
1617208952.0,2021-03-31,wallstreetbets,gsxjpsq,The people who bought puts on TSLA when it hit $590 yesterday are the same people who bought calls on TSLA when it hit $900,t3_mh2ryh,26
1617213676.0,2021-03-31,wallstreetbets,gsxu8rk,"$50K —> $20K —> $500 —> $5K

Somehow I feel like a winner",t3_mh2ryh,23
1617189632.0,2021-03-31,wallstreetbets,gswjldi,"Sentiment around chewy is WAY too positive.

buying puts.",t3_mh2ryh,25
1617205384.0,2021-03-31,wallstreetbets,gsxbr3t,"I don't trust this recovery, I refuse to let the stock market hurt me again",t3_mh2ryh,24
1617205976.0,2021-03-31,wallstreetbets,gsxd2uf,Today is when PLTR buys me a dozen roses after beating me bloody for a few weeks... I accept the apology and I still love her.,t3_mh2ryh,24
1617193850.0,2021-03-31,wallstreetbets,gswpbwr,"God I love seeing PLTR green. Even though I know it’s gonna plummet at open and slowly meander up to slightly below where it opened. It’s like my dying plant that perks up a little Everytime I water it but slowly continues to wither away no matter how much or little I water/fertilize/sun bathe it.

PLTR 100$ EOD",t3_mh2ryh,23
1617194839.0,2021-03-31,wallstreetbets,gswqwh5,"If we sell off at open, I might actually become a completely broken man.",t3_mh2ryh,23
1617205441.0,2021-03-31,wallstreetbets,gsxbvjz,"Down 30% all time, how do i turn this around?",t3_mh2ryh,22
1617184962.0,2021-03-31,wallstreetbets,gsweinz,All I need is a +25% day then we can forget the last 2 months ever happened,t3_mh2ryh,71
1617188265.0,2021-03-31,wallstreetbets,gswhzw7,[deleted],t3_mh2ryh,22
1617192743.0,2021-03-31,wallstreetbets,gswnopi,My arms are going to be so ripped from holding these BB bags.,t3_mh2ryh,21
1617193612.0,2021-03-31,wallstreetbets,gswoysd,"I like watching the chart on RH but it baffles me that people still invest with them.  Since using Fidelity, I feel like I'm using a big-boy broker now.",t3_mh2ryh,21
1617214721.0,2021-03-31,wallstreetbets,gsxwieb,I just bought a SPY put. It's going to moon past 400 now. You're welcome,t3_mh2ryh,23
1617219051.0,2021-03-31,wallstreetbets,gsy5ydg,I’m in MVIS at an average of $1.25 so I’m holding forever,t3_mh2ryh,22
1617190952.0,2021-03-31,wallstreetbets,gswl8k1,TSLA 1DTE $700Cs looks like it can't go tits up,t3_mh2ryh,21
1617208133.0,2021-03-31,wallstreetbets,gsxhvm4,20 more days like this and I'll break even,t3_mh2ryh,22
1617184872.0,2021-03-31,wallstreetbets,gswefe8,"Lol, seen this: 

“If you need a stimmy to satisfy a margin call, you don’t have to worry about Biden’s tax plan”",t3_mh2ryh,99
1617220472.0,2021-03-31,wallstreetbets,gsy91t2,"Alright Joe....go out there, read your teleprompter, don’t tell weird stories, and don’t say anything that could fuck this up.",t3_mh2ryh,20
1617189216.0,2021-03-31,wallstreetbets,gswj367,I just need 200% gain on TLRY to make it close to being green. Is that really too much to ask?,t3_mh2ryh,61
1617191435.0,2021-03-31,wallstreetbets,gswlvns,Today SPY will either hit 400 or the world economy will collapse,t3_mh2ryh,19
1617202859.0,2021-03-31,wallstreetbets,gsx68y2,"PLNTR TO 25$ EOD
Can we get some chest beatings and some aggressive grunts going",t3_mh2ryh,19
1617209155.0,2021-03-31,wallstreetbets,gsxk66j,"What is the strongest force in the universe?

tsla fomo",t3_mh2ryh,19
1617199896.0,2021-03-31,wallstreetbets,gsx02o3,PLTR is flying now to fuck all those people who set limit orders at 19.99.,t3_mh2ryh,18
1617205349.0,2021-03-31,wallstreetbets,gsxbo88,"AMC must stand for ""Always More Conspiracies"" cause these idiots are calling SEC filings fake news.",t3_mh2ryh,19
1617207672.0,2021-03-31,wallstreetbets,gsxgukg,Pltr: Thanks for the $1.60 today.  Don't forget you still owe me another  $10 though.,t3_mh2ryh,19
1617208127.0,2021-03-31,wallstreetbets,gsxhv56,Get ready for a massive disca green dildo soon,t3_mh2ryh,19
1617211135.0,2021-03-31,wallstreetbets,gsxol8f,I would watch 30 second ads for additional day trades.,t3_mh2ryh,18
1617213243.0,2021-03-31,wallstreetbets,gsxt9u9,Where my PLTR holders at?,t3_mh2ryh,18
1617190365.0,2021-03-31,wallstreetbets,gswkhgk,"EuroTard here who will **not** stare at tickers an hour early because they forgot clocks moved on Sunday and wonder why everything is frozen.  Yes, it was already Tuesday but still . . .",t3_mh2ryh,18
1617194686.0,2021-03-31,wallstreetbets,gswqnij,"Lol tesla bears crying, not realizing that their entire premise of valuing it on earnings ratio is something the rest of the market clearly took into consideration a long goddamn time ago.",t3_mh2ryh,16
1617197956.0,2021-03-31,wallstreetbets,gswwc6e,Everything is green. I’m sure this will last.,t3_mh2ryh,18
1617199762.0,2021-03-31,wallstreetbets,gswzt43,Holy moly PLTR fly you beautiful bastard!,t3_mh2ryh,16
1617200659.0,2021-03-31,wallstreetbets,gsx1mv4,Let’s go TSLA...breakout above $700,t3_mh2ryh,17
1617201176.0,2021-03-31,wallstreetbets,gsx2p8o,$PLTR don’t do this to me.. don’t give me hope..,t3_mh2ryh,17
1617204574.0,2021-03-31,wallstreetbets,gsx9yj2,Ummmm PLTR is that... you?,t3_mh2ryh,17
1617205668.0,2021-03-31,wallstreetbets,gsxcdys,PALANTIR BACK FROM THE DEAD,t3_mh2ryh,17
1617208023.0,2021-03-31,wallstreetbets,gsxhmko,See you in DISCA thread tomorrow,t3_mh2ryh,16
1617211636.0,2021-03-31,wallstreetbets,gsxppc5,I retract my statement. I am once again NOT taking profits on PLTR and will regret it when it’s down 10% tomorrow,t3_mh2ryh,16
1617212593.0,2021-03-31,wallstreetbets,gsxrty4,"Biden: We're going to spend a bunch of money to fix roads and stuff

Roku: Up 5%",t3_mh2ryh,18
1617219507.0,2021-03-31,wallstreetbets,gsy6yah,MVIS just saved my dying gambling career lol,t3_mh2ryh,16
1617219726.0,2021-03-31,wallstreetbets,gsy7fhn,"sorry, top is in on MVIS, I just bought.",t3_mh2ryh,17
1617185092.0,2021-03-31,wallstreetbets,gswen97,"**clutches tsla puts**

*I'm not gay, I'm not gay, I'm not gay, I'm not gay...*",t3_mh2ryh,15
1617186566.0,2021-03-31,wallstreetbets,gswg5d1,NOTHIN QUITE LIKE THE SMELL OF GREEN DILDOS IN THE MORNING,t3_mh2ryh,16
1617188615.0,2021-03-31,wallstreetbets,gswie4x,Jesus and our PLTR calls are both gonna come back to life this week,t3_mh2ryh,15
1617189835.0,2021-03-31,wallstreetbets,gswju38,Pltr green close and green pre market? April fools is tomorrow tho,t3_mh2ryh,16
1617191372.0,2021-03-31,wallstreetbets,gswlsmi,Bulls going on a stampede today,t3_mh2ryh,15
1617191734.0,2021-03-31,wallstreetbets,gswmaaz,"ARK removes 30% cap on single security in fund. Cathie gonna buy more TSLA guaranteed

TSLA 700 eow",t3_mh2ryh,17
1617197978.0,2021-03-31,wallstreetbets,gswwdpi,Wow I really sold PLTR at 21 USD... I really am retarded... BUy high sell low. This is the way.,t3_mh2ryh,16
1617202187.0,2021-03-31,wallstreetbets,gsx4tdk,whats with Discovery? did Alaskan gold miners get a new season or what,t3_mh2ryh,15
1617203615.0,2021-03-31,wallstreetbets,gsx7v47,What’s going on with Discovery?!??,t3_mh2ryh,15
1617205243.0,2021-03-31,wallstreetbets,gsxbfrp,"VXX up, TLT up, SPY up. SPY lies",t3_mh2ryh,16
1617205981.0,2021-03-31,wallstreetbets,gsxd3ah,Pltr saving my ass rn,t3_mh2ryh,16
1617206835.0,2021-03-31,wallstreetbets,gsxezoc,"Say it with me:  
A

Ap

Ape

Aper

Aperil

AAPL",t3_mh2ryh,15
1617210665.0,2021-03-31,wallstreetbets,gsxnjg9,"My thesis on BB:

* The letter B is shaped like Boobs and Butts.
* BB is the abbreviation of Boobs and Butts.
* I can type the whole ticker with a single button.
* It is currently available for a discount.",t3_mh2ryh,16
1617211080.0,2021-03-31,wallstreetbets,gsxogtg,Imagine going nearly all in on discb margin getting margin called and liquidated then watching it double in one day 😂😂,t3_mh2ryh,17
1617215868.0,2021-03-31,wallstreetbets,gsxz0kg,"drank 6 beers in 26 minutes, fkn staggering into power hour",t3_mh2ryh,17
1617216326.0,2021-03-31,wallstreetbets,gsy00g5,"How to tell you might have too many positions:

Your portfolio jumps 4% in 20 minutes and you can't find where it came from to see if it's time to take profit",t3_mh2ryh,17
1617221500.0,2021-03-31,wallstreetbets,gsybbd6,Imagine not being nervously glued to your screen for 6 and half hours in this market,t3_mh2ryh,15
1617189130.0,2021-03-31,wallstreetbets,gswizib,Figure out how the hell Credit Suisse is suffering a smaller loss than some of my tickers that just posted fantastic earnings.,t3_mh2ryh,16
1617194490.0,2021-03-31,wallstreetbets,gswqc26,[deleted],t3_mh2ryh,14
1617201403.0,2021-03-31,wallstreetbets,gsx366z,#**Reminder market closed Friday. Weeklies expires tomorrow**,t3_mh2ryh,16
1617202842.0,2021-03-31,wallstreetbets,gsx67nl,"$PLTR is up 5% today -- we can take it to the moon, y'all.. Now's the time to get in!",t3_mh2ryh,15
1617206045.0,2021-03-31,wallstreetbets,gsxd8iw,"guy: Will my PLTR calls be okay tomorrow?

Kid on Twitter who's not even old enough to legally trade: Yes 

guy: Thanks man!",t3_mh2ryh,14
1617206073.0,2021-03-31,wallstreetbets,gsxdap0,Crazy to see how bullish this sub becomes after one green day,t3_mh2ryh,16
1617220066.0,2021-03-31,wallstreetbets,gsy8654,Microsoft will buyout out MVIS now with the contract announcement.,t3_mh2ryh,15
1617190343.0,2021-03-31,wallstreetbets,gswkgiq,Why yes I got my $7.90 dividend today so I just need to receive it 400 times to break even,t3_mh2ryh,46
1617184948.0,2021-03-31,wallstreetbets,gswei6d,Stock is hard lmao,t3_mh2ryh,14
1617193701.0,2021-03-31,wallstreetbets,gswp3nw,"*Buy the fucking dip, you dumb bitch*
 -Abraham Lincoln",t3_mh2ryh,13
1617193782.0,2021-03-31,wallstreetbets,gswp85c,Apes your megathread is open.,t3_mh2ryh,13
1617195953.0,2021-03-31,wallstreetbets,gswsqtf,Ber fuk today. Very fuk,t3_mh2ryh,15
1617196631.0,2021-03-31,wallstreetbets,gswtxdf,Are you also scarred from the last 8 weeks and can no longer be excited with an overall +2% on your portfolio pre market because you think it’s going to come crashing down?,t3_mh2ryh,15
1617197898.0,2021-03-31,wallstreetbets,gsww8bv,Recession cancelled.,t3_mh2ryh,13
1617199760.0,2021-03-31,wallstreetbets,gswzswq,PLTR IS BACK BAYBEEEEEE,t3_mh2ryh,14
1617199887.0,2021-03-31,wallstreetbets,gsx021s,PLTR for president,t3_mh2ryh,14
1617199971.0,2021-03-31,wallstreetbets,gsx0869,"I just woke up, and everything is fucking green.  Did AAPL and TSLA agree to build a car together?",t3_mh2ryh,14
1617203344.0,2021-03-31,wallstreetbets,gsx7a26,it's about time for weed stocks to come back again,t3_mh2ryh,15
1617206825.0,2021-03-31,wallstreetbets,gsxeyul,"Up 300 dollars today, only 6k to break even lmao",t3_mh2ryh,13
1617207892.0,2021-03-31,wallstreetbets,gsxhc48,DISCA doin it 🚀,t3_mh2ryh,14
1617210213.0,2021-03-31,wallstreetbets,gsxmjds,Fr tho why does ur dick get hard when you sleep. I’ll be dreaming about the weirdest shit like being stranded at sea talking to a seagull and I’ll wake up bricked,t3_mh2ryh,14
1617210239.0,2021-03-31,wallstreetbets,gsxmlhv,Tesla going to $850 tomorrow,t3_mh2ryh,14
1617210438.0,2021-03-31,wallstreetbets,gsxn1ba,#🐻 👈🏻🤣,t3_mh2ryh,14
1617210821.0,2021-03-31,wallstreetbets,gsxnw3h,#BEARS IN SHAMBLES 😂😂😂,t3_mh2ryh,14
1617211445.0,2021-03-31,wallstreetbets,gsxp9ye,"PLTR flying, palantards rejoice",t3_mh2ryh,15
1617211812.0,2021-03-31,wallstreetbets,gsxq3jv,Pltr finally up 7% after bleeding -5% for 900 days. What a miracle we’re all going to financially recover,t3_mh2ryh,14
1617212501.0,2021-03-31,wallstreetbets,gsxrmlh,Imagine not starting a sentence with the word “imagine”,t3_mh2ryh,14
1617212835.0,2021-03-31,wallstreetbets,gsxsd95,I see a lot of people asking about the Biden speech cause no one believes the actual time is 4:20 lol,t3_mh2ryh,14
1617213542.0,2021-03-31,wallstreetbets,gsxtxz0,"Still down like 3k in a week, but I feel rich!!",t3_mh2ryh,12
1617215304.0,2021-03-31,wallstreetbets,gsxxs8m,"Me: losing 80% on every option I’ve bought

Broker: congratulations you can now trade 0DTE options!",t3_mh2ryh,13
1617216442.0,2021-03-31,wallstreetbets,gsy09gc,"if you think gambling is the solution to your problems, maybe gambling is your problem 

or maybe your problem is that incomes have not kept pace with the price of housing and education",t3_mh2ryh,13
1617216695.0,2021-03-31,wallstreetbets,gsy0ta5,[deleted],t3_mh2ryh,14
1617217271.0,2021-03-31,wallstreetbets,gsy237k,Tech almost up 2% while Dow is nearly negative. Now that’s some good shit.,t3_mh2ryh,13
1617221140.0,2021-03-31,wallstreetbets,gsyaj0b,"disappointed in anyone that talked shit about my girl Cathie and ARKK, good bye March what a shitty month",t3_mh2ryh,14
1617185174.0,2021-03-31,wallstreetbets,gsweqa5,"Every day this last month:

Red: my stocks are down

Green: my stocks are down.",t3_mh2ryh,40
1617188917.0,2021-03-31,wallstreetbets,gswiqmu,"The slightest bit of green in my calls makes me want to sell, just to miss the huge run.",t3_mh2ryh,14
1617192067.0,2021-03-31,wallstreetbets,gswmqmy,Weed is tight weed is tight,t3_mh2ryh,13
1617194291.0,2021-03-31,wallstreetbets,gswq0oq,Tim 🍏 days tendies for everyone today.  Except 🌈🐻,t3_mh2ryh,13
1617199783.0,2021-03-31,wallstreetbets,gswzukt,"Tf, never thought I'd see the day where a 23 PLTR would make me happy.   
Standards. . .",t3_mh2ryh,13
1617199870.0,2021-03-31,wallstreetbets,gsx00uq,Imagine thinking we were entering a bear market when we are about to kick off the golden years of the roaring 20s.,t3_mh2ryh,13
1617199935.0,2021-03-31,wallstreetbets,gsx05h6,PLTR WE LOVE YOU,t3_mh2ryh,13
1617202293.0,2021-03-31,wallstreetbets,gsx51d6,Holy DISCB lmao! Tell the GME apes thats a damn squeeze hahahaha halted like a mutha fucka!,t3_mh2ryh,14
1617202644.0,2021-03-31,wallstreetbets,gsx5sdw,Lmfao DISCB. Fuck this gay earth,t3_mh2ryh,14
1617203357.0,2021-03-31,wallstreetbets,gsx7b3b,If you bought DISCB you’re a retard your wife’s boyfriend is on DISCA,t3_mh2ryh,14
1617203605.0,2021-03-31,wallstreetbets,gsx7udj,Lmao the people who bought DISCB at the top might actually get paid off lol.,t3_mh2ryh,13
1617203931.0,2021-03-31,wallstreetbets,gsx8jua,"Just looked it up, DISCB shares afford 10 votes per share vs DISCAs 1 vote.  This is probably why DISCB is flying while DISCA is lagging.",t3_mh2ryh,12
1617203966.0,2021-03-31,wallstreetbets,gsx8mjt,DISCB naked and afraid,t3_mh2ryh,14
1617205710.0,2021-03-31,wallstreetbets,gsxcham,DISCA 4/16 60,t3_mh2ryh,14
1617206099.0,2021-03-31,wallstreetbets,gsxdcrm,PLTR straight up vertical rn,t3_mh2ryh,13
1617206800.0,2021-03-31,wallstreetbets,gsxewwa,"I buy. It go down. 

I sell. It go up.

Stonks.",t3_mh2ryh,14
1617207773.0,2021-03-31,wallstreetbets,gsxh2jf,PLTR!!!!!!! 7% up!,t3_mh2ryh,13
1617207891.0,2021-03-31,wallstreetbets,gsxhc00,Palantards are rising up like a Phoenix from the ashes of hell!,t3_mh2ryh,12
1617207894.0,2021-03-31,wallstreetbets,gsxhca3,#DISCA - the next squeeze,t3_mh2ryh,12
1617208740.0,2021-03-31,wallstreetbets,gsxj8lc,Every bear bone in my body is telling me to take profits but I shall prevail,t3_mh2ryh,13
1617208746.0,2021-03-31,wallstreetbets,gsxj92y,"Dont worry folks, PLTR put me at serious risk of seeing green today, but BB came in strong for me and is keeping me comfortably red. All's well.",t3_mh2ryh,12
1617208790.0,2021-03-31,wallstreetbets,gsxjcnp,LETS GO $PLTR!!!!,t3_mh2ryh,12
1617209995.0,2021-03-31,wallstreetbets,gsxm1y1,#BERS R FUK 🤡🤡🤡,t3_mh2ryh,12
1617210057.0,2021-03-31,wallstreetbets,gsxm6y5,PLTR FINALLY KARP showing these Fucks the dirt he has on them,t3_mh2ryh,12
1617211091.0,2021-03-31,wallstreetbets,gsxohow,DISCB-whole new generation of bagholders... as if there wasn't already enough. Nice.,t3_mh2ryh,13
1617211382.0,2021-03-31,wallstreetbets,gsxp4w5,"Discovery’s Class B shares DISCB spike 80%. [https://www.cnbc.com/2021/03/31/discoverys-class-b-shares-spike-80percent-in-unusual-move.html](https://www.cnbc.com/2021/03/31/discoverys-class-b-shares-spike-80percent-in-unusual-move.html?__source=sharebar|twitter&par=sharebar)

* Previously, over 95% of DISCB was held by insiders like former executives. [https://finance.yahoo.com/quote/DISCB/holders?p=DISCB](https://finance.yahoo.com/quote/DISCB/holders?p=DISCB)
* Historically, DISCB and DISCA have traded closely together. Today's divergence is quite...wide.",t3_mh2ryh,12
1617212836.0,2021-03-31,wallstreetbets,gsxsde6,"WFH hearing the zoom notification from my desk

“Oh shit that’s right I’m employed aren’t I”

*back to td app*",t3_mh2ryh,12
1617213499.0,2021-03-31,wallstreetbets,gsxtuh8,Wtf PLTR,t3_mh2ryh,13
1617213879.0,2021-03-31,wallstreetbets,gsxuor3,I buy before I do my DD.,t3_mh2ryh,13
1617217000.0,2021-03-31,wallstreetbets,gsy1hmf,Lmao stop sayin the stock is goinf parabolic or its shooting up when it makes a 10 cent move,t3_mh2ryh,13
1617217665.0,2021-03-31,wallstreetbets,gsy2y39,"**F** in the chat boys

I sold my 40 $235 weekly MSFT calls for a measly $400 profit, and literally 4 minutes later the army contract is announced, and they're now up $14k more...fml",t3_mh2ryh,12
1617217687.0,2021-03-31,wallstreetbets,gsy2zpz,[deleted],t3_mh2ryh,14
1617218994.0,2021-03-31,wallstreetbets,gsy5tug,What a fucking day MVIS just went up 45%!!!! 🚀🚀🚀🚀,t3_mh2ryh,13
1617219396.0,2021-03-31,wallstreetbets,gsy6pkw,MVIS just RKT but with a different name,t3_mh2ryh,12
1617219702.0,2021-03-31,wallstreetbets,gsy7dmb,IMAGINE BEING A DUMB STUPID FUCKING BEAR LMAOOOOOOOOOOOOO,t3_mh2ryh,12
1617220372.0,2021-03-31,wallstreetbets,gsy8u0v,Thank you MVIS,t3_mh2ryh,12
1617220720.0,2021-03-31,wallstreetbets,gsy9lbq,"All I'm [Tesla 4/1 yolo!!](https://i.imgur.com/Xqc2hn7.jpg)

If she hits 720 that's 50k baby",t3_mh2ryh,13
1617220831.0,2021-03-31,wallstreetbets,gsy9u4t,I swear just buying whatever random idea you idiots put on here makes me way more money than anything else. Thanks and I love you.,t3_mh2ryh,14
1617221201.0,2021-03-31,wallstreetbets,gsyansx,Fucking went from down $2k to +$17 at the end lmao...,t3_mh2ryh,14
1617186836.0,2021-03-31,wallstreetbets,gswgfkn,Biden rolling out the infrastructure bill today. Gonna close my positions this am and wait it out,t3_mh2ryh,12
1617186989.0,2021-03-31,wallstreetbets,gswglg9,"We rotating back to tech

Wonder what the insiders know",t3_mh2ryh,11
1617187612.0,2021-03-31,wallstreetbets,gswh9pt,An 🍎 today keeping the 🐻 away,t3_mh2ryh,12
1617188328.0,2021-03-31,wallstreetbets,gswi2ef,Hwang in there!,t3_mh2ryh,12
1617188827.0,2021-03-31,wallstreetbets,gswimz0,I think AAPL might hit the fabled $125 this week,t3_mh2ryh,12
1617189547.0,2021-03-31,wallstreetbets,gswjhle,TLRY holy fugg,t3_mh2ryh,12
1617190164.0,2021-03-31,wallstreetbets,gswk8il,Anyone else wake up early to work only to end up watching pre market tickers all morning?,t3_mh2ryh,12
1617191122.0,2021-03-31,wallstreetbets,gswlgo7,Why is adderall illegal in england but legal in the U.S?,t3_mh2ryh,12
1617192353.0,2021-03-31,wallstreetbets,gswn4wx,"Apha was up 4.20%.

Best fucking sign i got in a month.",t3_mh2ryh,13
1617192530.0,2021-03-31,wallstreetbets,gswndur,Chewy you goddamn beautiful fuck,t3_mh2ryh,13
1617192771.0,2021-03-31,wallstreetbets,gswnq4s,Can someone file bankruptcy to avoid paying margin debit? Asking for a friend,t3_mh2ryh,11
1617193597.0,2021-03-31,wallstreetbets,gswoxyv,Revenge of the bulls. 🖕🏾🌈🐻,t3_mh2ryh,13
1617194373.0,2021-03-31,wallstreetbets,gswq5do,"holy shit, is PLTR finally having a back to back green day????",t3_mh2ryh,12
1617195177.0,2021-03-31,wallstreetbets,gswrgay,CHWY going to 100 today. That's a fact,t3_mh2ryh,12
1617195608.0,2021-03-31,wallstreetbets,gsws5zt,VIAC?,t3_mh2ryh,12
1617195731.0,2021-03-31,wallstreetbets,gswsdbz,"TSLA PLTR ARKK. Averaged down, never left. Tech isn’t going anywhere.",t3_mh2ryh,12
1617196933.0,2021-03-31,wallstreetbets,gswugwt,This week I learned that the ‘S’ in $GUSH is silent...,t3_mh2ryh,12
1617197635.0,2021-03-31,wallstreetbets,gswvqtr,Apha🚀🚀🚀,t3_mh2ryh,12
1617198327.0,2021-03-31,wallstreetbets,gswx1c8,"Holy shit, quadrupled my portfolio on UI puts. Thanks to whoever tipped me off on that. Holy moley",t3_mh2ryh,12
1617198553.0,2021-03-31,wallstreetbets,gswxglt,"“We were just kidding for the last 3 months guys”.

- AAPL today",t3_mh2ryh,12
1617199663.0,2021-03-31,wallstreetbets,gswzm44,My account when it’s green.. up 2%... when red down 26.36%... a lil unbalanced,t3_mh2ryh,12
1617199762.0,2021-03-31,wallstreetbets,gswzt2e,Good guy PLTR giving me one day rest from all the raping,t3_mh2ryh,13
1617200088.0,2021-03-31,wallstreetbets,gsx0gkj,Palantir the prodigal son has returned. Slaughter my finest lamb!!!,t3_mh2ryh,12
1617200165.0,2021-03-31,wallstreetbets,gsx0m9j,Apple sellers are those fucks who won’t carry phone to potty because it is not hygienic and would rather stare at the wall for 1 hour,t3_mh2ryh,13
1617200215.0,2021-03-31,wallstreetbets,gsx0puv,Bought SPY calls. Crash incoming!,t3_mh2ryh,13
1617200827.0,2021-03-31,wallstreetbets,gsx1z7w,Palantir Palantir Palantir Palantir Palantir Palantir 🚀🚀🚀🚀🚀📈🙌💎,t3_mh2ryh,11
1617200841.0,2021-03-31,wallstreetbets,gsx20au,APHA,t3_mh2ryh,12
1617201305.0,2021-03-31,wallstreetbets,gsx2yuw,Tesla finally paying reparations for destroying my portfolio,t3_mh2ryh,12
1617202117.0,2021-03-31,wallstreetbets,gsx4o2n,What’s the deal with PLTR.  It’s going up.  No.  I mean I love it but I fear the rug pull.,t3_mh2ryh,13
1617202211.0,2021-03-31,wallstreetbets,gsx4v5z,"I bought the PLTR dip. 

Unfortunately I didn't buy the PLTR dip dip though.",t3_mh2ryh,13
1617202770.0,2021-03-31,wallstreetbets,gsx624k,[deleted],t3_mh2ryh,12
1617203844.0,2021-03-31,wallstreetbets,gsx8czy,If everyone could buy DISCA so my wife doesn't leave me I would be eternally grateful,t3_mh2ryh,10
1617205873.0,2021-03-31,wallstreetbets,gsxcuga,Disca is 🚀🚀🚀🚀🚀,t3_mh2ryh,12
1617206097.0,2021-03-31,wallstreetbets,gsxdcng,Imagine panic selling PLTR for $21 Monday,t3_mh2ryh,11
1617206705.0,2021-03-31,wallstreetbets,gsxep8n,Pltr tomorrow 27 eod,t3_mh2ryh,13
1617208106.0,2021-03-31,wallstreetbets,gsxhtew,Cashed in like a king on SQ 205C and Zoom 320C￼,t3_mh2ryh,12
