date,subreddit,id,body,parent_id,score
2019-11-05,wallstreetbets,f6md0nn,"So awesome having multiple options and just bleeding a couple hundred daily, rinse and repeat.  Like groundhogs day.  And a number of long dated so can’t even be put out of my misery.",t3_drxo17,6
2019-11-05,wallstreetbets,f6mdxos,imagine thinking amd isnt about to crash into the fucking shadow realm,t3_drxo17,6
2019-11-05,wallstreetbets,f6meeqn,Of course the market dips once I go bankrupt from SPY puts expiring last week,t3_drxo17,6
2019-11-05,wallstreetbets,f6mgiwx,sometimes i don't check wsb for a while and then come back to get all caught up. i am literally never disappointed.,t3_drxo17,5
2019-11-05,wallstreetbets,f6mgt2r,Stock market? More like stink market amirite fellas?,t3_drxo17,6
2019-11-05,wallstreetbets,f6mjifm,"Bloomberg is catching onto to the Robhinhood margin scam:

https://twitter.com/TheStalwart/status/1191764936155942913

https://www.bloomberg.com/news/articles/2019-11-05/robinhood-has-a-glitch-that-gives-traders-infinite-leverage",t3_drxo17,7
2019-11-05,wallstreetbets,f6mlevp,I love waking up and the temperature is - 4 outside! 🙃,t3_drxo17,5
2019-11-05,wallstreetbets,f6mlulf,"If the SEC wants to go after RH users for securities fraud, then they should also go after RH for enabling their users to commit securities fraud.",t3_drxo17,6
2019-11-05,wallstreetbets,f6mm5d2,"**Robinhood's ""Infinite Money Cheat Code"" Gives Traders Access To Unlimited Funds**

https://twitter.com/zerohedge/status/1191768226147053569

WSB shaking up the financial world once again",t3_drxo17,6
2019-11-05,wallstreetbets,f6mm5wz,CTN is a fucking legend.,t3_drxo17,6
2019-11-05,wallstreetbets,f6mm9i2,"WSB name should be ""Cutting edge leverage Research Institution""",t3_drxo17,5
2019-11-05,wallstreetbets,f6mmouh,[deleted],t3_drxo17,7
2019-11-05,wallstreetbets,f6mnnra,[deleted],t3_drxo17,6
2019-11-05,wallstreetbets,f6mnqe5,"306.75 is the floor, bounced off it 5 times today",t3_drxo17,6
2019-11-05,wallstreetbets,f6moa54,"If the SEC investigates GUH before the blatant prop job on spy, then ima run for office.",t3_drxo17,6
2019-11-05,wallstreetbets,f6mpeq5,"Christ, man. Buy a few AMD puts and next thing you know, you're 300 contracts deep",t3_drxo17,7
2019-11-05,wallstreetbets,f6mq62m,Uuuh i think i surpassed my maximum risk tolerance,t3_drxo17,6
2019-11-05,wallstreetbets,f6mrkrb,I love how the day after people agree to pump Nio it goes up 28%.,t3_drxo17,6
2019-11-05,wallstreetbets,f6mtanv,AMD can't be stopped,t3_drxo17,6
2019-11-05,wallstreetbets,f6mtb48,"#👩‍👦☝️😤

""SPY-LER ANDREW JACOBS - YOU MARCH BACK UP THOSE STAIRS RIGHT NOW, MISTER OR ELSE NO DINNER TONIGHT""",t3_drxo17,6
2019-11-05,wallstreetbets,f6mw1x3,CNN fear/greed index at 89/100. EXTREME GREED,t3_drxo17,5
2019-11-05,wallstreetbets,f6mwlmi,Went all in on Walgreens calls 1/1/2020 on the news and down 7k rn. Fuck,t3_drxo17,6
2019-11-05,wallstreetbets,f6mwtpf,Has anyone gotten the stop limit to work on RH? It’s the biggest piece of trash. It’s failed me 3 times now. Wtf,t3_drxo17,7
2019-11-05,wallstreetbets,f6mxy21,"Exited my bear position at a 50% loss, this stupid market pushing me to be a bull",t3_drxo17,7
2019-11-05,wallstreetbets,f6myc9u,"CNBC with the GUH coverage now... it’s probably already been mentioned, so anyway...",t3_drxo17,5
2019-11-05,wallstreetbets,f6mysra,I bought some $307 puts I think I fucked up lol,t3_drxo17,6
2019-11-05,wallstreetbets,f6n0nrm,GUH GUH GIUH GUHG UGH GUHG UHG JUST DROP .25c AMD,t3_drxo17,5
2019-11-05,wallstreetbets,f6n11d3,"sold my MCD calls at 10am and missed out on $10k profits.

&#x200B;

like a boss",t3_drxo17,7
2019-11-05,wallstreetbets,f6n15hy,[Banks don’t want you to know about this secret market info!](https://imgur.com/gallery/WlvbvgS),t3_drxo17,6
2019-11-05,wallstreetbets,f6n1w8j,How tf is AMD at $37,t3_drxo17,6
2019-11-05,wallstreetbets,f6n2l8n,Does anyone know what BTD means? Because I haven't seen a dip in ages I have just about forgotten what a dip means,t3_drxo17,6
2019-11-05,wallstreetbets,f6n3abq,Power hour is a thing of the past. In today’s economy we only do 30 second pump and dumps at open and close,t3_drxo17,6
2019-11-05,wallstreetbets,f6n3jvd,[removed],t3_drxo17,6
2019-11-05,wallstreetbets,f6n3x2r,"ATVI bros, I don't know if I'm strong enough to hold these fucking calls past ER.",t3_drxo17,7
2019-11-05,wallstreetbets,f6n7hpg, b e a r t r a p (or I'm ded tomorrow pt. 2),t3_drxo17,7
2019-11-05,wallstreetbets,f6n7j0n,Lol I think people have been bailing on Robinhoods cash management account because of this whole infinite leverage shit,t3_drxo17,6
2019-11-05,wallstreetbets,f6n89b6,I love a good Su Bae dump 💩,t3_drxo17,7
2019-11-05,wallstreetbets,f6n8cth,AMD better than any show on Netflix.,t3_drxo17,6
2019-11-05,wallstreetbets,f6n8txy,ROKU earnings ~~today~~ tomorrow after close. IV and premiums are bonkers. Still too scared to mess with them.,t3_drxo17,6
2019-11-05,wallstreetbets,f6n9kvs,"There's nothing interesting for today's **Magical Crayons TA.** We traded more or less flat. Today's flatness pushed us into one of two rising wedges I had mentioned yesterday. If you're a bull you want to see us tomorrow test and break 308. If we trade above 309 by Friday we'll have escaped that pattern. 

If you're a bear I will again reiterate the bulls are super insulated. There's a support at 306.2 and another at 305, so drastic drops without news are unlikely. 

As mentioned yesterday, the upcoming economic announcements for the week haven't impacted the market in a bearish manner even when expectations missed, so right now an upcoming correction would have to be technical by algos/chartists or by some piece of unexpected news event.",t3_drxo17,6
2019-11-05,wallstreetbets,f6na0md,"R I S E up Bear Gang 🎖🐻🎖
Tonight begins the FeAstIng 🔥🔥🔥",t3_drxo17,6
2019-11-05,wallstreetbets,f6nbqzi,Pubic service announcement. AMD is NOT rallying after hours,t3_drxo17,6
2019-11-05,wallstreetbets,f6nbv7n,Hope everyone loaded up on Uber puts or sold your calls.,t3_drxo17,6
2019-11-05,wallstreetbets,f6lrn2k,DD:This guy I went school with that was molested by two seperate icecream men is now working for $MRK. 11/8 $84p,t3_drxo17,12
2019-11-05,wallstreetbets,f6ls6k2,Past performance is not indicative  of future performance. Therefore my portfolio could move higher Today in theory.,t3_drxo17,11
2019-11-05,wallstreetbets,f6lu1n0,Someone start a gofundme for CTN,t3_drxo17,9
2019-11-05,wallstreetbets,f6lxaso,SPY up 5% in 3 months at ATH 👍😓🥜💦,t3_drxo17,10
2019-11-05,wallstreetbets,f6lxb9u,🐻 gang ride together.,t3_drxo17,9
2019-11-05,wallstreetbets,f6lmhm6,Should i sell my Apple puts today? Down a bunch,t3_drxo17,5
2019-11-05,wallstreetbets,f6lokl1,Trump woke up! Pump this shit,t3_drxo17,5
2019-11-05,wallstreetbets,f6londf,"Trump retweeted:   ""Throw in strong [\#profits](https://twitter.com/hashtag/profits?src=hashtag_click), [\#tradedeals](https://twitter.com/hashtag/tradedeals?src=hashtag_click), and more [\#economicgrowth](https://twitter.com/hashtag/economicgrowth?src=hashtag_click) still to come, and you can see why we have record highs on the stock market!"" [\#TaxCuts](https://twitter.com/hashtag/TaxCuts?src=hashtag_click) [\#Success](https://twitter.com/hashtag/Success?src=hashtag_click) [\#MyTake](https://twitter.com/hashtag/MyTake?src=hashtag_click) [\#VarneyCo](https://twitter.com/hashtag/VarneyCo?src=hashtag_click)",t3_drxo17,5
2019-11-05,wallstreetbets,f6lpr7s,PTON earnings out. Option sellers might be the winner on this one.,t3_drxo17,6
2019-11-05,wallstreetbets,f6lrtd5,Call me a maniac but this week the puts are getting cheap as ffffff...,t3_drxo17,5
2019-11-05,wallstreetbets,f6lte9f,[deleted],t3_drxo17,5
2019-11-05,wallstreetbets,f6lttld,"I've been burned by the past 3 major drops this year to know better than to get into the market right now. At least, that's what I said as I FOMO into AMD",t3_drxo17,5
2019-11-05,wallstreetbets,f6lva5b,"Even with a 7.2% drop not sure how much UBER puts will profit on that IV. That being said the IV crush is priced in, guh",t3_drxo17,5
2019-11-05,wallstreetbets,f6lvewy,Some doctors office called me and asked if i was feeling a little 🐻tarded,t3_drxo17,5
2019-11-05,wallstreetbets,f6lvotj,WHY DID I SELL MY NKE CALLS FOR A MEASLY 78% PROFIT YESTERDAY.  :-(,t3_drxo17,6
2019-11-05,wallstreetbets,f6lvpkv,MKT Fake and Gay....Just like mods,t3_drxo17,5
2019-11-05,wallstreetbets,f6lw2by,[deleted],t3_drxo17,5
2019-11-05,wallstreetbets,f6lwqkg,"Sold about all of my AMD calls last week, feeling extra FOMO. As soon as I jump back it, ik it dives to $34",t3_drxo17,5
2019-11-05,wallstreetbets,f6lx5h5,liquidate my entire portfolio and go all in on fd spy puts,t3_drxo17,5
2019-11-05,wallstreetbets,f6lxtic,but why is aapl dropping premarket 🌈,t3_drxo17,4
2019-11-05,wallstreetbets,f6lynwr,"So this is the real way to make money on this infinite leverage trick.


1. Find a big company with a small market cap ala JCP


2. Get around 100 retards to perform the infinite leverage trick to around $2M.


3. WSB members now have majority control in said company


4. Motion the board to officially declare bankruptcy or permanent closures or mass layoffs, something to make the company tank.


5. Shares are worthless, Calls that were written are now worthless.


Edit: Still in the hole for the shares, after big tank gotta pump the stock back up to about break even or a small loss to make profit on the worthless calls",t3_drxo17,5
2019-11-05,wallstreetbets,f6lzxlo,ROBINHOOD PUTS MILLIONAIRES GOING TO MAKE TENDIES WITH THIS REEE,t3_drxo17,4
2019-11-05,wallstreetbets,f6m10yg,"If Uber hits $17 maybe I can finally once again be in the green.

Dare to dream",t3_drxo17,6
2019-11-05,wallstreetbets,f6m11ob,ISM Non-Manufacturing index at 10 AM EST. Hold on to your loved ones.,t3_drxo17,5
2019-11-05,wallstreetbets,f6m1qo9,Uber iv crush was actually priced in. Like it’s literally not dropping,t3_drxo17,5
2019-11-05,wallstreetbets,f6m1un1,Any valid reason why the  fuck is SBUX still going down?,t3_drxo17,5
2019-11-05,wallstreetbets,f6m2216,"Before I enjoy my breakfast, I just wanna thank $GRUB investors for paying for it.",t3_drxo17,6
2019-11-05,wallstreetbets,f6m2azw,Holy fuck $atvi does the exact same shit every day.,t3_drxo17,5
2019-11-05,wallstreetbets,f6m3098,AMD just casually going to $37 nbd,t3_drxo17,4
2019-11-05,wallstreetbets,f6m4vsu,This is what the bear 🐻 Jesus foretold brothers... so long amd!,t3_drxo17,5
2019-11-05,wallstreetbets,f6m51kb,"Bunch of idiots here looking at a single stock like  ""OMG (XYZ) dropped!""

Look at the indexes. Literally every stock shit itself.",t3_drxo17,5
2019-11-05,wallstreetbets,f6m52f0,"I love this place

>SetzerWithFixedDice 1 point 16 hours ago 
I only do LEAPs— 11/15 82c",t3_drxo17,5
2019-11-05,wallstreetbets,f6m57fx,[deleted],t3_drxo17,4
2019-11-05,wallstreetbets,f6m59xn,Algos: just playin dawg,t3_drxo17,5
2019-11-05,wallstreetbets,f6m5k6v,read a great article in  current issue of Foreign Affairs on how taking the trading monopoly from NYSE is resulting in more frequent flash crashes and how this is threatening national security.,t3_drxo17,4
2019-11-05,wallstreetbets,f6m68hy,"Too much money being printed to even matter. We go up or end flat today. Buy your calls on whatever got wrecked there, I grabbed BMY at bottom dollar for a bounce",t3_drxo17,5
2019-11-05,wallstreetbets,f6m6h29,"Just bought $3k worth of amd 11/15 36.5C

Time to drill bb",t3_drxo17,6
2019-11-05,wallstreetbets,f6m70n5,Congrats. Y'all meme'd too hard and killed it,t3_drxo17,6
2019-11-05,wallstreetbets,f6m7501,"Lmao, well I predicted we’d miss on PMI and beat on JOLT, then we’d trade sideways and go up. We actually beat on PMI and missed on JOLT, then spiked up and now spiking down. I am really good at this shit!",t3_drxo17,4
2019-11-05,wallstreetbets,f6m9qvk,"Scalped Apple just so I could be up for the day.

🌈🥒🦄💖 *G A A A A A A Y Y Y* 💖🦄🥒🌈",t3_drxo17,6
2019-11-05,wallstreetbets,f6m9tos,"Gap to 306.25, then another gap from 305 to 302.50. Market needs to chill or it’ll want to fill em.",t3_drxo17,5
2019-11-05,wallstreetbets,f6man8i,"thought about buying some ROKU calls to ride any potential IV up as we get closer but saw premium and noped out of it.

$150+ calls are still going for like $5. that's some fucked up shit lol",t3_drxo17,6
2019-11-05,wallstreetbets,f6man9x,"Soo, is AMD more likely to hit 40 or back to 30? Looks like it's AMD to the moon :O",t3_drxo17,4
2019-11-05,wallstreetbets,f6mashg,"yolos for today?

MCD gonna leg back to pre CEO firing?",t3_drxo17,3
2019-11-05,wallstreetbets,f6mb8d8,"Fucking hell im gonna just drop all my other watched tickers and just trade DIS full time. 

It’s the most predictable fucking stock there is. 

Puts in the morning then sell wide condors after 10:30",t3_drxo17,5
2019-11-05,wallstreetbets,f6mbclv,"Will you be the next ""MARGIN MILLIONAIRE?"" Tune in tomorrow for more losses!",t3_drxo17,4
2019-11-05,wallstreetbets,f6mbcy9,"technical witchdoctors, more red to come or is this just a bear-tease?",t3_drxo17,4
2019-11-05,wallstreetbets,f6mcwca,"OK, so my puts are back in the red after being up a measly 2%.  This shit sucks.  I guess there will be no sell off. ever. fuck.",t3_drxo17,5
2019-11-05,wallstreetbets,f6mdyo3,"After Robinhood fucked up a month or two ago with failed transfers, they emailed me and said ""Sorry we'll give you a free month of gold"" then they never did anybody else?",t3_drxo17,5
2019-11-05,wallstreetbets,f6me8ra,"Infinite stock market growth.

FED cuts rate causing our stock market to rally and people run to America for better returns strengthening our dollar which will require another rate cut to meet inflation targets.

Literally can't go tits up.",t3_drxo17,5
2019-11-05,wallstreetbets,f6memev,holy shit gold whats going on baby,t3_drxo17,5
2019-11-05,wallstreetbets,f6mhav6,Remember like two months ago when silverbugs were mentally spending their unrealized riches?,t3_drxo17,5
2019-11-05,wallstreetbets,f6mhmig,[deleted],t3_drxo17,4
2019-11-05,wallstreetbets,f6mi42i,"Remember, remember, the 5th of November",t3_drxo17,5
2019-11-05,wallstreetbets,f6mix8i,"one of us

 [https://www.cnbc.com/2019/11/05/peloton-ceo-admits-he-does-not-understand-why-shares-sank.html](https://www.cnbc.com/2019/11/05/peloton-ceo-admits-he-does-not-understand-why-shares-sank.html)",t3_drxo17,5
2019-11-05,wallstreetbets,f6mjhv2,Sbux is a fucking bitch,t3_drxo17,5
2019-11-05,wallstreetbets,f6mk0qr,"whenever my account goes positive by anything more than $1 for the day, it immediately stops there....for like 10 min then drops me back to red. I feel like im playing mario kart and im travelling in reverse with the owl yelling at me while getting my ass clapped by the MMs",t3_drxo17,4
2019-11-05,wallstreetbets,f6mlcoa,WE DID IT! WSBs is a force to be reckoned with!,t3_drxo17,6
2019-11-05,wallstreetbets,f6mm1l2,"REEEEEE.........

🐻🐻🐻🐻🐻🐻

🍆💦💦💦💦💦💦",t3_drxo17,5
2019-11-05,wallstreetbets,f6mmuuc,"MTCH calls? currently got **69 karma, guess I oughta buy some calls 

anyone playing Wendy's ?",t3_drxo17,5
2019-11-05,wallstreetbets,f6mn0ko,I told ya mcd$ is a powerhouse :),t3_drxo17,5
2019-11-05,wallstreetbets,f6mn45z,Ready for that implied 8.8% move in SQ. I want it to go up tho,t3_drxo17,4
2019-11-05,wallstreetbets,f6mnawc,"Theta Gang may be the most profitable gang, but holy shit they are the most boring gang.",t3_drxo17,6
2019-11-05,wallstreetbets,f6mnl38,Anyone else waiting EOD to get SPY calls?,t3_drxo17,6
2019-11-05,wallstreetbets,f6mpbi9,"Going to 307.25 then back to 306.75, rinse repeat until something major happens.",t3_drxo17,6
2019-11-05,wallstreetbets,f6mpuef,I wonder if anyone at Robinhood ever envisioned that their company would become a meme/joke as a risk factor. Usually these Silicon Valley companies take themselves way too seriously.,t3_drxo17,5
2019-11-05,wallstreetbets,f6mqbok,"This bish next to me has a cold/the sniffles and sounds like she's railing coke every 10 seconds.

Lort pls give me the strength to not end it all 🙏🙏🙏🙏",t3_drxo17,5
2019-11-05,wallstreetbets,f6mspxc,Sold my Uber puts for some nice 50% gains,t3_drxo17,5
2019-11-05,wallstreetbets,f6msu8g,Anyone still use Wizdaddy?,t3_drxo17,5
2019-11-05,wallstreetbets,f6muh7d,"I'm torn, on one hand technicals say we are at extremely low volume buying so there's really no one buying so expect a pullback before we can break to even new highs and on the other hand trade talks going well.

Also we have had zero sell signals which makes things even more interesting. 

I'm thinking VIX shares or 310 and 311 SPY call credit spreads.",t3_drxo17,4
2019-11-05,wallstreetbets,f6mutu4,"To all 🐻, screen 🔒 your phone, turn it 90degrees to the right, and sell ur puts, this way it feels better",t3_drxo17,5
2019-11-05,wallstreetbets,f6muwx9,Amd was 28 less than a month ago.,t3_drxo17,6
2019-11-05,wallstreetbets,f6mvbzr,"“I don’t know why women get mad. They got half the money and all the pussy”

Siddhartha Gutama",t3_drxo17,6
2019-11-05,wallstreetbets,f6mwx3i,WSB gives me a cult feeling. Feels good to read articles on how the cult members are revolutionizing the World through the GUHH movement!,t3_drxo17,5
2019-11-05,wallstreetbets,f6mwzvh,Getting f-ed by Mickey Mouse holding a pumpkin spice latte right now. Jesus,t3_drxo17,6
2019-11-05,wallstreetbets,f6my3vf,legit who is holding AMD right now lmao,t3_drxo17,4
2019-11-05,wallstreetbets,f6mydde,Long live Theta Gang.,t3_drxo17,5
2019-11-05,wallstreetbets,f6myfci,GUHlumbus has me fucking DED.😂,t3_drxo17,5
2019-11-05,wallstreetbets,f6mzipq,"China agriculture product price been increasing sharply in the last month, even chicken meat price doubled in a month. 

Inflation in China is losing control, China need a trade deal badly.

SPY 310 end of month.",t3_drxo17,6
2019-11-05,wallstreetbets,f6mzl15,Who is the knife-catching idiot buying $UBER?,t3_drxo17,5
2019-11-05,wallstreetbets,f6mzqec,Muh Uber puts GUH 🥵,t3_drxo17,5
2019-11-05,wallstreetbets,f6n0ddn,Tomorrow the stark market crashes,t3_drxo17,5
2019-11-05,wallstreetbets,f6n0n53,"Fuck, UBER rigged uptick rule in effect, plan your mild, if that, gains from your puts accordingly boys, you've been warned",t3_drxo17,4
2019-11-05,wallstreetbets,f6n1u6u,"\+98% on MCD calls, too bad I'm -62% on V calls and -21% on SBUX.",t3_drxo17,6
2019-11-05,wallstreetbets,f6n31qf,"Got a bad feeling about power hour

Somethin's a'brewin

#🍲❔🤢",t3_drxo17,4
2019-11-05,wallstreetbets,f6n3k1b,Sold my puts today cause fuck spy. I can just swing options on pharma and be less stressed. Pharma usually goes one way or another. Spy gets manipulated after hours to maintain a flat big theta f u,t3_drxo17,4
2019-11-05,wallstreetbets,f6n3xia,"In and out of AMD puts (1.45-1.38)*1000

quick 700 baby.",t3_drxo17,7
2019-11-05,wallstreetbets,f6n41va,why is TDA gay and makes me wait till funds settle till i can have options buying power? I'm tryina buy options NOW. take a page outta robinshits book,t3_drxo17,4
2019-11-05,wallstreetbets,f6n5949,Give me a day trade for the last hour boyos,t3_drxo17,5
2019-11-05,wallstreetbets,f6n62fu,"$REAL fake shit poppin down! Who's been riding this with me with DIAMOND HANDS down to hell? 

To be honest, hands were getting paper thin right after earnings.",t3_drxo17,4
2019-11-05,wallstreetbets,f6n6ouw,do i hold AMD puts through close? up 20% already,t3_drxo17,4
2019-11-05,wallstreetbets,f6n6y63,"Alexa play Titanic theme song

Gonna have to send these BYND puts off to valhalla cause the theta burns too hot. But they shall be reborn as next month rollovers",t3_drxo17,4
2019-11-05,wallstreetbets,f6n7b33,We should use our infinite leverage to force Robinhood into breaking Shkreli out of prison,t3_drxo17,4
2019-11-05,wallstreetbets,f6n8grj,my first AMD tendies,t3_drxo17,4
2019-11-05,wallstreetbets,f6n9nay,Fucking stay down there amd u filthy fucking whore,t3_drxo17,3
2019-11-05,wallstreetbets,f6nen1c,holy shit.. CNBC is stealing from wsb...  robinhood story coming up.,t3_drxo17,4
2019-11-05,wallstreetbets,f6lola3,"imagine being a publicly traded company and reporting a loss of $1.16 billion lmao what the fuck

edit: should note a quarterly loss of $1.16 billion",t3_drxo17,10
2019-11-05,wallstreetbets,f6lstx1,"So who is pulling their $$ out of RH today?  For a split second I thought maybe WSB would cause a run on RH, then I realized that all of us pulling out our paltry balances isn't gonna do a thing.",t3_drxo17,9
2019-11-05,wallstreetbets,f6mwc3x,"Stock market is a scam invest in bitconnect Better returns

HEY HEY WASO WASO BITCONNECTTTTTTT",t3_drxo17,8
2019-11-05,wallstreetbets,f6lsnnz,"All the bears are dead, myself included. We have nearly all capitulated and closed our positions within the last 2 weeks or so. So now please put your tray tables and seat backs in the upright position while we prepare the market for descent.",t3_drxo17,8
2019-11-05,wallstreetbets,f6m0s20,It hasn’t even been 10 minutes and you guys are already screaming recession.  You guys need to chill.,t3_drxo17,8
2019-11-05,wallstreetbets,f6m2ac6,Kind of tempted to become a margin millionaire.,t3_drxo17,7
2019-11-05,wallstreetbets,f6m5imp,What the hell is happening in the market right now...what was that ridiculous spike and drop?  Why are metals selling off so hard?  What's the news can I have a TLDR?,t3_drxo17,9
2019-11-05,wallstreetbets,f6m95k5,"Y r stonks going un-up❓

#🤔",t3_drxo17,7
2019-11-05,wallstreetbets,f6malun,"SPY while I admire your effort, you can go down a lot further...like a lot",t3_drxo17,8
2019-11-05,wallstreetbets,f6mmuww,"I was absent for the rise and fall of GUH-man but after reading about his adventures in financial folly, I can truly say I am honored to share the same space of the internet with such a hoss.",t3_drxo17,8
2019-11-05,wallstreetbets,f6n4t8j,This market is flatter than my ex girlfriend's ass.,t3_drxo17,9
2019-11-05,wallstreetbets,f6n6szp,"Is anyone worried we are getting more and more attention in this sub? We made CNBC an hour ago. Not gonna post a link because I’m sure it’s been posted multiple times, but maybe we should go private for a bit.",t3_drxo17,8
2019-11-05,wallstreetbets,f6n9kv8,"Emboldened China refuses to flinch on tariffs in US trade talks


https://twitter.com/nar/status/1191818077450768386?s=21

Great job Donnie!

Now you either fuck this all up and give up the goods or you crash the market - lose lose you dumb son of a bitch,

*Note - this isn’t an endorsement of the Democratic Party.",t3_drxo17,8
2019-11-05,wallstreetbets,f6lopux,Let’s go MacDeeez!,t3_drxo17,3
2019-11-05,wallstreetbets,f6lpd14,"DST is gay, markets only open at 10.30pm where I’m at. The price of tendies is sleep i guess",t3_drxo17,3
2019-11-05,wallstreetbets,f6lqc77,These AMD puts tho. Get what deserve for going against Su Bae.,t3_drxo17,5
2019-11-05,wallstreetbets,f6lqx78,Siri play Bulls on Parade.,t3_drxo17,4
2019-11-05,wallstreetbets,f6lsgke,Let’s go Antares. 60-70% my portfolio lol,t3_drxo17,5
2019-11-05,wallstreetbets,f6lsu58,When is msft going to blow it's load already and rocket?,t3_drxo17,5
2019-11-05,wallstreetbets,f6lta78,"Damn, they buying all that amd and turning they head away from my boy nvda..",t3_drxo17,5
2019-11-05,wallstreetbets,f6ltzwe,"If ATVI doesn’t hit 56.50 on ANOTHER record breaking day, I’m fucking done with them.",t3_drxo17,4
2019-11-05,wallstreetbets,f6lu87m,BABA had like 4x average volume yesterday...,t3_drxo17,3
2019-11-05,wallstreetbets,f6luk4h,Bernstein just upgraded BYND to outperform with a 106 PT,t3_drxo17,4
2019-11-05,wallstreetbets,f6lv7m9,Pretty upset u/winkerpack never says good morning to me,t3_drxo17,3
2019-11-05,wallstreetbets,f6lvncp,"I don’t expect any negative trade news anytime soon, or until Trump gets re-elected.  Any news, good or bad, will be put aside as we make higher ATHs.  Buy dips at every chance, spy will hit 330 eoy.",t3_drxo17,4
2019-11-05,wallstreetbets,f6lwp0h,[deleted],t3_drxo17,4
2019-11-05,wallstreetbets,f6lx5uo,Opened a Schwab account and instantly fucking hated the user interface....god dammit RH did appeal to my retarded QUIRKY millennial ass - LOOKS LIKE WE'RE GOING WITH TD AMERITRADE,t3_drxo17,3
2019-11-05,wallstreetbets,f6lygic,What stocks have burned you so bad that you took them off your watch list? Mine is M,t3_drxo17,5
2019-11-05,wallstreetbets,f6lyuiq,Watching CNBC gets my adrenaline going,t3_drxo17,5
2019-11-05,wallstreetbets,f6lyzsu,"Just became aware about robinhoods “personal risk tolerance” and I honestly don’t know what to say, I can only smile",t3_drxo17,4
2019-11-05,wallstreetbets,f6lz6o0,"Wow its crazy to thing that in about 3 minutes, the pioneer of zero commission trading is going to go under.",t3_drxo17,3
2019-11-05,wallstreetbets,f6lzjwp,And here we go. Beer in hand already.,t3_drxo17,4
2019-11-05,wallstreetbets,f6m00hc,Can someone explain why SPY IV is so low? Is it just because the market keeps going up?,t3_drxo17,3
2019-11-05,wallstreetbets,f6m015m,Watch out for this bear trap 🐻,t3_drxo17,4
2019-11-05,wallstreetbets,f6m077y,[deleted],t3_drxo17,3
2019-11-05,wallstreetbets,f6m0clu,"OMG spy is Red!!! It’s red bois it’s red!!

Inb4 V reversal 😢",t3_drxo17,3
2019-11-05,wallstreetbets,f6m0rpw,SBUX still fuck you!,t3_drxo17,5
2019-11-05,wallstreetbets,f6m1feo,SBUX committing suicide,t3_drxo17,4
2019-11-05,wallstreetbets,f6m1m9v,BLOOD RED! BEARS INCOMING!,t3_drxo17,4
2019-11-05,wallstreetbets,f6m1q2z,Just cashed out up 50% on fucking Morgan Stanley in fifteen minutes. Lol.,t3_drxo17,4
2019-11-05,wallstreetbets,f6m24cx,Cant believe Ronald came to my rescue.,t3_drxo17,3
