created,date,subreddit,id,body,parent_id,score
1602764236.0,2020-10-15,wallstreetbets,g8w3zyd,"It's sorta a double-bummer for bulls when stimmy falls through.


They don't get their $1,200 check, then their positions take a shit because they don't get their $1,200 check.

Salt in the wound bois",t3_jbktdv,18
1602757687.0,2020-10-15,wallstreetbets,g8vwvrl,Time to set a phantom 930 meeting in my calendar so nobody can disrupt me from selling these worthless calls at open,t3_jbktdv,8
1602758931.0,2020-10-15,wallstreetbets,g8vy1fl,I for one welcome our new single-strand RNA overlord,t3_jbktdv,9
1602762011.0,2020-10-15,wallstreetbets,g8w19p2,"The pure bull denial and delusion this morning, again people with calls now are the same people who bought puts at the bottom a week ago",t3_jbktdv,9
1602762455.0,2020-10-15,wallstreetbets,g8w1sd0,aapl to ath would be good for 63% of this sub,t3_jbktdv,9
1602762690.0,2020-10-15,wallstreetbets,g8w22kz,And there goes my gains for the past couple weeks,t3_jbktdv,10
1602762846.0,2020-10-15,wallstreetbets,g8w29dd,Is it another moon day for NIO?,t3_jbktdv,10
1602764082.0,2020-10-15,wallstreetbets,g8w3ss5,[deleted],t3_jbktdv,10
1602764128.0,2020-10-15,wallstreetbets,g8w3uwu,Bro like.. why did I buy calls at 359 yesterday,t3_jbktdv,10
1602764134.0,2020-10-15,wallstreetbets,g8w3v6u,"Some guy on r/options has 200 FSTLY 115p, he’s gonna be rollin in it today",t3_jbktdv,9
1602764309.0,2020-10-15,wallstreetbets,g8w43ci,Apple was just up 6.5% in one day this week and now it's down like 2 a couple days in a row and you MFers are already broke?,t3_jbktdv,9
1602764679.0,2020-10-15,wallstreetbets,g8w4kw4,"Guys, buy the dip!


^^^I'll ^^^sell ^^^you ^^^the ^^^calls",t3_jbktdv,10
1602765352.0,2020-10-15,wallstreetbets,g8w5hqx,"NIO is #1 on Robinhood Top Movers. You know what that means, gonna get pumped more!",t3_jbktdv,9
1602765361.0,2020-10-15,wallstreetbets,g8w5i6u,Good thing I hate money,t3_jbktdv,9
1602765415.0,2020-10-15,wallstreetbets,g8w5ktx,worse than expected ON TOP of probably being heavily manipulated,t3_jbktdv,10
1602765495.0,2020-10-15,wallstreetbets,g8w5oth,Can’t wait for the 9:30 dumbass crew to buy puts at the bottom and see half of their money vanish. It happens every time we dip.,t3_jbktdv,9
1602765515.0,2020-10-15,wallstreetbets,g8w5pu7,I need to know what Ja thinks about this before I make a play,t3_jbktdv,8
1602765522.0,2020-10-15,wallstreetbets,g8w5q6i,##Markets not buying it anymore,t3_jbktdv,9
1602765702.0,2020-10-15,wallstreetbets,g8w5zf4,Have you ever had a really bad day 🤡,t3_jbktdv,9
1602765719.0,2020-10-15,wallstreetbets,g8w608a,Octember,t3_jbktdv,8
1602766061.0,2020-10-15,wallstreetbets,g8w6hsw,Lets just keep the market closed for today and not let options prices change,t3_jbktdv,10
1602766435.0,2020-10-15,wallstreetbets,g8w71q6,I have absolutely no motivation to do anything at work today. Fuck,t3_jbktdv,9
1602766508.0,2020-10-15,wallstreetbets,g8w75nm,"MMs at 9:00:  Dump it $NIO

Retards at 9;30: This is marker manipulation 😭😂",t3_jbktdv,9
1602766932.0,2020-10-15,wallstreetbets,g8w7szi,"Who else has puts? 🙋🏽 
Brrrrrrrr",t3_jbktdv,8
1602767078.0,2020-10-15,wallstreetbets,g8w80wi,Buying puts would be a huge mistake.. but go for it,t3_jbktdv,9
1602767674.0,2020-10-15,wallstreetbets,g8w8ylu,Really glad I got scared and sold my AAPL 10/30 118p yesterday afternoon.  Making great trades all the time over here,t3_jbktdv,9
1602768253.0,2020-10-15,wallstreetbets,g8w9vxd,"Buy AMZN pussies. 

Bears can jump off a cliff into poverty",t3_jbktdv,8
1602770240.0,2020-10-15,wallstreetbets,g8wd89b,[deleted],t3_jbktdv,9
1602771090.0,2020-10-15,wallstreetbets,g8weqj9,its a fuck shaped recovery,t3_jbktdv,9
1602771977.0,2020-10-15,wallstreetbets,g8wgcj8,"🚨🚨 Retard Alert 🚨🚨

https://reddit.com/r/wallstreetbets/comments/jb8eqw/_/g8vae52/?context=1

This is why you never listen to randoms on WSB

u/firstonesnotfree",t3_jbktdv,10
1602772683.0,2020-10-15,wallstreetbets,g8whnrm,Organizing the NIO top buyers union today at 4,t3_jbktdv,8
1602773062.0,2020-10-15,wallstreetbets,g8widdo,This is going to accelerate into a huge dump. They’re selling into every strength.,t3_jbktdv,8
1602773259.0,2020-10-15,wallstreetbets,g8wir5c,Buy AAPL calls they said. Free tendies they said,t3_jbktdv,10
1602773278.0,2020-10-15,wallstreetbets,g8wisgh,This drop is bigger than cardi bs nippples,t3_jbktdv,9
1602773375.0,2020-10-15,wallstreetbets,g8wizdo,"Just woke up and checked my account 

**THATS A LOT OF DAMAGE**",t3_jbktdv,8
1602774460.0,2020-10-15,wallstreetbets,g8wl3gq,dude turned his worthless puts into 360k off fsly... what a fucking crazy time we live in,t3_jbktdv,9
1602774486.0,2020-10-15,wallstreetbets,g8wl58l,Somehow managed to lose 1k playing nio calls 🤡,t3_jbktdv,9
1602774905.0,2020-10-15,wallstreetbets,g8wlykc,Taken NIO profits.... hats off to anyone who rides this one but I’m out!,t3_jbktdv,9
1602775837.0,2020-10-15,wallstreetbets,g8wnss7,Am I overleveraged? You fucking know it kiddo,t3_jbktdv,9
1602775866.0,2020-10-15,wallstreetbets,g8wnutf,"401k directly into GME, I expect I'll be able to retire before Halloween now.",t3_jbktdv,8
1602776356.0,2020-10-15,wallstreetbets,g8wotvp,NIO WRONG WAY! STONKS GO UP!,t3_jbktdv,10
1602776658.0,2020-10-15,wallstreetbets,g8wpfop,"Fastly - ""Hey everyone, our quarter wasn't great. Future prospects aren't looking great. We will probably not give guidance going forward. Sales numbers aren't looking hot.""

r/wsb - ""Time to invest in this company!""

Flawless logic boys",t3_jbktdv,10
1602776821.0,2020-10-15,wallstreetbets,g8wprhi,Hurr durr my GameStonk,t3_jbktdv,8
1602776862.0,2020-10-15,wallstreetbets,g8wpufx,I would have never imagined IG thots pumping a stonk like GME,t3_jbktdv,10
1602776904.0,2020-10-15,wallstreetbets,g8wpxil,"GME Moon Mission engaged. Shorts are shook, looking for any escape, each day likelihood of escape window shortens and days to cover approaches faster due to volume. We Winnin' out here.",t3_jbktdv,9
1602777122.0,2020-10-15,wallstreetbets,g8wqdhw,So GME just massively cucked my puts,t3_jbktdv,9
1602777727.0,2020-10-15,wallstreetbets,g8wrlc7,UBER acquiring PTON for virtual deliveries,t3_jbktdv,8
1602778179.0,2020-10-15,wallstreetbets,g8wshly,"[https://i.ibb.co/n1dNT4d/image.png](https://i.ibb.co/n1dNT4d/image.png)

I stand corrected

Huge SPY dark pool share print just in

900,000 at $345.90 for $311,000,000

Should be same-day",t3_jbktdv,9
1602778285.0,2020-10-15,wallstreetbets,g8wsp5m,Can't wait for Zoom to buy Boeing and merge with Peloton,t3_jbktdv,10
1602778882.0,2020-10-15,wallstreetbets,g8wtwap,Some of y'all only come here for *the next big play* - you never post any contrarian plays of your own. You people deserve to lose money. Vultures.,t3_jbktdv,10
1602778895.0,2020-10-15,wallstreetbets,g8wtx63,"Stimulus is just a myth at this point 

they keep dangling stimulus talks in our face but nothing getting done 

just crash the market and we'll get our stimulus ASAP",t3_jbktdv,10
1602779032.0,2020-10-15,wallstreetbets,g8wu750,This gonna dump. Stimi dead again,t3_jbktdv,9
1602779239.0,2020-10-15,wallstreetbets,g8wumcz,brb gonna go drop a few mcconnells off at the pool,t3_jbktdv,8
1602779410.0,2020-10-15,wallstreetbets,g8wuyze,Bruh just give us $1200 we're gonna spend that shit on buying stupid shit anyways. Daddy needs a new office chair. Act like $2400 in 8 months is actually helping people survive instead of powering consumerism. You know us idiots are gonna buy iPhones and ps5s with that money.,t3_jbktdv,8
1602779510.0,2020-10-15,wallstreetbets,g8wv66b,"AMZN is getting beat down with 14 days to ER.

Buy. The. Dip",t3_jbktdv,8
1602779628.0,2020-10-15,wallstreetbets,g8wvepx,"Never in my life did I think I’d be so invested in GME

One day you’re buying a game at GME then the next day you’re part owner",t3_jbktdv,10
1602780027.0,2020-10-15,wallstreetbets,g8ww7nx,Come on GME,t3_jbktdv,9
1602780072.0,2020-10-15,wallstreetbets,g8wwb0a,Just bought 1 NIO 3c for 01/2023 🥰 go China!,t3_jbktdv,9
1602780082.0,2020-10-15,wallstreetbets,g8wwbr7,Nio saved me today,t3_jbktdv,9
1602780256.0,2020-10-15,wallstreetbets,g8wwon4,Short squeeze on GME ?,t3_jbktdv,7
1602780699.0,2020-10-15,wallstreetbets,g8wxl6n,GME hit 14... is it going to do the thing?!?!?,t3_jbktdv,10
1602780919.0,2020-10-15,wallstreetbets,g8wy1m0,"If somebody was waiting to drop news on GME, now is a good time 😉",t3_jbktdv,8
1602781235.0,2020-10-15,wallstreetbets,g8wyowg,"The option I just bought, Volume: 1 🤡🤡🤡",t3_jbktdv,9
1602781457.0,2020-10-15,wallstreetbets,g8wz52b,hahahahahah fuck you GME shorts. keep shorting,t3_jbktdv,9
1602781607.0,2020-10-15,wallstreetbets,g8wzfy6,GME just break that $14 barrier already,t3_jbktdv,9
1602781979.0,2020-10-15,wallstreetbets,g8x06zi,Mitch the bitch don’t give a fuck about passing stimmy while his $34M nest egg is safe with stocks at ATH,t3_jbktdv,8
1602782109.0,2020-10-15,wallstreetbets,g8x0gel,This GameStop volume is very weird. Same for options expiring 10/16. Maybe we get some news or a filing today or tmrw,t3_jbktdv,9
1602782501.0,2020-10-15,wallstreetbets,g8x1904,Spy 350 EOD pls.,t3_jbktdv,9
1602782698.0,2020-10-15,wallstreetbets,g8x1npl,[deleted],t3_jbktdv,8
1602783108.0,2020-10-15,wallstreetbets,g8x2huz,[deleted],t3_jbktdv,9
1602784462.0,2020-10-15,wallstreetbets,g8x5828,[deleted],t3_jbktdv,8
1602784508.0,2020-10-15,wallstreetbets,g8x5bir,"The  year is 2022, ZM has been added to the S&P500",t3_jbktdv,9
1602784656.0,2020-10-15,wallstreetbets,g8x5mc6,0dtes aren't volatile enough. These nerds need to introduce hourlies.,t3_jbktdv,11
1602784669.0,2020-10-15,wallstreetbets,g8x5n97,I simply keep buying more puts,t3_jbktdv,10
1602785022.0,2020-10-15,wallstreetbets,g8x6cxi,"With a large enough deposit, you to can unlock green mode in RH!",t3_jbktdv,9
1602785120.0,2020-10-15,wallstreetbets,g8x6jwg,RIP those who bought puts at open,t3_jbktdv,10
1602785137.0,2020-10-15,wallstreetbets,g8x6l3c,So job numbers are worse than expected but SPY going up again? lol,t3_jbktdv,8
1602785266.0,2020-10-15,wallstreetbets,g8x6u7e,Whenever this shit dumps. It’s gonna dump.....,t3_jbktdv,10
1602785556.0,2020-10-15,wallstreetbets,g8x7evd,"How many autists bought puts at open, just to see their value slowly wither away",t3_jbktdv,9
1602786095.0,2020-10-15,wallstreetbets,g8x8hph,[deleted],t3_jbktdv,9
1602786444.0,2020-10-15,wallstreetbets,g8x96mi,Get ready for the afternoon PUMP,t3_jbktdv,9
1602786633.0,2020-10-15,wallstreetbets,g8x9k2d,CiRcUiT bReAkEr ToDaY,t3_jbktdv,10
1602787035.0,2020-10-15,wallstreetbets,g8xactu,I was promised circuit breakers today,t3_jbktdv,8
1602787060.0,2020-10-15,wallstreetbets,g8xaenw,Every dip is just fuel for a bigger pump,t3_jbktdv,9
1602787570.0,2020-10-15,wallstreetbets,g8xbfsj,"Update on yours truly true tist’s moves :
-bought SPWR at 17.31, sold at 15.50
-then bought GME at 14.50, and sold at 12.20
-put all of that in APHA at 7.50 CAD which is lost 20% today

The rest is yet to come 🤡🤡🤡",t3_jbktdv,9
1602787887.0,2020-10-15,wallstreetbets,g8xc2vr,GME forming your grandmother's entire fine china cabinet worth of cup and handles,t3_jbktdv,9
1602787940.0,2020-10-15,wallstreetbets,g8xc6sg,GME.  It’s starting to happen.,t3_jbktdv,11
1602788176.0,2020-10-15,wallstreetbets,g8xcnqq,I bought some .01 calls on GME for fun and they are up 300% lol,t3_jbktdv,10
1602788285.0,2020-10-15,wallstreetbets,g8xcvpp,My gme call is up 600% today. Only 8% gain for me tho :(,t3_jbktdv,9
1602788470.0,2020-10-15,wallstreetbets,g8xd99n,Come on GME... you can do 20. Just the tip,t3_jbktdv,9
1602788962.0,2020-10-15,wallstreetbets,g8xe8r6,SHOW 15 DOLLARS YOUR DICK GME,t3_jbktdv,8
1602789031.0,2020-10-15,wallstreetbets,g8xedq7," [https://twitter.com/FirstSquawk/status/1316818600938725376?s=20](https://twitter.com/FirstSquawk/status/1316818600938725376?s=20)

 REMDESIVIR HAS LITTLE EFFECT ON COVID-19 MORTALITY, WHO STUDY SAYS- FT",t3_jbktdv,9
1602789149.0,2020-10-15,wallstreetbets,g8xemey,GME can’t go tits up.,t3_jbktdv,9
1602789181.0,2020-10-15,wallstreetbets,g8xeonn,"congrats to the kids getting on gme or that have been on it, massive fucking cocks all of u i hope it goes good i’m jus too scared to get in myself",t3_jbktdv,9
1602764372.0,2020-10-15,wallstreetbets,g8w46dh,Tsla 10k >182.  Hello brother.,t1_g8w4214,48
1602757486.0,2020-10-15,wallstreetbets,g8vwp72,Would you be content with a Broadway musical?,t1_g8vwejb,11
1602763476.0,2020-10-15,wallstreetbets,g8w3158,Doesn’t hurt to try 😉,t1_g8w2yxd,17
1602760080.0,2020-10-15,wallstreetbets,g8vz6ce,Fact,t1_g8vyrqf,22
1602761534.0,2020-10-15,wallstreetbets,g8w0pwz,Classic Apple move,t1_g8vyrqf,12
1602757755.0,2020-10-15,wallstreetbets,g8vwxza,[deleted],t1_g8vwjpt,9
1602759232.0,2020-10-15,wallstreetbets,g8vyby3,Sir this is a gloryhole,t1_g8vyafw,63
1602758762.0,2020-10-15,wallstreetbets,g8vxvo8,"Almost forgot about the water, cheers 🍻",t1_g8vxpu6,52
1602758861.0,2020-10-15,wallstreetbets,g8vxz0s,Doesn’t the 2nd part actually work ? Asking for my wife’s bf,t1_g8vxpu6,20
1602762678.0,2020-10-15,wallstreetbets,g8w223k,putting airlines on the brink of bankruptcy by not going on vacations during a global lockdown while being unemployed,t1_g8w1ts8,96
1602763096.0,2020-10-15,wallstreetbets,g8w2khc,Not buying a brand new cell phone every 6 months like analysts have priced in.,t1_g8w1ts8,18
1602758077.0,2020-10-15,wallstreetbets,g8vx8qo,"Make it 5, just to be safe.",t1_g8vwwfi,8
1602766566.0,2020-10-15,wallstreetbets,g8w78vz,Hmm...almost like options should be sold long before they expire 🤔🤔🤔🤔,t1_g8w72ij,9
1602757261.0,2020-10-15,wallstreetbets,g8vwhwe,And everyone had puts,t1_g8vwfyg,40
1602763968.0,2020-10-15,wallstreetbets,g8w3nh6,"March was once in a lifetime. Waking up to limit down. Circuit breakers. People losing their goddamn minds, my account flashing green. It was my paradise.",t1_g8vwfyg,8
1602759588.0,2020-10-15,wallstreetbets,g8vyon6,"Lot of broke economists, don't worry.",t1_g8vyl5b,20
1602759527.0,2020-10-15,wallstreetbets,g8vymik,CFA here 🤡,t1_g8vyl5b,36
1602759599.0,2020-10-15,wallstreetbets,g8vyp1c,"Master in Business with a concentration in Global Economics.

I feel yah brother.",t1_g8vyl5b,15
1602761893.0,2020-10-15,wallstreetbets,g8w14o7,\-2k to start the day is worse bro trust me,t1_g8w0u5y,9
1602762729.0,2020-10-15,wallstreetbets,g8w24aa,Shhhhhh... They'll come for you and make you disappear.,t1_g8w2126,47
1602787812.0,2020-10-15,wallstreetbets,g8xbxdl,That’s great to hear.,t1_g8xbqtc,9
1602759946.0,2020-10-15,wallstreetbets,g8vz1ia,"I mean, JPow always yells one right before he cums so I just use that",t1_g8vyu85,18
1602759822.0,2020-10-15,wallstreetbets,g8vywxm,"It’s just a bunch of monkeys throwing darts, man. Don’t overthink it. 🐒🎯",t1_g8vyu85,22
1602765467.0,2020-10-15,wallstreetbets,g8w5nfw,Or...ever? Are you fucking retarded?,t1_g8w5ld8,13
1602795108.0,2020-10-15,wallstreetbets,g8xqb4v,Fuck you dude,t1_g8xpt2h,10
1602763061.0,2020-10-15,wallstreetbets,g8w2iyb,"In what directions should I be pulling my peen? Been doing east-west for 30 mins/day for the past few years, wondering if north-south was the play?",t1_g8w254k,11
1602762828.0,2020-10-15,wallstreetbets,g8w28kr,[deleted],t1_g8w270a,20
1602762994.0,2020-10-15,wallstreetbets,g8w2fxs,Buy the top sell the drop.,t1_g8w2dcf,11
1602767985.0,2020-10-15,wallstreetbets,g8w9gc3,100% ARK,t1_g8w9edz,11
1602760953.0,2020-10-15,wallstreetbets,g8w02ub,See you at 9:30am,t1_g8vzu41,11
1602763455.0,2020-10-15,wallstreetbets,g8w3077,Lower strike. More contracts,t1_g8w2y2i,9
1602778323.0,2020-10-15,wallstreetbets,g8wsrxz,it still is a stupid bike company,t1_g8wsm3n,9
1602756936.0,2020-10-15,wallstreetbets,g8vw7bc,DÕōMP EET. 😁,t1_g8vw46f,20
1602779671.0,2020-10-15,wallstreetbets,g8wvhvx,Yep,t1_g8wvgey,11
1602765886.0,2020-10-15,wallstreetbets,g8w68u1,Pelosi wants a Federal plan while Trump wants to leave it up to states. I think we should have a federal plan,t1_g8w64g7,9
1602784559.0,2020-10-15,wallstreetbets,g8x5f9a,"The year is 2022, and the President is calling Congress to pass Stimulus.",t1_g8x5bir,8
1602762844.0,2020-10-15,wallstreetbets,g8w29a4,[deleted],t1_g8w28kr,21
