created,date,subreddit,id,body,parent_id,score
1621865938.0,2021-05-24,wallstreetbets,gz9wxi2,"Chasdaq mooning, bers in shambles!",t3_njubrl,6
1621866049.0,2021-05-24,wallstreetbets,gz9x5qx,That dude posted last night how OLTY ice cream tastes like dog shit and investors agree apparently,t3_njubrl,8
1621866221.0,2021-05-24,wallstreetbets,gz9xiq9,how the fuck are we at 420 again,t3_njubrl,8
1621866427.0,2021-05-24,wallstreetbets,gz9xy95,TSLA closing back over 600 today would be huge,t3_njubrl,6
1621866876.0,2021-05-24,wallstreetbets,gz9yvov,SoFI been green for 6 straight days and this shit ain’t even parabolic yet. Get in before the takeoff,t3_njubrl,7
1621867213.0,2021-05-24,wallstreetbets,gz9zkxy,360K put guy. Can we get a wellness check? ⚰️⚰️,t3_njubrl,6
1621867279.0,2021-05-24,wallstreetbets,gz9zptr,RIP my 417 puts on SPY,t3_njubrl,7
1621867800.0,2021-05-24,wallstreetbets,gza0tgb,GREEN GREEN GREEEEEN MOTHERFUCKERS!! 🚀🚀🚀,t3_njubrl,8
1621867880.0,2021-05-24,wallstreetbets,gza0zss,God my stocks are hot garbage.  Indexes up big across the board and I'm bleeding out.,t3_njubrl,7
1621867938.0,2021-05-24,wallstreetbets,gza149t,rip pltr,t3_njubrl,7
1621868189.0,2021-05-24,wallstreetbets,gza1nsi,Pltr is starting to be a bag,t3_njubrl,7
1621868323.0,2021-05-24,wallstreetbets,gza1yb4,Can TSLA break 600 or is Elon pp permanently soft now?,t3_njubrl,7
1621868372.0,2021-05-24,wallstreetbets,gza2232,Sell for a profit or hold and let expire worthless🤔,t3_njubrl,7
1621869157.0,2021-05-24,wallstreetbets,gza3s75,Would anyone please mind holding my PLTR and PLUG bags while I run into the restroom really quick?,t3_njubrl,8
1621869270.0,2021-05-24,wallstreetbets,gza418o,188 MPH!,t3_njubrl,7
1621869275.0,2021-05-24,wallstreetbets,gza41ol,AMC to the moon,t3_njubrl,6
1621869732.0,2021-05-24,wallstreetbets,gza51sx,VIX going up again slowly boys... First alert!,t3_njubrl,6
1621870680.0,2021-05-24,wallstreetbets,gza73ak,My one measly SPCE put is dead,t3_njubrl,8
1621871093.0,2021-05-24,wallstreetbets,gza7ypr,Only down 40% on my NIO position now boys! We making gainz!!!,t3_njubrl,6
1621871200.0,2021-05-24,wallstreetbets,gza86ye,**TSLA BACK TO THE MOON RECLAM THAT 600** 📈📈📈🚀🚀🚀,t3_njubrl,8
1621871211.0,2021-05-24,wallstreetbets,gza87rv,ITS NICE TO SEE SPCE ALIVE AND WELL AGAIN,t3_njubrl,7
1621871419.0,2021-05-24,wallstreetbets,gza8o1h,DKNG🚀 degenerate gamblers support gambling! 📈,t3_njubrl,6
1621871454.0,2021-05-24,wallstreetbets,gza8qqr,tsla broke $600,t3_njubrl,7
1621871541.0,2021-05-24,wallstreetbets,gza8xj5,My dirty little secret: I once made money off of a stock.,t3_njubrl,7
1621871594.0,2021-05-24,wallstreetbets,gza91li,I can’t believe I invested in Cathie in my boomer account. Shits wrecked,t3_njubrl,7
1621872038.0,2021-05-24,wallstreetbets,gzaa0df,SPY to 435,t3_njubrl,7
1621872328.0,2021-05-24,wallstreetbets,gzaanm7,NIO gang how r we feeling?,t3_njubrl,8
1621872400.0,2021-05-24,wallstreetbets,gzaatkl,K-Pop girls are hot.,t3_njubrl,8
1621872568.0,2021-05-24,wallstreetbets,gzab7jj,SPCE is going crazy right now. The relative volume is almost 3 in 3 hours. Calls being covered from all the contracts that expired last Friday too. I have a really good feeling about tomorrow,t3_njubrl,6
1621872685.0,2021-05-24,wallstreetbets,gzabhjr,I could see a dump if SPY goes under 419,t3_njubrl,8
1621872737.0,2021-05-24,wallstreetbets,gzably0,AMC has me green today and that’s all I have to say!!!,t3_njubrl,7
1621872836.0,2021-05-24,wallstreetbets,gzabu0f,Damn. RBLX offering incoming I know it.,t3_njubrl,8
1621872858.0,2021-05-24,wallstreetbets,gzabvsg,"just bought SPCE $26 calls for friday, lets run it boys

&#x200B;

paid for by SPY call profits :)))",t3_njubrl,7
1621873231.0,2021-05-24,wallstreetbets,gzacq8h,CCL is getting into the space tourism. Taking off.,t3_njubrl,7
1621873247.0,2021-05-24,wallstreetbets,gzacrjr,When will inflation numbers come in this week? I need to know when to sell all that tech,t3_njubrl,7
1621873391.0,2021-05-24,wallstreetbets,gzad39d,DKNG making cathy a happy girl today,t3_njubrl,8
1621873699.0,2021-05-24,wallstreetbets,gzadsi8,800% on SPCE 30 Calls....Only regret is not buying a lotttt.,t3_njubrl,7
1621873702.0,2021-05-24,wallstreetbets,gzadsob,I’m not that good at selling the top. Anyone else having this problem?,t3_njubrl,8
1621873744.0,2021-05-24,wallstreetbets,gzadw4y,SPY wtf are you doing,t3_njubrl,7
1621874233.0,2021-05-24,wallstreetbets,gzaf0bk,"This is DJ EEAZY Dick, and you’re now listening to the Jack off hour.",t3_njubrl,7
1621874852.0,2021-05-24,wallstreetbets,gzagf44,What time is the rug pull ?,t3_njubrl,8
1621874977.0,2021-05-24,wallstreetbets,gzagpg7,Spy puts now or wait?,t3_njubrl,7
1621875258.0,2021-05-24,wallstreetbets,gzahcxw,"Oh Baby very fun , sold my DraftKings calls at open at a loss for coin, instead of up 200% in down 30% let’s GOOOOO",t3_njubrl,8
1621875645.0,2021-05-24,wallstreetbets,gzaih3u,Shorting RBLX 🐻,t3_njubrl,6
1621875717.0,2021-05-24,wallstreetbets,gzaio4w,low volume spy seems sketchy,t3_njubrl,8
1621875934.0,2021-05-24,wallstreetbets,gzaj9n9,TSLA broke $600!!!! 😍😍😍😍😍😍,t3_njubrl,7
1621876467.0,2021-05-24,wallstreetbets,gzakhcm,"The part that pisses me off the most about Roblox is that it just rockets in the morning and stays flat. If you're gonna fuck my puts, at least do it forcefully instead of a death by 1000 cuts",t3_njubrl,7
1621876826.0,2021-05-24,wallstreetbets,gzalb3h,"i bet on baba, nio and tesla 😊",t3_njubrl,8
1621877167.0,2021-05-24,wallstreetbets,gzam3f4,"thinkorswim is the best trading app 

come at me",t3_njubrl,7
1621877262.0,2021-05-24,wallstreetbets,gzamb9t,"TSLA was at 700 just 3 weeks ago - now it's rising everyone's about to sell it at 600, make themselves 30 dollars and think they've done something clever?",t3_njubrl,8
1621877334.0,2021-05-24,wallstreetbets,gzamhde,VIX over here just fucking dying,t3_njubrl,7
1621878190.0,2021-05-24,wallstreetbets,gzaof8s,[deleted],t3_njubrl,7
1621878514.0,2021-05-24,wallstreetbets,gzap5bh,SPCE is up 12% today🚀,t3_njubrl,6
1621878747.0,2021-05-24,wallstreetbets,gzapofm,SPY hitting 420 next hour maybe 420.5 after power hour. TSLA might hit 610 EOD. I do think TSLA will correct to 400+ this year but there are troughs in pricing.,t3_njubrl,6
1621880113.0,2021-05-24,wallstreetbets,gzasskt,SPY 420!!,t3_njubrl,6
1621880191.0,2021-05-24,wallstreetbets,gzasyu0,TSLA options are literally in the 1% IV percentile...,t3_njubrl,8
1621880347.0,2021-05-24,wallstreetbets,gzatben,SPCE breaking through a wall baby! hit it!,t3_njubrl,6
1621880669.0,2021-05-24,wallstreetbets,gzau2q0,According to my calculations using the principles of Quantum Autistics SPCE will choose moon..the squeeze shall be sqoozen,t3_njubrl,7
1621880702.0,2021-05-24,wallstreetbets,gzau5pt,When SPY hits 420.69 there are hidden confetti canons rigged to blow all over the country,t3_njubrl,7
1621880915.0,2021-05-24,wallstreetbets,gzauo6q,The SPCE support is insane.  Everytime it drops it just fucking claws back up and then some LMAO.  Hasn't been squozen yet it seems.,t3_njubrl,7
1621880933.0,2021-05-24,wallstreetbets,gzaupth,on the r/stocks there is a guy made $200 on the stonk market today and he made a post about it ....,t3_njubrl,7
1621881056.0,2021-05-24,wallstreetbets,gzav0fu,Taking profits along the way acting like I know what I’m doing which I obv don’t,t3_njubrl,8
1621881380.0,2021-05-24,wallstreetbets,gzavr0a,"Thanks to Psfe, my parents are divorcing 😟",t3_njubrl,7
1621859410.0,2021-05-24,wallstreetbets,gz9kw9x,"Wait. Didn't your post end with ""thank me later""?",t1_gz9kmf7,58
1621855368.0,2021-05-24,wallstreetbets,gz9fau9,or mute their fucking mics on the shitty zoom mtg,t1_gz9f7it,48
1621852702.0,2021-05-24,wallstreetbets,gz9c5su,"Finally got a W, feelsgoodman",t1_gz9c3bk,31
1621853623.0,2021-05-24,wallstreetbets,gz9d7a1,You're gonna love next weekend,t1_gz9cvwx,23
1621860302.0,2021-05-24,wallstreetbets,gz9marh,"That only adds up to 100%.

You're not even using margin, this sub has changed.

smh",t1_gz9m3we,29
1621862772.0,2021-05-24,wallstreetbets,gz9qm1z,We’re all retarded.,t1_gz9qc1x,8
1621866637.0,2021-05-24,wallstreetbets,gz9ye5y,[deleted],t1_gz9ya5c,17
1621862021.0,2021-05-24,wallstreetbets,gz9p8nm,I have trust issues with futures too,t1_gz9p5r5,8
1621879255.0,2021-05-24,wallstreetbets,gzaqug0,LOL!!!! This is guaranteed.,t1_gzaqoq4,8
1621861444.0,2021-05-24,wallstreetbets,gz9o898,ban,t1_gz9o6f2,30
1621858893.0,2021-05-24,wallstreetbets,gz9k4hp,Most of them think Roblox is one crappy game with crappy graphics. Little do they know that it’s a platform of thousands of crappy games with crappy graphics and an in platform economy to purchase crappy items for said crappy games.,t1_gz9jskk,41
1621858760.0,2021-05-24,wallstreetbets,gz9jx6z,The stock doesnt trace live users or smth: do they have earnings before your exp? If not it doesn't matter unless the market realizes this,t1_gz9jskk,8
1621859493.0,2021-05-24,wallstreetbets,gz9l0sm,"I did that too. Then baghold for a week. And panic sell. Then after sold, I watch it go up. Classic.",t1_gz9kylj,17
1621858218.0,2021-05-24,wallstreetbets,gz9j4wi,I hope you joking and there isn't any actual positive news for PLTR because I've got calls right now and I'm not looking forward to a massive dump.,t1_gz9iyfy,10
1621851955.0,2021-05-24,wallstreetbets,gz9bb3k,prolapse’d,t1_gz9aybj,16
1621856918.0,2021-05-24,wallstreetbets,gz9hbg2,Yeah fuck that guy,t1_gz9aybj,8
1621856763.0,2021-05-24,wallstreetbets,gz9h3yq,3 day weekend ahead. Historically it dumps...,t1_gz9fyq7,8
1621862665.0,2021-05-24,wallstreetbets,gz9qeze,"Tried that, the next day AAPL drops like 2% and i paper handed immediately",t1_gz9q3bh,8
1621883837.0,2021-05-24,wallstreetbets,gzb1ebi,Probably from all the retards tbh,t1_gzb1bju,11
1621856985.0,2021-05-24,wallstreetbets,gz9het1,Reported that guy every comment he made,t1_gz9hcll,8
1621859472.0,2021-05-24,wallstreetbets,gz9kzmj,[deleted],t1_gz9kqbc,9
1621867893.0,2021-05-24,wallstreetbets,gza10rr,Probably too drunk to post rn,t1_gza0xrx,7
1621875723.0,2021-05-24,wallstreetbets,gzaiorx,Retail who are about to become bagholders. Hopefully Cathie buys more today,t1_gzaij42,9
1621862297.0,2021-05-24,wallstreetbets,gz9pqp9,🤡,t1_gz9pony,7
1621858338.0,2021-05-24,wallstreetbets,gz9jb38,bottle and sell that shit. the sandal wearing crowd will love that its all natural,t1_gz9j3gc,15
1621879223.0,2021-05-24,wallstreetbets,gzaqrqw,Called sniping,t1_gzaqodf,8
1621868028.0,2021-05-24,wallstreetbets,gza1b6a,16,t1_gza18pt,11
1621869730.0,2021-05-24,wallstreetbets,gza51m0,Dont sell until its red again,t1_gza4uld,7
1621867612.0,2021-05-24,wallstreetbets,gza0f8p,I hope it hits that for you,t1_gza0byz,10
1621867735.0,2021-05-24,wallstreetbets,gza0ohw,You should quit them anyway. It is an amazing feeling to get that elephant off your chest.,t1_gza0byz,11
1621867657.0,2021-05-24,wallstreetbets,gza0iju,I'm rooting for this guy,t1_gza0byz,10
1621860213.0,2021-05-24,wallstreetbets,gz9m5gq,When a mom bot and a dad bot love each other so much...,t1_gz9m378,28
1621868225.0,2021-05-24,wallstreetbets,gza1qm4,starting? STARTING?!,t1_gza1nsi,13
1621868244.0,2021-05-24,wallstreetbets,gza1s4h,“Starting to” 😂,t1_gza1nsi,11
1621874889.0,2021-05-24,wallstreetbets,gzagi5v,"3pm, as is tradition.",t1_gzagf44,7
