created,date,subreddit,id,body,parent_id,score
1630583837.0,2021-09-02,wallstreetbets,hbazzf0,"All the wrong plays lately..
If i end up red today i might say goodbye for a long while",t3_pgergo,9
1630583994.0,2021-09-02,wallstreetbets,hbb09cn,"Snorting my morning addy, doc appointment, work at 9. Thinking about just not going into work tho because I quit anyways. What should I do, watching TimTheTatman later",t3_pgergo,9
1630585280.0,2021-09-02,wallstreetbets,hbb2kn2,If we ever get that 10% correction I'm going all in on TQQQ LEAPS.,t3_pgergo,10
1630585315.0,2021-09-02,wallstreetbets,hbb2n1r,"Ant financial IPO will happen soon, $BABA will hit $350 by then.",t3_pgergo,8
1630589691.0,2021-09-02,wallstreetbets,hbbbjff,SPY undefeated champion,t3_pgergo,9
1630590135.0,2021-09-02,wallstreetbets,hbbcjvz,"Felt cute, bought calls at open. 🤪",t3_pgergo,9
1630591475.0,2021-09-02,wallstreetbets,hbbflkr,PLTR 30 EOW,t3_pgergo,10
1630592083.0,2021-09-02,wallstreetbets,hbbh060,GME and AMC with the  “LIfE chAnGing MoneY” with a single share 🤣🤣🤣🤣,t3_pgergo,9
1630592112.0,2021-09-02,wallstreetbets,hbbh2ll,Got out of my positions. The pump will continue now due to my paper hands boys. You all are welcome,t3_pgergo,9
1630593833.0,2021-09-02,wallstreetbets,hbbl611,"It's sad when I consider it a win that my calls are finally green by 1% lmfao. ""I got to gamble and didn't lose money"".",t3_pgergo,8
1630595056.0,2021-09-02,wallstreetbets,hbbo0ed,Too many pumps. Not enough dumps,t3_pgergo,9
1630597195.0,2021-09-02,wallstreetbets,hbbt8g8,What’s the play if Joe Rogan kicks the bucket due to horse dewormer,t3_pgergo,9
1630597347.0,2021-09-02,wallstreetbets,hbbtkng,"Buy $CLF options and shares. We were notified by a material supplier they cannon get any more steel rod that is specified by a major OEM. Originally this was being supplied North American Stainless, they are cutting this out to focus on other areas of their business. So the OEM is telling suppliers to move over to CLF where they have some pull.  The material is specifically for exhaust pipes, hangers, mufflers, and shields.

I have added 30 shares to bring my total up to 170, I have stacked calls  for Sept/Oct/Nov between $24.50 - $26.

I have routinely bought and sold calls over the past 6 months for a steady profit each time.

Not financial or insider advice. CLF has a list of customers and NAS sent our a blanket memo to customers. This information is available in public domain with a little effort.",t3_pgergo,9
1630598093.0,2021-09-02,wallstreetbets,hbbvdx3,Meeting with the IRS in twenty minutes. They claim I owe them 102k from 2016! It was because my stock basis was all messed up (Scott trade transition). Anyway. Let this be a lesson...check your basis and don't put off doing taxes till the last second while totally sauced.  😶,t3_pgergo,10
1630598773.0,2021-09-02,wallstreetbets,hbbx3oy,"SOFI will be forming solid resistance at 15 over the next couple weeks, and you’ll never see sub 15 for the rest of your life.",t3_pgergo,10
1630598930.0,2021-09-02,wallstreetbets,hbbxhqu,Sold my spy calls expiring Sept 24th for a weak 7% gain because I'm a little girl and can't handle all this red September talk,t3_pgergo,9
1630599504.0,2021-09-02,wallstreetbets,hbbyxki,$10k in 1dte spy puts. Let’s go!,t3_pgergo,10
1630599764.0,2021-09-02,wallstreetbets,hbbzl7y,I also do think CLOV has the best chance of FLYING if it gains momemtum,t3_pgergo,9
1630599788.0,2021-09-02,wallstreetbets,hbbzngy,TLRY MOONING,t3_pgergo,9
1630600071.0,2021-09-02,wallstreetbets,hbc0dhz,"Cannabis stocks popping.

Over 2B in tax revenue last year in Massachusetts 

Pentagon to review discriminatory drug testing on marijuana 

Major legislation to be voted on STILL

Bezos lobbying Congress for the MORE act 
to pass

TLRY shorted 59% of yesterday’s trading volume per Fintel.io 

TLRY🚀",t3_pgergo,8
1630600297.0,2021-09-02,wallstreetbets,hbc0y92,TLRY $15 EOD,t3_pgergo,10
1630600478.0,2021-09-02,wallstreetbets,hbc1f1v,"Lucky Clover,  this is it!!!!",t3_pgergo,9
1630600585.0,2021-09-02,wallstreetbets,hbc1pcp,You guys ready for a 25 cent jump up on CLOV? its gonna happen in a couple of minutes,t3_pgergo,8
1630600984.0,2021-09-02,wallstreetbets,hbc2q0e,TLRY up 4.20%. Nice.,t3_pgergo,8
1630601498.0,2021-09-02,wallstreetbets,hbc418m,Clov please go to $20 tomorrow,t3_pgergo,9
1630601805.0,2021-09-02,wallstreetbets,hbc4tj3,quit whining about thetagang stealing your money when you buy weekly puts on something at like 300% IV,t3_pgergo,10
1630602006.0,2021-09-02,wallstreetbets,hbc5bwt,$12k in a day and I AINT SELLING. SOFI SOFI SOFI SOFI.,t3_pgergo,9
1630602102.0,2021-09-02,wallstreetbets,hbc5ks6,Baba fuck u,t3_pgergo,9
1630602272.0,2021-09-02,wallstreetbets,hbc605n,Break $9 clov you useless shitt,t3_pgergo,8
1630603878.0,2021-09-02,wallstreetbets,hbca1xp,Stocks Green but SPY is experiencing a free fall. Fuck this shit,t3_pgergo,10
1630605276.0,2021-09-02,wallstreetbets,hbcdjyd,Who woke the 🌈 🐻s?,t3_pgergo,9
1630606550.0,2021-09-02,wallstreetbets,hbcgnsq,If this V's I quit,t3_pgergo,9
1630606935.0,2021-09-02,wallstreetbets,hbchmmh,"I have once again played SPY exactly, perfectly wrong today. Suck on that, nerds. My instincts may be exactly wrong, but at least they’re exact!",t3_pgergo,9
1630606969.0,2021-09-02,wallstreetbets,hbchpq7,[deleted],t3_pgergo,8
1630608529.0,2021-09-02,wallstreetbets,hbclmr3,"2,000 folks dropping a day, global pandy, turmoil in the middle east, labor shortages... SPY at ATH... JPOW deserves a raise",t3_pgergo,10
1630610444.0,2021-09-02,wallstreetbets,hbcqgz5,"New strategy. Buy when stock goes down, sell when stock goes up. Will report back with results.",t3_pgergo,9
1630610922.0,2021-09-02,wallstreetbets,hbcrny5,SPYY go to $451 plsssssssss,t3_pgergo,8
1630611582.0,2021-09-02,wallstreetbets,hbctbn3,Can GME pump to 215 before close? Please and thank you,t3_pgergo,9
1630611607.0,2021-09-02,wallstreetbets,hbctdzz,"taiwan, you can be independent when amd stops being stupid.",t3_pgergo,9
1630611874.0,2021-09-02,wallstreetbets,hbcu266,Either way tomorrow is gonna see some volume. So it’s either SPY 0dte calls or puts. But SPY only goes up so it’s calls. See ya with my 250% return,t3_pgergo,8
1630612947.0,2021-09-02,wallstreetbets,hbcwspu,Phew 1.5 h recission was hard.,t3_pgergo,8
1630615207.0,2021-09-02,wallstreetbets,hbd2j6g,[deleted],t3_pgergo,10
1630579467.0,2021-09-02,wallstreetbets,hbat9dd,"I just wanna be a millionaire, so fuckin bad",t3_pgergo,37
1630584913.0,2021-09-02,wallstreetbets,hbb1w74,"Living the American dream baby. Walked my dog, tall glass of OJ, about to commute 35 minutes to a job where I’m extremely underpaid. The good life.",t3_pgergo,38
1630583182.0,2021-09-02,wallstreetbets,hbayvaf,"If BB goes up 5% today, I'll treat myself to a nice scone",t3_pgergo,23
1630586869.0,2021-09-02,wallstreetbets,hbb5luy,Wow a red September is also priced in. Market is super efficient,t3_pgergo,23
1630577316.0,2021-09-02,wallstreetbets,hbaqi82,Unsure whether to take the 90% loss on my GME calls today or to just wait till tomorrow so they r worthless,t3_pgergo,8
1630577423.0,2021-09-02,wallstreetbets,hbaqmvv,Open the Casino,t3_pgergo,8
1630578947.0,2021-09-02,wallstreetbets,hbaskat,"Alexa play ""I'm a big big girl in a big big world"" by Jim Cramer",t3_pgergo,9
1630579421.0,2021-09-02,wallstreetbets,hbat730,Pray my portfolio goes up 5%+ with BABA & DKNG calls.,t3_pgergo,9
1630581332.0,2021-09-02,wallstreetbets,hbavwi3,"Something feels off in the world

*astroid hits earth 

“SPY reaches all time highs despite catastrophic astroid event”",t3_pgergo,9
1630581904.0,2021-09-02,wallstreetbets,hbawrw5,This is the most highly regarded sub,t3_pgergo,9
1630582080.0,2021-09-02,wallstreetbets,hbax1qv,Next time SPY might gap down will be in 2022.,t3_pgergo,8
1630582332.0,2021-09-02,wallstreetbets,hbaxg7v,nyc under water bullish right?,t3_pgergo,8
1630582436.0,2021-09-02,wallstreetbets,hbaxmby,"World's markets all ended or are still in the green.

Buy calls today, gentlemen.",t3_pgergo,7
1630583477.0,2021-09-02,wallstreetbets,hbazd7m,"I’m about to make a chicken and Mayo sandwich for breakfast , anyone else want one ?",t3_pgergo,6
1630583594.0,2021-09-02,wallstreetbets,hbazkfa,Anybody watching this footage of the subway flooding on CNBC? Like what the hell the way the guys clearly see this tidal wave coming down the subway at them and they're still just chilling on their phones?,t3_pgergo,9
1630583979.0,2021-09-02,wallstreetbets,hbb08et,"[https://www.cnbc.com/2021/09/02/active-traders-are-seeing-their-account-balances-continue-to-rise.html](https://www.cnbc.com/2021/09/02/active-traders-are-seeing-their-account-balances-continue-to-rise.html)

&#x200B;

'They’re spreading out their investments as well. Some held stocks directly, but half also held mutual funds and ETFs, and a  high percentage of the money was held in cash, possibly because money is being direct deposited and waiting to be allocated.'

&#x200B;

Near top theory in shambles. As long as there area lot of people with cash as opposed to leveraged to the tits, this bull market will continue boyos",t3_pgergo,9
1630585868.0,2021-09-02,wallstreetbets,hbb3ogp,Jobs claim less than expected. Means bulls fuck?,t3_pgergo,9
1630585990.0,2021-09-02,wallstreetbets,hbb3wrh,Thank you BABA for sponsoring my tickets to go to the moon 🚀,t3_pgergo,9
1630586096.0,2021-09-02,wallstreetbets,hbb4448,BB ready to rocket :),t3_pgergo,8
1630586480.0,2021-09-02,wallstreetbets,hbb4ulv,"people love to say shit like ""you need to spend more time in nature or the country"" but i think it's just as important to tell people in the boonies ""you need to spend more time in cities""",t3_pgergo,8
1630587229.0,2021-09-02,wallstreetbets,hbb6bkd,"DOCUSIGN PUTS at open
220 PUT 9/3 EXP",t3_pgergo,8
1630587322.0,2021-09-02,wallstreetbets,hbb6i9c,Every time I go outside I end up letting like three mosquitoes in no matter how careful I am. They've evolved.,t3_pgergo,8
1630587710.0,2021-09-02,wallstreetbets,hbb7a83,"Got poison ivy all over my body, including my balls. I'm swollen and red. Confirmed bull trap today and close red.",t3_pgergo,8
1630588445.0,2021-09-02,wallstreetbets,hbb8tmg,If you'd have told me last year we'd be trading spy 453cs right now I'd slap you. But here we are,t3_pgergo,9
1630588624.0,2021-09-02,wallstreetbets,hbb975u,"Well, got fucked in SWBI. Never playing earnings again.",t3_pgergo,8
1630589233.0,2021-09-02,wallstreetbets,hbbail9,"Open the casino, I’m ready to hurt once again.",t3_pgergo,7
1630591290.0,2021-09-02,wallstreetbets,hbbf6fa,"Almost pissed myself laughing at the ""GME to $250"" people this morning.",t3_pgergo,9
1630591443.0,2021-09-02,wallstreetbets,hbbfiu7,Draftkings + ESPN Partnership coming just wait in it,t3_pgergo,8
1630591661.0,2021-09-02,wallstreetbets,hbbg11m,$PLTR is getting hoooot finally,t3_pgergo,7
1630591876.0,2021-09-02,wallstreetbets,hbbgiwf,I sold my puts at open and bought calls so I could lose the maximum amount of money today,t3_pgergo,7
1630592085.0,2021-09-02,wallstreetbets,hbbh0af,PLTR making steady gains everyday can’t complain,t3_pgergo,8
1630592162.0,2021-09-02,wallstreetbets,hbbh6v7,I'M NOT SELLING MY PUTS 🐻 fuck me or fuck you LFG,t3_pgergo,7
1630592362.0,2021-09-02,wallstreetbets,hbbhnlg,CLNE to the 10s 🚀🚀🚀😊😊,t3_pgergo,8
1630593339.0,2021-09-02,wallstreetbets,hbbjzs8,"Bear Diary,

RuG Pull InCoMiNg . Day 527",t3_pgergo,7
1630593730.0,2021-09-02,wallstreetbets,hbbkxin,SWBI could go up 60% and I’d still be fucked,t3_pgergo,8
1630594133.0,2021-09-02,wallstreetbets,hbblupv,"Me on Monday: I’m not going to do anything retarded til I get this account back to good… 

Me on Thursday: SPY CALLZZZ AT ATH YESSS",t3_pgergo,8
1630594568.0,2021-09-02,wallstreetbets,hbbmv40,SPY 455 EOD,t3_pgergo,7
1630594955.0,2021-09-02,wallstreetbets,hbbnrna,rip that BABA guy that sac’d himself so the BABagholders to come out green,t3_pgergo,9
1630595225.0,2021-09-02,wallstreetbets,hbbofoq,I wish there was a stock market photo ID i can see the face of the person selling me these retarded options,t3_pgergo,8
1630595674.0,2021-09-02,wallstreetbets,hbbpj5i,CRSR slowly but steady 🚀,t3_pgergo,7
1630595915.0,2021-09-02,wallstreetbets,hbbq4ma,"If you work for an investment bank and your “job” is to comb this sub for information, reflect on your life for me",t3_pgergo,8
1630596040.0,2021-09-02,wallstreetbets,hbbqfys,"Stock is up or down half a cent 

This sub : ITS MOONING, ITS DRILLING 

Bro, eat some pop tarts",t3_pgergo,9
1630596667.0,2021-09-02,wallstreetbets,hbbryo3,"god I fuckin love monthlies now. So much time for plays to work out, no skress.",t3_pgergo,7
1630596788.0,2021-09-02,wallstreetbets,hbbs8ve,Wow. PLTR is finally above my cost basis. I never thought this day would come,t3_pgergo,8
1630597565.0,2021-09-02,wallstreetbets,hbbu2z3,TSLA is allergic to 740 I think 😗,t3_pgergo,7
1630598311.0,2021-09-02,wallstreetbets,hbbvxns,Thought I was killing it this week until I realized if I’d just held my NIO calls from yesterday I’d be up 8k 🤡,t3_pgergo,9
1630598730.0,2021-09-02,wallstreetbets,hbbwzrr,PLTR with the slow grind up,t3_pgergo,7
1630598772.0,2021-09-02,wallstreetbets,hbbx3jz,Feels incestuous buying $HOOD FDs on Robinhood.,t3_pgergo,8
1630598774.0,2021-09-02,wallstreetbets,hbbx3qp,Tilray is awake,t3_pgergo,8
1630599443.0,2021-09-02,wallstreetbets,hbbys2z,PLTR GANG GANG,t3_pgergo,8
1630599730.0,2021-09-02,wallstreetbets,hbbzi85,Clov has to break $9. Remember that before burning money,t3_pgergo,8
1630599791.0,2021-09-02,wallstreetbets,hbbznro,CLOV finally going 🤔,t3_pgergo,8
1630599876.0,2021-09-02,wallstreetbets,hbbzvix,[deleted],t3_pgergo,8
1630600081.0,2021-09-02,wallstreetbets,hbc0eh6,"TLRY , Giant green dildo bois!!!!!  😳",t3_pgergo,9
1630600783.0,2021-09-02,wallstreetbets,hbc27qj,"GERMANY IS GOING TO LEGALIZA WEED BEFORE THE US BY THE END OF THIS MONTH. TLRY HAS THE MAJORITY MARKET SHARE IN THE ENTIRE COUNTRY COMPARED TO ITS US PEERS WHO HAVE TO WAIT OM BUDEN, CONGRESS and the SENATE

TLRY TO THE FUCKING MOON 🚀",t3_pgergo,8
1630600793.0,2021-09-02,wallstreetbets,hbc28lq,This is the slowest dump ever,t3_pgergo,8
1630601076.0,2021-09-02,wallstreetbets,hbc2yie,how CLOV go up without volume,t3_pgergo,7
1630601686.0,2021-09-02,wallstreetbets,hbc4ih2,I need every stock I own to go up 5-10% to make up the losses...no chance!,t3_pgergo,8
1630601956.0,2021-09-02,wallstreetbets,hbc57ge,$CLit OVary 🍀☘️🍀☘️🍀,t3_pgergo,9
1630602182.0,2021-09-02,wallstreetbets,hbc5s17,[deleted],t3_pgergo,8
1630602285.0,2021-09-02,wallstreetbets,hbc619f,Holy shit my SoFi calls were so dead this morning. I have 2 thousand lmao.,t3_pgergo,8
1630602999.0,2021-09-02,wallstreetbets,hbc7t98,SOFI on its second buy up,t3_pgergo,8
1630604788.0,2021-09-02,wallstreetbets,hbccbqw,"Well, entire profit from august lost in 4 days . WEEEE",t3_pgergo,7
1630605481.0,2021-09-02,wallstreetbets,hbce0u3,SPCE crash landing…,t3_pgergo,9
1630605852.0,2021-09-02,wallstreetbets,hbcexuy,BUYING PUTS IS NOT SHORTING YOU DEGENERATES,t3_pgergo,8
1630606052.0,2021-09-02,wallstreetbets,hbcffb6,SPCE banned from flying 😂😂😂,t3_pgergo,9
1630606173.0,2021-09-02,wallstreetbets,hbcfq8e,Made a quick 120% from spce puts,t3_pgergo,8
1630606588.0,2021-09-02,wallstreetbets,hbcgr77,RIP SPCE bois you flew too close to the sun,t3_pgergo,7
1630606633.0,2021-09-02,wallstreetbets,hbcgvcc,Sofi 15c 1dte ? Please vote,t3_pgergo,8
1630606756.0,2021-09-02,wallstreetbets,hbch6f8,"Tomorrow I’m gonna regret not selling these SPY puts, but a retard can dream",t3_pgergo,9
1630607751.0,2021-09-02,wallstreetbets,hbcjoq8,"Good job bers, you managed to push SPY all the down to +.43 on the day, impressive",t3_pgergo,8
1630608343.0,2021-09-02,wallstreetbets,hbcl631,Gotta take a squirt but too lazy to get up.  Haven’t pissed myself in a while.  Today might be the day boys,t3_pgergo,8
1630608732.0,2021-09-02,wallstreetbets,hbcm5ja,"Some of you old farts might remember Steve Miller had a song about this:

*SPY keeps on rippin, rippin, rippin... into the future*",t3_pgergo,8
1630610156.0,2021-09-02,wallstreetbets,hbcpqve,[removed],t3_pgergo,9
1630610188.0,2021-09-02,wallstreetbets,hbcptte,$TTCF. Another 5% gain today,t3_pgergo,9
1630610523.0,2021-09-02,wallstreetbets,hbcqo6y,"LMAO apple car almost saved the market. 

ALMOST",t3_pgergo,8
1630610933.0,2021-09-02,wallstreetbets,hbcroy8,RKLB saved my ass today lol,t3_pgergo,8
1630611906.0,2021-09-02,wallstreetbets,hbcu54x,"I'm so dumb, I'm gonna need a fucking miracle to get out of this one.",t3_pgergo,9
1630612566.0,2021-09-02,wallstreetbets,hbcvtva,Only forest fires prevent bears.,t3_pgergo,7
1630612689.0,2021-09-02,wallstreetbets,hbcw517,SPY 453.29 EOD,t3_pgergo,8
1630612908.0,2021-09-02,wallstreetbets,hbcwp4f,I can’t believe spy didnt go red at all today,t3_pgergo,10
1630614343.0,2021-09-02,wallstreetbets,hbd0cj0,Die DOCU Die!,t3_pgergo,6
1630617275.0,2021-09-02,wallstreetbets,hbd7mk2,If my calculus professor dies from covid I get an A right?,t3_pgergo,8
1630599149.0,2021-09-02,wallstreetbets,hbby1gc,"We're so blessed, love your parents and your friends  and be thankful for our health and shelter. Think of them kids in AFG or the ones suffering everyday. Millions would trade for your position without a thought - reminder to myself",t3_pgergo,22
1630578261.0,2021-09-02,wallstreetbets,hbarom6,BB gang checking in again.  I feel a rumbling below the belt today like maybe this is the day. But every time I think it my be the start of a stiffy it turns out it's just flatulence from too much cabbage.,t3_pgergo,22
1630585174.0,2021-09-02,wallstreetbets,hbb2dat,"Could some movie theater primate explain, how is the company planning to payback their 10B++ debt without diluting the stock massively. They werent profitable before the pandemic and now they are eating shit even harder 🤡🤡🤡🤡🤡",t3_pgergo,20
1630599945.0,2021-09-02,wallstreetbets,hbc01r5,"Cmon CLOV, I am headed to Vegas tomorrow and could the extra cash for hookers!",t3_pgergo,21
1630576913.0,2021-09-02,wallstreetbets,hbaq0mq,BULLISH AF ON $BB 🚀,t3_pgergo,35
1630586768.0,2021-09-02,wallstreetbets,hbb5eu9,## What are you doing Steptembro?,t3_pgergo,37
1630601677.0,2021-09-02,wallstreetbets,hbc4hot,Even Clov has its days,t3_pgergo,20
1630601841.0,2021-09-02,wallstreetbets,hbc4wws,CLOV RUNNING UP!! 🚀🍀🚀🍀🚀🍀🚀,t3_pgergo,19
1630577040.0,2021-09-02,wallstreetbets,hbaq60q,"I'm tired. I'm worn out. Graves are killing both me and my relationship, but worse than anything else the first hour of market open I'm driving home.",t3_pgergo,6
1630579898.0,2021-09-02,wallstreetbets,hbatuhi,Another day being poor. Fuk,t3_pgergo,7
1630582294.0,2021-09-02,wallstreetbets,hbaxe20,"Just need AAPL at 155 by 1 Oct, anything over that is profit",t3_pgergo,8
1630583505.0,2021-09-02,wallstreetbets,hbazewd,"Theta gang here, dancing as AMC hovers around 44$ and I have puts and calls at 44$.  I am dancing at those 1% gains.",t3_pgergo,6
1630584382.0,2021-09-02,wallstreetbets,hbb0xnp,"You idiots realize payroll numbers are coming out tomorrow, right?",t3_pgergo,6
1630584547.0,2021-09-02,wallstreetbets,hbb18a4,CHWY really fucked me in the asshole.,t3_pgergo,7
1630584619.0,2021-09-02,wallstreetbets,hbb1czi,This gameplay this week has been….buy BABA calls before market close and then sell them in the morning. Free money.,t3_pgergo,8
1630587328.0,2021-09-02,wallstreetbets,hbb6iq7,CHPT to $40 today,t3_pgergo,7
1630587483.0,2021-09-02,wallstreetbets,hbb6tvn,"My land lord is selling the apartment, now a bunch of people are going to walk through to look at it. I hate being a rentoid.",t3_pgergo,7
1630588012.0,2021-09-02,wallstreetbets,hbb7wl8,Corsair needs to stop being a little bitch,t3_pgergo,7
1630588060.0,2021-09-02,wallstreetbets,hbb809c,MY COCK HAS BECOME SO PLUMP WITH ANTICIPATION,t3_pgergo,6
1630588193.0,2021-09-02,wallstreetbets,hbb8a9x,Good morning gentlemen. May you all make money today.,t3_pgergo,7
1630588244.0,2021-09-02,wallstreetbets,hbb8e6n,"For once the Joe Rogan thing isn't actually a meme, lmao. Imagine if he actually died from this and people all thought it was a joke.",t3_pgergo,8
1630588340.0,2021-09-02,wallstreetbets,hbb8lj7,If AAPL holds this premarket gain and pumps up imma be lit. Steaks whiskey and big blunt blowing all weekend,t3_pgergo,6
1630588369.0,2021-09-02,wallstreetbets,hbb8nqb,BABA guy in shambles for not going EOW on his ban bet,t3_pgergo,7
1630588653.0,2021-09-02,wallstreetbets,hbb99b6,OPEN THE CASINO,t3_pgergo,7
1630588890.0,2021-09-02,wallstreetbets,hbb9rk7,BABA TO $200,t3_pgergo,7
1630589168.0,2021-09-02,wallstreetbets,hbbadbn,"🏳️‍🌈🐻 checking in, quick question, WTF?",t3_pgergo,8
1630589674.0,2021-09-02,wallstreetbets,hbbbi2k,imagine being a bear and thinking you were gonna make money today,t3_pgergo,8
1630589784.0,2021-09-02,wallstreetbets,hbbbr0e,Jim Cramer the kinda guy to get his 2nd adult circumcision,t3_pgergo,7
1630590297.0,2021-09-02,wallstreetbets,hbbcwzq,Stonks only go up for stonks I don't play,t3_pgergo,7
1630590774.0,2021-09-02,wallstreetbets,hbbdzs8,PLTR just took off her glasses and she’s way hotter than that stuck up cheerleader,t3_pgergo,6
1630590838.0,2021-09-02,wallstreetbets,hbbe52z,Literally stuck holding ALL SPY PUTS since like SPY 450 all week with theta up my ass,t3_pgergo,7
1630591224.0,2021-09-02,wallstreetbets,hbbf0w6,A little correction is healthy bulls.. so u can get in again,t3_pgergo,6
1630591253.0,2021-09-02,wallstreetbets,hbbf3e3,Webull told me I’m better at predicting SPY than 0.05% of people on that platform. I take comfort in not being the King Retard,t3_pgergo,7
1630591560.0,2021-09-02,wallstreetbets,hbbfsmh,Ah yes the classic good news is good and bad news is good pattern.,t3_pgergo,7
1630591716.0,2021-09-02,wallstreetbets,hbbg5oo,"Weren't we buying CRSR? I liked it at 28, but feeling like I would have loved it at 27 instead. Guess I'll find out soon enough",t3_pgergo,8
1630591971.0,2021-09-02,wallstreetbets,hbbgqvy,Paper hands gonna regret selling BABA lol watch,t3_pgergo,8
1630592034.0,2021-09-02,wallstreetbets,hbbgw0w,Thank you whoever linked to ttcf DD in comments. You are what this sub is all about brother ✊🏾,t3_pgergo,6
1630592423.0,2021-09-02,wallstreetbets,hbbhsp3,SPY CEO has resigned,t3_pgergo,8
1630592517.0,2021-09-02,wallstreetbets,hbbi0qq,TTCF ![gif](emote|free_emotes_pack|upvote),t3_pgergo,8
1630593321.0,2021-09-02,wallstreetbets,hbbjy6m,GSAT is running,t3_pgergo,5
1630593564.0,2021-09-02,wallstreetbets,hbbkj3n,Once again I see gme/amc go green and BB red. So I buy BB and wait,t3_pgergo,5
1630594110.0,2021-09-02,wallstreetbets,hbblsqb,Alibaba had us in the first half not gonna lie 😂👏,t3_pgergo,7
1630594126.0,2021-09-02,wallstreetbets,hbblu4g,gme 215 and we hit $300,t3_pgergo,7
1630594604.0,2021-09-02,wallstreetbets,hbbmxt7,BABA 10/11 250c,t3_pgergo,6
1630595067.0,2021-09-02,wallstreetbets,hbbo1ck,I am a failure. :),t3_pgergo,8
1630595331.0,2021-09-02,wallstreetbets,hbbop2x,"Still cash gang 

Still a coward",t3_pgergo,7
1630595467.0,2021-09-02,wallstreetbets,hbbp0yv,Both bulls and bears r stuborn,t3_pgergo,7
1630595695.0,2021-09-02,wallstreetbets,hbbpl1k,CRSR could be again in the middle of a move up after 2 bad days.,t3_pgergo,7
1630595892.0,2021-09-02,wallstreetbets,hbbq2jk,C’mon TLRY break above 14.20,t3_pgergo,6
1630596027.0,2021-09-02,wallstreetbets,hbbqes7,5 fuckin’ Green Days in a row for me!!!!  just need 150 more in a row and I’m retired,t3_pgergo,6
1630598408.0,2021-09-02,wallstreetbets,hbbw6f3," This week I learned I have the balls to buy options and yolo 100% portfolios into 0dte, but not the balls to hold. Therefore theta gang, I give my life to you now",t3_pgergo,7
1630598479.0,2021-09-02,wallstreetbets,hbbwd4c,Almost time for that monthly -3% Spy dip,t3_pgergo,6
1630598701.0,2021-09-02,wallstreetbets,hbbwx6d,Holding my spy puts so bulls can eat,t3_pgergo,6
1630598778.0,2021-09-02,wallstreetbets,hbbx42z,Confirmation bias is a bitch lol,t3_pgergo,7
1630599226.0,2021-09-02,wallstreetbets,hbby8fr,"This is a bullying post, u/shoretrooper89 is so poor he decided to REEEEEE in the daily thread about his yolo post on a $44m microcap getting removed. The yolo was worth $500 🤡🤡🤡",t3_pgergo,7
1630599330.0,2021-09-02,wallstreetbets,hbbyhsl,I just need a 3 bagger for tomorrow,t3_pgergo,6
1630600152.0,2021-09-02,wallstreetbets,hbc0kzh,I….. don’t think I know what I am doing.,t3_pgergo,8
1630600175.0,2021-09-02,wallstreetbets,hbc0n22,my uranium plays popping today. did I miss something?,t3_pgergo,8
1630600446.0,2021-09-02,wallstreetbets,hbc1c4z,Yolod in clov. Gonna go cry now in the corner,t3_pgergo,7
1630600794.0,2021-09-02,wallstreetbets,hbc28on,"Citi gives clov a $10 price target ,, lfg!!!!",t3_pgergo,6
1630600870.0,2021-09-02,wallstreetbets,hbc2fl7,CLoV is fkng titties today,t3_pgergo,7
1630601131.0,2021-09-02,wallstreetbets,hbc33p4,"Last year, the correction started on September 3 with a -3.44% day on SPY, followed by a -0.82% and -2.73% gap down for Labor Day weekend.

I'm a 🐂 who actually does believe SPY will hit $470 by EOY, but I have to say, it might be a good idea to close any calls that are in the green today and wait until next Tuesday before making any more moves.

I'm not even saying to buy puts, just think about closing your calls.",t3_pgergo,6
1630601790.0,2021-09-02,wallstreetbets,hbc4s5n,"man this shit is starting to get freaky, there will have to be a pull back soon this is insanity...  


  
I am buying calls",t3_pgergo,6
1630602209.0,2021-09-02,wallstreetbets,hbc5ufk,those SOFI calls i bought 30 mins after open are up 140% ! fast money,t3_pgergo,7
