created,date,subreddit,id,body,parent_id,score
1602073940.0,2020-10-07,wallstreetbets,g7zv64g,[deleted],t3_j6o9s8,129
1602076903.0,2020-10-07,wallstreetbets,g8000i9,[deleted],t3_j6o9s8,109
1602073007.0,2020-10-07,wallstreetbets,g7ztx1g,I kinda understand why this sub is so retarded now... You must think like the market. You must be the market,t3_j6o9s8,155
1602074639.0,2020-10-07,wallstreetbets,g7zw6a4,[deleted],t3_j6o9s8,75
1602089918.0,2020-10-07,wallstreetbets,g80p8z0,"**Mango meter update:**

Zero (0) days without tweetcident

Current reading 📈——🥭————📉 
(+4)

Mango status 💤|—————🥭—-|🤪💊

***Threat level upgraded***:

Covfefe

Bigly ✅

YUUUGE 

————————————————————",t3_j6o9s8,67
1602070289.0,2020-10-07,wallstreetbets,g7zqoko,Imagine thinking people are actually concerned with the operations of  these companies and aren't just trading them like baseball cards.,t3_j6o9s8,123
1602072108.0,2020-10-07,wallstreetbets,g7zsskx,Nancy has calls she ain’t fuckin with anything less then 4 Trill,t3_j6o9s8,58
1602068488.0,2020-10-07,wallstreetbets,g7zou3x,This market never ceases to amaze me. I swear if I see a markets rise from stimulus hopes headline I’ll eat a sandwich for lunch.,t3_j6o9s8,138
1602071243.0,2020-10-07,wallstreetbets,g7zrrn0,Y’all confused how we can pump after stimulus hopes died when the market literally brushed off a world recession caused by a pandemic for 6 months straight,t3_j6o9s8,93
1602070141.0,2020-10-07,wallstreetbets,g7zqiny,Upvote if you’re retarded,t3_j6o9s8,249
1602067364.0,2020-10-07,wallstreetbets,g7zns7f,">Trump reverses course on coronavirus relief talks, dangles new $1,200 stimulus checks

This fucking guy 🤬",t3_j6o9s8,174
1602076161.0,2020-10-07,wallstreetbets,g7zyp0y,"🚨 

Leak on what the 10 things that R/D agree on that will be in this bill:

1.	Everyone should get a $5 Starbucks gift card 
2.	We are going to import a herd of kangaroos to start a population here in South Dakota
3.	we are going to paint the White House green (to symbolize money)
4.	ban selling stocks 
5.	shoot all of our trash into the sun
6.	 you no longer have to pay for sugar free Red Bull’s
7.	everyone gets a cool hat that says “I love earth” on it
8.	 no one ever has to wear shoes again, sandals are approved everywhere 
9.	everyone gets TSA precheck 
10. Everyone who rides a moped will get a snazzy satchel",t3_j6o9s8,33
1602097493.0,2020-10-07,wallstreetbets,g814xew,BAN u/wildmongoose90210,t3_j6o9s8,36
1602097675.0,2020-10-07,wallstreetbets,g815b4l,Mods Ban u/wildmongoose90210,t3_j6o9s8,39
1602066289.0,2020-10-07,wallstreetbets,g7zmsf2,"Ya'll should pop on over to /r/stocks every now and then...

""Hey all, I’ve got about 4 shares in Apple and I was wondering if I should keep them or sell them? It just doesn’t seem like it’ll make any profit. So far I haven’t made any profit from it- instead I’ve lost like 6 bucks since I’ve bought it. From what it looks like on the graphs, it’s headed down. Any advice?""",t3_j6o9s8,117
1602066651.0,2020-10-07,wallstreetbets,g7zn57c,I’m gonna die broke taking advice from this sub😢,t3_j6o9s8,32
1602074658.0,2020-10-07,wallstreetbets,g7zw77m,"The V shaped recovery is so strong that the airlines need to be bailed out (again), consumers need $1,200 stimulus checks and rates have to remain at zero for years.
Other than that the economy is fantastic.",t3_j6o9s8,34
1602075661.0,2020-10-07,wallstreetbets,g7zxtgc,"$1200 checks mean basically nothing, I have received like 20k this year from Cares act unemployment. The unemployment boost is what matters for consumer spending",t3_j6o9s8,30
1602090945.0,2020-10-07,wallstreetbets,g80rc91,Won’t buy a shirt for more than $30 but will buy $300 contracts on a company I barely know anything about,t3_j6o9s8,31
1602070845.0,2020-10-07,wallstreetbets,g7zrba7,Retards who FOMO’d into puts yesterday in absolute shambles,t3_j6o9s8,55
1602070144.0,2020-10-07,wallstreetbets,g7zqirm,"Market falls on doubt of stimulus...

A little later

Market climbs on hope of stimulus


Kang gang in the bounce house",t3_j6o9s8,31
1602078069.0,2020-10-07,wallstreetbets,g8026ox,Imagine buying calls yesterday then switching to puts at the bottom in the afternoon and losing money both ways,t3_j6o9s8,26
1602081198.0,2020-10-07,wallstreetbets,g807t9y,"Id like to thank this sub for essentially bankrupting me. Yesterday I bought all puts and now I am broken. I'm out for good, taking my money and never coming back.",t3_j6o9s8,27
1602083448.0,2020-10-07,wallstreetbets,g80c60y,Trump is tweeting about a fuckin Coup and the market is just slowly trickling up.... straight clown world,t3_j6o9s8,26
1602092243.0,2020-10-07,wallstreetbets,g80u07l,What if the real stimulus are the friends we made along this way?,t3_j6o9s8,26
1602094346.0,2020-10-07,wallstreetbets,g80ydit,Let me know if you guys need tips on buying options at their absolute maximum price that doesn’t even show up on the daily charts.,t3_j6o9s8,25
1602099633.0,2020-10-07,wallstreetbets,g819c5q,Holy fuck this game is set to hardest difficulty,t3_j6o9s8,25
1602067613.0,2020-10-07,wallstreetbets,g7zo0g8,A MM trick as old as time... dump it just enough to trigger stop losses wait till EOD and buy back what you sold off for profit at 9:30 the next day,t3_j6o9s8,51
1602073337.0,2020-10-07,wallstreetbets,g7zucm7,"started ""trading"" Dec 2019 with 5k.

5k -> $600 -> 10k -> 1.5k -> 11.5k -> currently at 5k

Wouldve been better off just putting it in SPY lol",t3_j6o9s8,24
1602074434.0,2020-10-07,wallstreetbets,g7zvvgy,SPY DOWN TO LEVELS NOT SEEN SINCE 9AM YESTERDAY BULLS R FUK rUg PuLl InCoMiNg.,t3_j6o9s8,21
1602085465.0,2020-10-07,wallstreetbets,g80g6rz,*PELOSI SAYS SHE WOULDN'T GO ANYWHERE NEAR THE WHITE HOUSE NOW,t3_j6o9s8,24
1602093421.0,2020-10-07,wallstreetbets,g80wg43,Can i please just get a few 10 baggers so I don’t have to work 9-5 for the rest of my life?,t3_j6o9s8,23
1602094298.0,2020-10-07,wallstreetbets,g80y9y5,"so the fed says we’re in a bubble 


and stocks go up


because people believe bubbles go up


this is very concerning and it ends badly


long puts",t3_j6o9s8,23
1602098622.0,2020-10-07,wallstreetbets,g817972,[deleted],t3_j6o9s8,23
1602068485.0,2020-10-07,wallstreetbets,g7zotzt,Holy shit puts on everyone's sanity.,t3_j6o9s8,70
1602073643.0,2020-10-07,wallstreetbets,g7zurh3,Donnie knew he messed up with that tweet yesterday.,t3_j6o9s8,23
1602076826.0,2020-10-07,wallstreetbets,g7zzvl9,"As soon as Nancy responds, he will say ""TOO LATE YOU HAVEN'T ACTED IN GOOD FAITH. NOW THE GREAT CITIZENS OF OUR COUNTRY WILL SUFFER BECAUSE OF YOU.""",t3_j6o9s8,21
1602085721.0,2020-10-07,wallstreetbets,g80gpex,Who else not buying anything rn because they’re afraid of buying at the high?,t3_j6o9s8,21
1602088703.0,2020-10-07,wallstreetbets,g80mr5n,"Why tf did it randomly dump and then shoot back up? 

Damn this manipulated as fuck.",t3_j6o9s8,22
1602097522.0,2020-10-07,wallstreetbets,g814zpn,[deleted],t3_j6o9s8,23
1602097760.0,2020-10-07,wallstreetbets,g815hh1,REMEMBER THIS MELT UP IS ON NO STIMULUS,t3_j6o9s8,24
1602097927.0,2020-10-07,wallstreetbets,g815tpu,Wildmongoose is the first dude I’ve blocked in some time.,t3_j6o9s8,22
1602101373.0,2020-10-07,wallstreetbets,g81cw5k,"if trump calls a press conference tonight to say ""NO STIMULUS OF ANY KIND, NOT NOW, NOT EVER. I AM THE SENATE""

there will be a big AH drill

and then at 9:30: ""Markets open higher on stimulus hopes""",t3_j6o9s8,21
1602069829.0,2020-10-07,wallstreetbets,g7zq6p6,"We lost our homes, our jobs and our wives trading FDs, but I guess the real profit was the friends we made along the way.

—me, 7 October 2020",t3_j6o9s8,48
1602070720.0,2020-10-07,wallstreetbets,g7zr67p,"hasn’t nancy already said no to individual bills like a billion times now?


he’s trying to assign blame/put the pressure back on her, but i don’t think this will help stimulus get passed",t3_j6o9s8,42
1602075490.0,2020-10-07,wallstreetbets,g7zxioe,"BREAKING:  WHITE HOUSE CHIEF OF STAFF MEADOWS TELLS REPORTERS STIMULUS NEGOTIATIONS ARE OFF, LOOKING AT STANDALONE BILLS ON 10 THINGS ""WE AGREE ON""   


If Dems/Repub had 10 things they agreed on, we wouldn't be in this shitstorm",t3_j6o9s8,44
1602095365.0,2020-10-07,wallstreetbets,g810hkf,"Congress - No stimulus

Fed -  we're fucked

Market - guess we'll go up from here",t3_j6o9s8,42
1602069124.0,2020-10-07,wallstreetbets,g7zpgm2,Of course Trump’s tone on stimulus changes when the market drops... if only he didn’t make it drop in the first place,t3_j6o9s8,64
1602073255.0,2020-10-07,wallstreetbets,g7zu8qw,[deleted],t3_j6o9s8,60
1602067231.0,2020-10-07,wallstreetbets,g7znntw,"Looks like stimulus is back on the menu according to premarket. 

At a certain point you would think people realize they are all full of shit.",t3_j6o9s8,19
1602072263.0,2020-10-07,wallstreetbets,g7zszfj,How tf are we green this morning from nonsensical Tweets? Stock market is more retarded than this sub.,t3_j6o9s8,20
1602076832.0,2020-10-07,wallstreetbets,g7zzw1c,Today’s gonna be fucking insane,t3_j6o9s8,21
1602077195.0,2020-10-07,wallstreetbets,g800k1p,"There once was a girl from Nantucket

With a stim so big you could suck it

A thousand page screed

But forgot he can't read

So in a flurry of Tweets he said fuck it",t3_j6o9s8,21
1602078670.0,2020-10-07,wallstreetbets,g8038ee,I really really fucked up my life man,t3_j6o9s8,21
1602089393.0,2020-10-07,wallstreetbets,g80o6e1,"I have an interview in 15 minutes boys,  this is a big one for me,  my dream career since a teenage. 

see you guys on the other side",t3_j6o9s8,21
1602100921.0,2020-10-07,wallstreetbets,g81byzd,Just want to break even before tax season so I can hide my 13k loss from wife.,t3_j6o9s8,22
1602070828.0,2020-10-07,wallstreetbets,g7zramj,isn't amd cpu coming out tomorrow?,t3_j6o9s8,21
1602073014.0,2020-10-07,wallstreetbets,g7ztxdn,You deserve to lose money if you think Nancy will agree to send 1200$ checks for Donnie to buy votes before elections🤣🤣🤣,t3_j6o9s8,18
1602085150.0,2020-10-07,wallstreetbets,g80fk2b,"my girls old car has been sitting in the driveway, and last week i was thinking about giving it to a homeless person. this week i am about to become that homeless person.",t3_j6o9s8,21
1602088882.0,2020-10-07,wallstreetbets,g80n49u,starting to think i need to sit out until after the election,t3_j6o9s8,20
1602100823.0,2020-10-07,wallstreetbets,g81brs5,another 6 and a half hours of my life wasted,t3_j6o9s8,20
1602069254.0,2020-10-07,wallstreetbets,g7zpleq,TIL Eddie Van Halen suggests he got throat cancer from using metal guitar picks and putting them in his mouth and not from a lifetime smoking habit. He also lost a third of his tongue,t3_j6o9s8,56
1602072269.0,2020-10-07,wallstreetbets,g7zszne,[removed],t3_j6o9s8,58
1602070123.0,2020-10-07,wallstreetbets,g7zqhyj,Fucking knew it's be green,t3_j6o9s8,19
1602078479.0,2020-10-07,wallstreetbets,g802wdg,So cancelling stimulus makes the market go up now that’s cool,t3_j6o9s8,19
1602087155.0,2020-10-07,wallstreetbets,g80jmx7,"If there's a minimum age for the senate/house, then there should be a maximum age.  We got these 80 year old senile fucks dictating the future of Americans when they're pretty much almost on their death beds + have had years to fuck everyone and make money",t3_j6o9s8,19
1602097105.0,2020-10-07,wallstreetbets,g8143yw,"Almighty congress who works part time for a six figure salary, please deem us worthy of stimulus checks so we can pay one month’s rent and/or buy PS5s",t3_j6o9s8,19
1602097245.0,2020-10-07,wallstreetbets,g814ep9,Reddit app = WSB app,t3_j6o9s8,18
1602098913.0,2020-10-07,wallstreetbets,g817ut6,"I’m starting to feel like a genius 

I should probably close out everything and uninstall retardhood",t3_j6o9s8,18
1602075548.0,2020-10-07,wallstreetbets,g7zxm5c,Gotta love seeing a “Bulls/Bears are fuk” comment and clicking their profile to see they were on the other team a day before. Reminder 99% of this sub is losing money,t3_j6o9s8,41
1602076732.0,2020-10-07,wallstreetbets,g7zzpaq,[deleted],t3_j6o9s8,41
1602085006.0,2020-10-07,wallstreetbets,g80f9sh,"/r/Investing : How do I safely invest 100? 

/r/Stocks : Best long term growth stocks?

/r/PersonalFinance : Best dividend stocks to pay off credit card debt over next 40 years?

/r/StockMarket : Best stocks in next market crash?

/r/WallStreetBets : Fellow retards I need a fucking yolo play",t3_j6o9s8,38
1602076720.0,2020-10-07,wallstreetbets,g7zzokc,"Motherfucker really tweeted ""thank you Mr. President"" to himself 🤣🤣🤣",t3_j6o9s8,71
1602069337.0,2020-10-07,wallstreetbets,g7zpod3,Nancy are you ok? are you ok Nancy?,t3_j6o9s8,19
1602073547.0,2020-10-07,wallstreetbets,g7zumri,Mango Man is talking out his ass. Pelosi has no reason to make any kind of deal now.,t3_j6o9s8,18
1602075288.0,2020-10-07,wallstreetbets,g7zx6xk,What the actual fuck is happening,t3_j6o9s8,18
1602076930.0,2020-10-07,wallstreetbets,g80029a,"Do you guys eat breakfast, or just coffee enema to start your day?",t3_j6o9s8,19
1602077320.0,2020-10-07,wallstreetbets,g800rv0,"I like to think that all of you are sitting in your corner office, wearing a $5,000 suit, and casually scrolling through WSB amongst your busy productive work days",t3_j6o9s8,18
1602073368.0,2020-10-07,wallstreetbets,g7zue3r,Donald trump negotiates with himself on twitter after calling off talks for stimulus.  Stocks roar back up.,t3_j6o9s8,54
1602077592.0,2020-10-07,wallstreetbets,g80192y,"and just like that, yesterday never happened.",t3_j6o9s8,17
1602077731.0,2020-10-07,wallstreetbets,g801ii4,"imagine selling all your calls yesterday


yeah that was me",t3_j6o9s8,19
1602082084.0,2020-10-07,wallstreetbets,g809i5l,"Airlines can offer more equity or issue more debt but they do not need the american people to bail them out. They have been too reckless riding the highs over the past 5-10 years. If they go under they go under. Restructure their debt, cut routes that aren't profitable, and start over.",t3_j6o9s8,17
1602083416.0,2020-10-07,wallstreetbets,g80c3q2,*Markets rally on hopes that President Trump was just kidding about stimulus rejection*,t3_j6o9s8,17
1602091622.0,2020-10-07,wallstreetbets,g80spyg,AMD to $100,t3_j6o9s8,18
1602096724.0,2020-10-07,wallstreetbets,g813b6z,"Bitches be buying the top of solar energy lmaoooo.    
 .     

   .     
      
.      
    
   .     
.     
    .     
    .    
I’m bitches",t3_j6o9s8,18
1602100031.0,2020-10-07,wallstreetbets,g81a5je,People calling AAPL flat today are fucking retarded. It’s up about 2% which is like a $40 billion increase in their market cap. They don’t have many 5%+ days. You need to play AAPL at least a month out. Leaps are best.,t3_j6o9s8,16
1602065622.0,2020-10-07,wallstreetbets,g7zm49c,AMD callholders upvote for good luck 🍀,t3_j6o9s8,85
1602097543.0,2020-10-07,wallstreetbets,g81516y,"Operation ban u/wildmongoose90210 (omg even his username is so gay)

Who’s with me?",t3_j6o9s8,36
1602069036.0,2020-10-07,wallstreetbets,g7zpdc0,[deleted],t3_j6o9s8,50
1602072362.0,2020-10-07,wallstreetbets,g7zt3sa,Imagine panic selling your positions because an obese mango man yeeted out a tweet under drug influence 😂😂😂😳 oh wait that’s me,t3_j6o9s8,48
1602072434.0,2020-10-07,wallstreetbets,g7zt6x9,[removed],t3_j6o9s8,24
1602074927.0,2020-10-07,wallstreetbets,g7zwlza,Shouting “O’Doyle Rules!” As your portfolio drives off the cliff at least makes the losses minimally comical,t3_j6o9s8,16
1602076497.0,2020-10-07,wallstreetbets,g7zzaxx,"another roid rage twitter spree by Mango right now 

he's balls to the walls now, the drugs got em feeling loose",t3_j6o9s8,15
1602076903.0,2020-10-07,wallstreetbets,g8000h1,Mars is at it's closest point to earth today,t3_j6o9s8,16
1602082094.0,2020-10-07,wallstreetbets,g809ive,"White House economic adviser Larry Kudlow admits the White House is not focused on passing a coronavirus relief bill for the American people because they’ve got to push their new Supreme Court Justice nominee instead.“Not enough time to get stuff done,” he says.

Priorities I guess. Why are we up again?",t3_j6o9s8,15
1602084225.0,2020-10-07,wallstreetbets,g80dpgi,"At this point this feels like gambling. Your research doesn’t matter, neither does the news or what’s actually going on, and even with the amount of uncertainty In the market it’s still green. In addition the state of the economy makes no difference. The manipulation is crazy",t3_j6o9s8,14
1602089539.0,2020-10-07,wallstreetbets,g80oh37,Need a 120k to pay off my mortgage and I'm -10% on the way there!,t3_j6o9s8,15
1602093246.0,2020-10-07,wallstreetbets,g80w311,"imagine seeing the selloff yesterday and being like ""i need to load up on FDs!""

well that special idiot is now rich",t3_j6o9s8,16
1602095894.0,2020-10-07,wallstreetbets,g811kv8,God Donnie's twitter is fucking cancer...,t3_j6o9s8,15
1602096659.0,2020-10-07,wallstreetbets,g8136af,The best time to buy puts is always when there is zero readily available reason to buy puts,t3_j6o9s8,14
1602069553.0,2020-10-07,wallstreetbets,g7zpwd1,"Tbh 

I think everyone gonna get fuk today",t3_j6o9s8,14
1602071817.0,2020-10-07,wallstreetbets,g7zsfsa,Whenever the Twitter traders get all philosophical it means they just lost a lot of money. 🤡,t3_j6o9s8,15
1602073175.0,2020-10-07,wallstreetbets,g7zu4xh,"Fuck, he's already tweeting.",t3_j6o9s8,14
1602074060.0,2020-10-07,wallstreetbets,g7zvc4z,Donnie is the type of autist to give auto mod gold,t3_j6o9s8,15
1602074306.0,2020-10-07,wallstreetbets,g7zvot2,Lmao fuck i knew holding puts overnight would get me fucked over,t3_j6o9s8,15
1602076164.0,2020-10-07,wallstreetbets,g7zyp7b,Stimulus back on the table? Cool. Can I have my 25% back?,t3_j6o9s8,15
1602076219.0,2020-10-07,wallstreetbets,g7zyssx,"There is zero chance nancy is approving any aid besides the $1200 direct payments and that’s a long shot.

She ain’t caving after the Twitter no polar posts it makes him look terrible",t3_j6o9s8,16
1602079607.0,2020-10-07,wallstreetbets,g804w4l,"Stating the obvious here, but none of this feels stable. One knee jerk reaction on social media from you know who and we're free falling again today. Fartin bipolar POS",t3_j6o9s8,15
1602084939.0,2020-10-07,wallstreetbets,g80f4um,My face isn't working to unlock my Robinhood anymore. I guess it doesn't recognize it when it is so sad and stressed from this market,t3_j6o9s8,15
1602085196.0,2020-10-07,wallstreetbets,g80fndb,So they want to spend $35 billion to save 50k jobs in airlines. That's $700k per job and will only delay inevitable by another 4-6 months.,t3_j6o9s8,15
1602085779.0,2020-10-07,wallstreetbets,g80gtok,"Ohhh now I get it. Buy low, sell high!",t3_j6o9s8,15
1602086006.0,2020-10-07,wallstreetbets,g80hack,"Orange gets covid.  -1%

Orange is cured of Covid +3% off lows.

Idiot tweets. Down -1%. 

Idiot sort of takes back tweet, +3% off lows, 

Alright next time orange tweet and market tanks, apparently you buy the dip. Make sure it’s before market close because all the big money and future traders pump this overnight and trade sideways all day for retail.",t3_j6o9s8,15
1602087514.0,2020-10-07,wallstreetbets,g80kczs,No volume! VOTE!,t3_j6o9s8,15
1602090970.0,2020-10-07,wallstreetbets,g80re3f,"I BOUGHT AAPL PUTS!! U HEAR THAT MM’S???? I BOUGHT AAPL PUTS
AAPL PUTS",t3_j6o9s8,13
1602093833.0,2020-10-07,wallstreetbets,g80xb22,"Lol fed minutes: ""stock market too high imo""",t3_j6o9s8,14
1602094362.0,2020-10-07,wallstreetbets,g80yeok,So many spy puts,t3_j6o9s8,15
1602095487.0,2020-10-07,wallstreetbets,g810qp9,Stocks up on news of stocks going up,t3_j6o9s8,14
1602095514.0,2020-10-07,wallstreetbets,g810spi,"Markets rise 6-7% in the last week and half on ""stimulus hopes"", stimulus talks fail and they give up 1% of the gains and gain it back the very next day. Next week we'll be up another 5-6% on stimulus hopes again even though both sides say it ain't happening.",t3_j6o9s8,15
1602097122.0,2020-10-07,wallstreetbets,g8145av,"Guys, let's quit giving these brokers our money and form our own spac. Raise a couple hundred milly, buy some shit company with a cool name in a hot sector, and then all of us pump the shit out of it on every social media channel. We make our exit and leave the stocktwits and youtube trading gurus holding the bag. 

Who's in?",t3_j6o9s8,15
1602098111.0,2020-10-07,wallstreetbets,g8167g6,"I literally hold all the power right now.

Do I buy calls to plummet the market?

Or do I buy puts for us to soar to new heights?",t3_j6o9s8,15
1602100882.0,2020-10-07,wallstreetbets,g81bw1i,[deleted],t3_j6o9s8,15
1602069063.0,2020-10-07,wallstreetbets,g7zpebg,"If Tim Apple could hit 121 for me by EOD, that'd be gr88888",t3_j6o9s8,15
1602071926.0,2020-10-07,wallstreetbets,g7zskjq,"It is crazy how you can literally see the algos work and how undiscerning they are when it comes to what they trade - NIO, a Chinese EV Company that has nothing to do with stimulus talks (besides autists like us yoloing $1200 into it) drops from one tweet from Mango.",t3_j6o9s8,14
1602073272.0,2020-10-07,wallstreetbets,g7zu9kc,"Lol mango calling people “blathering idiots” before 9 am

Should be a fun day",t3_j6o9s8,15
1602073605.0,2020-10-07,wallstreetbets,g7zupmu,BREAKING: BEARS TEST POSITIVE FOR BEING GAY AND RETARDED,t3_j6o9s8,13
1602074666.0,2020-10-07,wallstreetbets,g7zw7mk,Lol this market is a Rollercoaster but its not fun and you lose money,t3_j6o9s8,13
1602075289.0,2020-10-07,wallstreetbets,g7zx6zi,How the fuck does 🥭 even tweet so fast?,t3_j6o9s8,14
1602075393.0,2020-10-07,wallstreetbets,g7zxcts,Come on Donny stop retweeting Hillary posts from 2018 any just give us the full 2t stimmy,t3_j6o9s8,13
1602079645.0,2020-10-07,wallstreetbets,g804ykp,BOUGHT THE TOP. GONNA SELL THE LOW IN A BIT,t3_j6o9s8,15
1602080768.0,2020-10-07,wallstreetbets,g8070fi,"Man , I always manage to make the wrong play. I have. 100 percent success rate at failure.",t3_j6o9s8,15
1602082232.0,2020-10-07,wallstreetbets,g809sf7,Donny shut the fuck up for an hour. Leave my tendies alone until lunch please.,t3_j6o9s8,15
1602082275.0,2020-10-07,wallstreetbets,g809vh1,"Lol Trump deleted his last tweet.

&#x200B;

&#x200B;

Never mind he put it back up wit ha link to go vote. Very stable. Very smart.",t3_j6o9s8,13
1602082737.0,2020-10-07,wallstreetbets,g80arq6,"This market makes no sense. After what that clown said yesterday, how the fuck are we up on stimulus hopes again? Jesus Christ. Even CNBC is confused.",t3_j6o9s8,15
1602084330.0,2020-10-07,wallstreetbets,g80dx6d,🔊I ... DECLARE ... BANKRUPTCY!!!!,t3_j6o9s8,14
1602084658.0,2020-10-07,wallstreetbets,g80el00,"gosh, does mango boy have to do any work at all? it feels like he tweets non-stop all day",t3_j6o9s8,15
1602086572.0,2020-10-07,wallstreetbets,g80ign3,Getting pretty sick of PTON mooning every single fucking day.,t3_j6o9s8,14
1602089336.0,2020-10-07,wallstreetbets,g80o249,"Remember, It's better to have 10% of a watermelon than a 100% of a grape. So trade big, but realize profits while you can. I'm gay",t3_j6o9s8,13
1602091108.0,2020-10-07,wallstreetbets,g80ro8e,"We are truly living in retarded times when a tweet sends the market instantly down 3%, the tweeter later says ""just kidding"" and the market shoots back up the next day like everything is just fine, oh and yes it's the unstable president of the United States doing the tweeting. Did I mention the market is higher than it was 7 months ago (new ATH at the time) in the midst of a global pandemic and one of the worst recessions in the last 100 years?",t3_j6o9s8,15
1602091320.0,2020-10-07,wallstreetbets,g80s3nx,"""Hey, welcome to Palantir, what can I get you?""

Yeah I'll have a large Sideways burger with a side of theta, and let me get a large Crush with that",t3_j6o9s8,15
1602091436.0,2020-10-07,wallstreetbets,g80sc7v,With small amounts of money I make such good trades with options but if I put in anything substantial I fuck it up,t3_j6o9s8,15
1602092253.0,2020-10-07,wallstreetbets,g80u0xw,Anyone else feeling nervous during this pump? Seems baseless to me 🧐🧐🧐🧐,t3_j6o9s8,14
1602095472.0,2020-10-07,wallstreetbets,g810pl8,Despite all my rage I am still just a bear in a cage,t3_j6o9s8,14
1602095683.0,2020-10-07,wallstreetbets,g81159i,"lol look at the picture CNBC uses to describe amateur robinhood traders 

&#x200B;

[https://www.cnbc.com/2020/10/07/how-robinhood-and-covid-introduced-millions-to-the-stock-market.html](https://www.cnbc.com/2020/10/07/how-robinhood-and-covid-introduced-millions-to-the-stock-market.html)",t3_j6o9s8,15
1602095952.0,2020-10-07,wallstreetbets,g811p5q,"It is definitely all going to come crashing down at some point, but it's going to make sure your puts have expired worthless first",t3_j6o9s8,14
1602096584.0,2020-10-07,wallstreetbets,g8130or,"Buying puts and being down 20% an hour later, name a better duo",t3_j6o9s8,14
1602097239.0,2020-10-07,wallstreetbets,g814e9n,"Honestly, which stock didn't go up 400% during this depression?",t3_j6o9s8,14
1602097707.0,2020-10-07,wallstreetbets,g815dio,"Every time I buy a dip it flash crashes another 5%.  Every time I take a short position after a huge rally, it gaps and goes another 5%.  If i buy a rally, it fails mid day.  If I short a dip, it V-recovers.  This shit is draining my soul.",t3_j6o9s8,14
1602098644.0,2020-10-07,wallstreetbets,g817asi,333 to 341 overnight lmaooo,t3_j6o9s8,14
1602065887.0,2020-10-07,wallstreetbets,g7zmdma,"At this point, I need Tim 🍏 to announce he created the vaccine.",t3_j6o9s8,29
1602069114.0,2020-10-07,wallstreetbets,g7zpg8l,Stocks rise on stimulus hopes of stock hoping stimulated stonk risers hopeful of stimulation,t3_j6o9s8,30
