created,date,subreddit,id,body,parent_id,score
1589883826.0,2020-05-19,wallstreetbets,fr4cm2g,"Futures bounce off 2933

Bulls: ""I threw some crayons at a wall and green made the biggest mark. The 2933 fibbocini alfredo marinara constant was rejected, will retest 3200 by 9am.""

Futures, literally 5 mins later: ""feelin cute might bash thru some support floor... idk.""",t3_gmlsuw,18
1589888001.0,2020-05-19,wallstreetbets,fr4h2y7,"Watched a documentary that says Lowes is the opposite of HD.

Basically HD caters to professionals and Lowes caters to consumers so in good times HD does well and in bad times Lowe's does well.

All in Lowe's calls",t3_gmlsuw,12
1589889039.0,2020-05-19,wallstreetbets,fr4ibml,"Gets alert on phone : **MARKETS DOWN AS OIL STRUGGLES BLAH BLAH**

Checks markets 

*Down 0.01%*",t3_gmlsuw,12
1589893488.0,2020-05-19,wallstreetbets,fr4oflo,It’s my birthday can I please make money,t3_gmlsuw,11
1589884517.0,2020-05-19,wallstreetbets,fr4dbl4,JPow’s wife just woke him up.  Whispered in his ear that it’s Tuesday.,t3_gmlsuw,5
1589886121.0,2020-05-19,wallstreetbets,fr4f0bk,"I did some quick TA. We close red and close the week with spy to $300. Triple chocolate lava cake pattern on the chart looks yum, solid TA here trust me.",t3_gmlsuw,6
1589887800.0,2020-05-19,wallstreetbets,fr4guj9,HD is example A. Of why you don't hold options through earnings.,t3_gmlsuw,6
1589887861.0,2020-05-19,wallstreetbets,fr4gx2a,DKNG calls at open.,t3_gmlsuw,5
1589888156.0,2020-05-19,wallstreetbets,fr4h9k6,"HD is the the Ron Jon surf shop of the construction world, nobody who knows what their doing goes there.  HD just beat Revenue so LOW will follow suite, i just think by more. And LOW will beat EPS because they only care about the bottom line.

Disclaimer - in no way does owning calls make me bias",t3_gmlsuw,7
1589888728.0,2020-05-19,wallstreetbets,fr4hy3e,WMT 🚀 let's print,t3_gmlsuw,5
1589889075.0,2020-05-19,wallstreetbets,fr4idan,"Unironically the media can just buy a buttload of calls on a pharmaceutical company, then say the magic free money line 'X might have found potential cure' and sell their calls at open. 

And load up on puts before saying it was a false alarm. Works everytime.",t3_gmlsuw,5
1589889149.0,2020-05-19,wallstreetbets,fr4ignv,"Wow I really sold my WMT calls.

Making the wrong moves again... 

Cheers 🍻😭",t3_gmlsuw,5
1589889173.0,2020-05-19,wallstreetbets,fr4ihr1,"$WMT beats earnings by .01 EPS, 1bn+ rev, doubled online sales. The future of Walmart is online. Price hit all-time highs pre-market, momentum should carry us into a strong open. $SPY should also respond positively to this. Daily momentum indicators MACD and MOM show strong upside potential. Will be letting my position ride indefinitely and selling off as my stops get hit on the eventual downtrend. [https://i.imgur.com/xOy0O2V.png](https://i.imgur.com/xOy0O2V.png)",t3_gmlsuw,6
1589889351.0,2020-05-19,wallstreetbets,fr4ipm7,"The massive restaurant companies at the White House yesterday asked for the PPP forgiving  grace period to be extended from 8 weeks to 24 weeks . 

These Businesses are fucked",t3_gmlsuw,6
1589889629.0,2020-05-19,wallstreetbets,fr4j27f,AAP missed and withdrew guidance. Stock up 7% 🤪,t3_gmlsuw,6
1589889685.0,2020-05-19,wallstreetbets,fr4j4sd,"HD call holders 

WMT put holders 

WYA!?!",t3_gmlsuw,5
1589889869.0,2020-05-19,wallstreetbets,fr4jd8b,"SPCE, the final frontier. These are the voyages of the Starship Tendieprize🚀 🚀 🚀",t3_gmlsuw,6
1589890003.0,2020-05-19,wallstreetbets,fr4jj9y,The correction for acb will be god like,t3_gmlsuw,6
1589890612.0,2020-05-19,wallstreetbets,fr4kblv,I smell a dump,t3_gmlsuw,6
1589890670.0,2020-05-19,wallstreetbets,fr4keat,"WMT pre pump n dump is on, aisle 6",t3_gmlsuw,6
1589890732.0,2020-05-19,wallstreetbets,fr4kh9u,"The ol' pharma phase 1 pump n dump.

It still works, somehow.",t3_gmlsuw,5
1589890809.0,2020-05-19,wallstreetbets,fr4kl0q,So happy I sold WMT at close yesterday for some secure tendies.,t3_gmlsuw,6
1589890855.0,2020-05-19,wallstreetbets,fr4kn7g,TD Ameritrade server errors this morning. Can't cancel order or create new orders. Active orders not filling.,t3_gmlsuw,6
1589890901.0,2020-05-19,wallstreetbets,fr4kpd8,[deleted],t3_gmlsuw,6
1589890967.0,2020-05-19,wallstreetbets,fr4kskf,$HUYA boutta print!,t3_gmlsuw,6
1589891147.0,2020-05-19,wallstreetbets,fr4l18m,"Looks like ToS is going full RH today.

Going to cost me thousands at open if it’s not fixed",t3_gmlsuw,7
1589891622.0,2020-05-19,wallstreetbets,fr4lol1,that's cool DKNG just keep fading. Not like I have calls.,t3_gmlsuw,6
1589891640.0,2020-05-19,wallstreetbets,fr4lpho,[deleted],t3_gmlsuw,7
1589892056.0,2020-05-19,wallstreetbets,fr4mas8,Puts on TD Ameritrade,t3_gmlsuw,7
1589892348.0,2020-05-19,wallstreetbets,fr4mq0y,"SPY's gonna pump +1% 1 hour into open, calling it now",t3_gmlsuw,7
1589893741.0,2020-05-19,wallstreetbets,fr4otry,Absolute bonkers volume on WMT premarket.  Over 700k shares traded premarket.  The average is under 10k.,t3_gmlsuw,7
1589893770.0,2020-05-19,wallstreetbets,fr4ovcr,Lol Cramer wants to kick dogs. He's gone man,t3_gmlsuw,5
1589893790.0,2020-05-19,wallstreetbets,fr4owic,what time is jpow live striptease?,t3_gmlsuw,7
1589893898.0,2020-05-19,wallstreetbets,fr4p2kq,4 million americans now skipping mortgage payments... ouch for brokers and banks,t3_gmlsuw,5
1589893965.0,2020-05-19,wallstreetbets,fr4p6b1,Unload my DIS 06/12 121c and wait for more pullback or hold in hopes of news this week ?,t3_gmlsuw,5
1589894208.0,2020-05-19,wallstreetbets,fr4pk5a,NVDA Got upgraded twice this morning and BYND also upgraded.,t3_gmlsuw,7
1589894435.0,2020-05-19,wallstreetbets,fr4px3e,[deleted],t3_gmlsuw,7
1589894838.0,2020-05-19,wallstreetbets,fr4qkgy,Cramer is all in on Moderna’s Ponzi scheme,t3_gmlsuw,6
1589894876.0,2020-05-19,wallstreetbets,fr4qmqa,Letsssss goooooo *rails addy line*,t3_gmlsuw,6
1589895286.0,2020-05-19,wallstreetbets,fr4ramz,Moderna had a sample size of 8!,t3_gmlsuw,5
1589895338.0,2020-05-19,wallstreetbets,fr4rdpa,I am so numb to my money just disappearing,t3_gmlsuw,6
1589895492.0,2020-05-19,wallstreetbets,fr4rmy9,"Cramer implying we’re headed toward a civil war, just your typical morning",t3_gmlsuw,6
1589896480.0,2020-05-19,wallstreetbets,fr4tcvh,Options trading really fucks with your perception of movements. 1% means nothing on a long stock but literally everything on a short dated option.,t3_gmlsuw,6
1589896797.0,2020-05-19,wallstreetbets,fr4tx8v,Sold my puts for very small profits.  Switched to calls on that 293 dip.  Let’s hit 300 boys,t3_gmlsuw,7
1589897454.0,2020-05-19,wallstreetbets,fr4v415,"""black or brown workers"" immediate red candle lmao",t3_gmlsuw,7
1589897611.0,2020-05-19,wallstreetbets,fr4vei4,"J.C. PENNEY TO ALLOW EMPLOYEES TO WORK FROM HOME PERMANENTLY - CNBC

Lol - what?",t3_gmlsuw,6
1589897696.0,2020-05-19,wallstreetbets,fr4vk6x,I am going to eat my own shit and post on liveleak if I break even on gay HD calls.,t3_gmlsuw,7
1589897795.0,2020-05-19,wallstreetbets,fr4vqsy,296 denied. Can't wait for the natural organic growth to rip right through it.,t3_gmlsuw,5
1589898483.0,2020-05-19,wallstreetbets,fr4x0q0,Mnuchin has one of those punchable faces.,t3_gmlsuw,7
1589898524.0,2020-05-19,wallstreetbets,fr4x3if,holy shit senator,t3_gmlsuw,6
1589898532.0,2020-05-19,wallstreetbets,fr4x3zs,Mnuchin doesn’t know what to say Lmaoooo,t3_gmlsuw,6
1589898557.0,2020-05-19,wallstreetbets,fr4x5pq,LOL what  kind of question is this? Is life fair? No not really.,t3_gmlsuw,6
1589898560.0,2020-05-19,wallstreetbets,fr4x5wo,The senate should have a panel where 3 people have calls and 3 people have puts to ask j pow questions,t3_gmlsuw,6
1589898610.0,2020-05-19,wallstreetbets,fr4x98r,Does Brown not know wtf these two do??,t3_gmlsuw,6
1589898662.0,2020-05-19,wallstreetbets,fr4xcq4,this idiot on Bloomberg doesn't know that the treasury and chair fed have no power in his requests.,t3_gmlsuw,7
1589898739.0,2020-05-19,wallstreetbets,fr4xhy9,Why does this FB announcement remind me of the witching bullshit. That said I’m going in blindly on calls because of you dumbasses.,t3_gmlsuw,5
1589898990.0,2020-05-19,wallstreetbets,fr4xz0a,Mnuchin looks like a muppet,t3_gmlsuw,5
1589899035.0,2020-05-19,wallstreetbets,fr4y254,"If the fed reserve thing doesn't work out for Powell, he'd be a great voice over actor, particularly for Family Guy. He got that voice.",t3_gmlsuw,6
1589899359.0,2020-05-19,wallstreetbets,fr4yoaj,Do these senators actually not understand what the Fed does?,t3_gmlsuw,7
1589899440.0,2020-05-19,wallstreetbets,fr4ytwq,These senators cockblocking this pump,t3_gmlsuw,6
1589899653.0,2020-05-19,wallstreetbets,fr4z8mw,Mnuchin looks like a worm trying to get out of his own skin,t3_gmlsuw,6
1589899735.0,2020-05-19,wallstreetbets,fr4ze8x,"imagine being in their shoes, having all the power to absolutely ruin the market today. Literally Jerome just needs to cough stupid hard and pass out and next leg down is here",t3_gmlsuw,6
1589899767.0,2020-05-19,wallstreetbets,fr4zggx,What are the next SPY fettuccine al dente levels?,t3_gmlsuw,6
1589899871.0,2020-05-19,wallstreetbets,fr4zns0,Is being ugly as fuck a requirement to be a Senator? I might have found a new career,t3_gmlsuw,6
1589900131.0,2020-05-19,wallstreetbets,fr505zl,You don't cuck the Zuck,t3_gmlsuw,6
1589900321.0,2020-05-19,wallstreetbets,fr50jfv,"Mnuchin and Powell pretending to give a shit about anyone but the wealthy is hilarious, they can't even pretend to do it, its so obvious how little of a shit they give",t3_gmlsuw,7
1589900330.0,2020-05-19,wallstreetbets,fr50k1o,"Zuck: ""I have decided to retire. Facebook was a mistake.""",t3_gmlsuw,7
1589900471.0,2020-05-19,wallstreetbets,fr50u1r,i'd love to go back in time and tell my 13 year old self that I'm gonna grow up to be a dude that watches the fed chairman talk to the senate and finds it exciting. 13 year old me would probably take the noose though.,t3_gmlsuw,6
1589900512.0,2020-05-19,wallstreetbets,fr50wu2,"Is Mnuchin pregnant?

My man is GLOWING",t3_gmlsuw,6
1589900900.0,2020-05-19,wallstreetbets,fr51nnm,That fucking gecko was right again 😂,t3_gmlsuw,5
1589901159.0,2020-05-19,wallstreetbets,fr525ml,Anyone else buy VTIQ at the recent peak and hold through the 30% re-trace? Time for the 2nd leg up,t3_gmlsuw,6
1589901352.0,2020-05-19,wallstreetbets,fr52j7h,These guys print trillions and they don't have access to 100 bucks for a good webcam?,t3_gmlsuw,6
1589901402.0,2020-05-19,wallstreetbets,fr52mof,"Fuck it, VTIQ I am ready to get hurt again",t3_gmlsuw,5
1589901555.0,2020-05-19,wallstreetbets,fr52xs2,"100+ point day and we're ACTUALLY green the day after.   

fuck this gay earth",t3_gmlsuw,7
1589901639.0,2020-05-19,wallstreetbets,fr533nx,296 the ceiling 295 the floor. This market really loves to play on whole numbers.,t3_gmlsuw,5
1589901721.0,2020-05-19,wallstreetbets,fr539cg,WRONG WAY FACEBOOK,t3_gmlsuw,5
1589902192.0,2020-05-19,wallstreetbets,fr546k3,elizabeth warren buffet,t3_gmlsuw,5
1589902438.0,2020-05-19,wallstreetbets,fr54o24,If HUYA prints I'm getting extra cheese on my mcdoubles all summer,t3_gmlsuw,7
1589902443.0,2020-05-19,wallstreetbets,fr54ofb,Mnuchin over there wondering why JPow gets all the softball questions while he get's shit on by everyone.,t3_gmlsuw,7
1589902498.0,2020-05-19,wallstreetbets,fr54s9y,"Too many people shorting $DIS, time to buy calls",t3_gmlsuw,6
1589902530.0,2020-05-19,wallstreetbets,fr54uje,SPY is such a cuck,t3_gmlsuw,6
1589902562.0,2020-05-19,wallstreetbets,fr54wtz,"I have given up - throwing in the towel.

3000 here we come by end of week.

Now that a bear has flipped sides obviously please inverse me.",t3_gmlsuw,5
1589902748.0,2020-05-19,wallstreetbets,fr55a9h,Always bet against Buffet! Airlines printing,t3_gmlsuw,7
1589902831.0,2020-05-19,wallstreetbets,fr55g4w,"Liquidity problems become solvency problems over time.

NO SHIT JEROME.",t3_gmlsuw,5
1589903006.0,2020-05-19,wallstreetbets,fr55sns,Dipping my toes in some Advanced Money Destroyer spreads,t3_gmlsuw,7
1589903938.0,2020-05-19,wallstreetbets,fr57oav,Dell 6/19 50c is just easy money. So many companies made large laptop/server  orders for the lockdown and the ones that didn’t are placing their orders for the second wave lockdowns in the fall.,t3_gmlsuw,6
1589903991.0,2020-05-19,wallstreetbets,fr57s7t,Who dat down der on da bayou ...  Oh senator Kennedy in Louisiana,t3_gmlsuw,6
1589904016.0,2020-05-19,wallstreetbets,fr57u2c,"""Chairman Powell, what stonks would you recommend I buy if I want bigly tendies?""

""Well senator, I would recommend all in on naked SPY calls.""",t3_gmlsuw,5
1589904128.0,2020-05-19,wallstreetbets,fr58260,"New stimulus payments will be Visa debit cards.  


V 5/29 $200

Updated:  https://www.businessinsider.com/personal-finance/stimulus-check-eip-prepaid-debit-card-questions-answers-2020-5",t3_gmlsuw,7
1589904179.0,2020-05-19,wallstreetbets,fr585ul,CAN I GET A HOOYA FOR HUYA!,t3_gmlsuw,6
1589904345.0,2020-05-19,wallstreetbets,fr58hol,Huya huya huya,t3_gmlsuw,7
1589904656.0,2020-05-19,wallstreetbets,fr59492,She's asking the wrong question. POWELLS RETIREMENT HOLDS OVER A MILLION IN BLACKROCK,t3_gmlsuw,6
1589904670.0,2020-05-19,wallstreetbets,fr59597,BlackRock doesnt have a fucking patriotic duty. For fucks sake,t3_gmlsuw,5
1589904737.0,2020-05-19,wallstreetbets,fr59a4z,MSFT better mooooon,t3_gmlsuw,6
1589904752.0,2020-05-19,wallstreetbets,fr59bcr,"Ever since I bought a put yesterday, spy has attached itself to 295... your...welcome?",t3_gmlsuw,5
1589904828.0,2020-05-19,wallstreetbets,fr59h1a,Remember when the market hated uncertainty?,t3_gmlsuw,5
1589904855.0,2020-05-19,wallstreetbets,fr59j20,bob loblaw's job loss,t3_gmlsuw,6
1589905322.0,2020-05-19,wallstreetbets,fr5ahqg,"Gsx is a fraud but u guys with puts need to really consider many obstacles: first ur exp needs to be far enough to catch the drop, second u need to pray the stock isn’t halted premarket, three is the real kicker - will rh even work that morning..",t3_gmlsuw,6
1589905467.0,2020-05-19,wallstreetbets,fr5asib,"Felt cute, might buy puts later",t3_gmlsuw,6
1589906159.0,2020-05-19,wallstreetbets,fr5c8iu,"Cancel Cancel Culture!


https://twitter.com/elonmusk/status/1262783922708058113

Don’t tell me for a second Elon isn’t trying to appeal to conservatives.",t3_gmlsuw,6
1589906917.0,2020-05-19,wallstreetbets,fr5dth4,sorry i didnt wash my dick today zuck but thanks for sucking!,t3_gmlsuw,6
1589907495.0,2020-05-19,wallstreetbets,fr5f1h7,ZUCK IS FUCKING TONIGHT,t3_gmlsuw,6
1589907661.0,2020-05-19,wallstreetbets,fr5fea9,VTIQ going to 40%,t3_gmlsuw,7
1589907851.0,2020-05-19,wallstreetbets,fr5fstq,That gap up yesterday was a bit too much imo and today seems unenthusiastic. Nothing has materially changed in the past week unless I missed some news. This has been the top of our range for the past month so we’ll see how this goes. 50 SPY 5/29 287p,t3_gmlsuw,7
1589907878.0,2020-05-19,wallstreetbets,fr5fuxy,my only regret is that i have boneitis,t3_gmlsuw,6
1589908041.0,2020-05-19,wallstreetbets,fr5g7ai,[X-files looking motherfucka.](https://i.imgur.com/2QOxzxu.jpg),t3_gmlsuw,6
1589908343.0,2020-05-19,wallstreetbets,fr5gucy,Holy fuck that SHOP drop 🤑🤑🤑,t3_gmlsuw,6
1589908408.0,2020-05-19,wallstreetbets,fr5gzew,"Imagine being a retard holding SHOP 🤣😂🤣

IM THAT RETARD 🤣😂🤣😂",t3_gmlsuw,5
1589908527.0,2020-05-19,wallstreetbets,fr5h8j7,Quick 30% on FB FDs. Gang,t3_gmlsuw,6
1589908629.0,2020-05-19,wallstreetbets,fr5hgg5,"The guy that paid $250 for my FB $215 put expiring this Friday, I'm so sorry",t3_gmlsuw,6
1589908641.0,2020-05-19,wallstreetbets,fr5hhdd,"SHOP is a partner not a competitor here

This fucks with Etsy more imo",t3_gmlsuw,6
1589908781.0,2020-05-19,wallstreetbets,fr5hsc2,"good, now announce also the covid vaccine only for fb users",t3_gmlsuw,7
1589908799.0,2020-05-19,wallstreetbets,fr5htts,I don’t remember who plugged the thread with FB last night but that dudes a fuckin homie,t3_gmlsuw,6
1589908912.0,2020-05-19,wallstreetbets,fr5i2m2,My only regret is not buying more FB calls,t3_gmlsuw,5
1589909096.0,2020-05-19,wallstreetbets,fr5ih0a,what's the news? SHOP & FB partnership?,t3_gmlsuw,7
1589909117.0,2020-05-19,wallstreetbets,fr5iiop,LMFAO those put holders on shop got zucked,t3_gmlsuw,6
1589909222.0,2020-05-19,wallstreetbets,fr5iqt5,Shopify CEO looks like he owns a vintage tea and incense shop on Shopify,t3_gmlsuw,6
1589909316.0,2020-05-19,wallstreetbets,fr5iy1t,"FB already broke the 218 resistance 

ATH is 223

FB IS MAKING NEW ATH SOON MARK THIS",t3_gmlsuw,5
1589909543.0,2020-05-19,wallstreetbets,fr5jff2,Damn man this sub really kicks ass sometimes. I saw nothing on financial news about FB announcement today but people were hyping it here. Bought a FD this morning and just closed for 100% gains,t3_gmlsuw,5
1589910041.0,2020-05-19,wallstreetbets,fr5kh61,"Fb is about to break $220. Next big tech stock finally reaching its all time high, after amazon and Netflix. Such a beautiful thing to see",t3_gmlsuw,5
1589910089.0,2020-05-19,wallstreetbets,fr5kktv,I cannot believe I was about to buy 8 220 FB calls for 100$ and pussied our. Fuck,t3_gmlsuw,4
1589910180.0,2020-05-19,wallstreetbets,fr5kry4,"FB just broke 220, next resistance at 378",t3_gmlsuw,6
1589910288.0,2020-05-19,wallstreetbets,fr5l08u,"PCG dumped all the way to 11.67 in seconds and people are buying the dip. There must be some insider info on the crash the volume is pretty fucking high.

Edit: 

[The only news known so far.](https://twitter.com/kavya_balaraman/with_replies?ref_src=twsrc%5Egoogle%7Ctwcamp%5Eserp%7Ctwgr%5Eauthor)

Sounds like it won't be settled this Friday as previously suspected.",t3_gmlsuw,6
1589910756.0,2020-05-19,wallstreetbets,fr5lziu,FB moon mission stopping for a refuel.,t3_gmlsuw,5
1589911036.0,2020-05-19,wallstreetbets,fr5mk89,"open position

underlying immediately tanks for first time in weeks

wait anxiously while it crawls back to breakeven

close position

high fives all round 

feelsgoodman",t3_gmlsuw,7
1589911138.0,2020-05-19,wallstreetbets,fr5mrww,[deleted],t3_gmlsuw,5
1589911268.0,2020-05-19,wallstreetbets,fr5n1fq,HUYA made me 3k today and it's not even Christmas,t3_gmlsuw,7
1589911415.0,2020-05-19,wallstreetbets,fr5nc7s,GUH,t3_gmlsuw,6
1589911514.0,2020-05-19,wallstreetbets,fr5nj9i,"https://www.cnbc.com/2020/01/17/luckin-coffee-is-a-stronger-growth-stock-than-starbucks-trader.html

This Luckin' Coffee company sounds legit!  The margins are massive, just listen to this very smart person on CNBC - it's a fundamentally strong business.  Can't argue with the chart either, just listen to Todd!  Love that name too - ""Todd.""  I'm ready to buy!  How come my buy order isn't filling?",t3_gmlsuw,6
1589911698.0,2020-05-19,wallstreetbets,fr5nwrn,God why even sell facebook at this point that shits gonna blow up AH and tomorrow.,t3_gmlsuw,6
1589911776.0,2020-05-19,wallstreetbets,fr5o2e8,Am I the only one that can only hold a couple hours in cash gang and throw it into calls or puts constantly ?,t3_gmlsuw,6
1589911822.0,2020-05-19,wallstreetbets,fr5o5vq,[deleted],t3_gmlsuw,7
1589912084.0,2020-05-19,wallstreetbets,fr5opav,[deleted],t3_gmlsuw,6
1589912228.0,2020-05-19,wallstreetbets,fr5p053,"I'm predicting an EOD dump because I flipped a coin and it came up tails and ""dump"" was assigned to tails",t3_gmlsuw,6
1589912420.0,2020-05-19,wallstreetbets,fr5peco,DKNG I swear to god if you dip below 30 again I'm going to wait patiently until you go higher.,t3_gmlsuw,6
1589912432.0,2020-05-19,wallstreetbets,fr5pf6w,Im so tempted to buy spy puts,t3_gmlsuw,6
1589912489.0,2020-05-19,wallstreetbets,fr5pjen,[deleted],t3_gmlsuw,6
1589912924.0,2020-05-19,wallstreetbets,fr5qfu9,I will literally suck Mr. Huya's dick,t3_gmlsuw,6
1589912986.0,2020-05-19,wallstreetbets,fr5qkes,Facebook is fucking on fire and IMO will continue well into after hours. The Shop Facebook announcement is completely underrated right now,t3_gmlsuw,6
1589913017.0,2020-05-19,wallstreetbets,fr5qms8,$HUYA to $20 EOD. Someone agree so I feel better about myself,t3_gmlsuw,5
1589913412.0,2020-05-19,wallstreetbets,fr5rg8g,Zuck you dirty bitch get through 220 and stay,t3_gmlsuw,6
1589913577.0,2020-05-19,wallstreetbets,fr5rsek,It’s funny and a bit unsettling that at least half of us have taken advice from someone here who likely can’t even drink or drive yet,t3_gmlsuw,5
1589913700.0,2020-05-19,wallstreetbets,fr5s1up,I love how so many stocks are now at ATHs,t3_gmlsuw,7
1589914149.0,2020-05-19,wallstreetbets,fr5sz6p,"Lmao the Joe Rogan contract pumping Spotify 7%, I realise it's the implications of them moving into a new market but it's better to just say it's the Rogan deal",t3_gmlsuw,6
1589914178.0,2020-05-19,wallstreetbets,fr5t1cs,absolutely retarded lol,t3_gmlsuw,5
1589914215.0,2020-05-19,wallstreetbets,fr5t454,FOMO is a hell of a drug,t3_gmlsuw,6
1589914218.0,2020-05-19,wallstreetbets,fr5t4el,"Imagine not buying the FB dip 


Free money",t3_gmlsuw,4
1589914226.0,2020-05-19,wallstreetbets,fr5t4zq,imagine thinking joe rogan is worth 3b,t3_gmlsuw,7
1589914270.0,2020-05-19,wallstreetbets,fr5t87i,Can we get a nice gentle massive EOD dump?,t3_gmlsuw,5
1589914373.0,2020-05-19,wallstreetbets,fr5tfyl,"Jesus, you ever walk to the freezer for a popsicle and the thought of what the fuck is your life going to look like in 30 years pops in your head and it's terrifying?",t3_gmlsuw,7
1589914401.0,2020-05-19,wallstreetbets,fr5ti0t,[deleted],t3_gmlsuw,5
1589914476.0,2020-05-19,wallstreetbets,fr5tnky,I convinced my wife to start a paper trading account.  She bought 10 167.5c 6/19 Spotify calls two hours ago....,t3_gmlsuw,6
1589914658.0,2020-05-19,wallstreetbets,fr5u14q,WTF IS HAPPENING,t3_gmlsuw,6
1589914933.0,2020-05-19,wallstreetbets,fr5umcp,I’m never gonna financially recover from this.,t3_gmlsuw,5
1589914985.0,2020-05-19,wallstreetbets,fr5uq67,Told u moderna = Gilead Same shady shit,t3_gmlsuw,7
1589887249.0,2020-05-19,wallstreetbets,fr4g8cd,"So what you’re saying is that Today by 1pm we’re either seeing SPY 300, or SPY 280. Nice",t1_fr4eyrq,28
1589886480.0,2020-05-19,wallstreetbets,fr4fe6l,Now *this* is a comment. Good man.,t1_fr4eyrq,44
1589887896.0,2020-05-19,wallstreetbets,fr4gym3,"SomeBODY one told me

we never ended QE

I am the sharpest tool in the Fed",t1_fr4diwx,31
1589885289.0,2020-05-19,wallstreetbets,fr4e4a2,"Hey now, he's a rockstar.",t1_fr4diwx,14
1589897667.0,2020-05-19,wallstreetbets,fr4vi9y,im so goddamn tired of those alerts,t1_fr4c4ql,7
1589883799.0,2020-05-19,wallstreetbets,fr4cl2u,This is the way,t1_fr4cej5,31
1589891899.0,2020-05-19,wallstreetbets,fr4m2hw,tech is more volatile than retail thats weird,t1_fr4ly9p,13
1589891834.0,2020-05-19,wallstreetbets,fr4lz8o,Honestly priced in,t1_fr4ly9p,6
1589886963.0,2020-05-19,wallstreetbets,fr4fwzn,"""Those autists at WSB put too much pressure on me""",t1_fr4fuuo,12
1589883450.0,2020-05-19,wallstreetbets,fr4c8fg, there are way less registers open. It's a constant stream of people that bottlenecks at 2 or 3 registers.  Same shit with Starbucks,t1_fr4c4sc,33
1589885231.0,2020-05-19,wallstreetbets,fr4e24i,"They beat revenue by 700 million dollars, so the parking lot full stuff was actually correct, they just didn’t factor in the Covid costs dragging everything down.",t1_fr4c4sc,8
1589891484.0,2020-05-19,wallstreetbets,fr4lhs8,May I interest you in tankers?,t1_fr4lf20,19
1589891649.0,2020-05-19,wallstreetbets,fr4lpwp,You see the one with the lady with gigantic titties yesterday?,t1_fr4lkvy,7
1589893074.0,2020-05-19,wallstreetbets,fr4nswt,"Yea... 

Dimon agrees with it till it's tax time....",t1_fr4nhiq,7
1589885582.0,2020-05-19,wallstreetbets,fr4efky,I love/hate cocaine too.,t1_fr4d9pv,10
1589903608.0,2020-05-19,wallstreetbets,fr57072,Bruh. Been doing that for weeks now.,t1_fr56xd4,6
1589890138.0,2020-05-19,wallstreetbets,fr4jpfy,"Cool, but how do you know it’s not going to be a triple bottom?",t1_fr4jn1r,15
1589884546.0,2020-05-19,wallstreetbets,fr4dco4,pls no,t1_fr4d8p3,6
1589889251.0,2020-05-19,wallstreetbets,fr4il5q,CNBC: “MARKETS IN TURMOIL”,t1_fr4iem0,15
1589891697.0,2020-05-19,wallstreetbets,fr4lsc8,God damnit I’m in,t1_fr4lrg9,14
1589887305.0,2020-05-19,wallstreetbets,fr4galg,Boomer DD is usually solid.  Tough part is translating that into option plays,t1_fr4fwti,24
1589900327.0,2020-05-19,wallstreetbets,fr50ju1,"Definitely fucked in long run, but current administration will be gone by time it actually hits us",t1_fr50gtf,7
1589884267.0,2020-05-19,wallstreetbets,fr4d2c8,not good - he ate the puts bug,t1_fr4c3bf,16
1589887134.0,2020-05-19,wallstreetbets,fr4g3pq,#INVERSE GILDED DD,t1_fr4g1t6,12
1589890597.0,2020-05-19,wallstreetbets,fr4kav5,"I first read that as Dr Timothy Leary, world of difference.",t1_fr4k3c2,9
1589886195.0,2020-05-19,wallstreetbets,fr4f36f,There was a good time to buy calls and today might not be it.,t1_fr4f0uv,6
1589893891.0,2020-05-19,wallstreetbets,fr4p25x,"Oh Man, 2.5 years! Get out of this addiction now, enjoy your recovered 20K",t1_fr4ov5s,6
1589905016.0,2020-05-19,wallstreetbets,fr59v0t,Fucking amazing soundtrack. It's so good.,t1_fr59qzb,5
1589889019.0,2020-05-19,wallstreetbets,fr4iarj,"Yes because during the initial lockdown you got everything you need from Sally's Swell Supermarket, right?",t1_fr4i5fv,6
1589899255.0,2020-05-19,wallstreetbets,fr4yh56,it’s tasty,t1_fr4yg1u,6
1589890632.0,2020-05-19,wallstreetbets,fr4kchy,[deleted],t1_fr4kabm,7
1589890910.0,2020-05-19,wallstreetbets,fr4kps9,Do it,t1_fr4kna8,6
1589908864.0,2020-05-19,wallstreetbets,fr5hyvl,U have fb calls and spy puts... lmfao,t1_fr5hv09,6
1589890647.0,2020-05-19,wallstreetbets,fr4kd6g,Wipe your ass,t1_fr4kblv,6
