created,date,subreddit,id,body,parent_id,score
1620745528.0,2021-05-11,wallstreetbets,gxqj3kc,"Cramer this morning says “Wsb has no respect for me, and I have no respect for them” like it’s breaking news",t3_n9th6n,10
1620745956.0,2021-05-11,wallstreetbets,gxqk3ra,I'm down 3.7% after being down 3.5% yesterday. How're yall doing?,t3_n9th6n,11
1620746881.0,2021-05-11,wallstreetbets,gxqmagt,Rotation into tech lmao,t3_n9th6n,11
1620746897.0,2021-05-11,wallstreetbets,gxqmbsx,PLTR 😍😍😍,t3_n9th6n,10
1620746926.0,2021-05-11,wallstreetbets,gxqme9x,If PLTR breaks through 20 we could see a massive run,t3_n9th6n,10
1620747089.0,2021-05-11,wallstreetbets,gxqms7r,"Tech free falls for 3 months and the market sleeps, but threaten the boomer’s stocks one day and the entire market turns green.",t3_n9th6n,11
1620747266.0,2021-05-11,wallstreetbets,gxqn7c2,buying calls on the whole tech market,t3_n9th6n,12
1620747413.0,2021-05-11,wallstreetbets,gxqnk0f,Yall are real optimistic and it's not even lunch yet.,t3_n9th6n,11
1620747707.0,2021-05-11,wallstreetbets,gxqo9lk,This market is more confused then my future ex-wife...,t3_n9th6n,11
1620748423.0,2021-05-11,wallstreetbets,gxqpzla,Lovely day outside. Think I'll sit in front of my computer inside and cry.,t3_n9th6n,12
1620749429.0,2021-05-11,wallstreetbets,gxqseqo,"Lets get the world restarted from a year and half of bullshit. Then, lets crash the market, hack the oil pipelines and launch rockets into shit just because we might as well pick right up where we left off.",t3_n9th6n,11
1620750537.0,2021-05-11,wallstreetbets,gxqv2ol,PLTR WITH 144 MILLION IN VOLUME TODAY. Goddamn,t3_n9th6n,11
1620750738.0,2021-05-11,wallstreetbets,gxqvjty,I should have just bought corn instead of stocks,t3_n9th6n,12
1620750911.0,2021-05-11,wallstreetbets,gxqvytt,Stocks are fuckin weird,t3_n9th6n,11
1620753288.0,2021-05-11,wallstreetbets,gxr1q9k,Just bought spy calls sorry guys,t3_n9th6n,11
1620754067.0,2021-05-11,wallstreetbets,gxr3ngd,Bears so busy touching tips they gonna miss out in buying these dips!,t3_n9th6n,10
1620754448.0,2021-05-11,wallstreetbets,gxr4khc,[deleted],t3_n9th6n,10
1620755400.0,2021-05-11,wallstreetbets,gxr6xad,PLTR got me rock hard rn,t3_n9th6n,11
1620755750.0,2021-05-11,wallstreetbets,gxr7sj8,Dow down Chad flat. Rotation back into tech?,t3_n9th6n,11
1620757197.0,2021-05-11,wallstreetbets,gxrbalz,So many people who sold PLTR in shambles rn,t3_n9th6n,12
1620758029.0,2021-05-11,wallstreetbets,gxrdbus,"Red days: -10%
Green days: +0.5%",t3_n9th6n,11
1620758163.0,2021-05-11,wallstreetbets,gxrdnvu,WW3. we're going circuit breakers tomorrow,t3_n9th6n,10
1620758244.0,2021-05-11,wallstreetbets,gxrdutz,I can appreciate a 2% gain after being down 10% a few hours ago.,t3_n9th6n,12
1620759304.0,2021-05-11,wallstreetbets,gxrggte,"How are bears surprised anymore, we have done this for over a year straight now",t3_n9th6n,11
1620761200.0,2021-05-11,wallstreetbets,gxrl4ro,Go Gme go,t3_n9th6n,11
1620761359.0,2021-05-11,wallstreetbets,gxrlina,Yup fuck this market.,t3_n9th6n,12
1620762454.0,2021-05-11,wallstreetbets,gxro5q2,"PLTR $23 tomorrow, $25 day after tomorrow and $21 Friday. I have spoken!",t3_n9th6n,10
1620762756.0,2021-05-11,wallstreetbets,gxrow2q,[deleted],t3_n9th6n,11
1620762827.0,2021-05-11,wallstreetbets,gxrp2cc,This has been a long week.,t3_n9th6n,11
1620762925.0,2021-05-11,wallstreetbets,gxrpayu,Too many bears in here. That’s how I know not to buy puts,t3_n9th6n,12
1620763731.0,2021-05-11,wallstreetbets,gxrr8ys,Congrats anyone that got in on fubo,t3_n9th6n,11
1620763979.0,2021-05-11,wallstreetbets,gxrru57,I have 140 Fubo $20 5/21 calls,t3_n9th6n,10
1620764292.0,2021-05-11,wallstreetbets,gxrsl1u,Fuboooooo let’s go,t3_n9th6n,11
1620767026.0,2021-05-11,wallstreetbets,gxrz676,Finally FUBO getting some love. My leaps have been bleeding for months.,t3_n9th6n,10
1620727430.0,2021-05-11,wallstreetbets,gxpn95b,PLTR $0p 5/14,t3_n9th6n,11
1620728095.0,2021-05-11,wallstreetbets,gxpnzsk,"premarket looks very red, so even more red at open?",t3_n9th6n,9
1620729200.0,2021-05-11,wallstreetbets,gxppa49,Anybody got some $ROPE I can use. Stores are all sold out due to high demand,t3_n9th6n,9
1620730295.0,2021-05-11,wallstreetbets,gxpqlwk,Turns out the short squeeze was actually a long squeeze,t3_n9th6n,10
1620730469.0,2021-05-11,wallstreetbets,gxpqtl3,"Not opening my account today, probably going to get margin called. Oh fucking well at this point",t3_n9th6n,10
1620730626.0,2021-05-11,wallstreetbets,gxpr0ow,Lmao SPCE is going to be a penny stock today,t3_n9th6n,11
1620731085.0,2021-05-11,wallstreetbets,gxprltl,So Kathie sold her apple holdings to buy donkeykong  and coinbase. Either she knows something we don't or she's on a speedrun to 0.,t3_n9th6n,11
1620731364.0,2021-05-11,wallstreetbets,gxpryv4,I was born in the red! moulded by it. I didn't see green till I was already ape. By then it was nothing to hold...,t3_n9th6n,11
1620731688.0,2021-05-11,wallstreetbets,gxpse4y,[deleted],t3_n9th6n,11
1620731812.0,2021-05-11,wallstreetbets,gxpsk10,Haha I’m in danger,t3_n9th6n,10
1620732142.0,2021-05-11,wallstreetbets,gxpt0br,These TSLA calls are the final nail in my coffin today holy fuck,t3_n9th6n,10
1620732162.0,2021-05-11,wallstreetbets,gxpt1ad,down another 3 grand on palantir 👍🏻👍🏻👍🏻👍🏻👍🏻👍🏻👍🏻👍🏻👍🏻👍🏻👍🏻👍🏻👍🏻👍🏻👍🏻👍🏻👍🏻👍🏻👍🏻👍🏻👍🏻👍🏻👍🏻,t3_n9th6n,10
1620732220.0,2021-05-11,wallstreetbets,gxpt46m,"Guess I'm selling some MSFT and APPL to ~~catch the knife~~ buy the 8th, 9th and 10th layers of the PLTR dips",t3_n9th6n,9
1620732564.0,2021-05-11,wallstreetbets,gxptlgm,Cathie's gonna look another 50 years older by the end of this month,t3_n9th6n,9
1620732733.0,2021-05-11,wallstreetbets,gxptu3f,Made 300% in APHA and now about to lose 100% of it in ARK FML,t3_n9th6n,10
1620732742.0,2021-05-11,wallstreetbets,gxptukx,Lol omg tesla.. GUUUUHHHH,t3_n9th6n,10
1620733084.0,2021-05-11,wallstreetbets,gxpucmg,"From now on, ill use this sub to make sure which stocks to stay away from.",t3_n9th6n,10
1620733091.0,2021-05-11,wallstreetbets,gxpud1i,"Reminder why ""It's only a loss if you sell"" if fucking terrible advice if you are holding speculative companies",t3_n9th6n,9
1620733250.0,2021-05-11,wallstreetbets,gxpulgc,**P**ain **L**oss **T**ears **R**IP,t3_n9th6n,10
1620733458.0,2021-05-11,wallstreetbets,gxpuwhn,WSB IN SHAMBLES,t3_n9th6n,12
1620733664.0,2021-05-11,wallstreetbets,gxpv7ow,A few whales get margin called and we’re right back to 08. I hate to admit this but with all the hype/ape trading everywhere I’m going to love seeing all the “influencers” get destroyed.,t3_n9th6n,10
1620733816.0,2021-05-11,wallstreetbets,gxpvgbh,We all bagholders now,t3_n9th6n,10
1620733902.0,2021-05-11,wallstreetbets,gxpvl3z,This sub been meme-ing about this fucking sell off since late february but legit it's not even a joke anymore. Straight up not having a good time lmao.,t3_n9th6n,10
1620733972.0,2021-05-11,wallstreetbets,gxpvox8,"«PLTR already tanked 60% pre earnings, how bad can it get?»

LMAOOOOO
-",t3_n9th6n,10
1620734032.0,2021-05-11,wallstreetbets,gxpvs6v,When ya go from +350% to might have to sell your pokemon cards in 24 hours,t3_n9th6n,10
1620734188.0,2021-05-11,wallstreetbets,gxpw0wm,"Yes, I wish to speak to the manager.",t3_n9th6n,10
1620734225.0,2021-05-11,wallstreetbets,gxpw327,AMD is a value stock now,t3_n9th6n,9
1620734650.0,2021-05-11,wallstreetbets,gxpwrhx,NO NO NO NO NO WHAT THE FUCK IS THIS? TURN THIS SHIP AROUND RIGHT NOW YOU MOTHERFUCKERS.,t3_n9th6n,9
1620734680.0,2021-05-11,wallstreetbets,gxpwt8v,I'm straight up not having a good time.,t3_n9th6n,10
1620735116.0,2021-05-11,wallstreetbets,gxpxj0w,I now understand the boomer mentality of wanting things go be the way they used to because I am from the time when stocks only used to go up.,t3_n9th6n,11
1620735209.0,2021-05-11,wallstreetbets,gxpxokz,The pandemic giveth and the pandemic taketh away.,t3_n9th6n,9
1620735296.0,2021-05-11,wallstreetbets,gxpxtq9,"I love how every time the market dips, market reporters try to come up with some x reason why. It’s whales selling and hedge funds shorting, probably even working together. Retail investors are too autistic to figure out what’s going on half the time.

Inflation? Tha fucks that?",t3_n9th6n,11
1620735374.0,2021-05-11,wallstreetbets,gxpxyjr,Cathy Wood is dumb. She is 65 years old and investing in risky stocks that may take decades to recover.,t3_n9th6n,9
1620735421.0,2021-05-11,wallstreetbets,gxpy1gl,ITS OK NOT REAL MONEY JUST NUMBERS ON A SCREEN I DIDNT NEED IT ANYWAY I WAS PROBABLY JUST GONNA SPEND IT ON SOME DUMB SHIT AND THEREFORE IM NOT BOTHERED IN THE SLIGHTEST AT THIS TRAGIC TURN OF EVENTS,t3_n9th6n,9
1620735726.0,2021-05-11,wallstreetbets,gxpykms,Robinhood is gonna crash for probably hours lol,t3_n9th6n,10
1620735814.0,2021-05-11,wallstreetbets,gxpypzf,"Took me months to break even, now it's back to bagholding for 6 months

Maybe it's a good thing they don't teach kids about investing in school. 90% of them would be dumb fucks like us, wasting hours away everyday just to make negative money",t3_n9th6n,10
1620736013.0,2021-05-11,wallstreetbets,gxpz2dh,T minus 1 hour 4 minutes until unscheduled Robinhood crash.,t3_n9th6n,9
1620736159.0,2021-05-11,wallstreetbets,gxpzbiu,I DECLARE BANKRUPTCYYYYYY,t3_n9th6n,11
1620736213.0,2021-05-11,wallstreetbets,gxpzewl,got hella meetings and i’m gonna lose a fuck ton of money. today is gonna blow,t3_n9th6n,10
1620736513.0,2021-05-11,wallstreetbets,gxpzy0n,Wth happened over night? Did WWIII just break out? 😭,t3_n9th6n,10
1620736561.0,2021-05-11,wallstreetbets,gxq013v,"AAPL you fuck, why did I believe in you. You’ve done nothing but fuck my portfolio over for a fucking year. Go fuck yourself!",t3_n9th6n,11
1620736622.0,2021-05-11,wallstreetbets,gxq056t,Recession back on.  See you boys in the bread line.  🍞,t3_n9th6n,10
1620736710.0,2021-05-11,wallstreetbets,gxq0asz,No panic selling I repeat no panic selling.....this is what they do.....as soon as all u peeps sell off the same sellers will be buyers,t3_n9th6n,10
1620736764.0,2021-05-11,wallstreetbets,gxq0eem,Last four months feel like a waste of time.,t3_n9th6n,10
1620736768.0,2021-05-11,wallstreetbets,gxq0elt,"Green by close, tomorrow +10% day",t3_n9th6n,9
1620736803.0,2021-05-11,wallstreetbets,gxq0gxi,"This is all Bill Hwang's fault

ngl i kinda admire him lmao",t3_n9th6n,9
1620736966.0,2021-05-11,wallstreetbets,gxq0rld,We all are fuk,t3_n9th6n,10
1620737065.0,2021-05-11,wallstreetbets,gxq0y51,"I dont think I've ever seen a whole sector report record earnings and improve guidance, only to instantly go into correction territory.",t3_n9th6n,9
1620737140.0,2021-05-11,wallstreetbets,gxq12yw,Good thing I like takin it up the ass,t3_n9th6n,11
1620737207.0,2021-05-11,wallstreetbets,gxq17da,"Don't worry guys, we'll break even in 10 years.",t3_n9th6n,10
1620737417.0,2021-05-11,wallstreetbets,gxq1ll6,Remember the day when your portfolios were green?,t3_n9th6n,10
1620737548.0,2021-05-11,wallstreetbets,gxq1ufn,Milk was a bad choice.,t3_n9th6n,11
1620737669.0,2021-05-11,wallstreetbets,gxq22lc,"I guess I'm a ""long term investor"" now",t3_n9th6n,10
1620737735.0,2021-05-11,wallstreetbets,gxq2748,I might need y’all to use my referral code for free stocks to stay out of margin call,t3_n9th6n,9
1620738070.0,2021-05-11,wallstreetbets,gxq2ttb,"*looks at TSLA premarket*

*chuckles* I’m in danger",t3_n9th6n,10
1620738075.0,2021-05-11,wallstreetbets,gxq2u3z,"Diversify they said, but it's all red Sir.",t3_n9th6n,11
1620738275.0,2021-05-11,wallstreetbets,gxq37p6,I WILL NEVER FINANCIALLY RECOVER FROM PRE-MARKET,t3_n9th6n,10
1620738438.0,2021-05-11,wallstreetbets,gxq3j69,"NYSE phone number: #212-656-3000!
Press 1 for refund",t3_n9th6n,10
1620738493.0,2021-05-11,wallstreetbets,gxq3n14,"As a bull, the cool thing about corrections is it’s a giant sale.

The bad thing about corrections is I don’t have any cash left",t3_n9th6n,9
1620738549.0,2021-05-11,wallstreetbets,gxq3qww,I will never hold anything through may again,t3_n9th6n,11
1620738702.0,2021-05-11,wallstreetbets,gxq41ki,"My boss later today:

Why are you being so nice to me today 🧐",t3_n9th6n,10
1620727614.0,2021-05-11,wallstreetbets,gxpnglq,hell yeah,t1_gxpnekv,67
1620727778.0,2021-05-11,wallstreetbets,gxpnn19,"Negative 0,76 on my investment acc",t1_gxpnekv,31
1620734234.0,2021-05-11,wallstreetbets,gxpw3kf,It'll all come back in the next 10 years.,t1_gxpw07u,34
1620734203.0,2021-05-11,wallstreetbets,gxpw1tc,It's okay Cathie,t1_gxpw07u,110
1620728187.0,2021-05-11,wallstreetbets,gxpo3hw,🤡,t1_gxpo28o,9
1620730263.0,2021-05-11,wallstreetbets,gxpqkgt,It's too bizarre to not believe at this point.,t1_gxpqfim,35
1620732113.0,2021-05-11,wallstreetbets,gxpsyx9,No shit. I’m outta cash,t1_gxpsx6f,14
1620728084.0,2021-05-11,wallstreetbets,gxpnzce,"huge dump on open, wsb buys puts on bottom, and BOOOM, green dildo after green dildo. Even PLTR gets to +0,01%.",t1_gxpnr1o,50
1620728288.0,2021-05-11,wallstreetbets,gxpo7nr,Alternative gains,t1_gxpnzjb,26
1620735085.0,2021-05-11,wallstreetbets,gxpxh6r,Do it,t1_gxpxb0y,15
1620730006.0,2021-05-11,wallstreetbets,gxpq910,"I come from the future.

Earnings were amazing. Everybody cheered. Stock -6%",t1_gxpq505,35
1620730008.0,2021-05-11,wallstreetbets,gxpq937,Wouldn’t want to be that retard,t1_gxppz4z,43
1620731539.0,2021-05-11,wallstreetbets,gxps72z,New range of oreos apparently,t1_gxprupi,16
1620736043.0,2021-05-11,wallstreetbets,gxpz48c,"I like this guy, watching out for the homies

Money is worthless we just have to ask Jpow to print us more.",t1_gxpykg6,13
1620735792.0,2021-05-11,wallstreetbets,gxpyomf,Thanks for making me feel better. I lost nearly half my portfolio value in months...,t1_gxpykg6,12
1620736483.0,2021-05-11,wallstreetbets,gxpzw28,"Bagholder spotted.

*I am a bot, and this action was performed automatically. Please [contact the moderators of this subreddit](/message/compose/?to=/r/wallstreetbets) if you have any questions or concerns.*",t1_gxpzw1h,10
1620734633.0,2021-05-11,wallstreetbets,gxpwqeh,See ya in r/investing! 👍😂,t1_gxpw3kf,18
1620733482.0,2021-05-11,wallstreetbets,gxpuxtg,"Let's not get crazy now. PLTR could release news that they've solved world hunger, poverty, cured cancer, and have a vaccine against the common cold, and they'd drop 2%.",t1_gxpnzce,11
