created,date,subreddit,id,body,parent_id,score
1620225764.0,2021-05-05,wallstreetbets,gx14xzl,Honestly at this point my money may have a higher ROI in a traditional savings account.,t3_n5cc1t,12
1620225967.0,2021-05-05,wallstreetbets,gx15ex9,GME volume be like 😳,t3_n5cc1t,14
1620226093.0,2021-05-05,wallstreetbets,gx15pdm,Peloton celebrated cinco de Mayo by having one of their treadmills eat a chihuahua.,t3_n5cc1t,12
1620226772.0,2021-05-05,wallstreetbets,gx17aez,Rkt 🚀🚀🚀🚀🚀,t3_n5cc1t,13
1620227259.0,2021-05-05,wallstreetbets,gx18g5z,"Every stock I own or have options in: green


My portfolio: down 11%",t3_n5cc1t,13
1620227517.0,2021-05-05,wallstreetbets,gx19272,Juicy RKT tendies incoming 🤤🤤 break that 23.30 resistance!!,t3_n5cc1t,13
1620228321.0,2021-05-05,wallstreetbets,gx1azd1,PLTR: how to turn $23 into $21,t3_n5cc1t,14
1620229494.0,2021-05-05,wallstreetbets,gx1dvkv,"The year is 5960

PLTR still 22$",t3_n5cc1t,12
1620232023.0,2021-05-05,wallstreetbets,gx1k2v1,Wow. CRSR really just going to 36 today. Ok,t3_n5cc1t,13
1620233105.0,2021-05-05,wallstreetbets,gx1mrjd,What in the mother fucking fuck is going on with this shit fucked market!!!! Fuck your fucking face  you fucking fuck!!,t3_n5cc1t,13
1620233398.0,2021-05-05,wallstreetbets,gx1ni6h,[deleted],t3_n5cc1t,13
1620234923.0,2021-05-05,wallstreetbets,gx1r9r3,"I love Stocktwits. 

Stock price:$19.58 

Comments: “someone come get me at $20 I’m bagholding #bullish”",t3_n5cc1t,14
1620236180.0,2021-05-05,wallstreetbets,gx1ua8y,This market has been hot fucking garbage for the past 3 weeks,t3_n5cc1t,13
1620236983.0,2021-05-05,wallstreetbets,gx1w71t,Holding RKT thru earnings? Yes I’m retarded,t3_n5cc1t,13
1620244517.0,2021-05-05,wallstreetbets,gx2e0s9,RKT gang ready for liftoff,t3_n5cc1t,13
1620244795.0,2021-05-05,wallstreetbets,gx2eof5,[deleted],t3_n5cc1t,14
1620245004.0,2021-05-05,wallstreetbets,gx2f6dz,GL RKT gang 🚀,t3_n5cc1t,13
1620245376.0,2021-05-05,wallstreetbets,gx2g23e,Lol RKT. I’m in calls but I can’t help but laugh at this.,t3_n5cc1t,12
1620210906.0,2021-05-05,wallstreetbets,gx0escq,Man the Brits have some exceptionally cunty history,t3_n5cc1t,13
1620213310.0,2021-05-05,wallstreetbets,gx0hrz4,"So many RKT YOLOs. No way wallstreet let's these guys eat, right? RIGHT!??

*don't FOMO don't FOMO don't FOMO*",t3_n5cc1t,11
1620213630.0,2021-05-05,wallstreetbets,gx0i7gm,GME giving me the daily GUH,t3_n5cc1t,12
1620214316.0,2021-05-05,wallstreetbets,gx0j63i,"Vxx dropping, spy climbing. We gucci boys.",t3_n5cc1t,13
1620215949.0,2021-05-05,wallstreetbets,gx0lmai,"Every day is a new opportunity to channel my inner Captain Kirk, raise my fists to the sky, and scream at the top of my lungs ""NNNIIIIOOOOOOOOOOOOO"" until I pass out from rage.",t3_n5cc1t,12
1620217210.0,2021-05-05,wallstreetbets,gx0nmz0,RKT post earnings. Real Estate boomed this quarter. Houses sold the moment they were put on the market. RKT Boomski to the moonski,t3_n5cc1t,12
1620217381.0,2021-05-05,wallstreetbets,gx0nxcv,"Let’s see TLRY go somewhere other than up my ass and to the center of the earth today, eh?",t3_n5cc1t,12
1620217385.0,2021-05-05,wallstreetbets,gx0nxkp,Big green SPY dildos today please.,t3_n5cc1t,12
1620219878.0,2021-05-05,wallstreetbets,gx0sftf,Having an opinion is unpopular,t3_n5cc1t,12
1620220395.0,2021-05-05,wallstreetbets,gx0tfdp,Gamestop's gonna have 200 million votes before lunchtime aren't they?,t3_n5cc1t,12
1620220544.0,2021-05-05,wallstreetbets,gx0tpum,How many times a day do you say WHO GIVES A FUCK???,t3_n5cc1t,12
1620220667.0,2021-05-05,wallstreetbets,gx0tyi7,I have two accounts. One I buy puts and one I buy calls. I can’t lose!,t3_n5cc1t,11
1620220701.0,2021-05-05,wallstreetbets,gx0u0z6,"I was promised Lambos, but now I'm homeless. Thanks, guys!",t3_n5cc1t,12
1620220916.0,2021-05-05,wallstreetbets,gx0uglg,Should I get fukt by RKT again?,t3_n5cc1t,13
1620221180.0,2021-05-05,wallstreetbets,gx0uznu,I’m starting to realize the only way to make money is buying puts on what I think a good investment idea is.,t3_n5cc1t,12
1620221928.0,2021-05-05,wallstreetbets,gx0wifz,RKT do not dare disappoint me,t3_n5cc1t,11
1620223876.0,2021-05-05,wallstreetbets,gx10ox6,RKT was never supposed to explode today. We are waiting on the obvious quarterly divi and/or huge acquisition announcement that we all know is coming after the bell during ER. Tomorrow is the day the stock flys. 🚀,t3_n5cc1t,11
1620223969.0,2021-05-05,wallstreetbets,gx10w8u,And the worst part about getting my balls crushed by this market is seeing my friends who work at a gas station posting their dog coin gains to further add insult to injury.,t3_n5cc1t,11
1620224045.0,2021-05-05,wallstreetbets,gx112dy,Fuck this fake and gay bear market. I'm praying you all get reamed at the top and fall...very hard before mid-day as the Bulls trample your shambled corpses into dust.,t3_n5cc1t,12
1620228495.0,2021-05-05,wallstreetbets,gx1bebu,$RKT hitting $27 AH's but will be back to $22 EOW.,t3_n5cc1t,12
1620231443.0,2021-05-05,wallstreetbets,gx1inh6,CRSR. Finally!!!   Up 10% today.,t3_n5cc1t,13
1620231537.0,2021-05-05,wallstreetbets,gx1ivv6,Whoever commented here about oil yesterday you are a trading god,t3_n5cc1t,12
1620231656.0,2021-05-05,wallstreetbets,gx1j6fq,CRSR gonna keep runnin over the next couple weeks,t3_n5cc1t,12
1620231822.0,2021-05-05,wallstreetbets,gx1jl7h,"It's OK PLTR, you just keep being the little bitch that you are.",t3_n5cc1t,12
1620232272.0,2021-05-05,wallstreetbets,gx1kp04,just blew up 160k on fisker lmao rip,t3_n5cc1t,14
1620233805.0,2021-05-05,wallstreetbets,gx1oj13,The problem for PTON is their target demo is full of soccer moms that have seen the video of the kid getting attacked by the treadmill 20x on social media. Concerned mothers can ruin a company/country.,t3_n5cc1t,13
1620235018.0,2021-05-05,wallstreetbets,gx1ri45,[deleted],t3_n5cc1t,12
1620237063.0,2021-05-05,wallstreetbets,gx1we33,RKT is the move. Glad we can all agree,t3_n5cc1t,12
1620237407.0,2021-05-05,wallstreetbets,gx1x7k3,PSFE fucking move holy dead ass fish stock flopping on the ground,t3_n5cc1t,12
1620243309.0,2021-05-05,wallstreetbets,gx2b4sc,Imagine having a functioning society and economy,t3_n5cc1t,13
1620243731.0,2021-05-05,wallstreetbets,gx2c4vt,"I sold my RKT calls so it’s going to the moon AH, you’re welcome brothers 🙏🏾",t3_n5cc1t,13
1620243798.0,2021-05-05,wallstreetbets,gx2cam4,Can we get this correction over with? This slow bleed is boring. Pop this bubble and move on ffs!,t3_n5cc1t,13
1620243852.0,2021-05-05,wallstreetbets,gx2cf6d,"This market is going to turn me into a legit fucking emo. Im talking emo bangs, black nail polish, My Chemical Romance t-shirt, the whole shebang.",t3_n5cc1t,10
1620244138.0,2021-05-05,wallstreetbets,gx2d3wr,Bagholder special this week,t3_n5cc1t,12
1620244280.0,2021-05-05,wallstreetbets,gx2dgde,"Chat moving so fast, no one will notice I am covering margin calls back to back 😭",t3_n5cc1t,11
1620208913.0,2021-05-05,wallstreetbets,gx0ckci,PLTR bag holders.  Prepare thy pooper for the daily incoming.,t3_n5cc1t,36
1620213288.0,2021-05-05,wallstreetbets,gx0hqwj,My Dad fucked my Mom,t3_n5cc1t,35
1620219191.0,2021-05-05,wallstreetbets,gx0r5ge,"""Sell in May, go away"" is so 1900-2020.

2021 is ""Don't be gay, buy all May""",t3_n5cc1t,35
1620215287.0,2021-05-05,wallstreetbets,gx0klwr,"“We’re gonna remove the GME thread cause it’s taken over and WSB OG’s want to get back to basics.”

WSB Front Page: RKT RKT RKT RKT MVIS RKT RKT CLOV RKT RKT RKT RKT",t3_n5cc1t,103
1620208939.0,2021-05-05,wallstreetbets,gx0clbv,If you’re at -94% it’s not a loss if you don’t sell.. right?,t3_n5cc1t,11
1620209095.0,2021-05-05,wallstreetbets,gx0cref,"Holding CRSR, AAPL and other companies that crushed earnings and sales estimates but market decides that it’s not good enough and drops

*Stares at earnings for RKT on May 5, DKNG on May 7 and PLTR on May 11 suspiciously*",t3_n5cc1t,11
1620209232.0,2021-05-05,wallstreetbets,gx0cwr7,"Oil gang wya 

Xom 65c July 16 
Xom 60c 1dte
SPY 420 1dte",t3_n5cc1t,11
1620213484.0,2021-05-05,wallstreetbets,gx0i020,Cramer would get so furious during intercourse,t3_n5cc1t,11
1620216880.0,2021-05-05,wallstreetbets,gx0n3b3,"Diversified, (adj.): a portfolio that declines in value while leaving the holder unable to figure out which stocks are to blame.",t3_n5cc1t,11
1620220113.0,2021-05-05,wallstreetbets,gx0svsl,Cramer reminds me of an old bulldog,t3_n5cc1t,11
1620220176.0,2021-05-05,wallstreetbets,gx0t01y,Yellen better keep her mouth shut today,t3_n5cc1t,11
1620220306.0,2021-05-05,wallstreetbets,gx0t93d,"Incoming ""the market literally always inverses me this is so rigged"" kids because they were dipshits and bought puts at the bottom",t3_n5cc1t,11
1620221112.0,2021-05-05,wallstreetbets,gx0uuqo,If spy could just shoot up 3 dollars at open that would be great.,t3_n5cc1t,10
1620222951.0,2021-05-05,wallstreetbets,gx0yobt,"I just want a 10-bagger, is that too much to ask?",t3_n5cc1t,12
1620223316.0,2021-05-05,wallstreetbets,gx0zgl6,"Me at 9:30: Can't wait for the market to open! Let's get it!!

Me at 9:45: Well that's enough of the stock market for me today",t3_n5cc1t,11
1620223612.0,2021-05-05,wallstreetbets,gx1041m,"Welcome new bagholders to rocket. Atleast you get dividends, but it barely ever moves.",t3_n5cc1t,10
1620224249.0,2021-05-05,wallstreetbets,gx11iqs,Media fear mongering this chip shortage worse than covid.... Fucking rediculous,t3_n5cc1t,10
1620224267.0,2021-05-05,wallstreetbets,gx11k3t,I recommend whoever bought $COIN at 450 to be moderators for this group,t3_n5cc1t,10
1620225478.0,2021-05-05,wallstreetbets,gx14alt,[removed],t3_n5cc1t,13
1620226416.0,2021-05-05,wallstreetbets,gx16gig,RKT get yo ass to 24 where u deserve to be queen 👸,t3_n5cc1t,11
1620226708.0,2021-05-05,wallstreetbets,gx1750x,RKT ready to launch,t3_n5cc1t,11
1620227457.0,2021-05-05,wallstreetbets,gx18x3f,Load up on that rkt boys let's go to the moon,t3_n5cc1t,11
1620227615.0,2021-05-05,wallstreetbets,gx19apj,RKT looking decent today. Rumored EPS of 2.63 and 13 billion in projected revenue. All it needs is more volume.,t3_n5cc1t,11
1620227694.0,2021-05-05,wallstreetbets,gx19hjk,Congratulations on everyone who got CRSR calls yesterday,t3_n5cc1t,10
1620228577.0,2021-05-05,wallstreetbets,gx1blhm,Kind of odd to think I'm indirectly profiting off a treadmill killing a child,t3_n5cc1t,11
1620229315.0,2021-05-05,wallstreetbets,gx1dfb1,"Evictions back on the menu, boys!",t3_n5cc1t,12
1620229618.0,2021-05-05,wallstreetbets,gx1e6lf,CRSR Shorts: Top 10 Anime Deaths,t3_n5cc1t,10
1620229728.0,2021-05-05,wallstreetbets,gx1egcg,CRSR broke 35. Next stop 40. Which is my avg. cost basis. I never gave up on you little boy.,t3_n5cc1t,11
1620231042.0,2021-05-05,wallstreetbets,gx1hoar,"Opened broker app

*CRSR is a vertical line*",t3_n5cc1t,10
1620231125.0,2021-05-05,wallstreetbets,gx1hvr6,Wow whoever said PLTR is a piece of shit is right,t3_n5cc1t,12
1620231141.0,2021-05-05,wallstreetbets,gx1hx4j,"Crsr, can’t stop won’t stop",t3_n5cc1t,12
1620231627.0,2021-05-05,wallstreetbets,gx1j3v0,holy shit [CRSR](https://imgur.com/lyMqtaW) you sexy beast,t3_n5cc1t,9
1620231954.0,2021-05-05,wallstreetbets,gx1jwsi,Wow look at CRSR finally moving,t3_n5cc1t,11
1620231991.0,2021-05-05,wallstreetbets,gx1k03f,Damn I gotta be dreaming- is CRSR actually moving up???,t3_n5cc1t,10
1620232339.0,2021-05-05,wallstreetbets,gx1kuxu,**RKT Quarter should be gr8888**,t3_n5cc1t,12
1620232884.0,2021-05-05,wallstreetbets,gx1m7i4,Help! They're short laddering me!,t3_n5cc1t,11
1620232987.0,2021-05-05,wallstreetbets,gx1mgqr,"Pro tip: when spy has 10 green candles in a row on dog shit volume, buy puts",t3_n5cc1t,11
1620233074.0,2021-05-05,wallstreetbets,gx1molo,Jesus fucking christ fuck PLTR,t3_n5cc1t,11
1620233533.0,2021-05-05,wallstreetbets,gx1nuad,Lmao I have officially moved to boomer LEAPS man fk this market,t3_n5cc1t,12
1620233941.0,2021-05-05,wallstreetbets,gx1ovcn,Who knew bill gates was such a player he had a girlfriend and his wife knew about it and let him visit her yearly.,t3_n5cc1t,11
1620234294.0,2021-05-05,wallstreetbets,gx1pqnx,"Motley Fool strategy: When their biggest positions are beginning to show weakness, they send out discounted subscription service notices to lure you in. Their biggest recommendations one month ago were LMND and APPN. Both down >50% since then. Scam alert.",t3_n5cc1t,11
1620234363.0,2021-05-05,wallstreetbets,gx1pwrm,Two scenarios; SPY touch 415 again and bounce back creating a double bottom and rocket to the moon OR just keep falling creating a new low. PLACE YOUR BETS BOYS!,t3_n5cc1t,11
1620234920.0,2021-05-05,wallstreetbets,gx1r9j9,Holy fuck you retards are still thinking PTON calls are the play. That’s honestly incredible.,t3_n5cc1t,10
1620235647.0,2021-05-05,wallstreetbets,gx1t0i5,Sad when the regular market has been so terrible that imaginary internet vouchers are the only way to make money.,t3_n5cc1t,12
1620236391.0,2021-05-05,wallstreetbets,gx1ury3,if you ever feel bad just know there are people who hold PTON from 160,t3_n5cc1t,10
1620237175.0,2021-05-05,wallstreetbets,gx1wnm5,Never realized how many people truly had gambling problems till WSB,t3_n5cc1t,11
1620242938.0,2021-05-05,wallstreetbets,gx2a8a9,Only confidence I have in GME is that Cathie Wood hasn’t bought it,t3_n5cc1t,10
1620242975.0,2021-05-05,wallstreetbets,gx2abp7,"Pack your bags son, I just lost the house",t3_n5cc1t,10
1620243074.0,2021-05-05,wallstreetbets,gx2akfv,"Some of the companies I’m invested in - AAPL and GOOGL being a few examples - not only crushed their recent earnings reports, but they’ve also created products that have completely changed the world and the way we interact with it. 

Not only am I losing money off of them, I’d be rich beyond my wildest dreams if I invested that money into stupid shitty fake electronic dog currency instead 🤡🤡🤡",t3_n5cc1t,11
1620243312.0,2021-05-05,wallstreetbets,gx2b51u,"Only AMD could beat all expectations, raise yearly guidance, and drop every day since then",t3_n5cc1t,11
1620243504.0,2021-05-05,wallstreetbets,gx2blrj,ARKK innovation ETF with the innovative new way to lose money,t3_n5cc1t,11
1620243561.0,2021-05-05,wallstreetbets,gx2bqjh,"I welcome these dips. I welcome the margin call. I welcome bankruptcy. I welcome foreclosure. I welcome my car getting repoed. 

More room for the lambo.",t3_n5cc1t,10
1620243973.0,2021-05-05,wallstreetbets,gx2cpej,"This bounce is just Cathie buying, please ignore it lmao",t3_n5cc1t,12
1620244596.0,2021-05-05,wallstreetbets,gx2e7dq,sinko de marketo,t3_n5cc1t,12
1620244838.0,2021-05-05,wallstreetbets,gx2es5u,"Rkt 23c, i’m in",t3_n5cc1t,11
1620248001.0,2021-05-05,wallstreetbets,gx2mebk,"RKT and Z blow their profits out of the water, drop 9%.  I am starting to think this is rigged.....",t3_n5cc1t,10
1620248950.0,2021-05-05,wallstreetbets,gx2oopq,"He turned off the bots 😭

*clears throat*

holy moly ghost pepper sticky yes or no nofap !guh

😍😍😍",t3_n5cc1t,12
1620251626.0,2021-05-05,wallstreetbets,gx2uu2e,RKT = Worst pc of shit stock in the market!,t3_n5cc1t,12
1620209427.0,2021-05-05,wallstreetbets,gx0d4ey,When will ARK funds move up again? 🤔,t3_n5cc1t,11
1620212545.0,2021-05-05,wallstreetbets,gx0gs2g,Too bullish in here today,t3_n5cc1t,11
1620213106.0,2021-05-05,wallstreetbets,gx0hiau,First time im paying someone to do my taxes. Too many retarded moves from last year to sift through,t3_n5cc1t,9
1620215682.0,2021-05-05,wallstreetbets,gx0l7dl,"I just liquidated another 12% of my portfolio, so I'm sure everything will moon today. You're welcome.",t3_n5cc1t,11
1620216806.0,2021-05-05,wallstreetbets,gx0myxe,Was all cash and bought spy and qqq calls at bottom yesterday. Feeling like a genius at the moment,t3_n5cc1t,10
1620219817.0,2021-05-05,wallstreetbets,gx0sbim,[deleted],t3_n5cc1t,11
1620220971.0,2021-05-05,wallstreetbets,gx0ukhd,Home Depot is a legitimate godstock.,t3_n5cc1t,9
1620221812.0,2021-05-05,wallstreetbets,gx0w9sx,Mind med actually going up 👀,t3_n5cc1t,9
1620222393.0,2021-05-05,wallstreetbets,gx0xhji,Jim cramer is the type of guy who doesn't put away his shopping cart in the parking lot,t3_n5cc1t,10
1620223433.0,2021-05-05,wallstreetbets,gx0zpsu,"Lmao and everything is falling off a cliff again, fuck this market",t3_n5cc1t,9
1620223623.0,2021-05-05,wallstreetbets,gx104ym,"Wow, fuck this fucking market jesus christ",t3_n5cc1t,9
1620223836.0,2021-05-05,wallstreetbets,gx10lq1,How fucking hard is it to not stuff your children under a treadmill,t3_n5cc1t,9
1620224073.0,2021-05-05,wallstreetbets,gx114ny,That spy dump correlated with my dump.  Thats why you always bring you phone into the terlet.,t3_n5cc1t,10
1620224683.0,2021-05-05,wallstreetbets,gx12hqu,"PTON CEO: our stock is fucked, but not as fuck as it would be if our treadmill killed a minority child instead.",t3_n5cc1t,10
1620224943.0,2021-05-05,wallstreetbets,gx132xs,all the hype here about rkt earnings makes me want to go all in on puts,t3_n5cc1t,11
1620225133.0,2021-05-05,wallstreetbets,gx13if1,peloton was overpriced garbage anyways.,t3_n5cc1t,10
1620225229.0,2021-05-05,wallstreetbets,gx13q7b,Shoutout to CLOV for only being 2% down today instead of 15%. Very bullish!,t3_n5cc1t,10
1620225331.0,2021-05-05,wallstreetbets,gx13yn2,I got into MVIS again...looks like I played myself.,t3_n5cc1t,10
1620225395.0,2021-05-05,wallstreetbets,gx143ub,PTON should just say that they’re making LiDAR treadmills and their stock will 10x.,t3_n5cc1t,11
1620225610.0,2021-05-05,wallstreetbets,gx14l8z,Out of day trade prison. Going all in on CRSR 🚀🚀🚀🚀,t3_n5cc1t,10
1620225671.0,2021-05-05,wallstreetbets,gx14q8p,CRSR finally might be on the move heads up CRSR gang my calls might not actually go tits up,t3_n5cc1t,9
1620225709.0,2021-05-05,wallstreetbets,gx14td5,I love seeing people here losing money and screaming into the void,t3_n5cc1t,9
1620226022.0,2021-05-05,wallstreetbets,gx15jh2,MVIS hahahahaha. Real men have HALIBURTON CALLS,t3_n5cc1t,9
1620226069.0,2021-05-05,wallstreetbets,gx15nc6,Tesla please make me back all the fuckin money you lost me,t3_n5cc1t,11
1620226310.0,2021-05-05,wallstreetbets,gx167f9,19K puts bought on RKT ??? Are they asking for WSB to get involved. Getting some momentum but let’s keep it going,t3_n5cc1t,10
1620226335.0,2021-05-05,wallstreetbets,gx169jw,Just watching this RKT prime for lift-off!!,t3_n5cc1t,11
1620226605.0,2021-05-05,wallstreetbets,gx16wal,I joined theta gang for less than $100 so I can buy myself a nice chicken sandwich in 5 months,t3_n5cc1t,9
1620226807.0,2021-05-05,wallstreetbets,gx17dfw,It's Wednesday my dudes!,t3_n5cc1t,11
1620227562.0,2021-05-05,wallstreetbets,gx1964v,"All my stocks suck fat fuckin dick. Hopefully RKT, and VIAC have good earnings this week.",t3_n5cc1t,10
1620228050.0,2021-05-05,wallstreetbets,gx1abyy,"another day for pltr to do us wrong, boys",t3_n5cc1t,10
1620228359.0,2021-05-05,wallstreetbets,gx1b2nh,happy cinco de mayo everyone,t3_n5cc1t,11
1620231332.0,2021-05-05,wallstreetbets,gx1idrk,"I’m up big time on CRSR, I’m buying 40 calls also fuck it.  All in",t3_n5cc1t,11
1620231352.0,2021-05-05,wallstreetbets,gx1iflc,AMD you're supposed to be up 2.5% in case no one told you,t3_n5cc1t,8
1620231374.0,2021-05-05,wallstreetbets,gx1ihgf,Stocks...I'm starting to think that maybe I am not good at this particular activity.,t3_n5cc1t,10
1620231910.0,2021-05-05,wallstreetbets,gx1jt18,Team $RKT blasting off again,t3_n5cc1t,8
1620233079.0,2021-05-05,wallstreetbets,gx1mp59,RKT is mooning..... It's up 7 cents 🙄,t3_n5cc1t,10
1620233186.0,2021-05-05,wallstreetbets,gx1myvd,People still beholding PLTR 👀,t3_n5cc1t,10
1620233450.0,2021-05-05,wallstreetbets,gx1nmwi,Up $20k on RKT calls. $200k more to Lambo 🤗,t3_n5cc1t,10
1620233462.0,2021-05-05,wallstreetbets,gx1no0p,"Goddamnit I am holding these RKT calls thru earnings, aren’t I. Fuck me",t3_n5cc1t,11
1620234288.0,2021-05-05,wallstreetbets,gx1pq4e,Because AMD closed barely green yesterday it’s time to dump to hell. Fuck this,t3_n5cc1t,10
1620234393.0,2021-05-05,wallstreetbets,gx1pzea,Today years old when I really realized that the markets are manipulated,t3_n5cc1t,10
1620234580.0,2021-05-05,wallstreetbets,gx1qftk,"Remember a few months ago when everyone here was writing erotic friend fiction about Cathie. Saying how she was an investment god, Wanting her to take a dump on them and whatnot.

Well you tired of getting shit on yet?",t3_n5cc1t,10
1620235128.0,2021-05-05,wallstreetbets,gx1rrv2,When I start investing in stocks my goal was to earn money without doing nothing... im now loosing money without doing nothing :),t3_n5cc1t,11
1620235258.0,2021-05-05,wallstreetbets,gx1s368,Weed stocks do something,t3_n5cc1t,9
1620235452.0,2021-05-05,wallstreetbets,gx1sjtr,PLTR your moms a hoe,t3_n5cc1t,10
1620236203.0,2021-05-05,wallstreetbets,gx1uc6e,[deleted],t3_n5cc1t,10
1620236333.0,2021-05-05,wallstreetbets,gx1un1o,can we please go back to free money december now,t3_n5cc1t,9
1620236338.0,2021-05-05,wallstreetbets,gx1unfd,"I just want like.... 5 million, and I’ll be happy... is that too much to ask for?",t3_n5cc1t,11
1620236653.0,2021-05-05,wallstreetbets,gx1vekb,Who else has RKT FDs?,t3_n5cc1t,10
1620237886.0,2021-05-05,wallstreetbets,gx1ybr9,"If AMD was the same PE as NVDA, we’d be trading at 170

AMD is making revenues almost near NVDA revenues",t3_n5cc1t,11
1620238778.0,2021-05-05,wallstreetbets,gx20epz,ASO 🚀,t3_n5cc1t,9
1620238810.0,2021-05-05,wallstreetbets,gx20hg8,[deleted],t3_n5cc1t,10
1620239325.0,2021-05-05,wallstreetbets,gx21oms,PLTR is such hot garbage. Fuck.,t3_n5cc1t,9
1620239399.0,2021-05-05,wallstreetbets,gx21uw8,"Is it true ARK Fund is now merged into Waste Management Service?

Otherwise, why is Cathie keep picking up garbage?",t3_n5cc1t,11
1620239590.0,2021-05-05,wallstreetbets,gx22au6,Expecting the entire market to tank on the news that zjz has disabled his bots,t3_n5cc1t,10
1620239618.0,2021-05-05,wallstreetbets,gx22d5b,i hate this market so much omg,t3_n5cc1t,10
1620239744.0,2021-05-05,wallstreetbets,gx22nuy,"Deep inhale* 
Market is fake and gay",t3_n5cc1t,10
1620239824.0,2021-05-05,wallstreetbets,gx22ulz,"amd stands for:

ALWAYS MOVING DOWN",t3_n5cc1t,9
1620240107.0,2021-05-05,wallstreetbets,gx23ioy,Questioning why I bothered trying to make investing/trading decisions and didn’t just buy a coin with a dog a few months ago so I could have retired by now. Playing the wrong game at the casino 🎰,t3_n5cc1t,10
1620241645.0,2021-05-05,wallstreetbets,gx275bp,[deleted],t3_n5cc1t,10
1620242171.0,2021-05-05,wallstreetbets,gx28e2h,“ Dow jumps 120 points”.... HOW .... WHAT STOCK IS ACTUALLY UP CAUSE IT AINT IN MY PORTFOLIO,t3_n5cc1t,11
1620242574.0,2021-05-05,wallstreetbets,gx29cnw,"If it keeps going like this, i'll only be losing hundreds per day, not thousands... so i have that going for me.",t3_n5cc1t,10
1620243159.0,2021-05-05,wallstreetbets,gx2aroo,[deleted],t3_n5cc1t,10
1620243474.0,2021-05-05,wallstreetbets,gx2bj5i,How does the market hit so many highs while everything I own goes red everyday,t3_n5cc1t,10
1620244000.0,2021-05-05,wallstreetbets,gx2crpn,What’s the best stock to hold for the quickest -90% return?,t3_n5cc1t,10
1620244151.0,2021-05-05,wallstreetbets,gx2d502,"Markets fucked

Get out",t3_n5cc1t,10
1620244277.0,2021-05-05,wallstreetbets,gx2dg5i,I’m losing so much fucking money fam,t3_n5cc1t,10
1620244471.0,2021-05-05,wallstreetbets,gx2dwuu,That's it; Finish me off; Sell into that bell and finish the job,t3_n5cc1t,9
1620244577.0,2021-05-05,wallstreetbets,gx2e5tj,My tech can’t go down tomorrow right? Surely there is a bounce tomorrow... 🤡,t3_n5cc1t,11
1620244637.0,2021-05-05,wallstreetbets,gx2eavw,"Whelp, I made 4 bucks today. Drinks on me bois!",t3_n5cc1t,9
1620244813.0,2021-05-05,wallstreetbets,gx2epx3,All right RKTards. It’s show time. Show me the tendies.,t3_n5cc1t,10
1620244828.0,2021-05-05,wallstreetbets,gx2er7r,Went for rkt. Hoping for the best.,t3_n5cc1t,10
1620244935.0,2021-05-05,wallstreetbets,gx2f0e1,Never will I EVER play options on MARA or RIOT again. Holy shit those stonks are garbage,t3_n5cc1t,11
1620245017.0,2021-05-05,wallstreetbets,gx2f7gw,Ok RKT I’m ready for this. Let’s see some action.,t3_n5cc1t,11
1620245360.0,2021-05-05,wallstreetbets,gx2g0t1,RKT might be a penny stock in 20 minutes,t3_n5cc1t,10
1620245462.0,2021-05-05,wallstreetbets,gx2g9eg,I think RKT missed earnings estimates,t3_n5cc1t,10
1620245870.0,2021-05-05,wallstreetbets,gx2h8al,Calls on RKT Q2 earnings for all the people who will be refinancing their mortgages after this earnings call.,t3_n5cc1t,11
1620245951.0,2021-05-05,wallstreetbets,gx2hfl9,I hate this market,t3_n5cc1t,10
1620209660.0,2021-05-05,wallstreetbets,gx0ddlz,Post above this is gay,t3_n5cc1t,140
1620218594.0,2021-05-05,wallstreetbets,gx0q1gn,Apple green or i skull fuck my goldfish.,t3_n5cc1t,32
1620218597.0,2021-05-05,wallstreetbets,gx0q1mw,[removed],t3_n5cc1t,33
1620219164.0,2021-05-05,wallstreetbets,gx0r3n5,[deleted],t3_n5cc1t,31
1620221212.0,2021-05-05,wallstreetbets,gx0v201,[deleted],t3_n5cc1t,31
1620230454.0,2021-05-05,wallstreetbets,gx1g8sa,this sub is fully compromised,t3_n5cc1t,30
1620211112.0,2021-05-05,wallstreetbets,gx0f105,When does Yellen speak again? Asking for Burry.,t3_n5cc1t,8
1620212151.0,2021-05-05,wallstreetbets,gx0ga2g,"OK CLOV you can stop joking around now, its not funny anymore.",t3_n5cc1t,8
1620212991.0,2021-05-05,wallstreetbets,gx0hd1x,Everyone and their mother knows that rates are going to rise. Why on earth would that not be priced in already.,t3_n5cc1t,9
1620213841.0,2021-05-05,wallstreetbets,gx0ihzl,Gonna play some rocket league today,t3_n5cc1t,9
