created,date,subreddit,id,body,parent_id,score
1602764281.0,2020-10-15,wallstreetbets,g8w4214,"My apple calls i paid $6400 for is now worth $12

🤪🤪🤪

Diamond hanz from $5.40 to $0.01🤪🤪🤪",t3_jbktdv,183
1602768048.0,2020-10-15,wallstreetbets,g8w9k0g,Cardi b’s nipples were the glue holding this market together,t3_jbktdv,105
1602758755.0,2020-10-15,wallstreetbets,g8vxvg6,"Morgan Stanley just cut AMZN price target from 3750 to 3740. 

Hahahahahaha a ten whole dollars. The analyst is gonna have a job that pays $10.",t3_jbktdv,99
1602757160.0,2020-10-15,wallstreetbets,g8vwejb,All I want is one of those trades where I go all in and make 3k% profit and a movie where Christian Bale plays me. Is that too much to ask?,t3_jbktdv,89
1602767109.0,2020-10-15,wallstreetbets,g8w82mw,"Her: babe come over 

Me: can’t market opens soon

Her: but my parents aren’t home

Me: UVXY is up 7% pre market",t3_jbktdv,79
1602763426.0,2020-10-15,wallstreetbets,g8w2yxd,"My favorite part of deep red days is watching people try and ""coach"" their shitty position like it is in a fucking Little League game.  ""Yeah, you can do it 10/16 AAPL $135C!"".",t3_jbktdv,143
1602764628.0,2020-10-15,wallstreetbets,g8w4ijd,Zoom out guys. We‘re in a bull run since 1929.,t3_jbktdv,68
1602759674.0,2020-10-15,wallstreetbets,g8vyrqf,[deleted],t3_jbktdv,138
1602757318.0,2020-10-15,wallstreetbets,g8vwjpt,"$AMZN PT Lowered to $3,740 from $3,750 at Morgan Stanley

It's over.",t3_jbktdv,58
1602759190.0,2020-10-15,wallstreetbets,g8vyafw,##I would like to speak to the NASDAQ manager,t3_jbktdv,120
1602758590.0,2020-10-15,wallstreetbets,g8vxpu6,"Remember: 
Drink water often &
Stretch your cock for maximum length",t3_jbktdv,119
1602762618.0,2020-10-15,wallstreetbets,g8w1zhv,"When our currency loses all value and unemployment goes to 100%, people will still need luxury electric cars. TSLA 800c 10/16.",t3_jbktdv,56
1602757577.0,2020-10-15,wallstreetbets,g8vws5m,Good thing none of us have calls.  Can you imagine if we did?,t3_jbktdv,55
1602784525.0,2020-10-15,wallstreetbets,g8x5csh,[deleted],t3_jbktdv,50
1602759136.0,2020-10-15,wallstreetbets,g8vy8iw,Every day was Shrek dildos till that asshole came in this sub with his stretched cock and ruined it all. God has forsaken WSB.,t3_jbktdv,47
1602761809.0,2020-10-15,wallstreetbets,g8w115e,ah yes one of those don't log into the account days,t3_jbktdv,49
1602765026.0,2020-10-15,wallstreetbets,g8w51qt,[deleted],t3_jbktdv,49
1602765868.0,2020-10-15,wallstreetbets,g8w67w9,"Whenever I saw people post "" I will never financially recover from this "" I thought it was just posted for fun or jokes. But now I know it is the harsh reality of this forum.  99% wont financially recover and now I am part of the 99% after today open.",t3_jbktdv,49
1602762488.0,2020-10-15,wallstreetbets,g8w1ts8,"As a millennial that created this overpriced stock market, I wonder what economic disaster or global atrocities I'll have the honor of being blamed for next week",t3_jbktdv,124
1602757708.0,2020-10-15,wallstreetbets,g8vwwfi,Just sign the 3 trillion already I cannot take it,t3_jbktdv,38
1602758985.0,2020-10-15,wallstreetbets,g8vy3af,Gre.... Green by open? 🥺👉👈,t3_jbktdv,77
1602764256.0,2020-10-15,wallstreetbets,g8w40wa,[deleted],t3_jbktdv,39
1602766450.0,2020-10-15,wallstreetbets,g8w72ij,"My spy 344 put expired worthless yesterday. 

Always a day late and a dollar short. 

🤡🤡🤡🤡🤡🤡🤡🤡🤡",t3_jbktdv,33
1602765470.0,2020-10-15,wallstreetbets,g8w5nkt,"Unemployment rising again, lockdowns happening all around the world again, hopes for a second stimulus or a vaccine as dim as ever, election frenzy...

Green by EOD",t3_jbktdv,66
1602757204.0,2020-10-15,wallstreetbets,g8vwfyg,If you weren’t here in March imagine this but 10 times crazier,t3_jbktdv,68
1602759489.0,2020-10-15,wallstreetbets,g8vyl5b,you would never guess that i have a bachelor of science in economics by looking at my RH portfolio,t3_jbktdv,67
1602761636.0,2020-10-15,wallstreetbets,g8w0u5y,Nothing worse than seeing a nice dip and having $7.10 in buying power.,t3_jbktdv,33
1602782006.0,2020-10-15,wallstreetbets,g8x08xa,I trade GME for a living,t3_jbktdv,31
1602784932.0,2020-10-15,wallstreetbets,g8x66cj,"My manager was talking about buying SPY puts so I assumed he browsed here. I proceeded to call him a ""gay bear"" then laugh, he didn't laugh back. He had no clue what I was talking about now I have a meeting with HR tomorrow.",t3_jbktdv,35
1602762653.0,2020-10-15,wallstreetbets,g8w2126,"There's a lot of rigged shit in the market, but earnings are the most rigged. The estimates are just set by analysts.


They can literally lower the estimates by 50% since last quarter, then the company beats it, and everyone loses their mind because they ""CRUSHED EARNINGS""

There should be no estimates, and the headlines should all be % change from same quarter last year.",t3_jbktdv,84
1602757111.0,2020-10-15,wallstreetbets,g8vwd0g,Ya about to see the power of fake job numbers at 8:30,t3_jbktdv,36
1602764408.0,2020-10-15,wallstreetbets,g8w4830,"Morgan Stanley beats expectations by a lot, immediately drops 2%.",t3_jbktdv,24
1602766411.0,2020-10-15,wallstreetbets,g8w70eu,[deleted],t3_jbktdv,24
1602772369.0,2020-10-15,wallstreetbets,g8wh2nk,"Bought 10 Apple shares 

Swing traded it made 2.10$ 


I am a monster ...",t3_jbktdv,27
1602779500.0,2020-10-15,wallstreetbets,g8wv5gn,I do nothing but smoke weed and stare at AAPL during my work at home job. Rona is the greatest thing ever! fuck the office,t3_jbktdv,27
1602788076.0,2020-10-15,wallstreetbets,g8xcgl3,GME is finally giving back our money from those used games trade ins,t3_jbktdv,25
1602758598.0,2020-10-15,wallstreetbets,g8vxq5d,It spooks me that the market is so red and there is a headline on CNBC’s website that says “nightmare stock valuations drive by young dumb investors.” Who could he possibly be referring to?,t3_jbktdv,22
1602765310.0,2020-10-15,wallstreetbets,g8w5fpf,"My account is stairs up, elevator down. Weeks worth of gains all destroyed this week lol. Hope my tickers recover by nov 2",t3_jbktdv,25
1602766662.0,2020-10-15,wallstreetbets,g8w7e7t,I go to the gym during open so I don’t do retarded shit,t3_jbktdv,23
1602775284.0,2020-10-15,wallstreetbets,g8wmp34,"none of this bad news is enough to strain the backbone of the american economy

exercise bikes with ipads on them",t3_jbktdv,24
1602777495.0,2020-10-15,wallstreetbets,g8wr4og,CNN Business has a NIO median forecast of $135.47 and a high forecast of $269.54 a year out LOL 🚀🚀🚀,t3_jbktdv,23
1602781569.0,2020-10-15,wallstreetbets,g8wzd6q,[deleted],t3_jbktdv,22
1602765627.0,2020-10-15,wallstreetbets,g8w5vid,[deleted],t3_jbktdv,20
1602785075.0,2020-10-15,wallstreetbets,g8x6gqt,"[gaining $20 on stock options] ah another excellent day for the stock master

[losing $2,000 on stock options] that's okay. i learned an important lesson in risk tolerance today",t3_jbktdv,22
1602787722.0,2020-10-15,wallstreetbets,g8xbqtc,[deleted],t3_jbktdv,43
1602765699.0,2020-10-15,wallstreetbets,g8w5z9c,I didn’t want money today anyways,t3_jbktdv,21
1602769947.0,2020-10-15,wallstreetbets,g8wcpnw,Just tried selling GME for 50% profit. Accidentally bought more and now I’m out of day trades lol. Guess I’m here to stay...,t3_jbktdv,21
1602772196.0,2020-10-15,wallstreetbets,g8wgqxj,"Im Jerome Powell and Im Steve Mnuchin

and this is Jackass",t3_jbktdv,21
1602761286.0,2020-10-15,wallstreetbets,g8w0fyb,Green by open. Market is a joke.,t3_jbktdv,20
1602763118.0,2020-10-15,wallstreetbets,g8w2lei,Hopped over to r/thetagang and they said I can't join if I don't swear off FaggyDelights and become a castrated eunuch.,t3_jbktdv,18
1602767066.0,2020-10-15,wallstreetbets,g8w809j,"CNBC asked the United CEO: “what if there are more lockdowns?”

He took a big pause.

He’s like, “MF we go bankrupt.”",t3_jbktdv,21
1602777065.0,2020-10-15,wallstreetbets,g8wq9ds,[deleted],t3_jbktdv,20
1602781006.0,2020-10-15,wallstreetbets,g8wy83t,the whole family's getting gamestop giftcards for christmas this year,t3_jbktdv,21
1602792030.0,2020-10-15,wallstreetbets,g8xkco2,Holy fuck wtf was today.,t3_jbktdv,20
1602759114.0,2020-10-15,wallstreetbets,g8vy7qc,"Reddit switched back to the orange logo, we have finally defeated racism.",t3_jbktdv,59
1602762610.0,2020-10-15,wallstreetbets,g8w1z5w,[deleted],t3_jbktdv,17
1602772476.0,2020-10-15,wallstreetbets,g8wh9td,"I’ve watched NIO rise from 10 fucking dollars and every week I think I’ll enter a position 

And I never fucking do 

I hate myself I’m disgusting",t3_jbktdv,18
1602780523.0,2020-10-15,wallstreetbets,g8wx8a6,"lmao don't feel jealous of the people posting 100% - 600% profit on a single play.  
  
what they don't show is their all-time account being down 90%",t3_jbktdv,19
1602781254.0,2020-10-15,wallstreetbets,g8wyqck,"Bought both NIO and GME at open, NIO when it was dropping

Past 10:00, GME was dipping hard, lost 20%, NIO was shooting up, up 60%

Sold all GME to buy more NIO.

Just went red for the day

Guess who's retarded?",t3_jbktdv,19
1602759827.0,2020-10-15,wallstreetbets,g8vyx4j,[deleted],t3_jbktdv,37
1602757851.0,2020-10-15,wallstreetbets,g8vx15s,when I play options... usually I get down big and just hope to break even or lose less by the end of the day.,t3_jbktdv,20
1602764336.0,2020-10-15,wallstreetbets,g8w44m0,"This is a bull market. So this is a bear trap, right? 🤡 🤡",t3_jbktdv,20
1602766376.0,2020-10-15,wallstreetbets,g8w6yhv,"Don’t get me wrong, I love NIO and I’m holding it for a long time - but who the fuck is buying it after a 22% gain? You are begging to get fucked by MMs",t3_jbktdv,16
1602766729.0,2020-10-15,wallstreetbets,g8w7hu8,The bearish sentiment here means I should buy calls at open. Thanks guys,t3_jbktdv,17
1602784488.0,2020-10-15,wallstreetbets,g8x5a0f,Raise your hand if you are supposed to work but glued to the screen hoping your chart just moons for god sake.,t3_jbktdv,19
1602787861.0,2020-10-15,wallstreetbets,g8xc0zt,"Everyone who bet against GME and hollered ""FoMo"" eat a dick",t3_jbktdv,18
1602790257.0,2020-10-15,wallstreetbets,g8xguc6,"This is really what a green day looks like, eh?

Morning: **Why are we down 300? I dunno, stimulus bad or something**

Afternoon: **Why are we up now? Did stimulus change? Nah, GME to $15 or something lol**",t3_jbktdv,18
1602792054.0,2020-10-15,wallstreetbets,g8xkedn,"This morning:😳
This afternoon:😎",t3_jbktdv,19
1602758005.0,2020-10-15,wallstreetbets,g8vx68y,Fucking France on lockdown again 😨,t3_jbktdv,17
1602765973.0,2020-10-15,wallstreetbets,g8w6dbj,"Bear or bull.
Winner or loser.
I think we can ALL agree that
what’s most important is that we’re all in dis dump TOGETHER 🤗",t3_jbktdv,17
1602766310.0,2020-10-15,wallstreetbets,g8w6v1c,Jim Cramer literally goes from bull to bear and back twice in every fucking sentence.,t3_jbktdv,17
1602766547.0,2020-10-15,wallstreetbets,g8w77v9,"Advice for anyone not around for September. If today is red, hold off on ""buying the dip."" You don't know how low it might go or for how long, half this sub got wiped out that last month chasing never ending dips. Not much reason still to expect continued all time highs, so just be conservative and be careful.

Just wait it out for a return to an uptrend.",t3_jbktdv,16
1602776965.0,2020-10-15,wallstreetbets,g8wq1xx,GME TO THE MOON WEÉEEEEEEEEEÉEE,t3_jbktdv,18
1602776989.0,2020-10-15,wallstreetbets,g8wq3pc,GameStop from the sidelines is amazing. Godspeed you melons,t3_jbktdv,17
1602792043.0,2020-10-15,wallstreetbets,g8xkdlf,GG fellow bulls we did it. We held the FUCKING LINE TODAY,t3_jbktdv,17
1602793104.0,2020-10-15,wallstreetbets,g8xmfgc,You don't have to report gains on your taxes if you don't have any 💪,t3_jbktdv,17
1602764052.0,2020-10-15,wallstreetbets,g8w3rd4,Robbinhood needs a comment section under stocks like yahoo finance,t3_jbktdv,37
1602762356.0,2020-10-15,wallstreetbets,g8w1o8o,"earnings reports of importance this morning (so far - will edit as more ERs are released):

**Morgan Stanley Q3 Earnings**

-Q3 Adj. EPS $1.59 (est $1.28)

-Q3 Revenue $11.7 Bln (est $10.6 Bln)

-Q3 FICC Revenue $1.92 Bln (est $1.70 Bln)

**Walgreens Boots Alliance** 

Q4 Adj. EPS $1.02 Beats $0.96 Estimate

Revenues $34.70B Beat $34.37B Estimate

**Taiwan Semiconductor Manufacturing (TSM)**

Q3 Adj. EPS $0.90 Misses $0.92 Estimate

Revenues $12.1B Misses $12.5B Estimate

EDIT: seeing conflicting numbers for TSM. the above is from earnings whisper but some reports are saying they beat
>Analysts expected the company to earn 81 cents a share on sales of $11.93 billion, according to S&P Global Market Intelligence.",t3_jbktdv,16
1602767265.0,2020-10-15,wallstreetbets,g8w8bc0,Looks like I picked a bad day to stop smoking crack,t3_jbktdv,18
1602773812.0,2020-10-15,wallstreetbets,g8wjtxc,"To all of you selling NIO, fuck you",t3_jbktdv,16
1602774380.0,2020-10-15,wallstreetbets,g8wkxvf,"Me: I’m selling at the next peak. I can’t take this.
    
Also me: it can go higher",t3_jbktdv,16
1602778128.0,2020-10-15,wallstreetbets,g8wsdy5,did my part and increased my GME shares to 1k,t3_jbktdv,15
1602787872.0,2020-10-15,wallstreetbets,g8xc1r8,Why the fuck did I just buy 1dte GME calls with 200% IV,t3_jbktdv,14
1602790092.0,2020-10-15,wallstreetbets,g8xgil9,Let’s do it. Let’s end green just like our ancestors would have wanted,t3_jbktdv,15
1602759744.0,2020-10-15,wallstreetbets,g8vyu85,"What do you guys use to find these meme stonks that ass-blast +/- 20%? 

I mean I use stock screeners and shit, but they mostly track trends and fundamentals. Every day there are some random-ass stocks up like 20% and I have no idea how anyone could see it coming. And yet there's always a handful of you retards on some obscure stock when it blasts.",t3_jbktdv,14
1602762993.0,2020-10-15,wallstreetbets,g8w2fwk,NIO still green in this sea of red,t3_jbktdv,16
1602765174.0,2020-10-15,wallstreetbets,g8w58xs,Man this market is so stupid stressful sometimes. It goes up when you least expect it to and then once you capitulate and say fuck I’m in it decides to tank. Stay strong brothers.,t3_jbktdv,15
1602765335.0,2020-10-15,wallstreetbets,g8w5gxw,I will never financially recover from this..,t3_jbktdv,13
1602765602.0,2020-10-15,wallstreetbets,g8w5u89,I’m a bull but I often have hedges and there’s something really satisfying about puts hitting,t3_jbktdv,15
1602765884.0,2020-10-15,wallstreetbets,g8w68qc,I turned the bed in another direction and i feel like i live in a new house. I am truly retarded,t3_jbktdv,17
1602766361.0,2020-10-15,wallstreetbets,g8w6xqo,"Wait so this sub says a red day means Wall Street wants Biden but a green day means a Biden victory is priced in?

🤔🤔🤔",t3_jbktdv,16
1602766969.0,2020-10-15,wallstreetbets,g8w7uzm,NIO is fighting so hard. I’m proud of my boy,t3_jbktdv,15
1602774232.0,2020-10-15,wallstreetbets,g8wknjg,"Alright boys.

Account down 90%.

Making it all back the non-retarded way will take too long.

Give me that 10 bagger to risk it all on.",t3_jbktdv,16
1602777050.0,2020-10-15,wallstreetbets,g8wq88w,GME rallying the market,t3_jbktdv,15
1602778192.0,2020-10-15,wallstreetbets,g8wsihd,Trading options now is just high stakes minesweeper.,t3_jbktdv,14
1602779956.0,2020-10-15,wallstreetbets,g8ww2gx,Sorry GME shorts but im hoping u get margin called today,t3_jbktdv,16
1602782049.0,2020-10-15,wallstreetbets,g8x0c2d,"""GME too high"" says MF yesterday. ""Rally could be one day wonder"" says Investopedia a day ago. Lol",t3_jbktdv,15
1602782854.0,2020-10-15,wallstreetbets,g8x1z4i,"Let's be honest., who cares about the next president.

&#x200B;

All we want is a big stock market pump",t3_jbktdv,15
1602784224.0,2020-10-15,wallstreetbets,g8x4qqu,No alcohol gang,t3_jbktdv,15
1602786707.0,2020-10-15,wallstreetbets,g8x9pet,[deleted],t3_jbktdv,14
1602787149.0,2020-10-15,wallstreetbets,g8xal2g,"GME actually wasn't a bad play, hm, would you look at that.

&#x200B;

edit: Have no positions in it, but proud to see the boys make money off of it",t3_jbktdv,15
1602787355.0,2020-10-15,wallstreetbets,g8xb02f,#GME: Fuck your puts,t3_jbktdv,15
1602788148.0,2020-10-15,wallstreetbets,g8xclsu,Sector rotation into unprofitable video game stores!,t3_jbktdv,15
1602789274.0,2020-10-15,wallstreetbets,g8xevln,GME infinity squeeze ain’t even started yet.,t3_jbktdv,14
1602789805.0,2020-10-15,wallstreetbets,g8xfy0s,BUY GME YOU SHITS,t3_jbktdv,15
1602792029.0,2020-10-15,wallstreetbets,g8xkcks,"Honestly, I'll take that close. Could have been a lot worse.",t3_jbktdv,16
1602793782.0,2020-10-15,wallstreetbets,g8xnqwq,So I made 1300 dollars this week. It was a good week.,t3_jbktdv,15
1602799897.0,2020-10-15,wallstreetbets,g8xza5k,My best guess is tomorrow will be Friday. We will open in a certain direction but prices will fluctuate throughout the day. Some stocks will go down and others will go up.,t3_jbktdv,15
1602763706.0,2020-10-15,wallstreetbets,g8w3bf1,None of my friends in real life are as fun as you guys on here. Puts on my friendships.,t3_jbktdv,43
1602758860.0,2020-10-15,wallstreetbets,g8vxz00,My stop losses needed stop losses,t3_jbktdv,14
1602765405.0,2020-10-15,wallstreetbets,g8w5kc0,If I had a quarter for everytime stimulus talks were going well id have $1200 exactly,t3_jbktdv,14
1602765425.0,2020-10-15,wallstreetbets,g8w5ld8,Gonna lose so much at open. Why do I even hold weeklies overnight with this sketchy market,t3_jbktdv,15
1602765581.0,2020-10-15,wallstreetbets,g8w5t60,"NIO powering through 30 today?

My bong rips at 9:28 will decide its fate",t3_jbktdv,14
1602767079.0,2020-10-15,wallstreetbets,g8w80zp,"WSB says puts, I’m getting calls😎",t3_jbktdv,13
1602771140.0,2020-10-15,wallstreetbets,g8wety0,If the pres. doesn't get a 3 trillion dollar relief bill pass you can kiss stocks and his second term goodbye.,t3_jbktdv,14
1602776578.0,2020-10-15,wallstreetbets,g8wp9zh,Joe Biden just announced he is PREGNANT. Should we buy puts or calls ?,t3_jbktdv,12
1602778744.0,2020-10-15,wallstreetbets,g8wtm81,"MCCONNELL REJECTS ""HIGHER AMOUNT"" FOR COVID-19 STIMULUS, SAYS HIS PLANNED $500 BILLION BILL IS THE APPROPRIATE RESPONSE",t3_jbktdv,14
1602780066.0,2020-10-15,wallstreetbets,g8wwaki,GME dude could have broke even now if he diamond hand. F,t3_jbktdv,15
1602782013.0,2020-10-15,wallstreetbets,g8x09hu,Gme life saving guy please just close Robin Hood and take a walk,t3_jbktdv,14
1602787425.0,2020-10-15,wallstreetbets,g8xb59p,[deleted],t3_jbktdv,13
1602789055.0,2020-10-15,wallstreetbets,g8xefgj,"finally hit 100k. started with 40k a month ago with 0 knowledge. dropped down to 15k a couple times, but i hit my goal!!! spy, nio, gme weeklies were my best plays.",t3_jbktdv,14
1602789172.0,2020-10-15,wallstreetbets,g8xeo11,EVERYBODY BUY GME HOOOOOOOLLLDDDDD,t3_jbktdv,14
1602790738.0,2020-10-15,wallstreetbets,g8xhszx,Lmao there r a shit ton of GME calls expiring tm,t3_jbktdv,13
1602791066.0,2020-10-15,wallstreetbets,g8xigjo,huge green day incoming tomorrow,t3_jbktdv,14
1602792218.0,2020-10-15,wallstreetbets,g8xkpri,If TACO meets earnings i will mail everyone in this thread a Taco,t3_jbktdv,13
1602794850.0,2020-10-15,wallstreetbets,g8xpt2h,Today I lost $1.000 on my first day of trading thank you guys...,t3_jbktdv,14
1602760879.0,2020-10-15,wallstreetbets,g8vzzys,3 mile run to start the day. At least I have my health because today will financially hurt,t3_jbktdv,30
1602762748.0,2020-10-15,wallstreetbets,g8w254k,"Guys, I only trade MSFT on the 15 minute timeframe.  I have a massive dick and I’m damn good at trading.  Feel free to ask me about my insecurities.",t3_jbktdv,29
1602762792.0,2020-10-15,wallstreetbets,g8w270a,[deleted],t3_jbktdv,31
1602758106.0,2020-10-15,wallstreetbets,g8vx9q0,I picked a terrible day to come back.,t3_jbktdv,13
1602759159.0,2020-10-15,wallstreetbets,g8vy9b9,Dix once again proven to be a reliable indicator,t3_jbktdv,13
1602760110.0,2020-10-15,wallstreetbets,g8vz7fu,"Red October, standing by",t3_jbktdv,11
1602760588.0,2020-10-15,wallstreetbets,g8vzp2o,Who still hasn't slept?  West coast Gang!,t3_jbktdv,13
1602763364.0,2020-10-15,wallstreetbets,g8w2w65,[deleted],t3_jbktdv,13
1602765024.0,2020-10-15,wallstreetbets,g8w51nn,"Bul r Fuk... 

&#x200B;

and Im a bull",t3_jbktdv,12
1602765445.0,2020-10-15,wallstreetbets,g8w5mbs,We've seen this before - bullshit $2 pump straight vertical at open then bleed all day,t3_jbktdv,14
1602765450.0,2020-10-15,wallstreetbets,g8w5ml4,Lmao we open red and they scramble to get some “Stimulus talks going well!” sound bites out into the world,t3_jbktdv,14
1602766612.0,2020-10-15,wallstreetbets,g8w7bhe,"A friendly reminder to

Hydrate

Take a leak before the session",t3_jbktdv,13
1602767587.0,2020-10-15,wallstreetbets,g8w8to1,If I don’t look it’s not real,t3_jbktdv,13
1602767681.0,2020-10-15,wallstreetbets,g8w8yz1,Today is going to wipe out a lot of retards,t3_jbktdv,13
1602767783.0,2020-10-15,wallstreetbets,g8w94p2,[deleted],t3_jbktdv,12
1602770640.0,2020-10-15,wallstreetbets,g8wdxr9,"All financial advisors: invest in these passive index funds to gain 10% per year if you have high risk tolerance.

WSB: you wanna see some real speed, bitch?",t3_jbktdv,13
1602772194.0,2020-10-15,wallstreetbets,g8wgqsz,"""Hi Robinhood? I accidentally only typed in 1000$ for my NIO trade, I was supposed to type 100,000$, could you please adjust my balance accordingly?""",t3_jbktdv,14
1602775280.0,2020-10-15,wallstreetbets,g8wmot4,Bulls and bears band together. These market makers are pieces of shit,t3_jbktdv,13
1602777490.0,2020-10-15,wallstreetbets,g8wr4b1,"You all thought NIO ran out of fuel when in reality, that bitch runs on solar",t3_jbktdv,13
1602777833.0,2020-10-15,wallstreetbets,g8wrswy,Becky and her bike give no fuks,t3_jbktdv,12
1602777858.0,2020-10-15,wallstreetbets,g8wruni,"I don't mean to brag, but so far today I'm $5 closer to making back the $6k I lost.",t3_jbktdv,13
1602779270.0,2020-10-15,wallstreetbets,g8wuoq8,"Signs you are over leveraged:




You talk to the price telling it which way to go",t3_jbktdv,13
1602779891.0,2020-10-15,wallstreetbets,g8wvxuc,GME saving me from my AMD calls,t3_jbktdv,13
1602782102.0,2020-10-15,wallstreetbets,g8x0fxc,"I'm all in GME, but I have a feeling the actual squeeze won't start until next week Thursday/Friday",t3_jbktdv,12
1602784548.0,2020-10-15,wallstreetbets,g8x5eex,"NIO wants its respect, AAPL wants it respect and I want my damn respect too",t3_jbktdv,14
1602784597.0,2020-10-15,wallstreetbets,g8x5hxm,SPY pump looks sus as fuck.,t3_jbktdv,15
1602789209.0,2020-10-15,wallstreetbets,g8xeqpt,"I bought NIO and GME calls at open that expire tomorrow... I honestly feel dirty, I've been pulling in high end escort money all day off a straight up retard play...",t3_jbktdv,14
1602789693.0,2020-10-15,wallstreetbets,g8xfpy6,Momma I bought the dip 😍💪🏻,t3_jbktdv,13
1602757104.0,2020-10-15,wallstreetbets,g8vwcsh,I should be asleep.,t3_jbktdv,12
1602761243.0,2020-10-15,wallstreetbets,g8w0e86,This will be the ultimate green by open.,t3_jbktdv,12
1602762936.0,2020-10-15,wallstreetbets,g8w2dcf,Sell on red day buy on green days... right?,t3_jbktdv,11
1602763121.0,2020-10-15,wallstreetbets,g8w2lii,"London bridge is locking down, locking down, locking down.",t3_jbktdv,12
1602764411.0,2020-10-15,wallstreetbets,g8w4879,Red Thursday’s back on the menu,t3_jbktdv,12
1602765492.0,2020-10-15,wallstreetbets,g8w5op6,# BUY CALLS AT OPEN,t3_jbktdv,12
1602766248.0,2020-10-15,wallstreetbets,g8w6rpv,"WSB sentiment is very bearish. 

Loading up on calls it is.",t3_jbktdv,12
1602767104.0,2020-10-15,wallstreetbets,g8w82cv,"I fought the dip, and the dip won",t3_jbktdv,12
1602767569.0,2020-10-15,wallstreetbets,g8w8smg,New wsb members thinking this is red 🤡,t3_jbktdv,11
1602768719.0,2020-10-15,wallstreetbets,g8wan31,FUCK YOU GAY BEARS IM NOT SELLING!!!,t3_jbktdv,13
1602771177.0,2020-10-15,wallstreetbets,g8wewc1,"DJT uses stimulus pump.

It isn't very effective.",t3_jbktdv,13
1602771218.0,2020-10-15,wallstreetbets,g8wez1y,[deleted],t3_jbktdv,12
1602774230.0,2020-10-15,wallstreetbets,g8wknd3,Why are tire companies giving out stars to restaurants ?,t3_jbktdv,12
1602776816.0,2020-10-15,wallstreetbets,g8wpr6e,"Big play -42%

Small play +83% 

Every time",t3_jbktdv,11
1602776864.0,2020-10-15,wallstreetbets,g8wpul4,"Getting my local GME employees lunch tomorrow.

Here we go",t3_jbktdv,13
1602777456.0,2020-10-15,wallstreetbets,g8wr1sy,GME you beautiful son of a bitch,t3_jbktdv,11
1602777684.0,2020-10-15,wallstreetbets,g8wri70,3 hours of sleep gang wya?? 🤕,t3_jbktdv,12
1602778524.0,2020-10-15,wallstreetbets,g8wt6c2,[deleted],t3_jbktdv,11
1602779237.0,2020-10-15,wallstreetbets,g8wum9m,Lets just pass 4 $500 billion stimulus packages,t3_jbktdv,12
1602779896.0,2020-10-15,wallstreetbets,g8wvy5n,GME QUIETLY UP 11% lol XD,t3_jbktdv,13
1602781647.0,2020-10-15,wallstreetbets,g8wzisv,GameStop vaccine play bois,t3_jbktdv,12
1602781952.0,2020-10-15,wallstreetbets,g8x050t,[deleted],t3_jbktdv,12
1602782056.0,2020-10-15,wallstreetbets,g8x0cka,Apparently GME is up 100% for the last month. Big wow.,t3_jbktdv,12
1602783018.0,2020-10-15,wallstreetbets,g8x2b9g,I bought GME at the top twice now,t3_jbktdv,13
1602784667.0,2020-10-15,wallstreetbets,g8x5n39,"Sir, this is a GameStop, most I can offer to buyback your stock is $3.50",t3_jbktdv,13
1602785745.0,2020-10-15,wallstreetbets,g8x7seh,Ah the weekly switching of expectations from “bro these calls are gonna make me rich this week!” To “Christ I hope I can just get back to breakeven tomorrow”,t3_jbktdv,12
1602785978.0,2020-10-15,wallstreetbets,g8x898i,Forgot I owned 40 shares of Chipotle. Thanks Dad,t3_jbktdv,12
