created,date,subreddit,id,body,parent_id,score
1617220277.0,2021-03-31,wallstreetbets,gsy8mj0,Buying puts on my college grades,t3_mh2ryh,9
1617220451.0,2021-03-31,wallstreetbets,gsy9054,MVIS AH 🚀,t3_mh2ryh,10
1617220774.0,2021-03-31,wallstreetbets,gsy9pka,MVIS 🚀🚀,t3_mh2ryh,10
1617220922.0,2021-03-31,wallstreetbets,gsya1nf,CRAYONS DOWN 🖍,t3_mh2ryh,9
1617223563.0,2021-03-31,wallstreetbets,gsyftbm,"You will never be strong enough, cool enough, or confident enough to get a woman like Siggy Weave.",t3_mh2ryh,10
1617185896.0,2021-03-31,wallstreetbets,gswfgcy,Holding 3500 GME bought in at 40,t3_mh2ryh,30
1617190320.0,2021-03-31,wallstreetbets,gswkfgc,"PLTR is up 1.4% premarket.
IF EVEN PLTR IS UP BEARS R SO FUCK",t3_mh2ryh,28
1617192173.0,2021-03-31,wallstreetbets,gswmvzw,"Weed Gang Roll Call 🚬
$TLRY $APHA $SNDL $ACB",t3_mh2ryh,30
1617194054.0,2021-03-31,wallstreetbets,gswpnh0,"New York legalized it.

It's weed day, baby.",t3_mh2ryh,28
1617185124.0,2021-03-31,wallstreetbets,gsweog5,"Averaged down to sub 35 on plug yesterday at the bottom of the dip 👌🏻🦍🦍🚀 big things going on with this company, plug, nio, and gme dips are my go forever never selling forever buying lol",t3_mh2ryh,10
1617185301.0,2021-03-31,wallstreetbets,gsweusr,Papa joe needs to come out smoking a spliff and texting on a BB for our thread to recover,t3_mh2ryh,8
1617186177.0,2021-03-31,wallstreetbets,gswfqlo,My puts are fucked,t3_mh2ryh,9
1617187740.0,2021-03-31,wallstreetbets,gswhes3,"So you know how when a tsunami hits all the water recedes like Cramer's hairline?

Yeah I feel like we're standing on an oceanless beach right now.",t3_mh2ryh,8
1617188800.0,2021-03-31,wallstreetbets,gswiltp,"Called that portfolio epstein's island, nothing but miners ready to moon ⛏",t3_mh2ryh,8
1617188981.0,2021-03-31,wallstreetbets,gswitb1,SNAP investing in drones for those aerial tittie shots 👍,t3_mh2ryh,10
1617189292.0,2021-03-31,wallstreetbets,gswj6hb,"I've already been here for 6 hours. I've been to the gym, I had two poached eggs, and played blackjack with Harry Dean Stanton.",t3_mh2ryh,8
1617189817.0,2021-03-31,wallstreetbets,gswjtaz,ey yo we really buying steel for the biden talk?,t3_mh2ryh,9
1617189864.0,2021-03-31,wallstreetbets,gswjve3,AAPL $124 eod?,t3_mh2ryh,10
1617190300.0,2021-03-31,wallstreetbets,gswkemg,[deleted],t3_mh2ryh,10
1617191302.0,2021-03-31,wallstreetbets,gswlp6j,"Bought some Snap today, thats how you know I have failed in life.",t3_mh2ryh,9
1617192071.0,2021-03-31,wallstreetbets,gswmqv7,So glad I went all in on tech Monday morning sheesh. Rocket set to fly again babyyyyy,t3_mh2ryh,9
1617192215.0,2021-03-31,wallstreetbets,gswmy2u,The day Motley Fool praises GME is the day I'm selling it all,t3_mh2ryh,10
1617192533.0,2021-03-31,wallstreetbets,gswndzt,All I know is NOK will go down even when it's up.,t3_mh2ryh,8
1617193599.0,2021-03-31,wallstreetbets,gswoy29,Guys why is my portfolio this green color? I haven’t seen anything like it before. Why is my money going up and not down can someone explain.,t3_mh2ryh,10
1617194398.0,2021-03-31,wallstreetbets,gswq6rq,"Think I’m going to spice it up today, and go with some 1DTE TSLA FD’s as opposed to SPY.",t3_mh2ryh,9
1617194400.0,2021-03-31,wallstreetbets,gswq6vw,any of you pussies in MU calls or all just gme and pltr retards,t3_mh2ryh,9
1617194659.0,2021-03-31,wallstreetbets,gswqlyi,"Chipotle giving away free burritos and the forbidden coin tomorrow for burrito day 

Just heard on the radio, they said not an April fools joke, the odds of winning are on the website lol",t3_mh2ryh,8
1617194909.0,2021-03-31,wallstreetbets,gswr0lg,[deleted],t3_mh2ryh,9
1617196038.0,2021-03-31,wallstreetbets,gswsw0i,"[when I see the whole pre market is green, something’s fucky](https://m.imgur.com/r/gifs/IgU4Y)",t3_mh2ryh,9
1617196039.0,2021-03-31,wallstreetbets,gswsw1d,Another 10% day to put the bears in the dirt,t3_mh2ryh,8
1617196061.0,2021-03-31,wallstreetbets,gswsxci,"Premarket looks good
Bears R fuk lessgo",t3_mh2ryh,9
1617196076.0,2021-03-31,wallstreetbets,gswsyba,Can we just have like 8 green days in a row for early May earnings? I promise to lose all my gains the week leading up to them.,t3_mh2ryh,9
1617196293.0,2021-03-31,wallstreetbets,gswtbz7,Why does a green premarket make me nervous 🤔,t3_mh2ryh,10
1617196524.0,2021-03-31,wallstreetbets,gswtqiu,This is just a warm up for April 🚀🚀🚀starting tomorrow!,t3_mh2ryh,9
1617196876.0,2021-03-31,wallstreetbets,gswud7w,WE WANT THE CASINO OPEN NOW WE WANT IT NOW,t3_mh2ryh,9
1617196937.0,2021-03-31,wallstreetbets,gswuh8f,Anyone else think it's funny that Biden's speech is at 4:20 today?,t3_mh2ryh,9
1617197503.0,2021-03-31,wallstreetbets,gswviaq,If spy hits 400 today I’ll go to the gym and approach a female,t3_mh2ryh,9
1617197732.0,2021-03-31,wallstreetbets,gswvx41,TSLA 700 EOD,t3_mh2ryh,9
1617197743.0,2021-03-31,wallstreetbets,gswvxx7,What if we just went up all day long and went past Jan ATHs today?  PLTR RKT FUbO,t3_mh2ryh,9
1617197774.0,2021-03-31,wallstreetbets,gsww001,BB ripping... wait no... what I meant to say is: RIP BB,t3_mh2ryh,9
1617197878.0,2021-03-31,wallstreetbets,gsww6xo,APHA lift... 🚀🚀🚀🚀🚀,t3_mh2ryh,9
1617197953.0,2021-03-31,wallstreetbets,gswwbzg,When AAPL announces their new EV along with iWeed after legalization we are going to fucking andromeda,t3_mh2ryh,11
1617198410.0,2021-03-31,wallstreetbets,gswx6tk,AM I ABOUT TO MAKE MONEY OFF APHA CALLS?!?!?!?1?,t3_mh2ryh,9
1617198444.0,2021-03-31,wallstreetbets,gswx95m,TilRay about to break $24 🚀🚀🚀🚀🚀,t3_mh2ryh,9
1617198468.0,2021-03-31,wallstreetbets,gswxatu,TLRY really mooning today,t3_mh2ryh,9
1617198548.0,2021-03-31,wallstreetbets,gswxg9y,TLRY lets fuggin goooooo,t3_mh2ryh,8
1617198548.0,2021-03-31,wallstreetbets,gswxgan,"I’m doubling down on my BB 11$ calls for 6/18. Premium is cheapest it’s been in a while.

Because if I’ve learned one thing in stocks this year, it’s that - if you’re wrong just double down over and over again until you’ve found financial ruin that takes the whole market with you",t3_mh2ryh,10
1617198773.0,2021-03-31,wallstreetbets,gswxvpm,VIAC killing me thanks,t3_mh2ryh,9
1617199160.0,2021-03-31,wallstreetbets,gswymu1,APHA at least back to $30 by the 4/20 merger. Calling it now.,t3_mh2ryh,8
1617199602.0,2021-03-31,wallstreetbets,gswzhpf," PLTR...   BRRRR!  LAST CALL...

HOUSTON, BEGIN THE COUNTDOWN!!!",t3_mh2ryh,9
1617199620.0,2021-03-31,wallstreetbets,gswziyz,"Palantir Demo day today, earnings coming...I feel good",t3_mh2ryh,10
1617199736.0,2021-03-31,wallstreetbets,gswzr7w,"PLTR breaks $23 😆

Let’s fly",t3_mh2ryh,10
1617199842.0,2021-03-31,wallstreetbets,gswzytl,"I finally have enough karma to post...I waited until it hit 69 for posterity. That being said, I’ve been enjoying all my lurking and the amount of info I have absorbed in that time. Thank you all!

Now if only I can turn that karma into some proper impulse purchases, I’ll be golden.",t3_mh2ryh,10
1617200501.0,2021-03-31,wallstreetbets,gsx1b4c,Man... I always have this problem... Option that's expiring tomorrow is up 400%... Do I sell and lock in a huge profit or pray for a lambo tomorrow... I always chose the lambo. I don't own a lambo yet.,t3_mh2ryh,11
1617201356.0,2021-03-31,wallstreetbets,gsx32of,SQ gang reporting for duty in the war against ber,t3_mh2ryh,8
1617201365.0,2021-03-31,wallstreetbets,gsx33fw,The fact that I picked Disca over Discb is gonna give me an aneurysm,t3_mh2ryh,10
1617201552.0,2021-03-31,wallstreetbets,gsx3hgm,"Bruh, I think we might have turned a corner. It's been a very tough month and a half, but I think April is going to be ripping.",t3_mh2ryh,8
1617201858.0,2021-03-31,wallstreetbets,gsx44jt,this is weird i'm not losing money,t3_mh2ryh,9
1617201917.0,2021-03-31,wallstreetbets,gsx48zi,Ignoring red flags like ⚫️👄⚫️,t3_mh2ryh,10
1617201919.0,2021-03-31,wallstreetbets,gsx494o,[deleted],t3_mh2ryh,10
1617202180.0,2021-03-31,wallstreetbets,gsx4stj,"Just short food stocks. In 10 years we won't need food because we will evolve, therefore most food companies will bankrupt and delist. My neighbor Kai hasn't eaten 15 days, he evolved. He only needs sun, water, THC and yoga.",t3_mh2ryh,9
1617202354.0,2021-03-31,wallstreetbets,gsx560z,So can disca do the same thing as B? I’m about to get retarded,t3_mh2ryh,9
1617202748.0,2021-03-31,wallstreetbets,gsx60f8,Why am I so Gay?,t3_mh2ryh,8
1617202854.0,2021-03-31,wallstreetbets,gsx68ig,just shotgunned a 0.5liter redbull with 2 scoops of pre. I can smell colors now,t3_mh2ryh,8
1617202958.0,2021-03-31,wallstreetbets,gsx6geu,Cathie charging my tesla right now. Just wanted to say RIP bers. You won't be missed.,t3_mh2ryh,10
1617203245.0,2021-03-31,wallstreetbets,gsx72ey,"VIAC 4/09 50c

Hahaha, not even sweating yet. 

&#x200B;

&#x200B;

&#x200B;

^(Help I'm fucking dying.)",t3_mh2ryh,9
1617203255.0,2021-03-31,wallstreetbets,gsx7350,why tf does discovery have 10 tickers,t3_mh2ryh,10
1617203353.0,2021-03-31,wallstreetbets,gsx7aso,AAPL options are the absolute biggest scam on this earth.,t3_mh2ryh,9
1617203748.0,2021-03-31,wallstreetbets,gsx85hp,NY officially legalized,t3_mh2ryh,10
1617203883.0,2021-03-31,wallstreetbets,gsx8g34,Was I the only one unaware about discover?,t3_mh2ryh,9
1617204028.0,2021-03-31,wallstreetbets,gsx8rg8,Wtf is DiscB doing...??,t3_mh2ryh,10
1617204340.0,2021-03-31,wallstreetbets,gsx9fzz,"Biden's speech is at 4:20 PM, very bullish on weed.",t3_mh2ryh,9
1617204370.0,2021-03-31,wallstreetbets,gsx9ifj,just nine more days like this and I can pull myself out of the hole I'm in...,t3_mh2ryh,8
1617205091.0,2021-03-31,wallstreetbets,gsxb3jy,There's nothing like seeing the tiny little  ^(ITM)  symbol next to my SPY calls in TOS,t3_mh2ryh,9
1617205162.0,2021-03-31,wallstreetbets,gsxb97x,Working from home this past year got me insanely addicted to vaping. Calls on popcorn lung,t3_mh2ryh,8
1617205343.0,2021-03-31,wallstreetbets,gsxbnqz,I still like RKT,t3_mh2ryh,10
1617205434.0,2021-03-31,wallstreetbets,gsxbv30,Who cares about space when I can't even buy a house,t3_mh2ryh,9
1617205551.0,2021-03-31,wallstreetbets,gsxc4f7,DISCA follow your brother!!,t3_mh2ryh,9
1617205774.0,2021-03-31,wallstreetbets,gsxcmh9,PLTR carrying water for my portfolio.  Its bizarro day.,t3_mh2ryh,10
1617205831.0,2021-03-31,wallstreetbets,gsxcr1w,PLTR!!!,t3_mh2ryh,9
1617206469.0,2021-03-31,wallstreetbets,gsxe6ff,"wtf PLTR, when I held you, you drilled, when you sold you, you rip",t3_mh2ryh,10
1617206824.0,2021-03-31,wallstreetbets,gsxeyu5,"Palantir green at noon: ""Hey, I've seen this one before""",t3_mh2ryh,8
1617207046.0,2021-03-31,wallstreetbets,gsxfggo,"Wow great PLTR up 7%, only down 10% now!",t3_mh2ryh,10
1617207315.0,2021-03-31,wallstreetbets,gsxg1qg,Pltr brs ar fk,t3_mh2ryh,8
1617207322.0,2021-03-31,wallstreetbets,gsxg2c0,"Palantards, it’s your day today",t3_mh2ryh,10
1617207330.0,2021-03-31,wallstreetbets,gsxg2yy,PLTR to $30🚀,t3_mh2ryh,8
1617207332.0,2021-03-31,wallstreetbets,gsxg35r,PLTR 25 EOD?,t3_mh2ryh,10
1617207655.0,2021-03-31,wallstreetbets,gsxgt51,Fuck it TSLA 4/1 $700C,t3_mh2ryh,9
1617207880.0,2021-03-31,wallstreetbets,gsxhb4o,Lmfao remember when NKLA was gonna PuT tEsLa OuT oF bUsInEsS?,t3_mh2ryh,9
1617208435.0,2021-03-31,wallstreetbets,gsxik8e,"It's fun to look at all your green lines, I know, but always be looking for something to buy.  And not the FOMO shit that'll kill you.

$CAT 6/18 230c

$VIAC June-sept 65c

$DISCA June-oct 60c",t3_mh2ryh,8
1617208908.0,2021-03-31,wallstreetbets,gsxjm4f,I am the Michael Jordan of buying the top,t3_mh2ryh,9
1617208986.0,2021-03-31,wallstreetbets,gsxjsk1,Looks like somebody pulled the rug... and underneath was an anti-gravity machine... 🤷🏽‍♂️,t3_mh2ryh,9
1617209166.0,2021-03-31,wallstreetbets,gsxk72i,I actually felt joy and happiness this morning looking at my portfolio. This is a key indicator that this is the top,t3_mh2ryh,10
1617209244.0,2021-03-31,wallstreetbets,gsxkdaw,TSLA hitting 700 today? stick around to find out,t3_mh2ryh,8
1617209650.0,2021-03-31,wallstreetbets,gsxla1d,Market makes Boys into Men. With that said Im still crying.,t3_mh2ryh,9
1617209981.0,2021-03-31,wallstreetbets,gsxm0w5,Which one of you retards got a tax bill for $800k and only profited $45k????,t3_mh2ryh,10
1617210307.0,2021-03-31,wallstreetbets,gsxmqtv,Bought some spy puts just now.  Gonna just see what happens at close and tomorrow.,t3_mh2ryh,8
1617210570.0,2021-03-31,wallstreetbets,gsxnbtf,"You ever feel like the market is rigged specifically against you?

Like how I have 4/16 calls on $CRSR and $RKT but those are the two stocks not moving on a moon mission day.",t3_mh2ryh,10
1617211000.0,2021-03-31,wallstreetbets,gsxoafz,DISCA punishing those who think they are on to something.,t3_mh2ryh,9
1617191153.0,2021-03-31,wallstreetbets,gswli5e,The year is 2050 and you’re still telling your friends $30 is right around the corner for PLTR,t1_gswle95,159
1617192590.0,2021-03-31,wallstreetbets,gswngvk,I’m getting the same error,t1_gswnefj,28
1617188298.0,2021-03-31,wallstreetbets,gswi17l,Stocks need to rise from the dead too,t1_gswhtnc,52
1617188294.0,2021-03-31,wallstreetbets,gswi12r,Judas was a gay bear. 🌈 🐻,t1_gswhtnc,78
1617191201.0,2021-03-31,wallstreetbets,gswlkfs,Is your wife single?,t1_gswl2kq,124
1617191003.0,2021-03-31,wallstreetbets,gswlayi,"""Dear, what is an OTM put and why is our joint account $30,000 down because of it?""",t1_gswl2kq,44
1617193391.0,2021-03-31,wallstreetbets,gswomv6,Rip or r.i.p.? Cant tell these days,t1_gswmnq1,12
1617188857.0,2021-03-31,wallstreetbets,gswio60,It's entirely possible,t1_gswil5h,14
1617205541.0,2021-03-31,wallstreetbets,gsxc3jv,You quit now and you consider it a 70% gain from future losses,t1_gsxbvjz,29
1617189438.0,2021-03-31,wallstreetbets,gswjcrz,Right with you...aphria too...lolololol,t1_gswj367,24
1617189231.0,2021-03-31,wallstreetbets,gswj3u6,We are in a completely fraudulent system,t1_gswizib,12
1617190449.0,2021-03-31,wallstreetbets,gswkl8j,ur rich,t1_gswkgiq,9
1617200016.0,2021-03-31,wallstreetbets,gsx0bfu,They agree to fuck i think,t1_gsx0869,10
1617217751.0,2021-03-31,wallstreetbets,gsy34q3,What the fuck? How is chicken soup for the soul still a company much less a publicly traded one?,t1_gsy2zpz,16
1617222323.0,2021-03-31,wallstreetbets,gsyd4b1,1000 eod bro ur fine,t1_gsyczvm,10
1617191448.0,2021-03-31,wallstreetbets,gswlwa5,[deleted],t1_gswlud9,13
1617200071.0,2021-03-31,wallstreetbets,gsx0fcx,King Mierdas,t1_gsx0d0x,9
1617192320.0,2021-03-31,wallstreetbets,gswn3cg,"Get the zip, and buy APHA instead.",t1_gswn00j,9
1617204090.0,2021-03-31,wallstreetbets,gsx8wcd,"DiscA will do the same, and so will viacom",t1_gsx8rg8,12
1617207688.0,2021-03-31,wallstreetbets,gsxgvtn,TSLA believer here even I think that's just retarded,t1_gsxgt51,11
1617189473.0,2021-03-31,wallstreetbets,gswjebt,He dumped Jesus for few coins and then Jesus skyrocket! And then Judas hang himself.. He could just buy back...,t1_gswi12r,36
1617191229.0,2021-03-31,wallstreetbets,gswllr8,"She’s Bi, so if you’re a hot girl, you’ve got a chance.",t1_gswlkfs,70
1617191273.0,2021-03-31,wallstreetbets,gswlnu6,I am not a cat.,t1_gswllr8,48
