date,subreddit,id,body,parent_id,score
2019-11-05,wallstreetbets,f6m2ezz,Wow i sold AMD 37C on earnings thinking there is no way i get exercised at that level but it looks like i might be,t3_drxo17,4
2019-11-05,wallstreetbets,f6m3bbl,"Thank you Visa, very cool",t3_drxo17,5
2019-11-05,wallstreetbets,f6m3ge1,BEAT,t3_drxo17,5
2019-11-05,wallstreetbets,f6m3h1i,Ism beat!,t3_drxo17,5
2019-11-05,wallstreetbets,f6m4nfr,Joined six digit account gang today. All 4 of us here will go out for drinks after market closes.,t3_drxo17,3
2019-11-05,wallstreetbets,f6m4y7k,"Good news is bad news

Bear gang",t3_drxo17,4
2019-11-05,wallstreetbets,f6m50jo,"It could be the rally in the USD spooking the market right now, just my guess, I don't see any bad news yet.",t3_drxo17,4
2019-11-05,wallstreetbets,f6m531y,"Stopped out of my puts, switched to calls. Jesus fucking Christ lmao",t3_drxo17,5
2019-11-05,wallstreetbets,f6m545n,"I fucking knew as soon as I switched to calls.  JFC, inverse my every instinct—I am retard incarnate",t3_drxo17,5
2019-11-05,wallstreetbets,f6m5e23,Algos holding SPY $307 support for dear life,t3_drxo17,4
2019-11-05,wallstreetbets,f6m5mky,I rushed into spy puts for a day trade but looks like I got caught and will get fucked again,t3_drxo17,3
2019-11-05,wallstreetbets,f6m654a,Time to buy some cheap SPY calls or wait for thursday?,t3_drxo17,4
2019-11-05,wallstreetbets,f6m6592,"I'm not very bright, but stop playing spy puts unless you are doing LOOOONG dated ITM Puts. Help me destroy Yelp!!!",t3_drxo17,4
2019-11-05,wallstreetbets,f6m6ojt,"Come on AMD, go red, you piece of shit",t3_drxo17,5
2019-11-05,wallstreetbets,f6m75l2,So how do you guys deal with the frustration of constantly losing money? Asking for a friend,t3_drxo17,4
2019-11-05,wallstreetbets,f6m7j1d,307 is a fucking magnet,t3_drxo17,4
2019-11-05,wallstreetbets,f6m7mvs,"UBER sucking dick today.

It’s 40% off of its high but still an over valued POS 😭",t3_drxo17,5
2019-11-05,wallstreetbets,f6m7nb7,"Alright just bought 15k in spx puts on a loan let's drop baby. 

(Inverse for tendies)",t3_drxo17,4
2019-11-05,wallstreetbets,f6lwngz,Tell em to GUH off then  [🖕](https://emojipedia.org/reversed-hand-with-middle-finger-extended/),t1_f6lweep,32
2019-11-05,wallstreetbets,f6lsn39,LMAO,t1_f6lrqm7,14
2019-11-05,wallstreetbets,f6lx1ww,This is now canon.,t1_f6lrqm7,5
2019-11-05,wallstreetbets,f6lw28f,Remember when everyone thought Five Guys was expensive? lol,t1_f6lvbio,26
2019-11-05,wallstreetbets,f6lvi2w,"I tried it once here in Austin after the locals raved about it, considering they talk highly of Mr.Gattis I wasn't surprised by how subpar it was.",t1_f6lvbio,11
2019-11-05,wallstreetbets,f6lswiw,[deleted],t1_f6lssvf,12
2019-11-05,wallstreetbets,f6lrbel,I’m sure there is a team of developers working around the click cursing this sub rn.,t1_f6lqmby,29
2019-11-05,wallstreetbets,f6lr63t,They got the intern on it,t1_f6lqmby,17
2019-11-05,wallstreetbets,f6ly5ih,Team Edward!!!,t1_f6lxyod,6
2019-11-05,wallstreetbets,f6mzwef,"You finally made it big time, kid.",t1_f6mzraq,6
2019-11-05,wallstreetbets,f6mxv6k,“PRT users” made me LOL,t1_f6mxlqw,32
2019-11-05,wallstreetbets,f6mxs8e,I warned ya’ll not to fuck around with recursion.,t1_f6mxlqw,20
2019-11-05,wallstreetbets,f6ohgw1,"Stock is up 10% since CTN started this shit. Coincidence? Yes, daily volume is 57m",t1_f6mxlqw,25
2019-11-05,wallstreetbets,f6p0ehi,"I don't think this could be it. 1M$ of amd is about 28K stock.

Even if 10 autists reached 1M$ and used it on amd that's still only 280K of amd stock, at 100 autists with 1M$ we reach barely .5% of the daily volume",t1_f6mxlqw,7
2019-11-05,wallstreetbets,f6lr3oa,Dude that shit makes me livid. Should be nerfed soon,t1_f6lqk2s,10
2019-11-05,wallstreetbets,f6mdihl,Yeah things escalated *quickly*,t1_f6md79h,11
2019-11-05,wallstreetbets,f6mdj7b,Understatement,t1_f6md79h,8
2019-11-05,wallstreetbets,f6ltpl9,Don’t worry investors are flocking to safe stocks like Peleton from shitty stocks like Starbucks. It’s up 5%,t1_f6ltfvc,18
2019-11-05,wallstreetbets,f6ltmss,Yeah but they doubled their rev YOY and doubled their uses from a year ago in prob the weakest fitness qtr. 👀,t1_f6ltfvc,9
2019-11-05,wallstreetbets,f6ltklc,there arent enough milfs to buy that shit,t1_f6ltfvc,5
2019-11-05,wallstreetbets,f6lu9e5,But it lost less than last year so it’s up 5.7% 😂,t1_f6ltfvc,4
2019-11-05,wallstreetbets,f6lsvqj,">	GTA duplication glitch
😂😂",t1_f6ls8vb,11
2019-11-05,wallstreetbets,f6lsjbk,#Lord✝️ 💲hkreli 🅿️roud 🧐,t1_f6ls8vb,17
2019-11-05,wallstreetbets,f6m7wca,Toys R Us,t1_f6m7uk5,13
2019-11-05,wallstreetbets,f6mn5tg,Or LTFMW,t1_f6mn2p6,5
2019-11-05,wallstreetbets,f6mne5g,"Imagine being an SEC intern to sort through this sub.

I recommend everyone to end their post with “asking for a friend”.",t1_f6mn2p6,5
2019-11-05,wallstreetbets,f6mr2o7,I think it's safe to say we have immortalized ourselves as the greatest finance sub on reddit,t1_f6mqjyx,9
2019-11-05,wallstreetbets,f6ls1mj,Only two more rounds of QE,t1_f6ls0d1,18
2019-11-05,wallstreetbets,f6ls7ff,Imagine 100 million in puts and a crash,t1_f6ls0d1,4
2019-11-05,wallstreetbets,f6mw3cy,"CNBC did too

Edit: SMH it said CBS at first",t1_f6mw24s,10
2019-11-05,wallstreetbets,f6lyapb,Only your entire account in this age of margin? Guhrow up,t1_f6lx8zm,13
2019-11-05,wallstreetbets,f6lxab1,guh,t1_f6lx8zm,5
2019-11-05,wallstreetbets,f6m2u6k,"They spend an assenine, retarded amount of money on R&D and 'innovation'. My question is, what's so wrong with making profit first, and innovating once you have a profitable model? Right now this dumpster fire is just burning money, and their hope is to get rid of drivers and use self-driving cars. Fuck you.",t1_f6m0skk,4
2019-11-05,wallstreetbets,f6n6eu1,O'DOYLE RULES! O'DOYLE RULES! O'DOYLE RULES! O'DOYLE RULES! O'DOYLE RULES! O'DOYLE RULES!,t1_f6n5ufg,7
2019-11-05,wallstreetbets,f6lzbxk,thanks mom,t1_f6lyzqq,5
2019-11-05,wallstreetbets,f6mp5ir,free shkreli bitch,t1_f6moxan,6
2019-11-05,wallstreetbets,f6lyqrx,That be honestly pretty funny,t1_f6lyndd,15
2019-11-05,wallstreetbets,f6lo0u2,where the fuck has 2-hour daylight saving,t1_f6lntou,18
2019-11-05,wallstreetbets,f6lo8py,Where the fuck you live? North of the wall? 2 hrs?,t1_f6lntou,12
2019-11-05,wallstreetbets,f6lohwo,You must live in guhtananmo bay,t1_f6lntou,9
2019-11-05,wallstreetbets,f6lv7dc,Not until you drain their blood and perform the ritual as prophecized,t1_f6lv2b4,4
2019-11-05,wallstreetbets,f6lv8dv,We thank him for his sacrifice.,t1_f6lv2b4,4
2019-11-05,wallstreetbets,f6lr352,"I bought at the top last September, going to finally exit in the green.",t1_f6lqq4c,4
2019-11-05,wallstreetbets,f6lr3e5,Kinda annoyed that the only action I've been getting is selling puts on it.,t1_f6lqq4c,3
2019-11-05,wallstreetbets,f6lwron,I hope they get exercised and both of them have to sell organs to cover only half the debt,t1_f6lwn0v,4
2019-11-05,wallstreetbets,f6m5q45,GUH,t1_f6m5g36,8
2019-11-05,wallstreetbets,f6m5jh4,"im sorry friend 

you fought a valiant battle",t1_f6m5g36,3
2019-11-05,wallstreetbets,f6m9gdg,"I lost 13k in 2 months, step it up",t1_f6m9a6w,7
2019-11-05,wallstreetbets,f6m9ih5,That's 4 years of 3k worth of tax breaks! Can't get the write off if you are dead! You can always make more money as long as you are alive.,t1_f6m9a6w,6
2019-11-05,wallstreetbets,f6mf06o,Are you within your Personal Risk Tolerance?,t1_f6metm9,9
2019-11-05,wallstreetbets,f6mfk1f,personal loan? how personal? like from Freddy 4 fingers down at the bowling alley?,t1_f6metm9,7
2019-11-05,wallstreetbets,f6msvm9,By getting the reporter to call it a glitch RH won.  The reporter should not be calling it a glitch.,t1_f6msljy,7
2019-11-05,wallstreetbets,f6myrdb,Two words: legend dairy,t1_f6myiqo,5
2019-11-05,wallstreetbets,f6n51wp,meanwhile all the bulls WHY IS THE MARKET SELLING OFFFFFF ?!?!?!?!,t1_f6n4pxn,4
2019-11-05,wallstreetbets,f6lxsol,He’s actually a Robinhood employee.,t1_f6lxgns,16
2019-11-05,wallstreetbets,f6lpgyr,310 after numbers regardless of what they say?,t1_f6lp7nl,10
2019-11-05,wallstreetbets,f6miuwy,Cow time?,t1_f6millp,7
2019-11-05,wallstreetbets,f6mq34j,*Waves at SEC*,t1_f6mppwx,10
2019-11-05,wallstreetbets,f6lml67,"They'll have to hibernate soon.

Unless you mean large hairy gay men.",t1_f6llrmf,7
2019-11-05,wallstreetbets,f6miq4e,"I wish I had lost my first bet, tripled my money in the first week, put more in, and lost it all lmao. lesson learned I guess, I'm not some stock market genius",t1_f6mifaf,5
2019-11-05,wallstreetbets,f6mj54k,">ITM

Y u bringing all this 🌈 shit",t1_f6mj07a,6
2019-11-05,wallstreetbets,f6n6gdl,Dude I have a 5 inch cock I been salty every since I was 15,t1_f6n65rq,8
2019-11-05,wallstreetbets,f6n6b7k,Alexa play This Is America - Childish Gambino,t1_f6n65rq,3
2019-11-05,wallstreetbets,f6lpxz1,Not SBUX... fuck,t1_f6lpvfy,7
2019-11-05,wallstreetbets,f6lt579,Stonks only GUH up 🥵,t1_f6lsz3k,11
2019-11-05,wallstreetbets,f6lunr9,What's the one trade?,t1_f6luhmb,5
2019-11-05,wallstreetbets,f6lusqz,"All in ☎️📞 until financial crisis

Or Robinhood goes 🍥🍥☝️",t1_f6luoja,8
2019-11-05,wallstreetbets,f6mh15m,no reason to ever regret a 50% profit,t1_f6mgu89,12
2019-11-05,wallstreetbets,f6mn32v,First time?,t1_f6mn0lz,10
2019-11-05,wallstreetbets,f6mvsmv,"They didn't even mention wallstreet bets, that bitch.",t1_f6mvgbx,4
2019-11-05,wallstreetbets,f6mx8nr,you mean YOLO 11/8 32p's,t1_f6mx4eq,6
2019-11-05,wallstreetbets,f6myoxb,We did jt,t1_f6myjpd,5
2019-11-05,wallstreetbets,f6n4ely,GUH,t1_f6n4a3i,6
2019-11-05,wallstreetbets,f6nboa7,"Robinhood IMO had a responsibility to be more selective in who gets approved for options, and they failed in their responsibilities. Therefore all my losses are their fault lol. Bring on the class action lawsuit.",t1_f6nbgmm,5
2019-11-05,wallstreetbets,f6lqltz,"Trump RT: Gyna talks are going very well. 

Now he doesn’t need to waste time every week typing that shit out",t1_f6lqh68,9
2019-11-05,wallstreetbets,f6lube6,Metalz Heavy 🥇🏋️‍♂️🥈,t1_f6lu4ph,4
2019-11-05,wallstreetbets,f6lxzju,get in those yoga pants,t1_f6lxpzp,5
2019-11-05,wallstreetbets,f6lyk50,yes yes yes PLS,t1_f6lyefx,4
2019-11-05,wallstreetbets,f6m621q,bold of you,t1_f6m5o4e,4
2019-11-05,wallstreetbets,f6mjsbv,SEC has entered the chat,t1_f6mjifm,6
2019-11-05,wallstreetbets,f6mnqjt,Pic of positions or ban,t1_f6mnnra,7
2019-11-05,wallstreetbets,f6mw5nc,"looks like there's room for more greed then, wait till it hits 120/100",t1_f6mw1x3,7
2019-11-05,wallstreetbets,f6lssf3,2 different icecream man? How? Cone in the butt?,t1_f6lrn2k,5
2019-11-05,wallstreetbets,f6lxh06,I'm out after this week man I want my account to beat its resistance line,t1_f6lxb9u,6
2019-11-05,wallstreetbets,f6lms8i,Have you ever heard the tragedy of /u/ControlTheNarrative The Retard?,t1_f6lmhm6,16
2019-11-05,wallstreetbets,f6mbkcg,"Hang on a sec, lemme drink some peyote and see what the ancestors think",t1_f6mbcy9,5
2019-11-05,wallstreetbets,f6mt243,Im working on a new wizdaddy lmao,t1_f6msu8g,7
2019-11-05,wallstreetbets,f6lpxqa,And having that beat expectations,t1_f6lola3,10
2019-11-05,wallstreetbets,f6lswec,Vision Fund is loyal to Robinhood ✊,t1_f6lstx1,10
2019-11-05,wallstreetbets,f6m13de,It’s all over. Sell everything  🔥🏚🔥,t1_f6m0s20,6
2019-11-05,wallstreetbets,f6m2xpy,You mean you're tempted to fuck yourself with thousands of dollars of debt that you can't repay?,t1_f6m2ac6,3
2019-11-05,wallstreetbets,f6m5omn,FIND OUT NEXT TIME ON MARKETBALL SQUEEEEE!!!,t1_f6m5imp,8
2019-11-05,wallstreetbets,f6m5llm,GUH,t1_f6m5imp,6
2019-11-05,wallstreetbets,f6m5of4, [https://www.marketwatch.com/tools/calendars/economic](https://www.marketwatch.com/tools/calendars/economic) Current thoughts are drop in jobs and a delay in algos from that data but idk im just shooting by the hip,t1_f6m5imp,7
2019-11-05,wallstreetbets,f6m5w6z,"The dollar is rallying hardcore. This usually causes some panic for exporters

And kills gold",t1_f6m5imp,6
2019-11-05,wallstreetbets,f6n71qb,Am considering taking WSB private for 420. Funding secured,t1_f6n6szp,8
2019-11-05,wallstreetbets,f6n722k,Would love to get rid of some folks,t1_f6n6szp,6
2019-11-05,wallstreetbets,f6m77uy,[deleted],t1_f6m75l2,9
2019-11-05,wallstreetbets,f6mbfg7,At least five guys is good,t1_f6lw28f,15
2019-11-05,wallstreetbets,f6n2gkr,Took multiple revisions to come up with that.,t1_f6mxv6k,12
2019-11-05,wallstreetbets,f6osv4v,I warned ya’ll not to fuck around with recursion.,t1_f6mxs8e,14
2019-11-05,wallstreetbets,f6ohr47,"Read paragraph 2.

And yeah, I was right. RH patched the AMD loop. Stock started falling.",t1_f6ohgw1,17
2019-11-05,wallstreetbets,f6ltu08,Still burning money 🔥💰🔥,t1_f6ltmss,9
2019-11-05,wallstreetbets,f6lsq4v,Well you can only hope that the other party did not sell on margin also,t1_f6ls7ff,8
2019-11-05,wallstreetbets,f6mw852,[deleted],t1_f6mw3cy,5
2019-11-05,wallstreetbets,f6lp0p8,"It's Australia. First you have Australian summer DST starting, then the next week you have American DST ending. Ends up being a 2hr swing.",t1_f6lo0u2,11
2019-11-05,wallstreetbets,f6ly227,[deleted],t1_f6lxsol,6
2019-11-05,wallstreetbets,f6n77px,Hey fuck you too buddy,t1_f6n722k,6
2019-11-05,wallstreetbets,f6p8ar5,How about “PRTards”,t1_f6n2gkr,9
2019-11-05,wallstreetbets,f6ot86j,I warned ya’ll not to fuck around with recursion.,t1_f6osv4v,12
2019-11-05,wallstreetbets,f6ly7g2,"Find bug

Have employee post on the biggest investment sub on Reddit

Lures other investors into the margin trick

Margin loans = easy money",t1_f6ly227,6
2019-11-05,wallstreetbets,f6owr79,I warned ya’ll not to fuck around with recursion.,t1_f6ot86j,8
2019-11-05,wallstreetbets,f6lyi4a,[deleted],t1_f6ly7g2,4
2019-11-05,wallstreetbets,f6oxk75, I warned ya’ll not to fuck around with recursion.,t1_f6owr79,8
2019-11-05,wallstreetbets,f6lz76a,People seem to be glossing over this criticical fact.,t1_f6lyi4a,6
