created,date,subreddit,id,body,parent_id,score
1596802223.0,2020-08-07,wallstreetbets,g0o2yo9,"Microsoft should buy onlyfans, not tiktok.",t3_i5b9o9,104
1596801076.0,2020-08-07,wallstreetbets,g0o0qn2,"China: bans Google, Facebook, Twitter, Snapchat, reddit, Tumblr, pinterest, slack, twitch, discord, Dropbox, YouTube, vimeo, Flickr, SoundCloud, etc etc. 


US: bans TikTok


China: ""I can't believe they've done this""",t3_i5b9o9,309
1596796671.0,2020-08-07,wallstreetbets,g0nu9k6,Who is margin and why does she keep calling me,t3_i5b9o9,160
1596803833.0,2020-08-07,wallstreetbets,g0o69x7,[deleted],t3_i5b9o9,68
1596802447.0,2020-08-07,wallstreetbets,g0o3fkb,"I’ve quit drinking and smoking and used the money saved to trade options. 

Somehow my doctor tells me I am less healthier now from all the stress and lack of sleep.",t3_i5b9o9,63
1596805258.0,2020-08-07,wallstreetbets,g0o9byx,Nothing better than sipping coffee while reading WSB and having explosive diarrhea every morning. Love you boys. ❤️,t3_i5b9o9,58
1596797006.0,2020-08-07,wallstreetbets,g0num6u,Options trading>sports betting. I have way more fun watching a graph go up or down than watching the Superbowl.,t3_i5b9o9,91
1596800728.0,2020-08-07,wallstreetbets,g0o04zc,"Who’s opening red this morning 🙋‍♂️

At least my RKT shares made gains AH",t3_i5b9o9,45
1596802828.0,2020-08-07,wallstreetbets,g0o47u2,I DECLARE BANKRUPTCYYYYYYYYYYYY,t3_i5b9o9,51
1596803752.0,2020-08-07,wallstreetbets,g0o63pc,"10% unemployment. Great reason to be all time high.

You would think some of this would be priced in given the insane run up lately. But I guess any news is reason to party.

Guess the Fed can stop their actions now. We're all good here. Congress can go back to recess.",t3_i5b9o9,44
1596805985.0,2020-08-07,wallstreetbets,g0oaw8r,[deleted],t3_i5b9o9,50
1596805291.0,2020-08-07,wallstreetbets,g0o9ehr,"this is going to be super out-of-place but this is my favorite online community so...

my uncle died yesterday at 75. he lived a great life and loved it. he taught me about the value of saving and investing money but also enjoying nice things like traveling first class around the world and nice as fuck cars. i took him to a 3 star michelin spot for his 70th birthday because that was his thing. he laughed at me and told me i'm a retard when i lost $40k in a day trading options.

he was a good person, extremely cool and i'm gonna miss him.

be well my autistic friends.

20x SPY 350C 8/28",t3_i5b9o9,197
1596803063.0,2020-08-07,wallstreetbets,g0o4o4h,This is the big one I can feel it. We may close -.02%,t3_i5b9o9,38
1596796446.0,2020-08-07,wallstreetbets,g0nu1ao,The thought of TikTok “influencers” needing to get an actual job makes me smile,t3_i5b9o9,179
1596797830.0,2020-08-07,wallstreetbets,g0nvhsg,"Guy's the Stim-pak it not coming today, the senate has already been told to go home because the package still has not been agreed on. The earliest it is coming is Monday. I agree it is inevitable, just not today:  


 

""Majority Leader [Mitch McConnell](https://thehill.com/people/mitch-mcconnell) (R-Ky.) said on Thursday that the Senate will technically be in session next week but signaled he's letting senators leave Washington, D.C., until an agreement is reached on a fifth coronavirus relief package.

""I will not be adjourning the Senate for our August recess today as has been previously scheduled. I've told Republican senators they'll have a 24-hour notice before a vote, but the Senate will be convening on Monday and I'll be right here in Washington,"" McConnell said from the Senate floor.

The Senate was scheduled to start a four-week August break on Friday, not returning to Washington until early September.""",t3_i5b9o9,37
1596831877.0,2020-08-07,wallstreetbets,g0pvofm,[deleted],t3_i5b9o9,38
1596795842.0,2020-08-07,wallstreetbets,g0ntfje,"As a gay bear, there's about 8 minutes until every index worldwide jumps positive. It's like clockwork at this fucking point.

And I fucking hate it",t3_i5b9o9,73
1596799292.0,2020-08-07,wallstreetbets,g0nxonp,Real silver gang didn't buy weeklies. SILVER GANG DIAMOND HANDS,t3_i5b9o9,70
1596798105.0,2020-08-07,wallstreetbets,g0nvsk6,"The great decline of America was due to:  
~~Civil War~~  
~~Spanish Flu~~  
~~The Great Depression~~  
~~Great Financial Crisis~~  
~~Global Pandemic~~  
TikTok",t3_i5b9o9,63
1596802750.0,2020-08-07,wallstreetbets,g0o41de,"For those who don’t want to scroll and have the attention span of a gnat with a learning disability:

Yes, people are buying the SLV dip

Yes, people are buying RKT

No, your [insert ticker] weeklies are not ok",t3_i5b9o9,66
1596796181.0,2020-08-07,wallstreetbets,g0ntrs6,[deleted],t3_i5b9o9,31
1596806464.0,2020-08-07,wallstreetbets,g0obz4s,RKT announcing WMT+ today,t3_i5b9o9,34
1596806676.0,2020-08-07,wallstreetbets,g0ocfm8,[deleted],t3_i5b9o9,31
1596816115.0,2020-08-07,wallstreetbets,g0oy57c,"No stimulus is bullish, because that means we can keep pumping on possible stimulus news.",t3_i5b9o9,31
1596819782.0,2020-08-07,wallstreetbets,g0p5z4o,"He bought?

“Dump it”",t3_i5b9o9,30
1596821007.0,2020-08-07,wallstreetbets,g0p8lzz,Gained money everyday this week. Lost it all today,t3_i5b9o9,33
1596829460.0,2020-08-07,wallstreetbets,g0pqnzf, “Market rallies in hopes of market rallying.”,t3_i5b9o9,31
1596795698.0,2020-08-07,wallstreetbets,g0ntaax,I’m convinced people just like to brag about their unrealized gains only to hold it for 10baggers and cry about it the next day when it goes down 😂,t3_i5b9o9,60
1596798366.0,2020-08-07,wallstreetbets,g0nw5rz,[deleted],t3_i5b9o9,80
1596798891.0,2020-08-07,wallstreetbets,g0nx0vr,“Nobody wants to hold over the weekend!” Says the bears as we watch big green dildos this afternoon and another violently green Monday.,t3_i5b9o9,25
1596800701.0,2020-08-07,wallstreetbets,g0o03a3,[deleted],t3_i5b9o9,31
1596805040.0,2020-08-07,wallstreetbets,g0o8uvo,"LOL AT ANYONE DOUBTING SLV.  


BIG DADDY SILVER IS GOING TO COCK SLAP YOU.",t3_i5b9o9,25
1596805344.0,2020-08-07,wallstreetbets,g0o9ilb,Your boy Chimpu died for your sins,t3_i5b9o9,26
1596805774.0,2020-08-07,wallstreetbets,g0oafhg,"I figured out why stimulus is taking so long. Republicans’ theory is that the $600/wk UI stops people from going back to work. They’re gonna cave on it eventually, but they want at least a full week or two without it to “incentivize” hesitant workers to return to the workforce. That boosts jobs numbers, validates their thesis, then they still get to claim good guy reasonable status for renewing the benefit.",t3_i5b9o9,24
1596806268.0,2020-08-07,wallstreetbets,g0objar,Who else is about to get totally financially wrecked,t3_i5b9o9,24
1596811840.0,2020-08-07,wallstreetbets,g0oo4db,# IF YOU DONT HAVE LOWE’S CALLS FOR EARNINGS YOU AINT BLACK,t3_i5b9o9,23
1596816252.0,2020-08-07,wallstreetbets,g0oygpk,[deleted],t3_i5b9o9,26
1596819615.0,2020-08-07,wallstreetbets,g0p5lwr,"I was up a grand today, but I wanted more, so I settled for -$500",t3_i5b9o9,27
1596829520.0,2020-08-07,wallstreetbets,g0pqsou,[deleted],t3_i5b9o9,25
1596805874.0,2020-08-07,wallstreetbets,g0oanlf,Maybe the real tendies are the friends we made on the way :),t3_i5b9o9,94
1596796786.0,2020-08-07,wallstreetbets,g0nudu6,"Vix up 6%. Spicy. Today’s gonna be fun. We all know green by open with dead Vix,",t3_i5b9o9,24
1596833614.0,2020-08-07,wallstreetbets,g0pz7bf,"I was so frustrated with today I broke every one of my rules and put my entire net worth into apple calls on the dip and sold them an hour later. 

Might have been the stupidest but most profitable thing I’ve ever done in my trading career",t3_i5b9o9,24
1596805497.0,2020-08-07,wallstreetbets,g0o9ufo,I was pretty disappointed when RKT wasn’t actually Reality Kings,t3_i5b9o9,22
1596806275.0,2020-08-07,wallstreetbets,g0objtw,10 more RKT posts and im out on WSB,t3_i5b9o9,23
1596810234.0,2020-08-07,wallstreetbets,g0okfvm,Whoever sellin SLV is a pussy,t3_i5b9o9,23
1596814941.0,2020-08-07,wallstreetbets,g0ovf0r,Friendly reminder to check your posture.,t3_i5b9o9,21
1596822754.0,2020-08-07,wallstreetbets,g0pcg7w,"Just ripped the Intel sticker off my laptop, no association ever again.",t3_i5b9o9,24
1596806256.0,2020-08-07,wallstreetbets,g0obi4l,So who actually has a 401k?,t3_i5b9o9,21
1596801041.0,2020-08-07,wallstreetbets,g0o0ogu,"Jobs report he like: 999,999 filed for unemployment. 1,000,000 expected. BULLISH!!!!! 🤡",t3_i5b9o9,45
1596812890.0,2020-08-07,wallstreetbets,g0oqr4k,"*facebook goes up $13.50 in a day*

*retard buys*

*facebook dips $1.50*

*retard cries “iS tHiS tHe ToP?!”*

It was the top 😯",t3_i5b9o9,19
1596815106.0,2020-08-07,wallstreetbets,g0ovsjv,This market is like refusing to walk away from a winning streak at roulette while the casino is burning around you.,t3_i5b9o9,22
1596829266.0,2020-08-07,wallstreetbets,g0pq95g,I started off -6k and day trade to -$80 I think that's a win,t3_i5b9o9,22
1596831462.0,2020-08-07,wallstreetbets,g0putoh,Where's that Groupon guy that was talking about Groupon and predicted this earning months ago? Please post so I can follow you and listen to everything you say,t3_i5b9o9,22
1596795550.0,2020-08-07,wallstreetbets,g0nt4s6,"All those holding RKT can wakeup and relax because there ain't no theta to fuck us overnight, and it's living up to its name 🚀",t3_i5b9o9,19
1596796218.0,2020-08-07,wallstreetbets,g0ntt4q,"China silences thoughts

Trump silences THOTs",t3_i5b9o9,20
1596802911.0,2020-08-07,wallstreetbets,g0o4dr5,We’re seeing levels in SLV that we haven’t seen since 1 PM yesterday 🤯🤯🤯🤯🤯,t3_i5b9o9,20
1596804430.0,2020-08-07,wallstreetbets,g0o7j43,"Jobs Data : THIS IS A RECESSION, but ""beat"" expectations.

Algos : BUY IT ALL

Hedge Funds: No wait....stawp.",t3_i5b9o9,20
1596829394.0,2020-08-07,wallstreetbets,g0pqit4,“Market rallies in hopes of market rallying.”,t3_i5b9o9,21
1596804860.0,2020-08-07,wallstreetbets,g0o8gle,People aren't going back to poverty level jobs. They got a taste of a living wage for the first time and now don't want to go back and I can't blame them tbh,t3_i5b9o9,59
1596802033.0,2020-08-07,wallstreetbets,g0o2lrh,"Metals will go green today. Don’t panic. Lotta bad news for the dollar will come out today, starting in 25 minutes 😎",t3_i5b9o9,18
1596802846.0,2020-08-07,wallstreetbets,g0o492k,"Me every fucking morning: I’m going to bed early tonight

Me every fucking night: but what if my calls don’t print",t3_i5b9o9,20
1596804626.0,2020-08-07,wallstreetbets,g0o7y90,Im disappointed but not at all surprised that half of rkt buyers think they’re trading an actual rocket company 🤦‍♂️,t3_i5b9o9,20
1596805007.0,2020-08-07,wallstreetbets,g0o8sed,"I love how they just make up numbers. 
“Yes futures look good, recession over”

We’re still in a pandemic, with no stimulus, high unemployment, and no end in sight.

It’s a fn game",t3_i5b9o9,19
1596810462.0,2020-08-07,wallstreetbets,g0okyja,"It’s okay SLV, shake out those weeklies",t3_i5b9o9,19
1596816899.0,2020-08-07,wallstreetbets,g0ozvoz,Pelosi is gunna come out with one of those huge checks they give to lotto winners,t3_i5b9o9,19
1596819089.0,2020-08-07,wallstreetbets,g0p4i08,Hold strong SLV gang,t3_i5b9o9,20
1596830783.0,2020-08-07,wallstreetbets,g0ptfow,Anyone else ever immediately regret opening a position that fills you instantly. That’s like a guarantee for me “Good job retard you lost money”,t3_i5b9o9,18
1596833356.0,2020-08-07,wallstreetbets,g0pyonu,Made some decent trades this week. Went from -80% to -65% all time. Literally printing!,t3_i5b9o9,18
1596796422.0,2020-08-07,wallstreetbets,g0nu0h8,[deleted],t3_i5b9o9,40
1596799266.0,2020-08-07,wallstreetbets,g0nxn02,#BEARS ENJOY YOUR 3.78% OPTION GAIN AT OPEN,t3_i5b9o9,45
1596800308.0,2020-08-07,wallstreetbets,g0nzf7j,Holy fuck it’s already the weekend? **Its already August 7th!!???**,t3_i5b9o9,40
1596804703.0,2020-08-07,wallstreetbets,g0o84bw,"Do I have this right?

Congress right now. "" We can't keep paying people more money not to work"" 
ALSO CONGRESS : ""We can't allow non essential people back to work during this pandemic""
People Just Trying to Pay their bills: 😬😬😬😬😬
Essential Businesses: No competition for us were making a killing.
Essential Employees ""Can we have hazard pay?""
ESSENTIAL BUSINESSES: ""TELL CONGRESS TO PASS HEROS ACT!"".
EVERYBODY WHO ISNT A BUSINESS:😬😬😬😬😬😬😬😠😠😠😠😡🤬🤬🤬🤬🤬

All of congress. 🥱🥱🥱 HOPE WE MAKE A DEAL TODAY BEFORE WE GO ON VACATION",t3_i5b9o9,36
1596806583.0,2020-08-07,wallstreetbets,g0oc8my,I just want my money back,t3_i5b9o9,17
1596815517.0,2020-08-07,wallstreetbets,g0owr5y,"I'm close to giving up on this shit.

Haven't made a single good play in weeks besides selling calls on fucking weedstocks.

Fuck this rigged piece of trash we call the free market. Suck my dick Mnuchin.",t3_i5b9o9,18
1596827992.0,2020-08-07,wallstreetbets,g0pnkdr,Stocks soar into the close as collapse of stimulus talks gives hope of new stimulus talks,t3_i5b9o9,19
1596828476.0,2020-08-07,wallstreetbets,g0pol1z,I am never gonna financially recover from this,t3_i5b9o9,18
1596807684.0,2020-08-07,wallstreetbets,g0oence,Amazing how so many trades can ALL be wrong.,t3_i5b9o9,17
1596809058.0,2020-08-07,wallstreetbets,g0ohsqc,Silver back to levels haven't seen since yesterday,t3_i5b9o9,17
1596826452.0,2020-08-07,wallstreetbets,g0pkb47,We haven’t seen lows this low since yesterday morning,t3_i5b9o9,18
1596804953.0,2020-08-07,wallstreetbets,g0o8nyd,"Everyone focusing on job numbers, when the real story is congress jerking off and letting the pandemic unemployment expire.

All these people basically have absolutely no income now, but all of their expenses. That 10.5% unemployment rate is now looking to become a 10.5% homeless rate.",t3_i5b9o9,35
1596822193.0,2020-08-07,wallstreetbets,g0pb682,Upvote if you’re basically mailing it in at work today because you are checking your positions every 10 minutes,t3_i5b9o9,34
1596802071.0,2020-08-07,wallstreetbets,g0o2ogi,job\_report\_better\_than\_expected.exe being compiled right now,t3_i5b9o9,17
1596807921.0,2020-08-07,wallstreetbets,g0of73h,Where is SLV gang did you fuck me? 🥺,t3_i5b9o9,15
1596816444.0,2020-08-07,wallstreetbets,g0oywb8,I hate buying the dip and then THERES ANOTHER FUCKING DIP,t3_i5b9o9,16
1596816711.0,2020-08-07,wallstreetbets,g0ozh9v,"Why y'all trippin, close RH and chill, next week gonna be green af",t3_i5b9o9,17
1596817598.0,2020-08-07,wallstreetbets,g0p1e22,No stimulus confirmation until after market close...assholes.,t3_i5b9o9,18
1596795533.0,2020-08-07,wallstreetbets,g0nt46h,I need the drop to wait until Wednesday. I need that paycheck to buy puts..  again. This time they'll work.,t3_i5b9o9,14
1596804465.0,2020-08-07,wallstreetbets,g0o7lwu,Poor people r fuk as usual,t3_i5b9o9,16
1596805206.0,2020-08-07,wallstreetbets,g0o97vc,**9AM LET’S HAVE A GREAT DAY EVERYBODY.**,t3_i5b9o9,15
1596805920.0,2020-08-07,wallstreetbets,g0oar58,"RKT baby, we are going to the moon today 🚀🌑 (if you bought at IPO and sold at $21-$22, you’ve been left out of this mission)",t3_i5b9o9,15
1596809285.0,2020-08-07,wallstreetbets,g0oibo6,Silver Lambo repossessed,t3_i5b9o9,14
1596814026.0,2020-08-07,wallstreetbets,g0otapk,What time is SLV earnings call tonight?,t3_i5b9o9,14
1596815525.0,2020-08-07,wallstreetbets,g0owrsw,[deleted],t3_i5b9o9,15
1596817692.0,2020-08-07,wallstreetbets,g0p1ky1,"i feel like 8 yr old me playing monopoly and not fully understanding the rules but my family never let me win and I keep handing money over to the ""banker"" no matter what spot i land on and the one property i bought is mortgaged so I dont even collect any premiums on it but everyone else is having a good time so i stay in the game",t3_i5b9o9,15
1596820747.0,2020-08-07,wallstreetbets,g0p82jw,"Welcome to **Nasdaq Black Friday!**

Buy 1 Get 1 Free on ATVI & ZM Calls!

25% off AMD, AAPL, MSFT, AMZN!

75% off FSLY and DDOG Calls!

**DOORBUSTER**: 99% off INTC Calls!

Let’s go shopping! 🛒",t3_i5b9o9,15
1596824750.0,2020-08-07,wallstreetbets,g0pgpnj,"The bad news is I lost most of my account, but the good news is for once when I sold something to cut a loss, it actually continued tanking and didn't immediately moon. 😎",t3_i5b9o9,14
1596825227.0,2020-08-07,wallstreetbets,g0phr8o,[deleted],t3_i5b9o9,14
1596828569.0,2020-08-07,wallstreetbets,g0pos7j,TRUMP BETTA HAVE MY MONEY,t3_i5b9o9,15
1596805027.0,2020-08-07,wallstreetbets,g0o8txl,"Last night I went to an All You Can Eat KBBQ restaurant, and eating in a restaurant, drinking pitchers of beer with your friends, albeit just 6 of us, 3 at each table 6ft apart, was the best time I have had in the last decade.",t3_i5b9o9,14
1596807075.0,2020-08-07,wallstreetbets,g0oda9i,Me looking at my SLV calls: cool cool cool cool cool cool,t3_i5b9o9,14
1596808165.0,2020-08-07,wallstreetbets,g0ofrx0,"Silver: Down 0.35/oz after doubling in price in a month.


WSB: RIP SiLvEr TiMe 4 $ROPE


🤡🤡",t3_i5b9o9,13
1596813269.0,2020-08-07,wallstreetbets,g0orltc,God fomoing in to FB at the top just wiped out my entire monthly gains lmao gg boys,t3_i5b9o9,14
1596814238.0,2020-08-07,wallstreetbets,g0otrx0,CNBC says stimulus talks have grind to a halt. So I’m almost certain a deal will get done today,t3_i5b9o9,14
1596814308.0,2020-08-07,wallstreetbets,g0otxjl,If you didn't buy the GLD and SLV dip this morning I can't help you,t3_i5b9o9,15
1596814342.0,2020-08-07,wallstreetbets,g0ou0hx,Buying power: $6.60,t3_i5b9o9,14
1596814981.0,2020-08-07,wallstreetbets,g0ovi9y,"Some people are hilarious. SLV had like 6 green days in a row, one pullback and everyone loses their minds. Look at the 2011 chart, all the pullbacks were great buying opportunities",t3_i5b9o9,14
1596815780.0,2020-08-07,wallstreetbets,g0oxdhn,"Show of hands, who here ***really, really*** needs another $1200 check of free money, right about now?",t3_i5b9o9,15
1596816098.0,2020-08-07,wallstreetbets,g0oy3rx,[removed],t3_i5b9o9,13
1596817738.0,2020-08-07,wallstreetbets,g0p1obg,In this market you really only have like an hour to make any money off puts and your timing must be perfect. Not worth it.,t3_i5b9o9,16
1596818862.0,2020-08-07,wallstreetbets,g0p4128,SLV prepping for moon mining mission,t3_i5b9o9,14
1596820491.0,2020-08-07,wallstreetbets,g0p7j7s,[deleted],t3_i5b9o9,14
1596821499.0,2020-08-07,wallstreetbets,g0p9n9q,Time to delete Robinhood and yahoo finance so I don’t have to look at this shitshow for the rest of the day. Hope we’re bigly green Monday. Good luck boys.,t3_i5b9o9,13
1596827068.0,2020-08-07,wallstreetbets,g0pllth,SLV SURFERSSSSSS GOING UPPPP,t3_i5b9o9,14
1596827991.0,2020-08-07,wallstreetbets,g0pnkak,"how humans work:

&#x200B;

mad im down $400

livid im down $1400, turn off pc

fucking ded im down $4300

pretty  relieved im down $3000",t3_i5b9o9,14
1596828941.0,2020-08-07,wallstreetbets,g0ppkig,"Yo congress. Can we just get some Yang bucks so people can pay rent and you all can work out the Federal UI stipend another time? Let’s split this up if we have to. 

Thanks!",t3_i5b9o9,13
1596801822.0,2020-08-07,wallstreetbets,g0o26t4,Bears if we open red please book profits on puts ASAP. Your family is starving.,t3_i5b9o9,26
1596799237.0,2020-08-07,wallstreetbets,g0nxl48,"Bears sacrifice so much, work so hard, for pennies.

Also slight red open then fat green",t3_i5b9o9,14
1596802526.0,2020-08-07,wallstreetbets,g0o3l3v,Can’t wait for JP Morgan to dump millions of silver contracts at open.,t3_i5b9o9,13
1596803085.0,2020-08-07,wallstreetbets,g0o4prp,Welp just gonna keep digging this hole to financial ruin I guess,t3_i5b9o9,13
1596803700.0,2020-08-07,wallstreetbets,g0o5zvr,Nice cookbooks,t3_i5b9o9,13
1596806668.0,2020-08-07,wallstreetbets,g0ocf2n,Calling today a “healthy” pullback is like a crackhead drinking one glass of lemon water after a 6 day bender and thinking it’s actually going to have an impact,t3_i5b9o9,14
1596807700.0,2020-08-07,wallstreetbets,g0oeop0,Nice try SLV but I ain't fuckin selling,t3_i5b9o9,13
1596808298.0,2020-08-07,wallstreetbets,g0og3fv,Congress isn't even close to a stimulus. What a bunch of fucking clowns. Just going back home after doing nothing for a week. Easiest job in the world. Guess Hoovervilles are coming back.,t3_i5b9o9,13
1596812839.0,2020-08-07,wallstreetbets,g0oqmw3,SLV heard ya'll talking shit,t3_i5b9o9,14
1596813621.0,2020-08-07,wallstreetbets,g0osdjb,FOMO’d into FB at 577 thought I could ride the wave. RODE THE WAVE DOWN TO -50% PORTFOLIO,t3_i5b9o9,13
1596814062.0,2020-08-07,wallstreetbets,g0otdil,put all i have left into Nov SLV 28 calls. see you fuckers in therapy,t3_i5b9o9,13
1596814314.0,2020-08-07,wallstreetbets,g0oty2g,The real evil in 🇺🇸 is the algo buy wall that prevents markets from healthy corrections.,t3_i5b9o9,12
1596814840.0,2020-08-07,wallstreetbets,g0ov6ii,Bought FB at $278 🤡,t3_i5b9o9,13
1596816326.0,2020-08-07,wallstreetbets,g0oymqv,"Which one of you is John Smith in the YouTube Pelosi Chat:

*John Smith: 
​Who bought $FB calls at the top*",t3_i5b9o9,14
1596816843.0,2020-08-07,wallstreetbets,g0ozrfv,"Down $17K today, this is cool.",t3_i5b9o9,13
1596817740.0,2020-08-07,wallstreetbets,g0p1ogv,"#WHY ARE THEY RESISTING

It's a small amount - only $4,000,000,000,0000",t3_i5b9o9,14
1596817905.0,2020-08-07,wallstreetbets,g0p20qq,"""A call to them"" - Pelosi

Buy calls",t3_i5b9o9,13
1596819355.0,2020-08-07,wallstreetbets,g0p51s0,Brought Apple dip then it dipped further,t3_i5b9o9,13
1596822385.0,2020-08-07,wallstreetbets,g0pblyn,"PELOSI, SUCCESSOR OF PUTS RUINER OF CALLS",t3_i5b9o9,13
1596822849.0,2020-08-07,wallstreetbets,g0pcnv3,The sheer panic in here shows how heavily leveraged into tech this sub is lol,t3_i5b9o9,14
1596823710.0,2020-08-07,wallstreetbets,g0pejor,"hey my name is jared, i’m 19, and I never learned how to take profits at the fucking top",t3_i5b9o9,14
1596823936.0,2020-08-07,wallstreetbets,g0pf0lt,who knew prpl mattress consisted of hundreds and hundreds of wsb bags sewn together lmaooooo,t3_i5b9o9,12
1596828310.0,2020-08-07,wallstreetbets,g0po8i0,[deleted],t3_i5b9o9,13
1596829394.0,2020-08-07,wallstreetbets,g0pqitb,I need a break from day trading... was up 7k yesterday. Down 8k today.... Why am I so trash,t3_i5b9o9,13
1596830647.0,2020-08-07,wallstreetbets,g0pt5ll,Who lost money today? Lol 😂,t3_i5b9o9,13
1596795502.0,2020-08-07,wallstreetbets,g0nt32h,Mornin’ retards. May the heavens open up and supply thee with tendies,t3_i5b9o9,12
1596800428.0,2020-08-07,wallstreetbets,g0nzmrs,Loading up on more SLV if this dip holds,t3_i5b9o9,12
1596802365.0,2020-08-07,wallstreetbets,g0o38t4,"I rolled out my precious metal leaps to 2022 yesterday. I still say gold is headed above $4,000 and silver should cross $100.",t3_i5b9o9,13
1596802572.0,2020-08-07,wallstreetbets,g0o3oib,Joining SLV gang plz dont fuck me,t3_i5b9o9,13
1596802762.0,2020-08-07,wallstreetbets,g0o4298,RKT up 12%+ to 24.11 🚀,t3_i5b9o9,11
1596802848.0,2020-08-07,wallstreetbets,g0o497q,I’m a ginger. I have a red RKT.,t3_i5b9o9,14
1596803606.0,2020-08-07,wallstreetbets,g0o5sxi,[deleted],t3_i5b9o9,11
1596803675.0,2020-08-07,wallstreetbets,g0o5y0k,THE CASINO IS RIGGED AND YOU KEEP BETTING AGAINST THE HOUSE 😂,t3_i5b9o9,11
1596805486.0,2020-08-07,wallstreetbets,g0o9tj2,Guess we are sector rotating into RKT,t3_i5b9o9,11
1596806136.0,2020-08-07,wallstreetbets,g0ob810,A red after a beat of estimate data is a red that is here to stay.,t3_i5b9o9,12
1596806565.0,2020-08-07,wallstreetbets,g0oc79a,Honestly west coast trading is sick. Trade all morning til work starts and can make final plays throughout lunchtime,t3_i5b9o9,13
1596807477.0,2020-08-07,wallstreetbets,g0oe6as,"Everything going down while Purple is going up , people are hiding their money in mattresses.",t3_i5b9o9,11
1596808971.0,2020-08-07,wallstreetbets,g0ohl6u,"If you aren’t pumping Kodak, you ain’t black",t3_i5b9o9,13
1596809049.0,2020-08-07,wallstreetbets,g0ohrww,some of yous have been bamboozled hard by SLV call sellers,t3_i5b9o9,12
1596809553.0,2020-08-07,wallstreetbets,g0oiv8z,"Buy the SLV dip at peak stimmy uncertainty. 

When it inevitably gets passed the fiscal spending will send SLV back up as the dollar dives.",t3_i5b9o9,13
1596810722.0,2020-08-07,wallstreetbets,g0oljc3,WHERE MY RKT HOLDERS AT,t3_i5b9o9,11
1596810733.0,2020-08-07,wallstreetbets,g0olk4u,shiny gang rise up,t3_i5b9o9,13
1596810948.0,2020-08-07,wallstreetbets,g0om1qp,gotta love when robbinhood hits you with the WOOHOO! when you sell for 60% loss,t3_i5b9o9,12
1596811412.0,2020-08-07,wallstreetbets,g0on30n,"WSB yesterday: damn, I wanna buy SLV but I’m waiting for a dip 

WSB today: OH SHIT A DIP I ain’t touchin that!!",t3_i5b9o9,11
1596812488.0,2020-08-07,wallstreetbets,g0oprmn,[deleted],t3_i5b9o9,12
1596814459.0,2020-08-07,wallstreetbets,g0ouaan,"**Bank of America strategist: 'I'm so bearish, I'm bullish'**   

Looks like inverse your logic is not just a WSB strategy anymore",t3_i5b9o9,10
1596814586.0,2020-08-07,wallstreetbets,g0oukr1,"SLV 3/19/21 36C

SLV 6/30/21 36C

SLV 6/17/22 50C",t3_i5b9o9,12
1596816911.0,2020-08-07,wallstreetbets,g0ozwpe,Made a million mistakes this year. Underperforming the market by 15% 💀💀💀,t3_i5b9o9,12
1596817742.0,2020-08-07,wallstreetbets,g0p1omu,"Need to make a 22 bagger, plays?",t3_i5b9o9,12
1596818027.0,2020-08-07,wallstreetbets,g0p29sj,Stimulus talks is the only thing keeping this market from dropping lmao meme market,t3_i5b9o9,13
1596819106.0,2020-08-07,wallstreetbets,g0p4jab,If we open red Monday I’ll eat a pork egg roll out of my gfs ass,t3_i5b9o9,13
