created,date,subreddit,id,body,parent_id,score
1617208112.0,2021-03-31,wallstreetbets,gsxhtvi,It turns out all we need to keep the bull market going is a weekly trillion dollar bill.,t3_mh2ryh,12
1617208222.0,2021-03-31,wallstreetbets,gsxi2vf,I’ve lost so much money a Green Day doesn’t make me feel any happier,t3_mh2ryh,12
1617208979.0,2021-03-31,wallstreetbets,gsxjrw2,"Palantir is green, apocalypse confirmed",t3_mh2ryh,11
1617209645.0,2021-03-31,wallstreetbets,gsxl9ll,"Bought PLTR at $30? *check*

Bought ARKK at $130? *check*

Bought ARKG at $104? *check*

Save me",t3_mh2ryh,12
1617210100.0,2021-03-31,wallstreetbets,gsxmae1,"Man. I went all in 6k TSLA calls around 11am when it pulled back a bit and then it started dumping. Was so stressed out and when it finally came back up, I sold for $25 profit. Now those calls would have been up $3k profit. Fuck me man.",t3_mh2ryh,12
1617211254.0,2021-03-31,wallstreetbets,gsxoumz,"Just received my first $.27 of dividends. Who's poor now, Calvin??",t3_mh2ryh,12
1617211951.0,2021-03-31,wallstreetbets,gsxqeqr,"President Joe Biden has unveiled an outline of his infrastructure plan, and it includes a proposed $174 billion investment in electric vehicles.

The Biden administration has released an outline of its infrastructure plan on its website.

It includes a $174 billion investment in electric vehicles that they summarized:

>*“Create good jobs electrifying vehicles. U.S. market share of plug-in electric vehicle (EV) sales is only one-third the size of the Chinese EV market. The President believes that must change. He is proposing a $174 billion investment to win the EV market. His plan will enable automakers to spur domestic supply chains from raw materials to parts, retool factories to compete globally, and support American workers to make batteries and EVs. It will give consumers point of sale rebates and tax incentives to buy American-made EVs, while ensuring that these vehicles are affordable for all families and manufactured by workers with good jobs. It will establish grant and incentive programs for state and local governments and the private sector to build a national network of 500,000 EV chargers by 2030, while promoting strong labor, training, and installation standards. His plan also will replace 50,000 diesel transit vehicles and electrify at least 20 percent of our yellow school bus fleet through a new Clean Buses for Kids Program at the Environmental Protection Agency, with support from the Department of Energy. These investments will set us on a path to 100 percent clean buses, while ensuring that the American workforce is trained to operate and maintain this 21st century infrastructure. Finally, it will utilize the vast tools of federal procurement to electrify the federal fleet, including the United States Postal Service.”*

Without going into details, the investment will include funds to help automakers secure materials for electric vehicle production and converting factories.

The announcement confirms that the initiative will also revamp the consumer incentive to buy electric vehicles.

Again without going into the details, we do have a confirmation that it will not only be a tax credit, but it will also be available at the point of sale, which is going to facilitate sales.

The summary also confirms that this incentive is only going to be for “American-made” electric vehicles.

Recently, Democrats have introduced several new legislations to reform the EV tax incentives and one of them, [the GREEN act](https://electrek.co/2021/02/26/more-generous-electric-car-federal-tax-credit-reform-being-proposed/), included a point-of-sales aspect.

&#x200B;

CREDIT -ELECTREK

long clean energy etc seem to be the play.Thoughts?",t3_mh2ryh,12
1617213077.0,2021-03-31,wallstreetbets,gsxswhw,"TSLA 677.50C, 700C, 705C. All expiring tomorrow.

This clown makeup is permanent baby 🤡",t3_mh2ryh,12
1617213243.0,2021-03-31,wallstreetbets,gsxt9v4,"SPY gonna domp, easy to spot double top",t3_mh2ryh,11
1617215244.0,2021-03-31,wallstreetbets,gsxxnfi,"Bears on the ropes! 
It’s me, I’m on the ropes. Between that damn boat, inflation and tax hikes I’m loaded to the tits on what were ITM puts. 
Fuck",t3_mh2ryh,13
1617216413.0,2021-03-31,wallstreetbets,gsy077w,"""VIAC good long term play""

""Not a bad entry point  if you want to hold VIAC for the next couple of month/years '

&#x200B;

Bitch, my calls expire next week.",t3_mh2ryh,13
1617218690.0,2021-03-31,wallstreetbets,gsy55y3,#$MVIS holders are gonna feast. Well played boizzzzzzz,t3_mh2ryh,12
1617218707.0,2021-03-31,wallstreetbets,gsy579v,I got MVIS AT 3200 shares @ 6$. I tried to tell you but nobody listened. Wait till they demo their LIDAR 📈🚀📈🚀🚀,t3_mh2ryh,12
1617219592.0,2021-03-31,wallstreetbets,gsy74zk,MVIS UP 50% LETS GO CHAMP,t3_mh2ryh,12
1617220053.0,2021-03-31,wallstreetbets,gsy857d,Holy MVIS. Bought some 4/16 18c on it last week when it was in the tank. Almost shit myself when I opened my app and it was at $18,t3_mh2ryh,13
1617222265.0,2021-03-31,wallstreetbets,gsyczvm,When is the $TSLA delivery numbers coming out? I bought $5k worth of $900 options expiring tomorrow but I think I fucked up,t3_mh2ryh,14
1617229726.0,2021-03-31,wallstreetbets,gsysg78,Glad to see the bulls,t3_mh2ryh,12
1617191407.0,2021-03-31,wallstreetbets,gswlud9,Ok Apple....announce some Apple car news and let’s roll.....,t3_mh2ryh,35
1617184891.0,2021-03-31,wallstreetbets,gsweg3u,"I love you guys.  I hope we all get rich together,",t3_mh2ryh,51
1617192372.0,2021-03-31,wallstreetbets,gswn5v9,"
>PLTR -10%

""It's just a dip bro, buy it up!"" 😬

>PLTR -20%

""Just a healthy correction bro!"" 😅

>PLTR -50%

""Consolidation bro! ATH by EoD tomorrow!"" 😰

>PLTR delisted March 31, 2021

🤡",t3_mh2ryh,52
1617186182.0,2021-03-31,wallstreetbets,gswfqru,Details of the infrastructure plan for anyone who wants to read it... https://punchbowl.news/wp-content/uploads/American-Jobs-Plan-Fact-Sheet.pdf,t3_mh2ryh,11
1617187572.0,2021-03-31,wallstreetbets,gswh86w,"I need an adult, I'm not used to seeing green anymore this is weird",t3_mh2ryh,11
1617189119.0,2021-03-31,wallstreetbets,gswiz2p,"Hope you brought your own lube today, 🐻",t3_mh2ryh,11
1617190632.0,2021-03-31,wallstreetbets,gswktn8,"If stocks don’t go back up, I will never be able to buy that iced out Bart Simpson chain I’ve been eyeing 😔",t3_mh2ryh,11
1617190937.0,2021-03-31,wallstreetbets,gswl7u6,[deleted],t3_mh2ryh,12
1617192096.0,2021-03-31,wallstreetbets,gswms29,Folks... Please pour one out this Easter weekend for all the gay bears who died today.,t3_mh2ryh,11
1617192358.0,2021-03-31,wallstreetbets,gswn56l,"Shits green boys, I'm scared.",t3_mh2ryh,11
1617192700.0,2021-03-31,wallstreetbets,gswnmkd,My chewy calls are gonna print,t3_mh2ryh,12
1617192879.0,2021-03-31,wallstreetbets,gswnvsh,I think at this point everyone knows virgin galactics 7 billion market cap is based on a PowerPoint slide show but damn their most recent video is sick,t3_mh2ryh,11
1617194063.0,2021-03-31,wallstreetbets,gswpo10,The best part of waking up is Shrek dicks in your cup,t3_mh2ryh,11
1617199829.0,2021-03-31,wallstreetbets,gswzxuv,The tech sell off was literally just a correction. Tech is the future. BULL GANG FUCKING THIS WEEK FOR SURE!!,t3_mh2ryh,10
1617199865.0,2021-03-31,wallstreetbets,gsx00fy,"Most of my put options are close to worthless now, aint live is great... lost 10k in 2 weeks damn",t3_mh2ryh,11
1617200039.0,2021-03-31,wallstreetbets,gsx0d0x,"I'm like the anti king midas, everything I touch turns to shit or red dildos.",t3_mh2ryh,10
1617200844.0,2021-03-31,wallstreetbets,gsx20iq,Palantir Pirates gettin that booty ☠️☠️☠️,t3_mh2ryh,11
1617201162.0,2021-03-31,wallstreetbets,gsx2o89,Back to back green days for Palantir... Bottom is in boys,t3_mh2ryh,10
1617201366.0,2021-03-31,wallstreetbets,gsx33in,"Made up my losses from yesterday 💪🏻💪🏻💪🏻

Only 45k to go to make up for the last two months",t3_mh2ryh,12
1617201681.0,2021-03-31,wallstreetbets,gsx3r9y,"Hahahah get fukt bears!

- me after selling my puts 10 minutes ago for an 80% loss",t3_mh2ryh,11
1617201894.0,2021-03-31,wallstreetbets,gsx47ag,What's happening with DISCB?? Level 2 data is all over the place... never seen this before.,t3_mh2ryh,11
1617201991.0,2021-03-31,wallstreetbets,gsx4en0,"Always love how SQ is kept down for days, even weeks, then a day without any news specific to it suddenly has it regaining weeks of losses. Totally not manipulated or anything!",t3_mh2ryh,12
1617202169.0,2021-03-31,wallstreetbets,gsx4s24,Lol discovery went to the moon. They can’t convince us that this isn’t a casino,t3_mh2ryh,10
1617202416.0,2021-03-31,wallstreetbets,gsx5asl,Maybe you need a few red days in order to fully appreciate the green ones,t3_mh2ryh,10
1617202736.0,2021-03-31,wallstreetbets,gsx5zfx,Huge green candles on APHA,t3_mh2ryh,11
1617202800.0,2021-03-31,wallstreetbets,gsx64fk,Everyone is having fun today except for that Indian dude who can only say Blackberry,t3_mh2ryh,11
1617202858.0,2021-03-31,wallstreetbets,gsx68vf,[deleted],t3_mh2ryh,12
1617202950.0,2021-03-31,wallstreetbets,gsx6fv6,I went full retard on DISCA,t3_mh2ryh,11
1617203437.0,2021-03-31,wallstreetbets,gsx7h9q,God I fucking suck at this,t3_mh2ryh,10
1617203964.0,2021-03-31,wallstreetbets,gsx8mev,DISB volatility is fucking wild,t3_mh2ryh,10
1617204064.0,2021-03-31,wallstreetbets,gsx8ud8,So.....buy DISCA?,t3_mh2ryh,11
1617204233.0,2021-03-31,wallstreetbets,gsx97po,DISCA has to moon right,t3_mh2ryh,10
1617204775.0,2021-03-31,wallstreetbets,gsxaegv,posture check.,t3_mh2ryh,10
1617205062.0,2021-03-31,wallstreetbets,gsxb185,I am ber and I am fuk,t3_mh2ryh,12
1617205495.0,2021-03-31,wallstreetbets,gsxbzwx,"Biden to smoke a massive blunt at 4:20 pm, giving a whole new meaning to the name Sleepy Joe.",t3_mh2ryh,11
1617205720.0,2021-03-31,wallstreetbets,gsxci3f,ARISE PALANTARDS,t3_mh2ryh,12
1617205858.0,2021-03-31,wallstreetbets,gsxct89,PLTR holders - I bought puts a week ago. You're welcome.,t3_mh2ryh,10
1617205926.0,2021-03-31,wallstreetbets,gsxcyqw,holy fuck PLTR welcome back!!!!,t3_mh2ryh,10
1617205989.0,2021-03-31,wallstreetbets,gsxd3y0,DISCA now boys. Get on board.,t3_mh2ryh,11
1617206098.0,2021-03-31,wallstreetbets,gsxdcow,PLTR elevator mode,t3_mh2ryh,11
1617206691.0,2021-03-31,wallstreetbets,gsxeo4o,"Y’all ever yolo your portfolio, sell at a 30% loss then 2 days later see you had a 5 bagger? Ya me either 🤡🤡",t3_mh2ryh,10
1617206878.0,2021-03-31,wallstreetbets,gsxf34i,i have managed to make every move the wrong move for the last 6 trading days.,t3_mh2ryh,11
1617207067.0,2021-03-31,wallstreetbets,gsxfi3x,yes PLTR moon for me baby you good thing fuck yeah,t3_mh2ryh,9
1617207675.0,2021-03-31,wallstreetbets,gsxgusv,"Up about 6% today

Just 15 straight days just like this and I’m retired",t3_mh2ryh,11
1617207719.0,2021-03-31,wallstreetbets,gsxgy8v,Go PLTR you can be anything you want. Just don’t be 🌈,t3_mh2ryh,10
1617207896.0,2021-03-31,wallstreetbets,gsxhcgo,Leveraged to the tits. Pray for me,t3_mh2ryh,11
1617208639.0,2021-03-31,wallstreetbets,gsxj0hp,TSLA out for a rip are ya bud?,t3_mh2ryh,10
1617208803.0,2021-03-31,wallstreetbets,gsxjdqz,Just praying for TSLA to hit 700 LOL,t3_mh2ryh,11
1617209146.0,2021-03-31,wallstreetbets,gsxk5gx,Pltr bag holders rejoice,t3_mh2ryh,12
1617209704.0,2021-03-31,wallstreetbets,gsxle9s,[deleted],t3_mh2ryh,11
1617210006.0,2021-03-31,wallstreetbets,gsxm2v2,ber is ultra fuk,t3_mh2ryh,11
1617210258.0,2021-03-31,wallstreetbets,gsxmn02,Literally what the fuck DISCB?,t3_mh2ryh,11
1617210436.0,2021-03-31,wallstreetbets,gsxn15c,Bear gang.. must be in shambles,t3_mh2ryh,12
1617211590.0,2021-03-31,wallstreetbets,gsxplll,"Markets ripping

RKT: Just let me die",t3_mh2ryh,11
1617211646.0,2021-03-31,wallstreetbets,gsxpq6f,PLTR GO BRRRRRRRRR!!,t3_mh2ryh,10
1617211848.0,2021-03-31,wallstreetbets,gsxq6j5,I thought my Palantir FD was playing an early April Fool’s joke on me when I saw my $33.5 4/1 c I got for $0.08 premium turn green so I sold early like a clown. Now it’s up 675% 🤡,t3_mh2ryh,11
1617212432.0,2021-03-31,wallstreetbets,gsxrh5a,"if aapl hits 130 tomorrow, i will gold the first 30 people to reply this comment.  


edit: reply not replay...",t3_mh2ryh,12
1617213172.0,2021-03-31,wallstreetbets,gsxt434,Face-ripping rally will continue until morale worsens.,t3_mh2ryh,12
1617214546.0,2021-03-31,wallstreetbets,gsxw4pd,Some of the most patient people I have met are palantards,t3_mh2ryh,12
1617219045.0,2021-03-31,wallstreetbets,gsy5xw5,Raise your hand if you just  bought MVIS at $18+,t3_mh2ryh,10
1617219146.0,2021-03-31,wallstreetbets,gsy65vn,Congrats to the mvis people!,t3_mh2ryh,11
1617219754.0,2021-03-31,wallstreetbets,gsy7hqu,I cannot wait to see everyone's MVIS gain porn,t3_mh2ryh,10
1617220462.0,2021-03-31,wallstreetbets,gsy90zx,Damn ARK went vertical today....Jesus helping Cathie out for Easter,t3_mh2ryh,11
1617220494.0,2021-03-31,wallstreetbets,gsy93ix,I’m getting an MVIS license plate for my lambo,t3_mh2ryh,11
1617220840.0,2021-03-31,wallstreetbets,gsy9uvk,"17 hours , 29 Minutes until regular session opens",t3_mh2ryh,11
1617220916.0,2021-03-31,wallstreetbets,gsya156,And.....fuck off March,t3_mh2ryh,10
1617221087.0,2021-03-31,wallstreetbets,gsyaeyp,"For those bitching about a bad PLTR close. We had nearly a 6% day and two green days in a row. 

What more do you want?",t3_mh2ryh,11
1617224378.0,2021-03-31,wallstreetbets,gsyhl5z,when's Joe saying the words to make tesla run,t3_mh2ryh,11
1617192744.0,2021-03-31,wallstreetbets,gswnos5,"After some 3-4 years of highs and lows on WSB, GME has finally made me life changing money, again, but this time I’m holding strong. I’ve literally went from a normal money’d dude with a wife and no college degree.
Life is different now.
I could literally live off the 1-3% SPY/QQQ ETF’s, and live off that forever. 
God bless WSB.
MU 45
Su Bae
1ronyman
GUH
CRON bull run/TLRY explosion

Man, I loved checking in on WSB when it was low key, under 250k subs. It made me very rich and very poor many times. Most times I didn’t cash out near the top.
Ugh one time I showed my coworkers making 100k in a week, and 30k in a day.
Literally lost all 100k real quick, but now I’ve rallied up basically my whole workplace on GME.
I’ve changed two of my coworker friends’ lives.

Back when they missed out on me telling them about FCEL at .50, they listened to me for GME at $15.
One of the lowest paid employees is up 300%+ on her fcel, it’s hilarious, she’s a better trader than all the other car salesmen. 
Man, life is different
God bless GME and WSB",t3_mh2ryh,83
1617186277.0,2021-03-31,wallstreetbets,gswfuap,"Man, if i was a value investor I could get rich in 30 years.",t3_mh2ryh,10
1617187767.0,2021-03-31,wallstreetbets,gswhfx5,On WSB before I walk into the gym so I can constantly think about how much money I’m going to throw at the market today,t3_mh2ryh,11
1617189805.0,2021-03-31,wallstreetbets,gswjsr9,Mecha lecha high mecha hiney ho.,t3_mh2ryh,9
1617189835.0,2021-03-31,wallstreetbets,gswju3p,Spy rise or drill but do not waste my time.,t3_mh2ryh,10
1617190125.0,2021-03-31,wallstreetbets,gswk6rn,"Just an hour left boys. 

No matter what happens, remember the one thing we all have in common;

**FUCK THETA GANG**

Edit: FUCK DST",t3_mh2ryh,9
1617190779.0,2021-03-31,wallstreetbets,gswl0jc,the UWMC bagholders are desperate,t3_mh2ryh,9
1617191082.0,2021-03-31,wallstreetbets,gswleq8,These BBags got preeeeetty heavy yesterday. Guess I’ll keep holding,t3_mh2ryh,11
1617191295.0,2021-03-31,wallstreetbets,gswlowe,Damn Tesla is killing it in the pre market!,t3_mh2ryh,11
1617191912.0,2021-03-31,wallstreetbets,gswmj13,"$ARVL $OPEN $APHA $SOXL $PLUG $FCEL $GEVO $WBA all looking juicy af 🤑🤑🤑

Green Day to all!!!",t3_mh2ryh,11
1617192253.0,2021-03-31,wallstreetbets,gswn00j,"Is investing in TLRY for the day smart, or should I just buy an ounce?",t3_mh2ryh,10
1617192307.0,2021-03-31,wallstreetbets,gswn2nn,"Im bullish on pot stocks today but also have some reload for a possible gme dip, doubt we will see one.",t3_mh2ryh,10
1617192686.0,2021-03-31,wallstreetbets,gswnlsd,"Full send on palantir, their products are named gotham, foundry, and apollo..

https://youtu.be/6VTKtJN-e24

🚀 PLTR $30c 6/18",t3_mh2ryh,10
1617193707.0,2021-03-31,wallstreetbets,gswp3zt,Man.. if IT folks ever look at my web usage in the office they are going to think I have a problem... its just back and forth between WSB and my brokerage account.,t3_mh2ryh,10
1617194748.0,2021-03-31,wallstreetbets,gswqr17,Is PLTR starting a resurgence again? Don't tease me !!!,t3_mh2ryh,9
1617194823.0,2021-03-31,wallstreetbets,gswqvjd,Any shot AAPL sees $125 today?,t3_mh2ryh,10
1617196099.0,2021-03-31,wallstreetbets,gswszr9,Im sensing a 10 point day for AAPL,t3_mh2ryh,9
1617196106.0,2021-03-31,wallstreetbets,gswt05d,Cathie just tweeted: “Bears r Philistines”,t3_mh2ryh,10
1617196194.0,2021-03-31,wallstreetbets,gswt5n6,Pretty bullish in here. We all know what happens whenever this sub is entirely bullish or entirely bearish,t3_mh2ryh,10
1617196382.0,2021-03-31,wallstreetbets,gswthjt,Rip my tesla puts,t3_mh2ryh,10
1617196474.0,2021-03-31,wallstreetbets,gswtnea,"50/50 CHANCE, IT CAN GO UP OR DOWN. THANKS FOR COMING TO MY TED TALK.",t3_mh2ryh,11
1617196530.0,2021-03-31,wallstreetbets,gswtqwg,"Bull gods, give us that rare and glorious

 MEGA 

GREEN 

DAY 

🕯 🙌 🐂 🙌 🕯",t3_mh2ryh,9
1617197438.0,2021-03-31,wallstreetbets,gswve27,"Microvision : MVIS

If you know, you know.",t3_mh2ryh,9
1617197506.0,2021-03-31,wallstreetbets,gswvihn,I'm ready for market and I will buy WSFT about 3000 shares. Yesterday had nice volume and is 6 days in row green.,t3_mh2ryh,97
1617197607.0,2021-03-31,wallstreetbets,gswvp1i,Damn APHA we now finally making money!,t3_mh2ryh,10
1617198575.0,2021-03-31,wallstreetbets,gswxi2h,PLTR YOU BITCH GO GO GO,t3_mh2ryh,11
1617198589.0,2021-03-31,wallstreetbets,gswxj1i,APHA-TLRY 💪,t3_mh2ryh,10
1617198812.0,2021-03-31,wallstreetbets,gswxyia,"damn APHA gapped up, feels so fukcing goooood",t3_mh2ryh,10
1617198911.0,2021-03-31,wallstreetbets,gswy5bx,More AAPL 🚀,t3_mh2ryh,10
1617199894.0,2021-03-31,wallstreetbets,gsx02k9,Return of the Palantards,t3_mh2ryh,9
1617199965.0,2021-03-31,wallstreetbets,gsx07op,Fuck seaworld all my homies hate seaworld,t3_mh2ryh,9
1617200168.0,2021-03-31,wallstreetbets,gsx0mfg,"Wait, stonks finally go up. It’s so beautiful. *cries*",t3_mh2ryh,10
1617200671.0,2021-03-31,wallstreetbets,gsx1ntc,we're still up? Is that legal?,t3_mh2ryh,12
1617200885.0,2021-03-31,wallstreetbets,gsx23fq,"portfolio yesterday: down -5%

portfolio today: up +4.5%

I'll take it 😩",t3_mh2ryh,9
1617200895.0,2021-03-31,wallstreetbets,gsx2470,TSLA please save my 700 call EOW,t3_mh2ryh,9
1617201156.0,2021-03-31,wallstreetbets,gsx2nt6,What’s going on with Discb?,t3_mh2ryh,10
1617201256.0,2021-03-31,wallstreetbets,gsx2v9l,Apes take note. DISCB is what a squeeze looks like,t3_mh2ryh,10
1617202288.0,2021-03-31,wallstreetbets,gsx50zw,I wish Disca would rocket like Discb to save my $95 calls,t3_mh2ryh,10
1617202356.0,2021-03-31,wallstreetbets,gsx565l,Wtf is going on with discovery???,t3_mh2ryh,9
1617202457.0,2021-03-31,wallstreetbets,gsx5dya,Bears in shambles! Let's fucking goooooooooooooooooooooooooo!,t3_mh2ryh,11
1617202479.0,2021-03-31,wallstreetbets,gsx5fp0,"Imagine trying to catch DISCB after a massive run up instead of DISCA. 

😂👍",t3_mh2ryh,10
1617202657.0,2021-03-31,wallstreetbets,gsx5te3,Of course I bought the wrong discovery channel stock,t3_mh2ryh,8
1617202727.0,2021-03-31,wallstreetbets,gsx5ysl,This is how gey bears felt 2 months straight.,t3_mh2ryh,9
1617202858.0,2021-03-31,wallstreetbets,gsx68u8,Wth going with Discovery?!!,t3_mh2ryh,9
1617202936.0,2021-03-31,wallstreetbets,gsx6esh,Infrastructure bill 🤝 Palantir,t3_mh2ryh,10
1617203785.0,2021-03-31,wallstreetbets,gsx88cv,"Exciting time ahead for Clean Energy, EVs and Weed! Spotlight back in memes.",t3_mh2ryh,10
1617203964.0,2021-03-31,wallstreetbets,gsx8mfg,Why is VIAC still tanking? My bleeding calls would like to talk to the manager please.,t3_mh2ryh,10
1617204771.0,2021-03-31,wallstreetbets,gsxae6y,Massive bull day and Im up 0.5% 🤡,t3_mh2ryh,10
1617205296.0,2021-03-31,wallstreetbets,gsxbjzx,Puts on the entire damn market at 4:20 EST cause the uh...uh...the thing,t3_mh2ryh,9
1617205322.0,2021-03-31,wallstreetbets,gsxbm2u,Whoever is selling dkng I’m coming over to fuck your mother,t3_mh2ryh,9
1617205574.0,2021-03-31,wallstreetbets,gsxc68l,Disca now,t3_mh2ryh,9
1617205790.0,2021-03-31,wallstreetbets,gsxcnr1,Keep going PLTR. My options need you at 30 tomorrow,t3_mh2ryh,10
1617205830.0,2021-03-31,wallstreetbets,gsxcqyc,PLTR 🚀🌝,t3_mh2ryh,11
1617206075.0,2021-03-31,wallstreetbets,gsxdaw5,Pltr bear SUCK MY FUCKING HAIRY BALLS U SUCKERS,t3_mh2ryh,10
1617206079.0,2021-03-31,wallstreetbets,gsxdb8d,Palantards rise up!!,t3_mh2ryh,9
1617206083.0,2021-03-31,wallstreetbets,gsxdbk6,holy shit I broke even on PLTR...,t3_mh2ryh,10
1617206095.0,2021-03-31,wallstreetbets,gsxdch5,$PLTR IS ALIVE !!!!,t3_mh2ryh,10
1617206095.0,2021-03-31,wallstreetbets,gsxdcim,PLTR BABY🚀,t3_mh2ryh,10
1617207030.0,2021-03-31,wallstreetbets,gsxff79,"Heyyyyy wait a minute. I’ve seen this before. 
  
*buys PLTR puts*",t3_mh2ryh,10
1617207339.0,2021-03-31,wallstreetbets,gsxg3o2,My god pltr I’m so hard,t3_mh2ryh,11
1617207340.0,2021-03-31,wallstreetbets,gsxg3qf,PLTR don’t stop pls bb 😳🤤,t3_mh2ryh,12
1617207620.0,2021-03-31,wallstreetbets,gsxgqbs,"* Position: 113 Contracts
* Open Interest: 113 Contracts
* Ask: .05
* Bid: .00",t3_mh2ryh,10
1617208083.0,2021-03-31,wallstreetbets,gsxhrj2,"Tech! Let my miner stocks out of your gnarly grasp! The corn is going up, free my people!",t3_mh2ryh,10
1617208121.0,2021-03-31,wallstreetbets,gsxhunv,rkt wtf,t3_mh2ryh,10
1617208520.0,2021-03-31,wallstreetbets,gsxir0r,"Y’all wanted EZ mode back, here it is. Just buy tech calls",t3_mh2ryh,10
1617208595.0,2021-03-31,wallstreetbets,gsxiwyy,"Been WFH for over a year and down 15 lbs. I know this is backwards for some, but the cafeteria food was real shitty at the office.",t3_mh2ryh,11
1617208734.0,2021-03-31,wallstreetbets,gsxj82t,Biden’s plan is out,t3_mh2ryh,10
1617208780.0,2021-03-31,wallstreetbets,gsxjbrz,I love how TSLA was $594 yesterday and now it’s almost $670,t3_mh2ryh,9
1617209026.0,2021-03-31,wallstreetbets,gsxjvpz,What the fk is this DISCB and why is it rising +80% today? I believe it rose 20+% yesterday too. This is making me upset.,t3_mh2ryh,11
1617209292.0,2021-03-31,wallstreetbets,gsxkh7i,GNUS more like ANUS,t3_mh2ryh,9
1617209786.0,2021-03-31,wallstreetbets,gsxll19,can all of april be like today,t3_mh2ryh,11
1617209970.0,2021-03-31,wallstreetbets,gsxlzzg,I was told there would be UWMC tendies,t3_mh2ryh,11
1617210109.0,2021-03-31,wallstreetbets,gsxmb12,Wtf I totally missed the discovery erection,t3_mh2ryh,10
1617210135.0,2021-03-31,wallstreetbets,gsxmd32,Lost $400 on 0dte spy puts. BUT IDGAF MY PLTR CALLS WENT FROM -80% TO -70%,t3_mh2ryh,11
1617210184.0,2021-03-31,wallstreetbets,gsxmgzx,What on earth is wrong with $DISCA,t3_mh2ryh,9
1617210452.0,2021-03-31,wallstreetbets,gsxn2gh,Come on apha you bitch go over 19.,t3_mh2ryh,10
1617210891.0,2021-03-31,wallstreetbets,gsxo1l6,Just bought SPY puts cause I wanted to buy calls and I'm always wrong,t3_mh2ryh,10
1617211242.0,2021-03-31,wallstreetbets,gsxotom,"I never had gf

I 29",t3_mh2ryh,9
1617211354.0,2021-03-31,wallstreetbets,gsxp2oj,i’m sure this DISCB thing will end well,t3_mh2ryh,10
1617211541.0,2021-03-31,wallstreetbets,gsxphrr,"Once again, I was wrong. I said yesterday was the ""buy the rumor"" day ahead of Buyden's infra announcement and that today will be a ""sell the news"" day, a red day.

I am the wrongest person in the history of trading.",t3_mh2ryh,9
1617211669.0,2021-03-31,wallstreetbets,gsxps10,April fools tomorrow,t3_mh2ryh,10
1617211714.0,2021-03-31,wallstreetbets,gsxpvq8,Moon me NOK!!!!,t3_mh2ryh,10
1617211984.0,2021-03-31,wallstreetbets,gsxqhee,"Ok DISCA, now is the time to do something instead of letting your big bro steal the show",t3_mh2ryh,11
1617214191.0,2021-03-31,wallstreetbets,gsxvd1b,Just got the moderna shot. Im vaxxed to the tits.,t3_mh2ryh,9
1617214273.0,2021-03-31,wallstreetbets,gsxvj8i,"Wtf happened to this sub, it’s all posts about gay shares outside of this daily thread. What happened to all the big option plays",t3_mh2ryh,9
1617214591.0,2021-03-31,wallstreetbets,gsxw89s,-17k on the day and feeling like captain of Hwang Gang,t3_mh2ryh,9
1617216206.0,2021-03-31,wallstreetbets,gsxzr1g,Scrolled thru my feed and not a single GME post.,t3_mh2ryh,10
1617216467.0,2021-03-31,wallstreetbets,gsy0bgt,"The casino is doing fine today, why can't it be like this every damn single day?",t3_mh2ryh,11
1617218596.0,2021-03-31,wallstreetbets,gsy4yjh,Tesla 750+ eow let's go,t3_mh2ryh,10
1617218828.0,2021-03-31,wallstreetbets,gsy5gv4,"I just cleared all my positions. Full liquid.

I’ve gotten too many things wrong these last two weeks. Need to reassess.

Fuck what a month",t3_mh2ryh,9
1617218973.0,2021-03-31,wallstreetbets,gsy5s75,I have a strong feeling TSLA is about to do some crazy shit after Biden’s speech,t3_mh2ryh,9
1617219165.0,2021-03-31,wallstreetbets,gsy67cd,RKT from the grave,t3_mh2ryh,9
1617220018.0,2021-03-31,wallstreetbets,gsy82fp,"Not in on MVIS, but would love to see it break $20 for ya'll today.",t3_mh2ryh,10
1617220121.0,2021-03-31,wallstreetbets,gsy8ad6,"What the fuck, I ask this thread about MVIS multiple times before, and get silence. Suddenly the lurkers come out and act like bulls. Fuck you 🚀🦍",t3_mh2ryh,10
