created,date,subreddit,id,body,parent_id,score
1620736449.0,2021-05-11,wallstreetbets,gxpztsx,"Holding PLTR from $12.20, held through all the spikes (stupid), burned myself on 25c 23c 22c months ago. Will buy more at $8 and will then hold through all of their incoming reverse splits, and let my children inherit the worthless pink sheets.

Edit: I was too stubborn to buy puts. Still holding 23c 6/17/22s

Edit 2: My children are inheriting a worthless mistress, my wife’s boyfriend will will them a fortune",t3_n9th6n,14
1620736580.0,2021-05-11,wallstreetbets,gxq02da,Lost every gain i had. A years worth of gains gone! Lesson learned: buy more. 😎,t3_n9th6n,14
1620736670.0,2021-05-11,wallstreetbets,gxq085t,I DECLARE BANKRUPTCYYYYYYYYYY!!!!!!!!!!!!!!!!,t3_n9th6n,14
1620736793.0,2021-05-11,wallstreetbets,gxq0gb9,Can’t help but feel really bad for anyone about to lose a lot of money today. Godspeed brothers. Just remember your family loves you,t3_n9th6n,14
1620736821.0,2021-05-11,wallstreetbets,gxq0i4t,I don‘t know if I should sell everything or buy everything again 😁😁😁,t3_n9th6n,13
1620737070.0,2021-05-11,wallstreetbets,gxq0yfp,Let’s pray 🙏for our palantard brothers👨🏼,t3_n9th6n,15
1620737337.0,2021-05-11,wallstreetbets,gxq1fyy,Gentleman it's been a pleasure buying FDs with you 😰,t3_n9th6n,14
1620739004.0,2021-05-11,wallstreetbets,gxq4n1a,"The stuff I sold: down 2%

The stuff I held: down 8%

🤡🤡🤡",t3_n9th6n,15
1620739116.0,2021-05-11,wallstreetbets,gxq4uzg,[deleted],t3_n9th6n,15
1620739396.0,2021-05-11,wallstreetbets,gxq5f9u,"step market, why are you trying to take my pants off?",t3_n9th6n,14
1620739498.0,2021-05-11,wallstreetbets,gxq5mgf,So...no lambo? Box instead?,t3_n9th6n,15
1620739509.0,2021-05-11,wallstreetbets,gxq5n9p,it was a pleasure playing with you gentlemen 🎻,t3_n9th6n,14
1620739588.0,2021-05-11,wallstreetbets,gxq5t2e,"SPY: 2.3% from all time high

WSB: down 97.7%",t3_n9th6n,14
1620740776.0,2021-05-11,wallstreetbets,gxq89hl,"*PLTR*

#Look at me. I'm the Captain now",t3_n9th6n,14
1620740795.0,2021-05-11,wallstreetbets,gxq8b2g,Now PLTR decides to go green after I was forced liquidated 🤡,t3_n9th6n,15
1620741662.0,2021-05-11,wallstreetbets,gxqa7m4,"If you panic sold pre-market or in the first 15 minutes of trading, you're probably not cut out for this kind of stuff...",t3_n9th6n,14
1620742846.0,2021-05-11,wallstreetbets,gxqcuxa,If the tech market crashes and housing doesn’t correct that is nature’s way of saying FU to millennials,t3_n9th6n,14
1620743649.0,2021-05-11,wallstreetbets,gxqepj4,I haven’t done anything right since February,t3_n9th6n,13
1620750181.0,2021-05-11,wallstreetbets,gxqu7ti,anyone numb to losing money,t3_n9th6n,13
1620751891.0,2021-05-11,wallstreetbets,gxqybez,[deleted],t3_n9th6n,13
1620752339.0,2021-05-11,wallstreetbets,gxqzeu7,The PLTR seller who sold at 17.9: *bruh*,t3_n9th6n,15
1620761369.0,2021-05-11,wallstreetbets,gxrljj9,"I panic sold and incurred $1500 loss. After losing more than 70k in the past 3 months, every dollar matters and all i feel is pain...",t3_n9th6n,15
1620763331.0,2021-05-11,wallstreetbets,gxrqaih,Kinda sad that there are more posts about shares than 1DTE Options now on this sub,t3_n9th6n,14
1620765212.0,2021-05-11,wallstreetbets,gxrutt9,FUBO crushed earnings. It's not too late to get in boys & girls. Think this one may be headed up for a while with sports betting becoming legal in more states and them having their own app plus the sports delivery platform.,t3_n9th6n,14
1620729224.0,2021-05-11,wallstreetbets,gxppb2w,Remember when we were all geniuses last year??,t3_n9th6n,41
1620731606.0,2021-05-11,wallstreetbets,gxpsa9c,STOP THE COUNT,t3_n9th6n,12
1620733236.0,2021-05-11,wallstreetbets,gxpukrh,I am fucked. Can’t stress that enough.,t3_n9th6n,13
1620735380.0,2021-05-11,wallstreetbets,gxpxyx8,[deleted],t3_n9th6n,13
1620735773.0,2021-05-11,wallstreetbets,gxpynic,Are circuit breakers back on the menu??,t3_n9th6n,13
1620738267.0,2021-05-11,wallstreetbets,gxq3728,I’m diversified so *ALL* my stocks are down 😎,t3_n9th6n,12
1620738661.0,2021-05-11,wallstreetbets,gxq3ynm,[deleted],t3_n9th6n,13
1620744637.0,2021-05-11,wallstreetbets,gxqh0mr,Everyone is fuk,t3_n9th6n,12
1620744793.0,2021-05-11,wallstreetbets,gxqhdv8,[deleted],t3_n9th6n,13
1620748786.0,2021-05-11,wallstreetbets,gxqqvg2,"If anyone wants any pointers, I was able to change my portfolio by 224k in the past quarter.

Negatively.",t3_n9th6n,13
1620751525.0,2021-05-11,wallstreetbets,gxqxfk8,Palantards rise from the ashes 😤,t3_n9th6n,13
1620751632.0,2021-05-11,wallstreetbets,gxqxope,"To the person that told us earlier this morning that if we still hold PLTR we deserved the meltdown:

I sincerely hope you had a very large position on puts.",t3_n9th6n,13
1620753223.0,2021-05-11,wallstreetbets,gxr1kk0,The lower the stock market crashes the higher it'll rebound that is a certainty. What matters is if you have the resolve to hold through the crash and reach all time highs or paper hand out like a bitch at the first sign of heat.,t3_n9th6n,12
1620753322.0,2021-05-11,wallstreetbets,gxr1t7v,This market transitions more abruptly than Caitlyn Jenner,t3_n9th6n,13
1620753402.0,2021-05-11,wallstreetbets,gxr20kn,Why does the moon look like the ocean floor?,t3_n9th6n,13
1620754614.0,2021-05-11,wallstreetbets,gxr4zdu,Rotation from tech to value and back to tech all on the same day,t3_n9th6n,14
1620755448.0,2021-05-11,wallstreetbets,gxr71kj,If I ever catch paysafe out in the streets I’m fucking him up,t3_n9th6n,13
1620756430.0,2021-05-11,wallstreetbets,gxr9g6y,Ah the classic bear bull bear bull trap,t3_n9th6n,13
1620759443.0,2021-05-11,wallstreetbets,gxrgt3t,Imagine the dude who bought puts at open... Oh wait im that retard 🤡,t3_n9th6n,13
1620727397.0,2021-05-11,wallstreetbets,gxpn7ur,[deleted],t3_n9th6n,56
1620727559.0,2021-05-11,wallstreetbets,gxpneei,I dont know if ill have anything left till the market opens...,t3_n9th6n,12
1620728321.0,2021-05-11,wallstreetbets,gxpo92x,Usually when I get the urge to paper hand is when things reverse so I think we’re close,t3_n9th6n,13
1620729336.0,2021-05-11,wallstreetbets,gxppfyb,CaThIe Is A gEnIuS,t3_n9th6n,11
1620729471.0,2021-05-11,wallstreetbets,gxpplto,I’m not having fun anymore,t3_n9th6n,12
1620729623.0,2021-05-11,wallstreetbets,gxppsbb,Holy fuck Palantir bleeding.,t3_n9th6n,12
1620730185.0,2021-05-11,wallstreetbets,gxpqgtv,"Can someone please explain this continued sell-off? Does it have to do with inflation because I'm really not trying to sit here and buy energy, materials and consumer good stocks for the next year.",t3_n9th6n,12
1620731304.0,2021-05-11,wallstreetbets,gxprw3u,F for plantards,t3_n9th6n,12
1620731344.0,2021-05-11,wallstreetbets,gxprxy3,Donde esta la bibliotecha,t3_n9th6n,13
1620731458.0,2021-05-11,wallstreetbets,gxps387,Starting to realize I have been finessed by Cathie,t3_n9th6n,12
1620731907.0,2021-05-11,wallstreetbets,gxpsoju,"I hate that I’m losing money, but this bull run couldn’t have gone on forever. 100-500% run ups in one year is simply not healthy. 

A good 20% correction and we’ll get the tasty dips we were waiting for. Hold onto your capital please",t3_n9th6n,12
1620732387.0,2021-05-11,wallstreetbets,gxptcg7,Who’s got the heavy bags this morning?,t3_n9th6n,13
1620732477.0,2021-05-11,wallstreetbets,gxpth1j,"You know some people bought the top of growth, and are going to sell the bottom. Only to FOMO into value at the top too. 😂",t3_n9th6n,11
1620732498.0,2021-05-11,wallstreetbets,gxpti3n,Romney has a $100 million roth IRA. WTF game is rigged,t3_n9th6n,12
1620732776.0,2021-05-11,wallstreetbets,gxptw9n,"Account value was 70 grand two weeks ago.......             now below 50 grand, thanks PLTR 👍🏻👍🏻👍🏻👍🏻👍🏻",t3_n9th6n,13
1620732988.0,2021-05-11,wallstreetbets,gxpu7e4,tech bubble go pop :(,t3_n9th6n,13
1620733406.0,2021-05-11,wallstreetbets,gxputok,I'm down 24% premarket... Lol,t3_n9th6n,10
1620733503.0,2021-05-11,wallstreetbets,gxpuyws,"A year of gains destroyed in 3 months...
Is there any real tangible reason for this crap?",t3_n9th6n,12
1620734461.0,2021-05-11,wallstreetbets,gxpwggs,"Hahahaha

This is worst than the COVID crash bc somehow the indexes are going up but everything I see is ded

What are people investing in that is going up",t3_n9th6n,12
1620734606.0,2021-05-11,wallstreetbets,gxpwotw,"Waiting for that one guy to type ""green by open""",t3_n9th6n,13
1620735149.0,2021-05-11,wallstreetbets,gxpxkzj,"Christ, the worry is if people panic at open, we could be looking at a 1987 armagheddon type day today. -10%+ across the board.

God have mercy upon us.",t3_n9th6n,12
1620735793.0,2021-05-11,wallstreetbets,gxpyoo8,Oreo prophecy was true,t3_n9th6n,11
1620735983.0,2021-05-11,wallstreetbets,gxpz0id,"Invest in stocks they said, passive income they said, better than leaving your funds in a bank account they said... as i look at my selection of growth stocks down 40% or more :D",t3_n9th6n,12
1620736483.0,2021-05-11,wallstreetbets,gxpzw1h,Every stock I own is down 10% pre-market cool cool cool cool,t3_n9th6n,12
1620736483.0,2021-05-11,wallstreetbets,gxpzw21,I welcome the drop. I love this setup. Strong conviction in tech. I don't believe computers are just a fad.,t3_n9th6n,12
1620737421.0,2021-05-11,wallstreetbets,gxq1lwu,I’m fucked. Rip my savings :(,t3_n9th6n,11
1620737537.0,2021-05-11,wallstreetbets,gxq1tpo,Friendly reminder that Elon on SNL was the top. He is now our bear messiah,t3_n9th6n,12
1620737616.0,2021-05-11,wallstreetbets,gxq1ywe,U r idiotic if u plan to buy puts or write calls today,t3_n9th6n,12
1620737828.0,2021-05-11,wallstreetbets,gxq2dcq,"Is there anything that could reasonably prop up tech at this point? 

All-time earnings smash, LOL fuck you red dildo.

Countless analyst upgrades, bigger red dildo.

Worst jobs report in 15 years, GREEN. LOL, just kidding here's an 18-inch red dildo.",t3_n9th6n,12
1620737860.0,2021-05-11,wallstreetbets,gxq2fjz,The great PE reset,t3_n9th6n,12
1620738381.0,2021-05-11,wallstreetbets,gxq3f3k,Someone unplug the market and plug it back in before 9:30,t3_n9th6n,12
1620738404.0,2021-05-11,wallstreetbets,gxq3gtb,I've lost so much at this point a -3% day doesn't even hurt anymore,t3_n9th6n,11
1620738412.0,2021-05-11,wallstreetbets,gxq3hd6,"Brit here, eating lunch in the garden intrigued to see how much money I lose at 2:30",t3_n9th6n,11
1620738458.0,2021-05-11,wallstreetbets,gxq3kjc,CLOSE THE CASINO,t3_n9th6n,11
1620738487.0,2021-05-11,wallstreetbets,gxq3mm2,i wish i had been more paper handed,t3_n9th6n,13
1620738672.0,2021-05-11,wallstreetbets,gxq3zfk,"Remember when Jpow said he would meet with the homeless?

I’m penciling him in for a Thursday 9am meeting.",t3_n9th6n,12
1620738706.0,2021-05-11,wallstreetbets,gxq41um,"*buys* 

*proceeds to dip*

*sips coffee*",t3_n9th6n,11
1620738947.0,2021-05-11,wallstreetbets,gxq4iyy,"*chuckles*

I’m in danger",t3_n9th6n,12
1620739041.0,2021-05-11,wallstreetbets,gxq4pmt,I swear It's been one big red slip and slide since the GME saga,t3_n9th6n,11
1620739112.0,2021-05-11,wallstreetbets,gxq4uoo,"I’m sure premarket is just a bear-trap. Unrelated, how early is too early to start drinking?",t3_n9th6n,12
1620739275.0,2021-05-11,wallstreetbets,gxq56ga,Maybe we're all here because we all hate our meaningless low payment jobs and want to escape work forever idk.,t3_n9th6n,13
1620739385.0,2021-05-11,wallstreetbets,gxq5ef0,"Palantards are fuk.


Dont worry tho were all fuk",t3_n9th6n,12
1620739557.0,2021-05-11,wallstreetbets,gxq5qsi,I sold my SPY puts yesterday. $420 5/14s. Ill be hosting a seminar on clown life at 3pm today. Be sure to drop by with any questions you may have.,t3_n9th6n,12
1620739961.0,2021-05-11,wallstreetbets,gxq6k5z,Turns out I'm a long term investor,t3_n9th6n,12
1620740797.0,2021-05-11,wallstreetbets,gxq8b7h,The same pattern always repeats- people are demoralized then prices rebound hard and suddenly Cramer is out waving the American flag and we’re the country you don’t bet against! Then the market sags again and the process repeats until nobody wants to touch stocks and then it’s usually time to buy,t3_n9th6n,12
1620740847.0,2021-05-11,wallstreetbets,gxq8f0t,50m volume pltr wtf,t3_n9th6n,11
1620741017.0,2021-05-11,wallstreetbets,gxq8sfm,PLTR you old sly dog,t3_n9th6n,13
1620742159.0,2021-05-11,wallstreetbets,gxqbb7e,"entire market - recovering

CLOV - i'll fuckin go lower m8",t3_n9th6n,13
1620742232.0,2021-05-11,wallstreetbets,gxqbgy8,I am amazed at my ability to do the wrong thing 🤡🤡🤡🤡🤡,t3_n9th6n,12
1620742276.0,2021-05-11,wallstreetbets,gxqbkfi,"If spy goes to $420 today, you’d be mad don’t lie",t3_n9th6n,12
1620743354.0,2021-05-11,wallstreetbets,gxqe0x5,#BEARLIVESDONTMATTER,t3_n9th6n,12
1620743482.0,2021-05-11,wallstreetbets,gxqebka,Bears are unamerican.,t3_n9th6n,12
1620743523.0,2021-05-11,wallstreetbets,gxqeezc,"Healthy pullback, yes should be health pullback, can’t drop anymore, I think after this pullback stock will go up

3 months later: 60% down",t3_n9th6n,13
1620743694.0,2021-05-11,wallstreetbets,gxqetgu,My disappointment is immeasurable and my day is ruined.,t3_n9th6n,12
1620743825.0,2021-05-11,wallstreetbets,gxqf4fr,Who else bought the dip 🤡,t3_n9th6n,13
1620744110.0,2021-05-11,wallstreetbets,gxqfs5c,All my gains since september 2020 have vanished because of stupid fomo trades and the market tanking. i went from a high of +28k to -5k without even playing options,t3_n9th6n,12
1620744599.0,2021-05-11,wallstreetbets,gxqgx9l,~~bear~~ ~~bull~~ idiot trap,t3_n9th6n,12
1620747205.0,2021-05-11,wallstreetbets,gxqn22x,PLTR 20 is the new 25,t3_n9th6n,12
1620748081.0,2021-05-11,wallstreetbets,gxqp5qa,Bear trap and bull trap. Time for iron condor,t3_n9th6n,12
1620748135.0,2021-05-11,wallstreetbets,gxqpabr,RIP for the poor fucks who sold shortly after open.,t3_n9th6n,12
1620748198.0,2021-05-11,wallstreetbets,gxqpfqy,tfw when your safe ITM leaps become OTM,t3_n9th6n,12
1620748556.0,2021-05-11,wallstreetbets,gxqqbab,Tech is undervalued.,t3_n9th6n,11
1620749268.0,2021-05-11,wallstreetbets,gxqs15c,This shit is unreal.  Of course the day I finally give in to the bears we immediately recover,t3_n9th6n,13
1620749711.0,2021-05-11,wallstreetbets,gxqt302,Not being able to see the future kinda gay tbh,t3_n9th6n,12
1620750418.0,2021-05-11,wallstreetbets,gxqus9o,Bought pltr puts so it will moon for you guys,t3_n9th6n,12
1620750761.0,2021-05-11,wallstreetbets,gxqvlx9,my pltr leaps that I bought yesterday are up 50%. Should I sell lol.,t3_n9th6n,12
1620750995.0,2021-05-11,wallstreetbets,gxqw5xy,Down 7.76% and still falling.  What a day.  RIP me.,t3_n9th6n,12
1620751509.0,2021-05-11,wallstreetbets,gxqxe4c,PLTR headed back to 30,t3_n9th6n,12
1620752174.0,2021-05-11,wallstreetbets,gxqz07a,Palantards are still in this 😎,t3_n9th6n,12
1620752433.0,2021-05-11,wallstreetbets,gxqzn91,my moves to stop the hemorrhage have resulted in diversification of the hemorrhage.,t3_n9th6n,13
1620753116.0,2021-05-11,wallstreetbets,gxr1azr,If SPY closes green today I'll put hairs from my asshole into my lazy coworker's drink on my next weekend shift,t3_n9th6n,12
1620753180.0,2021-05-11,wallstreetbets,gxr1go1,there is a zero percent chance trading is worth the stress right? just get your 7% annually from SPY or VOO and be happy.,t3_n9th6n,13
1620754293.0,2021-05-11,wallstreetbets,gxr46zo,"This morning: Filling out an application at mcdonalds for a second job

Right now: Filling out an email telling my boss im quitting because im rich and i dont need him",t3_n9th6n,12
1620755078.0,2021-05-11,wallstreetbets,gxr64pn,is this the bagholders' anonymous meeting?,t3_n9th6n,12
1620755134.0,2021-05-11,wallstreetbets,gxr69q7,accounts swung 40-50k today in value. yeah uh i might be a tad bit overleaveraged,t3_n9th6n,11
1620755645.0,2021-05-11,wallstreetbets,gxr7j55,GME is recovering. Buy the dip while you still can,t3_n9th6n,11
1620756029.0,2021-05-11,wallstreetbets,gxr8h1k,RIP to everyone that sold that dip,t3_n9th6n,12
1620756059.0,2021-05-11,wallstreetbets,gxr8jp4,Wtf is happening.... yes no yes no yes no.... this market is more unstable than my ex,t3_n9th6n,11
1620756712.0,2021-05-11,wallstreetbets,gxra4if,The last 5 hours have been a long month,t3_n9th6n,13
1620757149.0,2021-05-11,wallstreetbets,gxrb6d7,Cathie Wood is now a long-term value investor.,t3_n9th6n,13
1620757519.0,2021-05-11,wallstreetbets,gxrc2xr,I have to say something about the 3 day trade rule……. Who the fuck made this stupid rule? The rich can trade unlimited and even when I’m sleeping in bed but I can’t get rid of my plummeting stocks? Who was the piece of shit that put this rule into the market? It’s the single biggest reason for losses in my portfolio. Fuck the asshole that put this rule into effect. Oh and fuck you Webull. Your app sucks. Here I am trading options on robinhood and made an account on Webull to get more day trades and Webull won’t even let me trade options. Webull can suck a big fat dick.,t3_n9th6n,12
1620758931.0,2021-05-11,wallstreetbets,gxrfj6v,"""there's NO WAY we can keep dropping tomorrow""
-me before each new layer of dip",t3_n9th6n,11
1620769131.0,2021-05-11,wallstreetbets,gxs4246,Diamond hands on PLTR have paid off!,t3_n9th6n,13
1620770089.0,2021-05-11,wallstreetbets,gxs68e3,oh no guys i went to the MVIS sub ready for a laugh and now I just feel fucking terrible like kicking a puppy i want to dump all my puts I'm so depressed,t3_n9th6n,12
1620727969.0,2021-05-11,wallstreetbets,gxpnuou,Elon comes out on Twitter...”My real name is Enron.”,t3_n9th6n,33
1620728227.0,2021-05-11,wallstreetbets,gxpo54x,F in the chat for the put writer bois,t3_n9th6n,11
1620728809.0,2021-05-11,wallstreetbets,gxpotlw,When we dont even bounce a little after a day like yesterday you know we're fucked,t3_n9th6n,10
1620729020.0,2021-05-11,wallstreetbets,gxpp2d9,Tim AAPL unveils iARK: the sleek new device that you swipe your CC through so it can divide your money between AAPL and ARK. It then sends an electronic receipt to all of your iMessage contacts with a footer on the receipt: “this money vaporized by my iARK.”,t3_n9th6n,10
1620730121.0,2021-05-11,wallstreetbets,gxpqdz0,"June SPY 180P gang had it right, they were just off by a year 🥴",t3_n9th6n,10
1620730242.0,2021-05-11,wallstreetbets,gxpqjhc,"Cathy - I’m embarrassed to say I have 100 shares of ARKF. I was promised tendies, not a -30% return",t3_n9th6n,11
1620731487.0,2021-05-11,wallstreetbets,gxps4ld,Damn my single TSLA put I bought as a hedge might save my whole shit today,t3_n9th6n,10
1620731623.0,2021-05-11,wallstreetbets,gxpsb36,"Race to $10 who wins, PLTR, RKT, or SPCE?",t3_n9th6n,11
1620731986.0,2021-05-11,wallstreetbets,gxpssid,I’m fucking *long* on sink pissing (NYSE:SINK),t3_n9th6n,12
1620732781.0,2021-05-11,wallstreetbets,gxptwiy,Plz buy puts people. It's the only way market will start going up,t3_n9th6n,11
1620734303.0,2021-05-11,wallstreetbets,gxpw7d6,"When all these Palantir DCA buys start going in Cathies favour I don't wanna hear any if you bitching that her position is up 400% in a year and you wish you'd bought more too.

PLTR is a monster of a company, everyone knows it, don't let short term ""I'm not getting rich so I'm gunna sell my shares"" price action get you down ![gif](emote|free_emotes_pack|feels_bad_man)",t3_n9th6n,10
1620734650.0,2021-05-11,wallstreetbets,gxpwrhi,Turns out irrational market behavior has consequences 🤡🤡🤡,t3_n9th6n,11
1620734782.0,2021-05-11,wallstreetbets,gxpwzhc,"I just want to thank whoever recommended I buy ARK funds. I put my ""safe"" money there.


That is all.",t3_n9th6n,11
1620735355.0,2021-05-11,wallstreetbets,gxpxxc3,Goodbye I'll remember you all in therapy,t3_n9th6n,12
1620735743.0,2021-05-11,wallstreetbets,gxpylmw,Mods haven't pinned the suey hotline yet? It's like they don't even care anymore. They are compromised.,t3_n9th6n,10
1620735930.0,2021-05-11,wallstreetbets,gxpyx3s,Wisest thing to do today it NOT touching anything. Don't buy don't sell,t3_n9th6n,11
1620736112.0,2021-05-11,wallstreetbets,gxpz8jv,I hate this casino,t3_n9th6n,10
1620736449.0,2021-05-11,wallstreetbets,gxpztub,Welcome to hard mode bitches,t3_n9th6n,11
1620736584.0,2021-05-11,wallstreetbets,gxq02nb,You’ve 4 missed margin calls,t3_n9th6n,11
1620736658.0,2021-05-11,wallstreetbets,gxq07dl,Last one out turn off the lights,t3_n9th6n,10
1620736987.0,2021-05-11,wallstreetbets,gxq0szg,"Bro who else is just laughing at this point? 🤣

I might actually put more money in 😎",t3_n9th6n,10
1620737395.0,2021-05-11,wallstreetbets,gxq1k1y,PLTR beats expectations?  better drop 10%,t3_n9th6n,11
1620737698.0,2021-05-11,wallstreetbets,gxq24kb,"Welp. This fucking sucks. 

Portfolio down $50k in the past 90 days. 

A LOT of that is due to Karp and Co. Fucking PLTR.",t3_n9th6n,12
1620737735.0,2021-05-11,wallstreetbets,gxq274f,"Mods, time to sticky the $ROPE helpline",t3_n9th6n,11
1620738142.0,2021-05-11,wallstreetbets,gxq2ym3,Cathie earning her money behind the dumpster tonight,t3_n9th6n,12
1620738153.0,2021-05-11,wallstreetbets,gxq2zb3,"It's been an honor, guys.",t3_n9th6n,11
1620738161.0,2021-05-11,wallstreetbets,gxq2zvm,"Day 1: -2% ouch

Day 2: -3% wow this is crazy
 
Day 3: -5% man this is getting old

Day 4-15: -3% fuck me dead",t3_n9th6n,10
1620738171.0,2021-05-11,wallstreetbets,gxq30hw,"Turn around 

Every now and then I get a little bit terrified and then I see the fuckin' look in your eyes",t3_n9th6n,11
1620738306.0,2021-05-11,wallstreetbets,gxq39td,MODS WE NEED PRAYER THREADS STAT!,t3_n9th6n,10
1620738408.0,2021-05-11,wallstreetbets,gxq3h3a,Getting out of PLTR has been great for my mental health,t3_n9th6n,11
1620738699.0,2021-05-11,wallstreetbets,gxq41e0,BREAKING NEWS: Wendy’s flooded with job applications,t3_n9th6n,10
1620738704.0,2021-05-11,wallstreetbets,gxq41nr,"Sell in May, go away?",t3_n9th6n,12
1620738713.0,2021-05-11,wallstreetbets,gxq42d6,SPCE down another 18 percent. I’m thinking I should have let that go at $50,t3_n9th6n,10
1620738926.0,2021-05-11,wallstreetbets,gxq4hik,Cathie Woods at the very least should be sending us some feet pics if shes gonna bankrupt our generations accounts,t3_n9th6n,12
1620739115.0,2021-05-11,wallstreetbets,gxq4uvm,Wake up to a margin call. Yes! My first one ever in 16 years.,t3_n9th6n,11
1620739373.0,2021-05-11,wallstreetbets,gxq5dm6,Selling my puts at open,t3_n9th6n,10
1620739515.0,2021-05-11,wallstreetbets,gxq5np8,"It was a pleasure trading and shitposting with you lads and ladies... all stonks to the bottom of the ocean today

🎻",t3_n9th6n,11
1620740023.0,2021-05-11,wallstreetbets,gxq6opg,"Yesterday: It can’t get worse

Today: GOOOD MORNING VIETNAM!!",t3_n9th6n,10
1620740268.0,2021-05-11,wallstreetbets,gxq76qn,Just picked up my first ever GME at $138. Cheers!,t3_n9th6n,11
1620740447.0,2021-05-11,wallstreetbets,gxq7k38,Pltr holy crap,t3_n9th6n,10
1620740766.0,2021-05-11,wallstreetbets,gxq88qz,HERE COME THE PALANTARDS,t3_n9th6n,11
1620740883.0,2021-05-11,wallstreetbets,gxq8hsv,Palantir’s opening today was like a scene from Harry Potter or something,t3_n9th6n,11
1620741022.0,2021-05-11,wallstreetbets,gxq8sx6,Sheeeeeshh pltr,t3_n9th6n,10
1620741049.0,2021-05-11,wallstreetbets,gxq8v1a,"GET FUKT PLTR BEARS 🍆🍆🍆🐻🐻🐻

TO THE MOON! 🚀
TO THE MOON! 🚀
TO THE MOON! 🚀",t3_n9th6n,11
1620741397.0,2021-05-11,wallstreetbets,gxq9m5l,Imagine panic selling right at open,t3_n9th6n,11
1620741639.0,2021-05-11,wallstreetbets,gxqa5rr,Ok. It's not me that's retarded. It's the market. This is dumb as fuck.,t3_n9th6n,12
1620741968.0,2021-05-11,wallstreetbets,gxqaw5s,"Bers: “TSLA 500 EOD”

Bulls: “TSLA 700 EOD”

Me: “dude I’d suck a dick just to break even again”",t3_n9th6n,11
1620742830.0,2021-05-11,wallstreetbets,gxqcthw,this market is still better than Game of Thrones season 8,t3_n9th6n,10
1620743036.0,2021-05-11,wallstreetbets,gxqdamw,"Who the fuck is selling PLTR it’s already so fucking low, everyone should be buying this shit up",t3_n9th6n,10
1620743466.0,2021-05-11,wallstreetbets,gxqea7z,cash gang thinks they can escape inflation,t3_n9th6n,11
1620743549.0,2021-05-11,wallstreetbets,gxqehbx,Hot take: the market is a lot cooler when it goes up,t3_n9th6n,11
1620743661.0,2021-05-11,wallstreetbets,gxqeql1,Raise your hand if you bought the dip and are ready for the dump 🤚,t3_n9th6n,12
1620743663.0,2021-05-11,wallstreetbets,gxqeqre,Didn't stonks used to go up sometimes??,t3_n9th6n,11
1620743667.0,2021-05-11,wallstreetbets,gxqer1y,This game sucks I think I’m gonna delete it,t3_n9th6n,12
1620743769.0,2021-05-11,wallstreetbets,gxqezp8,"All the smart WSBers have left. All that’s left is idiots still talking about old meme stocks from the last few months and not doing their own DD.

Positions MT, FCX, KGC, KHC, AU, AUY, PAAS, GOLD, EQX, etc. and SQQQ, PSLV, PHYS",t3_n9th6n,11
1620743811.0,2021-05-11,wallstreetbets,gxqf39i,When buying the dip goes wrong,t3_n9th6n,12
1620744597.0,2021-05-11,wallstreetbets,gxqgx2p,"Market: Its going to rip


Anus: **RIPS WIDE OPEN**",t3_n9th6n,10
1620744629.0,2021-05-11,wallstreetbets,gxqgzyg,"Wow, its like no one warned you.",t3_n9th6n,11
1620744654.0,2021-05-11,wallstreetbets,gxqh255,Anyone know how to short your own portfolio? Asking for a friend.,t3_n9th6n,12
1620744887.0,2021-05-11,wallstreetbets,gxqhloe,V shape recovery starting,t3_n9th6n,11
1620745026.0,2021-05-11,wallstreetbets,gxqhxj2,"Do you have any idea the physical and emotional toll 3 signal reversals before 11am has on a person? 


SNIP SNAP SNIP SNAP SNIP SNAP",t3_n9th6n,11
1620745082.0,2021-05-11,wallstreetbets,gxqi28b,member when arkk was 159 and you were contemplating selling but didn’t because why would it go down now? i member,t3_n9th6n,11
