created,date,subreddit,id,body,parent_id,score
1589980197.0,2020-05-20,wallstreetbets,fr8je47,"I had LK 9/18 call that has been at .01 since it was halted...time for big tendies boys, i may be able to offload this today for .02. Champagne's on me tonight",t3_gn8r9k,8
1589980654.0,2020-05-20,wallstreetbets,fr8k3zr,I mean honestly why the fuck would anyone ever put money into LK lmao,t3_gn8r9k,9
1589981075.0,2020-05-20,wallstreetbets,fr8ksjh,"Donnie spewing propaganda before open idk how I feel about today yet 


https://twitter.com/realdonaldtrump/status/1263074783673102337?s=21",t3_gn8r9k,8
1589981091.0,2020-05-20,wallstreetbets,fr8kthn,If the Gecko is right again today this sub will explode.,t3_gn8r9k,8
1589981332.0,2020-05-20,wallstreetbets,fr8l7nx,Buying SPY 295p 9/18 at open and then forgetting about it for a while.,t3_gn8r9k,8
1589981404.0,2020-05-20,wallstreetbets,fr8lbtm,You may start your test.....NOW,t3_gn8r9k,9
1589981908.0,2020-05-20,wallstreetbets,fr8m5jp,Cashed out 10k profit laying down in bed lol you cannot make this up,t3_gn8r9k,8
1589982391.0,2020-05-20,wallstreetbets,fr8mzfm,"🐻 = wrecked


Me = 🐻 


Me = wrecked",t3_gn8r9k,8
1589983092.0,2020-05-20,wallstreetbets,fr8o72e,Joe Rogan now has a larger market cap than airlines,t3_gn8r9k,8
1589983137.0,2020-05-20,wallstreetbets,fr8o9ze,"Hello TSLA, my old friend.

I've come to buy puts on you again.",t3_gn8r9k,7
1589984519.0,2020-05-20,wallstreetbets,fr8qq5u,"Want to hear a joke?

“America has a free market economy”",t3_gn8r9k,7
1589985014.0,2020-05-20,wallstreetbets,fr8rmu4,Hey remember when SPY was @ $273. I remember it like it was 6 days ago😌,t3_gn8r9k,9
1589985146.0,2020-05-20,wallstreetbets,fr8rvkb,"LOW slaughters ER and dumps at open...AAP fucking shits on their earnings and holds their gains.

This fucking market...",t3_gn8r9k,8
1589985584.0,2020-05-20,wallstreetbets,fr8sovw,"OIL REPORTS GOOD, OIL GOES DOWN, YOU CAN'T EXPLAIN THAT!",t3_gn8r9k,8
1589986184.0,2020-05-20,wallstreetbets,fr8ttrj,I.. Will.. Not.. Sell.. My.. Puts...,t3_gn8r9k,8
1589986798.0,2020-05-20,wallstreetbets,fr8v0k2,Tell me why I shouldn't buy 290p right now,t3_gn8r9k,8
1589987513.0,2020-05-20,wallstreetbets,fr8we2d,"Just officially sold my 235 5/22s - average price of .14 - average sell of .80

16k > 350 > 4k I’m back bitch",t3_gn8r9k,9
1589988560.0,2020-05-20,wallstreetbets,fr8yglm,"Fuck, who else sold their FB calls this morning?",t3_gn8r9k,8
1589988952.0,2020-05-20,wallstreetbets,fr8z8yz,There is so much FOMO in this fake and gay market. Ho-rrrreee shit.,t3_gn8r9k,9
1589989135.0,2020-05-20,wallstreetbets,fr8zmez,"No news = good news

Bad news = good news

Good news = good news",t3_gn8r9k,8
1589989607.0,2020-05-20,wallstreetbets,fr90kq3,market is going to rip tomorrow with better than expected unemployment numbers (nobody left to lay off).,t3_gn8r9k,8
1589989723.0,2020-05-20,wallstreetbets,fr90t7w,"“About 15 million credit-card accounts and 3 million auto loans didn’t get paid in April as the coronavirus ravaged the economy, data show”


Highs by EOD",t3_gn8r9k,7
1589992348.0,2020-05-20,wallstreetbets,fr967uo,$GILD are such trolls. Authorizing royalty free vaccine to 127 different countries including every single one but the USA 🇺🇸,t3_gn8r9k,9
1589993195.0,2020-05-20,wallstreetbets,fr97zwq,"the gecko must have predicted the bill passing, truly the best trader on wsb",t3_gn8r9k,9
1589993811.0,2020-05-20,wallstreetbets,fr99c26,Move ur money to FB boys FB banned in China anyway,t3_gn8r9k,8
1589994748.0,2020-05-20,wallstreetbets,fr9bavw,Does intraday even matter at this point? Overnight ramps can't be stopped.,t3_gn8r9k,8
1589995539.0,2020-05-20,wallstreetbets,fr9czs8,"Just called my broker on the phone for the first time ever, to place an order for some autistic OTC shroom stock...it made me feel...fancy. They called me “sir” and everything.",t3_gn8r9k,9
1589996015.0,2020-05-20,wallstreetbets,fr9e0g4," I've lost too much money betting against america during a recession.  I will not be capitulating my long range puts, shit will hit the fan eventually.  Time to give money to my algo, which will far outperform me while simultaneously fucking my wife",t3_gn8r9k,8
1589996027.0,2020-05-20,wallstreetbets,fr9e1ed,Do you ever look back to April where you sold off all your long calls and thinking that you could have retired if you didn’t sell? Sigh....,t3_gn8r9k,9
1589996072.0,2020-05-20,wallstreetbets,fr9e4sz,"Bought WMT shares before earnings, they went up. I didn't sell because news was so good and now they're back close to where I bought them. I'm a fucking genius.",t3_gn8r9k,9
1589996834.0,2020-05-20,wallstreetbets,fr9fqd3,Gecko dump at 3pm,t3_gn8r9k,8
1589999592.0,2020-05-20,wallstreetbets,fr9lh3h,FB ditch that nerd 230 and come chill with 240,t3_gn8r9k,9
1589999853.0,2020-05-20,wallstreetbets,fr9m0ds,"DIS pump begins in 30 minutes, get your calls now!",t3_gn8r9k,9
1589999886.0,2020-05-20,wallstreetbets,fr9m2u4,[deleted],t3_gn8r9k,9
1590000114.0,2020-05-20,wallstreetbets,fr9mk26,"For those looking for a low stress, cheap, DIS play- 1/21/22 220c

Stop losing sleep over short exps",t3_gn8r9k,7
1590001259.0,2020-05-20,wallstreetbets,fr9oxdx,"Bought 100 calls of DIS at 1.65, sold like 15 seconds later for 2.05. Made $5.4k",t3_gn8r9k,8
1590002163.0,2020-05-20,wallstreetbets,fr9qskz,FB calls are printing.  THANKS WSB for some huge gains,t3_gn8r9k,9
1590002252.0,2020-05-20,wallstreetbets,fr9qz4v,In order for the gecko to be right we have to dump 1.5% in like 43 minutes. I believe,t3_gn8r9k,9
1590003264.0,2020-05-20,wallstreetbets,fr9t6mo,[deleted],t3_gn8r9k,9
1590003799.0,2020-05-20,wallstreetbets,fr9ubnk,DIS at 120 is scary... it is going to trigger a short squeeze and go even higher.,t3_gn8r9k,9
1590004054.0,2020-05-20,wallstreetbets,fr9uv5t,Get into DIS now if you missed the FB train 🚀,t3_gn8r9k,8
1590004547.0,2020-05-20,wallstreetbets,fr9vyqt,"Tech stocks = up

Reopening economy stocks = up

Stay at home stocks = up

Gov bonds = up

WSB portfolios = down",t3_gn8r9k,8
1590005078.0,2020-05-20,wallstreetbets,fr9x3y8,Made 2 dollars day trading lumber liquidators.,t3_gn8r9k,8
1590005173.0,2020-05-20,wallstreetbets,fr9xb7c,"DIS callers got caught holding their dick  


 [https://twitter.com/CNBCnow/status/1263198126334267392?s=20](https://twitter.com/CNBCnow/status/1263198126334267392?s=20)",t3_gn8r9k,9
1590005206.0,2020-05-20,wallstreetbets,fr9xdkn,"Updated 4:00 p.m.: CNBC is saying on its air that Disney tells the network it is not presenting a re-opening proposal to Florida officials tomorrow.

&#x200B;

FUCK IM ALL IN",t3_gn8r9k,8
1590005246.0,2020-05-20,wallstreetbets,fr9xgqm,"one thing I learned from my paper account:

the more capital you have the easier it is to make money",t3_gn8r9k,9
1590005273.0,2020-05-20,wallstreetbets,fr9xiyi,I lost enough money today to warrant a cheese quesadilla for dinner. No sour cream,t3_gn8r9k,8
1590005498.0,2020-05-20,wallstreetbets,fr9y0tu,That shrimp and gecko better straighten the fuck up before we get another animal,t3_gn8r9k,8
1590005878.0,2020-05-20,wallstreetbets,fr9yu29,To ALL MY DIS CALL HOLDERS. Group ORGY after next MOON? No homo,t3_gn8r9k,7
1589979198.0,2020-05-20,wallstreetbets,fr8hvei,"With all the $300 SPY calls that everyone is holding, do you really think MMs will allow them to go ITM? Low volume buys to push up, people buy calls, huge volume dumps. Same reason they won’t drop it below $270. MMs thank you for the theta.",t3_gn8r9k,14
1589979562.0,2020-05-20,wallstreetbets,fr8if67,bears waking up to beat their wives again,t3_gn8r9k,20
1589969864.0,2020-05-20,wallstreetbets,fr86v16," [https://www.ft.com/content/4be0d6d3-ccab-48df-83e4-0b726273ccac](https://www.ft.com/content/4be0d6d3-ccab-48df-83e4-0b726273ccac)

In January Mr Mallett opened a brokerage account with Royal Bank of Canada and as the rally intensified he has traded more, investing C$3,000 of stimulus money he received from the Canadian government into US stocks including Lyft and Tesla.

“I’m a little bit up,” he said. “I cut grass at a golf course. I’m on a lawnmower refreshing the app every few seconds — it’s great.”",t3_gn8r9k,13
1589990476.0,2020-05-20,wallstreetbets,fr92cwp,.,t3_gn8r9k,14
1589992430.0,2020-05-20,wallstreetbets,fr96e2p,"How do you short the class of 2020?

They are going to be Starbucks baristas, waiters, and janitors for the next decade.",t3_gn8r9k,13
1589969668.0,2020-05-20,wallstreetbets,fr86nyd,Where the TGT calls crew at?,t3_gn8r9k,7
1589969684.0,2020-05-20,wallstreetbets,fr86ojr,45 mins until LK is unleashed. #FREETHEBEAST,t3_gn8r9k,7
1589971105.0,2020-05-20,wallstreetbets,fr884so,Lol look at those candles at 4am and 4:15am exactly. Crazy,t3_gn8r9k,7
1589972679.0,2020-05-20,wallstreetbets,fr89r8g,Hope you all bought the dip,t3_gn8r9k,7
1589972967.0,2020-05-20,wallstreetbets,fr8a265,[deleted],t3_gn8r9k,7
1589975667.0,2020-05-20,wallstreetbets,fr8d43a,LK has 21 million shares short. In one hour 9 million shares have traded. Wondering how many of those were shorts covering.,t3_gn8r9k,6
1589975810.0,2020-05-20,wallstreetbets,fr8daez,"That mom who found her son after 30 years is immediately having him move in...

Goes to show you... Stop looking for your kids because no matter how old they are they are still young enough to move into your basement.",t3_gn8r9k,7
1589975905.0,2020-05-20,wallstreetbets,fr8delm,Where my FB gang at?,t3_gn8r9k,6
1589976910.0,2020-05-20,wallstreetbets,fr8eok1,Bought puts at the end of day yesterday 😢😭,t3_gn8r9k,8
1589977130.0,2020-05-20,wallstreetbets,fr8ez0v,"Anyone who held FB calls overnight wake up to find they mass emailed their extended family a 3D dancing baby dancing to Blue Swede from their AOL email account?

I have no recollection of it, is this normal?",t3_gn8r9k,7
1589977437.0,2020-05-20,wallstreetbets,fr8fduh,Krispy Kreme did the same thing LK did and look how popular they are right now,t3_gn8r9k,6
1589977484.0,2020-05-20,wallstreetbets,fr8fg58,Hopefully zoom gets deleted today,t3_gn8r9k,8
1589977778.0,2020-05-20,wallstreetbets,fr8fukd,Y’all holding FB calls from yday?,t3_gn8r9k,6
1589977971.0,2020-05-20,wallstreetbets,fr8g3qx,anyone who buys PUTS in DIS or any entertainment company should just send me the money they would have spent on puts. I can use it to buy more calls and actually make money.,t3_gn8r9k,7
1589978166.0,2020-05-20,wallstreetbets,fr8gdcq,Not regretting holding FB calls overnight anymore,t3_gn8r9k,7
1589978552.0,2020-05-20,wallstreetbets,fr8gx2q,"If you're wondering why SPCE is dead today...

#$SPCE 20.7M secondary offering said to be offered at $15.15/shr through Credit Suisse - press (update) (Virgin Galactic)",t3_gn8r9k,8
1589978696.0,2020-05-20,wallstreetbets,fr8h4kh,sold my $INO calls to get into $TGT. AMA,t3_gn8r9k,8
1589978923.0,2020-05-20,wallstreetbets,fr8hggf,what's that dumb psychological thing with stocks and round numbers? oh that's right $HUYA is gonna hit $20 because of that today. Don't miss out 6/5 $21 calls still pretty cheap for earnings!!,t3_gn8r9k,7
1589978961.0,2020-05-20,wallstreetbets,fr8hihn,"I raised a baby pigeon to maturity, but now it wont leave my room 🙄😓",t3_gn8r9k,7
1589980068.0,2020-05-20,wallstreetbets,fr8j6yj,I wonder how many people here have lost money on Spy 300 Calls 4 weeks in a row.,t3_gn8r9k,8
1589980690.0,2020-05-20,wallstreetbets,fr8k60s,"This sub: all in on LK
Also this sub: why do I keep losing money",t3_gn8r9k,8
1589980912.0,2020-05-20,wallstreetbets,fr8kizv,If CRM could just rocket today to save my old calls that would be helpful.,t3_gn8r9k,7
1589981145.0,2020-05-20,wallstreetbets,fr8kwjj,"a wise man once said, ""fuck your puts, faggot""",t3_gn8r9k,8
1589981997.0,2020-05-20,wallstreetbets,fr8maxi,U.S. economy doing some Weekend at Bernie's shit.,t3_gn8r9k,7
1589982522.0,2020-05-20,wallstreetbets,fr8n7j5,"The gecko initially had the worm in his mouth, only to spit it out afterward. 

I trust the gecko with my life. 297 will be rejected.",t3_gn8r9k,7
1589982696.0,2020-05-20,wallstreetbets,fr8nifd,"Perfectly normal market right here. 

I'd feel very comfortable investing for the long term at these prices.",t3_gn8r9k,6
1589982816.0,2020-05-20,wallstreetbets,fr8npue,"cmon huya, don't go limp ya bitch",t3_gn8r9k,7
1589983114.0,2020-05-20,wallstreetbets,fr8o8i9,HUYA having massive profit taking and it still won’t die,t3_gn8r9k,7
1589983330.0,2020-05-20,wallstreetbets,fr8om3q,"yahoo finance ""luckin coffin"" lmao",t3_gn8r9k,7
1589983624.0,2020-05-20,wallstreetbets,fr8p4pp,they really fatting the calf before slaughter,t3_gn8r9k,8
1589983799.0,2020-05-20,wallstreetbets,fr8pfs5,"Sold my FB 5/22 calls this morning I bought yesterday for 124% profit, then turned around and bought more 5/22 FB calls. 🎅🏿",t3_gn8r9k,7
1589983990.0,2020-05-20,wallstreetbets,fr8przp,"As a bear I'm not worried. Special magic TA indicators are in the way at 297 and 299. Then we have King Leonidas at 300. If it does break 300, then I guess I will just suck a dick like the rest of my kind.",t3_gn8r9k,8
1589984199.0,2020-05-20,wallstreetbets,fr8q5k9,"I sold my FB calls way too early, but profit is profit. Let's go Zuck🚀",t3_gn8r9k,7
1589984956.0,2020-05-20,wallstreetbets,fr8rj29,SPY 300 HODLERS UNITE!,t3_gn8r9k,7
1589985623.0,2020-05-20,wallstreetbets,fr8srjb,"man grats to FB ppl with diamond hands yesterday

or you were PDT and couldn't sell heh.",t3_gn8r9k,7
1589985623.0,2020-05-20,wallstreetbets,fr8srk2,[deleted],t3_gn8r9k,7
1589985746.0,2020-05-20,wallstreetbets,fr8szym,"I have an uneasy feeling that everything wants to tank and is just waiting for someone to make the first move. Then again I could be crazy, I did just anthropomorphise the stock market...",t3_gn8r9k,7
1589985800.0,2020-05-20,wallstreetbets,fr8t3lt,I was promised PCG to be the savior of my portfolio,t3_gn8r9k,8
1589986206.0,2020-05-20,wallstreetbets,fr8tvb3,**I will never financially recover from this**,t3_gn8r9k,7
1589986314.0,2020-05-20,wallstreetbets,fr8u2rw,"I’ve finally discovered the secret formula to making money in the stock market.

Always buy calls.",t3_gn8r9k,7
1589987511.0,2020-05-20,wallstreetbets,fr8wdwl,if spy hits 300 eod i will take a really deep breath.,t3_gn8r9k,8
1589988329.0,2020-05-20,wallstreetbets,fr8y01p,This is the top 🐻,t3_gn8r9k,6
1589988371.0,2020-05-20,wallstreetbets,fr8y344,[deleted],t3_gn8r9k,8
1589988376.0,2020-05-20,wallstreetbets,fr8y3fa, I’m upset I sold my FB calls 😭😑😬,t3_gn8r9k,7
1589988663.0,2020-05-20,wallstreetbets,fr8ynzo,"Pro tip: ES futures drive the entire market. Instead of looking at SPY charts, ES charts dictate where SPY is headed. 2nd Resistance for ES is 2998 which means SPY is headed for 299 today. If we break through that, there’s no stopping it until 3100. 

TA is still gay",t3_gn8r9k,7
1589988765.0,2020-05-20,wallstreetbets,fr8yvjq,Investing is hard because you have to throw out fundamental analysis and just think like a retard.  The more retarded you are the better you will do.,t3_gn8r9k,7
1589988982.0,2020-05-20,wallstreetbets,fr8zb5b,"Good news, SPY 300. Bad news, we're all going to be laid off. Yeah!",t3_gn8r9k,6
1589989865.0,2020-05-20,wallstreetbets,fr913nh,it can't go higher... it can't,t3_gn8r9k,7
1589989883.0,2020-05-20,wallstreetbets,fr914zn,"Is wall street bets exuberantly bullish? Yes,  yes they are",t3_gn8r9k,7
1589990116.0,2020-05-20,wallstreetbets,fr91m9d,Come out of the shower to HUYA pumping. Nice! Let’s gooooo!! 🚦,t3_gn8r9k,7
1589990520.0,2020-05-20,wallstreetbets,fr92g3g,Man it feels great when your otm call becomes an itm call,t3_gn8r9k,7
1589990693.0,2020-05-20,wallstreetbets,fr92suk,jesus fuck i wish i bought more HUYA,t3_gn8r9k,7
1589990714.0,2020-05-20,wallstreetbets,fr92ud1,HOLY FUCK HUYA,t3_gn8r9k,8
1589991511.0,2020-05-20,wallstreetbets,fr94h5v,Senate votes to delist Chinese stocks on US exchanges,t3_gn8r9k,7
1589991546.0,2020-05-20,wallstreetbets,fr94joq,Senate passes bill that could delist Chinese companies from US exchanges. Get out of the commie stonks,t3_gn8r9k,7
1589991744.0,2020-05-20,wallstreetbets,fr94yh7,I summon the power of GORDON! 🦎 📉,t3_gn8r9k,7
1589991922.0,2020-05-20,wallstreetbets,fr95bw4,"this is bad

market is about to fucking puke i can feel it",t3_gn8r9k,7
1589991979.0,2020-05-20,wallstreetbets,fr95g42,We go down .50-1% and these gays yelling “MY PUTS ARE PRINTING” yo wtf are they printing? Monopoly money?,t3_gn8r9k,7
1589992083.0,2020-05-20,wallstreetbets,fr95nsp,some old rich guy said never bet against america. and i think he might be right.,t3_gn8r9k,7
1589992795.0,2020-05-20,wallstreetbets,fr975ep,I feel sorry for all the noobs who came here in early March.  Got caught up in bear fervor and openly mocked the 'boomers' and 'normies' buying the dip.  Joining this sub might be the worst financial decision they've made in their young lives.,t3_gn8r9k,7
1589993286.0,2020-05-20,wallstreetbets,fr9872q,[deleted],t3_gn8r9k,7
1589993344.0,2020-05-20,wallstreetbets,fr98bk2,RIP anyone with BABA calls.,t3_gn8r9k,8
1589994183.0,2020-05-20,wallstreetbets,fr9a48i,"lol

https://imgur.com/FoWca9L",t3_gn8r9k,6
1589994226.0,2020-05-20,wallstreetbets,fr9a7du,Well today was a bad time to be holding calls on Chinese companies,t3_gn8r9k,7
1589994396.0,2020-05-20,wallstreetbets,fr9ak2c,"DKNG is about to go up. The NBA, NFL, MLB were all open to start playing again as long as they had testing but they didn't want to take away testing kits from the average joe. Now that they are participating in a ""study"", they will have access to frequent testing while looking like they are contributing to finding a vaccine and obtaining more data about the virus.

[https://www.si.com/nba/76ers/news/philadelphia-76ers-leaguewide-coronavirus-study](https://www.si.com/nba/76ers/news/philadelphia-76ers-leaguewide-coronavirus-study)

[http://www.nba.com/article/2020/05/20/timberwolves-leading-leaguewide-coronavirus-study](http://www.nba.com/article/2020/05/20/timberwolves-leading-leaguewide-coronavirus-study)",t3_gn8r9k,6
1589994484.0,2020-05-20,wallstreetbets,fr9aqrg,"Trade war.. pandemic... potential housing crisis... record breaking unemployment.... 


SPY 340c 7/17",t3_gn8r9k,7
1589994660.0,2020-05-20,wallstreetbets,fr9b4ch,"If it wasn't for this sub, I'd of not bought fb calls yesterday so thanks fags",t3_gn8r9k,8
1589997560.0,2020-05-20,wallstreetbets,fr9h8jn,"SRNE CEO: ""We're not a pump & dump scheme!""

 [https://finance.yahoo.com/news/sorrento-therapeutics-founder-we-are-not-a-pump-and-dump-scheme-155253179.html](https://finance.yahoo.com/news/sorrento-therapeutics-founder-we-are-not-a-pump-and-dump-scheme-155253179.html) 

lol",t3_gn8r9k,7
1589997572.0,2020-05-20,wallstreetbets,fr9h9e0,Loaded up on 295p and praying to 🌈🐻gods for EOD dump,t3_gn8r9k,7
1589997795.0,2020-05-20,wallstreetbets,fr9hpts,[deleted],t3_gn8r9k,7
1589997820.0,2020-05-20,wallstreetbets,fr9hro4,BABA not getting delisted news & crushing earnings on Friday = BABA 250c,t3_gn8r9k,8
1589997852.0,2020-05-20,wallstreetbets,fr9htzi,"Got pegged by PDT because I sold FB gains as a 4th day trade

Gotta lock in gains am I right

Also proud to have finally unlocked RH diamond hands mode",t3_gn8r9k,6
1589998304.0,2020-05-20,wallstreetbets,fr9irnk,SPY stock price too high imo,t3_gn8r9k,8
1589998472.0,2020-05-20,wallstreetbets,fr9j46t,Trump threatened to withhold funding from two states already today lmao.,t3_gn8r9k,6
1589998591.0,2020-05-20,wallstreetbets,fr9jd86,# FEAR THE 🦎,t3_gn8r9k,8
1589998705.0,2020-05-20,wallstreetbets,fr9jlts,We're ending the day red. Bet your life savings on it. Our lord Gordon would never let us fail.,t3_gn8r9k,6
1589998758.0,2020-05-20,wallstreetbets,fr9jpue,You know the majority of people here bought calls at the top with thousands of percentages of premiums when they don’t understand that in this climate even spy above 280 is bullish mid-long term.,t3_gn8r9k,6
1589998838.0,2020-05-20,wallstreetbets,fr9jw3s,Damn yall rly cheerleading a flat chart rn,t3_gn8r9k,7
1589999175.0,2020-05-20,wallstreetbets,fr9klj4,who would win - a mouse or a gecko? DIS calls baby,t3_gn8r9k,7
1589999524.0,2020-05-20,wallstreetbets,fr9lbzp,At the start of the week I didn’t think I would be playing Boot Barn earnings yet here we are,t3_gn8r9k,6
1589999729.0,2020-05-20,wallstreetbets,fr9lraz,[deleted],t3_gn8r9k,7
1590000001.0,2020-05-20,wallstreetbets,fr9mbpa,Tomorrow is going to be green too because AMERICA IS FUCKING #1 BITCH,t3_gn8r9k,6
1590000202.0,2020-05-20,wallstreetbets,fr9mqn7,"Eff it, all in on Disney and draftkings",t3_gn8r9k,7
1590000397.0,2020-05-20,wallstreetbets,fr9n5ds,I am going to post some stupid shit in /r/askwomen so the bears attention is distracted from SPY for a half hour.,t3_gn8r9k,7
1590000673.0,2020-05-20,wallstreetbets,fr9nq57,Guess who sold DIS calls at open 🤡,t3_gn8r9k,6
1590001359.0,2020-05-20,wallstreetbets,fr9p5bl,"This is why $dis is pumping!

2 p.m. update
Walt Disney World, the Universal Orlando Resort and SeaWorld will deliver reopening presentations to the Orange County Economic Recovery Task Force on Thursday.

*The presentations must include a planned reopening date.*


And in talks to host NBA season.

https://www.wftv.com/news/florida/live-updates-orlandos-major-theme-parks-reveal-planned-reopening-dates-tomorrow/SY55QYU3URDCZJVGZTEVD5IZBA/",t3_gn8r9k,7
1590001502.0,2020-05-20,wallstreetbets,fr9pfwy,Don’t doubt the fucking mouse,t3_gn8r9k,7
1590001670.0,2020-05-20,wallstreetbets,fr9ps5u,"DIS news boys:

https://www.wftv.com/news/florida/live-updates-orlandos-major-theme-parks-reveal-planned-reopening-dates-tomorrow/SY55QYU3URDCZJVGZTEVD5IZBA/",t3_gn8r9k,7
1590001688.0,2020-05-20,wallstreetbets,fr9pti4,"Gecko was a paid artist to trap all the bears

Change my mind 🤡",t3_gn8r9k,7
1590002776.0,2020-05-20,wallstreetbets,fr9s3yn,LOL **Georgia** leading cases for CV cases today. Imagine that. Even beating out New Jersey which has 151k confirmed cases.,t3_gn8r9k,6
1590002814.0,2020-05-20,wallstreetbets,fr9s720,[deleted],t3_gn8r9k,6
1590002893.0,2020-05-20,wallstreetbets,fr9sdec,DKNG is being such a cuck lol. Still believe calls will print but this is infuriating.,t3_gn8r9k,7
1590003318.0,2020-05-20,wallstreetbets,fr9tar0,Spy is up almost $20 this week. Nothing to see here.,t3_gn8r9k,7
1590004492.0,2020-05-20,wallstreetbets,fr9vudz,"finally, it' s almost that time of the day i can start getting work done",t3_gn8r9k,7
1590005053.0,2020-05-20,wallstreetbets,fr9x20a,DIS will be back tomorrow for this announcement,t3_gn8r9k,7
1590005173.0,2020-05-20,wallstreetbets,fr9xb8c,"Who purchased some DIS calls for 7/17 150 strike at 40 cents ?!?! 

MOOON BABY",t3_gn8r9k,7
1590005191.0,2020-05-20,wallstreetbets,fr9xcjq,Scared to death to watch DIS after hours action. But I gotta,t3_gn8r9k,8
1590005453.0,2020-05-20,wallstreetbets,fr9xx8x,DISNEY IS GOING TO RIP PRE MARKET TOMORROW IM JACKED TO THE FUCKING TITS IN CALLS,t3_gn8r9k,7
1590005562.0,2020-05-20,wallstreetbets,fr9y5uh,DIS calls holders on life support already? it's been only 15 mins,t3_gn8r9k,7
1590005706.0,2020-05-20,wallstreetbets,fr9ygsw,lebron james alley oop to mickey mouse,t3_gn8r9k,6
1590007587.0,2020-05-20,wallstreetbets,fra2egc,"News headlines really need to quit the bullshit and just say ""Stocks rise as Stonks Only Go Up""",t3_gn8r9k,7
1590011416.0,2020-05-20,wallstreetbets,fra6f5u,I haven't held any options through earnings and have walked away unscathed every time. Take my advice you fukken nerds.,t3_gn8r9k,7
1590012889.0,2020-05-20,wallstreetbets,fra7z6o,"Spy finna gonna boutta reject 300, 310, 320, 330, 340, 350",t3_gn8r9k,8
1589977581.0,2020-05-20,wallstreetbets,fr8fkzy,"Just saw my fathers boomer portfolio and fucker is up 20% for the year

His top stock holdings are 

NESTLE$ and LMT$ 

Fuck man good shit original l2fba senior 

The rest is gay bonds 

But man I forgot what a REDICKOULOUSLY good company nestle is and LMT well Merika so u know",t3_gn8r9k,14
1589978262.0,2020-05-20,wallstreetbets,fr8gi8e,[removed],t3_gn8r9k,13
1589990095.0,2020-05-20,wallstreetbets,fr91koa,"As a bear, I feel complete disbelief and despair. 

Top might be close",t3_gn8r9k,12
1589990330.0,2020-05-20,wallstreetbets,fr9222p,Sold fb for 700% gain. Thank god I homo-ed,t3_gn8r9k,13
1589999571.0,2020-05-20,wallstreetbets,fr9lfin,"(Don't DM me if a black swan event happens before this roundtable and you lose money)

DD: Florida Tourism Roundtable with Orlando tourist Mike Pence at 3PM ET. White House only schedules events during market hours when they think they can pump. DeSantis and Trump are buddies and DeSantis has been backing Trump more than any governor (debateably Greg Abbott). As thanks for supporting Trump, Pence is in Florida being photographed at local diners to show that the state is safe and tourism is endorsed by the White House. 

Florida allowed theme parks to submit proposals for reopening last Friday. Expect this roundtable to be a pump up of reopening announcements endorsed by Trump with Pence as the model tourist. I expect Disney to be at the roundtable in some capacity. In fact, as I write this multiple sources are saying NBA will happen at DIS. 

Roundtable Livestream: https://www.youtube.com/watch?v=lvoRE21HBtE&feature=emb_title

Theme park reopening proposals allowed to be submitted May 15: https://www.mynews13.com/fl/orlando/attractions/2020/05/15/theme-parks-can-submit-reopening-plans-to-the-state

NBA @ Disney rumors: https://twitter.com/TheAthleticNBA/status/1263172882818981888

DIS 5/29 $120c and $125c

EDIT: Mike Pence playing the tourist without a mask. https://twitter.com/owillis/status/1263164715397677057?s=20

EDIT2: I got some DMs asking about tips. Don’t bother with tips, instead donate to a charity my girlfriend works with. https://itsthevan.org/pages/donate",t3_gn8r9k,13
