created,date,subreddit,id,body,parent_id,score
1589829677.0,2020-05-18,wallstreetbets,fr21s0p,"Staying in a marriott when it opens cause my gains from them today are gross 

184% ⬆️⬆️⬆️",t3_glyucu,6
1589830022.0,2020-05-18,wallstreetbets,fr22hao,"$ZM is fuk

&#x200B;

1. MSFT, GOOG, FB offering ( better ) free version of their product

2. 48B mkt cap, 60x sales valuation ( full retard )

3. Reopening

4. Insiders dumping everything

5. Said they had 300mm users, then backtracked and said ""no wait we meant 10mm users and 300mm participants""

&#x200B;

tldr $ZM to $120",t3_glyucu,8
1589830054.0,2020-05-18,wallstreetbets,fr22jq7,[deleted],t3_glyucu,7
1589830391.0,2020-05-18,wallstreetbets,fr238q3,So can we all agree we should’ve bought calls on the 276 Spy dip?,t3_glyucu,6
1589830404.0,2020-05-18,wallstreetbets,fr239o6,Putting just the tip into 296. Will we go balls deep?,t3_glyucu,8
1589830521.0,2020-05-18,wallstreetbets,fr23ibv,It may never be safe to buy puts again.,t3_glyucu,8
1589831024.0,2020-05-18,wallstreetbets,fr24j3a,[deleted],t3_glyucu,6
1589831594.0,2020-05-18,wallstreetbets,fr25p3z,all im saying is that when everyone on wsb starts buying FD 300+ calls you gotta watch out a bit,t3_glyucu,6
1589831603.0,2020-05-18,wallstreetbets,fr25psr,"https://i.imgur.com/ilfKVtz.png

these are some pretty big sells",t3_glyucu,8
1589831692.0,2020-05-18,wallstreetbets,fr25wik,#HD CALL HOLDERS RISE UP,t3_glyucu,7
1589831789.0,2020-05-18,wallstreetbets,fr263po,Profit taking occuring,t3_glyucu,6
1589832022.0,2020-05-18,wallstreetbets,fr26l6q,Whoever just pumped BA at 3:59; Ya mom’s a hoe,t3_glyucu,7
1589832103.0,2020-05-18,wallstreetbets,fr26r0y,Jesus that was boring. Also when I hear bears rejoicing after we go down 50 cents in spy ik they are desperate,t3_glyucu,6
1589832157.0,2020-05-18,wallstreetbets,fr26v1w,i tripled down on my puts at the top,t3_glyucu,7
1589832211.0,2020-05-18,wallstreetbets,fr26yw0,This thread will be fun tomorrow,t3_glyucu,6
1589832329.0,2020-05-18,wallstreetbets,fr277m3,"How much do you need to make to quit options??

Sound off",t3_glyucu,7
1589832589.0,2020-05-18,wallstreetbets,fr27qhp,"All the autists keep screeching about buying puts like bears and buying calls like bulls and keeping diamond hands. 

But calls or puts, but don't get greedy or grandstand about iron hands. Boomer strategy of selling options for 50% profit and aggressively buying stonks during dips is the real winner. 


For the one guy who has 20k in Moderns calls, you have 50 retards who are giving 50 cent bareback blowjobs in the alley after getting raped by their brokers.",t3_glyucu,8
1589832749.0,2020-05-18,wallstreetbets,fr2822h,SRNE was a glitch guys,t3_glyucu,7
1589833034.0,2020-05-18,wallstreetbets,fr28mu6,Boeing is in a duopoly...meaning a monopoly with a friend.  Backed by govt money.  That this is way too big to fail.,t3_glyucu,7
1589833303.0,2020-05-18,wallstreetbets,fr296kh,Da fuck was that SRNE spike?,t3_glyucu,7
1589834247.0,2020-05-18,wallstreetbets,fr2b40i,no news that will have a red day so its all green everyday until the world ends,t3_glyucu,7
1589834715.0,2020-05-18,wallstreetbets,fr2c2a3,Our system works because people spend money. To attain wealth you have to spend as little as possible on everything that isn't an asset. So is that the barrier that separates people that work for money from the ones that have money work for them? Sorry juiced on the edge and also stating the obvious,t3_glyucu,7
1589803644.0,2020-05-18,wallstreetbets,fr0pwzf,"Lol at the futures, up 2.5%, really, this market is really full of clowns!",t3_glyucu,14
1589807252.0,2020-05-18,wallstreetbets,fr0usum,Did robinhood change it’s colors? What the fuck is this hideous shit-green?,t3_glyucu,13
1589807546.0,2020-05-18,wallstreetbets,fr0v952,Weird how 99% of people that claim to have these perfect golden ticket plays never show proof of their positions 🤔🤔🤔,t3_glyucu,13
1589821475.0,2020-05-18,wallstreetbets,fr1kupn,"Being a member of WSB, I proclaim that I am eligible to declare any SPY price a support or resistance. I will provide no research, graph, or logic and you shall take it as correct. My comment will fade away into the daily chat, rendering itself useless. I myself will forget I posted it and despite being utterly incorrect I will probably do it again tomorrow. If I am correct I will post a link to my own comment telling you that I told you so. Cheers.",t3_glyucu,14
1589817378.0,2020-05-18,wallstreetbets,fr1cnaa,Day trade limit is criminal in my opinion,t3_glyucu,17
1589816054.0,2020-05-18,wallstreetbets,fr1a1z9,Spy was fucking 276 Thursday morning this is wild,t3_glyucu,13
1589816273.0,2020-05-18,wallstreetbets,fr1ah9u,"Watching people lose their jobs and companies getting rewarded with higher stock prices is fucking heart breaking man. Companies that were never profitable getting a pass needs to end after this next recession. 

Amazon made it work for them so now ever company aspires to be like them so they will say ""Amazon wasn't profitable for a long time either""",t3_glyucu,12
1589797674.0,2020-05-18,wallstreetbets,fr0jaid,Anyone else can't fucking sleep?,t3_glyucu,6
1589798786.0,2020-05-18,wallstreetbets,fr0kfec,Rip my tsla puts rip my money rip mah life this game wicked only for the idiots I am mad super mad I can't chill,t3_glyucu,7
1589799209.0,2020-05-18,wallstreetbets,fr0kv0c,"https://www.secform4.com/insider-trading/1585521.htm

ZM insider short volume is off the charts. Their CEO just filed for a massive dump on Friday, predicting stock is gonna go into the ground. Thoughts on our moves, fellas? Will this overpowered Boomer stock finally drill? Play at your own risk -- it's clear the company has doubts about their ability to remain at that price with the astronomically high PE, but at the same time, other companies also have high short volume these past few months, though not many have filed recently.",t3_glyucu,5
1589799679.0,2020-05-18,wallstreetbets,fr0ld5n,SRNE up bigly on untested antibody claims. Pitching hard to media. Jacking up price to issue more shares? Puts.,t3_glyucu,6
1589800299.0,2020-05-18,wallstreetbets,fr0m1d8,imagine not being allowed to short a stock thats up 50+% premarket...,t3_glyucu,5
1589800494.0,2020-05-18,wallstreetbets,fr0m8xg,SRNE is a Frankenstock,t3_glyucu,7
1589800728.0,2020-05-18,wallstreetbets,fr0miaq,futures looking greener than the new RH app update,t3_glyucu,7
1589800903.0,2020-05-18,wallstreetbets,fr0mpcz,"wouldn't be surprised if we take out the 1-month high at 294 this week

virgin bears vs chad bulls",t3_glyucu,5
1589800920.0,2020-05-18,wallstreetbets,fr0mq0s,imagine buying TSLA at 780 and making profit — and they called me retarded,t3_glyucu,6
1589801243.0,2020-05-18,wallstreetbets,fr0n2wo,"FUCK THIS IS GOING TO BE A GLORIOUS DAY.

AMMMMMUUUUUURRRRRIIIIICAAAAAAAAAAAAAAAAAAAAA",t3_glyucu,6
1589801563.0,2020-05-18,wallstreetbets,fr0ng34,Bought some DIS 105c 7/17 last week when disney hit $99. Jacked to the tits right now.,t3_glyucu,6
1589801854.0,2020-05-18,wallstreetbets,fr0ns8a," SRNE is the next GILD

Change my mind",t3_glyucu,5
1589802666.0,2020-05-18,wallstreetbets,fr0oqj6,"Quick question... we can assume this rally is on optimism for a vaccine and that we can all return to normal life soon.

If that is the case, can we officially start shorting ZM, W, PTON, SHOP, etc.?  On the thesis that these all ran up on the work from home paradigm?",t3_glyucu,7
1589802813.0,2020-05-18,wallstreetbets,fr0owv9,Haha OK this is a little gay,t3_glyucu,6
1589802923.0,2020-05-18,wallstreetbets,fr0p1m5,"wednesday, Powell says something: market down

sunday, Powell says same thing in fancy camera: market moon",t3_glyucu,6
1589803252.0,2020-05-18,wallstreetbets,fr0pfr8,Airlines climbing to outer space today.,t3_glyucu,7
1589803628.0,2020-05-18,wallstreetbets,fr0pw97,"Remember last week when Bears talked about ""next leg down""?

Pepperidge farm remembers",t3_glyucu,6
1589803632.0,2020-05-18,wallstreetbets,fr0pwfv,DIS @ $113.50  lmao.,t3_glyucu,7
1589803636.0,2020-05-18,wallstreetbets,fr0pwm1,[deleted],t3_glyucu,5
1589803744.0,2020-05-18,wallstreetbets,fr0q1dn,"That PCG DD was so on the money, I want to kiss whoever wrote it.",t3_glyucu,6
1589804252.0,2020-05-18,wallstreetbets,fr0qolh,"BMO with that massive upgrade on NVDA

Absolutely bonkers 

I fuckin sold my nvda may22 350c for 50% gain a couple of days ago like an idiot 

Paid $130 for the contracts and sold them for $190

They were $1000ish as of Friday close",t3_glyucu,6
1589804422.0,2020-05-18,wallstreetbets,fr0qwi8,SRNE already moving 14 million shares premarket. What the fuck??,t3_glyucu,5
1589804447.0,2020-05-18,wallstreetbets,fr0qxmt,"lmao robinhood still saying my srne put is at +700%, thats gonna change real hard in about an hour",t3_glyucu,6
1589804454.0,2020-05-18,wallstreetbets,fr0qxyp,i actually dont know if ill be able to financially recover from this,t3_glyucu,6
1589804572.0,2020-05-18,wallstreetbets,fr0r3e7,[deleted],t3_glyucu,7
1589804639.0,2020-05-18,wallstreetbets,fr0r6ju,DKNG is the meme of all memes,t3_glyucu,6
1589804994.0,2020-05-18,wallstreetbets,fr0rnex,This is fucking nuts,t3_glyucu,7
1589805004.0,2020-05-18,wallstreetbets,fr0rnx7,You know how I know I’m addicted? I’m gonna be up 500% at opening and all I can say to myself is “i shouldve bought more”,t3_glyucu,6
1589805372.0,2020-05-18,wallstreetbets,fr0s5k1,"this shit screams we are near the top to me, but fuggit, i’m in on calls.

let’s ride",t3_glyucu,7
1589805531.0,2020-05-18,wallstreetbets,fr0sdbr,[deleted],t3_glyucu,7
1589805850.0,2020-05-18,wallstreetbets,fr0st81,Remember when we were kids and Spy was only something you pretended to be when your friend came over? Now my portfolio is shrek dicking this morning and I feel like I'm still not really as happy as then.,t3_glyucu,5
1589805889.0,2020-05-18,wallstreetbets,fr0sv3r,The stock news is hilarious each week “ohhh so bad long effects” go red “oh optimism for reopening stocks rise higher” go green. It’s so fucking pathetic and entertaining.,t3_glyucu,5
1589805958.0,2020-05-18,wallstreetbets,fr0syjm,Sell at open and buy  the dip anyone?,t3_glyucu,5
1589806099.0,2020-05-18,wallstreetbets,fr0t5h7,I could see spy dumping 1000 points again and then pumping up another 1000. This is insanity.,t3_glyucu,6
1589806112.0,2020-05-18,wallstreetbets,fr0t63f,"Wtf am I even supposed to buy, it's so green it might just be flat, profit takers will sell and the boomers shall buy.",t3_glyucu,6
1589806196.0,2020-05-18,wallstreetbets,fr0tabt,Fuckin Russell is limit up lol,t3_glyucu,6
1589806742.0,2020-05-18,wallstreetbets,fr0u29s,#👑🦐 tried telling you 🏳️‍🌈🐻🐼🏳️‍🌈,t3_glyucu,7
1589806780.0,2020-05-18,wallstreetbets,fr0u49a,"Bears. 

Just 

Buy

Calls",t3_glyucu,6
1589806981.0,2020-05-18,wallstreetbets,fr0uemh,[deleted],t3_glyucu,5
1589807211.0,2020-05-18,wallstreetbets,fr0uqle,So we went from the top to the bottom to the top of this fat range in a week.,t3_glyucu,6
1589807257.0,2020-05-18,wallstreetbets,fr0ut3w,3% rise afterhours eh. Lost all my profit from last week just like that,t3_glyucu,5
1589807392.0,2020-05-18,wallstreetbets,fr0v0jj,"When we ‘actually’ have a cure, we’re going to dump so hard arent we",t3_glyucu,6
1589807450.0,2020-05-18,wallstreetbets,fr0v3rm,are you kidding me? market up 2.45% and my stocks are down,t3_glyucu,6
1589807526.0,2020-05-18,wallstreetbets,fr0v812,RIP to anyone who bought ACB puts on Friday,t3_glyucu,7
1589807553.0,2020-05-18,wallstreetbets,fr0v9iz,RH scheduled to crash with bulls running for the door,t3_glyucu,7
1589807874.0,2020-05-18,wallstreetbets,fr0vr4x,It causes me physical pain to see ACB this high,t3_glyucu,6
1589807876.0,2020-05-18,wallstreetbets,fr0vr88,toxic tribalist bears and bulls bragging like they have 300 IQ for winning short term gambles,t3_glyucu,5
1589807972.0,2020-05-18,wallstreetbets,fr0vwi3,Imagine being the wife of a bear and finding out he lost 63k gambling,t3_glyucu,6
1589807998.0,2020-05-18,wallstreetbets,fr0vxwn,"If JPM breaks 90 I’ll buy my mother something really nice she can use it. Idk what she will want though. I thought let me just give her cash ease the stress a little bit. They cut off her social security months ago and it’s starting to take its toll. Unfair why they did it too. Anyway my brother bought her an iRobot vacuum cleaner great gift. Idk what she really likes tho. If I ask her she will say something cheap, like get me some coffee or a vacuum cleaner bags. Yes she still uses an old school vacuum. Probably a mop she would like. Idk want to do something more than just a pick me up. Something lasting. What do friends?",t3_glyucu,6
1589808043.0,2020-05-18,wallstreetbets,fr0w0ei,Yolo’d into SRNE and Moderna. Pray for me,t3_glyucu,7
1589808232.0,2020-05-18,wallstreetbets,fr0waru,"If we ever hit 294, I’m going all in on 300c",t3_glyucu,6
1589808379.0,2020-05-18,wallstreetbets,fr0wiy1,I’ll be buying high today! Who is with me!!!,t3_glyucu,6
1589808533.0,2020-05-18,wallstreetbets,fr0wrkv,"We should have DD Wall of Shame awards.

I'll start by nominating that guy who recommended puts on Zillow with a convincing display of pure horseshit the other day.",t3_glyucu,5
1589808872.0,2020-05-18,wallstreetbets,fr0x9yd,Robinhands activates again,t3_glyucu,5
1589809008.0,2020-05-18,wallstreetbets,fr0xhix,DIS made me 35k today. Thank you mouse.,t3_glyucu,7
1589809049.0,2020-05-18,wallstreetbets,fr0xjvu,Love how everytime robinhood does an update they just completely fudge some other aspect of their app,t3_glyucu,6
1589809081.0,2020-05-18,wallstreetbets,fr0xlow,Robinhood is like my abusive boyfriend,t3_glyucu,6
1589809115.0,2020-05-18,wallstreetbets,fr0xnp3,Robinhood what is you doing,t3_glyucu,7
1589809152.0,2020-05-18,wallstreetbets,fr0xptn,I really would like to see some accurate fucking green on my RH since I spent the last 2 weeks looking at at accurate fucking red,t3_glyucu,6
1589809201.0,2020-05-18,wallstreetbets,fr0xsog,"Sold DIS calls last week at 1.71

They were each worth 8.15 today

Fml",t3_glyucu,6
1589809325.0,2020-05-18,wallstreetbets,fr0xzxv,"Can we make a Robinhood megathread so we stop getting ""is rh broken???"" as every other comment?",t3_glyucu,6
1589809395.0,2020-05-18,wallstreetbets,fr0y40j,Thanks for glitching RH. I didn't want to know what my positions were doing today anyway. Very cool.,t3_glyucu,6
1589809483.0,2020-05-18,wallstreetbets,fr0y964,People complain about TD charging .65 commission but that’s relatively small compared to how much money RH fucks it’s users out of.,t3_glyucu,6
1589809502.0,2020-05-18,wallstreetbets,fr0yaar,[I would like to share my gain porn :-)](https://i.gyazo.com/af3e8035a5ca97165a1e686e5b4f73bf.png),t3_glyucu,6
1589809585.0,2020-05-18,wallstreetbets,fr0yf3m,"RH just activated their diamond hands feature. For all bears, the last two times SPY did not crack this level. So you better pray that it won't do it again.",t3_glyucu,6
1589809624.0,2020-05-18,wallstreetbets,fr0yhg1,"This shit is nuts. 

Half my watchlist is up 8-10%. What the hell is going on?",t3_glyucu,6
1589809709.0,2020-05-18,wallstreetbets,fr0ymm5,"Trying to close a multi leg spread on RH is like trying to rip your dick off with your bare hands, only more frustrating.",t3_glyucu,6
1589809727.0,2020-05-18,wallstreetbets,fr0ynn4,Look at this guy(i.e. me) who was afraid to buy DIS calls when it went under 100 last week...,t3_glyucu,6
1589809907.0,2020-05-18,wallstreetbets,fr0yybm,I’m gonna get a tattoo of Mickey,t3_glyucu,6
1589810136.0,2020-05-18,wallstreetbets,fr0zc31,[deleted],t3_glyucu,6
1589810243.0,2020-05-18,wallstreetbets,fr0zim8,casual $8 swing from friday to monday,t3_glyucu,5
1589810295.0,2020-05-18,wallstreetbets,fr0zlst,"Cramer at it again.


Won't touch an amazon box but is pushing us to go on cruises",t3_glyucu,6
1589810360.0,2020-05-18,wallstreetbets,fr0zpu1,Man holding calls sure is stressful,t3_glyucu,7
1589810380.0,2020-05-18,wallstreetbets,fr0zr1e,I would like to thank my DIS calls on reimbursing back my stimulus check I lost to spy puts.,t3_glyucu,5
1589810739.0,2020-05-18,wallstreetbets,fr10coo,"Why the fuck did I hold July puts over the weekend

-30% at open",t3_glyucu,6
1589801060.0,2020-05-18,wallstreetbets,fr0mviq,Stay strong brother bear.,t1_fr0mnj3,40
1589801261.0,2020-05-18,wallstreetbets,fr0n3mz,"Brother I am with you.
Trying to unload my 5/22 DIS puts on a small dip before ending my 🐻 life.

Enjoy the less stressful life.",t1_fr0mnj3,7
1589807157.0,2020-05-18,wallstreetbets,fr0unse,HAPPY DAY BRO ILY NOW BUY YOUR FAMILY SOMETHING NICE,t1_fr0uj5i,41
1589807152.0,2020-05-18,wallstreetbets,fr0unk3,[deleted],t1_fr0uj5i,15
1589807091.0,2020-05-18,wallstreetbets,fr0ukdp,Damn dude. Congrats.,t1_fr0uj5i,7
1589807104.0,2020-05-18,wallstreetbets,fr0ul15,Grats on the lambo,t1_fr0uj5i,6
1589807198.0,2020-05-18,wallstreetbets,fr0upy4,damn bro congratulations. life changing,t1_fr0uj5i,8
1589800365.0,2020-05-18,wallstreetbets,fr0m3y3,This is true.  The market manipulation right now is level plaid.,t1_fr0m1do,49
1589800989.0,2020-05-18,wallstreetbets,fr0msox,Powell just setting bear traps.. look at the day he said that not much later trump came out with some stupid pump tweet that made the market moon for a bit,t1_fr0m1do,10
1589800135.0,2020-05-18,wallstreetbets,fr0luv0,I sleep a lot better at night when I switched to calls,t1_fr0lppo,54
1589801295.0,2020-05-18,wallstreetbets,fr0n4zq,Lmao Fook 😹😹,t1_fr0n3a8,26
1589805063.0,2020-05-18,wallstreetbets,fr0rqof, Better show us the gain porn.,t1_fr0rpa6,15
1589805125.0,2020-05-18,wallstreetbets,fr0rtn7,Holding 50 293 5/20. Started as 400 bucks on Thursday. Congrats to you though sick play!,t1_fr0rpa6,6
1589797925.0,2020-05-18,wallstreetbets,fr0jjkm,Thanks elon.,t1_fr0jhqq,26
1589808302.0,2020-05-18,wallstreetbets,fr0wekb,“Career”,t1_fr0sq4n,5
1589801976.0,2020-05-18,wallstreetbets,fr0nxj7,Never seen it,t1_fr0namn,6
1589801721.0,2020-05-18,wallstreetbets,fr0nmrf,"I see it as a more neon green similar to Las Vegas lights.


They're trying to make us gamble more, dammit.",t1_fr0namn,7
1589806244.0,2020-05-18,wallstreetbets,fr0tcov,Amen,t1_fr0t93x,5
1589808414.0,2020-05-18,wallstreetbets,fr0wkwm,Warren Buffet ain’t afraid or jumpy from day to day fluctuations.  I would sleep easy if I had a hundred billion dollars.,t1_fr0s3zq,9
1589806386.0,2020-05-18,wallstreetbets,fr0tk14,We are stuck in a channel while mouth breathers screech bull or bear.,t1_fr0teqp,17
1589802802.0,2020-05-18,wallstreetbets,fr0owd6,[deleted],t1_fr0osfo,13
1589802807.0,2020-05-18,wallstreetbets,fr0owm3,Plot twist: op is a mega bull,t1_fr0osfo,6
1589816199.0,2020-05-18,wallstreetbets,fr1ac3h,"It was always like this, you must be new",t1_fr1a8hj,7
1589805851.0,2020-05-18,wallstreetbets,fr0st9m,"More like ""vaccine flops, DOW up another 800 points on re-opening hopes""",t1_fr0srmh,15
1589798497.0,2020-05-18,wallstreetbets,fr0k4nk,This sub is retarded,t1_fr0ilyc,18
1589804392.0,2020-05-18,wallstreetbets,fr0qv40,vaccine talks going well. might real deal soon!,t1_fr0qtzp,11
1589833649.0,2020-05-18,wallstreetbets,fr29wfk,ROFL...massive fraud,t1_fr29o9w,15
1589833921.0,2020-05-18,wallstreetbets,fr2agfc,"If only we had a governmental agency to oversee the securities and equities markets.  Oh well, whatchagonnadoaboutit?",t1_fr29o9w,12
1589833719.0,2020-05-18,wallstreetbets,fr2a1s8,LOL,t1_fr29o9w,7
1589804247.0,2020-05-18,wallstreetbets,fr0qocb,He could have doubled up if he bought friday,t1_fr0qm27,7
1589806153.0,2020-05-18,wallstreetbets,fr0t85i,That's the spirit!,t1_fr0t58s,6
1589805572.0,2020-05-18,wallstreetbets,fr0sffo,Gains are gains boyo.,t1_fr0sdwo,7
1589801744.0,2020-05-18,wallstreetbets,fr0nnn2,who's betting against the mongolian empire,t1_fr0ngid,63
1589801872.0,2020-05-18,wallstreetbets,fr0nszs,who's betting against the roman empire,t1_fr0ngid,33
1589802108.0,2020-05-18,wallstreetbets,fr0o2yr,Who's betting against the british empire?,t1_fr0ngid,26
1589820573.0,2020-05-18,wallstreetbets,fr1j0xa,They have nothing to do after their options expired worthless and mommy won’t fund more,t1_fr1ixyi,7
1589834654.0,2020-05-18,wallstreetbets,fr2bxry,"Yeah every time. To their credit, though, what the fuck else are they supposed to say? “Stocks up on another irrational day while world is burning”",t1_fr2bpw8,12
1589834728.0,2020-05-18,wallstreetbets,fr2c37g,"You are right, ""Stocks rally as your mom is giving out free blowjobs on Wall Street"" would've also worked.",t1_fr2bpw8,9
1589817244.0,2020-05-18,wallstreetbets,fr1cdp5,Magic carpet. It swoops under you and takes you to new highs. Aladin snuggles you as he shows you the world.,t1_fr1c49z,7
1589805523.0,2020-05-18,wallstreetbets,fr0scx5,Amen brother.,t1_fr0sbuv,7
1589833802.0,2020-05-18,wallstreetbets,fr2a7wn,How tf do you plan on selling a trillion worth of SPY,t1_fr2a44m,16
1589833935.0,2020-05-18,wallstreetbets,fr2ahf0,[deleted],t1_fr2a44m,8
1589833817.0,2020-05-18,wallstreetbets,fr2a8yy,This is not how you turn billions into trillions. Lol,t1_fr2a44m,8
1589800380.0,2020-05-18,wallstreetbets,fr0m4jn,if i actually took profits instead of getting greedy my all-time returns would probably be net positive,t1_fr0m0y0,18
1589822086.0,2020-05-18,wallstreetbets,fr1m30c,Hes a complete fucking retard.,t1_fr1m14b,10
1589833713.0,2020-05-18,wallstreetbets,fr2a1by,[deleted],t1_fr29tg1,10
1589801163.0,2020-05-18,wallstreetbets,fr0mzrm,"daily thread volume getting less and less since march

guessing most from r/all have been wiped out",t1_fr0mx8t,15
1589815789.0,2020-05-18,wallstreetbets,fr19jih,That's an outdated data point. They've been using the lasagna levels since 2008,t1_fr19gy1,8
1589832359.0,2020-05-18,wallstreetbets,fr279u7,"1,000,000.",t1_fr277m3,8
1589833574.0,2020-05-18,wallstreetbets,fr29qm5,sometimes a stock gains sentience and tries to escape the market and it’s our job as traders to beat it back down to submission where it belongs,t1_fr296kh,12
1589803701.0,2020-05-18,wallstreetbets,fr0pziw," 

# 🤡",t1_fr0pwzf,8
1589816306.0,2020-05-18,wallstreetbets,fr1ajm0,Fake ass capitalism breaks my heart too,t1_fr1ah9u,7
1589800089.0,2020-05-18,wallstreetbets,fr0lt3y,"It's a bullshit company with a bullshit app and inflated user account numbers due to their allowance of gmail tied registration. We should all short it into the dirt, but it's got retard strength the likes of which, I've never seen before.",t1_fr0kv0c,8
1589807432.0,2020-05-18,wallstreetbets,fr0v2rn,Lol more like 100k I wish doe,t1_fr0unk3,22
1589809531.0,2020-05-18,wallstreetbets,fr0ybyk,"I find the red theme more appealing, and thankfully my trades keep it that color.",t1_fr0nxj7,5
