created,date,subreddit,id,body,parent_id,score
1629985925.0,2021-08-26,wallstreetbets,hafa7h7,BB's straight vertical dong is hilarious,t3_pbwdez,5
1629985948.0,2021-08-26,wallstreetbets,hafa9be,[deleted],t3_pbwdez,6
1629986147.0,2021-08-26,wallstreetbets,hafapjz,Hahaha all the 🌈 fake 🐻s screaming that gme was over and death. How fcking many times you guys can be wrong before you’re going to adapt. Losing your money on memes AND spy puts lol,t3_pbwdez,6
1629986217.0,2021-08-26,wallstreetbets,hafavf8,RIDE up 38% thank fuck,t3_pbwdez,5
1629986233.0,2021-08-26,wallstreetbets,hafawpa,1 dte calls on spy anyone 👀,t3_pbwdez,6
1629986458.0,2021-08-26,wallstreetbets,hafbfgc,GME must pump,t3_pbwdez,5
1629986611.0,2021-08-26,wallstreetbets,hafbrzg,"I will not buy SPY puts

I will not buy SPY puts

I will not buy SPY puts",t3_pbwdez,5
1629986782.0,2021-08-26,wallstreetbets,hafc6cv,Spy puts or calls?,t3_pbwdez,7
1629986872.0,2021-08-26,wallstreetbets,hafcdho,Hate working hungover,t3_pbwdez,6
1629986962.0,2021-08-26,wallstreetbets,hafckzv,"Pfizer 48c 1dte, if not you don’t like money",t3_pbwdez,6
1629987193.0,2021-08-26,wallstreetbets,hafd43n,PLTR puts whenever it goes over $25 never seems to fail,t3_pbwdez,7
1629987215.0,2021-08-26,wallstreetbets,hafd5vr,Go go PLTR,t3_pbwdez,5
1629987414.0,2021-08-26,wallstreetbets,hafdmpi,"Is there news on SENS? Can’t find anything, but happy to have loaded up at 2.94",t3_pbwdez,6
1629987564.0,2021-08-26,wallstreetbets,hafdzcm,Glad I didnt listen to that retards SLQT DD,t3_pbwdez,6
1629987608.0,2021-08-26,wallstreetbets,hafe34q,"Market is flat until jpow talks

Make ur bets now",t3_pbwdez,7
1629987695.0,2021-08-26,wallstreetbets,hafealj,If this is your first time trading in September you're probably about to learn a hard lesson these next few weeks,t3_pbwdez,7
1629987753.0,2021-08-26,wallstreetbets,hafefha,If your dad owns Blackrock tell him to buy CRSR or I’m gonna tell my dad who owns Microsoft to ban you on Xbox Live.,t3_pbwdez,6
1629987897.0,2021-08-26,wallstreetbets,haferlj,"Take a shit spy, DO IT🐻🐻🐻🐻",t3_pbwdez,6
1629987983.0,2021-08-26,wallstreetbets,hafez2h,Yay SPY is crashing 🎉🎉🎉,t3_pbwdez,6
1629988034.0,2021-08-26,wallstreetbets,haff3g3,what just happened?,t3_pbwdez,5
1629988059.0,2021-08-26,wallstreetbets,haff5oy,Wow the fuck just happened!,t3_pbwdez,6
1629988100.0,2021-08-26,wallstreetbets,haff98b,What’s up with the red?  Any particular reason ?,t3_pbwdez,6
1629988108.0,2021-08-26,wallstreetbets,haff9z5,Looks like a bear trap,t3_pbwdez,6
1629988226.0,2021-08-26,wallstreetbets,haffk6w,Yo what the fuck happened.,t3_pbwdez,6
1629988352.0,2021-08-26,wallstreetbets,haffv91,Sold my puts for 15 dollar gain to jump back at spy 349 .... Could've been 500 20 mins later. Fck,t3_pbwdez,5
1629988453.0,2021-08-26,wallstreetbets,hafg41d,Oof quick +50% on 1dte spy puts there,t3_pbwdez,7
1629988501.0,2021-08-26,wallstreetbets,hafg85g,"That was a crazy spy dump, think there’s more to come",t3_pbwdez,5
1629988529.0,2021-08-26,wallstreetbets,hafganp,I….. declare….. BANKRUPTCY!!!!!!,t3_pbwdez,5
1629988545.0,2021-08-26,wallstreetbets,hafgc2d,Paper handed my spy puts at 50% gain now worth more than double mother fucker,t3_pbwdez,7
1629988563.0,2021-08-26,wallstreetbets,hafgdnt,"I'm not a bad trader, I'm a Poverty Creator.",t3_pbwdez,6
1629988590.0,2021-08-26,wallstreetbets,hafgg3g,"Could have sold yesterday, could have sold today, nope.  Fucking held on and lost my shirt.  Goddamn it.",t3_pbwdez,6
1629988604.0,2021-08-26,wallstreetbets,hafgham,445 EOD? Make my vix calls print even more,t3_pbwdez,6
1629988639.0,2021-08-26,wallstreetbets,hafgkbe,"should i take the 20% loss on SPY calls or is it going to recover

any SPY employees got some inside information for me",t3_pbwdez,6
1629988960.0,2021-08-26,wallstreetbets,hafhc57,The taliban are 🌈🐻,t3_pbwdez,5
1629988965.0,2021-08-26,wallstreetbets,hafhcn0,Dark days in American history,t3_pbwdez,6
1629989058.0,2021-08-26,wallstreetbets,hafhkv4,"Let spy dip a bit more, then buy SPY call 2 weeks out.

Works until it does not.",t3_pbwdez,7
1629989095.0,2021-08-26,wallstreetbets,hafho5h,KAPLAN SAYS FED HAS COMMUNICATED A TAPER IS COMING,t3_pbwdez,6
1629989117.0,2021-08-26,wallstreetbets,hafhq4t,You’d think with spy dumping gme would rip,t3_pbwdez,7
1629989147.0,2021-08-26,wallstreetbets,hafhsqb,I think I will buy the dip next week,t3_pbwdez,6
1629989197.0,2021-08-26,wallstreetbets,hafhx3f,It's been a wild ride holding spy puts through this week,t3_pbwdez,5
1629989275.0,2021-08-26,wallstreetbets,hafi406,First time I took a 100% profit in a long time instead of getting greedy. Feels good tbh. I'm a changed man.,t3_pbwdez,7
1629989516.0,2021-08-26,wallstreetbets,hafipg6,Down we go,t3_pbwdez,6
1629989599.0,2021-08-26,wallstreetbets,hafiwmu,Weird that the explosion at the airport isn’t the top story on Reddit.,t3_pbwdez,6
1629989636.0,2021-08-26,wallstreetbets,hafizy1,"It's on you JPow.


You got the juice now.",t3_pbwdez,6
1629989776.0,2021-08-26,wallstreetbets,hafjc56,Fakest dump I've ever seen,t3_pbwdez,6
1629989817.0,2021-08-26,wallstreetbets,hafjfpb,You know damn well spy is going down more than 5% soon cuz there's a thread on wsb telling everyone how it never went down 5% this year,t3_pbwdez,6
1629989882.0,2021-08-26,wallstreetbets,hafjld4,Taliban throwing bulls off buildings instead of bears,t3_pbwdez,6
1629990099.0,2021-08-26,wallstreetbets,hafk478,See you in Valhalla SPY bulls,t3_pbwdez,5
1629990140.0,2021-08-26,wallstreetbets,hafk7p5,Must be Thursday. Never could get the hang of Thursdays.,t3_pbwdez,6
1629990161.0,2021-08-26,wallstreetbets,hafk9g4,Dam. I keep grabbing more calls but she ain’t stopping,t3_pbwdez,6
1629990258.0,2021-08-26,wallstreetbets,hafkhwu,Just obliterated me… how do y’all deal,t3_pbwdez,6
1629990276.0,2021-08-26,wallstreetbets,hafkjh6,the SPY is falling!!!,t3_pbwdez,7
1629990400.0,2021-08-26,wallstreetbets,hafkuid,well after losing 7k last 2 weeks. I will take a win of $350 today and stay cashgang till maybe close,t3_pbwdez,6
1629990590.0,2021-08-26,wallstreetbets,haflav2,"""I can picture in my mind a world without war, a world without hate. And I can picture us attacking that world because they'd never expect it.""",t3_pbwdez,6
1629990873.0,2021-08-26,wallstreetbets,haflzac,"whew that was terrifying, glad it's over now, felt like forever

SPY 451 EOD",t3_pbwdez,5
1629990960.0,2021-08-26,wallstreetbets,hafm6x1,Taking a break from options was the best decision I made,t3_pbwdez,7
1629991088.0,2021-08-26,wallstreetbets,hafmhvj,This is the kind of volatility we need on a daily basis,t3_pbwdez,6
1629991324.0,2021-08-26,wallstreetbets,hafn2mz,"New bear market is two 5min red candles a week

Lmao Fook",t3_pbwdez,6
1629991453.0,2021-08-26,wallstreetbets,hafne1v,GME proves to be the safe haven today.,t3_pbwdez,6
1629991462.0,2021-08-26,wallstreetbets,hafnevl,"Went from up 7 bills On spy puts to only
Being up 175$ …. All in 30 minutes . 


FUCK",t3_pbwdez,7
1629991484.0,2021-08-26,wallstreetbets,hafngsh,"Wait a sec.  Taper coming and market bouncing?

Might just stay in cash to see",t3_pbwdez,5
1629991843.0,2021-08-26,wallstreetbets,hafoce8,I live my life like the fucking 1 minute chart,t3_pbwdez,6
1629991931.0,2021-08-26,wallstreetbets,hafok72,"Lost a ton of money trying to buy the dip today, then made it all up plus a tiny bit somehow.  Of course, I'm down on all my holdings, but a small win is a win.",t3_pbwdez,5
1629991989.0,2021-08-26,wallstreetbets,hafop5p,"So buying calls on $GME and puts on $SPY, it always works",t3_pbwdez,7
1629992037.0,2021-08-26,wallstreetbets,hafotip,To anyone who read the ASTS DD—welcome to the bag holder club. It’s easily my favorite bag to hold.,t3_pbwdez,6
1629992145.0,2021-08-26,wallstreetbets,hafp36h,Are my October $450c on SPY fuk or naw?,t3_pbwdez,7
1629992385.0,2021-08-26,wallstreetbets,hafpok6,Pancreatic cancer is one of the nastiest types of cancer you can get. Imagine Steve Jobs getting it and thinking he could overcome it with fruit. With all the resources he was privileged to.  Unreal,t3_pbwdez,6
1629992717.0,2021-08-26,wallstreetbets,hafqij4,You call that a dip? 📞😏,t3_pbwdez,6
1629992742.0,2021-08-26,wallstreetbets,hafqks0,Now we're at the part where SPY bounces up and down 50¢ until the final 3 minutes of the day,t3_pbwdez,7
1629992826.0,2021-08-26,wallstreetbets,hafqsbz,Punch myself in the dick ? Ok ✅,t3_pbwdez,5
1629992896.0,2021-08-26,wallstreetbets,hafqyqa,"Maybe I should do this gay bear thing more often, erased a month of losses in an hour",t3_pbwdez,8
1629993079.0,2021-08-26,wallstreetbets,hafrfm4,watch SPY trade perfectly flat rest of day as VIX goes back to 17.  Premium sellers getting one over on retail again.,t3_pbwdez,6
1629993236.0,2021-08-26,wallstreetbets,hafru02,[deleted],t3_pbwdez,5
1629993281.0,2021-08-26,wallstreetbets,hafry3f,Someone asked the best route of administration for Ivermectin. I knew he was dumb because its always boof. Boof all drugs,t3_pbwdez,7
1629993836.0,2021-08-26,wallstreetbets,haftck6,Literally horrible news today and we make a V I'm actually amazed,t3_pbwdez,6
1629993885.0,2021-08-26,wallstreetbets,haftguz,4 hours left. We really about to go green today.,t3_pbwdez,6
1629994081.0,2021-08-26,wallstreetbets,haftyej,Crash upwards,t3_pbwdez,6
1629994248.0,2021-08-26,wallstreetbets,hafudhy,"I live in the UK and saw my first Wendy's today in the city of Reading. I was shocked because I was certain there were no Wendy's in the UK. 

So is there like a secret code or phrase to get a Wendy's handjob?",t3_pbwdez,6
1629995023.0,2021-08-26,wallstreetbets,hafwc1q,"All these 🌈 🐻 trying to predict a market crash, thinking they’re so smart. It will happen when you capitulate and become a bull.",t3_pbwdez,5
1629995536.0,2021-08-26,wallstreetbets,hafxmv9,So Tesla gonna trade like a boomer stock now?,t3_pbwdez,5
1629995618.0,2021-08-26,wallstreetbets,hafxuf3,I hate when my plays immediately turn into [coffin flops](https://youtu.be/0Rn5QdO07d8),t3_pbwdez,6
1629995764.0,2021-08-26,wallstreetbets,hafy7tl,"Just starting out? Here's my best retard 7 step process to trading!  


1. Divide your portfolio into 52
2. Look at trendy companies that have earnings coming up in 1 to 2 weeks time
3. Buy calls or puts expiring the week of the earnings for one company at the highest (for calls) or lowest (for puts) strikes where volume disappears after that strike using 1/52th of your portfolio
4. Hope that maybe 5-10 of these hits big for you over the course of the 52 weeks.
5. Sell all your possessions
6. Panhandle until you get your capital again
7. Repeat",t3_pbwdez,5
1629995897.0,2021-08-26,wallstreetbets,hafyk4c,Imagine thinking fed is coming on today and not tomorrow,t3_pbwdez,7
1629995907.0,2021-08-26,wallstreetbets,hafyl5h,lol this fuckin market man,t3_pbwdez,7
1629995962.0,2021-08-26,wallstreetbets,hafyq3p,Have you even seen spy with his shirt off?,t3_pbwdez,5
1629990817.0,2021-08-26,wallstreetbets,hafluhn,It’s all apart of the quest.,t1_hafls5v,6
1629981386.0,2021-08-26,wallstreetbets,haf0qg9,Every fuckin day,t1_haezwci,6
1629995573.0,2021-08-26,wallstreetbets,hafxq8m,Probably should give it back to the dude that spent the night,t1_hafx527,12
1629981290.0,2021-08-26,wallstreetbets,haf0k06,Imagine suing the band that gave you your only reason to live.,t1_haf0fpz,36
1629982017.0,2021-08-26,wallstreetbets,haf1y09,The more you know 🌈,t1_haf1nb6,16
1629992901.0,2021-08-26,wallstreetbets,hafqz8t,Tomorrow afternoon,t1_hafqwnk,6
1629982877.0,2021-08-26,wallstreetbets,haf3nxp,"1.	Do you have a scanner and color printer?
2.	Are you prepared to fight the biggest guy in prison if necessary?",t1_haf33fw,30
1629983029.0,2021-08-26,wallstreetbets,haf3z3s,Use that money to buy a cute outfit and start hooking,t1_haf33fw,6
1629988402.0,2021-08-26,wallstreetbets,haffzik,yo I did the same thing but for AMC. Let's hold each other's hands and pray for miracle or we bagholding and sucking cock for days,t1_haffu9c,7
1629980677.0,2021-08-26,wallstreetbets,haezez6,Welcome to the club. Can I offer you an egg in these trying times?,t1_haez3uh,6
1630002155.0,2021-08-26,wallstreetbets,hagek2i,That's way too close - I'd sell off of any green dildo,t1_hagef5u,8
1630003080.0,2021-08-26,wallstreetbets,haggtzr,ride the snake,t1_haggqjk,7
1629977253.0,2021-08-26,wallstreetbets,haetmmz,Did we just become best friends?,t1_haetk0u,24
1629977669.0,2021-08-26,wallstreetbets,haeu9yj,Looks more like scotch instead of tea,t1_haetonc,7
1629991718.0,2021-08-26,wallstreetbets,hafo1a3,Watch one on Ants they are lit,t1_hafnyal,5
1629996472.0,2021-08-26,wallstreetbets,hag0105,goes down $4 and my options go down $700 :(,t1_hafzvxj,10
1629977233.0,2021-08-26,wallstreetbets,haetlgo,How else do you do naked shorting?,t1_haetilu,9
1629994359.0,2021-08-26,wallstreetbets,hafunfs,Comments like this make me sad. I hate how regional variation is dying. Tell Wendy’s to fuck off and get a hand job behind a British establishment,t1_hafudhy,6
1629981622.0,2021-08-26,wallstreetbets,haf16ni,Imagine growing up to chase money from the band which depicted you chasing money as child to .are a statement about the world we live in. Fulfilling his prophecy,t1_haf0k06,17
