created,date,subreddit,id,body,parent_id,score
1626122123.0,2021-07-13,wallstreetbets,h4ym6bx,"Sell my iPhone, watch, iPad, MacBook, airtags, and appleTV to cover this margin call.",t3_oiz3pf,12
1626124862.0,2021-07-13,wallstreetbets,h4ys67q,"Oh guys want it? You want the porn, feast your eyes!!! 

https://old.reddit.com/r/wallstreetbets/comments/oj0p9w/loss_porn_for_a_little_guy_bb_2k23k1900yes_i_have/?ref=share&ref_source=link


Yes I am gay now",t3_oiz3pf,11
1626126227.0,2021-07-13,wallstreetbets,h4yv29i,"Guys, according to CNBC we here on Reddit are going for silver again! 🤦‍♂️",t3_oiz3pf,10
1626126502.0,2021-07-13,wallstreetbets,h4yvn78,"WSB sentiment is currently max bullish, making me a bit skeptical about the continuation of this rally",t3_oiz3pf,11
1626126518.0,2021-07-13,wallstreetbets,h4yvofy,Breaking out my silver quarter collection right now to sell to Cramer,t3_oiz3pf,11
1626126609.0,2021-07-13,wallstreetbets,h4yvvje,Who the hell buys Silver when we got Memestonks?,t3_oiz3pf,11
1626126876.0,2021-07-13,wallstreetbets,h4ywfv6,Silver? Do they mean Reddit silver?,t3_oiz3pf,11
1626127081.0,2021-07-13,wallstreetbets,h4ywv8q,I convinced my uncle to yolo spy calls on Thursday that expired today. I sold them for 100% on Friday and forgot to tell him to sell. He called me saying schwab sold those call options for 3120. I walked away with 100% and he got 650%.,t3_oiz3pf,11
1626127509.0,2021-07-13,wallstreetbets,h4yxrfw,What are my moves for tomorrow? Definitely not buying into any of your bags you fucking meatballs.,t3_oiz3pf,12
1626128072.0,2021-07-13,wallstreetbets,h4yywtv,Everyday I regret not buying SPY calls. It goes down and comes back up immediately. Free money,t3_oiz3pf,12
1626130078.0,2021-07-13,wallstreetbets,h4z2zg1,So I bought Valheim on steam summer sale.. I'm wandering around pretty much clueless. Manage to craft me an axe. I decide to chop down a tree and it falls on me and fucking kills me. I can already tell I'm going to like this game.,t3_oiz3pf,12
1626131260.0,2021-07-13,wallstreetbets,h4z5b70,I wonder what the elevator down will look like,t3_oiz3pf,12
1626132956.0,2021-07-13,wallstreetbets,h4z8kyd,I’m hearing a lot about this SPY and my dad said it’s the stock for the CIA and your money goes to spies to help them fight for America that sounds great,t3_oiz3pf,10
1626133024.0,2021-07-13,wallstreetbets,h4z8pkh,#FUTURES FLAT RED,t3_oiz3pf,11
1626133093.0,2021-07-13,wallstreetbets,h4z8u8w,just checked my all time chart and I’m down $50K…F,t3_oiz3pf,11
1626133220.0,2021-07-13,wallstreetbets,h4z92lh,Riding those NVDA gainzzzz 🚀 🚀 🚀,t3_oiz3pf,11
1626133859.0,2021-07-13,wallstreetbets,h4za9vo,Butt stuff isnt just for women,t3_oiz3pf,12
1626135119.0,2021-07-13,wallstreetbets,h4zcmjl,"My software engineering friend made fun of me

His salary: 105k 

My salary: 40k",t3_oiz3pf,11
1626136854.0,2021-07-13,wallstreetbets,h4zfy99,spy continues to rip to new ATHs and my portfolio continues to go down. i’m in the wrong stocks man,t3_oiz3pf,10
1626137035.0,2021-07-13,wallstreetbets,h4zgam7,Dick Branson said when he was a kid he dreamed looking up at the stars and to imagine what kid today will be able to do later in life. Little did we know he was taking about making all the young people who invested into bagholders. WSB probably gonna have to set up a support group on this one,t3_oiz3pf,12
1626138330.0,2021-07-13,wallstreetbets,h4zir9e,"Bears think they gonna get SDOW JPOW on Wednesday for the speech.

But they forgot that it’s July.

Blackrock Powell is showing up instead with his $20,000,000 in BLK and $45,000,000 in broad market ETFs and real estate and dropping the mic on these bears.

Come back in September.",t3_oiz3pf,11
1626139759.0,2021-07-13,wallstreetbets,h4zlha4,"I sold my DIS too early.   


Fuck my juicy, tight, succulent ass.",t3_oiz3pf,9
1626140163.0,2021-07-13,wallstreetbets,h4zm9ky,Here comes the massive bull run in 2021,t3_oiz3pf,10
1626141151.0,2021-07-13,wallstreetbets,h4zo70y,#NVDA = 🚀,t3_oiz3pf,11
1626142010.0,2021-07-13,wallstreetbets,h4zptxm,"NVDA

BODY

DIS

GME

FCEL

BLDP

are stoks i like",t3_oiz3pf,12
1626142329.0,2021-07-13,wallstreetbets,h4zqesl,"Thread ticker mentions:

AAPL: 19  

NVDA: 19

AMC: 29

TSLA: 41

SPY: **192**

🧐",t3_oiz3pf,12
1626142660.0,2021-07-13,wallstreetbets,h4zr0eb,RIP my Boeing calls damn this stock can't catch a break.,t3_oiz3pf,10
1626145916.0,2021-07-13,wallstreetbets,h4zwsbv,[deleted],t3_oiz3pf,11
1626157123.0,2021-07-13,wallstreetbets,h50d2sy,[deleted],t3_oiz3pf,12
1626157297.0,2021-07-13,wallstreetbets,h50dajh,Tried the KFC chicken sandwich today and it confirms what I already knew...Popeyes reigns supreme.,t3_oiz3pf,9
1626160866.0,2021-07-13,wallstreetbets,h50hfwv,Fuck it i’m gonna try onlyfans for my hairy legs. There’s a market for anything bois,t3_oiz3pf,11
1626163165.0,2021-07-13,wallstreetbets,h50jxfk,Jpow better be drinking a 99 cent Arizona iced tea tomorrow to hammer home that inflation is fake and transitory.,t3_oiz3pf,10
1626164991.0,2021-07-13,wallstreetbets,h50lujq,[deleted],t3_oiz3pf,11
1626168707.0,2021-07-13,wallstreetbets,h50pn46,Prrmarket is fake and gay until cpi numbers,t3_oiz3pf,9
1626173688.0,2021-07-13,wallstreetbets,h50v3tg,Just buy NIO,t3_oiz3pf,11
1626120125.0,2021-07-13,wallstreetbets,h4yhswz,"If you got wrecked on SPCE, you should really only paper trade for the next 6 months or so.  This was the classic ""sell the news"" event.

We've all been there, it'll be okay.",t3_oiz3pf,67
1626120484.0,2021-07-13,wallstreetbets,h4yikpz,"Coworker swishes water in his mouth every time he takes a drink

Puts on my sanity",t3_oiz3pf,11
1626120569.0,2021-07-13,wallstreetbets,h4yirb4,Anyone long on disney is jizzing rn,t3_oiz3pf,10
1626120997.0,2021-07-13,wallstreetbets,h4yjo5p,Feel like I make all my money with thetagang and come here to throw it all away sigh,t3_oiz3pf,11
1626122198.0,2021-07-13,wallstreetbets,h4ymcam,"Gonna go get some Wendy’s, looking forward to seeing all the 🌈🐻s behind the dumpster sucking dick to make up for there puts.",t3_oiz3pf,9
1626124901.0,2021-07-13,wallstreetbets,h4ys99l,When the fuck is Opposite Day? Maybe then I can finally make some fucking money.,t3_oiz3pf,11
1626125544.0,2021-07-13,wallstreetbets,h4ytmj6,Mama cathie said deflation should start any minute now,t3_oiz3pf,11
1626126424.0,2021-07-13,wallstreetbets,h4yvh6o,"No matter what will happen tomorrow, I wish you all the best. I know some of you have been struggling a lot, especially bears. Consider taking a break from this meme market if you need to. But one thing for sure, what comes up, must come down, just matter when. We all know the fun will end at some point, but before that happens, stay alive.",t3_oiz3pf,11
1626126910.0,2021-07-13,wallstreetbets,h4ywige,The air of SPY invincibility on here make me nervous,t3_oiz3pf,10
1626126964.0,2021-07-13,wallstreetbets,h4ywmk7,Adele kinda bangable now,t3_oiz3pf,10
1626128190.0,2021-07-13,wallstreetbets,h4yz5im,Member when SPY phutes swung 1-3% everyday ? I member 🍇,t3_oiz3pf,11
1626129150.0,2021-07-13,wallstreetbets,h4z14e1,"**Without fail**

Every Sunday or Monday there is a front page post about how this week a certain meme stock will finally squeeze",t3_oiz3pf,10
1626129725.0,2021-07-13,wallstreetbets,h4z2a7x,Huge CPI miss tomorrow?  Momma Cathie told me we live in deflationary world.,t3_oiz3pf,11
1626130065.0,2021-07-13,wallstreetbets,h4z2yih,"Make a couple of grand > ""I'm pretty good at this""
Lose a couple of grand > ""Guess I just got unlucky""",t3_oiz3pf,11
1626130099.0,2021-07-13,wallstreetbets,h4z30wc,My cock started pulsating more and more with each green candle that CLOV put out today,t3_oiz3pf,10
1626130336.0,2021-07-13,wallstreetbets,h4z3i06,Cyberpunk kinda boring played it for 10 mins probably done,t3_oiz3pf,10
1626130851.0,2021-07-13,wallstreetbets,h4z4ibn,"If you invested $1000 in X stock one year ago here's how much you'd have now."" YouTube videos and articles are the lowest effort kuso available. Who reads this napkin math and gets wowed, honestly?",t3_oiz3pf,9
1626132227.0,2021-07-13,wallstreetbets,h4z76yw,I went from buying SPY 50 puts to buying SPY 440 calls. Good times.,t3_oiz3pf,10
1626133091.0,2021-07-13,wallstreetbets,h4z8u4v,Dick Branson,t3_oiz3pf,9
1626134044.0,2021-07-13,wallstreetbets,h4zam6c,[deleted],t3_oiz3pf,10
1626134576.0,2021-07-13,wallstreetbets,h4zblh7,Futures green whats new,t3_oiz3pf,10
1626134638.0,2021-07-13,wallstreetbets,h4zbpo5,This Friday what used to be 20% of my portfolio might expire worthless,t3_oiz3pf,10
1626135542.0,2021-07-13,wallstreetbets,h4zdfcs,Hey guys I’m retarded,t3_oiz3pf,10
1626135712.0,2021-07-13,wallstreetbets,h4zdqw0,"8:30AM BAD DATA

8:31AM SPY GREEN AS FUCK",t3_oiz3pf,11
1626135787.0,2021-07-13,wallstreetbets,h4zdw3r,"If anyone knows anything about major acquisitions or purchases of companies like State Auto or Stamps.com, now would be a great fucking time to say it.",t3_oiz3pf,10
1626137641.0,2021-07-13,wallstreetbets,h4zhg69,[deleted],t3_oiz3pf,10
1626138952.0,2021-07-13,wallstreetbets,h4zjxl8,Favorite Ticker from 2020 that gets no attention here anymore?  Ill start.  ICLN,t3_oiz3pf,9
1626139806.0,2021-07-13,wallstreetbets,h4zlkir,"If you don't have 25k then you really only get 3 trades a week, that's it edit- wow this went over a lot of heads",t3_oiz3pf,10
1626140300.0,2021-07-13,wallstreetbets,h4zmj4y,"🕧 🛎

░░░░░░███████ ]▄▄▄▄▄▄▄▄▃
▂▄▅█████████▅▄▃▂
I███████████████████].
◥⊙▲⊙▲⊙▲⊙▲⊙▲⊙▲⊙◤...",t3_oiz3pf,10
1626142438.0,2021-07-13,wallstreetbets,h4zqlxz,S&P Futures are as meaningless tomorrow as they were last night.,t3_oiz3pf,10
1626145009.0,2021-07-13,wallstreetbets,h4zv7ba,Disney about to go crazy tomorrow at open because of Elon’s tweet,t3_oiz3pf,10
1626146769.0,2021-07-13,wallstreetbets,h4zy8l8,"BABA Gang, how are we feeling?",t3_oiz3pf,11
1626148017.0,2021-07-13,wallstreetbets,h500bjt,Lost money on spy puts today and bought more b4 close am I dumb?,t3_oiz3pf,11
1626149397.0,2021-07-13,wallstreetbets,h502icx,Can someone tell me if my SPY puts are going to print?,t3_oiz3pf,10
1626156941.0,2021-07-13,wallstreetbets,h50cun8,Why do people hate on pineapple on pizza?,t3_oiz3pf,11
1626161459.0,2021-07-13,wallstreetbets,h50i34k,"CLOV having fun in Germany, bring it home boys 🤑",t3_oiz3pf,10
1626162266.0,2021-07-13,wallstreetbets,h50iyg2,El Pollo Loco value combos used to be $5 just a few months ago. It's like $5.69 now. Fucking inflation bro shit be real and tough out here,t3_oiz3pf,10
1626164781.0,2021-07-13,wallstreetbets,h50lmqb,Coming on here drunk in the middle of the night to shit post with a bunch of other drunks is something I wish I'd discovered sooner.  BTW fuck Branson he could have waited to announce the flight during market hours and he could have waited to announce the flood of extra shares at least a day later.,t3_oiz3pf,10
1626164883.0,2021-07-13,wallstreetbets,h50lql4,SPY $420 is not a meme,t3_oiz3pf,10
1626169010.0,2021-07-13,wallstreetbets,h50pyii,[deleted],t3_oiz3pf,10
1626122079.0,2021-07-13,wallstreetbets,h4ym2s0,[deleted],t3_oiz3pf,30
1626123503.0,2021-07-13,wallstreetbets,h4yp8io,$wish is such a trash ass stock lmao,t3_oiz3pf,30
1626124928.0,2021-07-13,wallstreetbets,h4ysbai,Where’s that fucker that posted 200k yolo on virgin galactic. Bet his pp not doing so good today,t3_oiz3pf,27
1626130350.0,2021-07-13,wallstreetbets,h4z3j18,"Nothing says ""healthy market"" like everyone doing an IPO and diluting their shares every single quarter.

Ha ha im in danger",t3_oiz3pf,28
1626145981.0,2021-07-13,wallstreetbets,h4zwwc6,"Top response on Elon’s recent Tweet is “I lost my house because of you.”

What a time to be alive.",t3_oiz3pf,31
1626121236.0,2021-07-13,wallstreetbets,h4yk6s0,Green by open.  Green by close.  Rinse and repeat.,t3_oiz3pf,10
1626122006.0,2021-07-13,wallstreetbets,h4ylwtm,"Me: I will not option trade this month while I move.  
My Brain: Its earnings time!  
Me: No, that money is for moving.   
My Brain: You Gotta!  
Me: I gotta!",t3_oiz3pf,8
1626122127.0,2021-07-13,wallstreetbets,h4ym6nc,Welp almost had a 100% day on spy and dis,t3_oiz3pf,9
1626122153.0,2021-07-13,wallstreetbets,h4ym8s3,"2.3 million SPY puts open for this Friday 

1.0 million SPY calls open for this Friday

Let’s see what happens",t3_oiz3pf,10
1626123461.0,2021-07-13,wallstreetbets,h4yp57u,"When I see a lot if you switching from SPY puts to calls, my street lights turn green to yellow.",t3_oiz3pf,8
1626125785.0,2021-07-13,wallstreetbets,h4yu4ox,SPY is a good dildo company. Always delivers on time.,t3_oiz3pf,9
1626126663.0,2021-07-13,wallstreetbets,h4yvznw,Puts on Silver might be the bet. CNBC is fake news!,t3_oiz3pf,9
1626127273.0,2021-07-13,wallstreetbets,h4yx9nh,"Ten minutes after I sell calls on clov to try to recoup some losses… the shit goes straight up!
Y’all are welcome!",t3_oiz3pf,10
1626129306.0,2021-07-13,wallstreetbets,h4z1fvh,Britney’s father should place a conservatorship on CRAMER.,t3_oiz3pf,8
1626130127.0,2021-07-13,wallstreetbets,h4z32wk,If a bunch of these zero earnings companies start doing secondaries im gonna be extra cautious.  Nothing kills aggressive calls as much as a fck ton of dilution,t3_oiz3pf,9
1626130356.0,2021-07-13,wallstreetbets,h4z3jhn,So is the definition of mooning +.01%,t3_oiz3pf,9
1626130668.0,2021-07-13,wallstreetbets,h4z45bt,I survived the futures crash of -0.35% yesterday. This is smol pp selling rn,t3_oiz3pf,8
1626130993.0,2021-07-13,wallstreetbets,h4z4s93,"Lumber finally coming down in price.  Now, yu can build your house just can't afford to paint it with PPG raising prices again because of infwacion",t3_oiz3pf,9
1626131290.0,2021-07-13,wallstreetbets,h4z5daq,"*Tokyo under state of emergency*

And the Nikkei 225 did so well yesterday too 😞🇯🇵",t3_oiz3pf,9
1626132376.0,2021-07-13,wallstreetbets,h4z7hak,$TSLA,t3_oiz3pf,10
1626132742.0,2021-07-13,wallstreetbets,h4z86cf,No volume today. No volume tonight. Calm before the storm,t3_oiz3pf,8
1626133063.0,2021-07-13,wallstreetbets,h4z8s77,"So let me get this straight...CVI report tomorrow, JPOW Wednesday....but you're saying YOLO on WISH tomorrow?",t3_oiz3pf,9
1626134140.0,2021-07-13,wallstreetbets,h4zasm9,So Apple resume moon tomorrow right?,t3_oiz3pf,8
1626134933.0,2021-07-13,wallstreetbets,h4zc9t1,"Stocks only go up, everything else is a lie.",t3_oiz3pf,9
1626136978.0,2021-07-13,wallstreetbets,h4zg6o8,[deleted],t3_oiz3pf,9
1626137503.0,2021-07-13,wallstreetbets,h4zh6td,i ate so many damn brussel sprouts for dinner. gonna drop a solid brick in the morning,t3_oiz3pf,9
1626138175.0,2021-07-13,wallstreetbets,h4zigh2,"Put a cap on capitalism.. call it capcaputism 
  
 🚫🧢",t3_oiz3pf,9
1626138362.0,2021-07-13,wallstreetbets,h4zitf7,"Jerome first line boutta be ""find a seat""",t3_oiz3pf,9
1626138544.0,2021-07-13,wallstreetbets,h4zj5w0,"Permabears have been yelling market correction for a good year now, when will their caretakers take away the phone",t3_oiz3pf,9
1626138804.0,2021-07-13,wallstreetbets,h4zjncj,"Listen up, retards. Put down the crayons, gather round, sit on the carpet, and hear about my potential infinite-money scheme I'm trying tomorrow:   

Step 1. Sell SPY put credit spreads. Collect premium (these are spreads, not naked puts, because they require less margin from your autistic broker - even poors can try this out!)   

Step 2. Spend that premium on OTM SPY calls  

Step 3. Stocks only go up!  

Step 4. Sell your OTM call for tendies. Repeat.  

Literally cannot go tits up, amirite???????? AM I RIGHT?!",t3_oiz3pf,9
1626138849.0,2021-07-13,wallstreetbets,h4zjqcz,Mickey Mouse Said $195 Tomorrow,t3_oiz3pf,9
1626140031.0,2021-07-13,wallstreetbets,h4zm088,I turned $100 into 20k playing slots and got sucked into spinning $100/spins and now in at 8k.  The last 9 hours are a blur,t3_oiz3pf,8
1626141224.0,2021-07-13,wallstreetbets,h4zoc1e,RIP $1M realized loss Disney yolo guy who had 5+ months left on his contracts.,t3_oiz3pf,8
1626142903.0,2021-07-13,wallstreetbets,h4zrg5j,Why the hell did I buy puts friday,t3_oiz3pf,9
1626143208.0,2021-07-13,wallstreetbets,h4zs0aj,"Pete ""Polar Bear"" Alonso about to win the home run derby  
 
*Bearish*",t3_oiz3pf,9
1626143316.0,2021-07-13,wallstreetbets,h4zs7d1,[deleted],t3_oiz3pf,9
1626143320.0,2021-07-13,wallstreetbets,h4zs7m2,Clov calls 🤑,t3_oiz3pf,9
1626143540.0,2021-07-13,wallstreetbets,h4zsls1,I notice CNBC runs that Sesame Street Autism awareness commercial a lot during Cramer.,t3_oiz3pf,8
1626143541.0,2021-07-13,wallstreetbets,h4zsltq,Ever referred to the morning as premarket in casual conversation?,t3_oiz3pf,8
1626144149.0,2021-07-13,wallstreetbets,h4ztonm,Holy shit. Vix going down faster than bears pp,t3_oiz3pf,9
1626144394.0,2021-07-13,wallstreetbets,h4zu47j,Loaded in my JPM 07/16 puts. Either 5x or become 0$ at market open. Wish me luck!,t3_oiz3pf,8
1626144886.0,2021-07-13,wallstreetbets,h4zuz89,Spy 450 tmrw,t3_oiz3pf,9
1626146029.0,2021-07-13,wallstreetbets,h4zwz9d,I miss the times when you check futures are 6pm and they are up 60 points and check back at 7pm and they’re down 40 points. This is soooo boring! 😒😒😒,t3_oiz3pf,10
1626146663.0,2021-07-13,wallstreetbets,h4zy29w,"The last time I saw this many bulls in here, calls were the way",t3_oiz3pf,10
1626147520.0,2021-07-13,wallstreetbets,h4zzi4c,Child tax credits start printing this week.. long diapers and formula,t3_oiz3pf,8
1626147548.0,2021-07-13,wallstreetbets,h4zzjtm,Alaskan King Crab 10 lbs at Costco is 399$. This is how I gauge inflation.,t3_oiz3pf,9
1626147619.0,2021-07-13,wallstreetbets,h4zzo1p,"As a straight man who poops transgender, DIS 190 EOW.",t3_oiz3pf,8
1626148346.0,2021-07-13,wallstreetbets,h500uzp,Ya wife is in me Deams!! - Conor,t3_oiz3pf,9
1626148556.0,2021-07-13,wallstreetbets,h501725,"CPI data and Investment bank earnings. 

Literally can’t go tits up",t3_oiz3pf,9
1626149542.0,2021-07-13,wallstreetbets,h502qeb,Adding another 100 CLOV,t3_oiz3pf,9
1626149735.0,2021-07-13,wallstreetbets,h5030tk,Just got the job offer I’ve been waiting for. Tell my boss politely tomorrow or cut a WWF style promo at the company picnic Friday?,t3_oiz3pf,8
1626150424.0,2021-07-13,wallstreetbets,h50430j,Its Chewsday innit.,t3_oiz3pf,9
1626150693.0,2021-07-13,wallstreetbets,h504hcm,F in chat for all fellow spcetards,t3_oiz3pf,8
1626151024.0,2021-07-13,wallstreetbets,h504yss,The USA mens basketball team is a god damn joke,t3_oiz3pf,7
1626154943.0,2021-07-13,wallstreetbets,h50abf8,Calls on $SNEK,t3_oiz3pf,8
1626155068.0,2021-07-13,wallstreetbets,h50ahcn,As Jpow always said:  fuck your puts,t3_oiz3pf,9
1626155218.0,2021-07-13,wallstreetbets,h50aooj,YO EVER HEAR OF JERKMATE?,t3_oiz3pf,9
1626155365.0,2021-07-13,wallstreetbets,h50avgz,"If you are the president and aren't running the printer at full blast so bers r fuk every day

You a bitch",t3_oiz3pf,10
1626156486.0,2021-07-13,wallstreetbets,h50cagt,I really dont wanna work tomorrow,t3_oiz3pf,9
1626156610.0,2021-07-13,wallstreetbets,h50cfvv,Craving a smoked salmon bagel with cream cheese 🤤,t3_oiz3pf,8
1626156960.0,2021-07-13,wallstreetbets,h50cvin,Buy a real stock $DIS,t3_oiz3pf,11
1626158814.0,2021-07-13,wallstreetbets,h50f3nn,Asia stocks so green right now,t3_oiz3pf,10
1626159453.0,2021-07-13,wallstreetbets,h50fucw,I love my spy money more than my working money cuz it’s a blessing and free so it’s okay if it goes away or I spend it on nonsense,t3_oiz3pf,10
1626160116.0,2021-07-13,wallstreetbets,h50gliv,Fucken fuck my account is blown tomorrow holy cock for shit,t3_oiz3pf,9
1626161028.0,2021-07-13,wallstreetbets,h50hm9s,They got three people trading in Frankfort or what? A little volume would be nice.,t3_oiz3pf,10
1626164563.0,2021-07-13,wallstreetbets,h50len8,Crash still happening,t3_oiz3pf,8
1626169933.0,2021-07-13,wallstreetbets,h50qx7u,Just like Nok i now have no working kia:( pray for my engine,t3_oiz3pf,9
1626172761.0,2021-07-13,wallstreetbets,h50u10d,NIO 🚀🚀🚀 exports to EUROPE next week 🚀🚀🚀 60$ EOD,t3_oiz3pf,10
1626121435.0,2021-07-13,wallstreetbets,h4ykm7i,Buying more $clov to help my other $clov shares not be so lonely,t3_oiz3pf,69
1626122325.0,2021-07-13,wallstreetbets,h4ymmjc,was glad to see CLOV do something positive for the CLOVtards today. I wish WKHS would take notes.,t3_oiz3pf,38
1626120056.0,2021-07-13,wallstreetbets,h4yhnp8,Fakest and gayest market out there,t3_oiz3pf,25
1626123063.0,2021-07-13,wallstreetbets,h4yo9oc,JPM downgraded CLOV and the stock rallied. Any news is good news.,t3_oiz3pf,28
1626123274.0,2021-07-13,wallstreetbets,h4yoqhe,"Hardly no one posts loss porn anymore. 

We get fucktards screaming,  ""To the moon "", then nothing. 

I know you out there.  Stop down voting,  take out the tampons  and show yourself",t3_oiz3pf,26
1626123485.0,2021-07-13,wallstreetbets,h4yp71f,7.5k—$780 in 1 week. Gg,t3_oiz3pf,27
1626124900.0,2021-07-13,wallstreetbets,h4ys97c,Daily reminder Epstein didn’t kill himself,t3_oiz3pf,24
1626127304.0,2021-07-13,wallstreetbets,h4yxbzj,"WSB in the media: ""the surprisingly intelligent and highly coordinated reddit traders are targeting silver as their next move.""

WSB in reality: *shitting, spitting, and pissing all over the room, absolute chaos with no direction and random god awful tickers being spammed by hopeless bagholders*",t3_oiz3pf,26
1626130198.0,2021-07-13,wallstreetbets,h4z3828,"$135 left to gamble. Just need about 20,000% to pay off my truck. Might have to go with CLOV who knows.",t3_oiz3pf,25
1626130447.0,2021-07-13,wallstreetbets,h4z3pt0,God damnit i cant believe that scumbag billionaire fucked me while looking at me dead in the eyes to “follow my dreams”. I hope Bezos goes to a higher altitude and comes back to fuck Bransons wife,t3_oiz3pf,26
1626131535.0,2021-07-13,wallstreetbets,h4z5uh4,If you don't have SPY calls you hate money.,t3_oiz3pf,22
1626141021.0,2021-07-13,wallstreetbets,h4znxwu,"Imagine pumping up your own company encouraging the retail traders to jump in and invest in the future of space travel.  Actually be a part of the publicity stunt only to sell 500 million in stock the next day tanking the stock.  WSB is like Richard Branson's personal charity fund, he thanks you for your donations.",t3_oiz3pf,25
1626121236.0,2021-07-13,wallstreetbets,h4yk6th,"Welp. After losing $4K when I could have made $6K, I decided cash gang was better than chasing for the night.",t3_oiz3pf,8
1626122382.0,2021-07-13,wallstreetbets,h4ymr65,[deleted],t3_oiz3pf,8
1626123281.0,2021-07-13,wallstreetbets,h4yor0v,I don’t know what to do with my life,t3_oiz3pf,8
1626123828.0,2021-07-13,wallstreetbets,h4ypy2z,NVDA calls anyone?,t3_oiz3pf,9
1626124701.0,2021-07-13,wallstreetbets,h4yrteh,SPY.. what a rocket,t3_oiz3pf,8
1626124894.0,2021-07-13,wallstreetbets,h4ys8o1,Can’t wait for 8:30 am EST Hulk dick because this market won’t go down. Fuck the bears🚀🚀🚀🚀🚀🚀🚀🚀🚀,t3_oiz3pf,8
1626125039.0,2021-07-13,wallstreetbets,h4ysk1e,Jerome still not tired printing,t3_oiz3pf,7
1626129064.0,2021-07-13,wallstreetbets,h4z0y4u,Cramer is my least favorite character on CNBC,t3_oiz3pf,8
1626129211.0,2021-07-13,wallstreetbets,h4z18u7,"Oh BB, you OK?",t3_oiz3pf,8
1626130394.0,2021-07-13,wallstreetbets,h4z3m1v,"I told my boss ""I rather hated"" being tha assistant manager!  She fired me.",t3_oiz3pf,8
1626130826.0,2021-07-13,wallstreetbets,h4z4glh,"Natural selection:
Males set supply
Women set demand 
80% of males get rejected and the other 20% are balls deep on $SOFI",t3_oiz3pf,8
1626130902.0,2021-07-13,wallstreetbets,h4z4lsv,"My average on spy 07/16 431p is $128 it closed at .63 

Only thing that can save me is a monumental sell off",t3_oiz3pf,8
1626131065.0,2021-07-13,wallstreetbets,h4z4xhi,Green by open,t3_oiz3pf,8
1626132872.0,2021-07-13,wallstreetbets,h4z8f9b,"“Far more money has been lost by investors preparing for corrections, or trying to anticipate corrections, than has been lost in corrections themselves.” - Michael Scarn",t3_oiz3pf,8
1626133339.0,2021-07-13,wallstreetbets,h4z9ain,I want to be the first person to shove my head up an asshole,t3_oiz3pf,7
1626134305.0,2021-07-13,wallstreetbets,h4zb3ih,"Cramer needs to get cancelled already, can’t stand him",t3_oiz3pf,7
1626134752.0,2021-07-13,wallstreetbets,h4zbxlg,Pls sir do you have some more bags?,t3_oiz3pf,8
1626134798.0,2021-07-13,wallstreetbets,h4zc0os,"Anyone get the feeling like they constantly gotta be doing something? I feel like I gotta go for a bike ride because it’s beautiful as fuck out, but I want to chill with my pup and read Count of Monte Cristo",t3_oiz3pf,8
1626134810.0,2021-07-13,wallstreetbets,h4zc1h1,Am I disabled?,t3_oiz3pf,8
1626134846.0,2021-07-13,wallstreetbets,h4zc3x6,Futures need to be tested for cocaine addiction,t3_oiz3pf,8
1626135156.0,2021-07-13,wallstreetbets,h4zcp17,Buy ATOS. Shares and calls. You’re welcome.,t3_oiz3pf,8
1626135354.0,2021-07-13,wallstreetbets,h4zd2f9,When pltr 40,t3_oiz3pf,7
1626135628.0,2021-07-13,wallstreetbets,h4zdl5g,# 🐻👈🤣,t3_oiz3pf,8
1626135964.0,2021-07-13,wallstreetbets,h4ze8gt,What’s the number one wsb bagheld stock.  I think it’s prb PLTR,t3_oiz3pf,8
1626136965.0,2021-07-13,wallstreetbets,h4zg5rw,"A retard yoloing 1k and a retard yoloing 100k can get to 0 in the same amount of time, but getting to 200k is a different story",t3_oiz3pf,8
1626137210.0,2021-07-13,wallstreetbets,h4zgmjb,It’s actually a relief to not have 100% of my portfolio in a play overnight for once.,t3_oiz3pf,9
1626137309.0,2021-07-13,wallstreetbets,h4zgtb1,BRK.A should have options. It would really take this sub to another level,t3_oiz3pf,8
