created,date,subreddit,id,body,parent_id,score
1604028919.0,2020-10-30,wallstreetbets,gakffmc,the only hoe I need is a hoe lotta cash,t3_jkhkw8,12
1604029232.0,2020-10-30,wallstreetbets,gakfwpj,some of y’all have been watching futures for hours and it’s been flat for the entire time.,t3_jkhkw8,11
1604031426.0,2020-10-30,wallstreetbets,gakj1r0,I’m holding tech calls🤡but at least it ain’t big tech😢🧐,t3_jkhkw8,11
1604032745.0,2020-10-30,wallstreetbets,gakkte1,"Y'all remember Pence's little powerpoint slide ""15 days to stop the spread"" or whatever

Big lol",t3_jkhkw8,12
1604034959.0,2020-10-30,wallstreetbets,gaknkfi,"So when rona is over, WSB convention in Vegas?",t3_jkhkw8,12
1604035597.0,2020-10-30,wallstreetbets,gakob6m,Hold your puts into the weekend if you’re a true 🌈🐻,t3_jkhkw8,11
1604035774.0,2020-10-30,wallstreetbets,gakoipo,VIX just announced its new VIX+ platform 🚀,t3_jkhkw8,12
1604035919.0,2020-10-30,wallstreetbets,gakoon1,Imagine $320 retest but it just goes through it like nothing,t3_jkhkw8,12
1604035936.0,2020-10-30,wallstreetbets,gakopcp,"Fuuuck me I bought 40 SPY 326p FDs at 3:30 today, then we we dropped at close I thought ""326 is way too far OTM"" and I sold them for some moderate gainz.

Luckily I still have some 332ps and 330ps, but those fucking 326ps are gonna print so God damn bigly tomorrow. Those are already on track to be overnight 5-baggers, if not more.

 I'm in pain.",t3_jkhkw8,12
1604036107.0,2020-10-30,wallstreetbets,gakowbw,"BEAR IS DOWN, BULL LOOKIN FOR THE SPEAR, HERE HE COMES...BEAR COUNTERS...STUNNER STUNNER BEAR GOT THE STUNNER ON BULL. THE COUNT 1 2 3!!! AND ITS OVER BULLS R FUK",t3_jkhkw8,12
1604036169.0,2020-10-30,wallstreetbets,gakoyuv,The guy who bought 70K in spy puts earlier. You lucky fuck.,t3_jkhkw8,11
1604036183.0,2020-10-30,wallstreetbets,gakozg6,Its funny that some of you guys think Trump winning will pump the market like crazy. More than likely a full blue sweep would be best since it guarantees a huge economic stimulus bill.,t3_jkhkw8,12
1604036364.0,2020-10-30,wallstreetbets,gakp6rc,"Global stock markets over the past week. 

Nikkei 🟢🔴🔴🔴🔴

KOSPI 🟢🔴🔴🔴🔴

China A50 🔴🔴🔴🔴🔴

Hang Seng 🔴🔴🔴🟢🔴

Dax/FTSE/CAC/Europoors 

🔴🔴🔴🔴🔴🔴🔴🔴🟢🔴

The USA 🔴🔴🔴🔴🔴🔴🔴🔴🟢🔴",t3_jkhkw8,12
1604037194.0,2020-10-30,wallstreetbets,gakq3z9,"Bulls made the classic October mistake. They bought calls in the spooky month and taunted our dark lord Samahin

You know how the old saying goes:

""Don't go long in this month of spooks! Bags will be held! Accounts will be nuked!""

scary yo

🎃",t3_jkhkw8,11
1604037194.0,2020-10-30,wallstreetbets,gakq3zg,"I’m too excited to go to sleep, this is the same feeling I’d have on Christmas Eve as a kid lmao",t3_jkhkw8,11
1604037369.0,2020-10-30,wallstreetbets,gakqav4,Wei Tu Lo,t3_jkhkw8,11
1604038048.0,2020-10-30,wallstreetbets,gakr0nf,"Bulls were hella obnoxious today. Some acting arrogant even, but I wont act like that. I'll just say you're a little bitch.",t3_jkhkw8,11
1604038116.0,2020-10-30,wallstreetbets,gakr33f,"IM ACTUALLY EATING SNACKS WATCHING THIS

🍿🍿",t3_jkhkw8,11
1604038244.0,2020-10-30,wallstreetbets,gakr7xz,if we limit down maybe than snap also can go down 0.01 %,t3_jkhkw8,11
1604038289.0,2020-10-30,wallstreetbets,gakr9nr,Boys sorry for your losses but tomorrows lookin to be a life changing event for me.  Can finally afford that Xlarge plug ive been dreaming of,t3_jkhkw8,11
1604038487.0,2020-10-30,wallstreetbets,gakrgx2,Shoutout all the bears who drilled before us. We wouldn’t be here without them today.,t3_jkhkw8,10
1604038590.0,2020-10-30,wallstreetbets,gakrkod,I remember when futures were .5% we’d get 2am tweet from the president and at least two cabinet members.,t3_jkhkw8,11
1604038595.0,2020-10-30,wallstreetbets,gakrkva,Europoor going to make us hit circuit breakers?,t3_jkhkw8,11
1604038672.0,2020-10-30,wallstreetbets,gakrnpu,Looks like I gotta buy a shopping cart full of toilet paper tomorrow.,t3_jkhkw8,11
1604039266.0,2020-10-30,wallstreetbets,gaks9ia,Bulls calling a bottom before DAX opens up is hilarious,t3_jkhkw8,11
1604039475.0,2020-10-30,wallstreetbets,gaksh3g,I DECLARE BANKRUPTCY!!!,t3_jkhkw8,11
1604039522.0,2020-10-30,wallstreetbets,gaksir8,318 EOD,t3_jkhkw8,11
1604039586.0,2020-10-30,wallstreetbets,gaksl0e,Imagine if you had calls that expire today 😬,t3_jkhkw8,11
1604039648.0,2020-10-30,wallstreetbets,gaksn7d,We could fall all the way to 305 honestly,t3_jkhkw8,11
1604042246.0,2020-10-30,wallstreetbets,gakv40z,Just remember the true gains are the friendships we made along the way...,t3_jkhkw8,11
1604043917.0,2020-10-30,wallstreetbets,gakwmt7,"I smoked thru 8k in 4days, probably 9-10 tomorrow. Woo",t3_jkhkw8,10
1604044272.0,2020-10-30,wallstreetbets,gakwy4n,[deleted],t3_jkhkw8,11
1604046158.0,2020-10-30,wallstreetbets,gakym6p,"Unless Pelosi surprises us passing a stimi or Trump
blesses us by sending dick pics. 0% chance tomorrow is green at any point of the day",t3_jkhkw8,10
1604048106.0,2020-10-30,wallstreetbets,gal0c0v,"It really was as easy as ""Buy puts dated after the election"". LMFAO",t3_jkhkw8,12
1604052069.0,2020-10-30,wallstreetbets,gal3t2m,Imagine thinking that people will buy in at open after seeing most earnings plays get slaughtered,t3_jkhkw8,13
1604014400.0,2020-10-30,wallstreetbets,gajpkhi,[deleted],t3_jkhkw8,31
1604018848.0,2020-10-30,wallstreetbets,gajxnwk,Man I’m 21 and I just want to make enough in the stock market so that I can give back to my parents and help them finally retire,t3_jkhkw8,31
1604018689.0,2020-10-30,wallstreetbets,gajxdmm,Anyone else feel like this whole COVID situation putting life on hold for a year has made them feel like they’re a loser going nowhere in life,t3_jkhkw8,43
1604016527.0,2020-10-30,wallstreetbets,gajtgky,I seriously think NIO is going to be the Tesla of WSB for 2021. I just need someone at Nio to start a lit twitter account and one of you Chinese spies to translate,t3_jkhkw8,21
1604039271.0,2020-10-30,wallstreetbets,gaks9oh,I am so fucking hard right now 😂😂🐂🔫,t3_jkhkw8,22
1604004886.0,2020-10-30,wallstreetbets,gaj74m7,**AAPL THIS IS WHAT YOU GET FOR PUTTING A FAT LADY ON SOLAR ROOF AND NOT SUPPLYING CHARGER WITH THE PHONE**,t3_jkhkw8,20
1604005232.0,2020-10-30,wallstreetbets,gaj7u6w,"FRIENDSHIP ENDED WITH NUTELLA, TIMMY, JEFFRY, AND WHOEVER RUNS WHIRLPOOL... i have no friends left",t3_jkhkw8,21
1604008718.0,2020-10-30,wallstreetbets,gajesgy,"Feels like a Circuit Breaker kind of Friday.

MSFT and AAPL declining to provide Q4 guidance is the giveaway. The canary in the coalmine.

Record breaking daily COVID cases is the poison gas.",t3_jkhkw8,20
1604010870.0,2020-10-30,wallstreetbets,gajiyrq,My ass went all in on my last of 2k I had left on apple puts 💰,t3_jkhkw8,20
1604034107.0,2020-10-30,wallstreetbets,gakmjq4,"Every dollar I make from puts feels so much better then calls. 

I guess that’s how I know I’m gay.",t3_jkhkw8,19
1604002011.0,2020-10-30,wallstreetbets,gaj159a,AMZN REEEEEEEEEEEE,t3_jkhkw8,11
1604002062.0,2020-10-30,wallstreetbets,gaj191j,"We choose to shitpost in this subreddit and do the other things, not because they are easy, but because they are hard; because that goal will serve to organize and measure the best of our energies and skills, because that challenge is one that we are willing to accept, one we are unwilling to postpone, and one we intend to win, and the others, too.",t3_jkhkw8,10
1604002137.0,2020-10-30,wallstreetbets,gaj1eob,Jesus Bezos Christ,t3_jkhkw8,11
1604002143.0,2020-10-30,wallstreetbets,gaj1f4f,"GOOGL 9% AH, and AMZN flat despite smashing it. Why",t3_jkhkw8,9
1604002258.0,2020-10-30,wallstreetbets,gaj1npm,i feel like tomorrow is going to be red,t3_jkhkw8,10
1604002283.0,2020-10-30,wallstreetbets,gaj1pli,Pretty sure tomorrow will have bloodbath in the close,t3_jkhkw8,9
1604002313.0,2020-10-30,wallstreetbets,gaj1rud,STOP THE PROFIT TAKING YOU SCARED FUCKS,t3_jkhkw8,9
1604002942.0,2020-10-30,wallstreetbets,gaj333x,AAPL hasn’t announced yet have they?,t3_jkhkw8,9
1604003180.0,2020-10-30,wallstreetbets,gaj3kzo,Bought 75k in SPX puts at close. Feelin pretty good,t3_jkhkw8,10
1604003194.0,2020-10-30,wallstreetbets,gaj3m1v,37% sales growth for AMZN and it drops. Ok.,t3_jkhkw8,11
1604003438.0,2020-10-30,wallstreetbets,gaj44iv,ONLY 2 CENT BEAT LMAAAAO,t3_jkhkw8,10
1604003502.0,2020-10-30,wallstreetbets,gaj498q,**APPLE IPHONE ORDERS LIGHT AND NO GUIDANCE**,t3_jkhkw8,10
1604003682.0,2020-10-30,wallstreetbets,gaj4mtq,BEARS WERE RIGHT I AM BLEEDING FROM THE ATTACK,t3_jkhkw8,9
1604003690.0,2020-10-30,wallstreetbets,gaj4nfh,"damn, spy is almost back to open now",t3_jkhkw8,11
1604003838.0,2020-10-30,wallstreetbets,gaj4yg3,that’s it. Apple you have fucked me for the last time,t3_jkhkw8,10
1604003961.0,2020-10-30,wallstreetbets,gaj57oz,"TSLA: Imma moon...

Market: Not now...",t3_jkhkw8,10
1604004232.0,2020-10-30,wallstreetbets,gaj5rv6,I hope bear gang held through that obvious bull trap. I’m eatin tomorrow morning are you? 🐻🌈🐻🌈🐻🌈,t3_jkhkw8,10
1604004619.0,2020-10-30,wallstreetbets,gaj6knl,"AAPL misses almost on everything and is down 3.5%
TWTR beats everything but user growth and tanks - 13.5%",t3_jkhkw8,10
1604004878.0,2020-10-30,wallstreetbets,gaj73ya,Wait until the europoors wake up.. it’s over,t3_jkhkw8,10
1604005245.0,2020-10-30,wallstreetbets,gaj7v5u,500k combined loss for WSB tomorrow? 5 Million? More?,t3_jkhkw8,10
1604005254.0,2020-10-30,wallstreetbets,gaj7vtk,I honestly don't know how everything doesn't sell off tomorrow,t3_jkhkw8,10
1604005841.0,2020-10-30,wallstreetbets,gaj92i7,Guess who’s gonna be the proud owner of $AAPL shares? This guy. Right into ex-div week. Shweet.,t3_jkhkw8,10
1604005950.0,2020-10-30,wallstreetbets,gaj9ab5,Apple puts printing brrrr,t3_jkhkw8,9
1604007640.0,2020-10-30,wallstreetbets,gajcnmm,AAPL 💀,t3_jkhkw8,10
1604007863.0,2020-10-30,wallstreetbets,gajd3qt,Ramen is not so bad. Hot sauce makes everything better.,t3_jkhkw8,10
1604008041.0,2020-10-30,wallstreetbets,gajdg7w,Holy apple is on a free fall mission,t3_jkhkw8,10
1604009276.0,2020-10-30,wallstreetbets,gajfw2f,europoor will dump,t3_jkhkw8,9
1604009548.0,2020-10-30,wallstreetbets,gajgf94,If GOOGL goes red... all hell will break loose. Literally propping the market on its back.,t3_jkhkw8,10
1604009622.0,2020-10-30,wallstreetbets,gajgk9j,"VXX +3.69% / $26.70

UVXY +5.46% / $21.81",t3_jkhkw8,10
1604009870.0,2020-10-30,wallstreetbets,gajh1ip,I asked my Grandma if this is the dip and she said no but she also has dementia so idk.,t3_jkhkw8,10
1604011060.0,2020-10-30,wallstreetbets,gajjbl8,The algos are getting ready to run the function `scalpTheRetards(level: .max);`,t3_jkhkw8,11
1604011189.0,2020-10-30,wallstreetbets,gajjkcx,[deleted],t3_jkhkw8,11
1604011597.0,2020-10-30,wallstreetbets,gajkc1g,"Up 700 on day, down 800 AH.

LOL",t3_jkhkw8,8
1604011639.0,2020-10-30,wallstreetbets,gajketr,We going to have a nice circuit breaker Monday,t3_jkhkw8,10
1604011756.0,2020-10-30,wallstreetbets,gajkmqk,Should I sell my leaps and purchase back in after election?,t3_jkhkw8,9
1604012158.0,2020-10-30,wallstreetbets,gajldwi,"Like my dad used to say....

""Son, we just ain't meant to be rich. 

But we'll die eternal, shiny and chrome. 

WITNESS""",t3_jkhkw8,12
1604012434.0,2020-10-30,wallstreetbets,gajlwss,So pissed I didn't go full cash gang last week 🤮,t3_jkhkw8,9
1604012558.0,2020-10-30,wallstreetbets,gajm57v,Can we just fast forward to open?  I know I'm going to wake up at like 4AM anyways.,t3_jkhkw8,9
1604013759.0,2020-10-30,wallstreetbets,gajodv7,[deleted],t3_jkhkw8,8
1604013991.0,2020-10-30,wallstreetbets,gajotcm,"It's over bulls. Bears have the high ground. Run away or get punched right on that fat nose.

&#x200B;

Fuck SNAP.",t3_jkhkw8,10
1604014277.0,2020-10-30,wallstreetbets,gajpc93,[deleted],t3_jkhkw8,10
1604014583.0,2020-10-30,wallstreetbets,gajpwns,Bought SPY puts at the peak today. Hoping this stays red til open,t3_jkhkw8,10
1604014799.0,2020-10-30,wallstreetbets,gajqawi,"I’m about to go get really, really drunk. You all are welcome to join",t3_jkhkw8,9
1604016005.0,2020-10-30,wallstreetbets,gajsidn,"Welcome to the second wave, boys. Buckle up and stay safe.",t3_jkhkw8,10
1604016244.0,2020-10-30,wallstreetbets,gajsy0r,NIO safe haven.,t3_jkhkw8,10
1604016291.0,2020-10-30,wallstreetbets,gajt11x,"Fun fact, China plans to eliminate gas cars by 2035... Looking at you Nio",t3_jkhkw8,10
1604016376.0,2020-10-30,wallstreetbets,gajt6ug,What's your #1 lesson this year?,t3_jkhkw8,12
1604017401.0,2020-10-30,wallstreetbets,gajv1nf,NIO going wild. Let's pump this shit to $40!,t3_jkhkw8,9
1604018420.0,2020-10-30,wallstreetbets,gajwvqs,Lil Wayne ain't black,t3_jkhkw8,10
1604019194.0,2020-10-30,wallstreetbets,gajyah8,[deleted],t3_jkhkw8,9
1604019559.0,2020-10-30,wallstreetbets,gajyy8d,"What dumbass buys DKNG calls as COVID cases hit ATH.

Me, I’m dumbass",t3_jkhkw8,9
1604019590.0,2020-10-30,wallstreetbets,gajz095,Rip the bandaid let’s just drop 10% and move on already.,t3_jkhkw8,11
1604019881.0,2020-10-30,wallstreetbets,gajzj1b,So the interesting earnings are over.  I think we just saw the beginning of the real pre-weekend selloff. tomorrow is going to be ugly.,t3_jkhkw8,10
1604020025.0,2020-10-30,wallstreetbets,gajzsd1,"This year has been one big pump and dump.  From QE, to Tik Tok talks, phase 1 trade talks, vaccine talks, stimulus talks, KODAK becoming a pharmaceutical company, etc.  

I’m angry.  

And I’m the clown left holding the bag.",t3_jkhkw8,9
1604022127.0,2020-10-30,wallstreetbets,gak3mxn,Tomorrow the bread line will be very long,t3_jkhkw8,10
1604022285.0,2020-10-30,wallstreetbets,gak3wxu,[deleted],t3_jkhkw8,10
1604022554.0,2020-10-30,wallstreetbets,gak4er2,"You’re either a bull or you’re a bear. Find out which one you are and stop pretending because you don’t have the balls to make the moves that could make you rich. Know what you are and use it’s strengths. 

Spy 200p 11/6",t3_jkhkw8,11
1604022868.0,2020-10-30,wallstreetbets,gak4ywp,GameStop bag holders are gonna be waiting for the short squeeze for the next 50 years 😂😂,t3_jkhkw8,12
1604023247.0,2020-10-30,wallstreetbets,gak5ndh,"Europoor coming in from the UK

We’re gonna lockdown soon, it’s inevitable. London traders are then gonna drop futures 5% before you’ve even woken up next week 😉",t3_jkhkw8,10
1604024476.0,2020-10-30,wallstreetbets,gak7u7b,Which one of y’all bought Luckin coffee @ 50 a share,t3_jkhkw8,10
1604024498.0,2020-10-30,wallstreetbets,gak7vmo,Sheesh this sub had me thinking the world was collapsing tomorrow,t3_jkhkw8,10
1604024701.0,2020-10-30,wallstreetbets,gak88ok,"I needs a bull’s perspective,

My 🌈 *vibes* are telling me that we are going to get another massive red day tomorrow. Why? 

- Last weekend before US election, and regardless of who you vote for, it will be a mess with both parties not conceding until EVERY vote is counted which could take weeks. The pre-election sell off has already begun. 
- Congress, to no surprise, has left for vacation without a deal made. The biggest catalyst for a bull run is now delayed 
- It’s flu season and as you know more cases will begin to pop up = more media coverage = typical “Market pussy-hands as COVID-19 releases sequel”
- Lockdowns are becoming a thing again overseas and as much I as think the US itself won’t go back to a lockdown, the fact that other countries are resorting to these lockdowns will affect the global market ^duh
- Where’s JPOW?

I can’t think of anything that could propel us back to $335+ without a stimy or working vaccine. 

Positions: I’ve been only buying SPY Iron Condors with $20 wide bodies but for this weekend, I’m looking into buying and holding ITM SPY puts 

So now I ask the Bulls, am I retarded?",t3_jkhkw8,11
1604024768.0,2020-10-30,wallstreetbets,gak8ct3,"God, if you can hear me, I swear to you I will live a true and just life full of charity if you just make these god damn fucking stupid shit 120 aapl calls print tomorrow.",t3_jkhkw8,9
1604025663.0,2020-10-30,wallstreetbets,gak9yo9,Why am I checking futures? I’ve already accepted my aapl calls being worthless,t3_jkhkw8,10
1604025702.0,2020-10-30,wallstreetbets,gaka147,Matt Ryan with those Cam Newton rushing yards,t3_jkhkw8,10
1604025946.0,2020-10-30,wallstreetbets,gakagfo,"What is the next ""Tom Hanks has covid"" moment?  Something doesn't feel right",t3_jkhkw8,12
1604026075.0,2020-10-30,wallstreetbets,gakaoor,So i guess we are all banking on a big drop tomorrow. Cant wait to ride the 0dte puts to infinity,t3_jkhkw8,9
1604026266.0,2020-10-30,wallstreetbets,gakb0h7,[deleted],t3_jkhkw8,10
1604026302.0,2020-10-30,wallstreetbets,gakb2qt,[deleted],t3_jkhkw8,10
1604009927.0,2020-10-30,wallstreetbets,gajh5hk,Mods,t1_gajgtr6,68
1604009930.0,2020-10-30,wallstreetbets,gajh5ri,Mods,t1_gajgtr6,19
1604010001.0,2020-10-30,wallstreetbets,gajharm,And mail it to me. Haven’t had any dinner for 5 weeks,t1_gajgtr6,22
1604018547.0,2020-10-30,wallstreetbets,gajx4cj,[deleted],t1_gajx1lg,11
1604005290.0,2020-10-30,wallstreetbets,gaj7yg6,If you’re in Philadelphia I got $20 and some chick fil a for you,t1_gaj7u2l,29
1604002281.0,2020-10-30,wallstreetbets,gaj1pi3,You son of a bitch I'm in 👉👉,t1_gaj18qn,69
1604021683.0,2020-10-30,wallstreetbets,gak2u43,"lol covid cases 100k on saturday, im buying a lambo with my spy puts",t1_gak2qbu,12
1604011846.0,2020-10-30,wallstreetbets,gajksu0,either chernobyl toast or gold leaf avocado toast,t1_gajkqmi,27
1604011843.0,2020-10-30,wallstreetbets,gajksnz,🐻🐻🐻,t1_gajkqmi,18
1604024556.0,2020-10-30,wallstreetbets,gak7zf2,Never has a Wsb comment vibed with me more,t1_gak7nzp,10
1604002363.0,2020-10-30,wallstreetbets,gaj1vl9,Their forecast is weak as fuck,t1_gaj1tmq,10
1604008891.0,2020-10-30,wallstreetbets,gajf4rv,No it wont I bought spy puts today,t1_gajdgk1,62
1604008237.0,2020-10-30,wallstreetbets,gajdu8l,My body is ready,t1_gajdgk1,25
1604017297.0,2020-10-30,wallstreetbets,gajuv21,Unemployment line,t1_gajuoea,27
1604010375.0,2020-10-30,wallstreetbets,gaji0ld,God I hope so. I will be exceedingly moist,t1_gajhy28,10
1604013834.0,2020-10-30,wallstreetbets,gajoivt,Big if true.,t1_gajofm2,11
1604026059.0,2020-10-30,wallstreetbets,gakanoe,There’s one right below your comment 5 seconds ago,t1_gakajp8,13
1604011551.0,2020-10-30,wallstreetbets,gajk8zh,"well green is ok but brown is best. if it's red or gray, call a doctor",t1_gajk1mj,25
1604004633.0,2020-10-30,wallstreetbets,gaj6lpk,Bro everyone down more than 10k this week,t1_gaj6jzz,20
1604011479.0,2020-10-30,wallstreetbets,gajk451,i never want to hear either of these names again,t1_gajjv0n,13
1604017920.0,2020-10-30,wallstreetbets,gajvzbc,Trump gets arrested. Y’allqueida takes up arms.,t1_gajvsd3,14
1604034662.0,2020-10-30,wallstreetbets,gakn7md,"20%

70% if you stay up though.",t1_gakn4jg,14
1604006690.0,2020-10-30,wallstreetbets,gajarmx,Very inspiring story of overcoming autism,t1_gajamq0,9
1604010933.0,2020-10-30,wallstreetbets,gajj2ze,I would literally shoot a cum rope into orbit,t1_gajiver,20
1604026573.0,2020-10-30,wallstreetbets,gakbjzk,Always has been🔫,t1_gakbhtf,12
1604018744.0,2020-10-30,wallstreetbets,gajxh6j,This happens to almost everyone. Except the losers,t1_gajxdmm,10
1604016416.0,2020-10-30,wallstreetbets,gajt9d8,Should have quit after I got my first one free,t1_gajt6ug,14
1604005399.0,2020-10-30,wallstreetbets,gaj86fm,Is it free? That’s the only thing I can pay you with.,t1_gaj7yg6,12
1604006184.0,2020-10-30,wallstreetbets,gaj9r91,Yeah,t1_gaj86fm,15
