created,date,subreddit,id,body,parent_id,score
1618524398.0,2021-04-16,wallstreetbets,gunn7p7,"I told the boys to spam (remove) more GME stuff that isn't news, that is duplicative, views of the same triangle, etc. If you're missing that content there are plenty of places to get it. We're looking for **new**s and novel data, not rehashes.",t3_mrms60,1
1618518158.0,2021-04-16,wallstreetbets,gun9bax,"SP500: Green

NASDAQ: Green

DowJones: Green 

Russell2000: Green

My Portfolio: 💣🧨💥☄️🌪🔥",t3_mrms60,367
1618520398.0,2021-04-16,wallstreetbets,gunei61,I just deposit the amount I lost in a week so it doesn’t look like I lost anything 😎,t3_mrms60,227
1618517364.0,2021-04-16,wallstreetbets,gun7gbs,"**Bears this time last year:** ""no way this keeps going up"" 🤣🤣🤣",t3_mrms60,162
1618516916.0,2021-04-16,wallstreetbets,gun6ff6,[deleted],t3_mrms60,145
1618517754.0,2021-04-16,wallstreetbets,gun8cvp,"how quickly i go from ""i hope i can make a decent profit"" to ""fuck me i hope i can break even"" lol",t3_mrms60,125
1618521781.0,2021-04-16,wallstreetbets,gunhke9,"Some things never change. Death, taxes, and PLTR at $23",t3_mrms60,112
1618516913.0,2021-04-16,wallstreetbets,gun6f5v,"DID EVERYONE HAVE A GOOD FUCKING DAY TRADING TODAY? ALL TIME HIGHS AGAIN BABY!!!!

i'm down 10k on the day",t3_mrms60,302
1618521386.0,2021-04-16,wallstreetbets,gungoo4,"Same thing I do every day....

1. Look at all the stock gains I missed out on.
2. Get massive FOMO
3. Buy deep into something I think hasn’t mooned yet.
4. Watch it drop like a rock. 
5. Paper hand like a bitch
6. Cry profusely
7. Do it again",t3_mrms60,299
1618527298.0,2021-04-16,wallstreetbets,gunt38f,My wife has been going out with her coworkers pretty frequently lately. I'm glad she's making friends!,t3_mrms60,84
1618517073.0,2021-04-16,wallstreetbets,gun6sbt,PLTR could cure cancer and that fucker would be down 5% on that day,t3_mrms60,242
1618517683.0,2021-04-16,wallstreetbets,gun86tt,SPY 420 4/20 was never a meme,t3_mrms60,77
1618517946.0,2021-04-16,wallstreetbets,gun8t91,"Five stages of a Palantard:  denial, anger, bargaining, depression, and coma.",t3_mrms60,65
1618518081.0,2021-04-16,wallstreetbets,gun94rq,"So PLTR demo day shows how it's software can drop stock prices? First in January now in April, I mean I'm pretty impressed.",t3_mrms60,72
1618517746.0,2021-04-16,wallstreetbets,gun8c7r,[removed],t3_mrms60,61
1618520097.0,2021-04-16,wallstreetbets,gundt45,10 baggers are dope except when they’re in the other direction and you got the 1/10th bagger.,t3_mrms60,63
1618517113.0,2021-04-16,wallstreetbets,gun6vl8,I DECLARE BANKRUPTCY,t3_mrms60,180
1618520908.0,2021-04-16,wallstreetbets,gunfmyr,"shoutout to the guy who said hes ending his toxic relationship with DKNG today, I would be absolutely fuming right now",t3_mrms60,55
1618529393.0,2021-04-16,wallstreetbets,gunx7uu,"Does anyone else get home from work, park and sit in your car on this forum for like 30 min before getting out and walking in?",t3_mrms60,59
1618517081.0,2021-04-16,wallstreetbets,gun6t0h, Please explain to me how THE FUCK spy is up this much and I'm STILL red.,t3_mrms60,54
1618517517.0,2021-04-16,wallstreetbets,gun7t17,gonna go to home depot after a lot of research into proper thread count. i dont want the rope to break in half like my portfolio did today.,t3_mrms60,53
1618517306.0,2021-04-16,wallstreetbets,gun7bkr,"Every stock in this thread was bleeding. All the meme stocks got hammered today. The market is at all time high, VIX is at all time low, premiums crashing big time. Our lunch money is being taken in front out of eyes, we are been attacked from all fronts.",t3_mrms60,51
1618528109.0,2021-04-16,wallstreetbets,gunuoet,So whenever I get a free award to give away within 24 hours I just kind of panic and give it to a rando. Is that what everyone else does?,t3_mrms60,44
1618536965.0,2021-04-16,wallstreetbets,guobszw,"I’ll wait for a dip.   

*dip happens*.  

Is this the crash",t3_mrms60,45
1618517005.0,2021-04-16,wallstreetbets,gun6mns,where is that PLTR 30K -> 500K challenge guy,t3_mrms60,42
1618517236.0,2021-04-16,wallstreetbets,gun75vc,Today was garbage,t3_mrms60,43
1618518445.0,2021-04-16,wallstreetbets,gun9zg9,Ah yes my streak continues. Bigly red while market major green.,t3_mrms60,41
1618521271.0,2021-04-16,wallstreetbets,gungfjo,Why does PLTR have to be such a dumb bitch.,t3_mrms60,40
1618523336.0,2021-04-16,wallstreetbets,gunkz47,Tomorrow I'm intentionally flagging my account as a PDT and locking myself out to prevent further damage.,t3_mrms60,43
1618523753.0,2021-04-16,wallstreetbets,gunlv5o,Oopsie poopsie I halved my portfolio,t3_mrms60,39
1618537179.0,2021-04-16,wallstreetbets,guoc7u3,My dad sent me a screenshot of his TLT calls up 90% with the caption “who’s the boomer now”. I’ve never been this defeated...,t3_mrms60,43
1618517350.0,2021-04-16,wallstreetbets,gun7f6b,My moves are to do NOTHING. The hardest thing for me when im in a play is to let it play out,t3_mrms60,38
1618518009.0,2021-04-16,wallstreetbets,gun8yjz,"I'm from the future, whatever you were thinking of doing - do the opposite.",t3_mrms60,40
1618529441.0,2021-04-16,wallstreetbets,gunxbd8,"2030 Washington state bans new gas powered car sales

2030 Tsla 🚀🚀🚀

2030 PLTR $24",t3_mrms60,41
1618542843.0,2021-04-16,wallstreetbets,guomq0d,[removed],t3_mrms60,41
1618548395.0,2021-04-16,wallstreetbets,guovkog,got in a car crash today lucky i’m alive feel like i’m wasting my life idk,t3_mrms60,36
1618521062.0,2021-04-16,wallstreetbets,gunfyw8,Breaking: Biden announces us dollar will be tied to PLTR to end inflation once and for all.,t3_mrms60,102
1618516897.0,2021-04-16,wallstreetbets,gun6dq6,Absolutely dog shit mental health day,t3_mrms60,96
1618517954.0,2021-04-16,wallstreetbets,gun8twu,I will not nut until I'm a millionaire. Will to power,t3_mrms60,32
1618517972.0,2021-04-16,wallstreetbets,gun8vei,I almost made money today,t3_mrms60,29
1618521373.0,2021-04-16,wallstreetbets,gungnmd,Imagine losing everything because someone drew a big triangle on a meme stock,t3_mrms60,34
1618534976.0,2021-04-16,wallstreetbets,guo7z7a,"You were here losing sleep over analysing a company.. You didn't hang out with your friend because u were reading charts all day.. You lost your sleep doing your DD trying to find the perfect stock.. You were doing all this so you can give your wife a better life that she deserves..  

And then she leaves you for the chad who threw 200 dollars into some freaking digital doggy crypto bullshit five years ago as a dare and then completely forgot about it until today..",t3_mrms60,34
1618537249.0,2021-04-16,wallstreetbets,guoccnz,"Just spitballing here, but I think I'd like to create and manage an ETF.  Its called $FOMO.

Its a fund that focuses on hype stocks and only purchases them at their peak.",t3_mrms60,33
1618541612.0,2021-04-16,wallstreetbets,guokips,Just a daily reminder that oil companies had to sell their oil for -$40 per barrel last year  😂,t3_mrms60,33
1618543304.0,2021-04-16,wallstreetbets,guoniid,"WOW never seen futures down this bad. 

I only started trading today tho",t3_mrms60,34
1618546369.0,2021-04-16,wallstreetbets,guosjpc,"I've religiously followed DD info for months, done my own DD, spread into a few other stocks and options outside of gme. I'm 99% red, 1% green and down thousands on my investmend.. 4 months ago if you had told me my only green play would be fake with a fuckin dog on it I never would have invested a penny",t3_mrms60,30
1618546387.0,2021-04-16,wallstreetbets,guoskr8,"In 2050 when AAPL is like a 100T company, PALANTIR would still be around $24 ish on a good day",t3_mrms60,32
1618553535.0,2021-04-16,wallstreetbets,gup2957,Good night to my fellow Bulls only,t3_mrms60,30
1618564676.0,2021-04-16,wallstreetbets,gupee4f,My wife just told me she’s not going back to work and wants to stay home with our baby for a year.  Explaining to her that our emergency fund is balls deep in PLTR monthlies is going to get real weird real quick.,t3_mrms60,31
1618517158.0,2021-04-16,wallstreetbets,gun6zdu,Spy will have its 420 on 4/20. The prophecy foretold,t3_mrms60,26
1618520946.0,2021-04-16,wallstreetbets,gunfq0t,Market right now feels like that expensive vacation you put completely on a credit card with a 23% interest rate.,t3_mrms60,28
1618521195.0,2021-04-16,wallstreetbets,gung9jp,PLTR bagholders continue to lose hope they weren't even aware they still had!,t3_mrms60,27
1618522853.0,2021-04-16,wallstreetbets,gunjxnq,You'd think QS fucked this guys wife or something.,t3_mrms60,29
1618523164.0,2021-04-16,wallstreetbets,gunkluy,palantir broke my heart for the 128th time today,t3_mrms60,25
1618524345.0,2021-04-16,wallstreetbets,gunn3ot,"Who is this guy ""Margin"" and why does he keep calling me?",t3_mrms60,28
1618525791.0,2021-04-16,wallstreetbets,gunq3n3,Tomorrow I guess I watch my PLTR position keep fucking me,t3_mrms60,24
1618530437.0,2021-04-16,wallstreetbets,gunz92r,"Getting hammered for my 32nd birthday at a Mexican restaurant, good stuff right. 

I was talking stocks with my buddy after he wished me happy birthday and mentioned DKNG. I decided to buy 5 6/16 60$ calls of DKNG before close because it looked undervalued to me. NFL news drops right after close - the best present. Dumb fucking luck. Have a night, fellas",t3_mrms60,26
1618531141.0,2021-04-16,wallstreetbets,guo0md8,"PLTR bears are so fucked tomorrow. Like so unbelievably fucked. Fucked to a dimension of fucked that fuck can't even describe.

That's right, we coming at ya hot with a $23.40 tomorrow 😎",t3_mrms60,29
1618532728.0,2021-04-16,wallstreetbets,guo3nyk,"Wife looked at brokerage account today. Sends me a text: ""What the fuck is going on in our account."" Text back: ""🤷""",t3_mrms60,28
1618536028.0,2021-04-16,wallstreetbets,guo9zxp,"I am not going to FOMO

I am not going to FOMO

I am not going to FOMO

I am not going to FOMO


I am not going to FOMO",t3_mrms60,25
1618542222.0,2021-04-16,wallstreetbets,guolmje,I bought a call today for $1 and it went up 1700%. Made $17 profit. Best day ever,t3_mrms60,26
1618542470.0,2021-04-16,wallstreetbets,guom2kf,"I just checked rh today after being out the whole week and somehow I’m up $2000 in the last hour because of a fucking dog meme I bought as a joke while my clean energy, airline and weed plays are tanking. I thought I knew at least a little bit about what I was doing but guess not",t3_mrms60,29
1618546706.0,2021-04-16,wallstreetbets,guot2oc,Yeah I’ve been losing a tremendous amount of money in the stock market thank you for asking,t3_mrms60,29
1618548697.0,2021-04-16,wallstreetbets,guovzy6,The shibu inu coin has 30B market cap and no real application . What the fuck is happening,t3_mrms60,26
1618562359.0,2021-04-16,wallstreetbets,gupc1c0,"Your life is fragile every single day you are alive. Dont forget that. Dont ever think you are not worth anything. Push through the pain, the shame, the guilt, the bullshit, the blame, and lets all be real everyday. Fuck all the distain. I been through some shit.  But Who hasnt been the one to blame? Be humble, be real, be lost in the moment but realize the feel, control your mind and you can go anywhere you’re willing to go. The keys to this are discipline and control. Goodnight see ya in the morning. 😎👋💥🍑",t3_mrms60,29
1618517024.0,2021-04-16,wallstreetbets,gun6o84,THIS IS THE LAST TIME I TAKE STOCK ADVICE FROM SOME HOE SHAKING HER ASS ON TIK TOK,t3_mrms60,113
1618519838.0,2021-04-16,wallstreetbets,gund7gd,PLTR + MVIS we will have our day soon,t3_mrms60,24
1618530419.0,2021-04-16,wallstreetbets,gunz7wg,"Market green, my portfolio deep fucking red. Palantears",t3_mrms60,24
1618542024.0,2021-04-16,wallstreetbets,guol9rm,How do you guys still have cash to buy stuff lol,t3_mrms60,23
1618543355.0,2021-04-16,wallstreetbets,guonllt," ""This random ass NBA player is up 5300% on his Coinbase investment"" cool story MarketWatch.. always can count on you for the best cherrypicking skills..",t3_mrms60,24
1618547088.0,2021-04-16,wallstreetbets,guotnz6,Funny how I’ll debate making a $50 purchase on clothes/whatever but throw down on stupid options with no research,t3_mrms60,23
1618552625.0,2021-04-16,wallstreetbets,gup14py,Even in my dreams PLTR doesn’t go up. Fuck that stock.,t3_mrms60,24
1618554585.0,2021-04-16,wallstreetbets,gup3ig1,#THIS PLACE FUCKS,t3_mrms60,25
1618534155.0,2021-04-16,wallstreetbets,guo6emw,"I feel like nothing that goes up as radically as the c-r-y-p-t-o market right now ends well... maybe I'm wrong. I've bought and sold the coins, but this just seems insane.",t3_mrms60,23
1618536291.0,2021-04-16,wallstreetbets,guoaikl,Damn Elon was kinda right.,t3_mrms60,23
1618543394.0,2021-04-16,wallstreetbets,guono1z,I need to make enough money in the stock market to quit my job and start my own business.,t3_mrms60,23
1618521228.0,2021-04-16,wallstreetbets,gungc5o,Tomorrow I will watch my money burn like every other day,t3_mrms60,23
1618522928.0,2021-04-16,wallstreetbets,gunk3i9,"dear PLTR, 

either trade in the teens so i can buy more

or trade in the thirties so i can buy more

at this rate, you’ll still be trading in the 20s in the year 2050

thank you

sincerely, yours retarded.",t3_mrms60,21
1618523275.0,2021-04-16,wallstreetbets,gunkueo,"Me finding money on the ground five years ago: *""Holy Shit it's a great fucking day! 5 Dollars Bitches!!'*

Me losing thousands in a day now:
*""Wow that was kinda nuts, lol. Not too bad though tbh.""*",t3_mrms60,22
1618523580.0,2021-04-16,wallstreetbets,gunlhxr,Just need AAPL to open at 500 tomorrow and I can retire,t3_mrms60,23
1618526511.0,2021-04-16,wallstreetbets,gunriu6,No better feeling in the world then when you time the absolute bottom of an option before it bounces. Am I right?,t3_mrms60,22
1618529563.0,2021-04-16,wallstreetbets,gunxk2l,You guys ever spend minutes writing a reply and then just erase it?,t3_mrms60,22
1618540548.0,2021-04-16,wallstreetbets,guoil4w,"Just want 1 million, its really not even a lot of money",t3_mrms60,20
1618541647.0,2021-04-16,wallstreetbets,guokl1z,[deleted],t3_mrms60,21
1618547598.0,2021-04-16,wallstreetbets,guoufmj,I’m never gonna get 20” blades on the impala at this rate,t3_mrms60,22
1618521578.0,2021-04-16,wallstreetbets,gunh3xg,DKNG up 5% after hours. DKNG down 3% tomorrow. Got it,t3_mrms60,20
1618526929.0,2021-04-16,wallstreetbets,gunscnj,Numb to losing money tbh.,t3_mrms60,21
1618527430.0,2021-04-16,wallstreetbets,guntcoh,Can we got back to January where all my stocks went up every day no matter what,t3_mrms60,21
1618525559.0,2021-04-16,wallstreetbets,gunpmo3,"APHA really fucked me good. I should sell, but I think I'll just keep buying more and watch it plummet some more.

It's my favorite activity",t3_mrms60,20
1618537225.0,2021-04-16,wallstreetbets,guocazz,"Spy's run up these past few weeks look nearly identical to the last week or so leading up to Sept 2nd, 2020.  GEX been ATH this week as well. Candle sticks, RSI, volume, OHLC, and patterns match very closely.

Spy 7/30/20 - Sept 1st = Spy 3/25/21 - Today

It means nothing and all our calls will print but its some spooky shit. 

This will get lost in the comments but my gay bear heart will be warm knowing I put it out into the universe.",t3_mrms60,20
1618538496.0,2021-04-16,wallstreetbets,guoer4g,"Which mod changed suggested from ""new"" to ""best""",t3_mrms60,19
1618541551.0,2021-04-16,wallstreetbets,guokeof,Best decision the mods ever made re-banning 🟦toe.  Twitter retards are freaking out over not being able to sell $200 of worthless shit,t3_mrms60,18
1618547067.0,2021-04-16,wallstreetbets,guotmrw,McDonald’s coffee is better than Starbucks,t3_mrms60,21
1618549354.0,2021-04-16,wallstreetbets,guowweo,Imagine seeing something worth 63k and remembering you used 160 of them for an hour long date via Backpage,t3_mrms60,19
1618517028.0,2021-04-16,wallstreetbets,gun6oj5,I give TSLA permission to hit $800 tomorrow,t3_mrms60,57
1618517458.0,2021-04-16,wallstreetbets,gun7o4w,[deleted],t3_mrms60,58
1618523167.0,2021-04-16,wallstreetbets,gunkm2g,"Honestly, I don't even wanna touch my infested portfolio with my worst enemy's dick. I'm disgusting.",t3_mrms60,19
1618524511.0,2021-04-16,wallstreetbets,gunngbq,Imagine just going through life and not knowing about the stock market,t3_mrms60,20
1618524739.0,2021-04-16,wallstreetbets,gunnxlu,My plan is to lose another 3% in PLTR,t3_mrms60,19
1618526794.0,2021-04-16,wallstreetbets,guns31z,"My home state of Massachusetts is trying to ban Robinhood. Fuck this state, it’s the only state in the country that banned fireworks.",t3_mrms60,20
1618528462.0,2021-04-16,wallstreetbets,gunvdcn,IMAGINE BUYING SNDL AT $3 LMAOOOOOOO,t3_mrms60,20
1618531110.0,2021-04-16,wallstreetbets,guo0k91,"if you're thinking about SPY puts, just fucking don't *trust me*",t3_mrms60,19
1618536419.0,2021-04-16,wallstreetbets,guoarc3,"lol, fuck me right, FOMO @ AN ALL TIME HIGH",t3_mrms60,20
1618542376.0,2021-04-16,wallstreetbets,guolwk4,"Sold 500,000 in January 🤡🤡🤡",t3_mrms60,19
1618547176.0,2021-04-16,wallstreetbets,guotsta,Wow that feel when dog coin is doing better than my actual dd positins,t3_mrms60,18
1618551240.0,2021-04-16,wallstreetbets,guoze42,"I think I'm gonna buy a PS5 and smash it.

I lose $500 on the reg anyway so might as well do something fun while losing it for once.",t3_mrms60,18
1618517182.0,2021-04-16,wallstreetbets,gun71dh,"Fuck this market, nio fucked me hard today. Fuck pltr",t3_mrms60,18
1618517689.0,2021-04-16,wallstreetbets,gun879n,Wait some of you actually *made* money today?,t3_mrms60,18
1618517911.0,2021-04-16,wallstreetbets,gun8q39,Draftkings Named NFL Sports Betting Partner,t3_mrms60,18
1618521624.0,2021-04-16,wallstreetbets,gunh7n1,"Save this comment, RIOT either blows up... or my portfolio does.",t3_mrms60,18
1618522479.0,2021-04-16,wallstreetbets,gunj3ui,AAPL please don’t fail me,t3_mrms60,17
1618522836.0,2021-04-16,wallstreetbets,gunjwan,People have realized that its more productive to buy a meme dog currency than it is to be participating in this shit market... Says a lot,t3_mrms60,18
1618530300.0,2021-04-16,wallstreetbets,gunyzln,gambling is just a hobby.  i can quit anytime i want. i just never want to because obviously you can't quit when you're down,t3_mrms60,19
1618530466.0,2021-04-16,wallstreetbets,gunzb5i,Remember it takes a 1000% move to correct a 90% loss in your account,t3_mrms60,18
1618531836.0,2021-04-16,wallstreetbets,guo1y9u,#SOMEONE WAKE THE 3 PEOPLE UP TRADING FUTURES!!!!,t3_mrms60,18
1618532926.0,2021-04-16,wallstreetbets,guo4227,"Here I am again, drinking an $8 bottle of wine looking at my calls expiring tomorrow down 86%. Fucking hate it here",t3_mrms60,18
1618533934.0,2021-04-16,wallstreetbets,guo5zjo,What's up with this dog ?,t3_mrms60,18
1618535291.0,2021-04-16,wallstreetbets,guo8kzb,"For the last 2 weeks I was struggling to make money in this market. This week I adopted a new strategy since small caps can’t hold gains anymore apparently. I look at Robinhood list of top gainers, and buy ITM puts on stocks that popped on little to no news. Easy 50% gain almost every time",t3_mrms60,17
1618538097.0,2021-04-16,wallstreetbets,guodz5e,Some of you guys don’t jerk off to AOC feet pics and it shows 🥵🥵🥵,t3_mrms60,18
1618542412.0,2021-04-16,wallstreetbets,guolyyc,"I'm hearing too much ""this has got to be the top"" and not enough ""putting student loan money into spy calls"". And for that reason, we are not at a top",t3_mrms60,17
1618544165.0,2021-04-16,wallstreetbets,guooyyj,"Took profits today

$14

yes",t3_mrms60,18
1618547345.0,2021-04-16,wallstreetbets,guou1xh,Getting my returns crushed by people that have never invested before and bet on a meme coin hurts a little bit. Just a little bit.,t3_mrms60,19
1618549380.0,2021-04-16,wallstreetbets,guowxqf,The last thing my girlfriend did before falling asleep was point out how the fan started squeaking and now I will never sleep comfortably again,t3_mrms60,17
1618549392.0,2021-04-16,wallstreetbets,guowy8w,The casino should have double exp weekends every once in awhile as a surprise,t3_mrms60,18
1618557336.0,2021-04-16,wallstreetbets,gup6oi3,You ever sit there for a minute and realize what a bullet you dodged not having kids right after high school? People in the 80’s really were on that last gasp of boomerism.,t3_mrms60,18
1618561161.0,2021-04-16,wallstreetbets,gupasao,"COIN, RIOT, MARA tanking in pre-market, craptos at all time highs, this market makes less sense than fucking magnets.",t3_mrms60,18
1618565843.0,2021-04-16,wallstreetbets,gupflks,"I’m over here busting my ass throwing my family savings into meme stocks I heard about on WSB and watching tickers all day, and my wife over here is all like “stop”, “that’s your daughter’s birthday money”, and “I’m hungry”.  Smh, women, ammirite?",t3_mrms60,17
1618516885.0,2021-04-16,wallstreetbets,gun6crn,"Whenever I do the obvious thing, I lose money. Whenever I don't do the obvious thing, I also lose money.

I guess I should just do nothing.",t3_mrms60,18
1618517238.0,2021-04-16,wallstreetbets,gun760x,MVIS 👏👏🍎,t3_mrms60,17
1618521256.0,2021-04-16,wallstreetbets,gungeff,I haven't made money in so long,t3_mrms60,18
1618527771.0,2021-04-16,wallstreetbets,gunu0m6,"https://www.cnbc.com/2021/04/15/theres-a-single-new-jersey-deli-doing-35000-in-sales-valued-at-100-million-in-the-stock-market.html

Hahahaha what the fuck. Should I go all in on this?",t3_mrms60,17
1618528830.0,2021-04-16,wallstreetbets,gunw3rp,SPY down 1 cent get fuk bulls,t3_mrms60,16
1618533875.0,2021-04-16,wallstreetbets,guo5vhy,How do I short the dog,t3_mrms60,18
1618535225.0,2021-04-16,wallstreetbets,guo8gcb,"How is something with an unlimited supply worth anything?

(Then thinks about the US dollar)",t3_mrms60,17
1618537761.0,2021-04-16,wallstreetbets,guodbm3,"She’s not coming back, I just have to accept it",t3_mrms60,16
1618538239.0,2021-04-16,wallstreetbets,guoe94t,"I wish this sub was a real place. I had a dream the other night that this sub was just a very large warehouse in which there are all 10 million wsb subscribers together. Some are lounging on couches drinking and watching sports, or CNBC (there were TVs everywhere); others are running from place to place frantically attempting to enter bids; others are just talking in a circle. Some wore shirts and ties, and some wore sweats. A couple were fucking in the middle of the floor. The sound was unlike anything you'd believe, just this roar of male voices with the occasional woman here or there. A guy was crying and another was puking from stress. The weed and beer were free. Elon was there and everyone was rushing to shake his hand. It was the best day of my life.",t3_mrms60,17
1618542171.0,2021-04-16,wallstreetbets,guolj5p,My move tomorrow is getting on my knees to thank God I'm retarded but not so much that I think COIN is a buy.,t3_mrms60,18
1618543903.0,2021-04-16,wallstreetbets,guooity,This is market is soul crushing - Every day you watch something go up 500% and youre not in it.,t3_mrms60,17
1618554760.0,2021-04-16,wallstreetbets,gup3pxh,I'm in Asia so I'm coming from the future to tell you that PLTR and TSLA will go up pre-market before dropping.,t3_mrms60,18
1618556720.0,2021-04-16,wallstreetbets,gup5zlp,[deleted],t3_mrms60,17
1618557008.0,2021-04-16,wallstreetbets,gup6b5a,You think JPOW is just confused by the S&P 500 being that when spy is only worth 415? And once spy hits 500 he’ll rename it to the s&p1000 so everyone knows where it’s heading?,t3_mrms60,18
1618516848.0,2021-04-16,wallstreetbets,gun69mp,PLTR had two of its ribs removed so it can suck its own dick,t3_mrms60,53
1618518413.0,2021-04-16,wallstreetbets,gun9wst,"Sold my SPY calls today so we should expect moon type levels in the upcoming weeks. 

You’re welcome.",t3_mrms60,15
1618526514.0,2021-04-16,wallstreetbets,gunrj1q,Got the vaccine. I can feel the 5G coursing through my veins.,t3_mrms60,17
1618527979.0,2021-04-16,wallstreetbets,gunuf8h,I’m not proud to be a palantard,t3_mrms60,16
1618529038.0,2021-04-16,wallstreetbets,gunwils,Solar down cause the sun will explode in a billion years?,t3_mrms60,17
1618532966.0,2021-04-16,wallstreetbets,guo44lv,RH restricting how much Dog you can buy. Jesus Vlad,t3_mrms60,15
1618536694.0,2021-04-16,wallstreetbets,guobabi,[removed],t3_mrms60,16
1618538780.0,2021-04-16,wallstreetbets,guofaih,Pltr is the chick that only dry humps,t3_mrms60,15
1618540318.0,2021-04-16,wallstreetbets,guoi5ps,[deleted],t3_mrms60,14
1618540579.0,2021-04-16,wallstreetbets,guoin6r,Must not FOMO,t3_mrms60,18
1618545960.0,2021-04-16,wallstreetbets,guorw1u,"If Tesla goes to 800 tomorrow, I’ll be giving snake awards out all day tomorrow and the next day.",t3_mrms60,14
1618546618.0,2021-04-16,wallstreetbets,guosxp0,Dog corn dump will be glorious,t3_mrms60,16
1618547260.0,2021-04-16,wallstreetbets,guotxfo,[deleted],t3_mrms60,16
1618517652.0,2021-04-16,wallstreetbets,gun8456,Told my husband I got fucked real hard by APHA & PLTR which means the steak and sex I planned for his birthday tonight is now Kraft dinner and a bj. Hoping for a miracle,t3_mrms60,75
1618518412.0,2021-04-16,wallstreetbets,gun9wrc,PLTR making dividend stocks feel like the right move lol,t3_mrms60,14
1618519142.0,2021-04-16,wallstreetbets,gunblod,if $SPY is green tomorrow I will ban myself from this subreddit and options forever. i have like $4k in puts rn.,t3_mrms60,15
1618523061.0,2021-04-16,wallstreetbets,gunkdva,It's really uncanny how the market can so accurately fuck me over with pinpoint surgical precision every time.,t3_mrms60,16
1618523200.0,2021-04-16,wallstreetbets,gunkomv,[deleted],t3_mrms60,15
