created,date,subreddit,id,body,parent_id,score
1604451684.0,2020-11-04,wallstreetbets,gb2dsxb,"Imagine pretending you know whats going to happen tomorrow. Smoke a joint and chill out, this ride’s just getting started",t3_jnhpwk,8
1604452045.0,2020-11-04,wallstreetbets,gb2eetm,I may piss myself laughing at the irony if Biden somehow loses the popular vote but wins the electoral college ahahahaha what a fucking plot twist that would be,t3_jnhpwk,11
1604452109.0,2020-11-04,wallstreetbets,gb2eiqo,Volatility please! We need MORE volatility!!!!!,t3_jnhpwk,9
1604452976.0,2020-11-04,wallstreetbets,gb2g038,Why the fuck is the nasdaq pumping,t3_jnhpwk,8
1604453425.0,2020-11-04,wallstreetbets,gb2gsnm,i was promised circuit breakers,t3_jnhpwk,9
1604454665.0,2020-11-04,wallstreetbets,gb2j0vv,Wondering which store I’ll loot tonight 💭,t3_jnhpwk,11
1604456181.0,2020-11-04,wallstreetbets,gb2lp43,I don’t even know who the market wants to see win anymore,t3_jnhpwk,11
1604456904.0,2020-11-04,wallstreetbets,gb2mznk,wow this is looking like 2016 all over again...,t3_jnhpwk,11
1604457284.0,2020-11-04,wallstreetbets,gb2nnlq,"Looks like Biden lost this

You know shit isn't good for him when r/ politics isn't excited anymore",t3_jnhpwk,9
1604458209.0,2020-11-04,wallstreetbets,gb2pb9w,[deleted],t3_jnhpwk,10
1604459636.0,2020-11-04,wallstreetbets,gb2rvrw,Tech futures up 4% holy shit,t3_jnhpwk,10
1604459984.0,2020-11-04,wallstreetbets,gb2si1h,Bears are officially dead,t3_jnhpwk,11
1604460241.0,2020-11-04,wallstreetbets,gb2syx2,Never seen futures this high.,t3_jnhpwk,11
1604460582.0,2020-11-04,wallstreetbets,gb2tlm4,I guess a buncha people ain’t black anymore 🤷🏼‍♂️,t3_jnhpwk,9
1604460744.0,2020-11-04,wallstreetbets,gb2tw3g,Futures gonna be up 10% when donald comes out in an hour and says I won,t3_jnhpwk,10
1604460977.0,2020-11-04,wallstreetbets,gb2ub80,[deleted],t3_jnhpwk,11
1604461084.0,2020-11-04,wallstreetbets,gb2uiar,I already ordered my lambo,t3_jnhpwk,11
1604461369.0,2020-11-04,wallstreetbets,gb2v0oe,"Bulls with red futures: “Futures don’t matter”

Bulls tonight: “What color Lambo should I get?”",t3_jnhpwk,11
1604461459.0,2020-11-04,wallstreetbets,gb2v6ho,"I’m a perma bull and this is the one time I bought SPY puts, cuz I was sure there would be a contested election and things would get fucky.

Serves my ass right I guess.",t3_jnhpwk,9
1604461557.0,2020-11-04,wallstreetbets,gb2vcqd,Anyone else go cash gang before the election and starting to regret it?,t3_jnhpwk,10
1604461677.0,2020-11-04,wallstreetbets,gb2vkee,Didn't we already knows most votes today will be red votes until they go though the 90m early ballots? These results are skewed today.,t3_jnhpwk,10
1604461819.0,2020-11-04,wallstreetbets,gb2vtf4,So many retards were expecting a market crash after election and missed the dip🤣🤣,t3_jnhpwk,11
1604461850.0,2020-11-04,wallstreetbets,gb2vvff,Dems stop appointing career politicians you fukks,t3_jnhpwk,10
1604461904.0,2020-11-04,wallstreetbets,gb2vyw2,Sooo my puts won’t pay tomorrow?,t3_jnhpwk,11
1604462196.0,2020-11-04,wallstreetbets,gb2whp7,If spy opens below 330 I’ll give gold to 2 people,t3_jnhpwk,11
1604462910.0,2020-11-04,wallstreetbets,gb2xpwy,Get ready $BullGang. Looks like $CashGang is sending in massive reinforcements.,t3_jnhpwk,11
1604463205.0,2020-11-04,wallstreetbets,gb2y7s9,Y’all really counting out my boy howie Hawkins like that,t3_jnhpwk,9
1604463915.0,2020-11-04,wallstreetbets,gb2zedi,"Is there an interactive board like the one CNN is using available online?

That shit is impressive. I wanna look at it myself without the biased commentary. Whichever data scientist built that deserves a pay rise.",t3_jnhpwk,10
1604464146.0,2020-11-04,wallstreetbets,gb2zrw1,Always inverse WSB,t3_jnhpwk,8
1604464586.0,2020-11-04,wallstreetbets,gb30iaq,Dr Fauci looking at plane tickets right now,t3_jnhpwk,10
1604464611.0,2020-11-04,wallstreetbets,gb30js7,"If this somehow goes red, I'm gonna rip off my dick",t3_jnhpwk,11
1604464824.0,2020-11-04,wallstreetbets,gb30wlr,Calls on 269-269,t3_jnhpwk,11
1604464937.0,2020-11-04,wallstreetbets,gb313bv,"Me today: insane we rallied that much in 2 days

Me Thursday: insane we dropped that much in 2 days",t3_jnhpwk,10
1604464966.0,2020-11-04,wallstreetbets,gb3153g,Yeah ima say futures can't be fuckin trusted haha,t3_jnhpwk,10
1604465430.0,2020-11-04,wallstreetbets,gb31w81,So we're just going to have wild fucking chop until they figure out which old dude wins. Massive IV and dick-ripping whipsaw movements. There are going to be a couple majestic idiots in here who make bank. Wonder what will happen to the rest of us?,t3_jnhpwk,10
1604466803.0,2020-11-04,wallstreetbets,gb3425u,Watching the guy on Fox News trying to work the tv reminds me of my grandmother with a smart phone.,t3_jnhpwk,10
1604467820.0,2020-11-04,wallstreetbets,gb35n0j,That 269 269 volatility will be legendary boys let’s see it,t3_jnhpwk,11
1604469039.0,2020-11-04,wallstreetbets,gb37frr,Calls on the North and South poles,t3_jnhpwk,11
1604469055.0,2020-11-04,wallstreetbets,gb37gmd,POLES BABY,t3_jnhpwk,8
1604469169.0,2020-11-04,wallstreetbets,gb37mng,"BREAKING: 

USA ENTERS CONTESTED ELECTION MODE

VIX PEEKS OUT OF RIGHT EYE, STILL REFUSES TO LOOK",t3_jnhpwk,11
1604469517.0,2020-11-04,wallstreetbets,gb384ma,"im so disillusioned by politics, I really feel the only way to rise above this shit is to make bank so whatever happens doesn't affect me as much",t3_jnhpwk,9
1604470294.0,2020-11-04,wallstreetbets,gb39819,Europeans waking up to see bears celebrate nq +2.2% and es +1% in the daily,t3_jnhpwk,11
1604470766.0,2020-11-04,wallstreetbets,gb39vp1,Honestly Lester Holt and this other dude are convincing me Biden might edge it out I’m more confused than ever.. great,t3_jnhpwk,11
1604471158.0,2020-11-04,wallstreetbets,gb3af7p,"Coke, heroin, crack and LSD decriminalized in Oregon, come here boys 😇",t3_jnhpwk,10
1604473052.0,2020-11-04,wallstreetbets,gb3czly,its easy to diamond hand when you aren't allowed to trade,t3_jnhpwk,10
1604473226.0,2020-11-04,wallstreetbets,gb3d7tg,Trump speaking in 5 minutes.  Calls on how many times he says “steal”.,t3_jnhpwk,10
1604473391.0,2020-11-04,wallstreetbets,gb3dfij,"Oh my, Trump is gonna make all our VIX dreams come true!  
  
**Chaos is a ladder**",t3_jnhpwk,11
1604474518.0,2020-11-04,wallstreetbets,gb3evsm,BLUE TIE WHAT DOES THIS MEAN,t3_jnhpwk,11
1604474962.0,2020-11-04,wallstreetbets,gb3feyj,NBC cutting him off LOL holy fuck,t3_jnhpwk,11
1604475184.0,2020-11-04,wallstreetbets,gb3fpix,CALLS ON CHAOS,t3_jnhpwk,10
1604475211.0,2020-11-04,wallstreetbets,gb3fqo0,"“We will make america great again again”

🤡",t3_jnhpwk,11
1604475259.0,2020-11-04,wallstreetbets,gb3fspu,Bears doing back flips right now,t3_jnhpwk,10
1604475305.0,2020-11-04,wallstreetbets,gb3fut3,Puts win the election!,t3_jnhpwk,9
1604475583.0,2020-11-04,wallstreetbets,gb3g758,Lol all those bulls who loaded themselves to the gills on calls and went to bed. The horror when they wake up 😱,t3_jnhpwk,10
1604475627.0,2020-11-04,wallstreetbets,gb3g94y,"for a president that cares about a strong market, he sure knows how to fuck it up",t3_jnhpwk,9
1604475629.0,2020-11-04,wallstreetbets,gb3g97r,"TRUMP SAID

“Futures looking too damn green rn. One of u stooges gimme an idea on something ridiculous I Can say to tank this market. NOW!”

Lmaoooo",t3_jnhpwk,9
1604475845.0,2020-11-04,wallstreetbets,gb3girk,"**REMEMBER: WSB CALLED THE TOP TONIGHT A FEW HOURS AGO**

:3",t3_jnhpwk,10
1604476157.0,2020-11-04,wallstreetbets,gb3gwf6,Will republicans condemn trumps 100th attempt at fascism? Probably not.,t3_jnhpwk,10
1604476452.0,2020-11-04,wallstreetbets,gb3h9ck,[deleted],t3_jnhpwk,11
1604477450.0,2020-11-04,wallstreetbets,gb3ifz0,[deleted],t3_jnhpwk,10
1604477498.0,2020-11-04,wallstreetbets,gb3ii0v,People really not seeing through the bullshit and realizing Trump's advisors are pissed over Arizona because its gonna end up deciding the election? Wild,t3_jnhpwk,10
1604477545.0,2020-11-04,wallstreetbets,gb3ijzz,cash gang sleeps well tonight,t3_jnhpwk,10
1604477557.0,2020-11-04,wallstreetbets,gb3ikhf,I expected more from you Kanye.,t3_jnhpwk,9
1604477778.0,2020-11-04,wallstreetbets,gb3itu7,Imagine if lil yachty ran for pres... the market would implode,t3_jnhpwk,10
1604479462.0,2020-11-04,wallstreetbets,gb3knhe,Thank you pole workers,t3_jnhpwk,11
1604479609.0,2020-11-04,wallstreetbets,gb3ksz4,I VOTE FOR ALGOS THAT MOVE 20% UP AND 20% DOWN EVERY 2 SECONDS!!!!!!!!!,t3_jnhpwk,10
1604480521.0,2020-11-04,wallstreetbets,gb3lq7k,Bye bye bears. Bulls are back baby,t3_jnhpwk,11
1604480830.0,2020-11-04,wallstreetbets,gb3m13m,R I P put holders holy fuck!!! Bless thy soul!!!!!,t3_jnhpwk,10
1604481685.0,2020-11-04,wallstreetbets,gb3mvmf,I don’t know what the fuck is going on anymore there’s less risk in gambling than there is in this shit,t3_jnhpwk,10
1604482763.0,2020-11-04,wallstreetbets,gb3nxca,Bought SQQQ puts on accident. Now its gonna print bigly. Im 💀,t3_jnhpwk,10
1604483919.0,2020-11-04,wallstreetbets,gb3p3dy,Idk but I’m >!retarded and gay!<,t3_jnhpwk,10
1604461797.0,2020-11-04,wallstreetbets,gb2vrxr,"Good news is the market is back in easy mode bad news is , the blue hair chicks are going to block the highways tomorrow",t3_jnhpwk,27
1604455881.0,2020-11-04,wallstreetbets,gb2l6z6,"Don't matter who wins, workers getting fucked",t3_jnhpwk,18
1604463258.0,2020-11-04,wallstreetbets,gb2yayt,"Biden has to win two out of PA, MI, WI which I don't think is happening... 4 more years of donnie tweets coming at ya",t3_jnhpwk,19
1604473262.0,2020-11-04,wallstreetbets,gb3d9k2,Trump about to take VIX to the 🌝,t3_jnhpwk,19
1604474105.0,2020-11-04,wallstreetbets,gb3ecst,"I fucking just wanna let you guys know that I love waiting for Donnies late ass with you guys, been many times the past few years, love y'all",t3_jnhpwk,18
1604470912.0,2020-11-04,wallstreetbets,gb3a343,Actually can’t wait for all the boomers to die so people other than old white people can run this country,t3_jnhpwk,35
1604434415.0,2020-11-04,wallstreetbets,gb1fwru,"Biden wins by a cunt's hair, trump contests, investigation, gap down, circuit breakers, gay bear seminal fluids all over the walls...",t3_jnhpwk,26
1604434506.0,2020-11-04,wallstreetbets,gb1g3vi,Puts on mods. Two days and still can't figure this shit out.,t3_jnhpwk,27
1604441296.0,2020-11-04,wallstreetbets,gb1uft5,"The market just wants a clear winner. I doubt it truly care much which one. 

What it doesn't want is uncertainty for days or weeks.

So if we get a solid winner tonight, it's up tomorrow.",t3_jnhpwk,26
1604438727.0,2020-11-04,wallstreetbets,gb1p3q8,"Bears literally want a lockdown and make people lose their jobs just so then can make $20 on their worthless puts 

SAD!",t3_jnhpwk,49
1604435472.0,2020-11-04,wallstreetbets,gb1i6v5,Trump needs to announce the stimmy will be distributed by PayPal to sort us out.,t3_jnhpwk,18
1604465445.0,2020-11-04,wallstreetbets,gb31x2l,Was that the most epic bull trap we've ever seen?,t3_jnhpwk,17
1604434551.0,2020-11-04,wallstreetbets,gb1g7bg,What the hell?  Why is this thread out already,t3_jnhpwk,9
1604434663.0,2020-11-04,wallstreetbets,gb1gg3n,"The fact that there's an algo out there that looks at the headline ""Comcast and Walmart making a smart TV"" and immediately calculates ""This is bad for ROKU"" and dump it faster than the human eye and brain can process the same headline is fucking terrifying.

You're never going to win.",t3_jnhpwk,9
1604437547.0,2020-11-04,wallstreetbets,gb1mol0,"SEC, yes this man right here",t1_gb1mej3,38
1604437466.0,2020-11-04,wallstreetbets,gb1mift,legit lol'd at this,t1_gb1mej3,57
1604453651.0,2020-11-04,wallstreetbets,gb2h76x,I would smash my phone,t1_gb2h3yy,30
1604438881.0,2020-11-04,wallstreetbets,gb1pff2,Puts - balls to the walls in puts,t1_gb1p6zz,48
1604442731.0,2020-11-04,wallstreetbets,gb1x9ui,Congrats bro genuinely,t1_gb1x6uk,62
1604442945.0,2020-11-04,wallstreetbets,gb1xp9i,[deleted],t1_gb1x6uk,114
1604439603.0,2020-11-04,wallstreetbets,gb1qxfm,"Dude, I lost 67% of my portfolio today. And it wasn’t a small amount. Literally about to throw up.",t1_gb1qnub,33
1604470745.0,2020-11-04,wallstreetbets,gb39um3,It was gonna be Bernie until some rich people got involved.,t1_gb39nxd,18
1604444100.0,2020-11-04,wallstreetbets,gb1zz6u,This place is a gold mine.. if you always inverse,t1_gb1zmti,22
1604435295.0,2020-11-04,wallstreetbets,gb1ht8g,Do I still have the right to buy calls if I'm in line?,t1_gb1holc,50
1604435825.0,2020-11-04,wallstreetbets,gb1iyss,Tomorrow Elon Musk announces he is running for Governor of Nevada,t1_gb1ismk,19
1604463743.0,2020-11-04,wallstreetbets,gb2z44i,"Woah there turbo, let’s get our 1.5k first",t1_gb2z23y,15
1604477202.0,2020-11-04,wallstreetbets,gb3i5oa,Lol,t1_gb3i4sb,10
1604450262.0,2020-11-04,wallstreetbets,gb2b92n,They appreciate that he’s tough on viruses,t1_gb2b4pr,12
1604471726.0,2020-11-04,wallstreetbets,gb3b73v,It's south Carolina....it's who they deserve,t1_gb3b1i2,11
1604440258.0,2020-11-04,wallstreetbets,gb1satv,Did you not like the drop from 350 to 320’s? Lol,t1_gb1s5pc,17
1604466381.0,2020-11-04,wallstreetbets,gb33ehb,Ain't nobody drinking unsweetened iced tea in Georgia bruh,t1_gb33aqy,26
1604438413.0,2020-11-04,wallstreetbets,gb1ofyk,The guy above you,t1_gb1oc6w,19
1604470816.0,2020-11-04,wallstreetbets,gb39y7e,I love my nigga Lester,t1_gb39vp1,8
1604443367.0,2020-11-04,wallstreetbets,gb1yjaq,"Congrats to op,  (but this was still funny in wsb fashion)",t1_gb1xp9i,10
