created,date,subreddit,id,body,parent_id,score
1629405174.0,2021-08-20,wallstreetbets,h9ksyyo,Wake up. Take a shit. Watch my options slowly expire worthless. Just to be itm Monday as per usual,t3_p7mehd,11
1629405492.0,2021-08-20,wallstreetbets,h9ktrgg,Charlie Munger is waking up to check his Robinhood account.,t3_p7mehd,9
1629406047.0,2021-08-20,wallstreetbets,h9kv5ua,It’s crazy how poor options have made me. What a life without them would be,t3_p7mehd,10
1629407549.0,2021-08-20,wallstreetbets,h9kyuf6,Charlie Munger depressed af right now watching his millions disappear,t3_p7mehd,10
1629407753.0,2021-08-20,wallstreetbets,h9kzbzl,"Majority of senior FED officials think tapering should begin this year
--> Market shits 


JPow comes out and says we won't do anything until Covid is under control
--> Market rips next week",t3_p7mehd,10
1629407891.0,2021-08-20,wallstreetbets,h9kznvp,Looking at NVDA ah someone is getting fired,t3_p7mehd,11
1629407990.0,2021-08-20,wallstreetbets,h9kzwe8,"The good thing about wsb apes is we are always positive. Always buying the dip.

IRS will be surprised on amount of taxes they will lose out in next few years from loss claims.",t3_p7mehd,10
1629408200.0,2021-08-20,wallstreetbets,h9l0edl,"S&p hasn't fallen by atleast 5% in nearly 200 sessions

Spy with retard strength. Bullish 

Spy 445 tomo",t3_p7mehd,10
1629408288.0,2021-08-20,wallstreetbets,h9l0lrr,"Holding puts makes you an angry person 

“I would hate for something catastrophic tonight but I mean…”",t3_p7mehd,11
1629409561.0,2021-08-20,wallstreetbets,h9l3mz9,"**BREAKING**

WSB bans shitposts",t3_p7mehd,11
1629410775.0,2021-08-20,wallstreetbets,h9l6ibd,"-2k today -10k for the week, what's a few ks between friends.. we are still friends right?  Give it back",t3_p7mehd,11
1629411371.0,2021-08-20,wallstreetbets,h9l7vjr,"Chip shortage has been effecting the auto industry for months now yet they still smash earnings estimates, f and gm are approaching their 2018 prices despite being in massively better places than pre-covid. Thinking about loading up on some 2022 leaps for both if they pull back any further.",t3_p7mehd,8
1629413598.0,2021-08-20,wallstreetbets,h9lcusu,Which one of you WISH bag holders just called into Cramer?,t3_p7mehd,9
1629414226.0,2021-08-20,wallstreetbets,h9le8ew,"Why is sex so taboo when it clearly sells. 

OnlyFans is stupid. Good luck to them",t3_p7mehd,9
1629415119.0,2021-08-20,wallstreetbets,h9lg5yk,Theta gang the coldest but I like jpow’s printer more,t3_p7mehd,10
1629415219.0,2021-08-20,wallstreetbets,h9lgdpx,Chinese puts! Putsssss!,t3_p7mehd,9
1629415567.0,2021-08-20,wallstreetbets,h9lh4cp,Spy got the gay bear variant 🏳️‍🌈🐻,t3_p7mehd,8
1629415743.0,2021-08-20,wallstreetbets,h9lhhsm,Buffett has been bagholding Coca Cola shares since 1988. That idiot.,t3_p7mehd,11
1629417381.0,2021-08-20,wallstreetbets,h9lkzbn,"Fire trucks are filled with water and spray water, so why don’t we just call them water trucks?",t3_p7mehd,11
1629418033.0,2021-08-20,wallstreetbets,h9lmcvb,Why does the tesla hold music sound like the theme song from a futuristic gay porn dungeon.,t3_p7mehd,11
1629419921.0,2021-08-20,wallstreetbets,h9lqelp,It was a pleasure losing money with you this week gentlemen,t3_p7mehd,8
1629420057.0,2021-08-20,wallstreetbets,h9lqp5x,Amazon's truly lost its momentum,t3_p7mehd,10
1629420362.0,2021-08-20,wallstreetbets,h9lrcdd,"I'm calling it now, TSLA AI day will be the gayest shit to ever exist on this planet.",t3_p7mehd,10
1629421287.0,2021-08-20,wallstreetbets,h9ltc5x,What the fuck is this guy talking about. We just want cars that can be invisible.,t3_p7mehd,10
1629421468.0,2021-08-20,wallstreetbets,h9ltqc1,This week needed to end a week ago,t3_p7mehd,10
1629421767.0,2021-08-20,wallstreetbets,h9ludms,This is worse than battery day. Cool stuff but tough to grasp.,t3_p7mehd,11
1629421899.0,2021-08-20,wallstreetbets,h9lunwc,Elon where is the robot that was gonna twerk,t3_p7mehd,9
1629423084.0,2021-08-20,wallstreetbets,h9lx5wu,my portfolio... look how they massacred my boy,t3_p7mehd,10
1629423937.0,2021-08-20,wallstreetbets,h9lyxst,Baba bout to be 120 tomorrow,t3_p7mehd,11
1629424701.0,2021-08-20,wallstreetbets,h9m0j6s,"Anyone know of any Chinese, bio-med, coffee companies that use pot and mushrooms to do genetic testing to create NFT's?  Because I've got a fetish for some more losses!!!!",t3_p7mehd,9
1629425290.0,2021-08-20,wallstreetbets,h9m1rk4,[deleted],t3_p7mehd,10
1629425570.0,2021-08-20,wallstreetbets,h9m2cd0,"Will the bot lick my butthole. If so, tsla 1000c",t3_p7mehd,10
1629426015.0,2021-08-20,wallstreetbets,h9m39bh,"Mr. Green SPY 

Please tell us why

You had to hide away for so long (so long)

Where did we go wrong?",t3_p7mehd,9
1629426021.0,2021-08-20,wallstreetbets,h9m39p7,"I remember the excitement of my High School Econ teacher when the Segway was revealed. He didn't know what it was going to be, he just knew there was going to be an announcement of a major invention that was going to change the way we live. He pondered outlook if cold fusion had been discovered, or if it was some fancy clean hydrogen power. He was disappointed with the Segway reveal, he may have lost alot of money that day. 

I hope he goes balls deep on Tesla calls tomorrow at open and crushes it, can finally stop driving an '86 Ford Escort.",t3_p7mehd,9
1629426096.0,2021-08-20,wallstreetbets,h9m3f9h,I thought Elon was warning against AI a few years ago…,t3_p7mehd,11
1629426775.0,2021-08-20,wallstreetbets,h9m4sep,[deleted],t3_p7mehd,11
1629426846.0,2021-08-20,wallstreetbets,h9m4xmp,China gives 0 fucks about their market. Gotta admire the balls on those lads.,t3_p7mehd,11
1629427523.0,2021-08-20,wallstreetbets,h9m69ur,Red futures again. Jesus Christ.,t3_p7mehd,10
1629427818.0,2021-08-20,wallstreetbets,h9m6uz6,Can’t wait till Elon throws a brick at the sex bot to show off how [agile](https://techcrunch.com/wp-content/uploads/2019/11/window-break.gif?w=600) it is.,t3_p7mehd,9
1629427825.0,2021-08-20,wallstreetbets,h9m6vfr,The robot announcement seems like just an idea lol,t3_p7mehd,10
1629427896.0,2021-08-20,wallstreetbets,h9m70fq,Elon said Tesla bot coming next year…so expect like 2030,t3_p7mehd,10
1629427972.0,2021-08-20,wallstreetbets,h9m75mo,Only -2% so far for BABA. That's like a green day for Cheena stocks.,t3_p7mehd,11
1629428470.0,2021-08-20,wallstreetbets,h9m84ae,"I had two of my stocks hit all time lows, four days in a row this week. incredible!!",t3_p7mehd,11
1629428541.0,2021-08-20,wallstreetbets,h9m898p,There’s a direct correlation between how much I’ve been drinking and the number of downvotes I get and I keep drinking because I’m here for the laughs.,t3_p7mehd,9
1629429107.0,2021-08-20,wallstreetbets,h9m9c6m,Asian markets are in full panic mode.,t3_p7mehd,10
1629431421.0,2021-08-20,wallstreetbets,h9mdku3,"Hang Seng, more like Gang Beng 😞",t3_p7mehd,10
1629431797.0,2021-08-20,wallstreetbets,h9me8uf,Burry’s still bearish because the sexbots aren’t thicc 🍑,t3_p7mehd,8
1629431869.0,2021-08-20,wallstreetbets,h9med9b,Tank Seng down another 3%.  Jeezus,t3_p7mehd,11
1629432720.0,2021-08-20,wallstreetbets,h9mfv1p,"holy shit Topps investors got some nice loss porn going, warrants down 77% in like an hour.",t3_p7mehd,10
1629433252.0,2021-08-20,wallstreetbets,h9mgrs4,I really feel for those OnlyFans thots. Talk about a rug pull. Mad ordinary ppl who finally got a leg up (lol) lose their income because some prudes in their payment providers’ compliance/risk teams pressed them to shut it down. I’ve never used it in any capacity but that shit isn’t right.,t3_p7mehd,11
1629433964.0,2021-08-20,wallstreetbets,h9mhy9i,Just preordered my TeslaBot with the Gripper Lips option,t3_p7mehd,10
1629434280.0,2021-08-20,wallstreetbets,h9migtp,Fed unemployment bonus ends September 3rd,t3_p7mehd,10
1629437630.0,2021-08-20,wallstreetbets,h9mnjga,I tried to buy a model 3 last week buts sold out till next year. Today i said fuck it and tried to buy a model S and its sold out till next March......Tesla is gonna go bankrupt selling too many cars man.,t3_p7mehd,11
1629437961.0,2021-08-20,wallstreetbets,h9mo0fq,How the fuck are there people in here actually bitching and crying about how the market “never goes up”. What are y’all smoking and where do I get some.,t3_p7mehd,8
1629438402.0,2021-08-20,wallstreetbets,h9mombe,[deleted],t3_p7mehd,10
1629439687.0,2021-08-20,wallstreetbets,h9mqcdw,Rip to so much people on who blew up there account the last couple days,t3_p7mehd,12
1629440742.0,2021-08-20,wallstreetbets,h9mrqqm,"If you need a good hedge, just use FSLY. get long dated puts and also FD puts before every earning. I've been holding this junk since last October and let me tell you, it has not been fun. 300 shares at 109 average. I have lost over 21K on that shit.

Now let me be clear, I lost 10K here and there multiple times on stupid degenerate moves, but never have I slow bled in a position for so long with such despair. Any small pump is immediately followed by a bigger dump. The stock is barely green in the greatest of days and any medium red day is an excuse for it to go -5%. Every time there seems to be hope after a +15% month there is the -30% month afterwards to take me to a new all time highest loss on this position.

Every single earnings this ""growth"" company reduces its guidance. Its growth is laughable and its probably the reason it tanks 25% every earnings for like 6 times in a row now. [Seriously](https://marketchameleon.com/Overview/FSLY/Earnings/Earnings-Dates/). Its never fucking green.

Its by a stroke of luck and stupidity that it has come to be one of my largest single-stock positions. I am a degenerate gambler after all but even degenerates have hopes and dreams. And my hopes get crushed time and time again by that succubus of a stock.

 I fucking hate this piece of shit with all my heart.

TL;DR short FSLY, free money.

/rant",t3_p7mehd,9
1629403515.0,2021-08-20,wallstreetbets,h9kouar,"Imagine owning both $435p and $445c because you thought there would be more volatility than there actually was, and now theta gang will get to penetrate you from both ends.

Couldn't be me 🤡",t3_p7mehd,32
1629418147.0,2021-08-20,wallstreetbets,h9lmlhr,"if spy opens at 445 I'll personally go kill that man that said he'll tattoo himself if spy opens at 435, ban if I don't deliver.",t3_p7mehd,30
1629426749.0,2021-08-20,wallstreetbets,h9m4qia,Quit my job to day trade today. Excited to start a new chapter in my life,t3_p7mehd,29
1629403477.0,2021-08-20,wallstreetbets,h9koqr7,"Me: buy spy 0 days 1 minute before close 

Also me: why am I broke",t3_p7mehd,8
1629403937.0,2021-08-20,wallstreetbets,h9kpvxb,I'm still not sure how SPY ended green today. I'm absolutely fucking confused to my core about this.,t3_p7mehd,9
1629404225.0,2021-08-20,wallstreetbets,h9kqlqr,Spy is a sadistic motherfucker. change my mind,t3_p7mehd,8
1629405211.0,2021-08-20,wallstreetbets,h9kt2ce,AAPL being 80% of my folio is both a blessing and a curse,t3_p7mehd,9
1629405433.0,2021-08-20,wallstreetbets,h9ktm7e,Plot twits: STONKS only go down 🥲,t3_p7mehd,11
1629406636.0,2021-08-20,wallstreetbets,h9kwmkj,"Made +$150 on spy calls, coulda made $800. Lost -$500 on spy puts, coulda made $900",t3_p7mehd,10
1629407583.0,2021-08-20,wallstreetbets,h9kyxc5,I’m so fucking mad at myself for averaging down my XLE and OIH calls the last few weeks. Wiped out all my gains for the year just like that.,t3_p7mehd,11
1629408793.0,2021-08-20,wallstreetbets,h9l1t16,"Onlyfans gets rid of porn, what's next Pizzahut without Pizza¿",t3_p7mehd,9
1629409104.0,2021-08-20,wallstreetbets,h9l2jqa,"Calls on Wendys

Job applications up 300% since OnlyFans",t3_p7mehd,9
1629410549.0,2021-08-20,wallstreetbets,h9l5zct,"jesus, dead in here, RIP to our fallen soldiers.",t3_p7mehd,8
1629411205.0,2021-08-20,wallstreetbets,h9l7hru,Does anyone feel like every time you buy the dip (try to time it) but shit just keeps going down. Haven’t money in Two weeks. Down about $6k. Don’t know what the fuck I’m doing wrong. Literally anything I buy barely goes up when I’m holding it,t3_p7mehd,7
1629413985.0,2021-08-20,wallstreetbets,h9ldpj2,oil took the whole summer off goddamit,t3_p7mehd,8
1629414262.0,2021-08-20,wallstreetbets,h9leba8,Definitely need spy to Tank more,t3_p7mehd,9
1629416405.0,2021-08-20,wallstreetbets,h9liwpb,"Christ almighty, the Memestock Darlings are just getting annihilated.

CLOV, CLNE, WKHS, AMC, WISH, UWMC, SNDL. All. Dead.",t3_p7mehd,8
1629416811.0,2021-08-20,wallstreetbets,h9ljror,*itsnotalossifyoudontsellitsnotalossifyoudontsellitsnotalossifyoudontsellitsnotalossifyoudontsellitsnotalossifyoudontsell*,t3_p7mehd,8
1629416893.0,2021-08-20,wallstreetbets,h9ljxzr,"Hi I’m Paul, I’m 21 and I have a gambling addiction",t3_p7mehd,11
1629417007.0,2021-08-20,wallstreetbets,h9lk6tk,Futures are plunging to the depths of earth.,t3_p7mehd,10
1629417258.0,2021-08-20,wallstreetbets,h9lkptl,My uncle works at the futures market as a drill sergeant.,t3_p7mehd,10
1629417607.0,2021-08-20,wallstreetbets,h9llgns,"🎵aaaaaaand the market's red glare, my calls bursting in air🎵",t3_p7mehd,10
1629417884.0,2021-08-20,wallstreetbets,h9lm1ug,The loss porn today has been excellent.,t3_p7mehd,9
1629418406.0,2021-08-20,wallstreetbets,h9ln50n,"lol i remember being a bear yesterday, watching futes drill -1%, only for it to open and go up $7. Biggest scam ever",t3_p7mehd,9
1629418847.0,2021-08-20,wallstreetbets,h9lo30c,SPY 443 tomorrow,t3_p7mehd,8
1629418900.0,2021-08-20,wallstreetbets,h9lo72x,I think I need to get away from market for awhile for my mental health. See you tomorrow though to discuss my losses.,t3_p7mehd,10
1629419850.0,2021-08-20,wallstreetbets,h9lq96t,Lmfao they have an $LGBT etf. Holy shit that's fucking gay as fuck lmao.,t3_p7mehd,11
1629420218.0,2021-08-20,wallstreetbets,h9lr1gb,[Was on a walk and saw this attached to a postal box close to a park just outside my neighbourhood](https://imgur.com/xp3TbyD),t3_p7mehd,11
1629422956.0,2021-08-20,wallstreetbets,h9lwwbk,">OnlyFans is getting out of the pornography business. Starting in October, the company will prohibit creators from posting material with sexually explicit conduct on its website, which many sex workers use to sell fans explicit content. **They’ll still be allowed to put up nude photos and videos, provided they’re consistent with OnlyFans’ policy, the company said Thursday.**

What?",t3_p7mehd,10
1629423565.0,2021-08-20,wallstreetbets,h9ly5v5,The loss porn around here has been off the chain yo,t3_p7mehd,9
1629423827.0,2021-08-20,wallstreetbets,h9lypk7,At this point Tesla should just make the next Grand Theft Auto,t3_p7mehd,9
1629424553.0,2021-08-20,wallstreetbets,h9m084j,Buy cheap stonks,t3_p7mehd,9
1629424583.0,2021-08-20,wallstreetbets,h9m0ac1,Long red candles,t3_p7mehd,9
1629424630.0,2021-08-20,wallstreetbets,h9m0dus,Market will close flat tomorrow so surely that won't fuck anyone's options,t3_p7mehd,9
1629424864.0,2021-08-20,wallstreetbets,h9m0veq,Going heavy on puts. Does this make me a gay bear ?,t3_p7mehd,9
1629426384.0,2021-08-20,wallstreetbets,h9m404b,TESLA IS GOING TO THE FUCKING STRATOSPHERE,t3_p7mehd,8
1629426421.0,2021-08-20,wallstreetbets,h9m42sz,I wanted to buy a model x but now i just want a robot to carry me to wherever i need to go,t3_p7mehd,9
1629426832.0,2021-08-20,wallstreetbets,h9m4wm7,Is it just me or has the big money loss porn been extra lit this past week? 👀,t3_p7mehd,9
1629426866.0,2021-08-20,wallstreetbets,h9m4z1y,This subreddit is just loss porn wow,t3_p7mehd,8
1629427090.0,2021-08-20,wallstreetbets,h9m5f45,"*yeah, so basically we're just making GTA:IRL*",t3_p7mehd,9
1629427137.0,2021-08-20,wallstreetbets,h9m5igq,"That is by far the worst hairstyle that you can wear on top of your head, balding and letting the remaining hair grow long. It makes that little dude look like a serial killer.",t3_p7mehd,10
1629428049.0,2021-08-20,wallstreetbets,h9m7b3h,Tesla bot better give handjobs,t3_p7mehd,9
1629429710.0,2021-08-20,wallstreetbets,h9mah1m,"TSLA is at 715 in Penguin Point, Antarctica",t3_p7mehd,9
1629429827.0,2021-08-20,wallstreetbets,h9maox6,"I ain't as good as I once was, I got a few years on me now. 

&#x200B;

But there was a time. 

&#x200B;

Back in my prime where I could l rlly lay these FDs down.",t3_p7mehd,7
1629429960.0,2021-08-20,wallstreetbets,h9maxom,I think the reason I don’t have a girlfriend is because I am ugly,t3_p7mehd,9
1629430082.0,2021-08-20,wallstreetbets,h9mb5og,Is this the final nail in the coffin for China stonks? Who's gonna want to invest in China after this shit lol,t3_p7mehd,8
1629430774.0,2021-08-20,wallstreetbets,h9mcetm,Lol hang Seng almost down 3%,t3_p7mehd,9
1629431298.0,2021-08-20,wallstreetbets,h9mdcz0,"Damn son, where’d you find this?",t3_p7mehd,9
1629431443.0,2021-08-20,wallstreetbets,h9mdmbc,I heard mama Cathie is going to open an ARKP fund which will have only PLTR.,t3_p7mehd,9
1629431454.0,2021-08-20,wallstreetbets,h9mdmzo,[deleted],t3_p7mehd,9
1629432042.0,2021-08-20,wallstreetbets,h9meo8c,This shit is gettin outta hands....1st the TaliBoys invade the STONK MARKET....2nd the TaliBoys invade OnlyFans....what' fukin next?,t3_p7mehd,10
1629432458.0,2021-08-20,wallstreetbets,h9mfejo,We are on the precipice of something major. I can feel it in my retarded nutsack.,t3_p7mehd,10
1629434423.0,2021-08-20,wallstreetbets,h9mip39,"can we have circuit breakers like March 2020 so that I can load up the stocks and focus on my day job, than losing money on options jfc",t3_p7mehd,9
1629435815.0,2021-08-20,wallstreetbets,h9mkw7k,"I still remember my golden days of buying call options on

Msft 200

Spy 300

Fb 255

Amazon 3000

Google 1500

Amd 60

And of course beloved ❤  tesla which used to moon $100 a day with retard strength 1500c 🥰🥰",t3_p7mehd,11
1629437372.0,2021-08-20,wallstreetbets,h9mn63m,market acting like jpow raising rates on monday,t3_p7mehd,8
1629438036.0,2021-08-20,wallstreetbets,h9mo49p,Futes 🩸,t3_p7mehd,10
1629438528.0,2021-08-20,wallstreetbets,h9mosn5,"Fuck it man I'm going all in on puts, either the lambo or my neighbor's kid's toy car",t3_p7mehd,9
1629439319.0,2021-08-20,wallstreetbets,h9mpuo8,[deleted],t3_p7mehd,9
1629439707.0,2021-08-20,wallstreetbets,h9mqddn,Can’t remember the last time I’m setting my alarm 30 mins before market opens to watch tesla. Miss these days,t3_p7mehd,10
1629441044.0,2021-08-20,wallstreetbets,h9ms4lz,The S&P will go down over 100 points tomorrow but close at -80.  That's all I remember.,t3_p7mehd,11
1629441113.0,2021-08-20,wallstreetbets,h9ms7qh,"My moves? Nothing. Gonna be epic fuckery with opex. Any spike will be sold, any dump will be bought. We close flat with worthless options and a sticky sock.",t3_p7mehd,10
1629441136.0,2021-08-20,wallstreetbets,h9ms8rj,Lmao Cathie underperformed everything in 2021 hahaha even Ford stock. What a failure of an investor.,t3_p7mehd,9
1629405988.0,2021-08-20,wallstreetbets,h9kv0go,OnlyFans blocking adult content was the signal I needed to confirm that this market is heading down bigly,t3_p7mehd,39
1629414961.0,2021-08-20,wallstreetbets,h9lftpc,[deleted],t3_p7mehd,36
1629403857.0,2021-08-20,wallstreetbets,h9kpoqf,Only fans banning explicit videos in October. The age of cheap hookers  may be upon us once again.,t3_p7mehd,27
1629407272.0,2021-08-20,wallstreetbets,h9ky6rb,Sometimes I like to pretend my life is fulfilling,t3_p7mehd,29
1629410215.0,2021-08-20,wallstreetbets,h9l573c,If the market closes above 445.50 tomorrow I'll film myself trying to break into the capital naked before December 1st 2021,t3_p7mehd,25
1629423970.0,2021-08-20,wallstreetbets,h9lz0bn,Options and algos have ruined the market. Nothing trades on fundamentals anymore.,t3_p7mehd,28
1629424976.0,2021-08-20,wallstreetbets,h9m13yh,90% of this sub wants the global economy to die and SPY to go to 300 just so they can turn their $200 in rent money into $2K,t3_p7mehd,25
1629404218.0,2021-08-20,wallstreetbets,h9kql1t,Serious question is anyone else holding BB long term like me? Been bagholding for months and selling CCs,t3_p7mehd,8
1629404376.0,2021-08-20,wallstreetbets,h9kqz8n,news just hit...STARLINK IPO[STARLINK IPO](https://m.youtube.com/watch?v=dQw4w9WgXcQ) soon,t3_p7mehd,9
1629404671.0,2021-08-20,wallstreetbets,h9krpt4,[deleted],t3_p7mehd,9
1629404680.0,2021-08-20,wallstreetbets,h9krqmx,"Tsla opening 5% up
Tomorrow 🙏🏻🙏🏻🙏🏻🙏🏻",t3_p7mehd,7
1629404977.0,2021-08-20,wallstreetbets,h9ksh97,"It doesn't matter if you were bul or ber

If you traded SPY today you are FUK",t3_p7mehd,8
1629405075.0,2021-08-20,wallstreetbets,h9ksq73,"Somewhere in CCP dungeon, Jack Ma wakes up to go pp.",t3_p7mehd,9
1629406075.0,2021-08-20,wallstreetbets,h9kv8cr,The list with my fucked stonks are too long today...,t3_p7mehd,8
1629406406.0,2021-08-20,wallstreetbets,h9kw1um,Is this the end of making money in the stock market,t3_p7mehd,7
1629407092.0,2021-08-20,wallstreetbets,h9kxqvl,How do I short Onlyfans?,t3_p7mehd,7
1629407246.0,2021-08-20,wallstreetbets,h9ky4hq,"Lmao institutional investors used Doordashs low ass volume to bid it up to a 60b valuation even though it just burns money even in an environment ripe for delivery services. And now that they feel they got enough profit they'll finally let it drop to where it should be (BlackRock and Softbank offering 13million shares on the same day). And what a coincidence analysts were giving it bullish price upgrades just yesterday. Leap puts on doordash till its $20. 

t. Bitter guy who's dash puts never pan out",t3_p7mehd,9
1629407409.0,2021-08-20,wallstreetbets,h9kyigq,VIX crush Friday tomorrow.,t3_p7mehd,8
1629408218.0,2021-08-20,wallstreetbets,h9l0ftm,We need a update on what is Nancy buying and holding now.,t3_p7mehd,8
1629409443.0,2021-08-20,wallstreetbets,h9l3ct1,Anyone here with honest dd on PINS? Don’t judge but I’m stuck in the stock at $74 and down basically 100k. Some idiot on CNBC said it will pull a SNAP and I went for it. I don’t need the money over the nest two months but scared. Suggestions ?,t3_p7mehd,8
1629409573.0,2021-08-20,wallstreetbets,h9l3o2p,They should just hive off the porn and call it OnlyClams,t3_p7mehd,7
1629410174.0,2021-08-20,wallstreetbets,h9l53lt,Starting a drive from central Florida to chicago tomorrow morning alone. WSBsynth will be accommodating me. Im gonna be bored asf,t3_p7mehd,8
1629411418.0,2021-08-20,wallstreetbets,h9l7zc8,HEY I'M CRAMER! And my JOB is to TAKE YOUR WIFE!,t3_p7mehd,8
1629412099.0,2021-08-20,wallstreetbets,h9l9j87,"Bears getting too confident, SPY do your thing tomorrow",t3_p7mehd,8
1629413630.0,2021-08-20,wallstreetbets,h9lcxci,Sometimes idk,t3_p7mehd,7
1629413659.0,2021-08-20,wallstreetbets,h9lczom,"Reuters: Fed Chair Powell to speak on 'economic outlook' next week

oh great, cool, can't wait",t3_p7mehd,8
1629414095.0,2021-08-20,wallstreetbets,h9ldy4a,"I would have made at least 5,000% on 1dte puts today if OnlyFans was publicly traded. RIP.",t3_p7mehd,8
1629414122.0,2021-08-20,wallstreetbets,h9le0ag,"Cathie was going in hard at burry earlier in CNBC, ranting and raving…

Maybe she’ll pump TSLA tomorrow? ☹️",t3_p7mehd,8
1629414131.0,2021-08-20,wallstreetbets,h9le11p,"""Amazon reported to eye new department stores-style locations"" called Mervyn's",t3_p7mehd,7
1629414520.0,2021-08-20,wallstreetbets,h9levcq,For those interested in PINS it’s approaching previous support of $52.06 from 11/13/2020. For a few weeks the largest open interest on PINS has been 8/20 $60p. Those puts are expiring tomorrow so hopefully MMs will stop trying to hold it down. Otherwise next support level is at $48.57. Look for confirmation of reversal next week before adding,t3_p7mehd,7
1629414598.0,2021-08-20,wallstreetbets,h9lf19n,Survive another day,t3_p7mehd,7
1629414850.0,2021-08-20,wallstreetbets,h9lfky4,"Statistically, 6 out of 7 dwarfs aren't happy.",t3_p7mehd,6
1629414875.0,2021-08-20,wallstreetbets,h9lfmz5,How much money does the average sugar daddy provide? … asking for a friend,t3_p7mehd,7
1629415648.0,2021-08-20,wallstreetbets,h9lhafy,"Michael Burrys hedge fund is literally 40% TSLA PUTS 😳

Not even shorting the stock but straight up Puts….🤔",t3_p7mehd,8
1629417267.0,2021-08-20,wallstreetbets,h9lkqh6,"“Imagine putting 100k in a solid target date retirement fund at 18. He would have been able to retire at 45.”

How the fuck is the a top comment in a loss porn post? This is r/wallstreetbets not r/investing.",t3_p7mehd,8
1629417380.0,2021-08-20,wallstreetbets,h9lkz9j,"Well, today was a rollercoaster.",t3_p7mehd,8
1629417738.0,2021-08-20,wallstreetbets,h9llqqa,"When you see futures hit -1% and it gets up to .4% during the day, you can say fuck futures they fake af",t3_p7mehd,8
1629417937.0,2021-08-20,wallstreetbets,h9lm5se,Don’t forget to spend your gains boyz.,t3_p7mehd,9
1629417958.0,2021-08-20,wallstreetbets,h9lm79t,Been too much red lately it’s starting to hurt,t3_p7mehd,8
1629418460.0,2021-08-20,wallstreetbets,h9ln961,Futures are preeminently fake and remarkably 🏳️‍🌈. Unless they're green of course then its real I don't make the rules,t3_p7mehd,7
1629419618.0,2021-08-20,wallstreetbets,h9lpr3k,"Congrats bulls, futes green. You win, unless.....",t3_p7mehd,9
1629419755.0,2021-08-20,wallstreetbets,h9lq1vs,OnlyFans is just Patreon wannabe after the ban.,t3_p7mehd,7
1629420036.0,2021-08-20,wallstreetbets,h9lqnj9,Can’t wait until big tobacco gets fully into weed and my Newport 100s are loud af.,t3_p7mehd,8
1629420101.0,2021-08-20,wallstreetbets,h9lqsfz,How many dips does it take till you get to the center of the SPY 🤔,t3_p7mehd,8
1629421417.0,2021-08-20,wallstreetbets,h9ltm7d,This dude trying to murder the investors with boredom.,t3_p7mehd,8
