created,date,subreddit,id,body,parent_id,score
1626137726.0,2021-07-13,wallstreetbets,h4zhlz8,I will continue to sell calls on my clf shares and use the premiums to buy more shares,t3_oiz3pf,8
1626137819.0,2021-07-13,wallstreetbets,h4zhs9q,CPI numbers gonna be insane cause of gas,t3_oiz3pf,8
1626137877.0,2021-07-13,wallstreetbets,h4zhw5o,I like the birds,t3_oiz3pf,8
1626138581.0,2021-07-13,wallstreetbets,h4zj8dh,"Jeff Bezos looks like a Mr Potato Head that got his ass kicked, by a snake",t3_oiz3pf,7
1626138693.0,2021-07-13,wallstreetbets,h4zjfyv,"Kind of weird that bezos doesn't have more of a cult following

Edit: from the replies it sounds like you guys just want to fuck Elon?",t3_oiz3pf,8
1626138725.0,2021-07-13,wallstreetbets,h4zji4y,"In an effort to not miss out on gains, I usually miss out on gains. 

How ironic.",t3_oiz3pf,9
1626139043.0,2021-07-13,wallstreetbets,h4zk3om,"Whenever DIS rockets, I think about that one retard who bet against the mouse with fd puts that would only print if all the disney theme parks got simultaneously nuked from existence",t3_oiz3pf,8
1626139563.0,2021-07-13,wallstreetbets,h4zl3rd,Are my spy puts fucked?,t3_oiz3pf,8
1626140091.0,2021-07-13,wallstreetbets,h4zm4k3,bu    f,t3_oiz3pf,9
1626140387.0,2021-07-13,wallstreetbets,h4zmp5q,Is there a way I could invest in the porn industry?,t3_oiz3pf,10
1626141803.0,2021-07-13,wallstreetbets,h4zpfsv,The SPY that shagged me,t3_oiz3pf,7
1626143209.0,2021-07-13,wallstreetbets,h4zs0dg,"What does SOFI amd AMZN have in common? 


They both will be down tomorrow",t3_oiz3pf,7
1626143390.0,2021-07-13,wallstreetbets,h4zsc4m,People asking how is inflation but not what is inflation 😟,t3_oiz3pf,9
1626143442.0,2021-07-13,wallstreetbets,h4zsfm1,"Looking up insta pot recipes and next thing I know I’m reading an argument in the comments about carbon footprints for thirty minutes.

I joined.",t3_oiz3pf,8
1626146151.0,2021-07-13,wallstreetbets,h4zx6v4,SPY kids,t3_oiz3pf,8
1626146584.0,2021-07-13,wallstreetbets,h4zxxb7,"If world war 4 happens, how would it affect our stocks?",t3_oiz3pf,8
1626147142.0,2021-07-13,wallstreetbets,h4zyv3j,"Whose ready to buy the 4 hour dip tomorrow for it to then rip to ATH immediately, again",t3_oiz3pf,7
1626147148.0,2021-07-13,wallstreetbets,h4zyvf9,"Moved apartments today. Love how I havent done any blow in like 4 years, but every time I move I find an old razor blade or a rolled up 20 in a random drawer without fail. Oh to be young again….",t3_oiz3pf,8
1626147760.0,2021-07-13,wallstreetbets,h4zzwb7,"I miss Louis CK......           SPY 7/14 434P, DIS JAN'23 175C, BABA JAN'22 210C, UAL JAN'23 50C",t3_oiz3pf,9
1626147841.0,2021-07-13,wallstreetbets,h50013b,SPY to 438 would just be lovely know wouldn’t it 🤤,t3_oiz3pf,6
1626148208.0,2021-07-13,wallstreetbets,h500myv,[deleted],t3_oiz3pf,7
1626149922.0,2021-07-13,wallstreetbets,h503b93,[deleted],t3_oiz3pf,9
1626154751.0,2021-07-13,wallstreetbets,h50a2az,[deleted],t3_oiz3pf,9
1626154875.0,2021-07-13,wallstreetbets,h50a890,"Calls on NaughtyAmerica, puts on my sleep",t3_oiz3pf,7
1626157730.0,2021-07-13,wallstreetbets,h50dt7j,"I love the smell of money, but I don’t think it’s because of societal conditioning, like I just like the smell. Does that make sense?",t3_oiz3pf,9
1626159306.0,2021-07-13,wallstreetbets,h50fo8e,holding way too many pltr calls. i dont think im gonna make it boys.,t3_oiz3pf,8
1626160606.0,2021-07-13,wallstreetbets,h50h5gu,Futures dont mean shit til 8:30a CPI results,t3_oiz3pf,8
1626162331.0,2021-07-13,wallstreetbets,h50j0yo,I prepared a laxative for 9 tomorrow morning since I’ll be shitting myself after CPI numbers.,t3_oiz3pf,8
1626163215.0,2021-07-13,wallstreetbets,h50jzdk,Imagine buying NEGG at $79. 🤣,t3_oiz3pf,8
1626164193.0,2021-07-13,wallstreetbets,h50l08c,"Bro, I thought it was PM not AM right now",t3_oiz3pf,8
1626169576.0,2021-07-13,wallstreetbets,h50qjjp,"So I figured it out. If I eat ramen for the next one year I would be able to save about $6000. That's enough for some calls, I guess. Might need to eat ramen for two years though.",t3_oiz3pf,7
1626173017.0,2021-07-13,wallstreetbets,h50ubjz,AAPL🍏🍏,t3_oiz3pf,9
1626185128.0,2021-07-13,wallstreetbets,h51defc,Bought spy puts at close yesterday sold for 20% gain switched to calls and now those are up 20% 😂,t3_oiz3pf,8
1626131112.0,2021-07-13,wallstreetbets,h4z50sa,TSLA is back to fuck some bear ass. I will put preworkout in my piss and drink it if we hit 800 this month.,t3_oiz3pf,21
1626120119.0,2021-07-13,wallstreetbets,h4yhsh2,CLOV don’t fuck me plz,t3_oiz3pf,33
1626120168.0,2021-07-13,wallstreetbets,h4yhw75,"Doing fat dabs as I watch my CLOV calls milk and GE be bullish af. Made 56% off SPY 7-14 calls, put that profit right into GE and CLOV calls on the dip, and I couldn’t be happier.

[Today was a good day. 🥂](https://youtu.be/EHoqwPcXup0)",t3_oiz3pf,33
1626122878.0,2021-07-13,wallstreetbets,h4ynuwa,"Watching CLOV to see if it hit the bottom today or the 5% bounce today is an anomaly. Given the short interest and volume and volatility, all of which seem totally divorced from the fundamentals, I’ve got no doubt that the mini squeeze to $28 last month was only a premonition of things to come. Just don’t know when the real squeeze is coming.",t3_oiz3pf,34
1626127108.0,2021-07-13,wallstreetbets,h4ywxaj,Bought 20k worth of random FDs on CLOV at close. I’d like to buy my mom a Porsche Cayenne with this money. She is a wonderful and loving woman I tell you.,t3_oiz3pf,30
1626121323.0,2021-07-13,wallstreetbets,h4ykdiw,I sold my CLOV options for a loss exactly 10 minutes before it started mooning.,t3_oiz3pf,20
1626121606.0,2021-07-13,wallstreetbets,h4ykzxd,Bear logic is buying more puts after losing money on puts,t3_oiz3pf,20
1626122829.0,2021-07-13,wallstreetbets,h4ynr1k,"Total WISH associated losses: $126k. 

Womp womp.",t3_oiz3pf,20
1626124538.0,2021-07-13,wallstreetbets,h4yrgt6,"Last time I used Robinhood, I instant deposited 4 grand I didn’t have and lost it on NIO calls when it was still under 3 bucks. Tried to get my account reinstated a month back and they politely emailed me back and said I couldn’t open an account for five years",t3_oiz3pf,20
1626124971.0,2021-07-13,wallstreetbets,h4ysepd,"12K in SPY puts, I am an asshat.",t3_oiz3pf,20
1626120021.0,2021-07-13,wallstreetbets,h4yhl38,"Folks, that was another textbook lesson of taking profits when you're up and not FOMOing at the top of a run.",t3_oiz3pf,7
1626120038.0,2021-07-13,wallstreetbets,h4yhmdb,Spy acting spoopy at the end there.,t3_oiz3pf,7
1626120105.0,2021-07-13,wallstreetbets,h4yhrcq,"I make fun of BB holders but own WISH bags. 

AMA",t3_oiz3pf,7
1626120123.0,2021-07-13,wallstreetbets,h4yhssp,Spy to $432 tomorrow by open,t3_oiz3pf,7
1626122270.0,2021-07-13,wallstreetbets,h4ymi5n,At this point you have no one to blame but yourself if you’re still a SPY 🐻,t3_oiz3pf,6
1626122275.0,2021-07-13,wallstreetbets,h4ymikk,Wonder how Burry is doing with his TSLA short? Ouch city.,t3_oiz3pf,7
1626122650.0,2021-07-13,wallstreetbets,h4yncr4,Has anyone tried the spicy chicken king from Burger King yet,t3_oiz3pf,7
1626123040.0,2021-07-13,wallstreetbets,h4yo7sz,Friendly reminder that the ayyylmaos👽 are real and BlackBerry is not a meme,t3_oiz3pf,6
1626124846.0,2021-07-13,wallstreetbets,h4ys4wg,NVDA😁,t3_oiz3pf,7
1626124899.0,2021-07-13,wallstreetbets,h4ys92r,"Dear Gay bears,

SPY GOES BRRRRRR

Curious?

Turning point, JPOW",t3_oiz3pf,8
1626125074.0,2021-07-13,wallstreetbets,h4ysmpn,DISNEY breaking out. Increasing subscription fee on ESPN+. 190 EOW?,t3_oiz3pf,6
1626125270.0,2021-07-13,wallstreetbets,h4yt1ga,Anyone else addicted to Atypical on Netflix?,t3_oiz3pf,7
1626126015.0,2021-07-13,wallstreetbets,h4yum4b,At this point I'll be happy just to see GREEN memes,t3_oiz3pf,6
1626126169.0,2021-07-13,wallstreetbets,h4yuxwd,My inner boomer just sold all my NVDA for Intel. I’m literally selling high and buying low. Watch out,t3_oiz3pf,7
1626126339.0,2021-07-13,wallstreetbets,h4yvas0,Continue my plunge into insanity via SoFi,t3_oiz3pf,6
1626126451.0,2021-07-13,wallstreetbets,h4yvjae,"I bought 40 contracts of SPY strike price $440 for 7/16, wish me luck",t3_oiz3pf,8
1626126589.0,2021-07-13,wallstreetbets,h4yvtza,CNBC running a fake premise that WSB is buying silver. Idiots.,t3_oiz3pf,7
1626128030.0,2021-07-13,wallstreetbets,h4yytqj,[deleted],t3_oiz3pf,8
1626128220.0,2021-07-13,wallstreetbets,h4yz7ps,[deleted],t3_oiz3pf,6
1626129433.0,2021-07-13,wallstreetbets,h4z1p2e,Who here opened your first brokerage acct with Scottrade? $5 trades was cheap af back then lol,t3_oiz3pf,6
1626129502.0,2021-07-13,wallstreetbets,h4z1u49,My risk tolerance is high and I'm bad at trading. I'm thinking about SPY wayyyy OTM LEAPS,t3_oiz3pf,8
1626130673.0,2021-07-13,wallstreetbets,h4z45nv,"Can’t decide how tight my Wendy’s uniform should
Be",t3_oiz3pf,8
1626130718.0,2021-07-13,wallstreetbets,h4z48wu,"TSLA sequel, return of the meme king",t3_oiz3pf,8
1626131118.0,2021-07-13,wallstreetbets,h4z519a,Should I invest 1000$ o er X or CLOV?,t3_oiz3pf,7
1626131289.0,2021-07-13,wallstreetbets,h4z5d8q,Are we to be expecting a market crash in the near future ?,t3_oiz3pf,7
1626124556.0,2021-07-13,wallstreetbets,h4yri93,"""ease of access to pharmaceuticals"" property value skyrockets",t1_h4yrbdk,30
1626124514.0,2021-07-13,wallstreetbets,h4yrf2v,"Yo, I got the oregano 🌿",t1_h4yrbdk,17
1626124898.0,2021-07-13,wallstreetbets,h4ys91l,Holy shit this comment deserves an award,t1_h4yrbdk,6
1626123364.0,2021-07-13,wallstreetbets,h4yoxig,God hates a quitter,t1_h4yn3eo,11
1626124115.0,2021-07-13,wallstreetbets,h4yqk7n,It's basically the only way you can get your money back.,t1_h4yn3eo,8
1626125154.0,2021-07-13,wallstreetbets,h4yssr9,Was there a guh?,t1_h4yslgy,24
1626125495.0,2021-07-13,wallstreetbets,h4ytitj,Thats the only fans id be willing to watch,t1_h4yslgy,17
1626125631.0,2021-07-13,wallstreetbets,h4ytt7x,He's already dead inside,t1_h4yslgy,15
1626125793.0,2021-07-13,wallstreetbets,h4yu5bf,Probably made a 100k on the last run up.,t1_h4yslgy,7
1626148470.0,2021-07-13,wallstreetbets,h50121x,"Some very fine prose there, and the sense of loss and ennui is palpable, but the part about us having interested female partners struck me as a bit too much magic realism for my taste. 4/5",t1_h500mzu,15
1626140902.0,2021-07-13,wallstreetbets,h4znpid,"It's the natural state of the market, I see nothing wrong here.",t1_h4znl1t,32
1626123668.0,2021-07-13,wallstreetbets,h4ypljd,PLTR trading at $23,t1_h4ym71j,9
1626122297.0,2021-07-13,wallstreetbets,h4ymkc0,"And if there is a recession, the fed just lowers interest rates to zero and pumps trillions into the economy by buying bonds, etc. It’s almost like there’s no risk.",t1_h4ym71j,6
1626143086.0,2021-07-13,wallstreetbets,h4zrsdw,That’s actually why I left the church,t1_h4zrkkp,32
1626146246.0,2021-07-13,wallstreetbets,h4zxcnf,And then have to wait for the paper to come out to see what happened,t1_h4zx50s,20
1626122124.0,2021-07-13,wallstreetbets,h4ym6d8,you're in it,t1_h4ylhxv,28
1626121903.0,2021-07-13,wallstreetbets,h4ylohv,r/wallstreetbets,t1_h4ylhxv,19
1626123502.0,2021-07-13,wallstreetbets,h4yp8f2,because you thought you knew what u where doing too,t1_h4yov0o,19
1626123421.0,2021-07-13,wallstreetbets,h4yp204,Sir this is a casino. 3x daily bull s&p.,t1_h4yov0o,7
1626126120.0,2021-07-13,wallstreetbets,h4yuu5x,i will suck eberyones dick if that happens,t1_h4yuha1,19
1626149247.0,2021-07-13,wallstreetbets,h502a2h,Calls on this guy's dog. Hope he's ok.,t1_h501vph,9
1626121727.0,2021-07-13,wallstreetbets,h4yl9yg,You are basically Socrates,t1_h4ykvip,48
1626122134.0,2021-07-13,wallstreetbets,h4ym76y,Could be a big hedge,t1_h4ym2pq,20
1626129706.0,2021-07-13,wallstreetbets,h4z28w5,Someone sold them too,t1_h4ym2pq,7
1626125768.0,2021-07-13,wallstreetbets,h4yu3gg,Ok Connor. And was this before or after the bears shattered your ankle?,t1_h4ytnb5,10
1626156415.0,2021-07-13,wallstreetbets,h50c7an,All the people who tried to get rich quick are gone. That just leaves all the degenerate gamblers.,t1_h50c31t,21
1626147538.0,2021-07-13,wallstreetbets,h4zzj8e,People and media clinging to Covid for dear life.  Delta variant!!!!!! Be scared!!!!! More masks and lock downs please?!!!  I swear people love being miserable,t1_h4zz8we,17
1626120376.0,2021-07-13,wallstreetbets,h4yicfm,Pick some winners,t1_h4yi6br,31
1626120384.0,2021-07-13,wallstreetbets,h4yid3c,"Fuck man, I feel your pain",t1_h4yi6br,8
1626133820.0,2021-07-13,wallstreetbets,h4za798,ARK etfs,t1_h4z9lyo,10
1626133561.0,2021-07-13,wallstreetbets,h4z9po2,PRPL 😅,t1_h4z9lyo,7
1626120930.0,2021-07-13,wallstreetbets,h4yjj5d,The gains cometh but they goeth faster then I can blinketh,t1_h4yiye6,15
1626150732.0,2021-07-13,wallstreetbets,h504jdd,The problem is if your girl likes it too much she will leave you for her after discovering her lesbian side,t1_h504d4i,10
1626160254.0,2021-07-13,wallstreetbets,h50gr58,Shit sucks. I work for an Amazon contractor and I hurt my back last week and haven’t been to work since. My work week starts tomorrow and I don’t really know what to do. My back is fucked but I need income. I won’t quit but I lowkey hope they fire me. It’s been a long ass 2 years here and my body has aged so much since I started. I’m throwing away my health for $15/hr...,t1_h50fezb,8
1626164070.0,2021-07-13,wallstreetbets,h50kvpu,Make sense. His whole brand is marketing,t1_h50kj83,8
1626121599.0,2021-07-13,wallstreetbets,h4ykzc1,Some1 had to pay for his dream,t1_h4ykr4w,13
1626130191.0,2021-07-13,wallstreetbets,h4z37ic,Lmao remember them saying “it will hit 100k”🤡,t1_h4z34xx,17
1626147486.0,2021-07-13,wallstreetbets,h4zzg5k,Company has serious long term growth potential. I’d recommend holding.,t1_h4zzb2q,10
1626164011.0,2021-07-13,wallstreetbets,h50kthi,Sold at an 80% loss yesterday at noon. Seems like it was the right call.,t1_h50kl5f,8
1626169875.0,2021-07-13,wallstreetbets,h50quyy,NOK bumping itself.,t1_h50qnld,12
1626142214.0,2021-07-13,wallstreetbets,h4zq797,Never heard a crack head say they’re too poor for drugs,t1_h4zpias,14
1626148271.0,2021-07-13,wallstreetbets,h500qjo,I really hope you're right my dude.,t1_h500o1n,7
1626164493.0,2021-07-13,wallstreetbets,h50lbyi,Drink,t1_h50l4fn,8
1626148640.0,2021-07-13,wallstreetbets,h501btr,Pass the ramen noodles please,t1_h50179z,12
1626150484.0,2021-07-13,wallstreetbets,h50464q,Pelosi?,t1_h5044og,10
1626121999.0,2021-07-13,wallstreetbets,h4ylwb8,"What happened? I bought some more at 9.02, logged off, check back and was surprised to see a small pop lol",t1_h4ylg1e,10
1626122031.0,2021-07-13,wallstreetbets,h4ylyvr,Knock that shorties,t1_h4ylg1e,8
1626122741.0,2021-07-13,wallstreetbets,h4ynjzz,*Wait a minute*,t1_h4ynj11,10
1626122986.0,2021-07-13,wallstreetbets,h4yo3ij,Just borrowed money from dangerous loan sharks so I can average down on my losses…👍🏻🙂🙂🙂market can’t outsmart ME!!!,t1_h4ynj11,7
1626144431.0,2021-07-13,wallstreetbets,h4zu6lq,"I want money, fuck you",t1_h4zu3rz,24
1626128257.0,2021-07-13,wallstreetbets,h4yzah9,The good thing is it's never too late. $SPY gonna be around for at least the next 50-60 years,t1_h4yywtv,10
1626135315.0,2021-07-13,wallstreetbets,h4zczsz,Not that you should ever make fun of someone else's salary but 105k is nothing to be arrogant about.,t1_h4zcmjl,9
1626146069.0,2021-07-13,wallstreetbets,h4zx1ra,Excellent CEO,t1_h4zwsbv,10
1626148104.0,2021-07-13,wallstreetbets,h500gsd,Yes.  But you might make money if you sell during the 10 second dip.,t1_h500bjt,10
1626149472.0,2021-07-13,wallstreetbets,h502mid,Refer to your flair.,t1_h502icx,10
1626157107.0,2021-07-13,wallstreetbets,h50d24a,Because their minds are too simple to comprehend that sweet/sour/savory/spicy can and should be enjoyed at once.,t1_h50cun8,15
1626169095.0,2021-07-13,wallstreetbets,h50q1n4,As a europoor that has no idea how big that is I choose to take it as a compliment.,t1_h50pyii,10
1626125178.0,2021-07-13,wallstreetbets,h4ysul3,Probably cut the damn thing off.,t1_h4ysbai,8
1626131351.0,2021-07-13,wallstreetbets,h4z5hja,They gonna cancel the olympics.,t1_h4z5daq,7
1626143478.0,2021-07-13,wallstreetbets,h4zshwi,"I’ve got clov shares, iv is too high for me. Good luck to you bro!",t1_h4zs7m2,8
1626147649.0,2021-07-13,wallstreetbets,h4zzpuc,They won't spend that free money on their kids.  Long BUD and MO and a weed stock ETF.,t1_h4zzi4c,9
1626150472.0,2021-07-13,wallstreetbets,h5045in,Absolutely mental bruv,t1_h50430j,8
1626122288.0,2021-07-13,wallstreetbets,h4ymjka,Just what I did today,t1_h4ykm7i,6
1626123541.0,2021-07-13,wallstreetbets,h4ypbiv,The fucktards screaming to the moon have $100 in their accounts,t1_h4yoqhe,9
1626125031.0,2021-07-13,wallstreetbets,h4ysjfh,Nor did Mcaffee uninstall himself,t1_h4ys97c,27
1626141069.0,2021-07-13,wallstreetbets,h4zo1d3,That was shisty,t1_h4znxwu,8
1626134859.0,2021-07-13,wallstreetbets,h4zc4sb,Check your mailbox,t1_h4zc1h1,9
1626139629.0,2021-07-13,wallstreetbets,h4zl89s,I’ve seen this same question so many times. And the answer is always unfortunately yes.,t1_h4zl3rd,11
1626154918.0,2021-07-13,wallstreetbets,h50aaad,I've been here since 2016 and still have no idea what 0dte is,t1_h50a2az,9
1626131143.0,2021-07-13,wallstreetbets,h4z52yq,Mods!!,t1_h4z50sa,9
1626127307.0,2021-07-13,wallstreetbets,h4yxc6y,"Lots of people will tell us how loving your mother is. hey oh!  no, but, seriously good luck.",t1_h4ywxaj,12
1626127189.0,2021-07-13,wallstreetbets,h4yx3cm,Gl,t1_h4ywxaj,8
1626121479.0,2021-07-13,wallstreetbets,h4ykpp8,Paper hands 🚮,t1_h4ykdiw,11
1626146322.0,2021-07-13,wallstreetbets,h4zxhf1,That episode of Seinfeld where George and Jerry become apes but rather than watch YouTube they have to run all over manhattan looking for a newspaper to see if they got tendies lol,t1_h4zxcnf,13
1626121989.0,2021-07-13,wallstreetbets,h4ylvfj,I came to the right place. I mean my friend will be happy to know.,t1_h4ylohv,8
1626126239.0,2021-07-13,wallstreetbets,h4yv35h,Mods,t1_h4yuu5x,7
1626146368.0,2021-07-13,wallstreetbets,h4zxk7j,George had them diamond hands,t1_h4zxhf1,8
