created,date,subreddit,id,body,parent_id,score
1629403511.0,2021-08-20,wallstreetbets,h9kotvk,You idiots are still buying S&P stocks that go down with the markets where I am holding UWMC which goes down regardless of the markets.,t3_p7mehd,105
1629408839.0,2021-08-20,wallstreetbets,h9l1x3s,Front page is turning into all loss porn. Wsb is healing,t3_p7mehd,84
1629403512.0,2021-08-20,wallstreetbets,h9kotzq,"My portfolio: *leveraged heavily in 0 DTE calls*

The Market: *down slightly*

Me: I am never going to financially recover from this",t3_p7mehd,65
1629406191.0,2021-08-20,wallstreetbets,h9kvitn,I miss easy mode,t3_p7mehd,58
1629406340.0,2021-08-20,wallstreetbets,h9kvw23,[deleted],t3_p7mehd,49
1629412848.0,2021-08-20,wallstreetbets,h9lb77o,At least Austin has a lot of homeless people so no one will notice just one more.,t3_p7mehd,52
1629418096.0,2021-08-20,wallstreetbets,h9lmhme,It’s a weird thing to be throwing 5k around so casually in the market and then go to Walmart and buy Raman and Banquets.,t3_p7mehd,54
1629411754.0,2021-08-20,wallstreetbets,h9l8r82,Take profits at +30% 🥰 baghold till -99% 😐,t3_p7mehd,47
1629418495.0,2021-08-20,wallstreetbets,h9lnbsn,"I’m a permabull but I just saw JPow buying Powerball tickets at the corner store in Cookie Monster pajamas.

My options are fucked.",t3_p7mehd,46
1629403959.0,2021-08-20,wallstreetbets,h9kpxt8,I thought WSB is just full of neckbeards and fat losers but apparently there's a bunch of OF thots here too? This truly is a place for all degenerates.,t3_p7mehd,38
1629404813.0,2021-08-20,wallstreetbets,h9ks2d4,"Come to think of it, China stocks were roaring until Jack Ma opened his stupid mouth before the scheduled ANT IPO.",t3_p7mehd,37
1629405828.0,2021-08-20,wallstreetbets,h9kum1r,Yahoo should buy onlyfans. They bought tumblr for like 3 billion or some shit then banned porn and sold it for 2 mil and change LMAOOOOOO,t3_p7mehd,34
1629407296.0,2021-08-20,wallstreetbets,h9ky8s8,How do I change my username to cashlow,t3_p7mehd,38
1629410490.0,2021-08-20,wallstreetbets,h9l5ucj,"If amazon goes up $100 tomorrow, I'll eat my semen",t3_p7mehd,36
1629405337.0,2021-08-20,wallstreetbets,h9ktdks,It’s amazing how quickly stocks go down versus going up,t3_p7mehd,100
1629404317.0,2021-08-20,wallstreetbets,h9kqtwf,#5 stages of grief is not a meme,t3_p7mehd,31
1629410692.0,2021-08-20,wallstreetbets,h9l6bbk,"Scenario: Explain to the wife how you lost 500k on a movie theatre stock, a video game store at the mall and company that gives an easy way to invest in a drop shipping company that sells scam products from china",t3_p7mehd,31
1629426423.0,2021-08-20,wallstreetbets,h9m42z3,"People think TSLA will fly tomorrow which mean it will tank, but we all know that which means it soars. But that means it it will tank. 

But honestly, never bet against TSLA on a Friday.",t3_p7mehd,29
1629419932.0,2021-08-20,wallstreetbets,h9lqfi4,"PUTS on my dog Gus. He was delisted from this world today, but still a strong blue chip in my heart. I love you buddy. See you on the other side of the rainbow bridge.

(2010-2021)",t3_p7mehd,91
1629406081.0,2021-08-20,wallstreetbets,h9kv8x7,"Turned $20,000 into $180

Now to reverse that somehow",t3_p7mehd,84
1629409180.0,2021-08-20,wallstreetbets,h9l2q7s,Onlyfans should start an on-demand home version. They could call it WhoreDash.,t3_p7mehd,78
1629406890.0,2021-08-20,wallstreetbets,h9kx95j,No nudity on OnlyFans? Puts on your mom,t3_p7mehd,25
1629413634.0,2021-08-20,wallstreetbets,h9lcxm8,STOP INVESTING IN CHINESE STOCKS.,t3_p7mehd,29
1629413654.0,2021-08-20,wallstreetbets,h9lcz9s, A Million Thots screamed out in unison 🤣,t3_p7mehd,26
1629418099.0,2021-08-20,wallstreetbets,h9lmhu4,Imagine gaining for 2 months only to lose it all and then some over 2 days,t3_p7mehd,25
1629434120.0,2021-08-20,wallstreetbets,h9mi7gu,Who knew the OnlyFans porn ban would be the catalyst that caused the great correction of 2021.,t3_p7mehd,28
1629416400.0,2021-08-20,wallstreetbets,h9liwd2,"Portfolio down 50% last 2 weeks. Not letting it get to me. I’m just cruising down the freeway in my Miata with the top down, not a worry in the world. Enjoying life and ignoring the margin calls on all 3 of my accounts like god intended.",t3_p7mehd,24
1629406770.0,2021-08-20,wallstreetbets,h9kwyiv,">OnlyFans to prohibit sexually explicit content beginning in October

On other news, McDonald's will stop selling burgers and Starbucks will stop selling coffee.",t3_p7mehd,24
1629423247.0,2021-08-20,wallstreetbets,h9lxi9f,Only fans is like that thot chic in college who suddenly quit being a hoe and found religion,t3_p7mehd,22
1629434099.0,2021-08-20,wallstreetbets,h9mi6ae,"Musk warned that the robot “probably won’t work.”—-CNBC 

This is the type of comment I need to see to confirm a retard rip of 10% tomorrow",t3_p7mehd,24
1629434718.0,2021-08-20,wallstreetbets,h9mj63a,"Here I am grinding away trying to get my portfolio to $100K, mostly playing SPY, and some fucking dude sets half a million on fire buying call options on an airline in the middle of the biggest global pandemic in 100 years.

What the fuck. I can't even laugh at this pure retardation. The dude was a simple $500K ATM SPY call purchase, 1 year to expiration, away from becoming a millionaire... and he had to go with American Airlines",t3_p7mehd,23
1629409831.0,2021-08-20,wallstreetbets,h9l4agd,"We've come full circle. Amazon is now opening department stores to double as warehouse space and point of sale.

first they killed them off, then they replaced them... Long AMZN.",t3_p7mehd,63
1629406238.0,2021-08-20,wallstreetbets,h9kvn1f,Watch in horror as SPY hits the 50 day MA in pre market and panic sell all my calls at open only to watch spy hulk dick up to a new ATH right after.,t3_p7mehd,21
1629409631.0,2021-08-20,wallstreetbets,h9l3t15,I can’t wait for some of my calls to expire worthless tomorrow. Tired of looking at them.,t3_p7mehd,21
1629433952.0,2021-08-20,wallstreetbets,h9mhxj0,You could make a living selling options with 500k and some dude lost it all betting on a single airline company during a pandemic? Only on WSB,t3_p7mehd,23
1629435185.0,2021-08-20,wallstreetbets,h9mjwx8,Maybe we should all go full bear for the next month. Crash this fucker to the ground then ride it back up. Who's in?,t3_p7mehd,21
1629424164.0,2021-08-20,wallstreetbets,h9lzf38,Chinese stocks appear to be a mistake,t3_p7mehd,20
1629427105.0,2021-08-20,wallstreetbets,h9m5g6m,Just working my ass off at work and buying options so i can get out my parents house 🥺,t3_p7mehd,20
1629430709.0,2021-08-20,wallstreetbets,h9mcame,China woke up and chose financial ruin.,t3_p7mehd,22
1629432147.0,2021-08-20,wallstreetbets,h9meuxw,Your 🇨🇳 stocks getting tienenman squared.,t3_p7mehd,20
1629408053.0,2021-08-20,wallstreetbets,h9l0216,"# Day 83,734 of waiting for a company to ipo with ticker $WSB",t3_p7mehd,20
1629424039.0,2021-08-20,wallstreetbets,h9lz5o9,"You think the Hang Seng guys just buy puts everyday and if you buy calls, you're a gay bull",t3_p7mehd,19
1629403958.0,2021-08-20,wallstreetbets,h9kpxsg,My portfolio is down 50% all time now lmao,t3_p7mehd,18
1629405368.0,2021-08-20,wallstreetbets,h9ktgem,"As someone with cash I hope this onlyfans shit is true, time these chicks got back on my dick for cash instead of just teasing simps on camera for it.",t3_p7mehd,18
1629416695.0,2021-08-20,wallstreetbets,h9ljit7,Who blew up their account this week. Show your hands. I know y’all here 🤪,t3_p7mehd,19
1629422148.0,2021-08-20,wallstreetbets,h9lv78z,"Bloomberg said we have record number of 401K, IRA millionaires. Ask your parents for FD money retards",t3_p7mehd,19
1629424631.0,2021-08-20,wallstreetbets,h9m0dx9,THEYRE SO RED 😍😍,t3_p7mehd,18
1629426976.0,2021-08-20,wallstreetbets,h9m56x9,Elon is creating giant robotic sex dolls. Fuck it. I'm in.,t3_p7mehd,18
1629427977.0,2021-08-20,wallstreetbets,h9m75yv,"Goodnight everyone, may God lighten our bags tomorrow so we don't have to carry so much weight on our shoulders going into the weekend. 

Unless you are a bear... then fuck you.",t3_p7mehd,18
1629432468.0,2021-08-20,wallstreetbets,h9mff50,Hang Seng is literally down about 25% over the past 3.5 years during supreme bull market.  This is attributable to a little known fact: China is communist.,t3_p7mehd,18
1629404203.0,2021-08-20,wallstreetbets,h9kqjrf,The funny thing about losing a ton of money is nothing,t3_p7mehd,54
1629409503.0,2021-08-20,wallstreetbets,h9l3i1m,"**BREAKING**

eBay bans second hand items",t3_p7mehd,56
1629406742.0,2021-08-20,wallstreetbets,h9kww3u,Oh shit not the smegma variant,t3_p7mehd,16
1629410043.0,2021-08-20,wallstreetbets,h9l4sio,This has been quite an expensive hobby,t3_p7mehd,18
1629426240.0,2021-08-20,wallstreetbets,h9m3pn3,TSLA 800 FDs at open confirmed,t3_p7mehd,17
1629403933.0,2021-08-20,wallstreetbets,h9kpvjs,My spy puts Don’t feel so good,t3_p7mehd,16
1629405128.0,2021-08-20,wallstreetbets,h9ksuua,"The downfall of OnlyFans will help raise employment tremendously, bullish",t3_p7mehd,15
1629409039.0,2021-08-20,wallstreetbets,h9l2e5x,Welp... I guess my dream of becoming a top 10 creator on Onlyfans is over 😳😩😩,t3_p7mehd,17
1629415849.0,2021-08-20,wallstreetbets,h9lhpxn,"If we're red tomorrow, I'm moving into an acorns account Monday",t3_p7mehd,16
1629417778.0,2021-08-20,wallstreetbets,h9lltqb,Oh look more red AH. Fucking shoot my dick off,t3_p7mehd,16
1629417941.0,2021-08-20,wallstreetbets,h9lm62w,Y'all ever been... Jackson Hole'd?,t3_p7mehd,16
1629419184.0,2021-08-20,wallstreetbets,h9lotb4,RH is the most expensive pay-to-play app ever.,t3_p7mehd,16
1629426606.0,2021-08-20,wallstreetbets,h9m4g86,I wanna be like a rich man in a white suit in 1980s Miami doing a lot of cocaine. Wish me luck,t3_p7mehd,17
1629426963.0,2021-08-20,wallstreetbets,h9m5602,"For sale: expired options, never exercised.",t3_p7mehd,15
1629430091.0,2021-08-20,wallstreetbets,h9mb68r,[deleted],t3_p7mehd,17
1629431092.0,2021-08-20,wallstreetbets,h9mcznn,"The Heng doesn't fuck around with bull traps. It's just picks a direction (always down) and then heads straight there, no nonsense.",t3_p7mehd,15
1629434917.0,2021-08-20,wallstreetbets,h9mjhmr,"Futures are below where they were Wednesday afternoon, but bulls still do victory lap all day.",t3_p7mehd,16
1629439729.0,2021-08-20,wallstreetbets,h9mqefj,"Didn't know it then, but Sir Davos said the realest thing when he told Gendry that nothing fucks you harder than time. 😔",t3_p7mehd,18
1629443529.0,2021-08-20,wallstreetbets,h9mv7ba,"Imagine, 5 years from now, you hail a car through the Tesla app to go visit your friend, on the way you decide to pick up burgers at a local McDonald's, now owned by Tesla, all workers humanoids, you pull up to your friend's house with the burgers, he is not excited about it because he is also a Tesla humanoid. Then you look at your reflection on the TV made by Tesla. All of a sudden you lose your appetite because you are also a humanoid made by Tesla.",t3_p7mehd,14
1629443543.0,2021-08-20,wallstreetbets,h9mv7xb,"Afghanistan GDP for the year is roughly 20 billion. 

Or the equivalent to a bankrupt movie theater's market cap",t3_p7mehd,15
1629405923.0,2021-08-20,wallstreetbets,h9kuuns,Consistently broke my own trading rules during the last 3 weeks and lost big every time 🤡,t3_p7mehd,14
1629417244.0,2021-08-20,wallstreetbets,h9lkop7,"Imagine wasting your entire off day watching stocks and making money, just to lose it all in the last 30 mins.",t3_p7mehd,14
1629419892.0,2021-08-20,wallstreetbets,h9lqcga,Battery day last year fucked up my portfolio. I’m getting flashbacks right now.,t3_p7mehd,16
1629423733.0,2021-08-20,wallstreetbets,h9lyiex,I’ve never seen WSB this dead,t3_p7mehd,15
1629429121.0,2021-08-20,wallstreetbets,h9m9d5x,"Onlyfans banned porn, Afghanistan banned afghans... Next thing you know, Wall Street bans gambling",t3_p7mehd,14
1629436199.0,2021-08-20,wallstreetbets,h9mlgue,I'm gonna buy a Tesla bot and have it teach itself to make profitable trades,t3_p7mehd,14
1629403474.0,2021-08-20,wallstreetbets,h9koqh7,"~~bears r fuk~~

~~bulls r fuk~~

we r fuk",t3_p7mehd,44
1629404227.0,2021-08-20,wallstreetbets,h9kqlv5,According to my technical analysis I'm fucked 🐣,t3_p7mehd,15
1629406507.0,2021-08-20,wallstreetbets,h9kwaxa,I've managed to turn $1600 into $4k and want to cash out because every time I reach this point I blow the account up,t3_p7mehd,14
1629425160.0,2021-08-20,wallstreetbets,h9m1hqr,"Orgasm while getting head > orgasm while fucking 

Dying on this hill",t3_p7mehd,15
1629426047.0,2021-08-20,wallstreetbets,h9m3bm7,Tsla built an army of robots to btfd spy 500 eow,t3_p7mehd,15
1629429612.0,2021-08-20,wallstreetbets,h9maai3,Texas beat Florida on Covid cases today 💪🔫🔫,t3_p7mehd,14
1629433010.0,2021-08-20,wallstreetbets,h9mgcz6,"Wow I was reading about Capitalization-weighted indicies on Wikipedia and got into a deep hole about how they put microsecond delays on trades on major exchanges or else the algorithms we created, would out trade us, and control the idea of money. Which is made up since we left the gold standard.",t3_p7mehd,14
1629434127.0,2021-08-20,wallstreetbets,h9mi7xi,I’m starting to think that bears are on to something 🤔,t3_p7mehd,15
1629438376.0,2021-08-20,wallstreetbets,h9mol0g,[deleted],t3_p7mehd,16
1629439191.0,2021-08-20,wallstreetbets,h9mpof4,Who the fucks blows their life savings buying calls on an airline stock during a pandemic. At least buy the stock so that maybe you could be right eventually. This is one of the dumbest things I’ve ever seen on WSB and that’s saying a lot.,t3_p7mehd,16
1629445198.0,2021-08-20,wallstreetbets,h9mx7ln,"Jokes on you guys, i already lost all my money!",t3_p7mehd,15
1629404014.0,2021-08-20,wallstreetbets,h9kq2u3,I made eight trades and looked at the market for more than 10 hours only to lose 30 bucks :/,t3_p7mehd,39
1629405556.0,2021-08-20,wallstreetbets,h9ktxco,I removed my credit card from my OnlyFan account. I was getting ripped off anyway. Last night I paid $79 for a nipple slip video.,t3_p7mehd,37
1629405866.0,2021-08-20,wallstreetbets,h9kupgd,Damn crazy how companies like MasterCard and visa have so much power. They legit flexed on Onlyfans and told them to cut off their bread and butter or get fucked.,t3_p7mehd,13
1629407311.0,2021-08-20,wallstreetbets,h9kya5p,Everything is red and I’m out of bananas. Fuck today.,t3_p7mehd,14
1629409302.0,2021-08-20,wallstreetbets,h9l30ns,"My moves tomorrow:
•sleep in
•have breakfast with Ben & Jerry
•not open any of my trading apps
•have lunch with Ben & Jerry
•try not to drown myself in the bog",t3_p7mehd,14
1629415482.0,2021-08-20,wallstreetbets,h9lgxub,Just farted and it sounded BABA....,t3_p7mehd,12
1629415749.0,2021-08-20,wallstreetbets,h9lhi98,I found the problem. Uranus is in retrograde.,t3_p7mehd,13
1629416648.0,2021-08-20,wallstreetbets,h9ljfbj,Hands up if you've lost money today.... and yesterday... and the day before yesterday...,t3_p7mehd,14
1629417132.0,2021-08-20,wallstreetbets,h9lkgcg,If spy opens at 435 I’ll get WSB logo tattooed on my leg. *MODS*,t3_p7mehd,14
1629417171.0,2021-08-20,wallstreetbets,h9lkj9l,"Bears shouldn't get credit for ""I told you so"" if they tell us the same thing every day and it happens to only be right once a month or two.",t3_p7mehd,14
1629421730.0,2021-08-20,wallstreetbets,h9luaod,I’m looking forward to the weekend thread more than usual this week. Calls on shitposts,t3_p7mehd,13
1629422795.0,2021-08-20,wallstreetbets,h9lwkbb,[It will definitely rise or fall](https://imgur.com/a/UdgmmOh),t3_p7mehd,13
1629425470.0,2021-08-20,wallstreetbets,h9m24zw,Less tard more tism,t3_p7mehd,14
1629425694.0,2021-08-20,wallstreetbets,h9m2lgq,How wet is Cathie rn seeing Tesla Robots?,t3_p7mehd,12
1629426833.0,2021-08-20,wallstreetbets,h9m4wo2,I wanna be like a middle class man in a tan and taupe suit in 1970s Newark selling annuities. Wish me luck,t3_p7mehd,13
1629428588.0,2021-08-20,wallstreetbets,h9m8cgg,Everyone so sure Tesla will gap up tomorrow. You know what that means lol,t3_p7mehd,13
1629430629.0,2021-08-20,wallstreetbets,h9mc5eu,This place single handedly made and lost me 62k off GME back in Jan @ 21 years old....,t3_p7mehd,13
1629433466.0,2021-08-20,wallstreetbets,h9mh4k1,Sometimes I want to go back to before I discovered stonks and options. When I thought $100 was significant. Before I was numb and emotionless after losing thousands…,t3_p7mehd,14
1629433978.0,2021-08-20,wallstreetbets,h9mhz3s,Whats with Netflix? They pump out a million shows and 2 are good,t3_p7mehd,14
1629434076.0,2021-08-20,wallstreetbets,h9mi4xd,OF banning porn means the top is in. My calls are fuk,t3_p7mehd,12
1629434910.0,2021-08-20,wallstreetbets,h9mjh7e,"SPY Dropping hard tomorrow, and I'm laying out major puts on Chinese stocks. Better to be retarded and rich than bullish and broke.",t3_p7mehd,12
1629435004.0,2021-08-20,wallstreetbets,h9mjmp0,You guys think anyone ever made money in the stock market?,t3_p7mehd,13
1629437797.0,2021-08-20,wallstreetbets,h9mnrz3,Drillings will continue until morale improves,t3_p7mehd,13
1629404149.0,2021-08-20,wallstreetbets,h9kqeya,"Out of money, spirit crushed.",t3_p7mehd,12
1629404832.0,2021-08-20,wallstreetbets,h9ks43e,hopefully watch the puts print and having steak or back to the 4 for $4,t3_p7mehd,14
1629404938.0,2021-08-20,wallstreetbets,h9ksdkl,"today was a mindfuck

see y’all tomorrow",t3_p7mehd,12
1629405886.0,2021-08-20,wallstreetbets,h9kurbc,Some guy on Twitter just solved inflation. Everyone burn $10,t3_p7mehd,13
1629406925.0,2021-08-20,wallstreetbets,h9kxc5n,Jumping off a bridge.. when will the hurting stop!,t3_p7mehd,12
1629406994.0,2021-08-20,wallstreetbets,h9kxid9,Government money and only fans money drying up. Lotta people gonna soon come to realize they fumbled the bag,t3_p7mehd,12
1629407088.0,2021-08-20,wallstreetbets,h9kxqkv,"Cnbc anchors look so defeated. 

Same guys, same....",t3_p7mehd,12
1629410411.0,2021-08-20,wallstreetbets,h9l5num,Lol AMZN opening large department stores now. We’ve gone full circle,t3_p7mehd,13
1629415362.0,2021-08-20,wallstreetbets,h9lgor7,Anybody else go full retard on MRNA calls,t3_p7mehd,13
1629416042.0,2021-08-20,wallstreetbets,h9li4zh,"Imagine OnlyFans was publicly traded when they announced that shit today. 

Lol would be opening -30% tomorrow",t3_p7mehd,12
1629417692.0,2021-08-20,wallstreetbets,h9lln7o,**She sent me 4 attachments🤩 but then when I opened them it was screenshots of me talking to other girls…**,t3_p7mehd,12
1629419397.0,2021-08-20,wallstreetbets,h9lp9xs,"Onlyfans CEO: *""Ya know tbh, I kinda fucking hate money.""*",t3_p7mehd,12
1629424829.0,2021-08-20,wallstreetbets,h9m0stm,Uh how do I get my job back after telling my boss to fuck off?,t3_p7mehd,12
1629426505.0,2021-08-20,wallstreetbets,h9m4900,I would fuck a Tesla bot.,t3_p7mehd,12
1629427580.0,2021-08-20,wallstreetbets,h9m6dvo,Sex bots arrived just as OF ban thots. Coincidence?,t3_p7mehd,12
1629427831.0,2021-08-20,wallstreetbets,h9m6vwb,Come on AMZN announce robot delivery you piece of shit stonk.,t3_p7mehd,13
1629427997.0,2021-08-20,wallstreetbets,h9m77gc,Epstein was the R.Kelly of the investment industry.....,t3_p7mehd,13
1629428127.0,2021-08-20,wallstreetbets,h9m7gjs,Ive been emotionally abused by futures too many times to even trust em till open anymore,t3_p7mehd,12
1629428577.0,2021-08-20,wallstreetbets,h9m8bp1,It's not just chip shortage. There's also money shortage in my account,t3_p7mehd,13
1629429499.0,2021-08-20,wallstreetbets,h9ma2qk,"yall member the days when we could just buy spy weekly calls every morning and double our money until MMs caught on, i member",t3_p7mehd,12
1629431458.0,2021-08-20,wallstreetbets,h9mdn9y,[deleted],t3_p7mehd,12
1629435904.0,2021-08-20,wallstreetbets,h9ml14o,"Drank too fast and now I have chronic hiccups. 

Slop in shambles.",t3_p7mehd,10
1629438213.0,2021-08-20,wallstreetbets,h9mod1u,YOU BOUGHT THE TOP. YOU ARE A BAGHOLDER. A ROOM FULL OF RICH BANKERS IS LAUGHING AT YOU RIGHT NOW,t3_p7mehd,12
1629442486.0,2021-08-20,wallstreetbets,h9mtxod,"I just don’t eat on red days, no money for that nonsense",t3_p7mehd,10
1629444748.0,2021-08-20,wallstreetbets,h9mwoeb,[deleted],t3_p7mehd,14
1629403260.0,2021-08-20,wallstreetbets,h9ko75n,"Today’s SPY highlights:

9:30: Ber fuk

10:30: Bul fuk

11:00: Ber fuk

12:00: Bul fuk

2:30: Ber fuk

3:30: Bul fuk

Closed +0.17%",t3_p7mehd,57
1629411187.0,2021-08-20,wallstreetbets,h9l7g9l,Only fans now requesting all content creators adhere to sharia law in their posts.,t3_p7mehd,51
1629407141.0,2021-08-20,wallstreetbets,h9kxvak,Xi has wiped over a trillion off Chinese stocks in market cap. Surely a group of executives can get together and get a hit out on him for a fraction of what they will continue to lose with him in power,t3_p7mehd,10
1629407426.0,2021-08-20,wallstreetbets,h9kyjxr,How much would it fuck everyone if spy just climbs back to 442 tomorrow?,t3_p7mehd,10
1629410113.0,2021-08-20,wallstreetbets,h9l4ych,"So many seething bears last night claiming it was “the big one.” “There will be no bounces.” Frothing at the mouth. Wishing for total economic collapse. Keyboards wet from the sweat from your hands. Barely coherent because you’ve been on a 4-day meth bender watching crayons.

This is why nobody listens to y’all.",t3_p7mehd,10
1629411084.0,2021-08-20,wallstreetbets,h9l77li,Great. Cramer just said Amazon was a great value. RIP my largest position,t3_p7mehd,11
1629411238.0,2021-08-20,wallstreetbets,h9l7kf9,*softens newspaper bed*,t3_p7mehd,12
1629412397.0,2021-08-20,wallstreetbets,h9la6ww,Can anyone holding the Chinese companies post their loss porn...need to fap!,t3_p7mehd,11
1629414369.0,2021-08-20,wallstreetbets,h9lejsj,Gonna look to see if I qualify for Biden loan forgiveness since I'm so fucking retarded 👍,t3_p7mehd,11
1629415013.0,2021-08-20,wallstreetbets,h9lfxoj,I’ve got a month for AMZN to get above $3200 and I’m still sweating like a priest at a playground.,t3_p7mehd,11
1629415980.0,2021-08-20,wallstreetbets,h9li04z,"Up $5K today, looks like I'm getting that dirt bike. 🙃",t3_p7mehd,13
1629417558.0,2021-08-20,wallstreetbets,h9llcy3,This shit is serious. We are only -4.8% away from limit down.,t3_p7mehd,11
1629418843.0,2021-08-20,wallstreetbets,h9lo2oj,I’m an old man.  I don’t use only fans.  I thought it was a porn site.  Now they’re a porn site without porn?  Bad business model.,t3_p7mehd,11
1629423262.0,2021-08-20,wallstreetbets,h9lxje5,"The tits are up! I REPEAT, THE TITS ARE UP!",t3_p7mehd,12
1629423639.0,2021-08-20,wallstreetbets,h9lybde,Everyday fucking red portfolio,t3_p7mehd,11
1629423832.0,2021-08-20,wallstreetbets,h9lypx8,I think Spy will have another leg down tomorrow. Doesn’t look strong at all to me,t3_p7mehd,11
1629424256.0,2021-08-20,wallstreetbets,h9lzm1g,[deleted],t3_p7mehd,11
1629425343.0,2021-08-20,wallstreetbets,h9m1vky,Tesla robots???!! We gonna see $1000 eod tomorrow,t3_p7mehd,11
1629426180.0,2021-08-20,wallstreetbets,h9m3lbw,Im gonna get my Tesla sexbot modeled after Cathie.,t3_p7mehd,11
1629427130.0,2021-08-20,wallstreetbets,h9m5hy1,Need to turn $3k into $20k to make up my losses,t3_p7mehd,11
1629428195.0,2021-08-20,wallstreetbets,h9m7lak,"I've honestly never seen this level of loss porn on wsb before
 Not even during corona time. Something is eery",t3_p7mehd,11
1629428404.0,2021-08-20,wallstreetbets,h9m7zod,"Lol 

https://imgur.com/a/ucRgMKW",t3_p7mehd,12
1629428585.0,2021-08-20,wallstreetbets,h9m8ca4,"With the only fans change, your local fast food joints will have a full staff again",t3_p7mehd,10
1629430408.0,2021-08-20,wallstreetbets,h9mbr1c,I CANT WAIT TO FUCK A TESLA BOT,t3_p7mehd,11
1629431198.0,2021-08-20,wallstreetbets,h9md6ke,"Chinese opened their fortune cookie and it said “stonks only go down”.

Their only consolation was the chuckle they got by adding “in bed” to the end of the fortune",t3_p7mehd,13
1629432588.0,2021-08-20,wallstreetbets,h9mfmrg,[deleted],t3_p7mehd,11
1629432745.0,2021-08-20,wallstreetbets,h9mfwjl,Buying puts on my life,t3_p7mehd,12
1629432930.0,2021-08-20,wallstreetbets,h9mg82t,Anyone else concerned that we’re going straight down the path towards a Terminator future?,t3_p7mehd,11
1629434387.0,2021-08-20,wallstreetbets,h9mimym,guys i still have AMC and GME and MVST and BB why is my portfolio red u guys said its be green how do I get a refund,t3_p7mehd,10
1629434886.0,2021-08-20,wallstreetbets,h9mjfsv,"still remember my first multi bagger..BA calls when it dipped to 90s last year..made 25k overnight.. damn, miss 2020, easy mode and so much $$$$$ made",t3_p7mehd,12
1629439093.0,2021-08-20,wallstreetbets,h9mpjt5,I like to imagine futures being just five traders all in one room yelling red and green at each other until market open.,t3_p7mehd,12
1629442357.0,2021-08-20,wallstreetbets,h9mtrzw,"VIX climbing, Bears dining.",t3_p7mehd,11
1629443165.0,2021-08-20,wallstreetbets,h9murmi,For anyone that doesn’t know: you’re given a free award courtesy of Reddit everyday to gift,t3_p7mehd,13
1629446053.0,2021-08-20,wallstreetbets,h9my7ef,Officially out of money tomorrow,t3_p7mehd,10
1629452280.0,2021-08-20,wallstreetbets,h9n57hz,"If you have a profit loss ratio on your trades of 100 to 1, you can be wrong 99 times out of 100 and still break even. 98 times wrong, 2  times right, and you're in the money.

That's a pep talk for anyone who likes getting butt raped by fd's.",t3_p7mehd,10
1629406854.0,2021-08-20,wallstreetbets,h9kx5y1,"Dang onlyfans banning porn. It's like the Taliban banning Islam.

I predict they're going to go the same route as Tumblr. Tumblr was the OG onlyfans (minus the payment system). They banned porn and now they're irrelevant af.",t3_p7mehd,45
