created,date,subreddit,id,body,parent_id,score
1608806221.0,2020-12-24,wallstreetbets,ggw0682,Alright fess up. Which one of you bastards asked Santa for sub drama for Christmas?,t3_kj17ga,1
1608760723.0,2020-12-24,wallstreetbets,ggu672a,So when the sub inevitably goes private again do we just brigade r/investing again and piss them off with our retardness?,t3_kj17ga,196
1608759201.0,2020-12-24,wallstreetbets,ggu3epr,mod drama is the weirdest thing on the internet,t3_kj17ga,318
1608758947.0,2020-12-24,wallstreetbets,ggu2xp1,WE MUST ORGANIZE AN UPRISING AGAINST THE TYRANNICAL FASCIST MODS IN THE NAME OF u/zjz!,t3_kj17ga,123
1608757897.0,2020-12-24,wallstreetbets,ggu0zyq,Legitimately going to start an onlyfans with the gf because its gotta be easier than this,t3_kj17ga,99
1608758411.0,2020-12-24,wallstreetbets,ggu1y52,"Someone dropped insider info on XL on this sub at about 10am and when I checked XL, it had a market cap of about $450m. I was like nah. The Reddit user also had a low karma so I thought it was a bot. 30 mins later, it mooned and got halted. 🤡🤡🤡",t3_kj17ga,98
1608757392.0,2020-12-24,wallstreetbets,ggu02nw,Yo we need that summary guy to tell us what the fuck just happened,t3_kj17ga,265
1608757818.0,2020-12-24,wallstreetbets,ggu0umy,ICLN gang rise up,t3_kj17ga,75
1608759207.0,2020-12-24,wallstreetbets,ggu3f35,Puts on Wallstreetbets moderation,t3_kj17ga,145
1608763271.0,2020-12-24,wallstreetbets,gguaxv7,"Lost 7k today. 
Shit hurts.",t3_kj17ga,70
1608757441.0,2020-12-24,wallstreetbets,ggu05r2,"Pre-splits stock price from ipo to today;

TSLA - $3,250

AAPL - $29,000

MSFT - $64,000

AMZN $38,400

I’m just sayin is all",t3_kj17ga,141
1608758506.0,2020-12-24,wallstreetbets,ggu24gn,Today my stock gains for the year surpassed my yearly salary. Thanks all. 🙏,t3_kj17ga,193
1608765793.0,2020-12-24,wallstreetbets,ggufp41,"Wake up tomorrow, check in to find WSB banned. Check the market, to find it doesnt move whatsoever, nothing moves, totally flat. 

It was then that we realized, It was us, it was only us.",t3_kj17ga,62
1608762299.0,2020-12-24,wallstreetbets,ggu937c,")))              (((ヽ

|  \                     |  \

|   ( \      (.       /)     |     )

ヽ   ヽ `  ( ͡° ͜ʖ ͡°)  _ノ    /

     ＼   |   ⌒Ｙ⌒   /  /

         | ヽ     |      ﾉ ／

         ＼トー仝ーイ

              | ミ土彡/

            ) \      °   /(

           (     \      /     )         

                  ѼΞΞΞΞΞΞΞΞΞΞΞΞD FUCK THE MODS 

       /  /     /      \ \   \                        }

       ( (    ).           ) ).  )                   }{

      (      ).            ( |    |                    { {

       |    /                \    /                   { }",t3_kj17ga,117
1608762425.0,2020-12-24,wallstreetbets,ggu9bhe,Defund the mods,t3_kj17ga,57
1608775411.0,2020-12-24,wallstreetbets,ggux4rf,Imagine some Goldman Sachs executive comes on this sub to see what the general sentiment is about tomorrow’s open and the first thing he reads is a comment about a guy carving a hole in an apple and sticking his dick in it. Lmao,t3_kj17ga,51
1608757267.0,2020-12-24,wallstreetbets,ggtzue3,"To the asshole who kept shorting PLTR at 29

Fuck you",t3_kj17ga,198
1608759432.0,2020-12-24,wallstreetbets,ggu3u35,[deleted],t3_kj17ga,154
1608758399.0,2020-12-24,wallstreetbets,ggu1xby,[deleted],t3_kj17ga,1651
1608769232.0,2020-12-24,wallstreetbets,ggulwpi,"I will never understand the people that pay for OnlyFans...

I mean think about it...you have Netflix, a massive company offering billions of dollars worth of full-length movies and TV series, available any time you want in Ultra HD for $18 a month...

Or you can have one thot, virtually indistinguishable from the vast sea of other online thots online available completely for free, record herself on a 2014 MacBook webcam spreading her ass checks once a month and these mf’s are paying $25-$35. I mean what the fuck lmao",t3_kj17ga,54
1608777083.0,2020-12-24,wallstreetbets,ggv03t1,"My RH balance went up by $4,500 in the last 48 hours. 🚀🚀🚀 It only took me depositing another $7,500 in the last 48 hours",t3_kj17ga,53
1608790520.0,2020-12-24,wallstreetbets,ggvks6h,"Shoutout to everyone who's lurking this page and is really struggling right now. I am struggling as well, and I fully understand how tough this time of year can be. I hope things change for us in a positive way, and that along the way, we can make a killing on the stock market. Keep your head up fellas.",t3_kj17ga,51
1608761026.0,2020-12-24,wallstreetbets,ggu6r1i,#u/zjz start an OF so I can support you,t3_kj17ga,49
1608762763.0,2020-12-24,wallstreetbets,ggu9xi3,"2019: perfectly diversified portfolio across multiple sectors to reduce risk 

2020: 100% in PLTR 

How did I get here",t3_kj17ga,46
1608788364.0,2020-12-24,wallstreetbets,ggvhzho,Just had an IG model answer my question in her story boys. I guess you could say things are getting pretty serious,t3_kj17ga,49
1608759520.0,2020-12-24,wallstreetbets,ggu3zyy,"Watching financial news outlets try to explain GME price movement without saying “short squeeze” is pretty hilarious. Everyone knows why it’s moving, but admitting that it’s happening would be admitting that the market has some pretty jarring imperfections that create opportunities for massive manipulation. Again, the mental and linguistic gymnastics are hilarious.",t3_kj17ga,90
1608759918.0,2020-12-24,wallstreetbets,ggu4ppd,"u/zjz he’s the hero WSB deserves, but not the one it needs right now. So we’ll hunt him. Because he can take it. Because he’s not our hero, he’s a silent guardian, a watchful protector. A gay mod.",t3_kj17ga,88
1608758164.0,2020-12-24,wallstreetbets,ggu1hvi,[deleted],t3_kj17ga,42
1608762117.0,2020-12-24,wallstreetbets,ggu8r3n,There’s a civil war going on in here between only1parkjisung and ZJZ. Who will you support? The North Korean Park Jis Ung or our unknown gay hero ZJZ?,t3_kj17ga,42
1608764406.0,2020-12-24,wallstreetbets,ggud9xq,"Cathie literally expects her funds to “more than double” in 2021, specifically genomics, and y’all motherfuckers are buying QS calls at the top 💀",t3_kj17ga,39
1608766152.0,2020-12-24,wallstreetbets,ggugbu4,"No stimulus in sight, mods are disappearing faster than kids in Uganda, retail enthusiasm is diminishing. We’re about to start off 2021 in 1347 Europe.",t3_kj17ga,46
1608782160.0,2020-12-24,wallstreetbets,ggv8pzk,"Still laughing at that boomer who lost 300k on options then tried to say he was hacked - and a bunch of news outlets just chose to believe him for no reason.

Like imagine a hacker getting into an account worth 300k and instead of taking the money decides to lose it by buying some options",t3_kj17ga,41
1608787938.0,2020-12-24,wallstreetbets,ggvhead,Is anyone in this thread like a normal fucking person that works 9-5 and doesn't have more than 10k in their account? jesus christ.,t3_kj17ga,43
1608757345.0,2020-12-24,wallstreetbets,ggtzzj4,"If my account was a stock, I’d buy puts",t3_kj17ga,115
1608757633.0,2020-12-24,wallstreetbets,ggu0id9,Every day there is a 10+ bagger out there waiting to be made and every day I somehow manage to do the opposite,t3_kj17ga,113
1608759195.0,2020-12-24,wallstreetbets,ggu3ebv,SPY literally dropped half a percent immediately when u/zjz announced he was leaving.,t3_kj17ga,171
1608758715.0,2020-12-24,wallstreetbets,ggu2i9n,RIP WSB. We lost the best mod there is.,t3_kj17ga,166
1608788482.0,2020-12-24,wallstreetbets,ggvi565,You call this mod drama? back in my day the head mod was running a ponzi money laundering pump and dump scheme and the whole sub had to be locked down.,t3_kj17ga,40
1608757427.0,2020-12-24,wallstreetbets,ggu04wz,"If you didn’t buy that dip you’re fucking stupid

If you sold on that dip you’re absolutely fucking retarded. 

Stimmy is coming retards, people are just scared because trump vetoed the defense bill",t3_kj17ga,102
1608758525.0,2020-12-24,wallstreetbets,ggu25s6,"🚨Real Talk🚨


**Holidays suck major dick for folks without any family or without the support of their family. I know a handful of you degenerates will be in that category with me the rest of this week.**

If anyone needs a friend to talk to, reach out, or shitpost on here. We are all in this 🐂💩 2020 beer flu world together.

❤️",t3_kj17ga,117
1608758570.0,2020-12-24,wallstreetbets,ggu28of,Guys my DD is scrolling this sub once a day,t3_kj17ga,30
1608758727.0,2020-12-24,wallstreetbets,ggu2j2h,Puts on wsb mod team,t3_kj17ga,33
1608758905.0,2020-12-24,wallstreetbets,ggu2uve,"PLTR anyone?

https://twitter.com/realwillmeade/status/1341856417356115968",t3_kj17ga,33
1608767273.0,2020-12-24,wallstreetbets,gguidw9,"The stimmy bill was trying to give $100 million to Somali Pirates. 

Bullish",t3_kj17ga,30
1608768822.0,2020-12-24,wallstreetbets,ggul5eo,[deleted],t3_kj17ga,33
1608793062.0,2020-12-24,wallstreetbets,ggvnpzi,Has this thread replaced all of your social media or is it just me,t3_kj17ga,32
1608796851.0,2020-12-24,wallstreetbets,ggvrngb,Just came across TikTokInvestors and I’m fucking disgusted,t3_kj17ga,29
1608757268.0,2020-12-24,wallstreetbets,ggtzufi,[deleted],t3_kj17ga,59
1608757943.0,2020-12-24,wallstreetbets,ggu134b,If u sold gme ur an actual 🤡,t3_kj17ga,59
1608790932.0,2020-12-24,wallstreetbets,ggvla5b,"There’s actually a fuck ton of cool people in the WSB community. Rich or poor, autist or retard, I feel a bond between all of us even though we will never know eachother.

We lose money together and we make money together. No homo",t3_kj17ga,59
1608785572.0,2020-12-24,wallstreetbets,ggve0hx,Mitch better have my money.,t3_kj17ga,52
1608757626.0,2020-12-24,wallstreetbets,ggu0hvk,"Awesome day. Donated another $1,000 to the local food bank.",t3_kj17ga,118
1608757486.0,2020-12-24,wallstreetbets,ggu08qw,ICLN is my safe haven 😌,t3_kj17ga,29
1608774730.0,2020-12-24,wallstreetbets,gguvwgf,100% of my account in baba calls how fucked am I,t3_kj17ga,28
1608776494.0,2020-12-24,wallstreetbets,gguz2fl,Sum Ting Wong with BABA,t3_kj17ga,28
1608777152.0,2020-12-24,wallstreetbets,ggv087z,Pltr and gme of course. 🚀🚀🚀🚀🚀✋💎,t3_kj17ga,24
1608777672.0,2020-12-24,wallstreetbets,ggv150y,Kinda liberating knowing futures mean nothing to you because you’re balls deep in BABA so you’re gonna be red regardless.,t3_kj17ga,26
1608779197.0,2020-12-24,wallstreetbets,ggv3t2t,#WSB mods are like divorced parents trying to fight for custody of us retards 😂,t3_kj17ga,27
1608780456.0,2020-12-24,wallstreetbets,ggv5xsy,"Mariah Carey makes $600,000 off the streaming credits for ""All I Want For Christmas"" every Christmas all while spreading Nutella on some sourdough on an exotic island.

And there's you, who's cooking up some Maruchan chicken, who loaded up your student loans on puts before the Santa rally.",t3_kj17ga,27
1608780575.0,2020-12-24,wallstreetbets,ggv64sc,Y’all think WSB is gunna die? Lol this subreddit is like a line of coke that never ends.,t3_kj17ga,26
1608781813.0,2020-12-24,wallstreetbets,ggv85iq,"I went 28 years without knowing what the stock market was up to. Now I cant go 30mins without knowing. Those were simpler times, albeit less indulgent",t3_kj17ga,28
1608786203.0,2020-12-24,wallstreetbets,ggvey6z,[deleted],t3_kj17ga,26
1608787501.0,2020-12-24,wallstreetbets,ggvgskj,Imagine being a Nikola employee and going in every morning to work on an actively failing scam.,t3_kj17ga,25
1608788334.0,2020-12-24,wallstreetbets,ggvhy39,People who smack when they chew don’t deserve food.,t3_kj17ga,27
1608790129.0,2020-12-24,wallstreetbets,ggvkatx,Late night WSB is a different animal...,t3_kj17ga,28
1608791075.0,2020-12-24,wallstreetbets,ggvlg8m,"So, you remember that guy that was a specialist at trading AAPL and made the lengthy post offering to help us by utilizing his years of expertise studying the intricacies of its daily price action?  
  
Then you assholes just straight up doxxed him and put him on blast about all his Jelqing posts.  
  
 Lmfaaooooooo",t3_kj17ga,27
1608791601.0,2020-12-24,wallstreetbets,ggvm2bs,Wife fell asleep and I can’t sleep for anything. Currently setting up meeting with people selling PS5s digital ($400 MSRP) selling it for $1200. I do not know who’s the bigger douche in this situation. I am having 3 of them drive about 40 minutes for meetup at the same place.,t3_kj17ga,27
1608796558.0,2020-12-24,wallstreetbets,ggvrcwg,"That moment where youre showing your non-trading friend your massive weekly Tesla win on Robinhood, but he proceeds to click  on the all time graph, revealing the ridiculous amount of money lost 🤡",t3_kj17ga,27
1608804284.0,2020-12-24,wallstreetbets,ggvyh4x,Who the fuck wakes up at 4am to buy 9 FSLY shares 😂,t3_kj17ga,27
1608804577.0,2020-12-24,wallstreetbets,ggvyqe4,[deleted],t3_kj17ga,29
1608757428.0,2020-12-24,wallstreetbets,ggu04xh,Guys that was a dump/dip before the shorter day tomorrow. We should expect a Green Day tomorrow as it’s Christmas Eve.,t3_kj17ga,24
1608767432.0,2020-12-24,wallstreetbets,gguinub,"Are you ready for the PUMP OF THE CENTURY?

>Elon Musk Floats Idea Of Starting One Parent Company To Hold Tesla, SpaceX, Boring, Neuralink

You better start hoarding cash",t3_kj17ga,24
1608800827.0,2020-12-24,wallstreetbets,ggvvf5u,"My Dad refused to buy Amazon because ""price was too high"" so he bought the cHiNeSe aMaZoN bAbA",t3_kj17ga,24
1608757366.0,2020-12-24,wallstreetbets,ggu0100,Dont forget tomorrow is only a half day for the market. Dont get cucked,t3_kj17ga,53
1608760293.0,2020-12-24,wallstreetbets,ggu5elw,"I just want to inform you that I won't be moderating in the future. Knowing this might happen, I didn't moderate in the past either.

But if I ever do moderate, I will ban you, dear reader. Yes, you in particular. You know what you did.",t3_kj17ga,50
1608762962.0,2020-12-24,wallstreetbets,gguaai8,"if all signs point to a red day tmw, you can bet your ass were gonna moon for no reason",t3_kj17ga,22
1608775830.0,2020-12-24,wallstreetbets,gguxvmb,BABA gang 🤚 how do I apply for food stamps?,t3_kj17ga,23
1608798311.0,2020-12-24,wallstreetbets,ggvt383,"Interesting how this was the deadliest year ever for the US. It’s almost as if covid is actually real. 🤔🤔 

People are like “tHeY aRe MaRkInG cAr AcCiDeNtS aS cOvId DeAtHs”. Damn I wonder why we had so many flu deaths and car accidents this year. Fucking wild.",t3_kj17ga,23
1608763726.0,2020-12-24,wallstreetbets,ggubxnn,Who made money today!,t3_kj17ga,21
1608763861.0,2020-12-24,wallstreetbets,gguc7kz,APE TOGETHER STRONG#GME💎👋,t3_kj17ga,22
1608780218.0,2020-12-24,wallstreetbets,ggv5jc5,half day tomorrow. Stocks go up twice as fast,t3_kj17ga,21
1608783207.0,2020-12-24,wallstreetbets,ggvae0l,We live in a world where in one year you could have created generational wealth selling butthole and feet pics and throwing the proceeds into high risk positions in the stock market,t3_kj17ga,22
1608791194.0,2020-12-24,wallstreetbets,ggvlldj,Get rich or die crying,t3_kj17ga,23
1608795688.0,2020-12-24,wallstreetbets,ggvqhfc,🥭 driving a wedge between the Republican party is seriously jeopardizing their chances of winning the Georgia runoffs. Poetic af lol,t3_kj17ga,23
1608757479.0,2020-12-24,wallstreetbets,ggu08bf,"After making 5 trades and checking RH no less than 20 times, I ended the day up literally $1. I think hobos pan handling for $ have better ROI 🤡",t3_kj17ga,48
1608758389.0,2020-12-24,wallstreetbets,ggu1woh,If GME opens at 25 tomorrow I’ll make peanut butter fudge.,t3_kj17ga,45
1608759038.0,2020-12-24,wallstreetbets,ggu33uu,#  puts on the mod team.,t3_kj17ga,46
1608779740.0,2020-12-24,wallstreetbets,ggv4qbx,"wonder what ackman is doing rn, prob laying around his penthouse not merging with anyone 

I wonder if he misses me like I miss him",t3_kj17ga,21
1608780723.0,2020-12-24,wallstreetbets,ggv6djj,[deleted],t3_kj17ga,23
1608785078.0,2020-12-24,wallstreetbets,ggvd9hp,"Remember all them times GameStop gave you $1.40 for your used n64 game, well we’re finally even you fucking snakes 

GME 🚀

Edit: fucking sneks!!",t3_kj17ga,21
1608794592.0,2020-12-24,wallstreetbets,ggvpd29,"Its really amazing that the key to financial freedom lies now in the correct sequence of buttons pressed on one's smartphone. 

Press the right button, you're up in the clouds. Press the wrong button... you start over.",t3_kj17ga,20
1608762794.0,2020-12-24,wallstreetbets,ggu9zh2,"What if we all wake up in a week and its Jan 2020 again and everything seems great, but there are rumors of a nasty virus in china?",t3_kj17ga,21
1608764602.0,2020-12-24,wallstreetbets,ggudm79,Trump threatening iran? Bullish. PLTR🚀🚀🚀,t3_kj17ga,20
1608780779.0,2020-12-24,wallstreetbets,ggv6gve,[deleted],t3_kj17ga,19
1608790544.0,2020-12-24,wallstreetbets,ggvkt8q,"Reading an article in regards to tomorrow’s half day. 

>The good news. Stock market investors will get some time off for Christmas Eve. 


Time off?? **We don’t want any fucking time off. The casino never sleeps**",t3_kj17ga,20
1608793447.0,2020-12-24,wallstreetbets,ggvo554,We need an ARK etf for all the ARK etfs. I'm too lazy to buy all of them separately,t3_kj17ga,19
1608801406.0,2020-12-24,wallstreetbets,ggvvxqb,"if you aren’t all in on GME, you ain’t black",t3_kj17ga,21
1608758328.0,2020-12-24,wallstreetbets,ggu1snw,[deleted],t3_kj17ga,18
1608759639.0,2020-12-24,wallstreetbets,ggu47ui,Tomorrow morning we will find out if Cohen kept buying GME shares on Monday,t3_kj17ga,19
1608762861.0,2020-12-24,wallstreetbets,ggua3w1,Went to the casino yesterday and turned $260 into $530 on blackjack. The workers kept on getting me hammered so I would lose but kept on winning. They are just as 🌈 as mods,t3_kj17ga,20
1608764585.0,2020-12-24,wallstreetbets,ggudl6h,I sure hope 🍊 gets us the $2000 stimmy bc boi I fucked my portfolio up REAL good today! 🤡,t3_kj17ga,18
1608774906.0,2020-12-24,wallstreetbets,gguw7ub,"u/zjz is a real fucking mod. I once wrote some throwaway comment about how the mods don’t care about the dumbest shitposts (this was the dark days of dozens of spongebob memes) and he took time to write me a novel explaining the calculus behind their mod choices. Seriously, the dude cared.

I hope the byproduct isn’t that we get banned for shilling some crap that doesn’t get effectively shut down",t3_kj17ga,19
1608775414.0,2020-12-24,wallstreetbets,ggux4yz,china is gonna be so mad that baba rockets tomorrow because of everyone using rh to buy anything that has a dip,t3_kj17ga,19
1608775877.0,2020-12-24,wallstreetbets,gguxypy,"Correct me if i'm wrong , so instead of just repeating 1200 they said its 600 and because mango said 2000 now nobody gets anything for another month?",t3_kj17ga,20
1608784061.0,2020-12-24,wallstreetbets,ggvbprc,imagine having an EBT card and a Robinhood debit card in the same wallet,t3_kj17ga,19
1608784434.0,2020-12-24,wallstreetbets,ggvcal6,[deleted],t3_kj17ga,19
1608793085.0,2020-12-24,wallstreetbets,ggvnqve,[deleted],t3_kj17ga,18
1608794619.0,2020-12-24,wallstreetbets,ggvpe2v,"Ordered taco Bell on door dash, they messed up the order super bad. Spent about 15 minutes arguing with their text bot about getting a refund. Got support number, but the bot chat was still open. Argued with both the bot and the support guy about the refund ended up getting twice my orders worth in money back.   Buy puts, made 200% on ordering taco Bell through their app",t3_kj17ga,18
1608797274.0,2020-12-24,wallstreetbets,ggvs2n9,imagine bagholding a chinese communist stock,t3_kj17ga,19
1608759048.0,2020-12-24,wallstreetbets,ggu34gs,"Hedge Funds paid off top mod in order to kill this sub? Sounds pretty desperate, if you ask me.",t3_kj17ga,18
1608759710.0,2020-12-24,wallstreetbets,ggu4byd,Mods need to have makeup sex,t3_kj17ga,17
1608769186.0,2020-12-24,wallstreetbets,ggultcm,"I think I might go full ARK gang, literally nothing but ARK stonks and calls. If I fall will you catch me mama Cathie? 🤗",t3_kj17ga,18
1608772237.0,2020-12-24,wallstreetbets,ggurctm,We just gonna ignore the fact that GME guy held through the march crash? like what the fuck,t3_kj17ga,18
1608773509.0,2020-12-24,wallstreetbets,ggutol9,Why do mods of every sub think we care about their discord drama?,t3_kj17ga,19
1608778321.0,2020-12-24,wallstreetbets,ggv29n7,[deleted],t3_kj17ga,20
1608780577.0,2020-12-24,wallstreetbets,ggv64wt,GME buys out  BABA,t3_kj17ga,19
1608783608.0,2020-12-24,wallstreetbets,ggvb0l2,$5 bags of orange chicken from Trader Joe’s are a fantastic investment,t3_kj17ga,16
1608784898.0,2020-12-24,wallstreetbets,ggvczrm,They sold us fake BABA stonks.,t3_kj17ga,17
1608790157.0,2020-12-24,wallstreetbets,ggvkc5a,"Back to single life. Time to go back to my routine from two years ago. Wake up, check stocks, work, eat, watch Seinfeld, and go to bed. Happy Festivus everyone.",t3_kj17ga,18
1608796194.0,2020-12-24,wallstreetbets,ggvqzqh, Change my view: Losing big on a braindead option play is necessary to becoming a good trader. Its necessary to learn your upper bound and figure out risk management to make actual good plays,t3_kj17ga,18
1608757326.0,2020-12-24,wallstreetbets,ggtzy8f,Went from like 2% green all day to 1% red in like 15 seconds the fuck?,t3_kj17ga,18
1608757696.0,2020-12-24,wallstreetbets,ggu0mid,VALE pleas fly again,t3_kj17ga,18
1608758420.0,2020-12-24,wallstreetbets,ggu1yrn,Bought back more GME shares at close 😊,t3_kj17ga,17
1608761207.0,2020-12-24,wallstreetbets,ggu72tw,That pinned mod post could be up there for weeks based on how often top mod shows up to work. 🙄,t3_kj17ga,17
1608761217.0,2020-12-24,wallstreetbets,ggu73i9,MODS GONE WELCOME TO THE REAL WSB,t3_kj17ga,17
1608765620.0,2020-12-24,wallstreetbets,ggufe2u,This subs about to turn into the Middle East with no moderators. Lmao,t3_kj17ga,18
1608767378.0,2020-12-24,wallstreetbets,gguiki6,[deleted],t3_kj17ga,16
1608768020.0,2020-12-24,wallstreetbets,ggujoxd,Cramer is not on tv because he to busy browsing WSB  comments to see if we are shutting down or not,t3_kj17ga,17
1608769863.0,2020-12-24,wallstreetbets,ggun1y6,Mods just deleted my extensive GME thesis can confirm they have puts,t3_kj17ga,17
1608779044.0,2020-12-24,wallstreetbets,ggv3jkt,When apple jumped off of EV news the other day their market cap moved +102 billion. The entire market cap of McDonalds is 150 billion. That shit is insane,t3_kj17ga,17
1608783714.0,2020-12-24,wallstreetbets,ggvb6hg,"I became a millionaire in Bangladesh dollars this year, and my wife still doesn’t want to try a threesome",t3_kj17ga,17
1608791162.0,2020-12-24,wallstreetbets,ggvljz1,[deleted],t3_kj17ga,17
1608794219.0,2020-12-24,wallstreetbets,ggvoz4r,Being balls deep in ICLN and the ARK’s is fun because you don’t go to bed thinking ‘I hope I’m green in the morning’ but instead ‘will I be green or HUGELY GREEN?’,t3_kj17ga,18
1608794951.0,2020-12-24,wallstreetbets,ggvpqe9,"For those thinking of buying the Baba dip tmrw, during the the last drop resulting from the postponement of Ant IPO it bleeds for weeks so be careful out there. Coming from a Baba bag holder from the last ‘dip’.",t3_kj17ga,16
1608761317.0,2020-12-24,wallstreetbets,ggu7a47,[deleted],t3_kj17ga,33
1608763588.0,2020-12-24,wallstreetbets,ggubmw0,"When I finally get my $2,000 my net worth will be $2,100!",t3_kj17ga,34
1608770622.0,2020-12-24,wallstreetbets,gguoexq,[deleted],t3_kj17ga,36
1608785656.0,2020-12-24,wallstreetbets,ggve4y2,"Someone hacked into my Robinhood account and bought a shit ton of baba calls, I need a refund on those",t3_kj17ga,36
1608757362.0,2020-12-24,wallstreetbets,ggu00rj,Gonna be checking the market every chance I get while pretending to think my brother-in-law's Cards Against Humanity answers are funny.,t3_kj17ga,63
1608758004.0,2020-12-24,wallstreetbets,ggu1771,Boomers forgot we’re still open tomorrow. Pumping will resume,t3_kj17ga,15
1608758895.0,2020-12-24,wallstreetbets,ggu2u62,"Christmas money——->PLTR, GME calls",t3_kj17ga,16
1608760995.0,2020-12-24,wallstreetbets,ggu6p2h,"With Robinhoods new margin rates, it looks like a very very effective strategy to just buy as many shares of a company you like and repeatedly sell OTM covered calls against it. I'm doing this with PLTR and my portfolio is already up 35% in 4 days",t3_kj17ga,17
1608761102.0,2020-12-24,wallstreetbets,ggu6w4f,Half day tomorrow. No selling allowed.,t3_kj17ga,15
1608762309.0,2020-12-24,wallstreetbets,ggu93wc,"Love it or hate it, I cannot wait for the Netflix documentary on Robinhood",t3_kj17ga,16
1608767390.0,2020-12-24,wallstreetbets,gguil9x,#MORE GME CALLS,t3_kj17ga,16
1608767519.0,2020-12-24,wallstreetbets,gguitcc,"*Futures up 150 points*

CNBC: “Futures flat.” 

*Futures up 26 points*

CNBC: “Futures higher!”",t3_kj17ga,15
1608767683.0,2020-12-24,wallstreetbets,gguj3ue,[removed],t3_kj17ga,17
1608773224.0,2020-12-24,wallstreetbets,ggut5yb,"Pretty fucked up, my wife has my kids making cookies for another man to eat. And he got my kids a present?! That fat piece of shit. 🎅🔫",t3_kj17ga,17
1608775097.0,2020-12-24,wallstreetbets,gguwkak,"If Apple opens super green tomorrow, I will buy a green Apple and cut a 1/4in hole in it and fuck it with my peen.",t3_kj17ga,15
1608778041.0,2020-12-24,wallstreetbets,ggv1s7y,[deleted],t3_kj17ga,16
1608780212.0,2020-12-24,wallstreetbets,ggv5iyn,BABA announcing 1:2 split tomorrow.  Each share will be selling at half price.,t3_kj17ga,16
1608780881.0,2020-12-24,wallstreetbets,ggv6mpp,The most insane women I’ve ever dated were licensed therapists.,t3_kj17ga,15
