created,date,subreddit,id,body,parent_id,score
1618524890.0,2021-04-16,wallstreetbets,guno95t,I just want to be right about the random TSLA spike one time,t3_mrms60,15
1618526496.0,2021-04-16,wallstreetbets,gunrhu1,CORN is a growth stalk,t3_mrms60,15
1618527912.0,2021-04-16,wallstreetbets,gunuahg,Seriously how do you guys stop yourself from checking prices every minute? Even my long term portfolio 🤦‍♂️,t3_mrms60,15
1618528835.0,2021-04-16,wallstreetbets,gunw457,Seriously. Why is Peloton even a thing? Isn't that just a Treadmill with a TV? Can't you buy a cheaper TV and a cheaper treadmill and put them together?,t3_mrms60,15
1618535291.0,2021-04-16,wallstreetbets,guo8l03,If all this puppy token madness goes viral - shits going to pop off tmrw like gme cult.,t3_mrms60,16
1618536242.0,2021-04-16,wallstreetbets,guoafb2,"I’m seeing all these loss porn of ppl down over 50% on options, while I have multiple stock SHARES are down over 50%. 

Maybe I’m too retarded even for WSB.",t3_mrms60,14
1618541237.0,2021-04-16,wallstreetbets,guoju8d,Feel like I keep missing the chances to make it big. I need that yolo spirit,t3_mrms60,15
1618544024.0,2021-04-16,wallstreetbets,guooq9q,"Alright, boys.  Gonna go turn on the shop vac and stick my cock in it till I fall asleep. Love you. 💕💕💘💜💖💓❣💋",t3_mrms60,15
1618544179.0,2021-04-16,wallstreetbets,guooztu,Not to be a 🌈🐻 or anything but last time dog currency mooned this hard it signaled the end of the crypto bull run so plan accordingly boys...,t3_mrms60,15
1618546604.0,2021-04-16,wallstreetbets,guoswxs,"Holy shit my girlfriend and I were reading about that $100 million deli and we should all start a deli. They put 300K of 'professional' and 'administrative' fees in the books.  I wanna administer shit as a professional.  

Like, I bet the 'CEO' is just using it as a front and praying no one catches on, meanwhile, CNBC catches wind of that shit and puts it front page.  GUH

Edit: anyone wanna split a PO Box in a UPS store in NV?  We can all incorporate different shit for cheap ffffuuuuuck yes I just nutted.  The American Dream",t3_mrms60,16
1618547042.0,2021-04-16,wallstreetbets,guotlfj,"I am not a gambler.

I enter into temporally limited contractual agreements with sophisticated investors who focus on delta-hedged risk management and capital preservation strategies that benefit society",t3_mrms60,15
1618547371.0,2021-04-16,wallstreetbets,guou3bl,Bi-annual reminder to change the orientation of your mattress to preserve it longer and sleep better.,t3_mrms60,16
1618551364.0,2021-04-16,wallstreetbets,guozjxn,"me: ok I'll make some long term plays so I'll be more productive and less distracted

also me: checks portfolio every 2 minutes",t3_mrms60,14
1618553140.0,2021-04-16,wallstreetbets,gup1rnq,"PLTR really went green for 1 day and said ""stfu for the rest of the month""",t3_mrms60,15
1618554456.0,2021-04-16,wallstreetbets,gup3cvq,"Meme quality has gone down. When I first joined this sub, some users out here were posting the funniest shit. What happened?",t3_mrms60,15
1618562006.0,2021-04-16,wallstreetbets,gupbo53,So has the market just been red or are my stocks just trash?,t3_mrms60,16
1618564066.0,2021-04-16,wallstreetbets,gupds9t,Trying to figure out how the market will violate me today..,t3_mrms60,14
1618564886.0,2021-04-16,wallstreetbets,gupelyw,Doggy coin ruining the reputation of internet money,t3_mrms60,15
1618539405.0,2021-04-16,wallstreetbets,guoggdn,"##IM GONNA DIP MY WIENER IN SUGAR WATER,  THEN GO OUTSIDE AND LET BUTTERFLIES LAND ON IT!!!! 🦋🦋🦋🦋🦋",t3_mrms60,45
1618518106.0,2021-04-16,wallstreetbets,gun96vo,"[https://twitter.com/BNODesk/status/1382790485329252354?s=20](https://twitter.com/BNODesk/status/1382790485329252354?s=20) 

>Some Brazilian hospitals have run out of sedatives, forcing doctors to use restraints while coronavirus patients are intubated.  
>  
>""I never thought I would be living through something like this,"" a doctor says. ""The patient is submitted to a form of torture"" 

$EWZ +1.14% today 

[https://twitter.com/BNODesk/status/1382758172281212930?s=20](https://twitter.com/BNODesk/status/1382758172281212930?s=20)

>BREAKING: India reports 216,669 new coronavirus cases, by far the biggest one-day increase so far, and a record 1,173 new deaths

$INDA +0.50% today",t3_mrms60,14
1618519485.0,2021-04-16,wallstreetbets,gunce0c,"Hey holy shit, we did great today!

*turns phone right side up*

Oh, f***!",t3_mrms60,14
1618520788.0,2021-04-16,wallstreetbets,gunfdh4,"Truly ironic seeing these Fast Money analysts calling ""pouring fuel on the fire"" of a stock irresponsible - yet they go on-air and do it every single damn day.",t3_mrms60,14
1618521499.0,2021-04-16,wallstreetbets,gungxie,Dude I fucking suck at this.,t3_mrms60,14
1618524760.0,2021-04-16,wallstreetbets,gunnz8k,What happened to all my money.,t3_mrms60,14
1618524813.0,2021-04-16,wallstreetbets,guno39j,"Spy ATH 

My account -8% 

Fucking magic",t3_mrms60,14
1618525765.0,2021-04-16,wallstreetbets,gunq1ql,[deleted],t3_mrms60,15
1618528092.0,2021-04-16,wallstreetbets,gunun86,"Dkng will keep lying to me in AH and premarket, then dump during market hours.",t3_mrms60,12
1618528098.0,2021-04-16,wallstreetbets,gununnv,Guys only want 1 thing and it's $SPY 420 on 4/20,t3_mrms60,14
1618529353.0,2021-04-16,wallstreetbets,gunx50s,"Crazy how options desensitize you to losing and gaining money. In a way it’s a good thing, allows me trade with less emotion",t3_mrms60,14
1618530897.0,2021-04-16,wallstreetbets,guo05g8,[removed],t3_mrms60,13
1618534242.0,2021-04-16,wallstreetbets,guo6kow,Anyone else's port hitting new All-Time lows every day while SPY and Nasdaq hit all-time highs? I can't be the only one.,t3_mrms60,14
1618537624.0,2021-04-16,wallstreetbets,guod28l,We all talk about all these different meme stocks and other BS. SPY went up almost every single day for a month straight.,t3_mrms60,14
1618538579.0,2021-04-16,wallstreetbets,guoewtb,"I honestly don't give a fuck about futures.  Either way my Apha, PLTR and ICLN bags will keep getting heavier.",t3_mrms60,14
1618540288.0,2021-04-16,wallstreetbets,guoi3pd,"God I could have had a cool flair like ""2 inch punisher"" or ""erect nipples"" but I got dis instead 😒🙄",t3_mrms60,14
1618541304.0,2021-04-16,wallstreetbets,guojyl8,"Missing opportunities left and right, is this life?",t3_mrms60,16
1618544455.0,2021-04-16,wallstreetbets,guopg9e,"Rubber, chips, all kinda supply chain fuckery. Car prices retarded. House prices retarded. Vaccines fuckin up. Stimulus cash only thing keeping retail afloat. Money printing only thing keeping stim cash afloat. Pending eviction armegedon. Commodity/food prices goin up. Gotta nail down boards on the job site cuz lumbers worth more than gold. Trade war happening. Chocolate shortage. Likely mass crop failures. And every ticker under the sun been overvalued over a year. Dafuqs a guy to do...but sit on cash...n wait",t3_mrms60,14
1618546062.0,2021-04-16,wallstreetbets,guos22f,Changed my valve cover gasket today by myself. Feel so proud. I waste thousands on options daily but refuse to pay a mechanic,t3_mrms60,15
1618548709.0,2021-04-16,wallstreetbets,guow0kz,I just want $PLTR to jump to $28 even if it’s for 5 mins.,t3_mrms60,14
1618551089.0,2021-04-16,wallstreetbets,guoz75b,"palantir isn't a real company, change my mind",t3_mrms60,14
1618553244.0,2021-04-16,wallstreetbets,gup1wcx,When every single stock is up 100% from the prices they are right now people will start to look at PLTR at $20 and buy back in,t3_mrms60,15
1618561537.0,2021-04-16,wallstreetbets,gupb6lh,I used to be a stripper but I always thought I was above being an escort. Starting to rethink that.,t3_mrms60,14
1618518150.0,2021-04-16,wallstreetbets,gun9an2,Market was very green today. No wonder I was very red today,t3_mrms60,12
1618519269.0,2021-04-16,wallstreetbets,gunbwb6,"DKNG DKNG DKNG DKNG

Donkey Kong, the real ape that rules them all.  🚀🚀🚀 Time baby.",t3_mrms60,12
1618519712.0,2021-04-16,wallstreetbets,guncwwx,Why the fuck did I buy all these spacs😭😭 straight anal bleeding 🩸,t3_mrms60,12
1618522023.0,2021-04-16,wallstreetbets,guni3oj,My 401k is outperforming my memefolio. I may actually suck at this,t3_mrms60,12
1618525568.0,2021-04-16,wallstreetbets,gunpnb4,The more I trade the more I lose,t3_mrms60,14
1618529857.0,2021-04-16,wallstreetbets,guny4sd,ok hear me out. PLTR,t3_mrms60,13
1618531045.0,2021-04-16,wallstreetbets,guo0ftj,"Well.  I was up 30k on my trades entered last Friday on docu aapl and tsla, closed all and took profits felt like a boss. 

Was feeling good Wednesday.  Decided to yolo otm expiring tomorrow.   Down 70% probably -99% tomorrow more than I was up.    

I’m crayongry",t3_mrms60,14
1618531635.0,2021-04-16,wallstreetbets,guo1kih,"Now for my next trick, watch as I catch a falling SPCE knife right in my pee hole.",t3_mrms60,13
1618531745.0,2021-04-16,wallstreetbets,guo1s43,"#FUCK, IF WE ARE FLAT TOMORROW IM GONNA LOSE IT!",t3_mrms60,14
1618534671.0,2021-04-16,wallstreetbets,guo7eck,[removed],t3_mrms60,14
1618534691.0,2021-04-16,wallstreetbets,guo7frm,[deleted],t3_mrms60,13
1618534790.0,2021-04-16,wallstreetbets,guo7mjk,I now believe we are in a bubble.,t3_mrms60,12
1618536670.0,2021-04-16,wallstreetbets,guob8pf,[removed],t3_mrms60,16
1618537589.0,2021-04-16,wallstreetbets,guoczuh,Just activated margin and I’m pretty sure it’s the beginning of the end,t3_mrms60,14
1618541532.0,2021-04-16,wallstreetbets,guokdgs,"Well I got drunk tonight and ordered a pair of trailer hitch style nut sacks to hang off the back of my crocs.

Unfortunately my best financial decision of the week",t3_mrms60,13
1618541830.0,2021-04-16,wallstreetbets,guokx3k,"Ok gentlemen, what tickers are we losing money on tomorrow?",t3_mrms60,14
1618547580.0,2021-04-16,wallstreetbets,guouepu,Who else bagholding ARKK leaps,t3_mrms60,14
1618548037.0,2021-04-16,wallstreetbets,guov2k4,There is no nobility in poverty,t3_mrms60,12
1618552368.0,2021-04-16,wallstreetbets,gup0tbx,"Bought amd at 92.

Come pick me up guys 🤡",t3_mrms60,12
1618555254.0,2021-04-16,wallstreetbets,gup4api,All my homies hate robinhood,t3_mrms60,13
1618556168.0,2021-04-16,wallstreetbets,gup5d3x,if you don’t headbutt your cat back are you even friends?,t3_mrms60,13
1618560098.0,2021-04-16,wallstreetbets,gup9nc0,"Anyone else buying onlyfans IPO today? I’m going all in, ready for massive green dildos at open",t3_mrms60,13
1618564163.0,2021-04-16,wallstreetbets,gupdvu5,"Probably just stare in contempt and frustration at my computer screen.

Same as always.",t3_mrms60,13
1618567970.0,2021-04-16,wallstreetbets,guphw71,Good morning beautiful people. I wish you money and  luck today. Reminder sometimes is not about who make more profits sometimes is about who loss less. 🌞☕️,t3_mrms60,13
1618517115.0,2021-04-16,wallstreetbets,gun6vqj,You ever just get pissed at losing 80% of your portfolio on some dumbass trades so you just say fuck it and yolo 4/16 416 calls? Cause I did. Let the gods decide idgaf anymore lmao,t3_mrms60,13
1618518327.0,2021-04-16,wallstreetbets,gun9pjr,"Yup DKNG NFL official partnership.

https://www.globenewswire.com/news-release/2021/04/15/2211253/0/en/DraftKings-Named-an-Official-Sports-Betting-Partner-of-the-National-Football-League.html


Side long play is PSFE as they are DKNGs partner",t3_mrms60,12
1618518385.0,2021-04-16,wallstreetbets,gun9uhs,hold $MVIS like a baby 🥲,t3_mrms60,11
1618519004.0,2021-04-16,wallstreetbets,gunba2c,What bigger partnership could DraftKings have gotten then the nfl?,t3_mrms60,12
1618520242.0,2021-04-16,wallstreetbets,gune5b6,I neglect putting up $$ for my car but will fire off $$$ into my account for a naked call on a stock that I spent less than 10 mins looking into without even blinking. Maybe I have a problem,t3_mrms60,10
1618522955.0,2021-04-16,wallstreetbets,gunk5o3,"Fuck you UWMC, you sideways trading trash. Puts on my $11 calls for april",t3_mrms60,12
1618522963.0,2021-04-16,wallstreetbets,gunk68a,I don’t have the energy to participate in this housing market anymore.  I’m tired of bidding high on overpriced average houses and losing to some crazy who YOLOs 100k over.  My little rental is looking better and better every day,t3_mrms60,12
1618523962.0,2021-04-16,wallstreetbets,gunmb0k,fuckthis market im joining theta gang,t3_mrms60,12
1618524360.0,2021-04-16,wallstreetbets,gunn4tf,"After drinking since close,I've got the clarity to realize the same thing I realized all day. I'm kinda retarded",t3_mrms60,13
1618524717.0,2021-04-16,wallstreetbets,gunnvxh,u/zjz saving the sub one ban at a time. My man,t3_mrms60,13
1618525308.0,2021-04-16,wallstreetbets,gunp49z,Small caps are absolutely getting destroyed. Im down over $60k from my ath. High beta speculative growth is my money maker. small caps for life 😆,t3_mrms60,12
1618525685.0,2021-04-16,wallstreetbets,gunpvwk,"Guys, please thank zjz for clearing the gme spam... 

Mods need some loving, butt touching and caressing.",t3_mrms60,11
1618525980.0,2021-04-16,wallstreetbets,gunqh7i,I’m the only dumbass not making in this market,t3_mrms60,13
1618528156.0,2021-04-16,wallstreetbets,gunurom,Ultimate bull case: annual beer virus shots and masks forever. Pandemic turns into epidemic and stays this way for the next 5 years. Spy 600 eoy,t3_mrms60,12
1618528362.0,2021-04-16,wallstreetbets,gunv67l,DKNG calls in the morning?,t3_mrms60,12
1618528476.0,2021-04-16,wallstreetbets,gunveay,[deleted],t3_mrms60,12
1618528845.0,2021-04-16,wallstreetbets,gunw4sq,Everybody’s hyping Apple & Tesla so I already know what’s going to happen tomorrow & Monday,t3_mrms60,11
1618529568.0,2021-04-16,wallstreetbets,gunxkdj,"Kind of jealous of the MVIS retards, for better or worse that stock is a fucking mover",t3_mrms60,13
1618531029.0,2021-04-16,wallstreetbets,guo0eps,I remember when my life was simple and I didn’t stare at stocks all day,t3_mrms60,12
1618531559.0,2021-04-16,wallstreetbets,guo1fco,NIO 40 tomorrow?,t3_mrms60,12
1618531772.0,2021-04-16,wallstreetbets,guo1tty,PLTR dumping a big fat dump on my chest tomorrow,t3_mrms60,12
1618532194.0,2021-04-16,wallstreetbets,guo2n1w,"I made all the money I will ever make this year in the first 2 weeks of 2021. Could have literally cashed out and Jack off for the rest of the year, but what did I do? .... roll the fuking dice more times 🤦‍♀️",t3_mrms60,12
1618534249.0,2021-04-16,wallstreetbets,guo6l75,There is no fundamental difference between 🌽 and 🌷 bulbs,t3_mrms60,13
1618534489.0,2021-04-16,wallstreetbets,guo71pc,"LOL @ the dog.

The world is a strange place",t3_mrms60,13
1618535243.0,2021-04-16,wallstreetbets,guo8hlm,Clearly the suits figured out a way to fix the dog price action because there’s no way this is natural movement.,t3_mrms60,11
1618535449.0,2021-04-16,wallstreetbets,guo8vwb,"Cathie doubled down and bought the dip on COIN lmao

She’s far more of a degenerate YOLOer then anyone on this sub",t3_mrms60,11
1618536196.0,2021-04-16,wallstreetbets,guoac5d,"lmao this can’t be real. i got some døgë at the absolute peak. as soon as i bought, it came crashing down. someone could legit be a billionaire if they just reversed me. it was just 25 bucks so not stressed but damn talk about timing",t3_mrms60,11
1618540398.0,2021-04-16,wallstreetbets,guoiaze,I'll be so ripped from carrying these NIO bags next year,t3_mrms60,10
1618541356.0,2021-04-16,wallstreetbets,guok1zn,"Wish i could buy calls on how many ""If you invested $1000 into ____ a year ago"" headlines i see in a day",t3_mrms60,12
1618542034.0,2021-04-16,wallstreetbets,guolaek,PLTR is a cruel mistress,t3_mrms60,12
1618543226.0,2021-04-16,wallstreetbets,guondsd,"I wish the market was like Skyrim.

Just get shitfaced and craft iron daggers for 3 days straight and suddenly you’re the richest guy on the fucking continent.",t3_mrms60,13
1618543254.0,2021-04-16,wallstreetbets,guonfg2,Note to self. Do not impulse yolo net worth on a gut feeling,t3_mrms60,12
1618543866.0,2021-04-16,wallstreetbets,guoogo1,"We get so much coverage now.... 
https://gizmodo.com/wallstreetbets-does-not-bow-to-crypto-wave-1846692894/amp

I miss the under the radar WSB :(",t3_mrms60,12
1618551111.0,2021-04-16,wallstreetbets,guoz868,I'd not date myself if I was a girl.,t3_mrms60,13
1618551231.0,2021-04-16,wallstreetbets,guozdof,"Taking an unwanted midnight shit

GF blasts into the bathroom

GF “I have to pee”

Me (clearly shitting) “I’m taking a shit”

GF “ I can smell it”

Me “bathtubs open”

GF *storms out*

Me *taking BF applications for her*

JFC",t3_mrms60,12
1618553345.0,2021-04-16,wallstreetbets,gup20su,"Going through my stages of Grief right now with Apha and Tlry.  Still pretty deep in Denial, in my head Tlry delayed the vote to scoop up more shares for cheap.",t3_mrms60,11
1618555441.0,2021-04-16,wallstreetbets,gup4iti,The virgin Warren buffet apple fan holding for a decade to make 1000% vs the chad dog enjoyer doing it in 7 minutes,t3_mrms60,11
1618561324.0,2021-04-16,wallstreetbets,gupaymt,"Thought I was slick buying COIN at 325, now its tearing me a new bunghole. Fs the chat for my fellow bagholders, I'm looking at you Cathie.",t3_mrms60,13
1618561519.0,2021-04-16,wallstreetbets,gupb5xa,AAPL I stg if you don’t open at 135 I’m gonna switch to Samsung,t3_mrms60,12
1618565797.0,2021-04-16,wallstreetbets,gupfjpj,I choose to believe that COIN manipulated dog to foster hype for their stock,t3_mrms60,12
1618516909.0,2021-04-16,wallstreetbets,gun6ert,"Losing money, apparently it’s what I love most in life",t3_mrms60,11
1618516940.0,2021-04-16,wallstreetbets,gun6hfl,Nio can’t hurt me anymore because my calls are at -79%.,t3_mrms60,11
1618518564.0,2021-04-16,wallstreetbets,guna9b8,That had to be the reddest green day I’ve ever had...,t3_mrms60,10
1618521919.0,2021-04-16,wallstreetbets,gunhvds,"Was up 3% on PLTR yesterday, and didn't take the money and run away from that piece of shit.

Shame on me....",t3_mrms60,11
1618521978.0,2021-04-16,wallstreetbets,guni03y,SPY is itching for a 5% day,t3_mrms60,11
1618522056.0,2021-04-16,wallstreetbets,guni6by,Fuck TLRY,t3_mrms60,10
1618522661.0,2021-04-16,wallstreetbets,gunjiix,"""Alcoholics Anonymous""  |  ""PLTR Shareholders""

*TheyretheSamePicture.png*",t3_mrms60,12
1618522851.0,2021-04-16,wallstreetbets,gunjxhj,I don’t care about QuantumScape but that Kir guy is a douche nozzle,t3_mrms60,10
1618523051.0,2021-04-16,wallstreetbets,gunkd47,Who currently owns quantumscape and is getting hammered because this idiot on cnbc ?,t3_mrms60,11
1618523645.0,2021-04-16,wallstreetbets,gunlmv8,PLTR taking everyone to Valhalla,t3_mrms60,11
1618524293.0,2021-04-16,wallstreetbets,gunmzro,"Anyone ever just go for the waffle stomp, but then realize afterward that your drain isn't a waffle drain, but is instead one of those ones that moves up and down to open and close, so then you spend the next 3 minutes wedging the grumpy between the minute clearance with your bare fingers to make sure it stays gone and doesn't resurface during the next shower? 😳",t3_mrms60,10
1618524342.0,2021-04-16,wallstreetbets,gunn3g7,Theta gonna eat me alive,t3_mrms60,11
1618524508.0,2021-04-16,wallstreetbets,gunng3g,"Sigh! 

No cigar today after what RIOT and PLTR did to me. See you folks behind Wendy’s.",t3_mrms60,11
1618524536.0,2021-04-16,wallstreetbets,gunnido,SPY 1% away from 420. Let's make it a fun Friday so we can smoke joints in the evening.,t3_mrms60,12
1618524546.0,2021-04-16,wallstreetbets,gunnj4d,"So sick of the people on CNBC saying that we're at ""all time highs."" We are SUPPOSED to be at all time highs. This is progress into the future, it's not linear, but on average it'll always be all time highs.",t3_mrms60,11
1618525915.0,2021-04-16,wallstreetbets,gunqcky,My Tesla 0dte $730 puts are not lookin good. Probably shouldn’t have yolod my whole portfolio,t3_mrms60,11
1618526001.0,2021-04-16,wallstreetbets,gunqinl,I'm learning to not react to losses emotionally and continuing to buy things at good value 😬😬😬,t3_mrms60,11
1618526440.0,2021-04-16,wallstreetbets,gunrdwt,If you’re not in overvalued large cap stocks right now you’re getting fucked.,t3_mrms60,11
1618526684.0,2021-04-16,wallstreetbets,gunrv5x,You ever feel like you literally don't deserve to make money? Me rn,t3_mrms60,11
1618526846.0,2021-04-16,wallstreetbets,guns6q1,"Calls on strip clubs?

$RICK",t3_mrms60,11
1618527606.0,2021-04-16,wallstreetbets,guntp1z,Imagine any other hobby that could have you this excited for a Monday,t3_mrms60,11
1618528232.0,2021-04-16,wallstreetbets,gunux37,Save your stocks by not mentioning it in this sub. You retards,t3_mrms60,11
1618528277.0,2021-04-16,wallstreetbets,gunv06z,[deleted],t3_mrms60,11
1618534380.0,2021-04-16,wallstreetbets,guo6u8g,[removed],t3_mrms60,14
1618534964.0,2021-04-16,wallstreetbets,guo7yee,Am I the only one who forgot Bumble is a stock now?,t3_mrms60,10
1618535807.0,2021-04-16,wallstreetbets,guo9kq7,The greater fool momentum of shit coins is unstoppable.,t3_mrms60,10
1618537711.0,2021-04-16,wallstreetbets,guod874,"So you’re telling me vaccine production ramps up exponentially, and then we have a worldwide semiconductor/chip shortage, and MSFT is hitting ATHs?

Sus.",t3_mrms60,9
1618537874.0,2021-04-16,wallstreetbets,guodjgb,Robinhood having server issues 🙄🙄,t3_mrms60,11
1618540760.0,2021-04-16,wallstreetbets,guoiz2a,Paysafe?,t3_mrms60,13
1618542640.0,2021-04-16,wallstreetbets,guomdbd,I would like it if my stocks could please be green tomorrow; nothing worse than a big red day going into the weekend,t3_mrms60,11
1618542987.0,2021-04-16,wallstreetbets,guomyxz,Michael burry is getting his smug interview ready for when the market crashes. His ego will be unmeasurable if it does,t3_mrms60,11
1618544275.0,2021-04-16,wallstreetbets,guop5jh,"kinda feels like jan/feb 2020 again... just slowly grinding up, vol disappearing.. and then all of a sudden china nukes california and ww3 starts",t3_mrms60,11
1618544723.0,2021-04-16,wallstreetbets,guopwdv,I think a goldfish would trade stocks better than me tbh,t3_mrms60,11
1618547360.0,2021-04-16,wallstreetbets,guou2r8,STOP. DROP. SHUT EM DOWN OPEN UP SHOP,t3_mrms60,11
1618547828.0,2021-04-16,wallstreetbets,guourtd,[deleted],t3_mrms60,11
1618547937.0,2021-04-16,wallstreetbets,guouxfb,Fuck this shit. I’m getting rich tomorrow,t3_mrms60,11
1618548006.0,2021-04-16,wallstreetbets,guov0yu,"Idk why I even bothered with canabis stocks, I've never even smoked before. 

Need this it to hype up on 4/20",t3_mrms60,10
1618548068.0,2021-04-16,wallstreetbets,guov47v,If the mods are so gay why don’t they ever give me kisses?,t3_mrms60,10
1618551186.0,2021-04-16,wallstreetbets,guozblg,I am Palantarded,t3_mrms60,12
1618552595.0,2021-04-16,wallstreetbets,gup13g9,"Fuckin Tilray

Why y’all postpone the vote???",t3_mrms60,10
1618554396.0,2021-04-16,wallstreetbets,gup3a94,"Good morning everyone! Have a great day, stay safe and healthy!   
May your net cash increase by 100 % on this day!",t3_mrms60,11
1618554975.0,2021-04-16,wallstreetbets,gup3z43,I’ll see all my PLTR brothers and sisters on the moon tomorrow.,t3_mrms60,11
1618560537.0,2021-04-16,wallstreetbets,gupa4dl,Pre market is indicatiNg : I’m ruined,t3_mrms60,11
1618561168.0,2021-04-16,wallstreetbets,gupaska,[deleted],t3_mrms60,11
1618565121.0,2021-04-16,wallstreetbets,gupeuhq,Please TSLA do something today like go up,t3_mrms60,11
1618567096.0,2021-04-16,wallstreetbets,gupgx5c,"Teenagers on the internet, give me advice",t3_mrms60,11
1618521233.0,2021-04-16,wallstreetbets,gungcky,[deleted],t3_mrms60,69
1618516965.0,2021-04-16,wallstreetbets,gun6jfa,Wowzers that was a bad day for me daytrading TSLA.,t3_mrms60,10
1618517043.0,2021-04-16,wallstreetbets,gun6psd,Does the market actually gain money? I don't think I've made a profit yet.,t3_mrms60,10
1618517069.0,2021-04-16,wallstreetbets,gun6rzo,"I've really been trying to figure out how I can best contribute and give back to this sub, and I've decided to start writing solid DD in my area of expertise.

Basically, I'll list all of the moves I've made, and then you all can do the exact opposite and make money.",t3_mrms60,10
1618517264.0,2021-04-16,wallstreetbets,gun7879,"Pot, please rise and get high again 😢",t3_mrms60,10
1618517920.0,2021-04-16,wallstreetbets,gun8qxq,Just saw the crypto is banned again. Fuck yes u/zjz I'm happy about this! R.I.P. 4/14 to 4/15 Good riddance,t3_mrms60,9
1618518158.0,2021-04-16,wallstreetbets,gun9bbu,BB continuing to disappoint me,t3_mrms60,11
1618518707.0,2021-04-16,wallstreetbets,gunal5b,Just gonna watch my portfolio continue to bleed out and do nothing,t3_mrms60,9
1618520350.0,2021-04-16,wallstreetbets,guneea0,"DOW above 34k

NASDAQ above 14k

S&P500 above 4.1k

We bullin’",t3_mrms60,10
1618521932.0,2021-04-16,wallstreetbets,gunhwec,Most people here have a super heavy tech portfolio? Out of my 19k in stocks about 10ish is tech?,t3_mrms60,11
1618522080.0,2021-04-16,wallstreetbets,guni893,"Oh PLTR, I just can't quit you.  Just hold me nice sometimes though, yeah?  I know not today, but maybe tomorrow?",t3_mrms60,10
1618522612.0,2021-04-16,wallstreetbets,gunjell,They call us retail cause we be carrying all these bags,t3_mrms60,10
1618523012.0,2021-04-16,wallstreetbets,gunka4b,"SPY 420.69 on 4/20 looks very possible

going to buy $420 worth of edibles at my local dispensary if it happens",t3_mrms60,10
1618523518.0,2021-04-16,wallstreetbets,gunld5q,"In January I bought dirt cheap TLRY calls and made a quick 500% on a run from $8 to $38

today I am just a few bucks from being back to 0 YTD . Enjoy !",t3_mrms60,10
