created,date,subreddit,id,body,parent_id,score
1608758178.0,2020-12-24,wallstreetbets,ggu1its,"Man... He really vetoed it.

He really just said fuck the GOP.

And somehow this is all basically priced in.

The government is about to stop delivering vaccines while there is a shut down... And its all priced in.",t3_kj17ga,61
1608757699.0,2020-12-24,wallstreetbets,ggu0mor,I can make $2000 turn into $600 faster than the government can turn $600 into $2000.,t3_kj17ga,10
1608757892.0,2020-12-24,wallstreetbets,ggu0znm,[deleted],t3_kj17ga,11
1608758586.0,2020-12-24,wallstreetbets,ggu29sz,"Mods longing $ROPE, it all comes full circle",t3_kj17ga,11
1608759091.0,2020-12-24,wallstreetbets,ggu37e8,"yay no mor gay mods

&#x200B;

wait who will take care of us children?

&#x200B;

we have special needs!!!

halp",t3_kj17ga,11
1608759743.0,2020-12-24,wallstreetbets,ggu4dy3,"ICLN gunna do nasty things.

I'm ready 😜💸",t3_kj17ga,12
1608760399.0,2020-12-24,wallstreetbets,ggu5lid,So is WSB in anarchy mode now?,t3_kj17ga,11
1608763726.0,2020-12-24,wallstreetbets,ggubxl7,AAPL coming back alive!,t3_kj17ga,12
1608765077.0,2020-12-24,wallstreetbets,gguefwu,Today I literally invested all 60k I have into ARKG shares and I’m letting it ride for a year or two.,t3_kj17ga,12
1608765744.0,2020-12-24,wallstreetbets,ggufm1x,Hey in the chance this does get removed from Reddit where do I connect with you retards again? Anyone got an autistic discord chat? Another sub?!! Fill me in retards,t3_kj17ga,11
1608766419.0,2020-12-24,wallstreetbets,ggugtab,Wall Street Bets will never shut down stop the 🧢,t3_kj17ga,12
1608766512.0,2020-12-24,wallstreetbets,ggugzch,"I never check futures, I just open this thread and read the comments and you know",t3_kj17ga,11
1608767246.0,2020-12-24,wallstreetbets,gguic6n,"1.Buy SPAC under $11.50  on merger news 
2. Sell SPAC over $15
3. Rinse and repeat",t3_kj17ga,11
1608767465.0,2020-12-24,wallstreetbets,gguipvw,"Looking for invite to r/WSB 

Where does a serious autist apply",t3_kj17ga,11
1608767801.0,2020-12-24,wallstreetbets,ggujb3u,I seriously diversify too much. I make like 20 plays and instead should be putting 25k across like 3 SPACs or all GME. I limit my gains tremendously,t3_kj17ga,10
1608769135.0,2020-12-24,wallstreetbets,ggulpq6,Puts on /r/wallstreetbets,t3_kj17ga,11
1608769690.0,2020-12-24,wallstreetbets,ggumqvr,Mango’s pardon train keeps on rolling. Pardoned Jared’s dad lol what for? He’s just gonna hit the whole fam before leaving 😂,t3_kj17ga,11
1608771289.0,2020-12-24,wallstreetbets,gguplzq,Jack Ma is going to reeducation camp,t3_kj17ga,11
1608772843.0,2020-12-24,wallstreetbets,ggusgvr,RIP to my entire stimulus check from the American government.... all thanks to the Chinese government,t3_kj17ga,10
1608772850.0,2020-12-24,wallstreetbets,ggusheg,Imagine being the wealthiest nation in the history of civilization and only giving a pair of Apple headphones to your citizens during a pandemic 🤡🤡🤡,t3_kj17ga,11
1608773353.0,2020-12-24,wallstreetbets,ggutefq,I heard a rumour that ICLN will never have a red day again,t3_kj17ga,12
1608773355.0,2020-12-24,wallstreetbets,ggutekb,BABA was already on life support before these allegations lmao.,t3_kj17ga,10
1608774001.0,2020-12-24,wallstreetbets,gguukwk,"anyone here pay for bloomberg?

I'm up 6k this month but paying $1.99 to be able to read information that will possibly make me more money is a deal-breaker for me",t3_kj17ga,11
1608775272.0,2020-12-24,wallstreetbets,gguwvqf,Paper handing BABA for a small loss a while back is probs the best decision I’ve made,t3_kj17ga,11
1608775430.0,2020-12-24,wallstreetbets,ggux60h,"“Baba down in HK after Chinese authorities launch antitrust probe”

This is called making an example. Xi doesn’t fuck around playing the game of thrones.",t3_kj17ga,11
1608776640.0,2020-12-24,wallstreetbets,gguzbqf,I’m never playing weeklies again.,t3_kj17ga,10
1608777466.0,2020-12-24,wallstreetbets,ggv0rzi,mods pleas fly again.,t3_kj17ga,10
1608777582.0,2020-12-24,wallstreetbets,ggv0zbb,[deleted],t3_kj17ga,11
1608777797.0,2020-12-24,wallstreetbets,ggv1cwu,"Wife thinks I’m giddy because of some newfound Christmas spirit.

Truth is, Whenever I think “Literally can’t go tits up” it makes me chuckle.  God I love this sub",t3_kj17ga,12
1608778231.0,2020-12-24,wallstreetbets,ggv240p,# fear greed index is at 57? what the fuck. DOW going to 40k by Feb,t3_kj17ga,11
1608778853.0,2020-12-24,wallstreetbets,ggv370d,r/zjzstreetbets 😍,t3_kj17ga,10
1608779283.0,2020-12-24,wallstreetbets,ggv3yjz,Prob get a Margin call for my BABA calls 🙂,t3_kj17ga,11
1608781688.0,2020-12-24,wallstreetbets,ggv7y7z,"Who else is getting assfucked with me tomorrow by the Chinese government???  You would think after getting fucked over by Ali Baba FOUR TIMES I would have learned.  But nope, this 5th time is fucking it.  I'm out.  I'll take my final big loss from my calls.  I could have had that shit in MGNI or PERI.  I'm about to lose all my gains from those two stocks because I wouldn't give up on BABA.  Talk about dying on the sunk cost fallacy hill.",t3_kj17ga,11
1608781906.0,2020-12-24,wallstreetbets,ggv8axx,"Feels nice I’m not
The only
One around with BABA calls.... September 2021 285c! ($17k worth) 🥶🥶🥶",t3_kj17ga,12
1608781917.0,2020-12-24,wallstreetbets,ggv8blp,"#BEARS ARE ANNOYING AS FUCK

also poor 😂

🐻🤡🐻🤡🐻🤡🐻🌈🌈🌈🌈",t3_kj17ga,11
1608782323.0,2020-12-24,wallstreetbets,ggv8zw2,Suddenly the whole sub has BABA calls.. where do yall come from,t3_kj17ga,11
1608784337.0,2020-12-24,wallstreetbets,ggvc56y,Jesus christ we have mod drama now? Normies truly have flooded this place 😫,t3_kj17ga,10
1608784704.0,2020-12-24,wallstreetbets,ggvcpdm,Don’t forget to drink a cold glass of water before bed. Stay hydrated. 💦 👄,t3_kj17ga,10
1608785185.0,2020-12-24,wallstreetbets,ggvdfcg,[deleted],t3_kj17ga,11
1608785242.0,2020-12-24,wallstreetbets,ggvdiff,[deleted],t3_kj17ga,11
1608785264.0,2020-12-24,wallstreetbets,ggvdjn1,RIP BABA holders. Important lesson here - never invest in a company that falls out of favour with a dictatorship.,t3_kj17ga,11
1608785783.0,2020-12-24,wallstreetbets,ggvebud,"So is China just realizing how powerful and devastating a big tech monopoly could be to their hold on power over their citizens?

Seems like they only want to do this anti monopoly stuff to ensure their own power. They’ve seen how much pull large companies in the US have or could potentially have over government officials. They don’t want outside corruption in their already corrupt government. 

Maybe this is an outlandish drunken thought. Feel free to let me know.",t3_kj17ga,11
1608786237.0,2020-12-24,wallstreetbets,ggvf000,"You know what, actually working makes work feel way shorter.",t3_kj17ga,10
1608786251.0,2020-12-24,wallstreetbets,ggvf0rx,Lol robinhood analyst ratings have BABA as 97% buy,t3_kj17ga,11
1608760841.0,2020-12-24,wallstreetbets,ggu6eu7,Let’s go to r/politics instead,t1_ggu672a,151
1608760848.0,2020-12-24,wallstreetbets,ggu6fb9,[deleted],t1_ggu672a,31
1608761245.0,2020-12-24,wallstreetbets,ggu75df,"Honestly it’s just what would happen in any kind of “professional” environment without a check at the end of a stick for the individuals in it

How long would it take you to tell your coworkers to go fuck themselves if you didn’t have to tolerate them just to get your monthly tendie fuel",t1_ggu3epr,86
1608758038.0,2020-12-24,wallstreetbets,ggu19hr,If your dick game is as good as your trade game you’re fucked and not in a good way,t1_ggu0zyq,57
1608757403.0,2020-12-24,wallstreetbets,ggu03df,On god,t1_ggu02nw,59
1608757546.0,2020-12-24,wallstreetbets,ggu0cmy,It fell.,t1_ggu02nw,38
1608757513.0,2020-12-24,wallstreetbets,ggu0ak1,🤣,t1_ggu02nw,14
1608758157.0,2020-12-24,wallstreetbets,ggu1hgm,Fuck yeah. We need Greta to hold a press conference and all that climate talk needs to be ramped up,t1_ggu0umy,31
1608757573.0,2020-12-24,wallstreetbets,ggu0eec,dude back then companies didn‘t IPO at like 10B or more,t1_ggu05r2,92
1608758606.0,2020-12-24,wallstreetbets,ggu2b3e,$2 is still more than $0 🤦‍♀️,t1_ggu24gn,179
1608760416.0,2020-12-24,wallstreetbets,ggu5mnp,My ex-wife could do this with the free stock she gets from signing up for Robinhood.,t1_ggu24gn,35
1608775455.0,2020-12-24,wallstreetbets,ggux7le,"if this is wsb culture what do u think actual finance culture looks like

nothing new friend",t1_ggux4rf,18
1608759072.0,2020-12-24,wallstreetbets,ggu364w,*EOD sell off as WSB mod zjz sets to retire from the firm. Siting firm as “too fucking retarded” at the top level. Investors shaken by news.* -Market Watch,t1_ggu1xby,235
1608762533.0,2020-12-24,wallstreetbets,ggu9inz,Great we lose the best mod due to the actions of the mod who asks fantasy football advice more than posting in his own sub.,t1_ggu1xby,156
1608759933.0,2020-12-24,wallstreetbets,ggu4quc,"You’re 100% gay and I love you for it. Thanks for everything you’ve done on this sub. You’re fucking great and kicked ass at a thankless job. 

Happy cake day you retard.",t1_ggu1xby,82
1608760530.0,2020-12-24,wallstreetbets,ggu5u73,[deleted],t1_ggu1xby,81
1608766351.0,2020-12-24,wallstreetbets,ggugoy0,"Was about to post some DD.   Now I won't.

The good mods are what make this sub.  Let us know if you decide to move elsewhere.   We'll follow.",t1_ggu1xby,69
1608768747.0,2020-12-24,wallstreetbets,ggul0cb,"Well hook a brother up with a invite to the ""other"" wsb 😁",t1_ggu1xby,72
1608758522.0,2020-12-24,wallstreetbets,ggu25kg,"What the fuck man....

I vote zjz for top mod cut the bullshit out",t1_ggu1xby,125
1608775136.0,2020-12-24,wallstreetbets,gguwmtm,"Thanks for your involvement here. I don't post on this sub much anymore, but it's sad to see the bullshit continue.

When I was a mod for a few months, I was cleaning shit off the front page like I was a fucking internet janitor. Then that cocksucker fartek and stormwontpass castrated my admin rights without telling me, so I quit.

Best of luck in retirement. Hope the tendies are in your favor.",t1_ggu1xby,57
1608759440.0,2020-12-24,wallstreetbets,ggu3uma,subbed to wsb at the top 🤡,t1_ggu1xby,105
1608760934.0,2020-12-24,wallstreetbets,ggu6l4h,This sub has been running the market lately to absurd highs. This post is the beginning of the fall of r/wallstreetbets. The fall of this sub will allow the market to finally correct itself. This post will be economically historic.,t1_ggu1xby,56
1608759270.0,2020-12-24,wallstreetbets,ggu3jbm,What can we do to kick that mofo out and put you at the top? I’m YOLOing deep OTM calls on your career,t1_ggu1xby,46
1608760281.0,2020-12-24,wallstreetbets,ggu5du5,#wsb wipeout mode,t1_ggu1xby,48
1608768727.0,2020-12-24,wallstreetbets,ggukz4y,"Can I have your Robinhood game save file if you are done playing?  

I messed up early on my stat choices and my character can't get past any of the bosses..",t1_ggu1xby,41
1608758456.0,2020-12-24,wallstreetbets,ggu215q,Thank you for your service,t1_ggu1xby,76
1608759455.0,2020-12-24,wallstreetbets,ggu3vn8,"I've noticed a lot of the work you've put in for this sub and I really like the wsb gold website you created. I hope you can find a place where your work is actually appreciated, I'm sorry to see you're leaving.",t1_ggu1xby,33
1608768286.0,2020-12-24,wallstreetbets,gguk665,You dropped this. 👑,t1_ggu1xby,32
1608760230.0,2020-12-24,wallstreetbets,ggu5ahl,invite me to the secret WSB sub plz this place is going down the tubes,t1_ggu1xby,58
1608758675.0,2020-12-24,wallstreetbets,ggu2fp8,Puts on friendship.,t1_ggu1xby,29
1608761731.0,2020-12-24,wallstreetbets,ggu81dn,Go back go back I am confused. Why is the best mod going inactive? Dude we need you. That UNPOPULAR_  guy mod is great too. Is there anything we as members do to help?,t1_ggu1xby,25
1608769455.0,2020-12-24,wallstreetbets,ggumbbk,"Quick, post the illegal stuff",t1_ggu1xby,52
1608759106.0,2020-12-24,wallstreetbets,ggu38fz,thanks for the efforts of controlling the garbage!,t1_ggu1xby,22
1608761823.0,2020-12-24,wallstreetbets,ggu87kd,"Followed you since the swineflupandemic days, thanks for all you do brotha. Unfortunate this situation has played out this way once again",t1_ggu1xby,23
1608760572.0,2020-12-24,wallstreetbets,ggu5wzx,NO. NOT THIS! I OBJECT YOUR HONOR!,t1_ggu1xby,23
1608766754.0,2020-12-24,wallstreetbets,gguheva,The sub has felt like a marketing scheme for a while now.,t1_ggu1xby,22
1608771058.0,2020-12-24,wallstreetbets,ggup6t1,Love some good e-drama.,t1_ggu1xby,22
1608758781.0,2020-12-24,wallstreetbets,ggu2miv,We are so fucked,t1_ggu1xby,21
1608764458.0,2020-12-24,wallstreetbets,ggudd8y,Does this mean we can say the F word again?,t1_ggu1xby,22
1608758738.0,2020-12-24,wallstreetbets,ggu2jre,"Hey man I respect the hell out of what you've done. Take some time off, this isn't supposed to be a job.",t1_ggu1xby,21
1608773399.0,2020-12-24,wallstreetbets,gguthdv,But.. but.. you're the heart of WSB.,t1_ggu1xby,20
1608760530.0,2020-12-24,wallstreetbets,ggu5u7e,Call Ryan Cohen. He's a pro at hostile takeovers 😅,t1_ggu1xby,17
1608760564.0,2020-12-24,wallstreetbets,ggu5wif,"We didn’t really have much interactions but I’ve truly appreciated all your efforts here. You were a great mod. Man, I just wish you success in happiness in the real world. You did this community a lot of good and it will be missed.",t1_ggu1xby,20
1608764241.0,2020-12-24,wallstreetbets,gguczb3,Reddit has destroyed everything good about itself. WSB is next on the chopping block.,t1_ggu1xby,17
1608758477.0,2020-12-24,wallstreetbets,ggu22l1,Damn son. Thanks for trying king.,t1_ggu1xby,37
1608760236.0,2020-12-24,wallstreetbets,ggu5aw6,Let us know who to put a hit on boss 😎,t1_ggu1xby,18
1608760654.0,2020-12-24,wallstreetbets,ggu62jm,Full time lurker here. You shall be missedddddddddddd,t1_ggu1xby,17
1608762267.0,2020-12-24,wallstreetbets,ggu912g,Does this mean bears n bulls r fuk,t1_ggu1xby,17
1608763842.0,2020-12-24,wallstreetbets,gguc63a,See you Monday retard,t1_ggu1xby,19
1608777049.0,2020-12-24,wallstreetbets,ggv01lm,"Cool story bro.

But seriously, your hard work was definitely appreciated by people here. I hope one day this gets resolved and you’ll be back. Kiss mechafuckboy bot goodnight for me.",t1_ggu1xby,18
1608779743.0,2020-12-24,wallstreetbets,ggv4qk2,"someone jokingly posted /r/zjzstreetbets

i registered it, if you come there i'll turn it over",t1_ggu1xby,19
1608758677.0,2020-12-24,wallstreetbets,ggu2fsl,"Damn. So much drama on a sub where we’re all just trying to get rich. There’s already tons of shills here, can’t imagine what it’ll be like unmoderated.",t1_ggu1xby,18
1608759708.0,2020-12-24,wallstreetbets,ggu4bru,Is this why SPY sold off at EOD?,t1_ggu1xby,17
1608759736.0,2020-12-24,wallstreetbets,ggu4din,Thank You for Your service 🥺,t1_ggu1xby,17
1608760634.0,2020-12-24,wallstreetbets,ggu616h,Puts on WSB,t1_ggu1xby,18
1608761828.0,2020-12-24,wallstreetbets,ggu87xi,No mods no gods,t1_ggu1xby,17
1608758698.0,2020-12-24,wallstreetbets,ggu2h4n,"Fuck. :(. I don’t want this sub to go completely to shit. For what it’s worth, I appreciate your work. You are merely bisexual, not totally gay like the other mods.",t1_ggu1xby,36
1608759685.0,2020-12-24,wallstreetbets,ggu4afw,"Wait what? No, you were the best mod. I respect your decision though. Godspeed brother",t1_ggu1xby,36
1608761164.0,2020-12-24,wallstreetbets,ggu701l,"WTF, do users need to create a new sub? 

Is the sun gonna go to both ng but pump and dump schemes? I've made money off them and been burned by them, don't wanna see the content go to complete shit.",t1_ggu1xby,37
1608764087.0,2020-12-24,wallstreetbets,ggucoma,Have you considered writing a shitty book about your experiences as  WSB mod and peddling it on Amazon?,t1_ggu1xby,31
1608767351.0,2020-12-24,wallstreetbets,gguiisv,">We've run into another situation where the active mod team no longer trusts judgment and intentions of the person (people) at the top of the subreddit mod team. Judas 2.0.

Elaborate?? Were there changes that make you say fuck this shit?",t1_ggu1xby,16
1608774975.0,2020-12-24,wallstreetbets,gguwcbr,Start your own sub with blackjack and hookers. I'll be there.,t1_ggu1xby,15
1608760466.0,2020-12-24,wallstreetbets,ggu5pzf,Let’s make wsb2,t1_ggu1xby,13
1608765563.0,2020-12-24,wallstreetbets,ggufahi,Thanks for your hard work papa. 🥺,t1_ggu1xby,16
1608767678.0,2020-12-24,wallstreetbets,gguj3ie,Thanks man for all you've done,t1_ggu1xby,15
1608786201.0,2020-12-24,wallstreetbets,ggvey31,GAY MOD FLAIR US BEFORE U LEAVE FOR VALHALLA,t1_ggu1xby,14
1608765543.0,2020-12-24,wallstreetbets,gguf98z,No wonder the sub has turned into such spammy shit recently. Thanks for trying though,t1_ggu1xby,15
1608775931.0,2020-12-24,wallstreetbets,gguy290,[deleted],t1_ggu1xby,33
1608758710.0,2020-12-24,wallstreetbets,ggu2hyb,"First my calls die and the last good subreddit is going to die now to shitposters. 

Merry fucking Christmas 🎄",t1_ggu1xby,13
1608763862.0,2020-12-24,wallstreetbets,gguc7mo,What does this mean? I need Ja Rule on the phone,t1_ggu1xby,12
1608778724.0,2020-12-24,wallstreetbets,ggv2ysz,"Oh shit, this is bad. Let us know what we can do",t1_ggu1xby,12
1608783344.0,2020-12-24,wallstreetbets,ggvalsr,I’m gonna need an invite to the new sub big man. Thanks for all your hard work,t1_ggu1xby,14
1608765630.0,2020-12-24,wallstreetbets,ggufeqj,"**IMPORTANT PLEASE READ**

WSB MIGHT SHUT DOWN. LAST TIME A MOD QUIT WSB WAS SHUR DOWN.
EVERYONE RETREAT TO THE DISCORD SERVERS
THEY WILL TRY TO SILENCE OUR GME PLAY

REPOST THIS PLEASE AS MUCH AS YOU CAN.

STAY WINNING 🚀🚀🚀🚀
**********************************",t1_ggu1xby,47
1608758557.0,2020-12-24,wallstreetbets,ggu27ug,RIP WSB.... We will continue to buy FD's as the ship sinks in your honor.,t1_ggu1xby,11
1608759326.0,2020-12-24,wallstreetbets,ggu3n2l,"No not Mechafuckboy, hes the homie.",t1_ggu1xby,12
1608777881.0,2020-12-24,wallstreetbets,ggv1i7c,I'm starting to think I'm the only person here that hasn't actually interacted with a real mod.....,t1_ggu1xby,12
1608781037.0,2020-12-24,wallstreetbets,ggv6vrx,Pitchforks out bois!!!,t1_ggu1xby,12
1608794707.0,2020-12-24,wallstreetbets,ggvphcj,Pleas fly again,t1_ggu1xby,12
1608758513.0,2020-12-24,wallstreetbets,ggu24zq,Top is in,t1_ggu1xby,26
1608759228.0,2020-12-24,wallstreetbets,ggu3ggw,🅱️🅱️ ©️⛎Ⓜ️ 🔙 💔😿,t1_ggu1xby,23
1608759439.0,2020-12-24,wallstreetbets,ggu3ukd,"This guy was the ungayest mod, you will be missed 😫

Ps can you change my flair plz",t1_ggu1xby,23
1608769078.0,2020-12-24,wallstreetbets,ggullug,"Thanks for all your work, you are always my fave mod",t1_ggu1xby,22
1608772351.0,2020-12-24,wallstreetbets,ggurkbc,"The hero we need, but not the one we deserve.  Please start something new that is up to your values and I will follow",t1_ggu1xby,25
1608787399.0,2020-12-24,wallstreetbets,ggvgngw,"I appreciate your hard work. With that being said, reeeee fuck your bots and your dictatorship. We are freeee",t1_ggu1xby,23
1608759492.0,2020-12-24,wallstreetbets,ggu3y6m,Here I’ll suck u off on the way out,t1_ggu1xby,22
1608785081.0,2020-12-24,wallstreetbets,ggvd9n1,Please invite me to the new secret sub.,t1_ggu1xby,23
1608759058.0,2020-12-24,wallstreetbets,ggu3572,Brother no!  All mods are 🌈🌈 but not you.,t1_ggu1xby,11
1608760088.0,2020-12-24,wallstreetbets,ggu5171,See you tomorrow,t1_ggu1xby,11
1608760345.0,2020-12-24,wallstreetbets,ggu5hyw,Oh shit! Bye bye WSB was a pleasure!,t1_ggu1xby,12
1608761355.0,2020-12-24,wallstreetbets,ggu7cmc,"Thank you for the service and God speed retard, may you have all the tendies you will ever need",t1_ggu1xby,11
1608762209.0,2020-12-24,wallstreetbets,ggu8x83,mods so gay they create more animosity and gayness between one another than all of us normies,t1_ggu1xby,12
1608764511.0,2020-12-24,wallstreetbets,ggudgk5,Happy cake day retard. We’ll miss you,t1_ggu1xby,10
1608784169.0,2020-12-24,wallstreetbets,ggvbvq8,Throw me on the list of patrons if you start a new sub,t1_ggu1xby,10
1608769300.0,2020-12-24,wallstreetbets,ggum19s,[deleted],t1_ggulwpi,57
1608765179.0,2020-12-24,wallstreetbets,gguemeg,"Easy. 

Step 1: Noticing the individual tickers aren’t moving anywhere in your diversified portfolio so you begin to sell them for small profit or loss. Ie, index and etfs. 

Step 2: you begin to buy the individual stocks that was in those etfs that was over performing hoping to catch more upside. 

Step 3: You turn into option on those stocks because shares are moving to slow. 

Step 4: Realize you need more excitement in your life and trading is no longer interesting unless your portfolio goes +/- 10% daily. 

Step 5: Welcome home.",t1_ggu9xi3,12
1608760058.0,2020-12-24,wallstreetbets,ggu4z99,"Yeah, most explanations for stock movements are complete bullshit. Trying to pretend the market is a perfectly logical and rational place.",t1_ggu3zyy,30
1608760621.0,2020-12-24,wallstreetbets,ggu6096,What if u/zjz is the orange man 🤔,t1_ggu3ebv,15
1608758932.0,2020-12-24,wallstreetbets,ggu2wot,"Man I didn't even see the dip, I was taking a shit and then when I was done I had lost all my money",t1_ggu04wz,47
1608757350.0,2020-12-24,wallstreetbets,ggtzzvw,Russell 2000 says hi,t1_ggtzufi,18
1608790979.0,2020-12-24,wallstreetbets,ggvlc4x,Sus,t1_ggvla5b,13
1608757660.0,2020-12-24,wallstreetbets,ggu0k5q,"I donated $1,000 to the MMs today",t1_ggu0hvk,84
1608774800.0,2020-12-24,wallstreetbets,gguw0ya,ho lee fuk rip,t1_gguvwgf,19
1608777235.0,2020-12-24,wallstreetbets,ggv0dbt,"80 PLTR 
50 GME

It ain’t much but it’s honest work",t1_ggv087z,12
1608786235.0,2020-12-24,wallstreetbets,ggvezwv,You blew someone huh,t1_ggvey6z,18
1608791649.0,2020-12-24,wallstreetbets,ggvm4d2,"Dude, that’s fuckin hilarious",t1_ggvm2bs,14
1608758454.0,2020-12-24,wallstreetbets,ggu20zt,If it closes at 24.99 I’ll creampie myself,t1_ggu1woh,11
1608758499.0,2020-12-24,wallstreetbets,ggu241j,Comes with one share of apple,t1_ggu1snw,11
1608775929.0,2020-12-24,wallstreetbets,gguy22g,Merica,t1_gguxypy,14
1608783859.0,2020-12-24,wallstreetbets,ggvbelx,You drew a line on your feet?,t1_ggvb9sj,14
1608757898.0,2020-12-24,wallstreetbets,ggu102v,https://wendys-careers.com,t1_ggu0vcp,45
1608789923.0,2020-12-24,wallstreetbets,ggvk1ea,Fuck no take care yo self king 👑,t1_ggvjzhi,12
1608767889.0,2020-12-24,wallstreetbets,ggujgl2,"You’ll become financially independent with $100 a month!

LMAO",t1_gguizil,11
1608806243.0,2020-12-24,wallstreetbets,ggw06xd,You’re a retard and you’re gonna do it anyways,t1_ggw04kv,12
1608758213.0,2020-12-24,wallstreetbets,ggu1l4b,"Chickens with heads cut off, I swear",t1_ggu1h0v,21
1608793242.0,2020-12-24,wallstreetbets,ggvnx1s,Welcome to wsb after dark,t1_ggvnrtg,14
1608759326.0,2020-12-24,wallstreetbets,ggu3n06,"It's not the covid bill, but the defense bill (where he wanted section 230 repealed)",t1_ggu1its,12
1608765985.0,2020-12-24,wallstreetbets,ggug1an,"Holy shit, they’re not ready.",t1_ggu6eu7,64
1608759867.0,2020-12-24,wallstreetbets,ggu4m6a,"amzn's ipo market cap / valuation was 300 million in 1997, per this source

[https://www.benzinga.com/general/education/19/05/11704701/this-day-in-market-history-amazon-goes-public-at-18-per-share](https://www.benzinga.com/general/education/19/05/11704701/this-day-in-market-history-amazon-goes-public-at-18-per-share)",t1_ggu0eec,14
1608773035.0,2020-12-24,wallstreetbets,ggustp3,"Yeah, but she doesn't have to, because I take care of her.",t1_ggu5mnp,12
1608759825.0,2020-12-24,wallstreetbets,ggu4jcp,Bezinga notes options trading on r/wsb with bearish flag.,t1_ggu364w,33
1608761327.0,2020-12-24,wallstreetbets,ggu7ar3,Yes. Autistic children. Why is this a surprise?,t1_ggu5u73,32
1608773420.0,2020-12-24,wallstreetbets,ggutit3,If this sub goes private the entire stock market will be affected lmao,t1_ggugoy0,11
1608775497.0,2020-12-24,wallstreetbets,gguxabu,"Can confirm.

WSB became a worse place the day fartek (the infamous cousin of 🅱️artek) demoted Shmokes 🚬 back to normie status.",t1_gguwmtm,18
1608778254.0,2020-12-24,wallstreetbets,ggv25ia,"Reposting my comment from the other zjz appreciation thread:

Can you and zjz and fuzzy and the other old schoolers start an ACTUAL wallstreetbets sub that we neophytes have to perform dangerous and possibly homoerotic stunts to join?

I've lurked here since December last year. I've been actively following since February.  I've heard the legends from the oldschoolers about what WSB used to be.

I'm sorry I didn't discover it sooner. I'd like the chance to atone for my mistakes.

Pleas Reddit again.",t1_gguwmtm,27
1608759801.0,2020-12-24,wallstreetbets,ggu4hoz,"Only admins can, which has happened before but im not holding my breath",t1_ggu3jbm,22
1608762172.0,2020-12-24,wallstreetbets,ggu8uqr,[deleted],t1_ggu5ahl,11
1608760596.0,2020-12-24,wallstreetbets,ggu5yn5,He literally just called out the user lol,t1_ggu5aw6,15
1608761379.0,2020-12-24,wallstreetbets,ggu7eax,I feel like Dorothy pulling back the curtain,t1_ggu7ar3,15
1608759946.0,2020-12-24,wallstreetbets,ggu4rrs,You underestimate the power of of over 1.5 million retards,t1_ggu4hoz,29
1608760614.0,2020-12-24,wallstreetbets,ggu5ztv,Can't read,t1_ggu5yn5,27
