created,date,subreddit,id,body,parent_id,score
1604444539.0,2020-11-04,wallstreetbets,gb20ttq,Of course it's fucking green 😂😂😂,t3_jnhpwk,13
1604444732.0,2020-11-04,wallstreetbets,gb2173s,#BEARS R FUK,t3_jnhpwk,13
1604447755.0,2020-11-04,wallstreetbets,gb26teq,The way the entire country feels about this election is how i feel about my 0dte options every single day,t3_jnhpwk,13
1604449014.0,2020-11-04,wallstreetbets,gb291s3,"...I have a portfolio of calls. It’s finally happening.

limit down by open",t3_jnhpwk,13
1604453902.0,2020-11-04,wallstreetbets,gb2hna0,[deleted],t3_jnhpwk,14
1604455271.0,2020-11-04,wallstreetbets,gb2k4io,"**people who pronounce ""target"" as ""tar-jay"" are fucking assholes. prove me wrong.**",t3_jnhpwk,13
1604455473.0,2020-11-04,wallstreetbets,gb2kh9f,definitely going to be a large dump pre market,t3_jnhpwk,11
1604457995.0,2020-11-04,wallstreetbets,gb2oxaz,[deleted],t3_jnhpwk,15
1604460990.0,2020-11-04,wallstreetbets,gb2uc4o,"This map guy on CNN, John King, is a fucking weapon. Talk about finding your niche",t3_jnhpwk,12
1604461510.0,2020-11-04,wallstreetbets,gb2v9q3,"SINCE ALL THE BEARS ARE QUIET ILL ADMIT

YES I AM JACKED TO THE TITS IN VXX I ADMIT IT! 

😢",t3_jnhpwk,14
1604461538.0,2020-11-04,wallstreetbets,gb2vbho,Giving my girlfriend a stimulus package tonight,t3_jnhpwk,14
1604461614.0,2020-11-04,wallstreetbets,gb2vgdm,I’m dumping 50k into spy at open,t3_jnhpwk,14
1604462885.0,2020-11-04,wallstreetbets,gb2xogy,California voted blue.. shocker,t3_jnhpwk,13
1604463220.0,2020-11-04,wallstreetbets,gb2y8ov,Imagine  thinking you're going to get a good night rest tonight,t3_jnhpwk,14
1604464056.0,2020-11-04,wallstreetbets,gb2zmnv,"There is nothing worse than the sinking pit of fear that forms in your soul when **WSB starts overwhelmingly hyping your plays**

WSB always calls the top on a play. Always.",t3_jnhpwk,13
1604465091.0,2020-11-04,wallstreetbets,gb31chs,Contested election still might be in play. Gonna be a wild week and I can’t wait to lose money,t3_jnhpwk,13
1604465914.0,2020-11-04,wallstreetbets,gb32nyc,"The process to break a 269-269 tie is incredible.

Goes to house where each state gets one vote (not per rep, 1 per state)

Currently 26-24 GOP advantage but I believe it goes on newly elected congress. If one state flips to 25-25. They must stay locked in the room like they are voting on the Pope.

Some state would have to flip.

Senate picks VP",t3_jnhpwk,14
1604466039.0,2020-11-04,wallstreetbets,gb32vbx,The market doesn’t know who it wants,t3_jnhpwk,13
1604468055.0,2020-11-04,wallstreetbets,gb35zur,Biden gonna sacrifice Hunter live on air for PA,t3_jnhpwk,14
1604468936.0,2020-11-04,wallstreetbets,gb37ad9,poles... lol.,t3_jnhpwk,13
1604468937.0,2020-11-04,wallstreetbets,gb37aff,Here comes trumps Twitter fingers,t3_jnhpwk,13
1604469819.0,2020-11-04,wallstreetbets,gb38k3p,"If you all dont go to bed, santas not going to bring tendies from the north poll",t3_jnhpwk,13
1604469922.0,2020-11-04,wallstreetbets,gb38p9h,[deleted],t3_jnhpwk,13
1604471071.0,2020-11-04,wallstreetbets,gb3aazf,This thread is better than the politics thread tbh,t3_jnhpwk,13
1604475461.0,2020-11-04,wallstreetbets,gb3g1sj,RIP to the bulls who went to sleep when tech was up 4%,t3_jnhpwk,13
1604475606.0,2020-11-04,wallstreetbets,gb3g85a,Held my VIX calls knowing this shit would happen. Would give every dime to not have to hear this jackass speak ever again. Good job America you fucking rubes,t3_jnhpwk,12
1604475611.0,2020-11-04,wallstreetbets,gb3g8ew,Went to sleep thinking my $20k of puts were worthless. Just woke up and glad to see it was just a nightmare and we printing at open,t3_jnhpwk,12
1604478541.0,2020-11-04,wallstreetbets,gb3joh8,Fam just decide this election by duel with a gun from the 1800s,t3_jnhpwk,13
1604479410.0,2020-11-04,wallstreetbets,gb3klj5,Can we ban these fucking algos from the market,t3_jnhpwk,13
1604482607.0,2020-11-04,wallstreetbets,gb3nrqd,[deleted],t3_jnhpwk,13
1604484693.0,2020-11-04,wallstreetbets,gb3pupz,Been trading futures all night. Went from +10k to -50k to +5k now. Think I’ll call it here,t3_jnhpwk,13
1604465509.0,2020-11-04,wallstreetbets,gb320s0,If this is contested and we don’t know till next week bulls are actually mega fucked,t3_jnhpwk,24
1604470364.0,2020-11-04,wallstreetbets,gb39bk6,USA- where you can have more votes than someone else and still lose. 🤡🤡🤡,t3_jnhpwk,25
1604435925.0,2020-11-04,wallstreetbets,gb1j6jd,This is the dumbest pump I’ve ever seen,t3_jnhpwk,12
1604437297.0,2020-11-04,wallstreetbets,gb1m5ck,What a bull trap that was.,t3_jnhpwk,12
1604437353.0,2020-11-04,wallstreetbets,gb1m9lw,[deleted],t3_jnhpwk,12
1604450079.0,2020-11-04,wallstreetbets,gb2axmx,"Wow this is like watching futures, but for normies",t3_jnhpwk,10
1604450146.0,2020-11-04,wallstreetbets,gb2b1ts,Imagine being a bear calling for the apocalypse all weekend just to get fucking cucked. Will they ever learn??,t3_jnhpwk,10
1604450631.0,2020-11-04,wallstreetbets,gb2bwo9,**WHY THE FUCK ISNT KANYE IN THE LEAD?**,t3_jnhpwk,12
1604452196.0,2020-11-04,wallstreetbets,gb2eo3s,Futures are going crazy tonight what’s the news?,t3_jnhpwk,12
1604453550.0,2020-11-04,wallstreetbets,gb2h0t9,Wish Robinhood would just have a roll the dice option for a random 1DTE YOLO at 3:50PM,t3_jnhpwk,12
1604454386.0,2020-11-04,wallstreetbets,gb2iinj,Don’t look at futures if you have epilepsy,t3_jnhpwk,12
1604455237.0,2020-11-04,wallstreetbets,gb2k2bj,futures are sexually confused,t3_jnhpwk,13
1604457505.0,2020-11-04,wallstreetbets,gb2o1sa,Kanye really got people out here voting for him 😂😂💀😂💀,t3_jnhpwk,11
1604458515.0,2020-11-04,wallstreetbets,gb2puxs,How is the polling so fucking bad?,t3_jnhpwk,10
1604460815.0,2020-11-04,wallstreetbets,gb2u0qj,Instead of a fridge with a screen to trade stocks they should put a stock trading screen at the back of your oven - so you can conveniently kill yourself when youre done.,t3_jnhpwk,12
1604461634.0,2020-11-04,wallstreetbets,gb2vhn5,"So basically stock market is back on easy mode, weekly yolo spy calls and we will be straight",t3_jnhpwk,12
1604462969.0,2020-11-04,wallstreetbets,gb2xtha,[removed],t3_jnhpwk,11
1604463624.0,2020-11-04,wallstreetbets,gb2yx3z,"7pm: spy is up because biden is going to win! 
11pm: spy is up because trump is going to win!",t3_jnhpwk,12
1604463920.0,2020-11-04,wallstreetbets,gb2zemp,Bruh literally every channel has one dude controlling the large tv screen like he’s Vanna White,t3_jnhpwk,11
1604465301.0,2020-11-04,wallstreetbets,gb31osr,Futures are like that chick who goes crazy first week at college and let’s the whole crew run train,t3_jnhpwk,12
1604465803.0,2020-11-04,wallstreetbets,gb32hny,AND THE WINNER IS.....ALADEEN,t3_jnhpwk,12
1604465804.0,2020-11-04,wallstreetbets,gb32hra,It would be great if Trump just declared himself big Pres of the red states tonight and came out dressed like Colonel Sanders,t3_jnhpwk,12
1604465945.0,2020-11-04,wallstreetbets,gb32pt1,"All I know is that if Trump wins, there will be memes for the next decade about how the polls were wrong again",t3_jnhpwk,11
1604467274.0,2020-11-04,wallstreetbets,gb34skf,Chamath for President,t3_jnhpwk,12
1604467503.0,2020-11-04,wallstreetbets,gb355hq,New Jersey residents leaving this planet tonight. Blaze up homies!!!!,t3_jnhpwk,13
1604468933.0,2020-11-04,wallstreetbets,gb37a89,Poles,t3_jnhpwk,12
1604469057.0,2020-11-04,wallstreetbets,gb37gq5,lmao this fucking moron's gonna send futures to the core of the earth with these tweets,t3_jnhpwk,12
1604469321.0,2020-11-04,wallstreetbets,gb37ui3,Buying puts after that fake pump today was the best decision I've ever made. Donnie is about to tank this shit and start a civil war with this mail in ballot bullshit,t3_jnhpwk,12
1604469542.0,2020-11-04,wallstreetbets,gb3860h,Polish people in shambles,t3_jnhpwk,12
1604469618.0,2020-11-04,wallstreetbets,gb38a0m,"Glad I’m watching this shit
Unfold with my WSB homies. The smartest guys in the room.",t3_jnhpwk,12
1604470490.0,2020-11-04,wallstreetbets,gb39hsb,So you’re going to tell me all i had to do was get tech calls and win no matter what?,t3_jnhpwk,13
1604470856.0,2020-11-04,wallstreetbets,gb3a08h,Contested election incomiiinngggggggg,t3_jnhpwk,12
1604471115.0,2020-11-04,wallstreetbets,gb3ad3w,"Basically it comes down to PA, WI and MI.",t3_jnhpwk,13
1604471312.0,2020-11-04,wallstreetbets,gb3amrh,Nio tank.  You can't have three days up.  That's not fair. To my puts,t3_jnhpwk,12
1604473892.0,2020-11-04,wallstreetbets,gb3e2x5,Cash gang fuck yea.,t3_jnhpwk,12
1604474002.0,2020-11-04,wallstreetbets,gb3e7yz,"If one of these dildos campaigned on removing the pattern day trader restriction, this election would be over right now",t3_jnhpwk,13
1604474362.0,2020-11-04,wallstreetbets,gb3eoo6,"🥭 the kind of guy to think arriving late is a power move. Holy fuck, get your ass to the podium already",t3_jnhpwk,13
1604475328.0,2020-11-04,wallstreetbets,gb3fvs3,Imagine being a bull and seeing futures moon and going to bed with a erection about all the lambos your going to buy and then he wakes up and its circuit breaking drill team 6 fucking your mom type red 😆,t3_jnhpwk,12
1604478224.0,2020-11-04,wallstreetbets,gb3jbx3,"Man I’m going between feeling fucked and not fucked. 

Tomorrow I might be fucked, I might not be, too.",t3_jnhpwk,12
1604478935.0,2020-11-04,wallstreetbets,gb3k3ri,Where the fuck is Ja rule when you need him,t3_jnhpwk,12
1604479193.0,2020-11-04,wallstreetbets,gb3kdhr,Imagine if we didn’t have Covid and people were out at the bars/clubs during all this fun?,t3_jnhpwk,11
1604483029.0,2020-11-04,wallstreetbets,gb3o71y,Biden just took Wisconsin,t3_jnhpwk,12
1604483054.0,2020-11-04,wallstreetbets,gb3o7y2,"Surprise name on the ballot, Elon Musk for the Republican Party takes 90% of the vote and is crowned leader of the free world plus China. The market is up 180% and everybody cheers.",t3_jnhpwk,11
1604463311.0,2020-11-04,wallstreetbets,gb2ye7o,Watching CNN right now is like watching a 🌈 🐻 try to convince you their puts are going to print tomorrow when futures are up 3%,t3_jnhpwk,23
1604463842.0,2020-11-04,wallstreetbets,gb2z9zb,Trump winning with a projected 10% chance is the reason why we have gain porn posts on the stupidest fucking positions.,t3_jnhpwk,23
1604466314.0,2020-11-04,wallstreetbets,gb33aqy,# Id love a nice hot georgia girl to feed me chick-fil-a unsweetened iced tea from between her big tits,t3_jnhpwk,24
1604466778.0,2020-11-04,wallstreetbets,gb340p2,Politics sub is in full meltdown.,t3_jnhpwk,23
1604467295.0,2020-11-04,wallstreetbets,gb34trk,CONTESTED ELECTION!  PREPARE TO BE FUK TOMORROW!!!,t3_jnhpwk,23
1604449149.0,2020-11-04,wallstreetbets,gb29al3,"trump wins, stonks go up

biden wins, stonks go up

stonks only go up",t3_jnhpwk,23
1604461010.0,2020-11-04,wallstreetbets,gb2udh8,[deleted],t3_jnhpwk,22
1604466030.0,2020-11-04,wallstreetbets,gb32us7,Election talks going well,t3_jnhpwk,23
1604434777.0,2020-11-04,wallstreetbets,gb1gp4d,*YOU AINT GOT THE ANSWERS SWAY*,t3_jnhpwk,11
1604438362.0,2020-11-04,wallstreetbets,gb1oc6w,Who is cash gang?,t3_jnhpwk,11
1604438597.0,2020-11-04,wallstreetbets,gb1otqz,I have calls but being a Bear is so much more fun as a gambler. Red candles are so much longer and angrier and faster. Nothing like the rush of having puts on a giant dump.,t3_jnhpwk,11
1604438639.0,2020-11-04,wallstreetbets,gb1owxe,"I just realized that I keep TDA app in my entertainment folder rather than my finance folder on iPhone. 

That...that was a wake up call of sorts. 😬",t3_jnhpwk,12
1604438911.0,2020-11-04,wallstreetbets,gb1phnt,"First time i buy puts at the top, was nice, should do it more often",t3_jnhpwk,10
1604439707.0,2020-11-04,wallstreetbets,gb1r5cw,I am jacked to the tits for the election results. Gonna need some zzzquil tonight.,t3_jnhpwk,10
1604440539.0,2020-11-04,wallstreetbets,gb1sw3x,"**Important:**

The **day** after GW Bush election day, QQQ dropped 5.4%.

The **day** after Obama election day, QQQ dropped 5.5%.",t3_jnhpwk,10
1604442038.0,2020-11-04,wallstreetbets,gb1vwap,Can’t wait to burn money on 0 DTEs tomorrow,t3_jnhpwk,11
1604443344.0,2020-11-04,wallstreetbets,gb1yhpd,Haven't gotten a match on tinder for 2 months. I'm ugly AF!!,t3_jnhpwk,11
1604444511.0,2020-11-04,wallstreetbets,gb20ryb,"tech futures green

in ter est ing",t3_jnhpwk,10
1604447504.0,2020-11-04,wallstreetbets,gb26cqu,lol doomsayer bears are delusional,t3_jnhpwk,11
1604448833.0,2020-11-04,wallstreetbets,gb28pw9,Whoever sold me those puts fuck you,t3_jnhpwk,11
1604449907.0,2020-11-04,wallstreetbets,gb2ampq,Trump losses Florida market plus 10%,t3_jnhpwk,12
1604451903.0,2020-11-04,wallstreetbets,gb2e65z,Texas Blue?!,t3_jnhpwk,11
1604452571.0,2020-11-04,wallstreetbets,gb2facc,Not sure if commuting by helicopter to work or homeless by end of week =/,t3_jnhpwk,11
1604452732.0,2020-11-04,wallstreetbets,gb2fkkh,I highly repect you if you bought call/puts today and they're are still active,t3_jnhpwk,11
1604452773.0,2020-11-04,wallstreetbets,gb2fn6z,So Florida is for mango?,t3_jnhpwk,10
1604452994.0,2020-11-04,wallstreetbets,gb2g17a,Lol of course tech is green and I have tech puts. 🤡🤡🤡,t3_jnhpwk,10
1604453105.0,2020-11-04,wallstreetbets,gb2g8dq,2016 repeat,t3_jnhpwk,11
1604453729.0,2020-11-04,wallstreetbets,gb2hc7n,Lol wow San Antonio full Biden now,t3_jnhpwk,11
1604453843.0,2020-11-04,wallstreetbets,gb2hjif,Spy 325 at open,t3_jnhpwk,12
1604455117.0,2020-11-04,wallstreetbets,gb2jueo,Twitter is literally a cesspool. Dear god.,t3_jnhpwk,13
1604455935.0,2020-11-04,wallstreetbets,gb2la4l,Support group update for BABA call holders: it’s recovering in HK,t3_jnhpwk,11
1604456417.0,2020-11-04,wallstreetbets,gb2m4gb,Being a futures trader right now is like playing on Nightmare mode,t3_jnhpwk,13
1604456585.0,2020-11-04,wallstreetbets,gb2mf44,"[I'm not a conspiracy theorist, but this Senator is clearly a lizard person](https://i.imgur.com/qby7k0w.png)",t3_jnhpwk,11
1604457249.0,2020-11-04,wallstreetbets,gb2nlfx,This fella on cnn clicking how he can get to 270 is like me adjusting my crayons trying to justify my positions,t3_jnhpwk,11
1604457624.0,2020-11-04,wallstreetbets,gb2o9f5,Dude just picked his nose on Fox. He may have ate it.,t3_jnhpwk,10
1604459372.0,2020-11-04,wallstreetbets,gb2reqw,Tech is ripping. Holy shit,t3_jnhpwk,11
1604460268.0,2020-11-04,wallstreetbets,gb2t0rb,"+4% up on futures, swing down to -4% and then another up to end the day flat",t3_jnhpwk,10
1604460525.0,2020-11-04,wallstreetbets,gb2thtr,Holy fuck are my puts murdered,t3_jnhpwk,11
1604461403.0,2020-11-04,wallstreetbets,gb2v2x2,"How in the hell is nasdaq futures up 4%???

Wtf is going on.

I guess on Friday market assumed we would have no president and suddenly today it realised we will. Wtf is this.",t3_jnhpwk,11
1604461460.0,2020-11-04,wallstreetbets,gb2v6k7,"Be honest, who’s in puts?",t3_jnhpwk,10
1604462039.0,2020-11-04,wallstreetbets,gb2w7rr,Imagine if Nasdaq opened red.,t3_jnhpwk,9
1604462190.0,2020-11-04,wallstreetbets,gb2whb9,MMs are like “let’s tell these retards the election is gonna be crazy then let them get balls deep in 🌈🐻 puts and then BAM let’s moon bitches!”,t3_jnhpwk,12
1604462319.0,2020-11-04,wallstreetbets,gb2wplc,Wouldn’t it be crazy if trump won popular but biden got electoral?,t3_jnhpwk,12
1604462320.0,2020-11-04,wallstreetbets,gb2wpms,FUCK MY COVERED CALLS ARE GONNA GET ASSIGNED,t3_jnhpwk,10
1604462948.0,2020-11-04,wallstreetbets,gb2xs76,Why are metals dumping?  Because of the almighty dollar?,t3_jnhpwk,12
1604463248.0,2020-11-04,wallstreetbets,gb2yads,Are we going to the days of easy mode?,t3_jnhpwk,10
1604464082.0,2020-11-04,wallstreetbets,gb2zo5m,Boys I might’ve just made 100k from trump. Haven’t been watching what swing states he’s won but so far it sounds like all the ones I picked. So if he does win it’ll be bitter sweet lol,t3_jnhpwk,12
1604464170.0,2020-11-04,wallstreetbets,gb2zt8v,When does the looting start I’m asking for a friend who wants a new Xbox and ps5,t3_jnhpwk,11
1604464928.0,2020-11-04,wallstreetbets,gb312rr,Betting odds are starting to converge closer to even. NASDAQ moon backing off a tad. Hold on tight boyos.,t3_jnhpwk,12
1604465233.0,2020-11-04,wallstreetbets,gb31ksl,Imagine going to sleep an hour ago and waking up to red lmao,t3_jnhpwk,12
1604465404.0,2020-11-04,wallstreetbets,gb31urq,"Hey, nasdaq futes were up 5% at one point lol",t3_jnhpwk,10
1604465456.0,2020-11-04,wallstreetbets,gb31xqn,WAIT VXX COULD STILL PRINT HAHAHA,t3_jnhpwk,11
1604465459.0,2020-11-04,wallstreetbets,gb31xvz,Starting to think a straddle was the only reasonable play.,t3_jnhpwk,11
1604465622.0,2020-11-04,wallstreetbets,gb327bw,"Realize, at this point the market is slow to catch on, but I can't see either candidate conceding any time soon, and if Biden gets a surge of mail in ballots, its going to be absolute insanity in the market as Trump melts down. Buckle your seatbelt.",t3_jnhpwk,10
1604465704.0,2020-11-04,wallstreetbets,gb32bzl,Imagine being Nate Silver lmao. How do you recover after you had 4 years to make a more accurate model?,t3_jnhpwk,11
1604466253.0,2020-11-04,wallstreetbets,gb337ch,the only winner in all of this is big. fucking. tech.,t3_jnhpwk,10
1604466376.0,2020-11-04,wallstreetbets,gb33e7w,LOL. James Carvel just told MSNBC viewers to put the razor blades back in the cabinet,t3_jnhpwk,11
1604466678.0,2020-11-04,wallstreetbets,gb33v3f,People who bet Biden at +120 are the same people who bought 4/20 SPY 200p,t3_jnhpwk,11
1604467102.0,2020-11-04,wallstreetbets,gb34ixe,Ok but how are stimulus talks,t3_jnhpwk,11
1604467179.0,2020-11-04,wallstreetbets,gb34nay,"Legalized recreational, good for you New Jersey.     I’ve blunt cruised the NJ turnpike on many an occasion.",t3_jnhpwk,12
1604467537.0,2020-11-04,wallstreetbets,gb357fp,"All of this will be ruined by an angry mango tweet tomorrow, I can all but guarantee it",t3_jnhpwk,11
1604467569.0,2020-11-04,wallstreetbets,gb35986,People on cnn are so mad LMAO,t3_jnhpwk,10
1604468732.0,2020-11-04,wallstreetbets,gb36zfz,Biden talking now so he can go to bed get a few hours of sleep and be on for pre-market when it opens,t3_jnhpwk,10
1604468912.0,2020-11-04,wallstreetbets,gb37944,Poles haha,t3_jnhpwk,11
1604469413.0,2020-11-04,wallstreetbets,gb37z8g,"Today should prove the VIX is not a fucking entity that lives, breathes and understands volatility then assigns it a value. It’s just another human manipulated instrument. I’ve seen it do all kinds of contradictory shit 2020.",t3_jnhpwk,10
1604469609.0,2020-11-04,wallstreetbets,gb389kk,"**ONE THING IS CLEAR - EVERYTHING IS PRICED IN**

##EXCEPT SOYBEAN FUTURES",t3_jnhpwk,12
1604470072.0,2020-11-04,wallstreetbets,gb38wvq,"Ok as much as you love or bash Twitter, the fact the PRESIDENTIAL CANDIDATES of the US use it as their message relating platform is pretty crazy",t3_jnhpwk,11
1604470220.0,2020-11-04,wallstreetbets,gb394ex,I find NIO more attractive rn at $35 that when it was at $10 months ago,t3_jnhpwk,12
1604471533.0,2020-11-04,wallstreetbets,gb3axu1,"Michigan is really gonna take up to 3 days?! Smh
That shitty state is gonna stop us from making money on calls smh",t3_jnhpwk,11
1604472544.0,2020-11-04,wallstreetbets,gb3cbaz,georgia getting very close.,t3_jnhpwk,11
1604472904.0,2020-11-04,wallstreetbets,gb3cse4,"VIX, the perfect conditions are here, here to set you free...

Only once every hundred years can an investor experience this kind of volatility...",t3_jnhpwk,10
1604473167.0,2020-11-04,wallstreetbets,gb3d51x,Wow futures are really volatile tonight. Is there some news or event going on tn?,t3_jnhpwk,10
1604474028.0,2020-11-04,wallstreetbets,gb3e96c,Jesus Christ this dude is ALWAYS FUCKING LATE,t3_jnhpwk,11
1604474172.0,2020-11-04,wallstreetbets,gb3efyd,[deleted],t3_jnhpwk,11
1604474625.0,2020-11-04,wallstreetbets,gb3f0fe,[deleted],t3_jnhpwk,12
1604474952.0,2020-11-04,wallstreetbets,gb3feht,"here we go, calling it a fraud and futures shit the bed",t3_jnhpwk,11
1604474979.0,2020-11-04,wallstreetbets,gb3ffs6,"“This is a fraud on the American public”

“Frankly we did win this election”

Oh boy",t3_jnhpwk,12
1604475029.0,2020-11-04,wallstreetbets,gb3fibt,There it is. Mangos going to contest mail in ballots. RIP Spy,t3_jnhpwk,10
1604475112.0,2020-11-04,wallstreetbets,gb3fm8n,He claimed victory early huh. Guess my VXX calls will print after all. Puts on America,t3_jnhpwk,12
1604475294.0,2020-11-04,wallstreetbets,gb3fu9n,"Holy shit my FD puts might print!!!! 🌈🐻

Oh yeah also our democracy is dead",t3_jnhpwk,11
1604475492.0,2020-11-04,wallstreetbets,gb3g34x,As a dem I constantly get cucked. Come on you bastards You knew Trump was gonna come for the mail in votes this whole time I wouldn’t even have been mad if it was a blowout and Trump won but those mail in votes left are obviously majority for Biden,t3_jnhpwk,11
1604475504.0,2020-11-04,wallstreetbets,gb3g3oo,Oof Trump just fucked everything up,t3_jnhpwk,10
1604475804.0,2020-11-04,wallstreetbets,gb3ggz6,Trump was a bear all along,t3_jnhpwk,12
1604476187.0,2020-11-04,wallstreetbets,gb3gxro,"LMAO. Biden going to win by mail in and Trump contesting is the worst fucking scenario.

DUMP ITTTT",t3_jnhpwk,11
1604477639.0,2020-11-04,wallstreetbets,gb3invy,You’d think that vote counting would continue through the night. Not like it’s important or anything 🤣,t3_jnhpwk,11
1604480059.0,2020-11-04,wallstreetbets,gb3l9dy,RIP clean energy,t3_jnhpwk,11
1604481516.0,2020-11-04,wallstreetbets,gb3mpoc,Don’t ask why you’re not making money. Ask why your gaming chair isn’t good,t3_jnhpwk,11
1604481520.0,2020-11-04,wallstreetbets,gb3mpte,"Despite being a bear i want market to rally trump to contest elections just to see what headlines we will see to explain this rally.

Absolute comedic show 😂😂😂",t3_jnhpwk,11
1604481962.0,2020-11-04,wallstreetbets,gb3n59v,Wisconsin results in 25 min,t3_jnhpwk,10
1604483045.0,2020-11-04,wallstreetbets,gb3o7mh,Trump gonna blow a 3-1 lead?,t3_jnhpwk,11
1604489710.0,2020-11-04,wallstreetbets,gb3uwqj,"Uncertainty will tank the markets

Proceeds to pump regardless of the uncertainty with presidential elections",t3_jnhpwk,12
1604437040.0,2020-11-04,wallstreetbets,gb1llf8,🐻 stand back and stand bi 🌈,t3_jnhpwk,33
1604475158.0,2020-11-04,wallstreetbets,gb3focl,Holy fuck hes actually retarded.,t3_jnhpwk,40
1604443547.0,2020-11-04,wallstreetbets,gb1yw6n,Just bet my mom $100 Biden will win. She doesn't know it yet but she'll be funding my next gram of cocaine,t3_jnhpwk,22
1604455953.0,2020-11-04,wallstreetbets,gb2lb3e,[deleted],t3_jnhpwk,21
1604465252.0,2020-11-04,wallstreetbets,gb31lxo,##bulls busy trying to work out how to put the cork back in the champagne bottle 🤣,t3_jnhpwk,22
1604466995.0,2020-11-04,wallstreetbets,gb34cwk,Tulsi Gabbard is hot af,t3_jnhpwk,21
1604467188.0,2020-11-04,wallstreetbets,gb34nun,#PA and WI mail vote 0% counted. Trump is fuk.,t3_jnhpwk,21
1604471505.0,2020-11-04,wallstreetbets,gb3awh0,All this because someone shot a gorilla in Cincinnati RIP in peace Harambe 😫,t3_jnhpwk,21
1604452248.0,2020-11-04,wallstreetbets,gb2er2k,[deleted],t3_jnhpwk,20
1604436819.0,2020-11-04,wallstreetbets,gb1l4gn,Made 50 dollars today working a real job. This is the most money I have made in years. Who knew it was this easy,t3_jnhpwk,10
1604437214.0,2020-11-04,wallstreetbets,gb1lyv7,Crayons down,t3_jnhpwk,11
1604441794.0,2020-11-04,wallstreetbets,gb1vf1z,too much anxiety in the air,t3_jnhpwk,11
1604441872.0,2020-11-04,wallstreetbets,gb1vkm0,I yolo'd half my account into 11/4 spy puts this morning. Got pretty wrecked but I guess it could all come together depending on how tonight goes.,t3_jnhpwk,10
1604442368.0,2020-11-04,wallstreetbets,gb1wjtw,"The U.S. stock market experienced its second-best Election Day rally in history today, with the Dow Jones Industrial Average closing up more than 550 points or 2 percent

https://twitter.com/politico/status/1323747103403855877?s=21",t3_jnhpwk,11
1604444302.0,2020-11-04,wallstreetbets,gb20dcb,Erection time!,t3_jnhpwk,10
1604444522.0,2020-11-04,wallstreetbets,gb20soj,Mad Money starts **NOOOOOW**,t3_jnhpwk,9
1604444973.0,2020-11-04,wallstreetbets,gb21n8n,"Texas pump

***Edison Research poll shows 5 out of 10 Texas voters say it is more important to contain virus now even if it hurts the economy, 6 out of 10 voters say climate change is a serious problem***",t3_jnhpwk,10
1604446153.0,2020-11-04,wallstreetbets,gb23urq,hey guys i’m new here is it true that stonks only go up ?,t3_jnhpwk,9
1604446643.0,2020-11-04,wallstreetbets,gb24rcz,"All these election comments when they went out of their way to make a separate thread

This really is the sub of kids eating paste in the corner of the classroom isn't it",t3_jnhpwk,10
1604446846.0,2020-11-04,wallstreetbets,gb2553v,"I think we can all agree this year... has been 

L E G E N D A R Y",t3_jnhpwk,9
1604447162.0,2020-11-04,wallstreetbets,gb25q0h,Futures are the opium of this sub,t3_jnhpwk,11
1604448313.0,2020-11-04,wallstreetbets,gb27tub,Reporter on NBC sounds more nervous than me on my last Grindr date,t3_jnhpwk,11
1604448898.0,2020-11-04,wallstreetbets,gb28u7l,"""GameStop Is Having A TikTok Competition For Its Employees And One Of The Prizes Is 10 Extra Labor Hours""

[https://www.thegamer.com/gamestop-black-friday-hours/](https://www.thegamer.com/gamestop-black-friday-hours/)

 GME to $100 tomorrow!",t3_jnhpwk,10
1604448988.0,2020-11-04,wallstreetbets,gb29027,[removed],t3_jnhpwk,10
1604449425.0,2020-11-04,wallstreetbets,gb29s24,Holy shit the market actually priced in a Kanye win today,t3_jnhpwk,12
1604450040.0,2020-11-04,wallstreetbets,gb2av4t,Fuck who had vxx calls ? Aka I’m fucked,t3_jnhpwk,10
