created,date,subreddit,id,body,parent_id,score
1604009758.0,2020-10-30,wallstreetbets,gajgtr6,If the market tanks tomorrow and SNAP goes up I'm gonna cut my penis off and eat it,t3_jkhkw8,106
1604018506.0,2020-10-30,wallstreetbets,gajx1lg,"Futures drilling and I have to go to dinner with my girlfriends parents, If anyone is in the frisco, tex area, I’ll drop my location, hit me with your car",t3_jkhkw8,93
1604005231.0,2020-10-30,wallstreetbets,gaj7u2l,I think I’m done. Can I get the address to the nearest breadline and shelter?,t3_jkhkw8,77
1604020417.0,2020-10-30,wallstreetbets,gak0ifz,Holy shit. My boss just sent out an email that we can expect to work from home all of 2021. Calls on pajamas,t3_jkhkw8,63
1604004652.0,2020-10-30,wallstreetbets,gaj6n4p,Europoors just woke up from their fever dream and have their finger ready for open on the sell button,t3_jkhkw8,60
1604011659.0,2020-10-30,wallstreetbets,gajkg8n,Yolo’d into AAPL calls today. And didn’t sell,t3_jkhkw8,58
1604008288.0,2020-10-30,wallstreetbets,gajdxsb,"WSB Bulls: What idiot would buy puts after a -4% day?

Also WSB Bulls: Calls after 3% up day",t3_jkhkw8,110
1604002058.0,2020-10-30,wallstreetbets,gaj18qn,"I'm starting an electric car company. RIO. 


Retarded Investors Only.",t3_jkhkw8,156
1604010656.0,2020-10-30,wallstreetbets,gajijyb,"Watch the stimulus news come out now, everyone fuk",t3_jkhkw8,52
1604021625.0,2020-10-30,wallstreetbets,gak2qbu,Bears are gonna be sipping hot chocolate in their mansions and look outside and see a bunch of bulls trying to keep warm around a dumpster fire tomorrow lol,t3_jkhkw8,49
1604003542.0,2020-10-30,wallstreetbets,gaj4cbe,"AAPL bottom jeans - boots with the furrrrr

And the whole club was lookin at ER

SHE HIT THE FLOOR! Next thing you Know!

Shawty went low low LOW LOW low low low low",t3_jkhkw8,97
1604006048.0,2020-10-30,wallstreetbets,gaj9hgf,I should never have joined this sub. 😂🤣😰,t3_jkhkw8,88
1604011138.0,2020-10-30,wallstreetbets,gajjgyg,"I swear is 1,000,000$ to much to ask for like I’m fine living off 4% or 40,000$ a year in dividends",t3_jkhkw8,44
1604011814.0,2020-10-30,wallstreetbets,gajkqmi,If SPY breaches 320 tomorrow...this sub is toast.,t3_jkhkw8,41
1604012310.0,2020-10-30,wallstreetbets,gajlod6,"Walmart pulls guns from their inventories, citing Civil Unrest. Holy crap. That’s wild.",t3_jkhkw8,39
1604024377.0,2020-10-30,wallstreetbets,gak7nzp,Man i just wanna be rich man fuck,t3_jkhkw8,42
1604009966.0,2020-10-30,wallstreetbets,gajh8e5,[deleted],t3_jkhkw8,37
1604019294.0,2020-10-30,wallstreetbets,gajyh0v,keep losing money. hedged by having a day job 🤙🏻,t3_jkhkw8,37
1604023412.0,2020-10-30,wallstreetbets,gak5y17,Fuckin bull trap today was and I bought in like a retard.,t3_jkhkw8,33
1604029734.0,2020-10-30,wallstreetbets,gakgnos,"Earnings are like heroine. That first time you hit it’s *unbelievable*. Three months later your portfolio is passed out behind an Arby’s, and you’re still chasing the dragon.",t3_jkhkw8,37
1604002336.0,2020-10-30,wallstreetbets,gaj1tmq,"Beat earnings by 67% 



PLUMMETS",t3_jkhkw8,132
1604008046.0,2020-10-30,wallstreetbets,gajdgk1,Tomorrow is going to be the biggest red day in the past 3 months. End of month sell off + weekend sell off + election sell off + earnings were “eh” sell off..... jesus christ,t3_jkhkw8,151
1604011119.0,2020-10-30,wallstreetbets,gajjflh,One day investors will realize that Apple is a company that makes phones and laptops and not actually the backbone of the global economy.,t3_jkhkw8,35
1604014393.0,2020-10-30,wallstreetbets,gajpjzk,Buying discount AAPL shares in the a.m. for my retirement account 👨🏽‍🦳,t3_jkhkw8,30
1604016961.0,2020-10-30,wallstreetbets,gaju8qb,*chuckles* I’m in danger,t3_jkhkw8,29
1604020258.0,2020-10-30,wallstreetbets,gak07r6,"There goes my iPhone 12 savings down the drain in one day, thanks to Tim Cuck himself",t3_jkhkw8,29
1604020902.0,2020-10-30,wallstreetbets,gak1eky,"Bunch of people talking about circuit breakers,

Calls on circuit city",t3_jkhkw8,32
1604011103.0,2020-10-30,wallstreetbets,gajjeii,Omg. Lil Yachty dropped a song called “Coffin” on Friday the 23rd. We shoulda seen this drop coming. Fuck.,t3_jkhkw8,60
1604018295.0,2020-10-30,wallstreetbets,gajwnoj,"All right who’s fucked tomorrow? I’ll start.

🙋🏻‍♂️",t3_jkhkw8,65
1604015632.0,2020-10-30,wallstreetbets,gajrtzc,"Bears eating caviar with a chianti

Bulls eating helper without da hamburger",t3_jkhkw8,28
1604016622.0,2020-10-30,wallstreetbets,gajtmqk,"Just got my iphone 12. it feels like the previous iphone, really dont notice a difference except a bit nicer screen. no wonder my aapl calls are fukd",t3_jkhkw8,25
1604017044.0,2020-10-30,wallstreetbets,gajue86,I was always wanting wsb to make money but after the amount of hate I got today predicting the amzn and aapl crash I really hope some of those bulls get killed tomorrow 😎🔫,t3_jkhkw8,24
1604017198.0,2020-10-30,wallstreetbets,gajuoea,Comment volume is back. Where yall been,t3_jkhkw8,30
1604022501.0,2020-10-30,wallstreetbets,gak4b8o,[deleted],t3_jkhkw8,27
1604022598.0,2020-10-30,wallstreetbets,gak4hk1,"Some people have no heart. Seriously, selling me TWTR calls? The fuck man. How do you sleep at night?",t3_jkhkw8,25
1604025504.0,2020-10-30,wallstreetbets,gak9on6,"New Zealand just voted to legalize euthanasia but rejected legalization of recreational marijuana 

Based",t3_jkhkw8,25
1604043244.0,2020-10-30,wallstreetbets,gakw0y0,"Don’t worry bulls.  Stock market crashes only happens once in a blue moon...

Now let’s check the upcoming moon phase...oh shit.",t3_jkhkw8,27
1604043826.0,2020-10-30,wallstreetbets,gakwjxz,The market is only falling because Halloween is tomorrow. Investors are getting spooked,t3_jkhkw8,26
1604045475.0,2020-10-30,wallstreetbets,gaky0g6,If the Euroriches actually pump us to green by open... I will personally pay for 100 British people to get braces,t3_jkhkw8,25
1604030508.0,2020-10-30,wallstreetbets,gakhs22,"At 6 am tomorrow, I want all you retards to give your balls a good ol’ slap on the back for holding options on one of the most volatile weeks of the year.

Get fukt cash holders 🍆",t3_jkhkw8,25
1604002259.0,2020-10-30,wallstreetbets,gaj1ntn,So...only google survived.,t3_jkhkw8,49
1604017946.0,2020-10-30,wallstreetbets,gajw10l,Things were more fun when vix was hitting the 50s,t3_jkhkw8,23
1604039997.0,2020-10-30,wallstreetbets,gakszna,"**All these need to happen for us to go green tomorrow:**  
  
1. Vaccine pumps  
2. Stimulus talks  
3. Job Numbers  
4. GDP Numbers  
5. Declining Covid numbers tonight  
6. EU shutdowns lifted  
7. TikTok talks resume  
8. AMZN 30:1 split  
9. Fed money printer go brrrr  
10. Xi Jinping says, ""USA Numba One!""  
  
*Add any others you think might help us go green...*",t3_jkhkw8,24
1604016539.0,2020-10-30,wallstreetbets,gajthd8,The bull run after election will be epic,t3_jkhkw8,21
1604032211.0,2020-10-30,wallstreetbets,gakk3wh,I’ve got Spy puts and all this talk of Spy puts has me a little uneasy.....,t3_jkhkw8,23
1604042109.0,2020-10-30,wallstreetbets,gakuzh4,You know the tank is real when you dont see anymore bull is fuk comments,t3_jkhkw8,22
1604026991.0,2020-10-30,wallstreetbets,gakc9tf,"4/5 FAANG down after hours

Bulls: I could see us opening green

Are you guys smoking meth, posting on a strangers phone using McDonalds WiFi?",t3_jkhkw8,20
1604028642.0,2020-10-30,wallstreetbets,gakf03o,"If you are panicking about the market crashing tomorrow, if you are panicking about school/work/more shutdowns.... If you need to get anything off your mind, I welcome you to vent in this thread",t3_jkhkw8,22
1604050103.0,2020-10-30,wallstreetbets,gal22ka,I would like to say that I am NOT okay with this futures recovery,t3_jkhkw8,20
1604005061.0,2020-10-30,wallstreetbets,gaj7hky,tmrw will be my worst day ever,t3_jkhkw8,21
1604009176.0,2020-10-30,wallstreetbets,gajfp05,**I didn't like my money anyway**,t3_jkhkw8,20
1604010339.0,2020-10-30,wallstreetbets,gajhy28,Actually a chance spy hits $319 tomorrow 😅,t3_jkhkw8,21
1604020358.0,2020-10-30,wallstreetbets,gak0ehn,[deleted],t3_jkhkw8,20
1604020643.0,2020-10-30,wallstreetbets,gak0xfp,[deleted],t3_jkhkw8,21
1604022896.0,2020-10-30,wallstreetbets,gak50s5,sure glad i sold my SPY puts for TWTR calls. im a fucking clown 🤡,t3_jkhkw8,21
1604026589.0,2020-10-30,wallstreetbets,gakbkz4,On the farm this week. Just peed under the stars while reading your REEEEing. Nothing better.,t3_jkhkw8,21
1604028411.0,2020-10-30,wallstreetbets,gakemra,"Don’t sleep tonight so you’re lizard brain tomorrow.

No emotion = peak performance",t3_jkhkw8,20
1604031611.0,2020-10-30,wallstreetbets,gakjax4,"I'm not saying it's gonna happen again, because gambler's fallacy and all that.

But like, good lord, these futures are *identical* to tuesday night's futures. We dropped after hours until 6PM to like -1%, then we stopped and sorta went rangebound/flat/bleed up until we fell off a fucking cliff at 1am.

So far, the exact same thing has happened. We dropped until 6pm to like -1%, and now we are rangebound/flat/bleeding up.

If we fall off a cliff at 1am again, I'm gonna shake my fist at the MMs for pulling the same exact shit again.",t3_jkhkw8,20
1604034292.0,2020-10-30,wallstreetbets,gakmrol,"And when the bulls needed JPow most, he vanished...",t3_jkhkw8,21
1604037274.0,2020-10-30,wallstreetbets,gakq76a,"I’m a bull but I won’t downvote bears bc if you’re right, you’re right no matter how much I hate it 🤷🏼‍♀️ 
Also, have a good night tonight and don’t worry too much about tomorrow. I love you all, big hugs and thanks for making me feel like I have friends. 
No, I’m not a guy writing a girly message either.",t3_jkhkw8,21
1604038281.0,2020-10-30,wallstreetbets,gakr9ca,"It’s very unethical to want your economy to collapse just so you can get some tendies, but if I’m being honest, I want my economy to collapse just so I can get some tendies",t3_jkhkw8,20
1604038726.0,2020-10-30,wallstreetbets,gakrpqe,"75% of my portfolio in SPY,QQQ AND AAPL puts... in jacked to the tits but god damn it feels weird rooting for the world to burn... this 🌈 🐻 shit is really nihilistic...",t3_jkhkw8,20
1604038848.0,2020-10-30,wallstreetbets,gakru6r,Big wealth transfer happened over the last few days from bulls to me,t3_jkhkw8,20
1604039165.0,2020-10-30,wallstreetbets,gaks5t5,I’m going to shoot a load onto my face,t3_jkhkw8,20
1604039177.0,2020-10-30,wallstreetbets,gaks685,"I swear I am gonna laugh my ass off if the whole market tomorrow is deep in red but there is one lone green warrior not giving up...  
  
#SNAP",t3_jkhkw8,20
1604040545.0,2020-10-30,wallstreetbets,gaktin8,puts on robinhood servers in the morning,t3_jkhkw8,18
1604003835.0,2020-10-30,wallstreetbets,gaj4y98,"Down 70% on AAPL $150 C 1/15/21 before earnings, tomorrow probably +90% lol. At least I can hold 'em for a lil' while feeling the pain of theta as it swallows my RH portfolio to oblivion. 

#F",t3_jkhkw8,19
1604026690.0,2020-10-30,wallstreetbets,gakbr8l,guh.,t3_jkhkw8,19
1604004309.0,2020-10-30,wallstreetbets,gaj5xk2,The CEO of SPY needs to step down immediately,t3_jkhkw8,40
1604013785.0,2020-10-30,wallstreetbets,gajofm2,[deleted],t3_jkhkw8,42
1604017430.0,2020-10-30,wallstreetbets,gajv3le,Markets gonna tank 800 points tomorrow and my puts still won’t print,t3_jkhkw8,37
1604005154.0,2020-10-30,wallstreetbets,gaj7ogu,# Bulls withdrawing their $2.07 buying power and deleting their Robinhood accounts right now,t3_jkhkw8,73
1604005641.0,2020-10-30,wallstreetbets,gaj8o3l,I blame Dorsey’s gross beard.,t3_jkhkw8,18
1604013375.0,2020-10-30,wallstreetbets,gajno61,[deleted],t3_jkhkw8,19
1604021903.0,2020-10-30,wallstreetbets,gak38ax,Gonna withdraw the remaining $30 out of my robinhood account so if you see the market suddenly tank that’s probably why.,t3_jkhkw8,18
1604021962.0,2020-10-30,wallstreetbets,gak3c8q,"Wish this sub was age restricted, I like my retards 21+",t3_jkhkw8,16
1604025997.0,2020-10-30,wallstreetbets,gakajp8,Has anyone said “bulls r fuk” 500 times yet?,t3_jkhkw8,19
1604026230.0,2020-10-30,wallstreetbets,gakay6y,My only regret is not buying more spy puts 😢,t3_jkhkw8,18
1604026459.0,2020-10-30,wallstreetbets,gakbcrb,You guys who keep on playing 0DTEs are insane.,t3_jkhkw8,19
1604038628.0,2020-10-30,wallstreetbets,gakrm2v,Euroboys: Stand back and stand by,t3_jkhkw8,18
1604039217.0,2020-10-30,wallstreetbets,gaks7ok,Guys I can’t sleep with all this live porn,t3_jkhkw8,18
1604039289.0,2020-10-30,wallstreetbets,gaksaaj,"German WSB looking at this like

*SCHNITZEL! COME HEEAH! LOOK WHAT ZE AMERICANS HAVE DONE TO MY STREUSEL MONEY! NEIN!*",t3_jkhkw8,17
1604040255.0,2020-10-30,wallstreetbets,gakt8rb,Green by.... 🤡🤡🤡,t3_jkhkw8,18
1604043274.0,2020-10-30,wallstreetbets,gakw1xw,"if the election becomes a weeks or months long battle in the courts, RIP markets",t3_jkhkw8,18
1604002279.0,2020-10-30,wallstreetbets,gaj1pd0,"Say hello to ""IV CRUSH"" and ""PRICED IN""",t3_jkhkw8,55
1604012768.0,2020-10-30,wallstreetbets,gajmj9n,I guess destroying earnings is priced in,t3_jkhkw8,16
1604016039.0,2020-10-30,wallstreetbets,gajskno,Calls on antidepressants,t3_jkhkw8,17
1604022979.0,2020-10-30,wallstreetbets,gak567u,Opening sub 325 is almost a certainty at this point,t3_jkhkw8,15
1604023209.0,2020-10-30,wallstreetbets,gak5kzd,Probably more than a 50% chance that there is no peaceful transfer of power,t3_jkhkw8,17
1604023291.0,2020-10-30,wallstreetbets,gak5q9u,I don’t think tomorrow will be green,t3_jkhkw8,17
1604023854.0,2020-10-30,wallstreetbets,gak6qjj,Futures too high imo,t3_jkhkw8,17
1604026022.0,2020-10-30,wallstreetbets,gakalb2,"Pretty incredible to see my 12 hours worth of Apple Gains shit the bed in about 35 seconds, to see it happen live is pretty amazing",t3_jkhkw8,16
1604026620.0,2020-10-30,wallstreetbets,gakbmwu,"i just want to make enough profit to buy a fsd model s so i can fuck golddigging whores in the backseat while cruising on the freeway

im not asking for much",t3_jkhkw8,18
1604027967.0,2020-10-30,wallstreetbets,gakdw86,The people in this sub are the real deal,t3_jkhkw8,17
1604029938.0,2020-10-30,wallstreetbets,gakgyh7,[deleted],t3_jkhkw8,17
1604030939.0,2020-10-30,wallstreetbets,gakidor,[deleted],t3_jkhkw8,16
1604030944.0,2020-10-30,wallstreetbets,gakidxf,Just drove my NKLA truck to the store at the bottom of the hill. How am I gonna get home now?,t3_jkhkw8,17
1604032762.0,2020-10-30,wallstreetbets,gakku4f,The idea of skyscrapers is crazy,t3_jkhkw8,18
1604034249.0,2020-10-30,wallstreetbets,gakmpwr,Looks like yesterday was one big bull trap,t3_jkhkw8,18
1604038134.0,2020-10-30,wallstreetbets,gakr3sc,"Whenever such an event happens, bull or bear, we can all unanimously hope that some of these Instagram, TikTok and YouTube investors/channels get wiped the fuck out!",t3_jkhkw8,17
1604038344.0,2020-10-30,wallstreetbets,gakrbon,Trump is probably sweating bullets right now,t3_jkhkw8,18
1604038375.0,2020-10-30,wallstreetbets,gakrcty,"Gotta hand it to the market makers. Well played!  
  
On Wednesday, there was a coordinated dump, especially around close, making a lot of people bearish.  
  
Today, there was a coordinated but weak pump almost all day, making a lot of people bullish.  
  
**Snip snap snip snap snip snap. You have no idea the physical toll that so many reversals take on a person!**",t3_jkhkw8,16
1604002271.0,2020-10-30,wallstreetbets,gaj1oqn,That dude who said 1700c 10/30 on GOOG was free money - getting bailed tf out lmao,t3_jkhkw8,35
1604011443.0,2020-10-30,wallstreetbets,gajk1mj,I don’t think tomorrow will be green,t3_jkhkw8,35
1604004929.0,2020-10-30,wallstreetbets,gaj77uo,"If I had a gun with two bullets and I was in a room with Hitler, Bin Laden and Tim Apple, I would shoot Tim Apple twice",t3_jkhkw8,75
1604004568.0,2020-10-30,wallstreetbets,gaj6gsm,"double circuit breaker tomorrow

trust me i’m an electrical engineer",t3_jkhkw8,45
1604006771.0,2020-10-30,wallstreetbets,gajaxi1,"This is why you never play earnings. AMZN beats expectations by 37% and still goes down. You can be wrong even when you're right, the risk is not worth the reward.",t3_jkhkw8,48
1604038886.0,2020-10-30,wallstreetbets,gakrvkx,I maaaaay retire tomorrow at the age of 30,t3_jkhkw8,15
1604039017.0,2020-10-30,wallstreetbets,gaks0cq,[deleted],t3_jkhkw8,16
1604047155.0,2020-10-30,wallstreetbets,gakzhxt,"Shorting the market should not feel this good🤔, its tickling my sphincter🤐... oh God, No, its happening....🌈🐻....",t3_jkhkw8,16
1604002683.0,2020-10-30,wallstreetbets,gaj2jqo,10 moves. All wrong. 10. This hurts,t3_jkhkw8,15
1604010005.0,2020-10-30,wallstreetbets,gajhb19,"ControlTheNarrative wasn't wrong, he was just a couple years early.",t3_jkhkw8,17
1604015658.0,2020-10-30,wallstreetbets,gajrvon,Anyone else hate those youtubers who put fake ass reactions of themselves in their thumbnails? That fedora wearing cuck is the worst,t3_jkhkw8,15
1604016979.0,2020-10-30,wallstreetbets,gaju9vp,"Can spy please continue dumping, i have puts",t3_jkhkw8,15
1604019122.0,2020-10-30,wallstreetbets,gajy5ze,Who thinks tomorrow will be even bloodier than yesterday? (At least for tech),t3_jkhkw8,15
1604022383.0,2020-10-30,wallstreetbets,gak43je,"For all we know this shit could open +2% 
All I’m saying is don’t count your chickens",t3_jkhkw8,16
1604022985.0,2020-10-30,wallstreetbets,gak56jd,AZKABAN MARKET DOWN 2% AND DROPPING,t3_jkhkw8,16
1604024894.0,2020-10-30,wallstreetbets,gak8kpt,320 is now lava. If we get there we either bounce off it like Mario or we drown and burn like Minecraft steve,t3_jkhkw8,16
1604025762.0,2020-10-30,wallstreetbets,gaka4vk,God I would have so much more money if I never had discovered WSB. The friendships were worth it though... I think,t3_jkhkw8,16
1604025816.0,2020-10-30,wallstreetbets,gaka899,"“ and If you zoom out to the weekly, you’ll see the bearish pattern known as “stairway to hell””",t3_jkhkw8,17
1604026695.0,2020-10-30,wallstreetbets,gakbrkq,Only 1 earnings report can save us and that’s PRPL. It’s a true indicator of economic recovery.,t3_jkhkw8,15
1604029483.0,2020-10-30,wallstreetbets,gakgacx,spy up 7% in zamunda,t3_jkhkw8,14
1604032360.0,2020-10-30,wallstreetbets,gakkb1n,2 years into the 15 day lockdown: S&P passes the 600 mark on vaccine hopes. Both parties are hopeful to approve a stimulus soon.,t3_jkhkw8,17
1604035287.0,2020-10-30,wallstreetbets,gakny7k,"Bears at 230 pm yesterday: Call an ambulance!

Bears at 300pm yesterday: BUT NOT FOR ME!",t3_jkhkw8,14
1604035353.0,2020-10-30,wallstreetbets,gako0xu,[deleted],t3_jkhkw8,15
1604035690.0,2020-10-30,wallstreetbets,gakof6i,Why does making money off puts feel a lot more satisfying,t3_jkhkw8,15
1604035829.0,2020-10-30,wallstreetbets,gakokzi,"$306.90 is the circuit breaker for tomorrow in case anyone is wondering.

as soon as the talking heads on CNBC started talking about how they were all reloading their positions i knew this shit was gonna keep drilling",t3_jkhkw8,15
1604036829.0,2020-10-30,wallstreetbets,gakppf4,"$5k YOLO, no problem.

$14/month Netflix, no money.",t3_jkhkw8,14
1604037358.0,2020-10-30,wallstreetbets,gakqaff,Spy ceo said the n word on twitter ah apparently,t3_jkhkw8,15
1604038894.0,2020-10-30,wallstreetbets,gakrvvl,"Bears: fuck yeah my puts are gonna print fucking hard

Also Bears: damn, my 401k is going to take a major hit

I am a gay bear",t3_jkhkw8,15
1604038970.0,2020-10-30,wallstreetbets,gakrync,Ppl who are sleeping through this rn lmao ..,t3_jkhkw8,15
1604040250.0,2020-10-30,wallstreetbets,gakt8kk,WATCH THE GREAT RED WAVE,t3_jkhkw8,14
1604041771.0,2020-10-30,wallstreetbets,gakuo5a,[deleted],t3_jkhkw8,15
1604043150.0,2020-10-30,wallstreetbets,gakvxvv,GOOD MORNING POOR STREET BETS!!! 😂😂😂,t3_jkhkw8,16
1604043274.0,2020-10-30,wallstreetbets,gakw1y1,If we break through this level of support shit could get super wild.,t3_jkhkw8,14
1604044521.0,2020-10-30,wallstreetbets,gakx62c,Tomorrow I'll time the bottom. Lately I've been very succesfull with it. My trading account went up to -94%,t3_jkhkw8,14
1604002170.0,2020-10-30,wallstreetbets,gaj1h4r,"Google beats by 46%, absolutely takes off. AMZN beats by 65%, drops. After getting screwed on UPS and ETSY calls I'm definitely done playing earnings",t3_jkhkw8,57
1604002408.0,2020-10-30,wallstreetbets,gaj1yy1,Tomorrow: Praying for SPY 325 and then masturbating all fucking day.,t3_jkhkw8,12
1604003755.0,2020-10-30,wallstreetbets,gaj4s8t,Apple should’ve included the Charger with their iPhones. Rip,t3_jkhkw8,15
1604004610.0,2020-10-30,wallstreetbets,gaj6jzz,Anyone down more than 10k this year?,t3_jkhkw8,13
1604005833.0,2020-10-30,wallstreetbets,gaj91xt,Sector rotation into the bread line,t3_jkhkw8,15
1604008317.0,2020-10-30,wallstreetbets,gajdzwk,They always post some goofy ass looking photo of Bezos when Amazon beats,t3_jkhkw8,14
1604008880.0,2020-10-30,wallstreetbets,gajf3zq,HTZ about to become “Hertz Pharmaceuticals”,t3_jkhkw8,15
1604011346.0,2020-10-30,wallstreetbets,gajjv0n,"Munchkin dump

***US Treasury Secretary Mnuchin says he spoke with House Speaker Pelosi nearly everyday for the last month and a half, adds letter he received from her was a political stunt, according to Fox News***",t3_jkhkw8,12
1604011395.0,2020-10-30,wallstreetbets,gajjyd8,"Hey

^Hey ^guys

*psst*


^^bullrfuk",t3_jkhkw8,15
1604014881.0,2020-10-30,wallstreetbets,gajqgd2,"Sept 4th I purchase $8,200 worth of gold and silver leaps. Today they are worth $2,063. I had a better time being in Tanker gang.",t3_jkhkw8,15
1604016641.0,2020-10-30,wallstreetbets,gajtnwh,"3 days from now, it will be dark by 5 pm",t3_jkhkw8,16
1604017872.0,2020-10-30,wallstreetbets,gajvw7a,"Acquire positions, then do dd",t3_jkhkw8,15
1604021590.0,2020-10-30,wallstreetbets,gak2o2a,"""Green by morning and btfd"" only works when Uncle Sam opens his checkbook with that stimmy and he ain't opening shyte until next year

🤡",t3_jkhkw8,12
1604023287.0,2020-10-30,wallstreetbets,gak5q21,"Cash gang ready to deploy life savings tomorrow, sir.",t3_jkhkw8,14
1604023743.0,2020-10-30,wallstreetbets,gak6jei,"Remember: **there's always another day**

There is nothing better than 0 overnight carry risk

Maintain your position sizes and be careful about going too far into a directional play

If you missed a $-10 yesterday, have faith there are countless +/- 3% days left",t3_jkhkw8,14
1604024578.0,2020-10-30,wallstreetbets,gak80t0,Futures only matter when they're red and I have puts,t3_jkhkw8,14
1604025738.0,2020-10-30,wallstreetbets,gaka3f0,"💴💴💴

Here’s some digital money for you retards. Spend these wisely",t3_jkhkw8,14
1604027983.0,2020-10-30,wallstreetbets,gakdx6r,"Woo boy is it bearish in here - rightfully so, but damn",t3_jkhkw8,15
1604028896.0,2020-10-30,wallstreetbets,gakfedv,"My Friend ""Wow, you have been investing since late March 2020?  You must have made a killing off the Markets Recovery."" Me  ""I made a killing multiple times and got killed even more""",t3_jkhkw8,14
1604029242.0,2020-10-30,wallstreetbets,gakfx7v,The Falcons won a game for once. Def will be red tomorrow,t3_jkhkw8,14
1604029559.0,2020-10-30,wallstreetbets,gakgef8,Tbh we won’t know anything until we see Zimbabwe futures,t3_jkhkw8,13
1604030622.0,2020-10-30,wallstreetbets,gakhxts,The pure joy of gambling on weeklies options for earnings is indescribable,t3_jkhkw8,13
1604031630.0,2020-10-30,wallstreetbets,gakjbvw,Is having a bee sting your muscles a good way to get swole? Asking for a friend.,t3_jkhkw8,13
1604032933.0,2020-10-30,wallstreetbets,gakl26h,Tomorrow is gonna be so fucking volatile. Mad swings for sure,t3_jkhkw8,13
1604034100.0,2020-10-30,wallstreetbets,gakmjdc,BULLS R FUK!,t3_jkhkw8,14
1604034506.0,2020-10-30,wallstreetbets,gakn0tt,“Markets down big due to the uncertainty of a peaceful transfer of power”,t3_jkhkw8,14
1604037504.0,2020-10-30,wallstreetbets,gakqg0v,jpow went to get a pack of cigarettes 2 months ago and never came back,t3_jkhkw8,15
1604038278.0,2020-10-30,wallstreetbets,gakr97m,Cmon bulls you gotta admit this is more exciting,t3_jkhkw8,15
1604039214.0,2020-10-30,wallstreetbets,gaks7l2,#VIX 100 EOD,t3_jkhkw8,14
1604039426.0,2020-10-30,wallstreetbets,gaksfc1,Gonna join the boy scout lawsuit and tell them the scout leader fingered my butthole,t3_jkhkw8,14
1604039520.0,2020-10-30,wallstreetbets,gaksip8,Anyone holdings calls with Robinhood... App will probably be down all day tomorrow. Enjoy your $20 Amazon gift card though!,t3_jkhkw8,14
1604040021.0,2020-10-30,wallstreetbets,gakt0g7,These futures are giving me flashbacks. Too bad I haven’t bought a put since March.,t3_jkhkw8,14
1604040060.0,2020-10-30,wallstreetbets,gakt1us,[deleted],t3_jkhkw8,14
1604041251.0,2020-10-30,wallstreetbets,gaku6p6,if spy doesn’t trigger a circuit breaker then it ain’t black,t3_jkhkw8,15
1604041520.0,2020-10-30,wallstreetbets,gakufnh,"if euro pumps this

I am gonna watch a soccer game",t3_jkhkw8,14
1604043146.0,2020-10-30,wallstreetbets,gakvxr9,I’ve felt so numb since March. I need VIX at 80 so I can feel again.,t3_jkhkw8,14
1604046754.0,2020-10-30,wallstreetbets,gakz59u,Holy fuck after that stretch in October where the market went full retard and futures were up 2-3% every night and I got my 🌈🐻 ass handed to me this feels like that scene from Shawshank redemption at the end where he climbs out of the sewer pipe covered in poop,t3_jkhkw8,15
1604002482.0,2020-10-30,wallstreetbets,gaj24ho,Tomorrow is gonna be Big Red boys. Where my gang at?,t3_jkhkw8,30
1604017813.0,2020-10-30,wallstreetbets,gajvsd3,"Nightmare scenario: Biden wins, Trump refuses to concede.

Priced in.",t3_jkhkw8,29
