created,date,subreddit,id,body,parent_id,score
1606893746.0,2020-12-02,wallstreetbets,gecj0lr,Pfizer/BioNTech vaccine approved by the UK regulator. Big green candle on futures.,t3_k4u5f8,13
1606894300.0,2020-12-02,wallstreetbets,gecjmr9,Make Chinese stocks great again,t3_k4u5f8,14
1606897149.0,2020-12-02,wallstreetbets,gecmp7g,Green by open?,t3_k4u5f8,12
1606897793.0,2020-12-02,wallstreetbets,gecncqm,PLTR main net 2.0 launch today...moon,t3_k4u5f8,13
1606898341.0,2020-12-02,wallstreetbets,gecnws1,[deleted],t3_k4u5f8,14
1606904998.0,2020-12-02,wallstreetbets,gecu21f,The only thing I know for sure is if our world ends both cockroaches and nkla will continue,t3_k4u5f8,13
1606905563.0,2020-12-02,wallstreetbets,gecukg0,"Is BB really the new meme such stock? What a time to be alive. 

Also the time is 5:39AM. Gym in 15 mins fellow tards. Today is leg day",t3_k4u5f8,13
1606906335.0,2020-12-02,wallstreetbets,gecvabs,"Yesterday I made $3.1K trading. I also cut part of my thumb off at work yesterday. 

*Now this is podracing!*",t3_k4u5f8,12
1606863534.0,2020-12-02,wallstreetbets,geb5v9j,I can’t believe how many are already dropping out of THC🐝 The DD specifically said it wouldn’t have any real movement until at least Dec 3. A bunch of paper hands in this bitch,t3_k4u5f8,39
1606857824.0,2020-12-02,wallstreetbets,geau394,RIP to my niggas who got left holding the bag on EV companies and PLTR...,t3_k4u5f8,48
1606857680.0,2020-12-02,wallstreetbets,geatsej,"I'm gonna need NIO and PLTR to stop acting like little bitches, k thx",t3_k4u5f8,11
1606857949.0,2020-12-02,wallstreetbets,geauctg,Yoo what's up counts!! I'm back after a 3 month hiatus. I went to work the oil fields now I'm back for my 3rd attempt at freedom. What are the current and new meme stocks?,t3_k4u5f8,13
1606858290.0,2020-12-02,wallstreetbets,geav2od,Damn I lost a lot today,t3_k4u5f8,12
1606858305.0,2020-12-02,wallstreetbets,geav3t4,"Legend has it that the Robinhood app turns green when the stocks you buy go up. Can anyone confirm this? I wouldn’t know, I’m retarded",t3_k4u5f8,12
1606858343.0,2020-12-02,wallstreetbets,geav6md,A sad day for memes,t3_k4u5f8,11
1606861092.0,2020-12-02,wallstreetbets,geb0z5g,"Meme holders, stand back and stand by",t3_k4u5f8,11
1606861304.0,2020-12-02,wallstreetbets,geb1ey5,If I could buy calls on DK Metcalf I would,t3_k4u5f8,12
1606863894.0,2020-12-02,wallstreetbets,geb6klm,Holy fuck y'all bears got me scared af. Made 17k in the past 2 weeks. Think I may sell off everything in the morning and take what I have and chill. Yall some scary fuckers right now,t3_k4u5f8,13
1606865347.0,2020-12-02,wallstreetbets,geb9c7b,perma bulls how we feelin?,t3_k4u5f8,12
1606865706.0,2020-12-02,wallstreetbets,geba09q,How did this sub suddenly get bearish? Guys we have to stay stomping bulls if we ever want a real correction,t3_k4u5f8,11
1606865893.0,2020-12-02,wallstreetbets,gebacv1,"Made $600 today, not bad.",t3_k4u5f8,12
1606866250.0,2020-12-02,wallstreetbets,gebb0ny,TSLA up a whopping 3% for the day and people be crying about -1% after hours lol,t3_k4u5f8,12
1606866769.0,2020-12-02,wallstreetbets,gebbyyh,AAPL 130 pls,t3_k4u5f8,12
1606866877.0,2020-12-02,wallstreetbets,gebc602,Back to tech gang?,t3_k4u5f8,12
1606868414.0,2020-12-02,wallstreetbets,gebextg,TSLA is wedging up for another big move 🚀🚀🚀,t3_k4u5f8,12
1606869609.0,2020-12-02,wallstreetbets,gebh2sf,This may be the dumbest move I’ve ever made but I’m getting Tesla puts this week.,t3_k4u5f8,11
1606869637.0,2020-12-02,wallstreetbets,gebh4l5,GME poppin off ?,t3_k4u5f8,12
1606871502.0,2020-12-02,wallstreetbets,gebkhwh,My leap account from 7k is at 46k . Pulling 30k tomorrow then starting back low before I lose it all,t3_k4u5f8,11
1606871885.0,2020-12-02,wallstreetbets,gebl6qm,There’s probably people in this sub that have never even heard of blackberry before... lol,t3_k4u5f8,11
1606871933.0,2020-12-02,wallstreetbets,gebl9tb,"""There's an old saying in GME — I know it's in PLTR, probably in GME — that says, fool me once, shame on — shame on you. Fool me — you can't get fooled again."" -Dubya",t3_k4u5f8,12
1606874847.0,2020-12-02,wallstreetbets,gebqi4m,PLTR $40 on the Jupiter stock exchange 🚀🚀,t3_k4u5f8,11
1606875425.0,2020-12-02,wallstreetbets,gebrjd5,Imagine actually cashing out on most of your PLTR calls over the last few weeks to then put those gains into GME at the top. My brain is telling me I’m a fucking dumbass but my body my body is telling me yesssssss,t3_k4u5f8,13
1606876728.0,2020-12-02,wallstreetbets,gebtwqn,"SHOP 1200 12/31C

AMZN 3500 12/31C

TSLA 600 12/18C

Long live the bull market.",t3_k4u5f8,11
1606876814.0,2020-12-02,wallstreetbets,gebu2hs,"lmao I never seen this before   


[https://twitter.com/realDonaldTrump/status/258640349872926720?ref\_src=twsrc%5Etfw%7Ctwcamp%5Etweetembed%7Ctwterm%5E258640349872926720%7Ctwgr%5E%7Ctwcon%5Es1\_&ref\_url=https%3A%2F%2Fwww.huffpost.com%2Fentry%2Frobert-pattinson-talks-trump-tweets\_n\_5991d173e4b09071f69b8768](https://twitter.com/realDonaldTrump/status/258640349872926720?ref_src=twsrc%5Etfw%7Ctwcamp%5Etweetembed%7Ctwterm%5E258640349872926720%7Ctwgr%5E%7Ctwcon%5Es1_&ref_url=https%3A%2F%2Fwww.huffpost.com%2Fentry%2Frobert-pattinson-talks-trump-tweets_n_5991d173e4b09071f69b8768)",t3_k4u5f8,12
1606877000.0,2020-12-02,wallstreetbets,gebuf1x,Automod told me a secret but said I can't tell any of you😎🧠,t3_k4u5f8,12
1606877973.0,2020-12-02,wallstreetbets,gebw7h8,THC 🍎might be the new 🐝,t3_k4u5f8,12
1606878097.0,2020-12-02,wallstreetbets,gebwfhx,Night time WSB > Day time WSB,t3_k4u5f8,13
1606879002.0,2020-12-02,wallstreetbets,geby0kk,WE LIVE IN A CASINO,t3_k4u5f8,12
1606880279.0,2020-12-02,wallstreetbets,gec07a5,"Stairs up, elevator down",t3_k4u5f8,11
1606880801.0,2020-12-02,wallstreetbets,gec12wt,"My buddy was stressing out today asking me my pro advice if he should buy 1 share of $SPY or 1 share of $VOO cause these etfs are pumping great returns.

This was the end of the day, it was hard for me to respond

If only this guy knew my account got fucking crucified and I ended the day -$7k

Thanks pltr",t3_k4u5f8,12
1606881461.0,2020-12-02,wallstreetbets,gec26h8,r/weedstocks is the most pussy shit ever. Imagine calling your subreddit weedstocks yet filled with bears,t3_k4u5f8,12
1606882818.0,2020-12-02,wallstreetbets,gec4enx,"“SoftBank To Wind Down Options Trading After Investor Backlash
 SoftBank Will Hold Onto Underlying Portfolio Of Big Tech Stocks, Including Amazon, Facebook” -Livesquawk

F",t3_k4u5f8,12
1606883321.0,2020-12-02,wallstreetbets,gec57gl,"Been out of cell service and haven’t checked the market for a few days. How’s it looking? Did my GME and PLTR print fat stacks?! Nio probably overtook Tesla. Fuck, I can’t wait to see.",t3_k4u5f8,12
1606883366.0,2020-12-02,wallstreetbets,gec5a17,"PLTR has 3 days to rocket to the moon.

If not, I'll be behind a Wendys eating dongus like a sticky fuckin nerd.",t3_k4u5f8,13
1606883477.0,2020-12-02,wallstreetbets,gec5gff,"Guys, I think I'm retarded. I found out my buddy and his fiance trade Boomer stocks on Robin Hood with petty cash. They asked me if I trade and I wasn't thinking and told them I'm a derivatives analyst. They said they wanted to try options and started asking me for advice. How do I tell them that I've blown up three accounts. Going from a few thousand to about 70,000 back down to zero again. I think it's fucking hilarious and it's good memes but they are not retarded. what do I do?",t3_k4u5f8,13
1606885382.0,2020-12-02,wallstreetbets,gec8d3q,[deleted],t3_k4u5f8,13
1606885401.0,2020-12-02,wallstreetbets,gec8e76,Is ARKK a good buy?,t3_k4u5f8,13
1606885861.0,2020-12-02,wallstreetbets,gec91yh,dont worry palantir bulls. i wrote a strongly worded letter to the ceo today about my stonks being down today. shud go up tmrw ez,t3_k4u5f8,11
1606886078.0,2020-12-02,wallstreetbets,gec9d4a,[deleted],t3_k4u5f8,12
1606886570.0,2020-12-02,wallstreetbets,geca2jm,Fuck it. Tesla calls it is. $694.20 EOW,t3_k4u5f8,11
1606887171.0,2020-12-02,wallstreetbets,gecawly,this fucking page is like uncut gems tbh,t3_k4u5f8,13
1606887354.0,2020-12-02,wallstreetbets,gecb5tk,"I want to short Tesla because Michael Burry did, but then I read his other tweets and realize he is not autistic, he is retarded. Maybe I will just stay away.",t3_k4u5f8,12
1606887524.0,2020-12-02,wallstreetbets,gecbe8y,"*Michael Burry says some obvious shit that literally everyone knows*

WSB Bulls: THAT FUCKING PIECE OF SHIT",t3_k4u5f8,12
1606887573.0,2020-12-02,wallstreetbets,gecbgj1,It only makes sense that NKLA keeps moving downward.  It's a gravity oriented company.,t3_k4u5f8,11
1606888699.0,2020-12-02,wallstreetbets,geccye0,"I have had PLTR for one day and it hasn't gone to $100 yet

should I sell?",t3_k4u5f8,10
1606888962.0,2020-12-02,wallstreetbets,gecdann,"1st Movie : The Big Short

2nd Movie : The Big Short Squeeze",t3_k4u5f8,12
1606889266.0,2020-12-02,wallstreetbets,gecdoq2,Another night of cold sweats hoping Tesla rallies,t3_k4u5f8,13
1606889463.0,2020-12-02,wallstreetbets,gecdxir,It's like my money is soaked in gasoline and my hands are napalm. I can't help myself,t3_k4u5f8,11
1606889557.0,2020-12-02,wallstreetbets,gece1ug,[deleted],t3_k4u5f8,11
1606890093.0,2020-12-02,wallstreetbets,gecepth,Currently watching The Big Short for research on how fucked my TSLA calls are.,t3_k4u5f8,12
1606892721.0,2020-12-02,wallstreetbets,gechugt,markets were green yesterday.. wsb meme stonks index was the only one red,t3_k4u5f8,12
1606893558.0,2020-12-02,wallstreetbets,gecit3j,FUCK THE BEARS GET VACC’d AGAIN,t3_k4u5f8,12
1606893915.0,2020-12-02,wallstreetbets,gecj7hb,PLTR absolutely MOONING in last weeks trading hours,t3_k4u5f8,12
1606894586.0,2020-12-02,wallstreetbets,gecjy4i,"Anyone else notice whenever market is red, we just magically get all this vaccine and stimulus news, but when it’s up 1-2% like yesterday, they don’t release any news at all? Yeah this shit is definitely planned.",t3_k4u5f8,12
1606894714.0,2020-12-02,wallstreetbets,geck398,fuck i just lost to a beginner chess bot. how the fuck can i beat trading firm algos and bots.,t3_k4u5f8,11
1606897110.0,2020-12-02,wallstreetbets,gecmnrm,"This shit is going to be up by pre market shut up, go to bed, and buy calls",t3_k4u5f8,11
1606901315.0,2020-12-02,wallstreetbets,gecqrcj,I was told PLTR would close my calls for me and automatically wire millions into my account,t3_k4u5f8,13
1606902310.0,2020-12-02,wallstreetbets,gecrntf,Everybody buy PLTR puts the algos will pump for us,t3_k4u5f8,13
1606906003.0,2020-12-02,wallstreetbets,gecuyvc,Damn PLTR is kill.,t3_k4u5f8,12
1606906820.0,2020-12-02,wallstreetbets,gecvraf,GME,t3_k4u5f8,13
1606907675.0,2020-12-02,wallstreetbets,gecwkvn,my dream is to hit 7 figures and have sex with lana rhoades cuz im rich.,t3_k4u5f8,12
1606908124.0,2020-12-02,wallstreetbets,gecx0pm,[deleted],t3_k4u5f8,12
1606857380.0,2020-12-02,wallstreetbets,geat60u,Bitch McConnell  please just do one good thing during your time in office and decriminalize weed  you piece of fucking shit faced motherfucker,t3_k4u5f8,68
1606859103.0,2020-12-02,wallstreetbets,geawtc2,My Tesla weeklies are FIGHTIN FOR THEIR FUCKIN LIFE MAN,t3_k4u5f8,23
1606863439.0,2020-12-02,wallstreetbets,geb5oj7,[deleted],t3_k4u5f8,24
1606864271.0,2020-12-02,wallstreetbets,geb7afm,I just found out the lead singer of Green Day actually made some major TENDIES in 1998 when everything was green for a week. He ended up buying all the band's equipment with his profit and then named the band Green Day wow you're still reading unbelievable I'm obviously fucking lying dude I can't believe I had to sell my Nio shares today,t3_k4u5f8,25
1606868339.0,2020-12-02,wallstreetbets,gebesz6,Mission codename PLTR encountered a major issue in its attempt to reach the moon. A large number of paper hands where found below in storage. PLTR had to drop as it chucked them out and continued on with its 💎 hand crew. Fuck your puts 🚀🚀🚀,t3_k4u5f8,24
1606871895.0,2020-12-02,wallstreetbets,gebl7fz,"This place is hilarious. Spy, qqq, Dow, iwm, xlv, xlf were all green today. We set records on spy and qqq and it feels like people just lost it all. Don’t worry. I am one of these people",t3_k4u5f8,27
1606872383.0,2020-12-02,wallstreetbets,gebm2uf,[deleted],t3_k4u5f8,23
1606873147.0,2020-12-02,wallstreetbets,gebnfyk,[deleted],t3_k4u5f8,23
1606878766.0,2020-12-02,wallstreetbets,gebxlxy,"Guys palantir and GameStop just pulled in my driveway and are walking towards my front door with baseball bats. I don’t think they’re fucking around this time, please help.",t3_k4u5f8,25
1606879192.0,2020-12-02,wallstreetbets,gebyc6v,⣿⣿⣿⣿⣿⣿⠟⢋⢡⢰⡰⣸⡰⣱⢰⡰⡠⡉⡛⠻⣿⣿⣿⣿⣿⣿⣿⣿ ⣿⣿⣿⣿⠏⢄⢖⢵⢝⡞⡮⡳⣍⠊⠥⠥⢑⣕⢎⢔⡈⡙⣿⣿⣿⣿⣿⣿ ⣿⣿⡟⢡⢪⡳⡝⢱⡫⣞⢝⡝⣎⢯⡳⡥⡠⡘⣝⢵⡱⡠⠘⣿⣿⣿⣿⣿ ⣿⣿⢃⢕⢗⡍⢼⠵⡝⡎⠇⢙⣈⣊⠪⠳⣅⢗⡵⡳⣝⡜⡔⠘⣿⣿⣿⣿ ⣿⣿⠐⢭⡳⡅⡬⡯⡺⡨⡈⢿⣿⣿⣿⣦⠨⡳⣝⣝⢮⡊⡜⡀⣿⣿⣿⣿ ⣿⣿⣧⠑⣝⢮⡳⣝⢽⣸⢰⠠⠙⠟⡋⡡⣸⣚⠮⢊⣓⠁⡎⡂⣸⣿⣿⣿ ⣿⣿⣿⣧⡘⡜⡮⣳⢳⢥⠱⣝⢼⢤⢌⠚⢮⣢⡲⡳⡅⡜⡌⢰⣿⣿⣿⣿ ⣿⣿⣿⠟⢃⠈⡊⢗⡽⣕⢇⡐⢌⡊⣏⢯⡢⣔⠙⢝⠜⢈⣠⣿⣿⣿⣿⣿ ⣿⡿⢁⢎⢮⢝⣆⡂⡙⢼⢕⢯⡲⣜⢵⡫⣞⢵⡹⡠⢐⠻⣿⣿⣿⣿⣿⣿ ⡿⢁⢧⣫⡳⣝⢮⡺⣢⣂⠉⠳⡹⣪⡳⣝⢮⡳⢕⣇⠥⠐⠈⡙⢿⣿⣿⣿ ⠃⠘⢮⢺⢜⡮⡳⡹⢐⣈⣬⣴⣌⡊⠞⡎⣗⢁⠮⢂⢔⡵⡳⡢⡂⠌⢿⣿ ⠄⡑⠈⡁⢋⠪⠣⠁⠈⢻⣿⣿⣿⣿⣷⣌⡊⠸⠠⣝⢵⢍⡙⠺⡜⡌⢸⣿ ⠄⡐⠐⠁⠄⠁⠄⠄⠄⠸⣿⣿⣿⣿⣿⣿⣿⣶⣌⠪⢳⢝⢮⢢⠑⠁⣼⣿ ⠄⠄⠉⠄⠁⠄⠄⠄⠄⠄⠘⣿⣿⣿⣿⣿⣿⣿⣿⣷⣦⣅⣃⣁⣤⣾⣿⣿,t3_k4u5f8,23
1606883430.0,2020-12-02,wallstreetbets,gec5dob,Moving on from PLTR and rotating into PLTR,t3_k4u5f8,27
1606862596.0,2020-12-02,wallstreetbets,geb405g,With how fast they made a covid vaccine they better make a balding cure soon cause this market got me stressing tf out 24/7,t3_k4u5f8,21
1606879151.0,2020-12-02,wallstreetbets,geby9mi,I just wanted to see someone eat shit.,t3_k4u5f8,22
1606883660.0,2020-12-02,wallstreetbets,gec5qsv,"It’s a bird

It’s a plane

It’s PLTR 🚀",t3_k4u5f8,22
1606857632.0,2020-12-02,wallstreetbets,geatoqz,This sub is called PalantirBets. Where’s all the loss porn?,t3_k4u5f8,12
1606857878.0,2020-12-02,wallstreetbets,geau7aj,Who the fuck knew about BB and didn’t fucking tell us what the fuck,t3_k4u5f8,9
1606858027.0,2020-12-02,wallstreetbets,geauitt,"GME is up AH, so we good? We mooning tomorrow?",t3_k4u5f8,10
1606859001.0,2020-12-02,wallstreetbets,geawlad,"How leveraged are you people that today is an extinction level event for you?

Buy some fucking leaps, Jfc",t3_k4u5f8,11
1606859418.0,2020-12-02,wallstreetbets,geaxhgw,Let’s see a 598 open on Tesla again 🥺,t3_k4u5f8,11
1606859647.0,2020-12-02,wallstreetbets,geaxzd9,Wtf this new stimulus doesn’t have checks?!?! How TF am I supposed to fuel my gambling addiction?,t3_k4u5f8,10
1606859742.0,2020-12-02,wallstreetbets,geay6vq,"Yup they are back to coronavirus relief Bill bull shit again

I’m out this market.

Literally fucked the market up, tweets would come out saying progress on the bill and nothing happens. Yet the market moves on the tweets.

We are going lower in December it looks like until we get closer to the vaccine",t3_k4u5f8,11
1606860283.0,2020-12-02,wallstreetbets,geazbp3,TSLA -> S&P500 -> shitload of etf's 👋 -> TSLA 💰💸💸💰,t3_k4u5f8,12
1606860753.0,2020-12-02,wallstreetbets,geb0abq,Being in the 10th percentage of intelligence on this sub still makes me a retard... right?,t3_k4u5f8,10
1606861848.0,2020-12-02,wallstreetbets,geb2iho,$TSLA over 600 tomorrow?,t3_k4u5f8,10
1606862050.0,2020-12-02,wallstreetbets,geb2wzc,As long as apple hits 130 by eow we got nothing to worry about,t3_k4u5f8,11
1606862703.0,2020-12-02,wallstreetbets,geb47wg,Inverse WSB is back in full effect,t3_k4u5f8,10
1606863151.0,2020-12-02,wallstreetbets,geb53yj,Fomo is like the 😈 on your shoulder.  It's crazy how strong the pull is sometimes especially if you have a position that has been making you a ton of money and you want to throw more at it.,t3_k4u5f8,12
1606863519.0,2020-12-02,wallstreetbets,geb5u7r,"People who think PLTR is overvalued but ignore TSLA, ZM are a new type of stupid",t3_k4u5f8,11
1606863631.0,2020-12-02,wallstreetbets,geb627f,Good news for NIO call holders: it drilled so deep it struck a new rare earth deposit and they won't have to off shore their batteries anymore.,t3_k4u5f8,10
1606864252.0,2020-12-02,wallstreetbets,geb796r,[deleted],t3_k4u5f8,10
1606864496.0,2020-12-02,wallstreetbets,geb7q09,“Future blood red!” 🤡,t3_k4u5f8,10
1606865285.0,2020-12-02,wallstreetbets,geb9825,Tomorrow I'm going to get smashed like a souffle under a sledgehammer,t3_k4u5f8,11
1606865709.0,2020-12-02,wallstreetbets,geba0gk,"Bears will eat tomorrow, bears gotta eat.   

Can’t stop won’t stop gamestop",t3_k4u5f8,13
1606865786.0,2020-12-02,wallstreetbets,geba5lu,"Oh my god they are just dumping equities already AH

$nnox $tsla

Im going to puke . Time to delete my trading app and reddit. Don’t even want to look at this anymore see you at 9:30 am",t3_k4u5f8,11
1606865895.0,2020-12-02,wallstreetbets,gebacza,Taking some of last weeks PLTR gains over to my degenerate gambling addict friends house to play poker. It’s easy to feel less shitty about your bad habits when you’re friends with people who are just as retarded as you are 🐃🙌🏾,t3_k4u5f8,12
1606867202.0,2020-12-02,wallstreetbets,gebcrbd,Lol green by open,t3_k4u5f8,11
1606867276.0,2020-12-02,wallstreetbets,gebcw7j,Citron 1 WSB 0,t3_k4u5f8,11
1606867437.0,2020-12-02,wallstreetbets,gebd6l2,[deleted],t3_k4u5f8,10
1606869256.0,2020-12-02,wallstreetbets,gebgg1e,The amount of loss porn on this sub right now with indices hitting ATH is so sad. Just buy shares or join theta gang holy shit guys.,t3_k4u5f8,11
1606870114.0,2020-12-02,wallstreetbets,gebhznh,"if you buy GME calls at open, wait 30 seconds, turn off your phone, turn it back on and buy more calls of GME, then press start and select at the same time, you will unlock SONIC THE HEDGEHOG",t3_k4u5f8,10
1606871008.0,2020-12-02,wallstreetbets,gebjlus,This isn’t drilling you pussies. Jeez,t3_k4u5f8,10
1606871087.0,2020-12-02,wallstreetbets,gebjr1b,I'm in danger,t3_k4u5f8,11
1606871375.0,2020-12-02,wallstreetbets,gebk9og,"I’m gonna delete the RH app, it’s the only way to get my money back.",t3_k4u5f8,10
1606873514.0,2020-12-02,wallstreetbets,gebo3tr,damn actual working sucks dick but my option trading career from 3/2020 - 11/2020 was the best damn job I ever had,t3_k4u5f8,11
1606874007.0,2020-12-02,wallstreetbets,gebozvr,"“WSB can’t handle one red day”

you’re right, I literally can’t 

all I’ve known is the post COVID market 

it is genuinely dumbfounding for me not ending green",t3_k4u5f8,11
1606875693.0,2020-12-02,wallstreetbets,gebs0o5,"I made $50 bucks today boys, here i come!",t3_k4u5f8,11
1606875713.0,2020-12-02,wallstreetbets,gebs202,"#SOLITARY EGG VS LOVE2FUKBEARASSHOLE 

FIGHT NIGHT ONLY ON HBO",t3_k4u5f8,10
1606876535.0,2020-12-02,wallstreetbets,gebtjpi,[deleted],t3_k4u5f8,10
1606876839.0,2020-12-02,wallstreetbets,gebu44m,Initiate V-shaped recover plan alpha omega bravo. Bear r fuk.,t3_k4u5f8,11
1606877902.0,2020-12-02,wallstreetbets,gebw2r1,Invested in 10 stocks that were all green then went red today. Sometimes the best play is to not have play at all smh,t3_k4u5f8,10
1606878991.0,2020-12-02,wallstreetbets,gebxzw7,"judging by the comments, I think PLTR call holders are going to get to see some shit eating on  Friday",t3_k4u5f8,11
1606879071.0,2020-12-02,wallstreetbets,geby4te,“Business woman. 💄💅” *is part of a multi-level marketing scheme*,t3_k4u5f8,11
1606881557.0,2020-12-02,wallstreetbets,gec2c7o,"Every time I start to see some momentum something gets in my way. 

God dammit. The road to my first 100k aint easy. 

Now I know how pimps feel.",t3_k4u5f8,12
1606866160.0,2020-12-02,wallstreetbets,gebauth,This is the top,t1_gebanhd,73
1606875579.0,2020-12-02,wallstreetbets,gebrt76,My friend was explaining to me how he made a couple hundred of bucks off holding some SE shares and I couldn’t find it in my heart to tell him I lost a couple of grand when BABA dropped last morning lol,t1_gebanhd,34
1606859769.0,2020-12-02,wallstreetbets,geay8uv,That would save me a step anyway,t1_geay5a6,33
1606861890.0,2020-12-02,wallstreetbets,geb2li4,Bullet dodged bro. You don't need chlamydia in your life,t1_geb2f86,98
1606876134.0,2020-12-02,wallstreetbets,gebstct,Bang 4 dudes to establish dominance,t1_geb2f86,46
1606861894.0,2020-12-02,wallstreetbets,geb2lu7,fuck that bitch she was nothing special,t1_geb2f86,42
1606862018.0,2020-12-02,wallstreetbets,geb2unw,Who said you can’t be the fourth?,t1_geb2f86,12
1606857620.0,2020-12-02,wallstreetbets,geatntf,Liar. We know you were sucking dick all day,t1_geatipe,120
1606857589.0,2020-12-02,wallstreetbets,geatlm3,My asshole hurts for a similar reason,t1_geatipe,53
1606858701.0,2020-12-02,wallstreetbets,geavxpd,Daily,t1_geavuku,12
1606875750.0,2020-12-02,wallstreetbets,gebs4eq,This fucks,t1_gebs3mx,27
1606876172.0,2020-12-02,wallstreetbets,gebsvrw,You're gonna look real stupid when you wake up to realize that tomorrow is actually today,t1_gebs3mx,22
1606859728.0,2020-12-02,wallstreetbets,geay5sf,"I quit my job Friday morning because I figured I would live off my PLTR and NIO gains. Then I also figured I'd hold all my calls just for another week.

Just kidding, I'm only partially retarded.",t1_geatzpw,49
1606858380.0,2020-12-02,wallstreetbets,geav9dp,🤞,t1_geauarb,49
1606858614.0,2020-12-02,wallstreetbets,geavr3q,"Not tmr lol.. in a few weeks, maybe",t1_geauarb,22
1606861863.0,2020-12-02,wallstreetbets,geb2jkl,I would do that regardless,t1_geb2eg3,48
1606862053.0,2020-12-02,wallstreetbets,geb2x85,If it goes to 35 tomorrow I’ll buy you anything you want for $1k or under,t1_geb2eg3,18
1606881974.0,2020-12-02,wallstreetbets,gec3170,"So accurate, I love coming here every now n then for a laugh",t1_geb1uhc,13
1606863751.0,2020-12-02,wallstreetbets,geb6aoo,"Yes, but will Tesla be included in the S&P 500?",t1_geax72b,14
1606866450.0,2020-12-02,wallstreetbets,gebbdzk,I’m fucking weak PLTR did NOT hit $40 lmfaoooo,t1_gebb5r6,15
1606858709.0,2020-12-02,wallstreetbets,geavyco,Paper handed cucks,t1_geavqzx,114
1606859375.0,2020-12-02,wallstreetbets,geaxe8l,Now I know how Bruce Wayne became Batman,t1_geavqzx,12
1606857973.0,2020-12-02,wallstreetbets,geaueqh,im not *not* trying,t1_geatpav,10
1606859146.0,2020-12-02,wallstreetbets,geawws9,"Down 9K this week, up $20 all time. If PLTR doesn’t rally again before EOM I’ll be joining you.",t1_geawmpp,34
1606859053.0,2020-12-02,wallstreetbets,geawpfk,It’s just money bro. You can make it back,t1_geawmpp,24
1606859410.0,2020-12-02,wallstreetbets,geaxgxf,[deleted],t1_geawmpp,18
1606861185.0,2020-12-02,wallstreetbets,geb163o,tinder was awesome years ago. now it’s mostly hookers and girls trying to bump up their instagram. try another way,t1_geb1024,15
1606858236.0,2020-12-02,wallstreetbets,geauyjh,Everybody hates Chris,t1_geauuqp,61
1606857658.0,2020-12-02,wallstreetbets,geatqs1,Dont forget about u/thiccgreenlines,t1_geatf9a,32
1606860365.0,2020-12-02,wallstreetbets,geazhpd,"300k is almost half of ""half a million"" lol,  they're stretching ""a bit over a quarter mill"" to ""almost half a mill."" Regardless,  that's a lucky dude.",t1_geatf9a,17
1606861558.0,2020-12-02,wallstreetbets,geb1xkm,r/investing laughing at us,t1_geb1ojc,13
1606879457.0,2020-12-02,wallstreetbets,gebyssc,This is so true it makes my eyes bulge out,t1_gebyppw,37
1606879560.0,2020-12-02,wallstreetbets,gebyz23,Take small bites but eat a lot. Take big bites and choke on cock.,t1_gebyppw,16
1606858102.0,2020-12-02,wallstreetbets,geauofi,"But I've been watching people making money on this since 10$ a share without doing anything and I just jumped in now at 20$, why am I losing money? This is BULLSHIT",t1_geau7ek,36
1606859671.0,2020-12-02,wallstreetbets,geay19v,Wow its like you can see the stock market,t1_geaxwox,33
1606861722.0,2020-12-02,wallstreetbets,geb29du,😂 but also 😭,t1_geb24gh,11
1606865834.0,2020-12-02,wallstreetbets,geba8t9,If they are really your kids then don't worry I don't think they will get into college,t1_geb9o8b,67
1606874330.0,2020-12-02,wallstreetbets,gebpl24,"I mean if they bought shares, they’ll be fine. Weekly calls yeah gonna be weird",t1_gebpfd5,13
1606871606.0,2020-12-02,wallstreetbets,gebkoom,A Tale of the Autumn of 2020,t1_gebkgb2,13
1606860511.0,2020-12-02,wallstreetbets,geazshg,"Because it literally has no reason to go up yet since nothing material has happened. Whenever the merger is actually announced, bam,  tendies. Until then, it's a boat in the ocean without a sail",t1_geavgyc,57
1606858930.0,2020-12-02,wallstreetbets,geawfmb,It’s not supposed to moon yet. December third they’re announcing an extension so keep holding.,t1_geavgyc,24
1606858550.0,2020-12-02,wallstreetbets,geavm6t,you’ll be rewarded soon,t1_geavgyc,16
1606859627.0,2020-12-02,wallstreetbets,geaxxr3,If it makes you feel better I work with PHD's all day and they are just as retarded.,t1_geavgyc,13
1606879143.0,2020-12-02,wallstreetbets,geby970,Reporting for duty 🙋🏼‍♀️,t1_geby6wl,11
1606862058.0,2020-12-02,wallstreetbets,geb2xlh,Me too . I am depressed cuz u are depressed. Cheer up.,t1_geb2o5w,15
1606859437.0,2020-12-02,wallstreetbets,geaxixe,Spain without the S 😔,t1_geasl13,12
