created,date,subreddit,id,body,parent_id,score
1618523916.0,2021-04-16,wallstreetbets,gunm7ky,"Now more than ever need a Tesla miracle AH or in premarket tomorrow. Honestly, what’s happened to the EV market? EV bulls fucked for the year or what?",t3_mrms60,9
1618524423.0,2021-04-16,wallstreetbets,gunn9l7,Going to hold my $MVIS babies,t3_mrms60,10
1618526033.0,2021-04-16,wallstreetbets,gunqkxx,wish i didn’t know what being in shambles felt like,t3_mrms60,10
1618526117.0,2021-04-16,wallstreetbets,gunqqz7,"I just want one crazy futures night, for old times sake.

I don't even care which way. Give me +6%. Give me -6%. Whatever. I just miss those old days of shitposting on WSB at 3AM with people losing their fucking minds.",t3_mrms60,10
1618526725.0,2021-04-16,wallstreetbets,gunry1m,"NKLA was the ultimate P and D

Down roughly 90% from ATH LOL",t3_mrms60,10
1618527127.0,2021-04-16,wallstreetbets,gunsr0g,"Haven't all the FAANGs destroyed earnings since Covid? With SPY at ATH, SPACs dead, AAPL and AMZN seem like the best options out there right now",t3_mrms60,9
1618527394.0,2021-04-16,wallstreetbets,gunta4h,GUYS I LIKE WEED STOCKS,t3_mrms60,11
1618528379.0,2021-04-16,wallstreetbets,gunv7fz,SPY in talks to acquire QQQ.,t3_mrms60,11
1618528960.0,2021-04-16,wallstreetbets,gunwd2w,When will green energy get lit again 😩,t3_mrms60,10
1618529425.0,2021-04-16,wallstreetbets,gunxa8l,Hoping MVIS starts the ascent,t3_mrms60,11
1618530080.0,2021-04-16,wallstreetbets,gunyk84,All in PLTR,t3_mrms60,11
1618530451.0,2021-04-16,wallstreetbets,gunza3e,"Feb & March : ""omg yields fuck tech""
April : ""omg yields dropping fuck tech""",t3_mrms60,10
1618531576.0,2021-04-16,wallstreetbets,guo1gja,RIDE just smacked its face on the floor and triggered an alternative uptick restriction.  Mad bullish.,t3_mrms60,10
1618531704.0,2021-04-16,wallstreetbets,guo1p82,"Ready to ride the roller coaster tomorrow.

Ameritrade said I had a House call. Ignoring that shit cause I live in an apartment",t3_mrms60,11
1618531727.0,2021-04-16,wallstreetbets,guo1qu2,[deleted],t3_mrms60,10
1618532269.0,2021-04-16,wallstreetbets,guo2s8q,Spy is gonna continue to rip tmw. (Confirm my bias),t3_mrms60,11
1618532444.0,2021-04-16,wallstreetbets,guo34be,Im prepared to quadruple down on TSM,t3_mrms60,10
1618533324.0,2021-04-16,wallstreetbets,guo4tdl,"Apha sigle handedly brought my folio from up 45% to up 8%.

Fucking awesome. You pos Mexican ditch weed dealing stock.",t3_mrms60,10
1618534669.0,2021-04-16,wallstreetbets,guo7e8v,Fuck PLTR i no longer like the stock,t3_mrms60,9
1618535093.0,2021-04-16,wallstreetbets,guo877c,I wish the shit I liked investing in was profitable,t3_mrms60,10
1618535455.0,2021-04-16,wallstreetbets,guo8w9e,"Today completely wiped out the losses from the day before.

So it tracks that tomorrow will completely wipe out the gains from today.

🦘🦘🦘",t3_mrms60,9
1618536018.0,2021-04-16,wallstreetbets,guo9z6p,What a fucking shit show.  I blame mods for giving an inch.,t3_mrms60,10
1618536136.0,2021-04-16,wallstreetbets,guoa7s2,I saved someone’s life today while they were choking. It provided no life lesson to me about how short life is or about making the most of what I have. Still a degenerate unfortunately.,t3_mrms60,10
1618536260.0,2021-04-16,wallstreetbets,guoagir,[removed],t3_mrms60,15
1618536388.0,2021-04-16,wallstreetbets,guoap96,Take (more) advantage of the price suppression on MVIS and keep buying May calls.,t3_mrms60,10
1618536464.0,2021-04-16,wallstreetbets,guoaugs,[removed],t3_mrms60,16
1618537189.0,2021-04-16,wallstreetbets,guoc8ki,The music is about to stop.,t3_mrms60,11
1618537221.0,2021-04-16,wallstreetbets,guocarc,Day off tomorrow. Am I mentally ill enough to watch tickers all day? Yup,t3_mrms60,10
1618538414.0,2021-04-16,wallstreetbets,guoelad,I lost $1000 on pltr fds.. I went beyond full Retard and created a new spectrum,t3_mrms60,11
1618540978.0,2021-04-16,wallstreetbets,guojdgl,"Idk what yall are bitching about RH for. He heard the complaints that you could only sell, no buy and switched it for you. The only thing hes guilty of is always improving.",t3_mrms60,11
1618541228.0,2021-04-16,wallstreetbets,guojtmb,Robinhood just cracks me up at this point.,t3_mrms60,8
1618542379.0,2021-04-16,wallstreetbets,guolwt1,Don’t chase the stonks. Let the stonks chase you,t3_mrms60,11
1618542686.0,2021-04-16,wallstreetbets,guomg8l,[deleted],t3_mrms60,11
1618543280.0,2021-04-16,wallstreetbets,guonh1a,Buying more PLTR because I'm RETARDED and I think Alex has neat hair,t3_mrms60,10
1618543986.0,2021-04-16,wallstreetbets,guoonxi,[deleted],t3_mrms60,11
1618544139.0,2021-04-16,wallstreetbets,guooxc0,"*me: been saving quarter for over 20 years*

*a virtual shibu inu being worth more in less than 48 hours*",t3_mrms60,10
1618544593.0,2021-04-16,wallstreetbets,guopojr,"I don't look at loss porn because I enjoy it, it just makes me feel better about my loss porn that I've chosen not to post",t3_mrms60,10
1618544808.0,2021-04-16,wallstreetbets,guoq1h2,I hate to be the person that asks but can someone explain the snek thing to me? Where did he come from? What does it mean?,t3_mrms60,10
1618545476.0,2021-04-16,wallstreetbets,guor48q,"                 ____
                / . .\
                \  ---<
                 \  /
       __________/ /
    -=:___________/",t3_mrms60,9
1618547700.0,2021-04-16,wallstreetbets,guoul2c,"Ray...people will come, Ray.  They'll come to Iowa, for reasons they can't even fathom.  They'll turn up your driveway, not even know for sure why they're doing it.  They'll arrive at your door, innocent as children, longing for the past.  ""Of course we don't mind if you look around,"" you'll say.  ""It's only $20 per person.""  And they'll hand over the money without even thinking about it.  For it is money they have, and peace they lack.

And they'll walk out to the bleachers...sit in ahirtsleeves, on a perfect afternoon.  They'll find they have reserved seats.  Somewhere, up along one of the baselines, where they sat when they were children, and cheered their heroes.  They'll watch the game, and it'll be as if they'd dipped themselves in magic waters.  The memories so thick, they'll have to brush them away from their faces.  

""You'll lose everything, Ray.""

People will come, Ray.

""You'll be evicted!""

The one constant through all the years, Ray, has been baseball.  America has rolled by like an army of steamrollers.  It's been erased like a blackboard, rebuilt, and erased again.  But baseball ⚾️ ☝🏾...has marked the time.  This field, this game, is a part of our past, Ray.  It reminds us of all that once was good, and could be again.

Oooooh...people will come, Ray.  People will most definitely come.",t3_mrms60,10
1618547780.0,2021-04-16,wallstreetbets,guoupb0,How is there not more talk about SPY $420C 4/20? It's so fucking obvious.,t3_mrms60,10
1618548262.0,2021-04-16,wallstreetbets,guovdz6,I prefer Pfizer’s earlier works like viagra and Xanax,t3_mrms60,10
1618548842.0,2021-04-16,wallstreetbets,guow772,"Ok Elon, now tell the puppy brigade to put their gains into $TSLA.",t3_mrms60,10
1618549163.0,2021-04-16,wallstreetbets,guowmy7,"When you guys see MVIS gain porn soon, remember this comment",t3_mrms60,10
1618549263.0,2021-04-16,wallstreetbets,guowrut,Holy shit we can talk about crypto on here now ?,t3_mrms60,10
1618550332.0,2021-04-16,wallstreetbets,guoy79u,"Personal demons are back, see y’all at market open",t3_mrms60,11
1618552148.0,2021-04-16,wallstreetbets,gup0j8s,I wanna move to a really northern elitist city and trade in a local coffee shop with all the hipsters,t3_mrms60,10
1618554521.0,2021-04-16,wallstreetbets,gup3fm7,"Good evening

I wish all bears a very lose all their money",t3_mrms60,11
1618555693.0,2021-04-16,wallstreetbets,gup4t5g,"My poisonous, alcoholic ex-fling contacted me about of the blue and offered me 5K to shoot porn (with him I presume). 

Guess I'll stay poor.",t3_mrms60,10
1618557145.0,2021-04-16,wallstreetbets,gup6gr7,I can't be the only one who thinks my son is an asshole for applying to college this year without considering how that might hurt my self-esteem.,t3_mrms60,9
1618559415.0,2021-04-16,wallstreetbets,gup8xae,Slime language,t3_mrms60,9
1618560117.0,2021-04-16,wallstreetbets,gup9o1w,[deleted],t3_mrms60,9
1618560814.0,2021-04-16,wallstreetbets,gupaf4q,"PLTR and PLUG down in premarket, that means big green day for them right?? Don’t even know why I look anymore",t3_mrms60,10
1618566159.0,2021-04-16,wallstreetbets,gupfxcd,I don’t get how all time high spy coincides with my all time low portfolio. And I didn’t even buy puts wtf,t3_mrms60,11
1618516869.0,2021-04-16,wallstreetbets,gun6bef,"""THIS HAS TO BE THE TOP"" - BEARS WHEN SPY WAS $400",t3_mrms60,31
1618533911.0,2021-04-16,wallstreetbets,guo5xzm,Dodge coin wtf,t3_mrms60,30
1618534087.0,2021-04-16,wallstreetbets,guo69z8,Gonna go finger blast my wife in the Dollar General bathroom cause I’m a real man.,t3_mrms60,32
1618517141.0,2021-04-16,wallstreetbets,gun6xxw,This subreddit has collectively lost at least.........200 dollars to PLTR,t3_mrms60,45
1618516904.0,2021-04-16,wallstreetbets,gun6ebn,🤣 fucking bears🤣🤣,t3_mrms60,9
1618517158.0,2021-04-16,wallstreetbets,gun6zc2,"There is no ""behind"" my Wendy's: it's in a mall parking lot. I do my dumpster business in the full view of man and God alike.",t3_mrms60,9
1618517281.0,2021-04-16,wallstreetbets,gun79kw,unreal NASDAQ making new ATH and my portfolio making new lows,t3_mrms60,9
1618517402.0,2021-04-16,wallstreetbets,gun7jeo,"Lol welp, that was fun today, but I like this money printing dog thing",t3_mrms60,9
1618517448.0,2021-04-16,wallstreetbets,gun7nb6,I’m glad I found this sub! Misery sure does love company...🥲,t3_mrms60,9
1618517906.0,2021-04-16,wallstreetbets,gun8poq,Rumor: DKNG NFL deal,t3_mrms60,9
1618518085.0,2021-04-16,wallstreetbets,gun9534,Can’t wait for PLTR to disappoint me for the 5th day in a row,t3_mrms60,8
1618518306.0,2021-04-16,wallstreetbets,gun9ntz,Any reason why green energy dump today?,t3_mrms60,9
1618518812.0,2021-04-16,wallstreetbets,gunatru,Spy 420 baby!,t3_mrms60,9
1618518878.0,2021-04-16,wallstreetbets,gunazcs,BAC 4/16 call gang check in,t3_mrms60,10
1618520453.0,2021-04-16,wallstreetbets,gunemlz,I honestly have no idea at this point,t3_mrms60,10
1618520471.0,2021-04-16,wallstreetbets,guneo61,Draft kings. See you bitches on the moon!,t3_mrms60,10
1618520765.0,2021-04-16,wallstreetbets,gunfbnj,I think you might be on to something with the stonks only go up shit. Pretty much the most exact financial advice you could get in the last 12 months,t3_mrms60,9
1618520907.0,2021-04-16,wallstreetbets,gunfmvd,Rotation from down 15% to down 25% today,t3_mrms60,9
1618521072.0,2021-04-16,wallstreetbets,gunfzqh,AAPL 135+ tmw,t3_mrms60,10
1618521337.0,2021-04-16,wallstreetbets,gungkq0,What’s the most beat up stock recently that honestly doesn’t deserve it?,t3_mrms60,10
1618522185.0,2021-04-16,wallstreetbets,gunigsh,Pltr is just a crack rock and we are all chasing that 10 bag we got the week after IPO,t3_mrms60,8
1618522341.0,2021-04-16,wallstreetbets,guniswl,Every non mega tech stock has the same 3 month chart,t3_mrms60,8
1618522563.0,2021-04-16,wallstreetbets,gunjand,"bought some GME 185 lotto tickets before close

those retards are annoying but i'll be damned if their 4/16 holy grail hits and i don't get a piece",t3_mrms60,8
1618522930.0,2021-04-16,wallstreetbets,gunk3nn,Why don’t we just start our own stock exchange?,t3_mrms60,8
1618523391.0,2021-04-16,wallstreetbets,gunl3di,To think that QS was 142 at one point,t3_mrms60,9
1618523754.0,2021-04-16,wallstreetbets,gunlv6s,"SPY has now found synchronicity with the date. 415 on 4/15, 416 on 4/16, etc etc until 420 on 4/20",t3_mrms60,9
1618523930.0,2021-04-16,wallstreetbets,gunm8mg,my overall net worth dropped 40% since feb highs. could i be overly levered on speculative stocks? or am i perfectly levered to my personal risk tolerance? 🤔,t3_mrms60,9
1618524808.0,2021-04-16,wallstreetbets,guno2tx,"Hit my first 2 bagger in a while with and AMD call I bought yesterday 🙂. Each time AMD has dipped I've bought atleast a call and hasn't let me down yet.

All my other calls expired worthless 🤪🤪🤪",t3_mrms60,9
1618527181.0,2021-04-16,wallstreetbets,gunsuyn,Up 16% scalping blue chips this month. So easy.,t3_mrms60,8
1618527309.0,2021-04-16,wallstreetbets,gunt40h,What’s the best play you ever lucked into? I had BB leaps I spent 400 on that went to 8k when it spiked to 25$ a few months ago. Gains were then sacrificed in weeklies with Tesla and cathiewood 3D printing and genetics hype. When u hit a big one. Take the money and run !,t3_mrms60,8
1618527647.0,2021-04-16,wallstreetbets,guntrwh,"This bong rip goes out to weed gang, gone but not forgotten. May your catalyst come soon, may you receive many tendies",t3_mrms60,9
1618529101.0,2021-04-16,wallstreetbets,gunwn5v,i trade almost as well as people act in law firm commercials,t3_mrms60,8
1618530308.0,2021-04-16,wallstreetbets,gunz06z,"LITERALLY WENT FROM +1% ON MY 200 $27 PLTR 4/23 CALLS TO -87% IN 2 DAYS. FUCK YES. I LOVE OPTIONS SO MUCH.

I didn't sell and get out at +1% because breaking even is for pussies.

Why the fuck couldn't it do the opposite? Why couldn't I be up 87% and down -1%?

FUCK

Bought 100 on Feb 18. Averaged down buying 50 more on March 8. Averaged down buying 50 more on March 14th. That motherfucker still going down. Fuck me.

Donate to the autism awareness fund, I need help.",t3_mrms60,10
1618530766.0,2021-04-16,wallstreetbets,gunzwe4,"damn, is my DKNG going to rise from the dead? just saw the NFL partnership news... holy fuck boys I might see some green tomorrow",t3_mrms60,10
1618530908.0,2021-04-16,wallstreetbets,guo065r,$FUBO = Fuck Ur Bitch Oass!,t3_mrms60,10
1618532359.0,2021-04-16,wallstreetbets,guo2yeg,nothing like spending hours looking through 8-Ks and news to try and find a play and then end up fomoing into something at open,t3_mrms60,9
1618532718.0,2021-04-16,wallstreetbets,guo3nc6,I hope the Friday before my 33rd birthday is a green day. May my birthday magic spread amongst all!!,t3_mrms60,9
1618532899.0,2021-04-16,wallstreetbets,guo402l,The tax man raided my bank acct today! 😭,t3_mrms60,9
1618534114.0,2021-04-16,wallstreetbets,guo6btu,I’m a good boy,t3_mrms60,10
1618534813.0,2021-04-16,wallstreetbets,guo7o33,Futures red because everyone is going to liquidate to buy dog.,t3_mrms60,9
1618535008.0,2021-04-16,wallstreetbets,guo81bz,[removed],t3_mrms60,13
1618536089.0,2021-04-16,wallstreetbets,guoa4dv,"Just put in $20 in puppy money, what color lambo?",t3_mrms60,9
1618536164.0,2021-04-16,wallstreetbets,guoa9uh,yo guys I did the math if tsla goes up to 800 tomorow I'm going to make a lot of money!!!!,t3_mrms60,9
1618536765.0,2021-04-16,wallstreetbets,guobf87,I think I found the secret to being successful in the stock market just buy call options a week out on blue chip stocks that are at their low. For a while I was doing the opposite I might be wrong though.,t3_mrms60,9
1618537883.0,2021-04-16,wallstreetbets,guodk1p,"Biden please just legalize, I don’t want to be down bad anymore",t3_mrms60,8
1618538358.0,2021-04-16,wallstreetbets,guoehhe,RH wiggin' out rn. Server errors,t3_mrms60,10
1618538407.0,2021-04-16,wallstreetbets,guoeksw,[deleted],t3_mrms60,11
1618538595.0,2021-04-16,wallstreetbets,guoexwm,"Any 🌈🐻 left in here?

Lemme know when you've all capitulated so I can start buying puts",t3_mrms60,9
1618541110.0,2021-04-16,wallstreetbets,guojm11,30 days to stop the spread,t3_mrms60,8
1618541327.0,2021-04-16,wallstreetbets,guok00l,puts on common sense and natural selection.,t3_mrms60,9
1618541664.0,2021-04-16,wallstreetbets,guokm72,"remember that guy that ""invested"" like $75 or 90k into PG&E during the fires ? then he sold, then blamed r/investing for telling him to sell when I think he could have recovered a decent amount ?",t3_mrms60,9
1618541827.0,2021-04-16,wallstreetbets,guokwvn,"NIO or PLTR calls tomorrow, lads?",t3_mrms60,10
1618542005.0,2021-04-16,wallstreetbets,guol8l4,Where’s my broke JD brothers at,t3_mrms60,10
1618542047.0,2021-04-16,wallstreetbets,guolb7f,Weeeeed playsssssss the Holy Week is approaching for TLRY 🙌🏽😩🙌🏽,t3_mrms60,9
1618542057.0,2021-04-16,wallstreetbets,guolbt8,Theta and unstoppable melt up on spy is literally gang bang double large black dicking my portfolio,t3_mrms60,9
1618542360.0,2021-04-16,wallstreetbets,guolvjl,Going 🌈🐻 on BABA is really dumb imo. Only like 1/2 of china has internet. That's 50% upside,t3_mrms60,9
1618544591.0,2021-04-16,wallstreetbets,guopog8,"Somehow a bunch of dudes obsessed with feet have found my girls Instagram account

Definitely have to start selling feet pictures right?",t3_mrms60,8
1618544713.0,2021-04-16,wallstreetbets,guopvql,US government lying about inflation yes or no? Something seems off,t3_mrms60,9
1618545567.0,2021-04-16,wallstreetbets,guor9f0,TSLA calls better print,t3_mrms60,10
1618545910.0,2021-04-16,wallstreetbets,guort1y,Oh shit a snake is about! 🤺 en gaurde!,t3_mrms60,10
1618546364.0,2021-04-16,wallstreetbets,guosjew,"A friend of mine 8 years ago mined something that was worth 1000th of a penny, about a million of them, barely broke even on his video cards etcetera at the time, hope he is smiling now.",t3_mrms60,10
1618546960.0,2021-04-16,wallstreetbets,guotgvh,Smokin a fatty and dreaming of getting a bigger fish tank,t3_mrms60,8
1618547119.0,2021-04-16,wallstreetbets,guotpp9,Money is just a social concept... right? 😧,t3_mrms60,9
1618518768.0,2021-04-16,wallstreetbets,gunaq77,Same,t1_gun9bax,36
1618517182.0,2021-04-16,wallstreetbets,gun71c0,I’m down 5 percent... i’ll be ur hooker,t1_gun6ff6,144
1618529369.0,2021-04-16,wallstreetbets,gunx688,"You missed the last stage, “I’ll just hold until it goes up again” (It never goes up again)",t1_gun8cvp,12
1618521442.0,2021-04-16,wallstreetbets,gungt13,Silver lining I guess is you keep coming up with a way to afford 7.,t1_gungoo4,29
1618521543.0,2021-04-16,wallstreetbets,gunh109,"Hi, are you me?",t1_gungoo4,9
1618527377.0,2021-04-16,wallstreetbets,gunt8xk,Calls on your wifes new boyfriend,t1_gunt38f,35
1618527393.0,2021-04-16,wallstreetbets,gunta1g,Calls on Randy from the workplace. He drives a Ducati 😳,t1_gunt38f,11
1618517226.0,2021-04-16,wallstreetbets,gun753x,Priced in,t1_gun6sbt,132
1618517151.0,2021-04-16,wallstreetbets,gun6yqf,Palantir probably will cure cancer by analyzing large swaths of healthcare data,t1_gun6sbt,38
1618518396.0,2021-04-16,wallstreetbets,gun9vdp,"6: do it all again because of some horseshit ""catalyst"" on the horizon",t1_gun8t91,10
1618517916.0,2021-04-16,wallstreetbets,gun8qld,[removed],t1_gun8c7r,54
1618517361.0,2021-04-16,wallstreetbets,gun7g2t,Fuck you mean. AMD balled out,t1_gun7bkr,25
1618517597.0,2021-04-16,wallstreetbets,gun7zl3,"I've got plenty of shit that isn't talked about on here in shambles as well

Never underestimate my ability to find new opportunities to lose money",t1_gun7bkr,29
1618517168.0,2021-04-16,wallstreetbets,gun705i,Long $ROPE probably,t1_gun6mns,30
1618518551.0,2021-04-16,wallstreetbets,guna8as,That seems to be the case for everyone. I’m afraid of getting wiped out when the market turns red.,t1_gun9zg9,8
1618517906.0,2021-04-16,wallstreetbets,gun8poa,"I hope you feel better tomorrow dude. When I’m having a shit day, I don’t even fight it anymore, because I found that I would just end up spiraling into a worse mood. I just call it a day and go to bed early. Usually wake up feeling a lot better. 


I mean fuk u",t1_gun6dq6,9
1618537413.0,2021-04-16,wallstreetbets,guocntc,You do that and I’ll start the inverse 3X $FOMO,t1_guoccnz,11
1618537341.0,2021-04-16,wallstreetbets,guocizt,Cathie Wood approved,t1_guoccnz,10
1618546495.0,2021-04-16,wallstreetbets,guosqty,🤣 and we will still be bagholding and complaining about it being red after it going up a $1,t1_guoskr8,9
1618564894.0,2021-04-16,wallstreetbets,gupemah,"Your baby surely is a good security for more money on the black market, just tell her you found a new babysitter...Vladimir, from Siberia.",t1_gupee4f,11
1618536089.0,2021-04-16,wallstreetbets,guoa4db,You'll MO if you dont,t1_guo9zxp,9
1618517893.0,2021-04-16,wallstreetbets,gun8oj1,"PLTR, right?",t1_gun6o84,18
1618522085.0,2021-04-16,wallstreetbets,guni8n2,You uh got a link for that? So that I can know what to avoid in the future of course.,t1_gun6o84,14
1618534264.0,2021-04-16,wallstreetbets,guo6m7b,it always ends in heartbreak. 2017.,t1_guo6emw,9
1618536318.0,2021-04-16,wallstreetbets,guoakh8,[deleted],t1_guoaikl,9
1618541757.0,2021-04-16,wallstreetbets,guoksah,"If you’re extremely socially awkward you’re gonna have to be a 9 or a 10 to pull a girl. Unless she can look past your awkwardness.

If you’re confident smooth and funny then you could be a literal 4-5 and pull a bad bitch",t1_guokl1z,12
1618541795.0,2021-04-16,wallstreetbets,guokuqm,It depends how attractive they are.,t1_guokl1z,10
1618517505.0,2021-04-16,wallstreetbets,gun7s15,this guy gets it.,t1_gun7o4w,17
1618524551.0,2021-04-16,wallstreetbets,gunnji6,Yeah I remember when I was happy too,t1_gunngbq,47
1618526867.0,2021-04-16,wallstreetbets,guns8a9,Boston’s funny because it’s woke and super racist at the same time,t1_guns31z,13
1618527826.0,2021-04-16,wallstreetbets,gunu4h8,This is some sopranos shit right here,t1_gunu0m6,14
1618543988.0,2021-04-16,wallstreetbets,guooo2p,The hallmark of a true grit investor - crying like a little bitch,t1_guooity,14
1618557026.0,2021-04-16,wallstreetbets,gup6bvl,"Women are a lot like stocks my friend, I don't understand them and they cost me money.",t1_gup5zlp,20
1618529065.0,2021-04-16,wallstreetbets,gunwkhf,Priced in,t1_gunwils,17
1618546732.0,2021-04-16,wallstreetbets,guot420,[deleted],t1_guosxp0,9
1618523296.0,2021-04-16,wallstreetbets,gunkw0o,Pull out for that tax writeoff,t1_gunkomv,10
1618529320.0,2021-04-16,wallstreetbets,gunx2rw,"Both my sister in laws bought one and now my wife is begging me for one even though WE HAVE A 400 $ ELLIPTICAL YOU DONT EVEN FUCKING USE REBECCA

So yeah I think it’s like a status thing at this point for a lot of people",t1_gunw457,13
1618562080.0,2021-04-16,wallstreetbets,gupbqxv,Market has been consistently green. Your stocks are just trash and so are mine.,t1_gupbo53,26
1618528225.0,2021-04-16,wallstreetbets,gunuwjv,Anyone else read DKNG as Donkey Kong?,t1_gunun86,9
1618560332.0,2021-04-16,wallstreetbets,gup9wg6,"I cannot believe I actually looked that up, though these days with all the SPACs running around wouldn't surprise me",t1_gup9nc0,9
1618551293.0,2021-04-16,wallstreetbets,guozgk8,Should have asked for a blumpkin,t1_guozdof,11
1618517086.0,2021-04-16,wallstreetbets,gun6tg9,Still 21% to go,t1_gun6hfl,10
1618542776.0,2021-04-16,wallstreetbets,guomly1,Everything has been red for like 2 months I swear...,t1_guomdbd,8
1618544423.0,2021-04-16,wallstreetbets,guopeby,Priced in,t1_guop5jh,16
1618521605.0,2021-04-16,wallstreetbets,gunh64k,"> wayfair 

Remember when they were mailing children in their cupboards",t1_gungcky,26
1618556108.0,2021-04-16,wallstreetbets,gup5anz,I’ll shoot one with you for free since you’re willing to stay poor,t1_gup4t5g,11
1618541722.0,2021-04-16,wallstreetbets,guokpyz,No. But please tell more.,t1_guokm72,12
1618518387.0,2021-04-16,wallstreetbets,gun9ull,"So, -10%",t1_gun6yqf,23
1618536405.0,2021-04-16,wallstreetbets,guoaqf1,Except with delivery timelines,t1_guoakh8,12
