created,date,subreddit,id,body,parent_id,score
1604435950.0,2020-11-04,wallstreetbets,gb1j8gs,"Current election thread: [Peri-Peri-Election Election Discussion Thread](https://www.reddit.com/r/wallstreetbets/comments/jnwset/periperielection_election_discussion_thread/)

No bans will be issued for posting there about politics. We hope it will keep this thread relatively politics-free.

[ Pre-Election Election Discussion Thread](https://www.reddit.com/r/wallstreetbets/comments/jnia8v/preelection_election_discussion_thread)

[Peri-Election Election Discussion Thread](https://www.reddit.com/r/wallstreetbets/comments/jnllmp/perielection_election_discussion_thread)",t3_jnhpwk,1
1604437414.0,2020-11-04,wallstreetbets,gb1mej3,Might go out and riot tonight to help my VIX calls a bit,t3_jnhpwk,296
1604453600.0,2020-11-04,wallstreetbets,gb2h3yy,"Tomorrow’s headline:

“Markets rise on Stimulus hopes”",t3_jnhpwk,83
1604438770.0,2020-11-04,wallstreetbets,gb1p6zz,"Upvote if you have 0 idea what to expect, promised yourself you’d be cash, and are balls to the wall in positions",t3_jnhpwk,277
1604442688.0,2020-11-04,wallstreetbets,gb1x6uk,"I can't believe I'm gambling 3 grand in the stock market on election night and just 5 years ago I was a homeless junkie, ill take it.",t3_jnhpwk,222
1604446254.0,2020-11-04,wallstreetbets,gb241m8,"Election LIVE results

Trump - 0

Biden - 0

Sponsored by pornhub.com",t3_jnhpwk,54
1604466344.0,2020-11-04,wallstreetbets,gb33chf,"Options made me look at money different now, $2000 just reads $20.00",t3_jnhpwk,57
1604464103.0,2020-11-04,wallstreetbets,gb2zpg0,**DEMOCRAT OR REPUBLICAN.. ONE THING WE CAN ALL AGREE ON HERE IS WSBs MODS GAY**,t3_jnhpwk,52
1604434619.0,2020-11-04,wallstreetbets,gb1gcn3,"I was down 65% all time last Thursday

Only down 27% now

*this is a victory*",t3_jnhpwk,101
1604444938.0,2020-11-04,wallstreetbets,gb21l5g,"Bears just need to shut the fuck up and let the bullish sentiment pump. If youre a real bear you move in silence and strike when the opportunity is right.

&#x200B;

With that said- I struck when the opportunity was wrong. Bears r fuk- including me.

&#x200B;

edit:

&#x200B;

Since this post is getting a lot of attention I just wanted to ask that you contribute to the GoFund me for my asshole. It was in a horrific accident today and may never recover. The anus tightening surgery I require will be in the millions, maybe even trillions, of pennies.",t3_jnhpwk,46
1604445674.0,2020-11-04,wallstreetbets,gb22y8w,gg was a good run in life. I put my life savings on November puts on Friday. Good thing Cali is nice to homeless people,t3_jnhpwk,40
1604441193.0,2020-11-04,wallstreetbets,gb1u8fy,[deleted],t3_jnhpwk,40
1604456551.0,2020-11-04,wallstreetbets,gb2mcyx,Imagine being a coked up futures trader tonight with this volatility,t3_jnhpwk,43
1604454209.0,2020-11-04,wallstreetbets,gb2i789,"Despite the retardation, this is the only place on the internet everyone can come together and talk shit. The only people getting offended are r/politics migrants who just discovered they can make money outside of their Starbucks jobs.",t3_jnhpwk,38
1604463002.0,2020-11-04,wallstreetbets,gb2xvd1,repubs and dems can both agreee that pollsters should be beaten in the streets,t3_jnhpwk,36
1604469862.0,2020-11-04,wallstreetbets,gb38m9o,**ODDS SAY 100% CHANCE IM GOING TO LOSE MORE MONEY TOMORROW**,t3_jnhpwk,36
1604437285.0,2020-11-04,wallstreetbets,gb1m4e9,"Had us in the first 6 hrs and 25 minutes, not gonna lie",t3_jnhpwk,30
1604439474.0,2020-11-04,wallstreetbets,gb1qnub,[deleted],t3_jnhpwk,31
1604448805.0,2020-11-04,wallstreetbets,gb28o3w,So is Obama winning tonight or mitt Romney?,t3_jnhpwk,33
1604453928.0,2020-11-04,wallstreetbets,gb2hoyw,98% chance mango is doing coke right now already celebrating,t3_jnhpwk,30
1604463451.0,2020-11-04,wallstreetbets,gb2ymo8,Bernie in his house right now playin Marvin’s room,t3_jnhpwk,34
1604465090.0,2020-11-04,wallstreetbets,gb31cfw,give me some adderall and i’ll count these ballots faster than these bozos,t3_jnhpwk,32
1604469311.0,2020-11-04,wallstreetbets,gb37tzs,Arizona has stayed at 76% longer than you guys have stayed financially solvent,t3_jnhpwk,29
1604470612.0,2020-11-04,wallstreetbets,gb39nxd,[deleted],t3_jnhpwk,32
1604434276.0,2020-11-04,wallstreetbets,gb1fm5l,You guys are disgusting. Mods come back from their 12 hour Wendy’s shifts and you guys call them out for releasing a thread at the wrong time. Shame on you! Give them a break!,t3_jnhpwk,58
1604443925.0,2020-11-04,wallstreetbets,gb1zmti,"You fuckers said puts until spy mooned these past 2 days, then you were all 'lol puts dumb' even though 2 weeks ago EVERYBODY HERE SAID IF BIDEN WINS THE MARKET WILL DROP

But now it's ""Market's going to moon no matter what lmao"" this place can fuck off",t3_jnhpwk,58
1604435236.0,2020-11-04,wallstreetbets,gb1holc,[deleted],t3_jnhpwk,128
1604440080.0,2020-11-04,wallstreetbets,gb1rxf6,Didn't you guys know? Covid expired worthless on the election day.,t3_jnhpwk,54
1604442898.0,2020-11-04,wallstreetbets,gb1xlpi,Bears are fucked. It's me. I'm bears.,t3_jnhpwk,55
1604456446.0,2020-11-04,wallstreetbets,gb2m68s,"Imagine they both get 269. 

2020 make it happen",t3_jnhpwk,27
1604462043.0,2020-11-04,wallstreetbets,gb2w827,If I could trade futures I’d be wiped out by now,t3_jnhpwk,27
1604464418.0,2020-11-04,wallstreetbets,gb3081m,"People are actually really civil today, faith in humanity until the riots tomorrow",t3_jnhpwk,24
1604464842.0,2020-11-04,wallstreetbets,gb30xrb,⚠️WARNING⚠️ cock inspection is NOT required at the voting booths!!!! don't be tricked like me!!,t3_jnhpwk,27
1604470660.0,2020-11-04,wallstreetbets,gb39qa3,tomorrow is gonna be a shit show,t3_jnhpwk,29
1604472058.0,2020-11-04,wallstreetbets,gb3bnfw,Mango getting ready for victory speech.  This gonna be a shitshow tomorrow.,t3_jnhpwk,26
1604466686.0,2020-11-04,wallstreetbets,gb33vhj,"“Oregonians can no longer be criminally charged for possessing small amounts of illegal drugs, including heroin, methamphetamine and cocaine.”

Congrats and fuck you Oregonians",t3_jnhpwk,24
1604467729.0,2020-11-04,wallstreetbets,gb35i0i,Imagine being sober tonight,t3_jnhpwk,24
1604481454.0,2020-11-04,wallstreetbets,gb3mnh4,[deleted],t3_jnhpwk,25
1604461976.0,2020-11-04,wallstreetbets,gb2w3mu,"I don’t give DD often so listen up. if Trump wins here buy MSFT ASAP at open. Riots/looting/civil unrest will mean a lot of Windows need to be replaced and who sells Windows, Bill Motherfucking Microsoft",t3_jnhpwk,23
1604467404.0,2020-11-04,wallstreetbets,gb34zzu,"Half this thread thinks biden is winning and the other half thinks trump is winning

Anyone see the social dilemma on Netflix",t3_jnhpwk,23
1604475216.0,2020-11-04,wallstreetbets,gb3fqw5,Trump just fuckeddddddddd futures rip bulls,t3_jnhpwk,22
1604477708.0,2020-11-04,wallstreetbets,gb3iqsk,Supreme Court talks going well and are cautiously optimistic,t3_jnhpwk,22
1604435748.0,2020-11-04,wallstreetbets,gb1ismk,"Tomorrow’s headlines 
Cities on fire after election results have not been confirmed, spy goes up on stability hopes",t3_jnhpwk,69
1604448000.0,2020-11-04,wallstreetbets,gb279n0,#We got Ja Rule on the phone. Let’s see what Ja’s thoughts are on these elections.,t3_jnhpwk,23
1604453065.0,2020-11-04,wallstreetbets,gb2g5ug,One thing for certain tom:  930 RH will NOT be functional lol.,t3_jnhpwk,22
1604463411.0,2020-11-04,wallstreetbets,gb2yk9d,People are so stupid in here. This is going to be contested because of Pennsylvania and Wisconsin. If those flip blue its going to be right down to the wire. People are celebrating way too prematurely.,t3_jnhpwk,21
1604463709.0,2020-11-04,wallstreetbets,gb2z23y,PLEASE PASS A 6K PER PERSON PACKAGE!,t3_jnhpwk,21
1604466930.0,2020-11-04,wallstreetbets,gb3499t,Wow I thought you guys were retarded b4. But this daily thread just proves that no one here has any idea what they are doing or talking about.,t3_jnhpwk,22
1604469056.0,2020-11-04,wallstreetbets,gb37gnw,“The fact that mango misspelled polls is chef’s kiss”,t3_jnhpwk,22
1604469883.0,2020-11-04,wallstreetbets,gb38n9v,Thank god nobody in this thread is talking about politics,t3_jnhpwk,22
1604437787.0,2020-11-04,wallstreetbets,gb1n540,Hopefully during Trumps speech tonight he says that GameStop is the only place he gets his games from.,t3_jnhpwk,48
1604439561.0,2020-11-04,wallstreetbets,gb1qubo,I don’t care who wins i just want both sides to have fun,t3_jnhpwk,48
1604466044.0,2020-11-04,wallstreetbets,gb32vm8,Should rally for the next few weeks while talks of ballot counting going well,t3_jnhpwk,64
1604439470.0,2020-11-04,wallstreetbets,gb1qnh8,[deleted],t3_jnhpwk,21
1604443719.0,2020-11-04,wallstreetbets,gb1z8b5,"I know that other people might be stressing out about this election, but I had a great day😀

Beautiful fall day. Clear sky. Popeye's tendies. And RKT leaps.",t3_jnhpwk,20
1604465655.0,2020-11-04,wallstreetbets,gb3294n,Crowds gathering in Seattle. Like bro it's a Tuesday and it's cold go back inside the election isn't even decided,t3_jnhpwk,20
1604442806.0,2020-11-04,wallstreetbets,gb1xf4n,Political subs trying to figure out the hidden meaning behind each exit poll ticker like wsb playing futures at 3am. I love America.,t3_jnhpwk,20
1604463728.0,2020-11-04,wallstreetbets,gb2z38j,Im balls deep in calls.....but they’re SQQQ calls fml,t3_jnhpwk,20
1604467184.0,2020-11-04,wallstreetbets,gb34nlz,Anyone watching CNN? This guy has been talking for four hours straight,t3_jnhpwk,20
1604475308.0,2020-11-04,wallstreetbets,gb3fux2,"Even fox news is disputing donny, wow",t3_jnhpwk,21
1604434066.0,2020-11-04,wallstreetbets,gb1f674,wow two fucking days in a row.  Puts on the mods.,t3_jnhpwk,59
1604440733.0,2020-11-04,wallstreetbets,gb1tapj,"I've been trading options for a little over a year now and I'm up a total of 50 cents, so let me know if you need any financial advice",t3_jnhpwk,19
1604441232.0,2020-11-04,wallstreetbets,gb1ub9k,What is this? An IPO for ANT?,t3_jnhpwk,19
1604448894.0,2020-11-04,wallstreetbets,gb28tyd,"If Biden gets Florida, it’s done",t3_jnhpwk,18
1604452868.0,2020-11-04,wallstreetbets,gb2ft8j,"Headline tomorrow:

Trump wins Thanks to Latino voters in Miami-dade county",t3_jnhpwk,19
1604454359.0,2020-11-04,wallstreetbets,gb2igsf,"Fucking Florida, every single election.",t3_jnhpwk,20
1604460994.0,2020-11-04,wallstreetbets,gb2uce8,"Bulls in their mansions eating fried chicken with choice of sauce

Bears in their parents basement eating pickles and crackers",t3_jnhpwk,19
1604465448.0,2020-11-04,wallstreetbets,gb31x82,Red or blue... I think we all just want green 💵,t3_jnhpwk,21
1604466982.0,2020-11-04,wallstreetbets,gb34c65,"Take a shot everytime you hear it’s way too early 🥴

Edit: thank you for the gold fellow autist!",t3_jnhpwk,19
1604467338.0,2020-11-04,wallstreetbets,gb34w9d,50k people really voted for Kanye,t3_jnhpwk,19
1604469717.0,2020-11-04,wallstreetbets,gb38f2f,Poles tweet got flagged lmaoooooooo,t3_jnhpwk,18
1604470091.0,2020-11-04,wallstreetbets,gb38xud,[deleted],t3_jnhpwk,18
1604474048.0,2020-11-04,wallstreetbets,gb3ea42,[deleted],t3_jnhpwk,18
1604474641.0,2020-11-04,wallstreetbets,gb3f14m,[deleted],t3_jnhpwk,19
1604475309.0,2020-11-04,wallstreetbets,gb3fuy7,trump said the worst things you could say,t3_jnhpwk,19
1604439396.0,2020-11-04,wallstreetbets,gb1qhxj,Made a total of -$1700 today. Time to whip out that oil and login to brazzers.,t3_jnhpwk,18
1604440165.0,2020-11-04,wallstreetbets,gb1s3rf,Thank god for that sell off my puts are only down 50 percent now phew 😅,t3_jnhpwk,19
1604453673.0,2020-11-04,wallstreetbets,gb2h8jw,"What does the market want, that's all I care about",t3_jnhpwk,18
1604461893.0,2020-11-04,wallstreetbets,gb2vy7m,If this shit reverses so many bulls gonna $ROPE,t3_jnhpwk,18
1604463131.0,2020-11-04,wallstreetbets,gb2y3ac,TACTICAL CASH GANG DEPLOYMENT INBOUND,t3_jnhpwk,18
1604464058.0,2020-11-04,wallstreetbets,gb2zmrx,Mike Judge deserves a nobel peace prize for writing Idiocracy. No one could predict the future better,t3_jnhpwk,18
1604468469.0,2020-11-04,wallstreetbets,gb36lvm,"Fuckin love you guys. The sense of community here...although toxic, is invaluable. God bless your accounts. 

Also, I am drunk.",t3_jnhpwk,19
1604471043.0,2020-11-04,wallstreetbets,gb3a9lp,"No matter what happens, Nate Silver is a 🤡",t3_jnhpwk,18
1604471268.0,2020-11-04,wallstreetbets,gb3aklu,I like how the mods made a seperate politics thread but we actually just have 2 politics threads.,t3_jnhpwk,19
1604471765.0,2020-11-04,wallstreetbets,gb3b90w,Blew up my account trading future fml🤡🤡,t3_jnhpwk,17
1604477181.0,2020-11-04,wallstreetbets,gb3i4sb,Could a circuit breaker negatively impact stocks?,t3_jnhpwk,19
1604477404.0,2020-11-04,wallstreetbets,gb3ie3l,By far the craziest futures swings I’ve seen in one night holy shit. I went from thinking I was fucked to thinking I was rich like 4 times,t3_jnhpwk,18
1604449776.0,2020-11-04,wallstreetbets,gb2aehz,May whomever win be 100% focused on creating new ATHs in the stock market weekly. Amen.,t3_jnhpwk,17
1604450192.0,2020-11-04,wallstreetbets,gb2b4pr,Biden is doing well in the parts of Florida where they shoot porn,t3_jnhpwk,16
1604453049.0,2020-11-04,wallstreetbets,gb2g4t0,They just gave FL to 🥭,t3_jnhpwk,17
1604462382.0,2020-11-04,wallstreetbets,gb2wtm0,If Biden wins Florida then this is rigged. 97% in and you can’t call it yet?,t3_jnhpwk,17
1604463451.0,2020-11-04,wallstreetbets,gb2ymnx,Gona go to xvideos to look for the step sisters that get stuck trying to get things from under the couch. I’ll be back in 40,t3_jnhpwk,18
1604464878.0,2020-11-04,wallstreetbets,gb30zu4,Market apparently wanted a Trump win so they pumped...now that Biden is gaining ground they dump?,t3_jnhpwk,16
1604465498.0,2020-11-04,wallstreetbets,gb3207o,When limit down?,t3_jnhpwk,18
1604466438.0,2020-11-04,wallstreetbets,gb33hmz,Buying Trump at -600 was like buying Nikola at $80 lol,t3_jnhpwk,18
1604467060.0,2020-11-04,wallstreetbets,gb34gj8,"Wsb can be, one day, its own app.",t3_jnhpwk,18
1604475017.0,2020-11-04,wallstreetbets,gb3fhoy,"“We want all voting to stop”

OMG",t3_jnhpwk,16
1604455937.0,2020-11-04,wallstreetbets,gb2laa2,[deleted],t3_jnhpwk,36
1604471127.0,2020-11-04,wallstreetbets,gb3adp5,Unpopular opinion: DNC would rather have trump than risk offending their corporate overlords with Bernie,t3_jnhpwk,46
1604438576.0,2020-11-04,wallstreetbets,gb1os58,Damn they really are expecting a 3% move either way tomorrow with spy options having IV of 48%,t3_jnhpwk,16
1604439321.0,2020-11-04,wallstreetbets,gb1qc7w,It has been the honor of my life to serve with you gentlemen,t3_jnhpwk,14
1604443937.0,2020-11-04,wallstreetbets,gb1znmt,Can all you pessimists fuck off,t3_jnhpwk,16
1604447938.0,2020-11-04,wallstreetbets,gb275hf,Wait is McConnell actually losing,t3_jnhpwk,15
1604454185.0,2020-11-04,wallstreetbets,gb2i5oy,Wow I definitely do not have enough alcohol,t3_jnhpwk,16
1604455604.0,2020-11-04,wallstreetbets,gb2kpgt,">*Kanye said he was running under a party he created called the Birthday party* ""Because when we win, it's everybody's birthday.""


Just a grim reminder of what we lost in meme potential for these next 4 years.",t3_jnhpwk,15
1604456673.0,2020-11-04,wallstreetbets,gb2mkny,If Biden wins Ohio I'll make an Onlyfans,t3_jnhpwk,16
1604460257.0,2020-11-04,wallstreetbets,gb2t017,What if we open red.. bulls would be in literal shambles after seeing +4%,t3_jnhpwk,16
1604460592.0,2020-11-04,wallstreetbets,gb2tm8t,Holy fuck my account is gonna hurt tomorrow wish I wasn’t a retard bear,t3_jnhpwk,17
1604460960.0,2020-11-04,wallstreetbets,gb2ua4d,"I don’t talk to girls, I don’t get any work done, I don’t sleep ... stocks are ruining my life.. and I love it!",t3_jnhpwk,17
1604461435.0,2020-11-04,wallstreetbets,gb2v4zf,Yang 2024,t3_jnhpwk,17
1604461799.0,2020-11-04,wallstreetbets,gb2vs2u,I honestly think the democratic party is FUCKED if they lose this. In shambles.,t3_jnhpwk,16
1604461820.0,2020-11-04,wallstreetbets,gb2vtg6,"Wendy’s earnings tomorrow before open, that’s what’s pumping NASDAQ",t3_jnhpwk,16
1604462305.0,2020-11-04,wallstreetbets,gb2wonc,"Fucking tech LOL. 

PLEASE RKT, CONVINCE THE MMs THAT YOU’RE TECH",t3_jnhpwk,16
1604462948.0,2020-11-04,wallstreetbets,gb2xs7q,"Everyone said Texas was a swing state. I kept saying hell nah. Bet y’all feel stupid now. 

AAPL 225 12/18",t3_jnhpwk,17
1604465402.0,2020-11-04,wallstreetbets,gb31unm,"""so, tell me about your last job""

""well, i was a pollster""

""oh, you know what? um...yeah...this job has been filled. sorry""",t3_jnhpwk,16
1604465668.0,2020-11-04,wallstreetbets,gb329wc,Who’s gonna laugh when these indices open down .1%,t3_jnhpwk,16
1604466759.0,2020-11-04,wallstreetbets,gb33znl,"###ALIBABA I SUMMON THEE, WAKE THE FUCK UP",t3_jnhpwk,16
1604467031.0,2020-11-04,wallstreetbets,gb34exe,I lost $40k on baba today. I am sad.,t3_jnhpwk,16
1604467177.0,2020-11-04,wallstreetbets,gb34n6z,Legalize cocaine,t3_jnhpwk,16
1604467488.0,2020-11-04,wallstreetbets,gb354n5,This is going to my favorite rug pull of all time. Good luck everyone.,t3_jnhpwk,15
1604469078.0,2020-11-04,wallstreetbets,gb37htx,[deleted],t3_jnhpwk,15
1604469611.0,2020-11-04,wallstreetbets,gb389oj,"just saw Trump's pinned tweet video compilation of him dancing to YMCA. Calls on this shit actually being a simulation, its all too stupid.",t3_jnhpwk,15
1604472347.0,2020-11-04,wallstreetbets,gb3c1mr,Joe diamond hands Biden,t3_jnhpwk,17
1604458203.0,2020-11-04,wallstreetbets,gb2pavz,lmao Trump wins Alabama. Big surprise,t3_jnhpwk,15
1604461888.0,2020-11-04,wallstreetbets,gb2vxvw,I will never trust any of those polls ever again.,t3_jnhpwk,16
1604462017.0,2020-11-04,wallstreetbets,gb2w6e5,this is going to crumble when everyone realizes we aren't getting a winner tonight,t3_jnhpwk,15
1604465629.0,2020-11-04,wallstreetbets,gb327ox,BREAKING NEWS: Nevada vote counter just lost count AGAIN. Expect results in 1-2 weeks.,t3_jnhpwk,15
1604465641.0,2020-11-04,wallstreetbets,gb328cp,People should take their civil unrest out on traffic / red light cameras,t3_jnhpwk,14
1604469451.0,2020-11-04,wallstreetbets,gb3816s,A contested election is a pretty predictable season finale for 2020 tbh,t3_jnhpwk,16
1604469582.0,2020-11-04,wallstreetbets,gb3885x,Trump calls usa a shithole country before 3 am u heard it here first,t3_jnhpwk,15
1604469755.0,2020-11-04,wallstreetbets,gb38gyy,[deleted],t3_jnhpwk,15
1604469888.0,2020-11-04,wallstreetbets,gb38njl,Mango bought the VIX dip,t3_jnhpwk,15
1604470043.0,2020-11-04,wallstreetbets,gb38veq,PA will be accepting mail ins until Friday. Market was pricing in a Biden possible demographic sweep past two days.  It’s gonna be fucked up tomorrow,t3_jnhpwk,16
1604470978.0,2020-11-04,wallstreetbets,gb3a6gi,I have taken more covid tests than I have std tests,t3_jnhpwk,16
1604471609.0,2020-11-04,wallstreetbets,gb3b1i2,Somebody please explain how Lindsey Graham still has a job?,t3_jnhpwk,15
1604471887.0,2020-11-04,wallstreetbets,gb3bevv,"It’s year 2020, and we still count absentee vote manually. Puts on our government.",t3_jnhpwk,15
1604472199.0,2020-11-04,wallstreetbets,gb3bue8,Feel like Biden Voters are having a “Battery Day”.,t3_jnhpwk,15
1604472758.0,2020-11-04,wallstreetbets,gb3clhh,Futes going red soon I’ve been edging all night for this,t3_jnhpwk,15
1604475107.0,2020-11-04,wallstreetbets,gb3fm0e,Drill Team 6 reporting!,t3_jnhpwk,14
1604483472.0,2020-11-04,wallstreetbets,gb3on7r,The amount of Biden supporters on this thread shocks me tbh.,t3_jnhpwk,15
1604434882.0,2020-11-04,wallstreetbets,gb1gxah,Mods forgot to turn their clock back 1 hr 😆🤣,t3_jnhpwk,14
1604439569.0,2020-11-04,wallstreetbets,gb1quxm,Bears will probably have their moment tonight just to spite us all call holders,t3_jnhpwk,14
1604443116.0,2020-11-04,wallstreetbets,gb1y1ge,"# when ya'll gonna learn that

# Eventual heat death of the universe is fucking priced in",t3_jnhpwk,13
1604446219.0,2020-11-04,wallstreetbets,gb23z99,Futures gonna be WILD tn🎢😍,t3_jnhpwk,13
1604447041.0,2020-11-04,wallstreetbets,gb25i0p,"We went from testing 323 to now breaking 339 within 2 trading sessions.  
  
A 5% rise. Insane.",t3_jnhpwk,15
1604447693.0,2020-11-04,wallstreetbets,gb26pcb,Legalize it.,t3_jnhpwk,13
1604452927.0,2020-11-04,wallstreetbets,gb2fwyu,I am moving to Canada if Kanye loses,t3_jnhpwk,14
1604453998.0,2020-11-04,wallstreetbets,gb2htku,Spy needs to be down 4% for my puts to print,t3_jnhpwk,14
1604455795.0,2020-11-04,wallstreetbets,gb2l1e6,I haven't felt this alive since March,t3_jnhpwk,16
1604460889.0,2020-11-04,wallstreetbets,gb2u5i8,Bears tomorrow: “I dIDN’t heAr NO Bell”,t3_jnhpwk,14
1604460997.0,2020-11-04,wallstreetbets,gb2ucl0,Nothing like celebrating unrealized gains!! LFG BOYS lmao,t3_jnhpwk,13
1604462448.0,2020-11-04,wallstreetbets,gb2wxv3,Buying puts on storefront windows,t3_jnhpwk,14
1604463991.0,2020-11-04,wallstreetbets,gb2zixo,Tonight's futures have been more exciting than my sex life the past 6 months,t3_jnhpwk,15
1604465306.0,2020-11-04,wallstreetbets,gb31p45,Lmfao if the election isn’t called tonight option volatility will be fucking insane,t3_jnhpwk,13
1604465787.0,2020-11-04,wallstreetbets,gb32gp2,"Either way, puts on pollsters.",t3_jnhpwk,14
1604465852.0,2020-11-04,wallstreetbets,gb32kh6,Imagine being happy a Republican won Texas lmfao,t3_jnhpwk,14
1604466472.0,2020-11-04,wallstreetbets,gb33jhw,gay by open,t3_jnhpwk,14
1604466635.0,2020-11-04,wallstreetbets,gb33snc,Four more years of market manipulation using Twitter!,t3_jnhpwk,14
1604466888.0,2020-11-04,wallstreetbets,gb346ww,Damn looks like Kanye is conceding things are becoming a little more clear,t3_jnhpwk,14
1604466957.0,2020-11-04,wallstreetbets,gb34are,Market pumps for Biden market pumps for trump,t3_jnhpwk,14
1604467184.0,2020-11-04,wallstreetbets,gb34nn4,Damn I’m drunk and confused af,t3_jnhpwk,13
1604468602.0,2020-11-04,wallstreetbets,gb36sp1,This speech is giving me TSLA battery day honking flashbacks,t3_jnhpwk,14
1604468717.0,2020-11-04,wallstreetbets,gb36yln,"Just like to remind the proud retards here we aren't a sub reddit of red retards and blue retards, we are a subreddit of United retards",t3_jnhpwk,14
1604469828.0,2020-11-04,wallstreetbets,gb38kk8,Market gonna be fucky tomorrow,t3_jnhpwk,12
1604470857.0,2020-11-04,wallstreetbets,gb3a0bx,Guys Chimpu just called and said we trade between 280 and 369 plan accordingly,t3_jnhpwk,13
1604472200.0,2020-11-04,wallstreetbets,gb3buft,Can’t wait til Trump comes out and declares victory ✌️ Shit will go crazy...,t3_jnhpwk,14
1604472940.0,2020-11-04,wallstreetbets,gb3cu3v,HOLY FUCK IVE HAD LIKE 8 heart attacks tonight,t3_jnhpwk,14
1604472957.0,2020-11-04,wallstreetbets,gb3cuxm,"bulls get fucked for dancing up 2%, now you’re barely up .3% and going red soon, get fucked",t3_jnhpwk,15
1604474304.0,2020-11-04,wallstreetbets,gb3em1f,[deleted],t3_jnhpwk,14
1604475096.0,2020-11-04,wallstreetbets,gb3fli8,"Trump wants to go to Supreme Court for the votes.

Tomorrow might be chaos",t3_jnhpwk,13
1604475221.0,2020-11-04,wallstreetbets,gb3fr32,This is a pivotal moment for our democracy,t3_jnhpwk,14
1604475839.0,2020-11-04,wallstreetbets,gb3gihb,"Holy shit, wish i had grabbed a screenshot of CNN. Big bar headline just reads ""Trump says he'll go to the Supreme Court; Unclear why."" 🤣🤣🤣",t3_jnhpwk,14
1604475872.0,2020-11-04,wallstreetbets,gb3gjw8,"^tomorrows ^headlines
#markets up on hopes of hope",t3_jnhpwk,13
1604476219.0,2020-11-04,wallstreetbets,gb3gz7g,"Just woke up to fucking chaos 

What the fuck america",t3_jnhpwk,15
1604480517.0,2020-11-04,wallstreetbets,gb3lq23,Can we all admit that the real losers tonight are Uber and Lyft drivers in California. Rip,t3_jnhpwk,13
1604480689.0,2020-11-04,wallstreetbets,gb3lw3t,"ToO EaRlY tO cAlL, but looks like bears lost the election lol",t3_jnhpwk,15
1604437356.0,2020-11-04,wallstreetbets,gb1m9tu,Half of wsb hoping for civil unrest and contested election to save their weeklies,t3_jnhpwk,30
1604439069.0,2020-11-04,wallstreetbets,gb1ptj3,"Whatever happens tonight, it’s been a pleasure gentlemen",t3_jnhpwk,28
1604440192.0,2020-11-04,wallstreetbets,gb1s5pc,I really want a drop to happen so I can quit being a bear,t3_jnhpwk,28
1604453502.0,2020-11-04,wallstreetbets,gb2gxqm,"Pelosi and Mnuchin just released a statement that they are hopeful that a stimulus might get done before the election, but still a ways apart",t3_jnhpwk,30
1604460587.0,2020-11-04,wallstreetbets,gb2tlwa,"“I will only raise taxes for people making over $400k”

A 26 year old McDonalds worker in Kentucky with no college degree:

_”That could be me one day”_",t3_jnhpwk,32
1604465095.0,2020-11-04,wallstreetbets,gb31crk,Melania in shambles that mango has a chance.,t3_jnhpwk,34
1604471184.0,2020-11-04,wallstreetbets,gb3agm2,Lindsey Graham gay as fk,t3_jnhpwk,29
1604477970.0,2020-11-04,wallstreetbets,gb3j1uj,"If anyone is wondering, the US president threatening to refuse to accept election results is worth exactly 22 minutes of market panic",t3_jnhpwk,29
1604435612.0,2020-11-04,wallstreetbets,gb1ihm3,Someone didn’t code in daylight savings time,t3_jnhpwk,14
1604437333.0,2020-11-04,wallstreetbets,gb1m83n,"Alright nerds... it’s officially too late for us all. We are locked in , now let’s watch the show",t3_jnhpwk,13
1604437449.0,2020-11-04,wallstreetbets,gb1mh65,AH trading like no one heard the bell,t3_jnhpwk,13
1604440564.0,2020-11-04,wallstreetbets,gb1sy1i,This entire decade has been some alternate reality.  If 10 years ago you’d have told me Kanye West would be right by Donald Trump on an election ballot I would’ve told ya it sounds like a skit on the Chappelle’s show.,t3_jnhpwk,13
