created,date,subreddit,id,body,parent_id,score
1614891717.0,2021-03-05,wallstreetbets,gpp4yr2,"Jpow's words were taken out of context by the mainstream media. 

Bullish from here on out.",t3_lxva6s,67
1614892385.0,2021-03-05,wallstreetbets,gpp6jfn,"Pro tip 

If you get margin called just hang up 🦬",t3_lxva6s,112
1614892299.0,2021-03-05,wallstreetbets,gpp6c4p,"JPow, just skip the next one fam. Straight up no show. Cameras rolling, empty chair status.",t3_lxva6s,22
1614892979.0,2021-03-05,wallstreetbets,gpp7wwy,"The bottom isn’t in, I just bought more so we are red tomorrow",t3_lxva6s,22
1614895978.0,2021-03-05,wallstreetbets,gppep8f,i feel real bad for people who discovered trading in like mid dec to now! i had a nice 300% run up for this bearish bullshit they just got thrown right into the shit storm,t3_lxva6s,22
1614896145.0,2021-03-05,wallstreetbets,gppf2i4,Tomorrow another +5% day for bond yields and we’re all broke,t3_lxva6s,23
1614897746.0,2021-03-05,wallstreetbets,gppih2x,How do you buy the dip when you used all your cash to buy the previous dips?,t3_lxva6s,22
1614898039.0,2021-03-05,wallstreetbets,gppj2yd,If we have a red day tomorrow I'm going to personally go out into the woods and beat the fuck out of a grizzly.,t3_lxva6s,22
1614900070.0,2021-03-05,wallstreetbets,gppn9qj,"cramer saying to go all cash.

limit up.",t3_lxva6s,21
1614900241.0,2021-03-05,wallstreetbets,gppnm3b,10 bucks says that even if GME reaches 1k half this sub will end up bagholding because 'the squeeze is not squoze',t3_lxva6s,22
1614910312.0,2021-03-05,wallstreetbets,gpq76sp,"23, male, hobbies include selling for >50% losses and immediately regretting plays no matter how well planned. Low maintenance but startles easily. $20 obo.",t3_lxva6s,22
1614913838.0,2021-03-05,wallstreetbets,gpqduxb,Calling a face ripping rally tomorrow to burn everyone who sold stonks today to buy puts,t3_lxva6s,22
1614913951.0,2021-03-05,wallstreetbets,gpqe29b,Lol I really hope there is a major turn around in the next few weeks or I am fkd,t3_lxva6s,21
1614917850.0,2021-03-05,wallstreetbets,gpqkybc,"Can’t wait to open flat/green just to get another giant rug pull by 945, fall to 15% down on the day by 11, flatline during lunch, and then slowly soak up the blood to a -9% day. All while I do fucking nothing for my job and debate what shitty boring value stock I should buy next before money rotates again. As is tradition.",t3_lxva6s,22
1614923603.0,2021-03-05,wallstreetbets,gpqtqwu,"It’s 1AM, I’m not addicted. You are.",t3_lxva6s,22
1614929206.0,2021-03-05,wallstreetbets,gpr0qtd,All I want is enough money to get a functional cocaine addiction.,t3_lxva6s,21
1614933853.0,2021-03-05,wallstreetbets,gpr5y58,"💰💰💰💰💰💰💰💰💰💰🐂🐂🐂🐂🐂🐂🐂🐂

You’ve just found the golden bull! Congrats on the 100 more years of bull markets and 10 baggers galore! 

📈📈📈📈📈📈📈📈📈📈📈📈📈📈📈📉📈📈",t3_lxva6s,23
1614936495.0,2021-03-05,wallstreetbets,gpr8yb3,"Just deposited another 1500 into my account. You know...

For dip buying and whatnot",t3_lxva6s,22
1614939100.0,2021-03-05,wallstreetbets,gprbp71,[deleted],t3_lxva6s,22
1614891638.0,2021-03-05,wallstreetbets,gpp4rov,Applying to Wendys,t3_lxva6s,64
1614893161.0,2021-03-05,wallstreetbets,gpp8bv6,I need PLTR to pull a rkt mortgage move. From $24 to $40+,t3_lxva6s,66
1614893509.0,2021-03-05,wallstreetbets,gpp94gw,PLTR is that girl in highschool who isnt all that attractive but in five years.... SHEEEEEESH.,t3_lxva6s,66
1614892918.0,2021-03-05,wallstreetbets,gpp7rnk,"Today was fun, right? 

So tomorrow I'm going to wake up. Have a morning piss. Look in the mirror and say to myself, ""have fun being poor, idiot.""",t3_lxva6s,21
1614894485.0,2021-03-05,wallstreetbets,gppbcms,Strange to actually see PLTR in the green today. i was getting so used to seeing PLTR red.,t3_lxva6s,20
1614895281.0,2021-03-05,wallstreetbets,gppd5eb,I actually root for a good drill now. Just get this over with and start the recovery sooner.,t3_lxva6s,22
1614895831.0,2021-03-05,wallstreetbets,gppedet,Buying more GME because that's the only thing that makes money rather than loses 10%+ a day 3 weeks straight.,t3_lxva6s,22
1614898465.0,2021-03-05,wallstreetbets,gppjzn0,My account used to go up and down 10k daily. Now it goes down and down 10k daily 🤔,t3_lxva6s,21
1614899214.0,2021-03-05,wallstreetbets,gppljge,i dont own it or know anything about it (other than it's tiny so please dont ban me) but 𝐆𝐀𝐘𝐌𝐅 is the funniest fucking ticker out there,t3_lxva6s,21
1614899335.0,2021-03-05,wallstreetbets,gpplsec,Hey guys did you know on the TD mobile app if you deposit more money than you lose then it looks like you are up on the day? Haven’t had a red day all month! 🍾,t3_lxva6s,21
1614904951.0,2021-03-05,wallstreetbets,gppwvf6,"Cramer just said the sell off is real.

So it's probably time to load the fuck up.

Except I'm already running out of capital to buy the dip.",t3_lxva6s,20
1614905284.0,2021-03-05,wallstreetbets,gppxilt,"We're definitely at the ""irrational selling of everything"" stage..",t3_lxva6s,20
1614905563.0,2021-03-05,wallstreetbets,gppy1y0,Is it still bagholding when its my whole portfolio?,t3_lxva6s,21
1614905971.0,2021-03-05,wallstreetbets,gppyuf2,[deleted],t3_lxva6s,20
1614911516.0,2021-03-05,wallstreetbets,gpq9hvz,“Buy when there is blood in the streets even if some of that blood is you’re own”,t3_lxva6s,21
1614912219.0,2021-03-05,wallstreetbets,gpqauux,Imagine not owning an air fryer in 2021 lmao,t3_lxva6s,20
1614912519.0,2021-03-05,wallstreetbets,gpqbfa6,Imagine being down overall the last year in this crazy run up. I don’t have to cus I am,t3_lxva6s,21
1614914582.0,2021-03-05,wallstreetbets,gpqf7wg,At least I can stop pretending to be a day trader and become a productive member of society again,t3_lxva6s,21
1614915198.0,2021-03-05,wallstreetbets,gpqgbiv,Plan for tomorrow: Buy 0DTE calls on a random ticker thinking I’m smarter than the market and watching my account go to -83%.,t3_lxva6s,20
1614915348.0,2021-03-05,wallstreetbets,gpqgl4v,At least the casino gives ya free drinks and a buffet voucher,t3_lxva6s,20
1614916081.0,2021-03-05,wallstreetbets,gpqhw60,You guys remember when you’d wake up to a green portfolio? I member....,t3_lxva6s,19
1614916289.0,2021-03-05,wallstreetbets,gpqi9dd,"Puts in $ASS 

*laughs for seventeen minutes*",t3_lxva6s,22
1614918893.0,2021-03-05,wallstreetbets,gpqmosi,"I can't believe I'm saying this, but GME had a pretty bullish daily chart today. 3 inside days leading into a break up. Tomorrow may get nutty.",t3_lxva6s,21
1614934761.0,2021-03-05,wallstreetbets,gpr7077,"1 minute countdown

INSOMNIAC GANG RISE UP!",t3_lxva6s,22
1614935410.0,2021-03-05,wallstreetbets,gpr7qu1,My profanity is up like 600% since subbing here.,t3_lxva6s,21
1614936830.0,2021-03-05,wallstreetbets,gpr9bip,The good news is when your position goes down 10% everyday the daily loss $ amount gets smaller,t3_lxva6s,21
1614938627.0,2021-03-05,wallstreetbets,gprb7sb,What are you doing step market,t3_lxva6s,21
1614939080.0,2021-03-05,wallstreetbets,gprbogl,GME at $129.5..... 👀,t3_lxva6s,23
1614946910.0,2021-03-05,wallstreetbets,gprkrce,"Motley Fool just put out an article called ""Don't gamble on Gamestop. buy these 2 surefire Growth stocks instead"". So if Ryan Cohen posts a frog emoji it's market manipulation, but when media says ""buy these stocks that are going to go up 100%"" that's totally fine. Makes sense to me. Still like the stock tho",t3_lxva6s,20
1614891668.0,2021-03-05,wallstreetbets,gpp4uf7,#Who’s holding GME 🚀,t3_lxva6s,639
1614896438.0,2021-03-05,wallstreetbets,gppfpec,[deleted],t3_lxva6s,186
1614892881.0,2021-03-05,wallstreetbets,gpp7oml,Tomorrow going to be one of the biggest bull runs ever.,t3_lxva6s,19
1614895596.0,2021-03-05,wallstreetbets,gppdu6z,Boys we nearly gone through this. Only one red day tomorrow left and another 2 red weeks 🤡,t3_lxva6s,21
1614896543.0,2021-03-05,wallstreetbets,gppfxmc,"My next play:

https://wendys-careers.com/job-search/?utm_campaign=Wendy%27s%202021%20-%20Major%20Markets-Branded%20Terms%20and%20Competitors",t3_lxva6s,19
1614899056.0,2021-03-05,wallstreetbets,gppl7td,[deleted],t3_lxva6s,20
1614900546.0,2021-03-05,wallstreetbets,gppo7yd,Cramer doesn’t like the Roblox IPO coming up. That means it’s a buy!,t3_lxva6s,21
1614905108.0,2021-03-05,wallstreetbets,gppx6fc,"So uh, stop losses all got triggered and all I hold now is ten shares of GME I bought at $29

What the fuck is going on",t3_lxva6s,21
1614906066.0,2021-03-05,wallstreetbets,gppz0z1,Cathie is going to end up fucking over both TSLA and PLTR. Legitimately sad to see.,t3_lxva6s,20
1614908283.0,2021-03-05,wallstreetbets,gpq3bjx,"Can we just crash all the way so we can start recovering, come on.",t3_lxva6s,19
1614909177.0,2021-03-05,wallstreetbets,gpq512d,If you’re new and out of money we won’t mind if you leave,t3_lxva6s,19
1614909414.0,2021-03-05,wallstreetbets,gpq5h96,[deleted],t3_lxva6s,21
1614910483.0,2021-03-05,wallstreetbets,gpq7imb,Yeah bears are gay but cash gang doesn’t even have the balls to play this market,t3_lxva6s,20
1614910601.0,2021-03-05,wallstreetbets,gpq7qkj,"I'm buying a shit load of puts Gents, that means we rebound tomorrow!",t3_lxva6s,19
1614913370.0,2021-03-05,wallstreetbets,gpqd095,When you buy the dip and it dips another 3 times after that 😫,t3_lxva6s,20
1614916526.0,2021-03-05,wallstreetbets,gpqioa8,Controversial take here but I get fucked more on diamond handing shit than paper handing. Take profits when you hit that dilemma in your head,t3_lxva6s,20
1614917670.0,2021-03-05,wallstreetbets,gpqknb4,How do I stop tormenting myself over losing the life changing amount of money I had a month ago?,t3_lxva6s,20
1614919309.0,2021-03-05,wallstreetbets,gpqncym,[deleted],t3_lxva6s,20
1614919866.0,2021-03-05,wallstreetbets,gpqo8s0,The market looking a lot like maybe investing in GME isn’t such a shit idea,t3_lxva6s,20
1614920933.0,2021-03-05,wallstreetbets,gpqpvi0,Media sure is driving home the message that the market is shitty. Probably time to buy,t3_lxva6s,21
1614921109.0,2021-03-05,wallstreetbets,gpqq55e,"How one accidently joins theta gang 101

1. Buy tons of shares in shit stocks
2. Forcefully become long term investor
3. write covered call to recoup loss
4. repeat",t3_lxva6s,20
1614921366.0,2021-03-05,wallstreetbets,gpqqj2w,Portnoy making an ETF was the top.,t3_lxva6s,20
1614922219.0,2021-03-05,wallstreetbets,gpqrsqz,"So just as a heads up / educational advice, this dip was planned and heavily telegraphed last week and the process started back in December with a massive 7 billion dollar dark pool influx into the bond market. The setup was heavily telegraphed last week when the vix spiked up 30% on Thursday. When you get spikes like that without much market movement (talking like under 3% swings) it's a heavy option flow increase. The setup was further confirmed when we had the MASSIVE equity dump EOD Friday, you can check the charts we're talking 6 million apple shares, Amazon, etc. And a MASSIVE share buy influx into the inverse ETF's and vix trackers IE SQQQ UVXY etc. The same exact thing happened before our last correction in October, you can look it up and see the exact same pattern before everything went to shit.

March is going to be red unless we get a crazy amount of QE from the fed which is a 50/50 chance but they could let this play out to keep eyes off inflation fears. Overall, don't try to catch knives right now, either stay out or time puts. You will get fucked trying to catch the bottom.",t3_lxva6s,20
1614923091.0,2021-03-05,wallstreetbets,gpqt19i,What are my moves for tomorrow? I'm gonna go to work and check my phone every 5 minutes so i can watch my portfolio continually go down the shitter. Weeeeeeeeeeeeee!    👦🔫,t3_lxva6s,20
1614928480.0,2021-03-05,wallstreetbets,gpqzw7g,Going to buy an Apple Watch to convince other people I'm not poor,t3_lxva6s,21
1614928571.0,2021-03-05,wallstreetbets,gpr003g,I overheard someone say last month “The market is easy. You just never sell when it’s down— and it’s never really going down.” I’d love to hear what that douchenozzle is saying right now,t3_lxva6s,21
1614929177.0,2021-03-05,wallstreetbets,gpr0pk6,"The more WSB resembles stocktwits, the closer the bubble is to being popped. That's my new indicator.",t3_lxva6s,20
1614930783.0,2021-03-05,wallstreetbets,gpr2jol,$SHART is about to explode,t3_lxva6s,19
1614940039.0,2021-03-05,wallstreetbets,gprcox9,GME $131. Fly fly fly 🚀🐸🚀🐸🚀🐸🚀🐸🚀,t3_lxva6s,19
1614940225.0,2021-03-05,wallstreetbets,gprcwbi,[deleted],t3_lxva6s,19
1614941046.0,2021-03-05,wallstreetbets,gprds68,GME GME GME WE ARE DOING IT GME GME GME GME,t3_lxva6s,19
1614892271.0,2021-03-05,wallstreetbets,gpp69rx,"My girlfriends parents dog just died and during the cancellation of the auto renew for his food, not only did a CS rep reach out and offer a refund for the last cycle, but Chewy also sent a huge bouquet of flowers to their house...


What other companies do this type of stuff for someone? Fuck all other pet supply companies. 
Chewy has a customer for life.",t3_lxva6s,93
1614892355.0,2021-03-05,wallstreetbets,gpp6gw7,[deleted],t3_lxva6s,92
1614893316.0,2021-03-05,wallstreetbets,gpp8oq1,">Whole market tumbles downwards

>GME 5% up

Oh you  know what my moves are tomorrow.",t3_lxva6s,55
1614893993.0,2021-03-05,wallstreetbets,gppa85l,"Ryan Cohen's new tweet. It's a sock puppet from a pets.com add. In the add the puppet looks at the driver and says, 'I like your shorts."" 

https://twitter.com/ryancohen/status/1367555194196787206?s=19",t3_lxva6s,61
1614895133.0,2021-03-05,wallstreetbets,gppctcf,"Buy stuff you believe in...


Average down 3 times till your 90% into something.

Rationally decide the floor is much closer and you were long in this position and nothing has changed.

See GME spike.... think about possibly dip before easy tendies.

Sell stocks you believe in.... they go up 3% literally within a minute and recover another 4% eod.

Have 2nd thoughts about being dumb and buying $gme again.

Sit on 78% of portfolio in cash while everything you sold gains a bit back.


Probably do that again.",t3_lxva6s,58
1614892668.0,2021-03-05,wallstreetbets,gpp775k,I'm gonna buy more $CUM,t3_lxva6s,18
1614895696.0,2021-03-05,wallstreetbets,gppe2ef,"Yesterday my account was a tragedy, today I realized it’s a fucking comedy.",t3_lxva6s,19
1614895960.0,2021-03-05,wallstreetbets,gppenpm,The market can stay irrational longer than you can keep rolling your tech calls,t3_lxva6s,18
1614896051.0,2021-03-05,wallstreetbets,gppev60,"TSLA has been **straight** down the past 3 days. 

It's impressive, really.",t3_lxva6s,20
1614897366.0,2021-03-05,wallstreetbets,gppho9t,"Okay bears, you’ve had your fun, now give me back my underwear so I can go",t3_lxva6s,18
1614898207.0,2021-03-05,wallstreetbets,gppjfrc,PLTR>SNOW,t3_lxva6s,18
1614898367.0,2021-03-05,wallstreetbets,gppjs4h,Today showed me that I have a gambling problem. I literally can’t stop buying the fucking dip. I’m not even trying to be funny saying this. I have to pull myself away from the market for a few days for a reset or something.,t3_lxva6s,20
1614899449.0,2021-03-05,wallstreetbets,gppm0jh,Cramer said we are in the clear after the last vix spike a few days ago now tonight he says we need to go thru the stages of grief with more downside,t3_lxva6s,21
1614900194.0,2021-03-05,wallstreetbets,gppnio2,"Speculative tech is fucked. 

I am fucked.",t3_lxva6s,18
1614901582.0,2021-03-05,wallstreetbets,gppqa42,"Ok, so if I Yolo again into GME, and use up all of my margin, I can buy roughly 13k shares then immediately sell a $135 weekly call and net 400k. It literally can't go tits up.

Edit: LOL thanks for the award!",t3_lxva6s,18
1614903087.0,2021-03-05,wallstreetbets,gppt7li,[deleted],t3_lxva6s,20
1614906522.0,2021-03-05,wallstreetbets,gppzwpk,"IM BUYING THESE DIPS. Either we gon bounce back or this is gonna be another recession/depression and ima jump off a bridge and get a cool ""It's a Wonderful Life"" sendoff",t3_lxva6s,19
1614906869.0,2021-03-05,wallstreetbets,gpq0kwb,"Don't worry guys. I heard this sub is getting a $1,400 dollar bail out.",t3_lxva6s,21
1614906938.0,2021-03-05,wallstreetbets,gpq0pt1,"Ok this has to be the bottom, right? Because i broke my fucking spine when we hit it",t3_lxva6s,18
1614907908.0,2021-03-05,wallstreetbets,gpq2lf6,2021: Market crashes and gamestop survives.,t3_lxva6s,18
1614908081.0,2021-03-05,wallstreetbets,gpq2xdi,"Down 14k since Feb 17th and got fired on Monday. Been a tough couple weeks but I’m still smiling, let’s get this $$$ baby",t3_lxva6s,18
1614908846.0,2021-03-05,wallstreetbets,gpq4e8t,"I love this sub because whatever amount of money I lose, there's always people here who manage to lose more which makes me slightly less sad.",t3_lxva6s,20
1614909050.0,2021-03-05,wallstreetbets,gpq4s76,"Market isn’t collapsing. If you zoom out this looks pretty healthy. Im just looking forward to the inevitable face ripper on the way back up. Don’t get caught with your dick out like last year

200p",t3_lxva6s,19
1614909457.0,2021-03-05,wallstreetbets,gpq5k91,I am seriously dreading the embarrassment of having to explain the past year to my accountant,t3_lxva6s,19
1614910688.0,2021-03-05,wallstreetbets,gpq7wi5,"My husband wants to ""assess our portfolios"" over the weekend and ""make a plan"". 

I don't even know who he is anymore. My plan is to go down swinging.",t3_lxva6s,19
1614910919.0,2021-03-05,wallstreetbets,gpq8ciw,"🐻📉 pp ╰⋃╯

🐂 📈 pp B=================D",t3_lxva6s,19
1614911394.0,2021-03-05,wallstreetbets,gpq99i5,"Guys, Jesus didn't take the wheel from Cathie.... It was fucken Tiger Woods 🤣",t3_lxva6s,19
1614912152.0,2021-03-05,wallstreetbets,gpqaq2m,"i have an exhaust leak on my tesla

and for some reason it says corolla on the back, elon you jokester",t3_lxva6s,19
1614912198.0,2021-03-05,wallstreetbets,gpqatcu,Bought 6k worth of TSLA and aapl calls and spy yesteday... current value is 2k if not less,t3_lxva6s,20
1614912587.0,2021-03-05,wallstreetbets,gpqbjvg,"If we're green tomorrow, that's probably cause I sold at the bottom. You're welcome.",t3_lxva6s,19
1614912854.0,2021-03-05,wallstreetbets,gpqc1rf,Feels like the whole sub is gonna buy puts tomorrow and that will be the bottom.,t3_lxva6s,19
1614912873.0,2021-03-05,wallstreetbets,gpqc31c,[deleted],t3_lxva6s,19
1614913447.0,2021-03-05,wallstreetbets,gpqd5bm,Did y’all listen to go he CNBC interview with the hedge fund guy? Said he predicted this and made bank. Closed 70% of his shorts today and plans to close the rest tomorrow. Same with one of the regulars. Seems like the big boys could be calling the bottom here and moving into their sold off favorites. We ‘should’ see select stocks move against the market tomorrow.,t3_lxva6s,20
1614913745.0,2021-03-05,wallstreetbets,gpqdotv,"I see at least 15% to 20% of yall have hope that we have ""reached the bottom"". Thank you for confirming we have a very bloody couple weeks ahead of us.",t3_lxva6s,18
1614913825.0,2021-03-05,wallstreetbets,gpqdu4m,#PLTR held its ground today and so did #GME,t3_lxva6s,19
1614914163.0,2021-03-05,wallstreetbets,gpqeg44,Tesla is down and oil is up. Dad is that you?,t3_lxva6s,18
1614914687.0,2021-03-05,wallstreetbets,gpqfen9,"Cramer yesterday: “buy buy buy! I love NVDA, I love tech”
Cramer today: “this sell-off is real.”

Really having our back there Jim.",t3_lxva6s,20
1614915802.0,2021-03-05,wallstreetbets,gpqheew,Fuck it I’ll buy more gme tomorrow,t3_lxva6s,20
1614916875.0,2021-03-05,wallstreetbets,gpqja5z,"I used to lose money. I still do, but I used to, too.",t3_lxva6s,18
1614916893.0,2021-03-05,wallstreetbets,gpqjb97,I swear to god i’ll delete my broker account if we open red tomorrow,t3_lxva6s,17
1614918340.0,2021-03-05,wallstreetbets,gpqlrys,"Delete Robinhood, this is financial advise.",t3_lxva6s,18
1614920846.0,2021-03-05,wallstreetbets,gpqpqtk,Bagholding like 80% of my portfolio at this point. No point in selling now,t3_lxva6s,20
1614922507.0,2021-03-05,wallstreetbets,gpqs7nu,My whole portfolio except gme is bleeding from every orifice..,t3_lxva6s,20
1614924979.0,2021-03-05,wallstreetbets,gpqvkyt,"Just went to the casino for 4 hour’s and played slots the entire time while occasionally looking at futures. Walked out down only $300. I wake up at times at 4am to check out pre-market trading and look at losses in my memefolio that are quadruple that number and bleed out throughout the day. 

It literally felt like nothing to walk out of there losing the money. I actually felt like I gained entertainment value while playing slots as I wasn’t chasing losses... I feel like this trip to the casino made me realize how much seeing the numbers on a screen decrease in value means basically nothing. I have entered the danger zone and the fast track to bankruptcy.",t3_lxva6s,19
1614926892.0,2021-03-05,wallstreetbets,gpqxzu2,Guys I sold all my stocks for a loss today so I can keep buying the dip. Am I doing it right ?,t3_lxva6s,19
1614928162.0,2021-03-05,wallstreetbets,gpqzio5,"China providing stimulus for EV purchases and expanding Charging Stations across china.

Nio back on the menu",t3_lxva6s,18
1614928275.0,2021-03-05,wallstreetbets,gpqznji,APHA PLTR,t3_lxva6s,19
1614930855.0,2021-03-05,wallstreetbets,gpr2mkt,[deleted],t3_lxva6s,19
1614931082.0,2021-03-05,wallstreetbets,gpr2vp1,If a bot replies to this I'll bust a sticky load on it's fucking circuit board,t3_lxva6s,19
1614931258.0,2021-03-05,wallstreetbets,gpr32uh,"lmao me buying 300 shares of GME and selling a month before the big boom. 

Me regretting it bigly. 

Me losing a huge chunk of my portfolio in ""safe"" investments""

Me realizing the GME train is too late and too expensive now anyway. 

Me getting into AMC only for it to just be ignored and devalued.",t3_lxva6s,20
1614937082.0,2021-03-05,wallstreetbets,gpr9l9x,"TSLA has had 15 corrections of 30% since IPO, 4 of 40%, and one of 60% (last March). We are currently at a 30% correction.
Do with that as you may.",t3_lxva6s,17
1614944150.0,2021-03-05,wallstreetbets,gprh9y9,"Thinking about putting all i have in $ASS, just worried that i miss out on $CUM",t3_lxva6s,19
1614893355.0,2021-03-05,wallstreetbets,gpp8rxt,"FUNNIST COMMENT I READ ON WSB 🤣🤣😭😭🤣🤣

“ My grandma spent years buying and holding stocks, holding life insurance policies and using CDs to give me what I’ve got. I just pissed it all away in two bad weeks.”

Update: 🤣🤣🤣🤣🤣🤣🤣",t3_lxva6s,170
1614892457.0,2021-03-05,wallstreetbets,gpp6pig,My yearly gains disappeared faster than a boomer sent to a New York nursing home.,t3_lxva6s,17
1614894326.0,2021-03-05,wallstreetbets,gppazju,I hope y’all held cause that was the last red day of March.,t3_lxva6s,18
1614894738.0,2021-03-05,wallstreetbets,gppbxbb,"Why do these motha fuckas give a shit about treasury yield increasing to 2% so much that the entire market dies?
You get those returns weekly flipping spy and qqq stock.",t3_lxva6s,18
1614895272.0,2021-03-05,wallstreetbets,gppd4ow,Haha. I’m in danger 😀,t3_lxva6s,19
1614898250.0,2021-03-05,wallstreetbets,gppjj65,Feels like a Little Caesar's kinda night,t3_lxva6s,17
1614898558.0,2021-03-05,wallstreetbets,gppk6lc,"CNBC: ""Wall street bets is targeting $CUM $COCK $ASS""",t3_lxva6s,17
1614899702.0,2021-03-05,wallstreetbets,gppmj1c,"Tomorrow WH announces $14,000 stimmy for all, comprehensive plan for vaccine distribution and re opening the country, and unemployment at record lows.

Market drops 5%",t3_lxva6s,18
1614902527.0,2021-03-05,wallstreetbets,gpps46l,At this rate I’m a long term investor,t3_lxva6s,18
1614903128.0,2021-03-05,wallstreetbets,gpptafj,Cathie is just getting her faith tested.,t3_lxva6s,18
1614903147.0,2021-03-05,wallstreetbets,gpptbrr,"cathie woods has insane 177% year with arkk 

Boomers:👨‍🦯 

Cathie woods arkk down 6% YTD 

Boomers:😩😩💦💦",t3_lxva6s,18
1614903568.0,2021-03-05,wallstreetbets,gppu5s4,So I bought 50k worth of TSLA puts at the open green spike but sold them immediately because I was scared 🤡,t3_lxva6s,19
1614905043.0,2021-03-05,wallstreetbets,gppx1u6,I wonder how's pelosi's calls doing,t3_lxva6s,17
1614905649.0,2021-03-05,wallstreetbets,gppy7rc,This bitch Cathie bought the dip again,t3_lxva6s,17
1614906724.0,2021-03-05,wallstreetbets,gpq0arz,"Wonder how many twitter stock guru and Instagram influencers we're losing during this pull back.

Sad trombone.",t3_lxva6s,17
1614906748.0,2021-03-05,wallstreetbets,gpq0cd8,"I’m taking a break and deleting Reddit for the next 3 months.

Got get less screen time and stop obsessing about tickers and actually study for college. Still in the green this year. 100% cash.",t3_lxva6s,19
1614908138.0,2021-03-05,wallstreetbets,gpq31hh,I think that fact nikola is still worth 5 bill means we may still have much further to go,t3_lxva6s,18
1614909719.0,2021-03-05,wallstreetbets,gpq62dx,[deleted],t3_lxva6s,18
1614909798.0,2021-03-05,wallstreetbets,gpq67x3,This market is really more afraid of bonds than a plague lol,t3_lxva6s,18
1614909818.0,2021-03-05,wallstreetbets,gpq69af,At least tomorrow's -15% wont hit as hard as todays -15%,t3_lxva6s,17
1614909990.0,2021-03-05,wallstreetbets,gpq6kyh,Jerome Bowel 💩,t3_lxva6s,18
