created,date,subreddit,id,body,parent_id,score
1614901579.0,2021-03-05,wallstreetbets,gppq9uf,"**G**UH.

**M**an, I can't believe y'all really just made me schedule megathreads for $SSR, $ASS, and $CUM. Mentions were off the charts.

**E**veryone who posted these tickers ought to be ashamed of themselves. Oh well, enjoy.",t3_lxva6s,1
1614894173.0,2021-03-05,wallstreetbets,gppan09,In my 4 months of investing I have never seen anything like this.  Truly a once in a 6 month phenomenon.,t3_lxva6s,867
1614891787.0,2021-03-05,wallstreetbets,gpp54p0,The secret to making your account green is to sell at a loss then buy back in and have your graph only show 1 day,t3_lxva6s,819
1614892260.0,2021-03-05,wallstreetbets,gpp68wc,"Nice

Just need 1500% gain to break even from last week",t3_lxva6s,587
1614892604.0,2021-03-05,wallstreetbets,gpp71tr,i demand to talk to the CEO of the stock market. This is unacceptable.,t3_lxva6s,387
1614891864.0,2021-03-05,wallstreetbets,gpp5bg2,[deleted],t3_lxva6s,269
1614894780.0,2021-03-05,wallstreetbets,gppc0mm,[deleted],t3_lxva6s,249
1614897670.0,2021-03-05,wallstreetbets,gppibf2,"If you lost a lot of money today, just remember there's more to life than stocks. There are options.",t3_lxva6s,728
1614901059.0,2021-03-05,wallstreetbets,gppp8r9,Wife still spending as if I make $5000 a day on stonks. How do i break it to her that she needs to get a job now,t3_lxva6s,230
1614892974.0,2021-03-05,wallstreetbets,gpp7whf,5 months of gains wiped out in 3 days. This is how you stock market children,t3_lxva6s,218
1614892325.0,2021-03-05,wallstreetbets,gpp6ebu,"What retards say: Buy the fucking dip

What retards do: Panic sell the fucking dip",t3_lxva6s,205
1614892960.0,2021-03-05,wallstreetbets,gpp7v9b,"$1400 stimulus check if you make under $70,000/year

or if you traded between Feb 15th - March 5th",t3_lxva6s,1143
1614893979.0,2021-03-05,wallstreetbets,gppa6ys,"Breakfast : Ice sandwhich with water sauce

Lunch: 2 dry ramen squares with Kraft cheese in the middle

Dinner: skip",t3_lxva6s,181
1614891845.0,2021-03-05,wallstreetbets,gpp59q5,Money is just a social construct anyways,t3_lxva6s,526
1614892609.0,2021-03-05,wallstreetbets,gpp729s,GME taking off while the entire market collapses has the same energy as the Macy’s parade moving through the war torn streets of Aleppo,t3_lxva6s,1102
1614894091.0,2021-03-05,wallstreetbets,gppaga9,"I only lost 3% a day, everyday for 15 days.",t3_lxva6s,161
1614893224.0,2021-03-05,wallstreetbets,gpp8gyk,How do you hide 60k loss from your wife. Asking for a friend,t3_lxva6s,501
1614897631.0,2021-03-05,wallstreetbets,gppi8ha,"there's someone on here 

out of the 9.4 million subs 

someone 

someone has the smallest penis 

it's not me though",t3_lxva6s,481
1614892802.0,2021-03-05,wallstreetbets,gpp7i3o,"“It’s simple, we kill the 10 year bond.”",t3_lxva6s,151
1614891795.0,2021-03-05,wallstreetbets,gpp55h3,I haven't logged into Vanguard in 2 weeks. I feel great!,t3_lxva6s,135
1614895724.0,2021-03-05,wallstreetbets,gppe4sx,Where's that retard who YOLO'd into GME 800c for tomorrow lol,t3_lxva6s,139
1614895185.0,2021-03-05,wallstreetbets,gppcxk7,Anyone here also laugh slightly harder the bigger the losses grow? Or am I just slowly descending into psychosis,t3_lxva6s,136
1614897429.0,2021-03-05,wallstreetbets,gppht24,If tech isn’t green tomorrow I’m getting a savings account,t3_lxva6s,133
1614902406.0,2021-03-05,wallstreetbets,gpprvqx,"profession: stock guy  
salary: -750 a day",t3_lxva6s,129
1614906058.0,2021-03-05,wallstreetbets,gppz0f0,"I’m bout to get kicked off the public library computer for crying, everybody have a good night",t3_lxva6s,127
1614893491.0,2021-03-05,wallstreetbets,gpp92xy,[deleted],t3_lxva6s,104
1614891662.0,2021-03-05,wallstreetbets,gpp4tv7,Update: I’m still fighting for my fucking life.,t3_lxva6s,498
1614894004.0,2021-03-05,wallstreetbets,gppa92j,"Tuesday: maybe I’ll buy myself a nice watch.

Today: going to go buy ramen.",t3_lxva6s,103
1614891725.0,2021-03-05,wallstreetbets,gpp4zf0,"I bought the dip. Then I bought the dip’s dip. And later I bought the dip’s dip’s dip. But when it came to buy the dip’s dip’s dip’s dip, there was no more money left after buying all the dips.",t3_lxva6s,726
1614891683.0,2021-03-05,wallstreetbets,gpp4vn6,Stop BRO that’s my ASS,t3_lxva6s,86
1614894459.0,2021-03-05,wallstreetbets,gppbai3,[deleted],t3_lxva6s,87
1614908499.0,2021-03-05,wallstreetbets,gpq3qky,[deleted],t3_lxva6s,83
1614891958.0,2021-03-05,wallstreetbets,gpp5jcp,"So here's what happened today.

The market has been pumped up by Powell's monetary handjobs. But after a year of that the market can't keep it up for just handjobs anymore. It needs blowies and a thumb up the ass to stay pumped. Powell said no blowies, and definitely no thumb, just more handjobs. So market go down.",t3_lxva6s,261
1614898290.0,2021-03-05,wallstreetbets,gppjm85,If the markets open tomorrow I am financially ruined,t3_lxva6s,251
1614898268.0,2021-03-05,wallstreetbets,gppjkjy,[deleted],t3_lxva6s,84
1614891672.0,2021-03-05,wallstreetbets,gpp4uqu,"Surely it can't be another red day.

SPY: I'll fuckin' do it again.",t3_lxva6s,246
1614893451.0,2021-03-05,wallstreetbets,gpp8zp0,The dips I bought have their own dips now :/,t3_lxva6s,75
1614896160.0,2021-03-05,wallstreetbets,gppf3pw,"Need a 750-bagger to break even, what’s the play boys",t3_lxva6s,72
1614891972.0,2021-03-05,wallstreetbets,gpp5kkt,Who else is out of dip buying money? Raise your hands ✋,t3_lxva6s,331
1614891860.0,2021-03-05,wallstreetbets,gpp5b20,Gme clapped some asses no doubt,t3_lxva6s,201
1614891679.0,2021-03-05,wallstreetbets,gpp4vc5,GME and PLTR green on a blood red day. Tomorrow is going to be absolutely wild,t3_lxva6s,554
1614893018.0,2021-03-05,wallstreetbets,gpp803i,I bought all ARK etfs at the top. Cathie gave me top 😎,t3_lxva6s,62
1614894781.0,2021-03-05,wallstreetbets,gppc0qf,Can’t wait for this sub to take two weeks to switch to puts and get cucked on the recovery,t3_lxva6s,66
1614891736.0,2021-03-05,wallstreetbets,gpp50c5,"According to the geniuses at Marketwatch, the crash is all our fault.",t3_lxva6s,318
1614893311.0,2021-03-05,wallstreetbets,gpp8o9u,"""Perfectly healthy correction""

Meanwhile im losing 10% per day",t3_lxva6s,61
1614907029.0,2021-03-05,wallstreetbets,gpq0w4j,Every single move I make is the wrong move,t3_lxva6s,61
1614893327.0,2021-03-05,wallstreetbets,gpp8pmv,GME saving my ass at this point,t3_lxva6s,59
1614891901.0,2021-03-05,wallstreetbets,gpp5eib,If gme goes above $200 I will call my ex gf and ask her to marry me.,t3_lxva6s,524
1614892468.0,2021-03-05,wallstreetbets,gpp6qdn,"\#stockmarketcrash is trending and we barely hit -10% correction lmfaooo.

Ya'll pussys would've been **obliterated** last year",t3_lxva6s,324
1614892925.0,2021-03-05,wallstreetbets,gpp7s8b,Mods we need a prayer thread,t3_lxva6s,49
1614896065.0,2021-03-05,wallstreetbets,gppew7k,"> what are your moves tomorrow

Crying you?",t3_lxva6s,53
1614897425.0,2021-03-05,wallstreetbets,gpphspo,If today taught me anything it’s that I’m a degenerate gambler,t3_lxva6s,53
1614900791.0,2021-03-05,wallstreetbets,gppopmf,TDA article just quoted Paper Hands Portnoy as being the king that started the retail trader boom. No the fuck he ain’t lmao,t3_lxva6s,49
1614903024.0,2021-03-05,wallstreetbets,gppt33v,BREAKING: NASDAQ found dead in Miami,t3_lxva6s,51
1614916238.0,2021-03-05,wallstreetbets,gpqi643,[deleted],t3_lxva6s,53
1614891706.0,2021-03-05,wallstreetbets,gpp4xri,My move tomorrow is stare at the GME ticker because it's the only thing keeping my portfolio alive.,t3_lxva6s,301
1614892992.0,2021-03-05,wallstreetbets,gpp7y1h,Great news mom! I’m moving back in :),t3_lxva6s,138
1614893439.0,2021-03-05,wallstreetbets,gpp8yrx,"Ryan Cohen's tweet is from a commercial where the puppet says ""I like your shorts"".",t3_lxva6s,50
1614895490.0,2021-03-05,wallstreetbets,gppdlw0,[deleted],t3_lxva6s,50
1614901559.0,2021-03-05,wallstreetbets,gppq8dw,"Your asshole:  *

Your asshole on wsb: ⭕",t3_lxva6s,45
1614903658.0,2021-03-05,wallstreetbets,gppucck,Honestly when 3 of my buddies said they could do this shit for a living I shoulda sold everything on sight,t3_lxva6s,51
1614921130.0,2021-03-05,wallstreetbets,gpqq6am,"going from ordering DoorDash to driving for DoorDash


😭😭😭",t3_lxva6s,49
1614934781.0,2021-03-05,wallstreetbets,gpr70ze,"guys today WILL be green, if not, then it will be red",t3_lxva6s,51
1614891926.0,2021-03-05,wallstreetbets,gpp5gov,"If I had to take a guess, I'd say I'm going to lose more money tomorrow.",t3_lxva6s,125
1614893726.0,2021-03-05,wallstreetbets,gpp9m80,"Gme is going to do something, idk what but 4 days green, daily looking like a healthy growth stock. Shit is fucking crazy.",t3_lxva6s,43
1614895674.0,2021-03-05,wallstreetbets,gppe0m9,my moves? watching calls expire worthless,t3_lxva6s,41
1614896717.0,2021-03-05,wallstreetbets,gppgauf,2k to 200k to 5k 😞,t3_lxva6s,44
1614898214.0,2021-03-05,wallstreetbets,gppjgbj,$CUM ceo said they ´re merging with $ASS,t3_lxva6s,41
1614902355.0,2021-03-05,wallstreetbets,gpprsaf,Hey Alexa cancel that Rolex order,t3_lxva6s,42
1614903966.0,2021-03-05,wallstreetbets,gppuyeg,[deleted],t3_lxva6s,41
1614904443.0,2021-03-05,wallstreetbets,gppvwbr,Pass this fucking stimulus already. Not because i need the 1400 dollars but because i want millions of retards to start buying 1400 dollars worth of calls again.,t3_lxva6s,43
1614910424.0,2021-03-05,wallstreetbets,gpq7ejb,Bring back Craigslist casual encounters,t3_lxva6s,42
1614892063.0,2021-03-05,wallstreetbets,gpp5s9h,If we hit 180$ GME  I drink all weekend 🥂🐒🚀,t3_lxva6s,113
1614895893.0,2021-03-05,wallstreetbets,gppeify,My new plays: add money to the brokerage account so the net loss % looks like less,t3_lxva6s,40
1614897238.0,2021-03-05,wallstreetbets,gpphenl,"You'll know the bottom is in when every schmuck in here is yelling ""BUY PUTS, ITS FREE MONEY"".",t3_lxva6s,34
1614898186.0,2021-03-05,wallstreetbets,gppje7i,I love u guys but Im willing to bet we would do much better in life if this subreddit didn’t exist,t3_lxva6s,38
1614899837.0,2021-03-05,wallstreetbets,gppmsv6,Imagine buying TSLA at 880 and selling at 605. Big GUH,t3_lxva6s,35
1614900275.0,2021-03-05,wallstreetbets,gppnolj,So... if I go all in on puts... the market will moon again?,t3_lxva6s,38
1614904991.0,2021-03-05,wallstreetbets,gppwy7z,Jim Cramer the type of dude to fart in the toilet and still flush,t3_lxva6s,38
1614913894.0,2021-03-05,wallstreetbets,gpqdyle,Who else high asf right now?,t3_lxva6s,34
1614914500.0,2021-03-05,wallstreetbets,gpqf2ny,Account only goes up when I deposit 😞,t3_lxva6s,35
1614921545.0,2021-03-05,wallstreetbets,gpqqssa,Cathy about to be eating ramen with us in a week.,t3_lxva6s,35
1614935390.0,2021-03-05,wallstreetbets,gpr7q1r,"When I die, I want Nio, hyleon, AMD, And triteras to be my pallbearers so they can let me down one last time.",t3_lxva6s,38
1614894267.0,2021-03-05,wallstreetbets,gppaurz,*Market falls as fear of economic improvement may be near*,t3_lxva6s,102
1614891957.0,2021-03-05,wallstreetbets,gpp5j9p,"get paid, get laid, buy GME",t3_lxva6s,92
1614892770.0,2021-03-05,wallstreetbets,gpp7fhb,down 50k this week make my hole weak,t3_lxva6s,31
1614892969.0,2021-03-05,wallstreetbets,gpp7w1v,"Tomorrow is big green. I can just feel it. 

Note: This may not apply to tech srry",t3_lxva6s,32
1614894059.0,2021-03-05,wallstreetbets,gppadml,Will be taking a mental health break.,t3_lxva6s,32
1614895144.0,2021-03-05,wallstreetbets,gppcu62,[deleted],t3_lxva6s,32
1614895317.0,2021-03-05,wallstreetbets,gppd8bt,Buy GME and wait for Cohen to tweet again,t3_lxva6s,32
1614895441.0,2021-03-05,wallstreetbets,gppdi3w,[deleted],t3_lxva6s,29
1614899259.0,2021-03-05,wallstreetbets,gpplmtt,I didn't want to pay rent anyways. Homeless is seriously going to help with my character development.,t3_lxva6s,33
1614900103.0,2021-03-05,wallstreetbets,gppnc5f,Maybe putting large portions of my portfolio into unprofitable companies wasnt the best idea 😰,t3_lxva6s,28
1614903235.0,2021-03-05,wallstreetbets,gppthyy,"“Buy the dip!, buy the dip!” ... Mf’er with what money?! Im broke from buying the last 10 dips",t3_lxva6s,32
1614912227.0,2021-03-05,wallstreetbets,gpqavdp,GME is a safe haven asset,t3_lxva6s,30
1614915197.0,2021-03-05,wallstreetbets,gpqgbib,Tomorrow morning’s Bloomberg article is going to say CUM is next Wallstreet Bets target.,t3_lxva6s,31
1614915617.0,2021-03-05,wallstreetbets,gpqh2jl,UWMC cult are you with me,t3_lxva6s,31
1614920216.0,2021-03-05,wallstreetbets,gpqos8e,Cathies prolly praying to God about Tesla while most of the worlds children will go to bed without so much as a Nvidia graphics chip to lay their head on.,t3_lxva6s,30
1614922645.0,2021-03-05,wallstreetbets,gpqsemi,[deleted],t3_lxva6s,32
1614925384.0,2021-03-05,wallstreetbets,gpqw3nd,Liquidating my positions and going all in on Pokemon cards,t3_lxva6s,34
1614930780.0,2021-03-05,wallstreetbets,gpr2jkl,"Last time I sold all my $CUM and put it into $PUSS.  No red day for 9 months, easy money.",t3_lxva6s,33
1614930852.0,2021-03-05,wallstreetbets,gpr2mfs,Fuck you guys for making me search for CUM stock.,t3_lxva6s,30
1614934262.0,2021-03-05,wallstreetbets,gpr6eyw,Just deposited money to my account so I’m back in the green bitches 😎,t3_lxva6s,31
1614936430.0,2021-03-05,wallstreetbets,gpr8vsj,You retards needs to hurry up and start yoloing on puts so that the market can inverse and go green again. Please and thank you.,t3_lxva6s,31
1614937118.0,2021-03-05,wallstreetbets,gpr9mn2,What are you doing step market,t3_lxva6s,33
1614937629.0,2021-03-05,wallstreetbets,gpra61z,Bought the highest point of the bull market. Who said you can't time the market.,t3_lxva6s,34
1614891634.0,2021-03-05,wallstreetbets,gpp4rcp,"Lie down

Try not to cry

Cry a lot",t3_lxva6s,192
1614892373.0,2021-03-05,wallstreetbets,gpp6ick,"Hedge fund guide to ez gains:

1) Scour Reddit to see what stock retail investors are rallying around.

2) Just before the end of a quarter, buy a bunch of listed puts on that stock.

3) Just after the end of the quarter, but before your 13F filing deadline, sell the puts and buy a fuckton of stock instead.

4) File your 13F, indicating that you’re short (via puts), even though you are actually very fucking long.

5) Reddit, which likes the stock anyway, will see that you are short, get absolutely triggered and decide to squeeze you by rocketing the stock to the moon.

6) Now you are rich.",t3_lxva6s,92
1614891691.0,2021-03-05,wallstreetbets,gpp4wea,I DECLARE BANKRUPTCY!,t3_lxva6s,259
1614892783.0,2021-03-05,wallstreetbets,gpp7gkk,Roblox save us,t3_lxva6s,82
1614891632.0,2021-03-05,wallstreetbets,gpp4r66,Who’s ready to send $ASS and $DICK to the moon? Bots thought ‘SSR’ was a ticker so get creative with your symbols boys.,t3_lxva6s,275
1614892482.0,2021-03-05,wallstreetbets,gpp6rma,[deleted],t3_lxva6s,29
1614894951.0,2021-03-05,wallstreetbets,gppceny,#QUIT SELLING YOUR TREASURIES YOU BOOMER BASTARDS 🤮,t3_lxva6s,24
1614895806.0,2021-03-05,wallstreetbets,gppebht,[deleted],t3_lxva6s,27
1614895984.0,2021-03-05,wallstreetbets,gppepnk,Yoooooo wtfffff happened .. I just kept buying the dip now I’m fucken broke 😂🤣😅🥺😢😥🥴,t3_lxva6s,29
1614896100.0,2021-03-05,wallstreetbets,gppeywh,If spy goes under 369 tomorrow I will for sure drink my own piss for you retards,t3_lxva6s,29
1614896124.0,2021-03-05,wallstreetbets,gppf0vn,"Buy more GME, watch it go down the second I press buy, watch GME all day and not work",t3_lxva6s,27
1614896185.0,2021-03-05,wallstreetbets,gppf5m0,Buy the dip gang assumes we have infinite money... robinhood patched that last year,t3_lxva6s,26
1614896581.0,2021-03-05,wallstreetbets,gppg0fe,You merely adopted the guh. I was born in it. Molded by it. I didn't see green in my account until I was already margin called. By then it was nothing but $ROPE.,t3_lxva6s,26
1614897356.0,2021-03-05,wallstreetbets,gpphnjh,"I’m leveraged to the tits on SPY puts for 3/5.
# You’re welcome I’ve saved the market",t3_lxva6s,27
1614898983.0,2021-03-05,wallstreetbets,gppl2gg,[deleted],t3_lxva6s,24
1614899162.0,2021-03-05,wallstreetbets,gpplfnm,Cramer is going full bear rn.  May be green tomorrow.,t3_lxva6s,26
1614899260.0,2021-03-05,wallstreetbets,gpplmwb,Be greedy when others are fearful,t3_lxva6s,25
1614899533.0,2021-03-05,wallstreetbets,gppm6ox,"home depot just hired me


TOMORROWS JOB REPORT WILL
BE GOOD


🚀",t3_lxva6s,27
1614899535.0,2021-03-05,wallstreetbets,gppm6rs,[deleted],t3_lxva6s,25
1614903095.0,2021-03-05,wallstreetbets,gppt84z,"If Buffett taught me anything,  it's to chase my losses with margin options.  Thanks Warren!",t3_lxva6s,29
1614903130.0,2021-03-05,wallstreetbets,gpptakc,Let’s be honest boys we all in deep and are down at least 40% across the board. No just me?,t3_lxva6s,28
1614903132.0,2021-03-05,wallstreetbets,gpptapq,"I was gonna fuck my girl in the ass tonight, then I looked at futures and told her to peg me instead.",t3_lxva6s,31
1614905241.0,2021-03-05,wallstreetbets,gppxflz,"This is great. no more spam about shitty stonks, and just people with real fear questioning all their decisions. this is the WSB I miss.",t3_lxva6s,30
1614907402.0,2021-03-05,wallstreetbets,gpq1m5a,We're just rotating sectors people. Out of Having Money and into Broke,t3_lxva6s,25
1614907909.0,2021-03-05,wallstreetbets,gpq2lgq,We are gonna look back at this in a few months and have a good chuckle. Whether we are reading this in our homes on our computers or at the public library computer between shifts behind the dumpster is the real question.,t3_lxva6s,25
1614908024.0,2021-03-05,wallstreetbets,gpq2thz,Everyone on here saying this is a crash was not here last March shit was crazy,t3_lxva6s,25
1614909627.0,2021-03-05,wallstreetbets,gpq5w3y,"1 year ago before the pandemic, I was out partying and enjoying life. Today, I'm sitting here worrying about 10-year treasury bond interest rates.

Crazy how putting money into the market changes you as a person.",t3_lxva6s,28
1614911564.0,2021-03-05,wallstreetbets,gpq9l5e,Anyone else want to see Elon’s loss porn for the week? 😂,t3_lxva6s,29
1614911964.0,2021-03-05,wallstreetbets,gpqacuu,You know shits bad when even the bots pack it in.,t3_lxva6s,28
1614915649.0,2021-03-05,wallstreetbets,gpqh4jw,"Can we bring back the trading floor?

All of us in suits yelling at eachother to fuck off and snorting cocaine off the desks while screaming out GODDAMMIT from across the room when a trade goes wrong? Everyone meeting at the pub afterwards to talk about it and the bigggest winner of the day buys the rounds?

Fuck this generation sucks. We can't even fucking get game consoles off a shelf at a store, and our houses cost 5x our salaries.",t3_lxva6s,29
1614916429.0,2021-03-05,wallstreetbets,gpqii8x,"Just remember guys stocks can only go down 100% but they can go up an unlimited %.

There’s way more potential upside than the limited downside.

Facts",t3_lxva6s,29
1614916527.0,2021-03-05,wallstreetbets,gpqiocg,"###SAY IT WITH ME *FUTURES DONT MATTER 

.....




unless they're in my favor",t3_lxva6s,28
1614918158.0,2021-03-05,wallstreetbets,gpqlh3n,So glad I bought 150k worth of Apple @136... smiling through the pain 😀😀😀😀😀😀😁,t3_lxva6s,29
1614919329.0,2021-03-05,wallstreetbets,gpqne3b,I’m selling my grandma’s oxygen tank to yolo in GME tomorrow,t3_lxva6s,29
1614919594.0,2021-03-05,wallstreetbets,gpqnthh,Jesus fuck every time I buy the dip. It keeps FUCKING DIPPING,t3_lxva6s,27
1614922002.0,2021-03-05,wallstreetbets,gpqrh4t,"Institutional investors are smart.

They sold tech at the top, are pushing a fake rotation out of tech due to RF yields to drastically lower prices.

Then they're gonna buy back in and take tech to all-time highs while the value stocks that people think they should be moving into trade flat for the next 6 months.",t3_lxva6s,28
1614922376.0,2021-03-05,wallstreetbets,gpqs0xl,"If you didn't loose money this week then you don't belong here. 
Also Well done well done 👏",t3_lxva6s,27
1614924897.0,2021-03-05,wallstreetbets,gpqvh5n,If i ever saw jim cramer in the street i’d do a split and punch him in his ball sack,t3_lxva6s,28
1614925366.0,2021-03-05,wallstreetbets,gpqw2t2,Started to notice the amount of time I spend thinking about making a trade is inversely proportional to the amount of money I make from it,t3_lxva6s,25
1614927257.0,2021-03-05,wallstreetbets,gpqyfwx,"So you're telling me that having my entire portfolio be comprised of entirely short dated call options on hyper valued growth stocks with no actual earnings and then chasing my losses the last 2 weeks, was not the way?",t3_lxva6s,25
1614935983.0,2021-03-05,wallstreetbets,gpr8e29,Good news-I’ve lost so much money that whenever it goes down I don’t care cuz it’s an irrelevant amount,t3_lxva6s,30
1614939737.0,2021-03-05,wallstreetbets,gprcdj8,Yo GME at $130,t3_lxva6s,24
1614940459.0,2021-03-05,wallstreetbets,gprd5bc,"There is only one flavor of dip I'm buying, GME.",t3_lxva6s,24
1614941093.0,2021-03-05,wallstreetbets,gprdu0x,Can't wait for Cramer to explode when tesla and GME swap share prices,t3_lxva6s,28
1614941879.0,2021-03-05,wallstreetbets,gpreoue,GME is the new gold standard.,t3_lxva6s,27
1614944559.0,2021-03-05,wallstreetbets,gprhrmj,Honey it's time for you buy the dip for the seventh time in a month in the hopes of escaping wage slavery,t3_lxva6s,25
1614945220.0,2021-03-05,wallstreetbets,gprikgr,"I've seen a couple people post that they're quitting their regular jobs to day trade, one of them being a warehouse worker, because they make more than their usual daily rate on the markets.

This is the most beautiful collection of complete retards I've ever seen",t3_lxva6s,29
1614891943.0,2021-03-05,wallstreetbets,gpp5i5b,"I'm not buying a damn thing tomorrow. I keep buying the fucking dip, and it's always too early of a dip.",t3_lxva6s,23
1614898294.0,2021-03-05,wallstreetbets,gppjmma,"On this sub, I was recently introduced to a video of a guy sucking his own dick, and now I can’t stop thinking about how lazy my husband is.",t3_lxva6s,24
1614900604.0,2021-03-05,wallstreetbets,gppoc2x,"Cramer a month ago:  ""We're never going down again""

Cramer today:   ""Let me explain the 5 stages of grief""",t3_lxva6s,24
1614901425.0,2021-03-05,wallstreetbets,gpppyyy,"How to participate in the ~~Standard and~~ Poor 500.

\- Buy at the top

\- Sell when the market's going down

\- FOMO when it goes up by  +1%

\- Sell again when you realize it's a bull trap",t3_lxva6s,24
1614901693.0,2021-03-05,wallstreetbets,gppqhtm,I bought NIO at $58 thinking it was a deal. Now it's $38 and still dropping. 🤡,t3_lxva6s,24
1614904377.0,2021-03-05,wallstreetbets,gppvro2,Cathie must drink herself to sleep every night.,t3_lxva6s,23
1614906378.0,2021-03-05,wallstreetbets,gppzmpb,"A rational man would say stocks are up 25% YoY through a pandemic, recession, political turmoil and general uncertainty. +25% in any year is insane let alone a the last twelve months. A correction is/was imminent.

Me? I'm not rational. I want more shrek dildos and I want them now. SPY 400.",t3_lxva6s,24
1614911888.0,2021-03-05,wallstreetbets,gpqa7l0,The market really is astrology for men. Shits changes my mood so much,t3_lxva6s,24
1614913928.0,2021-03-05,wallstreetbets,gpqe0si,No reason to panic sell at this point. Become an investor and hold long term 🥸,t3_lxva6s,23
1614914762.0,2021-03-05,wallstreetbets,gpqfjh9,I just want to wake up tomorrow morning with a big giant green hulk cock in my face when I check my stonks,t3_lxva6s,24
1614914897.0,2021-03-05,wallstreetbets,gpqfsao,Down 91.92% on the month.,t3_lxva6s,25
1614915630.0,2021-03-05,wallstreetbets,gpqh3bu,If you didn't lose money today there is something wrong with you,t3_lxva6s,23
1614917972.0,2021-03-05,wallstreetbets,gpql5t5,Who else bought the dip before the DIP,t3_lxva6s,25
1614918220.0,2021-03-05,wallstreetbets,gpqlkwm,"delete your account

This is financial advice",t3_lxva6s,24
1614918849.0,2021-03-05,wallstreetbets,gpqmm6o,"When I look in the mirror

All that I see 

Is this dumb fucking clown

Staring back at me",t3_lxva6s,24
1614928409.0,2021-03-05,wallstreetbets,gpqzt7r,# HOW ABOUT SHOVE YOUR 10 YEAR BOND YIELD UP YOUR INFLATED ASS,t3_lxva6s,24
1614929969.0,2021-03-05,wallstreetbets,gpr1mbx,**Fun Fact :** Cathie Woods is the only person in history to win both the best and worst ETF manager of the year,t3_lxva6s,24
1614938049.0,2021-03-05,wallstreetbets,gpralx2,My portfolio looks like I bought it on Wish.,t3_lxva6s,24
1614892673.0,2021-03-05,wallstreetbets,gpp77ie,"Losing thousands over the last 3 weeks😭


Calling the bottom and scalping 67 dollars on a single spy call in minutes 🤴",t3_lxva6s,23
1614899005.0,2021-03-05,wallstreetbets,gppl427,"LOL, Cramer talking about 5 stages of stock market grief",t3_lxva6s,22
1614905966.0,2021-03-05,wallstreetbets,gppyu1o,I'm done buying the dip. This ain't no fucking dip,t3_lxva6s,21
1614914221.0,2021-03-05,wallstreetbets,gpqejyf,"Listen up fuckers: If this is a true downtrend, we gonna have some big fucking rallies that make you all think “ahh this shit is over,” only to then resume drilling. Bond yields going up isn’t necessarily an issue. It’s the VELOCITY of the increase that is the scary fucking elephant in the room. I could be wrong too, so fuck you.",t3_lxva6s,23
1614926107.0,2021-03-05,wallstreetbets,gpqx0k0,Tech is oversold for almost 3 weeks now,t3_lxva6s,23
1614926439.0,2021-03-05,wallstreetbets,gpqxfml,"After the entire country reopens nobody is going to use smartphones or anything with semiconductors, get with the times zoomers.",t3_lxva6s,23
