created,date,subreddit,id,body,parent_id,score
1608783772.0,2020-12-24,wallstreetbets,ggvb9sj,I volunteered to become a mod but then they told me to send feet pics and thats where I drew the line.,t3_kj17ga,15
1608785051.0,2020-12-24,wallstreetbets,ggvd80y,"Elon- Can you hear me, Elon? I bet $8k that your TSLA is going to hulk cock up tomorrow. If you can hear me... *pleas fly*",t3_kj17ga,16
1608789985.0,2020-12-24,wallstreetbets,ggvk49k,I hope market makers see this comment. Fuck you,t3_kj17ga,15
1608791120.0,2020-12-24,wallstreetbets,ggvli66,You think this sub owns like 15% of GameStop at this point,t3_kj17ga,17
1608791509.0,2020-12-24,wallstreetbets,ggvlyir,Gonna get 80 more shares of PLTR to start the new year right! 🚀🚀🚀🚀🚀🚀🚀🚀,t3_kj17ga,15
1608791575.0,2020-12-24,wallstreetbets,ggvm19w,Jack ma finna be an American citizen by 2021,t3_kj17ga,16
1608792182.0,2020-12-24,wallstreetbets,ggvmqi8,"Welcome to Wallstreet Bets ✨⭐*niiiiiights*⭐✨ 🌛 come grab a tendie, your pajambies, and some jazz",t3_kj17ga,15
1608795240.0,2020-12-24,wallstreetbets,ggvq134,I’m counting on GME tomorrow,t3_kj17ga,16
1608801547.0,2020-12-24,wallstreetbets,ggvw2a6,Motherfucking alibaba gonna tank my portfolio,t3_kj17ga,16
1608802218.0,2020-12-24,wallstreetbets,ggvwnz8,"Was laughing about BABA, then saw I have some shares. Dont know why and when I bought. Still laughing but feeling like an idiot.",t3_kj17ga,15
1608805434.0,2020-12-24,wallstreetbets,ggvzhbn,"BABA bros yesterday: so glad i got in on that dip. 

BABA bros today: 😳",t3_kj17ga,16
1608757829.0,2020-12-24,wallstreetbets,ggu0vcp,"Buy high, and sell low? Feeling like your world is crashing in? It’s not. You’ll be ok. 

Your risk tolerance is wild enough for you to be here. You will get through this. Take a break and come back fresh. Don’t chase your losses. Talk to some comrades here about how dumb your plays were. If you still feel like you can’t handle life; check out the resources below. There’s no shame in reaching out. My inbox is always open as well, though response time may vary. Worst case, there’s always bankruptcy, and even that isn’t the end of the world. 

Money is replaceable, you are not.

24/7 Crisis Hotline: 1-800-273-TALK (8255) (Veterans, press 1)

Crisis Text Line: Text TALK to 741-741

Veterans Crisis Line: Send a text to 838255

SAMHSA Treatment Referral Hotline (Substance Abuse) 1-800-662-HELP (4357)

The National Problem Gambling Helpline (1-800-522-4700)

The National Problem Gambling Text Helpline 800-522-4700

**Wendy’s Customer Service Line: 888- 624-8140**",t3_kj17ga,94
1608758101.0,2020-12-24,wallstreetbets,ggu1doy,"If you don’t buy GME leaps tomorrow, YOU AIN’T BLACK",t3_kj17ga,15
1608758259.0,2020-12-24,wallstreetbets,ggu1o37,"Up $2k-5k all day. Back to even at close.


It’s like somehow losing when you’re up 3 touchdowns in the last 2 mins",t3_kj17ga,15
1608758756.0,2020-12-24,wallstreetbets,ggu2kxx,[deleted],t3_kj17ga,16
1608759197.0,2020-12-24,wallstreetbets,ggu3efh,"I'm willing to become a mod here for 1,000 a week.  No less.",t3_kj17ga,15
1608760065.0,2020-12-24,wallstreetbets,ggu4zpo,Green Day tmr guaranteed. You short tmr and you’ve betrayed millions of families trying to enjoy the Christmas spirit or what’s left of it in 2020,t3_kj17ga,15
1608764885.0,2020-12-24,wallstreetbets,ggue408,Every time I refresh I have to see this long emo post where some mod has to go on hiatus because his mom didn’t pay for the big data internet plan,t3_kj17ga,15
1608778018.0,2020-12-24,wallstreetbets,ggv1qqz,"On a dating site... Some cute girl is crying in her bio bout how hard life is and she wants a baby asap... Looks like needy clingy type 

I have a vasectomy. Quickest swipe right of my life",t3_kj17ga,17
1608778724.0,2020-12-24,wallstreetbets,ggv2ysb,[deleted],t3_kj17ga,15
1608780797.0,2020-12-24,wallstreetbets,ggv6hy6,This GME shit is out of hand. Whatever direction it moves people are getting wrecked. Can’t wait to see it.,t3_kj17ga,15
1608783913.0,2020-12-24,wallstreetbets,ggvbhnb,$PLTR building for a parobolic move,t3_kj17ga,14
1608785193.0,2020-12-24,wallstreetbets,ggvdfru,Where’s the guy who was eating his own shit on cam if pltr hit 25,t3_kj17ga,16
1608786758.0,2020-12-24,wallstreetbets,ggvfqyz,Thank god I bought the baba dip last week 🤡,t3_kj17ga,14
1608799916.0,2020-12-24,wallstreetbets,ggvulad,Planitar,t3_kj17ga,15
1608802346.0,2020-12-24,wallstreetbets,ggvws4z,"My condolences to BABA holders, you all just hit the unlucky lottery.",t3_kj17ga,15
1608803645.0,2020-12-24,wallstreetbets,ggvxx5h,[deleted],t3_kj17ga,15
1608803762.0,2020-12-24,wallstreetbets,ggvy0v4,"Daddy: Alright kids, we will have ramen for Christmas dinner

Kids: But why daddy, we've been eating ramen since yesterday

Daddy: Cause daddy all in BABA right before it tanked",t3_kj17ga,16
1608805193.0,2020-12-24,wallstreetbets,ggvz9tt,"WSB: **CHYNA IS A SCAAAAAM! USA! USA!**

also WSB: *lemme buy these BABA calls and bitch about it in the daily*",t3_kj17ga,14
1608757319.0,2020-12-24,wallstreetbets,ggtzxt4,PSA: short day tomorrow. Stop the count at 1pm.,t3_kj17ga,40
1608758100.0,2020-12-24,wallstreetbets,ggu1dl7,Raise your hand if you’re ending this year in the red,t3_kj17ga,16
1608758162.0,2020-12-24,wallstreetbets,ggu1hs8,Trump is the Grinch. 2k stimmy will never pass and we don't get 600 now.,t3_kj17ga,15
1608758274.0,2020-12-24,wallstreetbets,ggu1p2i,GME,t3_kj17ga,15
1608758952.0,2020-12-24,wallstreetbets,ggu2xzv,"This subreddits internal drama has more action today then the entire market, fuck these holidays",t3_kj17ga,13
1608759175.0,2020-12-24,wallstreetbets,ggu3d09,"Mods crying about who is in charge/more in charge of a subreddit lul, they should worry aobut the wait time for the damn drive thru im waiting like 15 gawd damn min for my fking frosty get it together guys",t3_kj17ga,12
1608760263.0,2020-12-24,wallstreetbets,ggu5clg,"NO RULES !!! 

TURN IT UP 


COCKS OUT 4 NO MODS !!!

YEAHHHHHHH 

MARGIN 10x 


LADY BOIS AND COCAIN BABY 🥳🥳😏🚀😈🦈",t3_kj17ga,15
1608760986.0,2020-12-24,wallstreetbets,ggu6ohn,Heard top mod is a member of Congress since he doesn’t do shit.,t3_kj17ga,14
1608766471.0,2020-12-24,wallstreetbets,ggugwjd,">As of April 2020, OnlyFans was valued at between $810,000,000 and $936,000,000, though estimates are difficult to ascertain as the company does not release its aggregate level data.[[15]](https://en.m.wikipedia.org/wiki/OnlyFans#cite_note-15) The site has over 24 million registered users and claims to have paid out US$725 million to its 450,000 content creators.[[16]](https://en.m.wikipedia.org/wiki/OnlyFans#cite_note-fandeck-16) CEO Tim Stokely claimed OnlyFans receives ""about 200,000 new users every 24 hours and 7,000 to 8,000 new creators joining every day.""[[17]](https://en.m.wikipedia.org/wiki/OnlyFans#cite_note-17)

That's a lot of simping.",t3_kj17ga,14
1608775426.0,2020-12-24,wallstreetbets,ggux5ri,Lol putting faith in Xi to say BABA isn't a monopoly 🤣🤣,t3_kj17ga,14
1608776723.0,2020-12-24,wallstreetbets,gguzgtu,"Baba and my ex girl the same, 

Both highly appealing undervalued Chinese prospects who fucked me and then went to shit",t3_kj17ga,14
1608777728.0,2020-12-24,wallstreetbets,ggv18ik,"Jack Ma refused to kneel and kiss the ring. Glad to see him fighting back

*RIP BABA holders though*",t3_kj17ga,14
1608779841.0,2020-12-24,wallstreetbets,ggv4wi4,"If you aren’t liquid, you aren’t wealthy",t3_kj17ga,14
1608783797.0,2020-12-24,wallstreetbets,ggvbb6l,Merry xmas everyone,t3_kj17ga,14
1608787708.0,2020-12-24,wallstreetbets,ggvh2tk,"https://imgur.com/a/HvUde0W

It either happens tomorrow, or it doesn’t. See you guys bright and early.",t3_kj17ga,13
1608787861.0,2020-12-24,wallstreetbets,ggvhahz,Got the day off tomorrow so I can finally fully focus on losing money without the distraction of my day job,t3_kj17ga,14
1608788253.0,2020-12-24,wallstreetbets,ggvhu2r,Market gonna rally tomorrow because Santa Claus. Lmfao,t3_kj17ga,13
1608789882.0,2020-12-24,wallstreetbets,ggvjzhi,Am I gay for making hot cocoa for myself tonight?,t3_kj17ga,15
1608790417.0,2020-12-24,wallstreetbets,ggvknp4,What if Robinhood is coded for a half day..but its the wrong half?,t3_kj17ga,14
1608791948.0,2020-12-24,wallstreetbets,ggvmgnz,Quiet desperation is the WSB way,t3_kj17ga,13
1608796805.0,2020-12-24,wallstreetbets,ggvrls8,[deleted],t3_kj17ga,14
1608798429.0,2020-12-24,wallstreetbets,ggvt77k,Should I yolo my tuition money on Tesla calls?,t3_kj17ga,14
1608806508.0,2020-12-24,wallstreetbets,ggw0f9o,"I would like to submit my application for wsb mod. This is my platform:
1) I am a bisexual trader so I can reach across the aisle to ban smooth brains of both persuasions. 
2) I will always be accesible and responsive because I have no life outside of wsb
3) I make disgusting retarded comments here. That’s what I call “character” leadership
4) I make dumb YOLO trades. That’s what I call “policy leadership”",t3_kj17ga,14
1608757720.0,2020-12-24,wallstreetbets,ggu0o30,Thanks to some clever financial maneuvering I will be moving into a cardboard box behind Arby's,t3_kj17ga,30
1608757785.0,2020-12-24,wallstreetbets,ggu0sek,Wtf .some stocks went from +15% to -2 % in a min. Never seen such thing😳,t3_kj17ga,31
1608758828.0,2020-12-24,wallstreetbets,ggu2pmq,"F in chat for zjz, a man more active then that fuckin OSU guy",t3_kj17ga,29
1608759609.0,2020-12-24,wallstreetbets,ggu45yw,"**That drop at the end today was rough. Don't hurt yourself. If you're struggling, there are [resources to help you](https://wendys-careers.com/job-search/). <3**",t3_kj17ga,28
1608767494.0,2020-12-24,wallstreetbets,gguirsn,At this rate GME will be at $500 by January so I raise my estimate once again to 1000 per share by July 2021,t3_kj17ga,28
1608767615.0,2020-12-24,wallstreetbets,gguizil,Holy shit I thought /r/investing was bad but check out the warcrime that is /r/dividends,t3_kj17ga,32
1608780451.0,2020-12-24,wallstreetbets,ggv5xgr,"Some people see a toothless, homeless meth head lady.

I see a $10 blowjob

It’s all about perspective, boys.",t3_kj17ga,33
1608762480.0,2020-12-24,wallstreetbets,ggu9f33,"50/50 NIO and PLTR, is that okay?",t3_kj17ga,13
1608763695.0,2020-12-24,wallstreetbets,ggubv7l,AAPL 🤡💎🖐 gang reporting in.  My 137c 12/31 still have a chance.,t3_kj17ga,14
1608764594.0,2020-12-24,wallstreetbets,ggudlr7,Imagine panic selling AAPL,t3_kj17ga,13
1608765268.0,2020-12-24,wallstreetbets,gguervc,Can we all appreciate that this subs mods are involved in more scandals than Enron?,t3_kj17ga,12
1608766214.0,2020-12-24,wallstreetbets,ggugfp1,VALE is the most boring stock I’ve ever held.,t3_kj17ga,13
1608766882.0,2020-12-24,wallstreetbets,gguhmw9, My friends over on Wall Street said we’re gonna have a Green Day tomorrow. And by friends on Wall Street I mean the retards in this thread,t3_kj17ga,13
1608766953.0,2020-12-24,wallstreetbets,gguhrs3,Lookin for a NIO run tommorrow. Down 60% on my 12/24's 47's. I refuse to rest in peace,t3_kj17ga,13
1608767272.0,2020-12-24,wallstreetbets,gguidti,"I want to clarify some of my recent comments about Campbells soup. I view Campbells soup as a great brand, and did not mean to impugn it by calling it ""luxury soup"" that was out of reach of Canadians. I support Campbells soup brands and recommend them to anyone, and will no longer make jokes at their expense. I am sorry for any harm that came to the brand from my recent comments.",t3_kj17ga,13
1608768132.0,2020-12-24,wallstreetbets,ggujvy8,BREAKING NEWS: Mods still gay.,t3_kj17ga,13
1608769143.0,2020-12-24,wallstreetbets,ggulqc7,Who else would be up over 500% of what they had now if they didn’t chose new positions everyday and grabbed one and rode it,t3_kj17ga,13
1608772152.0,2020-12-24,wallstreetbets,ggur74h,"BREAKING:

Mango pardons Thanos",t3_kj17ga,12
1608773624.0,2020-12-24,wallstreetbets,ggutw7a,Wait... why don’t we just take over the r/Madmoney you know as just a back up...,t3_kj17ga,13
1608777513.0,2020-12-24,wallstreetbets,ggv0uy2,"When HS classmates that you never talked to hit you up 10 years later to tell you about an ""exciting opportunity"" aka pypraid scheme, they always preface it with ""how you been man??"" 

I tell them fuck off :)",t3_kj17ga,13
1608777583.0,2020-12-24,wallstreetbets,ggv0zc0,"Who tf would actually buy a peloton? Buy an exercise bike for $500, tape an ipad to it, yolo the money you saved",t3_kj17ga,13
1608778366.0,2020-12-24,wallstreetbets,ggv2ceq,if tsla reaches 660 tomorrow i will do nothing special,t3_kj17ga,12
1608778468.0,2020-12-24,wallstreetbets,ggv2ike,"Since March I’ve seen

1) Breaking Bad
2) Better Call Saul
3) Ozark
4) Eastbound & Down
5) The Haunting of Hill House 
6) Narcos (Colombia and Mexico)


Any recommendations?


Please don’t say GOT. Ain’t nobody got time for that",t3_kj17ga,13
1608780943.0,2020-12-24,wallstreetbets,ggv6qa7,Holding gamestop till I'm cruising in my tesla drop top.,t3_kj17ga,12
1608781517.0,2020-12-24,wallstreetbets,ggv7o4m,Are these 20x BABA 1/15 255 naked puts i sold   today going to bankrupt me?,t3_kj17ga,13
1608781553.0,2020-12-24,wallstreetbets,ggv7q7s,"“Just cuz I’m from the C C P, that punk jack ma is afraid of me”-Easy Muthaphuckin Xi",t3_kj17ga,13
1608784143.0,2020-12-24,wallstreetbets,ggvbu9o,"ok baba bag holders, we're all waking up to -97% calls tomorrow",t3_kj17ga,12
1608785104.0,2020-12-24,wallstreetbets,ggvdaw2,Peanut Butter Falcon is actually a solid movie,t3_kj17ga,13
1608785109.0,2020-12-24,wallstreetbets,ggvdb80,15 minutes until my Christmas bonus hits my account. About to buy up some random Chinese spa company at open and hope it goes up 300%.,t3_kj17ga,13
1608785329.0,2020-12-24,wallstreetbets,ggvdn6v,SANTA RUN HERE WE COME,t3_kj17ga,14
1608788174.0,2020-12-24,wallstreetbets,ggvhq14,ARKK pls moon tomorrow. I wanna cash out and buy a big ass yeti water bottle,t3_kj17ga,13
1608788319.0,2020-12-24,wallstreetbets,ggvhxd0,Where's that retard always bragging about banging escorts and ended up with a sore throat? Haven't heard from him since,t3_kj17ga,12
1608791506.0,2020-12-24,wallstreetbets,ggvlyex,SQ rally tomorrow. Today was a BTFD.,t3_kj17ga,14
1608791593.0,2020-12-24,wallstreetbets,ggvm1zk,"Imagine there is no Algos 

It isn’t  hard to do 

Nothing to stop us in the market 

And no manipulation too 

Imagine all the tendies 

We can make in peace

yoooo hooooooooo",t3_kj17ga,14
1608792254.0,2020-12-24,wallstreetbets,ggvmted,Every time I see picture of Jack Ma I think that the screen ratio on my monitor is off,t3_kj17ga,13
1608793170.0,2020-12-24,wallstreetbets,ggvnu6i,"If Leaps get you sleeps, Shares make you don't cares.",t3_kj17ga,13
1608793172.0,2020-12-24,wallstreetbets,ggvnu96,QQQJ gang  💪🏻,t3_kj17ga,13
1608793173.0,2020-12-24,wallstreetbets,ggvnuaz,"Holy shit. Wanna see something cool? Go check the 1 week chart for Shopify. It literally shows you where i bought puts at, and where I sold. Damn how do they have the technology to do that? Crazy.",t3_kj17ga,13
1608793196.0,2020-12-24,wallstreetbets,ggvnv8a,Please do not buy BABA calls tomorrow. You will be severely disappointed.,t3_kj17ga,12
1608794144.0,2020-12-24,wallstreetbets,ggvowb4,Pleas mod again,t3_kj17ga,13
1608796996.0,2020-12-24,wallstreetbets,ggvrspk,I bet Ryan Cohen is creeping wsb sub and loving all the GME post,t3_kj17ga,14
1608798029.0,2020-12-24,wallstreetbets,ggvstdu,Theta decay doesn’t care about your feelings,t3_kj17ga,13
1608798433.0,2020-12-24,wallstreetbets,ggvt7cj,I don’t think I even want to be rich that bad. I just like to win,t3_kj17ga,12
1608799728.0,2020-12-24,wallstreetbets,ggvuf3b,We are only up 3% from September's high. The market has been flat as fuck in the last 3 months.,t3_kj17ga,13
1608803206.0,2020-12-24,wallstreetbets,ggvxjc9,PLTR good job now i can sleep see yall in 4 hrs,t3_kj17ga,13
1608803345.0,2020-12-24,wallstreetbets,ggvxnrp,[deleted],t3_kj17ga,13
1608805493.0,2020-12-24,wallstreetbets,ggvzj4l,"250 seemed like a sturdy rail for BABA. I leaned on it, it broke off, and I fell into the chasm",t3_kj17ga,13
1608767613.0,2020-12-24,wallstreetbets,gguizds,"Closed out all of my short term positions. Done YOLOing for the year. Cheers to all you degenerate gamblers!

$5k to $142k in a year. 

https://i.imgur.com/XQl0L2k.jpg",t3_kj17ga,38
1608766109.0,2020-12-24,wallstreetbets,ggug93i,[removed],t3_kj17ga,28
1608757722.0,2020-12-24,wallstreetbets,ggu0o6k,Jeff Bezos is the Grinch for not splitting his stock,t3_kj17ga,12
1608757926.0,2020-12-24,wallstreetbets,ggu11y9,Buy every dip of any stock!!!!!! If their is one thing history has taught us is that STOCKS ONlY GO UP!!!!! Let’s gooooooo!!!!!!,t3_kj17ga,11
1608758613.0,2020-12-24,wallstreetbets,ggu2bkz,I really really need tomorrow to be green so I can make more money,t3_kj17ga,12
1608759137.0,2020-12-24,wallstreetbets,ggu3aj0,Remember when WSBGOD was a thing and then got exposed as fake hood times,t3_kj17ga,11
1608759835.0,2020-12-24,wallstreetbets,ggu4k0f,This sub has turned to unrecognizable shit in 20 minutes.,t3_kj17ga,12
1608759894.0,2020-12-24,wallstreetbets,ggu4o1h,2% day tomorrow,t3_kj17ga,12
1608759896.0,2020-12-24,wallstreetbets,ggu4o6v,[deleted],t3_kj17ga,13
1608760008.0,2020-12-24,wallstreetbets,ggu4vzc,"Can I say ""clitcoin"" now that there are no mods?",t3_kj17ga,13
1608760068.0,2020-12-24,wallstreetbets,ggu4zws,It is more fun to shitpost in wsb when you aren't losing large sums of money.,t3_kj17ga,12
1608760211.0,2020-12-24,wallstreetbets,ggu597t,How soon until this sub goes private again lol 😂😂😂,t3_kj17ga,13
1608760908.0,2020-12-24,wallstreetbets,ggu6jec,"PLEASE SEND DICK PICS TO MOD TEAM

THOSE WITH BIGGEST COCKS WITH PLEASE GAY MOD TEAM IMMENSELY

PEASANT POSTERS WILL RESPECT NEW MODS BECAUSE THEY GOT HORSEDICKS",t3_kj17ga,12
1608761747.0,2020-12-24,wallstreetbets,ggu82gg,"If your homeless and you have nothing to lose you can turn a 5$ investment into a 5,000 dollar one on Robinhood, buy gold and transfer 5000 and ur instant deposit is there for you, just go spend it with your Robinhood card quick.",t3_kj17ga,12
1608762469.0,2020-12-24,wallstreetbets,ggu9ed8,[deleted],t3_kj17ga,11
1608764557.0,2020-12-24,wallstreetbets,ggudjgs,I’m just ready for PLTR to open above 30... we need a moon mission day,t3_kj17ga,13
1608766060.0,2020-12-24,wallstreetbets,ggug628,Jesus Christ the WSB Discord is total ass,t3_kj17ga,12
1608767189.0,2020-12-24,wallstreetbets,ggui8dw,1/15's feeling uncomfortably close,t3_kj17ga,12
1608773139.0,2020-12-24,wallstreetbets,ggut0d8,"Market closing early tomorrow then closed on Friday 😔

Fuck the holidays",t3_kj17ga,12
1608775290.0,2020-12-24,wallstreetbets,gguwwyg,A moment of silence for our Baba Boiis!!😰😰🙏🏼,t3_kj17ga,13
1608777289.0,2020-12-24,wallstreetbets,ggv0gpl,"This BABA thing will be fascinating to watch. Either Xi will break up China’s largest and most prominent tech company purely out of spite, in which case, it’ll just go to show why China will never overtake the US. Alternatively, the CCP huffs and puffs a little, slaps a fine on the wrist, and Jack Ma comes out with his giant dick swinging, looking like a goddamn hero. 

I am long in shares and will be adding in the dip.",t3_kj17ga,11
1608777738.0,2020-12-24,wallstreetbets,ggv1975,BABA pleas fly again,t3_kj17ga,12
1608777987.0,2020-12-24,wallstreetbets,ggv1orb,Show of hands who else completely forgot Tidal existed 🙋‍♂️,t3_kj17ga,13
1608778893.0,2020-12-24,wallstreetbets,ggv39ou,# BABA testing IPO lows?,t3_kj17ga,12
1608780231.0,2020-12-24,wallstreetbets,ggv5k5o,"I'm guessing worst case scenario is that Xi arrests Ma and strips him of all power. Richest man of China is a big target on your back. 

It happened in Russia back when Yukos Oil guy was the richest in Russia.",t3_kj17ga,12
1608780577.0,2020-12-24,wallstreetbets,ggv64x5,WTF is wrong with this country... Top 5 YouTube trending videos are all D'Amelio and james charles bullshit...,t3_kj17ga,11
1608780836.0,2020-12-24,wallstreetbets,ggv6k68,Stimulus talks going well...,t3_kj17ga,12
1608784295.0,2020-12-24,wallstreetbets,ggvc2qe,"Can WallStreetBets just have it’s own app or website? Is that against SEC rules? I like it more than Instagram, but not Tinder.",t3_kj17ga,12
1608784899.0,2020-12-24,wallstreetbets,ggvczsz,Santa Claus coming through with a check,t3_kj17ga,12
1608788478.0,2020-12-24,wallstreetbets,ggvi4y6,If musk tweeted something like “Merry ‘X’ Mas” this sub would lose our shit,t3_kj17ga,13
1608788504.0,2020-12-24,wallstreetbets,ggvi687,He’s gonna keep it up till someone compliments his doggos figure,t3_kj17ga,11
1608790921.0,2020-12-24,wallstreetbets,ggvl9nw,"Every stock ark buys I check out and I’m like damn I could see this rip and I think about buying it and then I think wait... I just did. 

Owning all arks is life",t3_kj17ga,11
1608792696.0,2020-12-24,wallstreetbets,ggvnbfe,(  .  )(  .  ),t3_kj17ga,12
1608792727.0,2020-12-24,wallstreetbets,ggvncoy,I trust Cathie Wood with my life,t3_kj17ga,11
1608792845.0,2020-12-24,wallstreetbets,ggvnhdi,Cathie Wood can peg me,t3_kj17ga,12
1608793049.0,2020-12-24,wallstreetbets,ggvnpgl,I sold my shares in thicc 🐝 early because the damn mods in here made it seem shady by banning,t3_kj17ga,12
1608795191.0,2020-12-24,wallstreetbets,ggvpzan,"Y'all ready for the 🎅🎄-rally❓ +1.5% EOD, calling it now ✅🐮",t3_kj17ga,13
1608797186.0,2020-12-24,wallstreetbets,ggvrzji,#Stonk Market closes at 1PM. Place your bets accordingly,t3_kj17ga,12
1608800596.0,2020-12-24,wallstreetbets,ggvv7ko,Hellloo pltr,t3_kj17ga,12
1608801492.0,2020-12-24,wallstreetbets,ggvw0ij,"US: if Chinese companies do not comply with US auditing rules within three years, they will be delisted

China: Hold my tea, we will delisting our own local companies better and faster than US, start with BABA",t3_kj17ga,11
1608804020.0,2020-12-24,wallstreetbets,ggvy8su, What you doing GameStop,t3_kj17ga,11
1608806169.0,2020-12-24,wallstreetbets,ggw04kv,Might fomo into GME. I’d rather risk some tendies for the possibility of going to the moon. Someone tell me I’m a retard and I shouldn’t do it,t3_kj17ga,11
1608806912.0,2020-12-24,wallstreetbets,ggw0s71,"A family member told me a story about someone he knew with a gambling addiction who would go to the casino and be up $3-$4 thousand and still not cash out trying to chase the jackpot. He says “Can you believe that?!” 

Me after watching my RH account all day fluctuating 4 figures, “Haha no, wow that’s crazy.”",t3_kj17ga,11
1608807417.0,2020-12-24,wallstreetbets,ggw18f1,"Imagine doubling down (again) on BABA yesterday.   
Could not have been me 🤡",t3_kj17ga,11
1608757277.0,2020-12-24,wallstreetbets,ggtzuzn,"Panic buy highs at open, panic sell lows at close.",t3_kj17ga,25
1608758151.0,2020-12-24,wallstreetbets,ggu1h0v,That market drop wasn’t from the bill being vetoed. Lol the veto was announced like 30 mins before that. 🙄🙄,t3_kj17ga,27
1608762439.0,2020-12-24,wallstreetbets,ggu9cdt,[deleted],t3_kj17ga,26
1608766713.0,2020-12-24,wallstreetbets,gguhc93,"Social media is fucking RIDICULOUS. 

Instagram really just removed my story bc I said “Girls are weird”, they said it was hate speech. Unfucking believable.",t3_kj17ga,24
1608766929.0,2020-12-24,wallstreetbets,gguhpyz,WSB is going to go black. Will lead to massive confusion and thousands of autists selling their options and stonks until they see rocket ships again. This will lead the next crash.,t3_kj17ga,25
1608776357.0,2020-12-24,wallstreetbets,gguytg4,"No one:  ...

BABA call holders:  IM FIGHTING FOR MY FUCKING LIFE",t3_kj17ga,24
1608781864.0,2020-12-24,wallstreetbets,ggv88hp,"FUUUUUUUUUCCCCCCKKKKKKKK BAAAAAAAAAAAAAAAABAAAAAAAAAAAAAAA!!!!!!!!!!!

Fuck China.  Fuck Chinese stocks.

10 years Chinese stocks blow up.  All along people said, be careful.  There's risk.  Risk?  What risk?  It's 10 years of baller growth over there.  Well this is the fucking risk they talked about all along.  Chinese government cutting the balls off their companies and putting them in jars because, get this... it's NOT A CAPITALIST COUNTRY!  It's NOT A DEMOCRACY!  It's A FUCKING AUTHORITARIAN COMMUNIST FUCK SHOW!",t3_kj17ga,23
1608782055.0,2020-12-24,wallstreetbets,ggv8jvy,I can almost guarantee some retard is holding 400k worth of PLTR 50 calls for 2023 and he'll be posting 4500% gains by summer 2021,t3_kj17ga,27
1608786503.0,2020-12-24,wallstreetbets,ggvfdvi,BABA means dad so that's why it's always letting me down,t3_kj17ga,23
1608788959.0,2020-12-24,wallstreetbets,ggvis3e,"Just got vaccinated, the microchip gave me more processing power to buy GME stonks",t3_kj17ga,25
1608760719.0,2020-12-24,wallstreetbets,ggu66qs,"#FREE STATE OF WALLSTREETBETS !!!! 

🇺🇸🇺🇸🇺🇸🇺🇸🇺🇸🚀🚀🚀🚀🚀",t3_kj17ga,23
1608768033.0,2020-12-24,wallstreetbets,ggujps7,[deleted],t3_kj17ga,23
1608789390.0,2020-12-24,wallstreetbets,ggvjcg6,"FUCK U I DONT WANNA LEAVE REMOTE WORK 

Fuck the commute 

Fuck the getting dressed and waking up 2hr early to get to the building on time 

Fuck making and buying lunch 

Fuck commute again 

Na bruh !!!",t3_kj17ga,22
1608793110.0,2020-12-24,wallstreetbets,ggvnrtg,This thread is so fucking weird at night,t3_kj17ga,22
1608806749.0,2020-12-24,wallstreetbets,ggw0n17,Lol mods removing comments about the mods for “stirring up subreddit drama.” Didn’t realize I could get censored politically on a sub where people call each other retards. Grow a thicker skin mods lol,t3_kj17ga,21
