created,date,subreddit,id,body,parent_id,score
1614910105.0,2021-03-05,wallstreetbets,gpq6spw,"Gotta love when you buy 5 contracts at 100 bucks a pop and it goes down so you buys some more and it keeps going down and you keep buying and next thing you know you have like 100 contracts, you are down a couple thousand bucks and you think oh man if it only goes back up to 100 i will have a nice pay day.

And it never fucking does...",t3_lxva6s,16
1614910334.0,2021-03-05,wallstreetbets,gpq78cp,"The crash is gonna turn a lot of bulls into bears. 

If you didnt know all bears used to be bulls until they got fucked by Mr. Market.",t3_lxva6s,18
1614911359.0,2021-03-05,wallstreetbets,gpq96yo,Can I pay rent with expired Starbucks gifts cards? Asking for the sub.,t3_lxva6s,17
1614912574.0,2021-03-05,wallstreetbets,gpqbixk,"So if my math here is correct, It seems im fucked",t3_lxva6s,17
1614913661.0,2021-03-05,wallstreetbets,gpqdjbg,"Just going to do the entire market a favor and sacrifice myself rn:

TSLA puts literally can’t go tits up",t3_lxva6s,18
1614913663.0,2021-03-05,wallstreetbets,gpqdjf0,"If you drop your adamant armor, I can trim it for you.",t3_lxva6s,18
1614913738.0,2021-03-05,wallstreetbets,gpqdocb,I ran out of chips for this dip a while ago,t3_lxva6s,17
1614914594.0,2021-03-05,wallstreetbets,gpqf8p2,I need to see green for my mental health.,t3_lxva6s,19
1614916966.0,2021-03-05,wallstreetbets,gpqjfst,I will sacrifice myself and go all in on puts so the reversal starts tomorrow.,t3_lxva6s,19
1614917381.0,2021-03-05,wallstreetbets,gpqk5l9,futures gonna turn green just to stick a red dildo up my ass tomorrow,t3_lxva6s,19
1614918268.0,2021-03-05,wallstreetbets,gpqlns4,Were due for a green bounce even if its just a bulltrap.,t3_lxva6s,18
1614921766.0,2021-03-05,wallstreetbets,gpqr4mi,Do any of you fuks have money left wtf,t3_lxva6s,17
1614922061.0,2021-03-05,wallstreetbets,gpqrk8s,Can Burry start tweeting about collapse so the market goes up again?,t3_lxva6s,18
1614925497.0,2021-03-05,wallstreetbets,gpqw8vl,Watching Queens Gambit makes me want to rail adderall and study charts,t3_lxva6s,18
1614927590.0,2021-03-05,wallstreetbets,gpqyud2,This thread is like twitter for insomniac degenerate gamblers,t3_lxva6s,17
1614929058.0,2021-03-05,wallstreetbets,gpr0kk4,Does anyone fiddle with their flaccid pp during trading hours when they are nervous and heavily red? Been doing it a lot recently,t3_lxva6s,18
1614929463.0,2021-03-05,wallstreetbets,gpr11hr,🙏🏽 AMC pleas fly again 🍿🍿,t3_lxva6s,17
1614933431.0,2021-03-05,wallstreetbets,gpr5he9,"2020 beer flu crashes market

2021 treasury yields crash market",t3_lxva6s,17
1614937561.0,2021-03-05,wallstreetbets,gpra3hj,Is it just me or is premarket volume abnormally low all around?,t3_lxva6s,17
1614938237.0,2021-03-05,wallstreetbets,gprat6d,"I think my Robinhood is glitched, how do I make it go back green?",t3_lxva6s,18
1614939494.0,2021-03-05,wallstreetbets,gprc49w,"I just cant wait for some news anchor to say ""todays trending tickers in wallstreetbets are $COCK $ASS $CUM"" and then be like....""omg did i just say that?""",t3_lxva6s,19
1614941204.0,2021-03-05,wallstreetbets,gprdyc7,[deleted],t3_lxva6s,19
1614892153.0,2021-03-05,wallstreetbets,gpp5zuw,"gotta go look for a job now😅fml, i thought this would be my way out of working",t3_lxva6s,53
1614893399.0,2021-03-05,wallstreetbets,gpp8viz,today is the worst day of your life... so far,t3_lxva6s,52
1614893757.0,2021-03-05,wallstreetbets,gpp9ot5,"PLTR$

THE STOCK OF HOPE 
WE MUST PROTECC IT!!",t3_lxva6s,52
1614893967.0,2021-03-05,wallstreetbets,gppa61z,Hold GME and UWMC.,t3_lxva6s,59
1614902034.0,2021-03-05,wallstreetbets,gppr5s4,"Somehow being in here makes me feel better. 

Like being in the homeless camp and someone invites you to stand by the burn barrel and passes the bottle of mad dog.

You guys are great!",t3_lxva6s,56
1614895479.0,2021-03-05,wallstreetbets,gppdkz4,anybody feel that every time they laugh they're on the verge of tears as well...or is that just me?,t3_lxva6s,15
1614896375.0,2021-03-05,wallstreetbets,gppfkeq,Upvote anything and everything that confirms my biases.,t3_lxva6s,16
1614896453.0,2021-03-05,wallstreetbets,gppfqm5,3 months of gains went poof,t3_lxva6s,19
1614896884.0,2021-03-05,wallstreetbets,gppgnqt,"PLTR - about 610,000 contracts traded in **Palantir Technologies Inc** on Wednesday and calls outpaced puts by about three to one. The most active calls were the 26 strike calls that expire at the end of this week. 

&#x200B;

I purchased 1500 shares every single fucking day this week for Palantard, let's go fucks",t3_lxva6s,16
1614896938.0,2021-03-05,wallstreetbets,gppgrx5,"REJECT STOCKS

RETVRN TO OPTIONS",t3_lxva6s,15
1614897024.0,2021-03-05,wallstreetbets,gppgyi7,Just woke up. Wow GME and PLTR yall are both retarded. Everything is blood red both of yall are somehow green...,t3_lxva6s,17
1614898017.0,2021-03-05,wallstreetbets,gppj1c2,CNBC: Reddit is targeting everything,t3_lxva6s,18
1614898091.0,2021-03-05,wallstreetbets,gppj6vo,[deleted],t3_lxva6s,17
1614899356.0,2021-03-05,wallstreetbets,gppltw8,"Cramer Sell Off 2007: THEY KNOW **NOTHING!!!**

Cramer Sell off 2021: *Just accept this d bb*",t3_lxva6s,17
1614899377.0,2021-03-05,wallstreetbets,gpplvf6,"Imagine buying Cramer’s books, watching his show every day, paying for ActionAlert Plus and other paid services on Street.com, calling into his show for advice and still losing money",t3_lxva6s,18
1614899469.0,2021-03-05,wallstreetbets,gppm1zz,I kind of like that I’m starting to get numb to 10-20% swings in my account in a day.,t3_lxva6s,17
1614899526.0,2021-03-05,wallstreetbets,gppm64k,maybe the most annoying thing about this gme saga is now people on this sub is pretending like every stock has to be a squeeze play of some sort,t3_lxva6s,16
1614899897.0,2021-03-05,wallstreetbets,gppmx6t,"Just started investing 1 month ago and checked my portfolio again. How do I change the font? Its all red but used to be green, was there an update or something?",t3_lxva6s,16
1614900730.0,2021-03-05,wallstreetbets,gppol9s,"Buy PLTR at 23.75, sell at 25, repeat",t3_lxva6s,16
1614901736.0,2021-03-05,wallstreetbets,gppqksn,Cathie’s recent trades starting to look like WSB FD’s,t3_lxva6s,17
1614902491.0,2021-03-05,wallstreetbets,gpps1p1,Yo this dip ain’t even funny no more,t3_lxva6s,18
1614903153.0,2021-03-05,wallstreetbets,gpptc7j,CNBC Headlines: $CUM is all over Reddit today,t3_lxva6s,18
1614903196.0,2021-03-05,wallstreetbets,gpptf6l,# you can fit a battering ram in my anal cavity rn,t3_lxva6s,16
1614903392.0,2021-03-05,wallstreetbets,gpptt5i,"Relax, its not real money. Its just a app on ur phone",t3_lxva6s,17
1614905523.0,2021-03-05,wallstreetbets,gppxz87,Surely this reaction to rising yields is an overreaction.,t3_lxva6s,17
1614905670.0,2021-03-05,wallstreetbets,gppy98i,Wow looks like my portfolio is gona be down like another 20% tomorrow morning. Hell ya bro. Live laugh love life...is that how it goes? 😭,t3_lxva6s,17
1614905947.0,2021-03-05,wallstreetbets,gppyspn,Lost about 20k so far this week and 32 last week. I can live with this I guess,t3_lxva6s,16
1614906965.0,2021-03-05,wallstreetbets,gpq0rn2,The beatings will continue until morale improves.,t3_lxva6s,17
1614907994.0,2021-03-05,wallstreetbets,gpq2rfl,"Dow futures just jumped 25 pts, now only down 200. Green by April",t3_lxva6s,17
1614908082.0,2021-03-05,wallstreetbets,gpq2xh7,"arkk - tsla $9000 target price. 

arkk - cryptic $1m target price. 

arkk - spy $150 target price. 

arkk - arkk $0 target price.

Insha'CathyWood",t3_lxva6s,16
1614908189.0,2021-03-05,wallstreetbets,gpq34xt,Officially making an onlyfans now,t3_lxva6s,16
1614908439.0,2021-03-05,wallstreetbets,gpq3mfj,"how do i keep buying the dip if im out of cash and dnt have a job
 
do i sell a kidney?",t3_lxva6s,17
1614908836.0,2021-03-05,wallstreetbets,gpq4dis,"Went broke being a bear, went broke again being a bull",t3_lxva6s,17
1614909188.0,2021-03-05,wallstreetbets,gpq51qy,Jim Cramer looks like the guy Netflix signed to headline their new show: Real Plumbers of Milwaukee,t3_lxva6s,17
1614909603.0,2021-03-05,wallstreetbets,gpq5ufp,That woman outside Wendy’s looked suspiciously like Cathie without glasses on 🤔,t3_lxva6s,17
1614909963.0,2021-03-05,wallstreetbets,gpq6j3h,"Too much 🔴🔻📛❗️


Not enough 🟢✅💹🤑

market gay",t3_lxva6s,17
1614909981.0,2021-03-05,wallstreetbets,gpq6kbj,As soon as all of u buy puts market reverses,t3_lxva6s,16
1614910209.0,2021-03-05,wallstreetbets,gpq6zph,I feel like AMD is an outrageously good roth IRA buy rn,t3_lxva6s,17
1614910339.0,2021-03-05,wallstreetbets,gpq78o5,$PLTR,t3_lxva6s,18
1614910350.0,2021-03-05,wallstreetbets,gpq79gl,JPOW said the word *inflation* over a hundred fucking times today and expected that to go well,t3_lxva6s,19
1614910448.0,2021-03-05,wallstreetbets,gpq7g87,"Just spent 2 hours trying to plunge the living shit out of my toilet as the fuckin shit water was rising up thru my shower drain. Just nasty. After googling one last hail mary attempt, I poured bleach in the toilet, waited 10 minutes and, voila, got the sonuvabitch unclogged after a solid minute of plunging. Then spent another hour bleaching the fn shower and cleaning up. I say that to say this, life throws shit as us whether it be stonks crashing or toilets clogging but you figure it out like a fuckin man and deal with it. Im buying more PLTR tomorrow.",t3_lxva6s,17
1614910959.0,2021-03-05,wallstreetbets,gpq8fd8,"Sir, this is a homeless shelter",t3_lxva6s,18
1614910984.0,2021-03-05,wallstreetbets,gpq8h3u,Bruh i put my savings into APPL calls and didnt take profit monday i might be kill,t3_lxva6s,17
1614911184.0,2021-03-05,wallstreetbets,gpq8usk,"Remember when Pitbull did an online poll for his next concert location and everybody picked Kodak, Alaska in the middle of nowhere? And the man actually went through with it. He truly is Mr. Worldwide",t3_lxva6s,18
1614911757.0,2021-03-05,wallstreetbets,gpq9yh9,"When you look into this enough you will see they have JPOW by the balls. The bond market is like massive cargo ship. When it starts to move it moves and it’s hard to be stopped. 

If you look at every market crash in the last 80 years you will see the correlation between bond buying and market volatility. I’m to lazy to look it up but if you search for it on the New York Fed Reserve website you will find it.

That said I don’t think this is the crash. Just a correction with it making the market 10% down. 

Sorry for some actual DD, continue to spam RKT and AOCs feet.",t3_lxva6s,17
1614913392.0,2021-03-05,wallstreetbets,gpqd1pk,"Mid February: honey I'm gonna preorder a Lucid with these fat gains!

Late February after DA: honey it's now a Hyundai Kona! Still an EV tho!

This week after broader market eats shit: honey I mortgaged our current cars to avoid margin call!

Let's see what happens next week.",t3_lxva6s,17
1614914485.0,2021-03-05,wallstreetbets,gpqf1o5,Im working on a dildo device that penetrates deeper or more shallow based on SPY movements,t3_lxva6s,17
1614915087.0,2021-03-05,wallstreetbets,gpqg4dx,"I've solved it guys

\> Settings

\>Chart color

\>Red up, Green down",t3_lxva6s,17
1614916447.0,2021-03-05,wallstreetbets,gpqijbl,Found out a coworker was making 30k more than me in an equal position. That fucker never even managed to close a deal and eventually quit. Jokes on them though because I spend 90% of my work day talking about apes and diamonds now anyways.,t3_lxva6s,17
1614916977.0,2021-03-05,wallstreetbets,gpqjgi1,UWMC anyone haha? Can’t go any lower.,t3_lxva6s,17
1614917017.0,2021-03-05,wallstreetbets,gpqjizf,After Cramer declared stonks dead and went through his retarded 5 steps of grief shit today I knew the market will moon. Ain't even worried about it anymore.,t3_lxva6s,17
1614920392.0,2021-03-05,wallstreetbets,gpqp1vo,"fuk da bears

 say it with me!",t3_lxva6s,17
1614921938.0,2021-03-05,wallstreetbets,gpqrdqx,Made some bad moves lately. Being in the red everywhere. Never lost so much money in my life. Maybe will buy some more palantir to lower my average. But still have many doubts what to do. At least is payday tomorrow. More cash to inject into the red zone.,t3_lxva6s,16
1614922297.0,2021-03-05,wallstreetbets,gpqrwtx,Can’t wait to lose more money tm,t3_lxva6s,17
1614923201.0,2021-03-05,wallstreetbets,gpqt6qy,"Don’t let anyone ruin your day

It’s your day. Ruin it yourself bois 

🍻",t3_lxva6s,17
1614923576.0,2021-03-05,wallstreetbets,gpqtplt,"Elon, I know you're scrolling through here",t3_lxva6s,18
1614924522.0,2021-03-05,wallstreetbets,gpquz9r,"First, I plan to look at my portfolio. Then I will continue to cry into my pillow. Then I will buy more stocks. Lather, Rinse, Repeat.",t3_lxva6s,16
1614925836.0,2021-03-05,wallstreetbets,gpqwobp,"Man every time My dad sat at a 2-5 table he’d lose money, I swear he knew how to play hold em, He knew his ranges etc wok plenty of tournaments but somehow He’d always end up losing a hand he should have won and tilting losing his money with an all in with 2-7 off and then coming home and taking it out in our family

Basically that’s what most of you did this week but with options instead",t3_lxva6s,18
1614927796.0,2021-03-05,wallstreetbets,gpqz3b3,"Going with leaps tomorrow. Fool me once on the march crash, cant fool me on the feb-march dip. Buy when there’s fucking bloood on the streets",t3_lxva6s,17
1614927862.0,2021-03-05,wallstreetbets,gpqz63e,I can't even jack off properly. My dick can't get hard. I keep thinking of my losses,t3_lxva6s,18
1614927991.0,2021-03-05,wallstreetbets,gpqzbjg,I was actually touched by my uncle as a kid but now I feel like I can’t tell anyone because its turned into a meme anyway I’m bullish for tomorrow,t3_lxva6s,16
1614928080.0,2021-03-05,wallstreetbets,gpqzf92,Guys don’t worry in 5 years it will all be over.,t3_lxva6s,17
1614928273.0,2021-03-05,wallstreetbets,gpqznfv,Having no more cash to buy the dip is not a bad thing. At that moment all you can do is wait and relinquish control of your account to the gods. Much less stressful that way,t3_lxva6s,18
1614937073.0,2021-03-05,wallstreetbets,gpr9kwl,I will have lost 5 months salary after today. Is there an emoji of someone crying with a happy mask in front of their face? Cause that’s me in front of “norms” these days,t3_lxva6s,18
1614938647.0,2021-03-05,wallstreetbets,gprb8jh,"These news articles about everything that is going on in this sub are the laziest, stupidest shit I have ever seen.  This isn’t someone reporting on like a war on the other side of the planet, ANYONE CAN VISIT THIS SITE AND SEE WHAT IS GOING ON.  IF YOU’RE THAT INTERESTED IN THIS COMMUNITY JUST GO STRAIGHT TO THE SOURCE.  Fucking boomers need CNBC to spoon-feed them everything.",t3_lxva6s,16
1614939597.0,2021-03-05,wallstreetbets,gprc85q,Another day where I get no work done and watch the market flatten my dick for the 4th time this week.,t3_lxva6s,17
1614939788.0,2021-03-05,wallstreetbets,gprcfgx,What alternate timeline do we live in when GME is a more effective hedge than precious metals lol,t3_lxva6s,16
1614939954.0,2021-03-05,wallstreetbets,gprcloa,well fuck me sideways i picked a fucked up time to get into trading,t3_lxva6s,16
1614891730.0,2021-03-05,wallstreetbets,gpp4zs4,Watch how GME goes up another 20-30% while i diamond hand,t3_lxva6s,61
1614917205.0,2021-03-05,wallstreetbets,gpqjur8,"I am beating Nasdaq so far, it is down about 8% and  my stocks are down about 50%.",t3_lxva6s,53
1614893399.0,2021-03-05,wallstreetbets,gpp8via,I gotta stop checking my damn phone so much,t3_lxva6s,16
1614893856.0,2021-03-05,wallstreetbets,gpp9wyl,Call me Edward scissor hands from all the knives I've been catching.,t3_lxva6s,16
1614895283.0,2021-03-05,wallstreetbets,gppd5ko,"If GME up. Buy puts on everything. If GME is down buy calls.... that’s how you beat the market, shit is more telling than $VIX",t3_lxva6s,16
1614895670.0,2021-03-05,wallstreetbets,gppe09b,Some poor asshole is spending their day reading the entire stimulus out loud to Ron Johnson,t3_lxva6s,16
1614895722.0,2021-03-05,wallstreetbets,gppe4n1,"I fucking did it. I ate my 5k loss on SPCE. I feel sick.

Literally an entire months worth of gains, gone.",t3_lxva6s,17
1614896300.0,2021-03-05,wallstreetbets,gppfel8,I’ve bought so many “dips” these past few weeks that I’m all out of monies for the reddest day 😭,t3_lxva6s,17
1614898367.0,2021-03-05,wallstreetbets,gppjs3y,Damn y'all turn from Caithie Bae to Caithie bitch real quick,t3_lxva6s,17
1614900388.0,2021-03-05,wallstreetbets,gppnwkv,Pro tip:  The Roast Chicken Flavor is the best Maruchan Instant Ramen,t3_lxva6s,16
1614900637.0,2021-03-05,wallstreetbets,gppoelp,Who remembers last year this time? Are we in for awesome times again??,t3_lxva6s,15
1614901287.0,2021-03-05,wallstreetbets,gpppp7m,"Imagine being a boomer ranting about inflation for decades,  and the value of your pet rocks go down when inflation is inbound 😂",t3_lxva6s,17
1614901824.0,2021-03-05,wallstreetbets,gppqr1z,Cathy held her PLTR!!!,t3_lxva6s,17
1614902641.0,2021-03-05,wallstreetbets,gppsbz8,"Go buy stocks they said, it will be fun they said, tech is really profitable they said",t3_lxva6s,16
1614903907.0,2021-03-05,wallstreetbets,gppuu8w,[deleted],t3_lxva6s,16
1614904042.0,2021-03-05,wallstreetbets,gppv3t0,GME will do one last infinite squeeze causing the market to explode into dust with everything dropping to near single digits.,t3_lxva6s,15
1614904076.0,2021-03-05,wallstreetbets,gppv65y,I've made really bad life choices,t3_lxva6s,17
1614894432.0,2021-03-05,wallstreetbets,gppb8bc,lol,t1_gppan09,49
1614894654.0,2021-03-05,wallstreetbets,gppbqfb,Market makers hate this trick.,t1_gpp54p0,19
1614897077.0,2021-03-05,wallstreetbets,gpph2i3,"Try 150 strike 3/19 dash puts. Lockup expires and ~35% float gets freed up. Also, DoorDash is a shit company. I’m  all in on puts.",t1_gpp68wc,18
1614891959.0,2021-03-05,wallstreetbets,gpp5jhm,I'm guessing it's because the yield is now higher than the S&P dividend yield. Equities are now not the only game in town,t1_gpp5bg2,50
1614891990.0,2021-03-05,wallstreetbets,gpp5m4c,"We had several corrections in that time frame. SPY dropped way harder than this in September.

The market will keep going up over the medium and long term. This is a correction that won't last more than a couple weeks.",t1_gpp5bg2,59
1614897774.0,2021-03-05,wallstreetbets,gppij4n,And if you had calls instead of puts....,t1_gppibf2,45
1614901124.0,2021-03-05,wallstreetbets,gpppdic,"more importantly, what will you tell her boyfriend?",t1_gppp8r9,122
1614901122.0,2021-03-05,wallstreetbets,gpppddo,Honey we are the short squeeze now,t1_gppp8r9,20
1614902811.0,2021-03-05,wallstreetbets,gppsntl,I lost 3 years work on GME. But it's creeping back...,t1_gpp7whf,18
1614894588.0,2021-03-05,wallstreetbets,gppbkz5,Lol fuck you and take your upvote,t1_gpp7v9b,209
1614899644.0,2021-03-05,wallstreetbets,gppmetk,"Pro gamer move: say you're ""fasting"" instead of ""skipping"" to make it look like you're just being healthy",t1_gppa6ys,19
1614893713.0,2021-03-05,wallstreetbets,gpp9l5q,💀,t1_gpp729s,20
1614893624.0,2021-03-05,wallstreetbets,gpp9dtp,"*oh god, it appears the Syrian government dropped a barrel bomb on the percussion section*",t1_gpp729s,103
1614893344.0,2021-03-05,wallstreetbets,gpp8r1y,"Wait, you had 60k and a wife?",t1_gpp8gyk,306
1614893281.0,2021-03-05,wallstreetbets,gpp8lrq,Edit the webpage HTML in chrome to change values,t1_gpp8gyk,96
1614893385.0,2021-03-05,wallstreetbets,gpp8ud5,Buy a burner phone. Send yourself some vague innuendo messages with a girl's name. Subtly let your wife see. She will be too busy suspecting an affair to figure out you blow up the retirement fund.,t1_gpp8gyk,26
1614893261.0,2021-03-05,wallstreetbets,gpp8k41,You make your way to Tijuana in the middle of the night while she sleeps,t1_gpp8gyk,17
1614897731.0,2021-03-05,wallstreetbets,gppig00,Not me either though. Definitely not. Odds in our favor..,t1_gppi8ha,20
1614895041.0,2021-03-05,wallstreetbets,gppclsp,I haven't logged into Valheim for 2 weeks as I'm too busy stating at a graph,t1_gpp55h3,18
1614895779.0,2021-03-05,wallstreetbets,gppe9br,If that actually works out I'm quitting the market,t1_gppe4sx,90
1614896214.0,2021-03-05,wallstreetbets,gppf7wu,I bought some 700C tomorrow. If it works I'm literally liquidating my whole account and leaving because it'll mean the market is more retarded than I am.,t1_gppe4sx,38
1614897549.0,2021-03-05,wallstreetbets,gppi29l,That .5% interest sounds pretty nice when im sitting at -60%,t1_gppht24,112
1614892225.0,2021-03-05,wallstreetbets,gpp65x4,"You're the retard who put all your house money in the market right? God speed, speed racer.",t1_gpp4tv7,126
1614891882.0,2021-03-05,wallstreetbets,gpp5cum,"Step-market, what are you doing?",t1_gpp4vn6,22
1614893729.0,2021-03-05,wallstreetbets,gpp9mim,Fuck that made sense to my smooth brain. You are true autist.,t1_gpp5jcp,65
1614904132.0,2021-03-05,wallstreetbets,gppva5c,Narrator: the market did in fact open,t1_gppjm85,26
1614898316.0,2021-03-05,wallstreetbets,gppjo8b,We’re an easy and convenient scapegoat,t1_gppjkjy,49
1614894253.0,2021-03-05,wallstreetbets,gppatm3,"Yeah, what the fuck is up with the nasdaq right now? Puts on that could print for weeks.",t1_gpp4uqu,18
1614896200.0,2021-03-05,wallstreetbets,gppf6sy,0dte tsla 800,t1_gppf3pw,40
1614892067.0,2021-03-05,wallstreetbets,gpp5slk,I'm out of money to buy lunch.,t1_gpp5kkt,119
1614893380.0,2021-03-05,wallstreetbets,gpp8tzn,I bought ARKK at $159.10. The literal top was $159.70. Nobody buys tops like me.,t1_gpp803i,16
1614906502.0,2021-03-05,wallstreetbets,gppzvd0,"God they must be so happy. The market has a scapegoat for every correction now. Blame the poor autists with their covid checks and Biden bucks.

That being said I kinda like that they’re making an etf just for meme stocks. We’re getting a seat at the kid’s table, guys!",t1_gpp50c5,19
1614891917.0,2021-03-05,wallstreetbets,gpp5fwk,Good,t1_gpp50c5,104
1614891944.0,2021-03-05,wallstreetbets,gpp5i8v,If GME goes to 250 I’ll pay for your attorney to fight the restraining order.,t1_gpp5eib,460
1614892709.0,2021-03-05,wallstreetbets,gpp7aet,I still have nightmares about my $200cs on MSFT in Feb 2020 and $340cs on SPY in March 2020.,t1_gpp6qdn,23
1614892730.0,2021-03-05,wallstreetbets,gpp7c67,"We're barely 5% below ATH peak to trough, this ain't even a correction. Just so happens the Twitter crowd tends not to buy boomer stocks lol",t1_gpp6qdn,92
1614894476.0,2021-03-05,wallstreetbets,gppbbtx,Lol you got other things in your portfolio than gme. No wonder you are bleeding!,t1_gpp4xri,24
1614895523.0,2021-03-05,wallstreetbets,gppdod5,100k to 50k,t1_gppdlw0,22
1614893805.0,2021-03-05,wallstreetbets,gpp9ssu,Lol r/investing laughed at me for holding 2/3 GME and 1/3 coin at one point who's laughing now old man,t1_gpp9m80,24
1614898265.0,2021-03-05,wallstreetbets,gppjkcp,This is the breaking news I come here for,t1_gppjgbj,15
1614894363.0,2021-03-05,wallstreetbets,gppb2l4,This whole market is being held up by qe and interest rates being 0. There’s some validity behind that headline,t1_gppaurz,22
1614891806.0,2021-03-05,wallstreetbets,gpp56c1,GME carried me today. Praise the 🦍 🦍 🦍,t1_gpp4rcp,120
1614891708.0,2021-03-05,wallstreetbets,gpp4xxu,Currently I’m pumping $CUM,t1_gpp4r66,217
1614891711.0,2021-03-05,wallstreetbets,gpp4y57,"Same, buying $SEX at 6:09pm tonight",t1_gpp4r66,50
1614891706.0,2021-03-05,wallstreetbets,gpp4xsa,"See I'm more of a $CUM guy myself, definitely not just a pump a dump",t1_gpp4r66,81
1614893582.0,2021-03-05,wallstreetbets,gpp9adq,😫💦 id fuck her now already,t1_gpp94gw,21
1614891991.0,2021-03-05,wallstreetbets,gpp5m81,I don't even know how to sell,t1_gpp4uf7,117
1614893533.0,2021-03-05,wallstreetbets,gpp96fe,Poor grandma for having a retarded grandson,t1_gpp8rxt,18
1614906887.0,2021-03-05,wallstreetbets,gpq0m4u,See you tomorrow at 9:30,t1_gpq0cd8,17
1614938237.0,2021-03-05,wallstreetbets,gprat6k,"That's a great question. It's an important question. Thanks for asking it. As I said in my opening statement, I appreciate you inviting me here to talk about this today. It's something that hasn't been discussed enough in my opinion. In conclusion, we're out of time.

*I am a bot, and this action was performed automatically. Please [contact the moderators of this subreddit](/message/compose/?to=/r/wallstreetbets) if you have any questions or concerns.*",t1_gprat6d,21
1614901749.0,2021-03-05,wallstreetbets,gppqlp6,Obviously asking for his wifes boyfriend,t1_gpp8r1y,37
1614897005.0,2021-03-05,wallstreetbets,gppgx3p,Spoiler: >!it didn't!<,t1_gppf7wu,36
1614893824.0,2021-03-05,wallstreetbets,gpp9udd,Good,t1_gpp5fwk,23
1614892492.0,2021-03-05,wallstreetbets,gpp6sgd,If GME gets to $300 I'll sit in court and draw pictures of the trial with my crayons 🖍️,t1_gpp5i8v,239
1614892233.0,2021-03-05,wallstreetbets,gpp66ou," $CUM doesn't even look that bad, up 15% this month",t1_gpp4xxu,17
1614891766.0,2021-03-05,wallstreetbets,gpp52xf,Could just put $CUM and $DICK into the $ASS etf,t1_gpp4xsa,46
1614893812.0,2021-03-05,wallstreetbets,gpp9tfw,"If it goes to 500, I’ll eat that crayon after said picture is drawn",t1_gpp6sgd,133
1614896598.0,2021-03-05,wallstreetbets,gppg1s1,When it goes to $600 I’ll eat this mans crayon poop,t1_gpp9tfw,31
1614897716.0,2021-03-05,wallstreetbets,gppiexg,"When $GME goes to $1000 tomorrow or next week, I will feel so grateful for all of you.",t1_gppg1s1,21
