created,date,subreddit,id,body,parent_id,score
1604017932.0,2020-10-30,wallstreetbets,gajw043,America is the best country because the houses are made of toothpicks/paper and all you gotta do to be considered attractive is not be obese,t3_jkhkw8,32
1604024659.0,2020-10-30,wallstreetbets,gak863b,Lil Wayne complaining about Biden tax plan but had no issue with Birdman robbing him for decades 🤣🤣🤣,t3_jkhkw8,30
1604002162.0,2020-10-30,wallstreetbets,gaj1gjc,THIS CHAT GONNA BE EMPTY TOMORROW,t3_jkhkw8,53
1604003648.0,2020-10-30,wallstreetbets,gaj4k7h,"Told u guys to buy AAPL puts ...

🌈🐻",t3_jkhkw8,12
1604005226.0,2020-10-30,wallstreetbets,gaj7tqc,If tmrw not green im super fucked  and it looks like im fcked rn,t3_jkhkw8,12
1604006811.0,2020-10-30,wallstreetbets,gajb0c6,The game isn't rigged just because you make bad trades.,t3_jkhkw8,12
1604007354.0,2020-10-30,wallstreetbets,gajc35e,APPL is dead. Only Tim Cook blowing himself on FaceTime could save it now,t3_jkhkw8,15
1604011638.0,2020-10-30,wallstreetbets,gajkes1,We have barely even erased today’s gain. This is going to be a fun evening once AH closes. Futures will drop so hard,t3_jkhkw8,13
1604017245.0,2020-10-30,wallstreetbets,gajurj4,How DARE stocks drop before I expected them to,t3_jkhkw8,13
1604017771.0,2020-10-30,wallstreetbets,gajvpkz,Imagine going to Vegas and betting on black 8 times in a row and losing every time... That's what has happened to me this month,t3_jkhkw8,14
1604019199.0,2020-10-30,wallstreetbets,gajyatz,"if you draw enough lines on a chart, you can find that resistance/support level no one knew existed",t3_jkhkw8,14
1604019225.0,2020-10-30,wallstreetbets,gajyci4,"Literally everyone: Haha I beat earnings, got 2x what you expected.

The market: Fuck man, paper here says I gotta dump 10% of your market cap unless you hit 3x.",t3_jkhkw8,15
1604020907.0,2020-10-30,wallstreetbets,gak1eyb,Ran out of milk so I’m having fruit loops with water. Puts on me.,t3_jkhkw8,14
1604024870.0,2020-10-30,wallstreetbets,gak8j4m,What if people interpreting the mayan calendar got it wrong and the end of the world is actually 2021 and not 2012,t3_jkhkw8,13
1604026499.0,2020-10-30,wallstreetbets,gakbfcz,"I believe this will be red by open

Just my opinion and this does not in any way constitute financial advice",t3_jkhkw8,12
1604026892.0,2020-10-30,wallstreetbets,gakc3r2,Ah I see everyone is wearing the same costume this year for Halloween: bag-holder,t3_jkhkw8,14
1604028961.0,2020-10-30,wallstreetbets,gakfhw9,"Things are getting a little too 🌈🐻 in here for me so I got out the crayons and made a fucking startling discovery that shook me to the ballllls!!

https://i.imgur.com/cjqBJkm.jpg",t3_jkhkw8,14
1604029412.0,2020-10-30,wallstreetbets,gakg6jc,Hello Europe? Yes I'd like one dump pls.,t3_jkhkw8,12
1604030192.0,2020-10-30,wallstreetbets,gakhbpd,"8 of the last 10 days been Red, and we’re still at 330 💪💪

Market didn’t go down much. Bullish",t3_jkhkw8,13
1604030223.0,2020-10-30,wallstreetbets,gakhdbk,"Lmao I love how the entire chat forgets that the us is going into an election probably the most important up to date, stop looking at other markets it’s not comparable go to sleep. Drill team 6 is happening",t3_jkhkw8,14
1604030308.0,2020-10-30,wallstreetbets,gakhhn5,"FUK U NY JUST LEGALIZE WEED ALREADY ,I dont wanna go to some weebs house and talk about Naruto for 45 minutes just to get an 1/8 . How are you gonna make me WFH all goddam day and not let me smoke???",t3_jkhkw8,12
1604032197.0,2020-10-30,wallstreetbets,gakk38e,It blows my mind when I see people on here who are actually wealthy. Like what are you doing? You made it. Go do a bunch of blow or something.,t3_jkhkw8,12
1604034582.0,2020-10-30,wallstreetbets,gakn442,BEARS FROM THE TOP ROPE!!,t3_jkhkw8,14
1604035811.0,2020-10-30,wallstreetbets,gakoka1,Vix futures up 7%,t3_jkhkw8,12
1604036251.0,2020-10-30,wallstreetbets,gakp27l,"Literally every single country has made the COVID vaccine TOP priority. China and Russia allegedly have a vaccine, but it's likely bullshit since China lies and Russia is... well Russia. The entire world cannot figure this out, and the virus mutates everyday. All I know is: Randy really should not have fucked that Pangolin.",t3_jkhkw8,13
1604036778.0,2020-10-30,wallstreetbets,gakpnff,"Ladies and gentlemen,  
  
This is your captain speaking. We have started our descent towards ES 3200 and NQ 11000. The weather at the destination is stormy until Tuesday. Please fasten your seatbelts while the seatbelt sign is on.  
  
Thank you for flying **Air Bearways**. We hope you enjoyed your flight.",t3_jkhkw8,12
1604037666.0,2020-10-30,wallstreetbets,gakqmai,There is no way europoors hold the line for the bulls at 320. See you guys at 300 in morning.,t3_jkhkw8,13
1604037899.0,2020-10-30,wallstreetbets,gakqv43,Tomorrow millionaires will be made and some others will go bankrupt,t3_jkhkw8,13
1604038317.0,2020-10-30,wallstreetbets,gakrapg,Who else is not sleeping tonight because of this action,t3_jkhkw8,12
1604038406.0,2020-10-30,wallstreetbets,gakrdyi,Stock market looks great!,t3_jkhkw8,13
1604038643.0,2020-10-30,wallstreetbets,gakrmn7,"Drill team 6 working so hard rn, they aren't even shit posting",t3_jkhkw8,14
1604038664.0,2020-10-30,wallstreetbets,gakrne6,"October surprise

American Airline declares bankruptcy",t3_jkhkw8,13
1604039193.0,2020-10-30,wallstreetbets,gaks6sw,Apple 🍎 will have to reverse split after this,t3_jkhkw8,13
1604039607.0,2020-10-30,wallstreetbets,gakslq8,"#Watch the Great Red Wave!  
  
https://twitter.com/realDonaldTrump/status/1322063800993013761  
  
Hahahaha, even he knows we are fucked!",t3_jkhkw8,14
1604042257.0,2020-10-30,wallstreetbets,gakv4ey,Trump's definitely watching futures,t3_jkhkw8,14
1604048328.0,2020-10-30,wallstreetbets,gal0j06,"Just because you comment here with some wild theory about how we won't drop any lower, doesn't mean its going to happen. 

Prepare for pain.",t3_jkhkw8,12
1604005130.0,2020-10-30,wallstreetbets,gaj7mnv,"The reality of the situation with Apple is that people are not upgrading phones as often as they once were. You just don’t need to, these phones can last year‘s and the technology is much better. They’ve been stagnant since 2017. That’s why they don’t show unit sales anymore.",t3_jkhkw8,45
1604002216.0,2020-10-30,wallstreetbets,gaj1km4,Holy shit. If google fucking holds tomorrow. Might be my happiest day in a while. Jesus Christ. Please hold. Please fucking hold.,t3_jkhkw8,12
1604002976.0,2020-10-30,wallstreetbets,gaj35oc,"If amzn really tanks, I’m going to have to load up on shares. This ER is fucking great. This is a company firing on all cylinders and just raking in money",t3_jkhkw8,11
1604002988.0,2020-10-30,wallstreetbets,gaj36m3,"Bears, we did it",t3_jkhkw8,12
1604004593.0,2020-10-30,wallstreetbets,gaj6io7,"Around this time last year, we were gifted the “GUH” AAPL put guy. Turns out he was only off by a year",t3_jkhkw8,13
1604004640.0,2020-10-30,wallstreetbets,gaj6m92,"ah yes, company makes profit. This must be a bad thing",t3_jkhkw8,12
1604005484.0,2020-10-30,wallstreetbets,gaj8clj,[deleted],t3_jkhkw8,11
1604005863.0,2020-10-30,wallstreetbets,gaj944z,So we all fucked again tomorrow? Today was a bull trap?,t3_jkhkw8,11
1604006109.0,2020-10-30,wallstreetbets,gaj9lv8,"Seriously, sorry for anybody that lost money this afternoon. I know a lot of you had money riding on these moves.",t3_jkhkw8,12
1604007654.0,2020-10-30,wallstreetbets,gajcomq,My 400 Apple shares gonna hurt tomorrow,t3_jkhkw8,13
1604009361.0,2020-10-30,wallstreetbets,gajg20t,I nearly doubled my net worth today. Granted I’m only 18 with 5k but I’ll take what I can. Only gotta do it like 10 more times to have fuck you money,t3_jkhkw8,12
1604009577.0,2020-10-30,wallstreetbets,gajgh6v,"Bulls instead of picking the color of your lambo, in what color are you getting your helmet?",t3_jkhkw8,13
1604010145.0,2020-10-30,wallstreetbets,gajhkqu,Today all the AAPL bulls are massacred en-masse. Whos left to call bears fucked every morning now?,t3_jkhkw8,13
1604010172.0,2020-10-30,wallstreetbets,gajhmjl,God please tank spy to 320 so I can get out,t3_jkhkw8,11
1604010368.0,2020-10-30,wallstreetbets,gaji03u,$AAPL is straight up not giving me a good time.,t3_jkhkw8,12
1604010426.0,2020-10-30,wallstreetbets,gaji451,HTZ is being delisted lmao,t3_jkhkw8,12
1604010512.0,2020-10-30,wallstreetbets,gajia06,Apple bagholders assemble! My calls are dated Jan 2022 so I'll be here ALL FUCKIN YEAR,t3_jkhkw8,12
1604010792.0,2020-10-30,wallstreetbets,gajitd7,"HTZ delisted

Crash confirmed",t3_jkhkw8,11
1604011104.0,2020-10-30,wallstreetbets,gajjelj,"I will buy at close and sell at open from now on

I will buy at close and sell at open from now on 

I will buy at close and sell at open from now on

I will buy at close and sell at open from now on",t3_jkhkw8,11
1604011340.0,2020-10-30,wallstreetbets,gajjul8,It still feels dirty holding puts but duck it daddy needs a blonde Call girl for Christmas,t3_jkhkw8,10
1604012056.0,2020-10-30,wallstreetbets,gajl734,Me and the Puerto Rican secretary keep flirting. Looks like she’ll be having kid number 5 very soon,t3_jkhkw8,11
1604012884.0,2020-10-30,wallstreetbets,gajmqxt,"Hot take DD/analysis: the reason Trump canceled his rally in Fayettenam, North Carolina tonight is not because of bad weather, but because he is sick. He has been hitting the campaign trail hard. He was in cold weather a few nights ago, then hot weather today. It takes a toll on the body. If Trump lays low this weekend and does not do any public appearances, it will confirm this analysis. Positions: VIX calls 50 strike expiring 4 Nov, UVXY call 23 strike 1dte, AAPL put 93 strike 1dte, SPY put 310 strike 1dte. Volatility gang rise up. Poor gang rise up.",t3_jkhkw8,12
1604013294.0,2020-10-30,wallstreetbets,gajnipd,"INVESTING.COM UPDATED TO ACCOUNT FOR AH. THE FACT THAT THERE ARE DOZENS OF PEOPLE THAT SAY ""OMG LOL WTF JUST HAPPENED?!?!?! LOOK AT DAT CANDLE!!!"" EVERY NIGHT IS FUCKING RIDICULOUS.

STOP BEING SO FUCKING RETARDED. THANKS!!!",t3_jkhkw8,12
1604013892.0,2020-10-30,wallstreetbets,gajomtw,"Imagine if we could trade the entire market all day

No one in this sub would ever sleep",t3_jkhkw8,10
1604016386.0,2020-10-30,wallstreetbets,gajt7hn,The weekly candle on SPY is dangerously close to just being a solid red dildo,t3_jkhkw8,11
1604017031.0,2020-10-30,wallstreetbets,gajuddy,"If anyone needs to talk blah blah blah Msg me. It’s just money. 

(No one does this for bears)",t3_jkhkw8,12
1604017221.0,2020-10-30,wallstreetbets,gajupzm,"Yikes, couple weeks of consistent gains gone in like 20 minutes today",t3_jkhkw8,10
1604017557.0,2020-10-30,wallstreetbets,gajvbu9,anyone ever bang a legit 9/10 or 10/10 escort? what was it like?,t3_jkhkw8,11
1604019655.0,2020-10-30,wallstreetbets,gajz4iv,Big red 📵,t3_jkhkw8,12
1604019929.0,2020-10-30,wallstreetbets,gajzm33,I think today was a gift to hop in on puts. I did not accept the gift,t3_jkhkw8,13
1604020388.0,2020-10-30,wallstreetbets,gak0gk2,"Lil Wayne and 🥭

Wtf is wrong with this timeline",t3_jkhkw8,12
1604020512.0,2020-10-30,wallstreetbets,gak0op9,Hopefully robinhood doesn’t have one of those days where “sorry we can’t connect to the internet”,t3_jkhkw8,12
1604021475.0,2020-10-30,wallstreetbets,gak2gke,"The Four Stages of GUH

Denial: Nooo AMZN can’t be going down!!! They beat😭

Anger: Fuck this I’m deleting my app😤 

Bargaining: It’s only -1.8% down, lot better than Apple🤔

Acceptance: It’s a dip. Imma buy it🤡",t3_jkhkw8,12
1604023492.0,2020-10-30,wallstreetbets,gak636s,I loaded up on SPY puts and VXX calls today and if I don't get rich tomorrow I'm gonna be pretty bummed,t3_jkhkw8,12
1604023579.0,2020-10-30,wallstreetbets,gak68rc,rip kobe,t3_jkhkw8,13
1604023875.0,2020-10-30,wallstreetbets,gak6rwx,The CEO of SPY needs to step down immediately,t3_jkhkw8,12
1604026411.0,2020-10-30,wallstreetbets,gakb9rg,"Fun fact - I am exactly where I was when I started the week, but I swear to fuck I lost about 10 years off my life",t3_jkhkw8,11
1604027171.0,2020-10-30,wallstreetbets,gakckkp,"Bears it’s okay to dance if you want to, you can leave those bulls behind",t3_jkhkw8,11
1604030609.0,2020-10-30,wallstreetbets,gakhx5z,"I almost grabbed puts at close but realized if there is a god who shat out an immaculate offspring into our existance that the little omnipotent Cunt would have made the markets reverse my positions because I jerked off once in my grandmas house.  
  
Sometime you have to know when to pick your battles",t3_jkhkw8,12
1604030840.0,2020-10-30,wallstreetbets,gaki8p6,Futures are coiling. Lower highs and higher lows. Hopefully we see a strong move up. I'm not delusional enough to think we'll go green but hopefully we get somewhere more manageable for market hours.,t3_jkhkw8,12
1604031046.0,2020-10-30,wallstreetbets,gakij23,"yesterday i bought spy puts at 329, sold them at 332, bought calls instead and sold them at 330.

how many chromosomes do i have?",t3_jkhkw8,12
1604031172.0,2020-10-30,wallstreetbets,gakip9r,"Amazon call holders are fucked. Bruh my biggest loss in one day was playing amazon earnings two quarters ago. 

Fucking -8K from one call.",t3_jkhkw8,13
1604031234.0,2020-10-30,wallstreetbets,gakisdn,I bought 100 shares of apple at 132 but this ship keeps fucking sinking. Fuck China,t3_jkhkw8,12
1604032073.0,2020-10-30,wallstreetbets,gakjx84,[deleted],t3_jkhkw8,13
1604034591.0,2020-10-30,wallstreetbets,gakn4jg,If i go to sleep rn what're the chances I wake up to futures down 2.2%,t3_jkhkw8,12
1604034940.0,2020-10-30,wallstreetbets,gaknjme,"If this 8.5k turns into 15k by open ill flush it all on 315p or 310p and roll the dice


Either papa quitting his job or it's back to the drawing board",t3_jkhkw8,13
1604037189.0,2020-10-30,wallstreetbets,gakq3qu,"Goodbye tech, goodbye stimulus, goodbye mango.

Spy 180 here we come.",t3_jkhkw8,12
1604037920.0,2020-10-30,wallstreetbets,gakqvvl,Ooh it’s dumping for real for real,t3_jkhkw8,12
1604038138.0,2020-10-30,wallstreetbets,gakr3wq,Futures so red my anus bleeding,t3_jkhkw8,11
1604038268.0,2020-10-30,wallstreetbets,gakr8ug,"Thats it boys we broke Sept lows

Next up 300 support",t3_jkhkw8,12
1604038596.0,2020-10-30,wallstreetbets,gakrkxj,All i need is spy to touch 320 during market hours,t3_jkhkw8,12
1604038653.0,2020-10-30,wallstreetbets,gakrmzs,"Fuck it, might start trading like crazy & get pdt tmrw . This level of volatility wooooo",t3_jkhkw8,11
1604039033.0,2020-10-30,wallstreetbets,gaks0yh,"Holy shit. Bought puts on Monday, sold most on Tuesday, regretted it and went even harder. Was down 3k yesterday, but said fuck it and averaged down. I've got:
$SPY $325 11/2 x 5
$SPY $320 11/4 x 3
$SPY $338 11/4 x 2
$DIS $113 11/6 x 3
$MSFT $200 11/6 x 3
$SNAP $43 11/6 x 5

I'm so fucking pumped right now.",t3_jkhkw8,12
1604039134.0,2020-10-30,wallstreetbets,gaks4o1,"At this rate, u/variation_separate will be back by morning saying: I might be early but I’m not wrong 🤣🤣",t3_jkhkw8,14
1604039912.0,2020-10-30,wallstreetbets,gakswjr,"Europe on deck. 

20 minute til shit gets real or they shock the world and start buying.",t3_jkhkw8,12
1604040277.0,2020-10-30,wallstreetbets,gakt9hw,Just saw futures holy shit,t3_jkhkw8,11
1604041254.0,2020-10-30,wallstreetbets,gaku6sl,Big red days are better for wsb than big green days. Don't gotta read BeAr R fUk every other comment with people being jerks for being scared of buying puts,t3_jkhkw8,12
1604041684.0,2020-10-30,wallstreetbets,gakul6g,"Well at least wsb is gonna be much cleaner now 

A lot of ya won’t survive this dump...

The market is a cold ruthless place 

It’s not meant for poor people and is harsh to noobs.



Those of us who been here for March and remember the 2018 trade wars
We know this and experienced this first hand",t3_jkhkw8,11
1604042652.0,2020-10-30,wallstreetbets,gakvhh8,VIX is mooning. Guess we’re in for a ride,t3_jkhkw8,13
1604042849.0,2020-10-30,wallstreetbets,gakvnx5,[Bear. Force. One!](https://youtu.be/twQlpFrm5iM),t3_jkhkw8,12
1604045777.0,2020-10-30,wallstreetbets,gakya33,"🤡🤡 0dte AAPL and AMZN Calls ✅
No hedging or downside protection ✅
Overleveraged 50:1 ✅
Cheap ass joint ✅
Wife's Boyfriend ready ✅
$ROPE within arm's reach ✅
Asshole ready, lubed and open for a gaping ✅

BRING IT!",t3_jkhkw8,11
1604047700.0,2020-10-30,wallstreetbets,gakzz8q,I haven’t slept,t3_jkhkw8,12
1604050478.0,2020-10-30,wallstreetbets,gal2ejz,Who the fuck keeps buying this shit...,t3_jkhkw8,13
1604004176.0,2020-10-30,wallstreetbets,gaj5nn1,"Was today a bull trap or is the AH giving the gay bears false hope, only to open green or flat? Find out in the next episode of “Retards of Wall St”",t3_jkhkw8,25
1604006622.0,2020-10-30,wallstreetbets,gajamq0,[deleted],t3_jkhkw8,25
1604008979.0,2020-10-30,wallstreetbets,gajfb0l,[deleted],t3_jkhkw8,23
1604009398.0,2020-10-30,wallstreetbets,gajg4ni,"Bulls, WITNESS ME",t3_jkhkw8,27
1604009438.0,2020-10-30,wallstreetbets,gajg7hq,"I unretired to say....
Bul r fuk",t3_jkhkw8,24
1604009648.0,2020-10-30,wallstreetbets,gajgm0q,"“Hey mom look how much money I made today”

“You’re going to fucking lose it all tomorrow”

Gee, thanks mom.",t3_jkhkw8,28
1604010161.0,2020-10-30,wallstreetbets,gajhlu2,Bulls going to slaughter house tmrw,t3_jkhkw8,22
1604016794.0,2020-10-30,wallstreetbets,gajtxsx,"🎉 new covid🦠 daily record!📈 🎉

🇺🇲 USA #1 🇺🇲 Keep up the great work! 💪🥰",t3_jkhkw8,29
1604017803.0,2020-10-30,wallstreetbets,gajvrot,Already lost $10k on MSFT and about to lose $20k on amazon tomorow. Fuck you all,t3_jkhkw8,24
1604017888.0,2020-10-30,wallstreetbets,gajvx9w,Imagine being in america where you have a chance of becoming rich even if the odds are low. Now imagine being in Europe where the chance of getting beheaded is 300% higher than america,t3_jkhkw8,25
1604002187.0,2020-10-30,wallstreetbets,gaj1ifm,Our broke asses couldn’t afford google calls 😂😂,t3_jkhkw8,11
1604003604.0,2020-10-30,wallstreetbets,gaj4gwr,AAPL no guidance GUH!,t3_jkhkw8,12
1604004006.0,2020-10-30,wallstreetbets,gaj5b0q,"Oh my god this google shrek cock... it’s beautiful 😭😭😭😭

Gonna prob have a 15-20k profit tomorrow",t3_jkhkw8,12
1604004057.0,2020-10-30,wallstreetbets,gaj5euz,The whole day was a trap,t3_jkhkw8,10
1604004091.0,2020-10-30,wallstreetbets,gaj5hal,"F \* \* \* you APPL

\* U \* \* you APPL

\* \* C \* you APPL

\* \* \* K you APPL",t3_jkhkw8,11
1604004557.0,2020-10-30,wallstreetbets,gaj6fyd,Nothing puts a smile on my face quite like zoom getting dumped,t3_jkhkw8,11
1604004793.0,2020-10-30,wallstreetbets,gaj6xlo,All the idiots who bought today. Godspeed. The institutional investors thank you for offloading their bags.,t3_jkhkw8,11
1604005159.0,2020-10-30,wallstreetbets,gaj7oua,"someone say on the webcast to tim fapple

fuck you and your shit",t3_jkhkw8,11
1604005161.0,2020-10-30,wallstreetbets,gaj7ozz,[deleted],t3_jkhkw8,12
1604005168.0,2020-10-30,wallstreetbets,gaj7pg9,FBI Most Wanted: Tim Apple,t3_jkhkw8,11
1604005223.0,2020-10-30,wallstreetbets,gaj7ti2,Wow..fuck tech... 🤡,t3_jkhkw8,10
1604005508.0,2020-10-30,wallstreetbets,gaj8ect,# Twitter Bears are choosing their Lambo color right now.,t3_jkhkw8,11
1604005628.0,2020-10-30,wallstreetbets,gaj8n4j,Tim Apple is a cuck,t3_jkhkw8,11
1604005793.0,2020-10-30,wallstreetbets,gaj8yz6,"Yo...so AMZN not only beat expected earnings, they even beat their last earnings - which was a massive ""Covid Lockdown"" beat. Now they're heading into the no in-store Black Friday shopping holiday season with the potential for even more lockdowns and the stonk falls AH?! 🤯

I'd like to speak to the head Algo, please.",t3_jkhkw8,11
1604006625.0,2020-10-30,wallstreetbets,gajamx9,After watching my SPY puts get smashed all day this is nice,t3_jkhkw8,10
1604007255.0,2020-10-30,wallstreetbets,gajbw14,I had one life and I spent it slowly throwing away my life savings over the course of 30 years. If I worked at McDonald’s part time for 1 year I would have more money than I do now. TSLA 415c nov 20. This will be the one,t3_jkhkw8,11
1604007540.0,2020-10-30,wallstreetbets,gajcggc,All we need to do is print 20% of the total USD ever in circulation every 6 months & we'll be fine,t3_jkhkw8,11
1604007805.0,2020-10-30,wallstreetbets,gajczfs,AAPL wont stop falling,t3_jkhkw8,11
1604007864.0,2020-10-30,wallstreetbets,gajd3u6,Yo anybody watch Queens Gambit? That shits bomb,t3_jkhkw8,10
1604008004.0,2020-10-30,wallstreetbets,gajddn3,Europeans finna have a field day with the selling when they wake up and smell the croissant,t3_jkhkw8,11
1604008142.0,2020-10-30,wallstreetbets,gajdneg,"We literally at market open price


Reset",t3_jkhkw8,12
1604008347.0,2020-10-30,wallstreetbets,gaje226,I have officially lost all hope in RKT,t3_jkhkw8,9
1604009473.0,2020-10-30,wallstreetbets,gajg9y1,Good luck bulls. Next time maybe don’t just aimlessly btd,t3_jkhkw8,11
1604009927.0,2020-10-30,wallstreetbets,gajh5j4,Well. There goes my calls. I should have just been happy with 100% gains. 🐖🐖🐖🐖,t3_jkhkw8,10
1604010122.0,2020-10-30,wallstreetbets,gajhj5t,Who lost money on AAPL today? Clown gang unite 🤡,t3_jkhkw8,10
1604010163.0,2020-10-30,wallstreetbets,gajhlxt,"I blew up my account on apple, how do I make money back",t3_jkhkw8,11
1604010329.0,2020-10-30,wallstreetbets,gajhxeb,"My power has been out for 15 FUCKING HOURS

WHEN DID THIS BECOME THE 3RD WORLD",t3_jkhkw8,11
1604010821.0,2020-10-30,wallstreetbets,gajiver,Can we hit some circuit breakers tomorrow?,t3_jkhkw8,12
1604011709.0,2020-10-30,wallstreetbets,gajkjky,futures blood red,t3_jkhkw8,12
1604012601.0,2020-10-30,wallstreetbets,gajm809,thoughts & prayers to people trying to use the main exit tomorrow open,t3_jkhkw8,10
1604013467.0,2020-10-30,wallstreetbets,gajnu7i,Dancing 🐻 gif incoming,t3_jkhkw8,10
1604014830.0,2020-10-30,wallstreetbets,gajqcyp,[deleted],t3_jkhkw8,9
1604015311.0,2020-10-30,wallstreetbets,gajr8td,I said no homo before buying Apple puts today so I’m not gay,t3_jkhkw8,10
1604015412.0,2020-10-30,wallstreetbets,gajrfig,"I told all my buddies we were gonna rally today with tech hype and then crash down after hours... and I was right. 

Still bought 10/30 expiry calls like a retard.",t3_jkhkw8,11
1604017113.0,2020-10-30,wallstreetbets,gajuitv,"I created a new Amazon account and said that I am a student, to have 6 month free trial.

After 6 months, create a new account",t3_jkhkw8,10
1604018815.0,2020-10-30,wallstreetbets,gajxls1,"Abraham Lincoln once said, “if you are racist, I will attack you with the north.”",t3_jkhkw8,11
1604019025.0,2020-10-30,wallstreetbets,gajxzjk,Gun shop across the street from my house has long lines everyday. All fat fucks though. They're bound to run out of breath as soon as the war starts,t3_jkhkw8,12
1604019491.0,2020-10-30,wallstreetbets,gajyttz,"Lol robinhood telling people not to panic 
That’s how you know the crash is gonna BIG, SCARY, DARK, RED


https://postimg.cc/tYmN6Nrs",t3_jkhkw8,11
1604020219.0,2020-10-30,wallstreetbets,gak056r,lol @ Exxon news... it took them 7 months to cut jobs in the worst oil market since the horse & buggy 🤡,t3_jkhkw8,11
1604020933.0,2020-10-30,wallstreetbets,gak1gn7,Diamond handed puts in April and lost so much fucking money. Now I'm doing it with calls. Fuck me this sucks.,t3_jkhkw8,11
1604021099.0,2020-10-30,wallstreetbets,gak1rl1,"My positions tomorrow. What do ya'll think???

[https://preview.redd.it/4qskyokqc4w51.png?width=1078&format=png&auto=webp&s=199f4af8c95c95dd6115f0f7e42d3ee493ffb8b4](https://preview.redd.it/4qskyokqc4w51.png?width=1078&format=png&auto=webp&s=199f4af8c95c95dd6115f0f7e42d3ee493ffb8b4)",t3_jkhkw8,13
1604021501.0,2020-10-30,wallstreetbets,gak2ibg,"Cramer said TWLO go up on ER, TWLO went down.  He said AAPL go up on ER, AAPL went down.  He said don’t buy PLTR, PLTR went up.",t3_jkhkw8,12
1604021932.0,2020-10-30,wallstreetbets,gak3a74,Spy $320 by Monday? Too bad I lost all my money before I could buy any of these guaranteed money printing options,t3_jkhkw8,10
1604022016.0,2020-10-30,wallstreetbets,gak3foe,please don't tell anyone how I live,t3_jkhkw8,13
1604022073.0,2020-10-30,wallstreetbets,gak3jfc,Oh fuck oh god oh god oh fu k SPY stop you’re gonna make me cuuuuum,t3_jkhkw8,9
1604024115.0,2020-10-30,wallstreetbets,gak77hd,"Lord, I told myself to get out of all my calls two weeks ago. I fucking played myself.",t3_jkhkw8,10
1604025869.0,2020-10-30,wallstreetbets,gakablv,Twitter is currently pricing in a trump loss,t3_jkhkw8,12
1604026126.0,2020-10-30,wallstreetbets,gakarwn,I made 5 dollars today. Still did better than half of r/investing,t3_jkhkw8,10
1604026404.0,2020-10-30,wallstreetbets,gakb9a9,I’ve seen this before. Red by open.,t3_jkhkw8,11
1604026538.0,2020-10-30,wallstreetbets,gakbhtf,This market has turned into a fucking casino..,t3_jkhkw8,12
1604026631.0,2020-10-30,wallstreetbets,gakbnkh,"What gives Netflix the audacity to raise their monthly subscription price??? Wtf? I’m still gonna pay for it, but there ain’t been shit on there for a coo minute.",t3_jkhkw8,10
1604027109.0,2020-10-30,wallstreetbets,gakcgwe,Anyone only strictly trade 0dte’s in their trading account? I can’t be the only one. I made some huge gains off of em and feel better trading intraday as opposed to holding positions overnight,t3_jkhkw8,12
1604027724.0,2020-10-30,wallstreetbets,gakdhy1,Looks like a sector rotation into VIX,t3_jkhkw8,11
1604028203.0,2020-10-30,wallstreetbets,gakea53,"Smart people are full of doubts, while retards think their plays can’t got tits up, literally free money. This is why retards dine on lobster while smart people sleep for dinner. I forgot the point I was trying to make. 
SPXS all in baby.",t3_jkhkw8,10
