created,date,subreddit,id,body,parent_id,score
1606866052.0,2020-12-02,wallstreetbets,gebanhd,"This past weekend i saw a friend i haven’t seen since quarantine started. We get to talking about the stanks, and he’s like “oh dude have you tried dividend investing? You just hold shares and it’s like residual income.” I didn’t know how to explain that i have 22k in monthly GME calls so i just smiled and said “dude yeah dividends are sick.” This is my burden to bear, not his.",t3_k4u5f8,386
1606862699.0,2020-12-02,wallstreetbets,geb47m8,"Bro 😎 just made 400.00 today. Another 79,600 to go! To be even for the year",t3_k4u5f8,146
1606859721.0,2020-12-02,wallstreetbets,geay5a6,CNBC: The new stimulus will not issue cash but will instead give vouchers only redeemable for PLTR shares 30% off of ATH,t3_k4u5f8,128
1606861802.0,2020-12-02,wallstreetbets,geb2f86,"The girl I like told me she’s fucking like 3 other guys, so my pltr better shoot up soon and give me a reason to keep going",t3_k4u5f8,127
1606857551.0,2020-12-02,wallstreetbets,geatipe,anyones jaw hurting from clenching their teeth all day,t3_k4u5f8,117
1606858660.0,2020-12-02,wallstreetbets,geavuku,you ever take a nap mid trading day feelin good about your positions and you wake up with a wider anus than you slept with?,t3_k4u5f8,124
1606875738.0,2020-12-02,wallstreetbets,gebs3mx,Damn tomorrow is 100% going to be tomorrow,t3_k4u5f8,121
1606857777.0,2020-12-02,wallstreetbets,geatzpw,Anyone else have zero productivity at work today while mindlessly watching their portfolio death spiral?,t3_k4u5f8,410
1606858931.0,2020-12-02,wallstreetbets,geawfq3,Market rotation into parents basement confirmed,t3_k4u5f8,212
1606857923.0,2020-12-02,wallstreetbets,geauarb,"Lol now this sub turns bearish on PLTR. It’s gonna hit ATH tmrw.

Update: the fact that this broke 100 upvotes is the reason I love this place.",t3_k4u5f8,291
1606861791.0,2020-12-02,wallstreetbets,geb2eg3,If PLTR goes to 35 tomorrow I will order a large cheese pizza and eat the entire thing myself,t3_k4u5f8,96
1606861516.0,2020-12-02,wallstreetbets,geb1uhc,difficulty just got turned to casual and a third of this sub wiped out,t3_k4u5f8,91
1606880299.0,2020-12-02,wallstreetbets,gec08ht,My baba calls dropped 20% and I found out I have Covid today. China did a Kung flu double fuck on me.,t3_k4u5f8,80
1606859282.0,2020-12-02,wallstreetbets,geax72b,"Tesla: 📉

Media: Tesla to be included in the S&P 500

Tesla: 📈

Next Day:

Tesla: 📉

Media: Tesla to be included in the S&P 500

Tesla: 📈",t3_k4u5f8,154
1606866324.0,2020-12-02,wallstreetbets,gebb5r6,Now that guy won't be able to leave his abusive relationship,t3_k4u5f8,79
1606858613.0,2020-12-02,wallstreetbets,geavqzx,you guys let Citron win and I'll never forgive you for that,t3_k4u5f8,250
1606858903.0,2020-12-02,wallstreetbets,geawdkt,"“Only true Americans YOLO on fucking PLTR”

-George Washington 🦅",t3_k4u5f8,135
1606857640.0,2020-12-02,wallstreetbets,geatpav,[deleted],t3_k4u5f8,447
1606859019.0,2020-12-02,wallstreetbets,geawmpp,[deleted],t3_k4u5f8,68
1606861104.0,2020-12-02,wallstreetbets,geb1024,[deleted],t3_k4u5f8,65
1606858186.0,2020-12-02,wallstreetbets,geauuqp,My name is chris and I haven't had a winning trade in 3 months. AMA,t3_k4u5f8,131
1606857504.0,2020-12-02,wallstreetbets,geatf9a,"CONGRATS u RETARD, u made front page:

&#x200B;

 [https://www.marketwatch.com/story/he-turned-5-000-into-nearly-half-a-million-with-the-help-of-tesla-options-now-hes-all-in-on-just-two-stocks-11606842686?mod=home-page](https://www.marketwatch.com/story/he-turned-5-000-into-nearly-half-a-million-with-the-help-of-tesla-options-now-hes-all-in-on-just-two-stocks-11606842686?mod=home-page)

# He turned $5,000 into nearly half a million with the help of Tesla options — now he’s all in on just two stocks",t3_k4u5f8,122
1606861435.0,2020-12-02,wallstreetbets,geb1ojc,"S&P at ATH 

This sub - shambles",t3_k4u5f8,62
1606879408.0,2020-12-02,wallstreetbets,gebyppw,"when I put in $200 : +357%📈

when I put in $8000 : day 1 -40%📉 day 2 -99%📉",t3_k4u5f8,116
1606857879.0,2020-12-02,wallstreetbets,geau7ek,Everyone losing their ass on GME and crying needs to take a lesson from u/deepfuckingvalue and shut the fuck up and hold long,t3_k4u5f8,59
1606859614.0,2020-12-02,wallstreetbets,geaxwox,"Let me guess how you made money today:

AAPL, TSLA, SPCE, PFE

Let me guess how you lost money today:

ZM, PLTR, Weed Stocks, EV Stocks

&#x200B;

Unless you are not a Gay bear.",t3_k4u5f8,56
1606861654.0,2020-12-02,wallstreetbets,geb24gh,This day was the worst day I've had in weeks. How can every meme be wrong at the same time?,t3_k4u5f8,57
1606862860.0,2020-12-02,wallstreetbets,geb4j3r,WSB is starting to talk about owning shares again and not just options. That's how you know IV is getting killed out there,t3_k4u5f8,61
1606863148.0,2020-12-02,wallstreetbets,geb53rm,[deleted],t3_k4u5f8,59
1606865524.0,2020-12-02,wallstreetbets,geb9o8b,Anyone got any plays tomorrow? I bought 100k of NIO calls when it was at 55 for 60 strike expiring in December. That money was for my kids college fund but I thought I could scalp 10k. Down 33% and we’re going to the financial advisor Saturday so I need it back for then. Thanks hombres,t3_k4u5f8,57
1606874243.0,2020-12-02,wallstreetbets,gebpfd5,"Some of my family members saw my PLTR gains over thanksgiving and bought in at $27-28. 

Christmas is gunna be real awkward 🤡",t3_k4u5f8,56
1606871477.0,2020-12-02,wallstreetbets,gebkgb2,"You put out your seventh cigarette of the morning in the Luckin Coffee cup sitting by the monitor. The red, jagged lines slicing across your screen have you on edge. You need some air.

You stand up and grab your keys. The plastic green-lettered Hertz keychain rests in your palm. You smile. You stole this car from a rental car lot, and no one noticed. Or maybe it’s just that no one cared.

You slip on a black GameStop t-shirt, part of the uniform to the only job you ever had. You weren’t fired. The place closed and had to let everyone go. It turns out there’s no market for used mid-2000s Madden NFL discs.

As you step out of your bunker into the sunlight, you blink rapidly. When was the last time you went outside?

“Don’t move!”

As your vision clears, you see armed men in black vests surrounding you. Most vests read FBI. A few read SEC. “How’d you find me?”

A guy in an SEC vest spits out a word you never want to hear—your biggest loser ever. “Palantir.”",t3_k4u5f8,108
1606856997.0,2020-12-02,wallstreetbets,geasdsi,jesus where is my rape whistle...,t3_k4u5f8,188
1606858481.0,2020-12-02,wallstreetbets,geavgyc,"Why did I put 50k into a failed weed SPAC now trying to merge with a Chinese battery company?   


I have an MBA and I am literally retarded.",t3_k4u5f8,304
1606859153.0,2020-12-02,wallstreetbets,geawxau,When your entire portfolio is on EV and SPACS 😅😂😭,t3_k4u5f8,54
1606871264.0,2020-12-02,wallstreetbets,gebk2mr,It smells like poor in here.,t3_k4u5f8,52
1606872764.0,2020-12-02,wallstreetbets,gebmrau,"PLTR gang, we rise at dawn",t3_k4u5f8,52
1606879106.0,2020-12-02,wallstreetbets,geby6wl,PLTR clownholders raise your hand🤡,t3_k4u5f8,50
1606857820.0,2020-12-02,wallstreetbets,geau2yh,[deleted],t3_k4u5f8,48
1606859624.0,2020-12-02,wallstreetbets,geaxxiy,"Ho lee foook.  That dude with about $5M (10000 contracts) in $40 planatir calls must be starting to sweat. Theta loss alone is like thousands of dollars, lol.",t3_k4u5f8,45
1606860067.0,2020-12-02,wallstreetbets,geayvll,"PLTR is actually looking like a possible bounce back if you take a technical approach, it’s corrected like this a few times already",t3_k4u5f8,46
1606861927.0,2020-12-02,wallstreetbets,geb2o5w,Lost $20k in 2 days. 60% of folio. Depressed af,t3_k4u5f8,50
1606864348.0,2020-12-02,wallstreetbets,geb7ftz,"Palantir baby just give me another chance, I swear I won’t make the same mistakes I did with those other meme stocks, I’ll treat you right I promise, I even let you wear the strap on these last few days but daddy needs some action too 💦",t3_k4u5f8,47
1606857093.0,2020-12-02,wallstreetbets,geasl13,"My move tomorrow...?

Not opening my account",t3_k4u5f8,162
1606857459.0,2020-12-02,wallstreetbets,geatbyf,I massively underperformed the market today!,t3_k4u5f8,122
1606856899.0,2020-12-02,wallstreetbets,geas6gu,"All volatility indices up 1-3% today with major indices up 1%. Record hospitalizations again and might hit 200K covid cases again. Shit economic numbers today indicating a slowing of the recovery. 2k deaths a day from covid especially after this shitty holiday reporting is done. 

SPY 380 Tomorrow.",t3_k4u5f8,150
1606859271.0,2020-12-02,wallstreetbets,geax69g,"Took 2 months to get to 50% unrealized gains, lost it all in one day today in SPACs and EV 😤",t3_k4u5f8,44
1606859888.0,2020-12-02,wallstreetbets,geayi0b,SPACs ⌐╦╦═─💥 My portfolio,t3_k4u5f8,40
1606861382.0,2020-12-02,wallstreetbets,geb1kr3,"I bought weed stonk high and now have the opportunity  to sell low, but should I wait until it goes lower?",t3_k4u5f8,43
1606862884.0,2020-12-02,wallstreetbets,geb4ksp,How do I tell my kids they can’t go to college because of a meme stock,t3_k4u5f8,40
1606871299.0,2020-12-02,wallstreetbets,gebk4v8,"Checks portfolio* negative numbers

Checks karma of comments in daily thread* negative numbers 

Checks results of covid test* finally something positive",t3_k4u5f8,43
1606894309.0,2020-12-02,wallstreetbets,gecjn51,"Okay, after feeling depressed for a year or so and actively sucidial for the last 8 months, I've decided I'm not gonna kill myself, I now have 1% hope that I can become the version of myself that I'll like and be comfortable with. 

Thank you for everyone here who helped me and kept me going, I don't think you'll find me on Reddit again, because the best version of myself doesn't spend time here.",t3_k4u5f8,44
1606856976.0,2020-12-02,wallstreetbets,geasc7k,"Down 40% on Monday, down 20% today. Improvement!",t3_k4u5f8,142
1606860564.0,2020-12-02,wallstreetbets,geazwgf,[deleted],t3_k4u5f8,105
1606857125.0,2020-12-02,wallstreetbets,geasnat,"""My grandson told me to put everything into PLTR and NIO at Thanksgiving, I wonder how it's doing!""",t3_k4u5f8,182
1606858460.0,2020-12-02,wallstreetbets,geavfei,My well diversified portfolio of meme stocks and shell companies (SPACs) got absolutely clobbered today.,t3_k4u5f8,39
1606859108.0,2020-12-02,wallstreetbets,geawtrn,Couldn't sleep last night because I can't decide to go with orange or blue Lambo.  Won't have that problem tonight that's for sure.,t3_k4u5f8,40
1606879928.0,2020-12-02,wallstreetbets,gebzlvz,"Don't you hate when you talk stocks with someone and they say ""oh what does that company do?"" Like, I don't fucking know but it's mentioned on wsb with a bunch of 🚀🚀🚀🚀 so load up on calls",t3_k4u5f8,35
1606880511.0,2020-12-02,wallstreetbets,gec0ldl,"If Apple hits $125 tomorrow, I’m going to be walking around in a Victorian age suit with a top hat, monocle, and cane on my way to pickup a burrito bowl at Chipotle for lunch.",t3_k4u5f8,37
1606881433.0,2020-12-02,wallstreetbets,gec24tg,[deleted],t3_k4u5f8,35
1606859644.0,2020-12-02,wallstreetbets,geaxz5x,"100% of my net worth on PLTR calls, I've never been so sure of something.",t3_k4u5f8,70
1606862269.0,2020-12-02,wallstreetbets,geb3con,The WSB community is unironically one of the most wholesome on the internet. You all lift my spirits in dark times,t3_k4u5f8,95
1606857269.0,2020-12-02,wallstreetbets,geasxuw," 

You're doing terrible, keep it up. Our algorithm has determined you are in the 10th percentile of the most retarded on the sub.

Don't tell anyone.",t3_k4u5f8,66
1606858455.0,2020-12-02,wallstreetbets,geavf1r,Not worried at all holding PLTR shares,t3_k4u5f8,66
1606858725.0,2020-12-02,wallstreetbets,geavzls,"Thank God for this community, you’re my support group and make me feel not so bad about losing my life savings",t3_k4u5f8,35
1606859192.0,2020-12-02,wallstreetbets,geax0ct,Weeklies always fuck me why do I Keep trying to gamble like a retard,t3_k4u5f8,31
1606860967.0,2020-12-02,wallstreetbets,geb0pvk,"Palantards, just ignore the markets for a week or two and come back once we revisit tendie town.",t3_k4u5f8,35
1606861482.0,2020-12-02,wallstreetbets,geb1rym,Pltr to the moon when they get the gov contract to be in charge of hunting the unvaccinated down,t3_k4u5f8,31
1606873644.0,2020-12-02,wallstreetbets,geboc7w,Imagine posting in this thread like you know what you’re talking while being down 90% all time,t3_k4u5f8,33
1606875455.0,2020-12-02,wallstreetbets,gebrlam,"WSB is the perfect mix of memes, shit posting, freedom of speech, and real life consequences.",t3_k4u5f8,31
1606884597.0,2020-12-02,wallstreetbets,gec76pp,I’m fighting for my life out here,t3_k4u5f8,29
1606885735.0,2020-12-02,wallstreetbets,gec8vjn,Scrolling thru this sub late at night sometimes feels like I’m driving by a homeless community hoping not to get flung too much shit my way,t3_k4u5f8,32
1606859619.0,2020-12-02,wallstreetbets,geaxx4n,"Putting my cock in a blender, be back in a minute",t3_k4u5f8,87
1606857339.0,2020-12-02,wallstreetbets,geat31k,I hope all you fucks add a 0 to your portfolio tomorrow,t3_k4u5f8,108
1606884163.0,2020-12-02,wallstreetbets,gec6iuj,⣿⣿⣿⣿⣿⣿⣿⣿⣿⠟⠛⢉⢉⠉⠉⠻⣿⣿⣿⣿⣿⣿ ⣿⣿⣿⣿⣿⣿⣿⠟⠠⡰⣕⣗⣷⣧⣀⣅⠘⣿⣿⣿⣿⣿ ⣿⣿⣿⣿⣿⣿⠃⣠⣳⣟⣿⣿⣷⣿⡿⣜⠄⣿⣿⣿⣿⣿ ⣿⣿⣿⣿⡿⠁⠄⣳⢷⣿⣿⣿⣿⡿⣝⠖⠄⣿⣿⣿⣿⣿ ⣿⣿⣿⣿⠃⠄⢢⡹⣿⢷⣯⢿⢷⡫⣗⠍⢰⣿⣿⣿⣿⣿ ⣿⣿⣿⡏⢀⢄⠤⣁⠋⠿⣗⣟⡯⡏⢎⠁⢸⣿⣿⣿⣿⣿ ⣿⣿⣿⠄⢔⢕⣯⣿⣿⡲⡤⡄⡤⠄⡀⢠⣿⣿⣿⣿⣿⣿ ⣿⣿⠇⠠⡳⣯⣿⣿⣾⢵⣫⢎⢎⠆⢀⣿⣿⣿⣿⣿⣿⣿ ⣿⣿⠄⢨⣫⣿⣿⡿⣿⣻⢎⡗⡕⡅⢸⣿⣿⣿⣿⣿⣿⣿ ⣿⣿⠄⢜⢾⣾⣿⣿⣟⣗⢯⡪⡳⡀⢸⣿⣿⣿⣿⣿⣿⣿ ⣿⣿⠄⢸⢽⣿⣷⣿⣻⡮⡧⡳⡱⡁⢸⣿⣿⣿⣿⣿⣿⣿ ⣿⣿⡄⢨⣻⣽⣿⣟⣿⣞⣗⡽⡸⡐⢸⣿⣿⣿⣿⣿⣿⣿ ⣿⣿⡇⢀⢗⣿⣿⣿⣿⡿⣞⡵⡣⣊⢸⣿⣿⣿⣿⣿⣿⣿ ⣿⣿⣿⡀⡣⣗⣿⣿⣿⣿⣯⡯⡺⣼⠎⣿⣿⣿⣿⣿⣿⣿ ⣿⣿⣿⣧⠐⡵⣻⣟⣯⣿⣷⣟⣝⢞⡿⢹⣿⣿⣿⣿⣿⣿ ⣿⣿⣿⣿⡆⢘⡺⣽⢿⣻⣿⣗⡷⣹⢩⢃⢿⣿⣿⣿⣿⣿ ⣿⣿⣿⣿⣷⠄⠪⣯⣟⣿⢯⣿⣻⣜⢎⢆⠜⣿⣿⣿⣿⣿ ⣿⣿⣿⣿⣿⡆⠄⢣⣻⣽⣿⣿⣟⣾⡮⡺⡸⠸⣿⣿⣿⣿ ⣿⣿⡿⠛⠉⠁⠄⢕⡳⣽⡾⣿⢽⣯⡿⣮⢚⣅⠹⣿⣿⣿ ⡿⠋⠄⠄⠄⠄⢀⠒⠝⣞⢿⡿⣿⣽⢿⡽⣧⣳⡅⠌⠻⣿ ⠁⠄⠄⠄⠄⠄⠐⡐⠱⡱⣻⡻⣝⣮⣟⣿⣻⣷⣏⣾⢰⣈,t3_k4u5f8,60
1606861050.0,2020-12-02,wallstreetbets,geb0w0w,[deleted],t3_k4u5f8,54
1606857137.0,2020-12-02,wallstreetbets,geaso8k,LOOK HOW THEY MASSACRED MY BOY,t3_k4u5f8,97
1606857732.0,2020-12-02,wallstreetbets,geatwd8,"PLTR gang holding shares.

How we feelin? I bought at $19.  No way we see below 20.",t3_k4u5f8,31
1606859641.0,2020-12-02,wallstreetbets,geaxyw5,"If BABA gets delisted my kids don’t go to college. Sorry, you little fuckers, you should have thought twice before being born to such an autistic father",t3_k4u5f8,25
1606860454.0,2020-12-02,wallstreetbets,geazo8q,PLTR $30 EOW ? Please god,t3_k4u5f8,26
1606865514.0,2020-12-02,wallstreetbets,geb9nhp,"“Stocks take a breather after strong start to December”

Tomorrow’s algo headline",t3_k4u5f8,28
1606867030.0,2020-12-02,wallstreetbets,gebcfzq,GME just got a deal to sell televisions and radios. I also hear they are partnering with RadioShack to revive the radio industry. 🚀 up at least 20% tomorrow.,t3_k4u5f8,27
1606873662.0,2020-12-02,wallstreetbets,geboddk,Wsb bout to be wiped out,t3_k4u5f8,27
1606874394.0,2020-12-02,wallstreetbets,gebpp7i,Pro tip: use your body heat to warm the can of beans before eating for a gourmet experience,t3_k4u5f8,29
1606875103.0,2020-12-02,wallstreetbets,gebqyjq,The market is clearly rotating out of everything into nothing.,t3_k4u5f8,28
1606875448.0,2020-12-02,wallstreetbets,gebrkuj,[removed],t3_k4u5f8,27
1606875710.0,2020-12-02,wallstreetbets,gebs1ro,How does one get into the Forbes’ 30under30? I already have less than $30 in my account and I’m under 30. What else do I gotta do?,t3_k4u5f8,27
1606877761.0,2020-12-02,wallstreetbets,gebvtky,"The Stock market is GS, JPM, Vanguard and Blackrock playing poker with eachother and we are the pants less hobos peeping through the window trying to guess their cards",t3_k4u5f8,28
1606879672.0,2020-12-02,wallstreetbets,gebz62t,"Imma give a toast to Evan Spiegel, ceo of Snapchat, right now. Love him or hate him, the dude rejected a $3 billion buyout from fb in the early days and everyone thought he was fkin crazy as the stock sank below ipo price for a good while and things looked bleak. Well guess what, snap is now worth $66 friken billion and the dude is shagging Miranda Kerr. Bravo mate",t3_k4u5f8,25
1606881203.0,2020-12-02,wallstreetbets,gec1r5i,[Some of you may need this link tomorrow](https://careers.mcdonalds.com/us-restaurants),t3_k4u5f8,25
1606882679.0,2020-12-02,wallstreetbets,gec46ng,I’m so fucking retarded,t3_k4u5f8,27
1606890158.0,2020-12-02,wallstreetbets,gecesij,Made 6k then lost 11k. im fucking retarded,t3_k4u5f8,26
1606902943.0,2020-12-02,wallstreetbets,gecs7yh,"I'm the biggest PLTR bull on this sub (80k in shares, bought at a ton of different prices ranging from 10 to 32, cost basis 20 at this point) but for the love of god guys get out of your calls. You got the timing wrong, we're not mooning any time in the near future.  


This is a great company that is pretty much guaranteed 200B market cap over the next 5 years as their commercial consulting offering takes off -- but this stock is not going to be at 40 EOY or even 30 EOY. It will be at 100 in 2 years, probably.",t3_k4u5f8,25
1606857795.0,2020-12-02,wallstreetbets,geau129,🐝 gang holding some heavy bags,t3_k4u5f8,92
1606860549.0,2020-12-02,wallstreetbets,geazvc5,THERE ARE OTHER STOCKS OUT THERE HOLY FUCK I just made a 3 bagger on fb,t3_k4u5f8,24
1606860949.0,2020-12-02,wallstreetbets,geb0oko,Biden says help is on the way for us retards,t3_k4u5f8,25
1606865614.0,2020-12-02,wallstreetbets,geb9u4o,Bears are awfully loud between 6 to 9pm and then awfully quiet afterwards,t3_k4u5f8,24
1606857036.0,2020-12-02,wallstreetbets,geasgsb,welp. time for a depression nap.,t3_k4u5f8,51
1606860326.0,2020-12-02,wallstreetbets,geazevo,[deleted],t3_k4u5f8,23
1606861685.0,2020-12-02,wallstreetbets,geb26me,[deleted],t3_k4u5f8,22
1606862312.0,2020-12-02,wallstreetbets,geb3fqg,[deleted],t3_k4u5f8,23
1606894169.0,2020-12-02,wallstreetbets,gecjhiz,PLTR dropped just so that guy didn’t have to eat his shit,t3_k4u5f8,23
1606905027.0,2020-12-02,wallstreetbets,gecu2yv,[deleted],t3_k4u5f8,22
1606859077.0,2020-12-02,wallstreetbets,geawrbr,[deleted],t3_k4u5f8,84
1606863650.0,2020-12-02,wallstreetbets,geb63lb,[deleted],t3_k4u5f8,22
1606865761.0,2020-12-02,wallstreetbets,geba3yg,I wanna fuck Doja cat,t3_k4u5f8,22
1606866912.0,2020-12-02,wallstreetbets,gebc8bl,if you dumb dumbs want PTLR to moon stop buying calls and start buying shares!,t3_k4u5f8,21
1606864669.0,2020-12-02,wallstreetbets,geb81x9,[deleted],t3_k4u5f8,20
1606878572.0,2020-12-02,wallstreetbets,gebx9w8,"Damn, PLTR down 2 mangos on the Nicaraguan fruit market.",t3_k4u5f8,21
1606879804.0,2020-12-02,wallstreetbets,gebzea9,[deleted],t3_k4u5f8,20
1606880506.0,2020-12-02,wallstreetbets,gec0l3n,Some of you bulls are alright... dont open RH tomorrow,t3_k4u5f8,20
1606882226.0,2020-12-02,wallstreetbets,gec3fvg,[deleted],t3_k4u5f8,22
1606882690.0,2020-12-02,wallstreetbets,gec47bh,Chris Cornell vocals are something else,t3_k4u5f8,21
1606886466.0,2020-12-02,wallstreetbets,gec9x9w,[deleted],t3_k4u5f8,21
1606906142.0,2020-12-02,wallstreetbets,gecv3kh,"We’re my homies at who bought PLTR >$30?

I shorted it at $19 🧐

We in the clown car together 🤡 🚙",t3_k4u5f8,21
1606857679.0,2020-12-02,wallstreetbets,geatscb,"I made some money with AAPL calls.

I lost the same with PLTR calls.

""Perfectly Balanced. As All things should be"" - Thanos.",t3_k4u5f8,21
1606864659.0,2020-12-02,wallstreetbets,geb818u,Today was a hit piece against wsb. Markets big green but meme stonks deep red,t3_k4u5f8,20
1606866004.0,2020-12-02,wallstreetbets,gebak8f,Buy more GME,t3_k4u5f8,21
1606883887.0,2020-12-02,wallstreetbets,gec63gu,"ARK keeps loading up on PLTR. Today, they added another $325k worth.",t3_k4u5f8,20
1606906881.0,2020-12-02,wallstreetbets,gecvtfo,"The day PLTR gets 0 airtime in this sub, is the day you buy shares and calls. Works like clockwork in here, remember PTON? I remember",t3_k4u5f8,20
1606907774.0,2020-12-02,wallstreetbets,gecwoec,pltr rocket emoji holders have been real quiet recently,t3_k4u5f8,20
1606856849.0,2020-12-02,wallstreetbets,geas2pn,"If you made money today you should consider donating to Wikipedia, it's the greatest depository of knowledge that has ever existed

But who am I kidding, no one made money today",t3_k4u5f8,124
1606860341.0,2020-12-02,wallstreetbets,geazg12,"Holy shit the amount of sob stories after buying OTM Calls on PLTR that HAD RUN 130% IN A MONTH are hilarious. Stop playing the victim. You gambled and you lost. Grow some balls

Edit: thanks for the gold!",t3_k4u5f8,117
1606857567.0,2020-12-02,wallstreetbets,geatjyo,AAPL leaving earth,t3_k4u5f8,20
1606863938.0,2020-12-02,wallstreetbets,geb6nno,open the market I need to sell,t3_k4u5f8,20
1606866025.0,2020-12-02,wallstreetbets,gebaln6,What is this. A dip for ants?,t3_k4u5f8,20
1606870333.0,2020-12-02,wallstreetbets,gebidui,You have no idea the physical toll that trading in this market has on a man,t3_k4u5f8,19
1606871674.0,2020-12-02,wallstreetbets,gebkt29,The chances of this entire sub getting wiped out tomorrow is increasing rapidly.,t3_k4u5f8,18
1606875276.0,2020-12-02,wallstreetbets,gebr9q8,"I like how tons of people here got wiped out on a day where spy and qqq are both up over 1%.

It’s not like it’s a fucking rule you have to constantly go all in on meme stocks after they’ve tripled in two weeks.",t3_k4u5f8,19
1606878502.0,2020-12-02,wallstreetbets,gebx5i9,[deleted],t3_k4u5f8,20
1606881157.0,2020-12-02,wallstreetbets,gec1oel,"Was offered a job today, contractual, but i kinda would  rather stay home and gamble😅",t3_k4u5f8,19
1606886280.0,2020-12-02,wallstreetbets,gec9nnz,"PROTIP for PLTR gang:

There are enough calories in one 450 gram jar of Betty Crocker chocolate frosting to sustain a human adult for 1 day. 

You’re welcome.",t3_k4u5f8,19
1606894623.0,2020-12-02,wallstreetbets,gecjzo6,“Markets rally in hopes that WSB pumps the market”,t3_k4u5f8,19
1606861452.0,2020-12-02,wallstreetbets,geb1prh,"remember when PLTR was $28 for one brief, glorious minute this morning.

things were simpler then....",t3_k4u5f8,39
1606875091.0,2020-12-02,wallstreetbets,gebqxtq,"14,000 in Robinhood but I just barely had enough left today for 1 gallon of gas and now I’m ordering 1 McChicken 

The life we choose",t3_k4u5f8,38
1606882684.0,2020-12-02,wallstreetbets,gec46y9,"daytime crew is such trash, so much spam, no sense of humor, bad advice, unemployed, probably virgins

we the night bois 😎",t3_k4u5f8,40
1606888328.0,2020-12-02,wallstreetbets,geccgwn,[deleted],t3_k4u5f8,43
1606861351.0,2020-12-02,wallstreetbets,geb1ien,$TSLA $700 eow or I have to file bankruptcy,t3_k4u5f8,18
1606862331.0,2020-12-02,wallstreetbets,geb3h48,How come we can get a COVID vaccine in a few months but not an HIV vaccine,t3_k4u5f8,18
1606869343.0,2020-12-02,wallstreetbets,gebglmv,Fuck you guys,t3_k4u5f8,18
1606875262.0,2020-12-02,wallstreetbets,gebr8v9,[deleted],t3_k4u5f8,19
1606879628.0,2020-12-02,wallstreetbets,gebz3dg,"Real talk: The economy is fucked, and the long term prospects of western civilization are already in the sewer. 

Counterpoint: It’s way easier to sleep when holding OTM calls.",t3_k4u5f8,19
1606889271.0,2020-12-02,wallstreetbets,gecdoyo,"Burry is long GME but short TSLA. He’s the ultimate autist, and this is the ultimate asymmetric trade",t3_k4u5f8,18
1606892656.0,2020-12-02,wallstreetbets,gechrpp,Guys i tried selling GME shares and they sent me a check for in-store credit and asked if id like to preorder the new Cooking  Mama game for nintendo switch?,t3_k4u5f8,18
1606893596.0,2020-12-02,wallstreetbets,geciule,"Here’s how this market works. 

UK may potentially approve vaccine. +2%

Uk actually approved vaccine. +2%

USA may get hit by asteroid. 0%.

USA actually gets hit by asteroid, severe impact but not as severe as analysts were expecting.  +8%!!!!",t3_k4u5f8,19
1606856960.0,2020-12-02,wallstreetbets,geasb1p,im so bad at this,t3_k4u5f8,52
1606860493.0,2020-12-02,wallstreetbets,geazr6l,"Trading with WSB can be easy and pretty profitable if you are willing to be half Boomer and half Autist:

1) find a ticker that's about to meme
2) get in with Boomer shares, leaps, or some calls that won't theta fuck you
3) let you position ride 10-30%
4) it it doesn't, GTFO and wait for the next one to come along
5) GTFO before earnings, citron strikes, stimulus fails, etc. 
6) don't get salty about the dudes who made it a 10 bagger but instead be glad you didn't let the position blow up your account
7) realize the annual gains of r/investing in one trade
8) repeat",t3_k4u5f8,49
