created,date,subreddit,id,body,parent_id,score
1606859582.0,2020-12-02,wallstreetbets,geaxu94,I swear that we are going to get 2008 play out again. Mitch going to reject stimulus and the market is going to drop so fucking hard that they are forced to come back and make an emergency stimulus.,t1_geas6gu,23
1606861414.0,2020-12-02,wallstreetbets,geb1n1s,Yes,t1_geb1kr3,12
1606860655.0,2020-12-02,wallstreetbets,geb0349,"You'll get fragged in cod, too.  But it'll be cheaper.  Have fun.",t1_geazwgf,50
1606857391.0,2020-12-02,wallstreetbets,geat6ty,Holy shit can you imagine? Poor grandpa,t1_geasnat,51
1606859891.0,2020-12-02,wallstreetbets,geayi88,So sure that you're going to be poor?,t1_geaxz5x,39
1606862304.0,2020-12-02,wallstreetbets,geb3f70,Wanna buy some coke?,t1_geb3con,56
1606857410.0,2020-12-02,wallstreetbets,geat8a7,My portfolios in the negative tho.,t1_geat31k,76
1606857797.0,2020-12-02,wallstreetbets,geau17w,"Bought at $9, $10 and $15, averaging at $13. You can pry these shares out of my cold dead hands",t1_geatwd8,19
1606890235.0,2020-12-02,wallstreetbets,gecevmv,One of us,t1_gecesij,12
1606857916.0,2020-12-02,wallstreetbets,geaua8w,"The bags only go down to $10, literally can’t go fully tits up",t1_geau129,43
1606860703.0,2020-12-02,wallstreetbets,geb06m9,Y'all wanted loss porn and people crying for weeks now. You get it and you're still complaining? Are you bitches ever happy?,t1_geazg12,25
1606879370.0,2020-12-02,wallstreetbets,gebyndo,Also need a “buy random option” for $100,t1_gebyhsa,19
1606856939.0,2020-12-02,wallstreetbets,geas9hi,Is this who I’m working with... no wonder the pltr gods are fucking me,t1_geas31k,28
1606867113.0,2020-12-02,wallstreetbets,gebclgg,Dude literally every stock WSBs has pumped the past 3 weeks drilled today. The entire fucking subreddit is depressed.,t1_gebcg4z,14
1606857922.0,2020-12-02,wallstreetbets,geauapd,Tesla 600c,t1_geau90m,12
1606904456.0,2020-12-02,wallstreetbets,gectkjg,"Did you know: Alex Karp is a health and fitness fanatic, and can run faster than a Nikola truck on a flat road?",t1_gectg0c,12
1606884819.0,2020-12-02,wallstreetbets,gec7iqr,I micro dose cocaine every hour,t1_gec7cq8,12
1606879209.0,2020-12-02,wallstreetbets,gebydaf,I recognize a talent when I see one,t1_gebyc6v,15
1606857737.0,2020-12-02,wallstreetbets,geatwrd,They had to cut their internet to afford food so they can’t post,t1_geatoqz,13
1606859548.0,2020-12-02,wallstreetbets,geaxrj0,[deleted],t1_geaxgxf,12
1606867001.0,2020-12-02,wallstreetbets,gebce28,"There's enough people in this sub to where the odds that happened are pretty good

Edit: fucking lol https://www.reddit.com/r/wallstreetbets/comments/k5da0z/note_to_self_no_more_repping_stonks_at/",t1_geat6ty,12
