created,date,subreddit,id,body,parent_id,score
1626124467.0,2021-07-13,wallstreetbets,h4yrbdk,I'm going to pay gangs to do drug deals in my neighborhood to stop my property taxes from going up so fucking high.,t3_oiz3pf,131
1626122534.0,2021-07-13,wallstreetbets,h4yn3eo,I’ve lost so much on badly timed SPY puts so I bought some more SPY puts,t3_oiz3pf,74
1626123701.0,2021-07-13,wallstreetbets,h4ypo5y,I made 25k on BB calls a few months ago......thats all gone now and I'm thinking of getting a dildo to practice sucking it for future references,t3_oiz3pf,70
1626138035.0,2021-07-13,wallstreetbets,h4zi6xg,"my girlfriend told me she was cheating on me, I just looked at her and said

""Priced in""",t3_oiz3pf,71
1626125057.0,2021-07-13,wallstreetbets,h4yslgy,Saw a dude live stream lose 50k on SPCE. Didn’t even flinch. What a stud.,t3_oiz3pf,65
1626148209.0,2021-07-13,wallstreetbets,h500mzu,"She runs her hand through your thinning hair and laughs. “What?” you ask absentmindedly. You’re looking at Futures, and you’re surprised to see them red.

“I want you to play with me.” She says it playfully, but the single ounce of you that isn’t totally aloof realizes she said this in earnest. And so you do. You throw your phone, and you pin her to the sofa, then the ground. You both roll about, wrestling, like lion cubs. Kissing, lightly biting. Sometime later, you both stop, breathing hard. She grabs an open bottle of red wine, and you pass it back and forth. Eventually she says, “I want to do that more.”

But you’ve already found your phone again to check Futures. Still red. “Uh huh,” you say, distracted. She stares at you for a long moment, but you don’t realize it. Silently, she gets up and goes to bed, and you don’t say a word because you don’t notice.

She hasn’t left you yet, but she will soon.

Unrealized losses.",t3_oiz3pf,56
1626123606.0,2021-07-13,wallstreetbets,h4ypgn3,Hows my little astronaut doing today? You winning? 🤡,t3_oiz3pf,51
1626140840.0,2021-07-13,wallstreetbets,h4znl1t,"*Market all times highs*

*WSB wiped out*",t3_oiz3pf,53
1626120287.0,2021-07-13,wallstreetbets,h4yi5do,"If SPY drops because of the CPI tomorrow, I'm loading up on calls.",t3_oiz3pf,49
1626122076.0,2021-07-13,wallstreetbets,h4ym2ig,IM THE KING AT MAKING WINNING BETS THEN IMMEDIATELY MAKING SHITTY BETS LEAVING ME EVEN FOR THE YEAR.,t3_oiz3pf,43
1626122132.0,2021-07-13,wallstreetbets,h4ym71j,"It’s the year 2029, there has been no recession in decades, bears still losing every penny of their paychecks betting against SPY",t3_oiz3pf,45
1626125917.0,2021-07-13,wallstreetbets,h4yueoe,I can’t keep living like this,t3_oiz3pf,45
1626140627.0,2021-07-13,wallstreetbets,h4zn5vb,If you invested $1mil in BABA in November 2019... you'd have the same amount of money but be a little more retarded.,t3_oiz3pf,44
1626142969.0,2021-07-13,wallstreetbets,h4zrkkp,i still cant believe females are allowed to fart,t3_oiz3pf,39
1626120094.0,2021-07-13,wallstreetbets,h4yhqjr,"In SPCE, no one can hear you guh",t3_oiz3pf,117
1626120652.0,2021-07-13,wallstreetbets,h4yixrk,"I dont understand it,  but I think SPY is going higher",t3_oiz3pf,40
1626124839.0,2021-07-13,wallstreetbets,h4ys4be,"So a billionaire CEO sees retards piling on his stock and issues more shares to raise capital and nobody saw it coming? Even the retard movie theater no pants guy was smart enough to do this, how do you think these guys got to sit in these chairs?",t3_oiz3pf,36
1626137825.0,2021-07-13,wallstreetbets,h4zhsmk,yOu haVe OPtIoNs eXpiRinG SoOn,t3_oiz3pf,35
1626146121.0,2021-07-13,wallstreetbets,h4zx50s,"Imagine trading without the internet, having to call a broker and be like “buy OTM 0DTE calls at 2pm today lol”",t3_oiz3pf,38
1626120483.0,2021-07-13,wallstreetbets,h4yikmm,I’m starting to think I might not get rich off this stuff you guys,t3_oiz3pf,154
1626121823.0,2021-07-13,wallstreetbets,h4ylhxv,Is there a bagholders anonymous subreddit? Asking for a friend.,t3_oiz3pf,31
1626123331.0,2021-07-13,wallstreetbets,h4yov0o,Why am I in dogshit clean energy and mortgage stocks when I could’ve just dumped it into SPY and forgot about it,t3_oiz3pf,32
1626123806.0,2021-07-13,wallstreetbets,h4ypwde,Branson deserves the 500 mill it was really hard for him to sit down then float for a few seconds.,t3_oiz3pf,32
1626125951.0,2021-07-13,wallstreetbets,h4yuha1,SPY 443 tomorrow at open.,t3_oiz3pf,31
1626137967.0,2021-07-13,wallstreetbets,h4zi27w,"can’t believe how much money i’ve lost, without profiting at all. THIS IS AWESOME!",t3_oiz3pf,34
1626148995.0,2021-07-13,wallstreetbets,h501vph,I believe sir dog may be dying. Tomorrow will not be a good day. But I hope all of you have good days tomorrow. Good night.,t3_oiz3pf,31
1626121553.0,2021-07-13,wallstreetbets,h4ykvip,If you take a shit at 11:59pm its the same shit different day,t3_oiz3pf,123
1626122079.0,2021-07-13,wallstreetbets,h4ym2pq,Someone bought 100k worth of spy 430 puts expiring on the 14th. Lol,t3_oiz3pf,24
1626122211.0,2021-07-13,wallstreetbets,h4ymdc6,SPY literally just goes up.,t3_oiz3pf,28
1626126349.0,2021-07-13,wallstreetbets,h4yvbke,Aint nobody on reddit buying fucking silver. We are not that fucking stooopid,t3_oiz3pf,27
1626127779.0,2021-07-13,wallstreetbets,h4yybcg,"If investing isn’t a team sport, why is my butthole always taking one for the team? 

Get fukt 🌈🐻",t3_oiz3pf,28
1626130444.0,2021-07-13,wallstreetbets,h4z3pj7,Today I plan to talk to my $AAPL calls and ignore my children.,t3_oiz3pf,25
1626131768.0,2021-07-13,wallstreetbets,h4z6auu,I've been learning about investing for last 6 months and I still haven't learned anything.,t3_oiz3pf,25
1626154736.0,2021-07-13,wallstreetbets,h50a1nk,Capitalism is a great system. It ensures that all resources end up in the hands of only the most patient of psychopaths.,t3_oiz3pf,28
1626125553.0,2021-07-13,wallstreetbets,h4ytnb5,Bears' wives were in my DMs,t3_oiz3pf,25
1626156319.0,2021-07-13,wallstreetbets,h50c31t,[deleted],t3_oiz3pf,23
1626123955.0,2021-07-13,wallstreetbets,h4yq801,Hopium turning into copium turning into ropium,t3_oiz3pf,25
1626133753.0,2021-07-13,wallstreetbets,h4za2pj,[deleted],t3_oiz3pf,23
1626139192.0,2021-07-13,wallstreetbets,h4zkdzx,Marriage counseling is over. Glad that’s done with. Gonna get high af now and watch cartoons,t3_oiz3pf,23
1626121133.0,2021-07-13,wallstreetbets,h4yjyql,"3 major indexes hit ATHs 2 days in a row. 

How many more in a row can they do?

$CHADSDAQ 15K eow",t3_oiz3pf,22
1626140771.0,2021-07-13,wallstreetbets,h4zngcc,I bought spy puts late afternoon today  🤡,t3_oiz3pf,21
1626141688.0,2021-07-13,wallstreetbets,h4zp800,Some headlights these days are just way too fucking bright,t3_oiz3pf,23
1626142332.0,2021-07-13,wallstreetbets,h4zqf0z,Cramer said if future is red buy all the dip. That probably means a correction or crash is coming cause that guy is a joke.,t3_oiz3pf,22
1626146297.0,2021-07-13,wallstreetbets,h4zxfu2,Hand to gland combat and then I’m going to sleep.,t3_oiz3pf,22
1626147367.0,2021-07-13,wallstreetbets,h4zz8we,"Covid is over bro, get over it bro",t3_oiz3pf,20
1626122086.0,2021-07-13,wallstreetbets,h4ym3au,Every time Disney rockets I think of Cinderella and Sleeping Beauty making out,t3_oiz3pf,21
1626132826.0,2021-07-13,wallstreetbets,h4z8c0u,Just a reminder that when you think “oh this is the bottom”’ most likely will drop further. Also when you think “oh this is top”’ it most like will run further,t3_oiz3pf,21
1626137003.0,2021-07-13,wallstreetbets,h4zg8e9,I have had it with these motherfucking sneks on this motherfucking ~~plane~~thread,t3_oiz3pf,22
1626131889.0,2021-07-13,wallstreetbets,h4z6j9x,Wtf do you mean you didnt use the official Pinewood Derby kit,t3_oiz3pf,21
1626139520.0,2021-07-13,wallstreetbets,h4zl0nn,[deleted],t3_oiz3pf,20
1626142415.0,2021-07-13,wallstreetbets,h4zqkel,Is there a way as a retail investor that I can subsidize rich people briefly flying into space while they sell shares to keep their tourism going?,t3_oiz3pf,20
1626121185.0,2021-07-13,wallstreetbets,h4yk2s7,Feels like just yesterday we had a July 13th thread,t3_oiz3pf,19
1626143124.0,2021-07-13,wallstreetbets,h4zruvw,Inflation will be transitory. From high to very high,t3_oiz3pf,19
1626155367.0,2021-07-13,wallstreetbets,h50avkq,I’ve been buying options for 8 years and I still have no idea how they work lol,t3_oiz3pf,20
1626159054.0,2021-07-13,wallstreetbets,h50fdqa,"Banks up, airlines up, spy up, tech up, memes down, bears down",t3_oiz3pf,19
1626122034.0,2021-07-13,wallstreetbets,h4ylz3a,Spy is a joke at this point,t3_oiz3pf,17
1626123605.0,2021-07-13,wallstreetbets,h4ypgjj,Take my generational wealth CLOV you deserve every Washington,t3_oiz3pf,19
1626124779.0,2021-07-13,wallstreetbets,h4yrzlc,Loaded with AAPL🚀🚀,t3_oiz3pf,18
1626131585.0,2021-07-13,wallstreetbets,h4z5y2j,SPY $450 eom calls?,t3_oiz3pf,17
1626137575.0,2021-07-13,wallstreetbets,h4zhboq,I have nothing good to add but it’s my Cake Day you degenerates!,t3_oiz3pf,18
1626148123.0,2021-07-13,wallstreetbets,h500hwd,"Imagine still playing ""reopening stocks"" 3 months after everything reopened.",t3_oiz3pf,17
1626149738.0,2021-07-13,wallstreetbets,h503117,FBI set up a tip line for people to send in videos and pictures of the people who stormed the capitol... I’ve been sending them pictures of Jack Ma. Hopefully they can find him.,t3_oiz3pf,19
1626120299.0,2021-07-13,wallstreetbets,h4yi6br,I’m tired of fucking losing,t3_oiz3pf,56
1626120152.0,2021-07-13,wallstreetbets,h4yhuyc,Lost 7k today. Ouch,t3_oiz3pf,17
1626130733.0,2021-07-13,wallstreetbets,h4z49yi,* Pours one ramen container out for my homies in SPCE . RIP  *,t3_oiz3pf,18
1626133508.0,2021-07-13,wallstreetbets,h4z9lyo,name a more disappointing stock than pltr.,t3_oiz3pf,19
1626138093.0,2021-07-13,wallstreetbets,h4ziax6,"Dammit guys 😤 I swear if I blow up my account 13 or 14 more times, I'm out of here! 🤬",t3_oiz3pf,17
1626140618.0,2021-07-13,wallstreetbets,h4zn598,Wow this place is dead,t3_oiz3pf,17
1626143336.0,2021-07-13,wallstreetbets,h4zs8me,Just buy SPY monthly calls ATM on dips and golf all day. Imagine using other strategies,t3_oiz3pf,17
1626147364.0,2021-07-13,wallstreetbets,h4zz8pm,"American here, how do i invest in european stocks




Said no one ever",t3_oiz3pf,17
1626160148.0,2021-07-13,wallstreetbets,h50gmv3,"Futures are fake and gay, spy $438 eod",t3_oiz3pf,18
1626160435.0,2021-07-13,wallstreetbets,h50gyi3,"Bers: FUTES ARE BLOOD RED

Bulls: And this is the part where I shove a massive green dildo up into the Bers anus.",t3_oiz3pf,17
1626125473.0,2021-07-13,wallstreetbets,h4yth5m,$CLOV & $BABA,t3_oiz3pf,53
1626120661.0,2021-07-13,wallstreetbets,h4yiye6,Y'all ok? What happened? So much depression here.,t3_oiz3pf,16
1626123082.0,2021-07-13,wallstreetbets,h4yob5s,My move tomorrow is watching my SPY calls continue to print,t3_oiz3pf,15
1626123743.0,2021-07-13,wallstreetbets,h4yprgc,[deleted],t3_oiz3pf,16
1626126277.0,2021-07-13,wallstreetbets,h4yv642,whose going for silver?  fucking liars CNBC,t3_oiz3pf,17
1626126418.0,2021-07-13,wallstreetbets,h4yvgqy,So CNBC is saying we’re allegedly pumping silver right now🤣🤣🤣,t3_oiz3pf,17
1626133329.0,2021-07-13,wallstreetbets,h4z99v0,"So anyways, my move tomorrow is to change my Tinder preference to men age 50+.",t3_oiz3pf,15
1626137685.0,2021-07-13,wallstreetbets,h4zhj67,The Fed is hiring graveyard shift. The job is to sit in the room with the money printer and simply go *brrrrrrrr* till dawn. Payment is in SPY calls.,t3_oiz3pf,17
1626146291.0,2021-07-13,wallstreetbets,h4zxfiv,"All the people in here who told you to “follow the trend, idiot!” are the same people who will say when we go red “you bought calls after two straight weeks of green? Lol”",t3_oiz3pf,16
1626148334.0,2021-07-13,wallstreetbets,h500ucq,"Will Smith don't gotta cuss in his raps to sell records,
Well, I do, so fuck him and fuck you too",t3_oiz3pf,16
1626122345.0,2021-07-13,wallstreetbets,h4ymo7b,why do i feel so dirty buying clov,t3_oiz3pf,15
1626123259.0,2021-07-13,wallstreetbets,h4yopbl,Still WISHing for $17,t3_oiz3pf,14
1626124508.0,2021-07-13,wallstreetbets,h4yrekh,"Every time an old friend from high school who I havent talked to in 10 years messages me ""Hey what's your address?""

I know it's for a fucking wedding invite but I always reply with my physical address and ""Let me know when you're on your way""

Gotta keep these dudes on their toes.",t3_oiz3pf,15
1626125851.0,2021-07-13,wallstreetbets,h4yu9nh,Every time I pick up my beer I dread the possibility that I may find it empty,t3_oiz3pf,15
1626126421.0,2021-07-13,wallstreetbets,h4yvgzx,Lets not forget about the NEGG bagholders,t3_oiz3pf,15
1626133235.0,2021-07-13,wallstreetbets,h4z93m4,"Oh BB, how long will you burden me? Why, oh why did I FOMO in at the top like the retard I am? God have mercy on my account. 🙏",t3_oiz3pf,15
1626133504.0,2021-07-13,wallstreetbets,h4z9lo4,I have a new hobby. Picking shit stocks and losing money. Anybody else into this hobby?,t3_oiz3pf,16
1626133842.0,2021-07-13,wallstreetbets,h4za8r3,"If I grew up in the coke age, I’d be a fucking bazillionaire.",t3_oiz3pf,17
1626139728.0,2021-07-13,wallstreetbets,h4zlf5q,are BBagholders still alive? ![gif](emote|free_emotes_pack|snoo),t3_oiz3pf,17
1626142609.0,2021-07-13,wallstreetbets,h4zqx54,Not wearing underwear is literally free money,t3_oiz3pf,15
1626150615.0,2021-07-13,wallstreetbets,h504d4i,"My girl just brought over a cute chick who immediately went for a hug then told me I smell nice.

Calls on a three way bois.",t3_oiz3pf,16
1626159085.0,2021-07-13,wallstreetbets,h50fezb,Gosh I hate being a wage cuck grinding the night shift,t3_oiz3pf,13
1626163740.0,2021-07-13,wallstreetbets,h50kj83,CEO went to space to sell shares,t3_oiz3pf,16
1626120420.0,2021-07-13,wallstreetbets,h4yifsh,I actually feel so bad for anyone holding SPCE. -18% is fucking rough anyway you put it,t3_oiz3pf,44
1626121498.0,2021-07-13,wallstreetbets,h4ykr4w,Beautiful masterclass retail bait by Branson.,t3_oiz3pf,46
1626122642.0,2021-07-13,wallstreetbets,h4ync3j,"I lived in Qatar for 2 years. The richer a person is there, the dumber he is. That's because everyone is filthy rich, never has to learn anything or work.  


Qatar is like WSB only in real life.",t3_oiz3pf,43
1626124605.0,2021-07-13,wallstreetbets,h4yrlzk,I tried pan handling and made more money than investing.,t3_oiz3pf,14
1626124691.0,2021-07-13,wallstreetbets,h4yrsmd,"I'm from the future. Bears have currently taken over planet earth. Nonstop celebrations everywhere in the streets and internet. They seem to be holding signs that read ""Bulls get fuk"". I opened my app and saw futures were severely down 0.001% and all Bulls were busy making a new life on Mars.",t3_oiz3pf,13
1626126552.0,2021-07-13,wallstreetbets,h4yvr2e,Fucking CNBC is so disconnected from the average person they can’t even read the subreddit and be accurate. Silver lies are coming back for their institutional friends lol 🤡,t3_oiz3pf,14
1626126632.0,2021-07-13,wallstreetbets,h4yvx9v,"@CNBC

Go fuck yourself and your silver narrative. 

Sincerely,

Retard",t3_oiz3pf,14
1626130156.0,2021-07-13,wallstreetbets,h4z34xx,Lmao anyone remember AMC? Poor thing,t3_oiz3pf,15
1626132478.0,2021-07-13,wallstreetbets,h4z7obp,"im a littler bag holder short and stout,
this is your cock and here is my mouth 

🙁",t3_oiz3pf,14
1626134057.0,2021-07-13,wallstreetbets,h4zan0s,Futes up big 📈📈📈 bears in a pickle 🐻 ☠️❗️,t3_oiz3pf,14
1626135369.0,2021-07-13,wallstreetbets,h4zd3g8,"all green. Take off your pants and pick up dat soap, bear",t3_oiz3pf,13
1626138068.0,2021-07-13,wallstreetbets,h4zi97o,CPA called me trying to sell me on some premium tax package. Told him I'd pay him out of the profits I'll make this year. He laughed and hung up,t3_oiz3pf,15
1626138513.0,2021-07-13,wallstreetbets,h4zj3sx,"“SPY puts are the move.” *SPY goes up*

“Fuck. Okay, now SPY puts are the move.” *SPY goes up*

“Fuck. Okay, SPY puts can’t go tits up now.” *SPY goes down for an hour, then up*",t3_oiz3pf,15
1626138630.0,2021-07-13,wallstreetbets,h4zjbpd,"“Haha this guy is bullish at market ath”

Yeah you fucking idiot that’s how it works",t3_oiz3pf,14
1626140714.0,2021-07-13,wallstreetbets,h4znc60,You guys want to have a cocaine picnic on Friday through Zoom?,t3_oiz3pf,15
1626141680.0,2021-07-13,wallstreetbets,h4zp7jk,"Lemme guess, spy calls?",t3_oiz3pf,15
1626142249.0,2021-07-13,wallstreetbets,h4zq9li,"Can’t wait for the fake CPI report tomorrow 

**leaked script** 

“EVERYTHING IS FINE, INFLATION IS TRANSITORY UNTIL A BOTTLE OF PEPSI IS $20”",t3_oiz3pf,15
1626147403.0,2021-07-13,wallstreetbets,h4zzb2q,"I was told there would be SOFI tendies. 

Why is my money gone",t3_oiz3pf,14
1626159317.0,2021-07-13,wallstreetbets,h50fook,"Hate to say I told you so but…

https://reddit.com/r/wallstreetbets/comments/og44qr/_/h4hktlj/?context=1",t3_oiz3pf,15
1626163790.0,2021-07-13,wallstreetbets,h50kl5f,"Ok, who's still holding SPCE? Show of hands bag holders",t3_oiz3pf,15
1626168369.0,2021-07-13,wallstreetbets,h50pap4,"Once my 401k hits 1 million, I am quitting my job and never working another day in my life",t3_oiz3pf,14
1626169684.0,2021-07-13,wallstreetbets,h50qnld,We bumping NOK?,t3_oiz3pf,15
1626121068.0,2021-07-13,wallstreetbets,h4yjtl0,I think clov gonna do that thing she be doin again,t3_oiz3pf,40
1626121672.0,2021-07-13,wallstreetbets,h4yl5ev,The market is in a very annoying place at the moment. It’s still too expensive to buy but also not tempting to sell because everything could take off soon. Am I the only one just sittings on my hands?,t3_oiz3pf,39
1626121262.0,2021-07-13,wallstreetbets,h4yk8s4,So my gf cheating on me is priced in?,t3_oiz3pf,14
1626121844.0,2021-07-13,wallstreetbets,h4yljls,[deleted],t3_oiz3pf,13
1626125572.0,2021-07-13,wallstreetbets,h4ytopi,"This is the only place in the world where I can lose 2k in an hour... Then feel totally fine about it the next day.

And... Throw even more money out the window.

Thanks WSB.",t3_oiz3pf,13
1626129660.0,2021-07-13,wallstreetbets,h4z25lr,"Not a TA dude, but $SPY hasn’t closed below 200 day MA for like over a fucking year. It is about 11.5% above it rn.",t3_oiz3pf,13
1626130362.0,2021-07-13,wallstreetbets,h4z3jwp,"Red futures implies bear fuk

Green futures implies bear rly fuk",t3_oiz3pf,13
1626130994.0,2021-07-13,wallstreetbets,h4z4s9r,"**Market:** *all time highs*

**WSB front page:** *all time lows*",t3_oiz3pf,13
1626133578.0,2021-07-13,wallstreetbets,h4z9qqz,So uh at what point do I go cash gang in my retirement accounts and let this cool off? I’m zero percent gay bear but SPY 600 by EOY seems wrong.,t3_oiz3pf,13
1626134587.0,2021-07-13,wallstreetbets,h4zbm8x,"You had a bad day, 
 Your holdin bags now, 
 They sold a buncha shares,  
 Now you look like a clown",t3_oiz3pf,12
1626135905.0,2021-07-13,wallstreetbets,h4ze4a6,"for any of you that ended today in the red, find solace in the fact you don’t own a Dodge Ram. That fact alone should put your heart and mind in the green.",t3_oiz3pf,13
1626137294.0,2021-07-13,wallstreetbets,h4zgsat,"As long as most Americans retirement is tied up in a 401k, and their remaining net worth is in their house, the fed will never allow this market to drop. 
And the fed will kill ever bear along the way.",t3_oiz3pf,14
1626140288.0,2021-07-13,wallstreetbets,h4zmi9b,"Goodnight. 

Fuck you. 

I love you. 

I hope I dream about each and every one of you.",t3_oiz3pf,14
1626141838.0,2021-07-13,wallstreetbets,h4zpias,I hate that two week period between paychecks where I can do nothing but have my cock in my hands while seeing others make money since I already did my investing lmao,t3_oiz3pf,13
1626145736.0,2021-07-13,wallstreetbets,h4zwhfe,"If you think of it, investing is rather easy. You buy the things that will make you money and don’t buy the things that lose you money",t3_oiz3pf,12
1626146380.0,2021-07-13,wallstreetbets,h4zxkyq,"Just wanted to say that I'm even though I'm barely even since the last two years, I fucking love gambling, and I love you guys. Hoping for my first all in 10 bagger soon.",t3_oiz3pf,12
1626146685.0,2021-07-13,wallstreetbets,h4zy3l6,At this point the “run up to earnings then dump” play is so expected that it’s gonna change by nature. Gonna be all about the run up to the run up now.,t3_oiz3pf,13
1626148200.0,2021-07-13,wallstreetbets,h500mft,gonna watch SOFI bags get heavier and slowly kill my portfolio like a cancer,t3_oiz3pf,13
1626148227.0,2021-07-13,wallstreetbets,h500o1n,you're going to have like a 90 minute window to sell your SPY puts at a profit tomorrow don't blow it,t3_oiz3pf,13
1626148338.0,2021-07-13,wallstreetbets,h500uk5,So bulls think spy 440 and bears 430. Spy 435 eod.,t3_oiz3pf,13
1626149730.0,2021-07-13,wallstreetbets,h5030ki,"Me: Should I spend extra and get the nice toilet paper?

Also me: Buying SPY puts expiring Wednesday sounds reasonable",t3_oiz3pf,13
1626149958.0,2021-07-13,wallstreetbets,h503db5,Stopped paying the electricity so I can save for more Yolo calls. Keeping it old school with candles.,t3_oiz3pf,13
1626155792.0,2021-07-13,wallstreetbets,h50bfbm,Idk who needs to hear this... but the guy/girl you’re talking to has 3-5 other people on their lineup that they’re also talking to.,t3_oiz3pf,13
1626158164.0,2021-07-13,wallstreetbets,h50ebv0,"“Tech is collapsing” 

You guys are the biggest overreactors in stock trading history. This is why u gets no monies",t3_oiz3pf,12
1626164300.0,2021-07-13,wallstreetbets,h50l4fn,God dammit i stayed up too late again thinking about dumb shit from the past,t3_oiz3pf,12
1626169760.0,2021-07-13,wallstreetbets,h50qqhq,NOK is the buy today,t3_oiz3pf,13
1626121193.0,2021-07-13,wallstreetbets,h4yk3fs,i want to see the $wish losses lol.  that fucking piece of shit company,t3_oiz3pf,12
1626125171.0,2021-07-13,wallstreetbets,h4ysu2h,"DoorDash tried to trick me showing my total as $13 but charging me $19. Got that shit handled with the quickness but the only compensation they would accept is reducing my dasher tip from $6.20 to $1.50. Such a scummy company, horrible to their drivers. The only reason I tipped $6.20 on a $12 order was because they were showing credits being applied up to $6.20. I was going to use the whole credit on tip. Total was $13.56 including tip and they charged me $19.76 essentially showing a fake credit on my receipt, but wouldn’t reimburse me except to let me reduce my dasher tip. Scummy company to their “employees”.",t3_oiz3pf,12
1626126825.0,2021-07-13,wallstreetbets,h4ywc0b,"CNBC was paid to make a Reddit account, post about silver 3 times and then pump silver on live TV for a per diem ETF sale. Tin foil hats anyone ?",t3_oiz3pf,11
1626126912.0,2021-07-13,wallstreetbets,h4ywili,"If the MSM is talking about us “pumping” silver again, then there is at least one meme stock that may be getting ready to spike that they are trying to start drawing attention from.",t3_oiz3pf,13
1626129590.0,2021-07-13,wallstreetbets,h4z20i5,PLUG dying slowly by 1k cuts.  Who tf got suckered into buying this over $30??,t3_oiz3pf,12
1626130476.0,2021-07-13,wallstreetbets,h4z3rt4,Being a 🐻 is not worth it. Ever.,t3_oiz3pf,11
1626133164.0,2021-07-13,wallstreetbets,h4z8yy5,Calm down bears you just had your allotted 1 monthly red day already,t3_oiz3pf,12
1626134232.0,2021-07-13,wallstreetbets,h4zayqi,SPY JUST GOES UP: AFTER HOURS EDITION.,t3_oiz3pf,12
1626138062.0,2021-07-13,wallstreetbets,h4zi8sm,My account always remains the same balance because I keep adding my monthly contribution,t3_oiz3pf,12
1626138374.0,2021-07-13,wallstreetbets,h4ziu8d,Bro. Bears are so fucked when cpi comes out tomorrown,t3_oiz3pf,13
1626138406.0,2021-07-13,wallstreetbets,h4ziwh3,The day I joined this thread my balances started dwindling,t3_oiz3pf,12
1626139231.0,2021-07-13,wallstreetbets,h4zkgpm,"This is how it goes every single time —  
This setup looks good. Time to….buy… right.. *now!*  
Aaaaand I’m **down.**",t3_oiz3pf,12
1626139921.0,2021-07-13,wallstreetbets,h4zlsfp,"Bought weekly SPY puts at the end of the day, literally can’t go tits up 😎",t3_oiz3pf,13
1626141276.0,2021-07-13,wallstreetbets,h4zofmi,I work at a gas station overnight to fund this options gambling habit,t3_oiz3pf,11
1626141949.0,2021-07-13,wallstreetbets,h4zppxd,Risk Management? never heard of her,t3_oiz3pf,12
1626142982.0,2021-07-13,wallstreetbets,h4zrlg9,"Bullish for tomorow, im sure inflation is fucking sky high which means stocks need to inflate aswell",t3_oiz3pf,12
1626144996.0,2021-07-13,wallstreetbets,h4zv6fl,If you find yourself losing back to back run some SPY plays(calls) and get back on your feet. If those fail you just fucking suck bro I’m sorry,t3_oiz3pf,11
1626148560.0,2021-07-13,wallstreetbets,h50179z,Losing money is a luxury,t3_oiz3pf,13
1626150456.0,2021-07-13,wallstreetbets,h5044og,"Lol BABA up 5% in Hong king, guess who bought leaps today",t3_oiz3pf,12
1626159223.0,2021-07-13,wallstreetbets,h50fks5,Europoors about to dump it further like they like to do.,t3_oiz3pf,11
1626160142.0,2021-07-13,wallstreetbets,h50gmmj,"GUH 


Sorry guys I’m practicing for tomorrow",t3_oiz3pf,12
1626164511.0,2021-07-13,wallstreetbets,h50lcnh,"Baba not looking back, join the train",t3_oiz3pf,12
1626120319.0,2021-07-13,wallstreetbets,h4yi7we,CLOV looking like a nice cock-and-ball formation. Hope you CLOVtards have lube.,t3_oiz3pf,90
1626121801.0,2021-07-13,wallstreetbets,h4ylg1e,CLOV bag holders rejoice 🥂 Round 2! Fight! 🥊,t3_oiz3pf,72
1626122729.0,2021-07-13,wallstreetbets,h4ynj11,Only lose what you can't afford to invest.,t3_oiz3pf,33
1626144388.0,2021-07-13,wallstreetbets,h4zu3rz,I want fuck you money,t3_oiz3pf,32
