created,date,subreddit,id,body,parent_id,score
1629422147.0,2021-08-20,wallstreetbets,h9lv76b,Hello,t3_p7mehd,7
1629422203.0,2021-08-20,wallstreetbets,h9lvbde,"Might get into trouble at work for ending an email today with:

Thanks & Retards,  
GadnukBreakerOfWrlds

I guess my phone immediately corrects to retards for regards :(",t3_p7mehd,7
1629423151.0,2021-08-20,wallstreetbets,h9lxays,Getting some Wingstop. If it tastes good then calls if it tastes bad then puts,t3_p7mehd,8
1629423577.0,2021-08-20,wallstreetbets,h9ly6u3,"Nobody:

Futes: Aight, I’m gonna head out now",t3_p7mehd,8
1629424116.0,2021-08-20,wallstreetbets,h9lzbiy,When you're balls deep in pharma stocks that tanked so much you can't talk about them on WSB anymore.,t3_p7mehd,8
1629424452.0,2021-08-20,wallstreetbets,h9m00or,Glad I didn't tell my boss to go fk himself. I'd have to ask him to unfuck himself and beg back for my job,t3_p7mehd,9
1629424690.0,2021-08-20,wallstreetbets,h9m0ic9,Spy leads to Anger. Anger leads to Spy. Spy leads to Suffering,t3_p7mehd,8
1629425367.0,2021-08-20,wallstreetbets,h9m1x9w,I would rather do meth than drink alcohol ever again,t3_p7mehd,8
1629425447.0,2021-08-20,wallstreetbets,h9m2385,Welp went all cash today for the first time ever. Sell in Sept come back in November I learned the hard way in May.,t3_p7mehd,8
1629425599.0,2021-08-20,wallstreetbets,h9m2ehw,will we have the option between male or female tsla bots? asking for a friend,t3_p7mehd,8
1629425907.0,2021-08-20,wallstreetbets,h9m318e,Ngl id work for Tesla for free. Just let me get some options.,t3_p7mehd,8
1629425990.0,2021-08-20,wallstreetbets,h9m37j9,Tesla sexbot Model 69,t3_p7mehd,8
1629426045.0,2021-08-20,wallstreetbets,h9m3bi4,I hope the TSLA bot bot calls,t3_p7mehd,8
1629426076.0,2021-08-20,wallstreetbets,h9m3dtz,Missed opportunity: Elon should've named it Model S3X.. just sayin,t3_p7mehd,7
1629426171.0,2021-08-20,wallstreetbets,h9m3koc,Selling all my stocks and buying bond market ETFs I'm done with this shit,t3_p7mehd,9
1629426301.0,2021-08-20,wallstreetbets,h9m3u6i,#Fucc Theta and that bihhh she came wit 😈,t3_p7mehd,8
1629426420.0,2021-08-20,wallstreetbets,h9m42qc,"yea, my calls have no chance r.i.p",t3_p7mehd,7
1629426517.0,2021-08-20,wallstreetbets,h9m49t9,Dollar broke out today. Highest level since November. Apparently this is a big deal,t3_p7mehd,7
1629427116.0,2021-08-20,wallstreetbets,h9m5gzz,#When Nate Dogg said I get mo' ass than a toilet seat. *BARS*,t3_p7mehd,8
1629427510.0,2021-08-20,wallstreetbets,h9m68x2,"Internet hoes in shambles. Come to me, I'll comfort you.",t3_p7mehd,8
1629427583.0,2021-08-20,wallstreetbets,h9m6e3a,Does the tesla bot have a tongue? If so how long?,t3_p7mehd,9
1629427614.0,2021-08-20,wallstreetbets,h9m6gb0,Only fans gonna make a lot of women go broke,t3_p7mehd,7
1629428041.0,2021-08-20,wallstreetbets,h9m7aiu,"Besides Elon being really fucking awkward, what did I miss for ai day",t3_p7mehd,7
1629428889.0,2021-08-20,wallstreetbets,h9m8xbt,"Its pretty crazy seeing people that have been on UI for a year and a half talk about their tax dollars and how the government doesnt care about the unemployed, like who wouldve ever thought they wouldve even done it this long",t3_p7mehd,7
1629429684.0,2021-08-20,wallstreetbets,h9maf93,[deleted],t3_p7mehd,8
1629429727.0,2021-08-20,wallstreetbets,h9mai6y,"Goodnight friends, catch you at the opening bell!",t3_p7mehd,8
1629429847.0,2021-08-20,wallstreetbets,h9maqa7,Big Red: The official gum of WSB,t3_p7mehd,6
1629430143.0,2021-08-20,wallstreetbets,h9mb9oz,SPY 450 tmmrw and ill walk away forever ....>!till december!<,t3_p7mehd,8
1629430606.0,2021-08-20,wallstreetbets,h9mc3ur,"CHINA NUMBA ONE!!!

At losing money…",t3_p7mehd,8
1629431326.0,2021-08-20,wallstreetbets,h9mdern,[deleted],t3_p7mehd,7
1629431395.0,2021-08-20,wallstreetbets,h9mdj6e,"""We are setting it so at a physical level you can run away from it"" ——-Elon Musk Aug 19, 2021",t3_p7mehd,10
1629432583.0,2021-08-20,wallstreetbets,h9mfmdt,Buying puts on Lorde’s career,t3_p7mehd,8
1629432777.0,2021-08-20,wallstreetbets,h9mfyif,"Moderna is set to start human trials for its experimental mRNA HIV vaccine as early as Thursday, the first time such a trial has ever been conducted

🤔",t3_p7mehd,8
1629432805.0,2021-08-20,wallstreetbets,h9mg08v,"Lames out here fishing for sneks smh

👀",t3_p7mehd,7
1629432910.0,2021-08-20,wallstreetbets,h9mg6ut,"My problem is I don't trust ""easy"" money and I'm not smart enough to find ""hard"" money.",t3_p7mehd,8
1629433192.0,2021-08-20,wallstreetbets,h9mgo3v,"Hang Seng and the Earth’s core.

Name a more iconic duo.",t3_p7mehd,8
1629436661.0,2021-08-20,wallstreetbets,h9mm56g,"https://www.nasdaq.com/articles/u.s.-probing-moderna-vaccine-for-higher-heart-inflammation-risk-washington-post-2021-08-20

I bought an ITM moderna put at close.   This is for sure going to make it drop, yes?  🤌",t3_p7mehd,7
1629437029.0,2021-08-20,wallstreetbets,h9mmok8,[deleted],t3_p7mehd,8
1629437857.0,2021-08-20,wallstreetbets,h9mnv24,"It's either 442 or 432

The Ultimate Nature Deathmatch of Bulls and Bears",t3_p7mehd,9
1629438384.0,2021-08-20,wallstreetbets,h9molff,It seems Uncle Elon played too much Detroit Become Human,t3_p7mehd,8
1629438554.0,2021-08-20,wallstreetbets,h9motzx,"These teslabots are going to make people rich by selling blowies while they're out working. The cars will taxi the bots around while they look for johns, offering a ride and a bj for a fee.",t3_p7mehd,9
1629439671.0,2021-08-20,wallstreetbets,h9mqblr,anyone staying up to watch premarket in 2 hours?,t3_p7mehd,8
1629439695.0,2021-08-20,wallstreetbets,h9mqcsf,"no more bag holding, no more greed, i’m sellin at first profit for every meme stock now that is the key to wealth",t3_p7mehd,8
1629440753.0,2021-08-20,wallstreetbets,h9mrr8l,Stockwits is cancerous,t3_p7mehd,10
1629441387.0,2021-08-20,wallstreetbets,h9mskgq,Is TSLA building sex robots? Wtf.,t3_p7mehd,7
1629441975.0,2021-08-20,wallstreetbets,h9mtb0h,Too many people predicting a big correction. Do you really think retail retards have evolved so quickly?,t3_p7mehd,7
1629444980.0,2021-08-20,wallstreetbets,h9mwyih,my 439p getting more and more in the money..absofuckingly love it 😄,t3_p7mehd,10
1629450004.0,2021-08-20,wallstreetbets,h9n2mva,Christ what happened to the volume? WSB is dead. Just a regular bout of Opex related turbulence and everyone got cleaned the fuck out 🤡,t3_p7mehd,9
1629451059.0,2021-08-20,wallstreetbets,h9n3shq,Another Red day.,t3_p7mehd,9
1629403461.0,2021-08-20,wallstreetbets,h9kop96,Today was a long week of trading,t3_p7mehd,22
1629404873.0,2021-08-20,wallstreetbets,h9ks7sg,Convinced there’s no way you can make money trading this market rn,t3_p7mehd,21
1629403549.0,2021-08-20,wallstreetbets,h9koxaf,TSLA makin me feel like a nude Mia Khalifa at downtown Kabul,t3_p7mehd,21
1629404725.0,2021-08-20,wallstreetbets,h9kruhf,#My broker made me broker! The irony.,t3_p7mehd,22
1629405571.0,2021-08-20,wallstreetbets,h9ktyno,"I think I'm going to just admit I'm no good at trading. I'm not emotional, I'm just stubborn. I guess ima just be here for the shit posting from now on.",t3_p7mehd,22
1629412993.0,2021-08-20,wallstreetbets,h9lbis6,Anyone regrets discovering options?,t3_p7mehd,21
1629404664.0,2021-08-20,wallstreetbets,h9krp61,"Calling it now options will be banned for retail traders by 2023

SEC will say it’s to protect us",t3_p7mehd,19
1629413756.0,2021-08-20,wallstreetbets,h9ld7f7,Some guy on Mad Money was down 50% on shares 😂,t3_p7mehd,19
1629404780.0,2021-08-20,wallstreetbets,h9krzev,That was a bloodbath,t3_p7mehd,9
1629404817.0,2021-08-20,wallstreetbets,h9ks2om,No ones safe in this market,t3_p7mehd,6
1629405058.0,2021-08-20,wallstreetbets,h9ksom8,Shits going to be flat tmrw. Good day to be cash gang.,t3_p7mehd,8
1629405305.0,2021-08-20,wallstreetbets,h9ktapz,Market kinda sucked today no? Yeah we had some nice volatility but shit is too random rn,t3_p7mehd,8
1629405844.0,2021-08-20,wallstreetbets,h9kunh1,Lol rip onlyfans. A bitter sweet end. All these girls going to be fucked outta luck now,t3_p7mehd,8
1629405921.0,2021-08-20,wallstreetbets,h9kuugf,So why can porn sites still operate but OF cant? Like OF is just another porn site,t3_p7mehd,6
1629407149.0,2021-08-20,wallstreetbets,h9kxw1a,[deleted],t3_p7mehd,7
1629407249.0,2021-08-20,wallstreetbets,h9ky4s0,Maybe I should get the new carrera s. Or a friend. Open to either,t3_p7mehd,5
1629407307.0,2021-08-20,wallstreetbets,h9ky9qv,Scalped some juicy returns on TQQQ after the morning dip but still ended red because my other shit plays. Oh well. Do it again tomorrow.,t3_p7mehd,8
1629407521.0,2021-08-20,wallstreetbets,h9kys09,My asshole is sore from getting fucked so hard today,t3_p7mehd,7
1629407750.0,2021-08-20,wallstreetbets,h9kzbpu,"As red as this week has been, next week is probably going to be more. Quarterly GDP number comes out next Thursday, and today Goldman Sachs just pulled their forecast. Not a good sign.",t3_p7mehd,8
1629408029.0,2021-08-20,wallstreetbets,h9kzzwf,Everything fake everything gay,t3_p7mehd,7
1629408097.0,2021-08-20,wallstreetbets,h9l05r5,"Trading212 is pleased to announce you can now buy BRK.A in fractional shares!

😂😂😂 God bless, I needed that laugh after today. Loaded up to the tits with 0.0001 share, let's fucking go 🥳",t3_p7mehd,7
1629408330.0,2021-08-20,wallstreetbets,h9l0pae,Puts on Only Fans,t3_p7mehd,6
1629409008.0,2021-08-20,wallstreetbets,h9l2bl5,So… AMZN is moving into the business model that they put out of business? What’s the worst that could happen?,t3_p7mehd,6
1629409100.0,2021-08-20,wallstreetbets,h9l2jfo,Holy fuck the loss porn its its…. Oh it’s beautiful,t3_p7mehd,7
1629409295.0,2021-08-20,wallstreetbets,h9l3036,battery day 🤡,t3_p7mehd,6
1629411183.0,2021-08-20,wallstreetbets,h9l7fxb,Tesla events only give me PTSD of battery day.,t3_p7mehd,5
1629411259.0,2021-08-20,wallstreetbets,h9l7m60,"Look at March 19. When SPYs monthly dump gets interrupted, it just ends up bleeding for a few days before moving back up.",t3_p7mehd,8
1629411300.0,2021-08-20,wallstreetbets,h9l7pl9,Fuck this market and fuck me too,t3_p7mehd,6
1629411632.0,2021-08-20,wallstreetbets,h9l8h9e,"Wish I could buy puts on OnlyFans.  I’d tell you all the news, but you already know, ya filthy animals.",t3_p7mehd,9
1629412585.0,2021-08-20,wallstreetbets,h9lam0r,“The reason why you are poor is because you think of sex when it rains instead of farming”,t3_p7mehd,6
1629412734.0,2021-08-20,wallstreetbets,h9lay1k,Damn bunch of hoes about to crowd the corners come October,t3_p7mehd,7
1629413252.0,2021-08-20,wallstreetbets,h9lc364,Should have bought puts at close but the color green plagued my judgment,t3_p7mehd,6
1629413490.0,2021-08-20,wallstreetbets,h9lcm38,Holy shit. You need to go see the loss porn at r/vldr,t3_p7mehd,8
1629413493.0,2021-08-20,wallstreetbets,h9lcmcx,Small caps are an inch away from falling to their death. Lowkey half of them have already been murdered tho,t3_p7mehd,7
1629413610.0,2021-08-20,wallstreetbets,h9lcvlz,Options have been nerfed,t3_p7mehd,8
1629413830.0,2021-08-20,wallstreetbets,h9lddff,Shout out to the guy who called about $WISH,t3_p7mehd,7
1629414261.0,2021-08-20,wallstreetbets,h9leb6m,"Tomorrow I finally say goodbye to all my August calls. 2000ish contracts across several stocks that were worth around 100k six months ago and nothing today. Oops. 

It's almost a good thing that they tanked hard again this week and are all super far OTM. I'd rather they end 30% OTM instead of just barely worthless.",t3_p7mehd,7
1629414871.0,2021-08-20,wallstreetbets,h9lfmm5,Weed stonk like Tilray is so damn cheap right now to be honest.,t3_p7mehd,6
1629414999.0,2021-08-20,wallstreetbets,h9lfwok,"Current market is carnage... I'd almost recovered from July dip, back in the hole again. 

PLTR & CLF pull me out this sh*t!!",t3_p7mehd,8
1629415511.0,2021-08-20,wallstreetbets,h9lh06d,"Gonna build myself an L shaped desk for my home office.  Will build to suit for multiple monitors and will put a wireless charger under the surface.  Also gonna put a built in bookcase off one side.

Some day, when I don't need to mortgage my house to buy wood.",t3_p7mehd,7
1629415545.0,2021-08-20,wallstreetbets,h9lh2s9,is it possible all of my stocks go red 5 days in a row....??,t3_p7mehd,7
1629415703.0,2021-08-20,wallstreetbets,h9lher7,Fuck you amzn. You piece of shit stonk. Fake internet money mooning and we're here trying to make a scratch. 😑😤😤,t3_p7mehd,9
1629415963.0,2021-08-20,wallstreetbets,h9lhyu1,If Amazon hits 3000 again it’s time for leaaaaps boys,t3_p7mehd,7
1629416594.0,2021-08-20,wallstreetbets,h9ljb8o,Lost a lot of money the past 2 days this sucks,t3_p7mehd,8
1629406568.0,2021-08-20,wallstreetbets,h9kwgea,"Only adult content, everything else blocked.",t1_h9kvw23,31
1629418232.0,2021-08-20,wallstreetbets,h9lmru3,I have 40K robinhood and also being charged overdraft fees by my bank 🤷🏻‍♂️,t1_h9lmhme,26
1629418252.0,2021-08-20,wallstreetbets,h9lmtcg,"preach brother 😅 ill never order a combo without a coupon , but 10k in calls? why not",t1_h9lmhme,13
1629404029.0,2021-08-20,wallstreetbets,h9kq43s,">/u/beefflanksteak

You gonna show us ur roast beef, home girl?",t1_h9kpxt8,19
1629410559.0,2021-08-20,wallstreetbets,h9l605x,MODS,t1_h9l5ucj,22
1629410883.0,2021-08-20,wallstreetbets,h9l6r0i,Pretty sure you’re gonna eat it either way,t1_h9l5ucj,15
1629410606.0,2021-08-20,wallstreetbets,h9l6443,Mods !!! We got one !!!,t1_h9l5ucj,11
1629405586.0,2021-08-20,wallstreetbets,h9ktzzm,Its fuck!!,t1_h9ktdks,9
1629411633.0,2021-08-20,wallstreetbets,h9l8hbl,"Just tell her that you’re really shit with money, bad at thinking critically and easily influenced by literal actual retards on the internet.

Also that you have no self control, a gambling addiction, and no regard for anyone but yourself.

If she loves you she’ll understand.",t1_h9l6bbk,12
1629410823.0,2021-08-20,wallstreetbets,h9l6m60,Say you got tested and have the big R,t1_h9l6bbk,7
1629420006.0,2021-08-20,wallstreetbets,h9lql7t,Sorry for your loss. 😔 Pictures of the good boi?,t1_h9lqfi4,10
1629406216.0,2021-08-20,wallstreetbets,h9kvl2w,"I know a guy who can turn that into 650

Chinese Yuan",t1_h9kv8x7,7
1629413918.0,2021-08-20,wallstreetbets,h9ldk8o,What about my North Korea stocks?,t1_h9lcxm8,9
1629418128.0,2021-08-20,wallstreetbets,h9lmk1e,Is this about losing your weight?,t1_h9lmhu4,10
1629418213.0,2021-08-20,wallstreetbets,h9lmqeu,Did that on AMZN earnings.,t1_h9lmhu4,7
1629418279.0,2021-08-20,wallstreetbets,h9lmveq,"All because I took my girl for a spa day and said to myself everything should be ok, I don’t have to sell everything and can hold overnight. Fucking idiot haha.",t1_h9lmhu4,8
1629409912.0,2021-08-20,wallstreetbets,h9l4hci,You will be assimilated,t1_h9l4agd,12
1629413962.0,2021-08-20,wallstreetbets,h9ldnq5,"Amazon department stores, only fans without porn, Florida schools fight the Man, Taliban Afghanistan, we didn’t start the fire 🎵",t1_h9l4agd,11
1629410197.0,2021-08-20,wallstreetbets,h9l55mx,"Don't let the year long consolidation fool you. Soon they will own the air you breathe, and eventually your eternal soul will belong to Amazon",t1_h9l4agd,8
1629435303.0,2021-08-20,wallstreetbets,h9mk3mh,That's what I've been saying. We should give this market the correction it wants now so we can continue our ridiculous bull run.,t1_h9mjwx8,7
1629430760.0,2021-08-20,wallstreetbets,h9mcdwh,CCP was loaded on puts,t1_h9mcame,9
1629427046.0,2021-08-20,wallstreetbets,h9m5bz0,Elon's Westworld is gonna be lit.,t1_h9m56x9,11
1629404117.0,2021-08-20,wallstreetbets,h9kqc40,So you only paid $3 an hour for all that fun?,t1_h9kq2u3,24
1629405746.0,2021-08-20,wallstreetbets,h9kuemu,Y pay when you can get pronz for free?,t1_h9ktxco,9
1629409368.0,2021-08-20,wallstreetbets,h9l369e,Are you fucking unemployed or unemployable?,t1_h9l30ns,8
1629404198.0,2021-08-20,wallstreetbets,h9kqj85,"better than .. out of spirit, money crushed..?",t1_h9kqeya,9
1629405958.0,2021-08-20,wallstreetbets,h9kuxr7,I've burnt a lot more than that with terrible picks.,t1_h9kurbc,9
1629407030.0,2021-08-20,wallstreetbets,h9kxlhk,When body hit ground,t1_h9kxc5n,7
1629407278.0,2021-08-20,wallstreetbets,h9ky7ax,They are supposed to pretend that everything is fine even when it isn’t.,t1_h9kxqkv,7
1629424909.0,2021-08-20,wallstreetbets,h9m0yt2,suck his dick you know this,t1_h9m0stm,9
1629424948.0,2021-08-20,wallstreetbets,h9m11rx,You spread your cheeks,t1_h9m0stm,9
1629403324.0,2021-08-20,wallstreetbets,h9kocx6,Before that Premarket: bul fuk bigly.,t1_h9ko75n,21
1629411295.0,2021-08-20,wallstreetbets,h9l7p7h,Taliban with the huge win in the lawsuit.,t1_h9l7g9l,18
1629407253.0,2021-08-20,wallstreetbets,h9ky53s,Don't be silly. He warned all his friends to dump that stock last October.,t1_h9kxvak,7
1629412478.0,2021-08-20,wallstreetbets,h9ladc3,The 300k and 650k loss porn yesterday wasn't enough for you?,t1_h9la6ww,8
1629433010.0,2021-08-20,wallstreetbets,h9mgd0l,Might as well at this point,t1_h9mg82t,11
1629405546.0,2021-08-20,wallstreetbets,h9ktwfb,Every day is a miracle that he wakes up at that age,t1_h9ktrgg,6
1629409615.0,2021-08-20,wallstreetbets,h9l3rq3,u/cashflow_ RIP,t1_h9l3mz9,8
1629411437.0,2021-08-20,wallstreetbets,h9l80x9,I'm making that play as well,t1_h9l7vjr,12
1629413624.0,2021-08-20,wallstreetbets,h9lcwrs,I did cramer fuck you,t1_h9lcusu,7
1629415391.0,2021-08-20,wallstreetbets,h9lgqz5,Reversal confirmed,t1_h9lgdpx,7
1629425371.0,2021-08-20,wallstreetbets,h9m1xlh,And fat,t1_h9m1rk4,13
1629403611.0,2021-08-20,wallstreetbets,h9kp2ul,Theta gang spit roastin',t1_h9kouar,10
1629426844.0,2021-08-20,wallstreetbets,h9m4xh8,I quot trading today to focus on my job. Starting a new one in a week,t1_h9m4qia,16
1629426842.0,2021-08-20,wallstreetbets,h9m4xav,Remember if you play stupid games you will win stupid prizes,t1_h9m4qia,10
1629426855.0,2021-08-20,wallstreetbets,h9m4y8c,I can’t tell if you’re serious,t1_h9m4qia,10
1629426850.0,2021-08-20,wallstreetbets,h9m4xvg,Lol right when there is a correction around the corner. Good luck.,t1_h9m4qia,10
1629424585.0,2021-08-20,wallstreetbets,h9m0ai1,Buy good socks,t1_h9m084j,8
1629431526.0,2021-08-20,wallstreetbets,h9mdrgy,Narrator voice: It was not.,t1_h9mdmzo,16
1629439379.0,2021-08-20,wallstreetbets,h9mpxja,meet kevin,t1_h9mpuo8,7
1629441113.0,2021-08-20,wallstreetbets,h9ms7rc,"Eat my dongus you fuckin nerd.

*I am a bot, and this action was performed automatically. Please [contact the moderators of this subreddit](/message/compose/?to=/r/wallstreetbets) if you have any questions or concerns.*",t1_h9ms7qh,12
1629441275.0,2021-08-20,wallstreetbets,h9msf8n,lot of fakes being exposed now that the market is only going up 70% of the time as opposed to 99%,t1_h9ms8rj,10
1629415729.0,2021-08-20,wallstreetbets,h9lhgs7,RIP to the Onlyfans thots.  The impending Great Thotcession is gonna suck,t1_h9lftpc,8
1629407410.0,2021-08-20,wallstreetbets,h9kyijj,You should work on being a better shitposter,t1_h9ky6rb,8
1629410262.0,2021-08-20,wallstreetbets,h9l5b4m,"If the market closes above 445.50 tomorrow I will be the happiest man alive

But it ain’t gonna happen",t1_h9l573c,7
1629425652.0,2021-08-20,wallstreetbets,h9m2ici,[deleted],t1_h9m2ehw,10
1629433015.0,2021-08-20,wallstreetbets,h9mgda5,your mom is easy and im hard,t1_h9mg6ut,11
1629403632.0,2021-08-20,wallstreetbets,h9kp4so,I aged 10 years today.,t1_h9kop96,14
1629407214.0,2021-08-20,wallstreetbets,h9ky1pp,I haven't showered in a week,t1_h9kxw1a,6
1629414363.0,2021-08-20,wallstreetbets,h9lejcj,You know you can sell contracts before they expire worthless right,t1_h9leb6m,8
1629404213.0,2021-08-20,wallstreetbets,h9kqkmr,"Physically, I'm not a girl. But mentally, I've been referred to as a bitch before. You still want to see my roast beef?",t1_h9kq43s,9
1629404369.0,2021-08-20,wallstreetbets,h9kqymj,Found out my time is worth -3$ an hour then😌,t1_h9kqc40,12
1629405965.0,2021-08-20,wallstreetbets,h9kuye7,OnlyFan is ruining free porn. Hot chicks are only doing OF.,t1_h9kuemu,12
1629406435.0,2021-08-20,wallstreetbets,h9kw4cb,"You trying to tell me that out of all the porn on the internet there isn't a video of a hot chick getting railed that you haven't seen yet?

Props to you.",t1_h9kuye7,19
