created,date,subreddit,id,body,parent_id,score
1606859199.0,2020-12-02,wallstreetbets,geax0ut,"Buy high, and sell low? Feeling like your world is crashing in? It’s not. You’ll be ok. You’re risk tolerance is wild enough for you to be here. You will get through this. Take a break and come back fresh. Don’t chase your losses. Talk to some comrades here about how dumb your plays were. If you still feel like you can’t handle life; check out the resources below. There’s no shame in reaching out. My inbox is always open as well, though response time may vary. Worst case, there’s always bankruptcy, and even that isn’t the end of the world. 

**Money is replaceable, you are not.**

24/7 Crisis Hotline: 1-800-273-TALK (8255) (Veterans, press 1)

Crisis Text Line: Text TALK to 741-741

Veterans Crisis Line: Send a text to 838255

SAMHSA Treatment Referral Hotline (Substance Abuse) 1-800-662-HELP (4357)

The National Problem Gambling Helpline (1-800-522-4700)

The National Problem Gambling Text Helpline 800-522-4700

**Wendy’s Customer Service Line: 888- 624-8140**",t3_k4u5f8,81
1606859268.0,2020-12-02,wallstreetbets,geax60z,That’s strange my strategy of throwing a dart at a stock didn’t work today 🤔,t3_k4u5f8,17
1606859994.0,2020-12-02,wallstreetbets,geayq29,Fuck I deleted app and reinstalled. Didn’t restore my gains,t3_k4u5f8,16
1606864054.0,2020-12-02,wallstreetbets,geb6vno,"bears:  extreme greed at 91 levels not seen since february, dix at 36.7 we are setting up for a huge drop

wsb: oh ok are my PLTR calls going to be safe  ?",t3_k4u5f8,17
1606869699.0,2020-12-02,wallstreetbets,gebh8n7,[deleted],t3_k4u5f8,18
1606871135.0,2020-12-02,wallstreetbets,gebju3t,"On second thought, putting my entire account into short dated calls was probably not the smartest play",t3_k4u5f8,17
1606874665.0,2020-12-02,wallstreetbets,gebq6l8,The government is really writing a $900 billion stimulus check to themselves LOL get fucked Romney,t3_k4u5f8,16
1606876315.0,2020-12-02,wallstreetbets,gebt538,It's time for PLTR civil war in wsb. Pick your side,t3_k4u5f8,17
1606878400.0,2020-12-02,wallstreetbets,gebwyyu,i just wanted to see a guy eat his own shit 😔,t3_k4u5f8,16
1606878812.0,2020-12-02,wallstreetbets,gebxosw,"If PLTR hits $29 by EOW I'll buy everyone that buys 100+ shares, screenshots for proof, and then replies with that screenshot, any car of their choice.",t3_k4u5f8,17
1606879280.0,2020-12-02,wallstreetbets,gebyhsa,WHY DOESNT ROBINHOOD HAVE A “SELL EVERYTHING” BUTTON?!?!,t3_k4u5f8,16
1606879855.0,2020-12-02,wallstreetbets,gebzhca,Best BJ technique? Trying to make as much money as possible in a short time,t3_k4u5f8,16
1606881048.0,2020-12-02,wallstreetbets,gec1hvl,"I can't believe how gay and paperhanded so many of these comments are. The fundamentals don't lie and meme magic is real.

Buy and hold GME and PLTR you retarded fucks.

You'll never go to the moon if you never try.",t3_k4u5f8,17
1606882857.0,2020-12-02,wallstreetbets,gec4gx8,"For anyone who says some piece of good news is priced in...

Remember that Joe Biden has won the presidential election 4 times in the past month.",t3_k4u5f8,17
1606883307.0,2020-12-02,wallstreetbets,gec56ou,Those of us still holding THicc Boy shall now be called 🐝 keepers,t3_k4u5f8,17
1606885961.0,2020-12-02,wallstreetbets,gec9745,How my APHA bulls feeling for tomorrow?,t3_k4u5f8,17
1606891705.0,2020-12-02,wallstreetbets,gecgnq3,Man I miss the good old days on YouTube where the trending was random cool videos. Now it’s a bunch of fucken vlogs people are so desperate to live others lifestyles. Can’t believe people watch that shit.,t3_k4u5f8,16
1606897076.0,2020-12-02,wallstreetbets,gecmmi2,AAPL carrying NASDAQ on its back,t3_k4u5f8,17
1606898181.0,2020-12-02,wallstreetbets,gecnqzl,"Honestly might just delete my Robinhood account until the PLTR vaccine PR comes out. Not worth my days being worse seeing my account go redder and redder until the real takeoff. 

Still very high long on PLTR.",t3_k4u5f8,16
1606903345.0,2020-12-02,wallstreetbets,gecskxe,everyday is pain day for PLTR bros,t3_k4u5f8,16
1606856853.0,2020-12-02,wallstreetbets,geas31k,Yesterday at close I bought PLTR 130 contracts for 40c exp 12/4 but it only cost me like .15 a share. They’re literally worth zero dollars right now lmao. I’ll drag my dick through glass if tomorrow and Thursday are green and I actually make money on this haha,t3_k4u5f8,37
1606857296.0,2020-12-02,wallstreetbets,geaszu3,"I sold all my NIO shares, so expect NIO prices to go to the end of the universe.

No need to thank me...",t3_k4u5f8,37
1606857706.0,2020-12-02,wallstreetbets,geatueu,Looks like little billy isn’t getting a Christmas present from me this year,t3_k4u5f8,38
1606864965.0,2020-12-02,wallstreetbets,geb8m5a,SOMEONE BOUGHT PLANT EAR AT 33 DOLL HAIRS,t3_k4u5f8,33
1606868498.0,2020-12-02,wallstreetbets,gebf37x,[deleted],t3_k4u5f8,35
1606871277.0,2020-12-02,wallstreetbets,gebk3h8,green by morning,t3_k4u5f8,35
1606876593.0,2020-12-02,wallstreetbets,gebtnqg,"If I wake up tomorrow and PLTR is at $27 pm, I’ll drink my own piss",t3_k4u5f8,33
1606881607.0,2020-12-02,wallstreetbets,gec2f4k,"Is my account down 99%?  
YES  
Am I giving up?   
NO  
Have I been trading less than a year?  
YES  
Will I ever learn?  
YES  
Does learning the stock market and options take time?  
YES  
Does it matter what anyone else thinks?  
HELL TO THE FUCK NO  
We will crawl out of hell.",t3_k4u5f8,34
1606883638.0,2020-12-02,wallstreetbets,gec5pm1,"# Alright boys, gather for our nightly prayer.

Papa Thiel, hear me. Bless my Palantir tonight.

Shine Green dildos through the darkness.

Keep me safe all morning from 🌈🧸

As I lay down to sleep, I pray Alex Karp to keep watch

guard me through the night, and wake me with morning Tendies.

Amen

*🙏 🙏 🚀🚀*",t3_k4u5f8,34
1606861186.0,2020-12-02,wallstreetbets,geb168h,"Ok, I'll admit, I deserved the severe ass pounding today. Got too cocky from almost a month of straight gains in November. I've come down to earth a bit, but I'm pretty sure I'll forget all the lessons I learned today and FOMO into something stupid in a couple days.",t3_k4u5f8,16
1606861245.0,2020-12-02,wallstreetbets,geb1ala,Every day I learn how meaningless AH and premarket is but every day I check AH and premarket every 5 minutes,t3_k4u5f8,16
1606861624.0,2020-12-02,wallstreetbets,geb22bt,My life savings is officially 100% in options. Ready to break even or lose it all.,t3_k4u5f8,17
1606862984.0,2020-12-02,wallstreetbets,geb4s22,"Who was more cocky:
(A) Trump supporters in the election thread on the first night, after he won Florida and Texas. Or

(B) PLTR call holders last week",t3_k4u5f8,16
1606866419.0,2020-12-02,wallstreetbets,gebbc18,#FUCK,t3_k4u5f8,16
1606867033.0,2020-12-02,wallstreetbets,gebcg4z,This thread is more dead than usual. Did that many people really get wiped out by PLTR and GME?,t3_k4u5f8,15
1606868374.0,2020-12-02,wallstreetbets,gebev81,"Is GME the electric vehicle version of GM? If so, I am all in!",t3_k4u5f8,17
1606869706.0,2020-12-02,wallstreetbets,gebh94p,My moves tomorrow? 100% lose money,t3_k4u5f8,17
1606871124.0,2020-12-02,wallstreetbets,gebjtff,# i declare chapter 7,t3_k4u5f8,16
1606871317.0,2020-12-02,wallstreetbets,gebk61m,"I'm sticking with PLTR since it has big money, Gov. backing, and little serious competition. With the shady revolving door that is Washington, the fact that they already have an in means that symbiotic/parasitic relationship will only grow with time. Options scare me, so I've just been buying shares, and I'll probably hold until there's either a dip or I remotely figure out what the fuck I'm doing.

Plus, Daddy Karpe is the Overlord Autist, whose off road rollerblading toes I'm not worthy to suck. That alone makes riding the PLTR plane worth it.

Edit: (_)
             =====================D~~🚀🚀🚀
         (_)

Edit 2: Fuck mobile. That was supposed to be a cock.",t3_k4u5f8,16
1606871972.0,2020-12-02,wallstreetbets,geblcbg,[deleted],t3_k4u5f8,15
1606874830.0,2020-12-02,wallstreetbets,gebqh2o,"Investors give no fucks about COVID. Stop citing any COVID stats, vaccine will be out before EOY and will be readily available in 2021. The virus will be irrelevant in a few months

Stop buying dumb-ass tech calls. Stop making dumb-ass bear plays that worked when COVID started. Buy stocks like MAR, LUV, and HLT (8 month+ calls for the audacious) and wait 6 months for the big summer 2021 travel boom. Numbers will be record breaking as consumers rush to travel again when COVID is gone.",t3_k4u5f8,17
1606875265.0,2020-12-02,wallstreetbets,gebr91q,"It doesn’t matter if my options fail miserably. 

In 8 months, I’m moving to a homestead on 8 acres to ride out the apocalypse. Bought the land last month. 

Godspeed, all.",t3_k4u5f8,16
1606875971.0,2020-12-02,wallstreetbets,gebsixa,lol @ automod pm'ing ppl to suck their dick or whatever. Mods r gay but this is ridiculous,t3_k4u5f8,17
1606878217.0,2020-12-02,wallstreetbets,gebwn5o,"If PLTR ends the week > 33.33, I will get a WSB tattoo somewhere on my arm",t3_k4u5f8,14
1606878989.0,2020-12-02,wallstreetbets,gebxzst,Palantir at 75 on Dr. Manns planet from Interstellar.,t3_k4u5f8,16
1606879106.0,2020-12-02,wallstreetbets,geby6y2,[deleted],t3_k4u5f8,16
1606879701.0,2020-12-02,wallstreetbets,gebz7vk,Imagine being a boomer and selling your shares in Coke and buying up Palantir last Friday just because your grandson did like 5 minutes of research and showed you The Matrix. Lmao,t3_k4u5f8,15
1606879994.0,2020-12-02,wallstreetbets,gebzpvb,My boss coming up to me and saying “are you day trading at work again?”,t3_k4u5f8,16
1606880718.0,2020-12-02,wallstreetbets,gec0xut,[deleted],t3_k4u5f8,16
1606882410.0,2020-12-02,wallstreetbets,gec3qt2,">red at night, bul delight

-Jerome Powell",t3_k4u5f8,17
1606885961.0,2020-12-02,wallstreetbets,gec975f,U ever just scroll thru so many videos on pornhub and then look up like damn it's really been 2 hours,t3_k4u5f8,16
1606888941.0,2020-12-02,wallstreetbets,gecd9ni,Why do they call them futures when they are happening right nowsies?,t3_k4u5f8,18
1606893024.0,2020-12-02,wallstreetbets,geci73r,PLTR 28 EOW,t3_k4u5f8,17
1606895521.0,2020-12-02,wallstreetbets,geckyhl,"jeez PLTR. 
it wont stop...i see all myprofits fade away",t3_k4u5f8,15
1606905851.0,2020-12-02,wallstreetbets,gecutup,"Some advice that will save you a chunk of change: when you sell off stock/options, just remove the ticker from the list that you follow. Straightup quit it cold turkey. Clean breakups give you the peace of mind to think clearly about the next one (as in life).",t3_k4u5f8,16
1606857901.0,2020-12-02,wallstreetbets,geau90m,"I’ve got $6000 free cash. I’m gonna put it all into one highly speculative, high risk high reward play. What should I do?",t3_k4u5f8,15
1606863440.0,2020-12-02,wallstreetbets,geb5ols,"I thought we were going to the moon, but we boarded the Challenger instead",t3_k4u5f8,14
1606871796.0,2020-12-02,wallstreetbets,gebl124,Can we go back to 6:31am on Monday please,t3_k4u5f8,15
1606872572.0,2020-12-02,wallstreetbets,gebmf1r,[deleted],t3_k4u5f8,14
1606876205.0,2020-12-02,wallstreetbets,gebsxwx,I’m scared for tomorrow someone hold me 🥺,t3_k4u5f8,15
1606876862.0,2020-12-02,wallstreetbets,gebu5nx,I like how so many people lately are like “thanks a lot retards GUH” like dude we didn’t force you to make that shitty trade lol,t3_k4u5f8,15
1606879507.0,2020-12-02,wallstreetbets,gebyvsy,Life would be good if we could make $3k a day trading LOL,t3_k4u5f8,15
1606881003.0,2020-12-02,wallstreetbets,gec1f7r,Pltr vaccine news dropping tomorrow,t3_k4u5f8,14
1606881544.0,2020-12-02,wallstreetbets,gec2bfq,"Palantir is becoming a religion. Like a fricken' cult where its followers are willing to sacrifice all their tendies now with the hope that they'll someday make it to tendieland. 

Bless your hearts.",t3_k4u5f8,15
1606882189.0,2020-12-02,wallstreetbets,gec3dqp,Isaac Newton invented probability theory because he YOLO'd all his money on tulips,t3_k4u5f8,16
1606882937.0,2020-12-02,wallstreetbets,gec4lhh,I think I need to quit this shit. I don’t think I’m ever gonna make my tendies back.,t3_k4u5f8,15
1606891484.0,2020-12-02,wallstreetbets,gecgeax,"Michael Burry: I’m shorting tesla 😎

S&P500: Fasho but I’m still legally obligated to buy millions of more shares so good luck with that man",t3_k4u5f8,15
1606891739.0,2020-12-02,wallstreetbets,gecgp83,"wsb: bro burry is in the gme short squeeze he is a genius

also wsb: this fucking retard burry is shorting tsla wtf?",t3_k4u5f8,15
1606893670.0,2020-12-02,wallstreetbets,gecixmi,Imagine not holding calls on vaccine Wednesday,t3_k4u5f8,15
1606893722.0,2020-12-02,wallstreetbets,gecizo4,After this latest pltr culling are you guys done buying calls with no intention of actually owning shares in the company? I mean pltr is actually a good company and you autists are ruining it.,t3_k4u5f8,14
1606895408.0,2020-12-02,wallstreetbets,gecku3t,"I bought PTLR and JMIA at their peak...currently down $4,877 😍😍😍",t3_k4u5f8,16
1606896368.0,2020-12-02,wallstreetbets,geclvk6,Tesla 875 lol,t3_k4u5f8,15
1606903590.0,2020-12-02,wallstreetbets,gecssls, Everyone that holds PLTR comment here about your moves we better inform each other or we will suck d,t3_k4u5f8,15
1606904444.0,2020-12-02,wallstreetbets,gectk4l,"Elon always puts out some shit when theres good news. ""Stock too high IMO"" and it fucking rockets. SP 500 and now the 1% profit shit. I am buying calls. Its gonna moon",t3_k4u5f8,15
1606907103.0,2020-12-02,wallstreetbets,gecw152,"New PLTR bagholder here, AMA. Baited some friends in as well.",t3_k4u5f8,15
1606859064.0,2020-12-02,wallstreetbets,geawq9r,"Lost 20k on BB bag holding and now I have hemorrhoids!

Great day!",t3_k4u5f8,14
1606863787.0,2020-12-02,wallstreetbets,geb6d5x,looks like that one bear managed to breed and the children bears are now spamming DIX. nice try. december is for tendies.,t3_k4u5f8,14
1606863941.0,2020-12-02,wallstreetbets,geb6nv8,I love WeBulls charts. So much clarity in my losses.,t3_k4u5f8,15
1606864170.0,2020-12-02,wallstreetbets,geb73nh,PLTR is dead long live PLTR,t3_k4u5f8,14
1606864963.0,2020-12-02,wallstreetbets,geb8lys,"bulls eating $100 sushi rolls off their girlfriends ass

bears eating rotten tuna",t3_k4u5f8,14
1606872836.0,2020-12-02,wallstreetbets,gebmvvg,red fute means sector rotation back into meme stonk and spac,t3_k4u5f8,14
1606873183.0,2020-12-02,wallstreetbets,gebni8b,Carole Baskin is clearly responsible for this,t3_k4u5f8,14
1606873536.0,2020-12-02,wallstreetbets,gebo57p,Time to fill out my Wendy’s application,t3_k4u5f8,13
1606875013.0,2020-12-02,wallstreetbets,gebqsre,"Going balls deep back into $NIO tomorrow. Way oversold based on the delisting noise (passed the senate in May jfc this isn’t new). This shit has been going on for 20 years since SOX was implemented. 

BALLS. DEEP. 🚀",t3_k4u5f8,15
1606875303.0,2020-12-02,wallstreetbets,gebrbjn,I still think about the guy that put his entire 401k into PLTR at the top,t3_k4u5f8,14
1606878311.0,2020-12-02,wallstreetbets,gebwt8y,"From my understanding, when people say someone playing PLTR is fucked, they’re primarily talking about those who FOMO’d into weeklies, right? 

It’s weird seeing how when one mentions shares, everyone pretty much says they’ll be fine.",t3_k4u5f8,13
1606879925.0,2020-12-02,wallstreetbets,gebzlp6,"if PLTR can make wsb retards think buy and hold investing is cool

no doubt they can get a vaccine in every single anti-vaxxer",t3_k4u5f8,14
1606880168.0,2020-12-02,wallstreetbets,gec00g6,The only way to become a better trader is through denial and error.,t3_k4u5f8,13
1606880886.0,2020-12-02,wallstreetbets,gec184t,I was looking to find some EOY tax deductions. Looks like I locked in a few years worth today.,t3_k4u5f8,14
1606882051.0,2020-12-02,wallstreetbets,gec35mg,Pltr already went to the moon. When you go to the moon it’s a pretty big deal but you have to come back to earth to refuel which is what it is doing rn. Next stop Mars,t3_k4u5f8,14
1606882913.0,2020-12-02,wallstreetbets,gec4k4x,Anybody following futures who thinks we’re opening red tomorrow is obviously retarded and should probably be chemically castrated. This bitch-ass honky jive fraud ass market ain’t ever going down again,t3_k4u5f8,13
1606885370.0,2020-12-02,wallstreetbets,gec8chs,Can someone say something bullish about PLTR so I can sleep tonight?,t3_k4u5f8,14
1606886458.0,2020-12-02,wallstreetbets,gec9wuh,bobs and vanga,t3_k4u5f8,15
1606888339.0,2020-12-02,wallstreetbets,gecchf4,"You guys are so stupid. I pump AAPL, FB, SPY, TSLA for you and you lose money? Stop trying so hard and take the free tendies. Trying to time the reversal on NIO and PLTR and Weed? Weed for christ sake?Fucking morons. All of you. AAPL $125 Fri was $0.22 yesterday at open. Would've tripled your money in one day. 

-masa",t3_k4u5f8,14
1606888392.0,2020-12-02,wallstreetbets,geccjuj,Almost time to buy PLTR. Wsb is wavering. Almost knocked out!,t3_k4u5f8,15
1606890115.0,2020-12-02,wallstreetbets,geceqrh,Shorting TSLA is absolutely irresistible to reasonably smart men who think they’re geniuses.,t3_k4u5f8,14
1606897761.0,2020-12-02,wallstreetbets,gecnbl6,"Here in my garage, just bought this uhh, new PLTR stocks here. It's fun to drive up the market here in the NYSE. But do you know what I like a lot more than materialistic things? PLTR calls!...In fact, I am a lot more proud of these seven new calls that I had to get during the dip, the whole portfolio is deep in calls. - Warren Buffett",t3_k4u5f8,14
1606898408.0,2020-12-02,wallstreetbets,gecnz79,"Bull or bear, we can agree futures kinda gay rn.

I want to check futures and experience euphoria or fear, not this boring shit",t3_k4u5f8,15
1606900837.0,2020-12-02,wallstreetbets,gecqbap,"Selling PLTR at open
I bought 600 shares at $14 and I’m red overall, I see nothing wrong with taking profits at a 60% return. 

Maybe id make more if I held for a year, but fuck that man this market is too much stress for me.",t3_k4u5f8,14
1606902239.0,2020-12-02,wallstreetbets,gecrlka,"Hold all the 🐝🐝🐝!

There will be a big fat honeypot",t3_k4u5f8,14
1606904167.0,2020-12-02,wallstreetbets,gectb42,"I have a feeling a lot of new people have conflated ""diamond hands"" and ""bear vs bull gang"" memes with actual trading strategies.",t3_k4u5f8,15
1606904315.0,2020-12-02,wallstreetbets,gectg0c,[deleted],t3_k4u5f8,14
1606906025.0,2020-12-02,wallstreetbets,gecuzlw,PLTR to $20 thanks citron. Puts till $20 then calls ALL THE WAY.,t3_k4u5f8,15
1606906644.0,2020-12-02,wallstreetbets,gecvl0b,"PLTR has been way up pre market on Friday, Monday AND Tuesday so far only to sink. At this point, I'd prefer PLTR to be down pre market and hope that it finally reverses course lol.",t3_k4u5f8,13
1606857290.0,2020-12-02,wallstreetbets,geaszf0,Pltr still dying. Holy fuck,t3_k4u5f8,32
1606864327.0,2020-12-02,wallstreetbets,geb7ec5,Hey if you're a billionaire reading this and you're cool put like 500 million dollars into GME at exactly 9:37 - it would be hilarious lol. i will be watching and if you do not do this you are not cool,t3_k4u5f8,32
1606864456.0,2020-12-02,wallstreetbets,geb7n80,"Palantir takes down terrorists around the world. Don't support terrorism, buy PLTR!",t3_k4u5f8,30
1606857371.0,2020-12-02,wallstreetbets,geat5bm,[deleted],t3_k4u5f8,14
1606857903.0,2020-12-02,wallstreetbets,geau97e,Tesla opens at 600 tomorrow just to nose dive to 580 again,t3_k4u5f8,13
1606858319.0,2020-12-02,wallstreetbets,geav4wc,The last couple of weeks felt like the underlings were playing fire extinguisher races with silly meme stocks. Today the boss came back from vacation and put an end to all the goofy shenanigans. Rotation into financially viable companies.,t3_k4u5f8,14
1606858437.0,2020-12-02,wallstreetbets,geavdn1,"All the market indexes boomed today, yet most of the bulls here got slaughtered today. It was almost as if... the Big Boys were targeting WSB specifically... terror attack O\_O",t3_k4u5f8,13
1606859140.0,2020-12-02,wallstreetbets,geawwak,Markets up but wsb down.,t3_k4u5f8,14
1606859163.0,2020-12-02,wallstreetbets,geawy3k,Lmao there go my CRM calls. Rip $5000,t3_k4u5f8,13
1606861355.0,2020-12-02,wallstreetbets,geb1iqk,Worked so hard to be back to even;  lost it all again in 2 days.,t3_k4u5f8,14
1606861782.0,2020-12-02,wallstreetbets,geb2drb,"Mom, I am scared!!!! I dont wanna play this game anymore!",t3_k4u5f8,13
1606862063.0,2020-12-02,wallstreetbets,geb2xxx,[deleted],t3_k4u5f8,14
1606862429.0,2020-12-02,wallstreetbets,geb3o99,GME dump and dump,t3_k4u5f8,14
1606862944.0,2020-12-02,wallstreetbets,geb4p2e,Monthly reminder to make your own plays and not listen to the spamming parrots 5 days after a stock already popped,t3_k4u5f8,13
1606864468.0,2020-12-02,wallstreetbets,geb7o1h,"I've seen the SPCE newbies and the battery day newbies get wiped, but you pltr autists are another breed. Dumb as rocks lmao",t3_k4u5f8,13
1606865988.0,2020-12-02,wallstreetbets,gebaj5q,Half the stocks we hold moon or dump unrelated  to the indexes. Fuck the indexes,t3_k4u5f8,13
1606866395.0,2020-12-02,wallstreetbets,gebbadm,MM realized we were going to force a squeeze on GME so they crashed all our other meme stocks to trigger their own squeeze,t3_k4u5f8,13
1606866742.0,2020-12-02,wallstreetbets,gebbx9o,How are my TH C 🐝 homo sexual s doing?,t3_k4u5f8,12
1606867427.0,2020-12-02,wallstreetbets,gebd5z4,"Seeing all of the gain and loss porn on here has really driven it into my head that one yolo can seriously make or break your financial status and could lead to the most difficult times or the best of times. Exciting yet scary, because at the end of the day who knows what’s gonna happen in the market.......


Totally unrelated, anyone wanna buy 80 contracts of PLTR 35c expiring this Friday???",t3_k4u5f8,13
1606869355.0,2020-12-02,wallstreetbets,gebgmes,Stonk goes down $1-2 **AH** and WSB loses their fucking mind. Calm the fuck down,t3_k4u5f8,13
1606869540.0,2020-12-02,wallstreetbets,gebgyb1,[deleted],t3_k4u5f8,13
1606869571.0,2020-12-02,wallstreetbets,gebh0bp,Here's a ticker symbol for you PLTR bears.  FAHQ,t3_k4u5f8,13
1606870439.0,2020-12-02,wallstreetbets,gebikro,"The story of PLTR. Institutions buy, WSB memes it to the moon and takes ownership, institutions cause panic, WSB sells it to the institutions, institutions retract panic news and sell to WSB at double the price.",t3_k4u5f8,13
1606871427.0,2020-12-02,wallstreetbets,gebkd0w,"You know, there's no shame in betting that the markets will go down *from all time highs*",t3_k4u5f8,12
1606871947.0,2020-12-02,wallstreetbets,geblaqp,Drill team six actually out here digging mass graves for the bulls in preparation for tomorrow,t3_k4u5f8,13
1606874005.0,2020-12-02,wallstreetbets,gebozs6,Every time I yolo my account we have a massive red day.  FUCK,t3_k4u5f8,12
1606875496.0,2020-12-02,wallstreetbets,gebrnvc,[deleted],t3_k4u5f8,13
1606877693.0,2020-12-02,wallstreetbets,gebvp7p,if you bought puts you aint black,t3_k4u5f8,13
1606877901.0,2020-12-02,wallstreetbets,gebw2o7,I’m disappointed about my losses sure. But I think I’m most disappointed about probably not seeing that guy eat his own shit,t3_k4u5f8,13
1606878326.0,2020-12-02,wallstreetbets,gebwu87,Im seriously depressed after today. Bye hard earned money.,t3_k4u5f8,12
1606878947.0,2020-12-02,wallstreetbets,gebxx5x,"CCL is the Walmart of the seas. 

Ships ahoy.",t3_k4u5f8,13
1606880574.0,2020-12-02,wallstreetbets,gec0p4v,"Fuck marry kill:

PLTR

GME

Riley Reid",t3_k4u5f8,13
1606881354.0,2020-12-02,wallstreetbets,gec206z,NKLA $0p,t3_k4u5f8,13
1606881871.0,2020-12-02,wallstreetbets,gec2v2s,"No matter how much money I lose being a part of this degenerate den of reprehensible rapscallions, at least I'm not a furry",t3_k4u5f8,13
1606882624.0,2020-12-02,wallstreetbets,gec43fe,"I'm gonna make a whole ""Stop Losing Money"" series.

Beginner: [https://www.reddit.com/r/wallstreetbets/comments/k4ztif/top\_5\_tips\_every\_noobie\_trader\_must\_know/](https://www.reddit.com/r/wallstreetbets/comments/k4ztif/top_5_tips_every_noobie_trader_must_know/)

Intermediate: [https://www.reddit.com/r/wallstreetbets/comments/iz68r4/how\_to\_consistently\_outperform\_the\_sp500\_using/](https://www.reddit.com/r/wallstreetbets/comments/iz68r4/how_to_consistently_outperform_the_sp500_using/)

Advanced: Coming Soon?",t3_k4u5f8,13
1606883217.0,2020-12-02,wallstreetbets,gec51l8,covid literally destroyed an entire year we will never get back,t3_k4u5f8,13
1606884465.0,2020-12-02,wallstreetbets,gec6zlz,city of god is one of the best movies ever,t3_k4u5f8,13
1606884708.0,2020-12-02,wallstreetbets,gec7cq8,[deleted],t3_k4u5f8,14
1606884858.0,2020-12-02,wallstreetbets,gec7kvj,Tomorrow might be the first NFL game in history that starts during trading hours,t3_k4u5f8,14
1606885842.0,2020-12-02,wallstreetbets,gec90zm,[deleted],t3_k4u5f8,14
1606886615.0,2020-12-02,wallstreetbets,geca4wi,"My Net Worth is closer to $10 million than Elon Musk’s. 

Elon is also my favorite African-American, but I’m selling 25 TSLA shares tomorrow and sending it to Team Bezos.😎

AMZN is hiring and buying planes, taking some of that Fed Ex/UPS pie.",t3_k4u5f8,13
1606888752.0,2020-12-02,wallstreetbets,gecd0uz,who else lost big money today on bullish positions while the indices rallied? 🙋‍♂️🤡,t3_k4u5f8,14
1606889490.0,2020-12-02,wallstreetbets,gecdyrw,PLTR only going for 12 wuhan bats in the wet markets today👀,t3_k4u5f8,13
1606890989.0,2020-12-02,wallstreetbets,gecfsr0,[deleted],t3_k4u5f8,13
1606892690.0,2020-12-02,wallstreetbets,gecht51,Europoors we're counting on you. Every dime to PLTR today.,t3_k4u5f8,13
