created,date,subreddit,id,body,parent_id,score
1633095959.0,2021-10-01,wallstreetbets,hez3fn4,Almost red from 0.5% up in 15 minutes. Yikes.,t3_pz4ta4,6
1633096052.0,2021-10-01,wallstreetbets,hez3mpe,The market has a small dick energy,t3_pz4ta4,7
1633096068.0,2021-10-01,wallstreetbets,hez3nvg,I was told this was Octobull,t3_pz4ta4,8
1633096090.0,2021-10-01,wallstreetbets,hez3pjw,I stuck my finger in the put pudding this morning. The sin feels good.,t3_pz4ta4,7
1633096400.0,2021-10-01,wallstreetbets,hez4df9,Red October coming.,t3_pz4ta4,7
1633096840.0,2021-10-01,wallstreetbets,hez5bda,Been at $429 for 25 minutes jesus,t3_pz4ta4,6
1633096879.0,2021-10-01,wallstreetbets,hez5ecu,"To whatever dingus actually paid over a hundred dollars for the TSLA 700 put expiring in six hours I sold, thank you and what the fuck is wrong with you, but also thank you for the money",t3_pz4ta4,8
1633096932.0,2021-10-01,wallstreetbets,hez5iil,SPDR S&P 500 Trust ETF. (NYSE: SPY) today announced its intention to voluntarily delist from the New York Stock Exchange (the “NYSE”),t3_pz4ta4,7
1633096933.0,2021-10-01,wallstreetbets,hez5il7,Wow 10 year just exploded,t3_pz4ta4,7
1633097011.0,2021-10-01,wallstreetbets,hez5omd,I plan to continue making money. Mostly by sucking cocks.,t3_pz4ta4,7
1633097153.0,2021-10-01,wallstreetbets,hez5zsr,"PLTR I was patient, now I’m just annoyed",t3_pz4ta4,7
1633097161.0,2021-10-01,wallstreetbets,hez60fk,I'm capitulating.  Fuck this shit.,t3_pz4ta4,8
1633097486.0,2021-10-01,wallstreetbets,hez6px4,Spy below 430 is the end of civilization as we know it,t3_pz4ta4,7
1633097622.0,2021-10-01,wallstreetbets,hez70ni,"I love you Microsoft 

Fuck you Apple! 🖕",t3_pz4ta4,6
1633097801.0,2021-10-01,wallstreetbets,hez7et4,#BULLS LMFAOO!!,t3_pz4ta4,7
1633098050.0,2021-10-01,wallstreetbets,hez7yrl,![img](emote|t5_2th52|4887),t3_pz4ta4,6
1633098126.0,2021-10-01,wallstreetbets,hez84z8,WE’rE iN A bULL mARKEt,t3_pz4ta4,7
1633098167.0,2021-10-01,wallstreetbets,hez88c8,Why the fuck haven't I just bought puts at open on every green futures day,t3_pz4ta4,6
1633098196.0,2021-10-01,wallstreetbets,hez8aon,TSLA LOSS PORNNN,t3_pz4ta4,7
1633098202.0,2021-10-01,wallstreetbets,hez8b7j,Another $8 down day for SPY in the works,t3_pz4ta4,6
1633098215.0,2021-10-01,wallstreetbets,hez8c9g,Green by…ummm…green by next year?,t3_pz4ta4,7
1633098252.0,2021-10-01,wallstreetbets,hez8f8g,Singing this will be the day that I die,t3_pz4ta4,7
1633098405.0,2021-10-01,wallstreetbets,hez8rkk,I had fun for the first 3 months of investing and learning about the stock market and about options. I'm not having fun anymore,t3_pz4ta4,7
1633098450.0,2021-10-01,wallstreetbets,hez8v6l,"I wanna join the next season of squid games

Life is meaningless now",t3_pz4ta4,7
1633098533.0,2021-10-01,wallstreetbets,hez9207,I'm cool with a stock market crash as long as the housing market gets obliterated along with it.,t3_pz4ta4,6
1633098633.0,2021-10-01,wallstreetbets,hez9a2b,It was nice to meet you all.  But I would like to get my refund.,t3_pz4ta4,7
1633098635.0,2021-10-01,wallstreetbets,hez9a7b,The best part of spy crashing is that it takes down everything thats been going straight down since feb with it🥲,t3_pz4ta4,8
1633098642.0,2021-10-01,wallstreetbets,hez9as2,"Any green is just a chance to buy puts. You can stop acting surprised, it's been like this for over a month now. Adapt or die.",t3_pz4ta4,7
1633098653.0,2021-10-01,wallstreetbets,hez9bos,"Tbh tho, SPY likely closing flat",t3_pz4ta4,6
1633098767.0,2021-10-01,wallstreetbets,hez9ktj,God I hope I get a squid game invite at this point!,t3_pz4ta4,7
1633098767.0,2021-10-01,wallstreetbets,hez9kv3,420 is no joke,t3_pz4ta4,8
1633099001.0,2021-10-01,wallstreetbets,heza1vm,"Almost 10k rise in car prices over last year…

Transitory",t3_pz4ta4,7
1633099009.0,2021-10-01,wallstreetbets,heza2kt,"AAPL under 140$, I cannot believe it!",t3_pz4ta4,7
1633099054.0,2021-10-01,wallstreetbets,heza6bm,I hope everyone is having the day they deserve. Play stupid games win stupid prizes.,t3_pz4ta4,8
1633099115.0,2021-10-01,wallstreetbets,hezabey,SPY wobbling like a dried up hooker on heroin.,t3_pz4ta4,7
1633099132.0,2021-10-01,wallstreetbets,hezactc,"Baba built like everything else that’s from China.

Not built to last.",t3_pz4ta4,6
1633099201.0,2021-10-01,wallstreetbets,hezai9y,Goddamn every single green sold the fuck off so hard.,t3_pz4ta4,8
1633099255.0,2021-10-01,wallstreetbets,hezamp2,"Octobear starting off with the lower low monthly candle, bull hunt mode 😆",t3_pz4ta4,7
1633099327.0,2021-10-01,wallstreetbets,hezasi6,God just won’t let me be rich ![img](emote|t5_2th52|4270),t3_pz4ta4,7
1633099495.0,2021-10-01,wallstreetbets,hezb63r,Close positions or delete app… which to choose…,t3_pz4ta4,8
1633099661.0,2021-10-01,wallstreetbets,hezbjji,"Getting chopped to hell today - better sit this one out before I’m living on the streets

#Hard mode is back on",t3_pz4ta4,6
1633100019.0,2021-10-01,wallstreetbets,hezcdif,How's mommy's little investor doing today?,t3_pz4ta4,7
1633100098.0,2021-10-01,wallstreetbets,hezck3n,I’d be careful buying calls on the SPY.,t3_pz4ta4,8
1633100293.0,2021-10-01,wallstreetbets,hezd0ax,I sense a strong rotation into Wendy's dumpsters.,t3_pz4ta4,8
1633100653.0,2021-10-01,wallstreetbets,hezdu65,I just bought SPY puts. Y’all can thank me for the bounce.,t3_pz4ta4,6
1633100666.0,2021-10-01,wallstreetbets,hezdvap,Yup makes sense.  Bounce super hard the morning I go balls deep in puts,t3_pz4ta4,7
1633100682.0,2021-10-01,wallstreetbets,hezdwnn,"Sofi Calls, Ford Puts, Waiting to see what to do with SPY",t3_pz4ta4,6
1633100693.0,2021-10-01,wallstreetbets,hezdxjs,Bull fuk. Bear fuk. That bitchass swing even fukt theta-gang-ol me. Made me close my put credit spread. Utter hogwash mayne. I demand stability![img](emote|t5_2th52|4260),t3_pz4ta4,7
1633100738.0,2021-10-01,wallstreetbets,heze18f,Pretty sure we dump hard eod like usual,t3_pz4ta4,6
1633100739.0,2021-10-01,wallstreetbets,heze1d9,"So they scare a bunch of people into selling, next week they're full of regret, FOMO back in at a higher price and we're back to $440? 

I only lose money though, so that's probably not what's gonna happen.",t3_pz4ta4,8
1633100804.0,2021-10-01,wallstreetbets,heze6ud,You can tell that a bear market is starting because activity in this sub is way down and the pump and dump bot accounts aren’t active.,t3_pz4ta4,7
1633100975.0,2021-10-01,wallstreetbets,hezekp0,I am now negative on my entire spy investment,t3_pz4ta4,7
1633100991.0,2021-10-01,wallstreetbets,hezelz2,Tech is dead my ass. Jumping back into MU and NVDA.,t3_pz4ta4,8
1633101201.0,2021-10-01,wallstreetbets,hezf345,Can cats have autism? I think my cat has autism lol,t3_pz4ta4,7
1633101267.0,2021-10-01,wallstreetbets,hezf8l3,Me leaving my job to trade stocks = 🤡,t3_pz4ta4,6
1633101391.0,2021-10-01,wallstreetbets,hezfiqv,Did spy actually just do that,t3_pz4ta4,8
1633101946.0,2021-10-01,wallstreetbets,hezgsp4,Holding spy puts until EOD wish me luck,t3_pz4ta4,7
1633102104.0,2021-10-01,wallstreetbets,hezh5qu,"Apparently SPY just beat the earning just now.

We will back to it , when we got more news.",t3_pz4ta4,8
1633102667.0,2021-10-01,wallstreetbets,hezigm9,what does my buying power have in common with when the hundred year war ended? they’re both $14.19,t3_pz4ta4,7
1633103708.0,2021-10-01,wallstreetbets,hezkwbs,I got skinned alive today,t3_pz4ta4,7
1633103720.0,2021-10-01,wallstreetbets,hezkxaf,Did you know masturbating to a pic of your Managers wife in his office can get you terminated?,t3_pz4ta4,7
1633104133.0,2021-10-01,wallstreetbets,hezlw2x,Wow spy gonna drill again today or what,t3_pz4ta4,6
1633104180.0,2021-10-01,wallstreetbets,hezm01a,"It's just money, who needs it right?",t3_pz4ta4,8
1633104412.0,2021-10-01,wallstreetbets,hezmjod,People who say short ladder and short squeeze ride the short bus.,t3_pz4ta4,8
1633104463.0,2021-10-01,wallstreetbets,hezmnvb,Fucked up.  Was up 20% today now I’m red chasing puts,t3_pz4ta4,6
1633104601.0,2021-10-01,wallstreetbets,hezmzej,Just woke up. How are my BABA calls looking?,t3_pz4ta4,7
1633104637.0,2021-10-01,wallstreetbets,hezn2ag,If the Bill was blocked…. Why is everything going up now?,t3_pz4ta4,7
1633104819.0,2021-10-01,wallstreetbets,heznhkh,I for one fucking love pumpkin spice lattes fuck off,t3_pz4ta4,7
1633104992.0,2021-10-01,wallstreetbets,heznw3q,Spy at 📉6 am spy 📈at 9 am spy📉 now🤡spy pump n dump meme. Stop playing in stock market you jokers,t3_pz4ta4,7
1633105063.0,2021-10-01,wallstreetbets,hezo20p,"Is this how it sounds,

When a dead bull bounces up?

How sweetly he fell.

🈵️",t3_pz4ta4,7
1633105574.0,2021-10-01,wallstreetbets,hezp8w3,"Bottoms in go long!

$SPY Jan ‘22 470/480 debits potential 10 bagger",t3_pz4ta4,7
1633105699.0,2021-10-01,wallstreetbets,hezpjcz,Just a daily reminder that RIDE is a fraudulent company,t3_pz4ta4,8
1633105834.0,2021-10-01,wallstreetbets,hezpuyn,CNBC: “Please buy my bags please!!! “,t3_pz4ta4,8
1633105939.0,2021-10-01,wallstreetbets,hezq3ri,HOW MY FUCKING BEARS DOING,t3_pz4ta4,7
1633106408.0,2021-10-01,wallstreetbets,hezr7v9,Apple under 140 and people are acting like the market is fine 😂😂😂,t3_pz4ta4,7
1633106530.0,2021-10-01,wallstreetbets,hezrial,Just consumed 3000 calories for copium,t3_pz4ta4,6
1633106956.0,2021-10-01,wallstreetbets,hezsil8,SPY you’ve got so many bigger things ahead of you quit saying you’re not $440,t3_pz4ta4,8
1633107004.0,2021-10-01,wallstreetbets,hezsmq7,green dildos please come out and play,t3_pz4ta4,8
1633108265.0,2021-10-01,wallstreetbets,hezvkz9,This shit is about to EXPLODE in either direction.,t3_pz4ta4,7
1633108448.0,2021-10-01,wallstreetbets,hezw05p,Bears all dead.,t3_pz4ta4,7
1633108496.0,2021-10-01,wallstreetbets,hezw488,so looks like fuck my poots,t3_pz4ta4,7
1633108577.0,2021-10-01,wallstreetbets,hezwazc,"It so so damn annoying when CNBC wastes time on anything other than stocks. Their are 50 different cable news channels if I want to hear about other shit. Good lord, this is why I never turn on Fox Business, it's like 15% stocks and 85% conservative politics.",t3_pz4ta4,7
1633108646.0,2021-10-01,wallstreetbets,hezwgl1,but what does bill hwang think of all of this?,t3_pz4ta4,7
1633109478.0,2021-10-01,wallstreetbets,hezydke,Nothing like making money on the long side everywhere & making money to the downside in TSLA. Something about it feels so good.,t3_pz4ta4,7
1633109738.0,2021-10-01,wallstreetbets,hezyyvt,They really gonna keep spy at 432 till 4pm then immediately dump it to 425?,t3_pz4ta4,7
1633109908.0,2021-10-01,wallstreetbets,hezzctx,"95% of money managers fail to beat SPY. 

Those idiots. They should have just invested into QQQ to easily beat SPY.",t3_pz4ta4,8
1633110075.0,2021-10-01,wallstreetbets,hezzqlo,averaging down on my puts,t3_pz4ta4,7
1633110186.0,2021-10-01,wallstreetbets,hezzzl1,SPY do your thang girl 😛,t3_pz4ta4,8
1633110217.0,2021-10-01,wallstreetbets,hf0024e,fuck my spy puts I guess lol,t3_pz4ta4,6
1633110912.0,2021-10-01,wallstreetbets,hf01obd,Just wanted to check in on all the bears who were flooding the feed this morning? How you all feeling now? Back to hibernation?,t3_pz4ta4,6
1633085763.0,2021-10-01,wallstreetbets,heylyv9,I blew up to. Emotionally feeling fucked up.![img](emote|t5_2th52|4266),t1_heylmtf,16
1633084755.0,2021-10-01,wallstreetbets,heykniz,All of that post made so little sense that I expect it to be fake,t1_heyk085,24
1633092721.0,2021-10-01,wallstreetbets,heyx061,then what was your plan initially ?,t1_heywrjh,8
1633084925.0,2021-10-01,wallstreetbets,heykv79,I love these overly simplistic reasonings. lmao,t1_heykotg,36
1633082883.0,2021-10-01,wallstreetbets,heyifmb,"50DMA - just the tip

100DMA - just for a minute

200DMA - just let me nut in you",t1_heyi9ma,20
1633083387.0,2021-10-01,wallstreetbets,heyj0fn,That would require him to come back from that store he’s trying to get some cigarettes from,t1_heyio8h,17
1633091323.0,2021-10-01,wallstreetbets,heyugkq,The best part is they are Canadian with no direct US market exposure and yet with every advancement of the US legalization efforts derps are betting on Tilray instead of US operators like Cresco.  If the MORE act passes then companies like Creaco will go from OTC to NYSE.,t1_heysi3c,10
1633089247.0,2021-10-01,wallstreetbets,heyr04d,Futures don't matter.,t1_heyqtut,8
1633090647.0,2021-10-01,wallstreetbets,heyta9v,".77 at kroger

but i think they might just use sewer water",t1_heyt6ad,14
1633091195.0,2021-10-01,wallstreetbets,heyu8hx,Don't try to talk sense to these people. Dip buyers were expected at the 150 day ma. Will just fall again.,t1_heyu2q0,14
1633084870.0,2021-10-01,wallstreetbets,heyksny,We will have a better idea about that at 8:30,t1_heyknn7,7
1633105436.0,2021-10-01,wallstreetbets,hezoxda,I'll hold for you and I'll loose everything for the cause,t1_hezou2l,8
1633084131.0,2021-10-01,wallstreetbets,heyjwf3,Prices are adjusted for inflation,t1_heyjlhc,25
1633091100.0,2021-10-01,wallstreetbets,heyu2gy,"Only 23,725% to go!",t1_heytu1m,15
1633093279.0,2021-10-01,wallstreetbets,heyy20m,used as lube in dire situations,t1_heyxz2q,13
1633093394.0,2021-10-01,wallstreetbets,heyy9wc,There's probably a tanker full of mayo anchored at sea waiting to get into port to offload.,t1_heyxz2q,7
1633095096.0,2021-10-01,wallstreetbets,hez1o1e,I do all the time,t1_hez1lp1,7
1633100073.0,2021-10-01,wallstreetbets,hezchzz,![img](emote|t5_2th52|4270),t1_hezcdif,13
1633084790.0,2021-10-01,wallstreetbets,heykp37,Never underestimate peak wsb brother,t1_heykniz,22
1633083682.0,2021-10-01,wallstreetbets,heyjd4r,[deleted],t1_heyj0fn,14
1633089405.0,2021-10-01,wallstreetbets,heyr96y,"Seriously. 

How can anyone play this game for more than a few months and still think futures matter.",t1_heyr04d,9
