created,date,subreddit,id,body,parent_id,score
1631831321.0,2021-09-16,wallstreetbets,hd4xhld,"https://www.reddit.com/r/wallstreetbets/comments/ppkudo/what_are_your_moves_tomorrow_september_17_2021/

New Thread homies",t3_ppab5b,1
1631793605.0,2021-09-16,wallstreetbets,hd2h1s4,"I’ll wait for a dip.   

*dip happens*.  

Is this the crash",t3_ppab5b,97
1631786495.0,2021-09-16,wallstreetbets,hd26zvn,"If you had put $1000 into a Hang Seng index fund on July 1st 2014, today your investment would be worth $1000.",t3_ppab5b,94
1631799360.0,2021-09-16,wallstreetbets,hd2s6g4,Places a small bet. 150% return. Huge bet. -50%,t3_ppab5b,60
1631791590.0,2021-09-16,wallstreetbets,hd2ds2c,There's some real dogshit tickers being pumped in here today,t3_ppab5b,38
1631801428.0,2021-09-16,wallstreetbets,hd2wu7x,"Friendship ended with SPY

PLTR is my new best friend",t3_ppab5b,43
1631788506.0,2021-09-16,wallstreetbets,hd29el0,The options gain porn today will be fucking bananas.,t3_ppab5b,36
1631789431.0,2021-09-16,wallstreetbets,hd2amuw,wsb moderation is like a group project where /u/zjz does all the work,t3_ppab5b,36
1631799715.0,2021-09-16,wallstreetbets,hd2sxix,PLTR insane run this past week,t3_ppab5b,39
1631800145.0,2021-09-16,wallstreetbets,hd2tvz9,PLTR gang breaking even!!! Congrats guys,t3_ppab5b,36
1631802142.0,2021-09-16,wallstreetbets,hd2yjib,Welp that's it boys. Account officially blown. From $30k to nothing in a little over a week. It's been fun. I'll be back next year with more money to lose.,t3_ppab5b,33
1631788157.0,2021-09-16,wallstreetbets,hd28yp6,"IRNT @60? 

Is this the matrix?",t3_ppab5b,24
1631788172.0,2021-09-16,wallstreetbets,hd28zeb,[deleted],t3_ppab5b,25
1631788711.0,2021-09-16,wallstreetbets,hd29o1p,lol how does it hit $60 then drop to $48 in 5 min,t3_ppab5b,28
1631796000.0,2021-09-16,wallstreetbets,hd2lbdf,Messing with options is really bad for my anxiety and I need to stop,t3_ppab5b,23
1631799466.0,2021-09-16,wallstreetbets,hd2secd,WTF? All of a sudden I'm even on shitty PLTR shares I bought back in February and forgot because they did not spark joy.,t3_ppab5b,26
1631800190.0,2021-09-16,wallstreetbets,hd2tzmt,PLTR $28 breached 🤩,t3_ppab5b,27
1631800285.0,2021-09-16,wallstreetbets,hd2u7e0,Been holding PLTR this whole time 409 shares,t3_ppab5b,25
1631803010.0,2021-09-16,wallstreetbets,hd30mwq,PLTR is back on the menu boys. Many retards can breathe again,t3_ppab5b,27
1631803010.0,2021-09-16,wallstreetbets,hd30mwy,After 65 years of consolidating PLTR finally breaks out,t3_ppab5b,29
1631803060.0,2021-09-16,wallstreetbets,hd30r83,PLTR bros our time in the shadows is no longer! Our patience has been rewarded 🌞,t3_ppab5b,26
1631812969.0,2021-09-16,wallstreetbets,hd3per1,Where my $SDC call holders at?,t3_ppab5b,23
1631816079.0,2021-09-16,wallstreetbets,hd3x2ph,Just bought 30k worth of **S**MALL **D**ICK  **C**LUB 🙏🙏🙏🙏,t3_ppab5b,22
1631816392.0,2021-09-16,wallstreetbets,hd3xuot,PLTR gang where u at!? Time for reunion my boys,t3_ppab5b,23
1631786804.0,2021-09-16,wallstreetbets,hd27cqw,"-97% on my portfolio last quarter.  
I just put my last 1k in SPY 450c 0dte 
Today is the day I either quit trading or start to reverse.  
Either way it’s been fun with you guys",t3_ppab5b,19
1631798392.0,2021-09-16,wallstreetbets,hd2q486,"Robinhood should integrate with Netflix, I need to be able to watch a show behind my chart",t3_ppab5b,20
1631805560.0,2021-09-16,wallstreetbets,hd36vg5,Why the fuck would anyone be a bear when stocks can only go down 100% but can go up like a gizilion %,t3_ppab5b,21
1631809244.0,2021-09-16,wallstreetbets,hd3g246,My all time chart is finally green. Its been about two years but I finally got back. :),t3_ppab5b,20
1631821344.0,2021-09-16,wallstreetbets,hd4a002,"Made $3660 trading in my car (not while driving) today while taking a lunch and running errands for work, made a couple hundred working today 🤡",t3_ppab5b,20
1631788062.0,2021-09-16,wallstreetbets,hd28uii,"congrats, IRNTards",t3_ppab5b,62
1631786478.0,2021-09-16,wallstreetbets,hd26z5h,If only markets opened at 6am and didn't close until 4am,t3_ppab5b,17
1631805962.0,2021-09-16,wallstreetbets,hd37vq4,"Am I the only one that doesn't watch the ticker, but instead comes here to guess the ticker movement based on the comments?",t3_ppab5b,19
1631822000.0,2021-09-16,wallstreetbets,hd4bn2h,So many pump and dumps in this thread this week. Holy shit,t3_ppab5b,19
1631789164.0,2021-09-16,wallstreetbets,hd2a9iu,Everyone being bearish today is making me feel a bit more confident about my SPY calls,t3_ppab5b,17
1631791564.0,2021-09-16,wallstreetbets,hd2dqpc,Fuck opad I’m gonna walk into work hard as fuck,t3_ppab5b,20
1631792550.0,2021-09-16,wallstreetbets,hd2fant,"This is gonna be the OPAD thread, and I am all for it.",t3_ppab5b,18
1631798204.0,2021-09-16,wallstreetbets,hd2ppv0,According to 🌈🐻 this is the 3rd market crash this week,t3_ppab5b,18
1631819605.0,2021-09-16,wallstreetbets,hd45pkw,Bears are so fucked it’s hilarious,t3_ppab5b,18
1631788372.0,2021-09-16,wallstreetbets,hd298c8,[deleted],t3_ppab5b,57
1631788708.0,2021-09-16,wallstreetbets,hd29nvz,"Finally getting close to achieving my dream of being a millionaire , only 999k to go 😍",t3_ppab5b,80
1631791054.0,2021-09-16,wallstreetbets,hd2cyf4,Bought OPAD 9/17 12.5c yesterday when it was at $12 and got scared and sold them before close. This thing running over 20 today goddammit,t3_ppab5b,18
1631794944.0,2021-09-16,wallstreetbets,hd2jdkf,"I always see these trash tickers get pumped in here and ignore them, then they spike 100%. I know if I try the next one I see I’ll just lose it all lol",t3_ppab5b,17
1631795224.0,2021-09-16,wallstreetbets,hd2jvoq,"About to claim 1billion inheritance from Nigerian prince, just need to pay $500 dollars first. Don't need to invest in these risky stocks from now",t3_ppab5b,16
1631796631.0,2021-09-16,wallstreetbets,hd2miww,"How to stay poor forever, chase tickers up 30 to 50% on the day and wonder why you're broke eod.",t3_ppab5b,16
1631801559.0,2021-09-16,wallstreetbets,hd2x5fu,PLTR feels like a +5 day let’s see $32,t3_ppab5b,16
1631807164.0,2021-09-16,wallstreetbets,hd3awf7,Fuck fellas interview in 15 minutes LETS FUCKING GOOOOO,t3_ppab5b,17
1631807962.0,2021-09-16,wallstreetbets,hd3cwtl,Return of the Palantards. I am glad they are having their time in the sun. Probably the best bagholder group,t3_ppab5b,17
1631808667.0,2021-09-16,wallstreetbets,hd3enfp,I definitely just put too much money into LiDR,t3_ppab5b,16
1631811895.0,2021-09-16,wallstreetbets,hd3mq6v,SDC is the next OPAD,t3_ppab5b,16
1631818148.0,2021-09-16,wallstreetbets,hd426v9,Bears have carpeted bathrooms change my mind,t3_ppab5b,17
1631818331.0,2021-09-16,wallstreetbets,hd42ndh,This is getting outta control. I have somehow ended up with OTM calls on like 5 different SPACs,t3_ppab5b,16
1631819616.0,2021-09-16,wallstreetbets,hd45qfz,"Jesus Christ bears I’m so sorry, even though you’re already dead the market is still going to keep fucking you.",t3_ppab5b,18
1631820578.0,2021-09-16,wallstreetbets,hd483p1,At this point do whatever the fuck you want SPY. You're retarded as fuck,t3_ppab5b,17
1631791844.0,2021-09-16,wallstreetbets,hd2e64b,What’s worse than coming up with a funny reply then getting hit with “this comment has been deleted”,t3_ppab5b,15
1631791856.0,2021-09-16,wallstreetbets,hd2e6r8,"Iron net is the latest example of the absurdity of this market where bad news is good.  I bet their management is laughing so hard that their stock went 5x on bad earnings news.

But I guess if you squint hard enough it sorta sounds like Palantir, so everyone buy a bazillion calls?",t3_ppab5b,16
1631795587.0,2021-09-16,wallstreetbets,hd2kjmz,"Predictions for today: SPY moves to the right   

I lose money somehow",t3_ppab5b,16
1631799792.0,2021-09-16,wallstreetbets,hd2t3gl,Iron Net bagholders incoming,t3_ppab5b,16
1631806592.0,2021-09-16,wallstreetbets,hd39gut,Is it just me or do the WSB plays just get dumber and dumber. The current set of ideas are just pumping stocks with low floats. CLOV gang has taught me one thing and that is that you apes can't actually count a float properly. I have also learned that you guys can't even count short interest either.,t3_ppab5b,16
1631817948.0,2021-09-16,wallstreetbets,hd41opi,"If this market won't move I'll just move it myself

**rolls up sleeves**

**buys fractional share of $F**

**💪**",t3_ppab5b,15
1631791504.0,2021-09-16,wallstreetbets,hd2dngf,"It's over.  My awful terrible supervisor is leaving to take a job in QA.  

So many people complained management actually took action and created a spot for this micromanaging asshat.   

Deli for dinner.  

So happy.   Like disbelief happiness.   I am so happy I am worried.",t3_ppab5b,15
1631795693.0,2021-09-16,wallstreetbets,hd2kqpi,Retail sales crushed it,t3_ppab5b,15
1631800183.0,2021-09-16,wallstreetbets,hd2tz38,holy fuck those PLTR 30c gonna be 10 baggers,t3_ppab5b,14
1631801558.0,2021-09-16,wallstreetbets,hd2x5f3,Palantards are back with bigger D,t3_ppab5b,15
1631801894.0,2021-09-16,wallstreetbets,hd2xxyr,I want to jump off a bridge fuck my life,t3_ppab5b,16
1631802097.0,2021-09-16,wallstreetbets,hd2yfi2,Anyone else like PLTR here? Market lod but this one keeps making new highs,t3_ppab5b,15
1631802750.0,2021-09-16,wallstreetbets,hd2zzz7,Palantir breakout?,t3_ppab5b,16
1631804574.0,2021-09-16,wallstreetbets,hd34gka,PLTR with almost 50 millions volume already. THis shit is getting real serious.,t3_ppab5b,14
1631804624.0,2021-09-16,wallstreetbets,hd34krc,"Holy Fuck PLTR, what are you smoking bro?",t3_ppab5b,16
1631808643.0,2021-09-16,wallstreetbets,hd3elad,LIDR ripping,t3_ppab5b,14
1631811379.0,2021-09-16,wallstreetbets,hd3lfl4,Oh my word..LIDR,t3_ppab5b,14
1631813459.0,2021-09-16,wallstreetbets,hd3qmlk,"Lol roaring kitty somehow cost his employer 4 mil. 


Hahahaha what a champ",t3_ppab5b,14
1631814564.0,2021-09-16,wallstreetbets,hd3tc9z,It’s fucked up how easy and fun it is to lose money,t3_ppab5b,15
1631815413.0,2021-09-16,wallstreetbets,hd3vg12,Finally in on something before the pump. $SDC all day!!,t3_ppab5b,14
1631819155.0,2021-09-16,wallstreetbets,hd44m7r,Where’s that guy that offered to suck all our ducks if SPY went green?,t3_ppab5b,15
1631822133.0,2021-09-16,wallstreetbets,hd4byvb,"Wow risked $500 to make $25.

Im good at trading.",t3_ppab5b,16
1631787848.0,2021-09-16,wallstreetbets,hd28l55,"On track to finally clear 170k this year, previous high was 149k 4 years ago. Feels good but I want a much better life still. 

Friends are all low wage earners so they think I’m crazy saying this really isn’t that good.
But realistically, quality of life hasn’t changed since around 70-80k range. It’s not like this produces some amazing life. Don’t have to worry about groceries, couple trips a year etc. But still that monotonous shitty middle class life I want to break free from.

Here is to only going up from here.",t3_ppab5b,51
1631788249.0,2021-09-16,wallstreetbets,hd292we,"zjz what are you doing in the comments dog, I like it, it makes me feel like when royalty walks through the peasants market",t3_ppab5b,14
1631788943.0,2021-09-16,wallstreetbets,hd29yz7,SDC people just sitting in the corner twiddling their thumbs.,t3_ppab5b,14
1631790191.0,2021-09-16,wallstreetbets,hd2bp54,[deleted],t3_ppab5b,15
1631796418.0,2021-09-16,wallstreetbets,hd2m3s6,Jobsless claims rise = the show goes on 🚀🚀,t3_ppab5b,15
1631799468.0,2021-09-16,wallstreetbets,hd2sefo,YOOOO PLTR are you good broo,t3_ppab5b,13
1631799762.0,2021-09-16,wallstreetbets,hd2t19j,PLTR is making me hornier than shit!,t3_ppab5b,14
1631802098.0,2021-09-16,wallstreetbets,hd2yfmp,Bulls googling how to return lambo,t3_ppab5b,14
1631803248.0,2021-09-16,wallstreetbets,hd317jo,Literally when most started to give up on PLTR it just rockets,t3_ppab5b,14
1631804831.0,2021-09-16,wallstreetbets,hd352t7,"In case you were wondering, I sold my PLTR leaps yesterday for a loss",t3_ppab5b,13
1631805601.0,2021-09-16,wallstreetbets,hd36z3b,Thinking I might just start lighting $100 bills on fire. Would be more fun to watch.,t3_ppab5b,13
1631812348.0,2021-09-16,wallstreetbets,hd3nuoc,SDC being pumped by bots is good for my long position and my calls. Not a bad company per se definitely appreciating the pump,t3_ppab5b,14
1631790910.0,2021-09-16,wallstreetbets,hd2cqqu,OPAD let's goooooooo,t3_ppab5b,13
1631794616.0,2021-09-16,wallstreetbets,hd2isk3,"Here's the deal with Evergrande.  They have $300B in debt.  For context, Lehmann Bros. was $600B.  Generously, Evergrande could pay back around $160B.  Lots of bag holders who are leveraged financial institutions gotta unwind their positions.  Many other real estate devs in China getting pummeled too as ppl discovering poor financial positions.  Look at some of the casino stocks...down 30+% due in part to Evergrande waking people up.  Also, theyre not limited to China...  UBS, HSBC, et al. in the mix.",t3_ppab5b,13
1631796212.0,2021-09-16,wallstreetbets,hd2lpqu,When getting coke and hookers use the 75/25 method.  Spend 75% on coke and the rest on hookers.   While this gets less hookers you'll get more and better coke which will attract free girls anyway.  It's just good business sense really.,t3_ppab5b,13
1631801221.0,2021-09-16,wallstreetbets,hd2wcrn,"I am crying 😭 my PLTR bags are finally green after 6 months.

Now thinking what to do? Hold or Sell",t3_ppab5b,13
1631801353.0,2021-09-16,wallstreetbets,hd2wnst,"Whomever is selling SPY your mom is a hoe

😡😡😡",t3_ppab5b,14
1631801377.0,2021-09-16,wallstreetbets,hd2wptc,I told my wife to leave me alone because I’m trying to concentrate on the market and then she saw I only have $165.00 in there and I’m pretty sure she is laughing at me talking to her friends while contemplating divorce. PLEASE HELP.,t3_ppab5b,14
1631802212.0,2021-09-16,wallstreetbets,hd2ypio,[deleted],t3_ppab5b,13
1631803664.0,2021-09-16,wallstreetbets,hd32840,Did someone feed PLTR another child?,t3_ppab5b,12
1631804388.0,2021-09-16,wallstreetbets,hd340dn,"I hate how they say “small business sales lost due to the pandemic”.

No, it’s sales lost due to forced government shutdowns, while Walmart and other corporations were allowed to stay open and be Covid cesspools. What a joke.",t3_ppab5b,13
1631805019.0,2021-09-16,wallstreetbets,hd35jbh,[deleted],t3_ppab5b,14
1631805238.0,2021-09-16,wallstreetbets,hd362qe,what the hell's PLTR doing today?,t3_ppab5b,13
1631809251.0,2021-09-16,wallstreetbets,hd3g2t2,!ticker check LIDR,t3_ppab5b,12
1631811917.0,2021-09-16,wallstreetbets,hd3ms68,[deleted],t3_ppab5b,14
1631814480.0,2021-09-16,wallstreetbets,hd3t4va,"Guys I've been in the stock market for over 4 hours now, why am I not retired yet",t3_ppab5b,13
1631818093.0,2021-09-16,wallstreetbets,hd421p3,"at least SpaceX went to acutal space, and not that suborbital bullshit like those Blue Virgins",t3_ppab5b,12
1631818588.0,2021-09-16,wallstreetbets,hd43aca,Small Dick Club rejoice,t3_ppab5b,13
1631820339.0,2021-09-16,wallstreetbets,hd47ihd,Pdt rule is so gay,t3_ppab5b,13
1631820733.0,2021-09-16,wallstreetbets,hd48hen,I don’t know what was more impressive today the sell off or the recovery,t3_ppab5b,12
1631799166.0,2021-09-16,wallstreetbets,hd2rrhj,PLTR CLEAR SKIES TO 30+ LFGGGGG,t3_ppab5b,12
1631801335.0,2021-09-16,wallstreetbets,hd2wmat,PLTR LORD HAVE MERCY MAKE US RICH,t3_ppab5b,13
1631801991.0,2021-09-16,wallstreetbets,hd2y6cn,"Bulls yesterday: Lambo, YATCH, Cocaine, hookers

Bulls today: surprisedpikachuface.jpeg",t3_ppab5b,13
1631803054.0,2021-09-16,wallstreetbets,hd30qqo,PLTR $30 eow lets gooo!,t3_ppab5b,11
1631803777.0,2021-09-16,wallstreetbets,hd32i4n,I'm just here cause I saw PLTR finally increase above $28. What is happening?,t3_ppab5b,12
1631804768.0,2021-09-16,wallstreetbets,hd34xch,pltr 30cs are fucking turbo blasting,t3_ppab5b,12
1631805101.0,2021-09-16,wallstreetbets,hd35qmz,PLTR I'm proud of you,t3_ppab5b,12
1631805186.0,2021-09-16,wallstreetbets,hd35y6m,I LOVE SELLING COVERED CALLS ON PLTR THE DAY BEFORE IT GOES APE SHIT. VERY COOL AND VERY LEGAL.,t3_ppab5b,12
1631805239.0,2021-09-16,wallstreetbets,hd362v7,Let’s go  PLTR  30 EOD 🚀🚀🚀,t3_ppab5b,13
1631805713.0,2021-09-16,wallstreetbets,hd37984,Buy more PLTR? ok got it,t3_ppab5b,13
1631811569.0,2021-09-16,wallstreetbets,hd3lwy3,SDC isn't even a shitty company,t3_ppab5b,11
1631811997.0,2021-09-16,wallstreetbets,hd3mz5o,SDC is ready to blow,t3_ppab5b,11
1631812055.0,2021-09-16,wallstreetbets,hd3n4d4,"Guys I bought OPAD, that was the very top 🎢",t3_ppab5b,13
1631812207.0,2021-09-16,wallstreetbets,hd3nhzy,Annnnnd the opad bag holders are born,t3_ppab5b,11
1631813972.0,2021-09-16,wallstreetbets,hd3rw0q,In for 200 SDC shares. Using profits to pay for SDC treatment,t3_ppab5b,11
1631816480.0,2021-09-16,wallstreetbets,hd3y2oi,If SDC explodes. Ill get my dog braces because that little fuck has some jacked up teeth,t3_ppab5b,12
1631816494.0,2021-09-16,wallstreetbets,hd3y3xm,PLTR bags have gotten so much lighter,t3_ppab5b,13
1631817082.0,2021-09-16,wallstreetbets,hd3zk3g,"*IRS can't see how much 1% makes*

Yet they can track every penny poors make hmm",t3_ppab5b,12
1631818660.0,2021-09-16,wallstreetbets,hd43gnr,Shorting this market gonna land me and the rest of the 27 bears left in this sub in the psych ward,t3_ppab5b,12
1631819354.0,2021-09-16,wallstreetbets,hd4539r,USA! USA! USA! USA!,t3_ppab5b,13
1631819598.0,2021-09-16,wallstreetbets,hd45oxj,*Narrator: The gay bears were indeed fukd*,t3_ppab5b,11
1631820812.0,2021-09-16,wallstreetbets,hd48ogf,Cmon spy end green I know you want to,t3_ppab5b,12
1631820944.0,2021-09-16,wallstreetbets,hd490ar,Well SDC has let me down...again...,t3_ppab5b,11
1631822301.0,2021-09-16,wallstreetbets,hd4cdrd,LILM to continue to pump at open 🙏,t3_ppab5b,12
1631788550.0,2021-09-16,wallstreetbets,hd29gld,OPEN THE CASINO,t3_ppab5b,10
1631788909.0,2021-09-16,wallstreetbets,hd29xfd,"There’s no way I’m
Gonna be paying attention at work today it’s all market today baby",t3_ppab5b,10
1631789218.0,2021-09-16,wallstreetbets,hd2ac4i,Yooo TMC up nearly 40% now fffffuuuuuarrrrk my calls gonna go brrrrrrrr,t3_ppab5b,9
1631792599.0,2021-09-16,wallstreetbets,hd2fdhm,Lmaoo the inevitable lost porn to come from those 3 tickers will be glorious! WSB making millionaires and Wendy’s employees all in the same week,t3_ppab5b,11
1631792996.0,2021-09-16,wallstreetbets,hd2g0zq,OPAD mooning 🚀,t3_ppab5b,10
1631794507.0,2021-09-16,wallstreetbets,hd2ilmn,I like to not look at my portfolio for half the day and guess where it's at based on WSB comments.,t3_ppab5b,11
1631794794.0,2021-09-16,wallstreetbets,hd2j3zd,[deleted],t3_ppab5b,11
1631795822.0,2021-09-16,wallstreetbets,hd2kz8k,"Hope everyone makes some good trades today, let’s get that bread boys",t3_ppab5b,11
1631797046.0,2021-09-16,wallstreetbets,hd2ncby,OPEN I cant stress this enough THE FUCKING CASINO,t3_ppab5b,11
1631797809.0,2021-09-16,wallstreetbets,hd2ow3u,"When Reddit goes public, I’ll be holding those shares for life. I love this platform.",t3_ppab5b,10
1631801343.0,2021-09-16,wallstreetbets,hd2wmzl,Spy is doing a fucky wucky,t3_ppab5b,11
1631805098.0,2021-09-16,wallstreetbets,hd35qd7,OPAD holy fuuuck,t3_ppab5b,11
1631805348.0,2021-09-16,wallstreetbets,hd36cjj,$OPAD to $20 let’s goooooo,t3_ppab5b,11
1631805596.0,2021-09-16,wallstreetbets,hd36ypv,ANOTHER $2K PROFIT off spy puts in 9 minutes loooool,t3_ppab5b,11
1631805992.0,2021-09-16,wallstreetbets,hd37ye1,#My spy 10/15 and 1tde puts printed in magnificent hd and color,t3_ppab5b,11
1631807288.0,2021-09-16,wallstreetbets,hd3b7p4,Opad paying my rent the next 2 months,t3_ppab5b,9
1631807498.0,2021-09-16,wallstreetbets,hd3bqtf,my weight will be an advantage when i hang myself,t3_ppab5b,10
1631812184.0,2021-09-16,wallstreetbets,hd3nfwc,Can someone explain why I’m not allowed to day trade with small amounts of money? Why is 25k the magic number,t3_ppab5b,11
1631812404.0,2021-09-16,wallstreetbets,hd3nzoz,"Just a friendly word of advice for any new traders on here experiencing a SPY ex-div date for the first time, I would advise against buying puts on SPY expiring tomorrow. The put contracts are getting the dividend price added into the contract prices.

You're paying an extra $1.27 for those puts. (Look at the theta values, > 1.4! for at the money puts)

It's your money but be sure you understand what you're buying.

Also, if you have short call contracts at or near the money, early assignment is a very good possibility.",t3_ppab5b,11
1631813813.0,2021-09-16,wallstreetbets,hd3ri0g,Time to rip sdc,t3_ppab5b,11
1631814939.0,2021-09-16,wallstreetbets,hd3ua2g,Spy green by close I'm sucking everyone off in here,t3_ppab5b,11
1631814984.0,2021-09-16,wallstreetbets,hd3udz1,Fuck! How we on the *next* squeeze already. Y’all are too much.,t3_ppab5b,12
1631815229.0,2021-09-16,wallstreetbets,hd3uzwu,"CLBT 

CERTIFIED LOVER BOY TENDIES",t3_ppab5b,11
1631816970.0,2021-09-16,wallstreetbets,hd3zabn,If CLBT keeps this goin AH there’s gonna be a lot of new astronauts landing on the moon,t3_ppab5b,11
1631817114.0,2021-09-16,wallstreetbets,hd3zmus,Yes keep shilling my SDC I will dump bags on you,t3_ppab5b,11
1631817293.0,2021-09-16,wallstreetbets,hd402jv,"lol since dude posted ""death cross on the 1 hour"" we're up 4 points. take your fancy 128 color crayon pack and shove it up your technical ass.",t3_ppab5b,11
1631817420.0,2021-09-16,wallstreetbets,hd40dzx,"So it was a bear trap all along?

👩‍🚀 🔫 👨‍🚀 

always has been",t3_ppab5b,11
1631818198.0,2021-09-16,wallstreetbets,hd42bfr,90% chance we bounce back to ATH and 10% chance 🌈🐻s get their wet dream,t3_ppab5b,12
1631818500.0,2021-09-16,wallstreetbets,hd432la,#SDC IS A $10 STONK,t3_ppab5b,11
1631818637.0,2021-09-16,wallstreetbets,hd43emh,another example of: FUCK YOUR PUTS,t3_ppab5b,11
1631819402.0,2021-09-16,wallstreetbets,hd457il,"What a recovery for SPY

#Recession canceled",t3_ppab5b,11
1631819591.0,2021-09-16,wallstreetbets,hd45ocq,BEARS TRAPPED LMAO,t3_ppab5b,11
1631819809.0,2021-09-16,wallstreetbets,hd467fc,Anyone think PLTR might rip into close and try to touch $29?,t3_ppab5b,11
1631820732.0,2021-09-16,wallstreetbets,hd48hd3,"Cash gang, I’m out.",t3_ppab5b,11
1631820958.0,2021-09-16,wallstreetbets,hd491kf,"SDC pumpers, PUMP HARDER.",t3_ppab5b,11
1631788104.0,2021-09-16,wallstreetbets,hd28wep,Holy tits 55,t3_ppab5b,10
1631788224.0,2021-09-16,wallstreetbets,hd291rn,This is bonkers,t3_ppab5b,10
1631791231.0,2021-09-16,wallstreetbets,hd2d8bm,What the fuck is opad,t3_ppab5b,10
1631793617.0,2021-09-16,wallstreetbets,hd2h2k6,[deleted],t3_ppab5b,10
1631795007.0,2021-09-16,wallstreetbets,hd2jhmk,"Honestly, when you retards are right ya'll are fucking RIGHT. Too bad it only happens once or twice a month...",t3_ppab5b,9
1631795506.0,2021-09-16,wallstreetbets,hd2kedt,Pooping and unemployment numbers. Name a more iconic duo.,t3_ppab5b,10
1631796547.0,2021-09-16,wallstreetbets,hd2mcwo,Retail sales and unemployment up? Meme stocks ripping? Fake internet money on the rise? Boys we time traveled back to January let’s break the fucking market again,t3_ppab5b,10
1631796792.0,2021-09-16,wallstreetbets,hd2mubf,Holy shit OPAD is about to make me rich,t3_ppab5b,9
1631797456.0,2021-09-16,wallstreetbets,hd2o5we,"If you can’t eat a banana in less than 5 seconds, then you’re not ready",t3_ppab5b,11
1631797730.0,2021-09-16,wallstreetbets,hd2oq97,8:29 : These puts feel pretty good. 8:30 : Guh.,t3_ppab5b,11
1631798508.0,2021-09-16,wallstreetbets,hd2qdas,"feeling cute, might buy the dip",t3_ppab5b,10
1631800227.0,2021-09-16,wallstreetbets,hd2u2nq,"Get a call from my broker, I have told me something about margin call. After that, I have just removed app.",t3_ppab5b,10
1631802272.0,2021-09-16,wallstreetbets,hd2yuoy,PLTR has retard strength,t3_ppab5b,10
1631802700.0,2021-09-16,wallstreetbets,hd2zvsg,I can’t believe SPY is going to be delisted. SAD!,t3_ppab5b,10
1631802751.0,2021-09-16,wallstreetbets,hd30054,Bought some PLTR 33 calls for .02 hits $30 they be at .12 at least,t3_ppab5b,10
1631802992.0,2021-09-16,wallstreetbets,hd30lbe,PLTR finallyyyyy,t3_ppab5b,9
1631803114.0,2021-09-16,wallstreetbets,hd30vyg,600% IV on OPAD FDS lmao,t3_ppab5b,10
1631803788.0,2021-09-16,wallstreetbets,hd32j58,Sold PLTR at $25 after holding for 6 months 🤡,t3_ppab5b,11
1631803959.0,2021-09-16,wallstreetbets,hd32ycr,Holding PLTR since $20 has been a fun journey. Exciting to finally see it go. But now I have no idea when to average up on more shares,t3_ppab5b,10
1631804962.0,2021-09-16,wallstreetbets,hd35eaa,PLTR... YOU SON OF A BITCH!,t3_ppab5b,10
1631804984.0,2021-09-16,wallstreetbets,hd35g5x,Damn PLTR you go girl,t3_ppab5b,10
1631805012.0,2021-09-16,wallstreetbets,hd35ion,"OPAD IS FLYING.

MY PENIS HAS EXCEEDED THE HARDNESS OF DIAMOND.",t3_ppab5b,9
1631805106.0,2021-09-16,wallstreetbets,hd35r49,So this is what it feels like to be green on PLTR,t3_ppab5b,10
1631805541.0,2021-09-16,wallstreetbets,hd36tq8,Congrats to degenerates who bought puts,t3_ppab5b,9
1631805661.0,2021-09-16,wallstreetbets,hd374ms,Need a 2500% play today. Someone gimme,t3_ppab5b,10
1631806078.0,2021-09-16,wallstreetbets,hd38669,Never doubt PLTR. All hail Karp! 🚀🚀,t3_ppab5b,10
1631806835.0,2021-09-16,wallstreetbets,hd3a2mb,Got so bored I daytraded on my ROTH IRA at work. Made a fat $6 by risking $2k. Stonks,t3_ppab5b,9
1631807245.0,2021-09-16,wallstreetbets,hd3b3rf,bulls blew their load too quick...now they have no more ammo for opex and FOMC. Bears are going for the kill now,t3_ppab5b,11
1631807485.0,2021-09-16,wallstreetbets,hd3bpnk,PLTR gamma going off the chart it’s about to turn into  incredible hulk to take out $29,t3_ppab5b,9
1631810023.0,2021-09-16,wallstreetbets,hd3hzvb,"So so far this September, bulls lose bears lose and Theta gang wins flawless victory",t3_ppab5b,10
1631810431.0,2021-09-16,wallstreetbets,hd3j0v2,I got puts on OPAD fuck me,t3_ppab5b,9
