created,date,subreddit,id,body,parent_id,score
1633299240.0,2021-10-01,wallstreetbets,hfa40ad,The next Daily Discussion thread is [here](https://redd.it/q0phh1),t3_pz4ta4,1
1633085514.0,2021-10-01,wallstreetbets,heylmtf,More or less blew up my account over the last week and a half. Went from over 60% up on the year to 77% down. Part of me says cash out and lick my wounds. But I can’t cause I’m a degenerate.,t3_pz4ta4,66
1633100932.0,2021-10-01,wallstreetbets,hezeh9a,"Fuck reddit, time to move to a real platform like yahoo",t3_pz4ta4,41
1633099143.0,2021-10-01,wallstreetbets,hezados,# The game is back on hard mode bois,t3_pz4ta4,33
1633087516.0,2021-10-01,wallstreetbets,heyocx9,"Just got off the phone with phone with Visa after an hour of explaining to them why they need to raise my debt ceiling for the good of the economy. Long story short I got another cash advance, puts on Visa.",t3_pz4ta4,92
1633093733.0,2021-10-01,wallstreetbets,heyyxnj,"CNBC - 85% of active managers underperform the index

CNBC - Coming up we'll speak with one money-manager that will tell you where you should put your money now

https://twitter.com/StockCats/status/1370385484040564738",t3_pz4ta4,33
1633098200.0,2021-10-01,wallstreetbets,hez8b1b,"Gentlemen


It has been an honor 🎻🎶🎶

🌊⛴️🌊",t3_pz4ta4,29
1633107802.0,2021-10-01,wallstreetbets,hezui3b,blew up....... 75k to 9k.,t3_pz4ta4,33
1633084220.0,2021-10-01,wallstreetbets,heyk085,That guy that sold his spce Jan 2022 calls yesterday at a 91% loss right before it took off. That shit was so sad and funny at the same time. Hope he’s alright. That was brutal,t3_pz4ta4,82
1633092594.0,2021-10-01,wallstreetbets,heywrjh,If we gap up my puts are fucked. If we gap down my calls are fucked. If we stay flat my ass is fucked.,t3_pz4ta4,26
1633095754.0,2021-10-01,wallstreetbets,hez30gl,"They say you can't time the market, but they're wrong. I can time the market perfectly to lose on every trade every time.",t3_pz4ta4,28
1633099561.0,2021-10-01,wallstreetbets,hezbbfz,AAPL is gonna have to release atleast 5 new colour iPhones to make up for this,t3_pz4ta4,24
1633102900.0,2021-10-01,wallstreetbets,hezj062,"iF iT tOuChEs 428, bUy PuTs

Never listen to WSB. Ever.",t3_pz4ta4,25
1633105150.0,2021-10-01,wallstreetbets,hezo9ao,Perhaps it’s not a bull trap or bear trap but it’s always just a degenerate trap,t3_pz4ta4,26
1633084315.0,2021-10-01,wallstreetbets,heyk489,![img](emote|t5_2th52|4553),t3_pz4ta4,25
1633105266.0,2021-10-01,wallstreetbets,hezoj5b,Gonna hire Dog the Bounty Hunter to find and stop the bears,t3_pz4ta4,23
1633107904.0,2021-10-01,wallstreetbets,hezuqr6,"Dont feel like you need to trade EVERY DAY.  
Just sit back and observe sometimes.  
If no play JUMPS OUT at you like a full conviction play then dont do it.  
Be patient.  
The other day Dollar Tree spiked 16% on a decent news report (share buyback) coupled with a bad news report (no more dollar prices), IV was very low so the calls went up 700% and PUTS went down 80%....I bought those PUTS and the next day they were a 120% profit...  
Ima just sit and wait for these full conviction plays.",t3_pz4ta4,24
1633117266.0,2021-10-01,wallstreetbets,hf0g7ip,i wish i never discovered this place,t3_pz4ta4,23
1633097841.0,2021-10-01,wallstreetbets,hez7hvn,it's September 31st bitches,t3_pz4ta4,22
1633104614.0,2021-10-01,wallstreetbets,hezn0h6,"Guys - we are obviously going to rip after the worst month since March 2020

I’m gonna be JPOW for Halloween",t3_pz4ta4,21
1633112631.0,2021-10-01,wallstreetbets,hf05mkz,[deleted],t3_pz4ta4,21
1633085424.0,2021-10-01,wallstreetbets,heylifp,Fake internet money is mooning while we are getting raped 😐🤡.,t3_pz4ta4,18
1633089013.0,2021-10-01,wallstreetbets,heyqmnk,Recession cancelled easy mode back on?,t3_pz4ta4,17
1633113411.0,2021-10-01,wallstreetbets,hf07fey,"Sold my puts at the top…… Sold my calls at the bottom…..

Iam depression ![img](emote|t5_2th52|4266)",t3_pz4ta4,18
1633084783.0,2021-10-01,wallstreetbets,heykotg,"This place is dead. Comment volume so low means a lot of accounts got wiped out. The bottom is almost in, the cycle repeats.",t3_pz4ta4,82
1633082739.0,2021-10-01,wallstreetbets,heyi9ma,"Bers be like ""just the tip""

 fuckers lied",t3_pz4ta4,17
1633089402.0,2021-10-01,wallstreetbets,heyr90f,Hoping this infamous 1st of the month rally can power thru 433,t3_pz4ta4,16
1633090586.0,2021-10-01,wallstreetbets,heyt6l7,"This has been the same story for 3 days. Another bull trap?


It's like groundhogs day...",t3_pz4ta4,18
1633093242.0,2021-10-01,wallstreetbets,heyxzfk,"0 dte 450C only $1, imagine Pelosi passing the bill today and we jump 5%",t3_pz4ta4,18
1633099346.0,2021-10-01,wallstreetbets,hezau0r,#GG BERS. WELL PLAYED.,t3_pz4ta4,18
1633103298.0,2021-10-01,wallstreetbets,hezjxid,"Was $20,000 down an hour ago, now $20 down",t3_pz4ta4,17
1633114293.0,2021-10-01,wallstreetbets,hf09fs4,"SPY is 1.15% and it's dead in here.

You guys bought way too many fucking puts man.  Or shitty growth tickers.",t3_pz4ta4,17
1633083093.0,2021-10-01,wallstreetbets,heyio8h,Dad the stock market is bullying me pls come beat them up,t3_pz4ta4,51
1633090174.0,2021-10-01,wallstreetbets,heysi3c,I’ll never understand you idiots who see millions of good deals in the market and decide to go long on fucking Tilray 😭,t3_pz4ta4,48
1633093171.0,2021-10-01,wallstreetbets,heyxukr,"If WSB is scared to BTFD, this is the bottom.",t3_pz4ta4,16
1633098061.0,2021-10-01,wallstreetbets,hez7zp1,I'm going to jump out a fucking window.  Jesus christ,t3_pz4ta4,17
1633112931.0,2021-10-01,wallstreetbets,hf06bg4,Longest bull trap I’ve ever seen I’ll tell ya hwat,t3_pz4ta4,15
1633114145.0,2021-10-01,wallstreetbets,hf093fa,The top searched term on bing is “google”,t3_pz4ta4,16
1633089137.0,2021-10-01,wallstreetbets,heyqtut,This is the type of shit that makes me suicidal. I woke up counting my money that my puts were going to make only to have futures absolutely fucking moon for no reason now I'm set to lose money.,t3_pz4ta4,13
1633089458.0,2021-10-01,wallstreetbets,heyrc6l,"Buy calls, stock go down, buy puts stock go up, fml",t3_pz4ta4,15
1633098983.0,2021-10-01,wallstreetbets,hez9ziw,"when i go to a gas station and i’m standing behind someone standing at the counter for 10 minutes buying lottery tickets, i look at them with shame and disgust. 

its ironic because I sit behind a screen 7 hours a day just to lose my money on the stock market , at least i do it the classy way",t3_pz4ta4,14
1633099306.0,2021-10-01,wallstreetbets,hezaqsh,I never gonna finically recover from this,t3_pz4ta4,15
1633101899.0,2021-10-01,wallstreetbets,hezgot9,"Ah, the paper jam was cleared.",t3_pz4ta4,14
1633105735.0,2021-10-01,wallstreetbets,hezpmcp,I overslept and my spy 428p got toasted fuck.,t3_pz4ta4,14
1633111644.0,2021-10-01,wallstreetbets,hf03czc,Wow.  Absolutely blew it today in every possible way.,t3_pz4ta4,14
1633090429.0,2021-10-01,wallstreetbets,heysx82,premarket is the fakest and gayest shit i’ve ever seen,t3_pz4ta4,43
1633084213.0,2021-10-01,wallstreetbets,heyjzw1,"Reminder that China always has energy problems and those that say it will collapse due to this (i fucking wish, tbh ) are just feeding you bad data.",t3_pz4ta4,12
1633086593.0,2021-10-01,wallstreetbets,heyn2jn,Reversal today hopefully since fake internet money just reversed.,t3_pz4ta4,14
1633087868.0,2021-10-01,wallstreetbets,heyovls,Someone wake that dude from GreenDay up please.,t3_pz4ta4,12
1633089348.0,2021-10-01,wallstreetbets,heyr5y2,My break even is when Spy hits $454 we on our way,t3_pz4ta4,13
1633091539.0,2021-10-01,wallstreetbets,heyuu7r,[removed],t3_pz4ta4,14
1633095230.0,2021-10-01,wallstreetbets,hez1xq4,"> Stocks rebound on Merck's promising oral Covid pill

Sign me up for the CNBC headline job",t3_pz4ta4,13
1633101406.0,2021-10-01,wallstreetbets,hezfjzs,The 0tde calls I bought for 0.90 and sold for 0.55 are worth 1.45 now 🤡,t3_pz4ta4,12
1633105793.0,2021-10-01,wallstreetbets,hezprfk,If you put $1000 in VIAC in April you would have $1000 today 🤡,t3_pz4ta4,13
1633111041.0,2021-10-01,wallstreetbets,hf01z0k,"It's really not hard to make money trading stocks, all you have to do is",t3_pz4ta4,12
1633090581.0,2021-10-01,wallstreetbets,heyt6ad,"As long as Arizona Ice Tea is still $.99, inflation doesn’t exist",t3_pz4ta4,12
1633093415.0,2021-10-01,wallstreetbets,heyybe5,"S&P mooning hard, gap up to OLYMPUS",t3_pz4ta4,12
1633094278.0,2021-10-01,wallstreetbets,hez004t,0 good news and futures are green. This is gonna dump right away,t3_pz4ta4,12
1633094449.0,2021-10-01,wallstreetbets,hez0chb,Holy shit futures are now green? Wtf. 😂,t3_pz4ta4,12
1633099356.0,2021-10-01,wallstreetbets,hezauti,# I can only buy so many dips my good Sir. 😫,t3_pz4ta4,12
1633099425.0,2021-10-01,wallstreetbets,hezb0el,I would like to remind everyone that AAPL is a fucking little bitch. That is all,t3_pz4ta4,12
1633103079.0,2021-10-01,wallstreetbets,hezjf3b,"I’m not early, I’m just wrong",t3_pz4ta4,11
1633103321.0,2021-10-01,wallstreetbets,hezjzhv,Amazon's 1Y gain: 1.97% 🤡,t3_pz4ta4,12
1633103998.0,2021-10-01,wallstreetbets,hezlktw,"Spy forming a cock and ball pattern. This shows that no matter what play you make, you’re wrong and you’re losing money",t3_pz4ta4,12
1633105788.0,2021-10-01,wallstreetbets,hezpr0y,The markets hilarious. Perfect storm of negativity for a month straight then overnight we realized there’s no 9 in the date anymore so recessions canceled,t3_pz4ta4,12
1633106221.0,2021-10-01,wallstreetbets,hezqs4u,"When SPY hits 420 again, JPOW should call for an emergency 4.20 to 1 stock split to bring SPY back to 100. Then we can buy it back up to 420",t3_pz4ta4,12
1633107574.0,2021-10-01,wallstreetbets,heztzdh,"There is no supply chain issue. Evergrande doesn't exist. The debt ceiling is not a real thing. 

You are in a simulation and some jackass in the universe above us is sitting at his computer, eating doritos and mountain dew, controlling you in a Sims-esque game while laughing at you staring at charts and losing money.",t3_pz4ta4,12
1633107949.0,2021-10-01,wallstreetbets,hezuukh,"My current impression of the skillset of VP level and above in corporations (entirely colored by two experiences)

Have many ways to say ""Come on guys we need to do better let's aim for world class!""

Narrowly focus on whether a metric is green or red without bothering to understand the data

Job hop when it starts to become apparent you aren't actually driving change.",t3_pz4ta4,12
1633111013.0,2021-10-01,wallstreetbets,hf01wmv,Whoever was smart enough to pick up 0DTE SPY calls at the dip today is RICH. I'm retarded so I am not rich.,t3_pz4ta4,13
1633112885.0,2021-10-01,wallstreetbets,hf067jl,Market just said “fuck your puts”,t3_pz4ta4,12
1633113197.0,2021-10-01,wallstreetbets,hf06xm4,Just bought my first SPY puts since April 2020. You’re welcome for this massive bull run we’re about to witness,t3_pz4ta4,12
1633115400.0,2021-10-01,wallstreetbets,hf0bz6l,The one time I buy spy puts 😭 I quit,t3_pz4ta4,12
1633116893.0,2021-10-01,wallstreetbets,hf0fdhq,"I’ve been sober five days now, and one thing I noticed is I actually trade better when I’m high. I make less emotional decisions",t3_pz4ta4,12
1633090195.0,2021-10-01,wallstreetbets,heysjbv,Bull’s gonna eat today,t3_pz4ta4,11
1633092062.0,2021-10-01,wallstreetbets,heyvsgv,Wow. Losing lots of ground.,t3_pz4ta4,12
1633092981.0,2021-10-01,wallstreetbets,heyxhmc,At this point I would be buying calls even if we were to get hit by an  unavoidable meteor,t3_pz4ta4,11
1633094456.0,2021-10-01,wallstreetbets,hez0czm,I’m ready for a huge green cocktober,t3_pz4ta4,10
1633099284.0,2021-10-01,wallstreetbets,hezap14,"there’s money to be made with puts , but i’m too much of a pussy to pull the trigger because i feel like at any moment we can rebound since we’re down so much already",t3_pz4ta4,11
1633099757.0,2021-10-01,wallstreetbets,hezbrcv,Bitches out here playing hot potato with stocks. Ain't nobody wanna hold shit anymore,t3_pz4ta4,11
1633099864.0,2021-10-01,wallstreetbets,hezc0dn,"Select your difficulty:

[     ] Recruit

[     ] Regular

[     ] Hardened 

[❌] Veteran",t3_pz4ta4,10
1633099979.0,2021-10-01,wallstreetbets,hezca40,I’m down 74% this week,t3_pz4ta4,11
1633103107.0,2021-10-01,wallstreetbets,hezjhhh,Bears lining up behind wendys,t3_pz4ta4,11
1633103570.0,2021-10-01,wallstreetbets,hezkkp0,The recession is ~~on~~ ~~off~~ ~~on~~ ~~off~~ ~~on~~ off,t3_pz4ta4,10
1633105130.0,2021-10-01,wallstreetbets,hezo7lc,I am out of this 🤡market,t3_pz4ta4,12
1633108507.0,2021-10-01,wallstreetbets,hezw55p,Im not so sure about a dump today......  Bears might be fucked,t3_pz4ta4,12
1633109740.0,2021-10-01,wallstreetbets,hezyz3m,These SPY puts are now well beyond my personal risk tolerance and I feel like a deer in headlights,t3_pz4ta4,11
1633110448.0,2021-10-01,wallstreetbets,hf00la8,Honestly how am I such a fucking loser,t3_pz4ta4,12
1633110704.0,2021-10-01,wallstreetbets,hf0170e,Every please give a very generous welcome back to.... THE BULL,t3_pz4ta4,11
1633110943.0,2021-10-01,wallstreetbets,hf01qvg,Yup i lost big money on puts. Shit is rigged,t3_pz4ta4,11
1633112579.0,2021-10-01,wallstreetbets,hf05i7h,How am I wrong every time,t3_pz4ta4,10
1633112676.0,2021-10-01,wallstreetbets,hf05qcr,Anyone else need this performance today to repeat 2-3 more times to break even? 👀,t3_pz4ta4,11
1633112838.0,2021-10-01,wallstreetbets,hf063s8,"Fuck.  What a day.  Started up, then down 30k, now up 15k, and 90 minutes to close.",t3_pz4ta4,11
1633113319.0,2021-10-01,wallstreetbets,hf077n0,"All the problems that caused the market to drop the past week have been solved since a few hours ago so, SPY 500?",t3_pz4ta4,11
1633083564.0,2021-10-01,wallstreetbets,heyj81p,"Me: Buys any stock.

Stock: Hello darkness my old friend.

Me: Sells any stock.

Stock: I LIVE AGAIN!!!",t3_pz4ta4,47
1633084005.0,2021-10-01,wallstreetbets,heyjqxe,Should I rescue bulls by buying some poots?,t3_pz4ta4,10
1633086242.0,2021-10-01,wallstreetbets,heymlji,Congress and the fed are just completely fuckin useless. Actively showing their ass with each and every passing day this week.,t3_pz4ta4,10
1633086391.0,2021-10-01,wallstreetbets,heymste,"Buying spy calls at open. Then puts, then calls , then beer, weed, and porn.",t3_pz4ta4,9
1633087961.0,2021-10-01,wallstreetbets,heyp0mh,Bears dancing last night now shuffling towards the exits,t3_pz4ta4,11
1633088544.0,2021-10-01,wallstreetbets,heypwfw,Yep seeing Halloween decorations out this morning. Bullish.,t3_pz4ta4,9
1633092832.0,2021-10-01,wallstreetbets,heyx7ps,WSB bearish make me excra bullish,t3_pz4ta4,10
1633093318.0,2021-10-01,wallstreetbets,heyy4ql,Oh boy can’t wait to join Cramer’s investing club!!! 🤡,t3_pz4ta4,9
1633093426.0,2021-10-01,wallstreetbets,heyyc6e,Getting real tired of your shit SPY,t3_pz4ta4,10
1633093514.0,2021-10-01,wallstreetbets,heyyidt,stop being an idiot and put the alligator in the trash can,t3_pz4ta4,11
1633094867.0,2021-10-01,wallstreetbets,hez171p,# Open this bish up im ready to risk it all,t3_pz4ta4,10
1633095933.0,2021-10-01,wallstreetbets,hez3drz,"Could have pulled out of a trade on IRNT with 70% profit but my greedy ass wanted 100% gains and instead ended up with 100% losses

What a difference a day makes",t3_pz4ta4,10
1633096035.0,2021-10-01,wallstreetbets,hez3ld0,"I like how CNBC acted like markers rebounded

October off to a great start!

Bruh it's been 15 mins, maybe wait a bit before making that call dumbfucks",t3_pz4ta4,10
1633096636.0,2021-10-01,wallstreetbets,hez4vjy,We all spark up at SPY 420,t3_pz4ta4,11
1633097086.0,2021-10-01,wallstreetbets,hez5ulz,Ok who bought the fake pump. Show yourselves,t3_pz4ta4,11
1633097494.0,2021-10-01,wallstreetbets,hez6qm3,"*""Die SPY, Die""; that's German for ""The SPY, The""* \- Sideshow Bob",t3_pz4ta4,10
1633098080.0,2021-10-01,wallstreetbets,hez816w,![img](emote|t5_2th52|4887),t3_pz4ta4,11
1633098988.0,2021-10-01,wallstreetbets,heza098,Wait $CLOV is gonna be banned on WSB soon because under 1.5B valuation and then ZERO people will be talking about it cause mods will ban posts and no more pump n dumps will happen sending it to like $3 LMAOOOOOO,t3_pz4ta4,10
1633099349.0,2021-10-01,wallstreetbets,hezau95,"You make most of your money in a bear market; you just don't realize it at the time.

If you can't make sense of this, you can't be helped.",t3_pz4ta4,10
1633099468.0,2021-10-01,wallstreetbets,hezb3sx,"Uh, looks like I am an apple bag holder",t3_pz4ta4,10
1633099683.0,2021-10-01,wallstreetbets,hezblbu,"as buffett said, being a bull in a bull market is great but nothing beats being a bear in a bear market 😈",t3_pz4ta4,10
1633099823.0,2021-10-01,wallstreetbets,hezbwx1,Prayers for those who bought calls instead of puts at open,t3_pz4ta4,9
1633100264.0,2021-10-01,wallstreetbets,hezcxw7,meme stocks are the new stable boomer stocks,t3_pz4ta4,10
1633100901.0,2021-10-01,wallstreetbets,hezeeq7,no time is too early to start drinking if you're out of a job and leeching off your parents,t3_pz4ta4,10
1633101000.0,2021-10-01,wallstreetbets,hezemqn,"Love being cash gang 😎 

JK blew up my account",t3_pz4ta4,10
1633101860.0,2021-10-01,wallstreetbets,hezglkh,"Like a retarded phoenix from the ashes, my portfolio begins to rise",t3_pz4ta4,10
1633102888.0,2021-10-01,wallstreetbets,heziz52,Closing my app for the day. Fuck this shit,t3_pz4ta4,9
1633103030.0,2021-10-01,wallstreetbets,hezjb05,"I always imagine all the biggest investors gossiping like a bunch of girls on volatile days in a group text.

Buffett: *""guys I'm about to sell most of this shit and just buy back in a month or so lol""* 

 Bloomberg: *""i fucking dare you you dumb bitch""*

Buffett: *(screenshots his account sell)*

Soros: *""lmaooo omfg dude. Look what you triggered""*🤣

Gates: *""Please take me off this chat""*",t3_pz4ta4,9
1633103477.0,2021-10-01,wallstreetbets,hezkcrh,"OH NO BIG CORP MAKING MONEY OFF KIDS! Honestly, Facebook should be listed under the state departments terrorist organizations.",t3_pz4ta4,11
1633103968.0,2021-10-01,wallstreetbets,hezliat,Eat a 2k loss today or a 20k loss Monday 😞,t3_pz4ta4,10
1633104398.0,2021-10-01,wallstreetbets,hezmiik,Options were invented to suck retail degenerates dry,t3_pz4ta4,11
1633104911.0,2021-10-01,wallstreetbets,heznpdp,"DEMS BLOCKED THE BILL, SHIT. That pump makes sense now.",t3_pz4ta4,11
1633105508.0,2021-10-01,wallstreetbets,hezp3et,*Sir your 12:30 depressive episode is here*,t3_pz4ta4,10
1633105788.0,2021-10-01,wallstreetbets,hezpqzz,"I sold my biggest losers and instead added to my core positions I believe in to have more concentration there. Was tired of holding 20 different bags, so now I just hold 5 big bags. Makes the portfolio look cleaner.",t3_pz4ta4,10
1633106090.0,2021-10-01,wallstreetbets,hezqgpm,Idk why you guys trust these wsb ppl on any kind of stock advice,t3_pz4ta4,10
1633106137.0,2021-10-01,wallstreetbets,hezqktz,Oh fuck me. Yesterday i was bitching about MRNA options being too pricey. Turns out they were cheap af,t3_pz4ta4,10
1633106178.0,2021-10-01,wallstreetbets,hezqoet,I’m going to induce color blindness so I never see red,t3_pz4ta4,10
1633106460.0,2021-10-01,wallstreetbets,hezrcbh,"Eviction off the table boys. I have a place till after winter and a job interview at domino's tonite.

Let's check the market since the day is going..... holy shit what the fuck happened to Spy.",t3_pz4ta4,10
1633107711.0,2021-10-01,wallstreetbets,hezuat4,"Spy just getting as many people to buy as possible at these prices, just before it legs down trapping call holders in for an anxiety filled weekend.",t3_pz4ta4,10
1633107771.0,2021-10-01,wallstreetbets,hezufqk,Easiest way to make money is to buy puts after a p&d shows up on wsb.,t3_pz4ta4,10
1633107795.0,2021-10-01,wallstreetbets,hezuhir,"Youve never lived until youve had 100 of the same contracts lol, jesus",t3_pz4ta4,9
1633107830.0,2021-10-01,wallstreetbets,hezukg8,"After SPY -10% correction.

JPOW: We can now start the taper.",t3_pz4ta4,10
1633110900.0,2021-10-01,wallstreetbets,hf01na8,5k -> 500 -> 7.2k today,t3_pz4ta4,9
1633111038.0,2021-10-01,wallstreetbets,hf01yry,"You think Bears R Fuk?

Or you think Bulls R Fuk?

The answer is neither.  The correct answer is:

U R Fuk.  We R Fuk.",t3_pz4ta4,10
1633112084.0,2021-10-01,wallstreetbets,hf04cx6,"‘Stagflation is here,’ following months of rising prices, BofA analysts say.

BofA Deez Nutz.",t3_pz4ta4,9
1633112526.0,2021-10-01,wallstreetbets,hf05dow,Alexa how do I turn hindsight into foresight,t3_pz4ta4,10
1633112917.0,2021-10-01,wallstreetbets,hf06a8t,[deleted],t3_pz4ta4,9
1633113189.0,2021-10-01,wallstreetbets,hf06x03,Spy sure knows how to break a person,t3_pz4ta4,10
1633113612.0,2021-10-01,wallstreetbets,hf07vtc,Apparently the Ozone is still getting thinner over populated areas and it’s been happening since right before I was born so maybe I’m *not* crazy for feeling like the sun is more intense now. I used to be able to hang out outside all day as a kid without it feeling like I was cooking,t3_pz4ta4,10
1633113802.0,2021-10-01,wallstreetbets,hf08b1a,"TAKE PROFITS, UR WELCOME",t3_pz4ta4,10
1633114472.0,2021-10-01,wallstreetbets,hf09ulz,"FUCK YOU SEPTEMBER IT'S A NEW MONTH, I AM REBORN!!!!",t3_pz4ta4,11
1633116454.0,2021-10-01,wallstreetbets,hf0ee2v,"Fucking fuck yes. 


2x 100% SPY calls. Once on 434 and again on 435. That means I’ve won every day this week except Thursday. Net up is around I don’t know 50-60k for the week. All spy. All calls except Monday or Tuesday put. 200k capital roughly. Just buying whichever direction. Always expire daily except mon or tues was for the next day. 


This continues my chronicle of using small amounts of initial capital and mostly going all in on spy daily calls. Up to about 200k now from about 9k. 


Goal is just to keep going all in but I have quickly pulled back as the all in went over 100k . That’s bad because my original plan was to just snowball it over 20 trades or whatever at 20% avg to $3-4m. Already have about $1m and so would then just retire.",t3_pz4ta4,10
1633117480.0,2021-10-01,wallstreetbets,hf0go75,Working hard all month only to lose it all in one day. Life of an option trader 🤥,t3_pz4ta4,11
1633091104.0,2021-10-01,wallstreetbets,heyu2q0,"SPY is up 0.5% premarket.

For reference yesterday it opened up +0.3%, topped at +0.53%, and ended -1.22%.",t3_pz4ta4,29
1633099176.0,2021-10-01,wallstreetbets,hezagdx,Forget student loan forgiveness.  The people need trade forgiveness.,t3_pz4ta4,31
1633083332.0,2021-10-01,wallstreetbets,heyiy5c,"It can make a man go insane...through September I lost at least 8k on SPY puts again and again I didn't learn my lesson until I finally did and stopped buying puts 🤡 of course that first 2% dip in September I have sold about 6k worth of SPY puts at a loss the day before then I stayed away. Fuck me dude, fuckkkkkkkk me",t3_pz4ta4,10
1633084757.0,2021-10-01,wallstreetbets,heyknn7,So calls at close yesterday turned out to be a bad idea.,t3_pz4ta4,9
1633084820.0,2021-10-01,wallstreetbets,heykqf0,"Haha, this isn't good",t3_pz4ta4,10
1633085527.0,2021-10-01,wallstreetbets,heylngq,"My favorite saying from game of thrones ""a Lanaster always pays their debts"" time to pay up",t3_pz4ta4,9
1633088287.0,2021-10-01,wallstreetbets,heypifp,The recession we had in Sept is the last one for the year right? Its all green for the remainder right?,t3_pz4ta4,10
1633088973.0,2021-10-01,wallstreetbets,heyqkdy,What a reversal,t3_pz4ta4,8
1633089812.0,2021-10-01,wallstreetbets,heyrwlz,"It's not about being a bear or a bull, it's playing the cards you're dealt.",t3_pz4ta4,8
1633090565.0,2021-10-01,wallstreetbets,heyt5dh,The dollar will fuck all the bulls shortly.,t3_pz4ta4,10
1633092037.0,2021-10-01,wallstreetbets,heyvqw7,Inflation came in above expectation.,t3_pz4ta4,8
1633093479.0,2021-10-01,wallstreetbets,heyyfuv,Everyone said I was crazy predicting a Shrek vs Hulk swordfight today,t3_pz4ta4,8
1633094993.0,2021-10-01,wallstreetbets,hez1gef,"there's about 30k users on here, assuming that a good two-thirds are bots, we have 10k actual human beings

all I need to do is sell each idiot $100 in worthless options and I make a million dollars

may I interest you in some bananas, dental braces, human-sized RC cars, or perhaps good old-fashioned doomsday index puts",t3_pz4ta4,9
1633095661.0,2021-10-01,wallstreetbets,hez2tlh,Bought calls at open. Yeah I’m done,t3_pz4ta4,10
1633095855.0,2021-10-01,wallstreetbets,hez37vq,"Crashing this market;

*WITH NO SURVIVORS*",t3_pz4ta4,10
1633096596.0,2021-10-01,wallstreetbets,hez4skv,I think the market forgot it isn't September anymore,t3_pz4ta4,10
1633096790.0,2021-10-01,wallstreetbets,hez57gx,It’s over spy give up,t3_pz4ta4,8
1633098170.0,2021-10-01,wallstreetbets,hez88mr,"HOLY!! 

Bulls I told you to go home 😞",t3_pz4ta4,10
1633098172.0,2021-10-01,wallstreetbets,hez88qa,AAPL is getting demolished rn,t3_pz4ta4,9
1633098434.0,2021-10-01,wallstreetbets,hez8tu3,SPY looks like it's gonna get delisted soon.,t3_pz4ta4,10
1633098591.0,2021-10-01,wallstreetbets,hez96p0,Bruh. The bulls were talking so much shit last week. This is so amazing lol.,t3_pz4ta4,9
1633099082.0,2021-10-01,wallstreetbets,heza8mc,if I buy puts and calls at the same time I bet the market would implode,t3_pz4ta4,9
1633099541.0,2021-10-01,wallstreetbets,hezb9uv,SPY is struggling to hold any semblance of a bounce right now. Not good. Bulls fell directly on their own hulk green dildos and now news to go to the ER to get them removed.,t3_pz4ta4,9
1633099615.0,2021-10-01,wallstreetbets,hezbfvs,Is $420 a thing today?,t3_pz4ta4,8
1633099800.0,2021-10-01,wallstreetbets,hezbuzh,lol buy the knife,t3_pz4ta4,10
1633100706.0,2021-10-01,wallstreetbets,hezdymw,HAHA MY PUTS ARE STILL GREEN BITCH,t3_pz4ta4,10
