created,date,subreddit,id,body,parent_id,score
1581595506.0,2020-02-13,wallstreetbets,fhh6g2z,I’m embarrassed to send my tax documents to my accountant in all honesty,t3_f38dq2,150
1581599815.0,2020-02-13,wallstreetbets,fhhb8x0,"Hello China my old friend....

The market's problem once again....

Why did you have to eat bat meat, that you were selling right in the street

Wuhan flu, I guess we should have knew, you'd fuck us too

To the sounds, of SPY 300",t3_f38dq2,110
1581594973.0,2020-02-13,wallstreetbets,fhh5y1m,"A Chinese company with zero US regulatory oversight reported monster earnings.

I’m shocked, SHOCKED, I tell you",t3_f38dq2,58
1581595854.0,2020-02-13,wallstreetbets,fhh6sco,The Roaring 20's ended so fast,t3_f38dq2,51
1581593792.0,2020-02-13,wallstreetbets,fhh4vxd,"*fires up trading app*

""Hey, want to see a dead body?""",t3_f38dq2,44
1581593942.0,2020-02-13,wallstreetbets,fhh50lg,Who here is ready to see the most disgusting and unreal recovery you’ve ever seen? I know I sure am.,t3_f38dq2,48
1581601566.0,2020-02-13,wallstreetbets,fhhdl0x,"For all the r/all people here saying autist is offensive and all, screw off. We don’t hop on your parade when some dude wants to be called a her. Autist is our gender neutral pronoun. That and retard.",t3_f38dq2,124
1581593980.0,2020-02-13,wallstreetbets,fhh51r5,"Didn’t expect to be back in the “fuck you, fuck everything, I’ll hold these MSFT calls until I fucking die” frame of mind again so soon, but here we are.

Why do all of my trades suck?",t3_f38dq2,80
1581603870.0,2020-02-13,wallstreetbets,fhhgtik,I too am raising my price target of Microsoft to $220,t3_f38dq2,39
1581595073.0,2020-02-13,wallstreetbets,fhh61gh,"If this judge could rule in Microsoft’s favor, that would be pretty dank.",t3_f38dq2,37
1581598549.0,2020-02-13,wallstreetbets,fhh9pz6,"Holding msft still. It’s already been a rough two days, suffering heavy losses. Unable to mitigate these losses, but still having some hope. Hope to see a better day. A greener day. Not a Green Day where it becomes barely green in the final 5 minutes of the day, but a Green Day where it prospers all day. Nevertheless, I’ve entered the third day, it’s period red due to the cabrona virus. The question remains. Am I 🇺🇸 enough to hold and sustain more losses today.",t3_f38dq2,36
1581603816.0,2020-02-13,wallstreetbets,fhhgqpj,"MSFT upgraded from $190 to $220 by Evercore.

https://www.streetinsider.com/dr/news.php?id=16464567",t3_f38dq2,33
1581615811.0,2020-02-13,wallstreetbets,fhi18bc,"just sold my SPCE leaps for $56,500. bought for $10,200. feels good man. account saved.",t3_f38dq2,31
1581592660.0,2020-02-13,wallstreetbets,fhh3y8z,Gonna buy the dip at open then head down to Panda Express get me some bat soup.,t3_f38dq2,56
1581595528.0,2020-02-13,wallstreetbets,fhh6gvv,My favorite part about Stocktwits is when these idiots think that the price of one share by itself means something. As if every company in the world has the exact same number of shares outstanding.,t3_f38dq2,29
1581597216.0,2020-02-13,wallstreetbets,fhh87tp,I am going to be glued to this sub when the actual depression starts,t3_f38dq2,24
1581602071.0,2020-02-13,wallstreetbets,fhheac2,"Attention all Wallstreet bets traders!

Elon Musk is in grave trouble! (oh no!) And he needs your help! 

He wants to take tesla private at $42,690! But to do this he needs to secure funding! 

To help him all he needs is your mom's credit card number, the three digits on the back, and the expiration month and year!

If you accept this mission, you will secure the bag, and rain tendies on yourself until the end of days!",t3_f38dq2,25
1581602968.0,2020-02-13,wallstreetbets,fhhfj19,Maybe if MSFT starts off red pre-market as opposed to the green that means it’ll trend up. Right guys?...... guys?,t3_f38dq2,25
1581612888.0,2020-02-13,wallstreetbets,fhhw2cv,"The average size of the adult bull’s penis is 30-36 inches long on average.

The average size of the adult bear’s penis is 7-8 inches long on average.

These are actual facts.",t3_f38dq2,22
1581625573.0,2020-02-13,wallstreetbets,fhiiska,I literally have no idea what people did at work before the advent of phone based trading.,t3_f38dq2,20
1581599367.0,2020-02-13,wallstreetbets,fhhaopi,Lmao leave it to some dumb fucks eating bats to ruin billions of dollars being pumped in,t3_f38dq2,19
1581602182.0,2020-02-13,wallstreetbets,fhhefrs,Msft needa moon 🌚,t3_f38dq2,20
1581612688.0,2020-02-13,wallstreetbets,fhhvpkx,MSFT bulls hold my hand I'm scared.,t3_f38dq2,20
1581602803.0,2020-02-13,wallstreetbets,fhhfas0,"One of these days, well trained WSB veterans will buy every layer of the 7 layer dip only to find out it's a 20 layer dip and the REEEEEE ensues. Loss porn will be unimaginable!",t3_f38dq2,20
1581617306.0,2020-02-13,wallstreetbets,fhi3xfw,##**rh i know my options expire tomorrow 😤i just bought them you fucking retard**,t3_f38dq2,19
1581622561.0,2020-02-13,wallstreetbets,fhide0w,"THEY SAID MSFT WOULD WIN THEY SAID THE FIRST ONE IS FREE


Please god rally by March 20",t3_f38dq2,20
1581597229.0,2020-02-13,wallstreetbets,fhh88b9,"Imagine investing in a company called Alibaba and expecting not to have your tendies stolen

I'm legit retarded!",t3_f38dq2,41
1581606038.0,2020-02-13,wallstreetbets,fhhk6ew,$MSFT's future right now relies on a female judge with a hyphenated last name handing a win to Trump.,t3_f38dq2,40
1581614399.0,2020-02-13,wallstreetbets,fhhyqxg,"Lost my job this week. Please msft go up, daddy needs to pay the rent",t3_f38dq2,19
1581622618.0,2020-02-13,wallstreetbets,fhidht5,"this is the issue with retards on WSB, when there is a dip you BUY, when we are going up you SELL. You dont sell at massive losses on a dip and then fomo in at the top",t3_f38dq2,19
1581602366.0,2020-02-13,wallstreetbets,fhheoxy,"Come on JEDI use the force to send MSFT to the moon.

Is the court ruling today, or is it a different Thursday?",t3_f38dq2,18
1581630593.0,2020-02-13,wallstreetbets,fhirve7,"MSFT 220c 5/15 🖐💎🖐💎

I ain’t fuckin leavin!",t3_f38dq2,17
1581594506.0,2020-02-13,wallstreetbets,fhh5im2,"Today at open, my portfolio will drop to four figures. I’m depressed and going find my yolo for next week",t3_f38dq2,16
1581597258.0,2020-02-13,wallstreetbets,fhh89fx,"u/lovetofuckbearasshoe! How many blowies behind Dennys will you need to make up for these losses, sir!",t3_f38dq2,15
1581598072.0,2020-02-13,wallstreetbets,fhh962p,"Dont let all this distract you from the fact that a burrito company has a 25B market cap and a $900 stock now

Y'all can't cook for shit!",t3_f38dq2,16
1581615518.0,2020-02-13,wallstreetbets,fhi0pi2,Up 700% on my tesla call spreads today. Too bad I’m still down 90% overall,t3_f38dq2,16
1581617703.0,2020-02-13,wallstreetbets,fhi4om4,"Maybe I'm retarded, but usually when a company announces they are selling more shares for a capital raise, that should be a bad thing for the stock price, not rising 4%?",t3_f38dq2,16
1581598590.0,2020-02-13,wallstreetbets,fhh9rop,"To all of the new robin hood account guys ,  it looks like there is a chance of a selloff this morning . dont buy the dip until you see the first green candle on the five minute chart. Remember you only got one shot with that 200.00",t3_f38dq2,14
1581602107.0,2020-02-13,wallstreetbets,fhhec24,Sooo...you’re saying there’s a chance MSFT?,t3_f38dq2,15
1581603488.0,2020-02-13,wallstreetbets,fhhg9jl,"$48b overnight and $30b 14-day term. Continuing through to April and then onto whenever they extend it to after that. Totally normal market, nothing to see here.

At this point they are clearly propping the fuck out of some bank or hedge fund somewhere and they can't get out from under it.",t3_f38dq2,15
1581614288.0,2020-02-13,wallstreetbets,fhhyjqf,"My friend sold his MSFT calls at a 80% loss
I WILL NEVER SURRENDER
BELIEVE IN THE SATYA",t3_f38dq2,14
1581615566.0,2020-02-13,wallstreetbets,fhi0sm9,Will piss on my playstation if MSFT hits $190 today,t3_f38dq2,15
1581617188.0,2020-02-13,wallstreetbets,fhi3p8k,"I just calculated the average market performance by day of the week using daily data from the last 5 years.

Monday	+0.02%

Tuesday	+0.04%

Wednesday	+0.11%

Thursday	+0.05%

Friday	-0.02%",t3_f38dq2,15
1581621156.0,2020-02-13,wallstreetbets,fhiavg6,"Guys, get out of MSFT... NOW.

[BREAKING: Court grants Amazon Web Services request to temporarily halt work on JEDI Cloud contract. Story to come.](https://twitter.com/jserbuWFED/status/1228033126233968642)",t3_f38dq2,14
1581631304.0,2020-02-13,wallstreetbets,fhit5d2,"MSFT 2/21 call Holders, how you doin?",t3_f38dq2,15
1581602301.0,2020-02-13,wallstreetbets,fhhelpj,[deleted],t3_f38dq2,15
1581602599.0,2020-02-13,wallstreetbets,fhhf0p4,.5% volatility is for kids. Gimme a 2% day. I don’t even care the direction I just wanna get fucked quick or make tendies quick.,t3_f38dq2,15
1581602733.0,2020-02-13,wallstreetbets,fhhf7ca,Evercore increases MSFT target price from $190 to $212,t3_f38dq2,14
1581603487.0,2020-02-13,wallstreetbets,fhhg9h9,Going to let out an audible REEEEEE at the office today if MSFT has another red day,t3_f38dq2,14
1581609450.0,2020-02-13,wallstreetbets,fhhq0n6,MSFT 🚀,t3_f38dq2,15
1581611786.0,2020-02-13,wallstreetbets,fhhu3vh,I’m feeling like holding MSFT was the play. I’m happy,t3_f38dq2,12
1581612934.0,2020-02-13,wallstreetbets,fhhw5ar,Just realized something today. I'm a retard,t3_f38dq2,14
1581616492.0,2020-02-13,wallstreetbets,fhi2fv7,Can we take this sub private?,t3_f38dq2,16
1581628315.0,2020-02-13,wallstreetbets,fhinq56,Mickey 🐭 fucked me. Boeing ✈️ fucked me and macrohard 💻 fucked me. Thanks for the solid day fuckers,t3_f38dq2,13
1581632547.0,2020-02-13,wallstreetbets,fhivatl,Greed kills tendies,t3_f38dq2,14
1581593615.0,2020-02-13,wallstreetbets,fhh4qlv,"The part that is so frustrating about the virus is the fact that some days we’ll be going great, no problem. Market act like virus doesn’t exist. Next day, hemorrhaging out your jugular because of the virus. I can only hope the Jedi contract will protect my msft today",t3_f38dq2,30
1581593988.0,2020-02-13,wallstreetbets,fhh5212,"welp... that $1500 of spy calls I bought yesterday are as good as dead now, thanks chyna you incompetent shitheels",t3_f38dq2,27
1581603646.0,2020-02-13,wallstreetbets,fhhghwf,"Who’s ready to watch their portfolio tank at open?? 🙋🏼‍♂️

Diamond hands.",t3_f38dq2,29
1581607042.0,2020-02-13,wallstreetbets,fhhltok,MSFT UP 1 cent cancel the fucking recession bois,t3_f38dq2,26
1581603413.0,2020-02-13,wallstreetbets,fhhg5se,[deleted],t3_f38dq2,13
1581604073.0,2020-02-13,wallstreetbets,fhhh4a4,Good luck boys. *HELMETS ON*,t3_f38dq2,14
1581606293.0,2020-02-13,wallstreetbets,fhhkl7w,🤭🤭🤭 Microsoft you’re making me p🅾️🅾️r,t3_f38dq2,13
1581609846.0,2020-02-13,wallstreetbets,fhhqpkl,WHO HELD THRU BOTH RED DAYS? Real MVP.,t3_f38dq2,13
1581612561.0,2020-02-13,wallstreetbets,fhhvhf7,This sub has become bulls talking shit about gainz before they even ever realize/sell them. Inevitably they jinx everything and all the people just quietly trying to make some tendies get shit on as well.,t3_f38dq2,12
1581616188.0,2020-02-13,wallstreetbets,fhi1wfz,"Fuck me, I actually had TSLA 935 calls that I sold for a loss this morning. Those fuckers are +2,880% now. 

I’m never selling for a loss again, till death or profit",t3_f38dq2,13
1581616855.0,2020-02-13,wallstreetbets,fhi33cc,[deleted],t3_f38dq2,13
1581619938.0,2020-02-13,wallstreetbets,fhi8ta9,A stock price moving up less than $1 and then falling back less than $1 in the same 3 hour period is not fucking 'mooning' you clown ass mother fuckers.,t3_f38dq2,12
1581624708.0,2020-02-13,wallstreetbets,fhih8nb,"If SPCE and MSFT want to start power hour that would be nice. Also, if TSLA would fuck itself to $650 that would also be nice.",t3_f38dq2,14
1581624804.0,2020-02-13,wallstreetbets,fhiheq9,"I was on the phone for 30  trying to get some pussy . I lost 5400$ ,I’m retarded as fuck tomorrow is Friday .i don’t see any way to recover my tendies",t3_f38dq2,12
1581625455.0,2020-02-13,wallstreetbets,fhiiksj,"As a MSFT and BABA call holder, today was not a good time 🐻",t3_f38dq2,13
1581593614.0,2020-02-13,wallstreetbets,fhh4qkr,Can judge ruling still save MSFT?,t3_f38dq2,12
1581601208.0,2020-02-13,wallstreetbets,fhhd36e,"What is this? A dip for ants!?

Wake me when it's -3%",t3_f38dq2,13
1581603870.0,2020-02-13,wallstreetbets,fhhgtjb,MSFT price target raised. Buy buy buy,t3_f38dq2,12
1581608739.0,2020-02-13,wallstreetbets,fhhorb2,"Ill never buy puts on anything again.

Bull market forever.

Bull gang forever.

Tendies forever.",t3_f38dq2,13
1581609690.0,2020-02-13,wallstreetbets,fhhqftw,".　　　　　　　　　　 ✦ 　　　　   　 　　　˚　　　　　　　　　　　　　　*　　　　　　   　　　　　　　　　　　　　　　.　　　　　　　　　　　　　　. 　　 　　　　　　　 ✦ 　　　　　　　　　　 　 ‍ ‍ ‍ ‍ 　　　　 　　　　　　　　　　　　,　　   　

.　　　　　　☀️　　　　　　　.　　　ﾟ　  　　　.　　　　　　　　　　　　　.

,　　　　　　　.　　　　　　    　　　🌒　 　　　　　　　　　　　　　　　　　　  　　　　　　　　　　　　　　　　　　    　      　　　　　        　　　　　　　　　　　　　. 　　　　　　　　　　.　　　　　　　　　　　　　. 　　　　　　　　　　　　　　　　       　   　　　　 　　　　　　　　　　　　　　　　       　   　　　　　　　　　　　　　　　　       　    ✦ 　   　　　,　　　　　　　　　　　    🚀 　　　　 　　,　　　 ‍ ‍ ‍ ‍ 　 　　　　　　　　　　　　.　　　　　 　　 　　　.　　　　　　　　　　　　　 　           　　　　　　　　　　　　　　　　　　　˚　　　 　   　　　　,　　　　　　　　　　　       　    　　　　　　　　　　　　　　　　.　　　  　　    　　　　　 　　　　　.　　　　　　　　　　　　　.　　　　　💸 　　　　　　　　　　* 　　   　　　　　 ✦ 　　　　　　　         　        　　　　 　　 　　　　　　　 　　　　　.　　　　　　　　　　　　　　　　　　.　　　　　    　　. 　 　　　　　.　　　　 💸 　　　　　   　　　　　.　　　　　　　　　　　.　　　　　　　　　　   　

˚　　　　　　　　　　　　　　　　　　　　　ﾟ　　　　🌎　　　　　　　　　　　. 　　 　 ‍ ‍ ‍ ‍ ‍ ‍ ‍ ‍ ‍ ‍ ,　 　　　　　　　　　　　　　　* .　　　　　 　　　　　　　　　　　　　　.　　　　　　　　　　 ✦ 　　　　   　 　　　˚　　　　　　　　　　　　　　*　　　　　　   　　　　　　　　　　　　　　　.　　　　　　　　　　　　　　.
MSFT",t3_f38dq2,12
1581612677.0,2020-02-13,wallstreetbets,fhhvoxj,hold msft or yolo,t3_f38dq2,13
1581614190.0,2020-02-13,wallstreetbets,fhhydif,It’s ok MSFT u go when u feel like it,t3_f38dq2,12
1581616255.0,2020-02-13,wallstreetbets,fhi20se,Holy fuck can we just get the Microsoft decision over with already,t3_f38dq2,12
1581623424.0,2020-02-13,wallstreetbets,fhiexv0,"News Article: Elon just fucked your girl in a tesla after running over 7 orphans. 

Tesla stonk: news is news. Moon time",t3_f38dq2,13
1581623603.0,2020-02-13,wallstreetbets,fhif9ln,Shut the fuck up about your MSFT 3/20 calls. That's 5 weeks away you massive pussies,t3_f38dq2,11
1581592879.0,2020-02-13,wallstreetbets,fhh44jm,"I'm about to go to sleep now, but I want all of my fellow SPCE niggas to know that the premarket volume is only 543 shares, meme stonks don't give a fuck about futures, and remember that there are positive catalysts later this month. If we dip today, think of it as refueling, diamond hand that shit, and man the fuck up. Now kiss me goodnight 🌈",t3_f38dq2,28
1581595866.0,2020-02-13,wallstreetbets,fhh6srw,[deleted],t3_f38dq2,24
1581600414.0,2020-02-13,wallstreetbets,fhhc0o7,[deleted],t3_f38dq2,22
1581613069.0,2020-02-13,wallstreetbets,fhhwdv4,Other subs call us homophobic but we have one of the strongest gay communities on Reddit. So many bears on here it’s crazy.,t3_f38dq2,24
1581603707.0,2020-02-13,wallstreetbets,fhhgkyp,"Last 2 days MSFT has been green premarket and shit the bed at open. Today reverse that, red premarket and moon at open? 🤔",t3_f38dq2,22
1581614266.0,2020-02-13,wallstreetbets,fhhyicq,If MSFT hits $190 today I'll take a dump on my neighbors doorstep,t3_f38dq2,22
1581592149.0,2020-02-13,wallstreetbets,fhh3jwq,muh gains wiped out :/,t3_f38dq2,13
1581594413.0,2020-02-13,wallstreetbets,fhh5fl7,Best part about trading with algos is they forget headlines. In 24 hours the wutang flu headline will be forgotten. All we need is a trump tweet to pump,t3_f38dq2,10
1581594862.0,2020-02-13,wallstreetbets,fhh5ubu,"Red futures because of the wonton virus? The McRib kills more people. Obviously, I sold puts",t3_f38dq2,11
1581595804.0,2020-02-13,wallstreetbets,fhh6ql2,"WHO meets today, right? Market should be green after. They'll say China has it all under control.",t3_f38dq2,12
1581596561.0,2020-02-13,wallstreetbets,fhh7i7y,I'm 100% bull but this pre-market pump feels like a trap on a Thursday,t3_f38dq2,12
1581598374.0,2020-02-13,wallstreetbets,fhh9ihd,TSLA just cuck call holders??,t3_f38dq2,11
1581600685.0,2020-02-13,wallstreetbets,fhhcdou,[deleted],t3_f38dq2,11
1581605431.0,2020-02-13,wallstreetbets,fhhj7lo,Day 3 of MSFT murders my portfolio,t3_f38dq2,12
1581607951.0,2020-02-13,wallstreetbets,fhhnda3,"Imagine if stupid 🇨🇳 never eat bat
🕵️‍♂️369",t3_f38dq2,10
1581610215.0,2020-02-13,wallstreetbets,fhhrcmg,Time for another MSFT spike,t3_f38dq2,11
1581610419.0,2020-02-13,wallstreetbets,fhhrpap,"TSLA: ""reports of my death have been greatly exaggerated""",t3_f38dq2,11
1581611061.0,2020-02-13,wallstreetbets,fhhstei,"If you've bought SPCE puts in the last three days, you are a mental midget and have weak genetics...

...>6%... warned.",t3_f38dq2,11
1581611569.0,2020-02-13,wallstreetbets,fhhtptg,"If you’re a bull and you’re not making money today, you should quit",t3_f38dq2,12
1581611898.0,2020-02-13,wallstreetbets,fhhub0e,Go BABA GO,t3_f38dq2,10
1581611934.0,2020-02-13,wallstreetbets,fhhud9d,🍺virus : Am i a joke to you!?,t3_f38dq2,11
1581613149.0,2020-02-13,wallstreetbets,fhhwj78,Bought 2 more $200 3/20 MSFT calls. Let's fucking fly,t3_f38dq2,12
1581614206.0,2020-02-13,wallstreetbets,fhhyeie,Holding MSFT calls is decreasing my life expectancy from the stress,t3_f38dq2,12
1581616476.0,2020-02-13,wallstreetbets,fhi2eun,Well I’m going to let these $MSFT calls chew my dick for the rest of the day. If this Jedi bullshit doesn’t turn on a big thick throbbing green lightsaber on this chart I’m fucking out,t3_f38dq2,11
1581618417.0,2020-02-13,wallstreetbets,fhi6113,MSFT just needs to make up its mind. Go to 200 right now or go to 170,t3_f38dq2,11
1581619781.0,2020-02-13,wallstreetbets,fhi8j96,"Whoever sold their MSFT calls at the bottom for this, Thank You",t3_f38dq2,11
1581621414.0,2020-02-13,wallstreetbets,fhibbl8,Its like a million msft call holders cried out in agony and then were silenced.,t3_f38dq2,11
1581621930.0,2020-02-13,wallstreetbets,fhic8ml,I hope bezos gets hit by a bus,t3_f38dq2,12
1581622022.0,2020-02-13,wallstreetbets,fhicejl,"Oh fuck, stupid judge just cock blocked MSFT pentagon deal. It's gunna be a bumpy ride......",t3_f38dq2,13
1581622369.0,2020-02-13,wallstreetbets,fhid1f1,Watch MSFT still go green in last 5 minutes like always and then all you TP hands get fukd,t3_f38dq2,11
1581622493.0,2020-02-13,wallstreetbets,fhid9iv,"BEZOS IS A PUSSY ASS CUCK.  

IF I SAW HIM ON STHE STRET, I  WOULD BOUNCE A AMAZON FIRE PHONE OFF HIS SKULL.",t3_f38dq2,12
1581622954.0,2020-02-13,wallstreetbets,fhie3rl,i actually love this sub its amazing. I could compile at least 100 comments from this thread alone of people LITERALLY DESCRIBING HOW THEY SOLD AT THE BOTTOM AND INTEND TO BUY AGAIN AT THE TOP,t3_f38dq2,11
1581624033.0,2020-02-13,wallstreetbets,fhig1gy,Making 300 bucks is so depressing.  Either down or up atleast 2k is the only thing that gets my blood moving anymore,t3_f38dq2,9
1581624546.0,2020-02-13,wallstreetbets,fhigyb3,Made a lot of bad decisions this week,t3_f38dq2,11
1581624644.0,2020-02-13,wallstreetbets,fhih4kq,"Amazon back to red, feeling avenged for what they did to my BEST FRIEND",t3_f38dq2,12
1581625194.0,2020-02-13,wallstreetbets,fhii3pb,Alibaba is a fucking rat,t3_f38dq2,12
1581626234.0,2020-02-13,wallstreetbets,fhijz8a,Glad I got out of my MSFT calls for only a 65% loss instead of 100%,t3_f38dq2,10
1581626926.0,2020-02-13,wallstreetbets,fhil855,Just bought the SPCE dip cuz I am a gooooood boy,t3_f38dq2,11
1581627670.0,2020-02-13,wallstreetbets,fhimkcs,"Down 41% today, 71% overall...fuck everything.",t3_f38dq2,12
1581593328.0,2020-02-13,wallstreetbets,fhh4hyz,"I have a family friend that owns a giant dessert chain in China. Most of the stores are still closed atm. But apparently the Chinese government announced that they are going to use some of the money that the riches has banked to help stabilize the economy. This leads to my family friend trying to move huge funds outside of the country atm, and he’s not the only one. Idk where it’s gonna go but I just wanted to share.

Edited: here’s a link from an English source https://www.hongkongfp.com/2020/02/12/cities-guangdong-china-allow-temporary-seizure-private-properties-control-spread-coronavirus/",t3_f38dq2,22
1581609591.0,2020-02-13,wallstreetbets,fhhq9l6,MSFT diamond hands who's with me,t3_f38dq2,21
1581592639.0,2020-02-13,wallstreetbets,fhh3xms,🐂🐃®️👉👌,t3_f38dq2,8
1581594949.0,2020-02-13,wallstreetbets,fhh5x9w,Tbh I just want the Dow to get to 30 so I can get one of those hats the NYSE guys wear,t3_f38dq2,11
1581595279.0,2020-02-13,wallstreetbets,fhh68fz,I have it written in my notes not to play BABA earnings because it’s such a turd. Everyone is about to get fucked by theta/IV crush.,t3_f38dq2,11
1581595852.0,2020-02-13,wallstreetbets,fhh6saq,"I could not seriously invest in a Chinese company.  One day the Chinese government is going to flip the switch and take complete ownership of every profitable industry in China and all the ""investors"" with no stake will be left out to dry.",t3_f38dq2,10
1581598883.0,2020-02-13,wallstreetbets,fhha3wl,">Home sick today

>Have all 3 day trade slots freed up

>High volatility

This is gonna be cozy",t3_f38dq2,9
1581599115.0,2020-02-13,wallstreetbets,fhhadqz,Don’t even wanna look at my account today... baba AAPL and msft calls... expire 2/28... please god...,t3_f38dq2,11
1581599124.0,2020-02-13,wallstreetbets,fhhae4j,"Markets coming back up, recession cancelled. Diamond hands boys",t3_f38dq2,10
1581599410.0,2020-02-13,wallstreetbets,fhhaqog,[deleted],t3_f38dq2,9
1581599903.0,2020-02-13,wallstreetbets,fhhbcsc,I'm beginning to not like this china place,t3_f38dq2,11
1581600385.0,2020-02-13,wallstreetbets,fhhbzcs,I don’t appreciate tastyworks showing my YTD losses for each ticker. I would prefer not to be reminded of my crippling autism after my FDs expire thank you.,t3_f38dq2,10
1581601192.0,2020-02-13,wallstreetbets,fhhd2de,Elon literally doesnt care. Tesla 420 by 420,t3_f38dq2,11
1581601374.0,2020-02-13,wallstreetbets,fhhdbfe,"Less than one hour away until u/a_real_Cool_user gives me $1,000 a month for the next year 


https://www.reddit.com/r/wallstreetbets/comments/f2y2vz/what_are_your_moves_tomorrow_february_13/fhg0tfj/?utm_source=share&utm_medium=ios_app&utm_name=iossmf",t3_f38dq2,9
1581601825.0,2020-02-13,wallstreetbets,fhhdxyd,This is how spoiled we are.  A .5% dip and people are losing their minds!,t3_f38dq2,11
1581602180.0,2020-02-13,wallstreetbets,fhhefnn,Spce definitely has the retard strength of 500k wsb autismos. May even Just buy a call or two or 20 here.,t3_f38dq2,10
1581602871.0,2020-02-13,wallstreetbets,fhhfe7u,This is an “F” message to that guy who bet $200k on ACB going up.,t3_f38dq2,10
1581604100.0,2020-02-13,wallstreetbets,fhhh5qb,It’s going to hurt isn’t it?,t3_f38dq2,10
1581604565.0,2020-02-13,wallstreetbets,fhhhv22,My MSFT calls are green? I didn't know they could do that.,t3_f38dq2,10
1581604888.0,2020-02-13,wallstreetbets,fhhiczr,[deleted],t3_f38dq2,10
1581608555.0,2020-02-13,wallstreetbets,fhhofhr,"MSFT is down but it's relieving that it's only down a bit. 

Today's drop is probably a technical sell off after we rallied so hard in the last 2 weeks. I wouldn't be worried about a correction or anything, especially while Powell is still in charge.",t3_f38dq2,10
1581608763.0,2020-02-13,wallstreetbets,fhhosw9,"JEDI waiting room here

https://www.uscfc.uscourts.gov/aggregator/sources/8

Let’s see that pro MSFT decision bb!",t3_f38dq2,10
1581609431.0,2020-02-13,wallstreetbets,fhhpzf4,[deleted],t3_f38dq2,10
1581609458.0,2020-02-13,wallstreetbets,fhhq15i,We broke 185 boissss. Moon time,t3_f38dq2,10
1581610357.0,2020-02-13,wallstreetbets,fhhrlgt,MSFT could hit 200 I aint selling shit  💎  💎  💎^(ok maybe just 1 contract),t3_f38dq2,10
1581611066.0,2020-02-13,wallstreetbets,fhhstpa,Twitter is basically a porn site now. I see no reason for it to not keep mooning.,t3_f38dq2,11
1581611136.0,2020-02-13,wallstreetbets,fhhsy5r,[deleted],t3_f38dq2,9
