created,date,subreddit,id,body,parent_id,score
1615975721.0,2021-03-17,wallstreetbets,gr80b6e,My stimulus has arrived and now I shall stimulate the stonk market 🚀,t3_m6wyk2,431
1615975399.0,2021-03-17,wallstreetbets,gr7zzkk,"THE PRICE IS WRONG, BITCH",t3_m6wyk2,234
1615975585.0,2021-03-17,wallstreetbets,gr806ad,The stimmy hit and I now have over $1100 in my bank account. Baller time,t3_m6wyk2,189
1615978069.0,2021-03-17,wallstreetbets,gr82pje,"Listen, idgaf about premarket, JPow tank speech, or fucking graphs. All I know is that its St. Patrick's day so that means its a green mother motherfuckin day",t3_m6wyk2,167
1615978106.0,2021-03-17,wallstreetbets,gr82r0g,"My school is doing a 5 day stock trading competition. We started with $50,000 in virtual money. I am currently at $2,443 with 3 days left.",t3_m6wyk2,724
1615978202.0,2021-03-17,wallstreetbets,gr82unk,Who else got their stimulus today and is outta fucks to give?,t3_m6wyk2,140
1615986885.0,2021-03-17,wallstreetbets,gr8f0t8,Dating in your late 20s is just learning how to be a step-dad,t3_m6wyk2,134
1615978589.0,2021-03-17,wallstreetbets,gr839sr,I get my finance exam grade back tomorrow. I need to get a 167% to pass the class,t3_m6wyk2,116
1615975736.0,2021-03-17,wallstreetbets,gr80bou,"Using your profits once this is all over, you should buy a Little cesars franchise. Think about it, pizza is a recession proof business. 

When 2008 happened, pizza stayed open. When the market tanked last year, little cesars stayed open. No matter how poor people get, they can afford a 7 dollar pizza. It’s recession proof and literally can’t go tits up. 

I’m hot and ready, are you?",t3_m6wyk2,406
1615975427.0,2021-03-17,wallstreetbets,gr800nm,Anyone know a good substitute for lube? I'm all out and about to get ass fucked by the market again,t3_m6wyk2,78
1615981734.0,2021-03-17,wallstreetbets,gr873b9,I’m up $1400 for the day,t3_m6wyk2,84
1615979092.0,2021-03-17,wallstreetbets,gr83u70,[deleted],t3_m6wyk2,78
1615975749.0,2021-03-17,wallstreetbets,gr80c4q,"Sometimes when im real low i like to take a stroll down to the bottom of the garden where theres a tree, i climb the tree, its a tall tree, i reach a steady branch near the top and nestle myself in beside the leaves. Then I pretend im a banana",t3_m6wyk2,63
1615979631.0,2021-03-17,wallstreetbets,gr84ga2,Ravioli ravioli give me the stimmyoli,t3_m6wyk2,66
1615975452.0,2021-03-17,wallstreetbets,gr801lv,Who’s feeding GME their stimmy then?,t3_m6wyk2,324
1615983114.0,2021-03-17,wallstreetbets,gr88zjs,I'm literally a god in buying stocks at the exact point where their growth stops and they start to tank. I'm such a fucking idiot lmao,t3_m6wyk2,59
1615976445.0,2021-03-17,wallstreetbets,gr811c8,My dad told me there is no such thing as free money and you have to work for it. What a retard. I guess I was genetically determined to end up here.,t3_m6wyk2,172
1615975834.0,2021-03-17,wallstreetbets,gr80f66,Excited for another day of panicking at every dip and feeling godly every time I see a green line.,t3_m6wyk2,55
1615991575.0,2021-03-17,wallstreetbets,gr8o2bm,lost  75% of my Stimulus so far in an hour. Speed running to -99.99% Portfolio value rn,t3_m6wyk2,55
1615976409.0,2021-03-17,wallstreetbets,gr80zzi,Stimulus comes on a dip day? Ooolala... *Strokes nuts* Decisions decisions..,t3_m6wyk2,49
1615976952.0,2021-03-17,wallstreetbets,gr81jf4,Don’t forget to pinch your red stocks for not wearing green today.,t3_m6wyk2,46
1615977408.0,2021-03-17,wallstreetbets,gr820kz,Looks like my account is gonna take a fat Cramer at open,t3_m6wyk2,48
1615981037.0,2021-03-17,wallstreetbets,gr866bq,For a straight male I do seem to be getting ass fucked everyday here,t3_m6wyk2,46
1615975339.0,2021-03-17,wallstreetbets,gr7zxgb,Stimmy hit and gme is down. Perfect,t3_m6wyk2,137
1615996921.0,2021-03-17,wallstreetbets,gr8zmje,"The year is 2096.

SPY is at 398 after going up and down half a percent every day for the past 70 years.",t3_m6wyk2,42
1615985430.0,2021-03-17,wallstreetbets,gr8ck26,"HA i'm only 36 , thought I was 37 for the past month. feels like I gained a year.",t3_m6wyk2,37
1615997097.0,2021-03-17,wallstreetbets,gr900re,"You know what’s so funny guys. I bought Plug calls yesterday right. After I bought it kept dipping so I kept buying, trynna average down in my contracts. Then boom big ass drop after hours. Then boom another drop premarket. I’m not fucking okay. I lost 38% and counting of my portfolio in 24 hours. I feel so fucking dumb.",t3_m6wyk2,40
1615997826.0,2021-03-17,wallstreetbets,gr91oua,"I blew my Biden bucks on rent and credit card bills. I feel like such a fucking loser. 

Fortunately that means I can spend all my time with you retards for another three months.",t3_m6wyk2,38
1615997839.0,2021-03-17,wallstreetbets,gr91pue,"Sell low, buy high gang rise up",t3_m6wyk2,38
1615999266.0,2021-03-17,wallstreetbets,gr94xi1,"Guys, I finally have my triple monitor set up so that I can watch the market more efficiently and lose money faster!!!",t3_m6wyk2,39
1615976299.0,2021-03-17,wallstreetbets,gr80vv5,Stimmy in the bank and a fat dip to buy,t3_m6wyk2,31
1615977188.0,2021-03-17,wallstreetbets,gr81scx,[deleted],t3_m6wyk2,30
1615983171.0,2021-03-17,wallstreetbets,gr892m7,Invest in the stock market they said. It'll be fun they said.,t3_m6wyk2,32
1615986425.0,2021-03-17,wallstreetbets,gr8e7tw,Wtf are you doing step-market?,t3_m6wyk2,32
1615992771.0,2021-03-17,wallstreetbets,gr8qjmy,"Pack your suitcase son, I lost the house",t3_m6wyk2,33
1615995403.0,2021-03-17,wallstreetbets,gr8w7l8,Whoever signed off on my options trading application clearly has no experience working with special needs children.,t3_m6wyk2,34
1615997142.0,2021-03-17,wallstreetbets,gr904di,Jpow looking in the mirror: “Get it together you pussy”,t3_m6wyk2,33
1616002367.0,2021-03-17,wallstreetbets,gr9bxju,"Calls expiring worthless👋😌

Buying more calls worth less 👈😏",t3_m6wyk2,31
1616009284.0,2021-03-17,wallstreetbets,gr9rl8o,# MY PUTS ARE FUCKED,t3_m6wyk2,32
1616011886.0,2021-03-17,wallstreetbets,gr9xecb,**I have lost money every single day since Feb 12th.** AMA,t3_m6wyk2,31
1615975894.0,2021-03-17,wallstreetbets,gr80hb4,"Thinking about dropping additional $1,400 into GME",t3_m6wyk2,138
1615975601.0,2021-03-17,wallstreetbets,gr806vq,"Happy St. Paddy’s day folks, sending all the green from Ireland!",t3_m6wyk2,84
1615975698.0,2021-03-17,wallstreetbets,gr80acj,"Time for my daily confirmation bias, will someone be so kind...",t3_m6wyk2,83
1616005396.0,2021-03-17,wallstreetbets,gr9iu3y,"Every single story being told about what really happened with wallstreetbets recently is **wrong**, or worse. Watch a minute or two of this video from the time I deep-linked. 

https://youtu.be/y5ar6E46Hio?t=283

Portnoy has his bad ideas out loud. Portnoy was also buddies with our deposed founder. The second he finds out about nerdcoins he has the idea to pump and dump them on his own audience. Mark Cuban showed up in /r/wallstreetbets (at the request of former scammer mods) to shill NFTs and decentralization too.

Weird huh? Remember this. It'll probably become clear within the next week or two why I'm starting to show you more of the truth of what happened. I offered the story to vice and others and they wouldn't commit to not including some scam crypto pitch, so I know which side they're on.

The above should make it less weirdly random and more suspicious that the Winklevii and Cuban were featured in GameStopped, or that the legacy media can't stop interviewing our deposed founder and showering him in money, deals, etc, despite literally being removed for scamming and also [harvesting emails to sell to scammers](https://i.gyazo.com/9e5589650d194d58e0638477b677f1a5.png) before being kicked out.

**More to come.** The rabbit hole is deep.",t3_m6wyk2,485
1615981034.0,2021-03-17,wallstreetbets,gr8665q,"So, I guess I can just start drinking now. It is St. Patrick's after all.",t3_m6wyk2,28
1615983358.0,2021-03-17,wallstreetbets,gr89ce4,Not even 10 stimulus checks can help me financially recover what I’ve lost in 2 days,t3_m6wyk2,27
1615983846.0,2021-03-17,wallstreetbets,gr8a2an,Today is a good day to get shitfaced and forget about the market. Amen!,t3_m6wyk2,27
1615984244.0,2021-03-17,wallstreetbets,gr8anyh,[deleted],t3_m6wyk2,27
1615990107.0,2021-03-17,wallstreetbets,gr8l3kn,Man apple is such a piece of shit stock,t3_m6wyk2,28
1615992360.0,2021-03-17,wallstreetbets,gr8poh5,"Woke up thinking I was late for high school. 

I haven’t been in high school for 8 years. 

This NoFap stuff is serious business.",t3_m6wyk2,24
1615992400.0,2021-03-17,wallstreetbets,gr8prgk,I gave my stimulus check to my mom,t3_m6wyk2,27
1615992441.0,2021-03-17,wallstreetbets,gr8pujk,"The market drops, my calls drops. The market bounces up, my calls stay the same. Damn",t3_m6wyk2,26
1616003309.0,2021-03-17,wallstreetbets,gr9e2i4,#UWMC making a comeback. Let’s get it 🔥🔥🔥🔥,t3_m6wyk2,27
1616003361.0,2021-03-17,wallstreetbets,gr9e6r7,UWMC coming for my desolate $25 3/19 fds,t3_m6wyk2,26
1616003647.0,2021-03-17,wallstreetbets,gr9eua3,"I bought $125,000 worth of stock this morning (all my money) and I am up $100.",t3_m6wyk2,26
1616009746.0,2021-03-17,wallstreetbets,gr9smlg,JPow announcing no rate hikes is like the guy who disappears from the party and comes back with more coke. The party goes on!,t3_m6wyk2,29
1616012338.0,2021-03-17,wallstreetbets,gr9yeak,UWMC climbing after hours.,t3_m6wyk2,27
1616012367.0,2021-03-17,wallstreetbets,gr9ygmz,How is PLTR being held down? Should be ripping! Hopefully we start testing $30 next week.,t3_m6wyk2,26
1616012997.0,2021-03-17,wallstreetbets,gr9zuov,Yo UMWC actually up to something.  Some tall green candles today.,t3_m6wyk2,25
1616014080.0,2021-03-17,wallstreetbets,gra29ha,GME tards asking talking about GME under RC’s tweet of his dead dad 😐,t3_m6wyk2,27
1616015190.0,2021-03-17,wallstreetbets,gra4psi,I honestly dont have a clue wtf to do in this market. Lol,t3_m6wyk2,27
1615975339.0,2021-03-17,wallstreetbets,gr7zxgc,Another fun day watching GME. Not selling bitch,t3_m6wyk2,125
1615979126.0,2021-03-17,wallstreetbets,gr83vma,Just saw a guy vaccinate himself under an overpass,t3_m6wyk2,315
1615975848.0,2021-03-17,wallstreetbets,gr80fo2,Fuck this market,t3_m6wyk2,23
1615976503.0,2021-03-17,wallstreetbets,gr813dk,oh no no no TSLA you weren’t supposed to do that,t3_m6wyk2,23
1615982487.0,2021-03-17,wallstreetbets,gr883y4,Why don’t I ever sell my PLTR calls for profit? What the fuck is wrong with me?,t3_m6wyk2,22
1615993978.0,2021-03-17,wallstreetbets,gr8t2zk,"Pro tip, when you go into an options trade, make sure you are maxxed out of daytrades like any degenerate should so you can't chicken out.",t3_m6wyk2,24
1616003551.0,2021-03-17,wallstreetbets,gr9emdj,"Food $200

Data $150

Rent $800

2 DTE options 6,900

Utility $150

someone who is good at the economy please help me budget this. my family is dying",t3_m6wyk2,25
1616005251.0,2021-03-17,wallstreetbets,gr9iigk,"Bears screaming ""bulltrap!"" with tears in their eyes and JPOW's meaty hog in their butts.",t3_m6wyk2,25
1616010252.0,2021-03-17,wallstreetbets,gr9tr6f,Can they arrange for JPow to speak every day?,t3_m6wyk2,24
1615978605.0,2021-03-17,wallstreetbets,gr83agi,Guys I ate Mexican last night and my stomach hurts this morning,t3_m6wyk2,23
1615982405.0,2021-03-17,wallstreetbets,gr87zun,"Even the smallest volume is flinging GME all directions premarket.

This could be a big day.",t3_m6wyk2,24
1615992007.0,2021-03-17,wallstreetbets,gr8oy0g,I’ve gotta learn how to paperhand at the right times and diamond hand at the right times instead of doing both wrong,t3_m6wyk2,25
1615995968.0,2021-03-17,wallstreetbets,gr8xgxv,I'm beginning to think that my strategy of grabbing 4 tiles from a scrabble bag and going long on whatever ticker I can make is probably not a winner.,t3_m6wyk2,23
1616003596.0,2021-03-17,wallstreetbets,gr9eq3x,#Stop what you’re doing and go get some UWMC before you miss this opportunity 🔥,t3_m6wyk2,23
1616005722.0,2021-03-17,wallstreetbets,gr9jkzq,SPY is officially a meme stock,t3_m6wyk2,24
1615978852.0,2021-03-17,wallstreetbets,gr83kea,"People with stimmys during pre market:

LET ME IN. LET ME IN. LET ME INNNNNNNN! 😂 

Stimmys loaded! 🚀",t3_m6wyk2,22
1615981757.0,2021-03-17,wallstreetbets,gr874h8,GME premarket SHES ALIVE,t3_m6wyk2,23
1615982411.0,2021-03-17,wallstreetbets,gr8805w,Most of you guys weren't here back last June when SPY would open up or down +-5$ those were the days. It was a literal casino.,t3_m6wyk2,22
1615993883.0,2021-03-17,wallstreetbets,gr8svo6,The name is Bond... 10Y treasury Bond,t3_m6wyk2,21
1615993972.0,2021-03-17,wallstreetbets,gr8t2lr,Awesome! Stimmy hit my accou..........*aaaaaaaaaaaaand its gone*,t3_m6wyk2,22
1616000627.0,2021-03-17,wallstreetbets,gr980cr,Don’t be a pussy Jerome either say we are fucked or spy 400.  Tired of this pussyfooting market. No more aladeen.,t3_m6wyk2,21
1616003327.0,2021-03-17,wallstreetbets,gr9e40x,oh my word UWMC actually got to 9,t3_m6wyk2,22
1616006926.0,2021-03-17,wallstreetbets,gr9mal8,[deleted],t3_m6wyk2,22
1616011244.0,2021-03-17,wallstreetbets,gr9vze1,"Woke up -$3,000, finished the day -$900. It was a good day.",t3_m6wyk2,23
1616012110.0,2021-03-17,wallstreetbets,gr9xw6q,[deleted],t3_m6wyk2,22
1616013613.0,2021-03-17,wallstreetbets,gra185i,GME gang be like - we survive another day. 😀,t3_m6wyk2,22
1615979757.0,2021-03-17,wallstreetbets,gr84lmh,Spent stimmy removing debt from my life. It’s as good as $0 if it hit my options account.,t3_m6wyk2,66
1615975429.0,2021-03-17,wallstreetbets,gr800pm,"Just woke up and found out I'm still retarded, Ill consider that a win",t3_m6wyk2,21
1615976592.0,2021-03-17,wallstreetbets,gr816g8,"CNBC hasn’t updated their GME ticker for 15 minutes.

Alright Europoors, keep your secrets.",t3_m6wyk2,23
1615978164.0,2021-03-17,wallstreetbets,gr82t6l,There is actually some data to support that a part of checks will be spent on stonks. The number of retards is growing,t3_m6wyk2,21
1615991096.0,2021-03-17,wallstreetbets,gr8n37e,If I scream shit like “GOOD HUSTLE” at my stocks like I’m a dad at a little league game will my stocks go up.,t3_m6wyk2,23
1615992366.0,2021-03-17,wallstreetbets,gr8poy4,Seriously I gotta be the worst trader possible.  Just cannot win.,t3_m6wyk2,20
1615992545.0,2021-03-17,wallstreetbets,gr8q2h2,How do I buy calls on my landlords property?,t3_m6wyk2,20
1615994590.0,2021-03-17,wallstreetbets,gr8ueoa,This game was more fun when EZ Mode was turned on. Blindly pick anything and watch it go up. Now we have to do actual research and make wise choices instead.,t3_m6wyk2,22
1615995329.0,2021-03-17,wallstreetbets,gr8w1kz,"Retards. The Fed press conference is STILL TODAY. JPOW was always going to speak tomorrow as well. 

It’s the policy meeting press conference that we are waiting for and it is still at 2 p.m. EDT today. This is when they will announce any changes.",t3_m6wyk2,22
1615996301.0,2021-03-17,wallstreetbets,gr8y831,CRSR WILL YOU JUST FUCKING STOP GOING DOWN EVERY FUCKING DAY YOU DO IT WHEN THE MARKET IS UP YOU DO IT WHEN THE MARKET IS DOWN YOU DO IT WHEN THE MARKET IS SIDEWAYS YOU JUST KEEP GOING DOWN FUCK YOU FUCK YOU FUCK YOU,t3_m6wyk2,21
1615996460.0,2021-03-17,wallstreetbets,gr8ykyo,maybe I wasn't meant to be rich after all,t3_m6wyk2,22
1615997252.0,2021-03-17,wallstreetbets,gr90de4,Don’t be scared my young bulls. I will hold you until it’s all over 🤗 then I will feed you sweet puddings and pastries and we can have a picnic in the park together.,t3_m6wyk2,20
1616000181.0,2021-03-17,wallstreetbets,gr97050,Anyone else find it impossible not to mentally read SNDL as sandal?,t3_m6wyk2,21
1616001941.0,2021-03-17,wallstreetbets,gr9ayi8,"Motley Fool is one of the worst things ever to happen to financial journalism.

You could create a fill in the blank paragraph and have a monkey pick the words and there you go, a Motley Fool article.",t3_m6wyk2,20
1616003198.0,2021-03-17,wallstreetbets,gr9dtcc,"The year is 2070.  I'm on my deathbed after handing my UWMC shares I'm still bagholding to my grandson.  I pull him close and, with my last breath, whisper, ""please hodl"".",t3_m6wyk2,21
1616006920.0,2021-03-17,wallstreetbets,gr9ma3k,[deleted],t3_m6wyk2,21
1616009191.0,2021-03-17,wallstreetbets,gr9rdth,"Its tapering off, JPow needs to fuck a muzzled bear live on stage",t3_m6wyk2,21
1615975959.0,2021-03-17,wallstreetbets,gr80jlk,AMC has commenced drilling,t3_m6wyk2,20
1615982394.0,2021-03-17,wallstreetbets,gr87z9z,"Currently holding calls on SPY, PLTR, F, GE and puts on VXX. I am fuk.",t3_m6wyk2,20
1615989443.0,2021-03-17,wallstreetbets,gr8jsy5,"Guys I’m going to be able to repair my car! I made $500+ since Monday I’m so stoked and honestly proud of myself for reading the market correctly.

Rode the wave of stimmy news with a $394c SPY, sold it yesterday and grabbed a SPY 397p for the inevitable fall, sold that this morning, and sold my PLTR $26p this morning as well.",t3_m6wyk2,20
1615989884.0,2021-03-17,wallstreetbets,gr8knw3,"when the market is rough you buy puts, when it is great you get calls....and if you time it perfectly like me all your options expire worthless",t3_m6wyk2,19
1615992147.0,2021-03-17,wallstreetbets,gr8p8ks,My portfolio has fallen and it cant get up,t3_m6wyk2,21
1615994331.0,2021-03-17,wallstreetbets,gr8tuhj,[deleted],t3_m6wyk2,19
1616002382.0,2021-03-17,wallstreetbets,gr9bysw,28min till i live under a bridge or a proper room,t3_m6wyk2,20
1616012133.0,2021-03-17,wallstreetbets,gr9xxxx,UWMC AA go 🚀🤞,t3_m6wyk2,21
1615976022.0,2021-03-17,wallstreetbets,gr80lv1,My 7 shares of GME from Biden are about to come in💸🎮,t3_m6wyk2,57
1615978937.0,2021-03-17,wallstreetbets,gr83ny6,"Buys the dip

Dip's dip immediately happens",t3_m6wyk2,19
1615990130.0,2021-03-17,wallstreetbets,gr8l59e,"Tywin Lannister : Any market which must constantly state ""There is no inflation problem"", has an inflation problem.",t3_m6wyk2,20
1615992138.0,2021-03-17,wallstreetbets,gr8p7tx,"stairs up, elevator down. wtf",t3_m6wyk2,20
1615993175.0,2021-03-17,wallstreetbets,gr8reag,"What is the fast way to turn $1,400 into $14?",t3_m6wyk2,18
1615998448.0,2021-03-17,wallstreetbets,gr932w3,I’m neither a bull or a 🌈 🐻 . I’m a retarded contrarian perpetually on the wrong side.,t3_m6wyk2,18
1616002510.0,2021-03-17,wallstreetbets,gr9c9bf,"I make $500 one day, lose 1.5k the next. Big sad",t3_m6wyk2,20
1616003346.0,2021-03-17,wallstreetbets,gr9e5k0,UWMC!  CHOO CHOO!!!!,t3_m6wyk2,19
1616008264.0,2021-03-17,wallstreetbets,gr9pb6f,JPow is deadass up there saying stonks on go up and we won’t stop printing until the peasants aren’t poor and these reporters are just absolutely baffled at the balls this man has,t3_m6wyk2,17
1616008873.0,2021-03-17,wallstreetbets,gr9qofm,AAPL really went green for 3 minutes and then said “aight ima head out” lol,t3_m6wyk2,18
1616009386.0,2021-03-17,wallstreetbets,gr9rtkz,"The year is 2029, and I'm only 1% away from breaking even on my $27.63 cost average PLTR shares",t3_m6wyk2,19
1615977304.0,2021-03-17,wallstreetbets,gr81wmj,Oh shit that stimmy hit diff,t3_m6wyk2,17
1615977561.0,2021-03-17,wallstreetbets,gr826aw,"Gotta buy this plug dip, right?",t3_m6wyk2,19
1615979649.0,2021-03-17,wallstreetbets,gr84h0g,Stimulus check hit and it’s a red open? Say no more,t3_m6wyk2,17
1615980562.0,2021-03-17,wallstreetbets,gr85kwo,"Happy St Paddy’s day everybody ☘️ 

Let’s get drunk",t3_m6wyk2,18
1615986342.0,2021-03-17,wallstreetbets,gr8e2pu,Gonna feel like a 🤡 in 25 minutes when my options update 🥳,t3_m6wyk2,18
1615988996.0,2021-03-17,wallstreetbets,gr8ixuf,"If losing money in stocks is cool, consider me Miles Davis",t3_m6wyk2,17
1615989384.0,2021-03-17,wallstreetbets,gr8jozw,Can’t wait to buy a beer and get a bj at AMC,t3_m6wyk2,17
1615989701.0,2021-03-17,wallstreetbets,gr8kb5c,**AAAANNDD MY stimmy is gone.**,t3_m6wyk2,19
1615992152.0,2021-03-17,wallstreetbets,gr8p8xo,"Daily ""fuck you PLTR"" post",t3_m6wyk2,18
1615995597.0,2021-03-17,wallstreetbets,gr8wna5,"My portfolio is so red, at least I'm sure it's not pregnant.",t3_m6wyk2,17
1615996409.0,2021-03-17,wallstreetbets,gr8ygsv,We need a bot that constantly relays JPOW speaking times so people will quit asking every 5 seconds,t3_m6wyk2,18
1615996429.0,2021-03-17,wallstreetbets,gr8yifw,Everybody that's freaking out and selling right now must not know about the massive Bull event at 2 p.m.,t3_m6wyk2,18
1615996444.0,2021-03-17,wallstreetbets,gr8yjnt,"Step 1: buy penny stock.   
Step 2: become bagholder.  
Wait",t3_m6wyk2,19
1615998997.0,2021-03-17,wallstreetbets,gr94biu,I really hope jpow starts his speech with “fuck your puts”,t3_m6wyk2,18
1616000783.0,2021-03-17,wallstreetbets,gr98cto,"Volkswagen: “Electric.......vehicles.....”

*70% GAIN*",t3_m6wyk2,17
1616001389.0,2021-03-17,wallstreetbets,gr99pn2,Stimmy here. Aaaaaaaand it’s gone,t3_m6wyk2,17
1616001613.0,2021-03-17,wallstreetbets,gr9a7i8,[deleted],t3_m6wyk2,17
1616002931.0,2021-03-17,wallstreetbets,gr9d7ni,ROPE HERE! Get your ROPE HERE!,t3_m6wyk2,17
1616003334.0,2021-03-17,wallstreetbets,gr9e4kd,Woah UWMC doin the thing,t3_m6wyk2,18
1616003420.0,2021-03-17,wallstreetbets,gr9ebow,is this the UWMC squeeze?,t3_m6wyk2,17
1616004968.0,2021-03-17,wallstreetbets,gr9hvi3,My entire watchlist flipped from red to green in a matter of minutes,t3_m6wyk2,18
1616005276.0,2021-03-17,wallstreetbets,gr9ikgy,Tomorrow is gonna be so fucking green,t3_m6wyk2,19
1616009558.0,2021-03-17,wallstreetbets,gr9s7mg,"In conclusion of today’s FED Conference: 

BEARS R FUK",t3_m6wyk2,18
1616011581.0,2021-03-17,wallstreetbets,gr9wq76,Who else went from negative 10% to postive 6% by EOD?,t3_m6wyk2,19
1616012165.0,2021-03-17,wallstreetbets,gr9y0jk,UWMC having a real run here...,t3_m6wyk2,20
1615975947.0,2021-03-17,wallstreetbets,gr80j6u,Can someone turn easy mode back on,t3_m6wyk2,16
1615977536.0,2021-03-17,wallstreetbets,gr825ds,My wife and my stimmy both hit my account. Looks like we didn’t qualify honey 🤷‍♀️,t3_m6wyk2,16
1615978606.0,2021-03-17,wallstreetbets,gr83ai3,*<scratching himself>* Y'all got any more of those +20-50% premarket sessions?,t3_m6wyk2,18
1615980987.0,2021-03-17,wallstreetbets,gr86441,OPEN THE CASINO. So I can stop the bleeding,t3_m6wyk2,18
1615981312.0,2021-03-17,wallstreetbets,gr86j7d,"Chase is now showing me... IRS Treas 310 CO Entry Desc: $1,400

$TIMMAY!!!!",t3_m6wyk2,16
1615983005.0,2021-03-17,wallstreetbets,gr88tww,Jesus do people expect JPow to say that stocks are fake,t3_m6wyk2,17
1615983987.0,2021-03-17,wallstreetbets,gr8a9ym,Jim Cramer gets in the bath before he runs it.,t3_m6wyk2,18
1615986388.0,2021-03-17,wallstreetbets,gr8e5kg,This market is so fucking annoying,t3_m6wyk2,17
1615986732.0,2021-03-17,wallstreetbets,gr8er0s,"Hey seriously, happy St. Patrick’s Day to everyone! May we have good fortune and make fat stacks today!!",t3_m6wyk2,17
1615986838.0,2021-03-17,wallstreetbets,gr8exuv,"Honestly, at this point, if I'd just inverse myself I'd be making a lot of money.",t3_m6wyk2,17
1615988563.0,2021-03-17,wallstreetbets,gr8i3qg,My stimmy came...and it’s gone. Gonna need another one Joeboy,t3_m6wyk2,17
1615990654.0,2021-03-17,wallstreetbets,gr8m6uy,HE SPEAKS AT 2PM EST STOP SPAMMING THE QUESTION,t3_m6wyk2,15
1615993729.0,2021-03-17,wallstreetbets,gr8sk1n,Stimmy = invested and lost all in one morning,t3_m6wyk2,18
1615996425.0,2021-03-17,wallstreetbets,gr8yi4v,"CRSR has to be the most disappointing pile of shit stock I've ever purchased. Every expert analyst out there a few weeks ago like ""under 40$ is an absolute steal"" can suck my wife's boyfriend's balls.",t3_m6wyk2,17
1615996550.0,2021-03-17,wallstreetbets,gr8ys7s,Only need one 8 bagger to break even,t3_m6wyk2,17
1616000552.0,2021-03-17,wallstreetbets,gr97ucw,"None of you need to watch powell later, I know how it goes: 

person A: I'm shit scared about inflation. 

Person B: Me too.

Powell: Don't worry, I've got got a tool in toolbox that'll fix that",t3_m6wyk2,17
1616000862.0,2021-03-17,wallstreetbets,gr98j36,"Upvote if you trade at your desk 
Do our bosses hate us?",t3_m6wyk2,18
1616002519.0,2021-03-17,wallstreetbets,gr9c9z6,What do you guys think would happen to the market if JPow took out a fat joint and started blazing,t3_m6wyk2,16
1616003324.0,2021-03-17,wallstreetbets,gr9e3rl,12 minutes until calls go on discount.,t3_m6wyk2,17
1616003433.0,2021-03-17,wallstreetbets,gr9ecs5,"UWMC on it's way up. With it's inclusion in the Russell 1000 and Russell 2000 indices next week and recent price suppression from short sellers, I think this stonk is going up.",t3_m6wyk2,18
1616003454.0,2021-03-17,wallstreetbets,gr9eejh,Doth UWMC squeezeth at this hour?,t3_m6wyk2,16
1616003646.0,2021-03-17,wallstreetbets,gr9eu6f,"Bought PLTR at $30? *check*

Bought ARKK at $130? *check*

Bought ARKG at $104? *check*

Save me",t3_m6wyk2,18
1616004580.0,2021-03-17,wallstreetbets,gr9gzfv,BREAKING: jpow slams cock down on table and walks out of room,t3_m6wyk2,15
1616005253.0,2021-03-17,wallstreetbets,gr9iil1,That was JPOW testing the new printer,t3_m6wyk2,18
1616007257.0,2021-03-17,wallstreetbets,gr9n1lh,"Raise your hand if you stuck out fat losses this morning to be green now

🙋",t3_m6wyk2,18
1616008353.0,2021-03-17,wallstreetbets,gr9pig4,$TSLA 700 boring AF.  either go back to 850 or drop to 500.,t3_m6wyk2,17
1616008395.0,2021-03-17,wallstreetbets,gr9plqj,Not to get *too* political but Jerome Powell was objectively the best nomination that came out of the Trump administration.,t3_m6wyk2,17
1616008923.0,2021-03-17,wallstreetbets,gr9qsf2,"UWMC, it’s time for lift off! 🚀 🚀 🚀",t3_m6wyk2,15
1616009767.0,2021-03-17,wallstreetbets,gr9so99,This is a bear extinction event lmao,t3_m6wyk2,17
1616010150.0,2021-03-17,wallstreetbets,gr9tivf,"fuking pltr, join the fuckin party already🤦‍♀️",t3_m6wyk2,17
