created,date,subreddit,id,body,parent_id,score
1581351558.0,2020-02-10,wallstreetbets,fh841oy,Every week I tell myself not to buy into the mouse yet here we are again with Micky eating my ass,t3_f1osqm,8
1581351897.0,2020-02-10,wallstreetbets,fh84l0w,[deleted],t3_f1osqm,8
1581351940.0,2020-02-10,wallstreetbets,fh84nio,Today I used the buy high sell low strat. Thank you TSLA for showing me how autistic I am,t3_f1osqm,9
1581351949.0,2020-02-10,wallstreetbets,fh84o0b,Just saw a car flipped over in the middle of the road. Buy $SPY calls.,t3_f1osqm,7
1581352376.0,2020-02-10,wallstreetbets,fh85ci1,"Congrats to all my fellow SPCE holders! Not too late to get aboard the ship for those on the fence but nice fast.

Financials are coming up soon and big announcements will be dropped about the i
Start of commercial flights this summer",t3_f1osqm,8
1581352623.0,2020-02-10,wallstreetbets,fh85qie,"MSFT, baby, you take us to 200 by March, I'll go out and buy you anything you want.",t3_f1osqm,9
1581352887.0,2020-02-10,wallstreetbets,fh865m0,""" 36 Wall Street analysts have issued ratings and price targets for Tesla in the last 12 months. Their average twelve-month price target is $427.41, suggesting that the stock has a possible downside of 43.39%.""

Even the analysts wanna get in on the $420 shit.",t3_f1osqm,7
1581354453.0,2020-02-10,wallstreetbets,fh88nyy,What if... SPY closes... 330... haha... just kidding... unless...?,t3_f1osqm,8
1581354843.0,2020-02-10,wallstreetbets,fh89anp,My 2022 Msft leaps are already in the money.,t3_f1osqm,8
1581355751.0,2020-02-10,wallstreetbets,fh8ark4,Where 👏 are 👏 my 👏 tax 👏 docs 👏,t3_f1osqm,9
1581355758.0,2020-02-10,wallstreetbets,fh8arya,up 70% on my SPCE calls . Ima hold these bitches,t3_f1osqm,7
1581355902.0,2020-02-10,wallstreetbets,fh8b0fh,"Today is just the confidence test after the Friday sell off. Green today, bigly green tomorrow. Green Wednesday. Flat Thursday. Sell Friday.",t3_f1osqm,7
1581356787.0,2020-02-10,wallstreetbets,fh8cgdq,wtf is this contest shit,t3_f1osqm,8
1581356983.0,2020-02-10,wallstreetbets,fh8crw4,This contest mode is gay,t3_f1osqm,8
1581362754.0,2020-02-10,wallstreetbets,fh8mar7,Contest mode was big 🏳️‍🌈 now back to your regularly scheduled program to the moon 🌝,t3_f1osqm,8
1581362757.0,2020-02-10,wallstreetbets,fh8mb00,Contest mode is GAAAAAAAY,t3_f1osqm,9
1581363384.0,2020-02-10,wallstreetbets,fh8nc8x,[deleted],t3_f1osqm,7
1581364930.0,2020-02-10,wallstreetbets,fh8px0m,MSFT TO THE MOON 🚀🌝,t3_f1osqm,8
1581364994.0,2020-02-10,wallstreetbets,fh8q0v7,I would like to thank WSB for pumping MSFT as it is the majority of my buy and hold account that offsets my thousands of losses playing options,t3_f1osqm,8
1581365380.0,2020-02-10,wallstreetbets,fh8qo1g,"I’m convinced we’re moving the bots with our $MSFT calls








Let’s do this on another ticker 🤔",t3_f1osqm,8
1581365677.0,2020-02-10,wallstreetbets,fh8r5vy,god damn i guess the stocks really do go only up,t3_f1osqm,8
1581366075.0,2020-02-10,wallstreetbets,fh8ru3s,Up 2.6k on my Microsoft calls again. These are long term. I'm holding these for another month,t3_f1osqm,8
1581366259.0,2020-02-10,wallstreetbets,fh8s5lf,"MSFT 188 EOD

Edit: YES BBY",t3_f1osqm,8
1581366277.0,2020-02-10,wallstreetbets,fh8s6pe,MSFT has offset so many of my retarded plays in one fell swoop today. I love you MSFT.,t3_f1osqm,7
1581366470.0,2020-02-10,wallstreetbets,fh8sik4,I need to stop playing with small money. Fuck these 1-2 contract buys that end up mooning,t3_f1osqm,7
1581366628.0,2020-02-10,wallstreetbets,fh8sse7,Bearish TA on MSFT right now. I'd get out of any 2/14 calls you may have,t3_f1osqm,7
1581366687.0,2020-02-10,wallstreetbets,fh8svww,"MSFT is on some insane shit, lets fuckin goooo",t3_f1osqm,9
1581367353.0,2020-02-10,wallstreetbets,fh8u0nx,"I'm now 100% confident the stock market is being artificially propped up by the Fed, Donald Trump, the Jews, and the Freemasons.",t3_f1osqm,8
1581367411.0,2020-02-10,wallstreetbets,fh8u4a6,#MACROHARD STRAIGHT TO 200,t3_f1osqm,7
1581367720.0,2020-02-10,wallstreetbets,fh8un5l,"Up $5,000 for the day on MSFT calls lol",t3_f1osqm,8
1581367944.0,2020-02-10,wallstreetbets,fh8v10t,"Now 6% down on MSFT puts.

Mudder pucker",t3_f1osqm,8
1581368250.0,2020-02-10,wallstreetbets,fh8vk4h,If you're not buying MSFT right now you're a fucking idiot.  Coming from a fucking moron,t3_f1osqm,8
1581368569.0,2020-02-10,wallstreetbets,fh8w3k6,Sold everything. I made today more than I made all time. Just wish tomorrow gives me more entry points.,t3_f1osqm,9
1581368712.0,2020-02-10,wallstreetbets,fh8wc6c,"MSFT in my heart it was always you, AAPL was just a phase in my teen years.",t3_f1osqm,6
1581370016.0,2020-02-10,wallstreetbets,fh8yk6i,"Microsoft mooning got me feeling some type of way, might fuck around and buy a Zune",t3_f1osqm,9
1581371009.0,2020-02-10,wallstreetbets,fh908z0,"https://i.imgur.com/LP4fsfo.jpg

Thanks MSFT",t3_f1osqm,7
1581339028.0,2020-02-10,wallstreetbets,fh7ndpp,"What WORK feels like to me 

=== =====

""Push that refridgerator up that mountain"" says the fat man with the cigar in his mouth.  ""I'll give you fifty dollars if you do.""

The mountain is steep, covered with ice and slippery.  By the side of the path up the mountain are countless dead bodies, thousands of them.  Crushed by the very refridgerator they were pushing. 

The rumor is, rich people at the top of the mountain will pay a thousand dollars for a delivered refridgerator.  But they can't get it up there by themselves.  The fat man with the cigar wants me to push it up there, then he'll pay me fifty and he will keep $950.

That's WORK.",t3_f1osqm,15
1581340469.0,2020-02-10,wallstreetbets,fh7owom,"*puts on tinfoil hat*

The Forbes TESLA article is a pump by institutional money to offload shares on retail.",t3_f1osqm,14
1581336469.0,2020-02-10,wallstreetbets,fh7kvmx,"TSLA might be the new safe haven instead of gold.  Every time the market is red, this mofo gains 10%.  

“I hedged my spy calls with TSLA calls”

Smart move.",t3_f1osqm,21
1581332794.0,2020-02-10,wallstreetbets,fh7hz55,If SPY could have a 3% day that would be awesome,t3_f1osqm,13
1581344347.0,2020-02-10,wallstreetbets,fh7tkdr,[deleted],t3_f1osqm,14
1581351615.0,2020-02-10,wallstreetbets,fh844za,"The market goes up every day, ignoring the virus news, but once they announce that they found a cure, it will jump another 5-6% in a week as if it was holding back because of the virus.",t3_f1osqm,15
1581352921.0,2020-02-10,wallstreetbets,fh867ma,"ate 2 pounds of shrimp yesterday, only 1k calories and delicious as fuck",t3_f1osqm,15
1581332909.0,2020-02-10,wallstreetbets,fh7i24c,TSLA is free money again yo,t3_f1osqm,7
1581333070.0,2020-02-10,wallstreetbets,fh7i672,Bull all day baby.,t3_f1osqm,6
1581336469.0,2020-02-10,wallstreetbets,fh7kvm5,I declare this market fraudulent.,t3_f1osqm,6
1581336729.0,2020-02-10,wallstreetbets,fh7l43i,Here is to another week of Tesla $1000c expiring worthless because of FOMO,t3_f1osqm,6
1581337160.0,2020-02-10,wallstreetbets,fh7li8l,"Man, I unironically think UBER is a great play for a while.",t3_f1osqm,6
1581338011.0,2020-02-10,wallstreetbets,fh7md1u,Holy I put my last 15 k on Feb 14 775 calls on Friday calls thank god,t3_f1osqm,6
1581338831.0,2020-02-10,wallstreetbets,fh7n6l0,we mooning on MSFT today!,t3_f1osqm,8
1581339479.0,2020-02-10,wallstreetbets,fh7nuhw,"**If you are not buying baba calls at open, it means you hate money**",t3_f1osqm,7
1581339591.0,2020-02-10,wallstreetbets,fh7nyt3,[deleted],t3_f1osqm,7
1581339835.0,2020-02-10,wallstreetbets,fh7o86r,[deleted],t3_f1osqm,7
1581340193.0,2020-02-10,wallstreetbets,fh7olvp,"I Wana believe tesla is up cause I mailed CNBC before I slept about the guys blog that the tesla factory was up and running again


~~~~~~~~~~~~~~~~~~~~~~~~~~~~~~~~~~~~~~

Zandra (CNBC)

Feb 10, 2:41 AM EST

Hi *****

Thanks for contacting CNBC Customer Care.

While we are not able to put you in direct contact with our editors or producers, CNBC welcomes all idea submissions and feedback. We will forward your message to the team for review, and they will be in touch directly if they require additional information.

Don't hesitate to reach out with any other questions or comments.
Hope you have a great rest of the day!

Sincerely,
Zandra
CNBC Customer Care
customercare@cnbc.com",t3_f1osqm,6
1581341474.0,2020-02-10,wallstreetbets,fh7q12q,   **China Steals US Wine Industry as Tariffs Take Their Toll According to U.S. Wine Trade Alliance**,t3_f1osqm,6
1581341764.0,2020-02-10,wallstreetbets,fh7qda2,1000 weeklies on TSLA I need to make rent,t3_f1osqm,6
1581342035.0,2020-02-10,wallstreetbets,fh7qoyv,"1.5k comments 45 min pre market open, nice",t3_f1osqm,7
1581342910.0,2020-02-10,wallstreetbets,fh7rr5e,[deleted],t3_f1osqm,7
1581343559.0,2020-02-10,wallstreetbets,fh7skg4,Lmao @ TSLA. The show goes on!,t3_f1osqm,8
1581343600.0,2020-02-10,wallstreetbets,fh7sm9e,TSLA????,t3_f1osqm,8
1581343702.0,2020-02-10,wallstreetbets,fh7sqyn,Are they still opening the Tesla Shanghai factory today like they were supposed to ?,t3_f1osqm,7
1581343947.0,2020-02-10,wallstreetbets,fh7t22j,Anyone else still holding TWTR puts from last week? 💎🤙🏻,t3_f1osqm,9
1581344019.0,2020-02-10,wallstreetbets,fh7t5e8,"how do crosswords work? 
5 letters
> the plate appearance in baseball",t3_f1osqm,7
1581344385.0,2020-02-10,wallstreetbets,fh7tm8k,I GUHed when I opened rh,t3_f1osqm,8
1581344624.0,2020-02-10,wallstreetbets,fh7txh7,[deleted],t3_f1osqm,7
1581346046.0,2020-02-10,wallstreetbets,fh7vtvl,[deleted],t3_f1osqm,8
1581346365.0,2020-02-10,wallstreetbets,fh7w9ql,Bill Gates is literally giving out free money via MSFT calls,t3_f1osqm,7
1581346409.0,2020-02-10,wallstreetbets,fh7wbww,AMD you make it to $53 I post a nude,t3_f1osqm,7
1581347055.0,2020-02-10,wallstreetbets,fh7x8n9,Tesla was at 750 on Friday and people are complaining that it’s at 790 right now. Anyone who complains isn’t making money or is a broke af wanna be bear.,t3_f1osqm,7
1581347600.0,2020-02-10,wallstreetbets,fh7y0s8,200c gonna printtttttt,t3_f1osqm,7
1581347883.0,2020-02-10,wallstreetbets,fh7yfj1,[deleted],t3_f1osqm,6
1581348008.0,2020-02-10,wallstreetbets,fh7ym4j,"MSFT 2/28 190c

Hold? +81% overall",t3_f1osqm,7
1581348045.0,2020-02-10,wallstreetbets,fh7yo52,[deleted],t3_f1osqm,7
1581348398.0,2020-02-10,wallstreetbets,fh7z6wr,Made enough this morning that I can just check out early today and play Xbox out of reverence for the big Microsoft,t3_f1osqm,8
1581348543.0,2020-02-10,wallstreetbets,fh7zesp,What the actual fuck MSFT,t3_f1osqm,7
1581348622.0,2020-02-10,wallstreetbets,fh7zj1o,MSFT is about to give me a fucking paycheck in one day.,t3_f1osqm,6
1581348666.0,2020-02-10,wallstreetbets,fh7zlem,Guys serious question. Where is spce going wow?,t3_f1osqm,7
1581348714.0,2020-02-10,wallstreetbets,fh7znyi,52 Week high for $MSFT ☝🏼,t3_f1osqm,7
1581348728.0,2020-02-10,wallstreetbets,fh7zorg,Go Microsoft!,t3_f1osqm,8
1581348854.0,2020-02-10,wallstreetbets,fh7zvi5,Msft tendies taste so good.,t3_f1osqm,6
1581348855.0,2020-02-10,wallstreetbets,fh7zvjv,msft carrying the team on it's back,t3_f1osqm,7
1581349019.0,2020-02-10,wallstreetbets,fh804bd,"Friendship ended with Timmy Apple (until the virus is over)

Michael Software is my new best friend",t3_f1osqm,7
1581349098.0,2020-02-10,wallstreetbets,fh808ov,Imagine not dumping all liquid assets into MSFT calls,t3_f1osqm,7
1581349536.0,2020-02-10,wallstreetbets,fh80wqc,I haven't made a single correct move in over a month. What. The. Fuck.,t3_f1osqm,7
1581349616.0,2020-02-10,wallstreetbets,fh8114m,Up 30%.  Took profits an hour and fifteen minutes into the day.  Time to smack my junk around.,t3_f1osqm,7
1581349731.0,2020-02-10,wallstreetbets,fh817go,"Up 200% on my MSFT 2/28 187.5 calls and not even thinking about selling. 

10 bagger or nothing 💎🤚",t3_f1osqm,7
1581349889.0,2020-02-10,wallstreetbets,fh81g89,On track for my portfolio to hit +200% today 🌝,t3_f1osqm,6
1581350216.0,2020-02-10,wallstreetbets,fh81yfc,"Do not ask for whom is fuk, for whomst fuk is thee",t3_f1osqm,7
1581350260.0,2020-02-10,wallstreetbets,fh820un,TSLA dots turning greens. Volume is slowly picking up. Lets see,t3_f1osqm,7
1581350414.0,2020-02-10,wallstreetbets,fh829fi,"It’s actually kind of impressive that I’m able to buy at the top so consistently. 

Maybe I should just buy puts when I feel like buying calls",t3_f1osqm,6
1581350778.0,2020-02-10,wallstreetbets,fh82ts2,[deleted],t3_f1osqm,8
1581350860.0,2020-02-10,wallstreetbets,fh82ygu,Down on my AAPL puts. Down on my AAPL calls.,t3_f1osqm,7
1581350988.0,2020-02-10,wallstreetbets,fh835fk,Imagine not owning $NVDA calls right now.,t3_f1osqm,7
1581351559.0,2020-02-10,wallstreetbets,fh841qa,Thank you MSFT and TQQQ. 😘,t3_f1osqm,6
1581351751.0,2020-02-10,wallstreetbets,fh84cnm,I was told on Friday there would be a recession,t3_f1osqm,7
1581351786.0,2020-02-10,wallstreetbets,fh84en6,"Microsoft 195 & 200 2/28c

Literally cant go wrong",t3_f1osqm,6
1581351797.0,2020-02-10,wallstreetbets,fh84f9u,"This TSLA stock will be the death of me, I swear to God...",t3_f1osqm,7
1581351879.0,2020-02-10,wallstreetbets,fh84jzi,"I hate it when you take two positions, and the larger one ends up losing and the smaller position ends up doubling, but it is still not enough to cancel out the larger loss of the main position.",t3_f1osqm,7
1581352040.0,2020-02-10,wallstreetbets,fh84t7n,Have had a rough month with options but we back https://i.imgur.com/Odq3ByN.jpg,t3_f1osqm,8
1581352145.0,2020-02-10,wallstreetbets,fh84z8u,SPCE CONNECCTTT!!!!,t3_f1osqm,7
1581352148.0,2020-02-10,wallstreetbets,fh84zdi,$SPCE to MOON,t3_f1osqm,8
1581352166.0,2020-02-10,wallstreetbets,fh850gk,Wtf SPCE!!@!!!!!!,t3_f1osqm,7
1581352417.0,2020-02-10,wallstreetbets,fh85evv,I sold my MSFT calls... to buy more MSFT calls,t3_f1osqm,7
1581352422.0,2020-02-10,wallstreetbets,fh85f6g,HOLY SHIT SPCE JUST PULLED A JORDAN BELFORT AND SAID IM NOT FUCKING LEAVING,t3_f1osqm,7
1581352673.0,2020-02-10,wallstreetbets,fh85tdq,The amount of people going on about the JEDI contract being the catalyst here is fucking hilarious. I know we meme about shit being priced in but that happened in like fucking October lmao,t3_f1osqm,7
1581352798.0,2020-02-10,wallstreetbets,fh860km,Probably should have held my SPCE calls longer but it’s hard to not take 80% gains ☺️,t3_f1osqm,6
1581353083.0,2020-02-10,wallstreetbets,fh86gu3,SPCE SPCE SPCE SPCE,t3_f1osqm,7
1581353169.0,2020-02-10,wallstreetbets,fh86ltj,MSFT calls: even a retard like me can do it™️,t3_f1osqm,6
1581353178.0,2020-02-10,wallstreetbets,fh86me8,"MSFT battling at 187 today. Probably closing 186 or a little less. Recharging for the rocket up. Ending week at 192, based on fucking nothing",t3_f1osqm,7
1581353573.0,2020-02-10,wallstreetbets,fh8791q,"Might be a fake rally. Oil prices still down/ flat. VIX is barely down.

Dangerous times to speculate on the market. Everyone knows it should dip but everyone knows to buy the dip. Perfect paradox.",t3_f1osqm,7
1581353640.0,2020-02-10,wallstreetbets,fh87cwz,"Go my lil' NOK, you got this",t3_f1osqm,7
1581354202.0,2020-02-10,wallstreetbets,fh889c9,No one ever lost money FOMOing,t3_f1osqm,6
1581354445.0,2020-02-10,wallstreetbets,fh88nhl,"As fortold, I caught the TSLA knife, didn't practice risk management and lost $800.",t3_f1osqm,7
1581354500.0,2020-02-10,wallstreetbets,fh88qp4,AMD is soaring,t3_f1osqm,8
1581354532.0,2020-02-10,wallstreetbets,fh88sk4,"Looks like markets are just waiting for some catalyst. No moves in any direction. I think the budgets probably priced in already and all eyes are instead on Powell tomorrow. If he even hints at potentially lowering rates because of corona, we're going to the stratosphere. Stay the course and we stay flat or dip.",t3_f1osqm,8
1581354676.0,2020-02-10,wallstreetbets,fh890ub,The more I read about SPCE the more I become fully torqued. Shit has a chance to go to the moon...literally.,t3_f1osqm,8
1581354712.0,2020-02-10,wallstreetbets,fh892yf,dont doubt ur vibe,t3_f1osqm,6
1581354867.0,2020-02-10,wallstreetbets,fh89c3i,"Never bet against China, they don't have to play by the rules.

https://i.imgur.com/SUB6FNa.png

I'm gonna stop buying ASHR and FXI puts...",t3_f1osqm,8
1581354868.0,2020-02-10,wallstreetbets,fh89c65,"i dont understand how MMM and HON aren't through the roof right now, given the fact that the virus containment has basically failed.",t3_f1osqm,6
1581355317.0,2020-02-10,wallstreetbets,fh8a28g,"Trump calling out EU, means new ATH this week. Time to buy $0.01 contracts and flip them for $.02  $$$$$$$$$$$$$",t3_f1osqm,7
1581355380.0,2020-02-10,wallstreetbets,fh8a5ut,"So glad we are running another paper trading competition. For all the new people, it’s a great way to practice and refine your strategies!",t3_f1osqm,6
1581355524.0,2020-02-10,wallstreetbets,fh8ae95,TSLA casually drop 50 points while I nap. Nice,t3_f1osqm,6
1581355625.0,2020-02-10,wallstreetbets,fh8ak8p,WRONG WAY TWITTER,t3_f1osqm,8
1581356149.0,2020-02-10,wallstreetbets,fh8bexz,what dumbfuck keeps putting this in contest mode,t3_f1osqm,8
1581356494.0,2020-02-10,wallstreetbets,fh8bz4p,Contest mode is retarded and worthless,t3_f1osqm,7
1581358221.0,2020-02-10,wallstreetbets,fh8et4c,Mods turn this stupid ass contest mode off 🙄🙄🙄,t3_f1osqm,7
1581358430.0,2020-02-10,wallstreetbets,fh8f5mf,WTF is contest mode.,t3_f1osqm,7
1581362760.0,2020-02-10,wallstreetbets,fh8mb5n,Gay mod made this in contest mode,t3_f1osqm,7
1581362783.0,2020-02-10,wallstreetbets,fh8mcin,"Finally out of contest, I miss you retards",t3_f1osqm,6
1581363360.0,2020-02-10,wallstreetbets,fh8nava,"Thank you mods for turning off contest mode.

Fuckers left it on in my post though.",t3_f1osqm,5
1581363981.0,2020-02-10,wallstreetbets,fh8obwg,MSFT break 187 plz,t3_f1osqm,8
1581364153.0,2020-02-10,wallstreetbets,fh8omav,That hard realization that the big short is a movie that will never be your life,t3_f1osqm,8
1581364488.0,2020-02-10,wallstreetbets,fh8p6f8,"Ok MSFT, 4th time is the charm",t3_f1osqm,7
1581364796.0,2020-02-10,wallstreetbets,fh8poy7,MSFT power hour,t3_f1osqm,8
1581364941.0,2020-02-10,wallstreetbets,fh8pxpu,MSFT YESS,t3_f1osqm,7
1581364960.0,2020-02-10,wallstreetbets,fh8pyv9,I. DON'T. UNDERSTAND. THIS. MARKET.,t3_f1osqm,7
1581365259.0,2020-02-10,wallstreetbets,fh8qglz,[deleted],t3_f1osqm,8
1581365299.0,2020-02-10,wallstreetbets,fh8qj3s,"gUyS...  iM aT 500% pRoFiT on MsFt

&#x200B;

do i sell or hold for 1000000000000000000%",t3_f1osqm,8
1581365661.0,2020-02-10,wallstreetbets,fh8r4ws,Can’t wait to get my kids into options trading in the future,t3_f1osqm,6
1581366021.0,2020-02-10,wallstreetbets,fh8rqw8,"I hate being a 🌈🧸🌈 at 💖

🤢🤮🤮🤮🤮",t3_f1osqm,7
1581366069.0,2020-02-10,wallstreetbets,fh8rts6,I'm done trying to be a bear. All I'm getting is claws in my asshole,t3_f1osqm,8
1581366233.0,2020-02-10,wallstreetbets,fh8s3yp,Tungsten hands if you hold Microsoft calls,t3_f1osqm,8
1581366388.0,2020-02-10,wallstreetbets,fh8sdlh,"Apple themselves: ""Our manufacturing supply chain is going to be heavily affected by the virus, as well as possible iPhone demand in China""

The market: Continues to buy the fuck out of Apple stock at 99 RSI",t3_f1osqm,8
1581366800.0,2020-02-10,wallstreetbets,fh8t2un,"WSB is top growing community. Prepare for an onslaught of ""errr what are options?""",t3_f1osqm,7
1581366852.0,2020-02-10,wallstreetbets,fh8t60b,[deleted],t3_f1osqm,7
1581366929.0,2020-02-10,wallstreetbets,fh8tapl,MSFT $188 💦💦💦,t3_f1osqm,7
1581366939.0,2020-02-10,wallstreetbets,fh8tbch,MSFT just touched 188,t3_f1osqm,9
1581367005.0,2020-02-10,wallstreetbets,fh8tffb,I hate these Forex homos I see on instagram... like ok weirdo,t3_f1osqm,7
1581367011.0,2020-02-10,wallstreetbets,fh8tfte,msft 200 eow,t3_f1osqm,7
1581367120.0,2020-02-10,wallstreetbets,fh8tmh5,The guy who promised sex to the mods if MSFT ended the day at $188 is getting excited.,t3_f1osqm,7
1581367330.0,2020-02-10,wallstreetbets,fh8tzc1,It's honestly unbelievable how the stocks I own are completely missing out on this rally. Fuck me I literally cannot catch a break,t3_f1osqm,7
1581367464.0,2020-02-10,wallstreetbets,fh8u7ig,imagine not buying msft this morning,t3_f1osqm,7
1581367538.0,2020-02-10,wallstreetbets,fh8ubzc,Microsoft just butt chugging bang energy drinks at running at walls,t3_f1osqm,7
1581367620.0,2020-02-10,wallstreetbets,fh8uh14,Whoever suggested FXI and ASHR puts a week or two back just know I sincerely hate you 😚,t3_f1osqm,5
1581367863.0,2020-02-10,wallstreetbets,fh8uw35,"Holding Microsoft till morning, a test of my willpower 🙏🏿🙏🏿",t3_f1osqm,8
1581368041.0,2020-02-10,wallstreetbets,fh8v749,The MSFT FOMO is WAY too real,t3_f1osqm,6
1581368244.0,2020-02-10,wallstreetbets,fh8vjrs,MSFT reallly testin my balls holding this 2/14 190c,t3_f1osqm,5
1581368589.0,2020-02-10,wallstreetbets,fh8w4rx,Remember when people said today would be red. Something about Gyna and winnie,t3_f1osqm,8
1581369237.0,2020-02-10,wallstreetbets,fh8x8n0,"This market is some serious 5th standard deviation above average shit. Nothing about this is normal. 

The amount of new people coming into the market is NOT a bullish indicator. The fact that we've got every possible stimulating trigger pulled just to pump ourselves to ATH after ATH is also very concerning. 

I'm not sure when the music is going to stop, but when it does, it's going to be fucking devastating.",t3_f1osqm,7
1581371306.0,2020-02-10,wallstreetbets,fh90r0x,"Sold my same day TSLA lol-calls at 1880c for modest profit.

Still riding MSFT 4/17 200c to the goddamn moon.",t3_f1osqm,8
1581373305.0,2020-02-10,wallstreetbets,fh94m4g,[deleted],t3_f1osqm,7
1581338658.0,2020-02-10,wallstreetbets,fh7n09r,About to yolo 10k on tsla 1000c’s at open wish me luck,t3_f1osqm,14
1581341299.0,2020-02-10,wallstreetbets,fh7ptuy,WSB is the #1 top growing community on reddit,t3_f1osqm,13
1581367293.0,2020-02-10,wallstreetbets,fh8twz2,Buy MSFT calls. I use excel everyday for work,t3_f1osqm,13
1581368449.0,2020-02-10,wallstreetbets,fh8vw89,"And just like that, I had a $11.5k day 😎💸",t3_f1osqm,13
1581337252.0,2020-02-10,wallstreetbets,fh7lmim,Please Tesla I promise if you have another parabolic run I’ll cash out at 50k gains and wont get greedy for 100k,t3_f1osqm,11
1581332815.0,2020-02-10,wallstreetbets,fh7hzp2,TSLA calls yay or neigh? 800 within 2 hours of open I reckon.,t3_f1osqm,6
1581333953.0,2020-02-10,wallstreetbets,fh7its1,"Beijing and Shanghai can lock down and barricade whatever they want, but TSLA is out here stunting on them all! 🚀",t3_f1osqm,5
1581335048.0,2020-02-10,wallstreetbets,fh7jojw,Has there ever been in the history of stocks... a double parabolic move?! 🚀🚀🚀,t3_f1osqm,6
1581335645.0,2020-02-10,wallstreetbets,fh7k61i,Who’s buying TSLA calls at open?,t3_f1osqm,6
1581336525.0,2020-02-10,wallstreetbets,fh7kxga,Alright tsla bros you know the saying “It DoEsNt MaTtER TiL 9:30”,t3_f1osqm,5
1581337235.0,2020-02-10,wallstreetbets,fh7llpb,TSLA back on they ol' bullshit,t3_f1osqm,6
1581337561.0,2020-02-10,wallstreetbets,fh7lx9i,Everything in my body is telling me not to yolo on tsla calls...what do I do??,t3_f1osqm,6
1581340109.0,2020-02-10,wallstreetbets,fh7oiog,I'm just gonna go cash gain for a while. This market rn is to sp00py for me,t3_f1osqm,7
1581340383.0,2020-02-10,wallstreetbets,fh7otc6,"Okay market, I'm ready to be hurt again. Do your worst 😈",t3_f1osqm,5
1581341099.0,2020-02-10,wallstreetbets,fh7plo3,Lmao Tesla making big dick premarket moves,t3_f1osqm,5
1581341200.0,2020-02-10,wallstreetbets,fh7ppr1,Paper trading competition 😈,t3_f1osqm,6
1581341603.0,2020-02-10,wallstreetbets,fh7q6ir,Last day on PDT restriction. It's been a long 90 days boys,t3_f1osqm,7
1581342249.0,2020-02-10,wallstreetbets,fh7qy97,BABA 6/3 230c 🤔📈,t3_f1osqm,6
1581342284.0,2020-02-10,wallstreetbets,fh7qzrz,Should I go all in on Microsoft calls?,t3_f1osqm,5
1581342499.0,2020-02-10,wallstreetbets,fh7r95h,"Visa is gonna fuck me again today, stocks are supposed to go up, not flop around like a Magikarp.",t3_f1osqm,5
1581342517.0,2020-02-10,wallstreetbets,fh7r9ys,People hating on Tesla comments just sour they didn’t get in even after they had their second chance,t3_f1osqm,6
1581342538.0,2020-02-10,wallstreetbets,fh7rawt,AMZN is the move today,t3_f1osqm,6
1581342766.0,2020-02-10,wallstreetbets,fh7rkqc,GO SPCE!!!!,t3_f1osqm,6
1581343243.0,2020-02-10,wallstreetbets,fh7s65k,"Lmao like 3rd / 4th time the bonds inverted???

“NOTHING TO SEE HERE FOLKS” - Powell to the Senate",t3_f1osqm,6
1581343492.0,2020-02-10,wallstreetbets,fh7shet,9:30 my account flashes red by a few k.  Thanks Tim and SPY ceo,t3_f1osqm,6
1581343622.0,2020-02-10,wallstreetbets,fh7snae,Daddy motherfucking Musk is killing it again.,t3_f1osqm,5
1581343714.0,2020-02-10,wallstreetbets,fh7srgk,i forgot what the color green looks like in my robinhood app,t3_f1osqm,6
1581343831.0,2020-02-10,wallstreetbets,fh7swsr,Futures undecided all night and now decidedly lower,t3_f1osqm,7
1581343965.0,2020-02-10,wallstreetbets,fh7t2up,"Apple is gonna be free money after it settles down, it’s falling so far",t3_f1osqm,6
1581344117.0,2020-02-10,wallstreetbets,fh7t9tp,[deleted],t3_f1osqm,6
1581344125.0,2020-02-10,wallstreetbets,fh7ta78,[deleted],t3_f1osqm,7
1581344151.0,2020-02-10,wallstreetbets,fh7tbd8,Premarket is fake and 🌈 today,t3_f1osqm,6
1581344424.0,2020-02-10,wallstreetbets,fh7to1w,I wish Cramer would stop talking about slipping in his own vomit.,t3_f1osqm,6
1581344625.0,2020-02-10,wallstreetbets,fh7txj5,Like Elon would ever sell. Fucking retarded,t3_f1osqm,7
1581344652.0,2020-02-10,wallstreetbets,fh7tyw8,"Imagine holding 400 dollar puts for next few weeks and hoping the economy crashes looses billions so you can make few thousands. 

Bulls might as well pay me to close my position.",t3_f1osqm,6
