created,date,subreddit,id,body,parent_id,score
1631815702.0,2021-09-16,wallstreetbets,hd3w5fc,Man WSB is making gains today.,t3_ppab5b,9
1631815721.0,2021-09-16,wallstreetbets,hd3w73h,Memestock pump and dumps are singlehandedly dragging the market to green which is mind-blowing and says something about the state of the market.,t3_ppab5b,8
1631815869.0,2021-09-16,wallstreetbets,hd3wk8j,Maybe Biden will say something about sdc,t3_ppab5b,8
1631815950.0,2021-09-16,wallstreetbets,hd3wrc1,"I can’t believe I lived through the Great Recession of September 16, 2021",t3_ppab5b,8
1631816035.0,2021-09-16,wallstreetbets,hd3wysj,Let’s see ATH tomorrow SPY. Thanks everyone who opened put positions,t3_ppab5b,7
1631816044.0,2021-09-16,wallstreetbets,hd3wzlk,Pleas fly SDC,t3_ppab5b,8
1631816149.0,2021-09-16,wallstreetbets,hd3x8xl,PLTR $30 EOD fuck it we want the cake!!!,t3_ppab5b,8
1631816647.0,2021-09-16,wallstreetbets,hd3yhpt,I wish at my job someone could ask me a question and I could just turn around and walk out of the room,t3_ppab5b,8
1631817290.0,2021-09-16,wallstreetbets,hd4028h,"listen up dipshits there is an unusually large number of options expiring friday. If you check yahoo finance you'll see most of the calls are for $450 and most of the puts are for $440. The big dogs dont want to fucking pay you, and they won't. SPY closes EOW right in the middle at $445 fucking the most amount of people possible 

If you are placing an order today, I would encourage some theta beyond Friday because they're playing games out here",t3_ppab5b,9
1631817665.0,2021-09-16,wallstreetbets,hd40zfp,I sell my Ford calls and it moons. Someone put a axe in my head,t3_ppab5b,8
1631817852.0,2021-09-16,wallstreetbets,hd41g3k,Can y’all watch AMD while I go smoke,t3_ppab5b,9
1631817922.0,2021-09-16,wallstreetbets,hd41ma5,bears close the fridge with their hips,t3_ppab5b,8
1631817988.0,2021-09-16,wallstreetbets,hd41s7w,if spy goes green I will suck my sisters toes off,t3_ppab5b,8
1631818349.0,2021-09-16,wallstreetbets,hd42p1b,The gym is the perfect place to rip a big fart.,t3_ppab5b,7
1631818626.0,2021-09-16,wallstreetbets,hd43dn4,"Lost 50% today on some contracts and sold, but if I held thru, I'd be up 20% or so. How tf do you do it? They were meme shits but still, sucks😔",t3_ppab5b,8
1631818703.0,2021-09-16,wallstreetbets,hd43kg6,"if spy goes to 452 tomorrow you can perma ban me from wsbs, ill be outtie!",t3_ppab5b,7
1631818869.0,2021-09-16,wallstreetbets,hd43xyy,Need to turn 2K into 27K by EOD tomorrow,t3_ppab5b,7
1631819794.0,2021-09-16,wallstreetbets,hd46658,Amazing how one mention of a stimulus gets all these crackheads to dump their life savings back into SPY when they were selling 3 fucking hours ago,t3_ppab5b,8
1631820062.0,2021-09-16,wallstreetbets,hd46tue,"AAPL’s relentless commitment to not following the broader market on a green day is admirable. That’s why they’re a market leader and not a follower, truly built different",t3_ppab5b,7
1631820317.0,2021-09-16,wallstreetbets,hd47gj2,SPY calls have always been the play bois,t3_ppab5b,8
1631820572.0,2021-09-16,wallstreetbets,hd4835d,SPY Close flatter than the few women who will sleep with me,t3_ppab5b,9
1631820814.0,2021-09-16,wallstreetbets,hd48onn,If LILM breaks $10.5 resistance we flyin,t3_ppab5b,7
1631821500.0,2021-09-16,wallstreetbets,hd4ae12,Go RKLB GO!,t3_ppab5b,8
1631821528.0,2021-09-16,wallstreetbets,hd4aggy,LILM is air taxi right? Looks fucking hilarious not gonna lie,t3_ppab5b,9
1631821807.0,2021-09-16,wallstreetbets,hd4b5o7,"Boss told me he trades options, doesnt know what spy is",t3_ppab5b,8
1631822117.0,2021-09-16,wallstreetbets,hd4bxge,SPY please dont guh me,t3_ppab5b,8
1631822184.0,2021-09-16,wallstreetbets,hd4c3cq,Making it out of today with a .1% portfolio gain feels like a huge win considering how we started lol,t3_ppab5b,8
1631822269.0,2021-09-16,wallstreetbets,hd4cawz,Lol they tell people with the Chevy volt to park 50ft away from other cars. That’s hilarious,t3_ppab5b,8
1631822304.0,2021-09-16,wallstreetbets,hd4ce0k,FOMOed into SDC,t3_ppab5b,8
1631822390.0,2021-09-16,wallstreetbets,hd4clnq,We are primed for bagholding 😎,t3_ppab5b,10
1631788373.0,2021-09-16,wallstreetbets,hd298e0,Ironnet holy shiiiii,t3_ppab5b,23
1631790813.0,2021-09-16,wallstreetbets,hd2cllt,**OPAD Gangnam style**,t3_ppab5b,19
1631804555.0,2021-09-16,wallstreetbets,hd34ewn,# PALANTARD GANG RISE THE FUCK UP OUT OF THE ASHES,t3_ppab5b,21
1631808645.0,2021-09-16,wallstreetbets,hd3elg9,LIDR possible gamma squeeze on top of the short squeeze if it hits and holds 10 up to 12.5.  Over 13k of OI on contracts.  Friday is gonna be fun.,t3_ppab5b,20
1631787251.0,2021-09-16,wallstreetbets,hd27vbb,Why is everyone talking about Europe collapsing?,t3_ppab5b,7
1631787466.0,2021-09-16,wallstreetbets,hd284g2,I'm convinced BABA is exchange traded racism at this point.,t3_ppab5b,8
1631787799.0,2021-09-16,wallstreetbets,hd28j09,Im tuggen my wewe,t3_ppab5b,6
1631788149.0,2021-09-16,wallstreetbets,hd28yck,Big green dildo! Leeeeets gooooo,t3_ppab5b,7
1631788865.0,2021-09-16,wallstreetbets,hd29vc6,OPAD opening at 14,t3_ppab5b,6
1631789015.0,2021-09-16,wallstreetbets,hd2a2h1,Okay opad I see you silently climbing too let’s go today is gonna be fucking great finally some money made,t3_ppab5b,8
1631789945.0,2021-09-16,wallstreetbets,hd2bckh,Another big green dildo day for uranium,t3_ppab5b,8
1631790578.0,2021-09-16,wallstreetbets,hd2c99z,Yessss opad now we’re moving LETS GO,t3_ppab5b,7
1631790805.0,2021-09-16,wallstreetbets,hd2cl6i,Holy fucking pump and dump,t3_ppab5b,8
1631791962.0,2021-09-16,wallstreetbets,hd2ecod,Fuck this I’m not jumping in at these levels when I don’t even have the day trades to get back out,t3_ppab5b,6
1631793107.0,2021-09-16,wallstreetbets,hd2g7rn,Daddy?  Are we going see new bagholders today?,t3_ppab5b,8
1631794365.0,2021-09-16,wallstreetbets,hd2icsm,Anyone in for $BABA at $300? It’s never going to be that high again FYI. China going back to the Stone Age,t3_ppab5b,7
1631794639.0,2021-09-16,wallstreetbets,hd2iu1e,"I wish SPY would sustain this plummet into the open. Seeing 444 would be nice, but it’ll probably reverse hard into 448",t3_ppab5b,6
1631795545.0,2021-09-16,wallstreetbets,hd2kgwj,Guys - I tried to analyze the P/E ratio of top 50 companies in S&P 500.  Then I realized that I don’t know what an “earning” is.  Back to basics.,t3_ppab5b,7
1631795615.0,2021-09-16,wallstreetbets,hd2kli9,Premarket was so juicy 🥺,t3_ppab5b,7
1631795898.0,2021-09-16,wallstreetbets,hd2l4d5,Why do I keep refreshing wsb and checking my tickers when the market isn't even open yet and I'm lying at the beach.,t3_ppab5b,7
1631796087.0,2021-09-16,wallstreetbets,hd2lh9n,Jobless ⬆️ retail ⬆️ market 🥴,t3_ppab5b,6
1631796844.0,2021-09-16,wallstreetbets,hd2mxxv,Haven’t slept at all.  Think I’m going to make some very bold decisions on some very meme stocks.  Gonna fire up all 3 accounts and get to firing away.,t3_ppab5b,8
1631797464.0,2021-09-16,wallstreetbets,hd2o6ib,"Spotted at Gym: lots of chicken legs and big pecs

Remember: to skip leg day is to anger the tendie gods *extremely*

(Also, drink water and stretch your hip flexors)",t3_ppab5b,9
1631799144.0,2021-09-16,wallstreetbets,hd2rpsd,[deleted],t3_ppab5b,7
1631799232.0,2021-09-16,wallstreetbets,hd2rwjs,"The entire drill team 6 was killed in a tragic drilling accident.

Pumping to commence immediately",t3_ppab5b,7
1631799360.0,2021-09-16,wallstreetbets,hd2s6e7,OPAD taking a dive,t3_ppab5b,8
1631799437.0,2021-09-16,wallstreetbets,hd2sc4z,CCJ raped me,t3_ppab5b,8
1631787018.0,2021-09-16,wallstreetbets,hd27lg5,Not bad returns for WSB to be honest,t1_hd26zvn,92
1631788661.0,2021-09-16,wallstreetbets,hd29lnz,Yeah I have a fresh pair of undies ready for when I nut all over myself,t1_hd29el0,6
1631789602.0,2021-09-16,wallstreetbets,hd2av9d,remember when u/zjz got the boot? this place was gross.,t1_hd2amuw,24
1631802252.0,2021-09-16,wallstreetbets,hd2ysye,Please post loss porn before you leave 🧸,t1_hd2yjib,9
1631788316.0,2021-09-16,wallstreetbets,hd295th,This is what crushing the blue and red pill and snorting it does,t1_hd28yp6,24
1631788754.0,2021-09-16,wallstreetbets,hd29q2i,Low float. Welcome to the Thunderdome,t1_hd29o1p,35
1631788985.0,2021-09-16,wallstreetbets,hd2a10j,"Expect more volatility. With a tiny float, the price moves quickly in both directions. Your normal price fluctuations of $2-3 are going to be even more dramatic from here.",t1_hd29o1p,11
1631796048.0,2021-09-16,wallstreetbets,hd2lemy,I have anxiety when I don’t play with options,t1_hd2lbdf,11
1631805649.0,2021-09-16,wallstreetbets,hd373ik,"That... Damn...

 Impeccable reasoning",t1_hd36vg5,8
1631789199.0,2021-09-16,wallstreetbets,hd2ab79,The first $1000 is the hardest,t1_hd29nvz,48
1631801586.0,2021-09-16,wallstreetbets,hd2x7pl,don’t stop I’m close,t1_hd2x5fu,8
1631808020.0,2021-09-16,wallstreetbets,hd3d1zt,Really great bagholders.  Would recommend.,t1_hd3cwtl,8
1631791916.0,2021-09-16,wallstreetbets,hd2ea4n,Watch for share dilution announcement,t1_hd2e6r8,13
1631819203.0,2021-09-16,wallstreetbets,hd44qe0,I don't even have a duck!,t1_hd44m7r,9
1631787891.0,2021-09-16,wallstreetbets,hd28n1w,I’m rooting for you bro,t1_hd28l55,9
1631788140.0,2021-09-16,wallstreetbets,hd28xy3,Make 500k and move to Colombia. Trust me.,t1_hd28l55,8
1631811944.0,2021-09-16,wallstreetbets,hd3muj5,🐂🐂🐂,t1_hd3ms68,7
1631812102.0,2021-09-16,wallstreetbets,hd3n8ou,Please post your loss porn as tribute to the trading gods.,t1_hd3n4d4,9
1631815112.0,2021-09-16,wallstreetbets,hd3upf2,$SDC baby,t1_hd3udz1,8
1631792888.0,2021-09-16,wallstreetbets,hd2fug3,No China,t1_hd2fs1b,9
1631812098.0,2021-09-16,wallstreetbets,hd3n89p,"you doubled your money, never look back friendo, always to the next play",t1_hd3n2z0,9
1631788523.0,2021-09-16,wallstreetbets,hd29fcv,This shits going parabolic,t1_hd298e0,8
1631787708.0,2021-09-16,wallstreetbets,hd28f4g,It's been a running theory for many centuries,t1_hd27vbb,8
1631796195.0,2021-09-16,wallstreetbets,hd2lolg,Cuz your lying at the beach and not lying on a yacht,t1_hd2l4d5,7
1631787979.0,2021-09-16,wallstreetbets,hd28qwb,"Thank you!!!

I hope your gf gets those new boobs. Good luck fella!",t1_hd28n1w,12
