created,date,subreddit,id,body,parent_id,score
1585742856.0,2020-04-01,wallstreetbets,fm4047n,"“Fuck it, i’m selling my puts and getting calls.” -some retards yesterday",t3_fsxqpm,392
1585745983.0,2020-04-01,wallstreetbets,fm442qv,This bull/bear stuff is completely stupid. I play both sides of the equation to maximize my losses,t3_fsxqpm,364
1585742345.0,2020-04-01,wallstreetbets,fm3zj3b,I just filed for unemployment. I’m doing my part 😤,t3_fsxqpm,155
1585744710.0,2020-04-01,wallstreetbets,fm42d9i,Who else is going from -60% to -30%? 🤩🤩🤩,t3_fsxqpm,284
1585747595.0,2020-04-01,wallstreetbets,fm46dmd,YOU A GOAT IF YOU HELD PUTS THROUGH ALL THE BULLSHIT TIL NOW 💎🙌🏽,t3_fsxqpm,134
1585744900.0,2020-04-01,wallstreetbets,fm42mgr,RIP to all the bears that sold their puts for a loss yesterday,t3_fsxqpm,126
1585740731.0,2020-04-01,wallstreetbets,fm3xq4d,[deleted],t3_fsxqpm,280
1585746602.0,2020-04-01,wallstreetbets,fm44xgr,"90% sure I got the rona. Was essentially paralyzed with fever last 48 hours. Lost sense of taste and smell. Body aches, shortness of breath. Really bad headache. About as bad as the worse the flu I’ve had. Didn’t need to go to hospital though.",t3_fsxqpm,85
1585744368.0,2020-04-01,wallstreetbets,fm41xiu,"How long before airbnb owners default.

Some are leverage 3-5 properties with no cash flow to pay for mortgage.

In 4 months they'll have burned through any cash buffer and force to start selling.",t3_fsxqpm,82
1585742992.0,2020-04-01,wallstreetbets,fm409yd,"Dance on the people that called you gay bears and making priced in comments.

Don't dance on anyone else though. Things are so bleak for the American economy that even autists screaming about tendies can see the walls closing in.

That's not a good sign.",t3_fsxqpm,68
1585743353.0,2020-04-01,wallstreetbets,fm40p30,My brother grabbed 2k in calls yesterday. Specifically so the market would go down. Doing the Lord's work lol,t3_fsxqpm,69
1585739291.0,2020-04-01,wallstreetbets,fm3w880,From $5k to $500 in a couple of weeks.. time to yolo it back up,t3_fsxqpm,128
1585740171.0,2020-04-01,wallstreetbets,fm3x4o0,"SPY down VIX up,

 that’s the shit that makes me nut 🥜🍆💦",t3_fsxqpm,166
1585742517.0,2020-04-01,wallstreetbets,fm3zqat,That bitch Carole Baskin,t3_fsxqpm,215
1585744264.0,2020-04-01,wallstreetbets,fm41ssd,The WHO just recommended a worldwide 30 day ban on eating ass,t3_fsxqpm,58
1585744387.0,2020-04-01,wallstreetbets,fm41yf2,Just worked all night in the hospital.. can't wait to make some tendies,t3_fsxqpm,59
1585739629.0,2020-04-01,wallstreetbets,fm3wkl9,It’s been a while since we hit a circuit breaker. I could use one today,t3_fsxqpm,51
1585750390.0,2020-04-01,wallstreetbets,fm4asez,Might sell my puts and immediately rebuy them so RobinHood doesn’t tell me they’re down 60%,t3_fsxqpm,53
1585748335.0,2020-04-01,wallstreetbets,fm47hc8,"SPY goes from -3.7% to -3.3%

Bulls: ""mOoNsHoT""",t3_fsxqpm,48
1585751940.0,2020-04-01,wallstreetbets,fm4dfz5,"Future kids in 20 years:

""Hey Dad, did you make any money during the crash in 2020?""

""It's all about the journey""",t3_fsxqpm,48
1585772574.0,2020-04-01,wallstreetbets,fm5glyr,[deleted],t3_fsxqpm,49
1585740747.0,2020-04-01,wallstreetbets,fm3xqq1,Never forget that bulls were mean to us during the deadcat bounce. We bears took it like men and didn’t cry very much. Now it’s our time to be sore winners and rub the bulls face in their own poo,t3_fsxqpm,291
1585741172.0,2020-04-01,wallstreetbets,fm3y7ea,"Guys you’re welcome, sold my puts yesterday at a loss",t3_fsxqpm,87
1585747400.0,2020-04-01,wallstreetbets,fm4636w,"Charts: Watched

Puts: Held

Important Work: Ignored

Oh yeah, it's tendie time.",t3_fsxqpm,39
1585747451.0,2020-04-01,wallstreetbets,fm465x1,"Bears, it's been an honor holding with you.",t3_fsxqpm,42
1585761738.0,2020-04-01,wallstreetbets,fm4vsw6,For me it always feels like I lose a fuck load up front then it's always a slow grind back to breaking even before I try a new strategy and lose a fuck load again.,t3_fsxqpm,44
1585772100.0,2020-04-01,wallstreetbets,fm5fq9r,[deleted],t3_fsxqpm,42
1585740019.0,2020-04-01,wallstreetbets,fm3wyyb,"They laughed at us. Taunted us. They wanted to see our loss porn. They buttfucked us, and whispered “stonks only go up” in our ears. And we took it. We endured. Some would even say we enjoyed it, a little bit. 

The true 🐻 never gave up. Our hands were forged in diamond 💎. While the toilet paper bears switched to bull gang, we doubled down our puts. While they chanted “printer go BRR 🖨” we jerked off to bad news articles. Bulls, I have one question. 

Where is your god now? Has he abandoned you when you needed him most? Even papa trump is on our side now. When he said expect the next two weeks to be painful, he meant it. And he’s talking about your asshole. 📉

-sincerely, Punished 🌈🐻 Gang",t3_fsxqpm,201
1585743874.0,2020-04-01,wallstreetbets,fm41bmm,"Jerome wakes up and opens his Well Fargo banking app. 

Current balance: -$5,000,000,000,000

He ponders for a second then mumbles, “if negative balances were bad, why did god invent negative numbers?”",t3_fsxqpm,75
1585744821.0,2020-04-01,wallstreetbets,fm42inb,"Hey, remember the cruise line industry? The one every American is bailing out? Lets see some facts about it.  
1. They are not registered in the US, so they dodge paying taxes here  
2. Their ships do not fly the USA flag for the same reason  
3. They hire foreigners that they pay for nothing  

Hey, nice we are taking care of such an important industry!",t3_fsxqpm,75
1585740589.0,2020-04-01,wallstreetbets,fm3xkoi,This may be the the day the market gets fucked to shit. Can’t wait for all the weaklings who sold their puts for a loss after buying at the previous bottom to buy back in after a circuit breaker because of FOMO. And then lose money again because of IV and theta and then spend all day in here screaming that the market is rigged.,t3_fsxqpm,37
1585761542.0,2020-04-01,wallstreetbets,fm4vfed,"Jokes on you gay bulls, I’m up 95% on my puts today! Now I’m only down 81% for the week!",t3_fsxqpm,33
1585771254.0,2020-04-01,wallstreetbets,fm5e6br,"Not to brag but I made $158 dollars today on $5,000 worth of SPY puts",t3_fsxqpm,40
1585739411.0,2020-04-01,wallstreetbets,fm3wcmo,Where are all the shit-talking bulls this morning?,t3_fsxqpm,69
1585741200.0,2020-04-01,wallstreetbets,fm3y8fb,"What’re people’s moves this morning besides watching our -90% puts rise?


Any morning plays?",t3_fsxqpm,33
1585741252.0,2020-04-01,wallstreetbets,fm3yahp,"If I sold my puts yesterday and bought calls, I’d find a new addiction. Maybe meth",t3_fsxqpm,31
1585759241.0,2020-04-01,wallstreetbets,fm4r2gp,"Why do I feel good about making $3,000 intraday but losing $10,000 overnight?

Good job retard",t3_fsxqpm,34
1585761144.0,2020-04-01,wallstreetbets,fm4uojw,[deleted],t3_fsxqpm,30
1585761696.0,2020-04-01,wallstreetbets,fm4vpxk,Who’s still holding 4/17 220 Puts?,t3_fsxqpm,33
1585761764.0,2020-04-01,wallstreetbets,fm4vumi,spy is stuck anyone got some wd40,t3_fsxqpm,32
1585743503.0,2020-04-01,wallstreetbets,fm40vgj,[deleted],t3_fsxqpm,61
1585743015.0,2020-04-01,wallstreetbets,fm40av8,"That dude who predicted a couple of weeks ago that we would moon to 270 and drop again, we may not have reached 270 exactly but that was still some pretty good DD",t3_fsxqpm,107
1585742350.0,2020-04-01,wallstreetbets,fm3zjbf,"Well Bulls, the wait is over and here's what you've all wanted. 

""Can't wait buy those cheap calls on the next dip"" 

Positions 
4/17 SPY $175P",t3_fsxqpm,28
1585742759.0,2020-04-01,wallstreetbets,fm40076,Give me a Circut breaker ONE TIME DEALAH,t3_fsxqpm,27
1585742914.0,2020-04-01,wallstreetbets,fm406n5,Is Lakewood Church publicly traded? ready to buy some calls on them when Osteen convinces his congregation to donate 100% of their stimulus checks,t3_fsxqpm,26
1585745624.0,2020-04-01,wallstreetbets,fm43l36,"SPY - tanking, Oil - tanking, Vix - mooning. Oh baby it's a triple",t3_fsxqpm,24
1585745798.0,2020-04-01,wallstreetbets,fm43tp6,All I need is a month straight of -20 drops and my puts might break even,t3_fsxqpm,29
1585745823.0,2020-04-01,wallstreetbets,fm43uvy,You know what they say.  Once you lose your first 2 deposits you start trading like a pro.  Fml,t3_fsxqpm,25
1585747338.0,2020-04-01,wallstreetbets,fm45zzf,[deleted],t3_fsxqpm,25
1585755971.0,2020-04-01,wallstreetbets,fm4kr5p,">BREAKING: China has concealed the extent of the coronavirus outbreak in its country, under-reporting both total cases and deaths, the U.S. intelligence community concluded in a classified report

No shit! Pikachu face.",t3_fsxqpm,30
1585760070.0,2020-04-01,wallstreetbets,fm4snd6,People asking for a pump to buy in.  What were you doing during the insane 7 day rally in the worst economic times the world has ever faced?,t3_fsxqpm,27
1585760403.0,2020-04-01,wallstreetbets,fm4tafs,Classic pool slide covered in coconut oil pattern. This is obviously a splash trap.,t3_fsxqpm,24
1585761143.0,2020-04-01,wallstreetbets,fm4uohp,CUOMO IS TALKING SHIT ABOUT THE PRINTER I LOVE THIS MAN,t3_fsxqpm,28
1585771431.0,2020-04-01,wallstreetbets,fm5ei1i,"Should I have sold some of my puts?

Yes. 

Should tomorrow be red? 

Yes. 

Will it be red?

No. 

Am I gay?

Yes.",t3_fsxqpm,26
1585772608.0,2020-04-01,wallstreetbets,fm5go6m,[deleted],t3_fsxqpm,24
1585772694.0,2020-04-01,wallstreetbets,fm5gu12,"Anyone think we will see a second wave of panic when boomers realize this virus is a big deal?
I work at an investment firm and was in a meeting mid march with 2 clients. They thought we already hit bottom in the first drop, i told them we’re at least two months away from the bottom. I told them we would probably be near bottom once more cities get locked down & fear is at an all time high. They said “that will never happen.” Then my boss said “don’t listen to him, he has no idea what he’s talking about.” A week later NYC exploded in cases and began shutting down. After this rally they could cut their losses & sell. I’m also retarded",t3_fsxqpm,28
1585742009.0,2020-04-01,wallstreetbets,fm3z59n,I bought a 4/17 247p SPy at the top. Woke up and realize that I might be ITM today,t3_fsxqpm,23
1585773169.0,2020-04-01,wallstreetbets,fm5hpwo,Uh oh boys Cramer has flipped to being bearish again,t3_fsxqpm,24
1585741501.0,2020-04-01,wallstreetbets,fm3ykdm,glad we finally have a banner and logo that accurately portrays the sub and also looks like it was made by one of us,t3_fsxqpm,23
1585744238.0,2020-04-01,wallstreetbets,fm41rko,RIP to all the retards who sold their puts and bought calls yesterday.,t3_fsxqpm,22
1585748010.0,2020-04-01,wallstreetbets,fm46zov,Omg I sold my puts and bought calls yesterday... jk I’m not that retarded,t3_fsxqpm,22
1585749263.0,2020-04-01,wallstreetbets,fm48xyb,"Lmao our own President says ""the next two weeks will be the toughest we've had yet fighting this. It will be grim. Be ready for that."" 

And the market says *Sweet!! What better time to invest in random STONKS*",t3_fsxqpm,23
1585752125.0,2020-04-01,wallstreetbets,fm4drnc,"Holy shit, reading some of these analyst reports on stocks makes you want to blow your brains out.

Right now, ""Not going out of business"" is basically a reason to buy retailers at 30+ PE's, lmfao

Holy fuck this market is gay",t3_fsxqpm,23
1585757617.0,2020-04-01,wallstreetbets,fm4ny73,I haven’t made a single profitable trade since last Wednesday,t3_fsxqpm,23
1585769689.0,2020-04-01,wallstreetbets,fm5b6pi,Imagine telling your broke ass children you were a bull during the great market crash of 2020,t3_fsxqpm,23
1585739368.0,2020-04-01,wallstreetbets,fm3wb1s,SPY down $9 after hours. Let's keep it going!,t3_fsxqpm,22
1585746616.0,2020-04-01,wallstreetbets,fm44y72,"I actually held my puts after going -21k unrealized, these past 3 weeks have been a test to my patience",t3_fsxqpm,22
1585747704.0,2020-04-01,wallstreetbets,fm46jj6,"steve mnuchin just called jerome ""jpow"" on cnbc lmao",t3_fsxqpm,22
1585749354.0,2020-04-01,wallstreetbets,fm493a1,Up $8 today on the option I’m down $759 on,t3_fsxqpm,21
1585749813.0,2020-04-01,wallstreetbets,fm49tvz,Fuck ya I’m up from -90% to -65%!,t3_fsxqpm,22
1585750453.0,2020-04-01,wallstreetbets,fm4aw7y,Calls? Lose money. Puts? Lose money. Market flat? IV crush.,t3_fsxqpm,21
1585760343.0,2020-04-01,wallstreetbets,fm4t67i,Someone point me to the SPY 260 guy. Who said we wouldn’t go lower. I want to see what he’s saying now,t3_fsxqpm,23
1585773436.0,2020-04-01,wallstreetbets,fm5i7v8,Hope we drop 20% tomorrow.,t3_fsxqpm,22
1585774349.0,2020-04-01,wallstreetbets,fm5jybm,"The prevailing sentiment lately seems to be that the unemployment numbers will either have no effect or cause SPY to surge up 5%. 

So glad I held my puts tonight. 🌈 🐻",t3_fsxqpm,21
1585777989.0,2020-04-01,wallstreetbets,fm5qkpf,"I’m not saying there is a correlation, but I lost my whole portfolio with bald man logo and I had a green day today...",t3_fsxqpm,21
1585756615.0,2020-04-01,wallstreetbets,fm4lzx5,"Just told 2 of my tenants to postpone the rent for 2 months. (Long island)

The puts cover the mortgage!",t3_fsxqpm,46
1585748358.0,2020-04-01,wallstreetbets,fm47ind,"lmao it's been 10 mins guys, literally stfu and let the day play out christ.",t3_fsxqpm,22
1585772607.0,2020-04-01,wallstreetbets,fm5go5t,people are cheering for their gain I'm here just wishing I'm gonna make up my loss lol,t3_fsxqpm,21
1585772805.0,2020-04-01,wallstreetbets,fm5h1hz,who else bought puts when SPY was 230 and got IV crush as fuck? LOL,t3_fsxqpm,21
1585739340.0,2020-04-01,wallstreetbets,fm3w9zh,Upvote if you’re pooping right now,t3_fsxqpm,178
1585746678.0,2020-04-01,wallstreetbets,fm451d5,JPOW is this sub's that bitch Carole Baskin,t3_fsxqpm,20
1585761136.0,2020-04-01,wallstreetbets,fm4uo1z,cuomo said fuck jpow,t3_fsxqpm,20
1585766067.0,2020-04-01,wallstreetbets,fm54a3g,"""I am never gonna financially recover from this""",t3_fsxqpm,20
1585766539.0,2020-04-01,wallstreetbets,fm556nk,"Tickers I've learned not to fuck with ever again in the past year:

* DIS

* NFLX

* UBER

* LYFT

* SNAP

* MU

* PTON

* ROKU

* Any weed stock ever

* AMD gets special mention too",t3_fsxqpm,19
1585768722.0,2020-04-01,wallstreetbets,fm59cdj,[deleted],t3_fsxqpm,20
1585774315.0,2020-04-01,wallstreetbets,fm5jvy3,So the weekly jobless claims are tomorrow.  Median estimate is 4 million.  So that means when we hit 5.3 million we will moon to 255+,t3_fsxqpm,20
1585774823.0,2020-04-01,wallstreetbets,fm5kuou,[deleted],t3_fsxqpm,20
1585739442.0,2020-04-01,wallstreetbets,fm3wdrc,"I'd like to just take a minute to say how fucking retarded some of this sub is. We literally had someone post 2-3 weeks ago warning us that stocks were going up before they came back down. Not only telling us they were going up,  but gave a pretty accurate estimate to the top. He even told us people would get all cocky. Absolute fucking morons.",t3_fsxqpm,111
1585744503.0,2020-04-01,wallstreetbets,fm423or,btw anyone who has puts that are further back dated than weeklies should not be selling today after one red day. the 1d chart is breaking down and with shit hitting the fan the next few weeks this is def at least retesting lows. don’t be a gay and sell right away,t3_fsxqpm,20
1585744553.0,2020-04-01,wallstreetbets,fm42620,"OK YOU AUTISTS I'M GONNA SAY THIS ONCE

* On Wednesday, the ADP releases private payrolls. It uses the week that includes the 12th of the month as a reference week.

* On Thursday, the Department of Labor releases initial jobless claims from the week before. That's the important piece of data this week because it includes data from when states were on lockdown.

* On Friday the BLS releases the official employment report for the month of March. Just like the ADP, the survey uses the week including the 12th of the month as the reference week. Again, most businesses were still open during that week so we will have to wait for the April report to see the extent of the damage from the pandemic.",t3_fsxqpm,18
1585748999.0,2020-04-01,wallstreetbets,fm48iwz,[deleted],t3_fsxqpm,19
1585749005.0,2020-04-01,wallstreetbets,fm48j8c,Can we all agree that we are NOT having a V bottom recovery?,t3_fsxqpm,19
1585758236.0,2020-04-01,wallstreetbets,fm4p4x0,"SPY puts now down a mere 56% 

Picked a terrible time to buy",t3_fsxqpm,19
1585758548.0,2020-04-01,wallstreetbets,fm4pqkm,LMAO took out 7500 personal loan for FDs last night that printedddd. Gambling someone elses money to get out of poverty like a real rich person,t3_fsxqpm,19
1585766004.0,2020-04-01,wallstreetbets,fm545ss,hahahah that shmuck portnoy is down 460k on BA and refuses to sell,t3_fsxqpm,19
1585766326.0,2020-04-01,wallstreetbets,fm54rzz,[deleted],t3_fsxqpm,20
1585768659.0,2020-04-01,wallstreetbets,fm5983d,Spy down Vix up that’s the way we like to put,t3_fsxqpm,19
1585771171.0,2020-04-01,wallstreetbets,fm5e0ri,This is fucking wild. If the market was like this all day you could sell fucking tickets to watch.,t3_fsxqpm,21
1585774960.0,2020-04-01,wallstreetbets,fm5l3kk,who else is in desperate need of a haircut fuck this virus,t3_fsxqpm,19
1585742897.0,2020-04-01,wallstreetbets,fm405xw,FUCK WHY DIDNT I BUY MORE PUTS AT CLOSE I HAD MY FINGER ON THE TRIGGER FUCK. This hurts more than losing money,t3_fsxqpm,41
1585739293.0,2020-04-01,wallstreetbets,fm3w8b1,this is all some sick april fools joke from jpow. the money printer is set to max throttle beginning at 9:29am.,t3_fsxqpm,74
1585742969.0,2020-04-01,wallstreetbets,fm408zz,"Coronavirus hasn't even really taken hold in the US yet.  New York is where it's worst, and still not at peak. There's no way movie theaters, theme parks, malls, stores, etc.. are going to reopen any time soon.

I don't know if we're red until then because the market is irrational. But I can't imagine a reason to go green.  The stimulus bill was shit, the government response in preparing for the virus has been shit, and without significant assistance, anyone without a work-from-home job isn't going to be spending money. Shit's gonna get dark.",t3_fsxqpm,19
1585743729.0,2020-04-01,wallstreetbets,fm415di,Where are all those arrogant bull fucks that have been parading around the last few days?,t3_fsxqpm,18
1585744386.0,2020-04-01,wallstreetbets,fm41ydf,"imagine buying calls when there's 1/3rd unemployment, the Fed printing money so fast that we'll need wheelbarrows soon to withdrawal enough cash for the breadlines, and we haven't come close to peak deaths per day according to Dr. ~~Mel Brooks~~ Fauci

holy shit, lmao... *you goddamn bulls really make me laugh.  I do you a favor and take Freddie in when you're having a bad time, and now you're gonna try and push me out!!*",t3_fsxqpm,18
1585748563.0,2020-04-01,wallstreetbets,fm47u6v,[deleted],t3_fsxqpm,17
1585750189.0,2020-04-01,wallstreetbets,fm4agbb,I hate trading and it’s all I want to do,t3_fsxqpm,18
1585752238.0,2020-04-01,wallstreetbets,fm4dyvz,"As a bull who got butt fucked last night, 🐻 s please be smart and take money when earned. This market is vicious and I want everyone here to be successful",t3_fsxqpm,19
1585760530.0,2020-04-01,wallstreetbets,fm4tj3a,"Guys, I'm about to become a hundredaire.",t3_fsxqpm,18
1585761191.0,2020-04-01,wallstreetbets,fm4urp6,18K -> 2.5K -> 6K. Ride or die baby.,t3_fsxqpm,17
1585768095.0,2020-04-01,wallstreetbets,fm585n8,"TRUMP, 2 weeks ago: We'll have a V shaped recovery

TRUMP, 1 week from now: We'll have a W shaped recovery

TRUMP, 2 weeks from now: We'll have a VVV recovery

TRUMP, 3 weeks from now: How many trillion is left on JPOW's Diamond Card?",t3_fsxqpm,18
1585768385.0,2020-04-01,wallstreetbets,fm58pa9,"To think, there were ppl on Monday switching into calls and swearing our bear days were over. 😬",t3_fsxqpm,18
1585768737.0,2020-04-01,wallstreetbets,fm59dec,The faster SPY drops the closer we get to justice for Carol Baskin's murdered husband.,t3_fsxqpm,17
1585769247.0,2020-04-01,wallstreetbets,fm5ac21,Loving this 245 fight.  Since we don't have sports right now this is the best we can do.,t3_fsxqpm,17
1585770828.0,2020-04-01,wallstreetbets,fm5ddni,I’m holding these puts until tomorrow boys! Who’s with me?,t3_fsxqpm,19
1585771075.0,2020-04-01,wallstreetbets,fm5dufi,Y’all are dumb. It’s shorts covering after 130 pt drop in SPX. It’s not manipulated tards. Tomorrow will be red again,t3_fsxqpm,17
1585771386.0,2020-04-01,wallstreetbets,fm5ef31,Is it. It cant be?!?!? The bull bear bull trap?,t3_fsxqpm,18
1585771422.0,2020-04-01,wallstreetbets,fm5ehg0,"1400+ NYPD officers test positive! Man, this is getting out of control.. what happens if now riot breaks out? or a big protest?

Source: [https://thehill.com/homenews/state-watch/490595-number-of-nypd-members-with-coronavirus-rises-to-more-than-1400](https://thehill.com/homenews/state-watch/490595-number-of-nypd-members-with-coronavirus-rises-to-more-than-1400)",t3_fsxqpm,18
1585771964.0,2020-04-01,wallstreetbets,fm5fh6g,If we open at 252 im selling all my puts and moving to sweden to herd sheep,t3_fsxqpm,19
1585772522.0,2020-04-01,wallstreetbets,fm5giiv,"Here is what the bloomberg terminal is showing for the April 2nd jobs report:

https://i.imgur.com/1HPvJGZ.png

The high is 6.5 mill. Seems a bit low to me, no?",t3_fsxqpm,19
1585774473.0,2020-04-01,wallstreetbets,fm5k6rf,[deleted],t3_fsxqpm,19
1585743044.0,2020-04-01,wallstreetbets,fm40c2p,Drill Team 6 ready to take out Bull Laden,t3_fsxqpm,66
1585740303.0,2020-04-01,wallstreetbets,fm3x9tr,Maybe watching my account bleed every day for the last week Will actually pay off,t3_fsxqpm,17
1585741004.0,2020-04-01,wallstreetbets,fm3y0rl,LOL can't wait to see stupid bulls faces today.... JPOW just please don't fuck us,t3_fsxqpm,17
1585743890.0,2020-04-01,wallstreetbets,fm41caz,Lol PJ bois just realized that the data is only up to march12.,t3_fsxqpm,17
1585745596.0,2020-04-01,wallstreetbets,fm43jqs,"Please take the time to read this:

https://www.bloomberg.com/news/articles/2020-04-01/supercharged-debt-bets-unravel-and-expose-wall-street-s-big-risk

Brought to you by your friendly neighborhood gay autist.",t3_fsxqpm,17
1585751548.0,2020-04-01,wallstreetbets,fm4craa,Crude oil inventory is 13.8MM vs 4MM expected lmaooooo,t3_fsxqpm,18
1585757923.0,2020-04-01,wallstreetbets,fm4ojf3,DONT DOUBT YOUR VIBE BOIS 🌈🐻💎👐,t3_fsxqpm,18
1585758293.0,2020-04-01,wallstreetbets,fm4p8s8,The problem with losing 80% is that you need to gain a whole lot more than 80% to get it back,t3_fsxqpm,16
1585760499.0,2020-04-01,wallstreetbets,fm4tgzl,My puts are only down -49.9%. Nice.,t3_fsxqpm,17
1585760789.0,2020-04-01,wallstreetbets,fm4u0oa,"Great start to Q2 guys 😎 market looking really good to me right now 👌🏼 I’d be all in, let’s see if I’m right 🤙🏼🤙🏼",t3_fsxqpm,16
1585765245.0,2020-04-01,wallstreetbets,fm52q5a,"I clawed back $38 from my LYFT puts

I’m kind of a big deal",t3_fsxqpm,17
1585767951.0,2020-04-01,wallstreetbets,fm57vut,"if you’re up and your puts expire on friday, for the love of god take your fucking money.",t3_fsxqpm,17
1585769655.0,2020-04-01,wallstreetbets,fm5b4b0,"Uh oh. No more 401k matches from the companies the boomers work for:

 [https://finance.yahoo.com/news/coronavirus-companies-begin-eliminating-401-k-matches-to-cut-costs-182416302.html](https://finance.yahoo.com/news/coronavirus-companies-begin-eliminating-401-k-matches-to-cut-costs-182416302.html) 

Panic sell panic sell panic sell",t3_fsxqpm,17
1585771949.0,2020-04-01,wallstreetbets,fm5fg8m,"There are so many livestreamed twerking fitness classes on Youtube right now and not a single one of them has called it quarantwerking yet which is, in my opinion, a missed marketing opportunity.",t3_fsxqpm,16
1585772475.0,2020-04-01,wallstreetbets,fm5gfdn,I feel like a hipster for being unemployed *before* the coronavirus,t3_fsxqpm,17
1585747050.0,2020-04-01,wallstreetbets,fm45ktn,"For the fuck of it, Here are the SPY Circuit Breaker Levels:

1. 239.71 
2. 224.24 
3. 206.20",t3_fsxqpm,35
1585755505.0,2020-04-01,wallstreetbets,fm4juxl,"# TODAY'S BIG EVENTS SO FAR

- US Intelligence reports China underreported deaths and concealed extent of virus

- EIA Oil data show lower consumption and more unaccounted oil

- Putin is under quarantine after his Doctor he saw last week tests positive for Corona 

- Canada's COVID cases towers to 9k from 7.7k, deaths at 105 = 85% survival rate with numbers current now (obviously not a true look at the viruses's mortality rate)

- EU Considering 100 billion dollar 'work scheme', would borrow against the market not against their budget. 

- France proposes joint debt issuance to finance virus response

- More China providences begin partial lockdowns, indicating a potential 2nd wave caused by returning to work to soon.

- S&P forecasting a U-Shaped US recovery in 2nd half of the year. ""Baseline US recession likely on par with losses seen during great recession, but over much shorter time""",t3_fsxqpm,36
1585739615.0,2020-04-01,wallstreetbets,fm3wk2v,I sold all my puts yesterday so yeah not surprised that market is tanking today. I must be the worst trader in history,t3_fsxqpm,50
1585740790.0,2020-04-01,wallstreetbets,fm3xshb,"Where are all the 🧻🖐 “bears” who sold yesterday. So sad. You knew EOQ rebalancing was going to cause an artificial spike. And you knew it was BS buying. If you were holding for days and sold when you knew it was probably going to go up - I have no sympathy for you

💎🖐 on the other hand - this is it boys, the momentum has shifted 🐻🌈",t3_fsxqpm,47
1585740361.0,2020-04-01,wallstreetbets,fm3xc31,"Our chosen one variation separate was right again.

Wonder if the other big brain boi's 95 vix call will follow suit",t3_fsxqpm,17
