created,date,subreddit,id,body,parent_id,score
1581625362.0,2020-02-13,wallstreetbets,fhiieqg,"Every fucking day i watch you guys panic sell spce when it dips below a dollar mark, get some better hands",t3_f38dq2,10
1581625484.0,2020-02-13,wallstreetbets,fhiimnk,Just another Theta day,t3_f38dq2,10
1581625907.0,2020-02-13,wallstreetbets,fhije55,"[https://flightaware.com/live/flight/VGX2](https://flightaware.com/live/flight/VGX2)   The SPCE aircraft is in flight back to NM.  I feel like a weirdo knowing this... and trying to figure out if it means anything for my tendies.

edit: it appears to be flying around in circles",t3_f38dq2,6
1581627013.0,2020-02-13,wallstreetbets,fhildtv,ALGOs are scanning these comments and are gonna murder bears for daring to defy them,t3_f38dq2,7
1581627602.0,2020-02-13,wallstreetbets,fhimfz4,"Everybody thinks red tomorrow, definitely going deep green",t3_f38dq2,7
1581627713.0,2020-02-13,wallstreetbets,fhimn36,Was up $1100 today and then down $445 -\_\_-,t3_f38dq2,9
1581628276.0,2020-02-13,wallstreetbets,fhinnn9,"ROKU only up 8% right now. Options were pricing in a near 15% move. 

IV crush is going to absolutely annihilate asshole if it doesn't gap up more",t3_f38dq2,9
1581599323.0,2020-02-13,wallstreetbets,fhhamqs,"All the meme stocks are down (TSLA, MSFT, AAPL, SPCE, BYND, PTON, AMD). Today will definitely be blood red",t3_f38dq2,15
1581601277.0,2020-02-13,wallstreetbets,fhhd6kz,"I get Elons move.  Its smart but damn TSLA 1000 gang, dump those bags.  It's not coming back for a while.",t3_f38dq2,15
1581628605.0,2020-02-13,wallstreetbets,fhio91x,Hi daddy trump. I’m going to need you to executive order the Jedi contract to MSFT. Thanks bye.,t3_f38dq2,15
1581596293.0,2020-02-13,wallstreetbets,fhh78b2,[removed],t3_f38dq2,15
1581612707.0,2020-02-13,wallstreetbets,fhhvquk,"[U.S. SECRETARY OF STATE POMPEO SAYS HAVE MADE REAL PROGRESS IN TALKS WITH TALIBAN OVER LAST FEW DAYS, TRUMP HAS OKAYED FURTHER TALKS](https://twitter.com/firstsquawk/status/1227998408155136001?s=21) 


Ahh look. Trade talks with TALIBAN going well! Looks like tariffs on terrorism? Will be coming off",t3_f38dq2,14
1581625235.0,2020-02-13,wallstreetbets,fhii6im,"MSFT reported revenue of 37 billion last quarter. The pentagon deal would add around 250 million to their quarterly revenues and they will most likely still get the deal. There is no reason to sell, BTFD BOYS",t3_f38dq2,15
1581592451.0,2020-02-13,wallstreetbets,fhh3ser,Waiting to see how BABA’s iron chef career is going with cooking them books. Sous vide is so hot right now.,t3_f38dq2,7
1581593982.0,2020-02-13,wallstreetbets,fhh51tk,This whole virus thing only started happening after they started making a live-action “Mulan”. This is all DIS fault. They should be sacrificed to save us all!!!,t3_f38dq2,7
1581594764.0,2020-02-13,wallstreetbets,fhh5r4j,[deleted],t3_f38dq2,7
1581596231.0,2020-02-13,wallstreetbets,fhh762p,[deleted],t3_f38dq2,8
1581597048.0,2020-02-13,wallstreetbets,fhh814t,RIP TSLA,t3_f38dq2,6
1581597968.0,2020-02-13,wallstreetbets,fhh91tg,"Looks like Waste Management is tanking as well

Someone check on u/winkerpack",t3_f38dq2,8
1581598366.0,2020-02-13,wallstreetbets,fhh9i4t,"TSLA down 5.5%, RIP to all you call FD bag holders",t3_f38dq2,7
1581598687.0,2020-02-13,wallstreetbets,fhh9vn5,So will there be a court decision make on Msft today?,t3_f38dq2,7
1581599919.0,2020-02-13,wallstreetbets,fhhbdjk,Anyone else in the MSFT boat 2/14? Cuz idk if I should sell today or wait until tomorrow,t3_f38dq2,7
1581600078.0,2020-02-13,wallstreetbets,fhhbkxw,"Recalls, SEC issues, and share dilution...

Drops 3% 

TSLA is literally run by retard juice",t3_f38dq2,8
1581600107.0,2020-02-13,wallstreetbets,fhhbm99,"Good luck buying luckin coffee when you are in FOCKDOWN

>NEW: Huanggang, a city of 6 million people near Wuhan, will tighten its lockdown at midnight to ban people from leaving their home; basic needs will be provided by the local government",t3_f38dq2,7
1581600343.0,2020-02-13,wallstreetbets,fhhbxdz,Looks like a good day to buy some of those month out MSFT calls if it tanks again,t3_f38dq2,7
1581601106.0,2020-02-13,wallstreetbets,fhhcy6t,RIP u/payme4tradeideas betting a year’s worth of his salary on TSLA FD 800 calls that are now worthless after their offering announcement,t3_f38dq2,7
1581601314.0,2020-02-13,wallstreetbets,fhhd8eq,Anyone still desperately holding 4/17 MSFT calls?? Gang shit,t3_f38dq2,7
1581602489.0,2020-02-13,wallstreetbets,fhhev62,u/winkerpack what's going on with WM? I WAS PROMISED THERE'D BE TENDIES,t3_f38dq2,8
1581602552.0,2020-02-13,wallstreetbets,fhheye9,Hold tight boys. Nothing stops this tendie train called SPCE.,t3_f38dq2,8
1581602669.0,2020-02-13,wallstreetbets,fhhf46j,Tank at open. No bears left to push bulls to buy.,t3_f38dq2,7
1581602701.0,2020-02-13,wallstreetbets,fhhf5pt,"Is the MSFT dip AH from the JEDI contract uncertainty?

MSFT has almost no exposure in China, *especially* compared to some of it's blue chip conterparts like AAPL...",t3_f38dq2,8
1581602796.0,2020-02-13,wallstreetbets,fhhfafq,TSLA calls or puts im confused.,t3_f38dq2,7
1581602804.0,2020-02-13,wallstreetbets,fhhfauj,So TSLA inching back up. Seems like this may be the retarded day where it crosses 800,t3_f38dq2,8
1581602848.0,2020-02-13,wallstreetbets,fhhfd2f,"***Whip crackling sound***

Xi: We gonna meet that quota boys...oh we gonna meet it.",t3_f38dq2,8
1581602965.0,2020-02-13,wallstreetbets,fhhfiw9,Markets never go Downies now 😔,t3_f38dq2,6
1581603051.0,2020-02-13,wallstreetbets,fhhfnct,Dis still being a gay ass mouse,t3_f38dq2,7
1581603622.0,2020-02-13,wallstreetbets,fhhggm2,If you tink this is a sell off turn in your Robinhood accounts now,t3_f38dq2,6
1581603637.0,2020-02-13,wallstreetbets,fhhghem,[deleted],t3_f38dq2,7
1581603667.0,2020-02-13,wallstreetbets,fhhgiy8,Big ass baby yoda today,t3_f38dq2,8
1581603776.0,2020-02-13,wallstreetbets,fhhgoko,"100% buying the MSFT dip, like this admin is going to rule in favor of AMZN give me a break",t3_f38dq2,7
1581604377.0,2020-02-13,wallstreetbets,fhhhkq6,$MSFT - what a pleasant surprise. Now fucking go to $200.,t3_f38dq2,7
1581604407.0,2020-02-13,wallstreetbets,fhhhmep,"u/stormwillpass should we try a daily discussion thread and add a daily trade ideas thread. Talking shit in the discussion but the trade idea is trades only catch a ban if you’re spamming dumb shit in that thread?

Tired of sifting through GUH, REE, Stonk posts to see what people have going on",t3_f38dq2,7
1581604469.0,2020-02-13,wallstreetbets,fhhhpsq,MICROSOFT IM CREAMINGGG,t3_f38dq2,8
1581604470.0,2020-02-13,wallstreetbets,fhhhpta,####🚀SPCERACE🚀,t3_f38dq2,7
1581604609.0,2020-02-13,wallstreetbets,fhhhxlw,Where did all the bears go? They were just in here 5min ago.,t3_f38dq2,8
1581604938.0,2020-02-13,wallstreetbets,fhhifrz,"Let’s run again $MSFT

I need to get out of my 2/14 calls successfully so I need you to go to $185.50",t3_f38dq2,6
1581605032.0,2020-02-13,wallstreetbets,fhhil2z,Y'all got anymore of those $MSFT moons?,t3_f38dq2,8
1581605154.0,2020-02-13,wallstreetbets,fhhirte,"TSLA up on news of SEC subpoena, critical audit findings and $2b cap raise. Love the $15 spike at open",t3_f38dq2,7
1581605230.0,2020-02-13,wallstreetbets,fhhiw0y,Spce bouta hit 25,t3_f38dq2,7
1581605322.0,2020-02-13,wallstreetbets,fhhj168,Entire portfolio now in MSFT,t3_f38dq2,7
1581605492.0,2020-02-13,wallstreetbets,fhhjawz,"I know the MSFT dips are worrying people, but I've used them to average down on $190-197.5 calls for 3/20 and 3/27. Once the JEDI decision BS settles and we get yet another upgrade it'll be tendy town by early March.",t3_f38dq2,7
1581605636.0,2020-02-13,wallstreetbets,fhhjj6x,Tesla really is the wildest of rides,t3_f38dq2,7
1581605659.0,2020-02-13,wallstreetbets,fhhjkfy,$MSFT NEXT LEG UP,t3_f38dq2,8
1581605867.0,2020-02-13,wallstreetbets,fhhjwj0,Wow incredible. Just insane this market makes no sense. Glad I held on to all my calls lol,t3_f38dq2,7
1581605931.0,2020-02-13,wallstreetbets,fhhk05g,MSFT can legitimately hit 190 EOW when this contract BS is settled later.,t3_f38dq2,7
1581606121.0,2020-02-13,wallstreetbets,fhhkb65,msft is it too much to ask for like a 10% day sheesh,t3_f38dq2,7
1581606882.0,2020-02-13,wallstreetbets,fhhlk5s,CNBC just said TSLA is overbought like a mofo,t3_f38dq2,8
1581607285.0,2020-02-13,wallstreetbets,fhhm81x,116 mile iceberg just broke off Antarctica shelf — Very bullish for SPCE since we’ll need to leave this planet.,t3_f38dq2,6
1581607923.0,2020-02-13,wallstreetbets,fhhnbgy,Ruling about to drop I bet. MSFT is stagnating,t3_f38dq2,7
1581608286.0,2020-02-13,wallstreetbets,fhhnygp,Is MSFT court ruling priced in?? Or y’all think there will be a pop if they get a favorable ruling ?,t3_f38dq2,6
1581609185.0,2020-02-13,wallstreetbets,fhhpjjc,🚨 MSFT GREEN 🚨,t3_f38dq2,8
1581609382.0,2020-02-13,wallstreetbets,fhhpw9h,"Man I thought today was going to be a big down day because of MSFT but I sold my ROKU calls at the top and Walmart is still coming through for me. 

Holding 36 $210 3/20 MSFT calls.",t3_f38dq2,6
1581609507.0,2020-02-13,wallstreetbets,fhhq4cc,Satya leaving the station with strippers and coke,t3_f38dq2,6
1581609509.0,2020-02-13,wallstreetbets,fhhq4ev,You did it you beautiful son of a bitch!!!,t3_f38dq2,7
1581609605.0,2020-02-13,wallstreetbets,fhhqai8,Guys I think that MSFT court decision came out,t3_f38dq2,6
1581609715.0,2020-02-13,wallstreetbets,fhhqhc4,MSFT bull run has started baby! 🐂🐂🐂🐂🐂🐂🐂🐂,t3_f38dq2,7
1581609752.0,2020-02-13,wallstreetbets,fhhqjow,MSFT 195C 3/6 gang checking in. 😎,t3_f38dq2,7
1581609776.0,2020-02-13,wallstreetbets,fhhql7c,Congrats to those that held MSFT,t3_f38dq2,8
1581609817.0,2020-02-13,wallstreetbets,fhhqnqj,MSFT paper hands in SHAMBLES,t3_f38dq2,7
1581609979.0,2020-02-13,wallstreetbets,fhhqxy6,You all sinking Microsoft for talking too much,t3_f38dq2,7
1581609992.0,2020-02-13,wallstreetbets,fhhqyqd,Was anyone else too broke to buy the dip because you had diamond hands on an all in call?,t3_f38dq2,7
1581610294.0,2020-02-13,wallstreetbets,fhhrhj2,MSFT is poised to leap with the good news being confirmed today. SPCE is leaping. Better get on both while you still can!,t3_f38dq2,7
1581610471.0,2020-02-13,wallstreetbets,fhhrsi2,INB4 “is anyone else’s RH not updating?” next Monday,t3_f38dq2,7
1581610903.0,2020-02-13,wallstreetbets,fhhsjdi,"I think 187 is an easy target for MSFT today, but i think its more likely to just rip straight to 195 after the court comes out in favor of MSFT",t3_f38dq2,7
1581610909.0,2020-02-13,wallstreetbets,fhhsjs8,Bears are the devil that try and tempt you when you’re at your lowest. Stay strong and have faith in our lord Satya. If your tech CEO  is brown he will never let you down.,t3_f38dq2,8
1581611700.0,2020-02-13,wallstreetbets,fhhtyd1,So funny seeing people not knowing how to lock in gains without burning a DT. 🤡,t3_f38dq2,8
1581611711.0,2020-02-13,wallstreetbets,fhhtz3a,BABA going up. Put your options in!,t3_f38dq2,6
1581611768.0,2020-02-13,wallstreetbets,fhhu2ps,recession canceled now back to your daily scheduled pump,t3_f38dq2,7
1581612000.0,2020-02-13,wallstreetbets,fhhuhdy,Can we round up whoever keeps cucking MSFT around 186 and lock then in a pit for the rest of the day.,t3_f38dq2,6
1581612058.0,2020-02-13,wallstreetbets,fhhul58,[deleted],t3_f38dq2,7
1581612185.0,2020-02-13,wallstreetbets,fhhut8l,About to take a test when I finish microsoft better be above $186,t3_f38dq2,7
1581612421.0,2020-02-13,wallstreetbets,fhhv8h5,I swear Tesla options are a fucking drug nothing else has multi thousand dollar swings within an hour on single contracts,t3_f38dq2,6
1581613032.0,2020-02-13,wallstreetbets,fhhwbiu,I had 2 VIX calls from last week that hit 0 today and auto-closed. XD,t3_f38dq2,6
1581613264.0,2020-02-13,wallstreetbets,fhhwqjb,Time to buy the mini dip on SPCE and MSFT during this lunch time lull.,t3_f38dq2,8
1581613510.0,2020-02-13,wallstreetbets,fhhx68x,"MSFT 2/14 call gang, who is here my fellow FD traders?",t3_f38dq2,6
1581613850.0,2020-02-13,wallstreetbets,fhhxrv6,"TSLA is truly something out of this world.... To think at one point this morning it got down to 713, and here we are headed for 800. Unbelievable lol.",t3_f38dq2,6
1581614586.0,2020-02-13,wallstreetbets,fhhz2ro,MSFT gonna go 💣 after the announcement they’re cleared from tech investigation 🔥,t3_f38dq2,7
1581614629.0,2020-02-13,wallstreetbets,fhhz5j3,"and its green, why are bears always wrong.",t3_f38dq2,6
1581614976.0,2020-02-13,wallstreetbets,fhhzrem,"TSLA at 803, I was taught that stock prices drop when shares get diluted, get fucked professors, papa elon doesn't give a shit.",t3_f38dq2,6
1581615155.0,2020-02-13,wallstreetbets,fhi02oj,TESLA IS BACK BITCHES,t3_f38dq2,7
1581615279.0,2020-02-13,wallstreetbets,fhi0aio,"Why is TSLA announcing 2billion in dilution causing buys?

Id rather a forward split to really fuck with the shorts, you know it would just go insane if it went 8 to 1 and people could really buy shares",t3_f38dq2,7
1581615322.0,2020-02-13,wallstreetbets,fhi0d9m,[deleted],t3_f38dq2,6
1581615530.0,2020-02-13,wallstreetbets,fhi0qa8,"CONSIDERING LEAVING WORK SO I CAN WATCH TSLA.

God damn it, you slutty tslalina.",t3_f38dq2,7
1581615773.0,2020-02-13,wallstreetbets,fhi15uo,Give us this fucking Jedi news already,t3_f38dq2,7
1581615839.0,2020-02-13,wallstreetbets,fhi1a2i,wsb I swear if you destroy TSLA again I stab you,t3_f38dq2,7
1581615970.0,2020-02-13,wallstreetbets,fhi1ifb,Yall jumped off of SPCE for Tsla and it shows,t3_f38dq2,7
1581616136.0,2020-02-13,wallstreetbets,fhi1t2c,"Coronavirus Could Infect Two-Thirds of Globe, Research Shows  https://www.bloomberg.com/news/articles/2020-02-13/coronavirus-could-infect-two-thirds-of-globe-researcher-says

Does Bloomberg do anything else other than fear monger now?",t3_f38dq2,7
1581616253.0,2020-02-13,wallstreetbets,fhi20li,3/13 $192.50 contracts $MSFT. Anyone else?,t3_f38dq2,7
1581616302.0,2020-02-13,wallstreetbets,fhi23q0,Just fomod into TSLA,t3_f38dq2,7
1581616571.0,2020-02-13,wallstreetbets,fhi2l3r,"Trading in 2020 is so easy. Buy any TSLA call, make 500%. Thx bears!",t3_f38dq2,8
1581616818.0,2020-02-13,wallstreetbets,fhi310j,"This market is like clockwork and I'm still too big of a retard gai boi to make money. Rise at open, sell off around 10:30, rise back until lunch time, melt down rest of day, rise a touch, but not to earlier levels by close. Rinse, repeat. Fuck I'm gay",t3_f38dq2,8
1581617141.0,2020-02-13,wallstreetbets,fhi3lyk,[deleted],t3_f38dq2,7
1581617174.0,2020-02-13,wallstreetbets,fhi3ocu,"some late cycle private equity bubble shit

https://imgur.com/8qivay2",t3_f38dq2,6
1581617222.0,2020-02-13,wallstreetbets,fhi3rms,its msft pump time !! toward jedi news!,t3_f38dq2,8
1581617614.0,2020-02-13,wallstreetbets,fhi4il8,"MSFT always starts the day down, then starts pumping around 10:30, dips at lunch, stays flat and jumps in the last 30 minutes.",t3_f38dq2,7
1581617801.0,2020-02-13,wallstreetbets,fhi4v9t,"Sbux to $100, pray to $BECKY",t3_f38dq2,7
1581618501.0,2020-02-13,wallstreetbets,fhi66o6,"2/14 725P TSLA lottery tickets, lets go red Friday.

https://imgur.com/S5Y9JX8",t3_f38dq2,8
1581618673.0,2020-02-13,wallstreetbets,fhi6i6b,[deleted],t3_f38dq2,6
1581618755.0,2020-02-13,wallstreetbets,fhi6nr0,Anyone else tired of this fucking Coronavirus bullshit?,t3_f38dq2,7
1581619374.0,2020-02-13,wallstreetbets,fhi7spb,Can this please be the last round of Microsoft panic sellers who have never seen a 30% profit in their life.,t3_f38dq2,6
1581619541.0,2020-02-13,wallstreetbets,fhi83wi,"all i did this week was buy the dip and collect free money from MMs

they're soooo nice",t3_f38dq2,8
1581619734.0,2020-02-13,wallstreetbets,fhi8g7n,BEARS BACK TO YOUR CAVES,t3_f38dq2,7
1581620794.0,2020-02-13,wallstreetbets,fhia9el,[removed],t3_f38dq2,7
1581621216.0,2020-02-13,wallstreetbets,fhiaz3y,And...my March MSFT calls get hammered. Sweet.,t3_f38dq2,7
1581621339.0,2020-02-13,wallstreetbets,fhib6u8,Fuck bezos piece of shit,t3_f38dq2,7
1581621411.0,2020-02-13,wallstreetbets,fhibbe1,Still holding MSFT I aint no punk,t3_f38dq2,6
1581621474.0,2020-02-13,wallstreetbets,fhibfd1,"Unpopular opnion, MSFT up tomorrow, just because they had to stop work doesn't mean AMZN will win and they are still MSFT this is a dip",t3_f38dq2,7
1581621565.0,2020-02-13,wallstreetbets,fhibl46,"# Max out credit cards on Amazon today, enjoy it, then return every single shit and demand full refund.

# Fuck you Bezos",t3_f38dq2,7
1581621650.0,2020-02-13,wallstreetbets,fhibqkt,MSFT CLIMBING BACK UP. LOL to all that sold under $184,t3_f38dq2,6
1581621731.0,2020-02-13,wallstreetbets,fhibvrb,"This doesn't mean that Amazon gets the contract, you dummies. More than likely, Microsoft will still have it. Lol.",t3_f38dq2,6
1581595576.0,2020-02-13,wallstreetbets,fhh6ii7,This is why I do my own taxes,t1_fhh6g2z,50
1581595030.0,2020-02-13,wallstreetbets,fhh6004,"Srsly, fuck baba",t1_fhh5y1m,14
1581601594.0,2020-02-13,wallstreetbets,fhhdmfo,Ok retard,t1_fhhdl0x,54
1581601596.0,2020-02-13,wallstreetbets,fhhdmj4,Who is saying all this lol,t1_fhhdl0x,8
1581601714.0,2020-02-13,wallstreetbets,fhhdsej,Nice one retard,t1_fhhdl0x,10
1581594061.0,2020-02-13,wallstreetbets,fhh54bk,because your position is the meme stock of the week?,t1_fhh51r5,50
1581594008.0,2020-02-13,wallstreetbets,fhh52nk,Bad parenting?,t1_fhh51r5,19
1581595212.0,2020-02-13,wallstreetbets,fhh664g,My calls would be thrilled,t1_fhh61gh,16
1581599006.0,2020-02-13,wallstreetbets,fhha94x,It’s posts like these that reassure me that buying calls yesterday was about perfect timing.,t1_fhh9pz6,8
1581603855.0,2020-02-13,wallstreetbets,fhhgsoi,RIP my losses,t1_fhhgqpj,8
1581603856.0,2020-02-13,wallstreetbets,fhhgsr9,Thank heavens,t1_fhhgqpj,9
1581603935.0,2020-02-13,wallstreetbets,fhhgx1g,[deleted],t1_fhhgqpj,9
1581592789.0,2020-02-13,wallstreetbets,fhh41wl,Bro why the fuck would you fill up on dip when you are already getting bat soup later 🤔🤔🤔,t1_fhh3y8z,17
1581592829.0,2020-02-13,wallstreetbets,fhh432u,I heard there’s a new vaping flavor in China. It’s called ‘bat farts’. They can’t get enough of it,t1_fhh3y8z,7
1581597300.0,2020-02-13,wallstreetbets,fhh8b31,"Jokes on you, I already have depression",t1_fhh87tp,19
1581598991.0,2020-02-13,wallstreetbets,fhha8g6,Thank you for making my morning a little better,t1_fhh88b9,8
1581606083.0,2020-02-13,wallstreetbets,fhhk8yt,F. Idk why you had to make it worse.,t1_fhhk6ew,12
1581594047.0,2020-02-13,wallstreetbets,fhh53v8,Ty for buying my calls i held for 10 minutes at market close yesterday 😘,t1_fhh5212,9
1581603471.0,2020-02-13,wallstreetbets,fhhg8o4,But I like to recommend retarded things,t1_fhhg5se,10
1581616920.0,2020-02-13,wallstreetbets,fhi373a,All these fucking kids and clowns running around makes me think the circus is in town,t1_fhi33cc,7
1581603790.0,2020-02-13,wallstreetbets,fhhgpba,Sounds like technical analysis to me 🧙‍♂️,t1_fhhgkyp,16
1581614282.0,2020-02-13,wallstreetbets,fhhyjdf,or ban,t1_fhhyicq,11
1581614344.0,2020-02-13,wallstreetbets,fhhynay,vid or ban,t1_fhhyicq,10
1581594642.0,2020-02-13,wallstreetbets,fhh5n3x,Curetalksgoingwell.exe,t1_fhh5fl7,11
1581595880.0,2020-02-13,wallstreetbets,fhh6t9a,[deleted],t1_fhh6ql2,14
1581597108.0,2020-02-13,wallstreetbets,fhh83k3,What pre-market pump are you seeing? Because I’m seeing the asshole getting ssssstttttrrrrreeeeeccccchhhhhheeeeeedddddd,t1_fhh7i7y,10
1581593391.0,2020-02-13,wallstreetbets,fhh4jus,Beijing is dipping into private citizen’s bank accounts?,t1_fhh4hyz,13
1581596196.0,2020-02-13,wallstreetbets,fhh74sj,"and this is exactly the reason why property prices around the world had risen.

Rich Chinese had to park their money outside of China for fear that the CCP will take it away.",t1_fhh6saq,8
1581609451.0,2020-02-13,wallstreetbets,fhhq0pl,TO THE MOON,t1_fhhpzf4,6
1581612799.0,2020-02-13,wallstreetbets,fhhvwrz,"judge buying calls rn, soon",t1_fhhvq7n,9
1581594187.0,2020-02-13,wallstreetbets,fhh58az,We could if the Jedi contract news is good,t1_fhh54vh,10
1581618804.0,2020-02-13,wallstreetbets,fhi6r3u,"good enough for me, going all in",t1_fhi6oet,12
1581601296.0,2020-02-13,wallstreetbets,fhhd7ix,"BRO.

Try being a bear the last 6 months",t1_fhhd3ck,6
1581599553.0,2020-02-13,wallstreetbets,fhhax2s,After hours was yesterday. It’s tomorrow now. You can call it premarket :),t1_fhhamiu,8
1581601299.0,2020-02-13,wallstreetbets,fhhd7p3,I got BA puts while flying yesterday on Southwest.  Was shorting myself,t1_fhhd4f5,8
1581616619.0,2020-02-13,wallstreetbets,fhi2o7f,Found the guy with TSLA puts,t1_fhi2jby,12
1581599427.0,2020-02-13,wallstreetbets,fhhareq,"- MSFT a meme stock

Look how WSB murdered mah boi",t1_fhhamqs,38
1581606134.0,2020-02-13,wallstreetbets,fhhkby9,I’d take 2%,t1_fhhkb65,9
1581617689.0,2020-02-13,wallstreetbets,fhi4noc,[removed],t1_fhi4il8,9
1581595950.0,2020-02-13,wallstreetbets,fhh6vq8,Shit I can’t even do it while my wife is home,t1_fhh6ii7,21
1581593976.0,2020-02-13,wallstreetbets,fhh51mq,"Yea, news is out from Guangdong already in Chinese. He’s not from there tho but he’s afraid other provinces will follow. 

It’s not just bank accounts, it’s assets and properties, *land and vehicles at the demand of the government in order to help against the virus.",t1_fhh4jus,9
1581596033.0,2020-02-13,wallstreetbets,fhh6ysl,My wife thinks I’m cheating every year around tax season. Truth is I’m just trying to hide I lost 20k again,t1_fhh6vq8,29
1581596453.0,2020-02-13,wallstreetbets,fhh7e5f,"Bro I’m sorry. Tell her it’s one of those loopholes trump uses to not pay taxes. You didn’t really loose that much, it’s a loophole. Slip taxman an extra tendie to stfu.",t1_fhh6ysl,13
