created,date,subreddit,id,body,parent_id,score
1581339699.0,2020-02-10,wallstreetbets,fh7o2wf,"To anyone who hasn’t seen a Monday opening before, please don’t panic sell because you lost 5 cents on your free Ford stock",t3_f1osqm,96
1581336823.0,2020-02-10,wallstreetbets,fh7l75d,MSFT going above 185 after open and its not coming back.,t3_f1osqm,81
1581340067.0,2020-02-10,wallstreetbets,fh7oh3l,"Jesus Christ the first thing I do when I wake up is read wsb and check futures, fuck need an intervention or methadone clinic",t3_f1osqm,74
1581342680.0,2020-02-10,wallstreetbets,fh7rh2w,"No matter if you're a bull or bear, I think we can all agree this market is absolutely retarded.  


Beijing shuts down and highest daily death count reported?? --> futures green.


Literally nothing happens except big money wakes up and snorts some Monday morning coke? --> Fuck it, red again",t3_f1osqm,63
1581333248.0,2020-02-10,wallstreetbets,fh7iaq4,I swear some asshole buys 5k of TSLA stock at 0400 at a premium every other day just to troll everyone.,t3_f1osqm,50
1581334398.0,2020-02-10,wallstreetbets,fh7j60o,MSFT $190 today,t3_f1osqm,43
1581340732.0,2020-02-10,wallstreetbets,fh7p716,Why is RH emailing me about Lizzo,t3_f1osqm,45
1581340767.0,2020-02-10,wallstreetbets,fh7p8dy,"Good to see the paper trading competition is back.  Don't forget to enter all you newbies, it's a great way to learn!",t3_f1osqm,39
1581334240.0,2020-02-10,wallstreetbets,fh7j1no,imagine seeing investors lose billions shorting tesla and following suit 🙊,t3_f1osqm,37
1581336788.0,2020-02-10,wallstreetbets,fh7l60q,"Every morning at 7:11 I spin around three times touch my dick to the ceiling and make a wish.

Today’s wish is that all of you make all the tendies and that all your dreams come true.

XOXO
Gossip Girl",t3_f1osqm,37
1581342387.0,2020-02-10,wallstreetbets,fh7r4dx,MSFT 💪💪😤😤,t3_f1osqm,41
1581336515.0,2020-02-10,wallstreetbets,fh7kx4y,I DECLARE BANKRUPTCY,t3_f1osqm,65
1581350635.0,2020-02-10,wallstreetbets,fh82lqr,Just sold my PTON calls for a 95% loss 💪💪,t3_f1osqm,29
1581335267.0,2020-02-10,wallstreetbets,fh7juxc,How do you guys wait until 9:30am to start this game?  Seems like forever.,t3_f1osqm,29
1581335832.0,2020-02-10,wallstreetbets,fh7kbld,"Every single Monday. I have the chance to buy Tesla low on Friday, but no. Doubting my vibe. Congrats to you retards.",t3_f1osqm,25
1581336448.0,2020-02-10,wallstreetbets,fh7kuz3,So many salty bitches in here because they didn’t buy TSLA calls Friday 🤡,t3_f1osqm,30
1581338924.0,2020-02-10,wallstreetbets,fh7n9z9,How I look like this morning after not buying TSLA calls on Friday: 🤡,t3_f1osqm,28
1581342397.0,2020-02-10,wallstreetbets,fh7r4sh,"Wow. I checked AAPL premarket and it couldn’t have been down a more perfect amount

https://imgur.com/a/ke6MJLN",t3_f1osqm,27
1581341452.0,2020-02-10,wallstreetbets,fh7q06t,You ever meet those people that never stop talking? Lady in my office comes in and doesn’t know when to cut off a conversation. Finally escaped the black hole that is her talking to me and not knowing when to stop,t3_f1osqm,24
1581343291.0,2020-02-10,wallstreetbets,fh7s8aq,I swear to fucking god if you could bottle the feeling of watching Robinhood go from black to white at 9:00 and inject that shit into my veins I would live forever,t3_f1osqm,68
1581341352.0,2020-02-10,wallstreetbets,fh7pw0r,Lmao @ the paper trading thread,t3_f1osqm,22
1581344195.0,2020-02-10,wallstreetbets,fh7tdd5,[deleted],t3_f1osqm,21
1581346289.0,2020-02-10,wallstreetbets,fh7w5vp,"lol TSLA, instantly burning half the new accounts that came in from r/all",t3_f1osqm,21
1581348018.0,2020-02-10,wallstreetbets,fh7ymoe,[deleted],t3_f1osqm,20
1581355264.0,2020-02-10,wallstreetbets,fh89z4m,Is it bad that I trust you retards more than the boomers on CNBC and Fox Buisness  ?,t3_f1osqm,18
1581337118.0,2020-02-10,wallstreetbets,fh7lgto,"Nice TSLA pump article LOL

 

# Google Could Acquire Tesla For $1,500 Per Share On Its Way To $2 Trillion Stock

 [https://www.forbes.com/sites/greatspeculations/2020/02/10/google-could-acquire-tesla-for-1500-per-share-on-its-way-to-2-trillion-stock/#5008939b6e65](https://www.forbes.com/sites/greatspeculations/2020/02/10/google-could-acquire-tesla-for-1500-per-share-on-its-way-to-2-trillion-stock/#5008939b6e65)",t3_f1osqm,18
1581338459.0,2020-02-10,wallstreetbets,fh7mt5h,Once I wake up in the mornings I can never go back to sleep thanks to fucking stonks 😅,t3_f1osqm,19
1581342567.0,2020-02-10,wallstreetbets,fh7rc62,"TSLA doing that Monday gap up again, huh. Does this mean we’re gonna get another 25k subs this week asking if they should get in?",t3_f1osqm,17
1581351827.0,2020-02-10,wallstreetbets,fh84gzk,"I know there are idiots who come in here expecting advice on how to turn their 500 dollar savings into 25,000 but it’s awfully scary that people come in blind with 10-25K asking the subreddit known for losing tons of money in most cases with a few winners how to invest for a quick million.",t3_f1osqm,17
1581334779.0,2020-02-10,wallstreetbets,fh7jgva,I need a tesla short squeeze and fomo at open. 🙏🙏 jump in the damn bandwagon boiz. We need to see the light at 1k.,t3_f1osqm,15
1581339430.0,2020-02-10,wallstreetbets,fh7nsm5,Microsoft is the only stock to buy,t3_f1osqm,17
1581348006.0,2020-02-10,wallstreetbets,fh7ym1f,If MSFT hits 200 by March I’ll shave my balls with a cheese grater,t3_f1osqm,16
1581348605.0,2020-02-10,wallstreetbets,fh7zi55,MSFT just paid for my mistress' abortion.,t3_f1osqm,18
1581362689.0,2020-02-10,wallstreetbets,fh8m6wz,"Jesus fuck wtf was that about, half a day in contest mode?

Fucking mods are shit",t3_f1osqm,17
1581333464.0,2020-02-10,wallstreetbets,fh7igig,MSFT up from 183 to 184 pre-market. My 02/21 190C looking good.,t3_f1osqm,14
1581346004.0,2020-02-10,wallstreetbets,fh7vrs5,"""Boeing CEO filmed throwing customers out of burning 737 as it free falls in a death spiral""

Stock goes up $10",t3_f1osqm,15
1581348636.0,2020-02-10,wallstreetbets,fh7zjsc,MSFT beats ath and just fucking shatters it go baby baby go I’ll buy 20 copies of gears of war 5 ultimate if you keep pumping,t3_f1osqm,15
1581352310.0,2020-02-10,wallstreetbets,fh858sy,"We could go into nuclear war, 50% of the worlds population could get wiped out, and the fucking NASDAQ would still go up .5-1% every day.",t3_f1osqm,15
1581332962.0,2020-02-10,wallstreetbets,fh7i3hc,Alll the homies never forget when futures were -1.5% the night before and you wake up to it being +1.5%✊🏻,t3_f1osqm,14
1581333899.0,2020-02-10,wallstreetbets,fh7isaz,Morning retards,t3_f1osqm,14
1581335418.0,2020-02-10,wallstreetbets,fh7jzee,So for the third time in a row - Tesla pump on mondays?,t3_f1osqm,15
1581338228.0,2020-02-10,wallstreetbets,fh7mkug,"I hate these filthy flat days, Kif. With bulls and bears you know where they stand but with neutrals, who knows? It sickens me.",t3_f1osqm,14
1581338806.0,2020-02-10,wallstreetbets,fh7n5qu,The daily discussion today looks like $TSLA only stonck exchange.,t3_f1osqm,14
1581342181.0,2020-02-10,wallstreetbets,fh7qvac,Everyone please join the paper trading competition. Thanks,t3_f1osqm,13
1581342603.0,2020-02-10,wallstreetbets,fh7rdsa,[deleted],t3_f1osqm,14
1581353749.0,2020-02-10,wallstreetbets,fh87jee,MSFT calls actually brought me back from -3.3k all time to up 50 today holy shit we did it boys,t3_f1osqm,14
1581366496.0,2020-02-10,wallstreetbets,fh8sk79,"If you're losing money today, I dont know what to tell you...",t3_f1osqm,14
1581367229.0,2020-02-10,wallstreetbets,fh8tt2f,"Lol so much for guaranteed red day from weekend bear gang. 

Now run back into the abyss where you belong. You dumb bitch.",t3_f1osqm,13
1581334029.0,2020-02-10,wallstreetbets,fh7ivu3,"TSLA 800 premarket, I have never had less doubt in my vibe",t3_f1osqm,29
1581336814.0,2020-02-10,wallstreetbets,fh7l6ur,[deleted],t3_f1osqm,29
1581335896.0,2020-02-10,wallstreetbets,fh7kdjy,So who went all bear gang on Tesla and calling 460.,t3_f1osqm,13
1581341741.0,2020-02-10,wallstreetbets,fh7qcab,Bought a beautiful new Herman Miller lounge chair over the weekend. Palisander wood finish with rich black full grain leather upholstery. Thanks Elon.,t3_f1osqm,12
1581348804.0,2020-02-10,wallstreetbets,fh7zsud,Congrats msft put holders. You have reached new all time high levels of autism.,t3_f1osqm,13
1581352102.0,2020-02-10,wallstreetbets,fh84wpa,If MSFT ends 188 EOD I'll fuck a mod.,t3_f1osqm,14
1581356665.0,2020-02-10,wallstreetbets,fh8c9ak,Stop this contest mode shit,t3_f1osqm,13
1581348734.0,2020-02-10,wallstreetbets,fh7zp2u,"MSFT !!

🏋️🏋️🚀🚀🚀🚀🌌🌌🌌🌌🚀🌌🌌🌌🚀🌌

LOOK UP ITS A PLANE 

NO ITS MSFT !!

👊💪💪💪💵💵💵💵💵",t3_f1osqm,11
1581348817.0,2020-02-10,wallstreetbets,fh7ztim,Wtf did wsb collectively pump MSFT,t3_f1osqm,13
1581349435.0,2020-02-10,wallstreetbets,fh80r58,CANT FUCKING BUY A MSFT DIP IF THERE IS NO DIP,t3_f1osqm,12
1581352921.0,2020-02-10,wallstreetbets,fh867ld,Any reason on SPCE spike besides pure autism?,t3_f1osqm,12
1581353160.0,2020-02-10,wallstreetbets,fh86la0,[deleted],t3_f1osqm,12
1581355566.0,2020-02-10,wallstreetbets,fh8agpn,"No matter how shit your day is in the market, just remember you didnt make this post:

&#x200B;

[https://www.reddit.com/r/personalfinance/comments/f1qs8w/truck\_payments\_are\_ruining\_my\_life/](https://www.reddit.com/r/personalfinance/comments/f1qs8w/truck_payments_are_ruining_my_life/)",t3_f1osqm,11
1581366624.0,2020-02-10,wallstreetbets,fh8ss4y,[deleted],t3_f1osqm,13
1581367568.0,2020-02-10,wallstreetbets,fh8udum,"Alright, switching homepage to Bing.",t3_f1osqm,13
1581368845.0,2020-02-10,wallstreetbets,fh8wkes,Robinhood should release a bull version of the app where the put button is greyed out and cant be clicked,t3_f1osqm,12
1581340160.0,2020-02-10,wallstreetbets,fh7oklu,"Woke up at 6am, this some bullshit. Monday's are like Christmas mornings now.",t3_f1osqm,11
1581341377.0,2020-02-10,wallstreetbets,fh7px1w,TSLA better hit $1k by next month or lost everything. Premarket looking good,t3_f1osqm,11
1581342228.0,2020-02-10,wallstreetbets,fh7qxai,"Omg I’m so gonna win the paper trading competition, Since I am a professional and all.",t3_f1osqm,11
1581343359.0,2020-02-10,wallstreetbets,fh7sbds,"Good to see the second annul paper trading competition starting up. That’s definitely brightening my mood. 

Good luck everyone!!",t3_f1osqm,12
1581343799.0,2020-02-10,wallstreetbets,fh7svbm,"China CCP has changed how Winnie the flu numbers get reported. No longer counting cases if they test positive but show no symptoms. Expect a sharp decline in number of cases

https://twitter.com/lwcalex/status/1226840055869632512?s=21",t3_f1osqm,12
1581344281.0,2020-02-10,wallstreetbets,fh7thbt,🐂🐃 were YUGE meanies last night so I told mommy 🕵️‍♀️🤱,t3_f1osqm,11
1581345217.0,2020-02-10,wallstreetbets,fh7upqu,"Imagine being fucked by a mouse


#thats me",t3_f1osqm,11
1581345852.0,2020-02-10,wallstreetbets,fh7vkec,"""AAPL rallies on supply chain disruptions, global pandemic""",t3_f1osqm,11
1581347072.0,2020-02-10,wallstreetbets,fh7x9h0,Got an interview for a hedge fund today at 3:30 boys. I think I’ll get the job when I mention I’m on r/wallstreetbets right?🚀,t3_f1osqm,13
1581350371.0,2020-02-10,wallstreetbets,fh8270o,"Applying for a job rn and one of the requirements is ""comfort with manipulation and presentation of financial data"" I shit u not",t3_f1osqm,12
1581351705.0,2020-02-10,wallstreetbets,fh84a2s,Still staring at charts even though my closest exp is a month out. This is not an addiction.,t3_f1osqm,12
1581353967.0,2020-02-10,wallstreetbets,fh87vul,[deleted],t3_f1osqm,12
1581355579.0,2020-02-10,wallstreetbets,fh8ahgz,[deleted],t3_f1osqm,10
1581356896.0,2020-02-10,wallstreetbets,fh8cmt7,This gay contest mode really has got to go,t3_f1osqm,10
1581366354.0,2020-02-10,wallstreetbets,fh8sbiw,"I am calling for an immediate halt on buying puts, until we can figure out WHAT THE HELL is going on.",t3_f1osqm,11
1581367681.0,2020-02-10,wallstreetbets,fh8ukrd,"Can you guess when I started trading options

 [https://imgur.com/a/x8hqBcr](https://imgur.com/a/x8hqBcr)",t3_f1osqm,11
1581340565.0,2020-02-10,wallstreetbets,fh7p0id,"From CNBC ""Jim Cramer expects more bad coronavirus news, calls buying Friday’s sell-off a ‘mistake’"".    
We're going to moon to today boys yeeeehaa! 🐂🚀🚀🚀",t3_f1osqm,21
1581334339.0,2020-02-10,wallstreetbets,fh7j4er,Don't doubt ur vibe.,t3_f1osqm,10
1581335225.0,2020-02-10,wallstreetbets,fh7jtpf,"I started to doubt my vibe after I told my stupid college friends that I was going to be rich on Monday morning. 

But Elon giveth. Elon giveth",t3_f1osqm,9
1581335491.0,2020-02-10,wallstreetbets,fh7k1js,Lord Satya Nutella please guide us to tendieland 🌅,t3_f1osqm,11
1581336552.0,2020-02-10,wallstreetbets,fh7kycw,We are all going to make SO much money today!,t3_f1osqm,9
1581336995.0,2020-02-10,wallstreetbets,fh7lcpq,Need this Msft day to cancel out my Apple day,t3_f1osqm,9
1581337413.0,2020-02-10,wallstreetbets,fh7ls6t,FML - I missed the weekly Monday TSLA tendies train again!  Tried using logic on an autist stock 🤦🏻‍♂️,t3_f1osqm,9
1581338622.0,2020-02-10,wallstreetbets,fh7mz0b,"Today’s gonna be real gay, ain’t it?",t3_f1osqm,10
1581339064.0,2020-02-10,wallstreetbets,fh7nf0j,I bought a TSLA 850c at the low on Friday for no other reason than an expected FOMO on Monday.  Sure enough it's going to save me from holding AAPL calls like a tard instead of taking gains at lunch,t3_f1osqm,10
1581340123.0,2020-02-10,wallstreetbets,fh7oj70,"How many times do we have to teach you this lesson, old man? 

*Looks at $TSLA calls*",t3_f1osqm,9
1581341313.0,2020-02-10,wallstreetbets,fh7puea,The words “ stonks” and “cuck” are severely tainted by these newbies. We need a lingo overhaul,t3_f1osqm,10
1581341890.0,2020-02-10,wallstreetbets,fh7qipo,"very excited to see new blood prove themselves in the paper trading competition, the cream of the crop shall rise to the top",t3_f1osqm,9
1581342408.0,2020-02-10,wallstreetbets,fh7r59q,It’s reassuring that no one here talks about Amazon.,t3_f1osqm,10
1581344007.0,2020-02-10,wallstreetbets,fh7t4tu,Why did I ever trust the 🐀?,t3_f1osqm,10
1581344273.0,2020-02-10,wallstreetbets,fh7tgxx,Whoever has Apple calls just blew up their account.,t3_f1osqm,10
1581347002.0,2020-02-10,wallstreetbets,fh7x5zt,Hey guys don’t forget to participate in the paper trading contest if you are new,t3_f1osqm,9
1581347474.0,2020-02-10,wallstreetbets,fh7xu9x,SPY 333 rejected like a nerd at prom...,t3_f1osqm,10
1581348555.0,2020-02-10,wallstreetbets,fh7zfdw,When are we selling these MSFT calls?,t3_f1osqm,9
1581348843.0,2020-02-10,wallstreetbets,fh7zuvf,"Have you guys heard of this MSFT stock?

Great company. Great people. The best people. We have to protect our companies like MSFT. They like clouds. And they do clouds very well. One of our genius companies, really.",t3_f1osqm,10
1581348945.0,2020-02-10,wallstreetbets,fh800ao,"MSFT $ 


I LOVE U AND YOUR CEO TIM COOK !!!",t3_f1osqm,10
1581355463.0,2020-02-10,wallstreetbets,fh8aanh,MSFT $190 EOW?,t3_f1osqm,10
1581363060.0,2020-02-10,wallstreetbets,fh8mt39,Whichever mod put this in contest mode is just mad they lost 85% of their portfolio today,t3_f1osqm,11
1581364831.0,2020-02-10,wallstreetbets,fh8pr3p,"Went from an account with 90% stock and 10% options to one with 90% options and 10% stock

Went from being excited by 5% gains to questioning whether 100% gains are worth the trouble

Happily found wsb",t3_f1osqm,10
1581364921.0,2020-02-10,wallstreetbets,fh8pwiv,"MSFT all time high bois, let’s ride the bull to death",t3_f1osqm,10
1581368272.0,2020-02-10,wallstreetbets,fh8vlh1,"All you had to do is just buy msft or amd calls whenever they dip. 

But nooooo. I wanna time and call the top on the market!! Let’s try a proven losing strategy with market puts! It’s way sexier than msft and amd calls!! I snorted zerohedge this morning, I’m feeling good about these puts!

Good going bears. Way to miss out on some of the easiest money in your life.",t3_f1osqm,10
1581337838.0,2020-02-10,wallstreetbets,fh7m70o,"**Foxconn restarts key China plant with only 10% workforce**

AAPL down pre-market",t3_f1osqm,18
1581344131.0,2020-02-10,wallstreetbets,fh7tahk,[deleted],t3_f1osqm,19
1581346508.0,2020-02-10,wallstreetbets,fh7wgy6,[deleted],t3_f1osqm,19
1581349164.0,2020-02-10,wallstreetbets,fh80c7t,MSFT is paying for my wife’s  boyfriends new car thank god,t3_f1osqm,20
1581339228.0,2020-02-10,wallstreetbets,fh7nl5z,"**OPEC says they do not like Oil this low.**

 >!THEY ARE TELLING US TO BUY USO CALLS!<",t3_f1osqm,9
1581340359.0,2020-02-10,wallstreetbets,fh7osc9,We should hold a WSB convention - rent out the room next to Comic-Con... prob a lot of the same basement dwellers,t3_f1osqm,8
1581341983.0,2020-02-10,wallstreetbets,fh7qmp1,The 800s are uncharted territory for TSLA during the trading hours.,t3_f1osqm,9
1581342018.0,2020-02-10,wallstreetbets,fh7qo91,"Guys.... Guys.... I think TSLA is gonna be overall flat today, let's just meme SPCE into the 20s.",t3_f1osqm,8
1581342542.0,2020-02-10,wallstreetbets,fh7rb3a,"https://twitter.com/globaltimesnews/status/1226864945926524930

WILL GET MYSELF INFECTED SO I CAN YMCA DANCE WITH CUTE WUHAN GIRLS",t3_f1osqm,9
1581342622.0,2020-02-10,wallstreetbets,fh7reln,[deleted],t3_f1osqm,10
1581342969.0,2020-02-10,wallstreetbets,fh7rts1,My paperback copy of the new WSB book just arrived. Thanks u/jartek.,t3_f1osqm,9
1581343355.0,2020-02-10,wallstreetbets,fh7sb7o,Damn Valentine’s Day this Friday... I swear it was New Years last week,t3_f1osqm,9
1581343551.0,2020-02-10,wallstreetbets,fh7sk22,Time flies when you’re losing money 🍻,t3_f1osqm,9
1581344633.0,2020-02-10,wallstreetbets,fh7txxo,There we go MSFT 🤗,t3_f1osqm,9
1581345234.0,2020-02-10,wallstreetbets,fh7uqjr,[deleted],t3_f1osqm,8
1581348059.0,2020-02-10,wallstreetbets,fh7yovi,“wHaT? hOw DiD i LoSe MoNeY BuYiNg TWTR pUtS aFtEr a 10% dRoP aLrEaDy?” Welcome newcomers.,t3_f1osqm,9
1581348259.0,2020-02-10,wallstreetbets,fh7yzdx,SPCE ship taking off 🚀‼️,t3_f1osqm,10
1581348571.0,2020-02-10,wallstreetbets,fh7zga0,MSFT and SPCE FTW,t3_f1osqm,9
1581348645.0,2020-02-10,wallstreetbets,fh7zk9f,MSFTTTTT,t3_f1osqm,9
1581348676.0,2020-02-10,wallstreetbets,fh7zlxs,"This is just the most fun, you guys.

Just made 2k on my MSFT 180c 2/14",t3_f1osqm,9
1581348765.0,2020-02-10,wallstreetbets,fh7zqq7,HOW DO I HAVE SEX WITH A STOCK,t3_f1osqm,9
1581350119.0,2020-02-10,wallstreetbets,fh81swu,Bought msft calls at the top AMA,t3_f1osqm,9
1581350815.0,2020-02-10,wallstreetbets,fh82vue,Someone doesn’t want Tesla below $760,t3_f1osqm,9
1581351442.0,2020-02-10,wallstreetbets,fh83v2b,My 100% MSFT options portfolio is printing,t3_f1osqm,8
1581352900.0,2020-02-10,wallstreetbets,fh866di,All the stonks on WSB’s watch lists are fucking printing fellas this is our fucking day!,t3_f1osqm,9
1581353353.0,2020-02-10,wallstreetbets,fh86wex,Microsoft passed Apple in marketcap 👀,t3_f1osqm,10
1581353442.0,2020-02-10,wallstreetbets,fh871hu,I've made more money with Microsoft calls in a day than I have within the past 3 months with stocks alone,t3_f1osqm,9
1581354750.0,2020-02-10,wallstreetbets,fh8956a,Come on MSFT break that 187. Don’t Cuck me until tomorrow,t3_f1osqm,8
1581355108.0,2020-02-10,wallstreetbets,fh89q2c,MSFT 190 EOW ez ez,t3_f1osqm,9
1581356156.0,2020-02-10,wallstreetbets,fh8bfb5,Contest mode can suck a bag of dicks!,t3_f1osqm,9
1581356413.0,2020-02-10,wallstreetbets,fh8bue1,TURN OFF CONTEST MODE YOU CUCKS,t3_f1osqm,8
1581359178.0,2020-02-10,wallstreetbets,fh8gemb,Fuck contest mode this shit SUCKS,t3_f1osqm,9
1581362821.0,2020-02-10,wallstreetbets,fh8meu2,MSFT getting resistance at $187. Fed will send it to the moon later this week,t3_f1osqm,9
1581365699.0,2020-02-10,wallstreetbets,fh8r79a,"I fomo'd into tsla at open and lost 800$ in 2 minutes. 

Finishing the day + thanks to Trill Gates",t3_f1osqm,10
1581365766.0,2020-02-10,wallstreetbets,fh8rben,Gonna hold my MSFT 2/14 190c. It’s only gonna go up right,t3_f1osqm,9
1581365912.0,2020-02-10,wallstreetbets,fh8rka9,Just hit 100% weekly gain thanks to MSFT autism. Shoutout to the loser who mocked me when I said I wasn't selling my 02/21 180c when I was up 830%. Up 1300% now (sold half earlier today).,t3_f1osqm,9
1581366570.0,2020-02-10,wallstreetbets,fh8sos6,Guys bears are actually on suicide watch,t3_f1osqm,8
1581367018.0,2020-02-10,wallstreetbets,fh8tga0,MSFT diamond hands gang if we don't sell it will keep going up. HOLD THE LINE,t3_f1osqm,9
1581368411.0,2020-02-10,wallstreetbets,fh8vtx8,BEAR GANG IS PISSED,t3_f1osqm,9
1581368420.0,2020-02-10,wallstreetbets,fh8vugv,MSFT 188.70 EOD what a frickin day,t3_f1osqm,9
1581368564.0,2020-02-10,wallstreetbets,fh8w399,That power hour run,t3_f1osqm,11
1581368588.0,2020-02-10,wallstreetbets,fh8w4pu,"I was actually up 51% on the day, how is this even possible lmfao",t3_f1osqm,7
1581338277.0,2020-02-10,wallstreetbets,fh7mmnb,"One of you guys need to become a journalist for CNBC, Bloomberg or Forbes and publish opinion articles on Meme stocks on red days to save our calls. Like the recent opinion on TSLA $1500 buyout by GOOGL",t3_f1osqm,14
1581344372.0,2020-02-10,wallstreetbets,fh7tlkz,[deleted],t3_f1osqm,16
1581332775.0,2020-02-10,wallstreetbets,fh7hyn9,[deleted],t3_f1osqm,9
1581335824.0,2020-02-10,wallstreetbets,fh7kbcr,TSLA headed to mars on Falcon Heavy 🚀🚀🚀,t3_f1osqm,7
1581336561.0,2020-02-10,wallstreetbets,fh7kyn2,"The Tesla rocket is refueled and ready, 875 today 1k by EOW",t3_f1osqm,8
1581337427.0,2020-02-10,wallstreetbets,fh7lsnm,Anyone buying TSLA calls at open or just my autistic FOMO ass?,t3_f1osqm,9
1581337474.0,2020-02-10,wallstreetbets,fh7luaj,So lucky selling my Tesla puts on Friday.,t3_f1osqm,9
1581341398.0,2020-02-10,wallstreetbets,fh7pxxw,I wish tesla opens at 1000 so I don't have to worry about make hard decisions to sell my 775 Feb 14 calls or wait,t3_f1osqm,9
1581341999.0,2020-02-10,wallstreetbets,fh7qndo,Odds Robinhood opens glitchy?,t3_f1osqm,8
1581342069.0,2020-02-10,wallstreetbets,fh7qqf9,"Makes me happy the one time I buy Apple calls it takes a big ole dookie, riding it out till 2/28 fuckin yolooooo",t3_f1osqm,8
1581342197.0,2020-02-10,wallstreetbets,fh7qvzm,"might fomo into spce today, so i can pretend to be a genius till earnings",t3_f1osqm,7
1581342692.0,2020-02-10,wallstreetbets,fh7rhk9,[deleted],t3_f1osqm,9
1581343039.0,2020-02-10,wallstreetbets,fh7rx10,"STAY OUT OF WENDYS!!!

L2FMW IS SICK AND STILL WORKING",t3_f1osqm,8
1581343040.0,2020-02-10,wallstreetbets,fh7rx2e,Apparently Tim is rubbing off on his company.  Aapl has caught the 🌈,t3_f1osqm,7
1581343676.0,2020-02-10,wallstreetbets,fh7sprw,"And to think 2/3 of last nights comments were ""Bears r gay"" and ""BLOOD green futurez!""",t3_f1osqm,9
1581344143.0,2020-02-10,wallstreetbets,fh7tazs,"My play:

Buy TSLA straddle on open

Vega crush as it trades flat for a whole hour

Rope",t3_f1osqm,8
1581344991.0,2020-02-10,wallstreetbets,fh7uf14,Mods are so fucking gay.,t3_f1osqm,8
1581345217.0,2020-02-10,wallstreetbets,fh7upqh,MSFT U BETTER GO TO THE MOON OR ELSE MY RENT IS BILLED TO YOU,t3_f1osqm,7
1581345566.0,2020-02-10,wallstreetbets,fh7v6k0,"People think they understand TSLA, truth is no one knows what the fuck is up with that stock.",t3_f1osqm,8
1581346255.0,2020-02-10,wallstreetbets,fh7w45n,The real enemy today is Theta gang.,t3_f1osqm,9
1581347124.0,2020-02-10,wallstreetbets,fh7xc8j,ITS SIMPLE. Dont doubt your vibe ❌,t3_f1osqm,8
1581347465.0,2020-02-10,wallstreetbets,fh7xttm,MSFT 🚀🚀🚀🚀,t3_f1osqm,8
1581348578.0,2020-02-10,wallstreetbets,fh7zgmq,come on msft lets see $186,t3_f1osqm,8
1581348608.0,2020-02-10,wallstreetbets,fh7zib2,MSFT the gift that keeps on giving,t3_f1osqm,8
1581348625.0,2020-02-10,wallstreetbets,fh7zj7x,Sold my 1/15/21 MSFT $210 calls on Jan 30th.  AMA,t3_f1osqm,8
1581348836.0,2020-02-10,wallstreetbets,fh7zuik,Is MSFT joking right now?  lol,t3_f1osqm,9
1581348863.0,2020-02-10,wallstreetbets,fh7zvyl,my only regret is buying MSFT calls in my traditional IRA and not my Roth. need those tax-free tendies,t3_f1osqm,9
1581349064.0,2020-02-10,wallstreetbets,fh806te,MSFT TO THE FUCKING MOON BOYS !,t3_f1osqm,8
1581349140.0,2020-02-10,wallstreetbets,fh80az9,TAKE MY BODY MSFT,t3_f1osqm,7
1581349277.0,2020-02-10,wallstreetbets,fh80ieg,"Up 140% total on my 3/20 MSFT contracts, gonna wait till %500 and sell.",t3_f1osqm,7
1581349285.0,2020-02-10,wallstreetbets,fh80iwl,Microsoft should change their name to Tendiesoft.,t3_f1osqm,8
1581349396.0,2020-02-10,wallstreetbets,fh80ozi,"keep pumping MSFT, i bought calls at the top like a retard",t3_f1osqm,9
1581349405.0,2020-02-10,wallstreetbets,fh80pgo,[deleted],t3_f1osqm,9
1581349524.0,2020-02-10,wallstreetbets,fh80w36,MSFT paying for my wifes boyfriends penis enlargement surgery,t3_f1osqm,9
1581349753.0,2020-02-10,wallstreetbets,fh818p1,Up 500% on some of my $MSFT calls. This is ridiculous.,t3_f1osqm,8
1581349914.0,2020-02-10,wallstreetbets,fh81hn6,Just fuck me up TSLA. Make me pay for my greed and erase my MSFT gains,t3_f1osqm,8
1581350003.0,2020-02-10,wallstreetbets,fh81mju,"This is amazing. As Tesla drops, i lose money on puts. Can’t explain it",t3_f1osqm,9
1581350965.0,2020-02-10,wallstreetbets,fh83457,China injected over $300 billion over the last 4 weeks and the effect has been it's markets dropping 6.5% instead of 11%. Meanwhile US is making new highs on their pump. Seems like a real lose-lose for them. America fuck yeah.,t3_f1osqm,8
1581351009.0,2020-02-10,wallstreetbets,fh836n1,My portfolio finally past the 10k gain. Only took me 500 days.,t3_f1osqm,8
1581351267.0,2020-02-10,wallstreetbets,fh83l8a,Shoo shoo theta goblins,t3_f1osqm,7
1581351425.0,2020-02-10,wallstreetbets,fh83u19,I def bought tsla shares at the wrong moment,t3_f1osqm,8
