created,date,subreddit,id,body,parent_id,score
1581611169.0,2020-02-13,wallstreetbets,fhht0b9,[deleted],t3_f38dq2,9
1581611582.0,2020-02-13,wallstreetbets,fhhtqpr,I’m literally cumming on bears,t3_f38dq2,10
1581611904.0,2020-02-13,wallstreetbets,fhhubc2,"Up 60% for the week 🤯🌝❤😫👍🐂😤🐔

Gonna just take the gains, eat my tendies, and wait for next week",t3_f38dq2,10
1581612697.0,2020-02-13,wallstreetbets,fhhvq7n,Man when the fuck is the contract announcement,t3_f38dq2,12
1581613953.0,2020-02-13,wallstreetbets,fhhxykz,i'm so bored I almost started working.,t3_f38dq2,9
1581614261.0,2020-02-13,wallstreetbets,fhhyi0w,"Fellow MSFT diciples...please take a moment to pray with me

I have made a shrine to Judge Patricia E Campbell Smith

https://i.imgur.com/3sjnwPr.png

Amen
🙏🙏🙏",t3_f38dq2,9
1581616235.0,2020-02-13,wallstreetbets,fhi1zhr,"Every time I stare at MSFT chart, it drops 20 cents within 5-10 seconds, like literally every single time. This happened like 30 times in the last 3 days alone. I must have a cursed stare.

If I never looked at MSFT chart at all, it would have been $190 right now.",t3_f38dq2,11
1581616282.0,2020-02-13,wallstreetbets,fhi22g0,Stuck in a meeting that could have been an email and don't have any open positions. 🤒🤒🤒🤒,t3_f38dq2,9
1581617400.0,2020-02-13,wallstreetbets,fhi43ul,msft bout to go straight to 190,t3_f38dq2,10
1581617797.0,2020-02-13,wallstreetbets,fhi4v01,this fucking MSFT roller coaster man,t3_f38dq2,10
1581619919.0,2020-02-13,wallstreetbets,fhi8s3e,[deleted],t3_f38dq2,11
1581621204.0,2020-02-13,wallstreetbets,fhiaydi,Well fuck us all. RIP MSFT. Fuck that judge,t3_f38dq2,11
1581623144.0,2020-02-13,wallstreetbets,fhieg1t,From down 7k to closing in on breaking even. Dont doubt your vibe fellas. Diamond hands 💎🙌,t3_f38dq2,10
1581623470.0,2020-02-13,wallstreetbets,fhif0vw,I started yelling at my screen and msft started climbing a little bit am i a god,t3_f38dq2,10
1581624327.0,2020-02-13,wallstreetbets,fhigk7t,Just knowing that if the work order doesnt get halted that MSFT would have hit 188 makes me sick,t3_f38dq2,11
1581625289.0,2020-02-13,wallstreetbets,fhii9z6,Fuck it holding SPCE through tomorrow,t3_f38dq2,12
1581625730.0,2020-02-13,wallstreetbets,fhij2rq,Can't wait for the CNBC alert: Stocks little changed as tomorrow is valentine's day,t3_f38dq2,9
1581626101.0,2020-02-13,wallstreetbets,fhijqm4,Wow today went from good to bad pretty quick,t3_f38dq2,9
1581626327.0,2020-02-13,wallstreetbets,fhik574,Who else lost money this week!!,t3_f38dq2,10
1581627698.0,2020-02-13,wallstreetbets,fhimm68,"Is there a particular reason females don't trade options? Or even own stocks? 

Not that I know many girls, but  the ones I have asked always say no and think I'm joking. Much like when I ask them out.",t3_f38dq2,11
1581627961.0,2020-02-13,wallstreetbets,fhin337,At least MSFT got a price target upgrade today,t3_f38dq2,11
1581628318.0,2020-02-13,wallstreetbets,fhinqc6,I would be fine this week if I didn't buy 50 shares of MSFT at $190.60,t3_f38dq2,10
1581623491.0,2020-02-13,wallstreetbets,fhif282,"Lol at the WSB highschoolers shitting on one of the strongest blue chip stocks in existence, and how dumb everyone is for buying into it, as they dump their McDonald's wage into a fucking space ship company that doesn't have a spaceship. You guys are waiting for earnings of a company that doesn't have a product yet. If you have Microsoft calls a month or more out, you're fine so shut the fuck up, rip weekly's but that's what you get for playing weekly's.",t3_f38dq2,19
1581594078.0,2020-02-13,wallstreetbets,fhh54vh,[deleted],t3_f38dq2,18
1581618765.0,2020-02-13,wallstreetbets,fhi6oet,"I think Microsoft is about to hit 190 in like 20 minutes , no proof , but I have a really good feeling",t3_f38dq2,17
1581596788.0,2020-02-13,wallstreetbets,fhh7r0t,[removed],t3_f38dq2,9
1581597832.0,2020-02-13,wallstreetbets,fhh8w5r,I love waking up and immediately being demoralized,t3_f38dq2,7
1581598052.0,2020-02-13,wallstreetbets,fhh95af,"At least the normies got slapped down almost immediately this time

The CTN normies got a couple of easy green months before they experienced their first dip",t3_f38dq2,8
1581598356.0,2020-02-13,wallstreetbets,fhh9hq6,Holy fuck I just bought TSLA monthlies yesterday. Fuck me in the ass Elon,t3_f38dq2,9
1581598574.0,2020-02-13,wallstreetbets,fhh9qyz,"Elon cucked the bulls.  He said no capital raise in the last conference call. Today, he raises 2B in stock offering.",t3_f38dq2,8
1581599400.0,2020-02-13,wallstreetbets,fhhaq8a,"I think it’s pretty obvious now. Load up on calls Monday-Wednesday. And load up on puts Thursday-Friday 

Anyone holding calls after the pumps these last few days are greedy af",t3_f38dq2,9
1581599679.0,2020-02-13,wallstreetbets,fhhb2ti,I bought Microsoft calls but feeling pretty good about them. What's everyone complaining about?,t3_f38dq2,8
1581599723.0,2020-02-13,wallstreetbets,fhhb4u4,We all know the truth. WSB murdered TSLA MSFT and now SPCE. Please do AAPL bois 🤗,t3_f38dq2,9
1581600309.0,2020-02-13,wallstreetbets,fhhbvtp,Msft does well during the rough times of cabrona virus. It’s showing again. Keep it up.,t3_f38dq2,8
1581600551.0,2020-02-13,wallstreetbets,fhhc76n,Honestly a smart move by TSLA for offering these shares now after this insane run up. This will allow them to more easily fulfill their shorter term financial obligations and keep their expansion moving. Some short term downside here but I see this as a positive move overall.,t3_f38dq2,9
1581601212.0,2020-02-13,wallstreetbets,fhhd3ck,"Yaaaaaaay everybody, baba dropped on a great report!!! Yaaaaaaay I love this market, it's totally not fucking gay!!",t3_f38dq2,9
1581601242.0,2020-02-13,wallstreetbets,fhhd4th,Let’s see those macrohard diamond hands boys 💎✋🏻💎 😭,t3_f38dq2,8
1581601793.0,2020-02-13,wallstreetbets,fhhdwex,Looks like I triple down on $MSFT $ICE $TSN calls today children,t3_f38dq2,9
1581601959.0,2020-02-13,wallstreetbets,fhhe4qk,[deleted],t3_f38dq2,9
1581602562.0,2020-02-13,wallstreetbets,fhheyvg,My portfolio is GUHing this week,t3_f38dq2,7
1581602673.0,2020-02-13,wallstreetbets,fhhf4dn,"WTF china 

Huangzhou District, which is part of Huanggang and close to Wuhan, has issued a 500 yuan ($71) reward for anyone who reports a person suffering from fever",t3_f38dq2,9
1581602702.0,2020-02-13,wallstreetbets,fhhf5s7,TSLA is 1% higher since the news of raising cash... LOL,t3_f38dq2,11
1581603696.0,2020-02-13,wallstreetbets,fhhgkfu,I swear half of y’all can’t see past the last 20 minutes. I see “RIP AMD” because it’s down 1% on a 10% run this week,t3_f38dq2,10
1581603734.0,2020-02-13,wallstreetbets,fhhgmdc,"BE STRONG BROTHAS! 
THE MARKET IS TESTING YOUR HANDS!
DO NOT BE WEAK! 
HOLD!",t3_f38dq2,9
1581603869.0,2020-02-13,wallstreetbets,fhhgth0,Microsoft upgraded bois we going green,t3_f38dq2,9
1581604619.0,2020-02-13,wallstreetbets,fhhhy5f,SPCE to the moon,t3_f38dq2,9
1581604656.0,2020-02-13,wallstreetbets,fhhi09a,Thank you SPCE! 😁👨🏿‍🚀🚀🚀,t3_f38dq2,10
1581604993.0,2020-02-13,wallstreetbets,fhhiiwd,Portfolio full of MSFT and BABA calls. Just deleted RH. Will check a week or two before 4/17 when they expire,t3_f38dq2,8
1581605258.0,2020-02-13,wallstreetbets,fhhixjg,Lol SPCE bears got pump faked right off the court,t3_f38dq2,10
1581605769.0,2020-02-13,wallstreetbets,fhhjquf,"To my beloved: $MSFT

It’s okay Microsoft-kun take all the time that you need :). You can rest today, tomorrow and the weekend if you’d like! Just be healthy and strong whenever you’re ready! 

Yours truly, 

Retard

PS I love you",t3_f38dq2,8
1581605770.0,2020-02-13,wallstreetbets,fhhjqxz,TSLA has an unbelievable and irrational amount of pure retard strength.,t3_f38dq2,9
1581606677.0,2020-02-13,wallstreetbets,fhhl7yy,SPCE to the Mooooooooon,t3_f38dq2,9
1581606717.0,2020-02-13,wallstreetbets,fhhladp,It just feels like MSFT is waiting to pop off. Getting green balls.,t3_f38dq2,10
1581606976.0,2020-02-13,wallstreetbets,fhhlpp5,[deleted],t3_f38dq2,9
1581608970.0,2020-02-13,wallstreetbets,fhhp62o,Should’ve just dumped all my money into SPCE... but noo I tried to DivErSifY,t3_f38dq2,8
1581609000.0,2020-02-13,wallstreetbets,fhhp7ws,You guys seeing this right? SPCE is looking to pump to $25,t3_f38dq2,9
1581609128.0,2020-02-13,wallstreetbets,fhhpg0m,"spce.

the tendie frontier.

these are the voyagers of the autist entreeeeeeprise

it's intraday mission: to diamondhand calls bought last month

to seek out bears and laugh at their puts

to boldly blow richard branson like he's never been blown before",t3_f38dq2,9
1581609392.0,2020-02-13,wallstreetbets,fhhpwum,MSFT COME ON BABY,t3_f38dq2,9
1581609725.0,2020-02-13,wallstreetbets,fhhqhyo,"Diamond fucking hands on the microsoft options turnaround, shout-out everyone who bout in under $1",t3_f38dq2,9
1581610133.0,2020-02-13,wallstreetbets,fhhr7ge,DIAMOND HANDS MSFT LETS FUCKING GO BABY GREEN FOR THE DUB,t3_f38dq2,9
1581610380.0,2020-02-13,wallstreetbets,fhhrmtc,Made enough tendies today to by general admission tickets  for rage against the machine. Fuck yesssssss,t3_f38dq2,9
1581610736.0,2020-02-13,wallstreetbets,fhhs8yf,[deleted],t3_f38dq2,8
1581611553.0,2020-02-13,wallstreetbets,fhhtotv,"Is it possible a community is more autistic than WSB? The people at Stocktwits are even worse than us, but they don’t know it. They are so unbelievably confident, yet still wrong like 90% of the time. At least we know we are bad at this.",t3_f38dq2,9
1581611718.0,2020-02-13,wallstreetbets,fhhtzik,Cmonnnn BABA march to green,t3_f38dq2,8
1581611987.0,2020-02-13,wallstreetbets,fhhuglv,I’m holding msft regardless into the weekend so fuck it 🥴,t3_f38dq2,9
1581612815.0,2020-02-13,wallstreetbets,fhhvxrj,MSFT refueling,t3_f38dq2,9
1581612876.0,2020-02-13,wallstreetbets,fhhw1n2,Just a reminder that bears are not only gay but also retarded,t3_f38dq2,9
1581613793.0,2020-02-13,wallstreetbets,fhhxo9x,I’m down 70% today fml,t3_f38dq2,9
1581613981.0,2020-02-13,wallstreetbets,fhhy0bp,"Market's rigged, QE until April
Stonks only go up
Imagine being a bear
Bears R Fuk
I have $6, where to yolo?
Should I hold MSFT, hands are getting weak? Reassure me
Diamond hands or gay, pussy, cuck, retard
TSLA retard strength
Tendies tendies tendies

Daily discussion 02/13 summary. No need to read any further",t3_f38dq2,9
1581614160.0,2020-02-13,wallstreetbets,fhhybnn,Bears were parading through the streets last night talking about futures and some other bullshit... I really feel bad for them 📈,t3_f38dq2,9
1581614168.0,2020-02-13,wallstreetbets,fhhyc46,The market is like stop lights in GTA. Green means go and red means who the fuck cares go anyway,t3_f38dq2,8
1581614170.0,2020-02-13,wallstreetbets,fhhyc88,Lmao. We actually reached new ATH today after the so-called bloodbath overnight on futures.,t3_f38dq2,10
1581614628.0,2020-02-13,wallstreetbets,fhhz5gp,Feeling cute might buy some TSLA fds idk 🥰🥰👀,t3_f38dq2,9
1581615060.0,2020-02-13,wallstreetbets,fhhzwrm,"People say we always drop on Fridays before 3 day weekends but after looking at data for the last 5 years, I found zero evidence of it. In fact, markets were up 2/3 of Fridays when we had a 3 day weekend coming. Remember to look at actual data and test your theories folks.",t3_f38dq2,9
1581615095.0,2020-02-13,wallstreetbets,fhhzyx4,what the fuck why am I sitting here staring at the drying paint that is microsoft TSLA is insane,t3_f38dq2,9
1581615280.0,2020-02-13,wallstreetbets,fhi0aje,"Sold the SPCE gain and jumped into TSLA. Up 95% in the last 20 minutes. Yeah, this is how I wished I could spend every trading day. Granted I'd be rich and have to leave you autists. What fun would that be?",t3_f38dq2,9
1581616223.0,2020-02-13,wallstreetbets,fhi1ypt,"Everyone waiting for a SPCE entry point THIS IS IT PEOPLE

GEt ready for lift off after we fuel up with rocket fuel and crunchwrap supremes get the fuck in",t3_f38dq2,9
1581617200.0,2020-02-13,wallstreetbets,fhi3q3p," [https://www.cnbc.com/2020/02/13/trump-fed-nominee-judy-shelton-hammered-by-democrats-in-confirmation-hearing.html](https://www.cnbc.com/2020/02/13/trump-fed-nominee-judy-shelton-hammered-by-democrats-in-confirmation-hearing.html)   


* once advocated a return to the gold standard
* criticized FDIC insurance
* believes the Fed should be subservient to White House
* agrees with Trump that rates should be lowered to match Europe's

Having this woman on the Fed board would be almost exactly like if Trump himself were on the Fed board.",t3_f38dq2,9
1581617418.0,2020-02-13,wallstreetbets,fhi452w,lul bought 2/14 TSLA calls at 810 i'm guhtarded,t3_f38dq2,9
1581617538.0,2020-02-13,wallstreetbets,fhi4dbs,Theta gang must be raking it in on MSFT this week,t3_f38dq2,10
1581617814.0,2020-02-13,wallstreetbets,fhi4w4h,I'm holding out on JEDI news and I know it's a waste of time but I'm committed at this point to losing -50% on MSFT,t3_f38dq2,9
1581618433.0,2020-02-13,wallstreetbets,fhi622r,"Alright guys, here me out.

&#x200B;

ADOBE

&#x200B;

Earnings are in one month. The stock has been rock solid the last 6 months. You couldn't get a more perfect looking trend line if you tried. This thing seems like its a tank, but I could see a good run-up to earnings. Premiums are not even that much either.  An ATM call for 3/20 only needs a 4.1% increase in the next month, meanwhile it has averaged 9%/mo the last three months without an earnings stimulus. I also saw a guy on here awhile back who worked for Adobe expressing quite a bit of confidence in their stuff. SaaS? I am in. Once I get my Schwab brokerage set up, I am going to put the chips on the table for this sob. Call me a noob or whatever, but if we add up our IQs, we should be able to come together on a halfway decent idea",t3_f38dq2,9
1581618485.0,2020-02-13,wallstreetbets,fhi65n9,"100+ year bull market baby. Here is to another 100 years.

https://media.ycharts.com/charts/a0f0df80bf946d165c5c75bd4c98f3b9.png",t3_f38dq2,9
1581619027.0,2020-02-13,wallstreetbets,fhi75up,"Guys, every time you’re about to buy into something after a huge jump/dip, just say “no FOMO” before you do it and you’re good.",t3_f38dq2,9
1581619033.0,2020-02-13,wallstreetbets,fhi769c,Fuck this liquidity of posts. Anything posted gets buried within 30 seconds.,t3_f38dq2,8
1581619841.0,2020-02-13,wallstreetbets,fhi8n5o,[removed],t3_f38dq2,9
1581619884.0,2020-02-13,wallstreetbets,fhi8pxh,Dimond hands 💎💎💰💰🚀🚀,t3_f38dq2,8
1581620311.0,2020-02-13,wallstreetbets,fhi9gq5,MSFT is making me want to fucking yolo into some AMD and NVDA calls right now,t3_f38dq2,9
1581621641.0,2020-02-13,wallstreetbets,fhibpzn,MSFT takin some noobs for the ride of their lives rn lol,t3_f38dq2,8
1581622027.0,2020-02-13,wallstreetbets,fhicew3,[deleted],t3_f38dq2,11
1581622032.0,2020-02-13,wallstreetbets,fhicf75,Nope. IM NOT FUCKING SELLING 😤😤,t3_f38dq2,9
1581623443.0,2020-02-13,wallstreetbets,fhiez55,Big LOL if MSFT ends green today,t3_f38dq2,8
1581623658.0,2020-02-13,wallstreetbets,fhifd4l,MSFT about to be green again lol. So glad those idiots with the weak hands sold all their stock lol.,t3_f38dq2,8
1581624574.0,2020-02-13,wallstreetbets,fhih03s,Buy high sell low my gays,t3_f38dq2,9
1581625343.0,2020-02-13,wallstreetbets,fhiidgi,Dude every day I lose more & more money. Sigh,t3_f38dq2,8
1581626108.0,2020-02-13,wallstreetbets,fhijr3o,MSFT I swear to god if you go red I am going to throw my laptop out the window,t3_f38dq2,11
1581626542.0,2020-02-13,wallstreetbets,fhikj7o,Diamond hands have brought me nothing but losses this week but hey at least I have diamond hands,t3_f38dq2,9
1581626947.0,2020-02-13,wallstreetbets,fhil9i8,"MSFT gonna moon any minute now 


Aaaanny minute now . . .",t3_f38dq2,9
1581626995.0,2020-02-13,wallstreetbets,fhilco3,"I got out of my calls in anticipation for red Friday 

Wait for Friday to be greener than Shrek’s ass",t3_f38dq2,10
1581627337.0,2020-02-13,wallstreetbets,fhilyuc,Got about 80% of my roth IRA is SPY puts expiring tuesday.,t3_f38dq2,10
1581627510.0,2020-02-13,wallstreetbets,fhima0k,"MSFT is down 4% from Tuesday open, is JEDI seriously worth 60 billion?",t3_f38dq2,7
1581612982.0,2020-02-13,wallstreetbets,fhhw8ch,"careful guys, MSFT about to do the [batman pattern](https://i.imgur.com/n9DlmTo.png)!",t3_f38dq2,17
1581601368.0,2020-02-13,wallstreetbets,fhhdb5e,"Microsoft announcement today over cloud government deal. 


Amazon isn’t getting shit. 


Adding more Microsoft calls in the morning 

🚀🚀🚀🚀🚀",t3_f38dq2,15
1581592471.0,2020-02-13,wallstreetbets,fhh3sxk,"DEAC has risen $4.15 (28.92%) from $14.35 to $18.50 per share in the past week and doesn't show any signs of stopping. Up 126.32% on 05/15 calls @ $.95. So tell me WSB, what the fuck are you waiting for?",t3_f38dq2,8
1581592624.0,2020-02-13,wallstreetbets,fhh3x8g,CSCO kid wasn't a friend of mine,t3_f38dq2,9
1581593241.0,2020-02-13,wallstreetbets,fhh4fck,BTFD HASNT STOPPED WORKING YET GOING ON 10 YEARS.,t3_f38dq2,7
1581594655.0,2020-02-13,wallstreetbets,fhh5njh,Bear gains slipping already lost sleep for no damn good reason. Big money buying the dip lets go.,t3_f38dq2,8
1581595214.0,2020-02-13,wallstreetbets,fhh666p,Calls on fire sale today,t3_f38dq2,8
1581597018.0,2020-02-13,wallstreetbets,fhh7zyn,This is with a repo operation not a shot in hell foxconn opens up next week and Singapore’s cases are about to exponential. Worry is going to set in today tomorrow by Monday. Which puts to by which puts anyone got any good ideas?,t3_f38dq2,7
1581598246.0,2020-02-13,wallstreetbets,fhh9d6e,[deleted],t3_f38dq2,8
1581598268.0,2020-02-13,wallstreetbets,fhh9e2h,TSLA announces 2B stock offering.  RiP tsla 1000 bulls.,t3_f38dq2,8
1581598578.0,2020-02-13,wallstreetbets,fhh9r60,Looks like I blew my account up yet again with fds....,t3_f38dq2,9
1581598599.0,2020-02-13,wallstreetbets,fhh9s1e,"I’m really excited to see if the market displays its retard strength at open. Chinese money trying to escape, not-QE, and plain old pumping could still save us.

Otherwise, it’s 💎🤚time.",t3_f38dq2,8
1581599318.0,2020-02-13,wallstreetbets,fhhamiu,SPCE down 4% in after hours FUCK,t3_f38dq2,8
1581600575.0,2020-02-13,wallstreetbets,fhhc8bm,[deleted],t3_f38dq2,7
1581600829.0,2020-02-13,wallstreetbets,fhhckkl,Spicy SPCE dip,t3_f38dq2,9
1581601234.0,2020-02-13,wallstreetbets,fhhd4f5,"Boarding a plane. If markets kill me while flying, remember me.",t3_f38dq2,8
1581601315.0,2020-02-13,wallstreetbets,fhhd8go,"I hope SPCE and DEAC don't care about Corona. I don't see why they would, really.",t3_f38dq2,7
1581602100.0,2020-02-13,wallstreetbets,fhhebqj,Rocketships don't dip. They either blast off or explode like the Columbia. Do with this what you will,t3_f38dq2,8
1581602402.0,2020-02-13,wallstreetbets,fhheqst,Alexa play The Red by Chavelle,t3_f38dq2,8
1581602756.0,2020-02-13,wallstreetbets,fhhf8fo,Thanks to you guys I hate MSFT,t3_f38dq2,8
1581603265.0,2020-02-13,wallstreetbets,fhhfy4m,Payday on a dip day is problematic. Gonna get carried away.,t3_f38dq2,8
1581604403.0,2020-02-13,wallstreetbets,fhhhm6l,SPCE destroyed my puts already GG,t3_f38dq2,8
1581604607.0,2020-02-13,wallstreetbets,fhhhxhc,SPCE is going nuts.,t3_f38dq2,7
1581604633.0,2020-02-13,wallstreetbets,fhhhyxg,AHAHAHAHA $SPCE you sexy son of a bitch,t3_f38dq2,8
1581604679.0,2020-02-13,wallstreetbets,fhhi1il,At this rate SPCE will actually hit 30$ soon,t3_f38dq2,8
1581604761.0,2020-02-13,wallstreetbets,fhhi60h,when are they announcing the ruling on MSFT/AMZN,t3_f38dq2,9
1581604941.0,2020-02-13,wallstreetbets,fhhifxx,SPCE getting ready to blast through the pathetic resistance at $24. We're headed to $26 today folks!,t3_f38dq2,8
1581605136.0,2020-02-13,wallstreetbets,fhhiqtu,Wow holding SPCE is really free money,t3_f38dq2,7
1581605499.0,2020-02-13,wallstreetbets,fhhjbbb,I’m starting to see a reverse cock and ball formation on Microsoft rn.,t3_f38dq2,8
1581606307.0,2020-02-13,wallstreetbets,fhhkm1p,Plz msft it’s rocket time 📈🚀🚀💂🏽,t3_f38dq2,8
1581607551.0,2020-02-13,wallstreetbets,fhhmo8s,Holy fucking shit Rick Santelli just loooost it on CNBC,t3_f38dq2,8
1581608373.0,2020-02-13,wallstreetbets,fhho3vq,Would you believe msft actually got upgraded today? I wouldn’t.,t3_f38dq2,7
1581608554.0,2020-02-13,wallstreetbets,fhhofdy,I am getting raaaaaped by theta this week. My SPY and MSFT calls might as well be toilet paper.,t3_f38dq2,7
1581608960.0,2020-02-13,wallstreetbets,fhhp5fm,Anyone know what time the MSFT announcement is?,t3_f38dq2,8
1581609363.0,2020-02-13,wallstreetbets,fhhpv20,MSFT OFF TO THE MOOOON,t3_f38dq2,8
1581609473.0,2020-02-13,wallstreetbets,fhhq24o,microsoft fucking goooooo,t3_f38dq2,7
1581609703.0,2020-02-13,wallstreetbets,fhhqgnr,"$MSFT 2/21 192c are slowly creeping back. Still fucked, but less fucked",t3_f38dq2,8
1581609732.0,2020-02-13,wallstreetbets,fhhqig1,MSFT MOON MISSION RESUMED,t3_f38dq2,9
1581609942.0,2020-02-13,wallstreetbets,fhhqvkh,TSLA proves how disconnected the market is from reality.,t3_f38dq2,7
1581609998.0,2020-02-13,wallstreetbets,fhhqz2f,"MSFT taking a 3 minute refuel break, stand by",t3_f38dq2,7
1581610002.0,2020-02-13,wallstreetbets,fhhqzbs,MSFT hit $186.20 and it acted like it hit a brick wall. We'll try again though.,t3_f38dq2,8
1581610424.0,2020-02-13,wallstreetbets,fhhrpkw,TSLA 🐻s feeling the pain today,t3_f38dq2,7
1581610722.0,2020-02-13,wallstreetbets,fhhs81s,I wish someone had warned us three days in a row that SPCE would be >6%,t3_f38dq2,8
1581610922.0,2020-02-13,wallstreetbets,fhhskk5,TSLA 2/14 1000c was free money. Bought at 0.08 now at 0.12 😎.,t3_f38dq2,8
1581610925.0,2020-02-13,wallstreetbets,fhhskpz,"If you’re not bullish now, idk when you ever will be.",t3_f38dq2,8
1581611704.0,2020-02-13,wallstreetbets,fhhtym4,"Fuck Bezos tryna scheme and take over the world, crying that they didn't get the contract. This judge better tell him better luck next time, MSFT 190 EOW",t3_f38dq2,8
1581611812.0,2020-02-13,wallstreetbets,fhhu5k3,186 is lava,t3_f38dq2,8
1581613258.0,2020-02-13,wallstreetbets,fhhwq6t,[deleted],t3_f38dq2,8
1581613315.0,2020-02-13,wallstreetbets,fhhwtra,What’s so funny is when the virus is “contained” markets are going to explode higher again.....it’s just non stop up,t3_f38dq2,7
1581613902.0,2020-02-13,wallstreetbets,fhhxv8p,"Every day, I always have the same ragrets. Why didn’t I buy more SPCE LEAPS?",t3_f38dq2,7
1581615156.0,2020-02-13,wallstreetbets,fhi02qk,TSLA BEARS ARE SO MAD. LMAO. THEY ALREADY LOST BILLIONS THIS YEAR ALONE.,t3_f38dq2,8
1581615176.0,2020-02-13,wallstreetbets,fhi0418,I love when TSLA acts like TSLA.  Straight fucking retarded.,t3_f38dq2,8
1581615350.0,2020-02-13,wallstreetbets,fhi0f07,TSLA IS BACK ON ITS BULLSHIT BOYES,t3_f38dq2,9
1581615529.0,2020-02-13,wallstreetbets,fhi0q7d,Should I sell my retarded MSFT calls and buy 26 strike 2/21 SPCE?? Am I retarded,t3_f38dq2,8
1581615920.0,2020-02-13,wallstreetbets,fhi1f92,We fomo'ing back into TSLA?,t3_f38dq2,8
1581616382.0,2020-02-13,wallstreetbets,fhi28wx,Does anyone know if ⛈ is still selling naked calls on TSLA? If so then rip,t3_f38dq2,8
1581616545.0,2020-02-13,wallstreetbets,fhi2jby,[deleted],t3_f38dq2,8
1581616677.0,2020-02-13,wallstreetbets,fhi2rwl,Msft you’re killing me bb,t3_f38dq2,8
1581616688.0,2020-02-13,wallstreetbets,fhi2sma,\*U.S. ADDS RACKETEERING CONSPIRACY CHARGE AGAINST HUAWEI,t3_f38dq2,7
1581616731.0,2020-02-13,wallstreetbets,fhi2vf7,Im actually getting boned by MSFT,t3_f38dq2,9
1581616852.0,2020-02-13,wallstreetbets,fhi3358,"I miss the days a few months ago, where everyone would yell BTFD, and we'd buy and we'd all make money.  Now, it seems like everyone is limp dickin around...",t3_f38dq2,9
1581617825.0,2020-02-13,wallstreetbets,fhi4wwh,I fucking hate MSFT,t3_f38dq2,8
1581619095.0,2020-02-13,wallstreetbets,fhi7ai4,"To the guy who said posts get buried now. I see your post, I care, some read em all",t3_f38dq2,8
1581620718.0,2020-02-13,wallstreetbets,fhia515,"Print out my tax forms from my brokerage.
204 pages of wash trades.
Lol",t3_f38dq2,8
1581621290.0,2020-02-13,wallstreetbets,fhib3rw,"WSB in *shambles*

Unless you did 200 3/20, in which case things are still looking amazing",t3_f38dq2,7
1581621388.0,2020-02-13,wallstreetbets,fhib9vh,"RIP MSFT

Welcome to the SPCE $hip! 🚀🚀🚀",t3_f38dq2,8
1581621666.0,2020-02-13,wallstreetbets,fhibrl7,$10 Billion is nothing to MSFT. Bunch of idiots just sold over nothing.,t3_f38dq2,8
1581621724.0,2020-02-13,wallstreetbets,fhibvb0,3/27 MSFT calls. Who gives a shit. Only those with toilet paper hands,t3_f38dq2,7
1581621774.0,2020-02-13,wallstreetbets,fhibyj3,I'm not selling. Ride or die mother fuckers.,t3_f38dq2,9
1581621819.0,2020-02-13,wallstreetbets,fhic1f2,this sub just got executed lmfao,t3_f38dq2,7
1581622415.0,2020-02-13,wallstreetbets,fhid4gu,"+5k on TSLA today. 

Need to actually do some work now....

Edit: 🅿️🅿️


[https://imgur.com/gallery/ZYdJo2C](https://imgur.com/gallery/ZYdJo2C)",t3_f38dq2,6
1581622807.0,2020-02-13,wallstreetbets,fhidu47,"That fucking bald, greedy piece of shit Bezos and eat a fucking dick",t3_f38dq2,7
1581622923.0,2020-02-13,wallstreetbets,fhie1om,[deleted],t3_f38dq2,9
1581623154.0,2020-02-13,wallstreetbets,fhiegon,[deleted],t3_f38dq2,7
1581623688.0,2020-02-13,wallstreetbets,fhiff3v,"if youve got MSFT calls expiring months out, close reddit, close robinhood, go on a walk. Its gonna be okay for mr. diamond hands.",t3_f38dq2,9
1581624098.0,2020-02-13,wallstreetbets,fhig5lx,"damn, that msft dip barely lasted",t3_f38dq2,7
1581624689.0,2020-02-13,wallstreetbets,fhih7e4,"Jedi block, reducing repos, virus locking up supply chains. Market still gonna get some ATHs.",t3_f38dq2,8
1581625113.0,2020-02-13,wallstreetbets,fhihygd,What kind of lubrication do you guys generally use when this many red candles penetrate your anus in one day?,t3_f38dq2,7
