created,date,subreddit,id,body,parent_id,score
1585755167.0,2020-04-01,wallstreetbets,fm4j7pz,"If you're expecting big unemployment numbers tomorrow, it might not pan out for your puts. Here's some local DD from NC -

I laid off 45 people when my restaurant was forced to temporarily close. 5 full timers and 40 part timers. Out of those 45, maybe 30 have filed claims. The remaining 15 are too lazy to bother getting free money. Seriously. The NC unemployment website is a disaster and it's taking people hours to get it to go all the way through the steps to file. 

Out of the 30 that have filed, I have received and approved 20 claims (I have to certify that they were laid off and not fired for misconduct or job abandonment to expedite their claims).

Out of those 20 claims I have approved, at least 12, including myself, have gotten delayed due to ""cannot verify social security number"". The people who are rejected this way are asked to take their social security card to the unemployment office in person (great for social distancing, right). Only two of the 12 have actually done this. 

So, out of 45 layoffs, only 30 (66%) have filed for unemployment, and only 10 (22%) have actually been approved for benefits. I don't know at what point they become initial jobless claims (is it when they apply, when they are approved, or when they actually receive a check). 

I bet this is a transparent attempt to show lower unemployment numbers. If this type of fuckery is going on in every state, the unemployment numbers are being VASTLY underreported. 

Point is, don't count on initial jobless claims to help your puts too much tomorrow.",t3_fsxqpm,27
1585757737.0,2020-04-01,wallstreetbets,fm4o6fz,"Mike Pence asks Thailand if they can help the US with PPE  


Thailand is all... nani the fuck? We just received a 2nd shipment of PPE *from the US*. Thanks for that btw very generous.  


Pence be like Jesus Christ who is in charge of this clusterfuck? Oh me.",t3_fsxqpm,25
1585761797.0,2020-04-01,wallstreetbets,fm4vwvi,"Walk towards the light MGM, walk towards the light...",t3_fsxqpm,26
1585766722.0,2020-04-01,wallstreetbets,fm55jhf,You dumbasses trading stonks. Commodities is where it's at. When your market goes tits up you're all broke. Not me though I got 14208 live cattle waiting for me back at home.,t3_fsxqpm,23
1585768653.0,2020-04-01,wallstreetbets,fm597os,"Up 30k since March 1st, up 40k all time. As of 10 minutes ago, closed out all positions and taking the gains.

Probably missing out on future gains but time to focus on work and personal goals instead of staring at numbers thinking about money.

Good luck to you all.",t3_fsxqpm,24
1585771385.0,2020-04-01,wallstreetbets,fm5eezf,Retards in here actually think jpow buying spy,t3_fsxqpm,25
1585752022.0,2020-04-01,wallstreetbets,fm4dl5l,"After days of gloating bulls I hoped that we might get some normalcy now that things are heading back down. Instead we have confused and angry bears who don't understand IV and think we should drop 20% at a time. Jesus people on this sub are retarded. Chill the fuck out.

I'm all in on puts. Have some god damn patience.",t3_fsxqpm,23
1585769498.0,2020-04-01,wallstreetbets,fm5atlj,[deleted],t3_fsxqpm,22
1585741252.0,2020-04-01,wallstreetbets,fm3yai9,"https://i.kym-cdn.com/entries/icons/original/000/025/817/Screen_Shot_2018-03-30_at_11.34.27_AM.png

Bulls rn",t3_fsxqpm,11
1585743703.0,2020-04-01,wallstreetbets,fm4148o,Everyone has PTSD based on the last couple weeks,t3_fsxqpm,11
1585744141.0,2020-04-01,wallstreetbets,fm41nd1,"Earthquake activity in Yellowstone area is still putting down 3.0 or better quakes every hour or so 

https://earthquake.usgs.gov/earthquakes/map/",t3_fsxqpm,11
1585744657.0,2020-04-01,wallstreetbets,fm42atv,"“Super Nintendo, sega genesis... when I was dead broke I never pictured this”


Puts to tendie land... Juicy",t3_fsxqpm,11
1585746369.0,2020-04-01,wallstreetbets,fm44lqm,[deleted],t3_fsxqpm,10
1585746370.0,2020-04-01,wallstreetbets,fm44lrk,The stock market has been better since Dr. Fauci became President.,t3_fsxqpm,11
1585746472.0,2020-04-01,wallstreetbets,fm44qt4,Oil going so low it might be free soon,t3_fsxqpm,11
1585746684.0,2020-04-01,wallstreetbets,fm451oh,"https://nypost.com/2020/03/31/teddy-bear-hunt-helping-kids-have-fun-amid-coronavirus-lockdown/

#PUT


A


#BEAR


IN


WINDOW


4


CIRCUIT


BREAKERS",t3_fsxqpm,10
1585746820.0,2020-04-01,wallstreetbets,fm458ow,Gonna have so many tendies to buy weed for Travis,t3_fsxqpm,10
1585746855.0,2020-04-01,wallstreetbets,fm45ai0,"Here some DD:

WSB changes logo and we all start losing.

WSB changes logo and the premarket has blood in the water

WSB logo clearly controls the market buy poots and calls.",t3_fsxqpm,11
1585746894.0,2020-04-01,wallstreetbets,fm45cji,"I got one dollar in buying power, guess I’ll pick up some spy calls now that they’re worthless",t3_fsxqpm,12
1585746912.0,2020-04-01,wallstreetbets,fm45diu,[deleted],t3_fsxqpm,10
1585747357.0,2020-04-01,wallstreetbets,fm460y2,Holy shit 912 people died in the USA on 3/31,t3_fsxqpm,10
1585747525.0,2020-04-01,wallstreetbets,fm469tc,"Welcome to tendie land  🐻🐼🐨 gang!

💎 🖐 🤚 finally paying off!",t3_fsxqpm,11
1585748720.0,2020-04-01,wallstreetbets,fm4831h,Ugh all this 'were in this together' wholesome commercials every 5 seconds giving me a headache.,t3_fsxqpm,11
1585749052.0,2020-04-01,wallstreetbets,fm48lw2,Well -50% is better than -70% I suppose. Keep holding bears?,t3_fsxqpm,12
1585749104.0,2020-04-01,wallstreetbets,fm48ow6,[deleted],t3_fsxqpm,11
1585749449.0,2020-04-01,wallstreetbets,fm498pb,A few big red candles would be dope,t3_fsxqpm,12
1585749916.0,2020-04-01,wallstreetbets,fm4a09k,Now instead of -50% I'm -25%!,t3_fsxqpm,11
1585750226.0,2020-04-01,wallstreetbets,fm4aikg,"4/17 hold brothers!!!! I am down 50% all time all in 4/17 puts

I AM WITH YOU AND I AM HOLDING!!!!",t3_fsxqpm,11
1585750399.0,2020-04-01,wallstreetbets,fm4aswa,Spy needs to start dropping or I’m gonna write a strongly worded letter to their CEO,t3_fsxqpm,11
1585751527.0,2020-04-01,wallstreetbets,fm4cq11,AMD is basically at pre-Corona prices lol,t3_fsxqpm,11
1585751651.0,2020-04-01,wallstreetbets,fm4cxp0,No upward traction on SPY.   This could drill hard in the PM and after hours,t3_fsxqpm,11
1585752003.0,2020-04-01,wallstreetbets,fm4djw8,I need to delete rh to preserve my mental health and bank account,t3_fsxqpm,11
1585752272.0,2020-04-01,wallstreetbets,fm4e0y6,at this rate i may own the oil industry,t3_fsxqpm,11
1585752693.0,2020-04-01,wallstreetbets,fm4erd4,"It's ok big guy she left you for someone else and you thought you could get her back if you got rich, but now you're broke and blew your life savings she's definitely not coming back now.",t3_fsxqpm,11
1585752933.0,2020-04-01,wallstreetbets,fm4f6ov,"I imagine the market as someone drowning, with heavy lead boots on. The Fed tries to help by throwing a life preserver, but it wraps around the market's neck. As the Fed tries to pull the market up, a shark comes along and grabs the market by the legs. The fed pulls harder. The lead boots, shark attack, and lowering tide yank the drowning market while the fed tries to desperately pull it up by the neck.",t3_fsxqpm,10
1585755685.0,2020-04-01,wallstreetbets,fm4k771,[deleted],t3_fsxqpm,11
1585756512.0,2020-04-01,wallstreetbets,fm4lsot,"[Pence to CNN: ""We think Italy may be the most comparable area to the United States at this point.""](https://twitter.com/ZekeJMiller/status/1245378623487516674)",t3_fsxqpm,12
1585757636.0,2020-04-01,wallstreetbets,fm4nzh0,I know I’m not the only 🌈🐻 in here thinking this rn. This is nice and all. But I lost about 30% in the past week or so. So I still need more.....,t3_fsxqpm,11
1585759228.0,2020-04-01,wallstreetbets,fm4r1lc,Whoever sold at open has literally helium hands,t3_fsxqpm,10
1585759416.0,2020-04-01,wallstreetbets,fm4rely,portnoy apparently bought 40k shares of BA at 139 lol what an asshole,t3_fsxqpm,10
1585759721.0,2020-04-01,wallstreetbets,fm4rzev,Don’t stop cuomo I’m almost there,t3_fsxqpm,10
1585760010.0,2020-04-01,wallstreetbets,fm4sj7u,Imagine buying calls at 263 yesterday lol,t3_fsxqpm,10
1585760337.0,2020-04-01,wallstreetbets,fm4t5qg,"1 more day like this tomorrow, and maybe, just maybe I will be green again on my 4/17 230p's.  Still down 50% since I bought at the highs in March.  FML",t3_fsxqpm,11
1585760717.0,2020-04-01,wallstreetbets,fm4tvwz,"where is the WSJ headline?

after their ""shortest bear market in history""

shouldnt this now be ""shortest bull market in history"" ?",t3_fsxqpm,11
1585760779.0,2020-04-01,wallstreetbets,fm4tzze,"gotta love how I bought SPY 5/1 200p a week ago, SPY is lower now, and I'm down 40%... theta and vega are some cruel mistresses",t3_fsxqpm,12
1585761378.0,2020-04-01,wallstreetbets,fm4v4b7,[deleted],t3_fsxqpm,11
1585761563.0,2020-04-01,wallstreetbets,fm4vgtp,Bad news tanking the market? Seems surreal,t3_fsxqpm,11
1585761736.0,2020-04-01,wallstreetbets,fm4vss7,I need a 15% drop for my breakeven by 4/17 FML,t3_fsxqpm,12
1585764102.0,2020-04-01,wallstreetbets,fm50lda,"remember fossilized boomers mostly support Dump. They're all in on this guy, until the bitter end. Like Hitlers minions in the Fuhrer Bunker with Soviets 800 yeards away. They've got 401k's, IRAs and pensions that depend 100% on the Dump/Fed stock price illusion show. They still need to get wiped out, and they have in aggregate trillions of dollars. 

The next 6 months are going to be ugly and painful. Well for them. For autists, not so much.",t3_fsxqpm,12
1585764858.0,2020-04-01,wallstreetbets,fm51zxw,[deleted],t3_fsxqpm,11
1585765009.0,2020-04-01,wallstreetbets,fm52a4l,"""I saw a Bear, and a Bear saw a man.""
-J.Pow Exotic, 2020",t3_fsxqpm,10
1585765037.0,2020-04-01,wallstreetbets,fm52c14,USO calls PRINTING,t3_fsxqpm,11
1585765571.0,2020-04-01,wallstreetbets,fm53c5p,"The F-ing Autistic who stated yesterday, that he was gonna buy AMRN Call options...please stand up

I laughed when reading your statement, then I bought $700 dollars worth at different strikes and dates...that's less than the premium on one SPY option

Congrats on at least tripling our money!  You may sit down now..",t3_fsxqpm,12
1585766014.0,2020-04-01,wallstreetbets,fm546hs,Love when I pick the trend reversal perfectly but my bid is $0.05 too low and I miss the entire thing.,t3_fsxqpm,12
1585767010.0,2020-04-01,wallstreetbets,fm563hc,Peloton mooning because people think everyone is going to buy a $2500 exercise bike during quarantine is the dumbest shit ever lol,t3_fsxqpm,11
1585768084.0,2020-04-01,wallstreetbets,fm584tx,The fuck is wrong with me?  Yesterday was the most obvious put buying opportunity ever with that end of quarter rebalancing bullshit.  Fucking missed a huge move again.,t3_fsxqpm,11
1585768219.0,2020-04-01,wallstreetbets,fm58e3k,Break past 245 and the bear jizz will be flowing,t3_fsxqpm,10
1585768594.0,2020-04-01,wallstreetbets,fm593my,Anyone else annoyed of people saying “IF WE BREAK X WE ARE FALLING TO X”,t3_fsxqpm,11
1585769436.0,2020-04-01,wallstreetbets,fm5ap7t,"Come on SPY baby, just try 244 one time. It won't hurt I promise. Just the tip is all.",t3_fsxqpm,10
1585769493.0,2020-04-01,wallstreetbets,fm5at9d,bears assemble. We need to break 245. Major bull blood if so,t3_fsxqpm,10
1585769495.0,2020-04-01,wallstreetbets,fm5atcp,"Everyone says profit is profit, and I couldn't agree more, but my plays have to be green for at least once second in their life for me to use this philosophy",t3_fsxqpm,10
1585769740.0,2020-04-01,wallstreetbets,fm5ba64,BREAK THE FUCKING RESISTANCE PLEASE FOR THE LOVE OF GOD,t3_fsxqpm,12
1585770097.0,2020-04-01,wallstreetbets,fm5byzy,"CNBC on a red day: We're probably headed towards a depression.

CNBC on a green day: This is what you should buy as markets may have probably hit a bottom.",t3_fsxqpm,12
1585770152.0,2020-04-01,wallstreetbets,fm5c2ve,RIP to all the boomers who sold at 220 and then fomod back in at 260,t3_fsxqpm,11
1585770192.0,2020-04-01,wallstreetbets,fm5c5p4,SPY - you a bitch if you can't hit 242.,t3_fsxqpm,11
1585770399.0,2020-04-01,wallstreetbets,fm5ck0t,"You guys are acting like an EOD pump somehow changes the fact that we're -5 percent at our low today. 

Chill the fuck out and hold your positions for more than 15 minutes and you won't be so fucking spazzy.",t3_fsxqpm,11
1585770401.0,2020-04-01,wallstreetbets,fm5ck6x,Pump just means another red day incoming,t3_fsxqpm,10
1585770407.0,2020-04-01,wallstreetbets,fm5ckkp,"SPY has to go down if the underlying components go bankrupt, right?",t3_fsxqpm,12
1585770650.0,2020-04-01,wallstreetbets,fm5d1c1,Grateful for this EOD pump so that tmrw can still be red,t3_fsxqpm,11
1585770896.0,2020-04-01,wallstreetbets,fm5dib7,Wait. . .Isn't EOD pump just shorts closing their positions before the day ends? It's still a bearish signal?,t3_fsxqpm,10
1585771400.0,2020-04-01,wallstreetbets,fm5eg0b,Absolutely massive red candle at 4 tells you all you need to know,t3_fsxqpm,11
1585771479.0,2020-04-01,wallstreetbets,fm5el3s,I'm glad it only took me $700 to figure out that you don't hold short otm puts overnight.,t3_fsxqpm,11
1585771779.0,2020-04-01,wallstreetbets,fm5f56w,"Tesla still dumping AH
 😂😂😂

You love to see it 🐻🐻🐻",t3_fsxqpm,11
1585772550.0,2020-04-01,wallstreetbets,fm5gkeq,All my puts combined now only down 41% :),t3_fsxqpm,11
1585772728.0,2020-04-01,wallstreetbets,fm5gwcs,I’m just here for the friends and the journey. And the money.,t3_fsxqpm,11
1585773174.0,2020-04-01,wallstreetbets,fm5hq7r,Do you think Trump is excited that he's gonna be responsible for a GREATER depression?  As in better than the first one!,t3_fsxqpm,12
1585775954.0,2020-04-01,wallstreetbets,fm5mw70,the vibe on CNBC has def gone very bear.  like i think the reality after yesterday pressor has set in that this is gonna be a long painful process.,t3_fsxqpm,11
1585777661.0,2020-04-01,wallstreetbets,fm5pzcw,"Damn Donnie, first our tendies, now our coke!",t3_fsxqpm,11
1585779357.0,2020-04-01,wallstreetbets,fm5t04b,puts on cocaine from south america.,t3_fsxqpm,10
1585739759.0,2020-04-01,wallstreetbets,fm3wpeb,"Sold my puts yesterday. Bought calls yesterday in the dip. Looks like I'm going to miss out on that ""generational wealth"" of this crash.",t3_fsxqpm,21
1585749339.0,2020-04-01,wallstreetbets,fm492de,my favorite part about investing is constantly buying things at the wrong time.,t3_fsxqpm,20
1585761500.0,2020-04-01,wallstreetbets,fm4vckx,[deleted],t3_fsxqpm,19
1585768969.0,2020-04-01,wallstreetbets,fm59t3u,So we just gonna ignore the fact that Variation-Separate was right the entire time?,t3_fsxqpm,20
1585771507.0,2020-04-01,wallstreetbets,fm5emzd,"Up almost $15k today, thats nice! 

Far cry from the $100k I was up a few weeks ago but a W is a W..",t3_fsxqpm,19
1585773288.0,2020-04-01,wallstreetbets,fm5hxt7,"Trusted my vibe. It wasn't right, but I still trusted it.",t3_fsxqpm,20
1585773494.0,2020-04-01,wallstreetbets,fm5ibrf,After buying a bunch of 3/27 and 4/03 puts that became worth pennies two weeks ago and buying a bunch of calls yesterday that became worth pennies I realized this is no different then gambling and am going to delete robinhood,t3_fsxqpm,20
1585761764.0,2020-04-01,wallstreetbets,fm4vulc,# Florida Governor Ron Desantis just announced that he will be signing a statewide stay-at-home executive order that will mirror what Miami,t3_fsxqpm,55
1585740242.0,2020-04-01,wallstreetbets,fm3x7e0,how fucked are my $270 4/17 calls,t3_fsxqpm,11
1585741768.0,2020-04-01,wallstreetbets,fm3yvao,"Lmao sorry 🧻 🤚 🌈 🐻 

We told you to hold",t3_fsxqpm,11
1585741825.0,2020-04-01,wallstreetbets,fm3yxn9,y’all know u buy calls before* the market goes up not after,t3_fsxqpm,10
1585742894.0,2020-04-01,wallstreetbets,fm405sk,worried VIX won't be up enough to save my puts,t3_fsxqpm,10
1585743320.0,2020-04-01,wallstreetbets,fm40nnt,[deleted],t3_fsxqpm,10
1585743467.0,2020-04-01,wallstreetbets,fm40tzg,how in the actual fuck were large businesses up 56k. small businesses only down 90k.,t3_fsxqpm,10
1585743609.0,2020-04-01,wallstreetbets,fm41055,"-150k for ADP estimates is shit

This thing didn’t even start gearing up until mid march really. A lot of big companies weren’t gonna freeze hire dates in March due to it

April and May will be the brunt of it",t3_fsxqpm,10
1585743637.0,2020-04-01,wallstreetbets,fm411dl,Glad I sold my 20k of spy calls I bought yesterday for just a 4K loss Jesus,t3_fsxqpm,11
1585743648.0,2020-04-01,wallstreetbets,fm411v4,Lol whoever sold your puts after getting fucked all last week. Thank you for your sacrifice. 😂,t3_fsxqpm,9
1585743772.0,2020-04-01,wallstreetbets,fm4176s,"So do we hold puts today or sell at open? I feel like this shit is gonna keep going down, but also know we are playing against the fed",t3_fsxqpm,10
1585744189.0,2020-04-01,wallstreetbets,fm41pgf,"On March 12 we only had 1,661 cases of the virus.

Today we have 189,800.",t3_fsxqpm,10
1585744346.0,2020-04-01,wallstreetbets,fm41wj6,"it’s not a coincidence that the heavy green candles around this time every morning only started after the fed announced QE. also, fed is purposely trying to make vix drop",t3_fsxqpm,11
1585744537.0,2020-04-01,wallstreetbets,fm425bl,"Donnie: Dont forget to buy your Easter Sunday best 

S&P 500: BYE MACY’S!!!!",t3_fsxqpm,10
1585744616.0,2020-04-01,wallstreetbets,fm428w0,Bulls were convincing suckers to buy calls yesterday RIP,t3_fsxqpm,10
1585744951.0,2020-04-01,wallstreetbets,fm42ox3,Nothing like waking up 2 hours after going to sleep and seeing the beautiful massacre of dirty bulls 🐸☕️,t3_fsxqpm,10
1585745348.0,2020-04-01,wallstreetbets,fm437uh,VIX almost up 12%. Looks like tendies are back on the menu boys.,t3_fsxqpm,11
1585745950.0,2020-04-01,wallstreetbets,fm4414q,Let’s fucking get to SPY 230 now!!,t3_fsxqpm,10
1585746085.0,2020-04-01,wallstreetbets,fm447qk,"Good bye SPY 260, hello SPY240 it's been a long time old friend.

RETARDS dont buy fucking weeklies when it hits 240 you will get cucked.",t3_fsxqpm,9
1585746112.0,2020-04-01,wallstreetbets,fm4491q,the stock market is starting to look good to me!,t3_fsxqpm,9
1585746330.0,2020-04-01,wallstreetbets,fm44juk,Fuk is this real? Bears are you here? Finally a real red day!,t3_fsxqpm,10
1585746715.0,2020-04-01,wallstreetbets,fm453a9,The pre-market is just a horoscope for autists,t3_fsxqpm,11
1585746818.0,2020-04-01,wallstreetbets,fm458jl,Think I'm going to watch Wolf of Wallstreet today and pretend I actually make money,t3_fsxqpm,10
1585747066.0,2020-04-01,wallstreetbets,fm45lov,"I have deposited $345 million into your account, you’re welcome. -M. Burry",t3_fsxqpm,11
1585747166.0,2020-04-01,wallstreetbets,fm45qxo,Munchkin gonna be like yah we thinking of a 4th stimulus bill totaling 4 quadrillion dollars and double infinite QE for the feds,t3_fsxqpm,11
1585747496.0,2020-04-01,wallstreetbets,fm468bl,[deleted],t3_fsxqpm,9
1585747620.0,2020-04-01,wallstreetbets,fm46ezt,If this closes green it will be the greatest April fools joke ever,t3_fsxqpm,10
1585748020.0,2020-04-01,wallstreetbets,fm4708g,The volume on red days is so much greater than the volume on green day but bulls really think we're gonna V shape,t3_fsxqpm,10
1585748378.0,2020-04-01,wallstreetbets,fm47jrj,Down 85% on my portfolio :D,t3_fsxqpm,10
1585748626.0,2020-04-01,wallstreetbets,fm47xpt,"Semi news: White House is not currently planning a fourth stimulus bill.

https://www.cnbc.com/2020/04/01/coronavirus-stimulus-package-white-house-is-not-planning-4th-bill.html",t3_fsxqpm,10
1585748693.0,2020-04-01,wallstreetbets,fm481ia,Who remembers circuit breakers? Those were quite fun,t3_fsxqpm,10
1585748803.0,2020-04-01,wallstreetbets,fm487qk,[deleted],t3_fsxqpm,11
1585748869.0,2020-04-01,wallstreetbets,fm48biq,Still holding May 15th puts. Kicking myself for not snagging more puts when they were on sale yesterday. Fuck!!,t3_fsxqpm,10
1585748940.0,2020-04-01,wallstreetbets,fm48fgq,After the earnings report you thought I’d flee. After the rally you’d thought I’d sell for sure. But I’m still here. ILL SEE YOU IN HELL GAMESTOP,t3_fsxqpm,9
1585749053.0,2020-04-01,wallstreetbets,fm48lxl,Holding my puts. I think we're red into Friday at least,t3_fsxqpm,10
1585749272.0,2020-04-01,wallstreetbets,fm48yg1,[deleted],t3_fsxqpm,10
1585750455.0,2020-04-01,wallstreetbets,fm4awan,Yo where did all the volume go wtf. It’s just stuck now,t3_fsxqpm,10
1585750628.0,2020-04-01,wallstreetbets,fm4b6qk,Crazy how every move I make the market goes the opposite,t3_fsxqpm,10
1585750756.0,2020-04-01,wallstreetbets,fm4bedc,My favorite callgirl is in quarantine. This is getting real,t3_fsxqpm,10
1585751163.0,2020-04-01,wallstreetbets,fm4c37g,"The funny thing is when I was a noob and had no idea what I was doing, like buying way OTM wow puts I was printing money so I decided to smarten up and have literally been hemorrhaging money since",t3_fsxqpm,10
1585751540.0,2020-04-01,wallstreetbets,fm4cqte,"SPY 5/4 $230p, 💎✋🏻boys",t3_fsxqpm,10
1585752003.0,2020-04-01,wallstreetbets,fm4djxq,A woman on CNBC just said she expects unemployment tomorrow to be an extra 9 million. crazy!,t3_fsxqpm,10
1585752573.0,2020-04-01,wallstreetbets,fm4ejul,I’m constantly reminded how garbage I am at this,t3_fsxqpm,10
1585753264.0,2020-04-01,wallstreetbets,fm4fs11,"I miss trading memes: spce, bynd, roku, pton ect",t3_fsxqpm,11
1585753372.0,2020-04-01,wallstreetbets,fm4fyr1,I just keep losing. 2 weeks ago I was in my glory. Now my portfolio is in shambles and I feel depressed. Really hope we have another crash between now and May,t3_fsxqpm,9
1585754150.0,2020-04-01,wallstreetbets,fm4hc9c,Stonks only go sideways,t3_fsxqpm,10
1585754474.0,2020-04-01,wallstreetbets,fm4hxhv,# CHINA CONCEALED EXTENT OF VIRUS OUTBREAK: U.S. INTELLIGENCE,t3_fsxqpm,9
1585754526.0,2020-04-01,wallstreetbets,fm4i0vk,At this point I’m taking money out of robinhood and buying barrels of oil to store in my garage for a little bit. FUCK JPow,t3_fsxqpm,11
1585742957.0,2020-04-01,wallstreetbets,fm408gj,So many people did this yesterday hahahahahaha,t1_fm4047n,120
1585742952.0,2020-04-01,wallstreetbets,fm40898,I was one of those retards. I'm not even mad. I'm just happy that things finally make sense.,t1_fm4047n,72
1585746041.0,2020-04-01,wallstreetbets,fm445kx,"Smart, gotta keep that balance low",t1_fm442qv,15
1585742419.0,2020-04-01,wallstreetbets,fm3zm4u,[Look ahead and...](https://i.pinimg.com/originals/2f/34/35/2f3435aeafa5513348bf7976494c693f.jpg),t1_fm3zj3b,22
1585744756.0,2020-04-01,wallstreetbets,fm42fi6,-85% to -60% here 🤑,t1_fm42d9i,73
1585744766.0,2020-04-01,wallstreetbets,fm42fza,-90 to -80 more likely,t1_fm42d9i,43
1585744944.0,2020-04-01,wallstreetbets,fm42olq,Haha I almost sold everything yesterday. man I would have been pissed,t1_fm42mgr,12
1585741167.0,2020-04-01,wallstreetbets,fm3y771,This is me.,t1_fm3xq4d,39
1585746644.0,2020-04-01,wallstreetbets,fm44znj,You definitely had it.,t1_fm44xgr,47
1585746713.0,2020-04-01,wallstreetbets,fm4536y,"Hope you get better soon. Once you do, you can flaunt your retard immunity",t1_fm44xgr,26
1585746861.0,2020-04-01,wallstreetbets,fm45as9,"On a serious note. Make a list of anyone you know personally that you've been in contact with the past couple of weeks and inform them that you have a highly probable case of contracting Covid. Even if you are good now, you should still contact those people.",t1_fm44xgr,20
1585744458.0,2020-04-01,wallstreetbets,fm421jw,[deleted],t1_fm41xiu,71
1585743434.0,2020-04-01,wallstreetbets,fm40slg,give that man a kiss for us,t1_fm40p30,10
1585740165.0,2020-04-01,wallstreetbets,fm3x4ff,Atta boy,t1_fm3w880,30
1585742644.0,2020-04-01,wallstreetbets,fm3zvhe,He’s in the septic tank!,t1_fm3zqat,37
1585745039.0,2020-04-01,wallstreetbets,fm42t3z,"ok real talk, she definitely killed her husband, right?",t1_fm3zqat,19
1585744317.0,2020-04-01,wallstreetbets,fm41v4g,"I can't tell if this is real or not and that says a lot about the world we currently live in.

Or I'm just autistic",t1_fm41ssd,15
1585744451.0,2020-04-01,wallstreetbets,fm421ap,Get this man a beer please!! My tab!,t1_fm41yf2,11
1585772610.0,2020-04-01,wallstreetbets,fm5goca,Ticker?,t1_fm5glyr,11
1585741376.0,2020-04-01,wallstreetbets,fm3yffv,[deleted],t1_fm3xqq1,62
1585741678.0,2020-04-01,wallstreetbets,fm3yrlc,All we did was cry haha,t1_fm3xqq1,33
1585740938.0,2020-04-01,wallstreetbets,fm3xy90,"🌈🐻 fuck them bulls, see if they got 💎🙌 now",t1_fm3xqq1,77
1585741197.0,2020-04-01,wallstreetbets,fm3y8bo,Fuck bulls i hope they lose it all. The way they treated us was disgusting,t1_fm3xqq1,46
1585741359.0,2020-04-01,wallstreetbets,fm3yeqr,I did too. The market will be -20% now,t1_fm3y7ea,34
1585740063.0,2020-04-01,wallstreetbets,fm3x0ki,Don’t celebrate too early it’s like not even 7:30,t1_fm3wyyb,84
1585744913.0,2020-04-01,wallstreetbets,fm42n3f,Even if cruise ships get a bailout they are going under. Ain't no one going to want to hop on a cruise ship after this after seeing how easily they spread disease.,t1_fm42inb,15
1585744869.0,2020-04-01,wallstreetbets,fm42kxk,How much of their debt do US banks hold? Serious question,t1_fm42inb,13
1585745266.0,2020-04-01,wallstreetbets,fm433xc,"Just an FYI, the only cruiseships getting bailed out are those that pay federal taxes and that are “created or organized in the United States or under the laws of the United States” and “have significant operations in and a majority of its employees based in the United States"" [source](https://www.nbcnews.com/business/business-news/most-cruise-lines-don-t-pay-taxes-u-s-just-n1172496).",t1_fm42inb,10
1585740651.0,2020-04-01,wallstreetbets,fm3xn2f,"If you're right, it's gonna be hilarious. If you're wrong, it's also going to be hilarious. Can't go tits up.",t1_fm3xkoi,23
1585739568.0,2020-04-01,wallstreetbets,fm3wibr,Stabbed in the fucking neck by the matador bro,t1_fm3wcmo,55
