created,date,subreddit,id,body,parent_id,score
1585741295.0,2020-04-01,wallstreetbets,fm3yc6f,Did people actually do that?,t1_fm3yahp,11
1585743617.0,2020-04-01,wallstreetbets,fm410hq,"lmao the guy was all ""uhhh i'm 100% straight but i'll suck yer noodle""

like yes okay man, it's ok to be gay  


edit: [https://www.reddit.com/r/wallstreetbets/comments/fsf6lk/im\_tired\_of\_this\_shit/](https://www.reddit.com/r/wallstreetbets/comments/fsf6lk/im_tired_of_this_shit/)  


\> I will go and suck a dick, im a straight man and I will suck a fucking human noodle if SPY isn’t below 210 on 5/8.",t1_fm40vgj,30
1585743132.0,2020-04-01,wallstreetbets,fm40fob,"I believe you’re referring to u/variation-seperate. He has solid DD.

EDIT: typo. It’s u/variation-separate you’re looking for",t1_fm40av8,42
1585743100.0,2020-04-01,wallstreetbets,fm40ee3,I think he has been spot on so far. Fucking crazy,t1_fm40av8,16
1585756690.0,2020-04-01,wallstreetbets,fm4m54h,you are exempt from the proletariat uprising,t1_fm4lzx5,13
1585739511.0,2020-04-01,wallstreetbets,fm3wg96,Poop Team 6 drilling.,t1_fm3w9zh,27
1585739519.0,2020-04-01,wallstreetbets,fm3wgk6,"you're talking about u/Variation-Separate. Yes, god bless him for giving me diamond hands",t1_fm3wdrc,71
1585742986.0,2020-04-01,wallstreetbets,fm409pj,You were a vagina but be grateful for the ones you have little vagina.,t1_fm405xw,10
1585739594.0,2020-04-01,wallstreetbets,fm3wjby,I was thinking it but didn’t want to write it.,t1_fm3w8b1,15
1585747089.0,2020-04-01,wallstreetbets,fm45mvz,who else needs breaker 3 to be ITM?,t1_fm45ktn,15
1585739767.0,2020-04-01,wallstreetbets,fm3wpoo,You deserve it pussy hands,t1_fm3wk2v,62
1585745235.0,2020-04-01,wallstreetbets,fm432g5,-90% to -60% here we come,t1_fm430e7,15
1585773518.0,2020-04-01,wallstreetbets,fm5idd0,see u tomorrow,t1_fm5ibrf,13
1585740431.0,2020-04-01,wallstreetbets,fm3xenm,Theta snacks,t1_fm3x7e0,12
1585741850.0,2020-04-01,wallstreetbets,fm3yymz,Dont know if this little drop will help me get back from -85%,t1_fm3yvao,10
1585744223.0,2020-04-01,wallstreetbets,fm41qy7,Next week 1.8 mill,t1_fm41pgf,10
1585752063.0,2020-04-01,wallstreetbets,fm4dnpt,You know what they are doing. They are shifting to forecasts to very high numbers so that when it is a high number that is lower than the redic forecasts the market goes green on 'better than expected',t1_fm4djxq,10
1585743696.0,2020-04-01,wallstreetbets,fm413y6,The trick was to do this two days ago and then sell those calls yesterday and re-buy puts.,t1_fm408gj,10
1585742988.0,2020-04-01,wallstreetbets,fm409st,Just don’t buy puts today. Otherwise spy will hit 270 EOD,t1_fm40898,47
1585744384.0,2020-04-01,wallstreetbets,fm41y9z,It's real. Under guidelines about sexual intercourse they have a line about analingus.,t1_fm41v4g,11
1585744532.0,2020-04-01,wallstreetbets,fm4252k,*1 corona coming right up*,t1_fm421ap,12
1585744988.0,2020-04-01,wallstreetbets,fm42qnc,That’s a lie... people care more about a cheap vacation then they do that disease..,t1_fm42n3f,41
1585745248.0,2020-04-01,wallstreetbets,fm4331t,Never underestimate how much boomer love their cruises. These are the same boomers that build their million dollar retirement homes in the paths of hurricanes.,t1_fm42n3f,11
