created,date,subreddit,id,body,parent_id,score
1581344750.0,2020-02-10,wallstreetbets,fh7u3jp,Alexa play The game by motorhead,t3_f1osqm,7
1581344933.0,2020-02-10,wallstreetbets,fh7uc81,"Contest mode?

WTF",t3_f1osqm,7
1581345177.0,2020-02-10,wallstreetbets,fh7unts,Msft with the W recovery. Letting us know we winning,t3_f1osqm,5
1581345491.0,2020-02-10,wallstreetbets,fh7v2vg,recession over phew,t3_f1osqm,5
1581345623.0,2020-02-10,wallstreetbets,fh7v9c4,Microsoft? Boys we micro**HARD**,t3_f1osqm,6
1581345712.0,2020-02-10,wallstreetbets,fh7vdln,MSFT LETS FUCKING GO,t3_f1osqm,5
1581347232.0,2020-02-10,wallstreetbets,fh7xhme,Panic sold my AAPL put just to buy more MSFT 3/20 200c,t3_f1osqm,6
1581347248.0,2020-02-10,wallstreetbets,fh7xifh,"i use to take ""the market can remain irrational"" as a cute kind of truism, but trying to time some bearish moves in the past two weeks has really driven it home for me. who the fuck is buying equities at ATH when china is literally shutting down lmao? (i know the answer, ""not-QE"", but still).",t3_f1osqm,5
1581347505.0,2020-02-10,wallstreetbets,fh7xvtl,[deleted],t3_f1osqm,6
1581347596.0,2020-02-10,wallstreetbets,fh7y0jc,Bought SPCE calls before leaving for work.  Am now rich at work,t3_f1osqm,6
1581347707.0,2020-02-10,wallstreetbets,fh7y698,"True retard here. Tried to buy 2 Tesla shares with all the money I got, ended up accidentally selling the three shares I already owned",t3_f1osqm,6
1581347784.0,2020-02-10,wallstreetbets,fh7yaby,[deleted],t3_f1osqm,5
1581348013.0,2020-02-10,wallstreetbets,fh7ymfl,I don’t deserve u msft baby,t3_f1osqm,6
1581348154.0,2020-02-10,wallstreetbets,fh7ytyp,RIP NOK calls.  Straight up fucked me raw,t3_f1osqm,5
1581348210.0,2020-02-10,wallstreetbets,fh7ywu8,"As the great Gandhi once said, ""Hextuple down on MSFT or ur a fucking pussy""",t3_f1osqm,5
1581348341.0,2020-02-10,wallstreetbets,fh7z3th,I sold my SPY and MSFT calls 45 mins ago. AMA,t3_f1osqm,6
1581348511.0,2020-02-10,wallstreetbets,fh7zd0k,MSFT will make it to the moon faster than SPCE,t3_f1osqm,6
1581348532.0,2020-02-10,wallstreetbets,fh7ze6d,Come on SPCE break into the 20s!!,t3_f1osqm,6
1581348625.0,2020-02-10,wallstreetbets,fh7zj7s,STOP SATYA I CAN ONLY GET THAT ERECT,t3_f1osqm,7
1581348637.0,2020-02-10,wallstreetbets,fh7zjuh,TSLA needs to stop it with this sideways shit and just pick a direction.,t3_f1osqm,6
1581348693.0,2020-02-10,wallstreetbets,fh7zmt1,Holy shit seriously 190 2/14 diamond steady hands,t3_f1osqm,5
1581348707.0,2020-02-10,wallstreetbets,fh7znjg,MICROSOFT GIVING ME A MACROHARD,t3_f1osqm,5
1581348821.0,2020-02-10,wallstreetbets,fh7ztqg,"MSFT you dirty girl, how u go up so fast?",t3_f1osqm,6
1581348825.0,2020-02-10,wallstreetbets,fh7zty6,is it too late to get in MSFT orrrrr,t3_f1osqm,6
1581348896.0,2020-02-10,wallstreetbets,fh7zxov,petition to change micro*soft* to micro**HARD**,t3_f1osqm,5
1581348899.0,2020-02-10,wallstreetbets,fh7zxud,[deleted],t3_f1osqm,5
1581348901.0,2020-02-10,wallstreetbets,fh7zy05,"Microsoft making me regret selling my calls on Friday...

Congrats to everyone still holding!",t3_f1osqm,6
1581349087.0,2020-02-10,wallstreetbets,fh8081n,I just put my whole bank account into msft calls literally cannot go tits up,t3_f1osqm,5
1581349165.0,2020-02-10,wallstreetbets,fh80c9o,Lol MSFT is just this week's Tesla.  SEC coming for you bois,t3_f1osqm,6
1581349273.0,2020-02-10,wallstreetbets,fh80i7x,MSFT take SPCE with you please,t3_f1osqm,6
1581349413.0,2020-02-10,wallstreetbets,fh80px2,"Took some profit on 1700% gains on MFST, rolled into some April 200c",t3_f1osqm,7
1581349458.0,2020-02-10,wallstreetbets,fh80sdg,Seeing all the msft comments.... pretty sure I just bought the top of the bubble. When it becomes popular in here the end is near. Rip,t3_f1osqm,6
1581349581.0,2020-02-10,wallstreetbets,fh80z7n,Bye tsla,t3_f1osqm,6
1581349589.0,2020-02-10,wallstreetbets,fh80znv,Tesla in free fall,t3_f1osqm,6
1581349691.0,2020-02-10,wallstreetbets,fh8159e,made 10k so far off of msft in span of 30m FUCK yes hopefully yall morning going as good,t3_f1osqm,7
1581349710.0,2020-02-10,wallstreetbets,fh816ci,Macrohard printing for dayzzz💯💯💯🚀🚀🥇💸💸💵💸💸💸🥇,t3_f1osqm,5
1581339861.0,2020-02-10,wallstreetbets,fh7o98f,I sold my groupon free share maybe for a loss :(,t1_fh7o2wf,9
1581336929.0,2020-02-10,wallstreetbets,fh7lale,My man,t1_fh7l75d,16
1581336932.0,2020-02-10,wallstreetbets,fh7laoa,All aboard!,t1_fh7l75d,13
1581348130.0,2020-02-10,wallstreetbets,fh7ysq3,Doot doot,t1_fh7l75d,6
1581340108.0,2020-02-10,wallstreetbets,fh7oinx,[deleted],t1_fh7oh3l,17
1581342749.0,2020-02-10,wallstreetbets,fh7rk1k,Volatility creates opportunities to make money.,t1_fh7rh2w,16
1581334704.0,2020-02-10,wallstreetbets,fh7jerc,[deleted],t1_fh7j60o,9
1581340817.0,2020-02-10,wallstreetbets,fh7pabj,Because your 100% that bitch,t1_fh7p716,43
1581340890.0,2020-02-10,wallstreetbets,fh7pd8l,the etf better be 80% weighted $MCD,t1_fh7p716,7
1581340870.0,2020-02-10,wallstreetbets,fh7pci8,Another great way to learn is maxing your credit cards on MSFT calls,t1_fh7p8dy,29
1581340852.0,2020-02-10,wallstreetbets,fh7pbs6,Good luck to all! WSB can seem a bit unwelcoming but this is a great opportunity to really gain some respect-- and who knows!? you could even be rewarded! lmao fuck,t1_fh7p8dy,12
1581335399.0,2020-02-10,wallstreetbets,fh7jyt9,its called edging,t1_fh7juxc,46
1581336239.0,2020-02-10,wallstreetbets,fh7koaj,Remember you said this.,t1_fh7kbld,6
1581339331.0,2020-02-10,wallstreetbets,fh7np0v,You look rly cute. ASL?,t1_fh7n9z9,13
1581342431.0,2020-02-10,wallstreetbets,fh7r69m,Nice 😎,t1_fh7r4sh,9
1581341511.0,2020-02-10,wallstreetbets,fh7q2mg,"Yeah, those people are not productive & always the first pink slipped 🎟",t1_fh7q06t,14
1581343331.0,2020-02-10,wallstreetbets,fh7sa5j,"Definitely not a gambling addiction, nope...",t1_fh7s8aq,30
1581343522.0,2020-02-10,wallstreetbets,fh7sipu,"This is what a nice shot of heroin gets you. Boy, just thinking of that makes me want to leave my wife, pack up our car with a nice ball of black tar to rip into my veins on the open road like in 95’. Think I’m going to give my buddy a ca......

Anyways, I mean ugh yeah. You should call someone.",t1_fh7s8aq,7
1581344230.0,2020-02-10,wallstreetbets,fh7tf0q,Nah u retard for holding,t1_fh7tdd5,12
1581337331.0,2020-02-10,wallstreetbets,fh7lpej,"Lol. Stupidest article ever, but now people will fomo more for it",t1_fh7lgto,13
1581338872.0,2020-02-10,wallstreetbets,fh7n845,That's every day now.,t1_fh7n5qu,6
1581334315.0,2020-02-10,wallstreetbets,fh7j3qv,"“I am not uncertain”

EDIT: Thanks for the silver, bro stranger!",t1_fh7ivu3,16
1581335989.0,2020-02-10,wallstreetbets,fh7kgji,I did but at 420 cuz I’m a memer. They’re 6 month so I might as well shorted.  I’ll be dead before they expire worthless.,t1_fh7kdjy,9
1581355707.0,2020-02-10,wallstreetbets,fh8aozx,"lmao, bought a second car for no fucking reason with no savings. this sounds like retards on this sub, but with options instead.",t1_fh8agpn,8
1581366649.0,2020-02-10,wallstreetbets,fh8stkl,pls commit to posting your loss porn when it all comes crashing down,t1_fh8ss4y,12
1581341503.0,2020-02-10,wallstreetbets,fh7q2aa,That’s some retard level risk you’re taking.,t1_fh7px1w,15
1581343460.0,2020-02-10,wallstreetbets,fh7sfy1,"Remember to only buy $0.01 contracts as they cannot possibly go lower and thus can only go up 😂😂😂

That shit is so funny to me.",t1_fh7sbds,6
1581343834.0,2020-02-10,wallstreetbets,fh7swx3,Can I hire China to be my accountant?,t1_fh7svbm,11
1581343881.0,2020-02-10,wallstreetbets,fh7sz4j,Fucking scum of the earth,t1_fh7svbm,6
1581344336.0,2020-02-10,wallstreetbets,fh7tjvc,The biggest meanies... all we tried to do was warn them 🥺,t1_fh7thbt,8
1581342581.0,2020-02-10,wallstreetbets,fh7rcsx,Too broke,t1_fh7r59q,8
1581337905.0,2020-02-10,wallstreetbets,fh7m9eg,[deleted],t1_fh7m70o,7
1581344176.0,2020-02-10,wallstreetbets,fh7tchf,You can enter [here](https://www.reddit.com/r/wallstreetbets/comments/f1q4rv/comment_here_to_join_wsbs_second_annual_paper/).,t1_fh7tahk,6
1581346560.0,2020-02-10,wallstreetbets,fh7wjjs,Yes,t1_fh7wgy6,6
1581340515.0,2020-02-10,wallstreetbets,fh7oyga,"everyone shows up in ties, holding notepads, no women, and no music. all looking up at a bar graph, really just mesmerized by the lazer pointer",t1_fh7osc9,5
1581342608.0,2020-02-10,wallstreetbets,fh7rdzi,"I bet quarantine orgies are insane. 

Booking a ticket",t1_fh7rb3a,13
1581338450.0,2020-02-10,wallstreetbets,fh7msug,"Ah I can see it now 

""Rumors of US military testing BYND meat in their MREs, BYND to become military contractor""",t1_fh7mmnb,15
1581344426.0,2020-02-10,wallstreetbets,fh7to76,🧼👐🧽,t1_fh7tlkz,6
1581333265.0,2020-02-10,wallstreetbets,fh7ib7k,Note he does not specify gender. Gentlemen send those hairy nipples and make bank.,t1_fh7hyn9,14
1581337591.0,2020-02-10,wallstreetbets,fh7lyav,When dobby died I was legit sad,t1_fh7lsnm,8
1581352692.0,2020-02-10,wallstreetbets,fh85ugy,if msft hits 200 ill finally activate windows on my gaming pc,t1_fh85qie,9
1581334127.0,2020-02-10,wallstreetbets,fh7iyjy,I’d suck yo dick if you make that happen,t1_fh7hz55,6
1581352963.0,2020-02-10,wallstreetbets,fh86a0u,idk man you probably ate at least an ounce of shrimp poopy,t1_fh867ma,11
1581336615.0,2020-02-10,wallstreetbets,fh7l0ez,As is tradition,t1_fh7kvm5,7
1581338059.0,2020-02-10,wallstreetbets,fh7mer2,Sell at open and take your money.,t1_fh7md1u,7
1581339875.0,2020-02-10,wallstreetbets,fh7o9rt,Famous last words,t1_fh7o86r,9
1581365706.0,2020-02-10,wallstreetbets,fh8r7ph,How are you gonna get your boyfriend pregnant?,t1_fh8r4ws,13
1581341602.0,2020-02-10,wallstreetbets,fh7q6hh,we can make a huge segment of the population bankrupt.,t1_fh7ptuy,9
1581367385.0,2020-02-10,wallstreetbets,fh8u2mp,Solid DD but this is insider's trading,t1_fh8twz2,12
1581337352.0,2020-02-10,wallstreetbets,fh7lq57,Narrator: He’ll get greedy for 100k.,t1_fh7lmim,39
1581342338.0,2020-02-10,wallstreetbets,fh7r269,Dont forget margin 😊👍🏻,t1_fh7qzrz,14
1581340754.0,2020-02-10,wallstreetbets,fh7p7vz,Yeah buddy went to bed at 9pm like an old man and woke up at 5am spent 30mims shitting and reading wsb because that is the way,t1_fh7oinx,9
1581334867.0,2020-02-10,wallstreetbets,fh7jjdl,5/15 200 c,t1_fh7jerc,6
1581341819.0,2020-02-10,wallstreetbets,fh7qfly,U right tho,t1_fh7pabj,7
1581342658.0,2020-02-10,wallstreetbets,fh7rg4m,Nice,t1_fh7r69m,6
1581343416.0,2020-02-10,wallstreetbets,fh7sdxh,"It's called INVESTING, mom!",t1_fh7sa5j,11
1581343606.0,2020-02-10,wallstreetbets,fh7smjb,For the last time I’m not doing heroin with you pls stop calling this number,t1_fh7sipu,5
