created,date,subreddit,id,body,parent_id,score
1633100833.0,2021-10-01,wallstreetbets,heze95p,Bulls in here talking as if SPY was +3% instead of still red!,t3_pz4ta4,8
1633102281.0,2021-10-01,wallstreetbets,hezhkjc,"When 95% of this sub are suddenly out-and-out bears, the writing is on the wall.",t3_pz4ta4,8
1633102301.0,2021-10-01,wallstreetbets,hezhm4r,We are going to close red,t3_pz4ta4,10
1633102739.0,2021-10-01,wallstreetbets,hezimpu,Once again I sold for a loss too early and it turned around an hour later,t3_pz4ta4,9
1633102870.0,2021-10-01,wallstreetbets,hezixni,Yeah sure. “Normal” market behavior,t3_pz4ta4,10
1633102971.0,2021-10-01,wallstreetbets,hezj60r,Did jpow turn back on the printers,t3_pz4ta4,9
1633103111.0,2021-10-01,wallstreetbets,hezjhtb,well that was the dip,t3_pz4ta4,10
1633103934.0,2021-10-01,wallstreetbets,hezlfe7,"So. Basically SPY is just one big pump and dump, isn’t it?",t3_pz4ta4,8
1633105396.0,2021-10-01,wallstreetbets,hezou2l,I’m such a paperhanded Beeeotch! I sold my spy calls and made $482 if held till about now I’d have made $3960,t3_pz4ta4,8
1633105468.0,2021-10-01,wallstreetbets,hezozzq,"if i had 1.00 for every time cnbs says the word Taper, i wouldn't need the stock market",t3_pz4ta4,9
1633105798.0,2021-10-01,wallstreetbets,hezprvw,These are just transitory losses,t3_pz4ta4,8
1633106764.0,2021-10-01,wallstreetbets,hezs2cm,Cramer the type of guy to surprise his homies with a visit from the tickle monster,t3_pz4ta4,9
1633107784.0,2021-10-01,wallstreetbets,hezugop,[deleted],t3_pz4ta4,10
1633107858.0,2021-10-01,wallstreetbets,hezumw5,"Came to donate blood. Need monies to keep paying to drink my dominatrix’s urine 

SPY 450c 10/8",t3_pz4ta4,9
1633108290.0,2021-10-01,wallstreetbets,hezvmzh,I can’t believe I can’t get rich overnight… my app is broken.,t3_pz4ta4,10
1633108387.0,2021-10-01,wallstreetbets,hezvv4e,It’s 3am in Australia and I’m still watching the markets,t3_pz4ta4,8
1633108397.0,2021-10-01,wallstreetbets,hezvvyf,And that’s what I get betting against America.,t3_pz4ta4,9
1633108625.0,2021-10-01,wallstreetbets,hezwews,I think if I sell my puts we break back down,t3_pz4ta4,9
1633109586.0,2021-10-01,wallstreetbets,hezym7t,"Rising wedge and fib retracement both should show some resistance in a couple minutes but since I decided to hold my puts it’ll probably blast through both of them.

Edit: Ah shit, there she goes.",t3_pz4ta4,8
1633109960.0,2021-10-01,wallstreetbets,hezzh31,"This low volume crap is so fake. 

Sell your Calls now before dump! 

Now, inverse me.

Now, inverse that.",t3_pz4ta4,8
1633110073.0,2021-10-01,wallstreetbets,hezzqgh,lmao SPY almost up 1% and AMZN is still red,t3_pz4ta4,10
1633110447.0,2021-10-01,wallstreetbets,hf00l8h,"SPY trying to trigger my stop losses so bad. Well guess what, I removed them so eat shit! 

\*SPY continues to inverse my position\*

Fuck.",t3_pz4ta4,10
1633110539.0,2021-10-01,wallstreetbets,hf00suu,Last night bears were jerking off to red futures. LOL,t3_pz4ta4,10
1633112694.0,2021-10-01,wallstreetbets,hf05rwl,The market is always reddest before the green boys.,t3_pz4ta4,10
1633112736.0,2021-10-01,wallstreetbets,hf05vez,If you weren’t with spy at its lowest then you don’t deserve it at its best,t3_pz4ta4,9
1633112798.0,2021-10-01,wallstreetbets,hf060ha,ok...im officially disgusted now.,t3_pz4ta4,9
1633113579.0,2021-10-01,wallstreetbets,hf07tay,SOFI a good play?,t3_pz4ta4,9
1633114431.0,2021-10-01,wallstreetbets,hf09r9r,This is absurd.,t3_pz4ta4,8
1633114455.0,2021-10-01,wallstreetbets,hf09taz,"I made money today, but it's been a rough fucking week.

Just gotta pick a good play next week and see if it makes up for the last 5 weeks of shitty decisions.",t3_pz4ta4,8
1633114805.0,2021-10-01,wallstreetbets,hf0aly0,"Well boys, no tendies for me tonight.....

Only tomahawk ribeye steak.

The secret sauce, inverse WSB",t3_pz4ta4,9
1633114886.0,2021-10-01,wallstreetbets,hf0asq4,EAT MY ASS BEARS 😤,t3_pz4ta4,8
1633115086.0,2021-10-01,wallstreetbets,hf0b9fa,lmaoo this morning was a big ass bear trap.,t3_pz4ta4,8
1633115501.0,2021-10-01,wallstreetbets,hf0c7gr,[deleted],t3_pz4ta4,8
1633115936.0,2021-10-01,wallstreetbets,hf0d7bu,Spy 455 end of next week,t3_pz4ta4,10
1633117388.0,2021-10-01,wallstreetbets,hf0ggye,Maybe buying 0dte Spy puts was retarded,t3_pz4ta4,9
1633117667.0,2021-10-01,wallstreetbets,hf0h2va,You were all warned to sell those calls about to 20 minutes ago,t3_pz4ta4,8
1633118572.0,2021-10-01,wallstreetbets,hf0j2eq,i have 4 437 calls expiring monday... god help me,t3_pz4ta4,8
1633083878.0,2021-10-01,wallstreetbets,heyjlhc,"One day, when I actually go to visit the states, I'll be really disappointed if I dont find cheap blow jobs behind any given Wendy's.",t3_pz4ta4,37
1633083451.0,2021-10-01,wallstreetbets,heyj35o,"Wow, buying and holding sure sucks this year.",t3_pz4ta4,24
1633089165.0,2021-10-01,wallstreetbets,heyqvgg,"Call an ambulance, but not for me 

- 🇺🇸",t3_pz4ta4,24
1633090964.0,2021-10-01,wallstreetbets,heytu1m,Quick reminder: you need to go up 100% to recover from losing 50%,t3_pz4ta4,22
1633093237.0,2021-10-01,wallstreetbets,heyxz2q,"Holy fuck, why is the price of mayonnaise up 40-50%???

I thought it was just at the expensive supermarket near my place, but I went to the el cheapo one and it’s the same high price?

Fuck you JPow! Fuck all bankers. This shit is not going to end well.",t3_pz4ta4,25
1633106170.0,2021-10-01,wallstreetbets,hezqnq9,Is correction over? Can the bulls come out now?,t3_pz4ta4,24
1633084036.0,2021-10-01,wallstreetbets,heyjs9b,Imagine if we sold before September like we said we would last year,t3_pz4ta4,8
1633084531.0,2021-10-01,wallstreetbets,heykdoh,SPY $420.69 eod,t3_pz4ta4,8
1633084684.0,2021-10-01,wallstreetbets,heykkbw,Remember we have a taper coming up. Valuations will likely fall even more as the Fed reduces the amount of liquidity it’s adds,t3_pz4ta4,9
1633084821.0,2021-10-01,wallstreetbets,heykqh8,SPY calls at open it is,t3_pz4ta4,8
1633085189.0,2021-10-01,wallstreetbets,heyl7dk,Everyone still wanting to buy calls confirms we are about to hit the days of panic selling.,t3_pz4ta4,8
1633085269.0,2021-10-01,wallstreetbets,heylb3v,internet money detaching from overall market trends?? people buying into the narrative finally or something else?,t3_pz4ta4,7
1633085365.0,2021-10-01,wallstreetbets,heylfkh,"Bulls, I didn't think you could do it, but you were right again! Green by open!! New ATH by lunch. Hope you brought a bag lunch, you can use it to throw up in.",t3_pz4ta4,7
1633086303.0,2021-10-01,wallstreetbets,heymohd,"Gonna have to turn off the indoor pool filter, stock up on Ramen, and just survive on essentials for a while. Kids' Montessori cancelled, leased cars, returned, private jet, grounded. Tighten the belt time. My poor landscaper Luis, what will he do when I tell him I'll mow my own lawn going forward...",t3_pz4ta4,8
1633086439.0,2021-10-01,wallstreetbets,heymv5v,"I am the banana man, my potassium is delicious",t3_pz4ta4,9
1633087405.0,2021-10-01,wallstreetbets,heyo790,[deleted],t3_pz4ta4,7
1633087753.0,2021-10-01,wallstreetbets,heyophi,"When I win powerball tomorrow, none of this will matter.",t3_pz4ta4,7
1633087792.0,2021-10-01,wallstreetbets,heyorjw,![img](emote|t5_2th52|4272),t3_pz4ta4,8
1633087888.0,2021-10-01,wallstreetbets,heyowo4,"Was it really as easy as waiting for September to end? I don't trust this market today, be safe out there boys.",t3_pz4ta4,8
1633088219.0,2021-10-01,wallstreetbets,heypepo,I'm fucking punching air fuck fuck fuck,t3_pz4ta4,8
1633088308.0,2021-10-01,wallstreetbets,heypjnh,“It’s fucking rigged” - Lao Tzu,t3_pz4ta4,8
1633088319.0,2021-10-01,wallstreetbets,heypk7a,Everyone knew this move was coming we always gap up every single time,t3_pz4ta4,9
1633089026.0,2021-10-01,wallstreetbets,heyqngt,No starting to celebrate until we reclaim 433,t3_pz4ta4,8
1633090016.0,2021-10-01,wallstreetbets,heys8q5,Friday pump to fuck up all the ITM puts expiring today,t3_pz4ta4,7
1633090172.0,2021-10-01,wallstreetbets,heyshxd,"Bears had us in September when market is it it’s weakest, but now it’s bull gang season. Back to ATH and beyond",t3_pz4ta4,8
1633090253.0,2021-10-01,wallstreetbets,heysmsf,Thank fuck September is over,t3_pz4ta4,8
1633090739.0,2021-10-01,wallstreetbets,heytfzf,"Garfield the cat does things like this all the time. He will take things from Jon: food, items, anything. This is his very nature.",t3_pz4ta4,8
1633090827.0,2021-10-01,wallstreetbets,heytlj9,"Watching financial news, you'd think the world economy is on the brink of destruction. No wonder theres so many bears",t3_pz4ta4,8
1633092019.0,2021-10-01,wallstreetbets,heyvpjz,TECH GOING RED,t3_pz4ta4,7
1633092283.0,2021-10-01,wallstreetbets,heyw6xz,Fade into open,t3_pz4ta4,7
1633092434.0,2021-10-01,wallstreetbets,heywgun,"Thank god I bought LEAPS on Merck. I was expecting retards buying ivermectin to give them an earnings beat, not a miracle COVID antiviral. But I'll take it.",t3_pz4ta4,9
1633092669.0,2021-10-01,wallstreetbets,heywwk3,"Inflation means Cash Gang is a guaranteed loss, at least play the ponies.",t3_pz4ta4,8
1633092868.0,2021-10-01,wallstreetbets,heyxa5b,"Cramer says, ""Don't panic and sell.""  So now is the time to panic and sell.

https://www.cnbc.com/2021/09/28/cramer-says-dont-panic-and-sell-but-realize-stocks-are-in-a-tough-spot.html",t3_pz4ta4,8
1633093074.0,2021-10-01,wallstreetbets,heyxnvt,If I had bought $5k of tqqq when I started investing I'd be retired by now,t3_pz4ta4,8
1633093162.0,2021-10-01,wallstreetbets,heyxtx7,"how come nobody is talking about the fact that ever since brian laundrie killed gabby petito, the market has been in free fall?",t3_pz4ta4,9
1633093412.0,2021-10-01,wallstreetbets,heyyb6v,I know we are very focused on spy... But is the mouse the biggest discount out there??,t3_pz4ta4,8
1633093461.0,2021-10-01,wallstreetbets,heyyek2,Market pricing in my bankruptcy,t3_pz4ta4,8
1633094393.0,2021-10-01,wallstreetbets,hez08bk,Really tempted to buy puts at open but a repeat pattern of yesterday seems too easy,t3_pz4ta4,9
1633095064.0,2021-10-01,wallstreetbets,hez1lp1,Are citadel interns allowed to shitpost their own company?,t3_pz4ta4,8
1633095619.0,2021-10-01,wallstreetbets,hez2qfg,Everything off a cliff,t3_pz4ta4,9
1633095660.0,2021-10-01,wallstreetbets,hez2th7,"#I take no responsibilities for wiped out portfolios today. Drill team 6, stand by. 🛠🗜👷‍♀️👷‍♂️🔧🚧🪛🪚🪓⛏",t3_pz4ta4,7
1633096158.0,2021-10-01,wallstreetbets,hez3urv,"Get to Costco and buy 4 month supply of beans and protein powder. Load up on toilet paper and pharmaceuticals (antibiotics, namely). Buy a generator and store gasoline. Now.",t3_pz4ta4,8
1633097200.0,2021-10-01,wallstreetbets,hez63jo,[deleted],t3_pz4ta4,8
1633097313.0,2021-10-01,wallstreetbets,hez6cf7,Down 5k today but I'm up $200 on covered calls I sold so I got that going for me,t3_pz4ta4,8
1633097482.0,2021-10-01,wallstreetbets,hez6pla,I have so many spy puts but I have never been more calm in my life.,t3_pz4ta4,8
1633097504.0,2021-10-01,wallstreetbets,hez6rfa,there is a war going on between bulls and bears i can feel it,t3_pz4ta4,8
1633097506.0,2021-10-01,wallstreetbets,hez6rjq,"pick a direction, shit.",t3_pz4ta4,7
1633097509.0,2021-10-01,wallstreetbets,hez6rsd,This shit makes no sense,t3_pz4ta4,7
1633097674.0,2021-10-01,wallstreetbets,hez74pg,Daily reminder that the fed sold the fucking top,t3_pz4ta4,7
1633097761.0,2021-10-01,wallstreetbets,hez7bjo,Are you fucking kidding me with this shit,t3_pz4ta4,8
1633098053.0,2021-10-01,wallstreetbets,hez7z13,"Remember, hiding losses from friends and family is all good!",t3_pz4ta4,7
1633098064.0,2021-10-01,wallstreetbets,hez7zxx,SPY 420 it is,t3_pz4ta4,8
1633098191.0,2021-10-01,wallstreetbets,hez8aaf,Press F to pay your respects to the bull market,t3_pz4ta4,8
1633098732.0,2021-10-01,wallstreetbets,hez9hzd,"Recent trends really highlight what I think is a major issue with the market, and that is that I am a fucking idiot and I don't know what I'm doing",t3_pz4ta4,8
1633098823.0,2021-10-01,wallstreetbets,hez9pcc,I am so generous that I like to give all my money to the rich people who desperately need it more than me.,t3_pz4ta4,7
1633098871.0,2021-10-01,wallstreetbets,hez9tb7,Some may argue we shouldn't cheer for a market crash. Others will remind us to think of how fucking dank the memes will be. I think I know which side I'm on.,t3_pz4ta4,8
1633099005.0,2021-10-01,wallstreetbets,heza28f,I DECLARE BANKRUUUUUPTCY,t3_pz4ta4,8
1633099099.0,2021-10-01,wallstreetbets,hezaa15,Are we seriously going to 420?,t3_pz4ta4,8
1633099338.0,2021-10-01,wallstreetbets,hezatcs,im gonna need spy to go up again because i can't afford to buy anymore dips,t3_pz4ta4,8
1633100000.0,2021-10-01,wallstreetbets,hezcbxb,My call is up $9 I'm thinking of cashing out and buying a big mac,t3_pz4ta4,9
1633100098.0,2021-10-01,wallstreetbets,hezck2s,Daily reminder that AMZN stock has done nothing since a year.,t3_pz4ta4,7
1633100192.0,2021-10-01,wallstreetbets,hezcryu,"Looks like Moderna got Merck’d, huh?",t3_pz4ta4,9
1633100233.0,2021-10-01,wallstreetbets,hezcvap,"to myself: dont fall for the bulltrap, dont fall for the bulltrap, dont fall to the bulltrap...

self: sells the puts, buys calls, lose all profit from puts when spy resumes tanking

o shi-",t3_pz4ta4,8
1633100237.0,2021-10-01,wallstreetbets,hezcvnj,[deleted],t3_pz4ta4,8
1633100284.0,2021-10-01,wallstreetbets,hezcziq,[deleted],t3_pz4ta4,8
1633100373.0,2021-10-01,wallstreetbets,hezd6wl,Sold my calls at the bottom. God I'm so bad at this,t3_pz4ta4,9
1633100425.0,2021-10-01,wallstreetbets,hezdb5l,"v shaped recovery - bear r fukt

Changes minute by minute. Come back in 60 seconds for the next update on which animal is fukt",t3_pz4ta4,7
1633100769.0,2021-10-01,wallstreetbets,heze3tg,"Remember when everyone was bullish on GOEV? 

#LMAOOOO",t3_pz4ta4,7
1633100856.0,2021-10-01,wallstreetbets,hezeb4f,Waking up was a bad idea today,t3_pz4ta4,9
1633100919.0,2021-10-01,wallstreetbets,hezeg8n,Lost two month’s gains in two weeks. Cool.,t3_pz4ta4,8
1633101373.0,2021-10-01,wallstreetbets,hezfh9n,Still believe this is a trap,t3_pz4ta4,9
1633101503.0,2021-10-01,wallstreetbets,hezfrtp,Sold my puts this morning. Will reload once we float high enough today.,t3_pz4ta4,8
1633101708.0,2021-10-01,wallstreetbets,hezg97k,"My annihilated portfolio: ""I didn't hear no bell""",t3_pz4ta4,8
1633102119.0,2021-10-01,wallstreetbets,hezh6zk,The market is a terrorist,t3_pz4ta4,9
1633102127.0,2021-10-01,wallstreetbets,hezh7o8,Spy really did some premeditated murder with that bull bear trap,t3_pz4ta4,8
1633102163.0,2021-10-01,wallstreetbets,hezharo,Every time i buy something i come to reddit for reassurance,t3_pz4ta4,8
1633102455.0,2021-10-01,wallstreetbets,hezhywx,Ain’t buying shit yet. Yesterday we had a massive pump too and shit went right back down,t3_pz4ta4,9
1633102662.0,2021-10-01,wallstreetbets,hezig92,I wanted to buy SPY puts but I accidentally bought SPY calls then I sold them for a loss🤡,t3_pz4ta4,7
1633102663.0,2021-10-01,wallstreetbets,hezigbb,"More like octobull, amirite?",t3_pz4ta4,8
1633102730.0,2021-10-01,wallstreetbets,hezilz0,"I can make money in a bull market.

I can make money in a bear market.

But kangaroo markets seem to bleed me dry.",t3_pz4ta4,7
1633102809.0,2021-10-01,wallstreetbets,hezisk7,Come on SPY for Asgard 💪💪,t3_pz4ta4,7
1633102841.0,2021-10-01,wallstreetbets,heziv92,"man bought puts and market is going up, WTF!!",t3_pz4ta4,7
1633103128.0,2021-10-01,wallstreetbets,hezjj8w,what a time to be alive,t3_pz4ta4,7
1633103132.0,2021-10-01,wallstreetbets,hezjjkh,This is low key inspirational,t3_pz4ta4,8
1633103220.0,2021-10-01,wallstreetbets,hezjqzd,Hope FB fuckin' burns tbh,t3_pz4ta4,8
1633103575.0,2021-10-01,wallstreetbets,hezkl6d,"Sold my calls for a loss on the morning dump 

🧻🤲",t3_pz4ta4,9
1633103689.0,2021-10-01,wallstreetbets,hezkuq5,Spy is so sus rn fr fr,t3_pz4ta4,8
1633103981.0,2021-10-01,wallstreetbets,hezlje2,"finally gave in and bought poots, so as usual, expect the rebound",t3_pz4ta4,8
1633104005.0,2021-10-01,wallstreetbets,hezllfg,"my WSB experience this year

*Turn $5000 into $0 with this one simple trick!*",t3_pz4ta4,8
1633104482.0,2021-10-01,wallstreetbets,hezmpeo,I'd rather shove a glass beaker up my dickhole and smash it with a hammer than put one more cent in this market,t3_pz4ta4,8
1633104895.0,2021-10-01,wallstreetbets,hezno0n,Puts are still the move,t3_pz4ta4,8
1633105086.0,2021-10-01,wallstreetbets,hezo3vh,Someone explain how CROX is up 1100% from the March 2020 bottom,t3_pz4ta4,7
1633105279.0,2021-10-01,wallstreetbets,hezok77,"The movement on those fuckin teeny tiny green candles is ridiculous, today was the bottom",t3_pz4ta4,9
1633105488.0,2021-10-01,wallstreetbets,hezp1q6,This shit been making 3 dollar moves an hour for the past week,t3_pz4ta4,7
1633105975.0,2021-10-01,wallstreetbets,hezq6x0,I genuinely feel bad for people holding SPIR and IRNT,t3_pz4ta4,8
1633107785.0,2021-10-01,wallstreetbets,hezugsl,SPY puts on sale!,t3_pz4ta4,8
1633109821.0,2021-10-01,wallstreetbets,hezz5rl,Plz stop jpow ive already lost everything,t3_pz4ta4,8
1633110224.0,2021-10-01,wallstreetbets,hf002r4,"it was a textbook pullback, SPY 500 is coming 🦅🇺🇸",t3_pz4ta4,8
1633110612.0,2021-10-01,wallstreetbets,hf00z3m,ATH by EOD,t3_pz4ta4,8
1633110798.0,2021-10-01,wallstreetbets,hf01evg,Fuking SPY man I swear. Rigged green dildos all day.,t3_pz4ta4,7
1633111702.0,2021-10-01,wallstreetbets,hf03hn1,Yeah not selling these puts yet,t3_pz4ta4,8
1633112013.0,2021-10-01,wallstreetbets,hf0477d,Would not mind seeing baba below 100 for patriotic reasons,t3_pz4ta4,8
1633112111.0,2021-10-01,wallstreetbets,hf04f7c,"Spy sideways rest of the day. I know for a fact. 

I bought $431p and $434c. 

And I always lose.",t3_pz4ta4,8
1633112136.0,2021-10-01,wallstreetbets,hf04h64,[deleted],t3_pz4ta4,8
1633112242.0,2021-10-01,wallstreetbets,hf04pxu,this is it. it's over. SPY 500 EOY,t3_pz4ta4,8
1633112387.0,2021-10-01,wallstreetbets,hf051xi,As if millions of 434 puts cried out in terror and were suddenly silenced.,t3_pz4ta4,8
1633112649.0,2021-10-01,wallstreetbets,hf05o2r,Power hour or sour hour. When to sell my SPY calls hmmm,t3_pz4ta4,9
1633112764.0,2021-10-01,wallstreetbets,hf05xnt,SPY was at 424.65 last night. Just lol.,t3_pz4ta4,8
1633112829.0,2021-10-01,wallstreetbets,hf0632d,GO SPY GO save these shitty calls,t3_pz4ta4,8
1633112986.0,2021-10-01,wallstreetbets,hf06fw5,"So todays price movement means that Pelosi will pass the bill today if not over the weekend, and spy will hit $450 on Monday",t3_pz4ta4,8
1633113113.0,2021-10-01,wallstreetbets,hf06qjd,Has wish had a single green day in the past 30 days?,t3_pz4ta4,8
1633113211.0,2021-10-01,wallstreetbets,hf06ytc,Honestly if you wanna make some good money just inverse anything I do,t3_pz4ta4,7
1633114454.0,2021-10-01,wallstreetbets,hf09t6m,WSBcrypto is awful! Just full of nano shrills… buy at least they aren’t here!,t3_pz4ta4,8
1633115109.0,2021-10-01,wallstreetbets,hf0bbbw,"Market roaring back even higher in the last hour 🚀🚀🚀

&#x200B;

Bye bye September",t3_pz4ta4,8
1633115298.0,2021-10-01,wallstreetbets,hf0bqwf,"I mean SPY did make an 8 dollar move in one session, which I was aiming for, just in the other direction.",t3_pz4ta4,8
1633116270.0,2021-10-01,wallstreetbets,hf0dz3m,"Bears left the chat good, u were never invited anyway",t3_pz4ta4,8
1633116388.0,2021-10-01,wallstreetbets,hf0e8pv,bought a spy call abt 3 minutes ago and down 10% lets go boys thats just my luck,t3_pz4ta4,9
1633116546.0,2021-10-01,wallstreetbets,hf0elkg,I bought 10 SPY calls on top of the 10 I already had this morning when it dropped. Today has been a good day.,t3_pz4ta4,9
1633117267.0,2021-10-01,wallstreetbets,hf0g7m5,"BABA couldn’t possibly go any lower, right? Time for calls!! 

*He says for the 50th time as he slowly loses his entire net worth",t3_pz4ta4,8
1633118413.0,2021-10-01,wallstreetbets,hf0ipxt,Cramers the type of guy to say ‘no more Mr. nice guy’ when he’s angry,t3_pz4ta4,7
1633118433.0,2021-10-01,wallstreetbets,hf0irfu,Lizzo sized Red candle got ate up,t3_pz4ta4,8
1633118449.0,2021-10-01,wallstreetbets,hf0isri,If you held calls I’d like to say thanks idiot,t3_pz4ta4,8
1633091888.0,2021-10-01,wallstreetbets,heyvgue,"Personal income down, personal spending up. God bless America.",t3_pz4ta4,22
1633093655.0,2021-10-01,wallstreetbets,heyys69,"Just woke up. Markets looking green, imaginary coins ripping hard af. Oct is here bois",t3_pz4ta4,21
1633084113.0,2021-10-01,wallstreetbets,heyjvna,"Let's go to the Winchester, have a nice cold pint, and wait for this all to blow over",t3_pz4ta4,6
1633085341.0,2021-10-01,wallstreetbets,heyledg,I'll be buying this dip.,t3_pz4ta4,7
1633086169.0,2021-10-01,wallstreetbets,heymi3y,"Futes broke north out of the range we've been stuck in since 9pm

Bears are fucked",t3_pz4ta4,7
1633086342.0,2021-10-01,wallstreetbets,heymqhk,Fuck my puts were going to print bigly at open guess not now.,t3_pz4ta4,6
1633086439.0,2021-10-01,wallstreetbets,heymv6a,"gay bear GAY BEAR don't crrrrryyyyyy to me, when your puuuts expiiree empty",t3_pz4ta4,7
1633086967.0,2021-10-01,wallstreetbets,heynkys,This week we learned that futes dont matter,t3_pz4ta4,8
1633087069.0,2021-10-01,wallstreetbets,heynq1b,Bears running for the hills,t3_pz4ta4,8
1633087814.0,2021-10-01,wallstreetbets,heyosqo,[deleted],t3_pz4ta4,7
1633087927.0,2021-10-01,wallstreetbets,heyoytx,"Hey /u/zjz can you guys stop locking the old threads?

I keep getting reminder bot messages and can't reply to mock people who were wrong. Like right now I am getting tons where people talked shit when I said we'd be green by open, and the thread won't let me call them poor. 

It's literally 95% of the joy on this sub and you guys broke it.",t3_pz4ta4,6
1633087998.0,2021-10-01,wallstreetbets,heyp2m1,Can you watch pornhub on a peloton?,t3_pz4ta4,7
1633088122.0,2021-10-01,wallstreetbets,heyp9fs,"BREAKING: Fed chairs loaded to the tits with SPY weeklies on September 30, 2021.  

- WSJ",t3_pz4ta4,6
1633088297.0,2021-10-01,wallstreetbets,heypiz5,"I should be happy, but why am I getting more and more scared",t3_pz4ta4,8
1633088365.0,2021-10-01,wallstreetbets,heypmpv,Sodomy assault canceled,t3_pz4ta4,8
1633088435.0,2021-10-01,wallstreetbets,heypqhw,If you don’t get 0dte calls at open then you ain’t black,t3_pz4ta4,6
1633088459.0,2021-10-01,wallstreetbets,heyprsy,Wow big boys are buying the dip? Good volume,t3_pz4ta4,7
1633088518.0,2021-10-01,wallstreetbets,heypv2j,Look at SPY man,t3_pz4ta4,8
1633089408.0,2021-10-01,wallstreetbets,heyr9bp,Fool me once shame on you fool me twice shame on me fool me thrice… aww shit here we go again maybe this time it will stay green,t3_pz4ta4,6
1633089515.0,2021-10-01,wallstreetbets,heyrfgg,#Happy Fucking Friday,t3_pz4ta4,7
1633089890.0,2021-10-01,wallstreetbets,heys186,Last time futures were doing this kinda shit was March and April 2020.,t3_pz4ta4,8
1633089978.0,2021-10-01,wallstreetbets,heys6du,"Picking up a 2022 Subaru Outback Onyx XT tomorrow,  kind of excited to get a new car!!",t3_pz4ta4,7
1633090257.0,2021-10-01,wallstreetbets,heysn0e,"Technical analysis isn’t male astrology, futures are.",t3_pz4ta4,7
1633090383.0,2021-10-01,wallstreetbets,heysuhy,"SPY, “you get hopium, you get hopium, you get copium!”",t3_pz4ta4,7
1633091119.0,2021-10-01,wallstreetbets,heyu3qz,"Lol my spy calls go burr but my individual stocks r fuk. 

I have no idea what’s going on here",t3_pz4ta4,7
1633091377.0,2021-10-01,wallstreetbets,heyujy6,Corn ATH end of week,t3_pz4ta4,7
1633091412.0,2021-10-01,wallstreetbets,heyum5b,Big Green Dildos all day and The many saints of Newark for evening would be a picture perfect Friday.,t3_pz4ta4,7
1633091614.0,2021-10-01,wallstreetbets,heyuz1r,NIO fucking blew their delivery numbers away.  next leg up starts here.,t3_pz4ta4,7
1633091928.0,2021-10-01,wallstreetbets,heyvjlh,Yay shutdown averted 🤗,t3_pz4ta4,6
1633092174.0,2021-10-01,wallstreetbets,heyvzp6,I look forward to sleeping on the sidewalk with you guys post-great depression,t3_pz4ta4,7
1633092520.0,2021-10-01,wallstreetbets,heywmm1,Bullish on coinbase ?,t3_pz4ta4,7
1633092585.0,2021-10-01,wallstreetbets,heywqw2,Merck or nio calls on open?,t3_pz4ta4,7
1633093060.0,2021-10-01,wallstreetbets,heyxmwe,Calls are gonna be a free triple today on mrna on a good dead cat bounce.,t3_pz4ta4,7
1633093357.0,2021-10-01,wallstreetbets,heyy7fq,Anyway to short Joe Manchin’s coal biz?,t3_pz4ta4,6
1633093539.0,2021-10-01,wallstreetbets,heyyk2z,I need more autism. Going into the top 3 thread.,t3_pz4ta4,8
1633094143.0,2021-10-01,wallstreetbets,heyzqiz,Spy will make quick move to $435,t3_pz4ta4,6
1633094324.0,2021-10-01,wallstreetbets,hez03fu,Delta on my calls is .00142. Is that good?,t3_pz4ta4,7
1633094367.0,2021-10-01,wallstreetbets,hez06i6,"It’s payday, time to make more regrettable decisions 🚀🚀🚀",t3_pz4ta4,6
1633095208.0,2021-10-01,wallstreetbets,hez1w3n,Drill team 6 in position,t3_pz4ta4,8
1633095212.0,2021-10-01,wallstreetbets,hez1wcs,# Morning pump. The dump starting in 30 minutes.,t3_pz4ta4,7
1633095243.0,2021-10-01,wallstreetbets,hez1ymp,# covid cure is actually bearish,t3_pz4ta4,8
1633095348.0,2021-10-01,wallstreetbets,hez26fq,Get rekt bulls,t3_pz4ta4,7
1633095482.0,2021-10-01,wallstreetbets,hez2gd5,I wanna place a 426 spy put but I'm fucking pussy,t3_pz4ta4,7
1633095589.0,2021-10-01,wallstreetbets,hez2o8f,Who just got trapped,t3_pz4ta4,7
1633095604.0,2021-10-01,wallstreetbets,hez2pc0,Just sold spy puts prepare for the circuit breaker now,t3_pz4ta4,8
1633095614.0,2021-10-01,wallstreetbets,hez2q2b,Goodbye tech :),t3_pz4ta4,7
1633095641.0,2021-10-01,wallstreetbets,hez2s47,market hanging on by a thread lmao 🧵,t3_pz4ta4,7
1633095955.0,2021-10-01,wallstreetbets,hez3fc0,New cardboard box who dis?,t3_pz4ta4,7
