created,date,subreddit,id,body,parent_id,score
1631810710.0,2021-09-16,wallstreetbets,hd3jqfa,[deleted],t3_ppab5b,9
1631810862.0,2021-09-16,wallstreetbets,hd3k47p,Airport beers at 11am hit different,t3_ppab5b,11
1631811398.0,2021-09-16,wallstreetbets,hd3lh9s,"Bulls: ""Printing time!"" \[SPY dips back to 446.\]

Bears: ""Printing time!"" \[SPY climbs back to 445\]

Never ends.",t3_ppab5b,10
1631812256.0,2021-09-16,wallstreetbets,hd3nmed,I’ve made more money in 2 weeks than my Roth IRA did in 4 years. Bullish on SDC,t3_ppab5b,10
1631812953.0,2021-09-16,wallstreetbets,hd3pdcx,"SDC 9/17 $6.5c x 100

Let’s go.",t3_ppab5b,10
1631814966.0,2021-09-16,wallstreetbets,hd3uccl,"SDC short interest close to 50%.

ALGN biggest crooks on wallst",t3_ppab5b,9
1631815311.0,2021-09-16,wallstreetbets,hd3v729,Opad closes over 19 and 20+ AH,t3_ppab5b,10
1631815438.0,2021-09-16,wallstreetbets,hd3vib1,Does PLTR maintain these levels?,t3_ppab5b,10
1631817007.0,2021-09-16,wallstreetbets,hd3zdil,"Capitol hill wants to close the etf ""loophole"" as another way of taxing the crap out of it. Are these guys lunatics or something?!? Low cost etf and indexes has been the investment choice for lower income households for decades and they wanna fuck with it?!?",t3_ppab5b,10
1631817188.0,2021-09-16,wallstreetbets,hd3ztbl,SDC wen moon?,t3_ppab5b,11
1631818403.0,2021-09-16,wallstreetbets,hd42u07,Got shares in both SDC and LILM. Let’s do this!,t3_ppab5b,10
1631818410.0,2021-09-16,wallstreetbets,hd42umn,I earned 500 bucks today. Thank you for the money dear bears 😭😈,t3_ppab5b,10
1631818586.0,2021-09-16,wallstreetbets,hd43a3a,Love when you do a dumbass desperate thing that could easily wreck your life but it works and you learn nothing,t3_ppab5b,11
1631819354.0,2021-09-16,wallstreetbets,hd453b4,And here comes SPY in original colour,t3_ppab5b,9
1631819784.0,2021-09-16,wallstreetbets,hd4659o,SDC AH is going to be nice,t3_ppab5b,11
1631820382.0,2021-09-16,wallstreetbets,hd47meo,"Listen SPY, I talked a lot of shit to a lot of bears so if you don’t muscle up and pump some more to finish green I’m gonna look really bad here so come on get movin",t3_ppab5b,9
1631821368.0,2021-09-16,wallstreetbets,hd4a27p,LILM.     CLBT.       LIDR……….. free fucking bands,t3_ppab5b,9
1631821369.0,2021-09-16,wallstreetbets,hd4a2ag,XOS RKLB LILM 🚀 THANK ME LATER,t3_ppab5b,11
1631822078.0,2021-09-16,wallstreetbets,hd4bu4b,IMO Lilium calls too cheap,t3_ppab5b,11
1631822307.0,2021-09-16,wallstreetbets,hd4cead,Lmao the $444 spy puts are worth more than the in the money $447 calls hahaha,t3_ppab5b,12
1631822369.0,2021-09-16,wallstreetbets,hd4cjqn,PLTR gonna hit 31 tomorrow,t3_ppab5b,11
1631822389.0,2021-09-16,wallstreetbets,hd4clm1,$6 AT CLOSE BABY. SDC,t3_ppab5b,11
1631822427.0,2021-09-16,wallstreetbets,hd4cow2,"SDC close at $6 looks beautiful, this baby might run tomorrow",t3_ppab5b,8
1631822452.0,2021-09-16,wallstreetbets,hd4cr63,"SDC closed at 6, good news for the bag holders!!",t3_ppab5b,12
1631789447.0,2021-09-16,wallstreetbets,hd2anmh,"TMC, OPAD & especially INRT... the fomo is real. Not in any of these",t3_ppab5b,31
1631787029.0,2021-09-16,wallstreetbets,hd27lwi,So we buy TMC?,t3_ppab5b,10
1631788131.0,2021-09-16,wallstreetbets,hd28xji,Good morning everyone I just wanted to tell everyone my tits are jacked like never before,t3_ppab5b,10
1631788278.0,2021-09-16,wallstreetbets,hd2944k,Hahaha oh my God.,t3_ppab5b,9
1631791354.0,2021-09-16,wallstreetbets,hd2df3m,"Lowest volume futures in a while. 

Something is up.",t3_ppab5b,9
1631792012.0,2021-09-16,wallstreetbets,hd2efja,"Evergrande is bears’ nuclear bomb. Imagine defaulting $500b dollars. In this meme economy, mostly everybody is a lender of somebody else. Ripple effect will destroy everything 😂",t3_ppab5b,8
1631792036.0,2021-09-16,wallstreetbets,hd2egw1,My 100 OPAD FDs were def too conservative sigh,t3_ppab5b,10
1631792074.0,2021-09-16,wallstreetbets,hd2ej4i,Sold my OPAD at $12 yesterday. I wanna drink some bleach,t3_ppab5b,9
1631792413.0,2021-09-16,wallstreetbets,hd2f2n2,Sold my calls at ATH. I am glad. Today I think we all see some dumps again,t3_ppab5b,9
1631792665.0,2021-09-16,wallstreetbets,hd2fhbq,"Not going to miss opad. Have enough for 1,000 shares to buy at open",t3_ppab5b,9
1631792847.0,2021-09-16,wallstreetbets,hd2fs1b,"I am buying the fear. China, tech, solar/green energy and meme stocks. I am buying it all with both hands. Buy when there is blood on the streets.",t3_ppab5b,10
1631793827.0,2021-09-16,wallstreetbets,hd2hfbp,[deleted],t3_ppab5b,8
1631794358.0,2021-09-16,wallstreetbets,hd2icbr,If we can hit the ChinaTradeTalksGoingWell.exe for the nice pump that would be awesome,t3_ppab5b,10
1631798180.0,2021-09-16,wallstreetbets,hd2po2y,Buying another 5k stocks on OPAD,t3_ppab5b,10
1631798670.0,2021-09-16,wallstreetbets,hd2qpoi,450 1 dte so tempting,t3_ppab5b,9
1631798823.0,2021-09-16,wallstreetbets,hd2r1hq,Pltr $25 by open $30 by lunch $22.90 by close,t3_ppab5b,9
1631799048.0,2021-09-16,wallstreetbets,hd2rii8,"**When you realize your gains depend on your moves**

Rigged market 😒😒😒",t3_ppab5b,9
1631799347.0,2021-09-16,wallstreetbets,hd2s5f9,I bought calls and we IMMEDIATELY dropped lmfaooo,t3_ppab5b,10
1631799735.0,2021-09-16,wallstreetbets,hd2sz59,"SPY, why r u gey?",t3_ppab5b,9
1631800083.0,2021-09-16,wallstreetbets,hd2tqv4,"So all I see is bulls BACK and bears fucked. Refresh 7 mins later and everyone is broken and game over.

I love this thread",t3_ppab5b,9
1631800100.0,2021-09-16,wallstreetbets,hd2ts9q,I just showered and 10 minutes later have to shit. Why do bad things happen to good people,t3_ppab5b,9
1631800578.0,2021-09-16,wallstreetbets,hd2uvd3,Drill Team 6 deployed. back-up arriving,t3_ppab5b,9
1631801266.0,2021-09-16,wallstreetbets,hd2wgkv,ITS JEROME POWELL WITH A STEEL CHAIR AND A PRINTER MY GAWD MY GAWD,t3_ppab5b,10
1631802084.0,2021-09-16,wallstreetbets,hd2yefa,Never trust someone who spells lose as loose,t3_ppab5b,8
1631802206.0,2021-09-16,wallstreetbets,hd2yoz3,My broker fee to sell my SPY calls is more than my SPY calls are worth,t3_ppab5b,8
1631802207.0,2021-09-16,wallstreetbets,hd2yp20,Lol well my tactic of just buying an insane amount of spy calls at the dips over the last few months worked great until the last few weeks... now I've lost over half my account,t3_ppab5b,9
1631802478.0,2021-09-16,wallstreetbets,hd2zck7,"My bulls brothers, we have been hoodwinked, bamboozled, lead astray, run amok",t3_ppab5b,10
1631802871.0,2021-09-16,wallstreetbets,hd30apf,"GO PLTR, GO TO THE MF MOON!!!!!!!!!!!!",t3_ppab5b,8
1631802885.0,2021-09-16,wallstreetbets,hd30bw7,PLTR 🚀🚀🚀🚀👀👀,t3_ppab5b,9
1631803190.0,2021-09-16,wallstreetbets,hd312jc,Guys PLTR isn’t stopping. It’s fomo at this point and I fuckin love it!!!,t3_ppab5b,8
1631803415.0,2021-09-16,wallstreetbets,hd31m7b,It’s fucking hard out here for a bull man fuck,t3_ppab5b,10
1631803716.0,2021-09-16,wallstreetbets,hd32cnz,I used PLTR Foundry and found my long lost dad,t3_ppab5b,9
1631803802.0,2021-09-16,wallstreetbets,hd32kcb,"I'm green on PLTR?  What!?

Everything I know is wrong! Black is white up is down and short is long!",t3_ppab5b,9
1631803806.0,2021-09-16,wallstreetbets,hd32kq0,Pltr silently ripping,t3_ppab5b,9
1631804455.0,2021-09-16,wallstreetbets,hd346cs,I could have made 5k yesterday... But I wanted more. Now I'm likely to lose 10k. 🤡,t3_ppab5b,9
1631804573.0,2021-09-16,wallstreetbets,hd34giv,if pltr can break 28.5 that would be swell,t3_ppab5b,9
1631804880.0,2021-09-16,wallstreetbets,hd3572j,"Holy shit.  

Options are definitely the way. Shares are a safe man's bet.",t3_ppab5b,9
1631805142.0,2021-09-16,wallstreetbets,hd35ub4,Who’s on the OPAD gain ? 🤝❤️,t3_ppab5b,10
1631805304.0,2021-09-16,wallstreetbets,hd368mu,Opad might double by tomorrow,t3_ppab5b,9
1631805502.0,2021-09-16,wallstreetbets,hd36q5v,The meme stocks are like a strip club that trading firms go to when they can't score in a regular club.,t3_ppab5b,10
1631805807.0,2021-09-16,wallstreetbets,hd37hrw,I got tricked ngl,t3_ppab5b,8
1631805918.0,2021-09-16,wallstreetbets,hd37rsw,I thought I was a market genius getting out of my spy puts yesterday for a huge loss when it was only up .30. Turns out I’m a retard,t3_ppab5b,8
1631806497.0,2021-09-16,wallstreetbets,hd3986u,LIDR GOING INSANE,t3_ppab5b,9
1631807206.0,2021-09-16,wallstreetbets,hd3b074,"Schwab: *WARNING: you have at or near the money options expiring tomorrow*

Also Schwab: Bid 0 x $0 haha got em",t3_ppab5b,11
1631807327.0,2021-09-16,wallstreetbets,hd3bb93,"Small gamble on LIDR, might as well.",t3_ppab5b,9
1631807387.0,2021-09-16,wallstreetbets,hd3bgpa,Just bought 1000 shares of LIDR. I dont know why,t3_ppab5b,9
1631807759.0,2021-09-16,wallstreetbets,hd3cej3,[removed],t3_ppab5b,9
1631808427.0,2021-09-16,wallstreetbets,hd3e1zt,LIDR is the easiest play ever,t3_ppab5b,10
1631808548.0,2021-09-16,wallstreetbets,hd3ecwk,"Bought 1 lidr 12.5C for 30$.

Hehe",t3_ppab5b,9
1631809023.0,2021-09-16,wallstreetbets,hd3fify,“Gamma squeeze” = P&D so be careful out there,t3_ppab5b,9
1631809531.0,2021-09-16,wallstreetbets,hd3grou,How the hell do you guys find out about these big meme stocks before they become memes?,t3_ppab5b,9
1631809628.0,2021-09-16,wallstreetbets,hd3h0ed,"PLTR making me rock hard, buying those dips paid off well",t3_ppab5b,9
1631810351.0,2021-09-16,wallstreetbets,hd3itn7,SDC looking strong,t3_ppab5b,10
1631811441.0,2021-09-16,wallstreetbets,hd3lld4,"Made a killing this week on the two big meme pumps. Cashed out enough for a Cancun trip and just put the rest into SDC just now.  
Lets keep this winning craps table going boys!!!!",t3_ppab5b,9
1631811605.0,2021-09-16,wallstreetbets,hd3m066,"OPAD halted, fuck shorts",t3_ppab5b,9
1631811690.0,2021-09-16,wallstreetbets,hd3m7uf,Opad suspended?,t3_ppab5b,8
1631811989.0,2021-09-16,wallstreetbets,hd3myft,OPAD out here giving me a stroke with its suspension.,t3_ppab5b,9
1631812439.0,2021-09-16,wallstreetbets,hd3o2vq,MSFT about to carry spy to 447 eod,t3_ppab5b,8
1631812481.0,2021-09-16,wallstreetbets,hd3o6lv,"money money money i love money

\-me, mr. krabs",t3_ppab5b,9
1631812722.0,2021-09-16,wallstreetbets,hd3os5s,Dammit im out of cocaine,t3_ppab5b,9
1631812742.0,2021-09-16,wallstreetbets,hd3ou2d,Opad to 50 EOD?,t3_ppab5b,9
1631813247.0,2021-09-16,wallstreetbets,hd3q3tr,"Market is boring, Meme is where the action is.",t3_ppab5b,9
1631813529.0,2021-09-16,wallstreetbets,hd3qss3,"I am become dump, destroyer of pump",t3_ppab5b,9
1631813616.0,2021-09-16,wallstreetbets,hd3r0dk,Opad doing some John wick shit trying to break out again,t3_ppab5b,10
1631814024.0,2021-09-16,wallstreetbets,hd3s0ow,Only down $1 K today. Feels like profit,t3_ppab5b,9
1631814174.0,2021-09-16,wallstreetbets,hd3sdtb,Did the suspension just kill OPAD?,t3_ppab5b,8
1631815628.0,2021-09-16,wallstreetbets,hd3vz1g,How do people have like one beer an hour who the fuck are you. I just went to a company lunch and I had to physically think about sipping slowly and not going at Frat star retard blackout pace,t3_ppab5b,7
1631815947.0,2021-09-16,wallstreetbets,hd3wr0x,SDC LETS GOOOO,t3_ppab5b,9
1631816016.0,2021-09-16,wallstreetbets,hd3wx4z,"So every time SPY hits 444 just load up on 0DTE calls

Got it",t3_ppab5b,9
1631816040.0,2021-09-16,wallstreetbets,hd3wz8t,Lol my spy puts went from +30% to -5% 🤡,t3_ppab5b,8
1631816112.0,2021-09-16,wallstreetbets,hd3x5ny,$SDC at daily average volume. Let’s go baby! Time to break that $6 resistance and let my calls print,t3_ppab5b,8
1631816407.0,2021-09-16,wallstreetbets,hd3xw4a,SDC with stock twit. And power hours. Oh baby,t3_ppab5b,8
1631816632.0,2021-09-16,wallstreetbets,hd3yge1,If SPY closes green I’ll ask my gf if I can watch this time,t3_ppab5b,10
1631817150.0,2021-09-16,wallstreetbets,hd3zpyc,Fuck it. SDC $6 1dte lets go,t3_ppab5b,9
1631817287.0,2021-09-16,wallstreetbets,hd401zw,PLTR you sexy beast! My wife’s bf is gonna drop her off at my place today🙂,t3_ppab5b,9
1631817300.0,2021-09-16,wallstreetbets,hd4035y,"They are buying the dip, sir",t3_ppab5b,8
1631817657.0,2021-09-16,wallstreetbets,hd40yr0,"In an attempt to be more like Robinhood, Fidelity has taken features away that I went there for.",t3_ppab5b,9
1631818017.0,2021-09-16,wallstreetbets,hd41utb,If Spy ends green we def hitting 450 tomorrow morning.,t3_ppab5b,9
1631818154.0,2021-09-16,wallstreetbets,hd427f3,[Taps Forehead]  you can’t get IV crushed if you keep driving the IV up.,t3_ppab5b,9
1631818596.0,2021-09-16,wallstreetbets,hd43b1d,This is a strong BODY,t3_ppab5b,9
1631819077.0,2021-09-16,wallstreetbets,hd44fa7,LILM above 10.5 will fly,t3_ppab5b,10
1631819096.0,2021-09-16,wallstreetbets,hd44gyy,Spy is so impressive.,t3_ppab5b,9
1631819189.0,2021-09-16,wallstreetbets,hd44p5w,Where the guy that said he’s going to suck his sister toes if spy goes green?,t3_ppab5b,10
1631819254.0,2021-09-16,wallstreetbets,hd44uta,Spy green let’s fucking go,t3_ppab5b,9
1631819352.0,2021-09-16,wallstreetbets,hd4534c,"SPY up ✅
Memes up ✅
Dick up ✅",t3_ppab5b,9
1631819749.0,2021-09-16,wallstreetbets,hd4628e,SPY don’t give a shit,t3_ppab5b,10
1631819939.0,2021-09-16,wallstreetbets,hd46ixr,#BUY EVERYTHING!!!,t3_ppab5b,9
1631820180.0,2021-09-16,wallstreetbets,hd474b0,Guys everything doesn’t have to be a trap. It may sound crazy but it’s true.,t3_ppab5b,9
1631820460.0,2021-09-16,wallstreetbets,hd47ta0,when you realize jan 2022 leaps are only 4 months out and not 1 year away...,t3_ppab5b,8
1631820635.0,2021-09-16,wallstreetbets,hd488o6,Spy doing its best Amazon impression the past few days. A whole lotta up and down to just move sideways,t3_ppab5b,10
1631821479.0,2021-09-16,wallstreetbets,hd4ac4h,Danngggg smells like shit in here. How many of ya’ll holding bags of shit?,t3_ppab5b,11
1631822137.0,2021-09-16,wallstreetbets,hd4bz8p,This is the moments when bagholders are born.,t3_ppab5b,9
1631822284.0,2021-09-16,wallstreetbets,hd4cc86,Wait SDC might be doing something...again..,t3_ppab5b,9
1631822331.0,2021-09-16,wallstreetbets,hd4cgch,Absolutely absurd sell wall for SDC at 6 through 6.05. Once that snaps this thing is going crazy,t3_ppab5b,8
1631807026.0,2021-09-16,wallstreetbets,hd3ajz7,"1% up does not make up for 1% down.  

Bears are inherently more powerful. Learn math dumb bulls.",t3_ppab5b,22
1631809371.0,2021-09-16,wallstreetbets,hd3gd9j,"This sub summarized: ""God I'm so sick of hearing about your stupid pump and dumb. Buy a real stock, like MY pump and dump""",t3_ppab5b,25
1631816446.0,2021-09-16,wallstreetbets,hd3xznd,"""You have expiring options positions"" shut up bitch i know",t3_ppab5b,27
1631823400.0,2021-09-16,wallstreetbets,hd4f2t8,"Well…I made $80 off of $10,000 in calls. Could’ve been worse",t3_ppab5b,23
1631787963.0,2021-09-16,wallstreetbets,hd28q7m,"46 smashed, 47 soon?",t3_ppab5b,7
1631788522.0,2021-09-16,wallstreetbets,hd29fbp,Where’s u/stonkgodcapital right now,t3_ppab5b,7
1631788688.0,2021-09-16,wallstreetbets,hd29mzm,I would do me.,t3_ppab5b,8
1631789708.0,2021-09-16,wallstreetbets,hd2b0jb,Iron Hands 🙌🏾 🥵,t3_ppab5b,8
1631792191.0,2021-09-16,wallstreetbets,hd2epvr,"LOL, Evergrande warns of additional defaults",t3_ppab5b,9
1631794207.0,2021-09-16,wallstreetbets,hd2i2rv,Waking up and seeing OPAD 🍆🍆🍆,t3_ppab5b,8
1631795333.0,2021-09-16,wallstreetbets,hd2k2wp,My SPY 450cs aren't feeling so good.,t3_ppab5b,8
1631795449.0,2021-09-16,wallstreetbets,hd2kanf,"Price predictions:

IRNT: 80 EOW

OPAD: 50 EOW

TMC: 40 EOW

&#x200B;

Source: My imagination",t3_ppab5b,7
1631795770.0,2021-09-16,wallstreetbets,hd2kvrh,I don’t even know what tapering will look like this time around considering the fact that the fed balance sheet is probably only composed of fucking spy and the nasdaq lmao,t3_ppab5b,9
1631795791.0,2021-09-16,wallstreetbets,hd2kx79,Wait.. good news is good news now??,t3_ppab5b,9
1631795913.0,2021-09-16,wallstreetbets,hd2l5d8,Is that Darth Vaders daughter on CNBC?,t3_ppab5b,9
1631795926.0,2021-09-16,wallstreetbets,hd2l6aj,This woman on CNBC has terrible connection and her voice is distorted like a robot. Hilarious,t3_ppab5b,7
1631795984.0,2021-09-16,wallstreetbets,hd2la9d,Retail sales beat? Tapering starts soon,t3_ppab5b,8
1631796018.0,2021-09-16,wallstreetbets,hd2lcm0,Uncle Xi no stop it hurts,t3_ppab5b,8
1631796197.0,2021-09-16,wallstreetbets,hd2lopi,"Squeeze this, squeeze that, squeeze your moms",t3_ppab5b,8
1631796735.0,2021-09-16,wallstreetbets,hd2mq8k,Phew good thing I’m safe with putting 25% of my portfolio in SPY puts yesterday…..🥴,t3_ppab5b,8
1631797615.0,2021-09-16,wallstreetbets,hd2ohwm,I just started working and I’m already eyeing my bed for a quick nap 😩,t3_ppab5b,9
1631797877.0,2021-09-16,wallstreetbets,hd2p16u,"Stock buying power: $1000

Options buying power $0.07

hate waiting for that deposit to clear on tda",t3_ppab5b,9
1631797978.0,2021-09-16,wallstreetbets,hd2p8vv,I'm so tempted to buy BABA but wtf bruh,t3_ppab5b,7
1631798566.0,2021-09-16,wallstreetbets,hd2qhme,Why all the uranium talks lately? Gas and oil getting too expensive? Wind stopped blowing in Europe? Lmao,t3_ppab5b,9
1631798705.0,2021-09-16,wallstreetbets,hd2qseg,"Why can't coinstar and Robinhood collaborate so I can deposit my chump change into the account? 🤔

Got like $400 in coins losin value each day.",t3_ppab5b,7
1631799127.0,2021-09-16,wallstreetbets,hd2rohn,Spy retard strength engage,t3_ppab5b,7
1631799168.0,2021-09-16,wallstreetbets,hd2rrmp,PLTR BABY GIRL,t3_ppab5b,8
1631799444.0,2021-09-16,wallstreetbets,hd2scoa,PLTR rocket ship,t3_ppab5b,8
1631799576.0,2021-09-16,wallstreetbets,hd2smnz,This is one of those mornings that I have no idea what to buy.,t3_ppab5b,8
1631799672.0,2021-09-16,wallstreetbets,hd2su52,PLTR the way up to new highs is free 🚀🚀🚀,t3_ppab5b,9
1631799909.0,2021-09-16,wallstreetbets,hd2tcsr,holy fuck will i finally be able to breakeven on PLTR?,t3_ppab5b,9
1631799950.0,2021-09-16,wallstreetbets,hd2tg50,I’m really tired of losing money guys,t3_ppab5b,7
1631799993.0,2021-09-16,wallstreetbets,hd2tjk2,"Big thanks to whoever posted that OPAD DD, grabbed 300% on my calls and i’m out in 15min 😂",t3_ppab5b,8
1631800043.0,2021-09-16,wallstreetbets,hd2tnir,My PLTR is finally green again. Bought at the start of the year @$37 like a true retard and bought some more when it dropped.,t3_ppab5b,8
1631800242.0,2021-09-16,wallstreetbets,hd2u3y5,PLTR is back on the menu bigly,t3_ppab5b,8
1631800319.0,2021-09-16,wallstreetbets,hd2ua75,Have you guys tried buying FD's and then don't look at the chart. Just read the comments here. You sell those FD's based on comments.,t3_ppab5b,8
1631800915.0,2021-09-16,wallstreetbets,hd2vn8g,Spy puts = easiest money today,t3_ppab5b,8
1631800933.0,2021-09-16,wallstreetbets,hd2vos8,"Mama Mia! Quick, inject more spaghett into the economy!",t3_ppab5b,7
1631801277.0,2021-09-16,wallstreetbets,hd2whio,"Portfolio just hit Stop Loss

^Stop ^Loss - the divorce papers my wife sent me",t3_ppab5b,8
1631801334.0,2021-09-16,wallstreetbets,hd2wm7l,Amc is green. Pltr is 28. Are we going back to better times?,t3_ppab5b,9
1631801363.0,2021-09-16,wallstreetbets,hd2won6,"Take a deep breath in

Exhale

Now repeat after me: ""I'm down but others are downer""

Thank you for participating in today's mental health boost",t3_ppab5b,7
1631801468.0,2021-09-16,wallstreetbets,hd2wxnc,I lost 20k in 2 days with PLTR. I knew god didn’t love me but this is too much to handle at once,t3_ppab5b,8
1631801555.0,2021-09-16,wallstreetbets,hd2x557,Pala. fucking. ntier.,t3_ppab5b,7
1631801714.0,2021-09-16,wallstreetbets,hd2xirp,PLTR: when you nut 🥜 but she keep succin,t3_ppab5b,8
1631801926.0,2021-09-16,wallstreetbets,hd2y0r8,Baba turning green bc I unloaded my calls for a 25k loss,t3_ppab5b,8
1631802271.0,2021-09-16,wallstreetbets,hd2yulz,"Wow, being a PLTR holder is cool again. What a time to be alive",t3_ppab5b,8
1631802394.0,2021-09-16,wallstreetbets,hd2z5cl,PLTR we in this bitch! Never doubt the hair! BREAKTHROUGH ACHIEVED,t3_ppab5b,8
1631803017.0,2021-09-16,wallstreetbets,hd30njg,i told you pltr would make its sneak run in Sept confusion,t3_ppab5b,7
1631803094.0,2021-09-16,wallstreetbets,hd30u6j,What’s the news behind PLTR?,t3_ppab5b,8
1631803133.0,2021-09-16,wallstreetbets,hd30xjn,Does anyone know why PLTR been pumping lately? I'm loaded to the tits on 9/24 $30 calls so I'm excited. Just wanna know if any news.,t3_ppab5b,9
1631803176.0,2021-09-16,wallstreetbets,hd311ap,+2500 shares of PLTR on margin yee haw,t3_ppab5b,7
1631803278.0,2021-09-16,wallstreetbets,hd31a8g,Bulls gave back all the gains in one fucking hour,t3_ppab5b,7
1631803402.0,2021-09-16,wallstreetbets,hd31kyz,Another $1.2k off spy puts in 7 minutes lmao another ez money day today $15k scalping,t3_ppab5b,8
1631803855.0,2021-09-16,wallstreetbets,hd32p52,"Friendship with SPY ended, PLTR new best friend",t3_ppab5b,8
1631803911.0,2021-09-16,wallstreetbets,hd32u2m,[deleted],t3_ppab5b,7
1631804055.0,2021-09-16,wallstreetbets,hd336va,If you're a perma bull retard please stand up.,t3_ppab5b,8
1631804082.0,2021-09-16,wallstreetbets,hd339ai,Can we get a -5% day like in good ol days,t3_ppab5b,9
1631804157.0,2021-09-16,wallstreetbets,hd33g11,Palantanatardian approaching 30. It’s flying too close to the sun.,t3_ppab5b,8
1631804763.0,2021-09-16,wallstreetbets,hd34wxx,OPAD. Strap in,t3_ppab5b,7
1631804795.0,2021-09-16,wallstreetbets,hd34zpe,PLTR gang rise up,t3_ppab5b,7
1631804898.0,2021-09-16,wallstreetbets,hd358ls,Regret not buying those PLTR $30c when they were 5 cents an hour ago. Ugh,t3_ppab5b,7
1631805015.0,2021-09-16,wallstreetbets,hd35iwx,Opaaaaaaaddd LFG,t3_ppab5b,9
1631805091.0,2021-09-16,wallstreetbets,hd35pqr,Fuck me OPAD is going crazy,t3_ppab5b,9
1631805581.0,2021-09-16,wallstreetbets,hd36xac,"If youve been in the market the past week and a half, you will probably ask yourself who in their right mind is still buying",t3_ppab5b,9
1631805581.0,2021-09-16,wallstreetbets,hd36xc1,Fucking way to completely erase yesterday jesus christ,t3_ppab5b,8
1631805681.0,2021-09-16,wallstreetbets,hd376ey,Is margin call going to fuck the market this afternoon?,t3_ppab5b,8
1631805691.0,2021-09-16,wallstreetbets,hd37788,Ok bears you won,t3_ppab5b,8
1631805720.0,2021-09-16,wallstreetbets,hd379t5,I appears I did not buy calls at the bottom. ..,t3_ppab5b,7
1631805822.0,2021-09-16,wallstreetbets,hd37j3m,WHAT IS NANCY BUYING????,t3_ppab5b,8
1631805935.0,2021-09-16,wallstreetbets,hd37tc1,WSB when a ticker is down 80%: BUY THE DIP WSB when a ticker is up 0.8%: mY CaLls ArE PrInTiNG,t3_ppab5b,8
1631805936.0,2021-09-16,wallstreetbets,hd37tfp,Bought an OPAD 17.50c. This is toxic. I can't trade like this!!!,t3_ppab5b,8
1631806889.0,2021-09-16,wallstreetbets,hd3a7ki,PLTR currently saving my portfolio!! That’s how wank my portfolio is 😂,t3_ppab5b,8
1631807124.0,2021-09-16,wallstreetbets,hd3astq,Selling October OPAD puts for the IV crush play. Surely this can't go wrong.,t3_ppab5b,6
1631807251.0,2021-09-16,wallstreetbets,hd3b4cf,Ah yes I forgot people stopped going to the movies because of the payment options that were available there. Bullish,t3_ppab5b,8
1631808524.0,2021-09-16,wallstreetbets,hd3eaq4,"I used to think fat people were gross and lazy. I still do, but I used to too",t3_ppab5b,9
1631809211.0,2021-09-16,wallstreetbets,hd3fz8m,Y’all ever been so red on the day you delete the app and jack off like 3 times?,t3_ppab5b,7
1631810848.0,2021-09-16,wallstreetbets,hd3k2xq,The hype is real on PLTR no one was buying when it was at 20$ though 🤷‍♂️,t3_ppab5b,8
1631810903.0,2021-09-16,wallstreetbets,hd3k7yu,Lets go opad just hopped back in,t3_ppab5b,9
1631810905.0,2021-09-16,wallstreetbets,hd3k84o,A dollar in OPAD calls yesterday is $30 in less than 24 hours,t3_ppab5b,9
1631810980.0,2021-09-16,wallstreetbets,hd3kf4j,if somehow OPAD gets through 22-23 there's gonna be so much delta that MMs need to hedge that they will shot it to $100,t3_ppab5b,8
1631811623.0,2021-09-16,wallstreetbets,hd3m1tu,Errrrrr OPAD,t3_ppab5b,7
1631812025.0,2021-09-16,wallstreetbets,hd3n1oq,OPAD tomorrow is going to be beautiful,t3_ppab5b,8
1631812040.0,2021-09-16,wallstreetbets,hd3n2z0,no shame in taking profit but I sold my 9/17 OPAD $17c's at open.  I was up over 100%.  Coulda been more. But coulda been less (probably less if I had held since I'm bad luck and shit),t3_ppab5b,8
1631812249.0,2021-09-16,wallstreetbets,hd3nlq2,Okay the fact that 90% of the comments are all shit despac tickers.. im starting to sense a shitty pattern,t3_ppab5b,7
1631812318.0,2021-09-16,wallstreetbets,hd3nrzs,I ❤️‍🩹❤️‍🩹❤️‍🩹 $opad dip buyers,t3_ppab5b,8
1631812389.0,2021-09-16,wallstreetbets,hd3nyc0,"Wowza, no skin in the game for lidr....but sheesh",t3_ppab5b,8
1631812492.0,2021-09-16,wallstreetbets,hd3o7mw,Lol the BODY pumpers trying to get some of this despac love so they can get ride of their bags.,t3_ppab5b,8
1631812767.0,2021-09-16,wallstreetbets,hd3owem,PLTR 1dte 30c will print,t3_ppab5b,9
1631812916.0,2021-09-16,wallstreetbets,hd3p9us,"Media: Lucid EV has longest range of any EV

Me: Cool, when can I take delivery 

Media: Lucid EV has longest range of any EV",t3_ppab5b,8
1631813099.0,2021-09-16,wallstreetbets,hd3pqmc,OPAD fighting hard,t3_ppab5b,7
1631813590.0,2021-09-16,wallstreetbets,hd3qy5j,Wing and a prayer my $SDC and $SBUX calls payout. 9/24 exp and 36k in student loan debt to pay. Let’s go baby,t3_ppab5b,8
1631814097.0,2021-09-16,wallstreetbets,hd3s71r,Anyone else completely blow up their account today😛,t3_ppab5b,9
1631814151.0,2021-09-16,wallstreetbets,hd3sbtf,[deleted],t3_ppab5b,8
1631814953.0,2021-09-16,wallstreetbets,hd3ubam,Small dick club back in the menu,t3_ppab5b,8
1631815332.0,2021-09-16,wallstreetbets,hd3v8ve,SDC going down IV going up on my calls oyyyyveyyyy,t3_ppab5b,9
1631815654.0,2021-09-16,wallstreetbets,hd3w1bv,PLTR will hit 30 tomorrow. Last chance to get on the rocket,t3_ppab5b,7
