created,date,subreddit,id,body,parent_id,score
1585747048.0,2020-04-01,wallstreetbets,fm45kp3,"After watching the bulls on parade for the last week, these 💎👐🏻 were getting were getting harder to justify. Glad I didn't cave.",t3_fsxqpm,16
1585748827.0,2020-04-01,wallstreetbets,fm48964,Where my 🌈 🐻 💎 🖐 gang at?,t3_fsxqpm,17
1585750713.0,2020-04-01,wallstreetbets,fm4bbuq,"Just following up on this, our friend in ICU passed this morning

He had stabilized for a few days and seemed to be on the up and up

Stay safe fellow auties, please.

Oh yeah, puts on everything


https://reddit.com/r/wallstreetbets/comments/fq4eah/_/flt7b89/?context=1",t3_fsxqpm,14
1585759488.0,2020-04-01,wallstreetbets,fm4rjkp,Who sold their puts yesterday at a loss and then bought calls? I want to publicly shame you,t3_fsxqpm,16
1585759906.0,2020-04-01,wallstreetbets,fm4sc51,"My whole family thinks I’m some stock wiz and that this is my side job. If only they knew all I do is fuck around in this sub, smoke a shit ton of weed and watch numbers go uppies and downies",t3_fsxqpm,16
1585760533.0,2020-04-01,wallstreetbets,fm4tja4,"Spy 180p gang, report in.",t3_fsxqpm,17
1585765141.0,2020-04-01,wallstreetbets,fm52j29,"FED RECIEVES NO BIDS ON OVERNIGHT REPO

Hahaha",t3_fsxqpm,15
1585765985.0,2020-04-01,wallstreetbets,fm544ij,"Can't wait for the next cycle of WSB Comments:

""Want to buy puts but IV is too high!"" 

User buys puts at a literal intraday bottom ""Wow already losing money on my puts, this market is rigged""

Have a totally normal move up after big move down ""Fed is printing to keep the market up, wtf"" 

""Everyone here is so bearish, gonna inverse and buy calls"" 

""What is IV crush?""",t3_fsxqpm,17
1585766035.0,2020-04-01,wallstreetbets,fm547yl,[deleted],t3_fsxqpm,16
1585770514.0,2020-04-01,wallstreetbets,fm5cs1d,[deleted],t3_fsxqpm,17
1585771890.0,2020-04-01,wallstreetbets,fm5fcfw,ALL OF YOU WERE TOO BUSY WATCHING SPY TO SEE THEY CANCELLED KHABIB V TONY... LONG $ROPE,t3_fsxqpm,16
1585771988.0,2020-04-01,wallstreetbets,fm5fitg,I remember this one day in January when the market was down 1% and people here were calling it a crash. Good times.,t3_fsxqpm,15
1585772838.0,2020-04-01,wallstreetbets,fm5h3qx,"Coronavirus cancelled bois

[http://www.msn.com/en-us/health/health-news/georgia-mayor-cancels-social-distancing-order-amid-coronavirus-pandemic/ar-BB121Vo7?li=BBnb7Kz&ocid=UE01DHP](http://www.msn.com/en-us/health/health-news/georgia-mayor-cancels-social-distancing-order-amid-coronavirus-pandemic/ar-BB121Vo7?li=BBnb7Kz&ocid=UE01DHP)",t3_fsxqpm,16
1585774508.0,2020-04-01,wallstreetbets,fm5k971,If red tomorrow i will fight a Mod.,t3_fsxqpm,16
1585774649.0,2020-04-01,wallstreetbets,fm5kiuq,Holy fuck the 10Y Is at .57% didn’t even realize. Bulls r so fucked,t3_fsxqpm,15
1585742886.0,2020-04-01,wallstreetbets,fm405gf,[deleted],t3_fsxqpm,15
1585747517.0,2020-04-01,wallstreetbets,fm469dq,You’re welcome... paper handed my puts yesterday,t3_fsxqpm,15
1585748118.0,2020-04-01,wallstreetbets,fm475gd,[deleted],t3_fsxqpm,15
1585748886.0,2020-04-01,wallstreetbets,fm48cfv,Why is it so much more fun to be a Bear than a bull?,t3_fsxqpm,15
1585749965.0,2020-04-01,wallstreetbets,fm4a34q,"Thank you to the  🌈🐻 bros who had toilet paper hands yesterday and flipped bullish so that we could profit, your sacrifice will not be forgotten.  💎🙌  all the way now boys",t3_fsxqpm,15
1585750644.0,2020-04-01,wallstreetbets,fm4b7p1,"I'm holding my SPY 5/15 $220p, unemployment numbers are going to be worse than expectations for at least a few weeks.

tomorrow's numbers will contain a good amount of claims that should have been counted in the last update; so many states' claims were completely backlogged/crashed entirely.",t3_fsxqpm,16
1585754836.0,2020-04-01,wallstreetbets,fm4il7y,Once I started going for a walk the market went down. I know what I must do. I will walk until bell close,t3_fsxqpm,15
1585769365.0,2020-04-01,wallstreetbets,fm5ak8g,"hey I'm up 34% today! Oh wait, I'm down 75% this month..",t3_fsxqpm,16
1585771330.0,2020-04-01,wallstreetbets,fm5ebe9,"https://www.newyorkfed.org/markets/domestic-market-operations/monetary-policy-implementation/treasury-securities/treasury-securities-operational-details

The Fed is reducing their daily treasury purchases to 120 billion tomorrow, down from 300 and then 225 billion in the last week",t3_fsxqpm,16
1585771540.0,2020-04-01,wallstreetbets,fm5ep52,"In the last month I’ve gone from -97% all time and I’ve raised it all the way to -2% all time! Still holding lots of spy puts so plenty of time to make it back to -100%!!!

**wsbgoals**",t3_fsxqpm,15
1585771843.0,2020-04-01,wallstreetbets,fm5f9e7,I held all my puts.  Didn’t lock in profits even in 1.  Up $12.7k today.  Almost made back my losses over the past 2 days. Another day like today please to close the week.  Also TSLA please die to $400,t3_fsxqpm,15
1585746939.0,2020-04-01,wallstreetbets,fm45ewa,"Casino is about to open 15 mins. I will be at spx table. Come say hi im the guy with 20k dow hat.

Good luck bulls, bears and hourglass gang.

Happy gambling.",t3_fsxqpm,40
1585739501.0,2020-04-01,wallstreetbets,fm3wfwi,I wish I averaged down more yesterday.,t3_fsxqpm,15
1585742050.0,2020-04-01,wallstreetbets,fm3z6y2,"Does this mean that my spy 4/1 160 p are saved?

Phew!",t3_fsxqpm,14
1585742715.0,2020-04-01,wallstreetbets,fm3zydp,F for the bears who capitulated yesterday,t3_fsxqpm,15
1585742853.0,2020-04-01,wallstreetbets,fm40444,It’s like that bull run was just one giant April fool pranks,t3_fsxqpm,14
1585743701.0,2020-04-01,wallstreetbets,fm4144r,"Real unemployment numbers out tomorrow, not today",t3_fsxqpm,13
1585743761.0,2020-04-01,wallstreetbets,fm416pu,"Yessa, I'd like a double-breaker biscuit. Tendies on the side.",t3_fsxqpm,13
1585745109.0,2020-04-01,wallstreetbets,fm42we1,As a wsb vet I’m now at the point where I can’t tell if JPow printer is a meme or if some people actually think he’s sitting in his office printing money 💀💀💀,t3_fsxqpm,15
1585745193.0,2020-04-01,wallstreetbets,fm430e7,I diamond handed my 4/17s since last wednesday. I finally awake with a smile.,t3_fsxqpm,14
1585745540.0,2020-04-01,wallstreetbets,fm43h1j,">Your monthly interest payment of $0.10 through Cash Management was made to your brokerage account today.

all hail RH",t3_fsxqpm,14
1585746528.0,2020-04-01,wallstreetbets,fm44tnl,All I’m really trying to do here is build my account large enough with puts that I can have a fuck ton of calls when we rip past the virus later.,t3_fsxqpm,14
1585747182.0,2020-04-01,wallstreetbets,fm45rui,The logo change was all this market needed,t3_fsxqpm,13
1585748332.0,2020-04-01,wallstreetbets,fm47h7m,"Man if SPY would hit $235 pretty soon so I could unload bags, that would be great",t3_fsxqpm,13
1585748356.0,2020-04-01,wallstreetbets,fm47iiy,"Oh my god guys, we went from -4% to -3%! Its a bear trap, sell puts! Buy calls! Retards...",t3_fsxqpm,13
1585748792.0,2020-04-01,wallstreetbets,fm4873k,Be patient bears. Even if -3% is all we get today there is still the rest of the week.,t3_fsxqpm,15
1585751581.0,2020-04-01,wallstreetbets,fm4ctaz,"Idk which of you fucking retards needs to hear this but,

THE DAY
JUST
STARTED

Don’t fucking panic at open you rock eaters",t3_fsxqpm,13
1585752396.0,2020-04-01,wallstreetbets,fm4e8sx,"Just close up your broker apps until 3:00, all the real action happens in power hour.",t3_fsxqpm,14
1585754548.0,2020-04-01,wallstreetbets,fm4i2b7,"Entire country is shut down and in complete standstill, people are losing their jobs left and right including my girlfriend who just got furloughed without pay from her $100k/year job in fertility, and talks that this could last over a year.

Yet we're 40 points off the bottom on SPY and only going up each day.

You would expect it to be much worse than this.",t3_fsxqpm,14
1585755049.0,2020-04-01,wallstreetbets,fm4izpy,"look if you comment and say ""if i held for 5 more minutes I would made like a bilgileon dollars""  shut the fuck up and tell it to your wifes boyfriend. No one cares.",t3_fsxqpm,13
1585755864.0,2020-04-01,wallstreetbets,fm4kjmj,I bought 200 shares of BA at $180 on Thursday's bull trap. $36K on margin. AMA.,t3_fsxqpm,13
1585755963.0,2020-04-01,wallstreetbets,fm4kqk0,"For those of you that don't remember the financial crises because you're too young or too stupid: THEY BAILOUT THE BONDHOLDERS NOT THE STOCKHOLDERS.

Hopefully you heard me in the back.",t3_fsxqpm,15
1585756082.0,2020-04-01,wallstreetbets,fm4kz0q,[deleted],t3_fsxqpm,14
1585757326.0,2020-04-01,wallstreetbets,fm4ne2m,I've never invested so much time into losing so much money.,t3_fsxqpm,14
1585757343.0,2020-04-01,wallstreetbets,fm4nf7u,#im a bull bois but I know in my heart we headed to 200 spy...,t3_fsxqpm,15
1585757519.0,2020-04-01,wallstreetbets,fm4nreo,"whenever i close a loser, i say ""you cant hurt me anymore""",t3_fsxqpm,14
1585757876.0,2020-04-01,wallstreetbets,fm4og3v,Its like Disney sacrifices children to not go below 95.,t3_fsxqpm,14
1585758294.0,2020-04-01,wallstreetbets,fm4p8tj,[deleted],t3_fsxqpm,15
1585759581.0,2020-04-01,wallstreetbets,fm4rpq4,All in on $F 5c 5/15 should only go tits up,t3_fsxqpm,14
1585759799.0,2020-04-01,wallstreetbets,fm4s4rq,[deleted],t3_fsxqpm,14
1585761748.0,2020-04-01,wallstreetbets,fm4vtjd,I was actually considering selling my Lyft 4/9 22p yesterday for a 90% loss. This market has me all sorts of fucked up,t3_fsxqpm,14
1585764576.0,2020-04-01,wallstreetbets,fm51h4a,"Florida goes on full lockdown, Disney rallies.",t3_fsxqpm,13
1585769500.0,2020-04-01,wallstreetbets,fm5atr5,The bulls are talking about closing the markets again,t3_fsxqpm,15
1585769570.0,2020-04-01,wallstreetbets,fm5ayhl,SPY about to collapse like a porn star after a bukkake scene.,t3_fsxqpm,14
1585770839.0,2020-04-01,wallstreetbets,fm5dedp,I absolutely hate the last 20 minutes of trading. It’s always a shitshow with candles the size of shrek and the devils cock out of nowhere,t3_fsxqpm,14
1585770994.0,2020-04-01,wallstreetbets,fm5dp0n,Yall need to chill. EOD pump means red tomorrow,t3_fsxqpm,14
1585771665.0,2020-04-01,wallstreetbets,fm5exha,"https://twitter.com/digital_explora/status/1245243178267095040?s=20

Puts on Ecuador",t3_fsxqpm,15
1585771843.0,2020-04-01,wallstreetbets,fm5f9ef,WeRE nOw IN a BuLL MarKET,t3_fsxqpm,14
1585772660.0,2020-04-01,wallstreetbets,fm5grqn,[deleted],t3_fsxqpm,14
1585772894.0,2020-04-01,wallstreetbets,fm5h7fh,Finally this shut the annoying brrrrrrr people up,t3_fsxqpm,14
1585773006.0,2020-04-01,wallstreetbets,fm5hexv,Is Carole Baskin’s husband being found in the septic tank priced in?,t3_fsxqpm,15
1585773205.0,2020-04-01,wallstreetbets,fm5hsa1,Nikkei futures down 6.9%,t3_fsxqpm,14
1585774007.0,2020-04-01,wallstreetbets,fm5jasv,"Remember yesterday when all the retarded bulls said quarter end was the same as quad witching, then we went down 4.5% the day after? I fuckin member hahaha dummies",t3_fsxqpm,13
1585741519.0,2020-04-01,wallstreetbets,fm3yl3d,[deleted],t3_fsxqpm,29
1585742915.0,2020-04-01,wallstreetbets,fm406oi,#APRIL FOOLS BULLS,t3_fsxqpm,33
1585740727.0,2020-04-01,wallstreetbets,fm3xpyq,I dont even wanna hear bastards who sold their puts,t3_fsxqpm,13
1585743710.0,2020-04-01,wallstreetbets,fm414jg,It pays to be a 🏳️‍🌈🐻 with 💎👐,t3_fsxqpm,12
1585744756.0,2020-04-01,wallstreetbets,fm42fjg,Circuit breaker today? It’s been so long since we had one,t3_fsxqpm,13
1585745798.0,2020-04-01,wallstreetbets,fm43tpz,"S&P moves up 0.01%
Bulls: ""Brrrrrrrrr. You hear that?!""",t3_fsxqpm,14
1585746156.0,2020-04-01,wallstreetbets,fm44b8g,"Finally, websites have stopped doing obnoxious April fool's gags, and all it took was a fucking pandemic",t3_fsxqpm,12
1585746970.0,2020-04-01,wallstreetbets,fm45gkn,"I realized why I was losing money all this time. I was charging my phone overnight, something I rarely do.",t3_fsxqpm,12
1585747530.0,2020-04-01,wallstreetbets,fm46a4q,BLASTING THROUGH SUPPORTS LIKE FRAT HOUSE DRYWALL,t3_fsxqpm,13
1585747885.0,2020-04-01,wallstreetbets,fm46t2f,Annnndddd my puts are still worth less than what I paid for them on Monday. Fuck IV,t3_fsxqpm,11
1585748783.0,2020-04-01,wallstreetbets,fm486n7,"Im a retard so im probably wrong but If I was to guess, I'd say were in for a wholeeee lot of flat theta fucking bullshit today.",t3_fsxqpm,14
1585748878.0,2020-04-01,wallstreetbets,fm48c02,Fuck this IV bullshit,t3_fsxqpm,13
1585750853.0,2020-04-01,wallstreetbets,fm4bka7,Bro can y’all stop staring at 1 second charts and idk maybe not have short sightedness of a goldfish. Lmfao.,t3_fsxqpm,13
1585751580.0,2020-04-01,wallstreetbets,fm4ct9j,"It's pretty cool that my puts are still down today.

👍",t3_fsxqpm,13
1585756041.0,2020-04-01,wallstreetbets,fm4kw73,RISE VIX and fulfill your destiny,t3_fsxqpm,12
1585756603.0,2020-04-01,wallstreetbets,fm4lz3n,Guy on cnbc said 40% of NY renters will not be able to pay rent today,t3_fsxqpm,13
1585757485.0,2020-04-01,wallstreetbets,fm4np28,"From down -90% to down -80% on these puts, I give up 😂",t3_fsxqpm,14
1585757944.0,2020-04-01,wallstreetbets,fm4okxj,"Guys listen I know its a crazy thought but

What if we had THREE red days in a row?",t3_fsxqpm,13
1585757992.0,2020-04-01,wallstreetbets,fm4oo87,[deleted],t3_fsxqpm,13
1585760150.0,2020-04-01,wallstreetbets,fm4ssst,The real test of diamond hands is holding when you are making money,t3_fsxqpm,13
1585761165.0,2020-04-01,wallstreetbets,fm4upxu,video went out on cuomos feed as soon as he talked about the feds printing money LOL THEYRE ONTO HIM,t3_fsxqpm,12
1585761264.0,2020-04-01,wallstreetbets,fm4uwkq,[deleted],t3_fsxqpm,13
1585761631.0,2020-04-01,wallstreetbets,fm4vlfu,nikkei futures down 6%,t3_fsxqpm,12
1585763378.0,2020-04-01,wallstreetbets,fm4z51h,"Guys hold your puts, Greenland/Madagascar/Caribbean are all infected so we're gonna mutate dysentery and total organ failure soon",t3_fsxqpm,12
1585763822.0,2020-04-01,wallstreetbets,fm501lm,"BA is the gift that keeps on giving

Rode BA from 300 to 100 with a 200P in early march

then 120 to 180 with a 200C

and now I have 100P from 160 to 130",t3_fsxqpm,14
1585765756.0,2020-04-01,wallstreetbets,fm53ot9,That Portnoy slug is down $400k today LMAO,t3_fsxqpm,13
1585767643.0,2020-04-01,wallstreetbets,fm57azj,"From -90% to now -70%, sweaty hands y’all 🐻",t3_fsxqpm,13
1585768327.0,2020-04-01,wallstreetbets,fm58lej,My puts are back in the green boys diamond hands unite,t3_fsxqpm,13
1585768515.0,2020-04-01,wallstreetbets,fm58y6h,My new book is entitled: “How to get an ulcer and lose money by not understanding theta.”,t3_fsxqpm,13
1585770072.0,2020-04-01,wallstreetbets,fm5bxc2,We're closer to 220 than we are to 270,t3_fsxqpm,13
1585770902.0,2020-04-01,wallstreetbets,fm5dio6,Did we learn nothing for the entire fall? A pump in the last 15 mins means red tomorrow.,t3_fsxqpm,13
1585771308.0,2020-04-01,wallstreetbets,fm5ea0k,Why everyone freaking out about the “pump”.  Literally went from 5% down to 4.5%. Nothing to get excited about,t3_fsxqpm,13
1585771308.0,2020-04-01,wallstreetbets,fm5ea0t,"Absolutely jacked to the tits with puts lads.

Its all down from here",t3_fsxqpm,13
1585773085.0,2020-04-01,wallstreetbets,fm5hk7v,Trump is going to start a war with Iran to save US shale oil.,t3_fsxqpm,14
1585761753.0,2020-04-01,wallstreetbets,fm4vtw3,End of day dump is going to be fucking glorious,t3_fsxqpm,37
1585746691.0,2020-04-01,wallstreetbets,fm4522a,Just found about about this “Coronavirus” shits crazy 😳,t3_fsxqpm,49
1585739219.0,2020-04-01,wallstreetbets,fm3w5lj,Puts ganna print. Trump had to retract what he said initially.,t3_fsxqpm,12
1585739700.0,2020-04-01,wallstreetbets,fm3wn75,"Alexa, play first of the month by bone thugs",t3_fsxqpm,12
1585741427.0,2020-04-01,wallstreetbets,fm3yhfi,[deleted],t3_fsxqpm,12
1585743603.0,2020-04-01,wallstreetbets,fm40zwh,So is this our April fools joke? We gonna moon now?,t3_fsxqpm,12
1585744352.0,2020-04-01,wallstreetbets,fm41wsg,I hope portnoy is balls deep in spy calls right now,t3_fsxqpm,12
1585744815.0,2020-04-01,wallstreetbets,fm42icx,"Well well well. Looks like everyone down 80% on those 4/17s are gonna only be down 40% today!

Myself included..",t3_fsxqpm,12
1585744929.0,2020-04-01,wallstreetbets,fm42num,Ain't no party like a circuit breaker party,t3_fsxqpm,12
1585745563.0,2020-04-01,wallstreetbets,fm43i49,Wow fuck me I sold my puts yesterday,t3_fsxqpm,13
1585745652.0,2020-04-01,wallstreetbets,fm43mhl,If you sold your puts for calls yesterday I have to wonder what the fuck are you even on /r/wallstreetbets for,t3_fsxqpm,11
1585745669.0,2020-04-01,wallstreetbets,fm43nbv,"Bulls go from directly being assholes to making printer noises. 

They cant just go away and know today isnt their day",t3_fsxqpm,13
1585746127.0,2020-04-01,wallstreetbets,fm449u9,Just bought a new car yesterday. My puts gonna pay for it this morning lmao.,t3_fsxqpm,12
1585746222.0,2020-04-01,wallstreetbets,fm44egm,[deleted],t3_fsxqpm,12
1585747227.0,2020-04-01,wallstreetbets,fm45u93,Imagine r/controlethenarative with his infinite money glitch during these time and his Apple puts play,t3_fsxqpm,12
1585747534.0,2020-04-01,wallstreetbets,fm46abt,"lmao, i saw many bear switch side just yesterday... this is how to get bankrupt 101.",t3_fsxqpm,10
1585747938.0,2020-04-01,wallstreetbets,fm46vtw,Were people really selling puts for a loss yesterday to buy calls?,t3_fsxqpm,11
1585747971.0,2020-04-01,wallstreetbets,fm46xlq,This isn't good enough for me to pull out. Looks like I'm holding.,t3_fsxqpm,12
1585748729.0,2020-04-01,wallstreetbets,fm483k4,"Fuck you Disney, fuck you in your stupid asshole.",t3_fsxqpm,13
1585750217.0,2020-04-01,wallstreetbets,fm4ai13,This was almost worst that a regular green day.,t3_fsxqpm,11
1585750444.0,2020-04-01,wallstreetbets,fm4avmw,SPY just announced they are letting go of 15% of their employees.,t3_fsxqpm,12
1585751250.0,2020-04-01,wallstreetbets,fm4c8k5,"The intraday chatter in this thread can be brain melting.  

0.3% fluctuations in SPX really doesn't merit: ""moonshot/drilltothecore/should I panic sell my 240p/260c that expires in 5 months""",t3_fsxqpm,12
1585752322.0,2020-04-01,wallstreetbets,fm4e45n,"Jesus Christ SPY, you and 250 should just get a room",t3_fsxqpm,12
1585752797.0,2020-04-01,wallstreetbets,fm4exvg,[deleted],t3_fsxqpm,12
1585753904.0,2020-04-01,wallstreetbets,fm4gwj3,I guess I’ll just go hit the circuit breakers on my house today for fun,t3_fsxqpm,12
1585754139.0,2020-04-01,wallstreetbets,fm4hbh4,Think it might be time to just hold these May puts and delete RH for a week or 2. This has been a very stressful few weeks watching my money evaporate,t3_fsxqpm,13
1585754427.0,2020-04-01,wallstreetbets,fm4hubq,[deleted],t3_fsxqpm,12
1585754596.0,2020-04-01,wallstreetbets,fm4i5e6," [https://www.bloomberg.com/news/articles/2020-04-01/china-concealed-extent-of-virus-outbreak-u-s-intelligence-says](https://www.bloomberg.com/news/articles/2020-04-01/china-concealed-extent-of-virus-outbreak-u-s-intelligence-says) 

&#x200B;

US is (officially) claiming that China was lying about their stats

&#x200B;

color me shocked",t3_fsxqpm,12
1585755234.0,2020-04-01,wallstreetbets,fm4jcdy,[deleted],t3_fsxqpm,13
1585755380.0,2020-04-01,wallstreetbets,fm4jmd6,"I’m down $25, this is so calming considering yesterday I lost $2.5k",t3_fsxqpm,12
1585756033.0,2020-04-01,wallstreetbets,fm4kvkr,Why doesn't the fed just buy puts. turn 2 trillion into 9 trillion then offer everyone stimulus.  Seems like the logical thing to do.,t3_fsxqpm,12
1585756226.0,2020-04-01,wallstreetbets,fm4l8tj,"Ah yeah, nothing like offloading puts and flipping to calls at the top yesterday",t3_fsxqpm,13
1585756518.0,2020-04-01,wallstreetbets,fm4lt46,I smell a dump incoming,t3_fsxqpm,12
1585758304.0,2020-04-01,wallstreetbets,fm4p9kd,20% chance of recovery if you get on a vent in NY woah,t3_fsxqpm,12
1585759480.0,2020-04-01,wallstreetbets,fm4rizw,Circuit breaker is at -7 not -5,t3_fsxqpm,11
1585760313.0,2020-04-01,wallstreetbets,fm4t44i,Don't be ego filled. This is the beginning of the leg down to retest the lows at 220. Be smart and play accordingly,t3_fsxqpm,11
1585760522.0,2020-04-01,wallstreetbets,fm4tij3,I will blow every bulls' dicks wearing Dr.Birx's scarf if SPY doesn't end below 242 today.,t3_fsxqpm,13
1585761259.0,2020-04-01,wallstreetbets,fm4uw8v,Real talk is anyone else starting to get pants shittingly terrified about all of this? Things are going to be fucked for a while...,t3_fsxqpm,13
1585761455.0,2020-04-01,wallstreetbets,fm4v9j4,I lost money on SPY puts today AMA,t3_fsxqpm,13
1585763396.0,2020-04-01,wallstreetbets,fm4z6ag,"Disney World will likely be closed until at least May 1, Florida just issued a month-long stay at home order.  Get your puts now so you can still be fucked by the mouse when $DIS goes up.",t3_fsxqpm,12
1585763462.0,2020-04-01,wallstreetbets,fm4zb56,"Im up $66 on $5,000 worth of SPY puts",t3_fsxqpm,12
1585764503.0,2020-04-01,wallstreetbets,fm51c54,[deleted],t3_fsxqpm,11
1585765902.0,2020-04-01,wallstreetbets,fm53yst,[deleted],t3_fsxqpm,12
1585766700.0,2020-04-01,wallstreetbets,fm55hxx,"Id be lying if i said i didnt screenshot various bull comments here during their run to go back and rub it in there face when their time was up. Its not a proud life, but spite fuels me. Almost time baby",t3_fsxqpm,12
1585768117.0,2020-04-01,wallstreetbets,fm5872d,Which of you 🌈 bois are holding poots overnight?,t3_fsxqpm,13
1585768302.0,2020-04-01,wallstreetbets,fm58jq8,"folks! folks!  
THE PRINTER IS PRICED IN   
hahahahhahahahah",t3_fsxqpm,12
1585769197.0,2020-04-01,wallstreetbets,fm5a8o9,we are without condoms now boys. only way this stops is -20% or EOD.,t3_fsxqpm,11
1585769503.0,2020-04-01,wallstreetbets,fm5aty9,"Positive on my all time for the first time in a week, it's a good day",t3_fsxqpm,11
1585769673.0,2020-04-01,wallstreetbets,fm5b5kp,Today the bears untied the rope from the rafters and put the chair back in its place.,t3_fsxqpm,12
1585769726.0,2020-04-01,wallstreetbets,fm5b95v,Bulls trying to pump their way out of an oil spill 🩸🔥,t3_fsxqpm,12
1585770087.0,2020-04-01,wallstreetbets,fm5byaw,Account just went green again for the first time in a week. Diamond. Fucking. Hands.,t3_fsxqpm,12
1585770142.0,2020-04-01,wallstreetbets,fm5c25n,"I’m about to break even on my SPY Puts 😂 😢 

🖐🏽 💎 🖐🏽",t3_fsxqpm,12
1585771157.0,2020-04-01,wallstreetbets,fm5dzsi,the last 15-30 mins of the day is like nfl redzone,t3_fsxqpm,12
1585771240.0,2020-04-01,wallstreetbets,fm5e5di,Casino is closed. See you phaggots tomorrow,t3_fsxqpm,11
1585772472.0,2020-04-01,wallstreetbets,fm5gf7d,"I'm down exactly $1,200 this week. 

Uncle Donny making me square.",t3_fsxqpm,12
1585772588.0,2020-04-01,wallstreetbets,fm5gmwt,h shaped recovery,t3_fsxqpm,12
1585772976.0,2020-04-01,wallstreetbets,fm5hcy9,"Worst affected city by COVID-19 in Ecuador is Guayaquil.


It's 30 Celsius/86 Fahrenheit in Guayaquil right now.


Puts on summer.",t3_fsxqpm,12
1585773221.0,2020-04-01,wallstreetbets,fm5htcv,1st day with no fund rebalancing - and what do you know - blood red.,t3_fsxqpm,12
1585777526.0,2020-04-01,wallstreetbets,fm5pqks,This has got to be a cover for them to do something else. It makes no fucking sense.,t3_fsxqpm,13
1585777622.0,2020-04-01,wallstreetbets,fm5pwu6,"I got an e-mail a couple of days ago informing us that States have been given the directive to start organizing and preparing National Guard units to be sent to Community Food Banks to help with distribution and protect food supplies.

If this isn't cover for them to start mobilizing troops to start prepping states for when we start hitting the apex of our curve... idk wtf is",t3_fsxqpm,11
1585744512.0,2020-04-01,wallstreetbets,fm4243o,"“I believe that banking institutions are more dangerous to our liberties than standing armies” ""If the American people ever allow private banks to control the issue of their currency, first by inflation, then by deflation, the banks and corporations that will grow up around (these banks) will deprive the people of all property until their children wake up homeless on the continent their fathers conquered... The issuing power of currency shall be taken from the banks and restored to the people, to whom it properly belongs.” - Thomas Jefferson",t3_fsxqpm,24
1585745883.0,2020-04-01,wallstreetbets,fm43xrt,If anyone says brrrr again I'm turning this fucking car around,t3_fsxqpm,25
1585747952.0,2020-04-01,wallstreetbets,fm46wlj,"Today is for you Joe Exotic. 

Carol Baskin is a bitch. 

🌈🐻",t3_fsxqpm,26
1585748457.0,2020-04-01,wallstreetbets,fm47o8f,"All you retards, are you not capable of having a time horizon longer than 24 hours? Like have some fucking constitution and have a thesis and hold a position. This thing isnt going to drop 40 points in an hour, but it might in 2-6 weeks. Damnit",t3_fsxqpm,24
