created,date,subreddit,id,body,parent_id,score
1616005096.0,2021-03-17,wallstreetbets,gr9i5ro,"Did Powell really only say “Well actually we see positive things”

And then the market just skyrocketed? Lol this is all a simulation.",t3_m6wyk2,13
1616005308.0,2021-03-17,wallstreetbets,gr9in2m,Stimulus talks are going well.,t3_m6wyk2,12
1616006260.0,2021-03-17,wallstreetbets,gr9ksdg,"i think its hilarious u kids talking shit about JPow. u wouldnt say this shit to him at Jackson Hole, hes jacked. not only that but he wears the freshest clothes, eats at the chillest restaurants and hangs out with the hottest rates. yall are pathetic lol",t3_m6wyk2,14
1616006544.0,2021-03-17,wallstreetbets,gr9lfi8,DID HE SAY LIFT OFF?,t3_m6wyk2,13
1616006549.0,2021-03-17,wallstreetbets,gr9lfwh,UWMC chart looks purty.  Just went into 3/19 $9C and $10C so prob about to crash tho.,t3_m6wyk2,13
1616006883.0,2021-03-17,wallstreetbets,gr9m70i,"Pow literally said ""I don't give a shit about other's opinion in my team. WE SELL WHEN I SAY...HEY HEY... WE SELL WHEN I SAY""",t3_m6wyk2,12
1616006891.0,2021-03-17,wallstreetbets,gr9m7qp,Lift off  lol hes a wsb troll,t3_m6wyk2,12
1616007458.0,2021-03-17,wallstreetbets,gr9ni4k,Bulls in lambos except for GME gang lmao,t3_m6wyk2,12
1616007553.0,2021-03-17,wallstreetbets,gr9npy6,Just goes to show if you give the whitest man the blackest name he can literally move markets,t3_m6wyk2,12
1616007672.0,2021-03-17,wallstreetbets,gr9nzsl,JPOW showed up to this meeting with big green dildos and bears got gaped.,t3_m6wyk2,12
1616008307.0,2021-03-17,wallstreetbets,gr9pep2,"Bears screaming ""bulltrap!"" with tears in their eyes and JPOW's meaty hog in their butts.",t3_m6wyk2,12
1616008364.0,2021-03-17,wallstreetbets,gr9pj9y,"vAlUaTiOnS aRE tOo hIgH!!!

Bitch shit the fuck up and BUY",t3_m6wyk2,14
1616008935.0,2021-03-17,wallstreetbets,gr9qtdp,"aapl,  you have betrayed me once again. fuck you.",t3_m6wyk2,13
1616008989.0,2021-03-17,wallstreetbets,gr9qxm3,Can he just shut up before he accidently slips the real inflation rate or something,t3_m6wyk2,13
1616009234.0,2021-03-17,wallstreetbets,gr9rh8t,[deleted],t3_m6wyk2,12
1616009661.0,2021-03-17,wallstreetbets,gr9sfpt,JPow fucks like straight up. This guy fucks,t3_m6wyk2,12
1616009664.0,2021-03-17,wallstreetbets,gr9sfx3,all this PLTR still can't stay green. fucking piece of shit,t3_m6wyk2,15
1616009666.0,2021-03-17,wallstreetbets,gr9sg4l,# MICHAEL BURRY IN SHAMBLES,t3_m6wyk2,14
1616009871.0,2021-03-17,wallstreetbets,gr9swm3,"So for anyone too retarded to understand what JP just said, he basically said that bears are gay and stonks only go up.",t3_m6wyk2,13
1616009950.0,2021-03-17,wallstreetbets,gr9t2ub,I can’t believe Powell went on live air and physically fukd every 🌈🐻 in America at the same time. What a chad.,t3_m6wyk2,13
1616009961.0,2021-03-17,wallstreetbets,gr9t3pu,Lmao GME must die for the market to thrive,t3_m6wyk2,12
1616010166.0,2021-03-17,wallstreetbets,gr9tk65,What’s it called when you have the opposite of the Midas touch? Cause I definitely got that. Everything I touch turns to shit,t3_m6wyk2,13
1616010230.0,2021-03-17,wallstreetbets,gr9tpej,I’m liking this less volatile increase AMC has been having.,t3_m6wyk2,12
1616011256.0,2021-03-17,wallstreetbets,gr9w0el,"From down 10.8% to up 17.4% on the day.  Made me work for it with 38 trades on the day, but fun is fun.

&#x200B;

Now THIS is pod racing!",t3_m6wyk2,14
1616011830.0,2021-03-17,wallstreetbets,gr9x9yy,Ok AMC EOD/AH,t3_m6wyk2,13
1616013744.0,2021-03-17,wallstreetbets,gra1in4,Thoughts on tomorrow? Will the party continue on?,t3_m6wyk2,13
1615977093.0,2021-03-17,wallstreetbets,gr81oqe,#NEVER IN MY LIFE HAVE I GOTTEN UP AT 5AM EVERYDAY NO MATTER WHAT AND BEEN EXCITED. GME FOREVER 🚀,t3_m6wyk2,100
1615975492.0,2021-03-17,wallstreetbets,gr802zl,God I want a new Tesla roadster,t3_m6wyk2,11
1615979860.0,2021-03-17,wallstreetbets,gr84q3v,"Friendship with $TSLA over

$ROPE is my new friend",t3_m6wyk2,12
1615979889.0,2021-03-17,wallstreetbets,gr84rcs,Everything red premarket besides Coca-cola...fuck you buffett,t3_m6wyk2,12
1615980321.0,2021-03-17,wallstreetbets,gr85a6w,damn I just should’ve just not woken up again.,t3_m6wyk2,12
1615981088.0,2021-03-17,wallstreetbets,gr868pr,10 year dildo raping tech bulls,t3_m6wyk2,12
1615981169.0,2021-03-17,wallstreetbets,gr86ck5,"All the tik tok robinhood investors lost their stimmy check before the market even opened 

RIP",t3_m6wyk2,11
1615981173.0,2021-03-17,wallstreetbets,gr86cr2,"Of course when you are a bull for the week, the market first moves sideways, then it’s all fucking red, I hate this market!  It should be illegal to have this “pre-market” or “after-hours” shit, that’s how these motherfuckers cheat",t3_m6wyk2,13
1615982136.0,2021-03-17,wallstreetbets,gr87mq5,Who else bought PLTR calls yesterday? 🤡,t3_m6wyk2,11
1615982366.0,2021-03-17,wallstreetbets,gr87xx8,Who else makes their first trade of the day from a porcelain cruise?,t3_m6wyk2,12
1615982382.0,2021-03-17,wallstreetbets,gr87ypa,Big boys can’t wait for everyone to panic sell so they get a nice discount over basically nothing,t3_m6wyk2,12
1615982946.0,2021-03-17,wallstreetbets,gr88qth,Pls don't tell me that I'm the only one who got seriously fucked by $PLUG over the last 2 months lol,t3_m6wyk2,12
1615983105.0,2021-03-17,wallstreetbets,gr88z3h,I appreciate how much cnbc cares about how stupid I may be,t3_m6wyk2,12
1615986146.0,2021-03-17,wallstreetbets,gr8dqyf,This game was more fun last year :(,t3_m6wyk2,14
1615987549.0,2021-03-17,wallstreetbets,gr8g820,NOK and bb aren’t memestocks when memestocks are mooning but are memestocks when memestocks are tanking. The infamous double donged dildo pattern🤔,t3_m6wyk2,11
1615988092.0,2021-03-17,wallstreetbets,gr8h81z,AMC 🚀,t3_m6wyk2,11
1615988331.0,2021-03-17,wallstreetbets,gr8hnyc,TSLA 700c 3/19,t3_m6wyk2,12
1615989468.0,2021-03-17,wallstreetbets,gr8juos,"Four loko ads be like: drink responsibly 

Like I’m just gonna stay in tonight, read a book and have a nice glass of 4loko",t3_m6wyk2,12
1615989510.0,2021-03-17,wallstreetbets,gr8jxpx,Bulls are fucking crack addicts for stimulus and your boy Jerome is a shameless enabler,t3_m6wyk2,12
1615990151.0,2021-03-17,wallstreetbets,gr8l6q7,Does anyone have a tourniquet for my calls,t3_m6wyk2,13
1615990164.0,2021-03-17,wallstreetbets,gr8l7n1,And that’s a smooth 5% off my portfolio this morning,t3_m6wyk2,12
1615990875.0,2021-03-17,wallstreetbets,gr8mmzw,i love how people in here think that hedge funds and investors know were in a bubble and are gonna sell because of what JPOW says. those motherfuckers nearly blew up the world economy in 2008. they’re gonna do the exact same thing and are going to keep inflating the bubble by taking on as much risk as possible until the US economy has one foot in the grave and another on a banana peel,t3_m6wyk2,11
1615991425.0,2021-03-17,wallstreetbets,gr8nrix,Guys do not buy Zillow. I bought a Jan leap on it and it won't go back up until next year or until i sell for a loss.,t3_m6wyk2,12
1615991805.0,2021-03-17,wallstreetbets,gr8oj7r,Can jpow speak at like 7am next time so we don’t have to wait hours to find out if we should or shouldn’t have bought this damn dip,t3_m6wyk2,12
1615992143.0,2021-03-17,wallstreetbets,gr8p8ai,"I’m trying to decide between buying at the 10:30am dip, 11:30am dip, or 1pm drill down",t3_m6wyk2,13
1615992572.0,2021-03-17,wallstreetbets,gr8q4hn,Cash gang is dancing in the streets rn,t3_m6wyk2,13
1615992784.0,2021-03-17,wallstreetbets,gr8qknj,Got my tax refund today but no stimmy. Wack,t3_m6wyk2,12
1615993120.0,2021-03-17,wallstreetbets,gr8ra43,Man all those articles about all the money retail is about to plow into markets with their stimmys really makes me think MMs going to dump the markets after we all buy in,t3_m6wyk2,11
1615994574.0,2021-03-17,wallstreetbets,gr8udfo,"Stimmy comes in, market goes down, can’t explain that!",t3_m6wyk2,11
1615994590.0,2021-03-17,wallstreetbets,gr8uenw,"I will not catch a falling knife again , i will not catch a falling knife again",t3_m6wyk2,13
1615995449.0,2021-03-17,wallstreetbets,gr8wbaj,JPow has no power in the robux economy,t3_m6wyk2,14
1615995793.0,2021-03-17,wallstreetbets,gr8x2xn,User JPOWW has abandoned the market. Please find your nearest exit.,t3_m6wyk2,12
1615995830.0,2021-03-17,wallstreetbets,gr8x5v2,[deleted],t3_m6wyk2,12
1615996133.0,2021-03-17,wallstreetbets,gr8xufg,"Hey guys, did you know the fed meeting was always going to be a two day event?",t3_m6wyk2,11
1615996497.0,2021-03-17,wallstreetbets,gr8ynwu,[deleted],t3_m6wyk2,13
1615996627.0,2021-03-17,wallstreetbets,gr8yygd,"Jpow speech:

“The economy is fucked and people won’t have jobs until at least 2023, so we’re not gonna raise rates and just keep printing money but inflation doesn’t real so don’t worry about it P.S buy more stocks at ATH”

There, I gave you insider knowledge. Now you don’t have to wait until 2:00 to make your decision",t3_m6wyk2,13
1615996729.0,2021-03-17,wallstreetbets,gr8z6oj,"There was a company that DFV had written on one of his lists for companies to look into. I can't mention it here because it's too low cap. But they make security stuff, are a household name and have a share price under a dollar.

They're slowly climbing.

I didn't look into 'em too bigly but they seem to have a low float and I feel like the name alone is worth more than they're currently trading for.

Edit: If you just sprayed someone in the eyes with pepper spray... 'You ___ed someone.'

I ain't saying it's going anywhere and if my understanding of their financials is anywhere near correct, their annual revenue is about half of their market cap (I seriously am not good at reading financials yet, I'm trying. So I *really* can't stress that enough, ok?) but.. y'know.. have a look.",t3_m6wyk2,13
1615997116.0,2021-03-17,wallstreetbets,gr902bb,"TSLA if I wanted my balls stomped on, I could’ve just asked my wife’s boyfriend to do it for free",t3_m6wyk2,11
1615997354.0,2021-03-17,wallstreetbets,gr90lw3,"*Not financial advice*

JPOW isn't under the same pressure to pump the market as he was during the Trump administration. I'm betting on markets dipping after he speaks. 

I bought puts in preparation for his speech. 

Disclaimer: I am a complete retard so take this with a grain of salt.

Edit: fuck",t3_m6wyk2,13
1615998503.0,2021-03-17,wallstreetbets,gr937fs,"Alright, who lost their $1400 stimmy on FDs already?",t3_m6wyk2,13
1615998647.0,2021-03-17,wallstreetbets,gr93j7i,STIMMY ALL INTO PLTR,t3_m6wyk2,12
1615999263.0,2021-03-17,wallstreetbets,gr94x77,My account not being green on St. Paddy’s Day seems wrong. Get it together JPOW,t3_m6wyk2,12
1615999714.0,2021-03-17,wallstreetbets,gr95xz7,If Apple doesn’t break 140 in the next 2 weeks I will destroy the iPhone I’m writing this on,t3_m6wyk2,11
1616000183.0,2021-03-17,wallstreetbets,gr9709t,Yolod into SPY $400 calls,t3_m6wyk2,12
1616000676.0,2021-03-17,wallstreetbets,gr98488,What time Jpow coming on to fuck my ass?,t3_m6wyk2,12
1616001270.0,2021-03-17,wallstreetbets,gr99g52,"Boy am I fucking glad I bought VW shares yesterday...but we don't discuss shares in this sub, so...",t3_m6wyk2,12
1616001302.0,2021-03-17,wallstreetbets,gr99ilw,[deleted],t3_m6wyk2,12
1616001892.0,2021-03-17,wallstreetbets,gr9aud3,This is truly a meme market,t3_m6wyk2,13
1616002099.0,2021-03-17,wallstreetbets,gr9bbh3,Legit took a xanax for this pow speech lol,t3_m6wyk2,12
1616003777.0,2021-03-17,wallstreetbets,gr9f4u5,My UWMC 3/19 9c printing rn,t3_m6wyk2,12
1616004277.0,2021-03-17,wallstreetbets,gr9ga3k,#RECESSION #CANCELLED,t3_m6wyk2,12
1616005212.0,2021-03-17,wallstreetbets,gr9if6v,So I got until 2023 to get rich,t3_m6wyk2,12
1616005218.0,2021-03-17,wallstreetbets,gr9ifoe,"For the maximum bear r fuk experience: 

[https://brrr.money/](https://brrr.money/)",t3_m6wyk2,13
1616005253.0,2021-03-17,wallstreetbets,gr9iiko,"As much as I'm crazy bullish, I want to warn everyone that this exact same thing happened last time he spoke. We got a large short burst rally beforehand and then the market shit its pants at the mere sight of Jpow.",t3_m6wyk2,12
1616005364.0,2021-03-17,wallstreetbets,gr9irlb,The lifespan on that run was like 10 minutes...,t3_m6wyk2,13
1616005452.0,2021-03-17,wallstreetbets,gr9iyp9,"So basically I got until 2023 to get rich, thanks jerome",t3_m6wyk2,12
1616005469.0,2021-03-17,wallstreetbets,gr9izzp,Reminder that bears have the mentality of betting against others because they are too scared of betting on themselves. And that is what makes them truly 🌈,t3_m6wyk2,12
1616005727.0,2021-03-17,wallstreetbets,gr9jldy,JPOW is gonna go on tv with a full blown boner. Bullish,t3_m6wyk2,11
1616006105.0,2021-03-17,wallstreetbets,gr9kfzv,get JPOW some water damn y'all,t3_m6wyk2,13
1616006128.0,2021-03-17,wallstreetbets,gr9kht1,Jpow coughs market tanks,t3_m6wyk2,12
1616006536.0,2021-03-17,wallstreetbets,gr9leu5,# “LIFT-OFF” - JPOW,t3_m6wyk2,11
1616006569.0,2021-03-17,wallstreetbets,gr9lhib,HE JUST SAID LIFTOFF HOLY FUCK,t3_m6wyk2,11
1616006885.0,2021-03-17,wallstreetbets,gr9m781,"HE SAID IT AGAIN

**LIFT OFF** 🚀🚀🚀🚀🚀🚀🚀🚀",t3_m6wyk2,12
1616007007.0,2021-03-17,wallstreetbets,gr9mh57,Yo flipping my +30% weekly puts this morning and buying weekly and month out calls was like the best fucking move I've made in years,t3_m6wyk2,13
1616007145.0,2021-03-17,wallstreetbets,gr9msf8,Bull market confirmed for the next three years. Why keep your money in a bank with low interest rates when you can by stocks and get an average rate of return of 10% per year,t3_m6wyk2,11
1616007576.0,2021-03-17,wallstreetbets,gr9nru4,Damn. Who is this girl? I would use my full range of tools on her,t3_m6wyk2,14
1616008632.0,2021-03-17,wallstreetbets,gr9q4xv,"""Stonks only go up."" -JPow",t3_m6wyk2,11
1615978142.0,2021-03-17,wallstreetbets,gr82sce,Yeah Science !,t1_gr82pje,28
1615978290.0,2021-03-17,wallstreetbets,gr82y3d,"A 5 day stock trading competition?

Honestly if you just didn't do anything you'd probably be in the top 10% of the contestants.",t1_gr82r0g,384
1615978159.0,2021-03-17,wallstreetbets,gr82sz3,Yolo it all on a spy 400C expiring Friday. Show your class just how retarded you are,t1_gr82r0g,150
1615978466.0,2021-03-17,wallstreetbets,gr8351o,This is cool. My school made me eat rice on the gym floor for a day to understand what it’s like to be poor somewhere in Africa. Your school is doing much better.,t1_gr82r0g,79
1615987035.0,2021-03-17,wallstreetbets,gr8fafy,"And for that reason, I’m out",t1_gr8f0t8,20
1615987060.0,2021-03-17,wallstreetbets,gr8fc3n,That is some profound shit right there. Geezus,t1_gr8f0t8,14
1615978708.0,2021-03-17,wallstreetbets,gr83eje,You mean you didn’t learn everything about finance here?,t1_gr839sr,21
1615975859.0,2021-03-17,wallstreetbets,gr80g2f,"Fuck it, I'm in.",t1_gr80bou,109
1615975625.0,2021-03-17,wallstreetbets,gr807qp,Blood,t1_gr800nm,42
1615975878.0,2021-03-17,wallstreetbets,gr80gqn,Thanks a bunch.,t1_gr80c4q,54
1615975920.0,2021-03-17,wallstreetbets,gr80i7s,Ape go to moon!,t1_gr801lv,58
1615976587.0,2021-03-17,wallstreetbets,gr81690,Tell him he is a retard after you are rich from clicking buttons on your phone,t1_gr811c8,40
1615975450.0,2021-03-17,wallstreetbets,gr801iu,It’s all coming together,t1_gr7zxgb,58
1616011933.0,2021-03-17,wallstreetbets,gr9xi0d,Gotta love the consistency as a trader.,t1_gr9xecb,15
1615975859.0,2021-03-17,wallstreetbets,gr80g1y,"GME is going to hit $500 today, $5000 EOW!!!!

Is that better?",t1_gr80acj,89
1615975814.0,2021-03-17,wallstreetbets,gr80eh0,"Give me a G 

Give me a M

Give me a E",t1_gr80acj,69
1616005454.0,2021-03-17,wallstreetbets,gr9iytl,"You still gay tho, luv u",t1_gr9iu3y,26
1616005531.0,2021-03-17,wallstreetbets,gr9j541,"u/zjz tell it like it is, bro. Keep up the good work.",t1_gr9iu3y,19
1616005552.0,2021-03-17,wallstreetbets,gr9j6ve,Cannot stand papernoy,t1_gr9iu3y,18
1616006119.0,2021-03-17,wallstreetbets,gr9kh3r,#THE PEOPLES MOD,t1_gr9iu3y,17
1616005650.0,2021-03-17,wallstreetbets,gr9jf39,I like the way people used mark cuban's appearance as a sign that they should go all-in in GME...,t1_gr9iu3y,14
1616005820.0,2021-03-17,wallstreetbets,gr9jswd,"Thank you.


Tried to watch the garbage hulu doc that's been spammed everywhere last night...disgusting misrepresentations of everything.


Right the wrongs and speak truth to power.",t1_gr9iu3y,13
1616005562.0,2021-03-17,wallstreetbets,gr9j7qm,can you post this as a stickied thread on the front page of WSB?,t1_gr9iu3y,13
1615979167.0,2021-03-17,wallstreetbets,gr83x8a,That’s one responsible mofo!,t1_gr83vma,51
1616010288.0,2021-03-17,wallstreetbets,gr9tu2z,Careful what you wish for,t1_gr9tr6f,19
1615979908.0,2021-03-17,wallstreetbets,gr84s4l,"Sometimes you have to make adult decisions, even if it's not fun. Proud of you.",t1_gr84lmh,54
1615996496.0,2021-03-17,wallstreetbets,gr8ynto,"Nonsense, you are rich in debt",t1_gr8ykyo,20
1616000241.0,2021-03-17,wallstreetbets,gr974yd,DKNG = Donkey Kong.,t1_gr97050,12
1615975866.0,2021-03-17,wallstreetbets,gr80gas,Then roll you a cigar between them afterwards.,t1_gr80f1i,16
1615981674.0,2021-03-17,wallstreetbets,gr870iv,"In my senior year my Social Studies teacher did a stock competition most of the school year between all his classes. The winner got a 100 on their final paper.

This was the year netflix went from like $35 to $140, (2010-2011) some kid invested all of his money into it and just destroyed all of us.

Edit: Looks like it was $20 to $40 but still...",t1_gr82y3d,98
1615983678.0,2021-03-17,wallstreetbets,gr89t9h,"That's one of the most retarded things I've ever read, and I can't read.",t1_gr8351o,24
1615975900.0,2021-03-17,wallstreetbets,gr80hhc,Keep going,t1_gr80g1y,43
1616005802.0,2021-03-17,wallstreetbets,gr9jrde,He has one of the most punchable faces I’ve ever seen,t1_gr9j6ve,16
1616005562.0,2021-03-17,wallstreetbets,gr9j7rh,"Eat my dongus you fuckin nerd.

*I am a bot, and this action was performed automatically. Please [contact the moderators of this subreddit](/message/compose/?to=/r/wallstreetbets) if you have any questions or concerns.*",t1_gr9j7qm,20
1615983855.0,2021-03-17,wallstreetbets,gr8a2s6,"We did one in high school too. Among other things,  I bought like 100,000 shares of a penny stock for a beverage company that makes crazy Thanksgiving flavors. It moved up by a few cents and I made a bunch of fake money.",t1_gr870iv,32
1615984052.0,2021-03-17,wallstreetbets,gr8adhy,"Damn, you must've bought so much fake cocaine. Good for you.",t1_gr8a2s6,42
