created,date,subreddit,id,body,parent_id,score
1616010992.0,2021-03-17,wallstreetbets,gr9vex9,"Holy shit, on this company wide call yesterday, the CEO and CTO both called me out in front of everyone to acknowledge the hard work and dedication I've brought to the team the past couple months.


In reality, I've literally been phoning it in since Feb and just browsing WallstreetBets and doing DD on random companies. My portfolio has also increased from the new strategy as well.",t3_m6wyk2,17
1615975654.0,2021-03-17,wallstreetbets,gr808rv,Stimmy has been loaded,t3_m6wyk2,16
1615976374.0,2021-03-17,wallstreetbets,gr80yp6,Will the real Stim Shady please stand up,t3_m6wyk2,15
1615978018.0,2021-03-17,wallstreetbets,gr82njs,Alcoholic beverage stocks prolly gonna launch if we crash 😆🤣😆,t3_m6wyk2,16
1615979544.0,2021-03-17,wallstreetbets,gr84cmv,My stimmy is already gone,t3_m6wyk2,17
1615983202.0,2021-03-17,wallstreetbets,gr89493,"Imagine being an investor with a 60/40 portfolio and watching both your stocks and bonds collapse simultaneously

""But the book said they would hedge derp""",t3_m6wyk2,15
1615985030.0,2021-03-17,wallstreetbets,gr8bwnv,Aqua Teen Hunger Force is a timeless masterpiece,t3_m6wyk2,16
1615985543.0,2021-03-17,wallstreetbets,gr8cqp5,Market has to be green on st Patrick’s day by law,t3_m6wyk2,15
1615986464.0,2021-03-17,wallstreetbets,gr8eact,What y'all worried about?  Do you not remember JPOW speaking two weeks ago?  Market gonna go down for fear of bad news and then rocket up after JPOW says he still doesnt know what inflation is or how it works,t3_m6wyk2,15
1615986543.0,2021-03-17,wallstreetbets,gr8ef7i,"If I just don't go to my portfolio, I won't realize my losses. Thats what they mean by realized vs unrealized right?",t3_m6wyk2,17
1615991853.0,2021-03-17,wallstreetbets,gr8omq1,Really hoping JPow dusts off one of his greatest hits from April 2020,t3_m6wyk2,15
1615992458.0,2021-03-17,wallstreetbets,gr8pvu4,Losing money is the new making money.,t3_m6wyk2,17
1615993221.0,2021-03-17,wallstreetbets,gr8rhri,"If anyone ever wants to know when a stock is at the top, just let me know and I'll buy some shares. Then it'll plummet and you'll know that the stock was peaked",t3_m6wyk2,15
1615993224.0,2021-03-17,wallstreetbets,gr8rhxi,Oil down 4 days in a row but my fucking gas prices going up every day.,t3_m6wyk2,17
1615993389.0,2021-03-17,wallstreetbets,gr8rue7,Down 60k but luckily I got that stimmy today so I'm only down 58.6k :),t3_m6wyk2,16
1615993587.0,2021-03-17,wallstreetbets,gr8s9bf,"“Oh my god will JPOW say something bad for the markets” 

Jerome, for like the 8th time this year: “I will sell my children to keep on printin’”",t3_m6wyk2,15
1615995899.0,2021-03-17,wallstreetbets,gr8xbfr,I’m faking a sick day Friday and taking an edible and jerking off all day I can’t wait,t3_m6wyk2,16
1615996755.0,2021-03-17,wallstreetbets,gr8z8v8,Prepare for a dip the millisecond carbon dioxide molecules are released from JPow’s mouth on national television today.,t3_m6wyk2,16
1615998979.0,2021-03-17,wallstreetbets,gr94a3i,"JPOW speech days and SPY puts, name a more iconic duo 🤑",t3_m6wyk2,16
1616002905.0,2021-03-17,wallstreetbets,gr9d5i7,"Volkswagen Group sold 400k EVs last year. They will introduce about 10 EVs this year. They are converting multiple factories to EV only.  

Last month NIO was valued higher than Volkswagen.",t3_m6wyk2,17
1616003437.0,2021-03-17,wallstreetbets,gr9ed33,Let’s get UWMC at least past 13$ before 3/19 calls end. 💪🏼💪🏼💪🏼💪🏼,t3_m6wyk2,15
1616004901.0,2021-03-17,wallstreetbets,gr9hq0a,#LET IT BE KNOWN THAT ON MARCH 17 ST. POWELL DROVE THE 🌈🐻 OUT OF WALL STREET,t3_m6wyk2,16
1616005078.0,2021-03-17,wallstreetbets,gr9i4ca,The fuck just happened? I was about to go poor now all of a sudden I'm the richest man in the county...,t3_m6wyk2,17
1616005337.0,2021-03-17,wallstreetbets,gr9ipe0,"St Patricks day green is no joke.

&#x200B;

You know what to do next year on 3/17, bears biatches",t3_m6wyk2,17
1616006120.0,2021-03-17,wallstreetbets,gr9kh5w,"I had dream Jpow went on stage, says ""BRRRR"" and then leaves

SPY to $420 EOW",t3_m6wyk2,17
1616006987.0,2021-03-17,wallstreetbets,gr9mfis,Fun fact: if you bought puts on SPY in 1895 you would be dead by now,t3_m6wyk2,15
1616007638.0,2021-03-17,wallstreetbets,gr9nwx7,"Welp, my SPY Puts are 90% down. I hate being a 🐻🌈",t3_m6wyk2,17
1616008240.0,2021-03-17,wallstreetbets,gr9p9c1,"For 12 months every time JPOW opened his mouth the markets tanked. So naturally, the one time I buy puts the markets decide to come roaring back to life. 



Honestly my time trading just feels like an elaborate Truman Show type practical joke where the goal is to ensure that literally every trading decision I make is the wrong one.",t3_m6wyk2,17
1616008243.0,2021-03-17,wallstreetbets,gr9p9je,"Fuck your puts 

- Jerome Powell",t3_m6wyk2,17
1616008274.0,2021-03-17,wallstreetbets,gr9pc0u,Yo bears are those puts printing?,t3_m6wyk2,15
1616008793.0,2021-03-17,wallstreetbets,gr9qhyb,"WRAP IT UP JPOW, these reporters are trying to hard to fuck up your message",t3_m6wyk2,17
1616008886.0,2021-03-17,wallstreetbets,gr9qpiq,AAPL you always find a way to let me down,t3_m6wyk2,16
1616009177.0,2021-03-17,wallstreetbets,gr9rcoj,Lol who’s still red just not that red,t3_m6wyk2,14
1616009251.0,2021-03-17,wallstreetbets,gr9rimq,Rolls Royce posting a 5 billion loss but up 3%. Just stock market things,t3_m6wyk2,16
1616009722.0,2021-03-17,wallstreetbets,gr9skmm,THE SECOND BULL RUN HAS BEGAN,t3_m6wyk2,16
1616010302.0,2021-03-17,wallstreetbets,gr9tv7p,Anybody else think Nasdaq jumps tomorrow?,t3_m6wyk2,17
1616011255.0,2021-03-17,wallstreetbets,gr9w0dl,Im about to buy my first option and im 100%sure im going bankrupt in the next few weeks,t3_m6wyk2,17
1616011414.0,2021-03-17,wallstreetbets,gr9wd6l,Your free trial of Wallstreetbets has expired. Would you like to renew?,t3_m6wyk2,14
1615977719.0,2021-03-17,wallstreetbets,gr82c6p,"Holding GME, same as always",t3_m6wyk2,70
1615975276.0,2021-03-17,wallstreetbets,gr7zv6t,Good morning y’all retards!,t3_m6wyk2,14
1615975405.0,2021-03-17,wallstreetbets,gr7zztj,stimmy hitttttt,t3_m6wyk2,14
1615976435.0,2021-03-17,wallstreetbets,gr810zj,The guy who yesterday bought plug puts accidentally. What a lucky bastard. 🤌🏻,t3_m6wyk2,15
1615977279.0,2021-03-17,wallstreetbets,gr81vqy,anyone else not get their stimulus yet,t3_m6wyk2,15
1615978606.0,2021-03-17,wallstreetbets,gr83ai7,As for me I like the cock... I mean stock,t3_m6wyk2,14
1615979849.0,2021-03-17,wallstreetbets,gr84pll,Good morning everyone. I hope you have a great day,t3_m6wyk2,15
1615981359.0,2021-03-17,wallstreetbets,gr86lfs,Boobs,t3_m6wyk2,16
1615982458.0,2021-03-17,wallstreetbets,gr882hn,"Time to play catch the falling knife with the face, my favorite game",t3_m6wyk2,17
1615982479.0,2021-03-17,wallstreetbets,gr883lf,"*Stimmy hits the bank account*

Where we dropping boys?",t3_m6wyk2,15
1615984191.0,2021-03-17,wallstreetbets,gr8akz3,Every time I start to get ahead I get slapped right back down,t3_m6wyk2,17
1615984441.0,2021-03-17,wallstreetbets,gr8az24,"The market keeps fucking me, but I also keep coming back. 

Am I gay? 🤔🤨",t3_m6wyk2,15
1615986977.0,2021-03-17,wallstreetbets,gr8f6pa,OPEN THE GOD DAMNED HELL GATE,t3_m6wyk2,15
1615987224.0,2021-03-17,wallstreetbets,gr8fmr1,"I can tell a lot of you are nervous about your calls, but remember you were going to fail at anything else you would have done anyway",t3_m6wyk2,16
1615987546.0,2021-03-17,wallstreetbets,gr8g7ve,"Daily reminder the stock market is not a team sport, also the stock market is a great way to hide a gambling addiction from loved ones.",t3_m6wyk2,16
1615991296.0,2021-03-17,wallstreetbets,gr8ni2d,"Pro tip on $PLUG:

accounting fraud is never a buying opportunity for a stock.  However, since it dragged the entire green energy sector down with it, look to those for buys.  $BE, $BLNK, $RUN",t3_m6wyk2,15
1615992573.0,2021-03-17,wallstreetbets,gr8q4mr,"Where's my stimulus gone, I just had it this morning? 🤔🤔",t3_m6wyk2,14
1615992683.0,2021-03-17,wallstreetbets,gr8qczk,If you think about it this tanking market makes sense. During the peak of lockdown and covid markets soared. Makes sense that opening up would make it shit the bed.,t3_m6wyk2,16
1615996823.0,2021-03-17,wallstreetbets,gr8zek3,I bought ICLN cause I believe in clean energy and in losing money every single day.,t3_m6wyk2,15
1615997101.0,2021-03-17,wallstreetbets,gr90129,RIP JPOW.  You were taken from us too soon and you will be sorely missed.,t3_m6wyk2,15
1615998457.0,2021-03-17,wallstreetbets,gr933m7,"Fuckers in school telling me, always in the barber shop  
""JPow ain't 'bout this, JPow ain't 'bout that""  
My boy a BD on fucking Lamron and them  
He, he, they say that brotha don't be putting in no work  
Shut the fuck up, y'all brothas ain't know shit  
All y'all motherfuckers talkin' about  
""JPow ain't no hitter, JPow ain't this, JPow a fake""  
Shut the fuck up, y'all don't live with that brotha  
Y'all know that brotha got caught with a ratchet  
Shootin' at the police and shit  
Brotha been on probation since fuckin' I don't know when  
Motherfucker, stop fuckin' playin' him like that  
Them brothas savages out there  
If I catch another motherfucker talking sweet about JPow  
I'm fucking beatin' they ass, I'm not fucking playin' no more",t3_m6wyk2,16
1615999010.0,2021-03-17,wallstreetbets,gr94ckt,"Selling my dumpster fire ICLN calls at open never felt so good.

0 to 700 percent gain to 5 percent loss in four months. Accepting Patreon subscribers now 🤡",t3_m6wyk2,14
1615999056.0,2021-03-17,wallstreetbets,gr94gc3,We’re so far into this work from home shit that I’ve devolved to watching ancient aliens. They’re arguing the movie “cowboys vs aliens” has a basis in historical facts.,t3_m6wyk2,15
1615999216.0,2021-03-17,wallstreetbets,gr94tgt,Everyone calm down. Jpow is looking at the printer user manual. He’ll get it going soon.,t3_m6wyk2,16
1615999216.0,2021-03-17,wallstreetbets,gr94thd,"The IRS giveth and AAPL, AMD, and ARKK take away.",t3_m6wyk2,16
1616000234.0,2021-03-17,wallstreetbets,gr974ek,"So there I was eating breakfast with RKT, all I did was ask how it was feeling and it started laughing and crying at the same time. Got awkward but it eventually calmed down and now we’re just sitting here quietly",t3_m6wyk2,16
1616000669.0,2021-03-17,wallstreetbets,gr983m2,If I spent as much time learning a skill as I do staring at a chart everyday Id still be poor but more skillful,t3_m6wyk2,14
1616002407.0,2021-03-17,wallstreetbets,gr9c0uw,I can’t wait for someone to invent nanobots that are basically little roombas for my ass,t3_m6wyk2,16
1616003377.0,2021-03-17,wallstreetbets,gr9e83r,Uwmc please save my 3/19 calls,t3_m6wyk2,15
1616003442.0,2021-03-17,wallstreetbets,gr9edie,NOBODY puts UWMC in the corner!!!,t3_m6wyk2,14
1616003749.0,2021-03-17,wallstreetbets,gr9f2lm,"UWMC SAYS FUK JPOW
🚀🚀🚀🚀",t3_m6wyk2,15
1616005074.0,2021-03-17,wallstreetbets,gr9i40n,Proud of my username.,t3_m6wyk2,14
1616005111.0,2021-03-17,wallstreetbets,gr9i6zx,If your portfolio didn’t have a green dildo then you might as well just sell now. If jpow can’t help you no one can,t3_m6wyk2,15
1616005715.0,2021-03-17,wallstreetbets,gr9jkf0,Powell confirmed to be an ass man. He likes a big fat yield curve,t3_m6wyk2,16
1616005861.0,2021-03-17,wallstreetbets,gr9jwbi,why is it drilling. hes just thanking healthcare workers lmfao,t3_m6wyk2,15
1616006069.0,2021-03-17,wallstreetbets,gr9kd36,Powell clearing his throat clears my portfolio,t3_m6wyk2,15
1616006531.0,2021-03-17,wallstreetbets,gr9leg7,JPOW SAID LIFTOFF. LETS GO,t3_m6wyk2,15
1616006629.0,2021-03-17,wallstreetbets,gr9lmd5,UWMC 🚀🚀🚀🚀🚀,t3_m6wyk2,15
1616006845.0,2021-03-17,wallstreetbets,gr9m3x2,HE SAID LIFTOFF AGAIN WHAT A FUCKING CHAD,t3_m6wyk2,16
1616008478.0,2021-03-17,wallstreetbets,gr9psax,"SPY open $400, GOEV open $17",t3_m6wyk2,15
1616008537.0,2021-03-17,wallstreetbets,gr9px5o,Tomorrow is going to be the greenest best trading day ever,t3_m6wyk2,15
1616009142.0,2021-03-17,wallstreetbets,gr9ra07,Good job Jerome. You can shut the fuck up now.,t3_m6wyk2,16
1616009412.0,2021-03-17,wallstreetbets,gr9rvpg,From all red to all green. It’s a saint patty’s day miracle🍀🍀🍀🍀,t3_m6wyk2,16
1616010134.0,2021-03-17,wallstreetbets,gr9thod,Apes starting to treat Cohen tweets like Q drops lmao,t3_m6wyk2,15
1615976059.0,2021-03-17,wallstreetbets,gr80n7j,wow all my stonks r fuk,t3_m6wyk2,47
1615975967.0,2021-03-17,wallstreetbets,gr80jvx,alex karp said buy GME,t3_m6wyk2,15
1615978696.0,2021-03-17,wallstreetbets,gr83e2e,Did everyone get their stimmies?,t3_m6wyk2,15
1615979160.0,2021-03-17,wallstreetbets,gr83wy3,S T I M M Y  B O Y Z,t3_m6wyk2,14
1615979463.0,2021-03-17,wallstreetbets,gr849dt,Cash gang winning today,t3_m6wyk2,14
1615979781.0,2021-03-17,wallstreetbets,gr84mny,PLUG deadass down 30% in 24 hours bruh,t3_m6wyk2,14
1615979909.0,2021-03-17,wallstreetbets,gr84s7h,"Wanna learn how to turn your 1400 into 700, apparently just throw that shit into literally any stock",t3_m6wyk2,15
1615980772.0,2021-03-17,wallstreetbets,gr85ue5,"When the market goes down, GME and AMC go up, good day to buy.",t3_m6wyk2,14
1615981330.0,2021-03-17,wallstreetbets,gr86k13,PLTR the kinda stonk where you wake up to see it up 40% the day after you sold your calls. That’s why I’ll never sell,t3_m6wyk2,15
1615981732.0,2021-03-17,wallstreetbets,gr8737i,Oh fuck GME is straight up,t3_m6wyk2,13
1615982522.0,2021-03-17,wallstreetbets,gr885o9,Seems like this will be a day to remember.,t3_m6wyk2,15
1615983205.0,2021-03-17,wallstreetbets,gr894ea,"Wow if plug didn’t already hurt me yesterday, it has to rip my face off today",t3_m6wyk2,14
1615984503.0,2021-03-17,wallstreetbets,gr8b2hb,How do I unlock the st Patrick’s day theme on Robinhood?  Everything is red instead of green.,t3_m6wyk2,15
1615984868.0,2021-03-17,wallstreetbets,gr8bn9d,So there’s gonna be a sell off every time J Pow is about to speak? Let me keep that on my calendar so I can remind myself to sell before the dweebs do.,t3_m6wyk2,15
1615985122.0,2021-03-17,wallstreetbets,gr8c21g,Jim Cramer writes personal checks to pay for his groceries.,t3_m6wyk2,15
1615985315.0,2021-03-17,wallstreetbets,gr8cd62,The only safety from 1.7% 10 year is gme. Apparently.,t3_m6wyk2,14
1615985919.0,2021-03-17,wallstreetbets,gr8dd09,Some water splashed on my ass cheeks when I was taking a shit. Could be a possible sign,t3_m6wyk2,14
1615987261.0,2021-03-17,wallstreetbets,gr8fp89,got the stim check and already lost all on PLTR,t3_m6wyk2,15
1615988240.0,2021-03-17,wallstreetbets,gr8hhww,"If you give me 10k. I’ll easily turn it into 12k, make you feel pumped, then watch it turn into 2k",t3_m6wyk2,14
1615990789.0,2021-03-17,wallstreetbets,gr8mgq0,"My investing strategy should probably be the Costanza method, wherein I do the opposite of what my gut tells me.",t3_m6wyk2,15
1615992476.0,2021-03-17,wallstreetbets,gr8px7h,Joe please fuck a solar panel or something I can't do this anymore,t3_m6wyk2,14
1615996127.0,2021-03-17,wallstreetbets,gr8xtwx,Officially a Palantard today,t3_m6wyk2,13
1615996466.0,2021-03-17,wallstreetbets,gr8ylfb,Lol DIS popping cause Disneyland,t3_m6wyk2,13
1615997150.0,2021-03-17,wallstreetbets,gr9050t,"the worst part about zoloft dick isnt that i cant get a boner, i get a boner and then it just dies randomly like my calls",t3_m6wyk2,14
1615998404.0,2021-03-17,wallstreetbets,gr92zdm,Bull run restarts in April . Survive,t3_m6wyk2,14
1615998422.0,2021-03-17,wallstreetbets,gr930wf,Let’s go UWMC. I’m not asking for the moon. Just green lines!,t3_m6wyk2,14
1615998436.0,2021-03-17,wallstreetbets,gr931yx,"Just want to say this. If you've had a difficult past year don't hesitate to reach out for help. A lot people got screwed over. Stay positive and keep your head up. Also, message me if you need to vent. 


Stay safe and happy investing. Possible buying opportunity today or possible day for tendies. 

Retards are with you.",t3_m6wyk2,14
1615999770.0,2021-03-17,wallstreetbets,gr962ju,Plug accounting error was they forgot to report even more revenue.,t3_m6wyk2,13
1615999801.0,2021-03-17,wallstreetbets,gr9650a,My stonks keep going down and I keep depositing more and more money. I didn't like this game at first but honestly it's pretty fun.,t3_m6wyk2,14
1616001045.0,2021-03-17,wallstreetbets,gr98xy1,it sucks that the majority of my day time friends are the stupidest 9.5 million people on the internet,t3_m6wyk2,14
1616003315.0,2021-03-17,wallstreetbets,gr9e308,UWMC!!!!,t3_m6wyk2,14
1616003336.0,2021-03-17,wallstreetbets,gr9e4p7,Love how my UWMC call is still sitting flat while its mooning,t3_m6wyk2,14
1616003402.0,2021-03-17,wallstreetbets,gr9ea6q,Don't tell me this fucked up boring day ends with UWMC resurrection of all things.,t3_m6wyk2,13
1616003457.0,2021-03-17,wallstreetbets,gr9eetu,UWMC starting to run.,t3_m6wyk2,14
1616004611.0,2021-03-17,wallstreetbets,gr9h230,HAHA FUCK YOU BEARS TECH UNDERVALUED TO THE MOOOOON,t3_m6wyk2,15
1616004805.0,2021-03-17,wallstreetbets,gr9hi5q,WTF is happening. All of my stocks went from deep red to green dildos.,t3_m6wyk2,15
1616004884.0,2021-03-17,wallstreetbets,gr9holv,Haha inverse WSB as usual.,t3_m6wyk2,14
1616006279.0,2021-03-17,wallstreetbets,gr9ktwd,I think he just mumbled spy 400 during that pause,t3_m6wyk2,14
1616007196.0,2021-03-17,wallstreetbets,gr9mwnn,jerome said fuck your puts,t3_m6wyk2,14
1616009101.0,2021-03-17,wallstreetbets,gr9r6o0,"translation of jpows last comment:

I WILL TELL YOU WHEN 2 FUCKING SELL. RELAX!",t3_m6wyk2,16
1616009615.0,2021-03-17,wallstreetbets,gr9sbzw,"# Here we go lads, the official start of BURRR season and the second bull run",t3_m6wyk2,14
1616010217.0,2021-03-17,wallstreetbets,gr9toaz,[deleted],t3_m6wyk2,14
1616010236.0,2021-03-17,wallstreetbets,gr9tpwb,"Powell straight up said some prices are historically high when asked if there was a bubble but he just brushed over it and kept talking about other shit

What a game",t3_m6wyk2,14
1616011397.0,2021-03-17,wallstreetbets,gr9wbsw,The salty bear tears in here and they’re throwing a temper tantrum,t3_m6wyk2,14
1615975830.0,2021-03-17,wallstreetbets,gr80f1i,I just want mommy Cathie to choke me with her thighs.,t3_m6wyk2,79
1615975851.0,2021-03-17,wallstreetbets,gr80fs0,Difference between us apes and Melvin is that Melvin sleeps,t3_m6wyk2,14
1615976503.0,2021-03-17,wallstreetbets,gr813dg,None of my stocks are wearing green today. I will pinch them.,t3_m6wyk2,13
1615977593.0,2021-03-17,wallstreetbets,gr827gb,I was promised green today. I want my fukkin green!!!,t3_m6wyk2,13
1615978689.0,2021-03-17,wallstreetbets,gr83dsi,"IM FIGHTING FOR MY FUKIN LIFE


           🤡",t3_m6wyk2,14
1615979222.0,2021-03-17,wallstreetbets,gr83zf1,TSLA you piece of electrical turd,t3_m6wyk2,13
1615979321.0,2021-03-17,wallstreetbets,gr843el,"Why does J Powell have to keep speaking? Didn't he speak 2 weeks ago? Does he have to give a speech twice a month or something?

The thing is his probably going to come out and say the same shit he said last time which is inflation is fine we going to be fine. No operation twist etc etc. So why even speak at all? He literally said it 2 weeks ago already. The very fact his speaking and his probably going to say the same shit is spooking the fk outta the market.",t3_m6wyk2,13
1615979679.0,2021-03-17,wallstreetbets,gr84iau,Blankly staring at premarket while wondering if she's thinking about me,t3_m6wyk2,13
1615981233.0,2021-03-17,wallstreetbets,gr86fj7,"i really hated living inside anyway,  the gutter has fresh air",t3_m6wyk2,14
1615981272.0,2021-03-17,wallstreetbets,gr86hc6,Turn off your device and get blackout drunk today. It's what St Patrick's day is good for!,t3_m6wyk2,14
1615981388.0,2021-03-17,wallstreetbets,gr86msl,"Help!

Market is getting step father attacked",t3_m6wyk2,15
1615981750.0,2021-03-17,wallstreetbets,gr87440,We green!!!! 🚀🚀🚀,t3_m6wyk2,13
1615982426.0,2021-03-17,wallstreetbets,gr880ws,JPow is a false bull prophet. He is the bear god incarnate,t3_m6wyk2,14
1615982566.0,2021-03-17,wallstreetbets,gr887tk,These conferences need to be over the weekend. So there's no immediate sell-off and gives us something to watch over the weekends when markets are closed,t3_m6wyk2,13
1615983220.0,2021-03-17,wallstreetbets,gr89571,Time for GMEs negative beta to put in work. Or time to find out if that's all bs,t3_m6wyk2,13
1615985890.0,2021-03-17,wallstreetbets,gr8db8t,Guys Elon is outside he looks fucking pissed,t3_m6wyk2,14
1615986259.0,2021-03-17,wallstreetbets,gr8dxql,"Hey guys just got back from the future....Fed will say: economy is in recovery with short term risk being from covid variants, they aren’t concerned with inflation, targeting 2%, will use full tool box to continue to support the economy until unemployment returns to normal.",t3_m6wyk2,13
1615986319.0,2021-03-17,wallstreetbets,gr8e1d2,GME DD has surpassed Variation-Separate levels of confirmation bias,t3_m6wyk2,13
1615988100.0,2021-03-17,wallstreetbets,gr8h8is,I swear it takes like 3 days for my positions to climb a little bit and then one AH dump to take me back to where I started.,t3_m6wyk2,14
1615989879.0,2021-03-17,wallstreetbets,gr8knjx,APHA APHA APHA✅,t3_m6wyk2,14
1615990726.0,2021-03-17,wallstreetbets,gr8mc4a,no fucking volume. everyone waiting for JPOW,t3_m6wyk2,15
1615990902.0,2021-03-17,wallstreetbets,gr8mp1a,Apha make up your mind and rocket already,t3_m6wyk2,13
1615991479.0,2021-03-17,wallstreetbets,gr8nvcm,RBLX has a bigger market cap than PLTR lol,t3_m6wyk2,13
1615991609.0,2021-03-17,wallstreetbets,gr8o4x6,How the fuck do Tesla bears still exist?,t3_m6wyk2,13
1615991829.0,2021-03-17,wallstreetbets,gr8ol0r,Markets shitting on TSLA bcoz VW might dethrone them in 10 years!? Makes sense...,t3_m6wyk2,13
1615992303.0,2021-03-17,wallstreetbets,gr8pk5z,The daily gme marvel movie scene edits are so tiresome.,t3_m6wyk2,13
1615992489.0,2021-03-17,wallstreetbets,gr8py9z,Spy isn’t even down 1% and people are feeling sick imagine all these new people if they were around last March,t3_m6wyk2,14
1615992674.0,2021-03-17,wallstreetbets,gr8qcbp,"The only thing green in my portfolio is - oh wait, nothing.",t3_m6wyk2,13
1615992698.0,2021-03-17,wallstreetbets,gr8qe4i,I have Cathie Woods sex tape 🦇💨🧛,t3_m6wyk2,13
1615992881.0,2021-03-17,wallstreetbets,gr8qs0f,Why are there so little comments? Did the market wipe out half of WSB already?,t3_m6wyk2,12
1615993967.0,2021-03-17,wallstreetbets,gr8t26g,"Wow AMC very strong support at 13.02
See you guys in 🌙",t3_m6wyk2,13
1615994407.0,2021-03-17,wallstreetbets,gr8u0ao,"Stimulus day, Jpow day, Quadwitching day..... 

lets be honest...for most of us its ""losing more money day""  😪😫😫",t3_m6wyk2,13
1615995811.0,2021-03-17,wallstreetbets,gr8x4c5,"AAPL doing poorly today.  


APLE on the other hand is up 2.5%  


Sometimes being a retard who bought the wrong company works out in the end.",t3_m6wyk2,13
1615996055.0,2021-03-17,wallstreetbets,gr8xnzc,Got my Level 3 on Fidelity. Time to fuck some shit up. Mostly my account.,t3_m6wyk2,14
1615996840.0,2021-03-17,wallstreetbets,gr8zfyy,"I'm going to AMC on Friday to watch a movie and eat concessions. Hopefully, I'll get my ass tattoo if it hits $21 by the EOD Friday. If not, at least I can enjoy the theater experience again. I like the movies.😋🍿🎥💎👐🦍",t3_m6wyk2,12
1615997426.0,2021-03-17,wallstreetbets,gr90rx8,"Tesla back to 666, satan confirmed",t3_m6wyk2,14
1615998537.0,2021-03-17,wallstreetbets,gr93a8r,I’ve been losing an unhealthy amount of money everyday for the past month or so... 😔☹️,t3_m6wyk2,14
1615998584.0,2021-03-17,wallstreetbets,gr93dyx,"Motley Fool just upgraded AMC from 1 penny to $2. That’s a 20,000% increase. Very bullish if you ask me.",t3_m6wyk2,13
1615998754.0,2021-03-17,wallstreetbets,gr93rvh,I’m buying 100 shares of PLTR and I won’t log into that account until 2022,t3_m6wyk2,12
1615999116.0,2021-03-17,wallstreetbets,gr94l8z,SPY is such a fucking laggard. If you went somewhere with SPY you'd be constantly waiting for its bitch ass outside of a restroom in a Vegas casino.,t3_m6wyk2,13
1616000913.0,2021-03-17,wallstreetbets,gr98n7r,"AAPL immediately wiping out all of yesterday’s gains, all is right in the world.",t3_m6wyk2,12
1616001033.0,2021-03-17,wallstreetbets,gr98wza,"Any of you Chad Bulls have the balls to buy SPY calls this morning with your welfare checks??

I did. Save me JPow.",t3_m6wyk2,13
1616002217.0,2021-03-17,wallstreetbets,gr9bl5p,"Ok, who bought the top of VW",t3_m6wyk2,13
1616002738.0,2021-03-17,wallstreetbets,gr9cruc,Fuck you PLTR!!! Get back to $35 already you dumb fuck,t3_m6wyk2,13
1616002866.0,2021-03-17,wallstreetbets,gr9d2ci,"TSLA: goes up a few dollars

TSLA: my job here is done",t3_m6wyk2,13
1616003053.0,2021-03-17,wallstreetbets,gr9dhi0,I hope Jpow sees his shadow today so we can get a couple more weeks of green,t3_m6wyk2,13
1616003340.0,2021-03-17,wallstreetbets,gr9e515,Time is running out for sub-10 UWMC tickets.,t3_m6wyk2,13
1616003385.0,2021-03-17,wallstreetbets,gr9e8qg,Plz UWMC 10 is all I ask for,t3_m6wyk2,13
1616003480.0,2021-03-17,wallstreetbets,gr9egnf,Bruh I thought that VW DD was full of shit. That's a $150 billion dollar company spiking by 30% lol,t3_m6wyk2,12
1616003722.0,2021-03-17,wallstreetbets,gr9f0e4,The only thing I’m stimulating is whoever sold me this fucking call,t3_m6wyk2,14
1616004206.0,2021-03-17,wallstreetbets,gr9g46c,RIP SPY PUTS🤡,t3_m6wyk2,12
1616004232.0,2021-03-17,wallstreetbets,gr9g69k,UWMC HOLDERS WHERE YOU AT,t3_m6wyk2,13
1616004367.0,2021-03-17,wallstreetbets,gr9ghny,No interest rate hikes THROUGH 2023!! ITS GAME ON BOYS!,t3_m6wyk2,14
1616004703.0,2021-03-17,wallstreetbets,gr9h9qq,Bear so stupid they wasted their stimulus thrice,t3_m6wyk2,12
